[{"date":20201104,"state":"MO","positive":193023,"probableCases":null,"negative":1353932,"pending":null,"totalTestResultsSource":"totalTestsViral","totalTestResults":2602880,"hospitalizedCurrently":1632,"hospitalizedCumulative":null,"inIcuCurrently":504,"inIcuCumulative":null,"onVentilatorCurrently":226,"onVentilatorCumulative":null,"recovered":null,"dataQualityGrade":"A+","lastUpdateEt":"11/4/2020 00:59","dateModified":"2020-11-04T24:59:00Z","checkTimeEt":"11/03 19:59","death":3088,"hospitalized":null,"dateChecked":"2020-11-04T24:59:00Z","totalTestsViral":2602880,"positiveTestsViral":219118,"negativeTestsViral":2378893,"positiveCasesViral":193023,"deathConfirmed":null,"deathProbable":null,"totalTestEncountersViral":null,"totalTestsPeopleViral":1546955,"totalTestsAntibody":88626,"positiveTestsAntibody":5730,"negativeTestsAntibody":82687,"totalTestsPeopleAntibody":84502,"positiveTestsPeopleAntibody":3618,"negativeTestsPeopleAntibody":71709,"totalTestsPeopleAntigen":33222,"positiveTestsPeopleAntigen":null,"totalTestsAntigen":47768,"positiveTestsAntigen":8149,"fips":"29","positiveIncrease":2599,"negativeIncrease":5093,"total":1546955,"totalTestResultsIncrease":17600,"posNeg":1546955,"deathIncrease":24,"hospitalizedIncrease":0,"hash":"1cb1c4d836f9356c2cf4ffcf7a0faa83c3d0c675","commercialScore":0,"negativeRegularScore":0,"negativeScore":0,"positiveScore":0,"score":0,"grade":""},{"date":20201103,"state":"MO","positive":190424,"probableCases":null,"negative":1348839,"pending":null,"totalTestResultsSource":"totalTestsViral","totalTestResults":2585280,"hospitalizedCurrently":1631,"hospitalizedCumulative":null,"inIcuCurrently":476,"inIcuCumulative":null,"onVentilatorCurrently":218,"onVentilatorCumulative":null,"recovered":null,"dataQualityGrade":"A+","lastUpdateEt":"11/3/2020 00:59","dateModified":"2020-11-03T24:59:00Z","checkTimeEt":"11/02 19:59","death":3064,"hospitalized":null,"dateChecked":"2020-11-03T24:59:00Z","totalTestsViral":2585280,"positiveTestsViral":216333,"negativeTestsViral":2364104,"positiveCasesViral":190424,"deathConfirmed":null,"deathProbable":null,"totalTestEncountersViral":null,"totalTestsPeopleViral":1539263,"totalTestsAntibody":88365,"positiveTestsAntibody":5685,"negativeTestsAntibody":82472,"totalTestsPeopleAntibody":84265,"positiveTestsPeopleAntibody":3618,"negativeTestsPeopleAntibody":71709,"totalTestsPeopleAntigen":32264,"positiveTestsPeopleAntigen":null,"totalTestsAntigen":46335,"positiveTestsAntigen":7864,"fips":"29","positiveIncrease":2238,"negativeIncrease":8927,"total":1539263,"totalTestResultsIncrease":31506,"posNeg":1539263,"deathIncrease":33,"hospitalizedIncrease":0,"hash":"6c1d2f40c8e5f9213513fbc9bdf91553b42ad6ae","commercialScore":0,"negativeRegularScore":0,"negativeScore":0,"positiveScore":0,"score":0,"grade":""},{"date":20201102,"state":"MO","positive":188186,"probableCases":null,"negative":1339912,"pending":null,"totalTestResultsSource":"totalTestsViral","totalTestResults":2553774,"hospitalizedCurrently":1659,"hospitalizedCumulative":null,"inIcuCurrently":476,"inIcuCumulative":null,"onVentilatorCurrently":221,"onVentilatorCumulative":null,"recovered":null,"dataQualityGrade":"A+","lastUpdateEt":"11/2/2020 00:59","dateModified":"2020-11-02T24:59:00Z","checkTimeEt":"11/01 19:59","death":3031,"hospitalized":null,"dateChecked":"2020-11-02T24:59:00Z","totalTestsViral":2553774,"positiveTestsViral":213941,"negativeTestsViral":2335025,"positiveCasesViral":188186,"deathConfirmed":null,"deathProbable":null,"totalTestEncountersViral":null,"totalTestsPeopleViral":1528098,"totalTestsAntibody":88144,"positiveTestsAntibody":5659,"negativeTestsAntibody":82277,"totalTestsPeopleAntibody":84090,"positiveTestsPeopleAntibody":3618,"negativeTestsPeopleAntibody":71709,"totalTestsPeopleAntigen":30850,"positiveTestsPeopleAntigen":null,"totalTestsAntigen":44460,"positiveTestsAntigen":7684,"fips":"29","positiveIncrease":2651,"negativeIncrease":6731,"total":1528098,"totalTestResultsIncrease":18592,"posNeg":1528098,"deathIncrease":5,"hospitalizedIncrease":0,"hash":"6813ea44167ebdf9a59911d0cc13cd32265985e9","commercialScore":0,"negativeRegularScore":0,"negativeScore":0,"positiveScore":0,"score":0,"grade":""},{"date":20201101,"state":"MO","positive":185535,"probableCases":null,"negative":1333181,"pending":null,"totalTestResultsSource":"totalTestsViral","totalTestResults":2535182,"hospitalizedCurrently":1649,"hospitalizedCumulative":null,"inIcuCurrently":494,"inIcuCumulative":null,"onVentilatorCurrently":214,"onVentilatorCumulative":null,"recovered":null,"dataQualityGrade":"A+","lastUpdateEt":"11/1/2020 00:59","dateModified":"2020-11-01T24:59:00Z","checkTimeEt":"10/31 20:59","death":3026,"hospitalized":null,"dateChecked":"2020-11-01T24:59:00Z","totalTestsViral":2535182,"positiveTestsViral":211106,"negativeTestsViral":2319312,"positiveCasesViral":185535,"deathConfirmed":null,"deathProbable":null,"totalTestEncountersViral":null,"totalTestsPeopleViral":1518716,"totalTestsAntibody":87952,"positiveTestsAntibody":5621,"negativeTestsAntibody":82124,"totalTestsPeopleAntibody":83927,"positiveTestsPeopleAntibody":3618,"negativeTestsPeopleAntibody":71709,"totalTestsPeopleAntigen":30074,"positiveTestsPeopleAntigen":null,"totalTestsAntigen":43552,"positiveTestsAntigen":7465,"fips":"29","positiveIncrease":2349,"negativeIncrease":6212,"total":1518716,"totalTestResultsIncrease":17632,"posNeg":1518716,"deathIncrease":2,"hospitalizedIncrease":0,"hash":"be104759fce0935c0f167cf966e15c513f933cdd","commercialScore":0,"negativeRegularScore":0,"negativeScore":0,"positiveScore":0,"score":0,"grade":""},{"date":20201031,"state":"MO","positive":183186,"probableCases":null,"negative":1326969,"pending":null,"totalTestResultsSource":"totalTestsViral","totalTestResults":2517550,"hospitalizedCurrently":1574,"hospitalizedCumulative":null,"inIcuCurrently":464,"inIcuCumulative":null,"onVentilatorCurrently":189,"onVentilatorCumulative":null,"recovered":null,"dataQualityGrade":"A+","lastUpdateEt":"10/31/2020 00:59","dateModified":"2020-10-31T24:59:00Z","checkTimeEt":"10/30 20:59","death":3024,"hospitalized":null,"dateChecked":"2020-10-31T24:59:00Z","totalTestsViral":2517550,"positiveTestsViral":208594,"negativeTestsViral":2304229,"positiveCasesViral":183186,"deathConfirmed":null,"deathProbable":null,"totalTestEncountersViral":null,"totalTestsPeopleViral":1510155,"totalTestsAntibody":87651,"positiveTestsAntibody":5556,"negativeTestsAntibody":81891,"totalTestsPeopleAntibody":83662,"positiveTestsPeopleAntibody":3618,"negativeTestsPeopleAntibody":71709,"totalTestsPeopleAntigen":29401,"positiveTestsPeopleAntigen":null,"totalTestsAntigen":42673,"positiveTestsAntigen":7286,"fips":"29","positiveIncrease":2986,"negativeIncrease":7887,"total":1510155,"totalTestResultsIncrease":22684,"posNeg":1510155,"deathIncrease":99,"hospitalizedIncrease":0,"hash":"fd519ca876fc29ef6faf05ff6481c3777a939a23","commercialScore":0,"negativeRegularScore":0,"negativeScore":0,"positiveScore":0,"score":0,"grade":""},{"date":20201030,"state":"MO","positive":180200,"probableCases":null,"negative":1319082,"pending":null,"totalTestResultsSource":"totalTestsViral","totalTestResults":2494866,"hospitalizedCurrently":1530,"hospitalizedCumulative":null,"inIcuCurrently":479,"inIcuCumulative":null,"onVentilatorCurrently":200,"onVentilatorCumulative":null,"recovered":null,"dataQualityGrade":"A+","lastUpdateEt":"10/30/2020 00:59","dateModified":"2020-10-30T24:59:00Z","checkTimeEt":"10/29 20:59","death":2925,"hospitalized":null,"dateChecked":"2020-10-30T24:59:00Z","totalTestsViral":2494866,"positiveTestsViral":205382,"negativeTestsViral":2284801,"positiveCasesViral":180200,"deathConfirmed":null,"deathProbable":null,"totalTestEncountersViral":null,"totalTestsPeopleViral":1499282,"totalTestsAntibody":87421,"positiveTestsAntibody":5501,"negativeTestsAntibody":81716,"totalTestsPeopleAntibody":83459,"positiveTestsPeopleAntibody":3618,"negativeTestsPeopleAntibody":71709,"totalTestsPeopleAntigen":28275,"positiveTestsPeopleAntigen":null,"totalTestsAntigen":41139,"positiveTestsAntigen":7009,"fips":"29","positiveIncrease":2507,"negativeIncrease":6158,"total":1499282,"totalTestResultsIncrease":20470,"posNeg":1499282,"deathIncrease":26,"hospitalizedIncrease":0,"hash":"8a363c623343c2e69d6e6d358bd2cd85fce88cce","commercialScore":0,"negativeRegularScore":0,"negativeScore":0,"positiveScore":0,"score":0,"grade":""},{"date":20201029,"state":"MO","positive":177693,"probableCases":null,"negative":1312924,"pending":null,"totalTestResultsSource":"totalTestsViral","totalTestResults":2474396,"hospitalizedCurrently":1490,"hospitalizedCumulative":null,"inIcuCurrently":464,"inIcuCumulative":null,"onVentilatorCurrently":179,"onVentilatorCumulative":null,"recovered":null,"dataQualityGrade":"A+","lastUpdateEt":"10/29/2020 00:59","dateModified":"2020-10-29T24:59:00Z","checkTimeEt":"10/28 20:59","death":2899,"hospitalized":null,"dateChecked":"2020-10-29T24:59:00Z","totalTestsViral":2474396,"positiveTestsViral":202697,"negativeTestsViral":2267061,"positiveCasesViral":177693,"deathConfirmed":null,"deathProbable":null,"totalTestEncountersViral":null,"totalTestsPeopleViral":1490617,"totalTestsAntibody":87067,"positiveTestsAntibody":5422,"negativeTestsAntibody":81442,"totalTestsPeopleAntibody":83145,"positiveTestsPeopleAntibody":3618,"negativeTestsPeopleAntibody":71709,"totalTestsPeopleAntigen":26900,"positiveTestsPeopleAntigen":null,"totalTestsAntigen":37742,"positiveTestsAntigen":6661,"fips":"29","positiveIncrease":3061,"negativeIncrease":6320,"total":1490617,"totalTestResultsIncrease":19969,"posNeg":1490617,"deathIncrease":29,"hospitalizedIncrease":0,"hash":"583fe58bb20688078075b07ad6e11d0781317717","commercialScore":0,"negativeRegularScore":0,"negativeScore":0,"positiveScore":0,"score":0,"grade":""},{"date":20201028,"state":"MO","positive":174632,"probableCases":null,"negative":1306604,"pending":null,"totalTestResultsSource":"totalTestsViral","totalTestResults":2454427,"hospitalizedCurrently":1446,"hospitalizedCumulative":null,"inIcuCurrently":451,"inIcuCumulative":null,"onVentilatorCurrently":173,"onVentilatorCumulative":null,"recovered":null,"dataQualityGrade":"A+","lastUpdateEt":"10/28/2020 00:59","dateModified":"2020-10-28T24:59:00Z","checkTimeEt":"10/27 20:59","death":2870,"hospitalized":null,"dateChecked":"2020-10-28T24:59:00Z","totalTestsViral":2454427,"positiveTestsViral":199417,"negativeTestsViral":2250415,"positiveCasesViral":174632,"deathConfirmed":null,"deathProbable":null,"totalTestEncountersViral":null,"totalTestsPeopleViral":1481236,"totalTestsAntibody":86882,"positiveTestsAntibody":5375,"negativeTestsAntibody":81304,"totalTestsPeopleAntibody":82980,"positiveTestsPeopleAntibody":3618,"negativeTestsPeopleAntibody":71709,"totalTestsPeopleAntigen":25800,"positiveTestsPeopleAntigen":null,"totalTestsAntigen":35726,"positiveTestsAntigen":6434,"fips":"29","positiveIncrease":1915,"negativeIncrease":4916,"total":1481236,"totalTestResultsIncrease":15848,"posNeg":1481236,"deathIncrease":32,"hospitalizedIncrease":0,"hash":"a3b83aeaaaeeeb30a47c65b86c4d89114ea41624","commercialScore":0,"negativeRegularScore":0,"negativeScore":0,"positiveScore":0,"score":0,"grade":""},{"date":20201027,"state":"MO","positive":172717,"probableCases":null,"negative":1301688,"pending":null,"totalTestResultsSource":"totalTestsViral","totalTestResults":2438579,"hospitalizedCurrently":1407,"hospitalizedCumulative":null,"inIcuCurrently":449,"inIcuCumulative":null,"onVentilatorCurrently":162,"onVentilatorCumulative":null,"recovered":null,"dataQualityGrade":"A+","lastUpdateEt":"10/27/2020 00:59","dateModified":"2020-10-27T24:59:00Z","checkTimeEt":"10/26 20:59","death":2838,"hospitalized":null,"dateChecked":"2020-10-27T24:59:00Z","totalTestsViral":2438579,"positiveTestsViral":197358,"negativeTestsViral":2236660,"positiveCasesViral":172717,"deathConfirmed":null,"deathProbable":null,"totalTestEncountersViral":null,"totalTestsPeopleViral":1474405,"totalTestsAntibody":86524,"positiveTestsAntibody":5327,"negativeTestsAntibody":80994,"totalTestsPeopleAntibody":82654,"positiveTestsPeopleAntibody":3618,"negativeTestsPeopleAntibody":71709,"totalTestsPeopleAntigen":25040,"positiveTestsPeopleAntigen":null,"totalTestsAntigen":33883,"positiveTestsAntigen":6208,"fips":"29","positiveIncrease":1695,"negativeIncrease":6761,"total":1474405,"totalTestResultsIncrease":17968,"posNeg":1474405,"deathIncrease":28,"hospitalizedIncrease":0,"hash":"66c8e5900e0fc7dae1218ff97e77a3372e6b518a","commercialScore":0,"negativeRegularScore":0,"negativeScore":0,"positiveScore":0,"score":0,"grade":""},{"date":20201026,"state":"MO","positive":171022,"probableCases":null,"negative":1294927,"pending":null,"totalTestResultsSource":"totalTestsViral","totalTestResults":2420611,"hospitalizedCurrently":1399,"hospitalizedCumulative":null,"inIcuCurrently":481,"inIcuCumulative":null,"onVentilatorCurrently":174,"onVentilatorCumulative":null,"recovered":null,"dataQualityGrade":"A+","lastUpdateEt":"10/26/2020 00:59","dateModified":"2020-10-26T24:59:00Z","checkTimeEt":"10/25 20:59","death":2810,"hospitalized":null,"dateChecked":"2020-10-26T24:59:00Z","totalTestsViral":2420611,"positiveTestsViral":195500,"negativeTestsViral":2220575,"positiveCasesViral":171022,"deathConfirmed":null,"deathProbable":null,"totalTestEncountersViral":null,"totalTestsPeopleViral":1465949,"totalTestsAntibody":86397,"positiveTestsAntibody":5299,"negativeTestsAntibody":80898,"totalTestsPeopleAntibody":82540,"positiveTestsPeopleAntibody":3618,"negativeTestsPeopleAntibody":71709,"totalTestsPeopleAntigen":23755,"positiveTestsPeopleAntigen":null,"totalTestsAntigen":31184,"positiveTestsAntigen":6020,"fips":"29","positiveIncrease":1527,"negativeIncrease":5582,"total":1465949,"totalTestResultsIncrease":13764,"posNeg":1465949,"deathIncrease":5,"hospitalizedIncrease":0,"hash":"f66aad7502d5b0236278bcd746d6b99e650ccf24","commercialScore":0,"negativeRegularScore":0,"negativeScore":0,"positiveScore":0,"score":0,"grade":""},{"date":20201025,"state":"MO","positive":169495,"probableCases":null,"negative":1289345,"pending":null,"totalTestResultsSource":"totalTestsViral","totalTestResults":2406847,"hospitalizedCurrently":1404,"hospitalizedCumulative":null,"inIcuCurrently":484,"inIcuCumulative":null,"onVentilatorCurrently":167,"onVentilatorCumulative":null,"recovered":null,"dataQualityGrade":"A+","lastUpdateEt":"10/25/2020 00:59","dateModified":"2020-10-25T24:59:00Z","checkTimeEt":"10/24 20:59","death":2805,"hospitalized":null,"dateChecked":"2020-10-25T24:59:00Z","totalTestsViral":2406847,"positiveTestsViral":193832,"negativeTestsViral":2208498,"positiveCasesViral":169495,"deathConfirmed":null,"deathProbable":null,"totalTestEncountersViral":null,"totalTestsPeopleViral":1458840,"totalTestsAntibody":86301,"positiveTestsAntibody":5289,"negativeTestsAntibody":80812,"totalTestsPeopleAntibody":82459,"positiveTestsPeopleAntibody":3618,"negativeTestsPeopleAntibody":71709,"totalTestsPeopleAntigen":23325,"positiveTestsPeopleAntigen":null,"totalTestsAntigen":30609,"positiveTestsAntigen":5928,"fips":"29","positiveIncrease":2043,"negativeIncrease":6782,"total":1458840,"totalTestResultsIncrease":18566,"posNeg":1458840,"deathIncrease":4,"hospitalizedIncrease":0,"hash":"21e43f829d589218b33fd60d51ff15bb6a012416","commercialScore":0,"negativeRegularScore":0,"negativeScore":0,"positiveScore":0,"score":0,"grade":""},{"date":20201024,"state":"MO","positive":167452,"probableCases":null,"negative":1282563,"pending":null,"totalTestResultsSource":"totalTestsViral","totalTestResults":2388281,"hospitalizedCurrently":1443,"hospitalizedCumulative":null,"inIcuCurrently":522,"inIcuCumulative":null,"onVentilatorCurrently":175,"onVentilatorCumulative":null,"recovered":null,"dataQualityGrade":"A+","lastUpdateEt":"10/24/2020 00:59","dateModified":"2020-10-24T24:59:00Z","checkTimeEt":"10/23 20:59","death":2801,"hospitalized":null,"dateChecked":"2020-10-24T24:59:00Z","totalTestsViral":2388281,"positiveTestsViral":191640,"negativeTestsViral":2192171,"positiveCasesViral":167452,"deathConfirmed":null,"deathProbable":null,"totalTestEncountersViral":null,"totalTestsPeopleViral":1450015,"totalTestsAntibody":85977,"positiveTestsAntibody":5231,"negativeTestsAntibody":80547,"totalTestsPeopleAntibody":82171,"positiveTestsPeopleAntibody":3618,"negativeTestsPeopleAntibody":71709,"totalTestsPeopleAntigen":22821,"positiveTestsPeopleAntigen":null,"totalTestsAntigen":29938,"positiveTestsAntigen":5820,"fips":"29","positiveIncrease":2918,"negativeIncrease":7781,"total":1450015,"totalTestResultsIncrease":24470,"posNeg":1450015,"deathIncrease":113,"hospitalizedIncrease":0,"hash":"f5158ae161b46e5f22f62fa80556c28e0b9cdf47","commercialScore":0,"negativeRegularScore":0,"negativeScore":0,"positiveScore":0,"score":0,"grade":""},{"date":20201023,"state":"MO","positive":164534,"probableCases":null,"negative":1274782,"pending":null,"totalTestResultsSource":"totalTestsViral","totalTestResults":2363811,"hospitalizedCurrently":1349,"hospitalizedCumulative":null,"inIcuCurrently":215,"inIcuCumulative":null,"onVentilatorCurrently":172,"onVentilatorCumulative":null,"recovered":null,"dataQualityGrade":"A+","lastUpdateEt":"10/23/2020 00:59","dateModified":"2020-10-23T24:59:00Z","checkTimeEt":"10/22 20:59","death":2688,"hospitalized":null,"dateChecked":"2020-10-23T24:59:00Z","totalTestsViral":2363811,"positiveTestsViral":188511,"negativeTestsViral":2170868,"positiveCasesViral":164534,"deathConfirmed":null,"deathProbable":null,"totalTestEncountersViral":null,"totalTestsPeopleViral":1439316,"totalTestsAntibody":85454,"positiveTestsAntibody":5130,"negativeTestsAntibody":80126,"totalTestsPeopleAntibody":81713,"positiveTestsPeopleAntibody":3618,"negativeTestsPeopleAntibody":71709,"totalTestsPeopleAntigen":21837,"positiveTestsPeopleAntigen":null,"totalTestsAntigen":28459,"positiveTestsAntigen":5614,"fips":"29","positiveIncrease":1811,"negativeIncrease":5033,"total":1439316,"totalTestResultsIncrease":17321,"posNeg":1439316,"deathIncrease":31,"hospitalizedIncrease":0,"hash":"49ee5716f7f89629a34980e310447d9c85b295c5","commercialScore":0,"negativeRegularScore":0,"negativeScore":0,"positiveScore":0,"score":0,"grade":""},{"date":20201022,"state":"MO","positive":162723,"probableCases":null,"negative":1269749,"pending":null,"totalTestResultsSource":"totalTestsViral","totalTestResults":2346490,"hospitalizedCurrently":1352,"hospitalizedCumulative":null,"inIcuCurrently":240,"inIcuCumulative":null,"onVentilatorCurrently":163,"onVentilatorCumulative":null,"recovered":null,"dataQualityGrade":"A+","lastUpdateEt":"10/22/2020 00:59","dateModified":"2020-10-22T24:59:00Z","checkTimeEt":"10/21 20:59","death":2657,"hospitalized":null,"dateChecked":"2020-10-22T24:59:00Z","totalTestsViral":2346490,"positiveTestsViral":186526,"negativeTestsViral":2155560,"positiveCasesViral":162723,"deathConfirmed":null,"deathProbable":null,"totalTestEncountersViral":null,"totalTestsPeopleViral":1432472,"totalTestsAntibody":85243,"positiveTestsAntibody":5082,"negativeTestsAntibody":79963,"totalTestsPeopleAntibody":81519,"positiveTestsPeopleAntibody":3618,"negativeTestsPeopleAntibody":71709,"totalTestsPeopleAntigen":21494,"positiveTestsPeopleAntigen":null,"totalTestsAntigen":27656,"positiveTestsAntigen":5432,"fips":"29","positiveIncrease":1854,"negativeIncrease":22744,"total":1432472,"totalTestResultsIncrease":19622,"posNeg":1432472,"deathIncrease":16,"hospitalizedIncrease":0,"hash":"d6f6c8d76c769580a9983c284096526de360b057","commercialScore":0,"negativeRegularScore":0,"negativeScore":0,"positiveScore":0,"score":0,"grade":""},{"date":20201021,"state":"MO","positive":160869,"probableCases":null,"negative":1247005,"pending":null,"totalTestResultsSource":"totalTestsViral","totalTestResults":2326868,"hospitalizedCurrently":1415,"hospitalizedCumulative":null,"inIcuCurrently":450,"inIcuCumulative":null,"onVentilatorCurrently":170,"onVentilatorCumulative":null,"recovered":null,"dataQualityGrade":"A","lastUpdateEt":"10/21/2020 00:59","dateModified":"2020-10-21T24:59:00Z","checkTimeEt":"10/20 20:59","death":2641,"hospitalized":null,"dateChecked":"2020-10-21T24:59:00Z","totalTestsViral":2326868,"positiveTestsViral":184494,"negativeTestsViral":2137998,"positiveCasesViral":160869,"deathConfirmed":null,"deathProbable":null,"totalTestEncountersViral":null,"totalTestsPeopleViral":1407874,"totalTestsAntibody":84961,"positiveTestsAntibody":5027,"negativeTestsAntibody":79737,"totalTestsPeopleAntibody":69077,"positiveTestsPeopleAntibody":3618,"negativeTestsPeopleAntibody":71709,"totalTestsPeopleAntigen":14660,"positiveTestsPeopleAntigen":null,"totalTestsAntigen":26609,"positiveTestsAntigen":5307,"fips":"29","positiveIncrease":1244,"negativeIncrease":12006,"total":1407874,"totalTestResultsIncrease":30194,"posNeg":1407874,"deathIncrease":26,"hospitalizedIncrease":0,"hash":"2d157397c0fc973a8bd6ccf4e0e0f13289eb9356","commercialScore":0,"negativeRegularScore":0,"negativeScore":0,"positiveScore":0,"score":0,"grade":""},{"date":20201020,"state":"MO","positive":159625,"probableCases":null,"negative":1234999,"pending":null,"totalTestResultsSource":"totalTestsViral","totalTestResults":2296674,"hospitalizedCurrently":1439,"hospitalizedCumulative":null,"inIcuCurrently":429,"inIcuCumulative":null,"onVentilatorCurrently":156,"onVentilatorCumulative":null,"recovered":null,"dataQualityGrade":"A","lastUpdateEt":"10/20/2020 00:59","dateModified":"2020-10-20T24:59:00Z","checkTimeEt":"10/19 20:59","death":2615,"hospitalized":null,"dateChecked":"2020-10-20T24:59:00Z","totalTestsViral":2296674,"positiveTestsViral":181463,"negativeTestsViral":2110912,"positiveCasesViral":159625,"deathConfirmed":null,"deathProbable":null,"totalTestEncountersViral":null,"totalTestsPeopleViral":1393100,"totalTestsAntibody":84652,"positiveTestsAntibody":4953,"negativeTestsAntibody":79502,"totalTestsPeopleAntibody":68919,"positiveTestsPeopleAntibody":3618,"negativeTestsPeopleAntibody":71709,"totalTestsPeopleAntigen":14224,"positiveTestsPeopleAntigen":null,"totalTestsAntigen":25263,"positiveTestsAntigen":5104,"fips":"29","positiveIncrease":1524,"negativeIncrease":0,"total":1394624,"totalTestResultsIncrease":0,"posNeg":1394624,"deathIncrease":25,"hospitalizedIncrease":0,"hash":"917c51f0168cba3746752512ea0e90a9c5f8a02d","commercialScore":0,"negativeRegularScore":0,"negativeScore":0,"positiveScore":0,"score":0,"grade":""},{"date":20201019,"state":"MO","positive":158101,"probableCases":null,"negative":1234999,"pending":null,"totalTestResultsSource":"totalTestsViral","totalTestResults":2296674,"hospitalizedCurrently":1439,"hospitalizedCumulative":null,"inIcuCurrently":476,"inIcuCumulative":null,"onVentilatorCurrently":null,"onVentilatorCumulative":null,"recovered":null,"dataQualityGrade":"B","lastUpdateEt":"10/19/2020 00:59","dateModified":"2020-10-19T24:59:00Z","checkTimeEt":"10/18 20:59","death":2590,"hospitalized":null,"dateChecked":"2020-10-19T24:59:00Z","totalTestsViral":2296674,"positiveTestsViral":181463,"negativeTestsViral":2110912,"positiveCasesViral":158101,"deathConfirmed":null,"deathProbable":null,"totalTestEncountersViral":null,"totalTestsPeopleViral":1393100,"totalTestsAntibody":84652,"positiveTestsAntibody":4953,"negativeTestsAntibody":79502,"totalTestsPeopleAntibody":68919,"positiveTestsPeopleAntibody":3618,"negativeTestsPeopleAntibody":71709,"totalTestsPeopleAntigen":14224,"positiveTestsPeopleAntigen":null,"totalTestsAntigen":25263,"positiveTestsAntigen":5104,"fips":"29","positiveIncrease":1405,"negativeIncrease":5159,"total":1393100,"totalTestResultsIncrease":11607,"posNeg":1393100,"deathIncrease":8,"hospitalizedIncrease":0,"hash":"36bbd77984c7244c64182ed56a82b8cea16b49ca","commercialScore":0,"negativeRegularScore":0,"negativeScore":0,"positiveScore":0,"score":0,"grade":""},{"date":20201018,"state":"MO","positive":156696,"probableCases":null,"negative":1229840,"pending":null,"totalTestResultsSource":"totalTestsViral","totalTestResults":2285067,"hospitalizedCurrently":918,"hospitalizedCumulative":null,"inIcuCurrently":null,"inIcuCumulative":null,"onVentilatorCurrently":null,"onVentilatorCumulative":null,"recovered":null,"dataQualityGrade":"B","lastUpdateEt":"10/18/2020 00:59","dateModified":"2020-10-18T24:59:00Z","checkTimeEt":"10/17 20:59","death":2582,"hospitalized":null,"dateChecked":"2020-10-18T24:59:00Z","totalTestsViral":2285067,"positiveTestsViral":179986,"negativeTestsViral":2100802,"positiveCasesViral":156696,"deathConfirmed":null,"deathProbable":null,"totalTestEncountersViral":null,"totalTestsPeopleViral":1386536,"totalTestsAntibody":84527,"positiveTestsAntibody":4983,"negativeTestsAntibody":79346,"totalTestsPeopleAntibody":68797,"positiveTestsPeopleAntibody":3618,"negativeTestsPeopleAntibody":71709,"totalTestsPeopleAntigen":14120,"positiveTestsPeopleAntigen":null,"totalTestsAntigen":25059,"positiveTestsAntigen":5042,"fips":"29","positiveIncrease":1768,"negativeIncrease":6105,"total":1386536,"totalTestResultsIncrease":18079,"posNeg":1386536,"deathIncrease":2,"hospitalizedIncrease":0,"hash":"1c15f77bbb2d192538db5e40129e4b5e2bdc6494","commercialScore":0,"negativeRegularScore":0,"negativeScore":0,"positiveScore":0,"score":0,"grade":""},{"date":20201017,"state":"MO","positive":154928,"probableCases":null,"negative":1223735,"pending":null,"totalTestResultsSource":"totalTestsViral","totalTestResults":2266988,"hospitalizedCurrently":1431,"hospitalizedCumulative":null,"inIcuCurrently":null,"inIcuCumulative":null,"onVentilatorCurrently":null,"onVentilatorCumulative":null,"recovered":null,"dataQualityGrade":"B","lastUpdateEt":"10/17/2020 00:59","dateModified":"2020-10-17T24:59:00Z","checkTimeEt":"10/16 20:59","death":2580,"hospitalized":null,"dateChecked":"2020-10-17T24:59:00Z","totalTestsViral":2266988,"positiveTestsViral":178082,"negativeTestsViral":2084659,"positiveCasesViral":154928,"deathConfirmed":null,"deathProbable":null,"totalTestEncountersViral":null,"totalTestsPeopleViral":1378663,"totalTestsAntibody":84189,"positiveTestsAntibody":4929,"negativeTestsAntibody":79062,"totalTestsPeopleAntibody":68599,"positiveTestsPeopleAntibody":3618,"negativeTestsPeopleAntibody":71709,"totalTestsPeopleAntigen":13907,"positiveTestsPeopleAntigen":null,"totalTestsAntigen":24668,"positiveTestsAntigen":4963,"fips":"29","positiveIncrease":2357,"negativeIncrease":15043,"total":1378663,"totalTestResultsIncrease":44134,"posNeg":1378663,"deathIncrease":121,"hospitalizedIncrease":0,"hash":"84a2a567c69a8dfd9c07c2226421180a0143c2bb","commercialScore":0,"negativeRegularScore":0,"negativeScore":0,"positiveScore":0,"score":0,"grade":""},{"date":20201016,"state":"MO","positive":152571,"probableCases":null,"negative":1208692,"pending":null,"totalTestResultsSource":"totalTestsViral","totalTestResults":2222854,"hospitalizedCurrently":1443,"hospitalizedCumulative":null,"inIcuCurrently":null,"inIcuCumulative":null,"onVentilatorCurrently":null,"onVentilatorCumulative":null,"recovered":null,"dataQualityGrade":"B","lastUpdateEt":"10/16/2020 00:59","dateModified":"2020-10-16T24:59:00Z","checkTimeEt":"10/15 20:59","death":2459,"hospitalized":null,"dateChecked":"2020-10-16T24:59:00Z","totalTestsViral":2222854,"positiveTestsViral":173299,"negativeTestsViral":2045374,"positiveCasesViral":152571,"deathConfirmed":null,"deathProbable":null,"totalTestEncountersViral":null,"totalTestsPeopleViral":1359246,"totalTestsAntibody":83529,"positiveTestsAntibody":4830,"negativeTestsAntibody":78502,"totalTestsPeopleAntibody":68258,"positiveTestsPeopleAntibody":3618,"negativeTestsPeopleAntibody":71709,"totalTestsPeopleAntigen":13340,"positiveTestsPeopleAntigen":null,"totalTestsAntigen":23021,"positiveTestsAntigen":4696,"fips":"29","positiveIncrease":2017,"negativeIncrease":0,"total":1361263,"totalTestResultsIncrease":0,"posNeg":1361263,"deathIncrease":17,"hospitalizedIncrease":0,"hash":"f1afe5e1a2d3ca16115ce5e6cfb1bbc4ec41bafa","commercialScore":0,"negativeRegularScore":0,"negativeScore":0,"positiveScore":0,"score":0,"grade":""},{"date":20201015,"state":"MO","positive":150554,"probableCases":null,"negative":1208692,"pending":null,"totalTestResultsSource":"totalTestsViral","totalTestResults":2222854,"hospitalizedCurrently":1443,"hospitalizedCumulative":null,"inIcuCurrently":null,"inIcuCumulative":null,"onVentilatorCurrently":null,"onVentilatorCumulative":null,"recovered":null,"dataQualityGrade":"B","lastUpdateEt":"10/15/2020 00:59","dateModified":"2020-10-15T24:59:00Z","checkTimeEt":"10/14 20:59","death":2442,"hospitalized":null,"dateChecked":"2020-10-15T24:59:00Z","totalTestsViral":2222854,"positiveTestsViral":173299,"negativeTestsViral":2045374,"positiveCasesViral":150554,"deathConfirmed":null,"deathProbable":null,"totalTestEncountersViral":null,"totalTestsPeopleViral":1359246,"totalTestsAntibody":83529,"positiveTestsAntibody":4830,"negativeTestsAntibody":78502,"totalTestsPeopleAntibody":68258,"positiveTestsPeopleAntibody":3618,"negativeTestsPeopleAntibody":71709,"totalTestsPeopleAntigen":13340,"positiveTestsPeopleAntigen":null,"totalTestsAntigen":23021,"positiveTestsAntigen":4696,"fips":"29","positiveIncrease":1875,"negativeIncrease":5210,"total":1359246,"totalTestResultsIncrease":16480,"posNeg":1359246,"deathIncrease":22,"hospitalizedIncrease":0,"hash":"7a2d3b0755f009bc07a130859561d4991b428c5a","commercialScore":0,"negativeRegularScore":0,"negativeScore":0,"positiveScore":0,"score":0,"grade":""},{"date":20201014,"state":"MO","positive":148679,"probableCases":null,"negative":1203482,"pending":null,"totalTestResultsSource":"totalTestsViral","totalTestResults":2206374,"hospitalizedCurrently":1413,"hospitalizedCumulative":null,"inIcuCurrently":null,"inIcuCumulative":null,"onVentilatorCurrently":null,"onVentilatorCumulative":null,"recovered":null,"dataQualityGrade":"B","lastUpdateEt":"10/14/2020 00:59","dateModified":"2020-10-14T24:59:00Z","checkTimeEt":"10/13 20:59","death":2420,"hospitalized":null,"dateChecked":"2020-10-14T24:59:00Z","totalTestsViral":2206374,"positiveTestsViral":171289,"negativeTestsViral":2030924,"positiveCasesViral":148679,"deathConfirmed":null,"deathProbable":null,"totalTestEncountersViral":null,"totalTestsPeopleViral":1352161,"totalTestsAntibody":83174,"positiveTestsAntibody":4773,"negativeTestsAntibody":78204,"totalTestsPeopleAntibody":68054,"positiveTestsPeopleAntibody":3618,"negativeTestsPeopleAntibody":71709,"totalTestsPeopleAntigen":13050,"positiveTestsPeopleAntigen":null,"totalTestsAntigen":22504,"positiveTestsAntigen":4545,"fips":"29","positiveIncrease":4449,"negativeIncrease":-99955,"total":1352161,"totalTestResultsIncrease":130675,"posNeg":1352161,"deathIncrease":-2,"hospitalizedIncrease":0,"hash":"b8bfa803ec1cea32c8d372288b407ad01f7169fb","commercialScore":0,"negativeRegularScore":0,"negativeScore":0,"positiveScore":0,"score":0,"grade":""},{"date":20201013,"state":"MO","positive":144230,"probableCases":null,"negative":1303437,"pending":null,"totalTestResultsSource":"totalTestsViral","totalTestResults":2075699,"hospitalizedCurrently":1313,"hospitalizedCumulative":null,"inIcuCurrently":null,"inIcuCumulative":null,"onVentilatorCurrently":null,"onVentilatorCumulative":null,"recovered":null,"dataQualityGrade":"B","lastUpdateEt":"10/10/2020 00:59","dateModified":"2020-10-10T24:59:00Z","checkTimeEt":"10/09 20:59","death":2422,"hospitalized":null,"dateChecked":"2020-10-10T24:59:00Z","totalTestsViral":2075699,"positiveTestsViral":163531,"negativeTestsViral":1908333,"positiveCasesViral":144230,"deathConfirmed":null,"deathProbable":null,"totalTestEncountersViral":null,"totalTestsPeopleViral":1447667,"totalTestsAntibody":80831,"positiveTestsAntibody":4188,"negativeTestsAntibody":76509,"totalTestsPeopleAntibody":69462,"positiveTestsPeopleAntibody":3618,"negativeTestsPeopleAntibody":71709,"totalTestsPeopleAntigen":14213,"positiveTestsPeopleAntigen":null,"totalTestsAntigen":20834,"positiveTestsAntigen":3979,"fips":"29","positiveIncrease":0,"negativeIncrease":0,"total":1447667,"totalTestResultsIncrease":0,"posNeg":1447667,"deathIncrease":0,"hospitalizedIncrease":0,"hash":"04dea9bc84ec4e2a38a6edba8b5be5670cef467d","commercialScore":0,"negativeRegularScore":0,"negativeScore":0,"positiveScore":0,"score":0,"grade":""},{"date":20201012,"state":"MO","positive":144230,"probableCases":null,"negative":1303437,"pending":null,"totalTestResultsSource":"totalTestsViral","totalTestResults":2075699,"hospitalizedCurrently":1313,"hospitalizedCumulative":null,"inIcuCurrently":null,"inIcuCumulative":null,"onVentilatorCurrently":null,"onVentilatorCumulative":null,"recovered":null,"dataQualityGrade":"B","lastUpdateEt":"10/10/2020 00:59","dateModified":"2020-10-10T24:59:00Z","checkTimeEt":"10/09 20:59","death":2422,"hospitalized":null,"dateChecked":"2020-10-10T24:59:00Z","totalTestsViral":2075699,"positiveTestsViral":163531,"negativeTestsViral":1908333,"positiveCasesViral":144230,"deathConfirmed":null,"deathProbable":null,"totalTestEncountersViral":null,"totalTestsPeopleViral":1447667,"totalTestsAntibody":80831,"positiveTestsAntibody":4188,"negativeTestsAntibody":76509,"totalTestsPeopleAntibody":69462,"positiveTestsPeopleAntibody":3618,"negativeTestsPeopleAntibody":71709,"totalTestsPeopleAntigen":14213,"positiveTestsPeopleAntigen":null,"totalTestsAntigen":20834,"positiveTestsAntigen":3979,"fips":"29","positiveIncrease":0,"negativeIncrease":0,"total":1447667,"totalTestResultsIncrease":0,"posNeg":1447667,"deathIncrease":0,"hospitalizedIncrease":0,"hash":"9c1ead0d3c50549ed6d9f052d3e2621278aeb80b","commercialScore":0,"negativeRegularScore":0,"negativeScore":0,"positiveScore":0,"score":0,"grade":""},{"date":20201011,"state":"MO","positive":144230,"probableCases":null,"negative":1303437,"pending":null,"totalTestResultsSource":"totalTestsViral","totalTestResults":2075699,"hospitalizedCurrently":1313,"hospitalizedCumulative":null,"inIcuCurrently":null,"inIcuCumulative":null,"onVentilatorCurrently":null,"onVentilatorCumulative":null,"recovered":null,"dataQualityGrade":"B","lastUpdateEt":"10/10/2020 00:59","dateModified":"2020-10-10T24:59:00Z","checkTimeEt":"10/09 20:59","death":2422,"hospitalized":null,"dateChecked":"2020-10-10T24:59:00Z","totalTestsViral":2075699,"positiveTestsViral":163531,"negativeTestsViral":1908333,"positiveCasesViral":144230,"deathConfirmed":null,"deathProbable":null,"totalTestEncountersViral":null,"totalTestsPeopleViral":1447667,"totalTestsAntibody":80831,"positiveTestsAntibody":4188,"negativeTestsAntibody":76509,"totalTestsPeopleAntibody":69462,"positiveTestsPeopleAntibody":3618,"negativeTestsPeopleAntibody":71709,"totalTestsPeopleAntigen":14213,"positiveTestsPeopleAntigen":null,"totalTestsAntigen":20834,"positiveTestsAntigen":3979,"fips":"29","positiveIncrease":0,"negativeIncrease":0,"total":1447667,"totalTestResultsIncrease":0,"posNeg":1447667,"deathIncrease":0,"hospitalizedIncrease":0,"hash":"9a3a1f6a945d2b0a59e1aafcd703002358e5d906","commercialScore":0,"negativeRegularScore":0,"negativeScore":0,"positiveScore":0,"score":0,"grade":""},{"date":20201010,"state":"MO","positive":144230,"probableCases":null,"negative":1303437,"pending":null,"totalTestResultsSource":"totalTestsViral","totalTestResults":2075699,"hospitalizedCurrently":1313,"hospitalizedCumulative":null,"inIcuCurrently":null,"inIcuCumulative":null,"onVentilatorCurrently":null,"onVentilatorCumulative":null,"recovered":null,"dataQualityGrade":"B","lastUpdateEt":"10/10/2020 00:59","dateModified":"2020-10-10T24:59:00Z","checkTimeEt":"10/09 20:59","death":2422,"hospitalized":null,"dateChecked":"2020-10-10T24:59:00Z","totalTestsViral":2075699,"positiveTestsViral":163531,"negativeTestsViral":1908333,"positiveCasesViral":144230,"deathConfirmed":null,"deathProbable":null,"totalTestEncountersViral":null,"totalTestsPeopleViral":1447667,"totalTestsAntibody":80831,"positiveTestsAntibody":4188,"negativeTestsAntibody":76509,"totalTestsPeopleAntibody":69462,"positiveTestsPeopleAntibody":3618,"negativeTestsPeopleAntibody":71709,"totalTestsPeopleAntigen":14213,"positiveTestsPeopleAntigen":null,"totalTestsAntigen":20834,"positiveTestsAntigen":3979,"fips":"29","positiveIncrease":5066,"negativeIncrease":42982,"total":1447667,"totalTestResultsIncrease":74720,"posNeg":1447667,"deathIncrease":27,"hospitalizedIncrease":0,"hash":"d19d600e1b403feada611975099fdc923ac2338e","commercialScore":0,"negativeRegularScore":0,"negativeScore":0,"positiveScore":0,"score":0,"grade":""},{"date":20201009,"state":"MO","positive":139164,"probableCases":null,"negative":1260455,"pending":null,"totalTestResultsSource":"totalTestsViral","totalTestResults":2000979,"hospitalizedCurrently":1303,"hospitalizedCumulative":null,"inIcuCurrently":null,"inIcuCumulative":null,"onVentilatorCurrently":null,"onVentilatorCumulative":null,"recovered":null,"dataQualityGrade":"B","lastUpdateEt":"10/9/2020 00:59","dateModified":"2020-10-09T24:59:00Z","checkTimeEt":"10/08 20:59","death":2395,"hospitalized":null,"dateChecked":"2020-10-09T24:59:00Z","totalTestsViral":2000979,"positiveTestsViral":158050,"negativeTestsViral":1839237,"positiveCasesViral":139164,"deathConfirmed":null,"deathProbable":null,"totalTestEncountersViral":null,"totalTestsPeopleViral":1399619,"totalTestsAntibody":79581,"positiveTestsAntibody":4042,"negativeTestsAntibody":75405,"totalTestsPeopleAntibody":68411,"positiveTestsPeopleAntibody":3618,"negativeTestsPeopleAntibody":71709,"totalTestsPeopleAntigen":12459,"positiveTestsPeopleAntigen":null,"totalTestsAntigen":18390,"positiveTestsAntigen":3722,"fips":"29","positiveIncrease":2008,"negativeIncrease":10472,"total":1399619,"totalTestResultsIncrease":21589,"posNeg":1399619,"deathIncrease":136,"hospitalizedIncrease":0,"hash":"c09025460c97c8b12f862a4e3134413a23576ffe","commercialScore":0,"negativeRegularScore":0,"negativeScore":0,"positiveScore":0,"score":0,"grade":""},{"date":20201008,"state":"MO","positive":137156,"probableCases":null,"negative":1249983,"pending":null,"totalTestResultsSource":"totalTestsViral","totalTestResults":1979390,"hospitalizedCurrently":1344,"hospitalizedCumulative":null,"inIcuCurrently":null,"inIcuCumulative":null,"onVentilatorCurrently":null,"onVentilatorCumulative":null,"recovered":null,"dataQualityGrade":"B","lastUpdateEt":"10/8/2020 00:59","dateModified":"2020-10-08T24:59:00Z","checkTimeEt":"10/07 20:59","death":2259,"hospitalized":null,"dateChecked":"2020-10-08T24:59:00Z","totalTestsViral":1979390,"positiveTestsViral":155881,"negativeTestsViral":1819846,"positiveCasesViral":137156,"deathConfirmed":null,"deathProbable":null,"totalTestEncountersViral":null,"totalTestsPeopleViral":1387139,"totalTestsAntibody":79251,"positiveTestsAntibody":3984,"negativeTestsAntibody":75135,"totalTestsPeopleAntibody":68157,"positiveTestsPeopleAntibody":3618,"negativeTestsPeopleAntibody":71709,"totalTestsPeopleAntigen":12276,"positiveTestsPeopleAntigen":null,"totalTestsAntigen":18042,"positiveTestsAntigen":3642,"fips":"29","positiveIncrease":1505,"negativeIncrease":10619,"total":1387139,"totalTestResultsIncrease":20929,"posNeg":1387139,"deathIncrease":23,"hospitalizedIncrease":0,"hash":"d7e4024c3c7fbd077d56eed30f2177b28413b10b","commercialScore":0,"negativeRegularScore":0,"negativeScore":0,"positiveScore":0,"score":0,"grade":""},{"date":20201007,"state":"MO","positive":135651,"probableCases":null,"negative":1239364,"pending":null,"totalTestResultsSource":"totalTestsViral","totalTestResults":1958461,"hospitalizedCurrently":1352,"hospitalizedCumulative":null,"inIcuCurrently":null,"inIcuCumulative":null,"onVentilatorCurrently":null,"onVentilatorCumulative":null,"recovered":null,"dataQualityGrade":"B","lastUpdateEt":"10/7/2020 00:59","dateModified":"2020-10-07T24:59:00Z","checkTimeEt":"10/06 20:59","death":2236,"hospitalized":null,"dateChecked":"2020-10-07T24:59:00Z","totalTestsViral":1958461,"positiveTestsViral":154257,"negativeTestsViral":1800597,"positiveCasesViral":135651,"deathConfirmed":null,"deathProbable":null,"totalTestEncountersViral":null,"totalTestsPeopleViral":1375015,"totalTestsAntibody":79027,"positiveTestsAntibody":3953,"negativeTestsAntibody":74942,"totalTestsPeopleAntibody":67984,"positiveTestsPeopleAntibody":3618,"negativeTestsPeopleAntibody":71709,"totalTestsPeopleAntigen":11596,"positiveTestsPeopleAntigen":null,"totalTestsAntigen":16095,"positiveTestsAntigen":3503,"fips":"29","positiveIncrease":1068,"negativeIncrease":6808,"total":1375015,"totalTestResultsIncrease":11857,"posNeg":1375015,"deathIncrease":36,"hospitalizedIncrease":0,"hash":"7f36c3d770d8c20631b87609fcd35a7d621e22c1","commercialScore":0,"negativeRegularScore":0,"negativeScore":0,"positiveScore":0,"score":0,"grade":""},{"date":20201006,"state":"MO","positive":134583,"probableCases":null,"negative":1232556,"pending":null,"totalTestResultsSource":"totalTestsViral","totalTestResults":1946604,"hospitalizedCurrently":1249,"hospitalizedCumulative":null,"inIcuCurrently":null,"inIcuCumulative":null,"onVentilatorCurrently":null,"onVentilatorCumulative":null,"recovered":null,"dataQualityGrade":"B","lastUpdateEt":"10/6/2020 00:59","dateModified":"2020-10-06T24:59:00Z","checkTimeEt":"10/05 20:59","death":2200,"hospitalized":null,"dateChecked":"2020-10-06T24:59:00Z","totalTestsViral":1946604,"positiveTestsViral":153132,"negativeTestsViral":1789896,"positiveCasesViral":134583,"deathConfirmed":null,"deathProbable":null,"totalTestEncountersViral":null,"totalTestsPeopleViral":1367139,"totalTestsAntibody":78709,"positiveTestsAntibody":3912,"negativeTestsAntibody":74665,"totalTestsPeopleAntibody":67764,"positiveTestsPeopleAntibody":3618,"negativeTestsPeopleAntibody":71709,"totalTestsPeopleAntigen":11216,"positiveTestsPeopleAntigen":null,"totalTestsAntigen":15458,"positiveTestsAntigen":3369,"fips":"29","positiveIncrease":1165,"negativeIncrease":7306,"total":1367139,"totalTestResultsIncrease":16518,"posNeg":1367139,"deathIncrease":26,"hospitalizedIncrease":0,"hash":"7dd2b17c7a149060ba70e56f28f68d078ab2deba","commercialScore":0,"negativeRegularScore":0,"negativeScore":0,"positiveScore":0,"score":0,"grade":""},{"date":20201005,"state":"MO","positive":133418,"probableCases":null,"negative":1225250,"pending":null,"totalTestResultsSource":"totalTestsViral","totalTestResults":1930086,"hospitalizedCurrently":1201,"hospitalizedCumulative":null,"inIcuCurrently":null,"inIcuCumulative":null,"onVentilatorCurrently":null,"onVentilatorCumulative":null,"recovered":null,"dataQualityGrade":"B","lastUpdateEt":"10/5/2020 00:59","dateModified":"2020-10-05T24:59:00Z","checkTimeEt":"10/04 20:59","death":2174,"hospitalized":null,"dateChecked":"2020-10-05T24:59:00Z","totalTestsViral":1930086,"positiveTestsViral":151860,"negativeTestsViral":1774689,"positiveCasesViral":133418,"deathConfirmed":null,"deathProbable":null,"totalTestEncountersViral":null,"totalTestsPeopleViral":1358668,"totalTestsAntibody":78620,"positiveTestsAntibody":3893,"negativeTestsAntibody":74599,"totalTestsPeopleAntibody":67695,"positiveTestsPeopleAntibody":3618,"negativeTestsPeopleAntibody":71709,"totalTestsPeopleAntigen":10968,"positiveTestsPeopleAntigen":null,"totalTestsAntigen":15027,"positiveTestsAntigen":3311,"fips":"29","positiveIncrease":987,"negativeIncrease":6936,"total":1358668,"totalTestResultsIncrease":13339,"posNeg":1358668,"deathIncrease":1,"hospitalizedIncrease":0,"hash":"68040a5b67dbf01d3ad8c5ae414c6c6afc78f08b","commercialScore":0,"negativeRegularScore":0,"negativeScore":0,"positiveScore":0,"score":0,"grade":""},{"date":20201004,"state":"MO","positive":132431,"probableCases":null,"negative":1218314,"pending":null,"totalTestResultsSource":"totalTestsViral","totalTestResults":1916747,"hospitalizedCurrently":1135,"hospitalizedCumulative":null,"inIcuCurrently":null,"inIcuCumulative":null,"onVentilatorCurrently":null,"onVentilatorCumulative":null,"recovered":null,"dataQualityGrade":"B","lastUpdateEt":"10/4/2020 00:59","dateModified":"2020-10-04T24:59:00Z","checkTimeEt":"10/03 20:59","death":2173,"hospitalized":null,"dateChecked":"2020-10-04T24:59:00Z","totalTestsViral":1916747,"positiveTestsViral":150807,"negativeTestsViral":1762433,"positiveCasesViral":132431,"deathConfirmed":null,"deathProbable":null,"totalTestEncountersViral":null,"totalTestsPeopleViral":1350745,"totalTestsAntibody":78506,"positiveTestsAntibody":3879,"negativeTestsAntibody":74499,"totalTestsPeopleAntibody":67615,"positiveTestsPeopleAntibody":3618,"negativeTestsPeopleAntibody":71709,"totalTestsPeopleAntigen":10942,"positiveTestsPeopleAntigen":null,"totalTestsAntigen":14987,"positiveTestsAntigen":3311,"fips":"29","positiveIncrease":1326,"negativeIncrease":9863,"total":1350745,"totalTestResultsIncrease":18569,"posNeg":1350745,"deathIncrease":4,"hospitalizedIncrease":0,"hash":"c8cffb73a6fca49cc0fc3c8f23b35bca46a0ee38","commercialScore":0,"negativeRegularScore":0,"negativeScore":0,"positiveScore":0,"score":0,"grade":""},{"date":20201003,"state":"MO","positive":131105,"probableCases":null,"negative":1208451,"pending":null,"totalTestResultsSource":"totalTestsViral","totalTestResults":1898178,"hospitalizedCurrently":1144,"hospitalizedCumulative":null,"inIcuCurrently":null,"inIcuCumulative":null,"onVentilatorCurrently":null,"onVentilatorCumulative":null,"recovered":null,"dataQualityGrade":"B","lastUpdateEt":"10/3/2020 00:59","dateModified":"2020-10-03T24:59:00Z","checkTimeEt":"10/02 20:59","death":2169,"hospitalized":null,"dateChecked":"2020-10-03T24:59:00Z","totalTestsViral":1898178,"positiveTestsViral":149342,"negativeTestsViral":1745338,"positiveCasesViral":131105,"deathConfirmed":null,"deathProbable":null,"totalTestEncountersViral":null,"totalTestsPeopleViral":1339556,"totalTestsAntibody":78281,"positiveTestsAntibody":3843,"negativeTestsAntibody":74311,"totalTestsPeopleAntibody":67449,"positiveTestsPeopleAntibody":3618,"negativeTestsPeopleAntibody":71709,"totalTestsPeopleAntigen":10864,"positiveTestsPeopleAntigen":null,"totalTestsAntigen":14859,"positiveTestsAntigen":3268,"fips":"29","positiveIncrease":1708,"negativeIncrease":11659,"total":1339556,"totalTestResultsIncrease":22500,"posNeg":1339556,"deathIncrease":25,"hospitalizedIncrease":0,"hash":"9971f8d7a570078a2e92815096ff19a64edef68d","commercialScore":0,"negativeRegularScore":0,"negativeScore":0,"positiveScore":0,"score":0,"grade":""},{"date":20201002,"state":"MO","positive":129397,"probableCases":null,"negative":1196792,"pending":null,"totalTestResultsSource":"totalTestsViral","totalTestResults":1875678,"hospitalizedCurrently":1184,"hospitalizedCumulative":null,"inIcuCurrently":null,"inIcuCumulative":null,"onVentilatorCurrently":null,"onVentilatorCumulative":null,"recovered":null,"dataQualityGrade":"B","lastUpdateEt":"10/2/2020 00:59","dateModified":"2020-10-02T24:59:00Z","checkTimeEt":"10/01 20:59","death":2144,"hospitalized":null,"dateChecked":"2020-10-02T24:59:00Z","totalTestsViral":1875678,"positiveTestsViral":147490,"negativeTestsViral":1724744,"positiveCasesViral":129397,"deathConfirmed":null,"deathProbable":null,"totalTestEncountersViral":null,"totalTestsPeopleViral":1326189,"totalTestsAntibody":78026,"positiveTestsAntibody":3809,"negativeTestsAntibody":74087,"totalTestsPeopleAntibody":67252,"positiveTestsPeopleAntibody":3618,"negativeTestsPeopleAntibody":71709,"totalTestsPeopleAntigen":10595,"positiveTestsPeopleAntigen":null,"totalTestsAntigen":14434,"positiveTestsAntigen":3225,"fips":"29","positiveIncrease":1485,"negativeIncrease":9286,"total":1326189,"totalTestResultsIncrease":19692,"posNeg":1326189,"deathIncrease":16,"hospitalizedIncrease":0,"hash":"a3ce4156e248fe008c7d64dc421d1bbc5b68ca6c","commercialScore":0,"negativeRegularScore":0,"negativeScore":0,"positiveScore":0,"score":0,"grade":""},{"date":20201001,"state":"MO","positive":127912,"probableCases":null,"negative":1187506,"pending":null,"totalTestResultsSource":"totalTestsViral","totalTestResults":1855986,"hospitalizedCurrently":1185,"hospitalizedCumulative":null,"inIcuCurrently":null,"inIcuCumulative":null,"onVentilatorCurrently":null,"onVentilatorCumulative":null,"recovered":null,"dataQualityGrade":"B","lastUpdateEt":"9/30/2020 00:00","dateModified":"2020-09-30T24:00:00Z","checkTimeEt":"09/29 20:00","death":2128,"hospitalized":null,"dateChecked":"2020-09-30T24:00:00Z","totalTestsViral":1855986,"positiveTestsViral":145846,"negativeTestsViral":1706722,"positiveCasesViral":127912,"deathConfirmed":null,"deathProbable":null,"totalTestEncountersViral":null,"totalTestsPeopleViral":1315418,"totalTestsAntibody":77845,"positiveTestsAntibody":3773,"negativeTestsAntibody":73944,"totalTestsPeopleAntibody":67113,"positiveTestsPeopleAntibody":3618,"negativeTestsPeopleAntibody":71709,"totalTestsPeopleAntigen":10054,"positiveTestsPeopleAntigen":null,"totalTestsAntigen":13721,"positiveTestsAntigen":3136,"fips":"29","positiveIncrease":1799,"negativeIncrease":9234,"total":1315418,"totalTestResultsIncrease":8617,"posNeg":1315418,"deathIncrease":10,"hospitalizedIncrease":0,"hash":"2beb4cdc5de935264868757a9bae6a581c2efd1b","commercialScore":0,"negativeRegularScore":0,"negativeScore":0,"positiveScore":0,"score":0,"grade":""},{"date":20200930,"state":"MO","positive":126113,"probableCases":null,"negative":1178272,"pending":null,"totalTestResultsSource":"totalTestsViral","totalTestResults":1847369,"hospitalizedCurrently":1171,"hospitalizedCumulative":null,"inIcuCurrently":null,"inIcuCumulative":null,"onVentilatorCurrently":null,"onVentilatorCumulative":null,"recovered":null,"dataQualityGrade":"B","lastUpdateEt":"9/30/2020 00:00","dateModified":"2020-09-30T24:00:00Z","checkTimeEt":"09/29 20:00","death":2118,"hospitalized":null,"dateChecked":"2020-09-30T24:00:00Z","totalTestsViral":1847369,"positiveTestsViral":143886,"negativeTestsViral":1700102,"positiveCasesViral":126113,"deathConfirmed":null,"deathProbable":null,"totalTestEncountersViral":null,"totalTestsPeopleViral":1302958,"totalTestsAntibody":77904,"positiveTestsAntibody":3747,"negativeTestsAntibody":74027,"totalTestsPeopleAntibody":75327,"positiveTestsPeopleAntibody":3618,"negativeTestsPeopleAntibody":71709,"totalTestsPeopleAntigen":null,"positiveTestsPeopleAntigen":null,"totalTestsAntigen":11328,"positiveTestsAntigen":3057,"fips":"29","positiveIncrease":1351,"negativeIncrease":0,"total":1304385,"totalTestResultsIncrease":21170,"posNeg":1304385,"deathIncrease":32,"hospitalizedIncrease":0,"hash":"d64ab82945e54c30653eafddd5ef8565acd0eed6","commercialScore":0,"negativeRegularScore":0,"negativeScore":0,"positiveScore":0,"score":0,"grade":""},{"date":20200929,"state":"MO","positive":124762,"probableCases":null,"negative":1178272,"pending":null,"totalTestResultsSource":"totalTestsViral","totalTestResults":1826199,"hospitalizedCurrently":1219,"hospitalizedCumulative":null,"inIcuCurrently":null,"inIcuCumulative":null,"onVentilatorCurrently":null,"onVentilatorCumulative":null,"recovered":null,"dataQualityGrade":"B","lastUpdateEt":"9/29/2020 00:00","dateModified":"2020-09-29T24:00:00Z","checkTimeEt":"09/28 20:00","death":2086,"hospitalized":null,"dateChecked":"2020-09-29T24:00:00Z","totalTestsViral":1826199,"positiveTestsViral":142431,"negativeTestsViral":1680422,"positiveCasesViral":124762,"deathConfirmed":null,"deathProbable":null,"totalTestEncountersViral":null,"totalTestsPeopleViral":1302958,"totalTestsAntibody":77747,"positiveTestsAntibody":3728,"negativeTestsAntibody":73889,"totalTestsPeopleAntibody":75327,"positiveTestsPeopleAntibody":3618,"negativeTestsPeopleAntibody":71709,"totalTestsPeopleAntigen":null,"positiveTestsPeopleAntigen":null,"totalTestsAntigen":10572,"positiveTestsAntigen":2863,"fips":"29","positiveIncrease":76,"negativeIncrease":0,"total":1303034,"totalTestResultsIncrease":13062,"posNeg":1303034,"deathIncrease":22,"hospitalizedIncrease":0,"hash":"6be53f43d641ce0dd2532afadc125e657a6d0b64","commercialScore":0,"negativeRegularScore":0,"negativeScore":0,"positiveScore":0,"score":0,"grade":""},{"date":20200928,"state":"MO","positive":124686,"probableCases":null,"negative":1178272,"pending":null,"totalTestResultsSource":"totalTestsViral","totalTestResults":1813137,"hospitalizedCurrently":1137,"hospitalizedCumulative":null,"inIcuCurrently":null,"inIcuCumulative":null,"onVentilatorCurrently":null,"onVentilatorCumulative":null,"recovered":null,"dataQualityGrade":"B","lastUpdateEt":"9/28/2020 00:00","dateModified":"2020-09-28T24:00:00Z","checkTimeEt":"09/27 20:00","death":2064,"hospitalized":null,"dateChecked":"2020-09-28T24:00:00Z","totalTestsViral":1813137,"positiveTestsViral":140554,"negativeTestsViral":1669272,"positiveCasesViral":124686,"deathConfirmed":null,"deathProbable":null,"totalTestEncountersViral":null,"totalTestsPeopleViral":1302958,"totalTestsAntibody":null,"positiveTestsAntibody":null,"negativeTestsAntibody":null,"totalTestsPeopleAntibody":75327,"positiveTestsPeopleAntibody":3618,"negativeTestsPeopleAntibody":71709,"totalTestsPeopleAntigen":null,"positiveTestsPeopleAntigen":null,"totalTestsAntigen":null,"positiveTestsAntigen":null,"fips":"29","positiveIncrease":1280,"negativeIncrease":3572,"total":1302958,"totalTestResultsIncrease":113818,"posNeg":1302958,"deathIncrease":1,"hospitalizedIncrease":0,"hash":"04ba2b000a60e64e573706e81fa6ee5c2010c5cd","commercialScore":0,"negativeRegularScore":0,"negativeScore":0,"positiveScore":0,"score":0,"grade":""},{"date":20200927,"state":"MO","positive":123406,"probableCases":null,"negative":1174700,"pending":null,"totalTestResultsSource":"totalTestsViral","totalTestResults":1699319,"hospitalizedCurrently":1125,"hospitalizedCumulative":null,"inIcuCurrently":null,"inIcuCumulative":null,"onVentilatorCurrently":null,"onVentilatorCumulative":null,"recovered":null,"dataQualityGrade":"B","lastUpdateEt":"9/27/2020 00:00","dateModified":"2020-09-27T24:00:00Z","checkTimeEt":"09/26 20:00","death":2063,"hospitalized":null,"dateChecked":"2020-09-27T24:00:00Z","totalTestsViral":1699319,"positiveTestsViral":129549,"negativeTestsViral":1566917,"positiveCasesViral":123406,"deathConfirmed":null,"deathProbable":null,"totalTestEncountersViral":null,"totalTestsPeopleViral":1298106,"totalTestsAntibody":null,"positiveTestsAntibody":null,"negativeTestsAntibody":null,"totalTestsPeopleAntibody":74259,"positiveTestsPeopleAntibody":3518,"negativeTestsPeopleAntibody":70741,"totalTestsPeopleAntigen":null,"positiveTestsPeopleAntigen":null,"totalTestsAntigen":null,"positiveTestsAntigen":null,"fips":"29","positiveIncrease":1392,"negativeIncrease":7545,"total":1298106,"totalTestResultsIncrease":11810,"posNeg":1298106,"deathIncrease":0,"hospitalizedIncrease":0,"hash":"1bbcc81224ef6797f200fb747d9f1b4296946639","commercialScore":0,"negativeRegularScore":0,"negativeScore":0,"positiveScore":0,"score":0,"grade":""},{"date":20200926,"state":"MO","positive":122014,"probableCases":null,"negative":1167155,"pending":null,"totalTestResultsSource":"totalTestsViral","totalTestResults":1687509,"hospitalizedCurrently":1101,"hospitalizedCumulative":null,"inIcuCurrently":null,"inIcuCumulative":null,"onVentilatorCurrently":null,"onVentilatorCumulative":null,"recovered":null,"dataQualityGrade":"B","lastUpdateEt":"9/26/2020 00:00","dateModified":"2020-09-26T24:00:00Z","checkTimeEt":"09/25 20:00","death":2063,"hospitalized":null,"dateChecked":"2020-09-26T24:00:00Z","totalTestsViral":1687509,"positiveTestsViral":128009,"negativeTestsViral":1556710,"positiveCasesViral":122014,"deathConfirmed":null,"deathProbable":null,"totalTestEncountersViral":null,"totalTestsPeopleViral":1289169,"totalTestsAntibody":null,"positiveTestsAntibody":null,"negativeTestsAntibody":null,"totalTestsPeopleAntibody":74093,"positiveTestsPeopleAntibody":3508,"negativeTestsPeopleAntibody":70585,"totalTestsPeopleAntigen":null,"positiveTestsPeopleAntigen":null,"totalTestsAntigen":null,"positiveTestsAntigen":null,"fips":"29","positiveIncrease":1716,"negativeIncrease":14288,"total":1289169,"totalTestResultsIncrease":20077,"posNeg":1289169,"deathIncrease":69,"hospitalizedIncrease":0,"hash":"e194054271ce1004a8bf9f67070ba28b4722683b","commercialScore":0,"negativeRegularScore":0,"negativeScore":0,"positiveScore":0,"score":0,"grade":""},{"date":20200925,"state":"MO","positive":120298,"probableCases":null,"negative":1152867,"pending":null,"totalTestResultsSource":"totalTestsViral","totalTestResults":1667432,"hospitalizedCurrently":1068,"hospitalizedCumulative":null,"inIcuCurrently":null,"inIcuCumulative":null,"onVentilatorCurrently":null,"onVentilatorCumulative":null,"recovered":null,"dataQualityGrade":"B","lastUpdateEt":"9/25/2020 00:00","dateModified":"2020-09-25T24:00:00Z","checkTimeEt":"09/24 20:00","death":1994,"hospitalized":null,"dateChecked":"2020-09-25T24:00:00Z","totalTestsViral":1667432,"positiveTestsViral":126185,"negativeTestsViral":1538424,"positiveCasesViral":120298,"deathConfirmed":null,"deathProbable":null,"totalTestEncountersViral":null,"totalTestsPeopleViral":1273165,"totalTestsAntibody":null,"positiveTestsAntibody":null,"negativeTestsAntibody":null,"totalTestsPeopleAntibody":73815,"positiveTestsPeopleAntibody":3475,"negativeTestsPeopleAntibody":70340,"totalTestsPeopleAntigen":null,"positiveTestsPeopleAntigen":null,"totalTestsAntigen":null,"positiveTestsAntigen":null,"fips":"29","positiveIncrease":1987,"negativeIncrease":11647,"total":1273165,"totalTestResultsIncrease":18080,"posNeg":1273165,"deathIncrease":42,"hospitalizedIncrease":0,"hash":"7e2c6e355b800d91063dc1e9af21a36c3bc829c2","commercialScore":0,"negativeRegularScore":0,"negativeScore":0,"positiveScore":0,"score":0,"grade":""},{"date":20200924,"state":"MO","positive":118311,"probableCases":null,"negative":1141220,"pending":null,"totalTestResultsSource":"totalTestsViral","totalTestResults":1649352,"hospitalizedCurrently":1056,"hospitalizedCumulative":null,"inIcuCurrently":null,"inIcuCumulative":null,"onVentilatorCurrently":null,"onVentilatorCumulative":null,"recovered":null,"dataQualityGrade":"B","lastUpdateEt":"9/24/2020 00:00","dateModified":"2020-09-24T24:00:00Z","checkTimeEt":"09/23 20:00","death":1952,"hospitalized":null,"dateChecked":"2020-09-24T24:00:00Z","totalTestsViral":1649352,"positiveTestsViral":124668,"negativeTestsViral":1521891,"positiveCasesViral":118311,"deathConfirmed":null,"deathProbable":null,"totalTestEncountersViral":null,"totalTestsPeopleViral":1259531,"totalTestsAntibody":null,"positiveTestsAntibody":null,"negativeTestsAntibody":null,"totalTestsPeopleAntibody":73592,"positiveTestsPeopleAntibody":3462,"negativeTestsPeopleAntibody":70130,"totalTestsPeopleAntigen":null,"positiveTestsPeopleAntigen":null,"totalTestsAntigen":null,"positiveTestsAntigen":null,"fips":"29","positiveIncrease":1365,"negativeIncrease":13603,"total":1259531,"totalTestResultsIncrease":15489,"posNeg":1259531,"deathIncrease":5,"hospitalizedIncrease":0,"hash":"b14dfefb7af1fa4597377ef227ea25144f245557","commercialScore":0,"negativeRegularScore":0,"negativeScore":0,"positiveScore":0,"score":0,"grade":""},{"date":20200923,"state":"MO","positive":116946,"probableCases":null,"negative":1127617,"pending":null,"totalTestResultsSource":"totalTestsViral","totalTestResults":1633863,"hospitalizedCurrently":989,"hospitalizedCumulative":null,"inIcuCurrently":null,"inIcuCumulative":null,"onVentilatorCurrently":null,"onVentilatorCumulative":null,"recovered":null,"dataQualityGrade":"B","lastUpdateEt":"9/23/2020 00:00","dateModified":"2020-09-23T24:00:00Z","checkTimeEt":"09/22 20:00","death":1947,"hospitalized":null,"dateChecked":"2020-09-23T24:00:00Z","totalTestsViral":1633863,"positiveTestsViral":122803,"negativeTestsViral":1508256,"positiveCasesViral":116946,"deathConfirmed":null,"deathProbable":null,"totalTestEncountersViral":null,"totalTestsPeopleViral":1244563,"totalTestsAntibody":null,"positiveTestsAntibody":null,"negativeTestsAntibody":null,"totalTestsPeopleAntibody":73234,"positiveTestsPeopleAntibody":3388,"negativeTestsPeopleAntibody":69846,"totalTestsPeopleAntigen":null,"positiveTestsPeopleAntigen":null,"totalTestsAntigen":null,"positiveTestsAntigen":null,"fips":"29","positiveIncrease":1580,"negativeIncrease":1234,"total":1244563,"totalTestResultsIncrease":5540,"posNeg":1244563,"deathIncrease":83,"hospitalizedIncrease":0,"hash":"5cf62da0180fdcd43a991206d0b414f2c64dd438","commercialScore":0,"negativeRegularScore":0,"negativeScore":0,"positiveScore":0,"score":0,"grade":""},{"date":20200922,"state":"MO","positive":115366,"probableCases":null,"negative":1126383,"pending":null,"totalTestResultsSource":"totalTestsViral","totalTestResults":1628323,"hospitalizedCurrently":981,"hospitalizedCumulative":null,"inIcuCurrently":null,"inIcuCumulative":null,"onVentilatorCurrently":null,"onVentilatorCumulative":null,"recovered":null,"dataQualityGrade":"B","lastUpdateEt":"9/22/2020 00:00","dateModified":"2020-09-22T24:00:00Z","checkTimeEt":"09/21 20:00","death":1864,"hospitalized":null,"dateChecked":"2020-09-22T24:00:00Z","totalTestsViral":1628323,"positiveTestsViral":122668,"negativeTestsViral":1502893,"positiveCasesViral":115366,"deathConfirmed":null,"deathProbable":null,"totalTestEncountersViral":null,"totalTestsPeopleViral":1241749,"totalTestsAntibody":null,"positiveTestsAntibody":null,"negativeTestsAntibody":null,"totalTestsPeopleAntibody":73015,"positiveTestsPeopleAntibody":3368,"negativeTestsPeopleAntibody":69647,"totalTestsPeopleAntigen":null,"positiveTestsPeopleAntigen":null,"totalTestsAntigen":null,"positiveTestsAntigen":null,"fips":"29","positiveIncrease":1059,"negativeIncrease":21131,"total":1241749,"totalTestResultsIncrease":35348,"posNeg":1241749,"deathIncrease":57,"hospitalizedIncrease":0,"hash":"22d0ff22fe627c93e4acb720819d68f4ae5eff9a","commercialScore":0,"negativeRegularScore":0,"negativeScore":0,"positiveScore":0,"score":0,"grade":""},{"date":20200921,"state":"MO","positive":114307,"probableCases":null,"negative":1105252,"pending":null,"totalTestResultsSource":"totalTestsViral","totalTestResults":1592975,"hospitalizedCurrently":1022,"hospitalizedCumulative":null,"inIcuCurrently":null,"inIcuCumulative":null,"onVentilatorCurrently":null,"onVentilatorCumulative":null,"recovered":null,"dataQualityGrade":"B","lastUpdateEt":"9/21/2020 00:00","dateModified":"2020-09-21T24:00:00Z","checkTimeEt":"09/20 20:00","death":1807,"hospitalized":null,"dateChecked":"2020-09-21T24:00:00Z","totalTestsViral":1592975,"positiveTestsViral":121430,"negativeTestsViral":1468805,"positiveCasesViral":114307,"deathConfirmed":null,"deathProbable":null,"totalTestEncountersViral":null,"totalTestsPeopleViral":1219559,"totalTestsAntibody":null,"positiveTestsAntibody":null,"negativeTestsAntibody":null,"totalTestsPeopleAntibody":72529,"positiveTestsPeopleAntibody":3346,"negativeTestsPeopleAntibody":69183,"totalTestsPeopleAntigen":null,"positiveTestsPeopleAntigen":null,"totalTestsAntigen":null,"positiveTestsAntigen":null,"fips":"29","positiveIncrease":1463,"negativeIncrease":5588,"total":1219559,"totalTestResultsIncrease":8991,"posNeg":1219559,"deathIncrease":12,"hospitalizedIncrease":0,"hash":"3f93ddf58805638745c3266b7020b1c3aec02ec7","commercialScore":0,"negativeRegularScore":0,"negativeScore":0,"positiveScore":0,"score":0,"grade":""},{"date":20200920,"state":"MO","positive":112844,"probableCases":null,"negative":1099664,"pending":null,"totalTestResultsSource":"totalTestsViral","totalTestResults":1583984,"hospitalizedCurrently":1064,"hospitalizedCumulative":null,"inIcuCurrently":null,"inIcuCumulative":null,"onVentilatorCurrently":null,"onVentilatorCumulative":null,"recovered":null,"dataQualityGrade":"B","lastUpdateEt":"9/20/2020 00:00","dateModified":"2020-09-20T24:00:00Z","checkTimeEt":"09/19 20:00","death":1795,"hospitalized":null,"dateChecked":"2020-09-20T24:00:00Z","totalTestsViral":1583984,"positiveTestsViral":120142,"negativeTestsViral":1461128,"positiveCasesViral":112844,"deathConfirmed":null,"deathProbable":null,"totalTestEncountersViral":null,"totalTestsPeopleViral":1212508,"totalTestsAntibody":null,"positiveTestsAntibody":null,"negativeTestsAntibody":null,"totalTestsPeopleAntibody":72455,"positiveTestsPeopleAntibody":3316,"negativeTestsPeopleAntibody":69139,"totalTestsPeopleAntigen":null,"positiveTestsPeopleAntigen":null,"totalTestsAntigen":null,"positiveTestsAntigen":null,"fips":"29","positiveIncrease":1328,"negativeIncrease":8556,"total":1212508,"totalTestResultsIncrease":12982,"posNeg":1212508,"deathIncrease":2,"hospitalizedIncrease":0,"hash":"f2733d35bf1d71eaeb73d3490b59a90997e8d6c4","commercialScore":0,"negativeRegularScore":0,"negativeScore":0,"positiveScore":0,"score":0,"grade":""},{"date":20200919,"state":"MO","positive":111516,"probableCases":null,"negative":1091108,"pending":null,"totalTestResultsSource":"totalTestsViral","totalTestResults":1571002,"hospitalizedCurrently":1004,"hospitalizedCumulative":null,"inIcuCurrently":null,"inIcuCumulative":null,"onVentilatorCurrently":null,"onVentilatorCumulative":null,"recovered":null,"dataQualityGrade":"B","lastUpdateEt":"9/19/2020 00:00","dateModified":"2020-09-19T24:00:00Z","checkTimeEt":"09/18 20:00","death":1793,"hospitalized":null,"dateChecked":"2020-09-19T24:00:00Z","totalTestsViral":1571002,"positiveTestsViral":118677,"negativeTestsViral":1449613,"positiveCasesViral":111516,"deathConfirmed":null,"deathProbable":null,"totalTestEncountersViral":null,"totalTestsPeopleViral":1202624,"totalTestsAntibody":null,"positiveTestsAntibody":null,"negativeTestsAntibody":null,"totalTestsPeopleAntibody":72342,"positiveTestsPeopleAntibody":3287,"negativeTestsPeopleAntibody":69055,"totalTestsPeopleAntigen":null,"positiveTestsPeopleAntigen":null,"totalTestsAntigen":null,"positiveTestsAntigen":null,"fips":"29","positiveIncrease":1387,"negativeIncrease":10857,"total":1202624,"totalTestResultsIncrease":16377,"posNeg":1202624,"deathIncrease":13,"hospitalizedIncrease":0,"hash":"d65e54def412cfeed7ae9a0cff410997a1014fa9","commercialScore":0,"negativeRegularScore":0,"negativeScore":0,"positiveScore":0,"score":0,"grade":""},{"date":20200918,"state":"MO","positive":110129,"probableCases":null,"negative":1080251,"pending":null,"totalTestResultsSource":"totalTestsViral","totalTestResults":1554625,"hospitalizedCurrently":1025,"hospitalizedCumulative":null,"inIcuCurrently":null,"inIcuCumulative":null,"onVentilatorCurrently":null,"onVentilatorCumulative":null,"recovered":null,"dataQualityGrade":"B","lastUpdateEt":"9/18/2020 00:00","dateModified":"2020-09-18T24:00:00Z","checkTimeEt":"09/17 20:00","death":1780,"hospitalized":null,"dateChecked":"2020-09-18T24:00:00Z","totalTestsViral":1554625,"positiveTestsViral":117326,"negativeTestsViral":1434610,"positiveCasesViral":110129,"deathConfirmed":null,"deathProbable":null,"totalTestEncountersViral":null,"totalTestsPeopleViral":1190380,"totalTestsAntibody":null,"positiveTestsAntibody":null,"negativeTestsAntibody":null,"totalTestsPeopleAntibody":72085,"positiveTestsPeopleAntibody":3266,"negativeTestsPeopleAntibody":68819,"totalTestsPeopleAntigen":null,"positiveTestsPeopleAntigen":null,"totalTestsAntigen":null,"positiveTestsAntigen":null,"fips":"29","positiveIncrease":1795,"negativeIncrease":10004,"total":1190380,"totalTestResultsIncrease":16393,"posNeg":1190380,"deathIncrease":23,"hospitalizedIncrease":0,"hash":"03672e851d2336824e9a05dd2275127384d713a9","commercialScore":0,"negativeRegularScore":0,"negativeScore":0,"positiveScore":0,"score":0,"grade":""},{"date":20200917,"state":"MO","positive":108334,"probableCases":null,"negative":1070247,"pending":null,"totalTestResultsSource":"totalTestsViral","totalTestResults":1538232,"hospitalizedCurrently":962,"hospitalizedCumulative":null,"inIcuCurrently":null,"inIcuCumulative":null,"onVentilatorCurrently":null,"onVentilatorCumulative":null,"recovered":null,"dataQualityGrade":"B","lastUpdateEt":"9/17/2020 00:00","dateModified":"2020-09-17T24:00:00Z","checkTimeEt":"09/16 20:00","death":1757,"hospitalized":null,"dateChecked":"2020-09-17T24:00:00Z","totalTestsViral":1538232,"positiveTestsViral":115983,"negativeTestsViral":1419584,"positiveCasesViral":108334,"deathConfirmed":null,"deathProbable":null,"totalTestEncountersViral":null,"totalTestsPeopleViral":1178581,"totalTestsAntibody":null,"positiveTestsAntibody":null,"negativeTestsAntibody":null,"totalTestsPeopleAntibody":71852,"positiveTestsPeopleAntibody":3250,"negativeTestsPeopleAntibody":68602,"totalTestsPeopleAntigen":null,"positiveTestsPeopleAntigen":null,"totalTestsAntigen":null,"positiveTestsAntigen":null,"fips":"29","positiveIncrease":1747,"negativeIncrease":12451,"total":1178581,"totalTestResultsIncrease":18798,"posNeg":1178581,"deathIncrease":18,"hospitalizedIncrease":0,"hash":"27a0435ac8d4eac5c7ac23897b56d20d9d346976","commercialScore":0,"negativeRegularScore":0,"negativeScore":0,"positiveScore":0,"score":0,"grade":""},{"date":20200916,"state":"MO","positive":106587,"probableCases":null,"negative":1057796,"pending":null,"totalTestResultsSource":"totalTestsViral","totalTestResults":1519434,"hospitalizedCurrently":989,"hospitalizedCumulative":null,"inIcuCurrently":null,"inIcuCumulative":null,"onVentilatorCurrently":null,"onVentilatorCumulative":null,"recovered":null,"dataQualityGrade":"B","lastUpdateEt":"9/16/2020 00:00","dateModified":"2020-09-16T24:00:00Z","checkTimeEt":"09/15 20:00","death":1739,"hospitalized":null,"dateChecked":"2020-09-16T24:00:00Z","totalTestsViral":1519434,"positiveTestsViral":114421,"negativeTestsViral":1402394,"positiveCasesViral":106587,"deathConfirmed":null,"deathProbable":null,"totalTestEncountersViral":null,"totalTestsPeopleViral":1164383,"totalTestsAntibody":null,"positiveTestsAntibody":null,"negativeTestsAntibody":null,"totalTestsPeopleAntibody":71668,"positiveTestsPeopleAntibody":3241,"negativeTestsPeopleAntibody":68427,"totalTestsPeopleAntigen":null,"positiveTestsPeopleAntigen":null,"totalTestsAntigen":null,"positiveTestsAntigen":null,"fips":"29","positiveIncrease":1191,"negativeIncrease":7440,"total":1164383,"totalTestResultsIncrease":9092,"posNeg":1164383,"deathIncrease":7,"hospitalizedIncrease":0,"hash":"daead6ba153a5006728d66fcb20b86ee798ac2cd","commercialScore":0,"negativeRegularScore":0,"negativeScore":0,"positiveScore":0,"score":0,"grade":""},{"date":20200915,"state":"MO","positive":105396,"probableCases":null,"negative":1050356,"pending":null,"totalTestResultsSource":"totalTestsViral","totalTestResults":1510342,"hospitalizedCurrently":1021,"hospitalizedCumulative":null,"inIcuCurrently":null,"inIcuCumulative":null,"onVentilatorCurrently":null,"onVentilatorCumulative":null,"recovered":null,"dataQualityGrade":"A","lastUpdateEt":"9/15/2020 00:00","dateModified":"2020-09-15T24:00:00Z","checkTimeEt":"09/14 20:00","death":1732,"hospitalized":null,"dateChecked":"2020-09-15T24:00:00Z","totalTestsViral":1510342,"positiveTestsViral":113579,"negativeTestsViral":1394117,"positiveCasesViral":105396,"deathConfirmed":null,"deathProbable":null,"totalTestEncountersViral":null,"totalTestsPeopleViral":1155752,"totalTestsAntibody":null,"positiveTestsAntibody":null,"negativeTestsAntibody":null,"totalTestsPeopleAntibody":71476,"positiveTestsPeopleAntibody":3220,"negativeTestsPeopleAntibody":68256,"totalTestsPeopleAntigen":null,"positiveTestsPeopleAntigen":null,"totalTestsAntigen":null,"positiveTestsAntigen":null,"fips":"29","positiveIncrease":1317,"negativeIncrease":9228,"total":1155752,"totalTestResultsIncrease":15029,"posNeg":1155752,"deathIncrease":18,"hospitalizedIncrease":0,"hash":"1bbd1a7a2def0ed50191c4f0d45774c056446a66","commercialScore":0,"negativeRegularScore":0,"negativeScore":0,"positiveScore":0,"score":0,"grade":""},{"date":20200914,"state":"MO","positive":104079,"probableCases":null,"negative":1041128,"pending":null,"totalTestResultsSource":"totalTestsViral","totalTestResults":1495313,"hospitalizedCurrently":1010,"hospitalizedCumulative":null,"inIcuCurrently":null,"inIcuCumulative":null,"onVentilatorCurrently":null,"onVentilatorCumulative":null,"recovered":null,"dataQualityGrade":"A","lastUpdateEt":"9/14/2020 00:00","dateModified":"2020-09-14T24:00:00Z","checkTimeEt":"09/13 20:00","death":1714,"hospitalized":null,"dateChecked":"2020-09-14T24:00:00Z","totalTestsViral":1495313,"positiveTestsViral":112317,"negativeTestsViral":1380372,"positiveCasesViral":104079,"deathConfirmed":null,"deathProbable":null,"totalTestEncountersViral":null,"totalTestsPeopleViral":1145207,"totalTestsAntibody":null,"positiveTestsAntibody":null,"negativeTestsAntibody":null,"totalTestsPeopleAntibody":71452,"positiveTestsPeopleAntibody":3221,"negativeTestsPeopleAntibody":68231,"totalTestsPeopleAntigen":null,"positiveTestsPeopleAntigen":null,"totalTestsAntigen":null,"positiveTestsAntigen":null,"fips":"29","positiveIncrease":1332,"negativeIncrease":15175,"total":1145207,"totalTestResultsIncrease":19730,"posNeg":1145207,"deathIncrease":9,"hospitalizedIncrease":0,"hash":"b8bd582997f3f9d119e9eafa6ef520a23a5bc8cb","commercialScore":0,"negativeRegularScore":0,"negativeScore":0,"positiveScore":0,"score":0,"grade":""},{"date":20200913,"state":"MO","positive":102747,"probableCases":null,"negative":1025953,"pending":null,"totalTestResultsSource":"totalTestsViral","totalTestResults":1475583,"hospitalizedCurrently":971,"hospitalizedCumulative":null,"inIcuCurrently":null,"inIcuCumulative":null,"onVentilatorCurrently":null,"onVentilatorCumulative":null,"recovered":null,"dataQualityGrade":"A","lastUpdateEt":"9/13/2020 00:00","dateModified":"2020-09-13T24:00:00Z","checkTimeEt":"09/12 20:00","death":1705,"hospitalized":null,"dateChecked":"2020-09-13T24:00:00Z","totalTestsViral":1475583,"positiveTestsViral":110962,"negativeTestsViral":1362014,"positiveCasesViral":102747,"deathConfirmed":null,"deathProbable":null,"totalTestEncountersViral":null,"totalTestsPeopleViral":1128700,"totalTestsAntibody":null,"positiveTestsAntibody":null,"negativeTestsAntibody":null,"totalTestsPeopleAntibody":71148,"positiveTestsPeopleAntibody":3196,"negativeTestsPeopleAntibody":67952,"totalTestsPeopleAntigen":null,"positiveTestsPeopleAntigen":null,"totalTestsAntigen":null,"positiveTestsAntigen":null,"fips":"29","positiveIncrease":1613,"negativeIncrease":13714,"total":1128700,"totalTestResultsIncrease":18739,"posNeg":1128700,"deathIncrease":1,"hospitalizedIncrease":0,"hash":"8b3e14bffda3a2ea97ab4600495bbb64aed04116","commercialScore":0,"negativeRegularScore":0,"negativeScore":0,"positiveScore":0,"score":0,"grade":""},{"date":20200912,"state":"MO","positive":101134,"probableCases":null,"negative":1012239,"pending":null,"totalTestResultsSource":"totalTestsViral","totalTestResults":1456844,"hospitalizedCurrently":1040,"hospitalizedCumulative":null,"inIcuCurrently":null,"inIcuCumulative":null,"onVentilatorCurrently":null,"onVentilatorCumulative":null,"recovered":null,"dataQualityGrade":"A","lastUpdateEt":"9/12/2020 00:00","dateModified":"2020-09-12T24:00:00Z","checkTimeEt":"09/11 20:00","death":1704,"hospitalized":null,"dateChecked":"2020-09-12T24:00:00Z","totalTestsViral":1456844,"positiveTestsViral":109562,"negativeTestsViral":1344724,"positiveCasesViral":101134,"deathConfirmed":null,"deathProbable":null,"totalTestEncountersViral":null,"totalTestsPeopleViral":1113373,"totalTestsAntibody":null,"positiveTestsAntibody":null,"negativeTestsAntibody":null,"totalTestsPeopleAntibody":70997,"positiveTestsPeopleAntibody":3188,"negativeTestsPeopleAntibody":67809,"totalTestsPeopleAntigen":null,"positiveTestsPeopleAntigen":null,"totalTestsAntigen":null,"positiveTestsAntigen":null,"fips":"29","positiveIncrease":1974,"negativeIncrease":14827,"total":1113373,"totalTestResultsIncrease":19114,"posNeg":1113373,"deathIncrease":3,"hospitalizedIncrease":0,"hash":"51468dc41d8a8b8b4fd52344ff4107416aa0d78a","commercialScore":0,"negativeRegularScore":0,"negativeScore":0,"positiveScore":0,"score":0,"grade":""},{"date":20200911,"state":"MO","positive":99160,"probableCases":null,"negative":997412,"pending":null,"totalTestResultsSource":"totalTestsViral","totalTestResults":1437730,"hospitalizedCurrently":934,"hospitalizedCumulative":null,"inIcuCurrently":null,"inIcuCumulative":null,"onVentilatorCurrently":113,"onVentilatorCumulative":null,"recovered":null,"dataQualityGrade":"A","lastUpdateEt":"9/11/2020 00:00","dateModified":"2020-09-11T24:00:00Z","checkTimeEt":"09/10 20:00","death":1701,"hospitalized":null,"dateChecked":"2020-09-11T24:00:00Z","totalTestsViral":1437730,"positiveTestsViral":107727,"negativeTestsViral":1327482,"positiveCasesViral":99160,"deathConfirmed":null,"deathProbable":null,"totalTestEncountersViral":null,"totalTestsPeopleViral":1096572,"totalTestsAntibody":null,"positiveTestsAntibody":null,"negativeTestsAntibody":null,"totalTestsPeopleAntibody":70812,"positiveTestsPeopleAntibody":3157,"negativeTestsPeopleAntibody":67655,"totalTestsPeopleAntigen":null,"positiveTestsPeopleAntigen":null,"totalTestsAntigen":null,"positiveTestsAntigen":null,"fips":"29","positiveIncrease":1569,"negativeIncrease":11079,"total":1096572,"totalTestResultsIncrease":18275,"posNeg":1096572,"deathIncrease":10,"hospitalizedIncrease":0,"hash":"b8c787ba4150f79029888259430d6f63daae8aa2","commercialScore":0,"negativeRegularScore":0,"negativeScore":0,"positiveScore":0,"score":0,"grade":""},{"date":20200910,"state":"MO","positive":97591,"probableCases":null,"negative":986333,"pending":null,"totalTestResultsSource":"totalTestsViral","totalTestResults":1419455,"hospitalizedCurrently":934,"hospitalizedCumulative":null,"inIcuCurrently":null,"inIcuCumulative":null,"onVentilatorCurrently":113,"onVentilatorCumulative":null,"recovered":null,"dataQualityGrade":"A","lastUpdateEt":"9/10/2020 00:00","dateModified":"2020-09-10T24:00:00Z","checkTimeEt":"09/09 20:00","death":1691,"hospitalized":null,"dateChecked":"2020-09-10T24:00:00Z","totalTestsViral":1419455,"positiveTestsViral":106440,"negativeTestsViral":1310509,"positiveCasesViral":97591,"deathConfirmed":null,"deathProbable":null,"totalTestEncountersViral":null,"totalTestsPeopleViral":1083924,"totalTestsAntibody":null,"positiveTestsAntibody":null,"negativeTestsAntibody":null,"totalTestsPeopleAntibody":70634,"positiveTestsPeopleAntibody":3136,"negativeTestsPeopleAntibody":67498,"totalTestsPeopleAntigen":null,"positiveTestsPeopleAntigen":null,"totalTestsAntigen":null,"positiveTestsAntigen":null,"fips":"29","positiveIncrease":1116,"negativeIncrease":11899,"total":1083924,"totalTestResultsIncrease":19498,"posNeg":1083924,"deathIncrease":18,"hospitalizedIncrease":0,"hash":"60228fa89c98f0738f395d2a3194e7f361ef5fd0","commercialScore":0,"negativeRegularScore":0,"negativeScore":0,"positiveScore":0,"score":0,"grade":""},{"date":20200909,"state":"MO","positive":96475,"probableCases":null,"negative":974434,"pending":null,"totalTestResultsSource":"totalTestsViral","totalTestResults":1399957,"hospitalizedCurrently":934,"hospitalizedCumulative":null,"inIcuCurrently":null,"inIcuCumulative":null,"onVentilatorCurrently":113,"onVentilatorCumulative":null,"recovered":null,"dataQualityGrade":"A","lastUpdateEt":"9/9/2020 00:00","dateModified":"2020-09-09T24:00:00Z","checkTimeEt":"09/08 20:00","death":1673,"hospitalized":null,"dateChecked":"2020-09-09T24:00:00Z","totalTestsViral":1399957,"positiveTestsViral":105700,"negativeTestsViral":1291761,"positiveCasesViral":96475,"deathConfirmed":null,"deathProbable":null,"totalTestEncountersViral":null,"totalTestsPeopleViral":1070909,"totalTestsAntibody":null,"positiveTestsAntibody":null,"negativeTestsAntibody":null,"totalTestsPeopleAntibody":70267,"positiveTestsPeopleAntibody":3112,"negativeTestsPeopleAntibody":67155,"totalTestsPeopleAntigen":null,"positiveTestsPeopleAntigen":null,"totalTestsAntigen":null,"positiveTestsAntigen":null,"fips":"29","positiveIncrease":1362,"negativeIncrease":8317,"total":1070909,"totalTestResultsIncrease":12678,"posNeg":1070909,"deathIncrease":12,"hospitalizedIncrease":0,"hash":"9b6cf031eced4455200dfa0122767fb591ab36ee","commercialScore":0,"negativeRegularScore":0,"negativeScore":0,"positiveScore":0,"score":0,"grade":""},{"date":20200908,"state":"MO","positive":95113,"probableCases":null,"negative":966117,"pending":null,"totalTestResultsSource":"totalTestsViral","totalTestResults":1387279,"hospitalizedCurrently":934,"hospitalizedCumulative":null,"inIcuCurrently":null,"inIcuCumulative":null,"onVentilatorCurrently":113,"onVentilatorCumulative":null,"recovered":null,"dataQualityGrade":"A","lastUpdateEt":"9/8/2020 00:00","dateModified":"2020-09-08T24:00:00Z","checkTimeEt":"09/07 20:00","death":1661,"hospitalized":null,"dateChecked":"2020-09-08T24:00:00Z","totalTestsViral":1387279,"positiveTestsViral":104695,"negativeTestsViral":1280117,"positiveCasesViral":95113,"deathConfirmed":null,"deathProbable":null,"totalTestEncountersViral":null,"totalTestsPeopleViral":1061230,"totalTestsAntibody":null,"positiveTestsAntibody":null,"negativeTestsAntibody":null,"totalTestsPeopleAntibody":70177,"positiveTestsPeopleAntibody":3102,"negativeTestsPeopleAntibody":67075,"totalTestsPeopleAntigen":null,"positiveTestsPeopleAntigen":null,"totalTestsAntigen":null,"positiveTestsAntigen":null,"fips":"29","positiveIncrease":773,"negativeIncrease":6072,"total":1061230,"totalTestResultsIncrease":8636,"posNeg":1061230,"deathIncrease":2,"hospitalizedIncrease":0,"hash":"aad3bc9bb9dcf6733dafb9c6a79ac7921b642923","commercialScore":0,"negativeRegularScore":0,"negativeScore":0,"positiveScore":0,"score":0,"grade":""},{"date":20200907,"state":"MO","positive":94340,"probableCases":null,"negative":960045,"pending":null,"totalTestResultsSource":"totalTestsViral","totalTestResults":1378643,"hospitalizedCurrently":934,"hospitalizedCumulative":null,"inIcuCurrently":null,"inIcuCumulative":null,"onVentilatorCurrently":113,"onVentilatorCumulative":null,"recovered":null,"dataQualityGrade":"A","lastUpdateEt":"9/7/2020 00:00","dateModified":"2020-09-07T24:00:00Z","checkTimeEt":"09/06 20:00","death":1659,"hospitalized":null,"dateChecked":"2020-09-07T24:00:00Z","totalTestsViral":1378643,"positiveTestsViral":103847,"negativeTestsViral":1272326,"positiveCasesViral":94340,"deathConfirmed":null,"deathProbable":null,"totalTestEncountersViral":null,"totalTestsPeopleViral":1054385,"totalTestsAntibody":null,"positiveTestsAntibody":null,"negativeTestsAntibody":null,"totalTestsPeopleAntibody":70158,"positiveTestsPeopleAntibody":3087,"negativeTestsPeopleAntibody":67071,"totalTestsPeopleAntigen":null,"positiveTestsPeopleAntigen":null,"totalTestsAntigen":null,"positiveTestsAntigen":null,"fips":"29","positiveIncrease":906,"negativeIncrease":7636,"total":1054385,"totalTestResultsIncrease":10058,"posNeg":1054385,"deathIncrease":1,"hospitalizedIncrease":0,"hash":"b5bdde9485eee9775180a031d6096b1a0a827f0c","commercialScore":0,"negativeRegularScore":0,"negativeScore":0,"positiveScore":0,"score":0,"grade":""},{"date":20200906,"state":"MO","positive":93434,"probableCases":null,"negative":952409,"pending":null,"totalTestResultsSource":"totalTestsViral","totalTestResults":1368585,"hospitalizedCurrently":934,"hospitalizedCumulative":null,"inIcuCurrently":null,"inIcuCumulative":null,"onVentilatorCurrently":113,"onVentilatorCumulative":null,"recovered":null,"dataQualityGrade":"A","lastUpdateEt":"9/6/2020 00:00","dateModified":"2020-09-06T24:00:00Z","checkTimeEt":"09/05 20:00","death":1658,"hospitalized":null,"dateChecked":"2020-09-06T24:00:00Z","totalTestsViral":1368585,"positiveTestsViral":102766,"negativeTestsViral":1263356,"positiveCasesViral":93434,"deathConfirmed":null,"deathProbable":null,"totalTestEncountersViral":null,"totalTestsPeopleViral":1045843,"totalTestsAntibody":null,"positiveTestsAntibody":null,"negativeTestsAntibody":null,"totalTestsPeopleAntibody":70006,"positiveTestsPeopleAntibody":3085,"negativeTestsPeopleAntibody":66921,"totalTestsPeopleAntigen":null,"positiveTestsPeopleAntigen":null,"totalTestsAntigen":null,"positiveTestsAntigen":null,"fips":"29","positiveIncrease":1232,"negativeIncrease":6310,"total":1045843,"totalTestResultsIncrease":8123,"posNeg":1045843,"deathIncrease":19,"hospitalizedIncrease":0,"hash":"cc812859136fef4e678f35d0907cb71f6872e00c","commercialScore":0,"negativeRegularScore":0,"negativeScore":0,"positiveScore":0,"score":0,"grade":""},{"date":20200905,"state":"MO","positive":92202,"probableCases":null,"negative":946099,"pending":null,"totalTestResultsSource":"totalTestsViral","totalTestResults":1360462,"hospitalizedCurrently":934,"hospitalizedCumulative":null,"inIcuCurrently":null,"inIcuCumulative":null,"onVentilatorCurrently":113,"onVentilatorCumulative":null,"recovered":null,"dataQualityGrade":"A","lastUpdateEt":"9/5/2020 00:00","dateModified":"2020-09-05T24:00:00Z","checkTimeEt":"09/04 20:00","death":1639,"hospitalized":null,"dateChecked":"2020-09-05T24:00:00Z","totalTestsViral":1360462,"positiveTestsViral":101521,"negativeTestsViral":1256574,"positiveCasesViral":92202,"deathConfirmed":null,"deathProbable":null,"totalTestEncountersViral":null,"totalTestsPeopleViral":1038301,"totalTestsAntibody":null,"positiveTestsAntibody":null,"negativeTestsAntibody":null,"totalTestsPeopleAntibody":69847,"positiveTestsPeopleAntibody":3040,"negativeTestsPeopleAntibody":66807,"totalTestsPeopleAntigen":null,"positiveTestsPeopleAntigen":null,"totalTestsAntigen":null,"positiveTestsAntigen":null,"fips":"29","positiveIncrease":1987,"negativeIncrease":14584,"total":1038301,"totalTestResultsIncrease":20791,"posNeg":1038301,"deathIncrease":77,"hospitalizedIncrease":0,"hash":"c930310847f4d038b54eae2ea661f5db3029cbc4","commercialScore":0,"negativeRegularScore":0,"negativeScore":0,"positiveScore":0,"score":0,"grade":""},{"date":20200904,"state":"MO","positive":90215,"probableCases":null,"negative":931515,"pending":null,"totalTestResultsSource":"totalTestsViral","totalTestResults":1339671,"hospitalizedCurrently":934,"hospitalizedCumulative":null,"inIcuCurrently":null,"inIcuCumulative":null,"onVentilatorCurrently":113,"onVentilatorCumulative":null,"recovered":null,"dataQualityGrade":"A","lastUpdateEt":"9/4/2020 00:00","dateModified":"2020-09-04T24:00:00Z","checkTimeEt":"09/03 20:00","death":1562,"hospitalized":null,"dateChecked":"2020-09-04T24:00:00Z","totalTestsViral":1339671,"positiveTestsViral":99995,"negativeTestsViral":1237342,"positiveCasesViral":90215,"deathConfirmed":null,"deathProbable":null,"totalTestEncountersViral":null,"totalTestsPeopleViral":1021730,"totalTestsAntibody":null,"positiveTestsAntibody":null,"negativeTestsAntibody":null,"totalTestsPeopleAntibody":69634,"positiveTestsPeopleAntibody":3017,"negativeTestsPeopleAntibody":66617,"totalTestsPeopleAntigen":null,"positiveTestsPeopleAntigen":null,"totalTestsAntigen":null,"positiveTestsAntigen":null,"fips":"29","positiveIncrease":1605,"negativeIncrease":12047,"total":1021730,"totalTestResultsIncrease":16422,"posNeg":1021730,"deathIncrease":17,"hospitalizedIncrease":0,"hash":"46a8c574ad5401acd1a57e06168512c1681aad61","commercialScore":0,"negativeRegularScore":0,"negativeScore":0,"positiveScore":0,"score":0,"grade":""},{"date":20200903,"state":"MO","positive":88610,"probableCases":null,"negative":919468,"pending":null,"totalTestResultsSource":"totalTestsViral","totalTestResults":1323249,"hospitalizedCurrently":934,"hospitalizedCumulative":null,"inIcuCurrently":null,"inIcuCumulative":null,"onVentilatorCurrently":113,"onVentilatorCumulative":null,"recovered":null,"dataQualityGrade":"A","lastUpdateEt":"9/3/2020 00:00","dateModified":"2020-09-03T24:00:00Z","checkTimeEt":"09/02 20:00","death":1545,"hospitalized":null,"dateChecked":"2020-09-03T24:00:00Z","totalTestsViral":1323249,"positiveTestsViral":98525,"negativeTestsViral":1222406,"positiveCasesViral":88610,"deathConfirmed":null,"deathProbable":null,"totalTestEncountersViral":null,"totalTestsPeopleViral":1008078,"totalTestsAntibody":null,"positiveTestsAntibody":null,"negativeTestsAntibody":null,"totalTestsPeopleAntibody":69430,"positiveTestsPeopleAntibody":2982,"negativeTestsPeopleAntibody":66448,"totalTestsPeopleAntigen":null,"positiveTestsPeopleAntigen":null,"totalTestsAntigen":null,"positiveTestsAntigen":null,"fips":"29","positiveIncrease":1397,"negativeIncrease":8584,"total":1008078,"totalTestResultsIncrease":12226,"posNeg":1008078,"deathIncrease":3,"hospitalizedIncrease":0,"hash":"1ec8f764665ac8cfc487a149c54f032ad150e99a","commercialScore":0,"negativeRegularScore":0,"negativeScore":0,"positiveScore":0,"score":0,"grade":""},{"date":20200902,"state":"MO","positive":87213,"probableCases":null,"negative":910884,"pending":null,"totalTestResultsSource":"totalTestsViral","totalTestResults":1311023,"hospitalizedCurrently":934,"hospitalizedCumulative":null,"inIcuCurrently":null,"inIcuCumulative":null,"onVentilatorCurrently":113,"onVentilatorCumulative":null,"recovered":null,"dataQualityGrade":"A","lastUpdateEt":"9/2/2020 00:00","dateModified":"2020-09-02T24:00:00Z","checkTimeEt":"09/01 20:00","death":1542,"hospitalized":null,"dateChecked":"2020-09-02T24:00:00Z","totalTestsViral":1311023,"positiveTestsViral":96924,"negativeTestsViral":1211811,"positiveCasesViral":87213,"deathConfirmed":null,"deathProbable":null,"totalTestEncountersViral":null,"totalTestsPeopleViral":998097,"totalTestsAntibody":null,"positiveTestsAntibody":null,"negativeTestsAntibody":null,"totalTestsPeopleAntibody":69257,"positiveTestsPeopleAntibody":2952,"negativeTestsPeopleAntibody":66305,"totalTestsPeopleAntigen":null,"positiveTestsPeopleAntigen":null,"totalTestsAntigen":null,"positiveTestsAntigen":null,"fips":"29","positiveIncrease":1458,"negativeIncrease":5395,"total":998097,"totalTestResultsIncrease":5992,"posNeg":998097,"deathIncrease":4,"hospitalizedIncrease":0,"hash":"0ab8884ea7ae8e4c0e264515ef0dba3e58a847d4","commercialScore":0,"negativeRegularScore":0,"negativeScore":0,"positiveScore":0,"score":0,"grade":""},{"date":20200901,"state":"MO","positive":85755,"probableCases":null,"negative":905489,"pending":null,"totalTestResultsSource":"totalTestsViral","totalTestResults":1305031,"hospitalizedCurrently":906,"hospitalizedCumulative":null,"inIcuCurrently":null,"inIcuCumulative":null,"onVentilatorCurrently":110,"onVentilatorCumulative":null,"recovered":null,"dataQualityGrade":"A","lastUpdateEt":"9/1/2020 00:00","dateModified":"2020-09-01T24:00:00Z","checkTimeEt":"08/31 20:00","death":1538,"hospitalized":null,"dateChecked":"2020-09-01T24:00:00Z","totalTestsViral":1305031,"positiveTestsViral":96068,"negativeTestsViral":1206684,"positiveCasesViral":85755,"deathConfirmed":null,"deathProbable":null,"totalTestEncountersViral":null,"totalTestsPeopleViral":991244,"totalTestsAntibody":null,"positiveTestsAntibody":null,"negativeTestsAntibody":null,"totalTestsPeopleAntibody":69005,"positiveTestsPeopleAntibody":2908,"negativeTestsPeopleAntibody":66097,"totalTestsPeopleAntigen":null,"positiveTestsPeopleAntigen":null,"totalTestsAntigen":null,"positiveTestsAntigen":null,"fips":"29","positiveIncrease":1058,"negativeIncrease":7231,"total":991244,"totalTestResultsIncrease":10904,"posNeg":991244,"deathIncrease":8,"hospitalizedIncrease":0,"hash":"15b44fbf08ef7f429175696c804ba577a50d8f98","commercialScore":0,"negativeRegularScore":0,"negativeScore":0,"positiveScore":0,"score":0,"grade":""},{"date":20200831,"state":"MO","positive":84697,"probableCases":null,"negative":898258,"pending":null,"totalTestResultsSource":"totalTestsViral","totalTestResults":1294127,"hospitalizedCurrently":906,"hospitalizedCumulative":null,"inIcuCurrently":null,"inIcuCumulative":null,"onVentilatorCurrently":110,"onVentilatorCumulative":null,"recovered":null,"dataQualityGrade":"A","lastUpdateEt":"8/31/2020 00:00","dateModified":"2020-08-31T24:00:00Z","checkTimeEt":"08/30 20:00","death":1530,"hospitalized":null,"dateChecked":"2020-08-31T24:00:00Z","totalTestsViral":1294127,"positiveTestsViral":95127,"negativeTestsViral":1196755,"positiveCasesViral":84697,"deathConfirmed":null,"deathProbable":null,"totalTestEncountersViral":null,"totalTestsPeopleViral":982955,"totalTestsAntibody":null,"positiveTestsAntibody":null,"negativeTestsAntibody":null,"totalTestsPeopleAntibody":68924,"positiveTestsPeopleAntibody":2899,"negativeTestsPeopleAntibody":66025,"totalTestsPeopleAntigen":null,"positiveTestsPeopleAntigen":null,"totalTestsAntigen":null,"positiveTestsAntigen":null,"fips":"29","positiveIncrease":1042,"negativeIncrease":7676,"total":982955,"totalTestResultsIncrease":11071,"posNeg":982955,"deathIncrease":22,"hospitalizedIncrease":0,"hash":"b617214a80923d956b600d8769edaa940534960e","commercialScore":0,"negativeRegularScore":0,"negativeScore":0,"positiveScore":0,"score":0,"grade":""},{"date":20200830,"state":"MO","positive":83655,"probableCases":null,"negative":890582,"pending":null,"totalTestResultsSource":"totalTestsViral","totalTestResults":1283056,"hospitalizedCurrently":1004,"hospitalizedCumulative":null,"inIcuCurrently":null,"inIcuCumulative":null,"onVentilatorCurrently":111,"onVentilatorCumulative":null,"recovered":null,"dataQualityGrade":"A","lastUpdateEt":"8/30/2020 00:00","dateModified":"2020-08-30T24:00:00Z","checkTimeEt":"08/29 20:00","death":1508,"hospitalized":null,"dateChecked":"2020-08-30T24:00:00Z","totalTestsViral":1283056,"positiveTestsViral":93879,"negativeTestsViral":1186910,"positiveCasesViral":83655,"deathConfirmed":null,"deathProbable":null,"totalTestEncountersViral":null,"totalTestsPeopleViral":974237,"totalTestsAntibody":null,"positiveTestsAntibody":null,"negativeTestsAntibody":null,"totalTestsPeopleAntibody":68819,"positiveTestsPeopleAntibody":2884,"negativeTestsPeopleAntibody":65935,"totalTestsPeopleAntigen":null,"positiveTestsPeopleAntigen":null,"totalTestsAntigen":null,"positiveTestsAntigen":null,"fips":"29","positiveIncrease":1465,"negativeIncrease":7446,"total":974237,"totalTestResultsIncrease":11197,"posNeg":974237,"deathIncrease":12,"hospitalizedIncrease":0,"hash":"4b7fe8bfa9412de1a2358544d1d7def941e02edb","commercialScore":0,"negativeRegularScore":0,"negativeScore":0,"positiveScore":0,"score":0,"grade":""},{"date":20200829,"state":"MO","positive":82190,"probableCases":null,"negative":883136,"pending":null,"totalTestResultsSource":"totalTestsViral","totalTestResults":1271859,"hospitalizedCurrently":976,"hospitalizedCumulative":null,"inIcuCurrently":null,"inIcuCumulative":null,"onVentilatorCurrently":113,"onVentilatorCumulative":null,"recovered":null,"dataQualityGrade":"A","lastUpdateEt":"8/29/2020 00:00","dateModified":"2020-08-29T24:00:00Z","checkTimeEt":"08/28 20:00","death":1496,"hospitalized":null,"dateChecked":"2020-08-29T24:00:00Z","totalTestsViral":1271859,"positiveTestsViral":92544,"negativeTestsViral":1177080,"positiveCasesViral":82190,"deathConfirmed":null,"deathProbable":null,"totalTestEncountersViral":null,"totalTestsPeopleViral":965326,"totalTestsAntibody":null,"positiveTestsAntibody":null,"negativeTestsAntibody":null,"totalTestsPeopleAntibody":68525,"positiveTestsPeopleAntibody":2851,"negativeTestsPeopleAntibody":65674,"totalTestsPeopleAntigen":null,"positiveTestsPeopleAntigen":null,"totalTestsAntigen":null,"positiveTestsAntigen":null,"fips":"29","positiveIncrease":1198,"negativeIncrease":9495,"total":965326,"totalTestResultsIncrease":13274,"posNeg":965326,"deathIncrease":32,"hospitalizedIncrease":0,"hash":"35e8bb17adfbeb7adb56ab26efcd2c31902a7e3e","commercialScore":0,"negativeRegularScore":0,"negativeScore":0,"positiveScore":0,"score":0,"grade":""},{"date":20200828,"state":"MO","positive":80992,"probableCases":null,"negative":873641,"pending":null,"totalTestResultsSource":"totalTestsViral","totalTestResults":1258585,"hospitalizedCurrently":1007,"hospitalizedCumulative":null,"inIcuCurrently":null,"inIcuCumulative":null,"onVentilatorCurrently":118,"onVentilatorCumulative":null,"recovered":null,"dataQualityGrade":"A","lastUpdateEt":"8/28/2020 00:00","dateModified":"2020-08-28T24:00:00Z","checkTimeEt":"08/27 20:00","death":1464,"hospitalized":null,"dateChecked":"2020-08-28T24:00:00Z","totalTestsViral":1258585,"positiveTestsViral":91202,"negativeTestsViral":1165164,"positiveCasesViral":80992,"deathConfirmed":null,"deathProbable":null,"totalTestEncountersViral":null,"totalTestsPeopleViral":954633,"totalTestsAntibody":null,"positiveTestsAntibody":null,"negativeTestsAntibody":null,"totalTestsPeopleAntibody":68113,"positiveTestsPeopleAntibody":2829,"negativeTestsPeopleAntibody":65284,"totalTestsPeopleAntigen":null,"positiveTestsPeopleAntigen":null,"totalTestsAntigen":null,"positiveTestsAntigen":null,"fips":"29","positiveIncrease":1418,"negativeIncrease":10192,"total":954633,"totalTestResultsIncrease":15535,"posNeg":954633,"deathIncrease":14,"hospitalizedIncrease":0,"hash":"905186d61823918de1ad14412b9438332f8599db","commercialScore":0,"negativeRegularScore":0,"negativeScore":0,"positiveScore":0,"score":0,"grade":""},{"date":20200827,"state":"MO","positive":79574,"probableCases":null,"negative":863449,"pending":null,"totalTestResultsSource":"totalTestsViral","totalTestResults":1243050,"hospitalizedCurrently":902,"hospitalizedCumulative":null,"inIcuCurrently":null,"inIcuCumulative":null,"onVentilatorCurrently":110,"onVentilatorCumulative":null,"recovered":null,"dataQualityGrade":"A","lastUpdateEt":"8/27/2020 00:00","dateModified":"2020-08-27T24:00:00Z","checkTimeEt":"08/26 20:00","death":1450,"hospitalized":null,"dateChecked":"2020-08-27T24:00:00Z","totalTestsViral":1243050,"positiveTestsViral":89878,"negativeTestsViral":1150970,"positiveCasesViral":79574,"deathConfirmed":null,"deathProbable":null,"totalTestEncountersViral":null,"totalTestsPeopleViral":943023,"totalTestsAntibody":null,"positiveTestsAntibody":null,"negativeTestsAntibody":null,"totalTestsPeopleAntibody":67581,"positiveTestsPeopleAntibody":2778,"negativeTestsPeopleAntibody":64803,"totalTestsPeopleAntigen":null,"positiveTestsPeopleAntigen":null,"totalTestsAntigen":null,"positiveTestsAntigen":null,"fips":"29","positiveIncrease":1512,"negativeIncrease":9371,"total":943023,"totalTestResultsIncrease":13011,"posNeg":943023,"deathIncrease":1,"hospitalizedIncrease":0,"hash":"d454c91f70dda13146c08701c94debb2a398d85b","commercialScore":0,"negativeRegularScore":0,"negativeScore":0,"positiveScore":0,"score":0,"grade":""},{"date":20200826,"state":"MO","positive":78062,"probableCases":null,"negative":854078,"pending":null,"totalTestResultsSource":"totalTestsViral","totalTestResults":1230039,"hospitalizedCurrently":882,"hospitalizedCumulative":null,"inIcuCurrently":null,"inIcuCumulative":null,"onVentilatorCurrently":116,"onVentilatorCumulative":null,"recovered":null,"dataQualityGrade":"A","lastUpdateEt":"8/26/2020 00:00","dateModified":"2020-08-26T24:00:00Z","checkTimeEt":"08/25 20:00","death":1449,"hospitalized":null,"dateChecked":"2020-08-26T24:00:00Z","totalTestsViral":1230039,"positiveTestsViral":88500,"negativeTestsViral":1139402,"positiveCasesViral":78062,"deathConfirmed":null,"deathProbable":null,"totalTestEncountersViral":null,"totalTestsPeopleViral":932140,"totalTestsAntibody":null,"positiveTestsAntibody":null,"negativeTestsAntibody":null,"totalTestsPeopleAntibody":67139,"positiveTestsPeopleAntibody":2737,"negativeTestsPeopleAntibody":64402,"totalTestsPeopleAntigen":null,"positiveTestsPeopleAntigen":null,"totalTestsAntigen":null,"positiveTestsAntigen":null,"fips":"29","positiveIncrease":1426,"negativeIncrease":6636,"total":932140,"totalTestResultsIncrease":6568,"posNeg":932140,"deathIncrease":9,"hospitalizedIncrease":0,"hash":"925e5b65de10170eeaf57754d2f7dd63686f7521","commercialScore":0,"negativeRegularScore":0,"negativeScore":0,"positiveScore":0,"score":0,"grade":""},{"date":20200825,"state":"MO","positive":76636,"probableCases":null,"negative":847442,"pending":null,"totalTestResultsSource":"totalTestsViral","totalTestResults":1223471,"hospitalizedCurrently":925,"hospitalizedCumulative":null,"inIcuCurrently":null,"inIcuCumulative":null,"onVentilatorCurrently":119,"onVentilatorCumulative":null,"recovered":null,"dataQualityGrade":"A","lastUpdateEt":"8/25/2020 00:00","dateModified":"2020-08-25T24:00:00Z","checkTimeEt":"08/24 20:00","death":1440,"hospitalized":null,"dateChecked":"2020-08-25T24:00:00Z","totalTestsViral":1223471,"positiveTestsViral":87041,"negativeTestsViral":1134314,"positiveCasesViral":76636,"deathConfirmed":null,"deathProbable":null,"totalTestEncountersViral":null,"totalTestsPeopleViral":924078,"totalTestsAntibody":null,"positiveTestsAntibody":null,"negativeTestsAntibody":null,"totalTestsPeopleAntibody":66891,"positiveTestsPeopleAntibody":2705,"negativeTestsPeopleAntibody":64186,"totalTestsPeopleAntigen":null,"positiveTestsPeopleAntigen":null,"totalTestsAntigen":null,"positiveTestsAntigen":null,"fips":"29","positiveIncrease":692,"negativeIncrease":3674,"total":924078,"totalTestResultsIncrease":9015,"posNeg":924078,"deathIncrease":14,"hospit