[{"date":20201012,"state":"SC","positive":158055,"probableCases":5813,"negative":1339762,"pending":null,"totalTestResultsSource":"posNeg","totalTestResults":1497817,"hospitalizedCurrently":684,"hospitalizedCumulative":9600,"inIcuCurrently":177,"inIcuCumulative":null,"onVentilatorCurrently":87,"onVentilatorCumulative":null,"recovered":78431,"dataQualityGrade":"A+","lastUpdateEt":"10/11/2020 23:59","dateModified":"2020-10-11T23:59:00Z","checkTimeEt":"10/11 19:59","death":3559,"hospitalized":9600,"dateChecked":"2020-10-11T23:59:00Z","totalTestsViral":1492004,"positiveTestsViral":198952,"negativeTestsViral":1293052,"positiveCasesViral":152242,"deathConfirmed":3355,"deathProbable":204,"totalTestEncountersViral":null,"totalTestsPeopleViral":null,"totalTestsAntibody":74809,"positiveTestsAntibody":7723,"negativeTestsAntibody":67086,"totalTestsPeopleAntibody":null,"positiveTestsPeopleAntibody":null,"negativeTestsPeopleAntibody":null,"totalTestsPeopleAntigen":null,"positiveTestsPeopleAntigen":null,"totalTestsAntigen":68648,"positiveTestsAntigen":12428,"fips":"45","positiveIncrease":649,"negativeIncrease":12510,"total":1497817,"totalTestResultsIncrease":13159,"posNeg":1497817,"deathIncrease":7,"hospitalizedIncrease":22,"hash":"ec9b50d224d699dc8060751097923732df0dca21","commercialScore":0,"negativeRegularScore":0,"negativeScore":0,"positiveScore":0,"score":0,"grade":""},{"date":20201011,"state":"SC","positive":157406,"probableCases":5757,"negative":1327252,"pending":null,"totalTestResultsSource":"posNeg","totalTestResults":1484658,"hospitalizedCurrently":685,"hospitalizedCumulative":9578,"inIcuCurrently":176,"inIcuCumulative":null,"onVentilatorCurrently":87,"onVentilatorCumulative":null,"recovered":78115,"dataQualityGrade":"A+","lastUpdateEt":"10/10/2020 23:59","dateModified":"2020-10-10T23:59:00Z","checkTimeEt":"10/10 19:59","death":3552,"hospitalized":9578,"dateChecked":"2020-10-10T23:59:00Z","totalTestsViral":1478901,"positiveTestsViral":198082,"negativeTestsViral":1280819,"positiveCasesViral":151649,"deathConfirmed":3348,"deathProbable":204,"totalTestEncountersViral":null,"totalTestsPeopleViral":null,"totalTestsAntibody":74645,"positiveTestsAntibody":7695,"negativeTestsAntibody":66950,"totalTestsPeopleAntibody":null,"positiveTestsPeopleAntibody":null,"negativeTestsPeopleAntibody":null,"totalTestsPeopleAntigen":null,"positiveTestsPeopleAntigen":null,"totalTestsAntigen":68153,"positiveTestsAntigen":12335,"fips":"45","positiveIncrease":785,"negativeIncrease":13562,"total":1484658,"totalTestResultsIncrease":14347,"posNeg":1484658,"deathIncrease":1,"hospitalizedIncrease":17,"hash":"f7955cb3abd41aa14f1211520383911db592f531","commercialScore":0,"negativeRegularScore":0,"negativeScore":0,"positiveScore":0,"score":0,"grade":""},{"date":20201010,"state":"SC","positive":156621,"probableCases":5706,"negative":1313690,"pending":null,"totalTestResultsSource":"posNeg","totalTestResults":1470311,"hospitalizedCurrently":728,"hospitalizedCumulative":9561,"inIcuCurrently":179,"inIcuCumulative":null,"onVentilatorCurrently":93,"onVentilatorCumulative":null,"recovered":77700,"dataQualityGrade":"A+","lastUpdateEt":"10/9/2020 23:59","dateModified":"2020-10-09T23:59:00Z","checkTimeEt":"10/09 19:59","death":3551,"hospitalized":9561,"dateChecked":"2020-10-09T23:59:00Z","totalTestsViral":1464605,"positiveTestsViral":197178,"negativeTestsViral":1267427,"positiveCasesViral":150915,"deathConfirmed":3346,"deathProbable":205,"totalTestEncountersViral":null,"totalTestsPeopleViral":null,"totalTestsAntibody":74342,"positiveTestsAntibody":7631,"negativeTestsAntibody":66711,"totalTestsPeopleAntibody":null,"positiveTestsPeopleAntibody":null,"negativeTestsPeopleAntibody":null,"totalTestsPeopleAntigen":null,"positiveTestsPeopleAntigen":null,"totalTestsAntigen":67607,"positiveTestsAntigen":12251,"fips":"45","positiveIncrease":945,"negativeIncrease":16798,"total":1470311,"totalTestResultsIncrease":17743,"posNeg":1470311,"deathIncrease":21,"hospitalizedIncrease":42,"hash":"83236e02f6a1d9bdc22db35d0418157e83515c35","commercialScore":0,"negativeRegularScore":0,"negativeScore":0,"positiveScore":0,"score":0,"grade":""},{"date":20201009,"state":"SC","positive":155676,"probableCases":5643,"negative":1296892,"pending":null,"totalTestResultsSource":"posNeg","totalTestResults":1452568,"hospitalizedCurrently":748,"hospitalizedCumulative":9519,"inIcuCurrently":193,"inIcuCumulative":null,"onVentilatorCurrently":99,"onVentilatorCumulative":null,"recovered":77102,"dataQualityGrade":"A+","lastUpdateEt":"10/8/2020 23:59","dateModified":"2020-10-08T23:59:00Z","checkTimeEt":"10/08 19:59","death":3530,"hospitalized":9519,"dateChecked":"2020-10-08T23:59:00Z","totalTestsViral":1446925,"positiveTestsViral":196026,"negativeTestsViral":1250899,"positiveCasesViral":150033,"deathConfirmed":3325,"deathProbable":205,"totalTestEncountersViral":null,"totalTestsPeopleViral":null,"totalTestsAntibody":73971,"positiveTestsAntibody":7573,"negativeTestsAntibody":66398,"totalTestsPeopleAntibody":null,"positiveTestsPeopleAntibody":null,"negativeTestsPeopleAntibody":null,"totalTestsPeopleAntigen":null,"positiveTestsPeopleAntigen":null,"totalTestsAntigen":65448,"positiveTestsAntigen":12054,"fips":"45","positiveIncrease":921,"negativeIncrease":21008,"total":1452568,"totalTestResultsIncrease":21929,"posNeg":1452568,"deathIncrease":16,"hospitalizedIncrease":44,"hash":"11c679728338d8eadeca7e25aa3a1494dd6ac249","commercialScore":0,"negativeRegularScore":0,"negativeScore":0,"positiveScore":0,"score":0,"grade":""},{"date":20201008,"state":"SC","positive":154755,"probableCases":5536,"negative":1275884,"pending":null,"totalTestResultsSource":"posNeg","totalTestResults":1430639,"hospitalizedCurrently":716,"hospitalizedCumulative":9475,"inIcuCurrently":191,"inIcuCumulative":null,"onVentilatorCurrently":94,"onVentilatorCumulative":null,"recovered":76477,"dataQualityGrade":"A+","lastUpdateEt":"10/7/2020 23:59","dateModified":"2020-10-07T23:59:00Z","checkTimeEt":"10/07 19:59","death":3514,"hospitalized":9475,"dateChecked":"2020-10-07T23:59:00Z","totalTestsViral":1425103,"positiveTestsViral":194725,"negativeTestsViral":1230378,"positiveCasesViral":149219,"deathConfirmed":3311,"deathProbable":203,"totalTestEncountersViral":null,"totalTestsPeopleViral":null,"totalTestsAntibody":73614,"positiveTestsAntibody":7498,"negativeTestsAntibody":66116,"totalTestsPeopleAntibody":null,"positiveTestsPeopleAntibody":null,"negativeTestsPeopleAntibody":null,"totalTestsPeopleAntigen":null,"positiveTestsPeopleAntigen":null,"totalTestsAntigen":63262,"positiveTestsAntigen":11862,"fips":"45","positiveIncrease":1050,"negativeIncrease":18993,"total":1430639,"totalTestResultsIncrease":20043,"posNeg":1430639,"deathIncrease":12,"hospitalizedIncrease":83,"hash":"11e04c9384c80e46c5def4dca3a224cc431a2efa","commercialScore":0,"negativeRegularScore":0,"negativeScore":0,"positiveScore":0,"score":0,"grade":""},{"date":20201007,"state":"SC","positive":153705,"probableCases":5371,"negative":1256891,"pending":null,"totalTestResultsSource":"posNeg","totalTestResults":1410596,"hospitalizedCurrently":707,"hospitalizedCumulative":9392,"inIcuCurrently":183,"inIcuCumulative":null,"onVentilatorCurrently":93,"onVentilatorCumulative":null,"recovered":75768,"dataQualityGrade":"A+","lastUpdateEt":"10/6/2020 23:59","dateModified":"2020-10-06T23:59:00Z","checkTimeEt":"10/06 19:59","death":3502,"hospitalized":9392,"dateChecked":"2020-10-06T23:59:00Z","totalTestsViral":1405225,"positiveTestsViral":193433,"negativeTestsViral":1211792,"positiveCasesViral":148334,"deathConfirmed":3300,"deathProbable":202,"totalTestEncountersViral":null,"totalTestsPeopleViral":null,"totalTestsAntibody":73100,"positiveTestsAntibody":7422,"negativeTestsAntibody":65678,"totalTestsPeopleAntibody":null,"positiveTestsPeopleAntibody":null,"negativeTestsPeopleAntibody":null,"totalTestsPeopleAntigen":null,"positiveTestsPeopleAntigen":null,"totalTestsAntigen":60381,"positiveTestsAntigen":11623,"fips":"45","positiveIncrease":735,"negativeIncrease":6725,"total":1410596,"totalTestResultsIncrease":7460,"posNeg":1410596,"deathIncrease":31,"hospitalizedIncrease":61,"hash":"3f56c10af6c60c8d48791ac9c7e083c91dedde21","commercialScore":0,"negativeRegularScore":0,"negativeScore":0,"positiveScore":0,"score":0,"grade":""},{"date":20201006,"state":"SC","positive":152970,"probableCases":5170,"negative":1250166,"pending":null,"totalTestResultsSource":"posNeg","totalTestResults":1403136,"hospitalizedCurrently":655,"hospitalizedCumulative":9331,"inIcuCurrently":167,"inIcuCumulative":null,"onVentilatorCurrently":87,"onVentilatorCumulative":null,"recovered":74949,"dataQualityGrade":"A+","lastUpdateEt":"10/5/2020 23:59","dateModified":"2020-10-05T23:59:00Z","checkTimeEt":"10/05 19:59","death":3471,"hospitalized":9331,"dateChecked":"2020-10-05T23:59:00Z","totalTestsViral":1397966,"positiveTestsViral":192727,"negativeTestsViral":1205239,"positiveCasesViral":147800,"deathConfirmed":3275,"deathProbable":196,"totalTestEncountersViral":null,"totalTestsPeopleViral":null,"totalTestsAntibody":72893,"positiveTestsAntibody":7359,"negativeTestsAntibody":65534,"totalTestsPeopleAntibody":null,"positiveTestsPeopleAntibody":null,"negativeTestsPeopleAntibody":null,"totalTestsPeopleAntigen":null,"positiveTestsPeopleAntigen":null,"totalTestsAntigen":58125,"positiveTestsAntigen":11303,"fips":"45","positiveIncrease":811,"negativeIncrease":13219,"total":1403136,"totalTestResultsIncrease":14030,"posNeg":1403136,"deathIncrease":15,"hospitalizedIncrease":48,"hash":"59d4588d8380844bd60283baa2725771c300acd6","commercialScore":0,"negativeRegularScore":0,"negativeScore":0,"positiveScore":0,"score":0,"grade":""},{"date":20201005,"state":"SC","positive":152159,"probableCases":5043,"negative":1236947,"pending":null,"totalTestResultsSource":"posNeg","totalTestResults":1389106,"hospitalizedCurrently":593,"hospitalizedCumulative":9283,"inIcuCurrently":150,"inIcuCumulative":null,"onVentilatorCurrently":72,"onVentilatorCumulative":null,"recovered":74272,"dataQualityGrade":"A+","lastUpdateEt":"10/4/2020 23:59","dateModified":"2020-10-04T23:59:00Z","checkTimeEt":"10/04 19:59","death":3456,"hospitalized":9283,"dateChecked":"2020-10-04T23:59:00Z","totalTestsViral":1384063,"positiveTestsViral":191423,"negativeTestsViral":1192640,"positiveCasesViral":147116,"deathConfirmed":3258,"deathProbable":198,"totalTestEncountersViral":null,"totalTestsPeopleViral":null,"totalTestsAntibody":72652,"positiveTestsAntibody":7320,"negativeTestsAntibody":65332,"totalTestsPeopleAntibody":null,"positiveTestsPeopleAntibody":null,"negativeTestsPeopleAntibody":null,"totalTestsPeopleAntigen":null,"positiveTestsPeopleAntigen":null,"totalTestsAntigen":55266,"positiveTestsAntigen":11062,"fips":"45","positiveIncrease":577,"negativeIncrease":10443,"total":1389106,"totalTestResultsIncrease":11020,"posNeg":1389106,"deathIncrease":3,"hospitalizedIncrease":24,"hash":"37bb8f6dfb226b912e571d85b286a96ae3427d60","commercialScore":0,"negativeRegularScore":0,"negativeScore":0,"positiveScore":0,"score":0,"grade":""},{"date":20201004,"state":"SC","positive":151582,"probableCases":5006,"negative":1226504,"pending":null,"totalTestResultsSource":"posNeg","totalTestResults":1378086,"hospitalizedCurrently":599,"hospitalizedCumulative":9259,"inIcuCurrently":153,"inIcuCumulative":null,"onVentilatorCurrently":72,"onVentilatorCumulative":null,"recovered":73973,"dataQualityGrade":"A+","lastUpdateEt":"10/3/2020 23:59","dateModified":"2020-10-03T23:59:00Z","checkTimeEt":"10/03 19:59","death":3453,"hospitalized":9259,"dateChecked":"2020-10-03T23:59:00Z","totalTestsViral":1373080,"positiveTestsViral":190741,"negativeTestsViral":1182339,"positiveCasesViral":146576,"deathConfirmed":3255,"deathProbable":198,"totalTestEncountersViral":null,"totalTestsPeopleViral":null,"totalTestsAntibody":72475,"positiveTestsAntibody":7285,"negativeTestsAntibody":65190,"totalTestsPeopleAntibody":null,"positiveTestsPeopleAntibody":null,"negativeTestsPeopleAntibody":null,"totalTestsPeopleAntigen":null,"positiveTestsPeopleAntigen":null,"totalTestsAntigen":54631,"positiveTestsAntigen":10995,"fips":"45","positiveIncrease":691,"negativeIncrease":37637,"total":1378086,"totalTestResultsIncrease":38328,"posNeg":1378086,"deathIncrease":11,"hospitalizedIncrease":43,"hash":"989d5942e94da9d452719b18322ddb79727350a6","commercialScore":0,"negativeRegularScore":0,"negativeScore":0,"positiveScore":0,"score":0,"grade":""},{"date":20201003,"state":"SC","positive":150891,"probableCases":4938,"negative":1188867,"pending":null,"totalTestResultsSource":"posNeg","totalTestResults":1339758,"hospitalizedCurrently":686,"hospitalizedCumulative":9216,"inIcuCurrently":163,"inIcuCumulative":null,"onVentilatorCurrently":88,"onVentilatorCumulative":null,"recovered":72951,"dataQualityGrade":"A+","lastUpdateEt":"10/1/2020 23:59","dateModified":"2020-10-01T23:59:00Z","checkTimeEt":"10/01 19:59","death":3442,"hospitalized":9216,"dateChecked":"2020-10-01T23:59:00Z","totalTestsViral":1333233,"positiveTestsViral":187608,"negativeTestsViral":1145625,"positiveCasesViral":145953,"deathConfirmed":3243,"deathProbable":199,"totalTestEncountersViral":null,"totalTestsPeopleViral":null,"totalTestsAntibody":71528,"positiveTestsAntibody":7065,"negativeTestsAntibody":64463,"totalTestsPeopleAntibody":null,"positiveTestsPeopleAntibody":null,"negativeTestsPeopleAntibody":null,"totalTestsPeopleAntigen":null,"positiveTestsPeopleAntigen":null,"totalTestsAntigen":51506,"positiveTestsAntigen":10785,"fips":"45","positiveIncrease":1706,"negativeIncrease":0,"total":1339758,"totalTestResultsIncrease":1706,"posNeg":1339758,"deathIncrease":33,"hospitalizedIncrease":0,"hash":"f398b8ed6db80c1bdbfc330a8af8238d9dd422f4","commercialScore":0,"negativeRegularScore":0,"negativeScore":0,"positiveScore":0,"score":0,"grade":""},{"date":20201002,"state":"SC","positive":149185,"probableCases":4819,"negative":1188867,"pending":null,"totalTestResultsSource":"posNeg","totalTestResults":1338052,"hospitalizedCurrently":679,"hospitalizedCumulative":9216,"inIcuCurrently":160,"inIcuCumulative":null,"onVentilatorCurrently":95,"onVentilatorCumulative":null,"recovered":72951,"dataQualityGrade":"A+","lastUpdateEt":"10/1/2020 23:59","dateModified":"2020-10-01T23:59:00Z","checkTimeEt":"10/01 19:59","death":3409,"hospitalized":9216,"dateChecked":"2020-10-01T23:59:00Z","totalTestsViral":1333233,"positiveTestsViral":187608,"negativeTestsViral":1145625,"positiveCasesViral":144366,"deathConfirmed":3211,"deathProbable":198,"totalTestEncountersViral":null,"totalTestsPeopleViral":null,"totalTestsAntibody":71528,"positiveTestsAntibody":7065,"negativeTestsAntibody":64463,"totalTestsPeopleAntibody":null,"positiveTestsPeopleAntibody":null,"negativeTestsPeopleAntibody":null,"totalTestsPeopleAntigen":null,"positiveTestsPeopleAntigen":null,"totalTestsAntigen":51506,"positiveTestsAntigen":10785,"fips":"45","positiveIncrease":862,"negativeIncrease":20736,"total":1338052,"totalTestResultsIncrease":21598,"posNeg":1338052,"deathIncrease":9,"hospitalizedIncrease":56,"hash":"43b558fc6eaab44e9f91cdff7e391a9f303df299","commercialScore":0,"negativeRegularScore":0,"negativeScore":0,"positiveScore":0,"score":0,"grade":""},{"date":20201001,"state":"SC","positive":148323,"probableCases":4536,"negative":1168131,"pending":null,"totalTestResultsSource":"posNeg","totalTestResults":1316454,"hospitalizedCurrently":709,"hospitalizedCumulative":9160,"inIcuCurrently":172,"inIcuCumulative":null,"onVentilatorCurrently":91,"onVentilatorCumulative":null,"recovered":74499,"dataQualityGrade":"A+","lastUpdateEt":"9/30/2020 23:59","dateModified":"2020-09-30T23:59:00Z","checkTimeEt":"09/30 19:59","death":3400,"hospitalized":9160,"dateChecked":"2020-09-30T23:59:00Z","totalTestsViral":1311918,"positiveTestsViral":186383,"negativeTestsViral":1125535,"positiveCasesViral":143787,"deathConfirmed":3203,"deathProbable":197,"totalTestEncountersViral":null,"totalTestsPeopleViral":null,"totalTestsAntibody":71256,"positiveTestsAntibody":6978,"negativeTestsAntibody":64278,"totalTestsPeopleAntibody":null,"positiveTestsPeopleAntibody":null,"negativeTestsPeopleAntibody":null,"totalTestsPeopleAntigen":null,"positiveTestsPeopleAntigen":null,"totalTestsAntigen":49191,"positiveTestsAntigen":10618,"fips":"45","positiveIncrease":381,"negativeIncrease":6975,"total":1316454,"totalTestResultsIncrease":7356,"posNeg":1316454,"deathIncrease":22,"hospitalizedIncrease":0,"hash":"ebb165ddc113f8cea70b87a83792cbb089c405ab","commercialScore":0,"negativeRegularScore":0,"negativeScore":0,"positiveScore":0,"score":0,"grade":""},{"date":20200930,"state":"SC","positive":147942,"probableCases":4319,"negative":1161156,"pending":null,"totalTestResultsSource":"posNeg","totalTestResults":1309098,"hospitalizedCurrently":729,"hospitalizedCumulative":9160,"inIcuCurrently":184,"inIcuCumulative":null,"onVentilatorCurrently":95,"onVentilatorCumulative":null,"recovered":71691,"dataQualityGrade":"A+","lastUpdateEt":"9/29/2020 23:59","dateModified":"2020-09-29T23:59:00Z","checkTimeEt":"09/29 19:59","death":3378,"hospitalized":9160,"dateChecked":"2020-09-29T23:59:00Z","totalTestsViral":1304779,"positiveTestsViral":185912,"negativeTestsViral":1118867,"positiveCasesViral":143623,"deathConfirmed":3186,"deathProbable":192,"totalTestEncountersViral":null,"totalTestsPeopleViral":null,"totalTestsAntibody":71177,"positiveTestsAntibody":6958,"negativeTestsAntibody":64219,"totalTestsPeopleAntibody":null,"positiveTestsPeopleAntibody":null,"negativeTestsPeopleAntibody":null,"totalTestsPeopleAntigen":null,"positiveTestsPeopleAntigen":null,"totalTestsAntigen":47058,"positiveTestsAntigen":10494,"fips":"45","positiveIncrease":308,"negativeIncrease":8376,"total":1309098,"totalTestResultsIncrease":8684,"posNeg":1309098,"deathIncrease":19,"hospitalizedIncrease":55,"hash":"6ec5a47871e4c091162295171f0d3d6839af1733","commercialScore":0,"negativeRegularScore":0,"negativeScore":0,"positiveScore":0,"score":0,"grade":""},{"date":20200929,"state":"SC","positive":147634,"probableCases":4139,"negative":1152780,"pending":null,"totalTestResultsSource":"posNeg","totalTestResults":1300414,"hospitalizedCurrently":690,"hospitalizedCumulative":9105,"inIcuCurrently":176,"inIcuCumulative":null,"onVentilatorCurrently":88,"onVentilatorCumulative":null,"recovered":73136,"dataQualityGrade":"A+","lastUpdateEt":"9/28/2020 11:59","dateModified":"2020-09-28T11:59:00Z","checkTimeEt":"09/28 07:59","death":3359,"hospitalized":9105,"dateChecked":"2020-09-28T11:59:00Z","totalTestsViral":1296275,"positiveTestsViral":185456,"negativeTestsViral":1110819,"positiveCasesViral":143495,"deathConfirmed":3173,"deathProbable":186,"totalTestEncountersViral":null,"totalTestsPeopleViral":null,"totalTestsAntibody":71059,"positiveTestsAntibody":6914,"negativeTestsAntibody":64145,"totalTestsPeopleAntibody":null,"positiveTestsPeopleAntibody":null,"negativeTestsPeopleAntibody":null,"totalTestsPeopleAntigen":null,"positiveTestsPeopleAntigen":null,"totalTestsAntigen":44877,"positiveTestsAntigen":10284,"fips":"45","positiveIncrease":1179,"negativeIncrease":25307,"total":1300414,"totalTestResultsIncrease":26486,"posNeg":1300414,"deathIncrease":22,"hospitalizedIncrease":40,"hash":"7274d6f9face9e04605e620931087c68909e1fe8","commercialScore":0,"negativeRegularScore":0,"negativeScore":0,"positiveScore":0,"score":0,"grade":""},{"date":20200928,"state":"SC","positive":146455,"probableCases":4006,"negative":1127473,"pending":null,"totalTestResultsSource":"posNeg","totalTestResults":1273928,"hospitalizedCurrently":753,"hospitalizedCumulative":9065,"inIcuCurrently":172,"inIcuCumulative":null,"onVentilatorCurrently":108,"onVentilatorCumulative":null,"recovered":70430,"dataQualityGrade":"A+","lastUpdateEt":"9/27/2020 11:59","dateModified":"2020-09-27T11:59:00Z","checkTimeEt":"09/27 07:59","death":3337,"hospitalized":9065,"dateChecked":"2020-09-27T11:59:00Z","totalTestsViral":1269922,"positiveTestsViral":183989,"negativeTestsViral":1085933,"positiveCasesViral":142449,"deathConfirmed":3154,"deathProbable":183,"totalTestEncountersViral":null,"totalTestsPeopleViral":null,"totalTestsAntibody":70816,"positiveTestsAntibody":6891,"negativeTestsAntibody":63925,"totalTestsPeopleAntibody":null,"positiveTestsPeopleAntibody":null,"negativeTestsPeopleAntibody":null,"totalTestsPeopleAntigen":null,"positiveTestsPeopleAntigen":null,"totalTestsAntigen":42553,"positiveTestsAntigen":10143,"fips":"45","positiveIncrease":568,"negativeIncrease":20822,"total":1273928,"totalTestResultsIncrease":21390,"posNeg":1273928,"deathIncrease":11,"hospitalizedIncrease":22,"hash":"8707269b5843d10cb6d7deaaf2918c5faaa14e62","commercialScore":0,"negativeRegularScore":0,"negativeScore":0,"positiveScore":0,"score":0,"grade":""},{"date":20200927,"state":"SC","positive":145887,"probableCases":3978,"negative":1106651,"pending":null,"totalTestResultsSource":"posNeg","totalTestResults":1252538,"hospitalizedCurrently":734,"hospitalizedCumulative":9043,"inIcuCurrently":179,"inIcuCumulative":null,"onVentilatorCurrently":108,"onVentilatorCumulative":null,"recovered":70028,"dataQualityGrade":"A+","lastUpdateEt":"9/26/2020 11:59","dateModified":"2020-09-26T11:59:00Z","checkTimeEt":"09/26 07:59","death":3326,"hospitalized":9043,"dateChecked":"2020-09-26T11:59:00Z","totalTestsViral":1248560,"positiveTestsViral":182242,"negativeTestsViral":1066318,"positiveCasesViral":141909,"deathConfirmed":3144,"deathProbable":182,"totalTestEncountersViral":null,"totalTestsPeopleViral":null,"totalTestsAntibody":70686,"positiveTestsAntibody":6876,"negativeTestsAntibody":63810,"totalTestsPeopleAntibody":null,"positiveTestsPeopleAntibody":null,"negativeTestsPeopleAntibody":null,"totalTestsPeopleAntigen":null,"positiveTestsPeopleAntigen":null,"totalTestsAntigen":40686,"positiveTestsAntigen":10030,"fips":"45","positiveIncrease":614,"negativeIncrease":9127,"total":1252538,"totalTestResultsIncrease":9741,"posNeg":1252538,"deathIncrease":3,"hospitalizedIncrease":15,"hash":"ac042c6e2d5d792403d89968bb34ece61130dc4f","commercialScore":0,"negativeRegularScore":0,"negativeScore":0,"positiveScore":0,"score":0,"grade":""},{"date":20200926,"state":"SC","positive":145273,"probableCases":3935,"negative":1097524,"pending":null,"totalTestResultsSource":"posNeg","totalTestResults":1242797,"hospitalizedCurrently":727,"hospitalizedCumulative":9028,"inIcuCurrently":186,"inIcuCumulative":null,"onVentilatorCurrently":99,"onVentilatorCumulative":null,"recovered":69629,"dataQualityGrade":"A+","lastUpdateEt":"9/25/2020 11:59","dateModified":"2020-09-25T11:59:00Z","checkTimeEt":"09/25 07:59","death":3323,"hospitalized":9028,"dateChecked":"2020-09-25T11:59:00Z","totalTestsViral":1238862,"positiveTestsViral":181055,"negativeTestsViral":1057807,"positiveCasesViral":141338,"deathConfirmed":3141,"deathProbable":182,"totalTestEncountersViral":null,"totalTestsPeopleViral":null,"totalTestsAntibody":70491,"positiveTestsAntibody":6831,"negativeTestsAntibody":63660,"totalTestsPeopleAntibody":null,"positiveTestsPeopleAntibody":null,"negativeTestsPeopleAntibody":null,"totalTestsPeopleAntigen":null,"positiveTestsPeopleAntigen":null,"totalTestsAntigen":39995,"positiveTestsAntigen":9972,"fips":"45","positiveIncrease":1371,"negativeIncrease":14959,"total":1242797,"totalTestResultsIncrease":16330,"posNeg":1242797,"deathIncrease":26,"hospitalizedIncrease":34,"hash":"9253dae27ae1516ae1f14887ce5ed9c7aa5e278c","commercialScore":0,"negativeRegularScore":0,"negativeScore":0,"positiveScore":0,"score":0,"grade":""},{"date":20200925,"state":"SC","positive":143902,"probableCases":3846,"negative":1082565,"pending":null,"totalTestResultsSource":"posNeg","totalTestResults":1226467,"hospitalizedCurrently":773,"hospitalizedCumulative":8994,"inIcuCurrently":191,"inIcuCumulative":null,"onVentilatorCurrently":101,"onVentilatorCumulative":null,"recovered":68854,"dataQualityGrade":"A+","lastUpdateEt":"9/24/2020 11:59","dateModified":"2020-09-24T11:59:00Z","checkTimeEt":"09/24 07:59","death":3297,"hospitalized":8994,"dateChecked":"2020-09-24T11:59:00Z","totalTestsViral":1222621,"positiveTestsViral":179372,"negativeTestsViral":1043249,"positiveCasesViral":140056,"deathConfirmed":3114,"deathProbable":183,"totalTestEncountersViral":null,"totalTestsPeopleViral":null,"totalTestsAntibody":70135,"positiveTestsAntibody":6666,"negativeTestsAntibody":63469,"totalTestsPeopleAntibody":null,"positiveTestsPeopleAntibody":null,"negativeTestsPeopleAntibody":null,"totalTestsPeopleAntigen":null,"positiveTestsPeopleAntigen":null,"totalTestsAntigen":38650,"positiveTestsAntigen":9856,"fips":"45","positiveIncrease":1195,"negativeIncrease":18166,"total":1226467,"totalTestResultsIncrease":19361,"posNeg":1226467,"deathIncrease":18,"hospitalizedIncrease":49,"hash":"d472fc9763368b57080a751300c0bdf48d56de3c","commercialScore":0,"negativeRegularScore":0,"negativeScore":0,"positiveScore":0,"score":0,"grade":""},{"date":20200924,"state":"SC","positive":142707,"probableCases":3686,"negative":1064399,"pending":null,"totalTestResultsSource":"posNeg","totalTestResults":1207106,"hospitalizedCurrently":804,"hospitalizedCumulative":8945,"inIcuCurrently":194,"inIcuCumulative":null,"onVentilatorCurrently":106,"onVentilatorCumulative":null,"recovered":68079,"dataQualityGrade":"A+","lastUpdateEt":"9/23/2020 16:25","dateModified":"2020-09-23T16:25:00Z","checkTimeEt":"09/23 12:25","death":3279,"hospitalized":8945,"dateChecked":"2020-09-23T16:25:00Z","totalTestsViral":1203420,"positiveTestsViral":178064,"negativeTestsViral":1025356,"positiveCasesViral":139021,"deathConfirmed":3097,"deathProbable":182,"totalTestEncountersViral":null,"totalTestsPeopleViral":null,"totalTestsAntibody":69862,"positiveTestsAntibody":6603,"negativeTestsAntibody":63259,"totalTestsPeopleAntibody":null,"positiveTestsPeopleAntibody":null,"negativeTestsPeopleAntibody":null,"totalTestsPeopleAntigen":null,"positiveTestsPeopleAntigen":null,"totalTestsAntigen":36799,"positiveTestsAntigen":9726,"fips":"45","positiveIncrease":1021,"negativeIncrease":15501,"total":1207106,"totalTestResultsIncrease":16522,"posNeg":1207106,"deathIncrease":17,"hospitalizedIncrease":39,"hash":"a65ff202183f9f3b000a2b16784818c0e5f7253e","commercialScore":0,"negativeRegularScore":0,"negativeScore":0,"positiveScore":0,"score":0,"grade":""},{"date":20200923,"state":"SC","positive":141686,"probableCases":3515,"negative":1048898,"pending":null,"totalTestResultsSource":"posNeg","totalTestResults":1190584,"hospitalizedCurrently":786,"hospitalizedCumulative":8906,"inIcuCurrently":190,"inIcuCumulative":null,"onVentilatorCurrently":103,"onVentilatorCumulative":null,"recovered":67491,"dataQualityGrade":"A+","lastUpdateEt":"9/22/2020 23:59","dateModified":"2020-09-22T23:59:00Z","checkTimeEt":"09/22 19:59","death":3262,"hospitalized":8906,"dateChecked":"2020-09-22T23:59:00Z","totalTestsViral":1187069,"positiveTestsViral":176559,"negativeTestsViral":1010510,"positiveCasesViral":138171,"deathConfirmed":3085,"deathProbable":177,"totalTestEncountersViral":null,"totalTestsPeopleViral":null,"totalTestsAntibody":69484,"positiveTestsAntibody":6470,"negativeTestsAntibody":63014,"totalTestsPeopleAntibody":null,"positiveTestsPeopleAntibody":null,"negativeTestsPeopleAntibody":null,"totalTestsPeopleAntigen":null,"positiveTestsPeopleAntigen":null,"totalTestsAntigen":34200,"positiveTestsAntigen":9523,"fips":"45","positiveIncrease":897,"negativeIncrease":17203,"total":1190584,"totalTestResultsIncrease":18100,"posNeg":1190584,"deathIncrease":19,"hospitalizedIncrease":55,"hash":"16d8915427add3b49f6458f2c07dcb807f537539","commercialScore":0,"negativeRegularScore":0,"negativeScore":0,"positiveScore":0,"score":0,"grade":""},{"date":20200922,"state":"SC","positive":140789,"probableCases":3383,"negative":1031695,"pending":null,"totalTestResultsSource":"posNeg","totalTestResults":1172484,"hospitalizedCurrently":768,"hospitalizedCumulative":8851,"inIcuCurrently":187,"inIcuCumulative":null,"onVentilatorCurrently":105,"onVentilatorCumulative":null,"recovered":68748,"dataQualityGrade":"A+","lastUpdateEt":"9/21/2020 23:59","dateModified":"2020-09-21T23:59:00Z","checkTimeEt":"09/21 19:59","death":3243,"hospitalized":8851,"dateChecked":"2020-09-21T23:59:00Z","totalTestsViral":1169101,"positiveTestsViral":175236,"negativeTestsViral":993865,"positiveCasesViral":137406,"deathConfirmed":3067,"deathProbable":176,"totalTestEncountersViral":null,"totalTestsPeopleViral":null,"totalTestsAntibody":68926,"positiveTestsAntibody":6349,"negativeTestsAntibody":62577,"totalTestsPeopleAntibody":null,"positiveTestsPeopleAntibody":null,"negativeTestsPeopleAntibody":null,"totalTestsPeopleAntigen":null,"positiveTestsPeopleAntigen":null,"totalTestsAntigen":30106,"positiveTestsAntigen":8954,"fips":"45","positiveIncrease":2665,"negativeIncrease":25701,"total":1172484,"totalTestResultsIncrease":28366,"posNeg":1172484,"deathIncrease":31,"hospitalizedIncrease":72,"hash":"6fde33a8b53807c2bf429851707fe831b3d142bb","commercialScore":0,"negativeRegularScore":0,"negativeScore":0,"positiveScore":0,"score":0,"grade":""},{"date":20200921,"state":"SC","positive":138124,"probableCases":3240,"negative":1005994,"pending":null,"totalTestResultsSource":"posNeg","totalTestResults":1144118,"hospitalizedCurrently":764,"hospitalizedCumulative":8779,"inIcuCurrently":199,"inIcuCumulative":null,"onVentilatorCurrently":112,"onVentilatorCumulative":null,"recovered":51431,"dataQualityGrade":"A+","lastUpdateEt":"9/20/2020 23:59","dateModified":"2020-09-20T23:59:00Z","checkTimeEt":"09/20 19:59","death":3212,"hospitalized":8779,"dateChecked":"2020-09-20T23:59:00Z","totalTestsViral":1140878,"positiveTestsViral":171879,"negativeTestsViral":968999,"positiveCasesViral":134884,"deathConfirmed":3040,"deathProbable":172,"totalTestEncountersViral":null,"totalTestsPeopleViral":null,"totalTestsAntibody":68266,"positiveTestsAntibody":6305,"negativeTestsAntibody":61961,"totalTestsPeopleAntibody":null,"positiveTestsPeopleAntibody":null,"negativeTestsPeopleAntibody":null,"totalTestsPeopleAntigen":null,"positiveTestsPeopleAntigen":null,"totalTestsAntigen":29352,"positiveTestsAntigen":8836,"fips":"45","positiveIncrease":416,"negativeIncrease":11107,"total":1144118,"totalTestResultsIncrease":11523,"posNeg":1144118,"deathIncrease":13,"hospitalizedIncrease":41,"hash":"01a52f2d1ccdb9ffd49c3107806fcaa80eefbffa","commercialScore":0,"negativeRegularScore":0,"negativeScore":0,"positiveScore":0,"score":0,"grade":""},{"date":20200920,"state":"SC","positive":137708,"probableCases":3214,"negative":994887,"pending":null,"totalTestResultsSource":"posNeg","totalTestResults":1132595,"hospitalizedCurrently":733,"hospitalizedCumulative":8738,"inIcuCurrently":203,"inIcuCumulative":null,"onVentilatorCurrently":123,"onVentilatorCumulative":null,"recovered":51431,"dataQualityGrade":"A+","lastUpdateEt":"9/19/2020 23:59","dateModified":"2020-09-19T23:59:00Z","checkTimeEt":"09/19 19:59","death":3199,"hospitalized":8738,"dateChecked":"2020-09-19T23:59:00Z","totalTestsViral":1129381,"positiveTestsViral":171027,"negativeTestsViral":958354,"positiveCasesViral":134494,"deathConfirmed":3028,"deathProbable":171,"totalTestEncountersViral":null,"totalTestsPeopleViral":null,"totalTestsAntibody":68049,"positiveTestsAntibody":6254,"negativeTestsAntibody":61795,"totalTestsPeopleAntibody":null,"positiveTestsPeopleAntibody":null,"negativeTestsPeopleAntibody":null,"totalTestsPeopleAntigen":null,"positiveTestsPeopleAntigen":null,"totalTestsAntigen":28772,"positiveTestsAntigen":8723,"fips":"45","positiveIncrease":468,"negativeIncrease":8862,"total":1132595,"totalTestResultsIncrease":9330,"posNeg":1132595,"deathIncrease":11,"hospitalizedIncrease":30,"hash":"e3578d960d4ba7fb2721519effa12b8caad3bbeb","commercialScore":0,"negativeRegularScore":0,"negativeScore":0,"positiveScore":0,"score":0,"grade":""},{"date":20200919,"state":"SC","positive":137240,"probableCases":3188,"negative":986025,"pending":null,"totalTestResultsSource":"posNeg","totalTestResults":1123265,"hospitalizedCurrently":826,"hospitalizedCumulative":8708,"inIcuCurrently":203,"inIcuCumulative":null,"onVentilatorCurrently":121,"onVentilatorCumulative":null,"recovered":51431,"dataQualityGrade":"A+","lastUpdateEt":"9/18/2020 23:59","dateModified":"2020-09-18T23:59:00Z","checkTimeEt":"09/18 19:59","death":3188,"hospitalized":8708,"dateChecked":"2020-09-18T23:59:00Z","totalTestsViral":1120077,"positiveTestsViral":170413,"negativeTestsViral":949664,"positiveCasesViral":134052,"deathConfirmed":3017,"deathProbable":171,"totalTestEncountersViral":null,"totalTestsPeopleViral":null,"totalTestsAntibody":67865,"positiveTestsAntibody":6232,"negativeTestsAntibody":61633,"totalTestsPeopleAntibody":null,"positiveTestsPeopleAntibody":null,"negativeTestsPeopleAntibody":null,"totalTestsPeopleAntigen":null,"positiveTestsPeopleAntigen":null,"totalTestsAntigen":27959,"positiveTestsAntigen":8621,"fips":"45","positiveIncrease":922,"negativeIncrease":10939,"total":1123265,"totalTestResultsIncrease":11861,"posNeg":1123265,"deathIncrease":11,"hospitalizedIncrease":39,"hash":"bc9a7d5481216902631ae1a2143a0f04a5c9d1a3","commercialScore":0,"negativeRegularScore":0,"negativeScore":0,"positiveScore":0,"score":0,"grade":""},{"date":20200918,"state":"SC","positive":136318,"probableCases":3008,"negative":975086,"pending":null,"totalTestResultsSource":"posNeg","totalTestResults":1111404,"hospitalizedCurrently":798,"hospitalizedCumulative":8669,"inIcuCurrently":217,"inIcuCumulative":null,"onVentilatorCurrently":125,"onVentilatorCumulative":null,"recovered":51431,"dataQualityGrade":"A+","lastUpdateEt":"9/17/2020 23:59","dateModified":"2020-09-17T23:59:00Z","checkTimeEt":"09/17 19:59","death":3177,"hospitalized":8669,"dateChecked":"2020-09-17T23:59:00Z","totalTestsViral":1108396,"positiveTestsViral":169306,"negativeTestsViral":939090,"positiveCasesViral":133310,"deathConfirmed":3010,"deathProbable":167,"totalTestEncountersViral":null,"totalTestsPeopleViral":null,"totalTestsAntibody":67459,"positiveTestsAntibody":6153,"negativeTestsAntibody":61306,"totalTestsPeopleAntibody":null,"positiveTestsPeopleAntibody":null,"negativeTestsPeopleAntibody":null,"totalTestsPeopleAntigen":null,"positiveTestsPeopleAntigen":null,"totalTestsAntigen":26886,"positiveTestsAntigen":8291,"fips":"45","positiveIncrease":872,"negativeIncrease":22945,"total":1111404,"totalTestResultsIncrease":23817,"posNeg":1111404,"deathIncrease":19,"hospitalizedIncrease":58,"hash":"bc2eb70722bb49bb9922e8d3bcaf05172fe95b7e","commercialScore":0,"negativeRegularScore":0,"negativeScore":0,"positiveScore":0,"score":0,"grade":""},{"date":20200917,"state":"SC","positive":135446,"probableCases":2881,"negative":952141,"pending":null,"totalTestResultsSource":"posNeg","totalTestResults":1087587,"hospitalizedCurrently":733,"hospitalizedCumulative":8611,"inIcuCurrently":203,"inIcuCumulative":null,"onVentilatorCurrently":123,"onVentilatorCumulative":null,"recovered":51431,"dataQualityGrade":"A+","lastUpdateEt":"9/16/2020 23:59","dateModified":"2020-09-16T23:59:00Z","checkTimeEt":"09/16 19:59","death":3158,"hospitalized":8611,"dateChecked":"2020-09-16T23:59:00Z","totalTestsViral":1084706,"positiveTestsViral":166907,"negativeTestsViral":917799,"positiveCasesViral":132565,"deathConfirmed":2992,"deathProbable":166,"totalTestEncountersViral":null,"totalTestsPeopleViral":null,"totalTestsAntibody":66921,"positiveTestsAntibody":6020,"negativeTestsAntibody":60901,"totalTestsPeopleAntibody":null,"positiveTestsPeopleAntibody":null,"negativeTestsPeopleAntibody":null,"totalTestsPeopleAntigen":null,"positiveTestsPeopleAntigen":null,"totalTestsAntigen":25086,"positiveTestsAntigen":8017,"fips":"45","positiveIncrease":1324,"negativeIncrease":5341,"total":1087587,"totalTestResultsIncrease":6665,"posNeg":1087587,"deathIncrease":26,"hospitalizedIncrease":59,"hash":"91363fc16c5cdefb0b06f3ab824b18f98e495f5f","commercialScore":0,"negativeRegularScore":0,"negativeScore":0,"positiveScore":0,"score":0,"grade":""},{"date":20200916,"state":"SC","positive":134122,"probableCases":2694,"negative":946800,"pending":null,"totalTestResultsSource":"posNeg","totalTestResults":1080922,"hospitalizedCurrently":784,"hospitalizedCumulative":8552,"inIcuCurrently":223,"inIcuCumulative":null,"onVentilatorCurrently":136,"onVentilatorCumulative":null,"recovered":51431,"dataQualityGrade":"A+","lastUpdateEt":"9/15/2020 23:59","dateModified":"2020-09-15T23:59:00Z","checkTimeEt":"09/15 19:59","death":3132,"hospitalized":8552,"dateChecked":"2020-09-15T23:59:00Z","totalTestsViral":1078228,"positiveTestsViral":166110,"negativeTestsViral":912118,"positiveCasesViral":131428,"deathConfirmed":2968,"deathProbable":164,"totalTestEncountersViral":null,"totalTestsPeopleViral":null,"totalTestsAntibody":66765,"positiveTestsAntibody":6001,"negativeTestsAntibody":60764,"totalTestsPeopleAntibody":null,"positiveTestsPeopleAntibody":null,"negativeTestsPeopleAntibody":null,"totalTestsPeopleAntigen":null,"positiveTestsPeopleAntigen":null,"totalTestsAntigen":24446,"positiveTestsAntigen":7921,"fips":"45","positiveIncrease":652,"negativeIncrease":5533,"total":1080922,"totalTestResultsIncrease":6185,"posNeg":1080922,"deathIncrease":34,"hospitalizedIncrease":50,"hash":"bbb0ba700b6de6041abc2a3a1b945a8dd7a8efa5","commercialScore":0,"negativeRegularScore":0,"negativeScore":0,"positiveScore":0,"score":0,"grade":""},{"date":20200915,"state":"SC","positive":133470,"probableCases":2553,"negative":941267,"pending":null,"totalTestResultsSource":"posNeg","totalTestResults":1074737,"hospitalizedCurrently":745,"hospitalizedCumulative":8502,"inIcuCurrently":211,"inIcuCumulative":null,"onVentilatorCurrently":127,"onVentilatorCumulative":null,"recovered":51431,"dataQualityGrade":"A+","lastUpdateEt":"9/14/2020 23:59","dateModified":"2020-09-14T23:59:00Z","checkTimeEt":"09/14 19:59","death":3098,"hospitalized":8502,"dateChecked":"2020-09-14T23:59:00Z","totalTestsViral":1072184,"positiveTestsViral":165462,"negativeTestsViral":906722,"positiveCasesViral":130917,"deathConfirmed":2943,"deathProbable":155,"totalTestEncountersViral":null,"totalTestsPeopleViral":null,"totalTestsAntibody":66624,"positiveTestsAntibody":5967,"negativeTestsAntibody":60657,"totalTestsPeopleAntibody":null,"positiveTestsPeopleAntibody":null,"negativeTestsPeopleAntibody":null,"totalTestsPeopleAntigen":null,"positiveTestsPeopleAntigen":null,"totalTestsAntigen":23477,"positiveTestsAntigen":7763,"fips":"45","positiveIncrease":790,"negativeIncrease":-14526,"total":1074737,"totalTestResultsIncrease":-13736,"posNeg":1074737,"deathIncrease":21,"hospitalizedIncrease":54,"hash":"130be463e16124b6f3324c476fcb274f90717fdf","commercialScore":0,"negativeRegularScore":0,"negativeScore":0,"positiveScore":0,"score":0,"grade":""},{"date":20200914,"state":"SC","positive":132680,"probableCases":2424,"negative":955793,"pending":null,"totalTestResultsSource":"posNeg","totalTestResults":1088473,"hospitalizedCurrently":733,"hospitalizedCumulative":8448,"inIcuCurrently":203,"inIcuCumulative":null,"onVentilatorCurrently":123,"onVentilatorCumulative":null,"recovered":51431,"dataQualityGrade":"A+","lastUpdateEt":"9/13/2020 23:59","dateModified":"2020-09-13T23:59:00Z","checkTimeEt":"09/13 19:59","death":3077,"hospitalized":8448,"dateChecked":"2020-09-13T23:59:00Z","totalTestsViral":1086049,"positiveTestsViral":172250,"negativeTestsViral":913799,"positiveCasesViral":130256,"deathConfirmed":2922,"deathProbable":155,"totalTestEncountersViral":null,"totalTestsPeopleViral":null,"totalTestsAntibody":66581,"positiveTestsAntibody":5960,"negativeTestsAntibody":60621,"totalTestsPeopleAntibody":null,"positiveTestsPeopleAntibody":null,"negativeTestsPeopleAntibody":null,"totalTestsPeopleAntigen":null,"positiveTestsPeopleAntigen":null,"totalTestsAntigen":null,"positiveTestsAntigen":null,"fips":"45","positiveIncrease":816,"negativeIncrease":15794,"total":1088473,"totalTestResultsIncrease":16610,"posNeg":1088473,"deathIncrease":13,"hospitalizedIncrease":22,"hash":"b4a5aa84ab5d7fc1cf516172d023ca9cbb81dacc","commercialScore":0,"negativeRegularScore":0,"negativeScore":0,"positiveScore":0,"score":0,"grade":""},{"date":20200913,"state":"SC","positive":131864,"probableCases":2380,"negative":939999,"pending":null,"totalTestResultsSource":"posNeg","totalTestResults":1071863,"hospitalizedCurrently":752,"hospitalizedCumulative":8426,"inIcuCurrently":205,"inIcuCumulative":null,"onVentilatorCurrently":130,"onVentilatorCumulative":null,"recovered":51431,"dataQualityGrade":"A+","lastUpdateEt":"9/12/2020 23:59","dateModified":"2020-09-12T23:59:00Z","checkTimeEt":"09/12 19:59","death":3064,"hospitalized":8426,"dateChecked":"2020-09-12T23:59:00Z","totalTestsViral":1069483,"positiveTestsViral":171055,"negativeTestsViral":898428,"positiveCasesViral":129484,"deathConfirmed":2915,"deathProbable":149,"totalTestEncountersViral":null,"totalTestsPeopleViral":null,"totalTestsAntibody":66426,"positiveTestsAntibody":5907,"negativeTestsAntibody":60519,"totalTestsPeopleAntibody":null,"positiveTestsPeopleAntibody":null,"negativeTestsPeopleAntibody":null,"totalTestsPeopleAntigen":null,"positiveTestsPeopleAntigen":null,"totalTestsAntigen":null,"positiveTestsAntigen":null,"fips":"45","positiveIncrease":1886,"negativeIncrease":15105,"total":1071863,"totalTestResultsIncrease":16991,"posNeg":1071863,"deathIncrease":24,"hospitalizedIncrease":24,"hash":"7d3cac17c472ff5846cfb044be0f3224743812a6","commercialScore":0,"negativeRegularScore":0,"negativeScore":0,"positiveScore":0,"score":0,"grade":""},{"date":20200912,"state":"SC","positive":129978,"probableCases":2332,"negative":924894,"pending":null,"totalTestResultsSource":"posNeg","totalTestResults":1054872,"hospitalizedCurrently":806,"hospitalizedCumulative":8402,"inIcuCurrently":220,"inIcuCumulative":null,"onVentilatorCurrently":131,"onVentilatorCumulative":null,"recovered":51431,"dataQualityGrade":"A+","lastUpdateEt":"9/11/2020 23:59","dateModified":"2020-09-11T23:59:00Z","checkTimeEt":"09/11 19:59","death":3040,"hospitalized":8402,"dateChecked":"2020-09-11T23:59:00Z","totalTestsViral":1052540,"positiveTestsViral":168092,"negativeTestsViral":884448,"positiveCasesViral":127646,"deathConfirmed":2891,"deathProbable":149,"totalTestEncountersViral":null,"totalTestsPeopleViral":null,"totalTestsAntibody":65834,"positiveTestsAntibody":5799,"negativeTestsAntibody":60035,"totalTestsPeopleAntibody":null,"positiveTestsPeopleAntibody":null,"negativeTestsPeopleAntibody":null,"totalTestsPeopleAntigen":null,"positiveTestsPeopleAntigen":null,"totalTestsAntigen":null,"positiveTestsAntigen":null,"fips":"45","positiveIncrease":932,"negativeIncrease":9464,"total":1054872,"totalTestResultsIncrease":10396,"posNeg":1054872,"deathIncrease":12,"hospitalizedIncrease":49,"hash":"9e1ce6bc07bbc238308f551b862f098044a05638","commercialScore":0,"negativeRegularScore":0,"negativeScore":0,"positiveScore":0,"score":0,"grade":""},{"date":20200911,"state":"SC","positive":129046,"probableCases":2254,"negative":915430,"pending":null,"totalTestResultsSource":"posNeg","totalTestResults":1044476,"hospitalizedCurrently":806,"hospitalizedCumulative":8353,"inIcuCurrently":220,"inIcuCumulative":null,"onVentilatorCurrently":131,"onVentilatorCumulative":null,"recovered":51431,"dataQualityGrade":"A+","lastUpdateEt":"9/10/2020 23:59","dateModified":"2020-09-10T23:59:00Z","checkTimeEt":"09/10 19:59","death":3028,"hospitalized":8353,"dateChecked":"2020-09-10T23:59:00Z","totalTestsViral":1042222,"positiveTestsViral":166754,"negativeTestsViral":875468,"positiveCasesViral":126792,"deathConfirmed":2877,"deathProbable":151,"totalTestEncountersViral":null,"totalTestsPeopleViral":null,"totalTestsAntibody":65478,"positiveTestsAntibody":5737,"negativeTestsAntibody":59741,"totalTestsPeopleAntibody":null,"positiveTestsPeopleAntibody":null,"negativeTestsPeopleAntibody":null,"totalTestsPeopleAntigen":null,"positiveTestsPeopleAntigen":null,"totalTestsAntigen":null,"positiveTestsAntigen":null,"fips":"45","positiveIncrease":2454,"negativeIncrease":9563,"total":1044476,"totalTestResultsIncrease":12017,"posNeg":1044476,"deathIncrease":53,"hospitalizedIncrease":58,"hash":"fc9b2043167604e662be703047950bdee98a1fed","commercialScore":0,"negativeRegularScore":0,"negativeScore":0,"positiveScore":0,"score":0,"grade":""},{"date":20200910,"state":"SC","positive":126592,"probableCases":2195,"negative":905867,"pending":null,"totalTestResultsSource":"posNeg","totalTestResults":1032459,"hospitalizedCurrently":852,"hospitalizedCumulative":8295,"inIcuCurrently":219,"inIcuCumulative":null,"onVentilatorCurrently":127,"onVentilatorCumulative":null,"recovered":51431,"dataQualityGrade":"A+","lastUpdateEt":"9/9/2020 23:59","dateModified":"2020-09-09T23:59:00Z","checkTimeEt":"09/09 19:59","death":2975,"hospitalized":8295,"dateChecked":"2020-09-09T23:59:00Z","totalTestsViral":1030264,"positiveTestsViral":165309,"negativeTestsViral":864955,"positiveCasesViral":124397,"deathConfirmed":2823,"deathProbable":152,"totalTestEncountersViral":null,"totalTestsPeopleViral":null,"totalTestsAntibody":65181,"positiveTestsAntibody":5680,"negativeTestsAntibody":59501,"totalTestsPeopleAntibody":null,"positiveTestsPeopleAntibody":null,"negativeTestsPeopleAntibody":null,"totalTestsPeopleAntigen":null,"positiveTestsPeopleAntigen":null,"totalTestsAntigen":null,"positiveTestsAntigen":null,"fips":"45","positiveIncrease":379,"negativeIncrease":14761,"total":1032459,"totalTestResultsIncrease":15140,"posNeg":1032459,"deathIncrease":33,"hospitalizedIncrease":59,"hash":"6c919d94f9a60097c82e66345630f371f74d34bf","commercialScore":0,"negativeRegularScore":0,"negativeScore":0,"positiveScore":0,"score":0,"grade":""},{"date":20200909,"state":"SC","positive":126213,"probableCases":2116,"negative":891106,"pending":null,"totalTestResultsSource":"posNeg","totalTestResults":1017319,"hospitalizedCurrently":801,"hospitalizedCumulative":8236,"inIcuCurrently":224,"inIcuCumulative":null,"onVentilatorCurrently":133,"onVentilatorCumulative":null,"recovered":51431,"dataQualityGrade":"A+","lastUpdateEt":"9/8/2020 23:59","dateModified":"2020-09-08T23:59:00Z","checkTimeEt":"09/08 19:59","death":2942,"hospitalized":8236,"dateChecked":"2020-09-08T23:59:00Z","totalTestsViral":1015203,"positiveTestsViral":162507,"negativeTestsViral":852696,"positiveCasesViral":124097,"deathConfirmed":2800,"deathProbable":142,"totalTestEncountersViral":null,"totalTestsPeopleViral":null,"totalTestsAntibody":65054,"positiveTestsAntibody":5647,"negativeTestsAntibody":59407,"totalTestsPeopleAntibody":null,"positiveTestsPeopleAntibody":null,"negativeTestsPeopleAntibody":null,"totalTestsPeopleAntigen":null,"positiveTestsPeopleAntigen":null,"totalTestsAntigen":null,"positiveTestsAntigen":null,"fips":"45","positiveIncrease":305,"negativeIncrease":2863,"total":1017319,"totalTestResultsIncrease":3168,"posNeg":1017319,"deathIncrease":30,"hospitalizedIncrease":54,"hash":"7e15557947b80673ea3d3864846738fe5fe672c6","commercialScore":0,"negativeRegularScore":0,"negativeScore":0,"positiveScore":0,"score":0,"grade":""},{"date":20200908,"state":"SC","positive":125908,"probableCases":2107,"negative":888243,"pending":null,"totalTestResultsSource":"posNeg","totalTestResults":1014151,"hospitalizedCurrently":766,"hospitalizedCumulative":8182,"inIcuCurrently":213,"inIcuCumulative":null,"onVentilatorCurrently":118,"onVentilatorCumulative":null,"recovered":51431,"dataQualityGrade":"A+","lastUpdateEt":"9/7/2020 23:59","dateModified":"2020-09-07T23:59:00Z","checkTimeEt":"09/07 19:59","death":2912,"hospitalized":8182,"dateChecked":"2020-09-07T23:59:00Z","totalTestsViral":1012044,"positiveTestsViral":162047,"negativeTestsViral":849997,"positiveCasesViral":123801,"deathConfirmed":2772,"deathProbable":140,"totalTestEncountersViral":null,"totalTestsPeopleViral":null,"totalTestsAntibody":64981,"positiveTestsAntibody":5645,"negativeTestsAntibody":59336,"totalTestsPeopleAntibody":null,"positiveTestsPeopleAntibody":null,"negativeTestsPeopleAntibody":null,"totalTestsPeopleAntigen":null,"positiveTestsPeopleAntigen":null,"totalTestsAntigen":null,"positiveTestsAntigen":null,"fips":"45","positiveIncrease":301,"negativeIncrease":4140,"total":1014151,"totalTestResultsIncrease":4441,"posNeg":1014151,"deathIncrease":5,"hospitalizedIncrease":11,"hash":"58afdc3c36aa21d3046882bce5504a264dffb713","commercialScore":0,"negativeRegularScore":0,"negativeScore":0,"positiveScore":0,"score":0,"grade":""},{"date":20200907,"state":"SC","positive":125607,"probableCases":2055,"negative":884103,"pending":null,"totalTestResultsSource":"posNeg","totalTestResults":1009710,"hospitalizedCurrently":787,"hospitalizedCumulative":8171,"inIcuCurrently":208,"inIcuCumulative":null,"onVentilatorCurrently":129,"onVentilatorCumulative":null,"recovered":51431,"dataQualityGrade":"A+","lastUpdateEt":"9/6/2020 23:59","dateModified":"2020-09-06T23:59:00Z","checkTimeEt":"09/06 19:59","death":2907,"hospitalized":8171,"dateChecked":"2020-09-06T23:59:00Z","totalTestsViral":1007655,"positiveTestsViral":161468,"negativeTestsViral":846187,"positiveCasesViral":123552,"deathConfirmed":2767,"deathProbable":140,"totalTestEncountersViral":null,"totalTestsPeopleViral":null,"totalTestsAntibody":64929,"positiveTestsAntibody":5641,"negativeTestsAntibody":59288,"totalTestsPeopleAntibody":null,"positiveTestsPeopleAntibody":null,"negativeTestsPeopleAntibody":null,"totalTestsPeopleAntigen":null,"positiveTestsPeopleAntigen":null,"totalTestsAntigen":null,"positiveTestsAntigen":null,"fips":"45","positiveIncrease":655,"negativeIncrease":7830,"total":1009710,"totalTestResultsIncrease":8485,"posNeg":1009710,"deathIncrease":20,"hospitalizedIncrease":27,"hash":"a2e8dee81bdd5af1ca27ad90e03cac31d5121938","commercialScore":0,"negativeRegularScore":0,"negativeScore":0,"positiveScore":0,"score":0,"grade":""},{"date":20200906,"state":"SC","positive":124952,"probableCases":2008,"negative":876273,"pending":null,"totalTestResultsSource":"posNeg","totalTestResults":1001225,"hospitalizedCurrently":787,"hospitalizedCumulative":8144,"inIcuCurrently":208,"inIcuCumulative":null,"onVentilatorCurrently":129,"onVentilatorCumulative":null,"recovered":51431,"dataQualityGrade":"A+","lastUpdateEt":"9/5/2020 23:59","dateModified":"2020-09-05T23:59:00Z","checkTimeEt":"09/05 19:59","death":2887,"hospitalized":8144,"dateChecked":"2020-09-05T23:59:00Z","totalTestsViral":999217,"positiveTestsViral":160614,"negativeTestsViral":838603,"positiveCasesViral":122944,"deathConfirmed":2748,"deathProbable":139,"totalTestEncountersViral":null,"totalTestsPeopleViral":null,"totalTestsAntibody":64756,"positiveTestsAntibody":5618,"negativeTestsAntibody":59138,"totalTestsPeopleAntibody":null,"positiveTestsPeopleAntibody":null,"negativeTestsPeopleAntibody":null,"totalTestsPeopleAntigen":null,"positiveTestsPeopleAntigen":null,"totalTestsAntigen":null,"positiveTestsAntigen":null,"fips":"45","positiveIncrease":663,"negativeIncrease":6635,"total":1001225,"totalTestResultsIncrease":7298,"posNeg":1001225,"deathIncrease":10,"hospitalizedIncrease":11,"hash":"72472c48e9a8327e26ce389090f86c18accd0242","commercialScore":0,"negativeRegularScore":0,"negativeScore":0,"positiveScore":0,"score":0,"grade":""},{"date":20200905,"state":"SC","positive":124289,"probableCases":1976,"negative":869638,"pending":null,"totalTestResultsSource":"posNeg","totalTestResults":993927,"hospitalizedCurrently":845,"hospitalizedCumulative":8133,"inIcuCurrently":213,"inIcuCumulative":null,"onVentilatorCurrently":128,"onVentilatorCumulative":null,"recovered":51431,"dataQualityGrade":"A+","lastUpdateEt":"9/4/2020 23:59","dateModified":"2020-09-04T23:59:00Z","checkTimeEt":"09/04 19:59","death":2877,"hospitalized":8133,"dateChecked":"2020-09-04T23:59:00Z","totalTestsViral":991951,"positiveTestsViral":159813,"negativeTestsViral":832138,"positiveCasesViral":122313,"deathConfirmed":2738,"deathProbable":139,"totalTestEncountersViral":null,"totalTestsPeopleViral":null,"totalTestsAntibody":64470,"positiveTestsAntibody":5562,"negativeTestsAntibody":58908,"totalTestsPeopleAntibody":null,"positiveTestsPeopleAntibody":null,"negativeTestsPeopleAntibody":null,"totalTestsPeopleAntigen":null,"positiveTestsPeopleAntigen":null,"totalTestsAntigen":null,"positiveTestsAntigen":null,"fips":"45","positiveIncrease":964,"negativeIncrease":10979,"total":993927,"totalTestResultsIncrease":11943,"posNeg":993927,"deathIncrease":31,"hospitalizedIncrease":60,"hash":"ac79b7924de01bce4282a7dbda5dcd0bbe102afe","commercialScore":0,"negativeRegularScore":0,"negativeScore":0,"positiveScore":0,"score":0,"grade":""},{"date":20200904,"state":"SC","positive":123325,"probableCases":1947,"negative":858659,"pending":null,"totalTestResultsSource":"posNeg","totalTestResults":981984,"hospitalizedCurrently":910,"hospitalizedCumulative":8073,"inIcuCurrently":230,"inIcuCumulative":null,"onVentilatorCurrently":140,"onVentilatorCumulative":null,"recovered":51431,"dataQualityGrade":"A+","lastUpdateEt":"9/3/2020 23:59","dateModified":"2020-09-03T23:59:00Z","checkTimeEt":"09/03 19:59","death":2846,"hospitalized":8073,"dateChecked":"2020-09-03T23:59:00Z","totalTestsViral":980037,"positiveTestsViral":158422,"negativeTestsViral":821615,"positiveCasesViral":121378,"deathConfirmed":2706,"deathProbable":140,"totalTestEncountersViral":null,"totalTestsPeopleViral":null,"totalTestsAntibody":64094,"positiveTestsAntibody":5478,"negativeTestsAntibody":58616,"totalTestsPeopleAntibody":null,"positiveTestsPeopleAntibody":null,"negativeTestsPeopleAntibody":null,"totalTestsPeopleAntigen":null,"positiveTestsPeopleAntigen":null,"totalTestsAntigen":null,"positiveTestsAntigen":null,"fips":"45","positiveIncrease":1629,"negativeIncrease":10930,"total":981984,"totalTestResultsIncrease":12559,"posNeg":981984,"deathIncrease":39,"hospitalizedIncrease":67,"hash":"15d1ae9c2fdad228dd5a32bd60e69e6806dd2370","commercialScore":0,"negativeRegularScore":0,"negativeScore":0,"positiveScore":0,"score":0,"grade":""},{"date":20200903,"state":"SC","positive":121696,"probableCases":1874,"negative":847729,"pending":null,"totalTestResultsSource":"posNeg","totalTestResults":969425,"hospitalizedCurrently":911,"hospitalizedCumulative":8006,"inIcuCurrently":235,"inIcuCumulative":null,"onVentilatorCurrently":145,"onVentilatorCumulative":null,"recovered":51431,"dataQualityGrade":"A+","lastUpdateEt":"9/2/2020 23:59","dateModified":"2020-09-02T23:59:00Z","checkTimeEt":"09/02 19:59","death":2807,"hospitalized":8006,"dateChecked":"2020-09-02T23:59:00Z","totalTestsViral":967551,"positiveTestsViral":154856,"negativeTestsViral":802372,"positiveCasesViral":119822,"deathConfirmed":2667,"deathProbable":140,"totalTestEncountersViral":null,"totalTestsPeopleViral":null,"totalTestsAntibody":63761,"positiveTestsAntibody":5313,"negativeTestsAntibody":58135,"totalTestsPeopleAntibody":null,"positiveTestsPeopleAntibody":null,"negativeTestsPeopleAntibody":null,"totalTestsPeopleAntigen":null,"positiveTestsPeopleAntigen":null,"totalTestsAntigen":null,"positiveTestsAntigen":null,"fips":"45","positiveIncrease":1193,"negativeIncrease":9200,"total":969425,"totalTestResultsIncrease":10393,"posNeg":969425,"deathIncrease":13,"hospitalizedIncrease":58,"hash":"c3d65ac4f66bc1519301167111cdb15c3e5c8ae5","commercialScore":0,"negativeRegularScore":0,"negativeScore":0,"positiveScore":0,"score":0,"grade":""},{"date":20200902,"state":"SC","positive":120503,"probableCases":1804,"negative":838529,"pending":null,"totalTestResultsSource":"posNeg","totalTestResults":959032,"hospitalizedCurrently":892,"hospitalizedCumulative":7948,"inIcuCurrently":228,"inIcuCumulative":null,"onVentilatorCurrently":145,"onVentilatorCumulative":null,"recovered":51431,"dataQualityGrade":"A+","lastUpdateEt":"9/1/2020 23:59","dateModified":"2020-09-01T23:59:00Z","checkTimeEt":"09/01 19:59","death":2794,"hospitalized":7948,"dateChecked":"2020-09-01T23:59:00Z","totalTestsViral":957228,"positiveTestsViral":154856,"negativeTestsViral":802372,"positiveCasesViral":118699,"deathConfirmed":2652,"deathProbable":142,"totalTestEncountersViral":null,"totalTestsPeopleViral":null,"totalTestsAntibody":63448,"positiveTestsAntibody":5313,"negativeTestsAntibody":58135,"totalTestsPeopleAntibody":null,"positiveTestsPeopleAntibody":null,"negativeTestsPeopleAntibody":null,"totalTestsPeopleAntigen":null,"positiveTestsPeopleAntigen":null,"totalTestsAntigen":null,"positiveTestsAntigen":null,"fips":"45","positiveIncrease":657,"negativeIncrease":3973,"total":959032,"totalTestResultsIncrease":4630,"posNeg":959032,"deathIncrease":37,"hospitalizedIncrease":78,"hash":"b73e86cecd15ab93705d8dbee780b98af6bdd8cf","commercialScore":0,"negativeRegularScore":0,"negativeScore":0,"positiveScore":0,"score":0,"grade":""},{"date":20200901,"state":"SC","positive":119846,"probableCases":1730,"negative":834556,"pending":null,"totalTestResultsSource":"posNeg","totalTestResults":954402,"hospitalizedCurrently":894,"hospitalizedCumulative":7870,"inIcuCurrently":232,"inIcuCumulative":null,"onVentilatorCurrently":141,"onVentilatorCumulative":null,"recovered":51431,"dataQualityGrade":"A+","lastUpdateEt":"8/31/2020 23:59","dateModified":"2020-08-31T23:59:00Z","checkTimeEt":"08/31 19:59","death":2757,"hospitalized":7870,"dateChecked":"2020-08-31T23:59:00Z","totalTestsViral":952672,"positiveTestsViral":153908,"negativeTestsViral":798764,"positiveCasesViral":118116,"deathConfirmed":2626,"deathProbable":131,"totalTestEncountersViral":null,"totalTestsPeopleViral":null,"totalTestsAntibody":63331,"positiveTestsAntibody":5281,"negativeTestsAntibody":58050,"totalTestsPeopleAntibody":null,"positiveTestsPeopleAntibody":null,"negativeTestsPeopleAntibody":null,"totalTestsPeopleAntigen":null,"positiveTestsPeopleAntigen":null,"totalTestsAntigen":null,"positiveTestsAntigen":null,"fips":"45","positiveIncrease":854,"negativeIncrease":4000,"total":954402,"totalTestResultsIncrease":4854,"posNeg":954402,"deathIncrease":37,"hospitalizedIncrease":59,"hash":"d159cb9a8e10c0e84e29255066f62f4212d7552c","commercialScore":0,"negativeRegularScore":0,"negativeScore":0,"positiveScore":0,"score":0,"grade":""},{"date":20200831,"state":"SC","positive":118992,"probableCases":1659,"negative":830556,"pending":null,"totalTestResultsSource":"posNeg","totalTestResults":949548,"hospitalizedCurrently":934,"hospitalizedCumulative":7811,"inIcuCurrently":247,"inIcuCumulative":null,"onVentilatorCurrently":136,"onVentilatorCumulative":null,"recovered":51431,"dataQualityGrade":"A+","lastUpdateEt":"8/30/2020 23:59","dateModified":"2020-08-30T23:59:00Z","checkTimeEt":"08/30 19:59","death":2720,"hospitalized":7811,"dateChecked":"2020-08-30T23:59:00Z","totalTestsViral":947889,"positiveTestsViral":152736,"negativeTestsViral":795153,"positiveCasesViral":117333,"deathConfirmed":2588,"deathProbable":132,"totalTestEncountersViral":null,"totalTestsPeopleViral":null,"totalTestsAntibody":63256,"positiveTestsAntibody":5267,"negativeTestsAntibody":57989,"totalTestsPeopleAntibody":null,"positiveTestsPeopleAntibody":null,"negativeTestsPeopleAntibody":null,"totalTestsPeopleAntigen":null,"positiveTestsPeopleAntigen":null,"totalTestsAntigen":null,"positiveTestsAntigen":null,"fips":"45","positiveIncrease":668,"negativeIncrease":6007,"total":949548,"totalTestResultsIncrease":6675,"posNeg":949548,"deathIncrease":11,"hospitalizedIncrease":29,"hash":"0c8bdec228c5e4dbf96d24bc67d8f8683b33890e","commercialScore":0,"negativeRegularScore":0,"negativeScore":0,"positiveScore":0,"score":0,"grade":""},{"date":20200830,"state":"SC","positive":118324,"probableCases":1627,"negative":824549,"pending":null,"totalTestResultsSource":"posNeg","totalTestResults":942873,"hospitalizedCurrently":956,"hospitalizedCumulative":7782,"inIcuCurrently":250,"inIcuCumulative":null,"onVentilatorCurrently":143,"onVentilatorCumulative":null,"recovered":51431,"dataQualityGrade":"A+","lastUpdateEt":"8/29/2020 23:59","dateModified":"2020-08-29T23:59:00Z","checkTimeEt":"08/29 19:59","death":2709,"hospitalized":7782,"dateChecked":"2020-08-29T23:59:00Z","totalTestsViral":941246,"positiveTestsViral":151869,"negativeTestsViral":789377,"positiveCasesViral":116697,"deathConfirmed":2574,"deathProbable":135,"totalTestEncountersViral":null,"totalTestsPeopleViral":null,"totalTestsAntibody":63017,"positiveTestsAntibody":5227,"negativeTestsAntibody":57790,"totalTestsPeopleAntibody":null,"positiveTestsPeopleAntibody":null,"negativeTestsPeopleAntibody":null,"totalTestsPeopleAntigen":null,"positiveTestsPeopleAntigen":null,"totalTestsAntigen":null,"positiveTestsAntigen":null,"fips":"45","positiveIncrease":1075,"negativeIncrease":6175,"total":942873,"totalTestResultsIncrease":7250,"posNeg":942873,"deathIncrease":11,"hospitalizedIncrease":17,"hash":"b10e4366177b1ebb527562ec0d0a5655dbcdfb84","commercialScore":0,"negativeRegularScore":0,"negativeScore":0,"positiveScore":0,"score":0,"grade":""},{"date":20200829,"state":"SC","positive":117249,"probableCases":1588,"negative":818374,"pending":null,"totalTestResultsSource":"posNeg","totalTestResults":935623,"hospitalizedCurrently":945,"hospitalizedCumulative":7765,"inIcuCurrently":245,"inIcuCumulative":null,"onVentilatorCurrently":145,"onVentilatorCumulative":null,"recovered":51431,"dataQualityGrade":"A+","lastUpdateEt":"8/28/2020 23:59","dateModified":"2020-08-28T23:59:00Z","checkTimeEt":"08/28 19:59","death":2698,"hospitalized":7765,"dateChecked":"2020-08-28T23:59:00Z","totalTestsViral":934035,"positiveTestsViral":150585,"negativeTestsViral":783450,"positiveCasesViral":115661,"deathConfirmed":2563,"deathProbable":135,"totalTestEncountersViral":null,"totalTestsPeopleViral":null,"totalTestsAntibody":62717,"positiveTestsAntibody":5173,"negativeTestsAntibody":57544,"totalTestsPeopleAntibody":null,"positiveTestsPeopleAntibody":null,"negativeTestsPeopleAntibody":null,"totalTestsPeopleAntigen":null,"positiveTestsPeopleAntigen":null,"totalTestsAntigen":null,"positiveTestsAntigen":null,"fips":"45","positiveIncrease":1298,"negativeIncrease":7816,"total":935623,"totalTestResultsIncrease":9114,"posNeg":935623,"deathIncrease":43,"hospitalizedIncrease":167,"hash":"423ecd0403137fde7c4f30b0f85f4925273a711f","commercialScore":0,"negativeRegularScore":0,"negativeScore":0,"positiveScore":0,"score":0,"grade":""},{"date":20200828,"state":"SC","positive":115951,"probableCases":1551,"negative":810558,"pending":null,"totalTestResultsSource":"posNeg","totalTestResults":926509,"hospitalizedCurrently":979,"hospitalizedCumulative":7598,"inIcuCurrently":246,"inIcuCumulative":null,"onVentilatorCurrently":146,"onVentilatorCumulative":null,"recovered":51431,"dataQualityGrade":"A+","lastUpdateEt":"8/27/2020 23:59","dateModified":"2020-08-27T23:59:00Z","checkTimeEt":"08/27 19:59","death":2655,"hospitalized":7598,"dateChecked":"2020-08-27T23:59:00Z","totalTestsViral":924958,"positiveTestsViral":149006,"negativeTestsViral":775952,"positiveCasesViral":114400,"deathConfirmed":2521,"deathProbable":134,"totalTestEncountersViral":null,"totalTestsPeopleViral":null,"totalTestsAntibody":62412,"positiveTestsAntibody":5104,"negativeTestsAntibody":57308,"totalTestsPeopleAntibody":null,"positiveTestsPeopleAntibody":null,"negativeTestsPeopleAntibody":null,"totalTestsPeopleAntigen":null,"positiveTestsPeopleAntigen":null,"totalTestsAntigen":null,"positiveTestsAntigen":null,"fips":"45","positiveIncrease":1353,"negativeIncrease":7137,"total":926509,"totalTestResultsIncrease":8490,"posNeg":926509,"deathIncrease":27,"hospitalizedIncrease":0,"hash":"48ada389a3f70ab3c852bcf9f367d9de4128f8b5","commercialScore":0,"negativeRegularScore":0,"negativeScore":0,"positiveScore":0,"score":0,"grade":""},{"date":20200827,"state":"SC","positive":114598,"probableCases":1491,"negative":803421,"pending":null,"totalTestResultsSource":"posNeg","totalTestResults":918019,"hospitalizedCurrently":1006,"hospitalizedCumulative":7598,"inIcuCurrently":262,"inIcuCumulative":null,"onVentilatorCurrently":144,"onVentilatorCumulative":null,"recovered":51431,"dataQualityGrade":"A+","lastUpdateEt":"8/26/2020 23:59","dateModified":"2020-08-26T23:59:00Z","checkTimeEt":"08/26 19:59","death":2628,"hospitalized":7598,"dateChecked":"2020-08-26T23:59:00Z","totalTestsViral":916528,"positiveTestsViral":147758,"negativeTestsViral":768770,"positiveCasesViral":113107,"deathConfirmed":2494,"deathProbable":134,"totalTestEncountersViral":null,"totalTestsPeopleViral":null,"totalTestsAntibody":62032,"positiveTestsAntibody":5026,"negativeTestsAntibody":57006,"totalTestsPeopleAntibody":null,"positiveTestsPeopleAntibody":null,"negativeTestsPeopleAntibody":null,"totalTestsPeopleAntigen":null,"positiveTestsPeopleAntigen":null,"totalTestsAntigen":null,"positiveTestsAntigen":null,"fips":"45","positiveIncrease":505,"negativeIncrease":7435,"total":918019,"totalTestResultsIncrease":7940,"posNeg":918019,"deathIncrease":55,"hospitalizedIncrease":0,"hash":"c956d23dd99ddfbc4704027be538d042fc702743","commercialScore":0,"negativeRegularScore":0,"negativeScore":0,"positiveScore":0,"score":0,"grade":""},{"date":20200826,"state":"SC","positive":114093,"probableCases":1450,"negative":795986,"pending":null,"totalTestResultsSource":"posNeg","totalTestResults":910079,"hospitalizedCurrently":1058,"hospitalizedCumulative":7598,"inIcuCurrently":268,"inIcuCumulative":null,"onVentilatorCurrently":156,"onVentilatorCumulative":null,"recovered":51431,"dataQualityGrade":"A+","lastUpdateEt":"8/25/2020 23:59","dateModified":"2020-08-25T23:59:00Z","checkTimeEt":"08/25 19:59","death":2573,"hospitalized":7598,"dateChecked":"2020-08-25T23:59:00Z","totalTestsViral":908629,"positiveTestsViral":146616,"negativeTestsViral":762013,"positiveCasesViral":112643,"deathConfirmed":2451,"deathProbable":122,"totalTestEncountersViral":null,"totalTestsPeopleViral":null,"totalTestsAntibody":61651,"positiveTestsAntibody":4949,"negativeTestsAntibody":56702,"totalTestsPeopleAntibody":null,"positiveTestsPeopleAntibody":null,"negativeTestsPeopleAntibody":null,"totalTestsPeopleAntigen":null,"positiveTestsPeopleAntigen":null,"totalTestsAntigen":null,"positiveTestsAntigen":null,"fips":"45","positiveIncrease":605,"negativeIncrease":3367,"total":910079,"totalTestResultsIncrease":3972,"posNeg":910079,"deathIncrease":44,"hospitalizedIncrease":0,"hash":"f6992114aefd63ecf4687405c052e4946ab261a1","commercialScore":0,"negativeRegularScore":0,"negativeScore":0,"positiveScore":0,"score":0,"grade":""},{"date":20200825,"state":"SC","positive":113488,"probableCases":1400,"negative":792619,"pending":null,"totalTestResultsSource":"posNeg","totalTestResults":906107,"hospitalizedCurrently":1025,"hospitalizedCumulative":7598,"inIcuCurrently":261,"inIcuCumulative":null,"onVentilatorCurrently":144,"onVentilatorCumulative":null,"recovered":51431,"dataQualityGrade":"A+","lastUpdateEt":"8/24/2020 23:59","dateModified":"2020-08-24T23:59:00Z","checkTimeEt":"08/24 19:59","death":2529,"hospitalized":7598,"dateChecked":"2020-08-24T23:59:00Z","totalTestsViral":904707,"positiveTestsViral":145798,"negativeTestsViral":758909,"positiveCasesViral":112088,"deathConfirmed":2408,"deathProbable":121,"totalTestEncountersViral":null,"totalTestsPeopleViral":null,"totalTestsAntibody":61524,"positiveTestsAntibody":4920,"negativeTestsAntibody":56604,"totalTestsPeopleAntibody":null,"positiveTestsPeopleAntibody":null,"negativeTestsPeopleAntibody":null,"totalTestsPeopleAntigen":null,"positiveTestsPeopleAntigen":null,"totalTestsAntigen":null,"positiveTestsAntigen":null,"fips":"45","positiveIncrease":937,"negativeIncrease":8693,"total":906107,"totalTestResultsIncrease":9630,"posNeg":906107,"deathIncrease":18,"hospitalizedIncrease":159,"hash":"ff53b54bd71d8ce80da61ff01d5fd88e0e94791c","commercialScore":0,"negativeRegularScore":0,"negativeScore":0,"positiveScore":0,"score":0,"grade":""},{"date":20200824,"state":"SC","positive":112551,"probableCases":1349,"negative":783926,"pending":null,"totalTestResultsSource":"posNeg","totalTestResults":896477,"hospitalizedCurrently":979,"hospitalizedCumulative":7439,"inIcuCurrently":248,"inIcuCumulative":null,"onVentilatorCurrently":148,"onVentilatorCumulative":null,"recovered":46118,"dataQualityGrade":"A+","lastUpdateEt":"8/23/2020 23:59","dateModified":"2020-08-23T23:59:00Z","checkTimeEt":"08/23 19:59","death":2511,"hospitalized":7439,"dateChecked":"2020-08-23T23:59:00Z","totalTestsViral":895128,"positiveTestsViral":144128,"negativeTestsViral":751000,"positiveCasesViral":111202,"deathConfirmed":2387,"deathProbable":124,"totalTestEncountersViral":null,"totalTestsPeopleViral":null,"totalTestsAntibody":61338,"positiveTestsAntibody":4861,"negativeTestsAntibody":56477,"totalTestsPeopleAntibody":null,"positiveTestsPeopleAntibody":null,"negativeTestsPeopleAntibody":null,"totalTestsPeopleAntigen":null,"positiveTestsPeopleAntigen":null,"totalTestsAntigen":null,"positiveTestsAntigen":null,"fips":"45","positiveIncrease":563,"negativeIncrease":3578,"total":896477,"totalTestResultsIncrease":4141,"posNeg":896477,"deathIncrease":7,"hospitalizedIncrease":0,"hash":"6dc2fd009cad9c8b9a245e9dc956e6535836df36","commercialScore":0,"negativeRegularScore":0,"negativeScore":0,"positiveScore":0,"score":0,"grade":""},{"date":20200823,"state":"SC","positive":111988,"probableCases":1330,"negative":780348,"pending":null,"totalTestResultsSource":"posNeg","totalTestResults":892336,"hospitalizedCurrently":1026,"hospitalizedCumulative":7439,"inIcuCurrently":250,"inIcuCumulative":null,"onVentilatorCurrently":150,"onVentilatorCumulative":null,"recovered":46118,"dataQualityGrade":"A+","lastUpdateEt":"8/22/2020 23:59","dateModified":"2020-08-22T23:59:00Z","checkTimeEt":"08/22 19:59","death":2504,"hospitalized":7439,"dateChecked":"2020-08-22T23:59:00Z","totalTestsViral":891006,"positiveTestsViral":143515,"negativeTestsViral":747491,"positiveCasesViral":110658,"deathConfirmed":2380,"deathProbable":124,"totalTestEncountersViral":null,"totalTestsPeopleViral":null,"totalTestsAntibody":61190,"positiveTestsAntibody":4846,"negativeTestsAntibody":56344,"totalTestsPeopleAntibody":null,"positiveTestsPeopleAntibody":null,"negativeTestsPeopleAntibody":null,"totalTestsPeopleAntigen":null,"positiveTestsPeopleAntigen":null,"totalTestsAntigen":null,"positiveTestsAntigen":null,"fips":"45","positiveIncrease":693,"negativeIncrease":-20489,"total":892336,"totalTestResultsIncrease":-19796,"posNeg":892336,"deathIncrease":11,"hospitalizedIncrease":0,"hash":"01df3da056d64671fb87b6fd83d4c525c29c7458","commercialScore":0,"negativeRegularScore":0,"negativeScore":0,"positiveScore":0,"score":0,"grade":""},{"date":20200822,"state":"SC","positive":111295,"probableCases":1333,"negative":800837,"pending":null,"totalTestResultsSource":"posNeg","totalTestResults":912132,"hospitalizedCurrently":1025,"hospitalizedCumulative":7439,"inIcuCurrently":258,"inIcuCumulative":null,"onVentilatorCurrently":155,"onVentilatorCumulative":null,"recovered":46118,"dataQualityGrade":"A+","lastUpdateEt":"8/21/2020 23:59","dateModified":"2020-08-21T23:59:00Z","checkTimeEt":"08/21 19:59","death":2493,"hospitalized":7439,"dateChecked":"2020-08-21T23:59:00Z","totalTestsViral":910799,"positiveTestsViral":147046,"negativeTestsViral":763753,"positiveCasesViral":109962,"deathConfirmed":2372,"deathProbable":121,"totalTestEncountersViral":null,"totalTestsPeopleViral":null,"totalTestsAntibody":62733,"positiveTestsAntibody":4970,"negativeTestsAntibody":57763,"totalTestsPeopleAntibody":null,"positiveTestsPeopleAntibody":null,"negativeTestsPeopleAntibody":null,"totalTestsPeopleAntigen":null,"positiveTestsPeopleAntigen":null,"totalTestsAntigen":null,"positiveTestsAntigen":null,"fips":"45","positiveIncrease":917,"negativeIncrease":8034,"total":912132,"totalTestResultsIncrease":8951,"posNeg":912132,"deathIncrease":34,"hospitalizedIncrease":0,"hash":"b6acea280f74e516cf8502b2061672f8db52f2cd","commercialScore":0,"negativeRegularScore":0,"negativeScore":0,"positiveScore":0,"score":0,"grade":""},{"date":20200821,"state":"SC","positive":110378,"probableCases":1243,"negative":792803,"pending":null,"totalTestResultsSource":"posNeg","totalTestResults":903181,"hospitalizedCurrently":1079,"hospitalizedCumulative":7439,"inIcuCurrently":278,"inIcuCumulative":null,"onVentilatorCurrently":160,"onVentilatorCumulative":null,"recovered":46118,"dataQualityGrade":"A+","lastUpdateEt":"8/20/2020 23:59","dateModified":"2020-08-20T23:59:00Z","checkTimeEt":"08/20 19:59","death":2459,"hospitalized":7439,"dateChecked":"2020-08-20T23:59:00Z","totalTestsViral":901938,"positiveTestsViral":145810,"negativeTestsViral":756128,"positiveCasesViral":109135,"deathConfirmed":2339,"deathProbable":120,"totalTestEncountersViral":null,"totalTestsPeopleViral":null,"totalTestsAntibody":62372,"positiveTestsAntibody":4894,"negativeTestsAntibody":57478,"totalTestsPeopleAntibody":null,"positiveTestsPeopleAntibody":null,"negativeTestsPeopleAntibody":null,"totalTestsPeopleAntigen":null,"positiveTestsPeopleAntigen":null,"totalTestsAntigen":null,"positiveTestsAntigen":null,"fips":"45","positiveIncrease":1058,"negativeIncrease":9323,"total":903181,"totalTestResultsIncrease":10381,"posNeg":903181,"deathIncrease":58,"hospitalizedIncrease":293,"hash":"1b5f52698f281027accac3bd1f42b701b5cade45","commercialScore":0,"negativeRegularScore":0,"negativeScore":0,"positiveScore":0,"score":0,"grade":""},{"date":20200820,"state":"SC","positive":109320,"probableCases":1174,"negative":783480,"pending":null,"totalTestResultsSource":"posNeg","totalTestResults":892800,"hospitalizedCurrently":1108,"hospitalizedCumulative":7146,"inIcuCurrently":272,"inIcuCumulative":null,"onVentilatorCurrently":170,"onVentilatorCumulative":null,"recovered":45205,"dataQualityGrade":"A+","lastUpdateEt":"8/19/2020 23:59","dateModified":"2020-08-19T23:59:00Z","checkTimeEt":"08/19 19:59","death":2401,"hospitalized":7146,"dateChecked":"2020-08-19T23:59:00Z","totalTestsViral":891626,"positiveTestsViral":144372,"negativeTestsViral":747254,"positiveCasesViral":108146,"deathConfirmed":2289,"deathProbable":112,"totalTestEncountersViral":null,"totalTestsPeopleViral":null,"totalTestsAntibody":61932,"positiveTestsAntibody":4812,"negativeTestsAntibody":57120,"totalTestsPeopleAntibody":null,"positiveTestsPeopleAntibody":null,"negativeTestsPeopleAntibody":null,"totalTestsPeopleAntigen":null,"positiveTestsPeopleAntigen":null,"totalTestsAntigen":null,"positiveTestsAntigen":null,"fips":"45","positiveIncrease":909,"negativeIncrease":7763,"total":892800,"totalTestResultsIncrease":8672,"posNeg":892800,"deathIncrease":41,"hospitalizedIncrease":0,"hash":"5caf8c8d76245246e043e85576655e72ab073fce","commercialScore":0,"negativeRegularScore":0,"negativeScore":0,"positiveScore":0,"score":0,"grade":""},{"date":20200819,"state":"SC","positive":108411,"probableCases":1137,"negative":775717,"pending":null,"totalTestResultsSource":"posNeg","totalTestResults":884128,"hospitalizedCurrently":1168,"hospitalizedCumulative":7146,"inIcuCurrently":293,"inIcuCumulative":null,"onVentilatorCurrently":164,"onVentilatorCumulative":null,"recovered":45205,"dataQualityGrade":"A+","lastUpdateEt":"8/18/2020 23:59","dateModified":"2020-08-18T23:59:00Z","checkTimeEt":"08/18 19:59","death":2360,"hospitalized":7146,"dateChecked":"2020-08-18T23:59:00Z","totalTestsViral":882991,"positiveTestsViral":142839,"negativeTestsViral":740152,"positiveCasesViral":107274,"deathConfirmed":2248,"deathProbable":112,"totalTestEncountersViral":null,"totalTestsPeopleViral":null,"totalTestsAntibody":61557,"positiveTestsAntibody":4795,"negativeTestsAntibody":56762,"totalTestsPeopleAntibody":null,"positiveTestsPeopleAntibody":null,"negativeTestsPeopleAntibody":null,"totalTestsPeopleAntigen":null,"positiveTestsPeopleAntigen":null,"totalTestsAntigen":null,"positiveTestsAntigen":null,"fips":"45","positiveIncrease":739,"negativeIncrease":4908,"total":884128,"totalTestResultsIncrease":5647,"posNeg":884128,"deathIncrease":17,"hospitalizedIncrease":0,"hash":"ac37df41d950dfe4f6220859a76bd55ba02dd979","commercialScore":0,"negativeRegularScore":0,"negativeScore":0,"positiveScore":0,"score":0,"grade":""},{"date":20200818,"state":"SC","positive":107672,"probableCases":1098,"negative":770809,"pending":null,"totalTestResultsSource":"posNeg","totalTestResults":878481,"hospitalizedCurrently":1116,"hospitalizedCumulative":7146,"inIcuCurrently":294,"inIcuCumulative":null,"onVentilatorCurrently":173,"onVentilatorCumulative":null,"recovered":45205,"dataQualityGrade":"A+","lastUpdateEt":"8/17/2020 23:59","dateModified":"2020-08-17T23:59:00Z","checkTimeEt":"08/17 19:59","death":2343,"hospitalized":7146,"dateChecked":"2020-08-17T23:59:00Z","totalTestsViral":877383,"positiveTestsViral":141827,"negativeTestsViral":735556,"positiveCasesViral":106574,"deathConfirmed":2230,"deathProbable":113,"totalTestEncountersViral":null,"totalTestsPeopleViral":null,"totalTestsAntibody":61311,"positiveTestsAntibody":4738,"negativeTestsAntibody":56573,"totalTestsPeopleAntibody":null,"positiveTestsPeopleAntibody":null,"negativeTestsPeopleAntibody":null,"totalTestsPeopleAntigen":null,"positiveTestsPeopleAntigen":null,"totalTestsAntigen":null,"positiveTestsAntigen":null,"fips":"45","positiveIncrease":719,"negativeIncrease":4215,"total":878481,"totalTestResultsIncrease":4934,"posNeg":878481,"deathIncrease":55,"hospitalizedIncrease":294,"hash":"52749f55deaf934983e3aff8fb7845f0fd7b9137","commercialScore":0,"negativeRegularScore":0,"negativeScore":0,"positiveScore":0,"score":0,"grade":""},{"date":20200817,"state":"SC","positive":106953,"probableCases":1048,"negative":766594,"pending":null,"totalTestResultsSource":"posNeg","totalTestResults":873547,"hospitalizedCurrently":1101,"hospitalizedCumulative":6852,"inIcuCurrently":282,"inIcuCumulative":null,"onVentilatorCurrently":175,"onVentilatorCumulative":null,"recovered":42730,"dataQualityGrade":"A+","lastUpdateEt":"8/16/2020 23:59","dateModified":"2020-08-16T23:59:00Z","checkTimeEt":"08/16 19:59","death":2288,"hospitalized":6852,"dateChecked":"2020-08-16T23:59:00Z","totalTestsViral":872499,"positiveTestsViral":140812,"negativeTestsViral":731687,"positiveCasesViral":105905,"deathConfirmed":2185,"deathProbable":103,"totalTestEncountersViral":null,"totalTestsPeopleViral":null,"totalTestsAntibody":61227,"positiveTestsAntibody":4722,"negativeTestsAntibody":56505,"totalTestsPeopleAntibody":null,"positiveTestsPeopleAntibody":null,"negativeTestsPeopleAntibody":null,"totalTestsPeopleAntigen":null,"positiveTestsPeopleAntigen":null,"totalTestsAntigen":null,"positiveTestsAntigen":null,"fips":"45","positiveIncrease":456,"negativeIncrease":5490,"total":873547,"totalTestResultsIncrease":5946,"posNeg":873547,"deathIncrease":19,"hospitalizedIncrease":0,"hash":"04867bee25c9c9b1788d7e50a0e6b575f9b876e3","commercialScore":0,"negativeRegularScore":0,"negativeScore":0,"positiveScore":0,"score":0,"grade":""},{"date":20200816,"state":"SC","positive":106497,"probableCases":1031,"negative":761104,"pending":null,"totalTestResultsSource":"posNeg","totalTestResults":867601,"hospitalizedCurrently":1161,"hospitalizedCumulative":6852,"inIcuCurrently":290,"inIcuCumulative":null,"onVentilatorCurrently":188,"onVentilatorCumulative":null,"recovered":42730,"dataQualityGrade":"A+","lastUpdateEt":"8/15/2020 23:59","dateModified":"2020-08-15T23:59:00Z","checkTimeEt":"08/15 19:59","death":2269,"hospitalized":6852,"dateChecked":"2020-08-15T23:59:00Z","totalTestsViral":866570,"positiveTestsViral":140201,"negativeTestsViral":726369,"positiveCasesViral":105466,"deathConfirmed":2165,"deathProbable":104,"totalTestEncountersViral":null,"totalTestsPeopleViral":null,"totalTestsAntibody":61005,"positiveTestsAntibody":4700,"negativeTestsAntibody":56305,"totalTestsPeopleAntibody":null,"positiveTestsPeopleAntibody":null,"negativeTestsPeopleAntibody":null,"totalTestsPeopleAntigen":null,"positiveTestsPeopleAntigen":null,"totalTestsAntigen":null,"positiveTestsAntigen":null,"fips":"45","positiveIncrease":615,"negativeIncrease":6586,"total":867601,"totalTestResultsIncrease":7201,"posNeg":867601,"deathIncrease":9,"hospitalizedIncrease":0,"hash":"fdd720f352aaae35c58d3ced4e5b33c9599a0b1d","commercialScore":0,"negativeRegularScore":0,"negativeScore":0,"positiveScore":0,"score":0,"grade":""},{"date":20200815,"state":"SC","positive":105882,"probableCases":1008,"negative":754518,"pending":null,"totalTestResultsSource":"posNeg","totalTestResults":860400,"hospitalizedCurrently":1246,"hospitalizedCumulative":6852,"inIcuCurrently":311,"inIcuCumulative":null,"onVentilatorCurrently":181,"onVentilatorCumulative":null,"recovered":42730,"dataQualityGrade":"A+","lastUpdateEt":"8/14/2020 23:59","dateModified":"2020-08-14T23:59:00Z","checkTimeEt":"08/14 19:59","death":2260,"hospitalized":6852,"dateChecked":"2020-08-14T23:59:00Z","totalTestsViral":859392,"positiveTestsViral":139470,"negativeTestsViral":719922,"positiveCasesViral":104874,"deathConfirmed":2156,"deathProbable":104,"totalTestEncountersViral":null,"totalTestsPeopleViral":null,"totalTestsAntibody":60532,"positiveTestsAntibody":4640,"negativeTestsAntibody":55892,"totalTestsPeopleAntibody":null,"positiveTestsPeopleAntibody":null,"negativeTestsPeopleAntibody":null,"totalTestsPeopleAntigen":null,"positiveTestsPeopleAntigen":null,"totalTestsAntigen":null,"positiveTestsAntigen":null,"fips":"45","positiveIncrease":1041,"negativeIncrease":7575,"total":860400,"totalTestResultsIncrease":8616,"posNeg":860400,"deathIncrease":56,"hospitalizedIncrease":0,"hash":"a4a5ddadd002123af6ff0e9fe701e0d2ce26aa72","commercialScore":0,"negativeRegularScore":0,"negativeScore":0,"positiveScore":0,"score":0,"grade":""},{"date":20200814,"state":"SC","positive":104841,"probableCases":961,"negative":746943,"pending":null,"totalTestResultsSource":"posNeg","totalTestResults":851784,"hospitalizedCurrently":1296,"hospitalizedCumulative":6852,"inIcuCurrently":327,"inIcuCumulative":null,"onVentilatorCurrently":198,"onVentilatorCumulative":null,"recovered":42730,"dataQualityGrade":"A+","lastUpdateEt":"8/13/2020 23:59","dateModified":"2020-08-13T23:59:00Z","checkTimeEt":"08/13 19:59","death":2204,"hospitalized":6852,"dateChecked":"2020-08-13T23:59:00Z","totalTestsViral":850823,"positiveTestsViral":138036,"negativeTestsViral":712787,"positiveCasesViral":103880,"deathConfirmed":2106,"deathProbable":98,"totalTestEncountersViral":null,"totalTestsPeopleViral":null,"totalTestsAntibody":59917,"positiveTestsAntibody":4553,"negativeTestsAntibody":55364,"totalTestsPeopleAntibody":null,"positiveTestsPeopleAntibody":null,"negativeTestsPeopleAntibody":null,"totalTestsPeopleAntigen":null,"positiveTestsPeopleAntigen":null,"totalTestsAntigen":null,"positiveTestsAntigen":null,"fips":"45","positiveIncrease":932,"negativeIncrease":44824,"total":851784,"totalTestResultsIncrease":45756,"posNeg":851784,"deathIncrease":18,"hospitalizedIncrease":370,"hash":"b1705c10dc1cb0d51e82288c329f1f0781ac6da9","commercialScore":0,"negativeRegularScore":0,"negativeScore":0,"positiveScore":0,"score":0,"grade":""},{"date":20200813,"state":"SC","positive":103909,"probableCases":858,"negative":702119,"pending":null,"totalTestResultsSource":"posNeg","totalTestResults":806028,"hospitalizedCurrently":1322,"hospitalizedCumulative":6482,"inIcuCurrently":323,"inIcuCumulative":null,"onVentilatorCurrently":201,"onVentilatorCumulative":null,"recovered":40837,"dataQualityGrade":"A+","lastUpdateEt":"8/12/2020 23:59","dateModified":"2020-08-12T23:59:00Z","checkTimeEt":"08/12 19:59","death":2186,"hospitalized":6482,"dateChecked":"2020-08-12T23:59:00Z","totalTestsViral":805170,"positiveTestsViral":130613,"negativeTestsViral":674577,"positiveCasesViral":103051,"deathConfirmed":2089,"deathProbable":97,"totalTestEncountersViral":null,"totalTestsPeopleViral":null,"totalTestsAntibody":56730,"positiveTestsAntibody":4168,"negativeTestsAntibody":52562,"totalTestsPeopleAntibody":null,"positiveTestsPeopleAntibody":null,"negativeTestsPeopleAntibody":null,"totalTestsPeopleAntigen":null,"positiveTestsPeopleAntigen":null,"totalTestsAntigen":null,"positiveTestsAntigen":null,"fips":"45","positiveIncrease":935,"negativeIncrease":5004,"total":806028,"totalTestResultsIncrease":5939,"posNeg":806028,"deathIncrease":42,"hospitalizedIncrease":0,"hash":"3c218f9c51e0272adf5376988cc529797633bc50","commercialScore":0,"negativeRegularScore":0,"negativeScore":0,"positiveScore":0,"score":0,"grade":""},{"date":20200812,"state":"SC","positive":102974,"probableCases":831,"negative":697115,"pending":null,"totalTestResultsSource":"posNeg","totalTestResults":800089,"hospitalizedCurrently":1366,"hospitalizedCumulative":6482,"inIcuCurrently":333,"inIcuCumulative":null,"onVentilatorCurrently":206,"onVentilatorCumulative":null,"recovered":40837,"dataQualityGrade":"A+","lastUpdateEt":"8/11/2020 23:59","dateModified":"2020-08-11T23:59:00Z","checkTimeEt":"08/11 19:59","death":2144,"hospitalized":6482,"dateChecked":"2020-08-11T23:59:00Z","totalTestsViral":799258,"positiveTestsViral":129544,"negativeTestsViral":669714,"positiveCasesViral":102143,"deathConfirmed":2057,"deathProbable":87,"totalTestEncountersViral":null,"totalTestsPeopleViral":null,"totalTestsAntibody":56309,"positiveTestsAntibody":4073,"negativeTestsAntibody":52236,"totalTestsPeopleAntibody":null,"positiveTestsPeopleAntibody":null,"negativeTestsPeopleAntibody":null,"totalTestsPeopleAntigen":null,"positiveTestsPeopleAntigen":null,"totalTestsAntigen":null,"positiveTestsAntigen":null,"fips":"45","positiveIncrease":844,"negativeIncrease":2894,"total":800089,"totalTestResultsIncrease":3738,"posNeg":800089,"deathIncrease":46,"hospitalizedIncrease":0,"hash":"76f6433c7eca84549a036c3a041da5afc61cc937","commercialScore":0,"negativeRegularScore":0,"negativeScore":0,"positiveScore":0,"score":0,"grade":""},{"date":20200811,"state":"SC","positive":102130,"probableCases":770,"negative":694221,"pending":null,"totalTestResultsSource":"posNeg","totalTestResults":796351,"hospitalizedCurrently":1330,"hospitalizedCumulative":6482,"inIcuCurrently":339,"inIcuCumulative":null,"onVentilatorCurrently":207,"onVentilatorCumulative":null,"recovered":40837,"dataQualityGrade":"A+","lastUpdateEt":"8/10/2020 23:59","dateModified":"2020-08-10T23:59:00Z","checkTimeEt":"08/10 19:59","death":2098,"hospitalized":6482,"dateChecked":"2020-08-10T23:59:00Z","totalTestsViral":795581,"positiveTestsViral":128846,"negativeTestsViral":666735,"positiveCasesViral":101360,"deathConfirmed":2012,"deathProbable":86,"totalTestEncountersViral":null,"totalTestsPeopleViral":null,"totalTestsAntibody":56148,"positiveTestsAntibody":4049,"negativeTestsAntibody":52099,"totalTestsPeopleAntibody":null,"positiveTestsPeopleAntibody":null,"negativeTestsPeopleAntibody":null,"totalTestsPeopleAntigen":null,"positiveTestsPeopleAntigen":null,"totalTestsAntigen":null,"positiveTestsAntigen":null,"fips":"45","positiveIncrease":971,"negativeIncrease":3750,"total":796351,"totalTestResultsIncrease":4721,"posNeg":796351,"deathIncrease":49,"hospitalizedIncrease":329,"hash":"5325c989c0c0f931e8467f7dfdfc18b37e4f888c","commercialScore":0,"negativeRegularScore":0,"negativeScore":0,"positiveScore":0,"score":0,"grade":""},{"date":20200810,"state":"SC","positive":101159,"probableCases":728,"negative":690471,"pending":null,"totalTestResultsSource":"posNeg","totalTestResults":791630,"hospitalizedCurrently":1353,"hospitalizedCumulative":6153,"inIcuCurrently":360,"inIcuCumulative":null,"onVentilatorCurrently":217,"onVentilatorCumulative":null,"recovered":37798,"dataQualityGrade":"A+","lastUpdateEt":"8/9/2020 23:59","dateModified":"2020-08-09T23:59:00Z","checkTimeEt":"08/09 19:59","death":2049,"hospitalized":6153,"dateChecked":"2020-08-09T23:59:00Z","totalTestsViral":790902,"positiveTestsViral":127842,"negativeTestsViral":663060,"positiveCasesViral":100431,"deathConfirmed":1966,"deathProbable":83,"totalTestEncountersViral":null,"totalTestsPeopleViral":null,"totalTestsAntibody":56070,"positiveTestsAntibody":4035,"negativeTestsAntibody":52035,"totalTestsPeopleAntibody":null,"positiveTestsPeopleAntibody":null,"negativeTestsPeopleAntibody":null,"totalTestsPeopleAntigen":null,"positiveTestsPeopleAntigen":null,"totalTestsAntigen":null,"positiveTestsAntigen":null,"fips":"45","positiveIncrease":724,"negativeIncrease":4922,"total":791630,"totalTestResultsIncrease":5646,"posNeg":791630,"deathIncrease":18,"hospitalizedIncrease":0,"hash":"a583eaa8875a980780b93ab2081322458fc42c2d","commercialScore":0,"negativeRegularScore":0,"negativeScore":0,"positiveScore":0,"score":0,"grade":""},{"date":20200809,"state":"SC","positive":100435,"probableCases":722,"negative":685549,"pending":null,"totalTestResultsSource":"posNeg","totalTestResults":785984,"hospitalizedCurrently":1378,"hospitalizedCumulative":6153,"inIcuCurrently":365,"inIcuCumulative":null,"onVentilatorCurrently":219,"onVentilatorCumulative":null,"recovered":37798,"dataQualityGrade":"A+","lastUpdateEt":"8/8/2020 23:59","dateModified":"2020-08-08T23:59:00Z","checkTimeEt":"08/08 19:59","death":2031,"hospitalized":6153,"dateChecked":"2020-08-08T23:59:00Z","totalTestsViral":785262,"positiveTestsViral":127056,"negativeTestsViral":658206,"positiveCasesViral":99713,"deathConfirmed":1949,"deathProbable":82,"totalTestEncountersViral":null,"totalTestsPeopleViral":null,"totalTestsAntibody":55882,"positiveTestsAntibody":4011,"negativeTestsAntibody":51871,"totalTestsPeopleAntibody":null,"positiveTestsPeopleAntibody":null,"negativeTestsPeopleAntibody":null,"totalTestsPeopleAntigen":null,"positiveTestsPeopleAntigen":null,"totalTestsAntigen":null,"positiveTestsAntigen":null,"fips":"45","positiveIncrease":975,"negativeIncrease":6934,"total":785984,"totalTestResultsIncrease":7909,"posNeg":785984,"deathIncrease":24,"hospitalizedIncrease":0,"hash":"e785328824e62dc3dcd0539ee3e7661c42e819b6","commercialScore":0,"negativeRegularScore":0,"negativeScore":0,"positiveScore":0,"score":0,"grade":""},{"date":20200808,"state":"SC","positive":99460,"probableCases":717,"negative":678615,"pending":null,"totalTestResultsSource":"posNeg","totalTestResults":778075,"hospitalizedCurrently":1402,"hospitalizedCumulative":6153,"inIcuCurrently":357,"inIcuCumulative":null,"onVentilatorCurrently":234,"onVentilatorCumulative":null,"recovered":37798,"dataQualityGrade":"A+","lastUpdateEt":"8/7/2020 23:59","dateModified":"2020-08-07T23:59:00Z","checkTimeEt":"08/07 19:59","death":2007,"hospitalized":6153,"dateChecked":"2020-08-07T23:59:00Z","totalTestsViral":777358,"positiveTestsViral":126005,"negativeTestsViral":651353,"positiveCasesViral":98743,"deathConfirmed":1931,"deathProbable":76,"totalTestEncountersViral":null,"totalTestsPeopleViral":null,"totalTestsAntibody":55713,"positiveTestsAntibody":3993,"negativeTestsAntibody":51720,"totalTestsPeopleAntibody":null,"positiveTestsPeopleAntibody":null,"negativeTestsPeopleAntibody":null,"totalTestsPeopleAntigen":null,"positiveTestsPeopleAntigen":null,"totalTestsAntigen":null,"positiveTestsAntigen":null,"fips":"45","positiveIncrease":1241,"negativeIncrease":8873,"total":778075,"totalTestResultsIncrease":10114,"posNeg":778075,"deathIncrease":45,"hospitalizedIncrease":0,"hash":"5f0bbd17397b117d6e2cf023035eee3c1e1a5568","commercialScore":0,"negativeRegularScore":0,"negativeScore":0,"positiveScore":0,"score":0,"grade":""},{"date":20200807,"state":"SC","positive":98219,"probableCases":665,"negative":669742,"pending":null,"totalTestResultsSource":"posNeg","totalTestResults":767961,"hospitalizedCurrently":1415,"hospitalizedCumulative":6153,"inIcuCurrently":358,"inIcuCumulative":null,"onVentilatorCurrently":231,"onVentilatorCumulative":null,"recovered":37798,"dataQualityGrade":"A+","lastUpdateEt":"8/6/2020 23:59","dateModified":"2020-08-06T23:59:00Z","checkTimeEt":"08/06 19:59","death":1962,"hospitalized":6153,"dateChecked":"2020-08-06T23:59:00Z","totalTestsViral":767296,"positiveTestsViral":124324,"negativeTestsViral":642972,"positiveCasesViral":97554,"deathConfirmed":1883,"deathProbable":79,"totalTestEncountersViral":null,"totalTestsPeopleViral":null,"totalTestsAntibody":55182,"positiveTestsAntibody":3905,"negativeTestsAntibody":51277,"totalTestsPeopleAntibody":null,"positiveTestsPeopleAntibody":null,"negativeTestsPeopleAntibody":null,"totalTestsPeopleAntigen":null,"positiveTestsPeopleAntigen":null,"totalTestsAntigen":null,"positiveTestsAntigen":null,"fips":"45","positiveIncrease":1422,"negativeIncrease":10394,"total":767961,"totalTestResultsIncrease":11816,"posNeg":767961,"deathIncrease":19,"hospitalizedIncrease":354,"hash":"98c34b047b1db96175592de753c7630675094414","commercialScore":0,"negativeRegularScore":0,"negativeScore":0,"positiveScore":0,"score":0,"grade":""},{"date":20200806,"state":"SC","positive":96797,"probableCases":665,"negative":659348,"pending":null,"totalTestResultsSource":"posNeg","totalTestResults":756145,"hospitalizedCurrently":1492,"hospitalizedCumulative":5799,"inIcuCurrently":356,"inIcuCumulative":null,"onVentilatorCurrently":276,"onVentilatorCumulative":null,"recovered":32859,"dataQualityGrade":"A+","lastUpdateEt":"8/5/2020 23:59","dateModified":"2020-08-05T23:59:00Z","checkTimeEt":"08/05 19:59","death":1943,"hospitalized":5799,"dateChecked":"2020-08-05T23:59:00Z","totalTestsViral":755480,"positiveTestsViral":122278,"negativeTestsViral":633202,"positiveCasesViral":96132,"deathConfirmed":1863,"deathProbable":80,"totalTestEncountersViral":null,"totalTestsPeopleViral":null,"totalTestsAntibody":54487,"positiveTestsAntibody":3761,"negativeTestsAntibody":50726,"totalTestsPeopleAntibody":null,"positiveTestsPeopleAntibody":null,"negativeTestsPeopleAntibody":null,"totalTestsPeopleAntigen":null,"positiveTestsPeopleAntigen":null,"totalTestsAntigen":null,"positiveTestsAntigen":null,"fips":"45","positiveIncrease":1325,"negativeIncrease":6198,"total":756145,"totalTestResultsIncrease":7523,"posNeg":756145,"deathIncrease":49,"hospitalizedIncrease":0,"hash":"43c95d94739b831165773615336c515b0f47715c","commercialScore":0,"negativeRegularScore":0,"negativeScore":0,"positiveScore":0,"score":0,"grade":""},{"date":20200805,"state":"SC","positive":95472,"probableCases":635,"negative":653150,"pending":null,"totalTestResultsSource":"posNeg","totalTestResults":748622,"hospitalizedCurrently":1469,"hospitalizedCumulative":5799,"inIcuCurrently":363,"inIcuCumulative":null,"onVentilatorCurrently":270,"onVentilatorCumulative":null,"recovered":32859,"dataQualityGrade":"A+","lastUpdateEt":"8/4/2020 23:59","dateModified":"2020-08-04T23:59:00Z","checkTimeEt":"08/04 19:59","death":1894,"hospitalized":5799,"dateChecked":"2020-08-04T23:59:00Z","totalTestsViral":747987,"positiveTestsViral":120715,"negativeTestsViral":627272,"positiveCasesViral":94837,"deathConfirmed":1819,"deathProbable":75,"totalTestEncountersViral":null,"totalTestsPeopleViral":null,"totalTestsAntibody":54232,"positiveTestsAntibody":3736,"negativeTestsAntibody":50496,"totalTestsPeopleAntibody":null,"positiveTestsPeopleAntibody":null,"negativeTestsPeopleAntibody":null,"totalTestsPeopleAntigen":null,"positiveTestsPeopleAntigen":null,"totalTestsAntigen":null,"positiveTestsAntigen":null,"fips":"45","positiveIncrease":1282,"negativeIncrease":6883,"total":748622,"totalTestResultsIncrease":8165,"posNeg":748622,"deathIncrease":47,"hospitalizedIncrease":0,"hash":"41269556d95c7bc102b2bd101d8d97bcd94d78e2","commercialScore":0,"negativeRegularScore":0,"negativeScore":0,"positiveScore":0,"score":0,"grade":""},{"date":20200804,"state":"SC","positive":94190,"probableCases":586,"negative":646267,"pending":null,"totalTestResultsSource":"posNeg","totalTestResults":740457,"hospitalizedCurrently":1458,"hospitalizedCumulative":5799,"inIcuCurrently":355,"inIcuCumulative":null,"onVentilatorCurrently":254,"onVentilatorCumulative":null,"recovered":32859,"dataQualityGrade":"A+","lastUpdateEt":"8/3/2020 23:59","dateModified":"2020-08-03T23:59:00Z","checkTimeEt":"08/03 19:59","death":1847,"hospitalized":5799,"dateChecked":"2020-08-03T23:59:00Z","totalTestsViral":739871,"positiveTestsViral":118989,"negativeTestsViral":620882,"positiveCasesViral":93604,"deathConfirmed":1774,"deathProbable":73,"totalTestEncountersViral":null,"totalTestsPeopleViral":null,"totalTestsAntibody":54061,"positiveTestsAntibody":3683,"negativeTestsAntibody":50378,"totalTestsPeopleAntibody":null,"positiveTestsPeopleAntibody":null,"negativeTestsPeopleAntibody":null,"totalTestsPeopleAntigen":null,"positiveTestsPeopleAntigen":null,"totalTestsAntigen":null,"positiveTestsAntigen":null,"fips":"45","positiveIncrease":1239,"negativeIncrease":7543,"total":740457,"totalTestResultsIncrease":8782,"posNeg":740457,"deathIncrease":54,"hospitalizedIncrease":272,"hash":"9bfa89fda6a68ffe90180b3c36e113f1e3c643b8","commercialScore":0,"negativeRegularScore":0,"negativeScore":0,"positiveScore":0,"score":0,"grade":""},{"date":20200803,"state":"SC","positive":92951,"probableCases":547,"negative":638724,"pending":null,"totalTestResultsSource":"posNeg","totalTestResults":731675,"hospitalizedCurrently":1401,"hospitalizedCumulative":5527,"inIcuCurrently":366,"inIcuCumulative":null,"onVentilatorCurrently":224,"onVentilatorCumulative":null,"recovered":32859,"dataQualityGrade":"A+","lastUpdateEt":"8/2/2020 23:59","dateModified":"2020-08-02T23:59:00Z","checkTimeEt":"08/02 19:59","death":1793,"hospitalized":5527,"dateChecked":"2020-08-02T23:59:00Z","totalTestsViral":731675,"positiveTestsViral":117336,"negativeTestsViral":614339,"positiveCasesViral":92404,"deathConfirmed":1721,"deathProbable":72,"totalTestEncountersViral":null,"totalTestsPeopleViral":null,"totalTestsAntibody":53960,"positiveTestsAntibody":3671,"negativeTestsAntibody":50289,"totalTestsPeopleAntibody":null,"positiveTestsPeopleAntibody":null,"negativeTestsPeopleAntibody":null,"totalTestsPeopleAntigen":null,"positiveTestsPeopleAntigen":null,"totalTestsAntigen":null,"positiveTestsAntigen":null,"fips":"45","positiveIncrease":1163,"negativeIncrease":8255,"total":731675,"totalTestResultsIncrease":9418,"posNeg":731675,"deathIncrease":16,"hospitalizedIncrease":0,"hash":"180801274de822c369148f35306d846d118c6291","commercialScore":0,"negativeRegularScore":0,"negativeScore":0,"positiveScore":0,"score":0,"grade":""},{"date":20200802,"state":"SC","positive":91788,"probableCases":531,"negative":630469,"pending":null,"totalTestResultsSource":"posNeg","totalTestResults":722257,"hospitalizedCurrently":1427,"hospitalizedCumulative":5527,"inIcuCurrently":365,"inIcuCumulative":null,"onVentilatorCurrently":230,"onVentilatorCumulative":null,"recovered":32859,"dataQualityGrade":"A+","lastUpdateEt":"8/1/2020 23:59","dateModified":"2020-08-01T23:59:00Z","checkTimeEt":"08/01 19:59","death":1777,"hospitalized":5527,"dateChecked":"2020-08-01T23:59:00Z","totalTestsViral":721726,"positiveTestsViral":115794,"negativeTestsViral":605932,"positiveCasesViral":91257,"deathConfirmed":1709,"deathProbable":68,"totalTestEncountersViral":null,"totalTestsPeopleViral":null,"totalTestsAntibody":53637,"positiveTestsAntibody":3635,"negativeTestsAntibody":50002,"totalTestsPeopleAntibody":null,"positiveTestsPeopleAntibody":null,"negativeTestsPeopleAntibody":null,"totalTestsPeopleAntigen":null,"positiveTestsPeopleAntigen":null,"totalTestsAntigen":null,"positiveTestsAntigen":null,"fips":"45","positiveIncrease":1189,"negativeIncrease":9199,"total":722257,"totalTestResultsIncrease":10388,"posNeg":722257,"deathIncrease":26,"hospitalizedIncrease":0,"hash":"fd8a1e385cc0413effaf19a388f81aa7eff1f284","commercialScore":0,"negativeRegularScore":0,"negativeScore":0,"positiveScore":0,"score":0,"grade":""},{"date":20200801,"state":"SC","positive":90599,"probableCases":523,"negative":621270,"pending":null,"totalTestResultsSource":"posNeg","totalTestResults":711869,"hospitalizedCurrently":1453,"hospitalizedCumulative":5527,"inIcuCurrently":359,"inIcuCumulative":null,"onVentilatorCurrently":235,"onVentilatorCumulative":null,"recovered":32859,"dataQualityGrade":"A+","lastUpdateEt":"7/31/2020 23:59","dateModified":"2020-07-31T23:59:00Z","checkTimeEt":"07/31 19:59","death":1751,"hospitalized":5527,"dateChecked":"2020-07-31T23:59:00Z","totalTestsViral":711346,"positiveTestsViral":114251,"negativeTestsViral":597095,"positiveCasesViral":90076,"deathConfirmed":1683,"deathProbable":68,"totalTestEncountersViral":null,"totalTestsPeopleViral":null,"totalTestsAntibody":53233,"positiveTestsAntibody":3557,"negativeTestsAntibody":49676,"totalTestsPeopleAntibody":null,"positiveTestsPeopleAntibody":null,"negativeTestsPeopleAntibody":null,"totalTestsPeopleAntigen":null,"positiveTestsPeopleAntigen":null,"totalTestsAntigen":null,"positiveTestsAn