[{"date":20201106,"state":"IA","positive":133510,"probableCases":null,"negative":788507,"pending":null,"totalTestResultsSource":"posNeg","totalTestResults":922017,"hospitalizedCurrently":912,"hospitalizedCumulative":null,"inIcuCurrently":188,"inIcuCumulative":null,"onVentilatorCurrently":67,"onVentilatorCumulative":null,"recovered":99243,"dataQualityGrade":"A+","lastUpdateEt":"11/6/2020 00:00","dateModified":"2020-11-06T24:00:00Z","checkTimeEt":"11/05 19:00","death":1818,"hospitalized":null,"dateChecked":"2020-11-06T24:00:00Z","totalTestsViral":null,"positiveTestsViral":null,"negativeTestsViral":null,"positiveCasesViral":133510,"deathConfirmed":null,"deathProbable":null,"totalTestEncountersViral":null,"totalTestsPeopleViral":923705,"totalTestsAntibody":null,"positiveTestsAntibody":null,"negativeTestsAntibody":null,"totalTestsPeopleAntibody":68582,"positiveTestsPeopleAntibody":3987,"negativeTestsPeopleAntibody":64555,"totalTestsPeopleAntigen":90450,"positiveTestsPeopleAntigen":11106,"totalTestsAntigen":null,"positiveTestsAntigen":null,"fips":"19","positiveIncrease":2778,"negativeIncrease":2835,"total":922017,"totalTestResultsIncrease":5613,"posNeg":922017,"deathIncrease":16,"hospitalizedIncrease":0,"hash":"e0bba8ee222c0d24eab211b20a439dc41ed06020","commercialScore":0,"negativeRegularScore":0,"negativeScore":0,"positiveScore":0,"score":0,"grade":""},{"date":20201105,"state":"IA","positive":130732,"probableCases":null,"negative":785672,"pending":null,"totalTestResultsSource":"posNeg","totalTestResults":916404,"hospitalizedCurrently":839,"hospitalizedCumulative":null,"inIcuCurrently":188,"inIcuCumulative":null,"onVentilatorCurrently":60,"onVentilatorCumulative":null,"recovered":98037,"dataQualityGrade":"A+","lastUpdateEt":"11/5/2020 00:00","dateModified":"2020-11-05T24:00:00Z","checkTimeEt":"11/04 19:00","death":1802,"hospitalized":null,"dateChecked":"2020-11-05T24:00:00Z","totalTestsViral":null,"positiveTestsViral":null,"negativeTestsViral":null,"positiveCasesViral":130732,"deathConfirmed":null,"deathProbable":null,"totalTestEncountersViral":null,"totalTestsPeopleViral":918096,"totalTestsAntibody":null,"positiveTestsAntibody":null,"negativeTestsAntibody":null,"totalTestsPeopleAntibody":68349,"positiveTestsPeopleAntibody":3970,"negativeTestsPeopleAntibody":64339,"totalTestsPeopleAntigen":88445,"positiveTestsPeopleAntigen":10502,"totalTestsAntigen":null,"positiveTestsAntigen":null,"fips":"19","positiveIncrease":3992,"negativeIncrease":4358,"total":916404,"totalTestResultsIncrease":8350,"posNeg":916404,"deathIncrease":15,"hospitalizedIncrease":0,"hash":"7d3ca86e286eec2d0e0c7b57f0f3729ac384dc2c","commercialScore":0,"negativeRegularScore":0,"negativeScore":0,"positiveScore":0,"score":0,"grade":""},{"date":20201104,"state":"IA","positive":126740,"probableCases":null,"negative":781314,"pending":null,"totalTestResultsSource":"posNeg","totalTestResults":908054,"hospitalizedCurrently":777,"hospitalizedCumulative":null,"inIcuCurrently":182,"inIcuCumulative":null,"onVentilatorCurrently":63,"onVentilatorCumulative":null,"recovered":96753,"dataQualityGrade":"A+","lastUpdateEt":"11/4/2020 00:00","dateModified":"2020-11-04T24:00:00Z","checkTimeEt":"11/03 19:00","death":1787,"hospitalized":null,"dateChecked":"2020-11-04T24:00:00Z","totalTestsViral":null,"positiveTestsViral":null,"negativeTestsViral":null,"positiveCasesViral":126740,"deathConfirmed":null,"deathProbable":null,"totalTestEncountersViral":null,"totalTestsPeopleViral":909756,"totalTestsAntibody":null,"positiveTestsAntibody":null,"negativeTestsAntibody":null,"totalTestsPeopleAntibody":68036,"positiveTestsPeopleAntibody":3952,"negativeTestsPeopleAntibody":64044,"totalTestsPeopleAntigen":86091,"positiveTestsPeopleAntigen":9782,"totalTestsAntigen":null,"positiveTestsAntigen":null,"fips":"19","positiveIncrease":2276,"negativeIncrease":2642,"total":908054,"totalTestResultsIncrease":4918,"posNeg":908054,"deathIncrease":24,"hospitalizedIncrease":0,"hash":"e9582a0d97da43c3e3c2c8d5bdd5f7d5872c6e76","commercialScore":0,"negativeRegularScore":0,"negativeScore":0,"positiveScore":0,"score":0,"grade":""},{"date":20201103,"state":"IA","positive":124464,"probableCases":null,"negative":778672,"pending":null,"totalTestResultsSource":"posNeg","totalTestResults":903136,"hospitalizedCurrently":730,"hospitalizedCumulative":null,"inIcuCurrently":170,"inIcuCumulative":null,"onVentilatorCurrently":59,"onVentilatorCumulative":null,"recovered":95500,"dataQualityGrade":"A+","lastUpdateEt":"11/3/2020 00:00","dateModified":"2020-11-03T24:00:00Z","checkTimeEt":"11/02 19:00","death":1763,"hospitalized":null,"dateChecked":"2020-11-03T24:00:00Z","totalTestsViral":null,"positiveTestsViral":null,"negativeTestsViral":null,"positiveCasesViral":124464,"deathConfirmed":null,"deathProbable":null,"totalTestEncountersViral":null,"totalTestsPeopleViral":904836,"totalTestsAntibody":null,"positiveTestsAntibody":null,"negativeTestsAntibody":null,"totalTestsPeopleAntibody":67791,"positiveTestsPeopleAntibody":3938,"negativeTestsPeopleAntibody":63813,"totalTestsPeopleAntigen":84206,"positiveTestsPeopleAntigen":9145,"totalTestsAntigen":null,"positiveTestsAntigen":null,"fips":"19","positiveIncrease":1092,"negativeIncrease":1050,"total":903136,"totalTestResultsIncrease":2142,"posNeg":903136,"deathIncrease":22,"hospitalizedIncrease":0,"hash":"92ec04b688f55fa119fe3af55a5ff7cd427d3d5b","commercialScore":0,"negativeRegularScore":0,"negativeScore":0,"positiveScore":0,"score":0,"grade":""},{"date":20201102,"state":"IA","positive":123372,"probableCases":null,"negative":777622,"pending":null,"totalTestResultsSource":"posNeg","totalTestResults":900994,"hospitalizedCurrently":718,"hospitalizedCumulative":null,"inIcuCurrently":156,"inIcuCumulative":null,"onVentilatorCurrently":57,"onVentilatorCumulative":null,"recovered":93943,"dataQualityGrade":"A+","lastUpdateEt":"11/2/2020 00:00","dateModified":"2020-11-02T24:00:00Z","checkTimeEt":"11/01 19:00","death":1741,"hospitalized":null,"dateChecked":"2020-11-02T24:00:00Z","totalTestsViral":null,"positiveTestsViral":null,"negativeTestsViral":null,"positiveCasesViral":123372,"deathConfirmed":null,"deathProbable":null,"totalTestEncountersViral":null,"totalTestsPeopleViral":902681,"totalTestsAntibody":null,"positiveTestsAntibody":null,"negativeTestsAntibody":null,"totalTestsPeopleAntibody":67608,"positiveTestsPeopleAntibody":3921,"negativeTestsPeopleAntibody":63647,"totalTestsPeopleAntigen":82806,"positiveTestsPeopleAntigen":8741,"totalTestsAntigen":null,"positiveTestsAntigen":null,"fips":"19","positiveIncrease":1405,"negativeIncrease":2414,"total":900994,"totalTestResultsIncrease":3819,"posNeg":900994,"deathIncrease":24,"hospitalizedIncrease":0,"hash":"03249df76e6083257440966a16356cae79413bff","commercialScore":0,"negativeRegularScore":0,"negativeScore":0,"positiveScore":0,"score":0,"grade":""},{"date":20201101,"state":"IA","positive":121967,"probableCases":null,"negative":775208,"pending":null,"totalTestResultsSource":"posNeg","totalTestResults":897175,"hospitalizedCurrently":718,"hospitalizedCumulative":null,"inIcuCurrently":156,"inIcuCumulative":null,"onVentilatorCurrently":57,"onVentilatorCumulative":null,"recovered":93522,"dataQualityGrade":"A+","lastUpdateEt":"11/1/2020 00:00","dateModified":"2020-11-01T24:00:00Z","checkTimeEt":"10/31 20:00","death":1717,"hospitalized":null,"dateChecked":"2020-11-01T24:00:00Z","totalTestsViral":null,"positiveTestsViral":null,"negativeTestsViral":null,"positiveCasesViral":121967,"deathConfirmed":null,"deathProbable":null,"totalTestEncountersViral":null,"totalTestsPeopleViral":898851,"totalTestsAntibody":null,"positiveTestsAntibody":null,"negativeTestsAntibody":null,"totalTestsPeopleAntibody":67569,"positiveTestsPeopleAntibody":3909,"negativeTestsPeopleAntibody":63620,"totalTestsPeopleAntigen":81999,"positiveTestsPeopleAntigen":8393,"totalTestsAntigen":null,"positiveTestsAntigen":null,"fips":"19","positiveIncrease":2212,"negativeIncrease":4531,"total":897175,"totalTestResultsIncrease":6743,"posNeg":897175,"deathIncrease":1,"hospitalizedIncrease":0,"hash":"e83cab66236a197628b554ffec341e32e72f4961","commercialScore":0,"negativeRegularScore":0,"negativeScore":0,"positiveScore":0,"score":0,"grade":""},{"date":20201031,"state":"IA","positive":119755,"probableCases":null,"negative":770677,"pending":null,"totalTestResultsSource":"posNeg","totalTestResults":890432,"hospitalizedCurrently":630,"hospitalizedCumulative":null,"inIcuCurrently":153,"inIcuCumulative":null,"onVentilatorCurrently":55,"onVentilatorCumulative":null,"recovered":93200,"dataQualityGrade":"A+","lastUpdateEt":"10/31/2020 00:00","dateModified":"2020-10-31T24:00:00Z","checkTimeEt":"10/30 20:00","death":1716,"hospitalized":null,"dateChecked":"2020-10-31T24:00:00Z","totalTestsViral":null,"positiveTestsViral":null,"negativeTestsViral":null,"positiveCasesViral":119755,"deathConfirmed":null,"deathProbable":null,"totalTestEncountersViral":null,"totalTestsPeopleViral":892097,"totalTestsAntibody":null,"positiveTestsAntibody":null,"negativeTestsAntibody":null,"totalTestsPeopleAntibody":67286,"positiveTestsPeopleAntibody":3889,"negativeTestsPeopleAntibody":63357,"totalTestsPeopleAntigen":81284,"positiveTestsPeopleAntigen":8197,"totalTestsAntigen":null,"positiveTestsAntigen":null,"fips":"19","positiveIncrease":2570,"negativeIncrease":3610,"total":890432,"totalTestResultsIncrease":6180,"posNeg":890432,"deathIncrease":10,"hospitalizedIncrease":0,"hash":"a903bba5787efd56b1aa38958423313b4c43f9c7","commercialScore":0,"negativeRegularScore":0,"negativeScore":0,"positiveScore":0,"score":0,"grade":""},{"date":20201030,"state":"IA","positive":117185,"probableCases":null,"negative":767067,"pending":null,"totalTestResultsSource":"posNeg","totalTestResults":884252,"hospitalizedCurrently":606,"hospitalizedCumulative":null,"inIcuCurrently":152,"inIcuCumulative":null,"onVentilatorCurrently":55,"onVentilatorCumulative":null,"recovered":92387,"dataQualityGrade":"A+","lastUpdateEt":"10/30/2020 00:00","dateModified":"2020-10-30T24:00:00Z","checkTimeEt":"10/29 20:00","death":1706,"hospitalized":null,"dateChecked":"2020-10-30T24:00:00Z","totalTestsViral":null,"positiveTestsViral":null,"negativeTestsViral":null,"positiveCasesViral":117185,"deathConfirmed":null,"deathProbable":null,"totalTestEncountersViral":null,"totalTestsPeopleViral":885919,"totalTestsAntibody":null,"positiveTestsAntibody":null,"negativeTestsAntibody":null,"totalTestsPeopleAntibody":66863,"positiveTestsPeopleAntibody":3850,"negativeTestsPeopleAntibody":62973,"totalTestsPeopleAntigen":79221,"positiveTestsPeopleAntigen":7759,"totalTestsAntigen":null,"positiveTestsAntigen":null,"fips":"19","positiveIncrease":2203,"negativeIncrease":3185,"total":884252,"totalTestResultsIncrease":5388,"posNeg":884252,"deathIncrease":13,"hospitalizedIncrease":0,"hash":"133e44ba44201bec00465c675c850ed69838c87a","commercialScore":0,"negativeRegularScore":0,"negativeScore":0,"positiveScore":0,"score":0,"grade":""},{"date":20201029,"state":"IA","positive":114982,"probableCases":null,"negative":763882,"pending":null,"totalTestResultsSource":"posNeg","totalTestResults":878864,"hospitalizedCurrently":605,"hospitalizedCumulative":null,"inIcuCurrently":135,"inIcuCumulative":null,"onVentilatorCurrently":56,"onVentilatorCumulative":null,"recovered":91449,"dataQualityGrade":"A+","lastUpdateEt":"10/29/2020 00:00","dateModified":"2020-10-29T24:00:00Z","checkTimeEt":"10/28 20:00","death":1693,"hospitalized":null,"dateChecked":"2020-10-29T24:00:00Z","totalTestsViral":null,"positiveTestsViral":null,"negativeTestsViral":null,"positiveCasesViral":114982,"deathConfirmed":null,"deathProbable":null,"totalTestEncountersViral":null,"totalTestsPeopleViral":880527,"totalTestsAntibody":null,"positiveTestsAntibody":null,"negativeTestsAntibody":null,"totalTestsPeopleAntibody":66562,"positiveTestsPeopleAntibody":3831,"negativeTestsPeopleAntibody":62691,"totalTestsPeopleAntigen":77568,"positiveTestsPeopleAntigen":7349,"totalTestsAntigen":null,"positiveTestsAntigen":null,"fips":"19","positiveIncrease":1940,"negativeIncrease":3562,"total":878864,"totalTestResultsIncrease":5502,"posNeg":878864,"deathIncrease":11,"hospitalizedIncrease":0,"hash":"9e431d89677a97e600b223b535dede1ad8784f2f","commercialScore":0,"negativeRegularScore":0,"negativeScore":0,"positiveScore":0,"score":0,"grade":""},{"date":20201028,"state":"IA","positive":113042,"probableCases":null,"negative":760320,"pending":null,"totalTestResultsSource":"posNeg","totalTestResults":873362,"hospitalizedCurrently":596,"hospitalizedCumulative":null,"inIcuCurrently":136,"inIcuCumulative":null,"onVentilatorCurrently":51,"onVentilatorCumulative":null,"recovered":90532,"dataQualityGrade":"A+","lastUpdateEt":"10/28/2020 00:00","dateModified":"2020-10-28T24:00:00Z","checkTimeEt":"10/27 20:00","death":1682,"hospitalized":null,"dateChecked":"2020-10-28T24:00:00Z","totalTestsViral":null,"positiveTestsViral":null,"negativeTestsViral":null,"positiveCasesViral":113042,"deathConfirmed":null,"deathProbable":null,"totalTestEncountersViral":null,"totalTestsPeopleViral":875020,"totalTestsAntibody":null,"positiveTestsAntibody":null,"negativeTestsAntibody":null,"totalTestsPeopleAntibody":66342,"positiveTestsPeopleAntibody":3807,"negativeTestsPeopleAntibody":62495,"totalTestsPeopleAntigen":75535,"positiveTestsPeopleAntigen":6949,"totalTestsAntigen":null,"positiveTestsAntigen":null,"fips":"19","positiveIncrease":1781,"negativeIncrease":2561,"total":873362,"totalTestResultsIncrease":4342,"posNeg":873362,"deathIncrease":21,"hospitalizedIncrease":0,"hash":"0cf6d036b21763a345bbd46b87c22c291fb499f9","commercialScore":0,"negativeRegularScore":0,"negativeScore":0,"positiveScore":0,"score":0,"grade":""},{"date":20201027,"state":"IA","positive":111261,"probableCases":null,"negative":757759,"pending":null,"totalTestResultsSource":"posNeg","totalTestResults":869020,"hospitalizedCurrently":564,"hospitalizedCumulative":null,"inIcuCurrently":128,"inIcuCumulative":null,"onVentilatorCurrently":46,"onVentilatorCumulative":null,"recovered":89490,"dataQualityGrade":"A+","lastUpdateEt":"10/27/2020 00:00","dateModified":"2020-10-27T24:00:00Z","checkTimeEt":"10/26 20:00","death":1661,"hospitalized":null,"dateChecked":"2020-10-27T24:00:00Z","totalTestsViral":null,"positiveTestsViral":null,"negativeTestsViral":null,"positiveCasesViral":111261,"deathConfirmed":null,"deathProbable":null,"totalTestEncountersViral":null,"totalTestsPeopleViral":870679,"totalTestsAntibody":null,"positiveTestsAntibody":null,"negativeTestsAntibody":null,"totalTestsPeopleAntibody":66073,"positiveTestsPeopleAntibody":3796,"negativeTestsPeopleAntibody":62237,"totalTestsPeopleAntigen":73681,"positiveTestsPeopleAntigen":6521,"totalTestsAntigen":null,"positiveTestsAntigen":null,"fips":"19","positiveIncrease":857,"negativeIncrease":1840,"total":869020,"totalTestResultsIncrease":2697,"posNeg":869020,"deathIncrease":13,"hospitalizedIncrease":0,"hash":"eb05abd03fbd5d4e20ca9ba4ad7df0c2e68fb7b7","commercialScore":0,"negativeRegularScore":0,"negativeScore":0,"positiveScore":0,"score":0,"grade":""},{"date":20201026,"state":"IA","positive":110404,"probableCases":null,"negative":755919,"pending":null,"totalTestResultsSource":"posNeg","totalTestResults":866323,"hospitalizedCurrently":561,"hospitalizedCumulative":null,"inIcuCurrently":129,"inIcuCumulative":null,"onVentilatorCurrently":45,"onVentilatorCumulative":null,"recovered":88124,"dataQualityGrade":"A+","lastUpdateEt":"10/26/2020 00:00","dateModified":"2020-10-26T24:00:00Z","checkTimeEt":"10/25 20:00","death":1648,"hospitalized":null,"dateChecked":"2020-10-26T24:00:00Z","totalTestsViral":null,"positiveTestsViral":null,"negativeTestsViral":null,"positiveCasesViral":110404,"deathConfirmed":null,"deathProbable":null,"totalTestEncountersViral":null,"totalTestsPeopleViral":867967,"totalTestsAntibody":null,"positiveTestsAntibody":null,"negativeTestsAntibody":null,"totalTestsPeopleAntibody":65924,"positiveTestsPeopleAntibody":3780,"negativeTestsPeopleAntibody":62105,"totalTestsPeopleAntigen":72763,"positiveTestsPeopleAntigen":6299,"totalTestsAntigen":null,"positiveTestsAntigen":null,"fips":"19","positiveIncrease":747,"negativeIncrease":2215,"total":866323,"totalTestResultsIncrease":2962,"posNeg":866323,"deathIncrease":14,"hospitalizedIncrease":0,"hash":"d64cf54769caa009f0bf02a527a5b2816636bdc5","commercialScore":0,"negativeRegularScore":0,"negativeScore":0,"positiveScore":0,"score":0,"grade":""},{"date":20201025,"state":"IA","positive":109657,"probableCases":null,"negative":753704,"pending":null,"totalTestResultsSource":"posNeg","totalTestResults":863361,"hospitalizedCurrently":541,"hospitalizedCumulative":null,"inIcuCurrently":119,"inIcuCumulative":null,"onVentilatorCurrently":42,"onVentilatorCumulative":null,"recovered":87739,"dataQualityGrade":"A+","lastUpdateEt":"10/25/2020 00:00","dateModified":"2020-10-25T24:00:00Z","checkTimeEt":"10/24 20:00","death":1634,"hospitalized":null,"dateChecked":"2020-10-25T24:00:00Z","totalTestsViral":null,"positiveTestsViral":null,"negativeTestsViral":null,"positiveCasesViral":109657,"deathConfirmed":null,"deathProbable":null,"totalTestEncountersViral":null,"totalTestsPeopleViral":865004,"totalTestsAntibody":null,"positiveTestsAntibody":null,"negativeTestsAntibody":null,"totalTestsPeopleAntibody":65891,"positiveTestsPeopleAntibody":3772,"negativeTestsPeopleAntibody":62080,"totalTestsPeopleAntigen":72039,"positiveTestsPeopleAntigen":6187,"totalTestsAntigen":null,"positiveTestsAntigen":null,"fips":"19","positiveIncrease":1143,"negativeIncrease":2799,"total":863361,"totalTestResultsIncrease":3942,"posNeg":863361,"deathIncrease":3,"hospitalizedIncrease":0,"hash":"2eb8e92b89ba575e9e56436c7f3c40879793f19a","commercialScore":0,"negativeRegularScore":0,"negativeScore":0,"positiveScore":0,"score":0,"grade":""},{"date":20201024,"state":"IA","positive":108514,"probableCases":null,"negative":750905,"pending":null,"totalTestResultsSource":"posNeg","totalTestResults":859419,"hospitalizedCurrently":545,"hospitalizedCumulative":null,"inIcuCurrently":130,"inIcuCumulative":null,"onVentilatorCurrently":49,"onVentilatorCumulative":null,"recovered":87463,"dataQualityGrade":"A+","lastUpdateEt":"10/24/2020 00:00","dateModified":"2020-10-24T24:00:00Z","checkTimeEt":"10/23 20:00","death":1631,"hospitalized":null,"dateChecked":"2020-10-24T24:00:00Z","totalTestsViral":null,"positiveTestsViral":null,"negativeTestsViral":null,"positiveCasesViral":108514,"deathConfirmed":null,"deathProbable":null,"totalTestEncountersViral":null,"totalTestsPeopleViral":861067,"totalTestsAntibody":null,"positiveTestsAntibody":null,"negativeTestsAntibody":null,"totalTestsPeopleAntibody":65653,"positiveTestsPeopleAntibody":3766,"negativeTestsPeopleAntibody":61848,"totalTestsPeopleAntigen":71378,"positiveTestsPeopleAntigen":6117,"totalTestsAntigen":null,"positiveTestsAntigen":null,"fips":"19","positiveIncrease":1640,"negativeIncrease":4830,"total":859419,"totalTestResultsIncrease":6470,"posNeg":859419,"deathIncrease":11,"hospitalizedIncrease":0,"hash":"fa23d8e3272c3bb5ce905911d2f408f678359c6d","commercialScore":0,"negativeRegularScore":0,"negativeScore":0,"positiveScore":0,"score":0,"grade":""},{"date":20201023,"state":"IA","positive":106874,"probableCases":null,"negative":746075,"pending":null,"totalTestResultsSource":"posNeg","totalTestResults":852949,"hospitalizedCurrently":536,"hospitalizedCumulative":null,"inIcuCurrently":134,"inIcuCumulative":null,"onVentilatorCurrently":49,"onVentilatorCumulative":null,"recovered":86630,"dataQualityGrade":"A+","lastUpdateEt":"10/23/2020 00:00","dateModified":"2020-10-23T24:00:00Z","checkTimeEt":"10/22 20:00","death":1620,"hospitalized":null,"dateChecked":"2020-10-23T24:00:00Z","totalTestsViral":null,"positiveTestsViral":null,"negativeTestsViral":null,"positiveCasesViral":106874,"deathConfirmed":null,"deathProbable":null,"totalTestEncountersViral":null,"totalTestsPeopleViral":854599,"totalTestsAntibody":null,"positiveTestsAntibody":null,"negativeTestsAntibody":null,"totalTestsPeopleAntibody":65299,"positiveTestsPeopleAntibody":3748,"negativeTestsPeopleAntibody":61512,"totalTestsPeopleAntigen":71282,"positiveTestsPeopleAntigen":6043,"totalTestsAntigen":null,"positiveTestsAntigen":null,"fips":"19","positiveIncrease":1249,"negativeIncrease":3430,"total":852949,"totalTestResultsIncrease":4679,"posNeg":852949,"deathIncrease":19,"hospitalizedIncrease":0,"hash":"1bef172ff70095f15d88705e4fef53dda70772f1","commercialScore":0,"negativeRegularScore":0,"negativeScore":0,"positiveScore":0,"score":0,"grade":""},{"date":20201022,"state":"IA","positive":105625,"probableCases":null,"negative":742645,"pending":null,"totalTestResultsSource":"posNeg","totalTestResults":848270,"hospitalizedCurrently":530,"hospitalizedCumulative":null,"inIcuCurrently":135,"inIcuCumulative":null,"onVentilatorCurrently":53,"onVentilatorCumulative":null,"recovered":85697,"dataQualityGrade":"A+","lastUpdateEt":"10/22/2020 00:00","dateModified":"2020-10-22T24:00:00Z","checkTimeEt":"10/21 20:00","death":1601,"hospitalized":null,"dateChecked":"2020-10-22T24:00:00Z","totalTestsViral":null,"positiveTestsViral":null,"negativeTestsViral":null,"positiveCasesViral":105625,"deathConfirmed":null,"deathProbable":null,"totalTestEncountersViral":null,"totalTestsPeopleViral":849925,"totalTestsAntibody":null,"positiveTestsAntibody":null,"negativeTestsAntibody":null,"totalTestsPeopleAntibody":64981,"positiveTestsPeopleAntibody":3725,"negativeTestsPeopleAntibody":61217,"totalTestsPeopleAntigen":70128,"positiveTestsPeopleAntigen":5801,"totalTestsAntigen":null,"positiveTestsAntigen":null,"fips":"19","positiveIncrease":1435,"negativeIncrease":4293,"total":848270,"totalTestResultsIncrease":5728,"posNeg":848270,"deathIncrease":17,"hospitalizedIncrease":0,"hash":"b34b41947c44173b1f30d597a4aaea8a7cb9d30d","commercialScore":0,"negativeRegularScore":0,"negativeScore":0,"positiveScore":0,"score":0,"grade":""},{"date":20201021,"state":"IA","positive":104190,"probableCases":null,"negative":738352,"pending":null,"totalTestResultsSource":"posNeg","totalTestResults":842542,"hospitalizedCurrently":534,"hospitalizedCumulative":null,"inIcuCurrently":134,"inIcuCumulative":null,"onVentilatorCurrently":49,"onVentilatorCumulative":null,"recovered":84671,"dataQualityGrade":"A+","lastUpdateEt":"10/21/2020 00:00","dateModified":"2020-10-21T24:00:00Z","checkTimeEt":"10/20 20:00","death":1584,"hospitalized":null,"dateChecked":"2020-10-21T24:00:00Z","totalTestsViral":null,"positiveTestsViral":null,"negativeTestsViral":null,"positiveCasesViral":104190,"deathConfirmed":null,"deathProbable":null,"totalTestEncountersViral":null,"totalTestsPeopleViral":844194,"totalTestsAntibody":null,"positiveTestsAntibody":null,"negativeTestsAntibody":null,"totalTestsPeopleAntibody":64568,"positiveTestsPeopleAntibody":3695,"negativeTestsPeopleAntibody":60834,"totalTestsPeopleAntigen":68339,"positiveTestsPeopleAntigen":5615,"totalTestsAntigen":null,"positiveTestsAntigen":null,"fips":"19","positiveIncrease":1179,"negativeIncrease":3645,"total":842542,"totalTestResultsIncrease":4824,"posNeg":842542,"deathIncrease":29,"hospitalizedIncrease":0,"hash":"2bdd43b1c7d4f4401ab5b6f33314eccab53304bd","commercialScore":0,"negativeRegularScore":0,"negativeScore":0,"positiveScore":0,"score":0,"grade":""},{"date":20201020,"state":"IA","positive":103011,"probableCases":null,"negative":734707,"pending":null,"totalTestResultsSource":"posNeg","totalTestResults":837718,"hospitalizedCurrently":501,"hospitalizedCumulative":null,"inIcuCurrently":122,"inIcuCumulative":null,"onVentilatorCurrently":45,"onVentilatorCumulative":null,"recovered":83518,"dataQualityGrade":"A+","lastUpdateEt":"10/20/2020 00:00","dateModified":"2020-10-20T24:00:00Z","checkTimeEt":"10/19 20:00","death":1555,"hospitalized":null,"dateChecked":"2020-10-20T24:00:00Z","totalTestsViral":null,"positiveTestsViral":null,"negativeTestsViral":null,"positiveCasesViral":103011,"deathConfirmed":null,"deathProbable":null,"totalTestEncountersViral":null,"totalTestsPeopleViral":839348,"totalTestsAntibody":null,"positiveTestsAntibody":null,"negativeTestsAntibody":null,"totalTestsPeopleAntibody":64329,"positiveTestsPeopleAntibody":3685,"negativeTestsPeopleAntibody":60605,"totalTestsPeopleAntigen":67096,"positiveTestsPeopleAntigen":5433,"totalTestsAntigen":null,"positiveTestsAntigen":null,"fips":"19","positiveIncrease":494,"negativeIncrease":1651,"total":837718,"totalTestResultsIncrease":2145,"posNeg":837718,"deathIncrease":17,"hospitalizedIncrease":0,"hash":"299a1568b026ea27f91f546f3566f66fcaf9cf70","commercialScore":0,"negativeRegularScore":0,"negativeScore":0,"positiveScore":0,"score":0,"grade":""},{"date":20201019,"state":"IA","positive":102517,"probableCases":null,"negative":733056,"pending":null,"totalTestResultsSource":"posNeg","totalTestResults":835573,"hospitalizedCurrently":480,"hospitalizedCumulative":null,"inIcuCurrently":113,"inIcuCumulative":null,"onVentilatorCurrently":45,"onVentilatorCumulative":null,"recovered":82188,"dataQualityGrade":"A+","lastUpdateEt":"10/19/2020 00:00","dateModified":"2020-10-19T24:00:00Z","checkTimeEt":"10/18 20:00","death":1538,"hospitalized":null,"dateChecked":"2020-10-19T24:00:00Z","totalTestsViral":null,"positiveTestsViral":null,"negativeTestsViral":null,"positiveCasesViral":102517,"deathConfirmed":null,"deathProbable":null,"totalTestEncountersViral":null,"totalTestsPeopleViral":837201,"totalTestsAntibody":null,"positiveTestsAntibody":null,"negativeTestsAntibody":null,"totalTestsPeopleAntibody":64121,"positiveTestsPeopleAntibody":3674,"negativeTestsPeopleAntibody":60408,"totalTestsPeopleAntigen":65534,"positiveTestsPeopleAntigen":5221,"totalTestsAntigen":null,"positiveTestsAntigen":null,"fips":"19","positiveIncrease":557,"negativeIncrease":2480,"total":835573,"totalTestResultsIncrease":3037,"posNeg":835573,"deathIncrease":10,"hospitalizedIncrease":0,"hash":"41d1ad49726d443f17a446cceee734a111d4a12d","commercialScore":0,"negativeRegularScore":0,"negativeScore":0,"positiveScore":0,"score":0,"grade":""},{"date":20201018,"state":"IA","positive":101960,"probableCases":null,"negative":730576,"pending":null,"totalTestResultsSource":"posNeg","totalTestResults":832536,"hospitalizedCurrently":475,"hospitalizedCumulative":null,"inIcuCurrently":108,"inIcuCumulative":null,"onVentilatorCurrently":45,"onVentilatorCumulative":null,"recovered":81811,"dataQualityGrade":"A+","lastUpdateEt":"10/18/2020 00:00","dateModified":"2020-10-18T24:00:00Z","checkTimeEt":"10/17 20:00","death":1528,"hospitalized":null,"dateChecked":"2020-10-18T24:00:00Z","totalTestsViral":null,"positiveTestsViral":null,"negativeTestsViral":null,"positiveCasesViral":101960,"deathConfirmed":null,"deathProbable":null,"totalTestEncountersViral":null,"totalTestsPeopleViral":834160,"totalTestsAntibody":null,"positiveTestsAntibody":null,"negativeTestsAntibody":null,"totalTestsPeopleAntibody":64094,"positiveTestsPeopleAntibody":3667,"negativeTestsPeopleAntibody":60388,"totalTestsPeopleAntigen":65140,"positiveTestsPeopleAntigen":5161,"totalTestsAntigen":null,"positiveTestsAntigen":null,"fips":"19","positiveIncrease":857,"negativeIncrease":3795,"total":832536,"totalTestResultsIncrease":4652,"posNeg":832536,"deathIncrease":1,"hospitalizedIncrease":0,"hash":"ab083e81e760c6c369b38804e70d0581cb508741","commercialScore":0,"negativeRegularScore":0,"negativeScore":0,"positiveScore":0,"score":0,"grade":""},{"date":20201017,"state":"IA","positive":101103,"probableCases":null,"negative":726781,"pending":null,"totalTestResultsSource":"posNeg","totalTestResults":827884,"hospitalizedCurrently":461,"hospitalizedCumulative":null,"inIcuCurrently":104,"inIcuCumulative":null,"onVentilatorCurrently":46,"onVentilatorCumulative":null,"recovered":81502,"dataQualityGrade":"A+","lastUpdateEt":"10/17/2020 00:00","dateModified":"2020-10-17T24:00:00Z","checkTimeEt":"10/16 20:00","death":1527,"hospitalized":null,"dateChecked":"2020-10-17T24:00:00Z","totalTestsViral":null,"positiveTestsViral":null,"negativeTestsViral":null,"positiveCasesViral":101103,"deathConfirmed":null,"deathProbable":null,"totalTestEncountersViral":null,"totalTestsPeopleViral":829503,"totalTestsAntibody":null,"positiveTestsAntibody":null,"negativeTestsAntibody":null,"totalTestsPeopleAntibody":63869,"positiveTestsPeopleAntibody":3663,"negativeTestsPeopleAntibody":60167,"totalTestsPeopleAntigen":65216,"positiveTestsPeopleAntigen":5158,"totalTestsAntigen":null,"positiveTestsAntigen":null,"fips":"19","positiveIncrease":1157,"negativeIncrease":3952,"total":827884,"totalTestResultsIncrease":5109,"posNeg":827884,"deathIncrease":4,"hospitalizedIncrease":0,"hash":"d4c5e2d72638033ea5a8624efeeef1a4f51cba23","commercialScore":0,"negativeRegularScore":0,"negativeScore":0,"positiveScore":0,"score":0,"grade":""},{"date":20201016,"state":"IA","positive":99946,"probableCases":null,"negative":722829,"pending":null,"totalTestResultsSource":"posNeg","totalTestResults":822775,"hospitalizedCurrently":468,"hospitalizedCumulative":null,"inIcuCurrently":105,"inIcuCumulative":null,"onVentilatorCurrently":48,"onVentilatorCumulative":null,"recovered":80560,"dataQualityGrade":"A+","lastUpdateEt":"10/16/2020 00:00","dateModified":"2020-10-16T24:00:00Z","checkTimeEt":"10/15 20:00","death":1523,"hospitalized":null,"dateChecked":"2020-10-16T24:00:00Z","totalTestsViral":null,"positiveTestsViral":null,"negativeTestsViral":null,"positiveCasesViral":99946,"deathConfirmed":null,"deathProbable":null,"totalTestEncountersViral":null,"totalTestsPeopleViral":824384,"totalTestsAntibody":null,"positiveTestsAntibody":null,"negativeTestsAntibody":null,"totalTestsPeopleAntibody":63528,"positiveTestsPeopleAntibody":3654,"negativeTestsPeopleAntibody":59835,"totalTestsPeopleAntigen":63948,"positiveTestsPeopleAntigen":5026,"totalTestsAntigen":null,"positiveTestsAntigen":null,"fips":"19","positiveIncrease":1229,"negativeIncrease":-14060,"total":822775,"totalTestResultsIncrease":-12831,"posNeg":822775,"deathIncrease":17,"hospitalizedIncrease":0,"hash":"2686f31767ccc4b98a7695697c9f7e607657f41c","commercialScore":0,"negativeRegularScore":0,"negativeScore":0,"positiveScore":0,"score":0,"grade":""},{"date":20201015,"state":"IA","positive":98717,"probableCases":null,"negative":736889,"pending":null,"totalTestResultsSource":"posNeg","totalTestResults":835606,"hospitalizedCurrently":482,"hospitalizedCumulative":null,"inIcuCurrently":107,"inIcuCumulative":null,"onVentilatorCurrently":49,"onVentilatorCumulative":null,"recovered":80203,"dataQualityGrade":"A+","lastUpdateEt":"10/15/2020 00:00","dateModified":"2020-10-15T24:00:00Z","checkTimeEt":"10/14 20:00","death":1506,"hospitalized":null,"dateChecked":"2020-10-15T24:00:00Z","totalTestsViral":null,"positiveTestsViral":null,"negativeTestsViral":null,"positiveCasesViral":98717,"deathConfirmed":null,"deathProbable":null,"totalTestEncountersViral":null,"totalTestsPeopleViral":837215,"totalTestsAntibody":null,"positiveTestsAntibody":null,"negativeTestsAntibody":null,"totalTestsPeopleAntibody":63224,"positiveTestsPeopleAntibody":3638,"negativeTestsPeopleAntibody":59547,"totalTestsPeopleAntigen":44640,"positiveTestsPeopleAntigen":4921,"totalTestsAntigen":null,"positiveTestsAntigen":null,"fips":"19","positiveIncrease":1333,"negativeIncrease":5020,"total":835606,"totalTestResultsIncrease":6353,"posNeg":835606,"deathIncrease":9,"hospitalizedIncrease":0,"hash":"c9aa0dc8ebc4e92d3d6cedb750aaa583c6f7529e","commercialScore":0,"negativeRegularScore":0,"negativeScore":0,"positiveScore":0,"score":0,"grade":""},{"date":20201014,"state":"IA","positive":97384,"probableCases":null,"negative":731869,"pending":null,"totalTestResultsSource":"posNeg","totalTestResults":829253,"hospitalizedCurrently":473,"hospitalizedCumulative":null,"inIcuCurrently":106,"inIcuCumulative":null,"onVentilatorCurrently":46,"onVentilatorCumulative":null,"recovered":79121,"dataQualityGrade":"A+","lastUpdateEt":"10/14/2020 00:00","dateModified":"2020-10-14T24:00:00Z","checkTimeEt":"10/13 20:00","death":1497,"hospitalized":null,"dateChecked":"2020-10-14T24:00:00Z","totalTestsViral":null,"positiveTestsViral":null,"negativeTestsViral":null,"positiveCasesViral":97384,"deathConfirmed":null,"deathProbable":null,"totalTestEncountersViral":null,"totalTestsPeopleViral":830861,"totalTestsAntibody":null,"positiveTestsAntibody":null,"negativeTestsAntibody":null,"totalTestsPeopleAntibody":62877,"positiveTestsPeopleAntibody":3612,"negativeTestsPeopleAntibody":59226,"totalTestsPeopleAntigen":43301,"positiveTestsPeopleAntigen":4722,"totalTestsAntigen":null,"positiveTestsAntigen":null,"fips":"19","positiveIncrease":1046,"negativeIncrease":3338,"total":829253,"totalTestResultsIncrease":4384,"posNeg":829253,"deathIncrease":12,"hospitalizedIncrease":0,"hash":"d3058dfa44fe6f24a3cb2b68cb5e24d3bc42fecc","commercialScore":0,"negativeRegularScore":0,"negativeScore":0,"positiveScore":0,"score":0,"grade":""},{"date":20201013,"state":"IA","positive":96338,"probableCases":null,"negative":728531,"pending":null,"totalTestResultsSource":"posNeg","totalTestResults":824869,"hospitalizedCurrently":463,"hospitalizedCumulative":null,"inIcuCurrently":114,"inIcuCumulative":null,"onVentilatorCurrently":44,"onVentilatorCumulative":null,"recovered":78136,"dataQualityGrade":"A+","lastUpdateEt":"10/13/2020 00:00","dateModified":"2020-10-13T24:00:00Z","checkTimeEt":"10/12 20:00","death":1485,"hospitalized":null,"dateChecked":"2020-10-13T24:00:00Z","totalTestsViral":null,"positiveTestsViral":null,"negativeTestsViral":null,"positiveCasesViral":96338,"deathConfirmed":null,"deathProbable":null,"totalTestEncountersViral":null,"totalTestsPeopleViral":826482,"totalTestsAntibody":null,"positiveTestsAntibody":null,"negativeTestsAntibody":null,"totalTestsPeopleAntibody":62562,"positiveTestsPeopleAntibody":3605,"negativeTestsPeopleAntibody":58918,"totalTestsPeopleAntigen":42383,"positiveTestsPeopleAntigen":4558,"totalTestsAntigen":null,"positiveTestsAntigen":null,"fips":"19","positiveIncrease":529,"negativeIncrease":2200,"total":824869,"totalTestResultsIncrease":2729,"posNeg":824869,"deathIncrease":13,"hospitalizedIncrease":0,"hash":"c422ccafbb503a588cbc6202077719c86eb8f207","commercialScore":0,"negativeRegularScore":0,"negativeScore":0,"positiveScore":0,"score":0,"grade":""},{"date":20201012,"state":"IA","positive":95809,"probableCases":null,"negative":726331,"pending":null,"totalTestResultsSource":"posNeg","totalTestResults":822140,"hospitalizedCurrently":449,"hospitalizedCumulative":null,"inIcuCurrently":109,"inIcuCumulative":null,"onVentilatorCurrently":39,"onVentilatorCumulative":null,"recovered":76611,"dataQualityGrade":"A+","lastUpdateEt":"10/12/2020 00:00","dateModified":"2020-10-12T24:00:00Z","checkTimeEt":"10/11 20:00","death":1472,"hospitalized":null,"dateChecked":"2020-10-12T24:00:00Z","totalTestsViral":null,"positiveTestsViral":null,"negativeTestsViral":null,"positiveCasesViral":95809,"deathConfirmed":null,"deathProbable":null,"totalTestEncountersViral":null,"totalTestsPeopleViral":823756,"totalTestsAntibody":null,"positiveTestsAntibody":null,"negativeTestsAntibody":null,"totalTestsPeopleAntibody":62388,"positiveTestsPeopleAntibody":3594,"negativeTestsPeopleAntibody":58755,"totalTestsPeopleAntigen":41464,"positiveTestsPeopleAntigen":4385,"totalTestsAntigen":null,"positiveTestsAntigen":null,"fips":"19","positiveIncrease":463,"negativeIncrease":2217,"total":822140,"totalTestResultsIncrease":2680,"posNeg":822140,"deathIncrease":12,"hospitalizedIncrease":0,"hash":"c00210f20c808b4801d957d993647fd65a7f52f2","commercialScore":0,"negativeRegularScore":0,"negativeScore":0,"positiveScore":0,"score":0,"grade":""},{"date":20201011,"state":"IA","positive":95346,"probableCases":null,"negative":724114,"pending":null,"totalTestResultsSource":"posNeg","totalTestResults":819460,"hospitalizedCurrently":438,"hospitalizedCumulative":null,"inIcuCurrently":100,"inIcuCumulative":null,"onVentilatorCurrently":40,"onVentilatorCumulative":null,"recovered":76260,"dataQualityGrade":"A+","lastUpdateEt":"10/11/2020 00:00","dateModified":"2020-10-11T24:00:00Z","checkTimeEt":"10/10 20:00","death":1460,"hospitalized":null,"dateChecked":"2020-10-11T24:00:00Z","totalTestsViral":null,"positiveTestsViral":null,"negativeTestsViral":null,"positiveCasesViral":95346,"deathConfirmed":null,"deathProbable":null,"totalTestEncountersViral":null,"totalTestsPeopleViral":821074,"totalTestsAntibody":null,"positiveTestsAntibody":null,"negativeTestsAntibody":null,"totalTestsPeopleAntibody":62364,"positiveTestsPeopleAntibody":3594,"negativeTestsPeopleAntibody":58731,"totalTestsPeopleAntigen":41229,"positiveTestsPeopleAntigen":4339,"totalTestsAntigen":null,"positiveTestsAntigen":null,"fips":"19","positiveIncrease":1075,"negativeIncrease":4307,"total":819460,"totalTestResultsIncrease":5382,"posNeg":819460,"deathIncrease":5,"hospitalizedIncrease":0,"hash":"9f7058c6c67358201b8b19869f30f747a39b0855","commercialScore":0,"negativeRegularScore":0,"negativeScore":0,"positiveScore":0,"score":0,"grade":""},{"date":20201010,"state":"IA","positive":94271,"probableCases":null,"negative":719807,"pending":null,"totalTestResultsSource":"posNeg","totalTestResults":814078,"hospitalizedCurrently":450,"hospitalizedCumulative":null,"inIcuCurrently":101,"inIcuCumulative":null,"onVentilatorCurrently":40,"onVentilatorCumulative":null,"recovered":75948,"dataQualityGrade":"A+","lastUpdateEt":"10/10/2020 00:00","dateModified":"2020-10-10T24:00:00Z","checkTimeEt":"10/09 20:00","death":1455,"hospitalized":null,"dateChecked":"2020-10-10T24:00:00Z","totalTestsViral":null,"positiveTestsViral":null,"negativeTestsViral":null,"positiveCasesViral":94271,"deathConfirmed":null,"deathProbable":null,"totalTestEncountersViral":null,"totalTestsPeopleViral":815700,"totalTestsAntibody":null,"positiveTestsAntibody":null,"negativeTestsAntibody":null,"totalTestsPeopleAntibody":62093,"positiveTestsPeopleAntibody":3586,"negativeTestsPeopleAntibody":58468,"totalTestsPeopleAntigen":41240,"positiveTestsPeopleAntigen":4320,"totalTestsAntigen":null,"positiveTestsAntigen":null,"fips":"19","positiveIncrease":1084,"negativeIncrease":4193,"total":814078,"totalTestResultsIncrease":5277,"posNeg":814078,"deathIncrease":18,"hospitalizedIncrease":0,"hash":"7648965ae5178401209c167d5207c1d7c94d51bb","commercialScore":0,"negativeRegularScore":0,"negativeScore":0,"positiveScore":0,"score":0,"grade":""},{"date":20201009,"state":"IA","positive":93187,"probableCases":null,"negative":715614,"pending":null,"totalTestResultsSource":"posNeg","totalTestResults":808801,"hospitalizedCurrently":461,"hospitalizedCumulative":null,"inIcuCurrently":104,"inIcuCumulative":null,"onVentilatorCurrently":38,"onVentilatorCumulative":null,"recovered":75113,"dataQualityGrade":"A+","lastUpdateEt":"10/9/2020 00:00","dateModified":"2020-10-09T24:00:00Z","checkTimeEt":"10/08 20:00","death":1437,"hospitalized":null,"dateChecked":"2020-10-09T24:00:00Z","totalTestsViral":null,"positiveTestsViral":null,"negativeTestsViral":null,"positiveCasesViral":93187,"deathConfirmed":null,"deathProbable":null,"totalTestEncountersViral":null,"totalTestsPeopleViral":810428,"totalTestsAntibody":null,"positiveTestsAntibody":null,"negativeTestsAntibody":null,"totalTestsPeopleAntibody":61682,"positiveTestsPeopleAntibody":3569,"negativeTestsPeopleAntibody":58074,"totalTestsPeopleAntigen":40536,"positiveTestsPeopleAntigen":4263,"totalTestsAntigen":null,"positiveTestsAntigen":null,"fips":"19","positiveIncrease":1042,"negativeIncrease":4722,"total":808801,"totalTestResultsIncrease":5764,"posNeg":808801,"deathIncrease":16,"hospitalizedIncrease":0,"hash":"7e48401504de95f5bf12d8e113f74705f2ebcf3c","commercialScore":0,"negativeRegularScore":0,"negativeScore":0,"positiveScore":0,"score":0,"grade":""},{"date":20201008,"state":"IA","positive":92145,"probableCases":null,"negative":710892,"pending":null,"totalTestResultsSource":"posNeg","totalTestResults":803037,"hospitalizedCurrently":449,"hospitalizedCumulative":null,"inIcuCurrently":112,"inIcuCumulative":null,"onVentilatorCurrently":63,"onVentilatorCumulative":null,"recovered":74250,"dataQualityGrade":"A+","lastUpdateEt":"10/8/2020 00:00","dateModified":"2020-10-08T24:00:00Z","checkTimeEt":"10/07 20:00","death":1421,"hospitalized":null,"dateChecked":"2020-10-08T24:00:00Z","totalTestsViral":null,"positiveTestsViral":null,"negativeTestsViral":null,"positiveCasesViral":92145,"deathConfirmed":null,"deathProbable":null,"totalTestEncountersViral":null,"totalTestsPeopleViral":804658,"totalTestsAntibody":null,"positiveTestsAntibody":null,"negativeTestsAntibody":null,"totalTestsPeopleAntibody":61395,"positiveTestsPeopleAntibody":3550,"negativeTestsPeopleAntibody":57806,"totalTestsPeopleAntigen":39309,"positiveTestsPeopleAntigen":4075,"totalTestsAntigen":null,"positiveTestsAntigen":null,"fips":"19","positiveIncrease":1261,"negativeIncrease":5719,"total":803037,"totalTestResultsIncrease":6980,"posNeg":803037,"deathIncrease":6,"hospitalizedIncrease":0,"hash":"0777bc1ca4d41c4e5434e3a1635fe2418517ae28","commercialScore":0,"negativeRegularScore":0,"negativeScore":0,"positiveScore":0,"score":0,"grade":""},{"date":20201007,"state":"IA","positive":90884,"probableCases":null,"negative":705173,"pending":null,"totalTestResultsSource":"posNeg","totalTestResults":796057,"hospitalizedCurrently":444,"hospitalizedCumulative":null,"inIcuCurrently":104,"inIcuCumulative":null,"onVentilatorCurrently":42,"onVentilatorCumulative":null,"recovered":73311,"dataQualityGrade":"A+","lastUpdateEt":"10/7/2020 00:00","dateModified":"2020-10-07T24:00:00Z","checkTimeEt":"10/06 20:00","death":1415,"hospitalized":null,"dateChecked":"2020-10-07T24:00:00Z","totalTestsViral":null,"positiveTestsViral":null,"negativeTestsViral":null,"positiveCasesViral":90884,"deathConfirmed":null,"deathProbable":null,"totalTestEncountersViral":null,"totalTestsPeopleViral":797684,"totalTestsAntibody":null,"positiveTestsAntibody":null,"negativeTestsAntibody":null,"totalTestsPeopleAntibody":60955,"positiveTestsPeopleAntibody":3531,"negativeTestsPeopleAntibody":57385,"totalTestsPeopleAntigen":36763,"positiveTestsPeopleAntigen":3691,"totalTestsAntigen":null,"positiveTestsAntigen":null,"fips":"19","positiveIncrease":950,"negativeIncrease":4264,"total":796057,"totalTestResultsIncrease":5214,"posNeg":796057,"deathIncrease":15,"hospitalizedIncrease":0,"hash":"bb628983749ed2f8b2cee41c6b2767e769f814a8","commercialScore":0,"negativeRegularScore":0,"negativeScore":0,"positiveScore":0,"score":0,"grade":""},{"date":20201006,"state":"IA","positive":89934,"probableCases":null,"negative":700909,"pending":null,"totalTestResultsSource":"posNeg","totalTestResults":790843,"hospitalizedCurrently":413,"hospitalizedCumulative":null,"inIcuCurrently":104,"inIcuCumulative":null,"onVentilatorCurrently":43,"onVentilatorCumulative":null,"recovered":72273,"dataQualityGrade":"A+","lastUpdateEt":"10/6/2020 00:00","dateModified":"2020-10-06T24:00:00Z","checkTimeEt":"10/05 20:00","death":1400,"hospitalized":null,"dateChecked":"2020-10-06T24:00:00Z","totalTestsViral":null,"positiveTestsViral":null,"negativeTestsViral":null,"positiveCasesViral":89934,"deathConfirmed":null,"deathProbable":null,"totalTestEncountersViral":null,"totalTestsPeopleViral":792418,"totalTestsAntibody":null,"positiveTestsAntibody":null,"negativeTestsAntibody":null,"totalTestsPeopleAntibody":60637,"positiveTestsPeopleAntibody":3515,"negativeTestsPeopleAntibody":57083,"totalTestsPeopleAntigen":35866,"positiveTestsPeopleAntigen":3629,"totalTestsAntigen":null,"positiveTestsAntigen":null,"fips":"19","positiveIncrease":474,"negativeIncrease":2355,"total":790843,"totalTestResultsIncrease":2829,"posNeg":790843,"deathIncrease":11,"hospitalizedIncrease":0,"hash":"f41722c8f836305e824c0ebb6b7e464567756070","commercialScore":0,"negativeRegularScore":0,"negativeScore":0,"positiveScore":0,"score":0,"grade":""},{"date":20201005,"state":"IA","positive":89460,"probableCases":null,"negative":698554,"pending":null,"totalTestResultsSource":"posNeg","totalTestResults":788014,"hospitalizedCurrently":389,"hospitalizedCumulative":null,"inIcuCurrently":99,"inIcuCumulative":null,"onVentilatorCurrently":43,"onVentilatorCumulative":null,"recovered":71920,"dataQualityGrade":"A+","lastUpdateEt":"10/5/2020 00:00","dateModified":"2020-10-05T24:00:00Z","checkTimeEt":"10/04 20:00","death":1389,"hospitalized":null,"dateChecked":"2020-10-05T24:00:00Z","totalTestsViral":null,"positiveTestsViral":null,"negativeTestsViral":null,"positiveCasesViral":89460,"deathConfirmed":null,"deathProbable":null,"totalTestEncountersViral":null,"totalTestsPeopleViral":789576,"totalTestsAntibody":null,"positiveTestsAntibody":null,"negativeTestsAntibody":null,"totalTestsPeopleAntibody":60388,"positiveTestsPeopleAntibody":3497,"negativeTestsPeopleAntibody":56852,"totalTestsPeopleAntigen":34953,"positiveTestsPeopleAntigen":3526,"totalTestsAntigen":null,"positiveTestsAntigen":null,"fips":"19","positiveIncrease":364,"negativeIncrease":2083,"total":788014,"totalTestResultsIncrease":2447,"posNeg":788014,"deathIncrease":7,"hospitalizedIncrease":0,"hash":"695d53399cac1f913f8ad96f9f7eee38a7b4a6b3","commercialScore":0,"negativeRegularScore":0,"negativeScore":0,"positiveScore":0,"score":0,"grade":""},{"date":20201004,"state":"IA","positive":89096,"probableCases":null,"negative":696471,"pending":null,"totalTestResultsSource":"posNeg","totalTestResults":785567,"hospitalizedCurrently":392,"hospitalizedCumulative":null,"inIcuCurrently":104,"inIcuCumulative":null,"onVentilatorCurrently":39,"onVentilatorCumulative":null,"recovered":71600,"dataQualityGrade":"A+","lastUpdateEt":"10/4/2020 00:00","dateModified":"2020-10-04T24:00:00Z","checkTimeEt":"10/03 20:00","death":1382,"hospitalized":null,"dateChecked":"2020-10-04T24:00:00Z","totalTestsViral":null,"positiveTestsViral":null,"negativeTestsViral":null,"positiveCasesViral":89096,"deathConfirmed":null,"deathProbable":null,"totalTestEncountersViral":null,"totalTestsPeopleViral":787127,"totalTestsAntibody":null,"positiveTestsAntibody":null,"negativeTestsAntibody":null,"totalTestsPeopleAntibody":60347,"positiveTestsPeopleAntibody":3488,"negativeTestsPeopleAntibody":56820,"totalTestsPeopleAntigen":34814,"positiveTestsPeopleAntigen":3502,"totalTestsAntigen":null,"positiveTestsAntigen":null,"fips":"19","positiveIncrease":626,"negativeIncrease":3632,"total":785567,"totalTestResultsIncrease":4258,"posNeg":785567,"deathIncrease":5,"hospitalizedIncrease":0,"hash":"121bb3a6a8ee5620ea66894d3e5f28ab4a310ea8","commercialScore":0,"negativeRegularScore":0,"negativeScore":0,"positiveScore":0,"score":0,"grade":""},{"date":20201003,"state":"IA","positive":88470,"probableCases":null,"negative":692839,"pending":null,"totalTestResultsSource":"posNeg","totalTestResults":781309,"hospitalizedCurrently":402,"hospitalizedCumulative":null,"inIcuCurrently":100,"inIcuCumulative":null,"onVentilatorCurrently":38,"onVentilatorCumulative":null,"recovered":71319,"dataQualityGrade":"A+","lastUpdateEt":"10/3/2020 00:00","dateModified":"2020-10-03T24:00:00Z","checkTimeEt":"10/02 20:00","death":1377,"hospitalized":null,"dateChecked":"2020-10-03T24:00:00Z","totalTestsViral":null,"positiveTestsViral":null,"negativeTestsViral":null,"positiveCasesViral":88470,"deathConfirmed":null,"deathProbable":null,"totalTestEncountersViral":null,"totalTestsPeopleViral":782856,"totalTestsAntibody":null,"positiveTestsAntibody":null,"negativeTestsAntibody":null,"totalTestsPeopleAntibody":60125,"positiveTestsPeopleAntibody":3483,"negativeTestsPeopleAntibody":56603,"totalTestsPeopleAntigen":34763,"positiveTestsPeopleAntigen":3493,"totalTestsAntigen":null,"positiveTestsAntigen":null,"fips":"19","positiveIncrease":911,"negativeIncrease":4406,"total":781309,"totalTestResultsIncrease":5317,"posNeg":781309,"deathIncrease":5,"hospitalizedIncrease":0,"hash":"a0f58ee069a8156b0afe641c2f46ff6595e04c3a","commercialScore":0,"negativeRegularScore":0,"negativeScore":0,"positiveScore":0,"score":0,"grade":""},{"date":20201002,"state":"IA","positive":87559,"probableCases":null,"negative":688433,"pending":null,"totalTestResultsSource":"posNeg","totalTestResults":775992,"hospitalizedCurrently":393,"hospitalizedCumulative":null,"inIcuCurrently":95,"inIcuCumulative":null,"onVentilatorCurrently":36,"onVentilatorCumulative":null,"recovered":70501,"dataQualityGrade":"A+","lastUpdateEt":"10/2/2020 00:00","dateModified":"2020-10-02T24:00:00Z","checkTimeEt":"10/01 20:00","death":1372,"hospitalized":null,"dateChecked":"2020-10-02T24:00:00Z","totalTestsViral":null,"positiveTestsViral":null,"negativeTestsViral":null,"positiveCasesViral":87559,"deathConfirmed":null,"deathProbable":null,"totalTestEncountersViral":null,"totalTestsPeopleViral":777529,"totalTestsAntibody":null,"positiveTestsAntibody":null,"negativeTestsAntibody":null,"totalTestsPeopleAntibody":59708,"positiveTestsPeopleAntibody":3462,"negativeTestsPeopleAntibody":56207,"totalTestsPeopleAntigen":34592,"positiveTestsPeopleAntigen":3464,"totalTestsAntigen":null,"positiveTestsAntigen":null,"fips":"19","positiveIncrease":925,"negativeIncrease":4124,"total":775992,"totalTestResultsIncrease":5049,"posNeg":775992,"deathIncrease":12,"hospitalizedIncrease":0,"hash":"abbb8ae6a27928adce19c9a7fecb12ba415443bc","commercialScore":0,"negativeRegularScore":0,"negativeScore":0,"positiveScore":0,"score":0,"grade":""},{"date":20201001,"state":"IA","positive":86634,"probableCases":null,"negative":684309,"pending":null,"totalTestResultsSource":"posNeg","totalTestResults":770943,"hospitalizedCurrently":407,"hospitalizedCumulative":null,"inIcuCurrently":104,"inIcuCumulative":null,"onVentilatorCurrently":33,"onVentilatorCumulative":null,"recovered":69619,"dataQualityGrade":"A+","lastUpdateEt":"10/1/2020 00:00","dateModified":"2020-10-01T24:00:00Z","checkTimeEt":"09/30 20:00","death":1360,"hospitalized":null,"dateChecked":"2020-10-01T24:00:00Z","totalTestsViral":null,"positiveTestsViral":null,"negativeTestsViral":null,"positiveCasesViral":86634,"deathConfirmed":null,"deathProbable":null,"totalTestEncountersViral":null,"totalTestsPeopleViral":772483,"totalTestsAntibody":null,"positiveTestsAntibody":null,"negativeTestsAntibody":null,"totalTestsPeopleAntibody":59364,"positiveTestsPeopleAntibody":3450,"negativeTestsPeopleAntibody":55875,"totalTestsPeopleAntigen":33336,"positiveTestsPeopleAntigen":3375,"totalTestsAntigen":null,"positiveTestsAntigen":null,"fips":"19","positiveIncrease":1038,"negativeIncrease":5038,"total":770943,"totalTestResultsIncrease":6076,"posNeg":770943,"deathIncrease":16,"hospitalizedIncrease":0,"hash":"f5aa72e4041e4432d9c8e15a3ea3e4c6980c12cc","commercialScore":0,"negativeRegularScore":0,"negativeScore":0,"positiveScore":0,"score":0,"grade":""},{"date":20200930,"state":"IA","positive":85596,"probableCases":null,"negative":679271,"pending":null,"totalTestResultsSource":"posNeg","totalTestResults":764867,"hospitalizedCurrently":390,"hospitalizedCumulative":null,"inIcuCurrently":100,"inIcuCumulative":null,"onVentilatorCurrently":31,"onVentilatorCumulative":null,"recovered":68456,"dataQualityGrade":"A+","lastUpdateEt":"9/30/2020 00:00","dateModified":"2020-09-30T24:00:00Z","checkTimeEt":"09/29 20:00","death":1344,"hospitalized":null,"dateChecked":"2020-09-30T24:00:00Z","totalTestsViral":null,"positiveTestsViral":null,"negativeTestsViral":null,"positiveCasesViral":85596,"deathConfirmed":null,"deathProbable":null,"totalTestEncountersViral":null,"totalTestsPeopleViral":766417,"totalTestsAntibody":null,"positiveTestsAntibody":null,"negativeTestsAntibody":null,"totalTestsPeopleAntibody":58927,"positiveTestsPeopleAntibody":3429,"negativeTestsPeopleAntibody":55459,"totalTestsPeopleAntigen":32440,"positiveTestsPeopleAntigen":3233,"totalTestsAntigen":null,"positiveTestsAntigen":null,"fips":"19","positiveIncrease":1120,"negativeIncrease":5359,"total":764867,"totalTestResultsIncrease":6479,"posNeg":764867,"deathIncrease":16,"hospitalizedIncrease":0,"hash":"82c85385674ffb01157e4b47ac9914ca0f8009cd","commercialScore":0,"negativeRegularScore":0,"negativeScore":0,"positiveScore":0,"score":0,"grade":""},{"date":20200929,"state":"IA","positive":84476,"probableCases":null,"negative":673912,"pending":null,"totalTestResultsSource":"posNeg","totalTestResults":758388,"hospitalizedCurrently":376,"hospitalizedCumulative":null,"inIcuCurrently":97,"inIcuCumulative":null,"onVentilatorCurrently":36,"onVentilatorCumulative":null,"recovered":67477,"dataQualityGrade":"A+","lastUpdateEt":"9/29/2020 00:00","dateModified":"2020-09-29T24:00:00Z","checkTimeEt":"09/28 20:00","death":1328,"hospitalized":null,"dateChecked":"2020-09-29T24:00:00Z","totalTestsViral":null,"positiveTestsViral":null,"negativeTestsViral":null,"positiveCasesViral":84476,"deathConfirmed":null,"deathProbable":null,"totalTestEncountersViral":null,"totalTestsPeopleViral":759938,"totalTestsAntibody":null,"positiveTestsAntibody":null,"negativeTestsAntibody":null,"totalTestsPeopleAntibody":58556,"positiveTestsPeopleAntibody":3416,"negativeTestsPeopleAntibody":55101,"totalTestsPeopleAntigen":31617,"positiveTestsPeopleAntigen":3162,"totalTestsAntigen":null,"positiveTestsAntigen":null,"fips":"19","positiveIncrease":474,"negativeIncrease":2598,"total":758388,"totalTestResultsIncrease":3072,"posNeg":758388,"deathIncrease":8,"hospitalizedIncrease":0,"hash":"c77cd7542a662abd06a6b826598ceb596cb3c432","commercialScore":0,"negativeRegularScore":0,"negativeScore":0,"positiveScore":0,"score":0,"grade":""},{"date":20200928,"state":"IA","positive":84002,"probableCases":null,"negative":671314,"pending":null,"totalTestResultsSource":"posNeg","totalTestResults":755316,"hospitalizedCurrently":353,"hospitalizedCumulative":null,"inIcuCurrently":96,"inIcuCumulative":null,"onVentilatorCurrently":39,"onVentilatorCumulative":null,"recovered":66327,"dataQualityGrade":"A+","lastUpdateEt":"9/28/2020 00:00","dateModified":"2020-09-28T24:00:00Z","checkTimeEt":"09/27 20:00","death":1320,"hospitalized":null,"dateChecked":"2020-09-28T24:00:00Z","totalTestsViral":null,"positiveTestsViral":null,"negativeTestsViral":null,"positiveCasesViral":84002,"deathConfirmed":null,"deathProbable":null,"totalTestEncountersViral":null,"totalTestsPeopleViral":756871,"totalTestsAntibody":null,"positiveTestsAntibody":null,"negativeTestsAntibody":null,"totalTestsPeopleAntibody":58318,"positiveTestsPeopleAntibody":3400,"negativeTestsPeopleAntibody":54878,"totalTestsPeopleAntigen":30094,"positiveTestsPeopleAntigen":2994,"totalTestsAntigen":null,"positiveTestsAntigen":null,"fips":"19","positiveIncrease":366,"negativeIncrease":327,"total":755316,"totalTestResultsIncrease":693,"posNeg":755316,"deathIncrease":6,"hospitalizedIncrease":0,"hash":"c23dca8da4db7fee24fdde6a0c9fd9f4252c194e","commercialScore":0,"negativeRegularScore":0,"negativeScore":0,"positiveScore":0,"score":0,"grade":""},{"date":20200927,"state":"IA","positive":83636,"probableCases":null,"negative":670987,"pending":null,"totalTestResultsSource":"posNeg","totalTestResults":754623,"hospitalizedCurrently":343,"hospitalizedCumulative":null,"inIcuCurrently":89,"inIcuCumulative":null,"onVentilatorCurrently":34,"onVentilatorCumulative":null,"recovered":65838,"dataQualityGrade":"A+","lastUpdateEt":"9/27/2020 00:00","dateModified":"2020-09-27T24:00:00Z","checkTimeEt":"09/26 20:00","death":1314,"hospitalized":null,"dateChecked":"2020-09-27T24:00:00Z","totalTestsViral":null,"positiveTestsViral":null,"negativeTestsViral":null,"positiveCasesViral":83636,"deathConfirmed":null,"deathProbable":null,"totalTestEncountersViral":null,"totalTestsPeopleViral":756180,"totalTestsAntibody":null,"positiveTestsAntibody":null,"negativeTestsAntibody":null,"totalTestsPeopleAntibody":58298,"positiveTestsPeopleAntibody":3396,"negativeTestsPeopleAntibody":54862,"totalTestsPeopleAntigen":26254,"positiveTestsPeopleAntigen":2792,"totalTestsAntigen":null,"positiveTestsAntigen":null,"fips":"19","positiveIncrease":692,"negativeIncrease":3033,"total":754623,"totalTestResultsIncrease":3725,"posNeg":754623,"deathIncrease":3,"hospitalizedIncrease":0,"hash":"3086693fab50870a45d59b0187f3571131374952","commercialScore":0,"negativeRegularScore":0,"negativeScore":0,"positiveScore":0,"score":0,"grade":""},{"date":20200926,"state":"IA","positive":82944,"probableCases":null,"negative":667954,"pending":null,"totalTestResultsSource":"posNeg","totalTestResults":750898,"hospitalizedCurrently":334,"hospitalizedCumulative":null,"inIcuCurrently":84,"inIcuCumulative":null,"onVentilatorCurrently":29,"onVentilatorCumulative":null,"recovered":65490,"dataQualityGrade":"A+","lastUpdateEt":"9/26/2020 00:00","dateModified":"2020-09-26T24:00:00Z","checkTimeEt":"09/25 20:00","death":1311,"hospitalized":null,"dateChecked":"2020-09-26T24:00:00Z","totalTestsViral":null,"positiveTestsViral":null,"negativeTestsViral":null,"positiveCasesViral":82944,"deathConfirmed":null,"deathProbable":null,"totalTestEncountersViral":null,"totalTestsPeopleViral":752449,"totalTestsAntibody":null,"positiveTestsAntibody":null,"negativeTestsAntibody":null,"totalTestsPeopleAntibody":57997,"positiveTestsPeopleAntibody":3389,"negativeTestsPeopleAntibody":54568,"totalTestsPeopleAntigen":20350,"positiveTestsPeopleAntigen":2645,"totalTestsAntigen":null,"positiveTestsAntigen":null,"fips":"19","positiveIncrease":899,"negativeIncrease":5018,"total":750898,"totalTestResultsIncrease":5917,"posNeg":750898,"deathIncrease":4,"hospitalizedIncrease":0,"hash":"c1dec7bc31fcb32853a8cb872305af04805b2519","commercialScore":0,"negativeRegularScore":0,"negativeScore":0,"positiveScore":0,"score":0,"grade":""},{"date":20200925,"state":"IA","positive":82045,"probableCases":null,"negative":662936,"pending":null,"totalTestResultsSource":"posNeg","totalTestResults":744981,"hospitalizedCurrently":330,"hospitalizedCumulative":null,"inIcuCurrently":87,"inIcuCumulative":null,"onVentilatorCurrently":35,"onVentilatorCumulative":null,"recovered":62648,"dataQualityGrade":"A+","lastUpdateEt":"9/25/2020 00:00","dateModified":"2020-09-25T24:00:00Z","checkTimeEt":"09/24 20:00","death":1307,"hospitalized":null,"dateChecked":"2020-09-25T24:00:00Z","totalTestsViral":null,"positiveTestsViral":null,"negativeTestsViral":null,"positiveCasesViral":82045,"deathConfirmed":null,"deathProbable":null,"totalTestEncountersViral":null,"totalTestsPeopleViral":746536,"totalTestsAntibody":null,"positiveTestsAntibody":null,"negativeTestsAntibody":null,"totalTestsPeopleAntibody":57499,"positiveTestsPeopleAntibody":3371,"negativeTestsPeopleAntibody":54088,"totalTestsPeopleAntigen":20262,"positiveTestsPeopleAntigen":2640,"totalTestsAntigen":null,"positiveTestsAntigen":null,"fips":"19","positiveIncrease":974,"negativeIncrease":5427,"total":744981,"totalTestResultsIncrease":6401,"posNeg":744981,"deathIncrease":5,"hospitalizedIncrease":0,"hash":"c319fca1e7185c38b28961ab6f83237e1bbbb103","commercialScore":0,"negativeRegularScore":0,"negativeScore":0,"positiveScore":0,"score":0,"grade":""},{"date":20200924,"state":"IA","positive":81071,"probableCases":null,"negative":657509,"pending":null,"totalTestResultsSource":"posNeg","totalTestResults":738580,"hospitalizedCurrently":305,"hospitalizedCumulative":null,"inIcuCurrently":79,"inIcuCumulative":null,"onVentilatorCurrently":37,"onVentilatorCumulative":null,"recovered":61509,"dataQualityGrade":"A+","lastUpdateEt":"9/24/2020 00:00","dateModified":"2020-09-24T24:00:00Z","checkTimeEt":"09/23 20:00","death":1302,"hospitalized":null,"dateChecked":"2020-09-24T24:00:00Z","totalTestsViral":null,"positiveTestsViral":null,"negativeTestsViral":null,"positiveCasesViral":81071,"deathConfirmed":null,"deathProbable":null,"totalTestEncountersViral":null,"totalTestsPeopleViral":740125,"totalTestsAntibody":null,"positiveTestsAntibody":null,"negativeTestsAntibody":null,"totalTestsPeopleAntibody":57067,"positiveTestsPeopleAntibody":3357,"negativeTestsPeopleAntibody":53670,"totalTestsPeopleAntigen":19784,"positiveTestsPeopleAntigen":2511,"totalTestsAntigen":null,"positiveTestsAntigen":null,"fips":"19","positiveIncrease":1148,"negativeIncrease":5579,"total":738580,"totalTestResultsIncrease":6727,"posNeg":738580,"deathIncrease":8,"hospitalizedIncrease":0,"hash":"037023767cdd3bdf29d95241dd51fe021221caeb","commercialScore":0,"negativeRegularScore":0,"negativeScore":0,"positiveScore":0,"score":0,"grade":""},{"date":20200923,"state":"IA","positive":79923,"probableCases":null,"negative":651930,"pending":null,"totalTestResultsSource":"posNeg","totalTestResults":731853,"hospitalizedCurrently":301,"hospitalizedCumulative":null,"inIcuCurrently":77,"inIcuCumulative":null,"onVentilatorCurrently":37,"onVentilatorCumulative":null,"recovered":60350,"dataQualityGrade":"A+","lastUpdateEt":"9/23/2020 00:00","dateModified":"2020-09-23T24:00:00Z","checkTimeEt":"09/22 20:00","death":1294,"hospitalized":null,"dateChecked":"2020-09-23T24:00:00Z","totalTestsViral":null,"positiveTestsViral":null,"negativeTestsViral":null,"positiveCasesViral":79923,"deathConfirmed":null,"deathProbable":null,"totalTestEncountersViral":null,"totalTestsPeopleViral":733400,"totalTestsAntibody":null,"positiveTestsAntibody":null,"negativeTestsAntibody":null,"totalTestsPeopleAntibody":56600,"positiveTestsPeopleAntibody":3345,"negativeTestsPeopleAntibody":53215,"totalTestsPeopleAntigen":19021,"positiveTestsPeopleAntigen":2434,"totalTestsAntigen":null,"positiveTestsAntigen":null,"fips":"19","positiveIncrease":1036,"negativeIncrease":5735,"total":731853,"totalTestResultsIncrease":6771,"posNeg":731853,"deathIncrease":8,"hospitalizedIncrease":0,"hash":"f55d7218e7ab0f5a6690fc2d0a757b43fbcc0f68","commercialScore":0,"negativeRegularScore":0,"negativeScore":0,"positiveScore":0,"score":0,"grade":""},{"date":20200922,"state":"IA","positive":78887,"probableCases":null,"negative":646195,"pending":null,"totalTestResultsSource":"posNeg","totalTestResults":725082,"hospitalizedCurrently":285,"hospitalizedCumulative":null,"inIcuCurrently":72,"inIcuCumulative":null,"onVentilatorCurrently":34,"onVentilatorCumulative":null,"recovered":59216,"dataQualityGrade":"A+","lastUpdateEt":"9/22/2020 00:00","dateModified":"2020-09-22T24:00:00Z","checkTimeEt":"09/21 20:00","death":1286,"hospitalized":null,"dateChecked":"2020-09-22T24:00:00Z","totalTestsViral":null,"positiveTestsViral":null,"negativeTestsViral":null,"positiveCasesViral":78887,"deathConfirmed":null,"deathProbable":null,"totalTestEncountersViral":null,"totalTestsPeopleViral":726620,"totalTestsAntibody":null,"positiveTestsAntibody":null,"negativeTestsAntibody":null,"totalTestsPeopleAntibody":56190,"positiveTestsPeopleAntibody":3339,"negativeTestsPeopleAntibody":52811,"totalTestsPeopleAntigen":18946,"positiveTestsPeopleAntigen":2416,"totalTestsAntigen":null,"positiveTestsAntigen":null,"fips":"19","positiveIncrease":548,"negativeIncrease":2939,"total":725082,"totalTestResultsIncrease":3487,"posNeg":725082,"deathIncrease":12,"hospitalizedIncrease":0,"hash":"770912a6465cb6c6d49f92ec73ce07788b1d62e0","commercialScore":0,"negativeRegularScore":0,"negativeScore":0,"positiveScore":0,"score":0,"grade":""},{"date":20200921,"state":"IA","positive":78339,"probableCases":null,"negative":643256,"pending":null,"totalTestResultsSource":"posNeg","totalTestResults":721595,"hospitalizedCurrently":271,"hospitalizedCumulative":null,"inIcuCurrently":74,"inIcuCumulative":null,"onVentilatorCurrently":35,"onVentilatorCumulative":null,"recovered":57942,"dataQualityGrade":"A+","lastUpdateEt":"9/21/2020 00:00","dateModified":"2020-09-21T24:00:00Z","checkTimeEt":"09/20 20:00","death":1274,"hospitalized":null,"dateChecked":"2020-09-21T24:00:00Z","totalTestsViral":null,"positiveTestsViral":null,"negativeTestsViral":null,"positiveCasesViral":78339,"deathConfirmed":null,"deathProbable":null,"totalTestEncountersViral":null,"totalTestsPeopleViral":723128,"totalTestsAntibody":null,"positiveTestsAntibody":null,"negativeTestsAntibody":null,"totalTestsPeopleAntibody":55948,"positiveTestsPeopleAntibody":3326,"negativeTestsPeopleAntibody":52582,"totalTestsPeopleAntigen":18817,"positiveTestsPeopleAntigen":2401,"totalTestsAntigen":null,"positiveTestsAntigen":null,"fips":"19","positiveIncrease":660,"negativeIncrease":2656,"total":721595,"totalTestResultsIncrease":3316,"posNeg":721595,"deathIncrease":9,"hospitalizedIncrease":0,"hash":"e6449ee017c7a4d772046a2f1be4b069d990cf3c","commercialScore":0,"negativeRegularScore":0,"negativeScore":0,"positiveScore":0,"score":0,"grade":""},{"date":20200920,"state":"IA","positive":77679,"probableCases":null,"negative":640600,"pending":null,"totalTestResultsSource":"posNeg","totalTestResults":718279,"hospitalizedCurrently":269,"hospitalizedCumulative":null,"inIcuCurrently":73,"inIcuCumulative":null,"onVentilatorCurrently":38,"onVentilatorCumulative":null,"recovered":57524,"dataQualityGrade":"A+","lastUpdateEt":"9/20/2020 00:00","dateModified":"2020-09-20T24:00:00Z","checkTimeEt":"09/19 20:00","death":1265,"hospitalized":null,"dateChecked":"2020-09-20T24:00:00Z","totalTestsViral":null,"positiveTestsViral":null,"negativeTestsViral":null,"positiveCasesViral":77679,"deathConfirmed":null,"deathProbable":null,"totalTestEncountersViral":null,"totalTestsPeopleViral":719817,"totalTestsAntibody":null,"positiveTestsAntibody":null,"negativeTestsAntibody":null,"totalTestsPeopleAntibody":55887,"positiveTestsPeopleAntibody":3320,"negativeTestsPeopleAntibody":52527,"totalTestsPeopleAntigen":18671,"positiveTestsPeopleAntigen":2368,"totalTestsAntigen":null,"positiveTestsAntigen":null,"fips":"19","positiveIncrease":621,"negativeIncrease":3883,"total":718279,"totalTestResultsIncrease":4504,"posNeg":718279,"deathIncrease":1,"hospitalizedIncrease":0,"hash":"be5ed742429ef89fff20012174142c5e69be6833","commercialScore":0,"negativeRegularScore":0,"negativeScore":0,"positiveScore":0,"score":0,"grade":""},{"date":20200919,"state":"IA","positive":77058,"probableCases":null,"negative":636717,"pending":null,"totalTestResultsSource":"posNeg","totalTestResults":713775,"hospitalizedCurrently":282,"hospitalizedCumulative":null,"inIcuCurrently":81,"inIcuCumulative":null,"onVentilatorCurrently":40,"onVentilatorCumulative":null,"recovered":57269,"dataQualityGrade":"A+","lastUpdateEt":"9/19/2020 00:00","dateModified":"2020-09-19T24:00:00Z","checkTimeEt":"09/18 20:00","death":1264,"hospitalized":null,"dateChecked":"2020-09-19T24:00:00Z","totalTestsViral":null,"positiveTestsViral":null,"negativeTestsViral":null,"positiveCasesViral":77058,"deathConfirmed":null,"deathProbable":null,"totalTestEncountersViral":null,"totalTestsPeopleViral":715311,"totalTestsAntibody":null,"positiveTestsAntibody":null,"negativeTestsAntibody":null,"totalTestsPeopleAntibody":55107,"positiveTestsPeopleAntibody":3312,"negativeTestsPeopleAntibody":51755,"totalTestsPeopleAntigen":18314,"positiveTestsPeopleAntigen":2326,"totalTestsAntigen":null,"positiveTestsAntigen":null,"fips":"19","positiveIncrease":847,"negativeIncrease":4897,"total":713775,"totalTestResultsIncrease":5744,"posNeg":713775,"deathIncrease":4,"hospitalizedIncrease":0,"hash":"45a9cc1e877b97d62534e70a775886bb9da13902","commercialScore":0,"negativeRegularScore":0,"negativeScore":0,"positiveScore":0,"score":0,"grade":""},{"date":20200918,"state":"IA","positive":76211,"probableCases":null,"negative":631820,"pending":null,"totalTestResultsSource":"posNeg","totalTestResults":708031,"hospitalizedCurrently":281,"hospitalizedCumulative":null,"inIcuCurrently":91,"inIcuCumulative":null,"onVentilatorCurrently":39,"onVentilatorCumulative":null,"recovered":56546,"dataQualityGrade":"A+","lastUpdateEt":"9/18/2020 00:00","dateModified":"2020-09-18T24:00:00Z","checkTimeEt":"09/17 20:00","death":1260,"hospitalized":null,"dateChecked":"2020-09-18T24:00:00Z","totalTestsViral":null,"positiveTestsViral":null,"negativeTestsViral":null,"positiveCasesViral":76211,"deathConfirmed":null,"deathProbable":null,"totalTestEncountersViral":null,"totalTestsPeopleViral":709565,"totalTestsAntibody":null,"positiveTestsAntibody":null,"negativeTestsAntibody":null,"totalTestsPeopleAntibody":54988,"positiveTestsPeopleAntibody":3289,"negativeTestsPeopleAntibody":51659,"totalTestsPeopleAntigen":18101,"positiveTestsPeopleAntigen":2314,"totalTestsAntigen":null,"positiveTestsAntigen":null,"fips":"19","positiveIncrease":1183,"negativeIncrease":5410,"total":708031,"totalTestResultsIncrease":6593,"posNeg":708031,"deathIncrease":9,"hospitalizedIncrease":0,"hash":"38a9d0d7e156fcec2bb9c0e9952d242b0ab2809b","commercialScore":0,"negativeRegularScore":0,"negativeScore":0,"positiveScore":0,"score":0,"grade":""},{"date":20200917,"state":"IA","positive":75028,"probableCases":null,"negative":626410,"pending":null,"totalTestResultsSource":"posNeg","totalTestResults":701438,"hospitalizedCurrently":271,"hospitalizedCumulative":null,"inIcuCurrently":85,"inIcuCumulative":null,"onVentilatorCurrently":36,"onVentilatorCumulative":null,"recovered":55834,"dataQualityGrade":"A+","lastUpdateEt":"9/17/2020 00:00","dateModified":"2020-09-17T24:00:00Z","checkTimeEt":"09/16 20:00","death":1251,"hospitalized":null,"dateChecked":"2020-09-17T24:00:00Z","totalTestsViral":null,"positiveTestsViral":null,"negativeTestsViral":null,"positiveCasesViral":75028,"deathConfirmed":null,"deathProbable":null,"totalTestEncountersViral":null,"totalTestsPeopleViral":702988,"totalTestsAntibody":null,"positiveTestsAntibody":null,"negativeTestsAntibody":null,"totalTestsPeopleAntibody":54504,"positiveTestsPeopleAntibody":3269,"negativeTestsPeopleAntibody":51195,"totalTestsPeopleAntigen":17663,"positiveTestsPeopleAntigen":2250,"totalTestsAntigen":null,"positiveTestsAntigen":null,"fips":"19","positiveIncrease":948,"negativeIncrease":5379,"total":701438,"totalTestResultsIncrease":6327,"posNeg":701438,"deathIncrease":14,"hospitalizedIncrease":0,"hash":"aeddcb7c15cfc8b536421cec8b69644c09d54c9f","commercialScore":0,"negativeRegularScore":0,"negativeScore":0,"positiveScore":0,"score":0,"grade":""},{"date":20200916,"state":"IA","positive":74080,"probableCases":null,"negative":621031,"pending":null,"totalTestResultsSource":"posNeg","totalTestResults":695111,"hospitalizedCurrently":291,"hospitalizedCumulative":null,"inIcuCurrently":79,"inIcuCumulative":null,"onVentilatorCurrently":32,"onVentilatorCumulative":null,"recovered":55067,"dataQualityGrade":"A+","lastUpdateEt":"9/16/2020 00:00","dateModified":"2020-09-16T24:00:00Z","checkTimeEt":"09/15 20:00","death":1237,"hospitalized":null,"dateChecked":"2020-09-16T24:00:00Z","totalTestsViral":null,"positiveTestsViral":null,"negativeTestsViral":null,"positiveCasesViral":74080,"deathConfirmed":null,"deathProbable":null,"totalTestEncountersViral":null,"totalTestsPeopleViral":696656,"totalTestsAntibody":null,"positiveTestsAntibody":null,"negativeTestsAntibody":null,"totalTestsPeopleAntibody":53963,"positiveTestsPeopleAntibody":3240,"negativeTestsPeopleAntibody":50683,"totalTestsPeopleAntigen":17285,"positiveTestsPeopleAntigen":2201,"totalTestsAntigen":null,"positiveTestsAntigen":null,"fips":"19","positiveIncrease":803,"negativeIncrease":4696,"total":695111,"totalTestResultsIncrease":5499,"posNeg":695111,"deathIncrease":3,"hospitalizedIncrease":0,"hash":"57005115196d392cc95b8035b0ba44927e3f491e","commercialScore":0,"negativeRegularScore":0,"negativeScore":0,"positiveScore":0,"score":0,"grade":""},{"date":20200915,"state":"IA","positive":73277,"probableCases":null,"negative":616335,"pending":null,"totalTestResultsSource":"posNeg","totalTestResults":689612,"hospitalizedCurrently":284,"hospitalizedCumulative":null,"inIcuCurrently":74,"inIcuCumulative":null,"onVentilatorCurrently":29,"onVentilatorCumulative":null,"recovered":54352,"dataQualityGrade":"A+","lastUpdateEt":"9/15/2020 00:00","dateModified":"2020-09-15T24:00:00Z","checkTimeEt":"09/14 20:00","death":1234,"hospitalized":null,"dateChecked":"2020-09-15T24:00:00Z","totalTestsViral":null,"positiveTestsViral":null,"negativeTestsViral":null,"positiveCasesViral":73277,"deathConfirmed":null,"deathProbable":null,"totalTestEncountersViral":null,"totalTestsPeopleViral":691147,"totalTestsAntibody":null,"positiveTestsAntibody":null,"negativeTestsAntibody":null,"totalTestsPeopleAntibody":53494,"positiveTestsPeopleAntibody":3224,"negativeTestsPeopleAntibody":50230,"totalTestsPeopleAntigen":16832,"positiveTestsPeopleAntigen":2112,"totalTestsAntigen":null,"positiveTestsAntigen":null,"fips":"19","positiveIncrease":401,"negativeIncrease":2575,"total":689612,"totalTestResultsIncrease":2976,"posNeg":689612,"deathIncrease":10,"hospitalizedIncrease":0,"hash":"93a08b7498c2e7b36c8dfa590023394ef66f9fb9","commercialScore":0,"negativeRegularScore":0,"negativeScore":0,"positiveScore":0,"score":0,"grade":""},{"date":20200914,"state":"IA","positive":72876,"probableCases":null,"negative":613760,"pending":null,"totalTestResultsSource":"posNeg","totalTestResults":686636,"hospitalizedCurrently":272,"hospitalizedCumulative":null,"inIcuCurrently":75,"inIcuCumulative":null,"onVentilatorCurrently":29,"onVentilatorCumulative":null,"recovered":53417,"dataQualityGrade":"A+","lastUpdateEt":"9/14/2020 00:00","dateModified":"2020-09-14T24:00:00Z","checkTimeEt":"09/13 20:00","death":1224,"hospitalized":null,"dateChecked":"2020-09-14T24:00:00Z","totalTestsViral":null,"positiveTestsViral":null,"negativeTestsViral":null,"positiveCasesViral":72876,"deathConfirmed":null,"deathProbable":null,"totalTestEncountersViral":null,"totalTestsPeopleViral":688157,"totalTestsAntibody":null,"positiveTestsAntibody":null,"negativeTestsAntibody":null,"totalTestsPeopleAntibody":53228,"positiveTestsPeopleAntibody":3205,"negativeTestsPeopleAntibody":49983,"totalTestsPeopleAntigen":16383,"positiveTestsPeopleAntigen":2024,"totalTestsAntigen":null,"positiveTestsAntigen":null,"fips":"19","positiveIncrease":386,"negativeIncrease":2805,"total":686636,"totalTestResultsIncrease":3191,"posNeg":686636,"deathIncrease":6,"hospitalizedIncrease":0,"hash":"0e9359ba4dbe1e5e7f7a574edcf8f8c2f618c602","commercialScore":0,"negativeRegularScore":0,"negativeScore":0,"positiveScore":0,"score":0,"grade":""},{"date":20200913,"state":"IA","positive":72490,"probableCases":null,"negative":610955,"pending":null,"totalTestResultsSource":"posNeg","totalTestResults":683445,"hospitalizedCurrently":274,"hospitalizedCumulative":null,"inIcuCurrently":79,"inIcuCumulative":null,"onVentilatorCurrently":28,"onVentilatorCumulative":null,"recovered":53151,"dataQualityGrade":"A+","lastUpdateEt":"9/13/2020 00:00","dateModified":"2020-09-13T24:00:00Z","checkTimeEt":"09/12 20:00","death":1218,"hospitalized":null,"dateChecked":"2020-09-13T24:00:00Z","totalTestsViral":null,"positiveTestsViral":null,"negativeTestsViral":null,"positiveCasesViral":72490,"deathConfirmed":null,"deathProbable":null,"totalTestEncountersViral":null,"totalTestsPeopleViral":684959,"totalTestsAntibody":null,"positiveTestsAntibody":null,"negativeTestsAntibody":null,"totalTestsPeopleAntibody":53195,"positiveTestsPeopleAntibody":3199,"negativeTestsPeopleAntibody":49956,"totalTestsPeopleAntigen":16319,"positiveTestsPeopleAntigen":2016,"totalTestsAntigen":null,"positiveTestsAntigen":null,"fips":"19","positiveIncrease":784,"negativeIncrease":3771,"total":683445,"totalTestResultsIncrease":4555,"posNeg":683445,"deathIncrease":1,"hospitalizedIncrease":0,"hash":"2011afac5086104e78c283ff529f23e920d3f7b1","commercialScore":0,"negativeRegularScore":0,"negativeScore":0,"positiveScore":0,"score":0,"grade":""},{"date":20200912,"state":"IA","positive":71706,"probableCases":null,"negative":607184,"pending":null,"totalTestResultsSource":"posNeg","totalTestResults":678890,"hospitalizedCurrently":290,"hospitalizedCumulative":null,"inIcuCurrently":90,"inIcuCumulative":null,"onVentilatorCurrently":35,"onVentilatorCumulative":null,"recovered":52953,"dataQualityGrade":"A+","lastUpdateEt":"9/12/2020 00:00","dateModified":"2020-09-12T24:00:00Z","checkTimeEt":"09/11 20:00","death":1217,"hospitalized":null,"dateChecked":"2020-09-12T24:00:00Z","totalTestsViral":null,"positiveTestsViral":null,"negativeTestsViral":null,"positiveCasesViral":71706,"deathConfirmed":null,"deathProbable":null,"totalTestEncountersViral":null,"totalTestsPeopleViral":680421,"totalTestsAntibody":null,"positiveTestsAntibody":null,"negativeTestsAntibody":null,"totalTestsPeopleAntibody":52915,"positiveTestsPeopleAntibody":3188,"negativeTestsPeopleAntibody":49687,"totalTestsPeopleAntigen":16279,"positiveTestsPeopleAntigen":1991,"totalTestsAntigen":null,"positiveTestsAntigen":null,"fips":"19","positiveIncrease":573,"negativeIncrease":4720,"total":678890,"totalTestResultsIncrease":5293,"posNeg":678890,"deathIncrease":6,"hospitalizedIncrease":0,"hash":"85822794c8cf6ee79ea19d66161eb46222c0a53b","commercialScore":0,"negativeRegularScore":0,"negativeScore":0,"positiveScore":0,"score":0,"grade":""},{"date":20200911,"state":"IA","positive":71133,"probableCases":null,"negative":602464,"pending":null,"totalTestResultsSource":"posNeg","totalTestResults":673597,"hospitalizedCurrently":281,"hospitalizedCumulative":null,"inIcuCurrently":83,"inIcuCumulative":null,"onVentilatorCurrently":36,"onVentilatorCumulative":null,"recovered":52370,"dataQualityGrade":"A+","lastUpdateEt":"9/11/2020 00:00","dateModified":"2020-09-11T24:00:00Z","checkTimeEt":"09/10 20:00","death":1211,"hospitalized":null,"dateChecked":"2020-09-11T24:00:00Z","totalTestsViral":null,"positiveTestsViral":null,"negativeTestsViral":null,"positiveCasesViral":71133,"deathConfirmed":null,"deathProbable":null,"totalTestEncountersViral":null,"totalTestsPeopleViral":675126,"totalTestsAntibody":null,"positiveTestsAntibody":null,"negativeTestsAntibody":null,"totalTestsPeopleAntibody":52493,"positiveTestsPeopleAntibody":3177,"negativeTestsPeopleAntibody":49276,"totalTestsPeopleAntigen":15171,"positiveTestsPeopleAntigen":1895,"totalTestsAntigen":null,"positiveTestsAntigen":null,"fips":"19","positiveIncrease":728,"negativeIncrease":5000,"total":673597,"totalTestResultsIncrease":5728,"posNeg":673597,"deathIncrease":4,"hospitalizedIncrease":0,"hash":"ff42822a6b87c2d0905378057d0216cdb5ee4a6f","commercialScore":0,"negativeRegularScore":0,"negativeScore":0,"positiveScore":0,"score":0,"grade":""},{"date":20200910,"state":"IA","positive":70405,"probableCases":null,"negative":597464,"pending":null,"totalTestResultsSource":"posNeg","totalTestResults":667869,"hospitalizedCurrently":302,"hospitalizedCumulative":null,"inIcuCurrently":85,"inIcuCumulative":null,"onVentilatorCurrently":34,"onVentilatorCumulative":null,"recovered":51691,"dataQualityGrade":"A+","lastUpdateEt":"9/10/2020 00:00","dateModified":"2020-09-10T24:00:00Z","checkTimeEt":"09/09 20:00","death":1207,"hospitalized":null,"dateChecked":"2020-09-10T24:00:00Z","totalTestsViral":null,"positiveTestsViral":null,"negativeTestsViral":null,"positiveCasesViral":70405,"deathConfirmed":null,"deathProbable":null,"totalTestEncountersViral":null,"totalTestsPeopleViral":669391,"totalTestsAntibody":null,"positiveTestsAntibody":null,"negativeTestsAntibody":null,"totalTestsPeopleAntibody":52103,"positiveTestsPeopleAntibody":3155,"negativeTestsPeopleAntibody":48908,"totalTestsPeopleAntigen":14985,"positiveTestsPeopleAntigen":1852,"totalTestsAntigen":null,"positiveTestsAntigen":null,"fips":"19","positiveIncrease":902,"negativeIncrease":5392,"total":667869,"totalTestResultsIncrease":6294,"posNeg":667869,"deathIncrease":13,"hospitalizedIncrease":0,"hash":"3b2da22de2e8efe44ff46af61d9873960bcc597a","commercialScore":0,"negativeRegularScore":0,"negativeScore":0,"positiveScore":0,"score":0,"grade":""},{"date":20200909,"state":"IA","positive":69503,"probableCases":null,"negative":592072,"pending":null,"totalTestResultsSource":"posNeg","totalTestResults":661575,"hospitalizedCurrently":322,"hospitalizedCumulative":null,"inIcuCurrently":83,"inIcuCumulative":null,"onVentilatorCurrently":37,"onVentilatorCumulative":null,"recovered":51014,"dataQualityGrade":"A+","lastUpdateEt":"9/9/2020 00:00","dateModified":"2020-09-09T24:00:00Z","checkTimeEt":"09/08 20:00","death":1194,"hospitalized":null,"dateChecked":"2020-09-09T24:00:00Z","totalTestsViral":null,"positiveTestsViral":null,"negativeTestsViral":null,"positiveCasesViral":69503,"deathConfirmed":null,"deathProbable":null,"totalTestEncountersViral":null,"totalTestsPeopleViral":663101,"totalTestsAntibody":null,"positiveTestsAntibody":null,"negativeTestsAntibody":null,"totalTestsPeopleAntibody":51688,"positiveTestsPeopleAntibody":3149,"negativeTestsPeopleAntibody":48499,"totalTestsPeopleAntigen":14539,"positiveTestsPeopleAntigen":1762,"totalTestsAntigen":null,"positiveTestsAntigen":null,"fips":"19","positiveIncrease":364,"negativeIncrease":2234,"total":661575,"totalTestResultsIncrease":2598,"posNeg":661575,"deathIncrease":14,"hospitalizedIncrease":0,"hash":"b3dffe9a002724ef76eca016a849dab7c1da347c","commercialScore":0,"negativeRegularScore":0,"negativeScore":0,"positiveScore":0,"score":0,"grade":""},{"date":20200908,"state":"IA","positive":69139,"probableCases":null,"negative":589838,"pending":null,"totalTestResultsSource":"posNeg","totalTestResults":658977,"hospitalizedCurrently":326,"hospitalizedCumulative":null,"inIcuCurrently":92,"inIcuCumulative":null,"onVentilatorCurrently":37,"onVentilatorCumulative":null,"recovered":50466,"dataQualityGrade":"A+","lastUpdateEt":"9/8/2020 00:00","dateModified":"2020-09-08T24:00:00Z","checkTimeEt":"09/07 20:00","death":1180,"hospitalized":null,"dateChecked":"2020-09-08T24:00:00Z","totalTestsViral":null,"positiveTestsViral":null,"negativeTestsViral":null,"positiveCasesViral":69139,"deathConfirmed":null,"deathProbable":null,"totalTestEncountersViral":null,"totalTestsPeopleViral":660497,"totalTestsAntibody":null,"positiveTestsAntibody":null,"negativeTestsAntibody":null,"totalTestsPeopleAntibody":51459,"positiveTestsPeopleAntibody":3130,"negativeTestsPeopleAntibody":48289,"totalTestsPeopleAntigen":14126,"positiveTestsPeopleAntigen":1726,"totalTestsAntigen":null,"positiveTestsAntigen":null,"fips":"19","positiveIncrease":455,"negativeIncrease":2676,"total":658977,"totalTestResultsIncrease":3131,"posNeg":658977,"deathIncrease":12,"hospitalizedIncrease":0,"hash":"a38ac5fa7923c0cf4cf0b541b60124de799593f9","commercialScore":0,"negativeRegularScore":0,"negativeScore":0,"positiveScore":0,"score":0,"grade":""},{"date":20200907,"state":"IA","positive":68684,"probableCases":null,"negative":587162,"pending":null,"totalTestResultsSource":"posNeg","totalTestResults":655846,"hospitalizedCurrently":311,"hospitalizedCumulative":null,"inIcuCurrently":99,"inIcuCumulative":null,"onVentilatorCurrently":35,"onVentilatorCumulative":null,"recovered":49884,"dataQualityGrade":"A+","lastUpdateEt":"9/7/2020 00:00","dateModified":"2020-09-07T24:00:00Z","checkTimeEt":"09/06 20:00","death":1168,"hospitalized":null,"dateChecked":"2020-09-07T24:00:00Z","totalTestsViral":null,"positiveTestsViral":null,"negativeTestsViral":null,"positiveCasesViral":68684,"deathConfirmed":null,"deathProbable":null,"totalTestEncountersViral":null,"totalTestsPeopleViral":657363,"totalTestsAntibody":null,"positiveTestsAntibody":null,"negativeTestsAntibody":null,"totalTestsPeopleAntibody":51445,"positiveTestsPeopleAntibody":3126,"negativeTestsPeopleAntibody":48279,"totalTestsPeopleAntigen":14069,"positiveTestsPeopleAntigen":1719,"totalTestsAntigen":null,"positiveTestsAntigen":null,"fips":"19","positiveIncrease":393,"negativeIncrease":2516,"total":655846,"totalTestResultsIncrease":2909,"posNeg":655846,"deathIncrease":3,"hospitalizedIncrease":0,"hash":"166c166a085de836ca95c22b4dc6540bbfcea75c","commercialScore":0,"negativeRegularScore":0,"negativeScore":0,"positiveScore":0,"score":0,"grade":""},{"date":20200906,"state":"IA","positive":68291,"probableCases":null,"negative":584646,"pending":null,"totalTestResultsSource":"posNeg","totalTestResults":652937,"hospitalizedCurrently":309,"hospitalizedCumulative":null,"inIcuCurrently":91,"inIcuCumulative":null,"onVentilatorCurrently":37,"onVentilatorCumulative":null,"recovered":49723,"dataQualityGrade":"A+","lastUpdateEt":"9/6/2020 00:00","dateModified":"2020-09-06T24:00:00Z","checkTimeEt":"09/05 20:00","death":1165,"hospitalized":null,"dateChecked":"2020-09-06T24:00:00Z","totalTestsViral":null,"positiveTestsViral":null,"negativeTestsViral":null,"positiveCasesViral":68291,"deathConfirmed":null,"deathProbable":null,"totalTestEncountersViral":null,"totalTestsPeopleViral":654436,"totalTestsAntibody":null,"positiveTestsAntibody":null,"negativeTestsAntibody":null,"totalTestsPeopleAntibody":51413,"positiveTestsPeopleAntibody":3121,"negativeTestsPeopleAntibody":48252,"totalTestsPeopleAntigen":14081,"positiveTestsPeopleAntigen":1719,"totalTestsAntigen":null,"positiveTestsAntigen":null,"fips":"19","positiveIncrease":649,"negativeIncrease":3777,"total":652937,"totalTestResultsIncrease":4426,"posNeg":652937,"deathIncrease":4,"hospitalizedIncrease":0,"hash":"47889c7a1cca90c06625d7d91da699c48f659e32","commercialScore":0,"negativeRegularScore":0,"negativeScore":0,"positiveScore":0,"score":0,"grade":""},{"date":20200905,"state":"IA","positive":67642,"probableCases":null,"negative":580869,"pending":null,"totalTestResultsSource":"posNeg","totalTestResults":648511,"hospitalizedCurrently":315,"hospitalizedCumulative":null,"inIcuCurrently":94,"inIcuCumulative":null,"onVentilatorCurrently":38,"onVentilatorCumulative":null,"recovered":49521,"dataQualityGrade":"A+","lastUpdateEt":"9/5/2020 00:00","dateModified":"2020-09-05T24:00:00Z","checkTimeEt":"09/04 20:00","death":1161,"hospitalized":null,"dateChecked":"2020-09-05T24:00:00Z","totalTestsViral":null,"positiveTestsViral":null,"negativeTestsViral":null,"positiveCasesViral":67642,"deathConfirmed":null,"deathProbable":null,"totalTestEncountersViral":null,"totalTestsPeopleViral":650020,"totalTestsAntibody":null,"positiveTestsAntibody":null,"negativeTestsAntibody":null,"totalTestsPeopleAntibody":51112,"positiveTestsPeopleAntibody":3118,"negativeTestsPeopleAntibody":47954,"totalTestsPeopleAntigen":13362,"positiveTestsPeopleAntigen":1664,"totalTestsAntigen":null,"positiveTestsAntigen":null,"fips":"19","positiveIncrease":1028,"negativeIncrease":5148,"total":648511,"totalTestResultsIncrease":6176,"posNeg":648511,"deathIncrease":20,"hospitalizedIncrease":0,"hash":"a8f8cdad2a747171c740ac3820bea790e44d2e9c","commercialScore":0,"negativeRegularScore":0,"negativeScore":0,"positiveScore":0,"score":0,"grade":""},{"date":20200904,"state":"IA","positive":66614,"probableCases":null,"negative":575721,"pending":null,"totalTestResultsSource":"posNeg","totalTestResults":642335,"hospitalizedCurrently":317,"hospitalizedCumulative":null,"inIcuCurrently":87,"inIcuCumulative":null,"onVentilatorCurrently":41,"onVentilatorCumulative":null,"recovered":49053,"dataQualityGrade":"A+","lastUpdateEt":"9/4/2020 00:00","dateModified":"2020-09-04T24:00:00Z","checkTimeEt":"09/03 20:00","death":1141,"hospitalized":null,"dateChecked":"2020-09-04T24:00:00Z","totalTestsViral":null,"positiveTestsViral":null,"negativeTestsViral":null,"positiveCasesViral":66614,"deathConfirmed":null,"deathProbable":null,"totalTestEncountersViral":null,"totalTestsPeopleViral":643829,"totalTestsAntibody":null,"positiveTestsAntibody":null,"negativeTestsAntibody":null,"totalTestsPeopleAntibody":50680,"positiveTestsPeopleAntibody":3106,"negativeTestsPeopleAntibody":47534,"totalTestsPeopleAntigen":13188,"positiveTestsPeopleAntigen":1642,"totalTestsAntigen":null,"positiveTestsAntigen":null,"fips":"19","positiveIncrease":1091,"negativeIncrease":6486,"total":642335,"totalTestResultsIncrease":7577,"posNeg":642335,"deathIncrease":6,"hospitalizedIncrease":0,"hash":"6aa0c23993a3e3e62a8e2dfca4ca3f44fdb97ff6","commercialScore":0,"negativeRegularScore":0,"negativeScore":0,"positiveScore":0,"score":0,"grade":""},{"date":20200903,"state":"IA","positive":65523,"probableCases":null,"negative":569235,"pending":null,"totalTestResultsSource":"posNeg","totalTestResults":634758,"hospitalizedCurrently":323,"hospitalizedCumulative":null,"inIcuCurrently":88,"inIcuCumulative":null,"onVentilatorCurrently":41,"onVentilatorCumulative":null,"recovered":48580,"dataQualityGrade":"A+","lastUpdateEt":"9/3/2020 00:00","dateModified":"2020-09-03T24:00:00Z","checkTimeEt":"09/02 20:00","death":1135,"hospitalized":null,"dateChecked":"2020-09-03T24:00:00Z","totalTestsViral":null,"positiveTestsViral":null,"negativeTestsViral":null,"positiveCasesViral":65523,"deathConfirmed":null,"deathProbable":null,"totalTestEncountersViral":null,"totalTestsPeopleViral":636250,"totalTestsAntibody":null,"positiveTestsAntibody":null,"negativeTestsAntibody":null,"totalTestsPeopleAntibody":50202,"positiveTestsPeopleAntibody":3091,"negativeTestsPeopleAntibody":47071,"totalTestsPeopleAntigen":13081,"positiveTestsPeopleAntigen":1628,"totalTestsAntigen":null,"positiveTestsAntigen":null,"fips":"19","positiveIncrease":878,"negativeIncrease":4226,"total":634758,"totalTestResultsIncrease":5104,"posNeg":634758,"deathIncrease":9,"hospitalizedIncrease":0,"hash":"c153022a12d9fc488c83add93c1e2166bb6f0aeb","commercialScore":0,"negativeRegularScore":0,"negativeScore":0,"positiveScore":0,"score":0,"grade":""},{"date":20200902,"state":"IA","positive":64645,"probableCases":null,"negative":565009,"pending":null,"totalTestResultsSource":"posNeg","totalTestResults":629654,"hospitalizedCurrently":310,"hospitalizedCumulative":null,"inIcuCurrently":87,"inIcuCumulative":null,"onVentilatorCurrently":39,"onVentilatorCumulative":null,"recovered":48074,"dataQualityGrade":"A+","lastUpdateEt":"9/2/2020 00:00","dateModified":"2020-09-02T24:00:00Z","checkTimeEt":"09/01 20:00","death":1126,"hospitalized":null,"dateChecked":"2020-09-02T24:00:00Z","totalTestsViral":null,"positiveTestsViral":null,"negativeTestsViral":null,"positiveCasesViral":64645,"deathConfirmed":null,"deathProbable":null,"totalTestEncountersViral":null,"totalTestsPeopleViral":631146,"totalTestsAntibody":null,"positiveTestsAntibody":null,"negativeTestsAntibody":null,"totalTestsPeopleAntibody":49749,"positiveTestsPeopleAntibody":3084,"negativeTestsPeopleAntibody":46625,"totalTestsPeopleAntigen":12809,"positiveTestsPeopleAntigen":1604,"totalTestsAntigen":null,"positiveTestsAntigen":null,"fips":"19","positiveIncrease":726,"negativeIncrease":5381,"total":629654,"totalTestResultsIncrease":6107,"posNeg":629654,"deathIncrease":3,"hospitalizedIncrease":0,"hash":"f3cae7985c77630ee22039add6dccdd0f6aeb6e5","commercialScore":0,"negativeRegularScore":0,"negativeScore":0,"positiveScore":0,"score":0,"grade":""},{"date":20200901,"state":"IA","positive":63919,"probableCases":null,"negative":559628,"pending":null,"totalTestResultsSource":"posNeg","totalTestResults":623547,"hospitalizedCurrently":311,"hospitalizedCumulative":null,"inIcuCurrently":88,"inIcuCumulative":null,"onVentilatorCurrently":43,"onVentilatorCumulative":null,"recovered":47437,"dataQualityGrade":"A+","lastUpdateEt":"9/1/2020 00:00","dateModified":"2020-09-01T24:00:00Z","checkTimeEt":"08/31 20:00","death":1123,"hospitalized":null,"dateChecked":"2020-09-01T24:00:00Z","totalTestsViral":null,"positiveTestsViral":null,"negativeTestsViral":null,"positiveCasesViral":63919,"deathConfirmed":null,"deathProbable":null,"totalTestEncountersViral":null,"totalTestsPeopleViral":625058,"totalTestsAntibody":null,"positiveTestsAntibody":null,"negativeTestsAntibody":null,"totalTestsPeopleAntibody":49415,"positiveTestsPeopleAntibody":3071,"negativeTestsPeopleAntibody":46304,"totalTestsPeopleAntigen":12398,"positiveTestsPeopleAntigen":1558,"totalTestsAntigen":null,"positiveTestsAntigen":null,"fips":"19","positiveIncrease":591,"negativeIncrease":2084,"total":623547,"totalTestResultsIncrease":2675,"posNeg":623547,"deathIncrease":7,"hospitalizedIncrease":0,"hash":"eb468e4536a8f058d044ab4ac9c03a4c5d3d791f","commercialScore":0,"negativeRegularScore":0,"negativeScore":0,"positiveScore":0,"score":0,"grade":""},{"date":20200831,"state":"IA","positive":63328,"probableCases":null,"negative":557544,"pending":null,"totalTestResultsSource":"posNeg","totalTestResults":620872,"hospitalizedCurrently":299,"hospitalizedCumulative":null,"inIcuCurrently":85,"inIcuCumulative":null,"onVentilatorCurrently":46,"onVentilatorCumulative":null,"recovered":46740,"dataQualityGrade":"A+","lastUpdateEt":"8/31/2020 00:00","dateModified":"2020-08-31T24:00:00Z","checkTimeEt":"08/30 20:00","death":1116,"hospitalized":null,"dateChecked":"2020-08-31T24:00:00Z","totalTestsViral":null,"positiveTestsViral":null,"negativeTestsViral":null,"positiveCasesViral":63328,"deathConfirmed":null,"deathProbable":null,"totalTestEncountersViral":null,"totalTestsPeopleViral":622372,"totalTestsAntibody":null,"positiveTestsAntibody":null,"negativeTestsAntibody":null,"totalTestsPeopleAntibody":49191,"positiveTestsPeopleAntibody":3052,"negativeTestsPeopleAntibody":46099,"totalTestsPeopleAntigen":11957,"positiveTestsPeopleAntigen":1500,"totalTestsAntigen":null,"positiveTestsAntigen":null,"fips":"19","positiveIncrease":608,"negativeIncrease":3169,"total":620872,"totalTestResultsIncrease":3777,"posNeg":620872,"deathIncrease":3,"hospitalizedIncrease":0,"hash":"5b5da3372f658ec2502b309b645b79256bfda2f6","commercialScore":0,"negativeRegularScore":0,"negativeScore":0,"positiveScore":0,"score":0,"grade":""},{"date":20200830,"state":"IA","positive":62720,"probableCases":null,"negative":554375,"pending":null,"totalTestResultsSource":"posNeg","totalTestResults":617095,"hospitalizedCurrently":308,"hospitalizedCumulative":null,"inIcuCurrently":88,"inIcuCumulative":null,"onVentilatorCurrently":42,"onVentilatorCumulative":null,"recovered":46555,"dataQualityGrade":"A+","lastUpdateEt":"8/30/2020 00:00","dateModified":"2020-08-30T24:00:00Z","checkTimeEt":"08/29 20:00","death":1113,"hospitalized":null,"dateChecked":"2020-08-30T24:00:00Z","totalTestsViral":null,"positiveTestsViral":null,"negativeTestsViral":null,"positiveCasesViral":62720,"deathConfirmed":null,"deathProbable":null,"totalTestEncountersViral":null,"totalTestsPeopleViral":618597,"totalTestsAntibody":null,"positiveTestsAntibody":null,"negativeTestsAntibody":null,"totalTestsPeopleAntibody":49157,"positiveTestsPeopleAntibody":3044,"negativeTestsPeopleAntibody":46073,"totalTestsPeopleAntigen":11962,"positiveTestsPeopleAntigen":1488,"totalTestsAntigen":null,"positiveTestsAntigen":null,"fips":"19","positiveIncrease":971,"negativeIncrease":3545,"total":617095,"totalTestResultsIncrease":4516,"posNeg":617095,"deathIncrease":5,"hospitalizedIncrease":0,"hash":"41b028184d366f4b758086d14246e62d4afbfea8","commercialScore":0,"negativeRegularScore":0,"negativeScore":0,"positiveScore":0,"score":0,"grade":""},{"date":20200829,"state":"IA","positive":61749,"probableCases":null,"negative":550830,"pending":null,"totalTestResultsSource":"posNeg","totalTestResults":612579,"hospitalizedCurrently":315,"hospitalizedCumulative":null,"inIcuCurrently":91,"inIcuCumulative":null,"onVentilatorCurrently":43,"onVentilatorCumulative":null,"recovered":46409,"dataQualityGrade":"A+","lastUpdateEt":"8/29/2020 00:00","dateModified":"2020-08-29T24:00:00Z","checkTimeEt":"08/28 20:00","death":1108,"hospitalized":null,"dateChecked":"2020-08-29T24:00:00Z","totalTestsViral":null,"positiveTestsViral":null,"negativeTestsViral":null,"positiveCasesViral":61749,"deathConfirmed":null,"deathProbable":null,"totalTestEncountersViral":null,"totalTestsPeopleViral":614094,"totalTestsAntibody":null,"positiveTestsAntibody":null,"negativeTestsAntibody":null,"totalTestsPeopleAntibody":48817,"positiveTestsPeopleAntibody":3034,"negativeTestsPeopleAntibody":45743,"totalTestsPeopleAntigen":11775,"positiveTestsPeopleAntigen":1450,"totalTestsAntigen":null,"positiveTestsAntigen":null,"fips":"19","positiveIncrease":778,"negativeIncrease":4642,"total":612579,"totalTestResultsIncrease":5420,"posNeg":612579,"deathIncrease":13,"hospitalizedIncrease":0,"hash":"24f470ce6ccca3c3faf9f4b14b4713b7cfa0d67e","commercialScore":0,"negativeRegularScore":0,"negativeScore":0,"positiveScore":0,"score":0,"grade":""},{"date":20200828,"state":"IA","positive":60971,"probableCases":null,"negative":546188,"pending":null,"totalTestResultsSource":"posNeg","totalTestResults":607159,"hospitalizedCurrently":299,"hospitalizedCumulative":null,"inIcuCurrently":91,"inIcuCumulative":null,"onVentilatorCurrently":41,"onVentilatorCumulative":null,"recovered":45977,"dataQualityGrade":"A+","lastUpdateEt":"8/28/2020 00:00","dateModified":"2020-08-28T24:00:00Z","checkTimeEt":"08/27 20:00","death":1095,"hospitalized":null,"dateChecked":"2020-08-28T24:00:00Z","totalTestsViral":null,"positiveTestsViral":null,"negativeTestsViral":null,"positiveCasesViral":60971,"deathConfirmed":null,"deathProbable":null,"totalTestEncountersViral":null,"totalTestsPeopleViral":608675,"totalTestsAntibody":null,"positiveTestsAntibody":null,"negativeTestsAntibody":null,"totalTestsPeopleAntibody":48321,"positiveTestsPeopleAntibody":3020,"negativeTestsPeopleAntibody":45261,"totalTestsPeopleAntigen":11155,"positiveTestsPeopleAntigen":1382,"totalTestsAntigen":null,"positiveTestsAntigen":null,"fips":"19","positiveIncrease":1185,"negativeIncrease":4331,"total":607159,"totalTestResultsIncrease":5516,"posNeg":607159,"deathIncrease":12,"hospitalizedIncrease":0,"hash":"c4ed42c6b37dbdf51783c271368672de04b7ea29","commercialScore":0,"negativeRegularScore":0,"negativeScore":0,"positiveScore":0,"score":0,"grade":""},{"date":20200827,"state":"IA","positive":59786,"probableCases":null,"negative":541857,"pending":null,"totalTestResultsSource":"posNeg","totalTestResults":601643,"hospitalizedCurrently":305,"hospitalizedCumulative":null,"inIcuCurrently":99,"inIcuCumulative":null,"onVentilatorCurrently":44,"onVentilatorCumulative":null,"recovered":45447,"dataQualityGrade":"A+","lastUpdateEt":"8/27/2020 00:00","dateModified":"2020-08-27T24:00:00Z","checkTimeEt":"08/26 20:00","death":1083,"hospitalized":null,"dateChecked":"2020-08-27T24:00:00Z","totalTestsViral":null,"positiveTestsViral":null,"negativeTestsViral":null,"positiveCasesViral":59786,"deathConfirmed":null,"deathProbable":null,"totalTestEncountersViral":null,"totalTestsPeopleViral":616510,"totalTestsAntibody":null,"positiveTestsAntibody":null,"negativeTestsAntibody":null,"totalTestsPeopleAntibody":47705,"positiveTestsPeopleAntibody":3011,"negativeTestsPeopleAntibody":44654,"totalTestsPeopleAntigen":null,"positiveTestsPeopleAntigen":null,"totalTestsAntigen":null,"positiveTestsAntigen":null,"fips":"19","positiveIncrease":1551,"negativeIncrease":6284,"total":601643,"totalTestResultsIncrease":7835,"posNeg":601643,"deathIncrease":16,"hospitalizedIncrease":0,"hash":"d970cc95f5eb96459f64e6210506ca6873daa022","commercialScore":0,"negativeRegularScore":0,"negativeScore":0,"positiveScore":0,"score":0,"grade":""},{"date":20200826,"state":"IA","positive":58235,"probableCases":null,"negative":535573,"pending":null,"totalTestResultsSource":"posNeg","totalTestResults":593808,"hospitalizedCurrently":313,"hospitalizedCumulative":null,"inIcuCurrently":102,"inIcuCumulative":null,"onVentilatorCurrently":40,"onVentilatorCumulative":null,"recovered":44903,"dataQualityGrade":"A+","lastUpdateEt":"8/26/2020 00:00","dateModified":"2020-08-26T24:00:00Z","checkTimeEt":"08/25 20:00","death":1067,"hospitalized":null,"dateChecked":"2020-08-26T24:00:00Z","totalTestsViral":null,"positiveTestsViral":null,"negativeTestsViral":null,"positiveCasesViral":58235,"deathConfirmed":null,"deathProbable":null,"totalTestEncountersViral":null,"totalTestsPeopleViral":608333,"totalTestsAntibody":null,"positiveTestsAntibody":null,"negativeTestsAntibody":null,"totalTestsPeopleAntibody":47597,"positiveTestsPeopleAntibody":2999,"negativeTestsPeopleAntibody":44558,"totalTestsPeopleAntigen":null,"positiveTestsPeopleAntigen":null,"totalTestsAntigen":null,"positiveTestsAntigen":null,"fips":"19","positiveIncrease":941,"negativeIncrease":5124,"total":593808,"totalTestResultsIncrease":6065,"posNeg":593808,"deathIncrease":15,"hospitalizedIncrease":0,"hash":"536e3c0dabe60af17745fa8abb4b848b924efade","commercialScore":0,"negativeRegularScore":0,"negativeScore":0,"positiveScore":0,"score":0,"grade":""},{"date":20200825,"state":"IA","positive":57294,"probableCases":null,"negative":530449,"pending":null,"totalTestResultsSource":"posNeg","totalTestResults":587743,"hospitalizedCurrently":295,"hospitalizedCumulative":null,"inIcuCurrently":82,"inIcuCumulative":null,"onVentilatorCurrently":37,"onVentilatorCumulative":null,"recovered":4439