[{"date":20201022,"state":"MS","positive":113081,"probableCases":12616,"negative":729544,"pending":null,"totalTestResultsSource":null,"totalTestResults":842625,"hospitalizedCurrently":695,"hospitalizedCumulative":6380,"inIcuCurrently":157,"inIcuCumulative":null,"onVentilatorCurrently":68,"onVentilatorCumulative":null,"recovered":97675,"dataQualityGrade":"A+","lastUpdateEt":"10/21/2020 00:00","dateModified":"2020-10-21T00:00:00Z","checkTimeEt":"10/20 20:00","death":3231,"hospitalized":6380,"dateChecked":"2020-10-21T00:00:00Z","totalTestsViral":827497,"positiveTestsViral":null,"negativeTestsViral":null,"positiveCasesViral":100465,"deathConfirmed":2926,"deathProbable":305,"totalTestEncountersViral":null,"totalTestsPeopleViral":null,"totalTestsAntibody":41053,"positiveTestsAntibody":95,"negativeTestsAntibody":null,"totalTestsPeopleAntibody":null,"positiveTestsPeopleAntibody":null,"negativeTestsPeopleAntibody":null,"totalTestsPeopleAntigen":null,"positiveTestsPeopleAntigen":null,"totalTestsAntigen":72982,"positiveTestsAntigen":null,"fips":"28","positiveIncrease":958,"negativeIncrease":0,"total":842625,"totalTestResultsIncrease":958,"posNeg":842625,"deathIncrease":8,"hospitalizedIncrease":0,"hash":"59d10684d62030cba04222cd1727eb907eb79b94","commercialScore":0,"negativeRegularScore":0,"negativeScore":0,"positiveScore":0,"score":0,"grade":""},{"date":20201021,"state":"MS","positive":112123,"probableCases":12204,"negative":729544,"pending":null,"totalTestResultsSource":null,"totalTestResults":841667,"hospitalizedCurrently":711,"hospitalizedCumulative":6380,"inIcuCurrently":151,"inIcuCumulative":null,"onVentilatorCurrently":73,"onVentilatorCumulative":null,"recovered":97675,"dataQualityGrade":"A+","lastUpdateEt":"10/20/2020 00:00","dateModified":"2020-10-20T00:00:00Z","checkTimeEt":"10/19 20:00","death":3223,"hospitalized":6380,"dateChecked":"2020-10-20T00:00:00Z","totalTestsViral":827497,"positiveTestsViral":null,"negativeTestsViral":null,"positiveCasesViral":99919,"deathConfirmed":2919,"deathProbable":304,"totalTestEncountersViral":null,"totalTestsPeopleViral":null,"totalTestsAntibody":41053,"positiveTestsAntibody":95,"negativeTestsAntibody":null,"totalTestsPeopleAntibody":null,"positiveTestsPeopleAntibody":null,"negativeTestsPeopleAntibody":null,"totalTestsPeopleAntigen":null,"positiveTestsPeopleAntigen":null,"totalTestsAntigen":72982,"positiveTestsAntigen":null,"fips":"28","positiveIncrease":801,"negativeIncrease":0,"total":841667,"totalTestResultsIncrease":801,"posNeg":841667,"deathIncrease":21,"hospitalizedIncrease":0,"hash":"5009c0d98b4162096ee931afa3ea802838171f58","commercialScore":0,"negativeRegularScore":0,"negativeScore":0,"positiveScore":0,"score":0,"grade":""},{"date":20201020,"state":"MS","positive":111322,"probableCases":11871,"negative":729544,"pending":null,"totalTestResultsSource":null,"totalTestResults":840866,"hospitalizedCurrently":664,"hospitalizedCumulative":6380,"inIcuCurrently":161,"inIcuCumulative":null,"onVentilatorCurrently":73,"onVentilatorCumulative":null,"recovered":97675,"dataQualityGrade":"A+","lastUpdateEt":"10/19/2020 00:00","dateModified":"2020-10-19T00:00:00Z","checkTimeEt":"10/18 20:00","death":3202,"hospitalized":6380,"dateChecked":"2020-10-19T00:00:00Z","totalTestsViral":827497,"positiveTestsViral":null,"negativeTestsViral":null,"positiveCasesViral":99451,"deathConfirmed":2903,"deathProbable":299,"totalTestEncountersViral":null,"totalTestsPeopleViral":null,"totalTestsAntibody":41053,"positiveTestsAntibody":95,"negativeTestsAntibody":null,"totalTestsPeopleAntibody":null,"positiveTestsPeopleAntibody":null,"negativeTestsPeopleAntibody":null,"totalTestsPeopleAntigen":null,"positiveTestsPeopleAntigen":null,"totalTestsAntigen":72982,"positiveTestsAntigen":null,"fips":"28","positiveIncrease":730,"negativeIncrease":0,"total":840866,"totalTestResultsIncrease":730,"posNeg":840866,"deathIncrease":31,"hospitalizedIncrease":0,"hash":"42a01f200a4ed4d756cd0b6634521513500a2f10","commercialScore":0,"negativeRegularScore":0,"negativeScore":0,"positiveScore":0,"score":0,"grade":""},{"date":20201019,"state":"MS","positive":110592,"probableCases":11645,"negative":729544,"pending":null,"totalTestResultsSource":null,"totalTestResults":840136,"hospitalizedCurrently":653,"hospitalizedCumulative":6380,"inIcuCurrently":151,"inIcuCumulative":null,"onVentilatorCurrently":70,"onVentilatorCumulative":null,"recovered":97675,"dataQualityGrade":"A+","lastUpdateEt":"10/18/2020 00:00","dateModified":"2020-10-18T00:00:00Z","checkTimeEt":"10/17 20:00","death":3171,"hospitalized":6380,"dateChecked":"2020-10-18T00:00:00Z","totalTestsViral":827497,"positiveTestsViral":null,"negativeTestsViral":null,"positiveCasesViral":98947,"deathConfirmed":2879,"deathProbable":292,"totalTestEncountersViral":null,"totalTestsPeopleViral":null,"totalTestsAntibody":41053,"positiveTestsAntibody":95,"negativeTestsAntibody":null,"totalTestsPeopleAntibody":null,"positiveTestsPeopleAntibody":null,"negativeTestsPeopleAntibody":null,"totalTestsPeopleAntigen":null,"positiveTestsPeopleAntigen":null,"totalTestsAntigen":72982,"positiveTestsAntigen":null,"fips":"28","positiveIncrease":586,"negativeIncrease":0,"total":840136,"totalTestResultsIncrease":586,"posNeg":840136,"deathIncrease":0,"hospitalizedIncrease":143,"hash":"98fec03e43c8361c1a209cf1125e48357add9687","commercialScore":0,"negativeRegularScore":0,"negativeScore":0,"positiveScore":0,"score":0,"grade":""},{"date":20201018,"state":"MS","positive":110006,"probableCases":11531,"negative":729544,"pending":null,"totalTestResultsSource":null,"totalTestResults":839550,"hospitalizedCurrently":609,"hospitalizedCumulative":6237,"inIcuCurrently":140,"inIcuCumulative":null,"onVentilatorCurrently":69,"onVentilatorCumulative":null,"recovered":94165,"dataQualityGrade":"A+","lastUpdateEt":"10/16/2020 00:00","dateModified":"2020-10-16T00:00:00Z","checkTimeEt":"10/15 20:00","death":3171,"hospitalized":6237,"dateChecked":"2020-10-16T00:00:00Z","totalTestsViral":827497,"positiveTestsViral":null,"negativeTestsViral":null,"positiveCasesViral":98475,"deathConfirmed":2879,"deathProbable":292,"totalTestEncountersViral":null,"totalTestsPeopleViral":null,"totalTestsAntibody":41053,"positiveTestsAntibody":95,"negativeTestsAntibody":null,"totalTestsPeopleAntibody":null,"positiveTestsPeopleAntibody":null,"negativeTestsPeopleAntibody":null,"totalTestsPeopleAntigen":null,"positiveTestsPeopleAntigen":null,"totalTestsAntigen":72982,"positiveTestsAntigen":null,"fips":"28","positiveIncrease":0,"negativeIncrease":0,"total":839550,"totalTestResultsIncrease":0,"posNeg":839550,"deathIncrease":0,"hospitalizedIncrease":0,"hash":"2721c2f70c6d33d4ff98d69c03502aba0d5bedde","commercialScore":0,"negativeRegularScore":0,"negativeScore":0,"positiveScore":0,"score":0,"grade":""},{"date":20201017,"state":"MS","positive":110006,"probableCases":11531,"negative":729544,"pending":null,"totalTestResultsSource":null,"totalTestResults":839550,"hospitalizedCurrently":609,"hospitalizedCumulative":6237,"inIcuCurrently":140,"inIcuCumulative":null,"onVentilatorCurrently":69,"onVentilatorCumulative":null,"recovered":94165,"dataQualityGrade":"A+","lastUpdateEt":"10/16/2020 00:00","dateModified":"2020-10-16T00:00:00Z","checkTimeEt":"10/15 20:00","death":3171,"hospitalized":6237,"dateChecked":"2020-10-16T00:00:00Z","totalTestsViral":827497,"positiveTestsViral":null,"negativeTestsViral":null,"positiveCasesViral":98475,"deathConfirmed":2879,"deathProbable":292,"totalTestEncountersViral":null,"totalTestsPeopleViral":null,"totalTestsAntibody":41053,"positiveTestsAntibody":95,"negativeTestsAntibody":null,"totalTestsPeopleAntibody":null,"positiveTestsPeopleAntibody":null,"negativeTestsPeopleAntibody":null,"totalTestsPeopleAntigen":null,"positiveTestsPeopleAntigen":null,"totalTestsAntigen":72982,"positiveTestsAntigen":null,"fips":"28","positiveIncrease":751,"negativeIncrease":0,"total":839550,"totalTestResultsIncrease":751,"posNeg":839550,"deathIncrease":11,"hospitalizedIncrease":0,"hash":"c8fdce877608c2708ee876697d25eb88fcbf47bf","commercialScore":0,"negativeRegularScore":0,"negativeScore":0,"positiveScore":0,"score":0,"grade":""},{"date":20201016,"state":"MS","positive":109255,"probableCases":11302,"negative":729544,"pending":null,"totalTestResultsSource":null,"totalTestResults":838799,"hospitalizedCurrently":596,"hospitalizedCumulative":6237,"inIcuCurrently":146,"inIcuCumulative":null,"onVentilatorCurrently":75,"onVentilatorCumulative":null,"recovered":94165,"dataQualityGrade":"A+","lastUpdateEt":"10/15/2020 00:00","dateModified":"2020-10-15T00:00:00Z","checkTimeEt":"10/14 20:00","death":3160,"hospitalized":6237,"dateChecked":"2020-10-15T00:00:00Z","totalTestsViral":827497,"positiveTestsViral":null,"negativeTestsViral":null,"positiveCasesViral":97953,"deathConfirmed":2869,"deathProbable":291,"totalTestEncountersViral":null,"totalTestsPeopleViral":null,"totalTestsAntibody":41053,"positiveTestsAntibody":95,"negativeTestsAntibody":null,"totalTestsPeopleAntibody":null,"positiveTestsPeopleAntibody":null,"negativeTestsPeopleAntibody":null,"totalTestsPeopleAntigen":null,"positiveTestsPeopleAntigen":null,"totalTestsAntigen":72982,"positiveTestsAntigen":null,"fips":"28","positiveIncrease":1116,"negativeIncrease":24889,"total":838799,"totalTestResultsIncrease":26005,"posNeg":838799,"deathIncrease":8,"hospitalizedIncrease":0,"hash":"2dbe04083f49628d3920c9c0d2ae6f19cef6f8b3","commercialScore":0,"negativeRegularScore":0,"negativeScore":0,"positiveScore":0,"score":0,"grade":""},{"date":20201015,"state":"MS","positive":108139,"probableCases":10903,"negative":704655,"pending":null,"totalTestResultsSource":null,"totalTestResults":812794,"hospitalizedCurrently":598,"hospitalizedCumulative":6237,"inIcuCurrently":138,"inIcuCumulative":null,"onVentilatorCurrently":69,"onVentilatorCumulative":null,"recovered":94165,"dataQualityGrade":"A+","lastUpdateEt":"10/14/2020 00:00","dateModified":"2020-10-14T00:00:00Z","checkTimeEt":"10/13 20:00","death":3152,"hospitalized":6237,"dateChecked":"2020-10-14T00:00:00Z","totalTestsViral":796968,"positiveTestsViral":null,"negativeTestsViral":null,"positiveCasesViral":97236,"deathConfirmed":2864,"deathProbable":288,"totalTestEncountersViral":null,"totalTestsPeopleViral":null,"totalTestsAntibody":40048,"positiveTestsAntibody":95,"negativeTestsAntibody":null,"totalTestsPeopleAntibody":null,"positiveTestsPeopleAntibody":null,"negativeTestsPeopleAntibody":null,"totalTestsPeopleAntigen":null,"positiveTestsPeopleAntigen":null,"totalTestsAntigen":66989,"positiveTestsAntigen":null,"fips":"28","positiveIncrease":1322,"negativeIncrease":0,"total":812794,"totalTestResultsIncrease":1322,"posNeg":812794,"deathIncrease":12,"hospitalizedIncrease":0,"hash":"b4bad58fda4e6ffdbf0e5dc31144c676785a3d0d","commercialScore":0,"negativeRegularScore":0,"negativeScore":0,"positiveScore":0,"score":0,"grade":""},{"date":20201014,"state":"MS","positive":106817,"probableCases":10312,"negative":704655,"pending":null,"totalTestResultsSource":null,"totalTestResults":811472,"hospitalizedCurrently":633,"hospitalizedCumulative":6237,"inIcuCurrently":143,"inIcuCumulative":null,"onVentilatorCurrently":72,"onVentilatorCumulative":null,"recovered":94165,"dataQualityGrade":"A+","lastUpdateEt":"10/13/2020 00:00","dateModified":"2020-10-13T00:00:00Z","checkTimeEt":"10/12 20:00","death":3140,"hospitalized":6237,"dateChecked":"2020-10-13T00:00:00Z","totalTestsViral":796968,"positiveTestsViral":null,"negativeTestsViral":null,"positiveCasesViral":96505,"deathConfirmed":2855,"deathProbable":285,"totalTestEncountersViral":null,"totalTestsPeopleViral":null,"totalTestsAntibody":40048,"positiveTestsAntibody":95,"negativeTestsAntibody":null,"totalTestsPeopleAntibody":null,"positiveTestsPeopleAntibody":null,"negativeTestsPeopleAntibody":null,"totalTestsPeopleAntigen":null,"positiveTestsPeopleAntigen":null,"totalTestsAntigen":66989,"positiveTestsAntigen":null,"fips":"28","positiveIncrease":876,"negativeIncrease":0,"total":811472,"totalTestResultsIncrease":876,"posNeg":811472,"deathIncrease":25,"hospitalizedIncrease":0,"hash":"df6f5ae077bff276c8badfb4f8ca0bfd5648ae63","commercialScore":0,"negativeRegularScore":0,"negativeScore":0,"positiveScore":0,"score":0,"grade":""},{"date":20201013,"state":"MS","positive":105941,"probableCases":9975,"negative":704655,"pending":null,"totalTestResultsSource":null,"totalTestResults":810596,"hospitalizedCurrently":600,"hospitalizedCumulative":6237,"inIcuCurrently":145,"inIcuCumulative":null,"onVentilatorCurrently":69,"onVentilatorCumulative":null,"recovered":94165,"dataQualityGrade":"A+","lastUpdateEt":"10/12/2020 00:00","dateModified":"2020-10-12T00:00:00Z","checkTimeEt":"10/11 20:00","death":3115,"hospitalized":6237,"dateChecked":"2020-10-12T00:00:00Z","totalTestsViral":796968,"positiveTestsViral":null,"negativeTestsViral":null,"positiveCasesViral":95966,"deathConfirmed":2839,"deathProbable":276,"totalTestEncountersViral":null,"totalTestsPeopleViral":null,"totalTestsAntibody":40048,"positiveTestsAntibody":95,"negativeTestsAntibody":null,"totalTestsPeopleAntibody":null,"positiveTestsPeopleAntibody":null,"negativeTestsPeopleAntibody":null,"totalTestsPeopleAntigen":null,"positiveTestsPeopleAntigen":null,"totalTestsAntigen":66989,"positiveTestsAntigen":null,"fips":"28","positiveIncrease":713,"negativeIncrease":0,"total":810596,"totalTestResultsIncrease":713,"posNeg":810596,"deathIncrease":14,"hospitalizedIncrease":0,"hash":"d1401411cdc8daf4673854028c736803c79d9fbb","commercialScore":0,"negativeRegularScore":0,"negativeScore":0,"positiveScore":0,"score":0,"grade":""},{"date":20201012,"state":"MS","positive":105228,"probableCases":9685,"negative":704655,"pending":null,"totalTestResultsSource":null,"totalTestResults":809883,"hospitalizedCurrently":600,"hospitalizedCumulative":6237,"inIcuCurrently":136,"inIcuCumulative":null,"onVentilatorCurrently":59,"onVentilatorCumulative":null,"recovered":94165,"dataQualityGrade":"A+","lastUpdateEt":"10/11/2020 00:00","dateModified":"2020-10-11T00:00:00Z","checkTimeEt":"10/10 20:00","death":3101,"hospitalized":6237,"dateChecked":"2020-10-11T00:00:00Z","totalTestsViral":796968,"positiveTestsViral":null,"negativeTestsViral":null,"positiveCasesViral":95543,"deathConfirmed":2829,"deathProbable":272,"totalTestEncountersViral":null,"totalTestsPeopleViral":null,"totalTestsAntibody":40048,"positiveTestsAntibody":95,"negativeTestsAntibody":null,"totalTestsPeopleAntibody":null,"positiveTestsPeopleAntibody":null,"negativeTestsPeopleAntibody":null,"totalTestsPeopleAntigen":null,"positiveTestsPeopleAntigen":null,"totalTestsAntigen":66989,"positiveTestsAntigen":null,"fips":"28","positiveIncrease":296,"negativeIncrease":0,"total":809883,"totalTestResultsIncrease":296,"posNeg":809883,"deathIncrease":0,"hospitalizedIncrease":184,"hash":"76f3ecaa6705929a5d45d31785b35a61c472f7e6","commercialScore":0,"negativeRegularScore":0,"negativeScore":0,"positiveScore":0,"score":0,"grade":""},{"date":20201011,"state":"MS","positive":104932,"probableCases":9643,"negative":704655,"pending":null,"totalTestResultsSource":null,"totalTestResults":809587,"hospitalizedCurrently":600,"hospitalizedCumulative":6053,"inIcuCurrently":136,"inIcuCumulative":null,"onVentilatorCurrently":59,"onVentilatorCumulative":null,"recovered":90577,"dataQualityGrade":"A+","lastUpdateEt":"10/10/2020 00:00","dateModified":"2020-10-10T00:00:00Z","checkTimeEt":"10/09 20:00","death":3101,"hospitalized":6053,"dateChecked":"2020-10-10T00:00:00Z","totalTestsViral":796968,"positiveTestsViral":null,"negativeTestsViral":null,"positiveCasesViral":95289,"deathConfirmed":2829,"deathProbable":272,"totalTestEncountersViral":null,"totalTestsPeopleViral":null,"totalTestsAntibody":40048,"positiveTestsAntibody":95,"negativeTestsAntibody":null,"totalTestsPeopleAntibody":null,"positiveTestsPeopleAntibody":null,"negativeTestsPeopleAntibody":null,"totalTestsPeopleAntigen":null,"positiveTestsPeopleAntigen":null,"totalTestsAntigen":66989,"positiveTestsAntigen":null,"fips":"28","positiveIncrease":294,"negativeIncrease":0,"total":809587,"totalTestResultsIncrease":294,"posNeg":809587,"deathIncrease":5,"hospitalizedIncrease":0,"hash":"245ba83f2b6cc7dba38b00a196cf7e561bfe54c0","commercialScore":0,"negativeRegularScore":0,"negativeScore":0,"positiveScore":0,"score":0,"grade":""},{"date":20201010,"state":"MS","positive":104638,"probableCases":9550,"negative":704655,"pending":null,"totalTestResultsSource":null,"totalTestResults":809293,"hospitalizedCurrently":600,"hospitalizedCumulative":6053,"inIcuCurrently":136,"inIcuCumulative":null,"onVentilatorCurrently":59,"onVentilatorCumulative":null,"recovered":90577,"dataQualityGrade":"A+","lastUpdateEt":"10/9/2020 00:00","dateModified":"2020-10-09T00:00:00Z","checkTimeEt":"10/08 20:00","death":3096,"hospitalized":6053,"dateChecked":"2020-10-09T00:00:00Z","totalTestsViral":796968,"positiveTestsViral":null,"negativeTestsViral":null,"positiveCasesViral":95088,"deathConfirmed":2825,"deathProbable":271,"totalTestEncountersViral":null,"totalTestsPeopleViral":null,"totalTestsAntibody":40048,"positiveTestsAntibody":95,"negativeTestsAntibody":null,"totalTestsPeopleAntibody":null,"positiveTestsPeopleAntibody":null,"negativeTestsPeopleAntibody":null,"totalTestsPeopleAntigen":null,"positiveTestsPeopleAntigen":null,"totalTestsAntigen":66989,"positiveTestsAntigen":null,"fips":"28","positiveIncrease":957,"negativeIncrease":0,"total":809293,"totalTestResultsIncrease":957,"posNeg":809293,"deathIncrease":16,"hospitalizedIncrease":0,"hash":"10be521f065ac9856689b87ca3aff7880dd4ff9a","commercialScore":0,"negativeRegularScore":0,"negativeScore":0,"positiveScore":0,"score":0,"grade":""},{"date":20201009,"state":"MS","positive":103681,"probableCases":9175,"negative":704655,"pending":null,"totalTestResultsSource":null,"totalTestResults":808336,"hospitalizedCurrently":627,"hospitalizedCumulative":6053,"inIcuCurrently":130,"inIcuCumulative":null,"onVentilatorCurrently":64,"onVentilatorCumulative":null,"recovered":90577,"dataQualityGrade":"A+","lastUpdateEt":"10/8/2020 00:00","dateModified":"2020-10-08T00:00:00Z","checkTimeEt":"10/07 20:00","death":3080,"hospitalized":6053,"dateChecked":"2020-10-08T00:00:00Z","totalTestsViral":796968,"positiveTestsViral":null,"negativeTestsViral":null,"positiveCasesViral":94506,"deathConfirmed":2812,"deathProbable":268,"totalTestEncountersViral":null,"totalTestsPeopleViral":null,"totalTestsAntibody":40048,"positiveTestsAntibody":95,"negativeTestsAntibody":null,"totalTestsPeopleAntibody":null,"positiveTestsPeopleAntibody":null,"negativeTestsPeopleAntibody":null,"totalTestsPeopleAntigen":null,"positiveTestsPeopleAntigen":null,"totalTestsAntigen":66989,"positiveTestsAntigen":null,"fips":"28","positiveIncrease":862,"negativeIncrease":0,"total":808336,"totalTestResultsIncrease":862,"posNeg":808336,"deathIncrease":6,"hospitalizedIncrease":0,"hash":"2e68990d27e9397301471ce28adf96b327f774d2","commercialScore":0,"negativeRegularScore":0,"negativeScore":0,"positiveScore":0,"score":0,"grade":""},{"date":20201008,"state":"MS","positive":102819,"probableCases":8938,"negative":704655,"pending":null,"totalTestResultsSource":null,"totalTestResults":807474,"hospitalizedCurrently":606,"hospitalizedCumulative":6053,"inIcuCurrently":139,"inIcuCumulative":null,"onVentilatorCurrently":66,"onVentilatorCumulative":null,"recovered":90577,"dataQualityGrade":"A+","lastUpdateEt":"10/7/2020 00:00","dateModified":"2020-10-07T00:00:00Z","checkTimeEt":"10/06 20:00","death":3074,"hospitalized":6053,"dateChecked":"2020-10-07T00:00:00Z","totalTestsViral":796968,"positiveTestsViral":null,"negativeTestsViral":null,"positiveCasesViral":93881,"deathConfirmed":2807,"deathProbable":267,"totalTestEncountersViral":null,"totalTestsPeopleViral":null,"totalTestsAntibody":40048,"positiveTestsAntibody":95,"negativeTestsAntibody":null,"totalTestsPeopleAntibody":null,"positiveTestsPeopleAntibody":null,"negativeTestsPeopleAntibody":null,"totalTestsPeopleAntigen":null,"positiveTestsPeopleAntigen":null,"totalTestsAntigen":66989,"positiveTestsAntigen":null,"fips":"28","positiveIncrease":578,"negativeIncrease":0,"total":807474,"totalTestResultsIncrease":578,"posNeg":807474,"deathIncrease":23,"hospitalizedIncrease":0,"hash":"f86c876c6c813c47039190c5a5ed3cf25a77b9e5","commercialScore":0,"negativeRegularScore":0,"negativeScore":0,"positiveScore":0,"score":0,"grade":""},{"date":20201007,"state":"MS","positive":102241,"probableCases":8819,"negative":704655,"pending":null,"totalTestResultsSource":null,"totalTestResults":806896,"hospitalizedCurrently":571,"hospitalizedCumulative":6053,"inIcuCurrently":127,"inIcuCumulative":null,"onVentilatorCurrently":62,"onVentilatorCumulative":null,"recovered":90577,"dataQualityGrade":"A+","lastUpdateEt":"10/6/2020 00:00","dateModified":"2020-10-06T00:00:00Z","checkTimeEt":"10/05 20:00","death":3051,"hospitalized":6053,"dateChecked":"2020-10-06T00:00:00Z","totalTestsViral":796968,"positiveTestsViral":null,"negativeTestsViral":null,"positiveCasesViral":93422,"deathConfirmed":2794,"deathProbable":257,"totalTestEncountersViral":null,"totalTestsPeopleViral":null,"totalTestsAntibody":40048,"positiveTestsAntibody":95,"negativeTestsAntibody":null,"totalTestsPeopleAntibody":null,"positiveTestsPeopleAntibody":null,"negativeTestsPeopleAntibody":null,"totalTestsPeopleAntigen":null,"positiveTestsPeopleAntigen":null,"totalTestsAntigen":66989,"positiveTestsAntigen":null,"fips":"28","positiveIncrease":1538,"negativeIncrease":0,"total":806896,"totalTestResultsIncrease":1538,"posNeg":806896,"deathIncrease":38,"hospitalizedIncrease":0,"hash":"7fed95b9a4d74192caf11acaa37031c4bda8b103","commercialScore":0,"negativeRegularScore":0,"negativeScore":0,"positiveScore":0,"score":0,"grade":""},{"date":20201006,"state":"MS","positive":100703,"probableCases":8390,"negative":704655,"pending":null,"totalTestResultsSource":null,"totalTestResults":805358,"hospitalizedCurrently":554,"hospitalizedCumulative":6053,"inIcuCurrently":128,"inIcuCumulative":null,"onVentilatorCurrently":64,"onVentilatorCumulative":null,"recovered":90577,"dataQualityGrade":"A+","lastUpdateEt":"10/5/2020 00:00","dateModified":"2020-10-05T00:00:00Z","checkTimeEt":"10/04 20:00","death":3013,"hospitalized":6053,"dateChecked":"2020-10-05T00:00:00Z","totalTestsViral":796968,"positiveTestsViral":null,"negativeTestsViral":null,"positiveCasesViral":92313,"deathConfirmed":2765,"deathProbable":248,"totalTestEncountersViral":null,"totalTestsPeopleViral":null,"totalTestsAntibody":40048,"positiveTestsAntibody":95,"negativeTestsAntibody":null,"totalTestsPeopleAntibody":null,"positiveTestsPeopleAntibody":null,"negativeTestsPeopleAntibody":null,"totalTestsPeopleAntigen":null,"positiveTestsPeopleAntigen":null,"totalTestsAntigen":66989,"positiveTestsAntigen":null,"fips":"28","positiveIncrease":0,"negativeIncrease":0,"total":805358,"totalTestResultsIncrease":0,"posNeg":805358,"deathIncrease":0,"hospitalizedIncrease":0,"hash":"325562c601a8d2b943074a85083837112c34587a","commercialScore":0,"negativeRegularScore":0,"negativeScore":0,"positiveScore":0,"score":0,"grade":""},{"date":20201005,"state":"MS","positive":100703,"probableCases":8390,"negative":704655,"pending":null,"totalTestResultsSource":null,"totalTestResults":805358,"hospitalizedCurrently":554,"hospitalizedCumulative":6053,"inIcuCurrently":128,"inIcuCumulative":null,"onVentilatorCurrently":64,"onVentilatorCumulative":null,"recovered":90577,"dataQualityGrade":"A+","lastUpdateEt":"10/4/2020 00:00","dateModified":"2020-10-04T00:00:00Z","checkTimeEt":"10/03 20:00","death":3013,"hospitalized":6053,"dateChecked":"2020-10-04T00:00:00Z","totalTestsViral":796968,"positiveTestsViral":null,"negativeTestsViral":null,"positiveCasesViral":92313,"deathConfirmed":2765,"deathProbable":248,"totalTestEncountersViral":null,"totalTestsPeopleViral":null,"totalTestsAntibody":40048,"positiveTestsAntibody":95,"negativeTestsAntibody":null,"totalTestsPeopleAntibody":null,"positiveTestsPeopleAntibody":null,"negativeTestsPeopleAntibody":null,"totalTestsPeopleAntigen":null,"positiveTestsPeopleAntigen":null,"totalTestsAntigen":66989,"positiveTestsAntigen":null,"fips":"28","positiveIncrease":215,"negativeIncrease":65812,"total":805358,"totalTestResultsIncrease":66027,"posNeg":805358,"deathIncrease":0,"hospitalizedIncrease":78,"hash":"3aa4e00547935961a9608ee496868e6c510adc15","commercialScore":0,"negativeRegularScore":0,"negativeScore":0,"positiveScore":0,"score":0,"grade":""},{"date":20201004,"state":"MS","positive":100488,"probableCases":8334,"negative":638843,"pending":null,"totalTestResultsSource":null,"totalTestResults":739331,"hospitalizedCurrently":515,"hospitalizedCumulative":5975,"inIcuCurrently":132,"inIcuCumulative":null,"onVentilatorCurrently":69,"onVentilatorCumulative":null,"recovered":89737,"dataQualityGrade":"A+","lastUpdateEt":"10/3/2020 00:00","dateModified":"2020-10-03T00:00:00Z","checkTimeEt":"10/02 20:00","death":3013,"hospitalized":5975,"dateChecked":"2020-10-03T00:00:00Z","totalTestsViral":728519,"positiveTestsViral":null,"negativeTestsViral":null,"positiveCasesViral":92154,"deathConfirmed":2765,"deathProbable":248,"totalTestEncountersViral":null,"totalTestsPeopleViral":null,"totalTestsAntibody":38720,"positiveTestsAntibody":95,"negativeTestsAntibody":null,"totalTestsPeopleAntibody":null,"positiveTestsPeopleAntibody":null,"negativeTestsPeopleAntibody":null,"totalTestsPeopleAntigen":null,"positiveTestsPeopleAntigen":null,"totalTestsAntigen":55946,"positiveTestsAntigen":null,"fips":"28","positiveIncrease":321,"negativeIncrease":0,"total":739331,"totalTestResultsIncrease":321,"posNeg":739331,"deathIncrease":2,"hospitalizedIncrease":0,"hash":"4d2f5077171bbcbc93579a2d3e0fa60489c76ba5","commercialScore":0,"negativeRegularScore":0,"negativeScore":0,"positiveScore":0,"score":0,"grade":""},{"date":20201003,"state":"MS","positive":100167,"probableCases":8215,"negative":638843,"pending":null,"totalTestResultsSource":null,"totalTestResults":739010,"hospitalizedCurrently":515,"hospitalizedCumulative":5975,"inIcuCurrently":132,"inIcuCumulative":null,"onVentilatorCurrently":69,"onVentilatorCumulative":null,"recovered":89737,"dataQualityGrade":"A+","lastUpdateEt":"10/2/2020 00:00","dateModified":"2020-10-02T00:00:00Z","checkTimeEt":"10/01 20:00","death":3011,"hospitalized":5975,"dateChecked":"2020-10-02T00:00:00Z","totalTestsViral":728519,"positiveTestsViral":null,"negativeTestsViral":null,"positiveCasesViral":91952,"deathConfirmed":2763,"deathProbable":248,"totalTestEncountersViral":null,"totalTestsPeopleViral":null,"totalTestsAntibody":38720,"positiveTestsAntibody":95,"negativeTestsAntibody":null,"totalTestsPeopleAntibody":null,"positiveTestsPeopleAntibody":null,"negativeTestsPeopleAntibody":null,"totalTestsPeopleAntigen":null,"positiveTestsPeopleAntigen":null,"totalTestsAntigen":55946,"positiveTestsAntigen":null,"fips":"28","positiveIncrease":609,"negativeIncrease":0,"total":739010,"totalTestResultsIncrease":609,"posNeg":739010,"deathIncrease":12,"hospitalizedIncrease":0,"hash":"c64f2b18dd5e293c64d9bbc8abfc441939e2b325","commercialScore":0,"negativeRegularScore":0,"negativeScore":0,"positiveScore":0,"score":0,"grade":""},{"date":20201002,"state":"MS","positive":99558,"probableCases":8060,"negative":638843,"pending":null,"totalTestResultsSource":null,"totalTestResults":738401,"hospitalizedCurrently":531,"hospitalizedCumulative":5975,"inIcuCurrently":134,"inIcuCumulative":null,"onVentilatorCurrently":68,"onVentilatorCumulative":null,"recovered":89737,"dataQualityGrade":"A+","lastUpdateEt":"10/1/2020 00:00","dateModified":"2020-10-01T00:00:00Z","checkTimeEt":"09/30 20:00","death":2999,"hospitalized":5975,"dateChecked":"2020-10-01T00:00:00Z","totalTestsViral":728519,"positiveTestsViral":null,"negativeTestsViral":null,"positiveCasesViral":91498,"deathConfirmed":2753,"deathProbable":246,"totalTestEncountersViral":null,"totalTestsPeopleViral":null,"totalTestsAntibody":38720,"positiveTestsAntibody":95,"negativeTestsAntibody":null,"totalTestsPeopleAntibody":null,"positiveTestsPeopleAntibody":null,"negativeTestsPeopleAntibody":null,"totalTestsPeopleAntigen":null,"positiveTestsPeopleAntigen":null,"totalTestsAntigen":55946,"positiveTestsAntigen":null,"fips":"28","positiveIncrease":672,"negativeIncrease":0,"total":738401,"totalTestResultsIncrease":672,"posNeg":738401,"deathIncrease":20,"hospitalizedIncrease":0,"hash":"4fffaf0a97b49f8b8799e9fca3e0242d02da4674","commercialScore":0,"negativeRegularScore":0,"negativeScore":0,"positiveScore":0,"score":0,"grade":""},{"date":20201001,"state":"MS","positive":98886,"probableCases":7906,"negative":638843,"pending":null,"totalTestResultsSource":null,"totalTestResults":737729,"hospitalizedCurrently":531,"hospitalizedCumulative":5975,"inIcuCurrently":134,"inIcuCumulative":null,"onVentilatorCurrently":68,"onVentilatorCumulative":null,"recovered":89737,"dataQualityGrade":"A+","lastUpdateEt":"9/30/2020 00:00","dateModified":"2020-09-30T00:00:00Z","checkTimeEt":"09/29 20:00","death":2979,"hospitalized":5975,"dateChecked":"2020-09-30T00:00:00Z","totalTestsViral":728519,"positiveTestsViral":null,"negativeTestsViral":null,"positiveCasesViral":90980,"deathConfirmed":2738,"deathProbable":241,"totalTestEncountersViral":null,"totalTestsPeopleViral":null,"totalTestsAntibody":38720,"positiveTestsAntibody":95,"negativeTestsAntibody":null,"totalTestsPeopleAntibody":null,"positiveTestsPeopleAntibody":null,"negativeTestsPeopleAntibody":null,"totalTestsPeopleAntigen":null,"positiveTestsPeopleAntigen":null,"totalTestsAntigen":55946,"positiveTestsAntigen":null,"fips":"28","positiveIncrease":696,"negativeIncrease":0,"total":737729,"totalTestResultsIncrease":696,"posNeg":737729,"deathIncrease":10,"hospitalizedIncrease":131,"hash":"d6f0c6ab37c11ed3e7b764a433c933814d9a02d9","commercialScore":0,"negativeRegularScore":0,"negativeScore":0,"positiveScore":0,"score":0,"grade":""},{"date":20200930,"state":"MS","positive":98190,"probableCases":7728,"negative":638843,"pending":null,"totalTestResultsSource":null,"totalTestResults":737033,"hospitalizedCurrently":556,"hospitalizedCumulative":5844,"inIcuCurrently":136,"inIcuCumulative":null,"onVentilatorCurrently":71,"onVentilatorCumulative":null,"recovered":89737,"dataQualityGrade":"A+","lastUpdateEt":"9/29/2020 00:00","dateModified":"2020-09-29T00:00:00Z","checkTimeEt":"09/28 20:00","death":2969,"hospitalized":5844,"dateChecked":"2020-09-29T00:00:00Z","totalTestsViral":728519,"positiveTestsViral":null,"negativeTestsViral":null,"positiveCasesViral":90462,"deathConfirmed":2729,"deathProbable":240,"totalTestEncountersViral":null,"totalTestsPeopleViral":null,"totalTestsAntibody":38720,"positiveTestsAntibody":95,"negativeTestsAntibody":null,"totalTestsPeopleAntibody":null,"positiveTestsPeopleAntibody":null,"negativeTestsPeopleAntibody":null,"totalTestsPeopleAntigen":null,"positiveTestsPeopleAntigen":null,"totalTestsAntigen":55946,"positiveTestsAntigen":null,"fips":"28","positiveIncrease":552,"negativeIncrease":0,"total":737033,"totalTestResultsIncrease":552,"posNeg":737033,"deathIncrease":12,"hospitalizedIncrease":0,"hash":"0e879303f428dbd15733f626497c89d2a9ebf186","commercialScore":0,"negativeRegularScore":0,"negativeScore":0,"positiveScore":0,"score":0,"grade":""},{"date":20200929,"state":"MS","positive":97638,"probableCases":7556,"negative":638843,"pending":null,"totalTestResultsSource":null,"totalTestResults":736481,"hospitalizedCurrently":564,"hospitalizedCumulative":5844,"inIcuCurrently":138,"inIcuCumulative":null,"onVentilatorCurrently":67,"onVentilatorCumulative":null,"recovered":89737,"dataQualityGrade":"A+","lastUpdateEt":"9/28/2020 00:00","dateModified":"2020-09-28T00:00:00Z","checkTimeEt":"09/27 20:00","death":2957,"hospitalized":5844,"dateChecked":"2020-09-28T00:00:00Z","totalTestsViral":728519,"positiveTestsViral":null,"negativeTestsViral":null,"positiveCasesViral":90082,"deathConfirmed":2722,"deathProbable":235,"totalTestEncountersViral":null,"totalTestsPeopleViral":null,"totalTestsAntibody":38720,"positiveTestsAntibody":95,"negativeTestsAntibody":null,"totalTestsPeopleAntibody":null,"positiveTestsPeopleAntibody":null,"negativeTestsPeopleAntibody":null,"totalTestsPeopleAntigen":null,"positiveTestsPeopleAntigen":null,"totalTestsAntigen":55946,"positiveTestsAntigen":null,"fips":"28","positiveIncrease":589,"negativeIncrease":0,"total":736481,"totalTestResultsIncrease":589,"posNeg":736481,"deathIncrease":36,"hospitalizedIncrease":0,"hash":"bedf08a35663817e4b689cce768cb35ad100a377","commercialScore":0,"negativeRegularScore":0,"negativeScore":0,"positiveScore":0,"score":0,"grade":""},{"date":20200928,"state":"MS","positive":97049,"probableCases":7373,"negative":638843,"pending":null,"totalTestResultsSource":null,"totalTestResults":735892,"hospitalizedCurrently":601,"hospitalizedCumulative":5844,"inIcuCurrently":147,"inIcuCumulative":null,"onVentilatorCurrently":68,"onVentilatorCumulative":null,"recovered":89737,"dataQualityGrade":"A+","lastUpdateEt":"9/27/2020 00:00","dateModified":"2020-09-27T00:00:00Z","checkTimeEt":"09/26 20:00","death":2921,"hospitalized":5844,"dateChecked":"2020-09-27T00:00:00Z","totalTestsViral":728519,"positiveTestsViral":null,"negativeTestsViral":null,"positiveCasesViral":89676,"deathConfirmed":2695,"deathProbable":226,"totalTestEncountersViral":null,"totalTestsPeopleViral":null,"totalTestsAntibody":38720,"positiveTestsAntibody":95,"negativeTestsAntibody":null,"totalTestsPeopleAntibody":null,"positiveTestsPeopleAntibody":null,"negativeTestsPeopleAntibody":null,"totalTestsPeopleAntigen":null,"positiveTestsPeopleAntigen":null,"totalTestsAntigen":55946,"positiveTestsAntigen":null,"fips":"28","positiveIncrease":190,"negativeIncrease":4807,"total":735892,"totalTestResultsIncrease":4997,"posNeg":735892,"deathIncrease":2,"hospitalizedIncrease":237,"hash":"5ee84196499f9bb1e0548c268c56058297b7279a","commercialScore":0,"negativeRegularScore":0,"negativeScore":0,"positiveScore":0,"score":0,"grade":""},{"date":20200927,"state":"MS","positive":96859,"probableCases":7354,"negative":634036,"pending":null,"totalTestResultsSource":null,"totalTestResults":730895,"hospitalizedCurrently":601,"hospitalizedCumulative":5607,"inIcuCurrently":147,"inIcuCumulative":null,"onVentilatorCurrently":68,"onVentilatorCumulative":null,"recovered":85327,"dataQualityGrade":"A+","lastUpdateEt":"9/26/2020 00:00","dateModified":"2020-09-26T00:00:00Z","checkTimeEt":"09/25 20:00","death":2919,"hospitalized":5607,"dateChecked":"2020-09-26T00:00:00Z","totalTestsViral":723389,"positiveTestsViral":null,"negativeTestsViral":null,"positiveCasesViral":89505,"deathConfirmed":2693,"deathProbable":226,"totalTestEncountersViral":null,"totalTestsPeopleViral":null,"totalTestsAntibody":38425,"positiveTestsAntibody":95,"negativeTestsAntibody":null,"totalTestsPeopleAntibody":null,"positiveTestsPeopleAntibody":null,"negativeTestsPeopleAntibody":null,"totalTestsPeopleAntigen":null,"positiveTestsPeopleAntigen":null,"totalTestsAntigen":55557,"positiveTestsAntigen":null,"fips":"28","positiveIncrease":182,"negativeIncrease":0,"total":730895,"totalTestResultsIncrease":182,"posNeg":730895,"deathIncrease":8,"hospitalizedIncrease":0,"hash":"c8b0c7b0c2465ff2c29376b897debf0cfa3d5f66","commercialScore":0,"negativeRegularScore":0,"negativeScore":0,"positiveScore":0,"score":0,"grade":""},{"date":20200926,"state":"MS","positive":96677,"probableCases":7324,"negative":634036,"pending":null,"totalTestResultsSource":null,"totalTestResults":730713,"hospitalizedCurrently":601,"hospitalizedCumulative":5607,"inIcuCurrently":147,"inIcuCumulative":null,"onVentilatorCurrently":68,"onVentilatorCumulative":null,"recovered":85327,"dataQualityGrade":"A+","lastUpdateEt":"9/25/2020 00:00","dateModified":"2020-09-25T00:00:00Z","checkTimeEt":"09/24 20:00","death":2911,"hospitalized":5607,"dateChecked":"2020-09-25T00:00:00Z","totalTestsViral":723389,"positiveTestsViral":null,"negativeTestsViral":null,"positiveCasesViral":89353,"deathConfirmed":2686,"deathProbable":225,"totalTestEncountersViral":null,"totalTestsPeopleViral":null,"totalTestsAntibody":38425,"positiveTestsAntibody":95,"negativeTestsAntibody":null,"totalTestsPeopleAntibody":null,"positiveTestsPeopleAntibody":null,"negativeTestsPeopleAntibody":null,"totalTestsPeopleAntigen":null,"positiveTestsPeopleAntigen":null,"totalTestsAntigen":55557,"positiveTestsAntigen":null,"fips":"28","positiveIncrease":645,"negativeIncrease":3682,"total":730713,"totalTestResultsIncrease":4327,"posNeg":730713,"deathIncrease":17,"hospitalizedIncrease":0,"hash":"f7f9667bffed6233bfbaa6d58e41b12c5d7f921d","commercialScore":0,"negativeRegularScore":0,"negativeScore":0,"positiveScore":0,"score":0,"grade":""},{"date":20200925,"state":"MS","positive":96032,"probableCases":7164,"negative":630354,"pending":null,"totalTestResultsSource":null,"totalTestResults":726386,"hospitalizedCurrently":609,"hospitalizedCumulative":5607,"inIcuCurrently":143,"inIcuCumulative":null,"onVentilatorCurrently":73,"onVentilatorCumulative":null,"recovered":85327,"dataQualityGrade":"A+","lastUpdateEt":"9/24/2020 00:00","dateModified":"2020-09-24T00:00:00Z","checkTimeEt":"09/23 20:00","death":2894,"hospitalized":5607,"dateChecked":"2020-09-24T00:00:00Z","totalTestsViral":719222,"positiveTestsViral":null,"negativeTestsViral":null,"positiveCasesViral":88868,"deathConfirmed":2671,"deathProbable":223,"totalTestEncountersViral":null,"totalTestsPeopleViral":null,"totalTestsAntibody":38109,"positiveTestsAntibody":95,"negativeTestsAntibody":null,"totalTestsPeopleAntibody":null,"positiveTestsPeopleAntibody":null,"negativeTestsPeopleAntibody":null,"totalTestsPeopleAntigen":null,"positiveTestsPeopleAntigen":null,"totalTestsAntigen":54718,"positiveTestsAntigen":null,"fips":"28","positiveIncrease":722,"negativeIncrease":3905,"total":726386,"totalTestResultsIncrease":4627,"posNeg":726386,"deathIncrease":20,"hospitalizedIncrease":0,"hash":"50151ef86db0afc601b53082512b9b3f838147c5","commercialScore":0,"negativeRegularScore":0,"negativeScore":0,"positiveScore":0,"score":0,"grade":""},{"date":20200924,"state":"MS","positive":95310,"probableCases":6907,"negative":626449,"pending":null,"totalTestResultsSource":null,"totalTestResults":721759,"hospitalizedCurrently":631,"hospitalizedCumulative":5607,"inIcuCurrently":149,"inIcuCumulative":null,"onVentilatorCurrently":84,"onVentilatorCumulative":null,"recovered":85327,"dataQualityGrade":"A+","lastUpdateEt":"9/23/2020 00:00","dateModified":"2020-09-23T00:00:00Z","checkTimeEt":"09/22 20:00","death":2874,"hospitalized":5607,"dateChecked":"2020-09-23T00:00:00Z","totalTestsViral":714852,"positiveTestsViral":null,"negativeTestsViral":null,"positiveCasesViral":88403,"deathConfirmed":2651,"deathProbable":223,"totalTestEncountersViral":null,"totalTestsPeopleViral":null,"totalTestsAntibody":37921,"positiveTestsAntibody":95,"negativeTestsAntibody":null,"totalTestsPeopleAntibody":null,"positiveTestsPeopleAntibody":null,"negativeTestsPeopleAntibody":null,"totalTestsPeopleAntigen":null,"positiveTestsPeopleAntigen":null,"totalTestsAntigen":53678,"positiveTestsAntigen":null,"fips":"28","positiveIncrease":737,"negativeIncrease":4311,"total":721759,"totalTestResultsIncrease":5048,"posNeg":721759,"deathIncrease":4,"hospitalizedIncrease":0,"hash":"df62ef808a32afe185321d4a12b352ca140125b2","commercialScore":0,"negativeRegularScore":0,"negativeScore":0,"positiveScore":0,"score":0,"grade":""},{"date":20200923,"state":"MS","positive":94573,"probableCases":6671,"negative":622138,"pending":null,"totalTestResultsSource":null,"totalTestResults":716711,"hospitalizedCurrently":620,"hospitalizedCumulative":5607,"inIcuCurrently":148,"inIcuCumulative":null,"onVentilatorCurrently":74,"onVentilatorCumulative":null,"recovered":85327,"dataQualityGrade":"A+","lastUpdateEt":"9/22/2020 00:00","dateModified":"2020-09-22T00:00:00Z","checkTimeEt":"09/21 20:00","death":2870,"hospitalized":5607,"dateChecked":"2020-09-22T00:00:00Z","totalTestsViral":710040,"positiveTestsViral":null,"negativeTestsViral":null,"positiveCasesViral":87902,"deathConfirmed":2647,"deathProbable":223,"totalTestEncountersViral":null,"totalTestsPeopleViral":null,"totalTestsAntibody":37700,"positiveTestsAntibody":95,"negativeTestsAntibody":null,"totalTestsPeopleAntibody":null,"positiveTestsPeopleAntibody":null,"negativeTestsPeopleAntibody":null,"totalTestsPeopleAntigen":null,"positiveTestsPeopleAntigen":null,"totalTestsAntigen":51862,"positiveTestsAntigen":null,"fips":"28","positiveIncrease":552,"negativeIncrease":3658,"total":716711,"totalTestResultsIncrease":4210,"posNeg":716711,"deathIncrease":24,"hospitalizedIncrease":0,"hash":"c29a480c31ffa8930733a4c5468ed6915e9e6166","commercialScore":0,"negativeRegularScore":0,"negativeScore":0,"positiveScore":0,"score":0,"grade":""},{"date":20200922,"state":"MS","positive":94021,"probableCases":6492,"negative":618480,"pending":null,"totalTestResultsSource":null,"totalTestResults":712501,"hospitalizedCurrently":642,"hospitalizedCumulative":5607,"inIcuCurrently":147,"inIcuCumulative":null,"onVentilatorCurrently":74,"onVentilatorCumulative":null,"recovered":85327,"dataQualityGrade":"A+","lastUpdateEt":"9/21/2020 00:00","dateModified":"2020-09-21T00:00:00Z","checkTimeEt":"09/20 20:00","death":2846,"hospitalized":5607,"dateChecked":"2020-09-21T00:00:00Z","totalTestsViral":706009,"positiveTestsViral":null,"negativeTestsViral":null,"positiveCasesViral":87529,"deathConfirmed":2625,"deathProbable":221,"totalTestEncountersViral":null,"totalTestsPeopleViral":null,"totalTestsAntibody":37439,"positiveTestsAntibody":95,"negativeTestsAntibody":null,"totalTestsPeopleAntibody":null,"positiveTestsPeopleAntibody":null,"negativeTestsPeopleAntibody":null,"totalTestsPeopleAntigen":null,"positiveTestsPeopleAntigen":null,"totalTestsAntigen":50385,"positiveTestsAntigen":null,"fips":"28","positiveIncrease":465,"negativeIncrease":5130,"total":712501,"totalTestResultsIncrease":5595,"posNeg":712501,"deathIncrease":36,"hospitalizedIncrease":0,"hash":"c29286029bcee544c758474fa4a31179d9507a4b","commercialScore":0,"negativeRegularScore":0,"negativeScore":0,"positiveScore":0,"score":0,"grade":""},{"date":20200921,"state":"MS","positive":93556,"probableCases":6396,"negative":613350,"pending":null,"totalTestResultsSource":null,"totalTestResults":706906,"hospitalizedCurrently":621,"hospitalizedCumulative":5607,"inIcuCurrently":162,"inIcuCumulative":null,"onVentilatorCurrently":77,"onVentilatorCumulative":null,"recovered":85327,"dataQualityGrade":"A+","lastUpdateEt":"9/20/2020 00:00","dateModified":"2020-09-20T00:00:00Z","checkTimeEt":"09/19 20:00","death":2810,"hospitalized":5607,"dateChecked":"2020-09-20T00:00:00Z","totalTestsViral":700510,"positiveTestsViral":null,"negativeTestsViral":null,"positiveCasesViral":87160,"deathConfirmed":2591,"deathProbable":219,"totalTestEncountersViral":null,"totalTestsPeopleViral":null,"totalTestsAntibody":37165,"positiveTestsAntibody":95,"negativeTestsAntibody":null,"totalTestsPeopleAntibody":null,"positiveTestsPeopleAntibody":null,"negativeTestsPeopleAntibody":null,"totalTestsPeopleAntigen":null,"positiveTestsPeopleAntigen":null,"totalTestsAntigen":49300,"positiveTestsAntigen":null,"fips":"28","positiveIncrease":192,"negativeIncrease":3551,"total":706906,"totalTestResultsIncrease":3743,"posNeg":706906,"deathIncrease":0,"hospitalizedIncrease":108,"hash":"05630a0dccff17d5aac226acc9af30b2a6663eb9","commercialScore":0,"negativeRegularScore":0,"negativeScore":0,"positiveScore":0,"score":0,"grade":""},{"date":20200920,"state":"MS","positive":93364,"probableCases":6319,"negative":609799,"pending":null,"totalTestResultsSource":null,"totalTestResults":703163,"hospitalizedCurrently":630,"hospitalizedCumulative":5499,"inIcuCurrently":171,"inIcuCumulative":null,"onVentilatorCurrently":87,"onVentilatorCumulative":null,"recovered":78971,"dataQualityGrade":"A+","lastUpdateEt":"9/19/2020 00:00","dateModified":"2020-09-19T00:00:00Z","checkTimeEt":"09/18 20:00","death":2810,"hospitalized":5499,"dateChecked":"2020-09-19T00:00:00Z","totalTestsViral":696618,"positiveTestsViral":null,"negativeTestsViral":null,"positiveCasesViral":87045,"deathConfirmed":2591,"deathProbable":219,"totalTestEncountersViral":null,"totalTestsPeopleViral":null,"totalTestsAntibody":36912,"positiveTestsAntibody":95,"negativeTestsAntibody":null,"totalTestsPeopleAntibody":null,"positiveTestsPeopleAntibody":null,"negativeTestsPeopleAntibody":null,"totalTestsPeopleAntigen":null,"positiveTestsPeopleAntigen":null,"totalTestsAntigen":48844,"positiveTestsAntigen":null,"fips":"28","positiveIncrease":277,"negativeIncrease":0,"total":703163,"totalTestResultsIncrease":277,"posNeg":703163,"deathIncrease":1,"hospitalizedIncrease":0,"hash":"64c00fade7ff5ee6975ca1e761b67b4d5da04c07","commercialScore":0,"negativeRegularScore":0,"negativeScore":0,"positiveScore":0,"score":0,"grade":""},{"date":20200919,"state":"MS","positive":93087,"probableCases":6268,"negative":609799,"pending":null,"totalTestResultsSource":null,"totalTestResults":702886,"hospitalizedCurrently":630,"hospitalizedCumulative":5499,"inIcuCurrently":171,"inIcuCumulative":null,"onVentilatorCurrently":87,"onVentilatorCumulative":null,"recovered":78971,"dataQualityGrade":"A+","lastUpdateEt":"9/18/2020 00:00","dateModified":"2020-09-18T00:00:00Z","checkTimeEt":"09/17 20:00","death":2809,"hospitalized":5499,"dateChecked":"2020-09-18T00:00:00Z","totalTestsViral":696618,"positiveTestsViral":null,"negativeTestsViral":null,"positiveCasesViral":86819,"deathConfirmed":2593,"deathProbable":216,"totalTestEncountersViral":null,"totalTestsPeopleViral":null,"totalTestsAntibody":36912,"positiveTestsAntibody":95,"negativeTestsAntibody":null,"totalTestsPeopleAntibody":null,"positiveTestsPeopleAntibody":null,"negativeTestsPeopleAntibody":null,"totalTestsPeopleAntigen":null,"positiveTestsPeopleAntigen":null,"totalTestsAntigen":48844,"positiveTestsAntigen":null,"fips":"28","positiveIncrease":1152,"negativeIncrease":68302,"total":702886,"totalTestResultsIncrease":69454,"posNeg":702886,"deathIncrease":29,"hospitalizedIncrease":0,"hash":"3d6ae6578dbc6e5c4fb4c545213560b6111afc2e","commercialScore":0,"negativeRegularScore":0,"negativeScore":0,"positiveScore":0,"score":0,"grade":""},{"date":20200918,"state":"MS","positive":91935,"probableCases":5991,"negative":541497,"pending":null,"totalTestResultsSource":null,"totalTestResults":633432,"hospitalizedCurrently":630,"hospitalizedCumulative":5499,"inIcuCurrently":171,"inIcuCumulative":null,"onVentilatorCurrently":87,"onVentilatorCumulative":null,"recovered":78971,"dataQualityGrade":"A+","lastUpdateEt":"9/17/2020 00:00","dateModified":"2020-09-17T00:00:00Z","checkTimeEt":"09/16 20:00","death":2780,"hospitalized":5499,"dateChecked":"2020-09-17T00:00:00Z","totalTestsViral":626881,"positiveTestsViral":null,"negativeTestsViral":null,"positiveCasesViral":85944,"deathConfirmed":2572,"deathProbable":208,"totalTestEncountersViral":null,"totalTestsPeopleViral":null,"totalTestsAntibody":29016,"positiveTestsAntibody":95,"negativeTestsAntibody":null,"totalTestsPeopleAntibody":null,"positiveTestsPeopleAntibody":null,"negativeTestsPeopleAntibody":null,"totalTestsPeopleAntigen":null,"positiveTestsPeopleAntigen":null,"totalTestsAntigen":40904,"positiveTestsAntigen":null,"fips":"28","positiveIncrease":0,"negativeIncrease":0,"total":633432,"totalTestResultsIncrease":0,"posNeg":633432,"deathIncrease":0,"hospitalizedIncrease":0,"hash":"4845ffaf0d8ef5d6b7719a588b4eb42015e33b11","commercialScore":0,"negativeRegularScore":0,"negativeScore":0,"positiveScore":0,"score":0,"grade":""},{"date":20200917,"state":"MS","positive":91935,"probableCases":5991,"negative":541497,"pending":null,"totalTestResultsSource":null,"totalTestResults":633432,"hospitalizedCurrently":622,"hospitalizedCumulative":5499,"inIcuCurrently":169,"inIcuCumulative":null,"onVentilatorCurrently":95,"onVentilatorCumulative":null,"recovered":78971,"dataQualityGrade":"A+","lastUpdateEt":"9/17/2020 00:00","dateModified":"2020-09-17T00:00:00Z","checkTimeEt":"09/16 20:00","death":2780,"hospitalized":5499,"dateChecked":"2020-09-17T00:00:00Z","totalTestsViral":626881,"positiveTestsViral":null,"negativeTestsViral":null,"positiveCasesViral":85944,"deathConfirmed":2572,"deathProbable":208,"totalTestEncountersViral":null,"totalTestsPeopleViral":null,"totalTestsAntibody":29016,"positiveTestsAntibody":95,"negativeTestsAntibody":null,"totalTestsPeopleAntibody":null,"positiveTestsPeopleAntibody":null,"negativeTestsPeopleAntibody":null,"totalTestsPeopleAntigen":null,"positiveTestsPeopleAntigen":null,"totalTestsAntigen":40904,"positiveTestsAntigen":null,"fips":"28","positiveIncrease":701,"negativeIncrease":0,"total":633432,"totalTestResultsIncrease":701,"posNeg":633432,"deathIncrease":24,"hospitalizedIncrease":0,"hash":"9c4d4b596bbc825af5f1ce42c3ca08a7d822b036","commercialScore":0,"negativeRegularScore":0,"negativeScore":0,"positiveScore":0,"score":0,"grade":""},{"date":20200916,"state":"MS","positive":91234,"probableCases":5850,"negative":541497,"pending":null,"totalTestResultsSource":null,"totalTestResults":632731,"hospitalizedCurrently":632,"hospitalizedCumulative":5499,"inIcuCurrently":168,"inIcuCumulative":null,"onVentilatorCurrently":98,"onVentilatorCumulative":null,"recovered":78971,"dataQualityGrade":"A+","lastUpdateEt":"9/15/2020 00:00","dateModified":"2020-09-15T00:00:00Z","checkTimeEt":"09/14 20:00","death":2756,"hospitalized":5499,"dateChecked":"2020-09-15T00:00:00Z","totalTestsViral":626881,"positiveTestsViral":null,"negativeTestsViral":null,"positiveCasesViral":85384,"deathConfirmed":2562,"deathProbable":194,"totalTestEncountersViral":null,"totalTestsPeopleViral":null,"totalTestsAntibody":29016,"positiveTestsAntibody":95,"negativeTestsAntibody":null,"totalTestsPeopleAntibody":null,"positiveTestsPeopleAntibody":null,"negativeTestsPeopleAntibody":null,"totalTestsPeopleAntigen":null,"positiveTestsPeopleAntigen":null,"totalTestsAntigen":40904,"positiveTestsAntigen":null,"fips":"28","positiveIncrease":711,"negativeIncrease":5709,"total":632731,"totalTestResultsIncrease":6420,"posNeg":632731,"deathIncrease":22,"hospitalizedIncrease":0,"hash":"9bdbfacc5530d30342234a6ded6fbc597b07a5c6","commercialScore":0,"negativeRegularScore":0,"negativeScore":0,"positiveScore":0,"score":0,"grade":""},{"date":20200915,"state":"MS","positive":90523,"probableCases":5611,"negative":535788,"pending":null,"totalTestResultsSource":null,"totalTestResults":626311,"hospitalizedCurrently":667,"hospitalizedCumulative":5499,"inIcuCurrently":177,"inIcuCumulative":null,"onVentilatorCurrently":88,"onVentilatorCumulative":null,"recovered":78971,"dataQualityGrade":"A+","lastUpdateEt":"9/14/2020 00:00","dateModified":"2020-09-14T00:00:00Z","checkTimeEt":"09/13 20:00","death":2734,"hospitalized":5499,"dateChecked":"2020-09-14T00:00:00Z","totalTestsViral":620345,"positiveTestsViral":null,"negativeTestsViral":null,"positiveCasesViral":84912,"deathConfirmed":2543,"deathProbable":191,"totalTestEncountersViral":null,"totalTestsPeopleViral":null,"totalTestsAntibody":28852,"positiveTestsAntibody":95,"negativeTestsAntibody":null,"totalTestsPeopleAntibody":null,"positiveTestsPeopleAntibody":null,"negativeTestsPeopleAntibody":null,"totalTestsPeopleAntigen":null,"positiveTestsPeopleAntigen":null,"totalTestsAntigen":38649,"positiveTestsAntigen":null,"fips":"28","positiveIncrease":505,"negativeIncrease":0,"total":626311,"totalTestResultsIncrease":505,"posNeg":626311,"deathIncrease":28,"hospitalizedIncrease":0,"hash":"9340e90085c2d7d5691611bf28194b5bbc15b7d9","commercialScore":0,"negativeRegularScore":0,"negativeScore":0,"positiveScore":0,"score":0,"grade":""},{"date":20200914,"state":"MS","positive":90018,"probableCases":5461,"negative":535788,"pending":null,"totalTestResultsSource":null,"totalTestResults":625806,"hospitalizedCurrently":513,"hospitalizedCumulative":5499,"inIcuCurrently":171,"inIcuCumulative":null,"onVentilatorCurrently":null,"onVentilatorCumulative":null,"recovered":78971,"dataQualityGrade":"A+","lastUpdateEt":"9/13/2020 00:00","dateModified":"2020-09-13T00:00:00Z","checkTimeEt":"09/12 20:00","death":2706,"hospitalized":5499,"dateChecked":"2020-09-13T00:00:00Z","totalTestsViral":620345,"positiveTestsViral":null,"negativeTestsViral":null,"positiveCasesViral":84557,"deathConfirmed":2523,"deathProbable":183,"totalTestEncountersViral":null,"totalTestsPeopleViral":null,"totalTestsAntibody":28852,"positiveTestsAntibody":95,"negativeTestsAntibody":null,"totalTestsPeopleAntibody":null,"positiveTestsPeopleAntibody":null,"negativeTestsPeopleAntibody":null,"totalTestsPeopleAntigen":null,"positiveTestsPeopleAntigen":null,"totalTestsAntigen":38649,"positiveTestsAntigen":null,"fips":"28","positiveIncrease":144,"negativeIncrease":2869,"total":625806,"totalTestResultsIncrease":3013,"posNeg":625806,"deathIncrease":9,"hospitalizedIncrease":89,"hash":"7afa09886e705c6d0f2f51d3ab5cac2577406c74","commercialScore":0,"negativeRegularScore":0,"negativeScore":0,"positiveScore":0,"score":0,"grade":""},{"date":20200913,"state":"MS","positive":89874,"probableCases":5423,"negative":532919,"pending":null,"totalTestResultsSource":null,"totalTestResults":622793,"hospitalizedCurrently":542,"hospitalizedCumulative":5410,"inIcuCurrently":179,"inIcuCumulative":null,"onVentilatorCurrently":null,"onVentilatorCumulative":null,"recovered":74098,"dataQualityGrade":"A+","lastUpdateEt":"9/12/2020 00:00","dateModified":"2020-09-12T00:00:00Z","checkTimeEt":"09/11 20:00","death":2697,"hospitalized":5410,"dateChecked":"2020-09-12T00:00:00Z","totalTestsViral":617161,"positiveTestsViral":null,"negativeTestsViral":null,"positiveCasesViral":84451,"deathConfirmed":2514,"deathProbable":183,"totalTestEncountersViral":null,"totalTestsPeopleViral":null,"totalTestsAntibody":28693,"positiveTestsAntibody":95,"negativeTestsAntibody":null,"totalTestsPeopleAntibody":null,"positiveTestsPeopleAntibody":null,"negativeTestsPeopleAntibody":null,"totalTestsPeopleAntigen":null,"positiveTestsPeopleAntigen":null,"totalTestsAntigen":38257,"positiveTestsAntigen":null,"fips":"28","positiveIncrease":254,"negativeIncrease":0,"total":622793,"totalTestResultsIncrease":254,"posNeg":622793,"deathIncrease":12,"hospitalizedIncrease":0,"hash":"f29c9f075ab378a02743a3106d1af82c849c7c1c","commercialScore":0,"negativeRegularScore":0,"negativeScore":0,"positiveScore":0,"score":0,"grade":""},{"date":20200912,"state":"MS","positive":89620,"probableCases":5378,"negative":532919,"pending":null,"totalTestResultsSource":null,"totalTestResults":622539,"hospitalizedCurrently":542,"hospitalizedCumulative":5410,"inIcuCurrently":179,"inIcuCumulative":null,"onVentilatorCurrently":null,"onVentilatorCumulative":null,"recovered":74098,"dataQualityGrade":"A+","lastUpdateEt":"9/11/2020 00:00","dateModified":"2020-09-11T00:00:00Z","checkTimeEt":"09/10 20:00","death":2685,"hospitalized":5410,"dateChecked":"2020-09-11T00:00:00Z","totalTestsViral":617161,"positiveTestsViral":null,"negativeTestsViral":null,"positiveCasesViral":84242,"deathConfirmed":2502,"deathProbable":183,"totalTestEncountersViral":null,"totalTestsPeopleViral":null,"totalTestsAntibody":28693,"positiveTestsAntibody":95,"negativeTestsAntibody":null,"totalTestsPeopleAntibody":null,"positiveTestsPeopleAntibody":null,"negativeTestsPeopleAntibody":null,"totalTestsPeopleAntigen":null,"positiveTestsPeopleAntigen":null,"totalTestsAntigen":38257,"positiveTestsAntigen":null,"fips":"28","positiveIncrease":445,"negativeIncrease":3715,"total":622539,"totalTestResultsIncrease":4160,"posNeg":622539,"deathIncrease":15,"hospitalizedIncrease":0,"hash":"ead7766de07c67addf99c062deb7fba801e6ded9","commercialScore":0,"negativeRegularScore":0,"negativeScore":0,"positiveScore":0,"score":0,"grade":""},{"date":20200911,"state":"MS","positive":89175,"probableCases":5257,"negative":529204,"pending":null,"totalTestResultsSource":null,"totalTestResults":618379,"hospitalizedCurrently":545,"hospitalizedCumulative":5410,"inIcuCurrently":182,"inIcuCumulative":null,"onVentilatorCurrently":null,"onVentilatorCumulative":null,"recovered":74098,"dataQualityGrade":"A+","lastUpdateEt":"9/10/2020 00:00","dateModified":"2020-09-10T00:00:00Z","checkTimeEt":"09/09 20:00","death":2670,"hospitalized":5410,"dateChecked":"2020-09-10T00:00:00Z","totalTestsViral":613122,"positiveTestsViral":null,"negativeTestsViral":null,"positiveCasesViral":83918,"deathConfirmed":2489,"deathProbable":181,"totalTestEncountersViral":null,"totalTestsPeopleViral":null,"totalTestsAntibody":28579,"positiveTestsAntibody":95,"negativeTestsAntibody":null,"totalTestsPeopleAntibody":null,"positiveTestsPeopleAntibody":null,"negativeTestsPeopleAntibody":null,"totalTestsPeopleAntigen":null,"positiveTestsPeopleAntigen":null,"totalTestsAntigen":37009,"positiveTestsAntigen":null,"fips":"28","positiveIncrease":853,"negativeIncrease":4288,"total":618379,"totalTestResultsIncrease":5141,"posNeg":618379,"deathIncrease":14,"hospitalizedIncrease":0,"hash":"49afe2996c367f1b93f70761b288d95b3f8ae76d","commercialScore":0,"negativeRegularScore":0,"negativeScore":0,"positiveScore":0,"score":0,"grade":""},{"date":20200910,"state":"MS","positive":88322,"probableCases":4994,"negative":524916,"pending":null,"totalTestResultsSource":null,"totalTestResults":613238,"hospitalizedCurrently":668,"hospitalizedCumulative":5410,"inIcuCurrently":177,"inIcuCumulative":null,"onVentilatorCurrently":101,"onVentilatorCumulative":null,"recovered":74098,"dataQualityGrade":"A+","lastUpdateEt":"9/9/2020 00:00","dateModified":"2020-09-09T00:00:00Z","checkTimeEt":"09/08 20:00","death":2656,"hospitalized":5410,"dateChecked":"2020-09-09T00:00:00Z","totalTestsViral":608244,"positiveTestsViral":null,"negativeTestsViral":null,"positiveCasesViral":83328,"deathConfirmed":2477,"deathProbable":179,"totalTestEncountersViral":null,"totalTestsPeopleViral":null,"totalTestsAntibody":28319,"positiveTestsAntibody":95,"negativeTestsAntibody":null,"totalTestsPeopleAntibody":null,"positiveTestsPeopleAntibody":null,"negativeTestsPeopleAntibody":null,"totalTestsPeopleAntigen":null,"positiveTestsPeopleAntigen":null,"totalTestsAntigen":36315,"positiveTestsAntigen":null,"fips":"28","positiveIncrease":517,"negativeIncrease":3083,"total":613238,"totalTestResultsIncrease":3600,"posNeg":613238,"deathIncrease":33,"hospitalizedIncrease":0,"hash":"e040aa2fd2bc4a875f440009bdf776cf99169be0","commercialScore":0,"negativeRegularScore":0,"negativeScore":0,"positiveScore":0,"score":0,"grade":""},{"date":20200909,"state":"MS","positive":87805,"probableCases":4862,"negative":521833,"pending":null,"totalTestResultsSource":null,"totalTestResults":609638,"hospitalizedCurrently":683,"hospitalizedCumulative":5410,"inIcuCurrently":185,"inIcuCumulative":null,"onVentilatorCurrently":111,"onVentilatorCumulative":null,"recovered":74098,"dataQualityGrade":"A+","lastUpdateEt":"9/8/2020 00:00","dateModified":"2020-09-08T00:00:00Z","checkTimeEt":"09/07 20:00","death":2623,"hospitalized":5410,"dateChecked":"2020-09-08T00:00:00Z","totalTestsViral":604776,"positiveTestsViral":null,"negativeTestsViral":null,"positiveCasesViral":82943,"deathConfirmed":2447,"deathProbable":176,"totalTestEncountersViral":null,"totalTestsPeopleViral":null,"totalTestsAntibody":28071,"positiveTestsAntibody":95,"negativeTestsAntibody":null,"totalTestsPeopleAntibody":null,"positiveTestsPeopleAntibody":null,"negativeTestsPeopleAntibody":null,"totalTestsPeopleAntigen":null,"positiveTestsPeopleAntigen":null,"totalTestsAntigen":35351,"positiveTestsAntigen":null,"fips":"28","positiveIncrease":426,"negativeIncrease":2751,"total":609638,"totalTestResultsIncrease":3177,"posNeg":609638,"deathIncrease":38,"hospitalizedIncrease":0,"hash":"b5d33ec38c0577584ddcb0cc10ed941b55a04648","commercialScore":0,"negativeRegularScore":0,"negativeScore":0,"positiveScore":0,"score":0,"grade":""},{"date":20200908,"state":"MS","positive":87379,"probableCases":4695,"negative":519082,"pending":null,"totalTestResultsSource":null,"totalTestResults":606461,"hospitalizedCurrently":758,"hospitalizedCumulative":5410,"inIcuCurrently":186,"inIcuCumulative":null,"onVentilatorCurrently":111,"onVentilatorCumulative":null,"recovered":74098,"dataQualityGrade":"A+","lastUpdateEt":"9/7/2020 00:00","dateModified":"2020-09-07T00:00:00Z","checkTimeEt":"09/06 20:00","death":2585,"hospitalized":5410,"dateChecked":"2020-09-07T00:00:00Z","totalTestsViral":601766,"positiveTestsViral":null,"negativeTestsViral":null,"positiveCasesViral":82684,"deathConfirmed":2417,"deathProbable":168,"totalTestEncountersViral":null,"totalTestsPeopleViral":null,"totalTestsAntibody":27730,"positiveTestsAntibody":95,"negativeTestsAntibody":null,"totalTestsPeopleAntibody":null,"positiveTestsPeopleAntibody":null,"negativeTestsPeopleAntibody":null,"totalTestsPeopleAntigen":null,"positiveTestsPeopleAntigen":null,"totalTestsAntigen":34497,"positiveTestsAntigen":null,"fips":"28","positiveIncrease":249,"negativeIncrease":8161,"total":606461,"totalTestResultsIncrease":8410,"posNeg":606461,"deathIncrease":0,"hospitalizedIncrease":84,"hash":"748a6c79d9329af99dfad4ac17bc98ea90602fac","commercialScore":0,"negativeRegularScore":0,"negativeScore":0,"positiveScore":0,"score":0,"grade":""},{"date":20200907,"state":"MS","positive":87130,"probableCases":4673,"negative":510921,"pending":null,"totalTestResultsSource":null,"totalTestResults":598051,"hospitalizedCurrently":758,"hospitalizedCumulative":5326,"inIcuCurrently":186,"inIcuCumulative":null,"onVentilatorCurrently":111,"onVentilatorCumulative":null,"recovered":67918,"dataQualityGrade":"A+","lastUpdateEt":"9/6/2020 00:00","dateModified":"2020-09-06T00:00:00Z","checkTimeEt":"09/05 20:00","death":2585,"hospitalized":5326,"dateChecked":"2020-09-06T00:00:00Z","totalTestsViral":592831,"positiveTestsViral":null,"negativeTestsViral":null,"positiveCasesViral":82457,"deathConfirmed":2417,"deathProbable":168,"totalTestEncountersViral":null,"totalTestsPeopleViral":null,"totalTestsAntibody":27468,"positiveTestsAntibody":95,"negativeTestsAntibody":null,"totalTestsPeopleAntibody":null,"positiveTestsPeopleAntibody":null,"negativeTestsPeopleAntibody":null,"totalTestsPeopleAntigen":null,"positiveTestsPeopleAntigen":null,"totalTestsAntigen":33480,"positiveTestsAntigen":null,"fips":"28","positiveIncrease":242,"negativeIncrease":0,"total":598051,"totalTestResultsIncrease":242,"posNeg":598051,"deathIncrease":1,"hospitalizedIncrease":0,"hash":"104bd5d8eb98bac775dfb535de494c65f25e31a6","commercialScore":0,"negativeRegularScore":0,"negativeScore":0,"positiveScore":0,"score":0,"grade":""},{"date":20200906,"state":"MS","positive":86888,"probableCases":4653,"negative":510921,"pending":null,"totalTestResultsSource":null,"totalTestResults":597809,"hospitalizedCurrently":758,"hospitalizedCumulative":5326,"inIcuCurrently":186,"inIcuCumulative":null,"onVentilatorCurrently":111,"onVentilatorCumulative":null,"recovered":67918,"dataQualityGrade":"A+","lastUpdateEt":"9/5/2020 00:00","dateModified":"2020-09-05T00:00:00Z","checkTimeEt":"09/04 20:00","death":2584,"hospitalized":5326,"dateChecked":"2020-09-05T00:00:00Z","totalTestsViral":592831,"positiveTestsViral":null,"negativeTestsViral":null,"positiveCasesViral":82235,"deathConfirmed":2416,"deathProbable":168,"totalTestEncountersViral":null,"totalTestsPeopleViral":null,"totalTestsAntibody":27468,"positiveTestsAntibody":95,"negativeTestsAntibody":null,"totalTestsPeopleAntibody":null,"positiveTestsPeopleAntibody":null,"negativeTestsPeopleAntibody":null,"totalTestsPeopleAntigen":null,"positiveTestsPeopleAntigen":null,"totalTestsAntigen":33480,"positiveTestsAntigen":null,"fips":"28","positiveIncrease":410,"negativeIncrease":0,"total":597809,"totalTestResultsIncrease":410,"posNeg":597809,"deathIncrease":15,"hospitalizedIncrease":0,"hash":"92fbdf0ecbc8763666ca5338412545ffe0dd7df3","commercialScore":0,"negativeRegularScore":0,"negativeScore":0,"positiveScore":0,"score":0,"grade":""},{"date":20200905,"state":"MS","positive":86478,"probableCases":4568,"negative":510921,"pending":null,"totalTestResultsSource":null,"totalTestResults":597399,"hospitalizedCurrently":758,"hospitalizedCumulative":5326,"inIcuCurrently":186,"inIcuCumulative":null,"onVentilatorCurrently":111,"onVentilatorCumulative":null,"recovered":67918,"dataQualityGrade":"A+","lastUpdateEt":"9/4/2020 00:00","dateModified":"2020-09-04T00:00:00Z","checkTimeEt":"09/03 20:00","death":2569,"hospitalized":5326,"dateChecked":"2020-09-04T00:00:00Z","totalTestsViral":592831,"positiveTestsViral":null,"negativeTestsViral":null,"positiveCasesViral":81910,"deathConfirmed":2401,"deathProbable":168,"totalTestEncountersViral":null,"totalTestsPeopleViral":null,"totalTestsAntibody":27468,"positiveTestsAntibody":95,"negativeTestsAntibody":null,"totalTestsPeopleAntibody":null,"positiveTestsPeopleAntibody":null,"negativeTestsPeopleAntibody":null,"totalTestsPeopleAntigen":null,"positiveTestsPeopleAntigen":null,"totalTestsAntigen":33480,"positiveTestsAntigen":null,"fips":"28","positiveIncrease":539,"negativeIncrease":9456,"total":597399,"totalTestResultsIncrease":9995,"posNeg":597399,"deathIncrease":11,"hospitalizedIncrease":0,"hash":"d8ba68103a5e1d7c7cc70b55224a4c312c82fc5d","commercialScore":0,"negativeRegularScore":0,"negativeScore":0,"positiveScore":0,"score":0,"grade":""},{"date":20200904,"state":"MS","positive":85939,"probableCases":4409,"negative":501465,"pending":null,"totalTestResultsSource":null,"totalTestResults":587404,"hospitalizedCurrently":789,"hospitalizedCumulative":5326,"inIcuCurrently":178,"inIcuCumulative":null,"onVentilatorCurrently":115,"onVentilatorCumulative":null,"recovered":67918,"dataQualityGrade":"A+","lastUpdateEt":"9/3/2020 00:00","dateModified":"2020-09-03T00:00:00Z","checkTimeEt":"09/02 20:00","death":2558,"hospitalized":5326,"dateChecked":"2020-09-03T00:00:00Z","totalTestsViral":582297,"positiveTestsViral":null,"negativeTestsViral":null,"positiveCasesViral":81530,"deathConfirmed":2394,"deathProbable":164,"totalTestEncountersViral":null,"totalTestsPeopleViral":null,"totalTestsAntibody":27057,"positiveTestsAntibody":95,"negativeTestsAntibody":null,"totalTestsPeopleAntibody":null,"positiveTestsPeopleAntibody":null,"negativeTestsPeopleAntibody":null,"totalTestsPeopleAntigen":null,"positiveTestsPeopleAntigen":null,"totalTestsAntigen":32271,"positiveTestsAntigen":null,"fips":"28","positiveIncrease":823,"negativeIncrease":0,"total":587404,"totalTestResultsIncrease":823,"posNeg":587404,"deathIncrease":22,"hospitalizedIncrease":0,"hash":"50a43ef46cb25c6664754ecb0c20c3ae9a82488e","commercialScore":0,"negativeRegularScore":0,"negativeScore":0,"positiveScore":0,"score":0,"grade":""},{"date":20200903,"state":"MS","positive":85116,"probableCases":4284,"negative":501465,"pending":null,"totalTestResultsSource":null,"totalTestResults":586581,"hospitalizedCurrently":812,"hospitalizedCumulative":5326,"inIcuCurrently":176,"inIcuCumulative":null,"onVentilatorCurrently":110,"onVentilatorCumulative":null,"recovered":67918,"dataQualityGrade":"A+","lastUpdateEt":"9/2/2020 00:00","dateModified":"2020-09-02T00:00:00Z","checkTimeEt":"09/01 20:00","death":2536,"hospitalized":5326,"dateChecked":"2020-09-02T00:00:00Z","totalTestsViral":582297,"positiveTestsViral":null,"negativeTestsViral":null,"positiveCasesViral":80832,"deathConfirmed":2373,"deathProbable":163,"totalTestEncountersViral":null,"totalTestsPeopleViral":null,"totalTestsAntibody":27057,"positiveTestsAntibody":95,"negativeTestsAntibody":null,"totalTestsPeopleAntibody":null,"positiveTestsPeopleAntibody":null,"negativeTestsPeopleAntibody":null,"totalTestsPeopleAntigen":null,"positiveTestsPeopleAntigen":null,"totalTestsAntigen":32271,"positiveTestsAntigen":null,"fips":"28","positiveIncrease":751,"negativeIncrease":4244,"total":586581,"totalTestResultsIncrease":4995,"posNeg":586581,"deathIncrease":10,"hospitalizedIncrease":0,"hash":"6a369852ab4c27392b9d177035795eec48747a41","commercialScore":0,"negativeRegularScore":0,"negativeScore":0,"positiveScore":0,"score":0,"grade":""},{"date":20200902,"state":"MS","positive":84365,"probableCases":4172,"negative":497221,"pending":null,"totalTestResultsSource":null,"totalTestResults":581586,"hospitalizedCurrently":856,"hospitalizedCumulative":5326,"inIcuCurrently":190,"inIcuCumulative":null,"onVentilatorCurrently":111,"onVentilatorCumulative":null,"recovered":67918,"dataQualityGrade":"A+","lastUpdateEt":"9/1/2020 00:00","dateModified":"2020-09-01T00:00:00Z","checkTimeEt":"08/31 20:00","death":2526,"hospitalized":5326,"dateChecked":"2020-09-01T00:00:00Z","totalTestsViral":577414,"positiveTestsViral":null,"negativeTestsViral":null,"positiveCasesViral":80193,"deathConfirmed":2364,"deathProbable":162,"totalTestEncountersViral":null,"totalTestsPeopleViral":null,"totalTestsAntibody":26774,"positiveTestsAntibody":95,"negativeTestsAntibody":null,"totalTestsPeopleAntibody":null,"positiveTestsPeopleAntibody":null,"negativeTestsPeopleAntibody":null,"totalTestsPeopleAntigen":null,"positiveTestsPeopleAntigen":null,"totalTestsAntigen":31722,"positiveTestsAntigen":null,"fips":"28","positiveIncrease":781,"negativeIncrease":3288,"total":581586,"totalTestResultsIncrease":4069,"posNeg":581586,"deathIncrease":33,"hospitalizedIncrease":0,"hash":"26b13ee8308858c695bb4777e640992a8ac12e89","commercialScore":0,"negativeRegularScore":0,"negativeScore":0,"positiveScore":0,"score":0,"grade":""},{"date":20200901,"state":"MS","positive":83584,"probableCases":3934,"negative":493933,"pending":null,"totalTestResultsSource":null,"totalTestResults":577517,"hospitalizedCurrently":798,"hospitalizedCumulative":5326,"inIcuCurrently":196,"inIcuCumulative":null,"onVentilatorCurrently":117,"onVentilatorCumulative":null,"recovered":67918,"dataQualityGrade":"A+","lastUpdateEt":"9/1/2020 00:00","dateModified":"2020-09-01T00:00:00Z","checkTimeEt":"08/31 20:00","death":2493,"hospitalized":5326,"dateChecked":"2020-09-01T00:00:00Z","totalTestsViral":573583,"positiveTestsViral":null,"negativeTestsViral":null,"positiveCasesViral":79650,"deathConfirmed":2337,"deathProbable":156,"totalTestEncountersViral":null,"totalTestsPeopleViral":null,"totalTestsAntibody":26337,"positiveTestsAntibody":95,"negativeTestsAntibody":null,"totalTestsPeopleAntibody":null,"positiveTestsPeopleAntibody":null,"negativeTestsPeopleAntibody":null,"totalTestsPeopleAntigen":null,"positiveTestsPeopleAntigen":null,"totalTestsAntigen":31360,"positiveTestsAntigen":null,"fips":"28","positiveIncrease":634,"negativeIncrease":3018,"total":577517,"totalTestResultsIncrease":3652,"posNeg":577517,"deathIncrease":20,"hospitalizedIncrease":0,"hash":"b743023e3c50e4ee28fe3f2957aa57dd3e547ee4","commercialScore":0,"negativeRegularScore":0,"negativeScore":0,"positiveScore":0,"score":0,"grade":""},{"date":20200831,"state":"MS","positive":82950,"probableCases":3785,"negative":490915,"pending":null,"totalTestResultsSource":null,"totalTestResults":573865,"hospitalizedCurrently":802,"hospitalizedCumulative":5326,"inIcuCurrently":207,"inIcuCumulative":null,"onVentilatorCurrently":121,"onVentilatorCumulative":null,"recovered":67918,"dataQualityGrade":"A+","lastUpdateEt":"8/31/2020 00:00","dateModified":"2020-08-31T00:00:00Z","checkTimeEt":"08/30 20:00","death":2473,"hospitalized":5326,"dateChecked":"2020-08-31T00:00:00Z","totalTestsViral":570080,"positiveTestsViral":null,"negativeTestsViral":null,"positiveCasesViral":79165,"deathConfirmed":2319,"deathProbable":154,"totalTestEncountersViral":null,"totalTestsPeopleViral":null,"totalTestsAntibody":25554,"positiveTestsAntibody":95,"negativeTestsAntibody":null,"totalTestsPeopleAntibody":null,"positiveTestsPeopleAntibody":null,"negativeTestsPeopleAntibody":null,"totalTestsPeopleAntigen":null,"positiveTestsPeopleAntigen":null,"totalTestsAntigen":31261,"positiveTestsAntigen":null,"fips":"28","positiveIncrease":274,"negativeIncrease":4427,"total":573865,"totalTestResultsIncrease":4701,"posNeg":573865,"deathIncrease":32,"hospitalizedIncrease":26,"hash":"a368bccd26ed7f2e7329c108ae43b126fac24392","commercialScore":0,"negativeRegularScore":0,"negativeScore":0,"positiveScore":0,"score":0,"grade":""},{"date":20200830,"state":"MS","positive":82676,"probableCases":3772,"negative":486488,"pending":null,"totalTestResultsSource":null,"totalTestResults":569164,"hospitalizedCurrently":819,"hospitalizedCumulative":5300,"inIcuCurrently":215,"inIcuCumulative":null,"onVentilatorCurrently":111,"onVentilatorCumulative":null,"recovered":62707,"dataQualityGrade":"A+","lastUpdateEt":"8/30/2020 00:00","dateModified":"2020-08-30T00:00:00Z","checkTimeEt":"08/29 20:00","death":2441,"hospitalized":5300,"dateChecked":"2020-08-30T00:00:00Z","totalTestsViral":564933,"positiveTestsViral":null,"negativeTestsViral":null,"positiveCasesViral":78904,"deathConfirmed":2294,"deathProbable":147,"totalTestEncountersViral":null,"totalTestsPeopleViral":null,"totalTestsAntibody":25255,"positiveTestsAntibody":95,"negativeTestsAntibody":null,"totalTestsPeopleAntibody":null,"positiveTestsPeopleAntibody":null,"negativeTestsPeopleAntibody":null,"totalTestsPeopleAntigen":null,"positiveTestsPeopleAntigen":null,"totalTestsAntigen":30859,"positiveTestsAntigen":null,"fips":"28","positiveIncrease":647,"negativeIncrease":0,"total":569164,"totalTestResultsIncrease":647,"posNeg":569164,"deathIncrease":14,"hospitalizedIncrease":0,"hash":"937bb584d3ec97ff729cdd4af18b8258642643a8","commercialScore":0,"negativeRegularScore":0,"negativeScore":0,"positiveScore":0,"score":0,"grade":""},{"date":20200829,"state":"MS","positive":82029,"probableCases":3584,"negative":486488,"pending":null,"totalTestResultsSource":null,"totalTestResults":568517,"hospitalizedCurrently":819,"hospitalizedCumulative":5300,"inIcuCurrently":215,"inIcuCumulative":null,"onVentilatorCurrently":111,"onVentilatorCumulative":null,"recovered":62707,"dataQualityGrade":"A+","lastUpdateEt":"8/28/2020 19:00","dateModified":"2020-08-28T19:00:00Z","checkTimeEt":"08/28 15:00","death":2427,"hospitalized":5300,"dateChecked":"2020-08-28T19:00:00Z","totalTestsViral":564933,"positiveTestsViral":null,"negativeTestsViral":null,"positiveCasesViral":78445,"deathConfirmed":2281,"deathProbable":146,"totalTestEncountersViral":null,"totalTestsPeopleViral":null,"totalTestsAntibody":25255,"positiveTestsAntibody":95,"negativeTestsAntibody":null,"totalTestsPeopleAntibody":null,"positiveTestsPeopleAntibody":null,"negativeTestsPeopleAntibody":null,"totalTestsPeopleAntigen":null,"positiveTestsPeopleAntigen":null,"totalTestsAntigen":30859,"positiveTestsAntigen":null,"fips":"28","positiveIncrease":735,"negativeIncrease":4900,"total":568517,"totalTestResultsIncrease":5635,"posNeg":568517,"deathIncrease":14,"hospitalizedIncrease":21,"hash":"4c916aa2977c23bf1d2d7dea51e50f51d9bdc6e4","commercialScore":0,"negativeRegularScore":0,"negativeScore":0,"positiveScore":0,"score":0,"grade":""},{"date":20200828,"state":"MS","positive":81294,"probableCases":3472,"negative":481588,"pending":null,"totalTestResultsSource":null,"totalTestResults":562882,"hospitalizedCurrently":825,"hospitalizedCumulative":5279,"inIcuCurrently":203,"inIcuCumulative":null,"onVentilatorCurrently":108,"onVentilatorCumulative":null,"recovered":62707,"dataQualityGrade":"A+","lastUpdateEt":"8/27/2020 19:00","dateModified":"2020-08-27T19:00:00Z","checkTimeEt":"08/27 15:00","death":2413,"hospitalized":5279,"dateChecked":"2020-08-27T19:00:00Z","totalTestsViral":559410,"positiveTestsViral":null,"negativeTestsViral":null,"positiveCasesViral":77822,"deathConfirmed":2269,"deathProbable":144,"totalTestEncountersViral":null,"totalTestsPeopleViral":null,"totalTestsAntibody":25000,"positiveTestsAntibody":95,"negativeTestsAntibody":null,"totalTestsPeopleAntibody":null,"positiveTestsPeopleAntibody":null,"negativeTestsPeopleAntibody":null,"totalTestsPeopleAntigen":null,"positiveTestsPeopleAntigen":null,"totalTestsAntigen":28733,"positiveTestsAntigen":null,"fips":"28","positiveIncrease":599,"negativeIncrease":5645,"total":562882,"totalTestResultsIncrease":6244,"posNeg":562882,"deathIncrease":14,"hospitalizedIncrease":12,"hash":"ae6b736924cc7ba00a859e75ccde6c21e3c8789d","commercialScore":0,"negativeRegularScore":0,"negativeScore":0,"positiveScore":0,"score":0,"grade":""},{"date":20200827,"state":"MS","positive":80695,"probableCases":3372,"negative":475943,"pending":null,"totalTestResultsSource":null,"totalTestResults":556638,"hospitalizedCurrently":827,"hospitalizedCumulative":5267,"inIcuCurrently":230,"inIcuCumulative":null,"onVentilatorCurrently":125,"onVentilatorCumulative":null,"recovered":62707,"dataQualityGrade":"A+","lastUpdateEt":"8/26/2020 19:00","dateModified":"2020-08-26T19:00:00Z","checkTimeEt":"08/26 15:00","death":2399,"hospitalized":5267,"dateChecked":"2020-08-26T19:00:00Z","totalTestsViral":553266,"positiveTestsViral":null,"negativeTestsViral":null,"positiveCasesViral":77323,"deathConfirmed":2256,"deathProbable":143,"totalTestEncountersViral":null,"totalTestsPeopleViral":null,"totalTestsAntibody":24653,"positiveTestsAntibody":95,"negativeTestsAntibody":null,"totalTestsPeopleAntibody":null,"positiveTestsPeopleAntibody":null,"negativeTestsPeopleAntibody":null,"totalTestsPeopleAntigen":null,"positiveTestsPeopleAntigen":null,"totalTestsAntigen":25042,"positiveTestsAntigen":null,"fips":"28","positiveIncrease":585,"negativeIncrease":4263,"total":556638,"totalTestResultsIncrease":4848,"posNeg":556638,"deathIncrease":26,"hospitalizedIncrease":33,"hash":"67e4d86c99020cc19a1116da9deb2e14fa554868","commercialScore":0,"negativeRegularScore":0,"negativeScore":0,"positiveScore":0,"score":0,"grade":""},{"date":20200826,"state":"MS","positive":80110,"probableCases":3193,"negative":471680,"pending":null,"totalTestResultsSource":null,"totalTestResults":551790,"hospitalizedCurrently":878,"hospitalizedCumulative":5234,"inIcuCurrently":232,"inIcuCumulative":null,"onVentilatorCurrently":119,"onVentilatorCumulative":null,"recovered":62707,"dataQualityGrade":"A+","lastUpdateEt":"8/24/2020 19:00","dateModified":"2020-08-24T19:00:00Z","checkTimeEt":"08/24 15:00","death":2373,"hospitalized":5234,"dateChecked":"2020-08-24T19:00:00Z","totalTestsViral":548597,"positiveTestsViral":null,"negativeTestsViral":null,"positiveCasesViral":76917,"deathConfirmed":2234,"deathProbable":139,"totalTestEncountersViral":null,"totalTestsPeopleViral":null,"totalTestsAntibody":24384,"positiveTestsAntibody":95,"negativeTestsAntibody":null,"totalTestsPeopleAntibody":null,"positiveTestsPeopleAntibody":null,"negativeTestsPeopleAntibody":null,"totalTestsPeopleAntigen":null,"positiveTestsPeopleAntigen":null,"totalTestsAntigen":24363,"positiveTestsAntigen":null,"fips":"28","positiveIncrease":904,"negativeIncrease":3625,"total":551790,"totalTestResultsIncrease":4529,"posNeg":551790,"deathIncrease":58,"hospitalizedIncrease":26,"hash":"e5a4ab0f8392044db5eedbd9e7112f46c91ebfa8","commercialScore":0,"negativeRegularScore":0,"negativeScore":0,"positiveScore":0,"score":0,"grade":""},{"date":20200825,"state":"MS","positive":79206,"probableCases":2978,"negative":468055,"pending":null,"totalTestResultsSource":null,"totalTestResults":547261,"hospitalizedCurrently":920,"hospitalizedCumulative":5208,"inIcuCurrently":234,"inIcuCumulative":null,"onVentilatorCurrently":124,"onVentilatorCumulative":null,"recovered":62707,"dataQualityGrade":"A+","lastUpdateEt":"8/24/2020 19:00","dateModified":"2020-08-24T19:00:00Z","checkTimeEt":"08/24 15:00","death":2315,"hospitalized":5208,"dateChecked":"2020-08-24T19:00:00Z","totalTestsViral":544283,"positiveTestsViral":null,"negativeTestsViral":null,"positiveCasesViral":76228,"deathConfirmed":2201,"deathProbable":114,"totalTestEncountersViral":null,"totalTestsPeopleViral":null,"totalTestsAntibody":24188,"positiveTestsAntibody":95,"negativeTestsAntibody":null,"totalTestsPeopleAntibody":null,"positiveTestsPeopleAntibody":null,"negativeTestsPeopleAntibody":null,"totalTestsPeopleAntigen":null,"positiveTestsPeopleAntigen":null,"totalTestsAntigen":23678,"positiveTestsAntigen":null,"fips":"28","positiveIncrease":801,"negativeIncrease":3798,"total":547261,"totalTestResultsIncrease":4599,"posNeg":547261,"deathIncrease":67,"hospitalizedIncrease":29,"hash":"e8a82140246af0d729a4b57a990b098a8306eb0e","commercialScore":0,"negativeRegularScore":0,"negativeScore":0,"positiveScore":0,"score":0,"grade":""},{"date":20200824,"state":"MS","positive":78405,"probableCases":2834,"negative":464257,"pending":null,"totalTestResultsSource":null,"totalTestResults":542662,"hospitalizedCurrently":903,"hospitalizedCumulative":5179,"inIcuCurrently":237,"inIcuCumulative":null,"onVentilatorCurrently":127,"onVentilatorCumulative":null,"recovered":56577,"dataQualityGrade":"A+","lastUpdateEt":"8/23/2020 19:00","dateModified":"2020-08-23T19:00:00Z","checkTimeEt":"08/23 15:00","death":2248,"hospitalized":5179,"dateChecked":"2020-08-23T19:00:00Z","totalTestsViral":539828,"positiveTestsViral":null,"negativeTestsViral":null,"positiveCasesViral":75571,"deathConfirmed":2147,"deathProbable":101,"totalTestEncountersViral":null,"totalTestsPeopleViral":null,"totalTestsAntibody":23899,"positiveTestsAntibody":95,"negativeTestsAntibody":null,"totalTestsPeopleAntibody":null,"positiveTestsPeopleAntibody":null,"negativeTestsPeopleAntibody":null,"totalTestsPeopleAntigen":null,"positiveTestsPeopleAntigen":null,"totalTestsAntigen":22904,"positiveTestsAntigen":null,"fips":"28","positiveIncrease":511,"negativeIncrease":7903,"total":542662,"totalTestResultsIncrease":8414,"posNeg":542662,"deathIncrease":8,"hospitalizedIncrease":30,"hash":"086a1a9a471bfa9c67ce6b5e2d75bbb26ecbe0cc","commercialScore":0,"negativeRegularScore":0,"negativeScore":0,"positiveScore":0,"score":0,"grade":""},{"date":20200823,"state":"MS","positive":77894,"probableCases":2718,"negative":456354,"pending":null,"totalTestResultsSource":null,"totalTestResults":534248,"hospitalizedCurrently":982,"hospitalizedCumulative":5149,"inIcuCurrently":259,"inIcuCumulative":null,"onVentilatorCurrently":148,"onVentilatorCumulative":null,"recovered":56577,"dataQualityGrade":"A+","lastUpdateEt":"8/22/2020 00:00","dateModified":"2020-08-22T00:00:00Z","checkTimeEt":"08/21 20:00","death":2240,"hospitalized":5149,"dateChecked":"2020-08-22T00:00:00Z","totalTestsViral":530974,"positiveTestsViral":null,"negativeTestsViral":null,"positiveCasesViral":75176,"deathConfirmed":2139,"deathProbable":101,"totalTestEncountersViral":null,"totalTestsPeopleViral":null,"totalTestsAntibody":22862,"positiveTestsAntibody":95,"negativeTestsAntibody":null,"totalTestsPeopleAntibody":null,"positiveTestsPeopleAntibody":null,"negativeTestsPeopleAntibody":null,"totalTestsPeopleAntigen":null,"positiveTestsPeopleAntigen":null,"totalTestsAntigen":null,"positiveTestsAntigen":null,"fips":"28","positiveIncrease":626,"negativeIncrease":0,"total":534248,"totalTestResultsIncrease":626,"posNeg":534248,"deathIncrease":3,"hospitalizedIncrease":0,"hash":"a6998747033087f2fd3a2c57e36d7d09d3610c53","commercialScore":0,"negativeRegularScore":0,"negativeScore":0,"positiveScore":0,"score":0,"grade":""},{"date":20200822,"state":"MS","positive":77268,"probableCases":2648,"negative":456354,"pending":null,"totalTestResultsSource":null,"totalTestResults":533622,"hospitalizedCurrently":982,"hospitalizedCumulative":5149,"inIcuCurrently":259,"inIcuCumulative":null,"onVentilatorCurrently":148,"onVentilatorCumulative":null,"recovered":56577,"dataQualityGrade":"A+","lastUpdateEt":"8/21/2020 19:00","dateModified":"2020-08-21T19:00:00Z","checkTimeEt":"08/21 15:00","death":2237,"hospitalized":5149,"dateChecked":"2020-08-21T19:00:00Z","totalTestsViral":530974,"positiveTestsViral":null,"negativeTestsViral":null,"positiveCasesViral":74620,"deathConfirmed":2136,"deathProbable":101,"totalTestEncountersViral":null,"totalTestsPeopleViral":null,"totalTestsAntibody":22862,"positiveTestsAntibody":95,"negativeTestsAntibody":null,"totalTestsPeopleAntibody":null,"positiveTestsPeopleAntibody":null,"negativeTestsPeopleAntibody":null,"totalTestsPeopleAntigen":null,"positiveTestsPeopleAntigen":null,"totalTestsAntigen":null,"positiveTestsAntigen":null,"fips":"28","positiveIncrease":945,"negativeIncrease":2875,"total":533622,"totalTestResultsIncrease":3820,"posNeg":533622,"deathIncrease":23,"hospitalizedIncrease":22,"hash":"051c4f82f1f81b189efb74328c3f75cf65201a07","commercialScore":0,"negativeRegularScore":0,"negativeScore":0,"positiveScore":0,"score":0,"grade":""},{"date":20200821,"state":"MS","positive":76323,"probableCases":2497,"negative":453479,"pending":null,"totalTestResultsSource":null,"totalTestResults":529802,"hospitalizedCurrently":997,"hospitalizedCumulative":5127,"inIcuCurrently":264,"inIcuCumulative":null,"onVentilatorCurrently":152,"onVentilatorCumulative":null,"recovered":56577,"dataQualityGrade":"A+","lastUpdateEt":"8/20/2020 19:00","dateModified":"2020-08-20T19:00:00Z","checkTimeEt":"08/20 15:00","death":2214,"hospitalized":5127,"dateChecked":"2020-08-20T19:00:00Z","totalTestsViral":527305,"positiveTestsViral":null,"negativeTestsViral":null,"positiveCasesViral":73826,"deathConfirmed":2119,"deathProbable":95,"totalTestEncountersViral":null,"totalTestsPeopleViral":null,"totalTestsAntibody":22662,"positiveTestsAntibody":95,"negativeTestsAntibody":null,"totalTestsPeopleAntibody":null,"positiveTestsPeopleAntibody":null,"negativeTestsPeopleAntibody":null,"totalTestsPeopleAntigen":null,"positiveTestsPeopleAntigen":null,"totalTestsAntigen":null,"positiveTestsAntigen":null,"fips":"28","positiveIncrease":874,"negativeIncrease":1302,"total":529802,"totalTestResultsIncrease":2176,"posNeg":529802,"deathIncrease":24,"hospitalizedIncrease":30,"hash":"7b8049c6673c5f666d6c71f6cff1731ba23e1381","commercialScore":0,"negativeRegularScore":0,"negativeScore":0,"positiveScore":0,"score":0,"grade":""},{"date":20200820,"state":"MS","positive":75449,"probableCases":2364,"negative":452177,"pending":null,"totalTestResultsSource":null,"totalTestResults":527626,"hospitalizedCurrently":1025,"hospitalizedCumulative":5097,"inIcuCurrently":276,"inIcuCumulative":null,"onVentilatorCurrently":176,"onVentilatorCumulative":null,"recovered":56577,"dataQualityGrade":"A+","lastUpdateEt":"8/19/2020 19:00","dateModified":"2020-08-19T19:00:00Z","checkTimeEt":"08/19 15:00","death":2190,"hospitalized":5097,"dateChecked":"2020-08-19T19:00:00Z","totalTestsViral":522738,"positiveTestsViral":null,"negativeTestsViral":null,"positiveCasesViral":73085,"deathConfirmed":2100,"deathProbable":90,"totalTestEncountersViral":null,"totalTestsPeopleViral":null,"totalTestsAntibody":18516,"positiveTestsAntibody":95,"negativeTestsAntibody":null,"totalTestsPeopleAntibody":null,"positiveTestsPeopleAntibody":null,"negativeTestsPeopleAntibody":null,"totalTestsPeopleAntigen":null,"positiveTestsPeopleAntigen":null,"totalTestsAntigen":null,"positiveTestsAntigen":null,"fips":"28","positiveIncrease":894,"negativeIncrease":0,"total":527626,"totalTestResultsIncrease":894,"posNeg":527626,"deathIncrease":27,"hospitalizedIncrease":34,"hash":"49456c903cd546a01a0f326228ab696e9bf7970a","commercialScore":0,"negativeRegularScore":0,"negativeScore":0,"positiveScore":0,"score":0,"grade":""},{"date":20200819,"state":"MS","positive":74555,"probableCases":2137,"negative":452177,"pending":null,"totalTestResultsSource":null,"totalTestResults":526732,"hospitalizedCurrently":1073,"hospitalizedCumulative":5063,"inIcuCurrently":286,"inIcuCumulative":null,"onVentilatorCurrently":160,"onVentilatorCumulative":null,"recovered":56577,"dataQualityGrade":"A+","lastUpdateEt":"8/18/2020 19:00","dateModified":"2020-08-18T19:00:00Z","checkTimeEt":"08/18 15:00","death":2163,"hospitalized":5063,"dateChecked":"2020-08-18T19:00:00Z","totalTestsViral":522738,"positiveTestsViral":null,"negativeTestsViral":null,"positiveCasesViral":72418,"deathConfirmed":2077,"deathProbable":86,"totalTestEncountersViral":null,"totalTestsPeopleViral":null,"totalTestsAntibody":18516,"positiveTestsAntibody":95,"negativeTestsAntibody":null,"totalTestsPeopleAntibody":null,"positiveTestsPeopleAntibody":null,"negativeTestsPeopleAntibody":null,"totalTestsPeopleAntigen":null,"positiveTestsPeopleAntigen":null,"totalTestsAntigen":null,"positiveTestsAntigen":null,"fips":"28","positiveIncrease":1348,"negativeIncrease":0,"total":526732,"totalTestResultsIncrease":1348,"posNeg":526732,"deathIncrease":35,"hospitalizedIncrease":38,"hash":"c0897bf3b045bd2247d69b8c73a3e137257c9105","commercialScore":0,"negativeRegularScore":0,"negativeScore":0,"positiveScore":0,"score":0,"grade":""},{"date":20200818,"state":"MS","positive":73207,"probableCases":1953,"negative":452177,"pending":null,"totalTestResultsSource":null,"totalTestResults":525384,"hospitalizedCurrently":1090,"hospitalizedCumulative":5025,"inIcuCurrently":284,"inIcuCumulative":null,"onVentilatorCurrently":163,"onVentilatorCumulative":null,"recovered":56577,"dataQualityGrade":"A+","lastUpdateEt":"8/17/2020 19:00","dateModified":"2020-08-17T19:00:00Z","checkTimeEt":"08/17 15:00","death":2128,"hospitalized":5025,"dateChecked":"2020-08-17T19:00:00Z","totalTestsViral":522738,"positiveTestsViral":null,"negativeTestsViral":null,"positiveCasesViral":71254,"deathConfirmed":2046,"deathProbable":82,"totalTestEncountersViral":null,"totalTestsPeopleViral":null,"totalTestsAntibody":18516,"positiveTestsAntibody":95,"negativeTestsAntibody":null,"totalTestsPeopleAntibody":null,"positiveTestsPeopleAntibody":null,"negativeTestsPeopleAntibody":null,"totalTestsPeopleAntigen":null,"positiveTestsPeopleAntigen":null,"totalTestsAntigen":null,"positiveTestsAntigen":null,"fips":"28","positiveIncrease":795,"negativeIncrease":0,"total":525384,"totalTestResultsIncrease":795,"posNeg":525384,"deathIncrease":33,"hospitalizedIncrease":36,"hash":"9f228c86a29688d84d0a186e8eea171d88abc41f","commercialScore":0,"negativeRegularScore":0,"negativeScore":0,"positiveScore":0,"score":0,"grade":""},{"date":20200817,"state":"MS","positive":72412,"probableCases":1851,"negative":452177,"pending":null,"totalTestResultsSource":null,"totalTestResults":524589,"hospitalizedCurrently":1081,"hospitalizedCumulative":4989,"inIcuCurrently":289,"inIcuCumulative":null,"onVentilatorCurrently":168,"onVentilatorCumulative":null,"recovered":56577,"dataQualityGrade":"A+","lastUpdateEt":"8/16/2020 19:00","dateModified":"2020-08-16T19:00:00Z","checkTimeEt":"08/16 15:00","death":2095,"hospitalized":4989,"dateChecked":"2020-08-16T19:00:00Z","totalTestsViral":522738,"positiveTestsViral":null,"negativeTestsViral":null,"positiveCasesViral":70561,"deathConfirmed":2015,"deathProbable":80,"totalTestEncountersViral":null,"totalTestsPeopleViral":null,"totalTestsAntibody":18516,"positiveTestsAntibody":95,"negativeTestsAntibody":null,"totalTestsPeopleAntibody":null,"positiveTestsPeopleAntibody":null,"negativeTestsPeopleAntibody":null,"totalTestsPeopleAntigen":null,"positiveTestsPeopleAntigen":null,"totalTestsAntigen":null,"positiveTestsAntigen":null,"fips":"28","positiveIncrease":276,"negativeIncrease":4167,"total":524589,"totalTestResultsIncrease":4443,"posNeg":524589,"deathIncrease":11,"hospitalizedIncrease":73,"hash":"d63ba92f806abbd55e483079727c5a699ebd6bd5","commercialScore":0,"negativeRegularScore":0,"negativeScore":0,"positiveScore":0,"score":0,"grade":""},{"date":20200816,"state":"MS","positive":72136,"probableCases":1786,"negative":448010,"pending":null,"totalTestResultsSource":null,"totalTestResults":520146,"hospitalizedCurrently":1126,"hospitalizedCumulative":4916,"inIcuCurrently":321,"inIcuCumulative":null,"onVentilatorCurrently":176,"onVentilatorCumulative":null,"recovered":49836,"dataQualityGrade":"A+","lastUpdateEt":"8/16/2020 00:00","dateModified":"2020-08-16T00:00:00Z","checkTimeEt":"08/15 20:00","death":2084,"hospitalized":4916,"dateChecked":"2020-08-16T00:00:00Z","totalTestsViral":518057,"positiveTestsViral":null,"negativeTestsViral":null,"positiveCasesViral":70350,"deathConfirmed":2004,"deathProbable":80,"totalTestEncountersViral":null,"totalTestsPeopleViral":null,"totalTestsAntibody":18253,"positiveTestsAntibody":95,"negativeTestsAntibody":null,"totalTestsPeopleAntibody":null,"positiveTestsPeopleAntibody":null,"negativeTestsPeopleAntibody":null,"totalTestsPeopleAntigen":null,"positiveTestsPeopleAntigen":null,"totalTestsAntigen":null,"positiveTestsAntigen":null,"fips":"28","positiveIncrease":381,"negativeIncrease":0,"total":520146,"totalTestResultsIncrease":381,"posNeg":520146,"deathIncrease":4,"hospitalizedIncrease":0,"hash":"af7cb91fe9fcd077e8af749991fba5275f8853fc","commercialScore":0,"negativeRegularScore":0,"negativeScore":0,"positiveScore":0,"score":0,"grade":""},{"date":20200815,"state":"MS","positive":71755,"probableCases":1708,"negative":448010,"pending":null,"totalTestResultsSource":null,"totalTestResults":519765,"hospitalizedCurrently":1126,"hospitalizedCumulative":4916,"inIcuCurrently":321,"inIcuCumulative":null,"onVentilatorCurrently":176,"onVentilatorCumulative":null,"recovered":49836,"dataQualityGrade":"A+","lastUpdateEt":"8/14/2020 19:00","dateModified":"2020-08-14T19:00:00Z","checkTimeEt":"08/14 15:00","death":2080,"hospitalized":4916,"dateChecked":"2020-08-14T19:00:00Z","totalTestsViral":518057,"positiveTestsViral":null,"negativeTestsViral":null,"positiveCasesViral":70047,"deathConfirmed":2000,"deathProbable":80,"totalTestEncountersViral":null,"totalTestsPeopleViral":null,"totalTestsAntibody":18253,"positiveTestsAntibody":95,"negativeTestsAntibody":null,"totalTestsPeopleAntibody":null,"positiveTestsPeopleAntibody":null,"negativeTestsPeopleAntibody":null,"totalTestsPeopleAntigen":null,"positiveTestsPeopleAntigen":null,"totalTestsAntigen":null,"positiveTestsAntigen":null,"fips":"28","positiveIncrease":825,"negativeIncrease":7898,"total":519765,"totalTestResultsIncrease":8723,"posNeg":519765,"deathIncrease":37,"hospitalizedIncrease":43,"hash":"a96059a7c3723b61ebc8a3f95d5f473c1bad567a","commercialScore":0,"negativeRegularScore":0,"negativeScore":0,"positiveScore":0,"score":0,"grade":""},{"date":20200814,"state":"MS","positive":70930,"probableCases":1662,"negative":440112,"pending":null,"totalTestResultsSource":null,"totalTestResults":511042,"hospitalizedCurrently":1107,"hospitalizedCumulative":4873,"inIcuCurrently":312,"inIcuCumulative":null,"onVentilatorCurrently":179,"onVentilatorCumulative":null,"recovered":49836,"dataQualityGrade":"A+","lastUpdateEt":"8/13/2020 19:00","dateModified":"2020-08-13T19:00:00Z","checkTimeEt":"08/13 15:00","death":2043,"hospitalized":4873,"dateChecked":"2020-08-13T19:00:00Z","totalTestsViral":509380,"positiveTestsViral":null,"negativeTestsViral":null,"positiveCasesViral":69268,"deathConfirmed":1965,"deathProbable":78,"totalTestEncountersViral":null,"totalTestsPeopleViral":null,"totalTestsAntibody":17823,"positiveTestsAntibody":95,"negativeTestsAntibody":null,"totalTestsPeopleAntibody":null,"positiveTestsPeopleAntibody":null,"negativeTestsPeopleAntibody":null,"totalTestsPeopleAntigen":null,"positiveTestsPeopleAntigen":null,"totalTestsAntigen":null,"positiveTestsAntigen":null,"fips":"28","positiveIncrease":944,"negativeIncrease":1672,"total":511042,"totalTestResultsIncrease":2616,"posNeg":511042,"deathIncrease":32,"hospitalizedIncrease":26,"hash":"378a4d909ee6436fee71481c5dd766f42da025e6","commercialScore":0,"negativeRegularScore":0,"negativeScore":0,"positiveScore":0,"score":0,"grade":""},{"date":20200813,"state":"MS","positive":69986,"probableCases":1556,"negative":438440,"pending":null,"totalTestResultsSource":null,"totalTestResults":508426,"hospitalizedCurrently":1136,"hospitalizedCumulative":4847,"inIcuCurrently":318,"inIcuCumulative":null,"onVentilatorCurrently":195,"onVentilatorCumulative":null,"recovered":49836,"dataQualityGrade":"A+","lastUpdateEt":"8/12/2020 19:00","dateModified":"2020-08-12T19:00:00Z","checkTimeEt":"08/12 15:00","death":2011,"hospitalized":4847,"dateChecked":"2020-08-12T19:00:00Z","totalTestsViral":506353,"positiveTestsViral":null,"negativeTestsViral":null,"positiveCasesViral":68430,"deathConfirmed":1942,"deathProbable":69,"totalTestEncountersViral":null,"totalTestsPeopleViral":null,"totalTestsAntibody":17765,"positiveTestsAntibody":95,"negativeTestsAntibody":null,"totalTestsPeopleAntibody":null,"positiveTestsPeopleAntibody":null,"negativeTestsPeopleAntibody":null,"totalTestsPeopleAntigen":null,"positiveTestsPeopleAntigen":null,"totalTestsAntigen":null,"positiveTestsAntigen":null,"fips":"28","positiveIncrease":612,"negativeIncrease":0,"total":508426,"totalTestResultsIncrease":612,"posNeg":508426,"deathIncrease":22,"hospitalizedIncrease":53,"hash":"f614eb8fab286d2b5633639afae53defb14f301b","commercialScore":0,"negativeRegularScore":0,"negativeScore":0,"positiveScore":0,"score":0,"grade":""},{"date":20200812,"state":"MS","positive":69374,"probableCases":1461,"negative":438440,"pending":null,"totalTestResultsSource":null,"totalTestResults":507814,"hospitalizedCurrently":1148,"hospitalizedCumulative":4794,"inIcuCurrently":323,"inIcuCumulative":null,"onVentilatorCurrently":195,"onVentilatorCumulative":null,"recovered":49836,"dataQualityGrade":"A+","lastUpdateEt":"8/11/2020 19:00","dateModified":"2020-08-11T19:00:00Z","checkTimeEt":"08/11 15:00","death":1989,"hospitalized":4794,"dateChecked":"2020-08-11T19:00:00Z","totalTestsViral":506353,"positiveTestsViral":null,"negativeTestsViral":null,"positiveCasesViral":67913,"deathConfirmed":1922,"deathProbable":67,"totalTestEncountersViral":null,"totalTestsPeopleViral":null,"totalTestsAntibody":17765,"positiveTestsAntibody":95,"negativeTestsAntibody":null,"totalTestsPeopleAntibody":null,"positiveTestsPeopleAntibody":null,"negativeTestsPeopleAntibody":null,"totalTestsPeopleAntigen":null,"positiveTestsPeopleAntigen":null,"totalTestsAntigen":null,"positiveTestsAntigen":null,"fips":"28","positiveIncrease":1081,"negativeIncrease":2329,"total":507814,"totalTestResultsIncrease":3410,"posNeg":507814,"deathIncrease":45,"hospitalizedIncrease":56,"hash":"9e72acac30ca5b94addc8f7574d01aa25ac2e52f","commercialScore":0,"negativeRegularScore":0,"negativeScore":0,"positiveScore":0,"score":0,"grade":""},{"date":20200811,"state":"MS","positive":68293,"probableCases":1354,"negative":436111,"pending":null,"totalTestResultsSource":null,"totalTestResults":504404,"hospitalizedCurrently":1114,"hospitalizedCumulative":4738,"inIcuCurrently":325,"inIcuCumulative":null,"onVentilatorCurrently":192,"onVentilatorCumulative":null,"recovered":49836,"dataQualityGrade":"A+","lastUpdateEt":"8/10/2020 19:00","dateModified":"2020-08-10T19:00:00Z","checkTimeEt":"08/10 15:00","death":1944,"hospitalized":4738,"dateChecked":"2020-08-10T19:00:00Z","totalTestsViral":503050,"positiveTestsViral":null,"negativeTestsViral":null,"positiveCasesViral":66939,"deathConfirmed":1879,"deathProbable":65,"totalTestEncountersViral":null,"totalTestsPeopleViral":null,"totalTestsAntibody":17684,"positiveTestsAntibody":95,"negativeTestsAntibody":null,"totalTestsPeopleAntibody":null,"positiveTestsPeopleAntibody":null,"negativeTestsPeopleAntibody":null,"totalTestsPeopleAntigen":null,"positiveTestsPeopleAntigen":null,"totalTestsAntigen":null,"positiveTestsAntigen":null,"fips":"28","positiveIncrease":644,"negativeIncrease":9167,"total":504404,"totalTestResultsIncrease":9811,"posNeg":504404,"deathIncrease":32,"hospitalizedIncrease":58,"hash":"1a464a63ed4d6659781018195aaef4b2c233ca8d","commercialScore":0,"negativeRegularScore":0,"negativeScore":0,"positiveScore":0,"score":0,"grade":""},{"date":20200810,"state":"MS","positive":67649,"probableCases":1315,"negative":426944,"pending":null,"totalTestResultsSource":null,"totalTestResults":494593,"hospitalizedCurrently":1074,"hospitalizedCumulative":4680,"inIcuCurrently":328,"inIcuCumulative":null,"onVentilatorCurrently":196,"onVentilatorCumulative":null,"recovered":42391,"dataQualityGrade":"A+","lastUpdateEt":"8/9/2020 19:00","dateModified":"2020-08-09T19:00:00Z","checkTimeEt":"08/09 15:00","death":1912,"hospitalized":4680,"dateChecked":"2020-08-09T19:00:00Z","totalTestsViral":492386,"positiveTestsViral":null,"negativeTestsViral":null,"positiveCasesViral":66334,"deathConfirmed":1847,"deathProbable":65,"totalTestEncountersViral":null,"totalTestsPeopleViral":null,"totalTestsAntibody":17226,"positiveTestsAntibody":95,"negativeTestsAntibody":null,"totalTestsPeopleAntibody":null,"positiveTestsPeopleAntibody":null,"negativeTestsPeopleAntibody":null,"totalTestsPeopleAntigen":null,"positiveTestsPeopleAntigen":null,"totalTestsAntigen":null,"positiveTes