state,notes,covid19Site,covid19SiteSecondary,covid19SiteTertiary,twitter,covid19SiteOld,covidTrackingProjectPreferredTotalTestUnits,covidTrackingProjectPreferredTotalTestField,totalTestResultsField,name,fips,pui,pum
NH,"As of May 25, 2020, New Hampshire reports PCR tests separately from antibody tests.

On September 2, 2020, New Hampshire did not update their dashboards or summary report by the time of our update.

On September 9, 2020, New Hampshire did not update their dashboards or summary report by the time of our update.

Negative test results reported in our API and CSVs are calculated by subtracting **Positive PCR tests (people)** from **Total PCR tests (people)**.

As of September 18, 2020, New Hampshire's total test results are drawn from our `totalTestsViral` field instead of calculated via positive+negative. The number of unique people tested is available in our API as `totalTestsPeopleViral`.",https://www.dhhs.nh.gov/dphs/cdcs/2019-ncov.htm,https://www.nh.gov/covid19/dashboard/summary.htm,https://www.nh.gov/covid19/dashboard/overview.htm#dash,@NHPubHealth,https://www.dhhs.nh.gov/dphs/cdcs/2019-ncov.htm,Specimens,totalTestsViral,Total Tests (PCR),New Hampshire,33,,false
