date,state,positive,probableCases,negative,pending,totalTestResultsSource,totalTestResults,hospitalizedCurrently,hospitalizedCumulative,inIcuCurrently,inIcuCumulative,onVentilatorCurrently,onVentilatorCumulative,recovered,dataQualityGrade,lastUpdateEt,dateModified,checkTimeEt,death,hospitalized,dateChecked,totalTestsViral,positiveTestsViral,negativeTestsViral,positiveCasesViral,deathConfirmed,deathProbable,totalTestEncountersViral,totalTestsPeopleViral,totalTestsAntibody,positiveTestsAntibody,negativeTestsAntibody,totalTestsPeopleAntibody,positiveTestsPeopleAntibody,negativeTestsPeopleAntibody,totalTestsPeopleAntigen,positiveTestsPeopleAntigen,totalTestsAntigen,positiveTestsAntigen,fips,positiveIncrease,negativeIncrease,total,totalTestResultsIncrease,posNeg,deathIncrease,hospitalizedIncrease,hash,commercialScore,negativeRegularScore,negativeScore,positiveScore,score,grade
20201025,WA,102913,,2257474,,NaN,2360387,308,8280,,,43,,,B,10/25/2020 02:59,2020-10-25T02:59:00Z,10/24 22:59,2296,8280,2020-10-25T02:59:00Z,,,,102913,2296,,2360387,,,,,,,,,,,,53,1568,39888,2360387,41456,2360387,0,49,1124c326f7ba8e7f4ac5bfb5e095eb7c26de786c,0,0,0,0,0,
20201024,WA,101345,,2217586,,NaN,2318931,314,8231,,,48,,,B,10/23/2020 02:59,2020-10-23T02:59:00Z,10/22 22:59,2296,8231,2020-10-23T02:59:00Z,,,,101345,2296,,2318931,,,,,,,,,,,,53,820,21836,2318931,22656,2318931,7,48,9152262b6a20d7dac5d647f9dc23cd9001ab55c9,0,0,0,0,0,
20201023,WA,100525,,2195750,,NaN,2296275,321,8183,,,49,,,B,10/23/2020 02:59,2020-10-23T02:59:00Z,10/22 22:59,2289,8183,2020-10-23T02:59:00Z,,,,100525,2289,,2296275,,,,,,,,,,,,53,651,19171,2296275,19822,2296275,3,34,8cd3d1bbf31dfa705904ed90a1689e0dfd12a945,0,0,0,0,0,
20201022,WA,99874,,2176579,,NaN,2276453,318,8149,,,43,,,B,10/23/2020 02:59,2020-10-23T02:59:00Z,10/22 22:59,2286,8149,2020-10-23T02:59:00Z,,,,99874,2286,,2276453,,,,,,,,,,,,53,724,22941,2276453,23665,2276453,4,25,59c5958cf9aaaa53d3d15cb57f3746658aeea22f,0,0,0,0,0,
20201021,WA,99150,,2153638,,NaN,2252788,301,8124,,,43,,,B,10/20/2020 02:59,2020-10-20T02:59:00Z,10/19 22:59,2282,8124,2020-10-20T02:59:00Z,,,,99150,2282,,2252788,,,,,,,,,,,,53,489,7963,2252788,8452,2252788,24,47,049a67b9edbe1a22ad7732215cfb33368459062c,0,0,0,0,0,
20201020,WA,98661,,2145675,,NaN,2244336,289,8077,,,36,,,B,10/19/2020 02:59,2020-10-19T02:59:00Z,10/18 22:59,2258,8077,2020-10-19T02:59:00Z,,,,98661,2258,,2244336,,,,,,,,,,,,53,460,13091,2244336,13551,2244336,19,59,5915744593b87ba2528b3f37f095b4e7bd6ee8e2,0,0,0,0,0,
20201019,WA,98201,,2132584,,NaN,2230785,292,8018,,,26,,,B,10/18/2020 02:59,2020-10-18T02:59:00Z,10/17 22:59,2239,8018,2020-10-18T02:59:00Z,,,,98201,2239,,2230785,,,,,,,,,,,,53,0,15695,2230785,16225,2230785,0,24,7e5cad5721f45efd3b05d608d620d12dacf16043,0,0,0,0,0,
20201018,WA,98201,,2116889,,NaN,2214560,292,7994,,,26,,,B,10/18/2020 02:59,2020-10-18T02:59:00Z,10/17 22:59,2239,7994,2020-10-18T02:59:00Z,,,,98201,2239,,2214560,,,,,,,,,,,,53,1307,19529,2215090,20306,2215090,0,23,00cd6ab383eb8e28a042eba5f61324dd2961b193,0,0,0,0,0,
20201017,WA,96894,,2097360,,NaN,2194254,280,7971,,,27,,,B,10/16/2020 02:59,2020-10-16T02:59:00Z,10/15 22:59,2239,7971,2020-10-16T02:59:00Z,,,,96894,2239,,2194254,,,,,,,,,,,,53,709,24353,2194254,25062,2194254,7,15,f1104a6809868f01378721a1fa01df9b2e2c4476,0,0,0,0,0,
20201016,WA,96185,,2073007,,NaN,2169192,274,7956,,,18,,,B,10/15/2020 02:59,2020-10-15T02:59:00Z,10/14 22:59,2232,7956,2020-10-15T02:59:00Z,,,,96185,2232,,2169192,,,,,,,,,,,,53,676,22007,2169192,22683,2169192,11,73,4f376c53e932744410231187e646d9f3d63f78cd,0,0,0,0,0,
20201015,WA,95509,,2051000,,NaN,2146509,281,7883,,,25,,,B,10/14/2020 02:59,2020-10-14T02:59:00Z,10/13 22:59,2221,7883,2020-10-14T02:59:00Z,,,,95509,2221,,2146509,,,,,,,,,,,,53,734,21867,2146509,22601,2146509,10,9,43e2f81bd79b0b5ca8a83837162c3a0b84988445,0,0,0,0,0,
20201014,WA,94775,,2029133,,NaN,2123908,279,7874,,,26,,,B,10/13/2020 02:59,2020-10-13T02:59:00Z,10/12 22:59,2211,7874,2020-10-13T02:59:00Z,,,,94775,2211,,2123908,,,,,,,,,,,,53,0,0,2123908,0,2123908,0,0,ed5f3577e01df65b2ffce24ea6dcd3ba02b1f404,0,0,0,0,0,
20201013,WA,94775,,2029133,,NaN,2123908,279,7874,,,26,,,B,10/13/2020 02:59,2020-10-13T02:59:00Z,10/12 22:59,2211,7874,2020-10-13T02:59:00Z,,,,94775,2190,,2123908,,,,,,,,,,,,53,1740,60730,2123908,62470,2123908,21,88,a5ed7e4c30b9f53045c90cc3eb5ec3f6d490217d,0,0,0,0,0,
20201012,WA,93035,,1968403,,NaN,2061438,262,7786,,,27,,,B,10/12/2020 02:59,2020-10-12T02:59:00Z,10/11 22:59,2190,7786,2020-10-12T02:59:00Z,,,,93035,2190,,2061438,,,,,,,,,,,,53,0,0,2061438,0,2061438,0,0,fbcbc574e40eb01ee1007c3c1087c4149bc93cb9,0,0,0,0,0,
20201011,WA,93035,,1968403,,NaN,2061438,262,7786,,,27,,,B,10/12/2020 02:59,2020-10-12T02:59:00Z,10/11 22:59,2190,7786,2020-10-12T02:59:00Z,,,,93035,2190,,2061438,,,,,,,,,,,,53,475,23017,2061438,23492,2061438,0,24,11d02526fc132e83be653c75ecad764f47ca0d72,0,0,0,0,0,
20201010,WA,92560,,1945386,,NaN,2037946,264,7762,,,30,,,B,10/9/2020 02:59,2020-10-09T02:59:00Z,10/08 22:59,2190,7762,2020-10-09T02:59:00Z,,,,92560,2190,,2037946,,,,,,,,,,,,53,642,20833,2037946,21475,2037946,7,29,fee35c1c0a6afd30a196a646961e294e6f59e9cb,0,0,0,0,0,
20201009,WA,91918,,1924553,,NaN,2016471,245,7733,,,29,,,B,10/8/2020 02:59,2020-10-08T02:59:00Z,10/07 22:59,2183,7733,2020-10-08T02:59:00Z,,,,91918,2183,,2016471,,,,,,,,,,,,53,710,28284,2016471,28994,2016471,6,30,9f3abf14b00784fb12283afae6452b23fe2adc40,0,0,0,0,0,
20201008,WA,91208,,1896269,,NaN,1987477,256,7703,,,30,,,B,10/7/2020 02:59,2020-10-07T02:59:00Z,10/06 22:59,2177,7703,2020-10-07T02:59:00Z,,,,91208,2177,,1987477,,,,,,,,,,,,53,545,25865,1987477,26410,1987477,12,30,7ea7b9eb10cd9b712940ad1cbfd888825fd09b65,0,0,0,0,0,
20201007,WA,90663,,1870404,,NaN,1961067,253,7673,,,31,,,B,10/6/2020 02:59,2020-10-06T02:59:00Z,10/05 22:59,2165,7673,2020-10-06T02:59:00Z,,,,90663,2165,,1961067,,,,,,,,,,,,53,387,9273,1961067,9660,1961067,7,51,049d98bec3bf838df1a94e942dc36d9fd710f169,0,0,0,0,0,
20201006,WA,90276,,1861131,,NaN,1951407,253,7622,,,31,,,B,10/5/2020 02:59,2020-10-05T02:59:00Z,10/04 22:59,2158,7622,2020-10-05T02:59:00Z,,,,90276,2158,,1951407,,,,,,,,,,,,53,402,15106,1951407,15508,1951407,16,-6,f1d658ed4c86ef5e53cb78cd830256c66fa6cc40,0,0,0,0,0,
20201005,WA,89874,,1846025,,NaN,1935899,260,7628,,,29,,,B,10/4/2020 02:59,2020-10-04T02:59:00Z,10/03 22:59,2142,7628,2020-10-04T02:59:00Z,,,,89874,2142,,1935899,,,,,,,,,,,,53,455,12488,1935899,12943,1935899,0,17,3eeae18908eec63657ba45070468b93b8de9f3e6,0,0,0,0,0,
20201004,WA,89419,,1833537,,NaN,1922956,252,7611,,,26,,,B,10/3/2020 02:59,2020-10-03T02:59:00Z,10/02 22:59,2142,7611,2020-10-03T02:59:00Z,,,,89419,2142,,1922956,,,,,,,,,,,,53,609,16588,1922956,17197,1922956,-1,25,e0612be6f1b84c5a000d2797a5b7a5bff84a1944,0,0,0,0,0,
20201003,WA,88810,,1816949,,NaN,1905759,263,7586,,,40,,,B,10/2/2020 02:59,2020-10-02T02:59:00Z,10/01 22:59,2143,7586,2020-10-02T02:59:00Z,,,,88810,2143,,1905759,,,,,,,,,,,,53,694,20361,1905759,21685,1905759,11,13,284c44fe12c9dc2a74ddd70e41e01d8949387101,0,0,0,0,0,
20201002,WA,88116,,1796588,,NaN,1884074,263,7573,,,33,,,B,10/1/2020 02:59,2020-10-01T02:59:00Z,09/30 22:59,2132,7573,2020-10-01T02:59:00Z,,,,88116,2132,,1884074,,,,,,,,,,,,53,594,16021,1884704,15985,1884704,6,40,e824ad005bc0d734a648757544be47bfa18e5d50,0,0,0,0,0,
20201001,WA,87522,,1780567,,NaN,1868089,268,7533,,,32,,,B,10/1/2020 02:59,2020-10-01T02:59:00Z,09/30 22:59,2126,7533,2020-10-01T02:59:00Z,,,,87522,2126,,1868089,,,,,,,,,,,,53,480,13210,1868089,13690,1868089,2,50,fbd07c639e110023ed0aab3c5e1bf896e6040db8,0,0,0,0,0,
20200930,WA,87042,,1767357,,NaN,1854399,278,7483,,,26,,,B,9/29/2020 02:59,2020-09-29T02:59:00Z,09/28 22:59,2124,7483,2020-09-29T02:59:00Z,,,,87042,2124,,1854399,,,,,,,,,,,,53,404,5532,1854399,5936,1854399,24,6,c6405940c442af23a463f523f826a1dc0e08b875,0,0,0,0,0,
20200929,WA,86638,,1761825,,NaN,1848463,278,7477,,,43,,,B,9/28/2020 02:59,2020-09-28T02:59:00Z,09/27 22:59,2100,7477,2020-09-28T02:59:00Z,,,,86638,2100,,1848463,,,,,,,,,,,,53,369,10888,1848463,11257,1848463,0,22,115e46518014d5166b3f63b957fdae9666b12745,0,0,0,0,0,
20200928,WA,86269,,1750937,,NaN,1837206,268,7455,,,25,,,B,9/27/2020 02:59,2020-09-27T02:59:00Z,09/26 22:59,2100,7455,2020-09-27T02:59:00Z,,,,86269,2100,,1837206,,,,,,,,,,,,53,439,16144,1837206,16583,1837206,0,24,1faef85824ea56974528bced4a00f8f5a5efc779,0,0,0,0,0,
20200927,WA,85830,,1734793,,NaN,1820623,259,7431,,,31,,,B,9/26/2020 02:59,2020-09-26T02:59:00Z,09/25 22:59,2100,7431,2020-09-26T02:59:00Z,,,,85830,2100,,1820623,,,,,,,,,,,,53,604,18998,1820623,19602,1820623,0,19,ea746f5071e6fa64d9ad847d19e2ede522052a23,0,0,0,0,0,
20200926,WA,85226,,1715795,,NaN,1801021,264,7412,,,28,,,B,9/25/2020 02:59,2020-09-25T02:59:00Z,09/24 22:59,2100,7412,2020-09-25T02:59:00Z,,,,85226,2100,,1801021,,,,,,,,,,,,53,988,16754,1801021,17742,1801021,20,55,631d489fb47ba8c2a24d37761e7a4815d65212ce,0,0,0,0,0,
20200925,WA,84238,,1699041,,NaN,1783279,269,7357,,,27,,,B,9/24/2020 02:59,2020-09-24T02:59:00Z,09/23 22:59,2080,7357,2020-09-24T02:59:00Z,,,,84238,2080,,1783279,,,,,,,,,,,,53,536,39447,1783279,39983,1783279,-1,8,7bd14048c50e9d99e7e8010f985f9b80680b4a62,0,0,0,0,0,
20200924,WA,83702,,1659594,,NaN,1743296,262,7349,,,27,,,B,9/23/2020 02:59,2020-09-23T02:59:00Z,09/22 22:59,2081,7349,2020-09-23T02:59:00Z,,,,83702,2081,,1743296,,,,,,,,,,,,53,509,1888,1743296,2397,1743296,11,35,b8d6897afdec8f6ffac872ed9bf1eb8b33b908ef,0,0,0,0,0,
20200923,WA,83193,,1657706,,NaN,1740899,277,7314,,,32,,,B,9/22/2020 02:59,2020-09-22T02:59:00Z,09/21 22:59,2070,7314,2020-09-22T02:59:00Z,,,,83193,2070,,1740899,,,,,,,,,,,,53,0,0,1740899,0,1740899,0,0,ced2768506c94a3ee72fbc24da64301d7a360fc6,0,0,0,0,0,
20200922,WA,83193,,1657706,,NaN,1740899,277,7314,,,32,,,B,9/20/2020 02:59,2020-09-20T02:59:00Z,09/19 22:59,2070,7314,2020-09-20T02:59:00Z,,,,83193,2070,,1740899,,,,,,,,,,,,53,645,3698,1740899,4343,1740899,33,52,894b1cda4842e8e0f1d8c5d3cbec2b04214b2b46,0,0,0,0,0,
20200921,WA,82548,,1654008,,NaN,1736556,266,7262,,,21,,,B,9/20/2020 02:59,2020-09-20T02:59:00Z,09/19 22:59,2037,7262,2020-09-20T02:59:00Z,,,,82548,2037,,1736556,,,,,,,,,,,,53,349,13167,1736556,13516,1736556,0,14,b30359a4844406b67d2d7cc78d7340d5c52a615b,0,0,0,0,0,
20200920,WA,82199,,1640841,,NaN,1723040,262,7248,,,26,,,B,9/19/2020 02:59,2020-09-19T02:59:00Z,09/18 22:59,2037,7248,2020-09-19T02:59:00Z,,,,82199,2037,,1723040,,,,,,,,,,,,53,597,17773,1723040,18370,1723040,0,33,07104a5c0bbfe21d42ce46c6240e7ee3964188d2,0,0,0,0,0,
20200919,WA,81602,,1623068,,NaN,1704670,248,7215,,,34,,,B,9/18/2020 02:59,2020-09-18T02:59:00Z,09/17 22:59,2037,7215,2020-09-18T02:59:00Z,,,,81602,2037,,1704670,,,,,,,,,,,,53,0,0,1704670,0,1704670,0,0,48d2962aaf4c700d4f213d9c5e5a4e7b66763130,0,0,0,0,0,
20200918,WA,81602,,1623068,,NaN,1704670,248,7215,,,34,,,B,9/18/2020 02:59,2020-09-18T02:59:00Z,09/17 22:59,2037,7215,2020-09-18T02:59:00Z,,,,81602,2037,,1704670,,,,,,,,,,,,53,404,13219,1704670,13623,1704670,6,19,c10006f04b969d9a73f50bfd1746f1e574cca7fa,0,0,0,0,0,
20200917,WA,81198,,1609849,,NaN,1691047,248,7196,,,36,,,B,9/17/2020 02:59,2020-09-17T02:59:00Z,09/16 22:59,2031,7196,2020-09-17T02:59:00Z,,,,81198,2031,,1691047,,,,,,,,,,,,53,386,13959,1691047,14345,1691047,11,34,435081eddec0ddb7b367ffaa81a680bce10f966c,0,0,0,0,0,
20200916,WA,80812,,1595890,,NaN,1676702,248,7162,,,29,,,B,9/16/2020 02:59,2020-09-16T02:59:00Z,09/15 22:59,2020,7162,2020-09-16T02:59:00Z,,,,80812,2020,,1676702,,,,,,,,,,,,53,347,10640,1676702,10987,1676702,5,35,c6493ba5143e745ce44c97d95deea2ee85671970,0,0,0,0,0,
20200915,WA,80465,,1585250,,NaN,1665715,262,7127,,,28,,,B,9/15/2020 02:59,2020-09-15T02:59:00Z,09/14 22:59,2015,7127,2020-09-15T02:59:00Z,,,,80465,2015,,1665715,,,,,,,,,,,,53,327,11421,1665715,11748,1665715,9,29,3ec0230f8cf518f707a657a75ce17bfec64c2b96,0,0,0,0,0,
20200914,WA,80138,,1573829,,NaN,1653967,247,7098,,,26,,,B,9/14/2020 02:59,2020-09-14T02:59:00Z,09/13 22:59,2006,7098,2020-09-14T02:59:00Z,,,,80138,2006,,1653967,,,,,,,,,,,,53,312,9070,1653967,9382,1653967,15,17,553cd113091b73fd9bf679c88c2958c028ad4b72,0,0,0,0,0,
20200913,WA,79826,,1564759,,NaN,1644585,254,7081,,,29,,,B,9/13/2020 02:59,2020-09-13T02:59:00Z,09/12 22:59,1991,7081,2020-09-13T02:59:00Z,,,,79826,1991,,1644585,,,,,,,,,,,,53,350,13073,1644585,13423,1644585,0,33,d81ae53d93f23ae3c167815834b441596528874e,0,0,0,0,0,
20200912,WA,79476,,1551686,,NaN,1631162,269,7048,,,19,,,B,9/11/2020 02:59,2020-09-11T02:59:00Z,09/10 22:59,1991,7048,2020-09-11T02:59:00Z,,,,79476,1991,,1631162,,,,,,,,,,,,53,465,15949,1631162,16414,1631162,0,30,9273f46e33ad63e8e37a550a203f2eac84094582,0,0,0,0,0,
20200911,WA,79011,,1535737,,NaN,1614748,269,7018,,,19,,,B,9/11/2020 02:59,2020-09-11T02:59:00Z,09/10 22:59,1991,7018,2020-09-11T02:59:00Z,,,,79011,1991,,1614748,,,,,,,,,,,,53,544,16217,1614748,16761,1614748,6,25,66e93d1d76a411d04c2719a76d0a2a25278ae276,0,0,0,0,0,
20200910,WA,78467,,1519520,,NaN,1597987,284,6993,,,29,,,B,9/10/2020 02:59,2020-09-10T02:59:00Z,09/09 22:59,1985,6993,2020-09-10T02:59:00Z,,,,78467,1985,,1597987,,,,,,,,,,,,53,458,13626,1597987,14084,1597987,7,27,9bf218867937c2618c8ab0e8b8d31a8aed81e612,0,0,0,0,0,
20200909,WA,78009,,1505894,,NaN,1583903,290,6966,,,34,,,B,9/9/2020 02:59,2020-09-09T02:59:00Z,09/08 22:59,1978,6966,2020-09-09T02:59:00Z,,,,78009,1978,,1583903,,,,,,,,,,,,53,774,20076,1583903,20850,1583903,25,106,be437c8c0c702d4f9397a3974436ccd886a13273,0,0,0,0,0,
20200908,WA,77235,,1485818,,NaN,1563053,277,6860,,,37,,,B,9/6/2020 02:59,2020-09-06T02:59:00Z,09/05 22:59,1953,6860,2020-09-06T02:59:00Z,,,,77235,1953,,1563053,,,,,,,,,,,,53,0,0,1563053,0,1563053,0,0,e029c6dbafbb8a2617f7d27793312269ed9578fc,0,0,0,0,0,
20200907,WA,77235,,1485818,,NaN,1563053,277,6860,,,37,,,B,9/6/2020 02:59,2020-09-06T02:59:00Z,09/05 22:59,1953,6860,2020-09-06T02:59:00Z,,,,77235,1953,,1563053,,,,,,,,,,,,53,399,12177,1563053,12576,1563053,0,18,31c73c5984112ca42b4c030c7f8eb5324e022db0,0,0,0,0,0,
20200906,WA,76836,,1473641,,NaN,1550477,282,6842,,,34,,,B,9/5/2020 02:59,2020-09-05T02:59:00Z,09/04 22:59,1953,6842,2020-09-05T02:59:00Z,,,,76836,1953,,1550477,,,,,,,,,,,,53,501,15886,1550477,16387,1550477,0,-6,861de345a9b4fbbdfcaf6c6fdee213b2d076718b,0,0,0,0,0,
20200905,WA,76335,,1457755,,NaN,1534090,293,6848,,,48,,,B,9/4/2020 02:59,2020-09-04T02:59:00Z,09/03 22:59,1953,6848,2020-09-04T02:59:00Z,,,,76335,1953,,1534090,,,,,,,,,,,,53,479,15522,1534090,16001,1534090,8,14,ffeabfdb9e10bd054ea6e67ab917174fe8336f18,0,0,0,0,0,
20200904,WA,75856,,1442233,,NaN,1518089,309,6834,,,50,,,B,9/3/2020 02:59,2020-09-03T02:59:00Z,09/02 22:59,1945,6834,2020-09-03T02:59:00Z,,,,75856,1945,,1518089,,,,,,,,,,,,53,479,21257,1518089,21736,1518089,10,39,befbc635fd12ed3f8d6aceacdb97d778932cddad,0,0,0,0,0,
20200903,WA,75377,,1420976,,NaN,1496353,311,6795,,,65,,,B,9/2/2020 02:59,2020-09-02T02:59:00Z,09/01 22:59,1935,6795,2020-09-02T02:59:00Z,,,,75377,1935,,1496353,,,,,,,,,,,,53,438,15876,1496353,16314,1496353,4,8,d212eb99ee7ddc86161e7b531d6ffec1a90229b9,0,0,0,0,0,
20200902,WA,74939,,1405100,,NaN,1480039,328,6787,,,48,,,B,9/1/2020 02:59,2020-09-01T02:59:00Z,08/31 22:59,1931,6787,2020-09-01T02:59:00Z,,,,74939,1931,,1480039,,,,,,,,,,,,53,304,6490,1480039,6794,1480039,16,24,f34b4bc47ea548a6020f7417d7334ed58238a12e,0,0,0,0,0,
20200901,WA,74635,,1398610,,NaN,1473245,331,6763,,,49,,,B,8/31/2020 02:59,2020-08-31T02:59:00Z,08/30 22:59,1915,6763,2020-08-31T02:59:00Z,,,,74635,1915,,1473245,,,,,,,,,,,,53,315,11576,1473245,11891,1473245,10,23,3121e7166ea5a6980fc80dde48d70899e1a4c2bb,0,0,0,0,0,
20200831,WA,74320,,1387034,,NaN,1461354,340,6740,,,51,,,B,8/30/2020 02:59,2020-08-30T02:59:00Z,08/29 22:59,1905,6740,2020-08-30T02:59:00Z,,,,74320,1905,,1461354,,,,,,,,,,,,53,0,0,1461354,0,1461354,0,0,a4b8a554bbf53da8a8b38f5727d0d851ccbaa9b5,0,0,0,0,0,
20200830,WA,74320,,1387034,,NaN,1461354,340,6740,,,51,,,B,8/30/2020 02:59,2020-08-30T02:59:00Z,08/29 22:59,1905,6740,2020-08-30T02:59:00Z,,,,74320,1905,,1461354,,,,,,,,,,,,53,1019,36564,1461354,37583,1461354,0,61,f413e4a3711d7130a63d2b65e2304718fdb95a1f,0,0,0,0,0,
20200829,WA,73301,,1350470,,NaN,1423771,346,6679,,,46,,,B,8/28/2020 02:59,2020-08-28T02:59:00Z,08/27 22:59,1905,6679,2020-08-28T02:59:00Z,,,,73301,1905,,1423771,,,,,,,,,,,,53,598,15009,1423771,15607,1423771,15,5,0c780b89aecc27164548662732b3d6201b36aa5c,0,0,0,0,0,
20200828,WA,72703,,1335461,,NaN,1408164,347,6674,,,45,,,B,8/27/2020 02:59,2020-08-27T02:59:00Z,08/26 22:59,1890,6674,2020-08-27T02:59:00Z,,,,72703,1890,,1408164,,,,,,,,,,,,53,542,16313,1408164,16855,1408164,10,34,dd1f8ad824c6e1b5f3d19d3b624788fd6077ae75,0,0,0,0,0,
20200827,WA,72161,,1319148,,NaN,1391309,351,6640,,,37,,,B,8/26/2020 02:59,2020-08-26T02:59:00Z,08/25 22:59,1880,6640,2020-08-26T02:59:00Z,,,,72161,1880,,1391309,,,,,,,,,,,,53,456,10749,1391309,11205,1391309,4,45,1f1a5875527c06612d41a49de676462385581f5e,0,0,0,0,0,
20200826,WA,71705,,1308399,,NaN,1380104,358,6595,,,47,,,B,8/25/2020 02:59,2020-08-25T02:59:00Z,08/24 22:59,1876,6595,2020-08-25T02:59:00Z,,,,71705,1876,,1380104,,,,,,,,,,,,53,24,30,1380104,54,1380104,9,53,8363ed14bfd7b34281d47038137b816e78374776,0,0,0,0,0,
20200825,WA,71681,,1308369,,NaN,1380050,354,6542,,,37,,,B,8/24/2020 02:59,2020-08-24T02:59:00Z,08/23 22:59,1867,6542,2020-08-24T02:59:00Z,,,,71681,1867,,1380050,,,,,,,,,,,,53,0,0,1380050,0,1380050,4,12,405fa7a5fc1fdf628a8ff0820e2407b7d5c213fb,0,0,0,0,0,
20200824,WA,71681,,1308369,,NaN,1380050,373,6530,,,36,,,B,8/23/2020 02:59,2020-08-23T02:59:00Z,08/22 22:59,1863,6530,2020-08-23T02:59:00Z,,,,71681,1863,,1380050,,,,,,,,,,,,53,22,992,1380050,1014,1380050,6,30,ddd9749be68789ffa6bd71f50c3a13ccb9f77b5d,0,0,0,0,0,
20200823,WA,71659,,1307377,,NaN,1379036,371,6500,,,42,,,B,8/22/2020 02:59,2020-08-22T02:59:00Z,08/21 22:59,1857,6500,2020-08-22T02:59:00Z,,,,71659,1857,,1379036,,,,,,,,,,,,53,61,2442,1379036,2503,1379036,7,31,0ab8971456e2edc229c97a84130e6d212ac91cd8,0,0,0,0,0,
20200822,WA,71598,,1304935,,NaN,1376533,371,6469,,,45,,,B,8/21/2020 02:59,2020-08-21T02:59:00Z,08/20 22:59,1850,6469,2020-08-21T02:59:00Z,,,,71598,1850,,1376533,,,,,,,,,,,,53,184,7085,1376533,7269,1376533,13,69,b4af969e6f3c101ccdcf964edc0f5008dd37b536,0,0,0,0,0,
20200821,WA,71414,,1297850,,NaN,1369264,374,6400,,,48,,,B,8/20/2020 02:59,2020-08-20T02:59:00Z,08/19 22:59,1837,6400,2020-08-20T02:59:00Z,,,,71414,1837,,1369264,,,,,,,,,,,,53,441,11955,1369264,12396,1369264,15,12,dce65251c4aa5e0fa9ab713397e12549a83714e9,0,0,0,0,0,
20200820,WA,70973,,1285895,,NaN,1356868,385,6388,,,44,,,B,8/19/2020 02:59,2020-08-19T02:59:00Z,08/18 22:59,1822,6388,2020-08-19T02:59:00Z,,,,70973,1822,,1356868,,,,,,,,,,,,53,443,12382,1356868,12825,1356868,13,30,45cf19c0daa0b8fd485fbe161ae59e750e772091,0,0,0,0,0,
20200819,WA,70530,,1273513,,NaN,1344043,375,6358,,,43,,,B,8/18/2020 02:59,2020-08-18T02:59:00Z,08/17 22:59,1809,6358,2020-08-18T02:59:00Z,,,,70530,1809,,1344043,,,,,,,,,,,,53,563,14264,1344043,14827,1344043,24,62,86b6d141ea48a6b1246c4ee1908e180a2d2c5dc4,0,0,0,0,0,
20200818,WA,69967,,1259249,,NaN,1329216,394,6296,,,39,,,B,8/17/2020 02:59,2020-08-17T02:59:00Z,08/16 22:59,1785,6296,2020-08-17T02:59:00Z,,,,69967,1785,,1329216,,,,,,,,,,,,53,598,14503,1329216,15101,1329216,4,41,7b12195e87c1bf9c462cfacfa9741ae2964f3c7b,0,0,0,0,0,
20200817,WA,69369,,1244746,,NaN,1314115,391,6255,,,43,,,B,8/16/2020 02:59,2020-08-16T02:59:00Z,08/15 22:59,1781,6255,2020-08-16T02:59:00Z,,,,69369,1781,,1314115,,,,,,,,,,,,53,640,15547,1314115,16187,1314115,15,25,63cec66607ddb15d2d8bab19f5347ea99e5815ce,0,0,0,0,0,
20200816,WA,68729,,1229199,,NaN,1297928,395,6230,,,55,,,B,8/15/2020 02:59,2020-08-15T02:59:00Z,08/14 22:59,1766,6230,2020-08-15T02:59:00Z,,,,68729,1766,,1297928,,,,,,,,,,,,53,150,4801,1297928,4951,1297928,11,24,d9d3d835c8249fdc3afe5c5eee4024f102304c68,0,0,0,0,0,
20200815,WA,68579,,1224398,,NaN,1292977,390,6206,,,58,,,B,8/13/2020 02:59,2020-08-13T02:59:00Z,08/12 22:59,1755,6206,2020-08-13T02:59:00Z,,,,68579,1755,,1292977,,,,,,,,,,,,53,345,8491,1292977,8836,1292977,19,24,cb570fdc009c1986d030a0f9547ffd3e0785e178,0,0,0,0,0,
20200814,WA,68234,,1215907,,NaN,1284141,403,6182,,,58,,,B,8/13/2020 02:59,2020-08-13T02:59:00Z,08/12 22:59,1736,6182,2020-08-13T02:59:00Z,,,,68234,1736,,1284141,,,,,,,,,,,,53,623,13887,1284141,14510,1284141,12,45,2e1cf6cdb294741cadc6b113bc34a37e85ff984e,0,0,0,0,0,
20200813,WA,67611,,1202020,,NaN,1269631,395,6137,,,40,,,B,8/11/2020 02:59,2020-08-11T02:59:00Z,08/10 22:59,1724,6137,2020-08-11T02:59:00Z,,,,67611,1724,,1269631,,,,,,,,,,,,53,606,14511,1269631,15117,1269631,8,35,8d3a2784081bddc74f2191430c928d05af4c3719,0,0,0,0,0,
20200812,WA,67005,,1187509,,NaN,1254514,383,6102,,,59,,,B,8/11/2020 02:59,2020-08-11T02:59:00Z,08/10 22:59,1716,6102,2020-08-11T02:59:00Z,,,,67005,1716,,1254514,,,,,,,,,,,,53,601,16011,1254514,16612,1254514,19,53,abc904f5ff62f9c2daf0a5d074b86ec1bd12f1e9,0,0,0,0,0,
20200811,WA,66404,,1171498,,NaN,1237902,386,6049,,,35,,,B,8/10/2020 02:59,2020-08-10T02:59:00Z,08/09 22:59,1697,6049,2020-08-10T02:59:00Z,,,,66404,1697,,1237902,,,,,,,,,,,,53,683,15268,1237902,15951,1237902,9,48,2f93cdf1717215c9487290c4ee8dde7b2095c5aa,0,0,0,0,0,
20200810,WA,65721,,1156230,,NaN,1221951,402,6001,,,49,,,B,8/9/2020 02:59,2020-08-09T02:59:00Z,08/08 22:59,1688,6001,2020-08-09T02:59:00Z,,,,65721,1688,,1221951,,,,,,,,,,,,53,803,18151,1221951,18954,1221951,0,105,da5ebe46b7f380a371dc580b1893ea990985bd27,0,0,0,0,0,
20200809,WA,64918,,1138079,,NaN,1202997,400,5896,,,60,,,B,8/8/2020 02:59,2020-08-08T02:59:00Z,08/07 22:59,1688,5896,2020-08-08T02:59:00Z,,,,64918,1688,,1202997,,,,,,,,,,,,53,195,4795,1202997,4990,1202997,16,6,55dbcca44030ef3a91d834dbcc432aec3f182add,0,0,0,0,0,
20200808,WA,64723,,1133284,,NaN,1198007,415,5890,,,56,,,B,8/6/2020 20:30,2020-08-06T20:30:00Z,08/06 16:30,1672,5890,2020-08-06T20:30:00Z,,,,64723,1672,,1198007,,,,,,,,,,,,53,366,8976,1198007,9342,1198007,19,16,f02c00904a65f1089c81fc60ba5a81d413416ef1,0,0,0,0,0,
20200807,WA,64357,,1124308,,NaN,1188665,405,5874,,,50,,,B,8/6/2020 02:59,2020-08-06T02:59:00Z,08/05 22:59,1653,5874,2020-08-06T02:59:00Z,,,,64357,1653,,1188665,,,,,,,,,,,,53,659,14356,1188665,15015,1188665,29,34,cda034eff4194756de306916e0388b2c20cdf837,0,0,0,0,0,
20200806,WA,63698,,1109952,,NaN,1173650,426,5840,,,58,,,B,8/5/2020 02:59,2020-08-05T02:59:00Z,08/04 22:59,1624,5840,2020-08-05T02:59:00Z,,,,63698,1624,,1173650,,,,,,,,,,,,53,706,13883,1173650,14589,1173650,5,61,5f419899eb6ddff559c6fb61584509414c0e2948,0,0,0,0,0,
20200805,WA,62992,,1096069,,NaN,1159061,424,5779,,,47,,,B,8/4/2020 02:59,2020-08-04T02:59:00Z,08/03 22:59,1619,5779,2020-08-04T02:59:00Z,,,,62992,1619,,1159061,1009486,,,,,,,,,,,53,725,14343,1159061,15068,1159061,19,35,e1e271ab9bb15f72517c236da8f0ba650c7af1d7,0,0,0,0,0,
20200804,WA,62267,,1081726,,NaN,1143993,401,5744,,,52,,,B,8/3/2020 02:59,2020-08-03T02:59:00Z,08/02 22:59,1600,5744,2020-08-03T02:59:00Z,,,,62267,1600,,1143993,1008822,,,,,,,,,,,53,839,15535,1143993,16374,1143993,4,52,be1d0d5c56341bfb0d7240e5d13238443bf1f5b7,0,0,0,0,0,
20200803,WA,61428,,1066191,,NaN,1127619,401,5692,,,51,,,B,8/2/2020 02:59,2020-08-02T02:59:00Z,08/01 22:59,1596,5692,2020-08-02T02:59:00Z,,,,61428,1596,,1127619,1008280,,,,,,,,,,,53,840,16694,1127619,17534,1127619,4,37,36ed41a49b28dd6f71c0a876cc8da1a8ff4348e8,0,0,0,0,0,
20200802,WA,60588,,1049497,,NaN,1110085,407,5655,,,57,,,B,8/1/2020 02:59,2020-08-01T02:59:00Z,07/31 22:59,1592,5655,2020-08-01T02:59:00Z,,,,60588,1592,,1110085,1001528,,,,,,,,,,,53,228,4559,1110085,4787,1110085,28,87,c19ef20c5282820041f06a401806d7a679dc03dd,0,0,0,0,0,
20200801,WA,60360,,1044938,,NaN,1105298,415,5568,,,56,,,B,7/30/2020 02:59,2020-07-30T02:59:00Z,07/29 22:59,1564,5568,2020-07-30T02:59:00Z,,,,60360,1564,,1105298,973654,,,,,,,,,,,53,410,8586,1105298,8996,1105298,0,0,c561f34c5edf8f4f2db1ca2c39c4f460090d94ed,0,0,0,0,0,
20200731,WA,59950,,1036352,,NaN,1096302,415,5568,,,56,,,B,7/30/2020 02:59,2020-07-30T02:59:00Z,07/29 22:59,1564,5568,2020-07-30T02:59:00Z,,,,59950,1564,,1096302,973654,,,,,,,,,,,53,687,14129,1096302,14816,1096302,9,92,2a4fc30454af9940bf62eb61d8f8d7f090f60b46,0,0,0,0,0,
20200730,WA,59263,,1022223,,NaN,1081486,399,5476,,,57,,,B,7/29/2020 02:59,2020-07-29T02:59:00Z,07/28 22:59,1555,5476,2020-07-29T02:59:00Z,,,,59263,1555,,1081486,958307,,,,,,,,,,,53,733,13855,1081486,14588,1081486,7,2,b4d32d361bde6f4c59485fc2cecf350193f06259,0,0,0,0,0,
20200729,WA,58530,,1008368,,NaN,1066898,407,5474,,,48,,,B,7/28/2020 02:59,2020-07-28T02:59:00Z,07/27 22:59,1548,5474,2020-07-28T02:59:00Z,,,,58530,1548,,1066898,945234,,,,,,,,,,,53,875,14401,1066898,15276,1066898,30,77,1f044cdd693677579e915e50e27f7b55ca3ed47d,0,0,0,0,0,
20200728,WA,57655,,993967,,NaN,1051622,386,5397,,,49,,,B,7/27/2020 02:59,2020-07-27T02:59:00Z,07/26 22:59,1518,5397,2020-07-27T02:59:00Z,,,,57655,1518,,1051622,933304,,,,,,,,,,,53,909,15194,1051622,16103,1051622,17,23,674fa44cceb5ebe3474d3727a87cca719b0cbcc7,0,0,0,0,0,
20200727,WA,56746,,978773,,NaN,1035519,396,5374,,,42,,,B,7/26/2020 02:59,2020-07-26T02:59:00Z,07/25 22:59,1501,5374,2020-07-26T02:59:00Z,,,,56746,1501,,1035519,919347,,,,,,,,,,,53,973,16323,1035519,17296,1035519,7,33,f1d2298fcc3e67fbb29c919fadf6e780f0dd6165,0,0,0,0,0,
20200726,WA,55773,,962450,,NaN,1018223,407,5341,,,51,,,B,7/25/2020 02:59,2020-07-25T02:59:00Z,07/24 22:59,1494,5341,2020-07-25T02:59:00Z,,,,55773,1494,,1018223,903674,,,,,,,,,,,53,321,4623,1018223,4944,1018223,-1,40,495ac128630f6ac7af2aa130590c7802e973d8fa,0,0,0,0,0,
20200725,WA,55452,,957827,,NaN,1013279,407,5301,,,52,,,B,7/24/2020 02:59,2020-07-24T02:59:00Z,07/23 22:59,1495,5301,2020-07-24T02:59:00Z,,,,55452,1495,,1013279,883982,,,,,,,,,,,53,482,9087,1013279,9569,1013279,13,25,5c0078960716ae033249fbb6c363646d1e028408,0,0,0,0,0,
20200724,WA,54970,,948740,,NaN,1003710,386,5276,,,47,,,B,7/23/2020 02:59,2020-07-23T02:59:00Z,07/22 22:59,1482,5276,2020-07-23T02:59:00Z,,,,54970,1482,,1003710,870763,,,,,,,,,,,53,793,14382,1003710,15175,1003710,14,65,6614da1dd597a05ad09013f8b91597c3cc88c78c,0,0,0,0,0,
20200723,WA,54177,,934358,,NaN,988535,385,5211,,,55,,,B,7/22/2020 02:59,2020-07-22T02:59:00Z,07/21 22:59,1468,5211,2020-07-22T02:59:00Z,,,,54177,1468,,988535,855152,,,,,,,,,,,53,871,13582,988535,14453,988535,3,50,d264777fc06f178992567bd1987bb0e1dbf38700,0,0,0,0,0,
20200722,WA,53306,,920776,,NaN,974082,392,5161,,,51,,,B,7/21/2020 02:59,2020-07-21T02:59:00Z,07/20 22:59,1465,5161,2020-07-21T02:59:00Z,,,,53306,1465,,974082,841184,,,,,,,,,,,53,1016,14751,974082,15767,974082,12,59,cf9af30d41f37fe2486bfd86880445d5368e9a42,0,0,0,0,0,
20200721,WA,52290,,906025,,NaN,958315,365,5102,,,43,,,B,7/20/2020 02:59,2020-07-20T02:59:00Z,07/19 22:59,1453,5102,2020-07-20T02:59:00Z,,,,52290,1453,,958315,826354,,,,,,,,,,,53,1084,15973,958315,17057,958315,6,39,acb20f8a3d833197c7245b4099c049a5e857d37f,0,0,0,0,0,
20200720,WA,51206,,890052,,NaN,941258,354,5063,,,42,,,B,7/19/2020 02:59,2020-07-19T02:59:00Z,07/18 22:59,1447,5063,2020-07-19T02:59:00Z,,,,51206,1447,,941258,809339,,,,,,,,,,,53,990,16737,941258,17727,941258,3,30,6c05d08f1cfd87e438093ede51c171dd3a32e92b,0,0,0,0,0,
20200719,WA,50216,,873315,,NaN,923531,364,5033,,,62,,,B,7/18/2020 02:59,2020-07-18T02:59:00Z,07/17 22:59,1444,5033,2020-07-18T02:59:00Z,,,,50216,1444,,923531,791786,,,,,,,,,,,53,334,4877,923531,5211,923531,10,49,abb2beb530278b8518bfbc1f5a3fef6baf179af4,0,0,0,0,0,
20200718,WA,49882,,868438,,NaN,918320,348,4984,,,46,,,B,7/17/2020 02:59,2020-07-17T02:59:00Z,07/16 22:59,1434,4984,2020-07-17T02:59:00Z,,,,49882,1434,,918320,767657,,,,,,,,,,,53,524,9163,918320,9687,918320,7,40,aeea7c2c555a454800f7cdf777ec46f36dda9489,0,0,0,0,0,
20200717,WA,49358,,859275,,NaN,908633,379,4944,,,45,,,B,7/16/2020 02:59,2020-07-16T02:59:00Z,07/15 22:59,1427,4944,2020-07-16T02:59:00Z,,,,49358,1427,,908633,753174,,,,,,,,,,,53,878,15519,908633,16397,908633,6,115,00b9a3163fd692ebfd21207f49db27cdbaff411a,0,0,0,0,0,
20200716,WA,48480,,843756,,NaN,892236,372,4829,,,53,,,B,7/15/2020 02:59,2020-07-15T02:59:00Z,07/14 22:59,1421,4829,2020-07-15T02:59:00Z,,,,48480,1421,,892236,733886,,,,,,,,,,,53,825,14586,892236,15411,892236,17,41,286476f57f6feeaf580e4c3ceab656df1d8b3b93,0,0,0,0,0,
20200715,WA,47655,,829170,,NaN,876825,353,4788,,,55,,,B,7/14/2020 02:59,2020-07-14T02:59:00Z,07/13 22:59,1404,4788,2020-07-14T02:59:00Z,,,,47655,1404,,876825,718234,,,,,,,,,,,53,962,15888,876825,16850,876825,5,10,3e1bd48cde4f0773bfceb4d426521f3e826725af,0,0,0,0,0,
20200714,WA,46693,,813282,,NaN,859975,332,4778,,,39,,,B,7/13/2020 02:59,2020-07-13T02:59:00Z,07/12 22:59,1399,4778,2020-07-13T02:59:00Z,,,,46693,1399,,859975,708274,,,,,,,,,,,53,948,16965,859975,17913,859975,-39,27,8c679e807863501c7d4c09a21cc8b72338f30738,0,0,0,0,0,
20200713,WA,45745,,796317,,NaN,842062,331,4751,,,35,,,B,7/12/2020 02:59,2020-07-12T02:59:00Z,07/11 22:59,1438,4751,2020-07-12T02:59:00Z,,,,45745,1438,,842062,686005,,,,,,,,,,,53,1070,17490,842062,18560,842062,14,89,68645a916aa5d31ff29bd9723e015d91f8e69870,0,0,0,0,0,
20200712,WA,44675,,778827,,NaN,823502,326,4662,,,57,,,B,7/10/2020 02:59,2020-07-10T02:59:00Z,07/09 22:59,1424,4662,2020-07-10T02:59:00Z,,,,44675,1424,,823502,668466,,,,,,,,,,,53,334,5048,823502,5382,823502,0,0,209883d18c342f5c38a89fcdd7931242da7ceefe,0,0,0,0,0,
20200711,WA,44341,,773779,,NaN,818120,326,4662,,,57,,,B,7/10/2020 02:59,2020-07-10T02:59:00Z,07/09 22:59,1424,4662,2020-07-10T02:59:00Z,,,,44341,1424,,818120,668466,,,,,,,,,,,53,526,9817,818120,10343,818120,15,-3,d148526c9205d38b1ee87b0c8d4e8d58d9519744,0,0,0,0,0,
20200710,WA,43815,,763962,,NaN,807777,326,4665,,,60,,,B,7/9/2020 02:59,2020-07-09T02:59:00Z,07/08 22:59,1409,4665,2020-07-09T02:59:00Z,,,,43815,1409,,807777,660330,,,,,,,,,,,53,841,13386,807777,14227,807777,15,35,baf079267abb82d59619d18dd3b2afc014613e69,0,0,0,0,0,
20200709,WA,42974,,750576,,NaN,793550,329,4630,,,59,,,B,7/8/2020 02:59,2020-07-08T02:59:00Z,07/07 22:59,1394,4630,2020-07-08T02:59:00Z,,,,42974,1394,,793550,645072,,,,,,,,,,,53,842,11657,793550,12499,793550,10,48,7b4c2508e53b93d34971ed76c835cbcb39262fff,0,0,0,0,0,
20200708,WA,42132,,738919,,NaN,781051,318,4582,,,52,,,B,7/7/2020 02:59,2020-07-07T02:59:00Z,07/06 22:59,1384,4582,2020-07-07T02:59:00Z,,,,42132,1384,,781051,635524,,,,,,,,,,,53,960,14437,781051,15397,781051,14,38,4083bbd9af4914f691ac61423a19fd28cd59eb4d,0,0,0,0,0,
20200707,WA,41172,,724482,,NaN,765654,222,4544,,,37,,,B,7/6/2020 02:59,2020-07-06T02:59:00Z,07/05 22:59,1370,4544,2020-07-06T02:59:00Z,,,,41172,1370,,765654,629256,,,,,,,,,,,53,1047,16609,765654,17656,765654,11,62,bddf84e60ed17dcdd811511d296cbbde381f43d4,0,0,0,0,0,
20200706,WA,40125,,707873,,NaN,747998,248,4482,,,39,,,B,7/5/2020 02:59,2020-07-05T02:59:00Z,07/04 22:59,1359,4482,2020-07-05T02:59:00Z,,,,40125,1359,,747998,612706,,,,,,,,,,,53,969,16780,747998,17749,747998,5,9,6d073aa949ee45d4c225cc123e62d91457486df5,0,0,0,0,0,
20200705,WA,39156,,691093,,NaN,730249,305,4473,,,56,,,B,7/4/2020 02:59,2020-07-04T02:59:00Z,07/03 22:59,1354,4473,2020-07-04T02:59:00Z,,,,39156,1354,,730249,607276,,,,,,,,,,,53,293,4510,730249,4803,730249,2,10,1c960d059c35eee50f11773fb73400590072d64e,0,0,0,0,0,
20200704,WA,38863,,686583,,NaN,725446,315,4463,,,58,,,B,7/3/2020 02:59,2020-07-03T02:59:00Z,07/02 22:59,1352,4463,2020-07-03T02:59:00Z,,,,38863,1352,,725446,599975,,,,,,,,,,,53,231,4403,725446,4634,725446,10,21,409071bbdfb4dcfdad9fad4fdd908d32d2ae4a29,0,0,0,0,0,
20200703,WA,38632,,682180,,NaN,720812,334,4442,,,62,,,B,7/2/2020 02:59,2020-07-02T02:59:00Z,07/01 22:59,1342,4442,2020-07-02T02:59:00Z,,,,38632,1342,,720812,584989,,,,,,,,,,,53,443,9626,720812,10069,720812,3,40,88f07d33b06a463d5e2c4b1d4f85e9f46d0d8e05,0,0,0,0,0,
20200702,WA,38189,,672554,,NaN,710743,311,4402,,,57,,,B,7/1/2020 02:59,2020-07-01T02:59:00Z,06/30 22:59,1339,4402,2020-07-01T02:59:00Z,,,,38189,1339,,710743,571964,,,,,,,,,,,53,869,13942,710743,14811,710743,7,41,779cc3d0c6665384954095a65f5754377b95dcad,0,0,0,0,0,
20200701,WA,37320,,658612,,NaN,695932,288,4361,,,50,,,B,6/30/2020 02:59,2020-06-30T02:59:00Z,06/29 22:59,1332,4361,2020-06-30T02:59:00Z,,,,37320,1332,,695932,557275,,,,,,,,,,,53,878,15270,695932,16148,695932,12,38,dd9cccdf99c80699aa02b7e007e20d882e751ece,0,0,0,0,0,
20200630,WA,36442,,643342,,NaN,679784,282,4323,,,50,,,B,6/29/2020 02:59,2020-06-29T02:59:00Z,06/28 22:59,1320,4323,2020-06-29T02:59:00Z,,,,36442,1320,,679784,548220,,,,,,,,,,,53,902,16827,679784,17729,679784,10,48,9d9541e5e2f7b70f13cf04c75eb65f43a86baf55,0,0,0,0,0,
20200629,WA,35540,,626515,,NaN,662055,270,4275,,,52,,,B,6/28/2020 02:59,2020-06-28T02:59:00Z,06/27 22:59,1310,4275,2020-06-28T02:59:00Z,,,,35540,1310,,662055,534443,,,,,,,,,,,53,984,16632,662055,17616,662055,0,35,6b13d2fa6bcadc91e5149d11e4d795e3b042ebbd,0,0,0,0,0,
20200628,WA,34556,,609883,,NaN,644439,304,4240,,,58,,,B,6/27/2020 02:59,2020-06-27T02:59:00Z,06/26 22:59,1310,4240,2020-06-27T02:59:00Z,,,,34556,1310,,644439,525802,,,,,,,,,,,53,264,4590,644439,4854,644439,6,46,963df38c5d854fc39f36fea3f6f6d4ad77291f13,0,0,0,0,0,
20200627,WA,34292,,605293,,NaN,639585,305,4194,,,50,,,B,6/26/2020 02:59,2020-06-26T02:59:00Z,06/25 22:59,1304,4194,2020-06-26T02:59:00Z,,,,34292,1304,,639585,514428,,,,,,,,,,,53,489,8189,639585,8678,639585,4,88,c00f1017edf999e36875590493fc0a323ee8f1f5,0,0,0,0,0,
20200626,WA,33803,,597104,,NaN,630907,272,4106,,,49,,,B,6/25/2020 02:59,2020-06-25T02:59:00Z,06/24 22:59,1300,4106,2020-06-25T02:59:00Z,,,,33803,1300,,630907,505795,,,,,,,,,,,53,620,12967,630907,13587,630907,7,13,2bfdbb81f268faf40b2317801a8477f1656c9907,0,0,0,0,0,
20200625,WA,33183,,584137,,NaN,617320,304,4093,,,56,,,B,6/24/2020 02:59,2020-06-24T02:59:00Z,06/23 22:59,1293,4093,2020-06-24T02:59:00Z,,,,33183,1293,,617320,495498,,,,,,,,,,,53,660,12573,617320,13233,617320,9,26,8fe5b51415077d4fe343df512b721804db55d2e0,0,0,0,0,0,
20200624,WA,32523,,571564,,NaN,604087,234,4067,,,44,,,B,6/23/2020 02:59,2020-06-23T02:59:00Z,06/22 22:59,1284,4067,2020-06-23T02:59:00Z,,,,32523,1284,,604087,487059,,,,,,,,,,,53,675,13870,604087,14545,604087,8,5,8a5ebd39c886641db93c85e9182018c05472d8c4,0,0,0,0,0,
20200623,WA,31848,,557694,,NaN,589542,204,4062,,,37,,,B,6/22/2020 02:59,2020-06-22T02:59:00Z,06/21 22:59,1276,4062,2020-06-22T02:59:00Z,,,,31848,1276,,589542,477204,,,,,,,,,,,53,616,12482,589542,13098,589542,6,13,c32123d7c94f27d579bfb71414c32804e4f81e47,0,0,0,0,0,
20200622,WA,31232,,545212,,NaN,576444,205,4049,,,42,,,B,6/22/2020 02:59,2020-06-22T02:59:00Z,06/21 22:59,1270,4049,2020-06-22T02:59:00Z,,,,31232,1270,,576444,474938,,,,,,,,,,,53,719,12915,576444,13634,576444,5,19,8f5bffa1ee4d0fdd6ed1ea839e4aeda6c1293d7a,0,0,0,0,0,
20200621,WA,30513,,532297,,NaN,562810,267,4030,,,54,,,B,6/21/2020 02:59,2020-06-21T02:59:00Z,06/20 22:59,1265,4030,2020-06-21T02:59:00Z,,,,30513,1265,,562810,466069,,,,,,,,,,,53,189,3608,562810,3797,562810,10,27,9f36214121562a1bddd66429db8256c81e5c85c7,0,0,0,0,0,
20200620,WA,30324,,528689,,NaN,559013,245,4003,,,49,,,B,6/20/2020 02:59,2020-06-20T02:59:00Z,06/19 22:59,1255,4003,2020-06-20T02:59:00Z,,,,30324,1255,,559013,474876,,,,,,,,,,,53,314,6758,559013,7072,559013,10,44,4d68ff9643139b600cd0926c2b9c0428ecb5e986,0,0,0,0,0,
20200619,WA,30010,,521931,,NaN,551941,276,3959,,,47,,,B,6/18/2020 02:59,2020-06-18T02:59:00Z,06/17 22:59,1245,3959,2020-06-18T02:59:00Z,,,,30010,1245,,551941,474187,,,,,,,,,,,53,517,9489,551941,10006,551941,19,21,a1cecb1d1b40fc1a277b4075852bf497547f0643,0,0,0,0,0,
20200618,WA,29493,,512442,,NaN,541935,263,3938,,,47,,,B,6/17/2020 02:59,2020-06-17T02:59:00Z,06/16 22:59,1226,3938,2020-06-17T02:59:00Z,,,,29493,1226,,541935,469768,,,,,,,,,,,53,537,9258,541935,9795,541935,-5,23,defa43c82b279f9428eed80a74d2cc4aa64067c5,0,0,0,0,0,
20200617,WA,28956,,503184,,NaN,532140,256,3915,,,47,,,B,6/16/2020 02:59,2020-06-16T02:59:00Z,06/15 22:59,1231,3915,2020-06-16T02:59:00Z,,,,28956,1231,,532140,463149,,,,,,,,,,,53,461,10334,532140,10795,532140,10,21,37402230e7d59dacf3d81ff594e1aee019a00d84,0,0,0,0,0,
20200616,WA,28495,,492850,,NaN,521345,235,3894,,,38,,,B,6/15/2020 02:59,2020-06-15T02:59:00Z,06/14 22:59,1221,3894,2020-06-15T02:59:00Z,,,,28495,1221,,521345,454236,,,,,,,,,,,53,494,12066,521345,12560,521345,4,38,f1c2d753fd948a808c3d7feeb5dd00a7d40c7f62,0,0,0,0,0,
20200615,WA,28001,,480784,,NaN,508785,197,3856,,,41,,,B,6/14/2020 02:59,2020-06-14T02:59:00Z,06/13 22:59,1217,3856,2020-06-14T02:59:00Z,,,,28001,1217,,508785,443294,,,,,,,,,,,53,517,11366,508785,11883,508785,4,11,b29c8e45b538e28ef8c98aec4fc09e46a36a5a60,0,0,0,0,0,
20200614,WA,27484,,469418,,NaN,496902,229,3845,,,49,,,B,6/13/2020 02:59,2020-06-13T02:59:00Z,06/12 22:59,1213,3845,2020-06-13T02:59:00Z,,,,27484,1213,,496902,432619,,,,,,,,,,,53,136,3957,496902,4093,496902,9,28,fea59f36257c19ced0e5973e8e2ec1e8977c6e24,0,0,0,0,0,
20200613,WA,27348,,465461,,NaN,492809,225,3817,,,43,,,B,6/12/2020 02:59,2020-06-12T02:59:00Z,06/11 22:59,1204,3817,2020-06-12T02:59:00Z,,,,27348,1204,,492809,428859,,,,,,,,,,,53,193,6230,492809,6423,492809,10,45,ceef1c2f774027fd4bacf76b2e6b84218804a605,0,0,0,0,0,
20200612,WA,27155,,459231,,NaN,486386,226,3772,,,8,,,B,6/12/2020 02:59,2020-06-12T02:59:00Z,06/11 22:59,1194,3772,2020-06-12T02:59:00Z,,,,27155,1194,,486386,422770,,,,,,,,,,,53,388,9249,486386,9637,486386,4,-1,999d95e884ec5e50cfb02a8acdcb1232e6607baf,0,0,0,0,0,
20200611,WA,26767,,449982,,NaN,476749,226,3773,,,63,,,B,6/11/2020 02:59,2020-06-11T02:59:00Z,06/10 22:59,1190,3773,2020-06-11T02:59:00Z,,,,26767,1190,,476749,413579,,,,,,,,,,,53,400,11570,476749,11970,476749,14,26,8087914cf452e8f49e225485657231b57554ff39,0,0,0,0,0,
20200610,WA,26367,,438412,,NaN,464779,238,3747,,,92,,,B,6/10/2020 02:59,2020-06-10T02:59:00Z,06/09 22:59,1176,3747,2020-06-10T02:59:00Z,,,,26367,1176,,464779,402370,,,,,,,,,,,53,368,12053,464779,12421,464779,15,48,93fa20768517223f234f8d27dbd850e033222c2b,0,0,0,0,0,
20200609,WA,25999,,426359,,NaN,452358,205,3699,,,60,,,B,6/8/2020 02:59,2020-06-08T02:59:00Z,06/07 22:59,1161,3699,2020-06-08T02:59:00Z,,,,25999,1161,,452358,390815,,,,,,,,,,,53,408,11343,452358,11751,452358,2,30,7f832319fdacb4e4e7a2568c7ea7edc9ae3e4f26,0,0,0,0,0,
20200608,WA,25591,,415016,,NaN,440607,213,3669,,,66,,,B,6/7/2020 02:59,2020-06-07T02:59:00Z,06/06 22:59,1159,3669,2020-06-07T02:59:00Z,,,,25591,1159,,440607,381030,,,,,,,,,,,53,510,10050,440607,10560,440607,6,17,943fef03c24f8258a948b29fb4b2d416639fc91b,0,0,0,0,0,
20200607,WA,25081,,404966,,NaN,430047,205,3652,,,57,,,B,6/6/2020 02:59,2020-06-06T02:59:00Z,06/05 22:59,1153,3652,2020-06-06T02:59:00Z,,,,25081,1153,,430047,372754,,,,,,,,,,,53,110,3015,430047,3125,430047,4,13,4018747156702f631f4d64ba5402a59fbf750128,0,0,0,0,0,
20200606,WA,24971,,401951,,NaN,426922,247,3639,,,86,,,B,6/6/2020 02:59,2020-06-06T02:59:00Z,06/05 22:59,1149,3639,2020-06-06T02:59:00Z,,,,24971,1149,,426922,370382,,,,,,,,,,,53,162,4610,426922,4772,426922,11,24,948493bd6bbff08cdb23ef8ea9edf7e0a22291b3,0,0,0,0,0,
20200605,WA,24809,,397341,,NaN,422150,285,3615,,,91,,,B,6/5/2020 00:00,2020-06-05T00:00:00Z,06/04 20:00,1138,3615,2020-06-05T00:00:00Z,,,,24809,1138,,422150,366633,,,,,,,,,,,53,393,7676,422150,8069,422150,3,37,d133e96cc7b5994ad8ec081953abb4a67063f9b0,0,0,0,0,0,
20200604,WA,24416,,389665,,NaN,414081,272,3578,,,94,,,B,6/4/2020 02:59,2020-06-04T02:59:00Z,06/03 22:59,1135,3578,2020-06-04T02:59:00Z,,,,24416,1135,,414081,360374,,,,,,,,,,,53,330,6047,414081,6377,414081,6,35,73ef1ecf8a406433cf78f0416714bdf938866360,0,0,0,0,0,
20200603,WA,24086,,383618,,NaN,407704,263,3543,,,89,,,B,6/3/2020 00:00,2020-06-03T00:00:00Z,06/02 20:00,1129,3543,2020-06-03T00:00:00Z,,,,24086,1129,,407704,355785,,,,,,,,,,,53,383,6946,407704,7329,407704,5,26,1cfb3a0945cffaf828352efda2bc70509f3aa682,0,0,0,0,0,
20200602,WA,23703,,376672,,NaN,400375,232,3517,,,48,,,B,6/2/2020 00:00,2020-06-02T00:00:00Z,06/01 20:00,1124,3517,2020-06-02T00:00:00Z,,,,23703,1124,,400375,350457,,,,,,,,,,,53,415,8055,400375,8470,400375,6,16,6c82352aacb59f6a99ff23fa04f16a95c3b25905,0,0,0,0,0,
20200601,WA,23288,,368617,,NaN,391905,245,3501,,,52,,,B,6/1/2020 00:00,2020-06-01T00:00:00Z,05/31 20:00,1118,3501,2020-06-01T00:00:00Z,,,,23288,1118,,391905,344050,,,,,,,,,,,53,410,7613,391905,8023,391905,0,21,0d77e9fce7d05042770f7b9c20cea09768febf1e,0,0,0,0,0,
20200531,WA,22878,,361004,,NaN,383882,266,3480,,,67,,,B,5/31/2020 02:59,2020-05-31T02:59:00Z,05/30 22:59,1118,3480,2020-05-31T02:59:00Z,,,,22878,1118,,383882,337852,,,,,,,,,,,53,100,2822,383882,2922,383882,7,25,3df09ead3cdacde23629f2927b90256b3443cb5b,0,0,0,0,0,
20200530,WA,22778,,358182,,NaN,380960,319,3455,,,88,,,B,5/30/2020 02:59,2020-05-30T02:59:00Z,05/29 22:59,1111,3455,2020-05-30T02:59:00Z,,,,22778,1111,,380960,335508,,,,,,,,,,,53,148,3939,380960,4087,380960,5,42,c4ae852ce10fa59a410115fef2bf97bf8764b15a,0,0,0,0,0,
20200529,WA,22630,,354243,,NaN,376873,317,3413,,,85,,,B,5/29/2020 02:59,2020-05-29T02:59:00Z,05/28 22:59,1106,3413,2020-05-29T02:59:00Z,,,,22630,1106,,376873,332210,,,,,,,,,,,53,345,6495,376873,6840,376873,11,19,3df0a1c5514f6614788990384a6e5c7c23d968b4,0,0,0,0,0,
20200528,WA,22285,,347748,,NaN,370033,325,3394,,,94,,,B,5/27/2020 02:59,2020-05-27T02:59:00Z,05/26 22:59,1095,3394,2020-05-27T02:59:00Z,,,,22285,1095,,370033,326818,,,,,,,,,,,53,300,6522,370033,6822,370033,17,56,7f0ffd4cd57395110d2195b1aeb3daca3f8a97b6,0,0,0,0,0,
20200527,WA,21985,,341226,,NaN,363211,241,3338,,,53,,,B,5/26/2020 02:59,2020-05-26T02:59:00Z,05/25 22:59,1078,3338,2020-05-26T02:59:00Z,,,,21985,1078,,363211,321586,,,,,,,,,,,53,351,6958,363211,7309,363211,8,48,8f5e9dd15f01446d58488b0495e533debe1005c9,0,0,0,0,0,
20200526,WA,21634,,334268,,NaN,355902,267,3290,,,51,,,B,5/25/2020 02:59,2020-05-25T02:59:00Z,05/24 22:59,1070,3290,2020-05-25T02:59:00Z,,,,21634,1070,,355902,315843,,,,,,,,,,,53,398,8372,355902,8770,355902,9,3,80a92819eead18f0e3cd0446ad83274488c50ade,0,0,0,0,0,
20200525,WA,21236,,325896,,NaN,347132,207,3287,,,47,,,B,5/24/2020 02:59,2020-05-24T02:59:00Z,05/23 22:59,1061,3287,2020-05-24T02:59:00Z,,,,21236,1061,,347132,308948,,,,,,,,,,,53,149,3154,347132,3303,347132,6,31,41424c1376927863a3ce39d0155676da00bc5f52,0,0,0,0,0,
20200524,WA,21087,,322742,,NaN,343829,313,3256,,,74,,,B,5/23/2020 02:59,2020-05-23T02:59:00Z,05/22 22:59,1055,3256,2020-05-23T02:59:00Z,,,,21087,1055,,343829,306465,,,,,,,,,,,53,101,2722,343829,2823,343829,5,26,84d0e763f1b2bfcfc209c764940da36cd72c07d7,0,0,0,0,0,
20200523,WA,20986,,320020,,NaN,341006,332,3230,,,96,,,B,5/22/2020 02:59,2020-05-22T02:59:00Z,05/21 22:59,1050,3230,2020-05-22T02:59:00Z,,,,20986,1050,,341006,304123,,,,,,,,,,,53,149,3201,341006,3350,341006,6,74,05292a4ea7a61c647a5a3f3f0d1da498da109c4a,0,0,0,0,0,
20200522,WA,20837,,316819,,NaN,337656,332,3156,,,85,,,B,5/21/2020 02:59,2020-05-21T02:59:00Z,05/20 22:59,1044,3156,2020-05-21T02:59:00Z,,,,20837,1044,,337656,301452,,,,,,,,,,,53,313,5531,337656,5844,337656,7,31,094be6df13097bfeee6234864d02b4837b76c7d3,0,0,0,0,0,
20200521,WA,20524,,311288,,NaN,331812,242,3125,,,70,,,B,5/20/2020 02:59,2020-05-20T02:59:00Z,05/19 22:59,1037,3125,2020-05-20T02:59:00Z,,,,20524,1037,,331812,296884,,,,,,,,,,,53,296,5437,331812,5733,331812,6,3125,2d57e1502e4f6c572779e815161854dd0cea707b,0,0,0,0,0,
20200520,WA,20228,,305851,,NaN,326079,168,,52,,,,,B,5/19/2020 02:59,2020-05-19T02:59:00Z,05/18 22:59,1031,,2020-05-19T02:59:00Z,,,,20228,1031,,326079,292212,,,,,,,,,,,53,268,6792,326079,7060,326079,29,0,c78294ece693597c52e032d32645492aa9737a6c,0,0,0,0,0,
20200519,WA,19960,,299059,,NaN,319019,168,,52,,,,,A,5/18/2020 02:59,2020-05-18T02:59:00Z,05/17 22:59,1002,,2020-05-18T02:59:00Z,,,,19960,1002,,319019,286574,,,,,,,,,,,53,298,8335,319019,8633,319019,1,0,97cda9c65317166f4a47221747b9a2bccb9e8efa,0,0,0,0,0,
20200518,WA,19662,,290724,,NaN,310386,168,,52,,,,,A,5/17/2020 02:59,2020-05-17T02:59:00Z,05/16 22:59,1001,,2020-05-17T02:59:00Z,,,,19662,1001,,310386,279478,,,,,,,,,,,53,319,8143,310386,8462,310386,1,0,504c3e50b4577cc1bebce96b0cda764b4d0d6ae6,0,0,0,0,0,
20200517,WA,19343,,282581,,NaN,301924,168,,52,,,,,A,5/17/2020 00:00,2020-05-17T00:00:00Z,05/16 20:00,1000,,2020-05-17T00:00:00Z,,,,19343,1000,,301924,272496,,,,,,,,,,,53,64,2404,301924,2468,301924,8,0,a6f11f0813f23d3c460e7875f563129de2022b78,0,0,0,0,0,
20200516,WA,19279,,280177,,NaN,299456,331,,90,,,,,A,5/16/2020 00:00,2020-05-16T00:00:00Z,05/15 20:00,992,,2020-05-16T00:00:00Z,,,,19279,992,,299456,270526,,,,,,,,,,,53,118,3380,299456,3498,299456,9,0,c6bc27bf796c31497f4ff059f7aa0a482afb2442,0,0,0,0,0,
20200515,WA,19161,,276797,,NaN,295958,374,,114,,,,,A,5/15/2020 00:00,2020-05-15T00:00:00Z,05/14 20:00,983,,2020-05-15T00:00:00Z,,,,19161,983,,295958,267697,,,,,,,,,,,53,263,6278,295958,6541,295958,8,0,81f528ced5cbbba8d4e2b125c1f76b7993e8ebb8,0,0,0,0,0,
20200514,WA,18898,,270519,,NaN,289417,365,,111,,,,,A,5/14/2020 00:00,2020-05-14T00:00:00Z,05/13 20:00,975,,2020-05-14T00:00:00Z,,,,18898,975,,289417,262293,,,,,,,,,,,53,271,6102,289417,6373,289417,13,0,34042911dfc287e96d8053c3a8f82364f9435a9c,0,0,0,0,0,
20200513,WA,18627,,264417,,NaN,283044,384,,114,,,,,A,5/13/2020 00:00,2020-05-13T00:00:00Z,05/12 20:00,962,,2020-05-13T00:00:00Z,,,,18627,962,,283044,257288,,,,,,,,,,,53,308,5836,283044,6144,283044,17,0,99f8f4b9a7d50e41f1fd456e73515315874c5bea,0,0,0,0,0,
20200512,WA,18319,,258581,,NaN,276900,321,,94,,,,,A,5/12/2020 00:00,2020-05-12T00:00:00Z,05/11 20:00,945,,2020-05-12T00:00:00Z,,,,18319,945,,276900,252541,,,,,,,,,,,53,250,5856,276900,6106,276900,14,0,9c9164d86e94fe5b33fba65bdac66045c4875276,0,0,0,0,0,
20200511,WA,18069,,252725,,NaN,270794,350,,110,,,,,B,5/11/2020 00:00,2020-05-11T00:00:00Z,05/10 20:00,931,,2020-05-11T00:00:00Z,,,,18069,931,,270794,247565,,,,,,,,,,,53,296,5902,270794,6198,270794,10,0,50d8f39088171b502d3e3ada698cf69b83baacba,0,0,0,0,0,
20200510,WA,17773,,246823,,NaN,264596,335,,101,,,,,B,5/10/2020 00:00,2020-05-10T00:00:00Z,05/09 20:00,921,,2020-05-10T00:00:00Z,,,,17773,921,,264596,242722,,,,,,,,,,,53,62,1714,264596,1776,264596,16,0,bfc279527abc0277ad66cda6121a248cc3edd671,0,0,0,0,0,
20200509,WA,17711,,245109,,NaN,262820,393,,128,,,,,B,5/9/2020 00:00,2020-05-09T00:00:00Z,05/08 20:00,905,,2020-05-09T00:00:00Z,,,,17711,905,,262820,241361,,,,,,,,,,,53,128,2380,262820,2508,262820,14,0,8af13b7f6534279a0a66bf8059e63389ca59750b,0,0,0,0,0,
20200508,WA,17583,,242729,,NaN,260312,393,,122,,,,,B,5/8/2020 00:00,2020-05-08T00:00:00Z,05/07 20:00,891,,2020-05-08T00:00:00Z,,,,17583,891,,260312,239267,,,,,,,,,,,53,253,5843,260312,6096,260312,21,0,c229ab57922f0e51b65015cde906be9dfdf8e138,0,0,0,0,0,
20200507,WA,17330,,236886,,NaN,254216,358,,144,,,,,B,5/7/2020 00:00,2020-05-07T00:00:00Z,05/06 20:00,870,,2020-05-07T00:00:00Z,,,,17330,870,,254216,234092,,,,,,,,,,,53,265,5249,254216,5514,254216,8,0,0d12c9314f077e5e126d21176f9f88e356dc1a9b,0,0,0,0,0,
20200506,WA,17065,,231637,,NaN,248702,390,,127,,,,,B,5/6/2020 00:00,2020-05-06T00:00:00Z,05/05 20:00,862,,2020-05-06T00:00:00Z,,,,17065,862,,248702,229508,,,,,,,,,,,53,289,6123,248702,6412,248702,21,0,afc3ccda435c85b9dec91d9ffe689be2840d0936,0,0,0,0,0,
20200505,WA,16776,,225514,,NaN,242290,292,,102,,,,,B,5/5/2020 00:00,2020-05-05T00:00:00Z,05/04 20:00,841,,2020-05-05T00:00:00Z,,,,16776,841,,242290,224209,,,,,,,,,,,53,258,5867,242290,6125,242290,7,0,eed1a063d31911bd8c4d9477d471ebccfc91fa4e,0,0,0,0,0,
20200504,WA,16518,,219647,,NaN,236165,263,,86,,,,,B,5/4/2020 00:00,2020-05-04T00:00:00Z,05/03 20:00,834,,2020-05-04T00:00:00Z,,,,16518,834,,236165,219140,,,,,,,,,,,53,386,5979,236165,6365,236165,4,0,dbc3b891c284faa7aa42e451f5ce9a109c899d0b,0,0,0,0,0,
20200503,WA,16132,,213668,,NaN,229800,411,,120,,,,,B,5/3/2020 00:00,2020-05-03T00:00:00Z,05/02 20:00,830,,2020-05-03T00:00:00Z,,,,16132,,,229800,213630,,,,,,,,,,,53,84,1713,229800,1797,229800,6,0,fb247ba6e448439fff5dbb14df5bc374319fe56a,0,0,0,0,0,
20200502,WA,16048,,211955,,NaN,228003,428,,117,,,,,B,5/2/2020 00:00,2020-05-02T00:00:00Z,05/01 20:00,824,,2020-05-02T00:00:00Z,,,,16048,,,228003,212146,,,,,,,,,,,53,112,2592,228003,2704,228003,10,0,1aec1c082d81a095f74b52829a6ab71ef6994629,0,0,0,0,0,
20200501,WA,15936,,209363,,NaN,225299,470,,120,,,,,B,5/1/2020 00:00,2020-05-01T00:00:00Z,04/30 20:00,814,,2020-05-01T00:00:00Z,,,,15936,,,225299,209827,,,,,,,,,,,53,317,5378,225299,5695,225299,13,0,d6c1e7031832976d6d476702b44022d9231bb880,0,0,0,0,0,
20200430,WA,15619,,203985,,NaN,219604,474,,145,,,,,B,4/30/2020 00:00,2020-04-30T00:00:00Z,04/29 20:00,801,,2020-04-30T00:00:00Z,,,,15619,,,219604,205035,,,,,,,,,,,53,248,5278,219604,5526,219604,15,0,19cdb53ca00db0fbf5ffd12f6d8f69eb8cbd04cf,0,0,0,0,0,
20200429,WA,15371,,198707,,NaN,214078,490,,156,,,,,B,4/29/2020 00:00,2020-04-29T00:00:00Z,04/28 20:00,786,,2020-04-29T00:00:00Z,,,,15371,,,214078,200153,,,,,,,,,,,53,328,5368,214078,5696,214078,21,0,e9a13686ed535f823336918b865894ae3cdc5bc9,0,0,0,0,0,
20200428,WA,15043,,193339,,NaN,208382,436,,158,,,,,B,4/28/2020 00:00,2020-04-28T00:00:00Z,04/27 20:00,765,,2020-04-28T00:00:00Z,,,,15043,,,208382,195230,,,,,,,,,,,53,295,5673,208382,5968,208382,16,0,406d46dac867fc57d44d8993b317f072334320ce,0,0,0,0,0,
20200427,WA,14748,,187666,,NaN,202414,536,,115,,,,,B,4/27/2020 00:00,2020-04-27T00:00:00Z,04/26 20:00,749,,2020-04-27T00:00:00Z,,,,14748,,,202414,189883,,,,,,,,,,,53,369,5428,202414,5797,202414,11,0,5d2eae58dacbe2c697be059ad3fa928355724cd0,0,0,0,0,0,
20200426,WA,14379,,182238,,NaN,196617,508,,145,,,,,B,4/26/2020 00:00,2020-04-26T00:00:00Z,04/25 20:00,738,,2020-04-26T00:00:00Z,,,,14379,,,196617,184766,,,,,,,,,,,53,113,1972,196617,2085,196617,73,0,8502a8aa78fdbd5d037e5ce385d5b644c7f13846,0,0,0,0,0,
20200425,WA,14266,,180266,,NaN,194532,455,,174,,,,,B,4/25/2020 00:00,2020-04-25T00:00:00Z,04/24 20:00,665,,2020-04-25T00:00:00Z,,,,14266,,,194532,182988,,,,,,,,,,,53,166,3282,194532,3448,194532,6,0,c3e2bd2719c1839a2d55b2608916ab58ceada784,0,0,0,0,0,
20200424,WA,14100,,176984,,NaN,191084,551,,164,,,,,C,4/24/2020 00:00,2020-04-24T00:00:00Z,04/23 20:00,659,,2020-04-24T00:00:00Z,,,,14100,,,191084,179977,,,,,,,,,,,53,350,5826,191084,6176,191084,5,0,477e09b2eef899bdd97238fd82d2ee4d2f5948fe,0,0,0,0,0,
20200423,WA,13750,,171158,,NaN,184908,544,,151,,,,,C,4/23/2020 00:00,2020-04-23T00:00:00Z,04/22 20:00,654,,2020-04-23T00:00:00Z,,,,13750,,,184908,174468,,,,,,,,,,,53,274,4689,184908,4963,184908,7,0,6c01e36e8ec97d65826fecd3f5efeba9c173e25d,0,0,0,0,0,
20200422,WA,13476,,166469,,NaN,179945,543,,161,,,,,C,4/22/2020 00:00,2020-04-22T00:00:00Z,04/21 20:00,647,,2020-04-22T00:00:00Z,,,,13476,,,179945,170130,,,,,,,,,,,53,283,4844,179945,5127,179945,7,0,1eeb4ef411839a42a15d2875e2f50f00be369f28,0,0,0,0,0,
20200421,WA,13193,,161625,,NaN,174818,503,,161,,,,,C,4/21/2020 00:00,2020-04-21T00:00:00Z,04/20 20:00,640,,2020-04-21T00:00:00Z,,,,13193,,,174818,165706,,,,,,,,,,,53,270,4521,174818,4791,174818,11,0,f0f48f031bfdbf729ecec42285263f38e889fe42,0,0,0,0,0,
20200420,WA,12923,,157104,,NaN,170027,403,,122,,,,,C,4/20/2020 00:00,2020-04-20T00:00:00Z,04/19 20:00,629,,2020-04-20T00:00:00Z,,,,12923,,,170027,161504,,,,,,,,,,,53,334,4634,170027,4968,170027,14,0,ba162c435aee1cfaf7f91e0c5b3fce703b3e7a25,0,0,0,0,0,
20200419,WA,12589,,152470,,NaN,165059,586,,193,,,,,C,4/19/2020 00:00,2020-04-19T00:00:00Z,04/18 20:00,615,,2020-04-19T00:00:00Z,,,,12589,,,165059,157116,,,,,,,,,,,53,96,1871,165059,1967,165059,17,0,9baa3b9800a7742b5537fa85c927e820f2e8ecaf,0,0,0,0,0,
20200418,WA,12493,,150599,,NaN,163092,518,,155,,,,,C,4/18/2020 00:00,2020-04-18T00:00:00Z,04/17 20:00,598,,2020-04-18T00:00:00Z,,,,12493,,,163092,155439,,,,,,,,,,,53,175,2393,163092,2568,163092,13,0,b45dd92ea1121f856e77ffb7dd2f650e268a37eb,0,0,0,0,0,
20200417,WA,12318,,148206,,NaN,160524,622,,195,,,,,C,4/17/2020 00:00,2020-04-17T00:00:00Z,04/16 20:00,585,,2020-04-17T00:00:00Z,,,,12318,,,160524,153193,,,,,,,,,,,53,351,4772,160524,5123,160524,14,0,56bd375d00f1461786777e209d6ceb97cfd66f16,0,0,0,0,0,
20200416,WA,11967,,143434,,NaN,155401,595,,196,,,,,C,4/16/2020 00:00,2020-04-16T00:00:00Z,04/15 20:00,571,,2020-04-16T00:00:00Z,,,,11967,,,155401,148741,,,,,,,,,,,53,309,4393,155401,4702,155401,20,0,3aafb65b5935b028bd755e8ecd68f8c9094e807a,0,0,0,0,0,
20200415,WA,11658,,139041,,NaN,150699,645,,194,,,,,C,4/15/2020 00:00,2020-04-15T00:00:00Z,04/14 20:00,551,,2020-04-15T00:00:00Z,,,,11658,,,150699,144393,,,,,,,,,,,53,328,4170,150699,4498,150699,9,0,6035b27fbead441615ffd0ec497b59cca933646e,0,0,0,0,0,
20200414,WA,11330,,134871,,NaN,146201,387,,98,,,,,C,4/14/2020 00:00,2020-04-14T00:00:00Z,04/13 20:00,542,,2020-04-14T00:00:00Z,,,,11330,,,146201,140247,,,,,,,,,,,53,302,4356,146201,4658,146201,16,0,e9cd95cb596e86184f27d84a34bc2ee954a489ba,0,0,0,0,0,
20200413,WA,11028,,130515,,NaN,141543,527,,166,,,,,C,4/13/2020 00:00,2020-04-13T00:00:00Z,04/12 20:00,526,,2020-04-13T00:00:00Z,,,,11028,,,141543,135938,,,,,,,,,,,53,371,4215,141543,4586,141543,17,0,6f4668f7f9a1a842c730eba332325dfd45ad6f05,0,0,0,0,0,
20200412,WA,10657,,126300,,NaN,136957,642,,191,,,,,C,4/12/2020 00:00,2020-04-12T00:00:00Z,04/11 20:00,509,,2020-04-12T00:00:00Z,,,,10657,,,136957,131718,,,,,,,,,,,53,89,1392,136957,1481,136957,15,0,4af879b45beed2116afd83b67161f45e327d50b9,0,0,0,0,0,
20200411,WA,10568,,124908,,NaN,135476,649,,191,,,,,C,4/11/2020 00:00,2020-04-11T00:00:00Z,04/10 20:00,494,,2020-04-11T00:00:00Z,,,,10568,,,135476,130287,,,,,,,,,,,53,155,2032,135476,2187,135476,18,0,a37b0440d638165313fd8cf2aacea6b2f4687689,0,0,0,0,0,
20200410,WA,10413,,122876,,NaN,133289,642,,191,,,,,C,4/10/2020 00:00,2020-04-10T00:00:00Z,04/09 20:00,476,,2020-04-10T00:00:00Z,,,,10413,,,133289,128211,,,,,,,,,,,53,309,4172,133289,4481,133289,17,0,e24b4904493ecec5c42b4da62bd7dcff7234a643,0,0,0,0,0,
20200409,WA,10104,,118704,,NaN,128808,650,,191,,,,,A,4/9/2020 00:00,2020-04-09T00:00:00Z,04/08 20:00,459,,2020-04-09T00:00:00Z,,,,10104,,,128808,123912,,,,,,,,,,,53,363,4128,128808,4491,128808,16,0,2c619462acaba3d95e9b3fb0c3a7d206a6791ab2,0,0,0,0,0,
20200408,WA,9741,,114576,,NaN,124317,655,,186,,,,,A,4/8/2020 00:00,2020-04-08T00:00:00Z,04/07 20:00,443,,2020-04-08T00:00:00Z,,,,9741,,,124317,119606,,,,,,,,,,,53,345,4720,124317,5065,124317,14,0,d92ba9473a3afecfc9c670863c3fa02039192e0c,0,0,0,0,0,
20200407,WA,9396,,109856,,NaN,119252,641,,190,,,,,A,4/7/2020 00:00,2020-04-07T00:00:00Z,04/06 20:00,429,,2020-04-07T00:00:00Z,,,,9396,,,119252,114802,,,,,,,,,,,53,413,5063,119252,5476,119252,22,0,a0f8f5a3d13e143af017e511150ae5bc489dd66a,0,0,0,0,0,
20200406,WA,8983,,104793,,NaN,113776,638,,191,,,,,A,4/6/2020 00:00,2020-04-06T00:00:00Z,04/05 20:00,407,,2020-04-06T00:00:00Z,,,,8983,,,113776,109573,,,,,,,,,,,53,394,4989,113776,5383,113776,21,0,75b7888b827e512c663995af68dc7b1f69182bbd,0,0,0,0,0,
20200405,WA,8589,,99804,,NaN,108393,581,,178,,,,,A,4/5/2020 00:00,2020-04-05T00:00:00Z,04/04 20:00,386,,2020-04-05T00:00:00Z,,,,8589,,,108393,104437,,,,,,,,,,,53,171,1925,108393,2096,108393,21,0,c59ae58ca250f7c85dbb3aaffb904e22c1664560,0,0,0,0,0,
20200404,WA,8418,,97879,,NaN,106297,574,,174,,,,,A,4/4/2020 00:00,2020-04-04T00:00:00Z,04/03 20:00,365,,2020-04-04T00:00:00Z,,,,8418,,,106297,102485,,,,,,,,,,,53,207,2492,106297,2699,106297,27,0,b57c9447080ab96928ce62d4773a563d11bed115,0,0,0,0,0,
20200403,WA,8211,,95387,,NaN,103598,,,,,,,,A,4/3/2020 00:00,2020-04-03T00:00:00Z,04/02 20:00,338,,2020-04-03T00:00:00Z,,,,8211,,,103598,99871,,,,,,,,,,,53,415,4638,103598,5053,103598,28,0,8637c271893b96ef2812a289618cbcf848285219,0,0,0,0,0,
20200402,WA,7796,,90749,,NaN,98545,,,,,,,,A,4/2/2020 00:00,2020-04-02T00:00:00Z,04/01 20:00,310,,2020-04-02T00:00:00Z,,,,7796,,,98545,95017,,,,,,,,,,,53,397,4774,98545,5171,98545,28,0,a171fd05402328170800ccfb26dabf3b8a1cc31d,0,0,0,0,0,
20200401,WA,7399,,85975,,NaN,93374,,,,,,,,A,4/1/2020 00:00,2020-04-01T00:00:00Z,03/31 20:00,282,,2020-04-01T00:00:00Z,,,,7399,,,93374,90110,,,,,,,,,,,53,450,4512,93374,4962,93374,20,0,0e973a5c15ce7058a06bda01a4b0b0d74b4f2f2d,0,0,0,0,0,
20200331,WA,6949,,81463,,NaN,88412,,,,,,,,A,3/31/2020 00:00,2020-03-31T00:00:00Z,03/30 20:00,262,,2020-03-31T00:00:00Z,,,,6949,,,88412,85393,,,,,,,,,,,53,465,4416,88412,4881,88412,14,0,6255963ad634df0cb2e0511557cc4dc630bad993,0,0,0,0,0,
20200330,WA,6484,,77047,,NaN,83531,,,,,,,,A,3/30/2020 00:00,2020-03-30T00:00:00Z,03/29 20:00,248,,2020-03-30T00:00:00Z,,,,6484,,,83531,80687,,,,,,,,,,,53,563,4887,83531,5450,83531,11,0,def35ae5382ffd94768a0e5e5fd59f403460d92f,0,0,0,0,0,
20200329,WA,5921,,72160,,NaN,78081,,,,,,,,A,3/29/2020 00:00,2020-03-29T00:00:00Z,03/28 20:00,237,,2020-03-29T00:00:00Z,,,,5921,,,78081,75537,,,,,,,,,,,53,242,1745,78081,1987,78081,17,0,3a00736cb83515063d025c044e52f85a6493f028,0,0,0,0,0,
20200328,WA,5679,,70415,,NaN,76094,,,,,,,,A,3/28/2020 00:00,2020-03-28T00:00:00Z,03/27 20:00,220,,2020-03-28T00:00:00Z,,,,5679,,,76094,73704,,,,,,,,,,,53,288,2509,76094,2797,76094,21,0,f234e97492ec9de62ddbbb990530d9d8e31ca887,0,0,0,0,0,
20200327,WA,5391,,67906,,NaN,73297,,,,,,,,A,3/27/2020 00:00,2020-03-27T00:00:00Z,03/26 20:00,199,,2020-03-27T00:00:00Z,,,,5391,,,73297,71103,,,,,,,,,,,53,464,4153,73297,4617,73297,16,0,79bc05ddde01e33aa68f534452d1a821f7d14d0c,0,0,0,0,0,
20200326,WA,4927,,63753,,NaN,68680,,,,,,,,A,3/26/2020 00:00,2020-03-26T00:00:00Z,03/25 20:00,183,,2020-03-26T00:00:00Z,,,,4927,,,68680,66743,,,,,,,,,,,53,435,4252,68680,4687,68680,24,0,f11718e064f96424cd2bd4e50249d2a12c146762,0,0,0,0,0,
20200325,WA,4492,,59501,,NaN,63993,,,,,,,,A,3/25/2020 00:00,2020-03-25T00:00:00Z,03/24 20:00,159,,2020-03-25T00:00:00Z,,,,4492,,,63993,62272,,,,,,,,,,,53,440,4808,63993,5248,63993,13,0,1106d7ac18a21a652cb97c82e50aba8e4442cb36,0,0,0,0,0,
20200324,WA,4052,,54693,,NaN,58745,,,,,,,,A,3/24/2020 00:00,2020-03-24T00:00:00Z,03/23 20:00,146,,2020-03-24T00:00:00Z,,,,4052,,,58745,57265,,,,,,,,,,,53,438,5062,58745,5500,58745,9,0,53edf0cd17dcc5bdccf5475cdd2a935ecd096b64,0,0,0,0,0,
20200323,WA,3614,,49631,,NaN,53245,,,,,,,,A,3/23/2020 00:00,2020-03-23T00:00:00Z,03/22 20:00,137,,2020-03-23T00:00:00Z,,,,3614,,,53245,52038,,,,,,,,,,,53,463,5044,53245,5507,53245,11,0,5a3068e5989357c67661d0895774459c7651b565,0,0,0,0,0,
20200322,WA,3151,,44587,,NaN,47738,,,,,,,,,3/22/2020 00:00,2020-03-22T00:00:00Z,03/21 20:00,126,,2020-03-22T00:00:00Z,,,,3151,,,47738,46735,,,,,,,,,,,53,186,1846,47738,2032,47738,15,0,0d4c36875c0ca8bad38479f3cddaf81b64880c31,0,0,0,0,0,
20200321,WA,2965,,42741,,NaN,45706,,,,,,,,,3/21/2020 00:00,2020-03-21T00:00:00Z,03/20 20:00,111,,2020-03-21T00:00:00Z,,,,2965,,,45706,44847,,,,,,,,,,,53,194,2236,45706,2430,45706,7,0,68ef9e7f3fda292c9c70abb9c038cad53732b52f,0,0,0,0,0,
20200320,WA,2771,,40505,,NaN,43276,,,,,,,,,3/20/2020 00:00,2020-03-20T00:00:00Z,03/19 20:00,104,,2020-03-20T00:00:00Z,,,,2771,,,43276,42505,,,,,,,,,,,53,303,3817,43276,4120,43276,12,0,1ae28a5c732ae8b57c94d9fc0f70ec3fed68b6f5,0,0,0,0,0,
20200319,WA,2468,,36688,,NaN,39156,,,,,,,,,3/19/2020 00:00,2020-03-19T00:00:00Z,03/18 20:00,92,,2020-03-19T00:00:00Z,,,,2468,,,39156,38444,,,,,,,,,,,53,333,4127,39156,4460,39156,10,0,5b6792f6125e1d78a36078684dc6b883fa623328,0,0,0,0,0,
20200318,WA,2135,,32561,,NaN,34696,,,,,,,,,3/18/2020 00:00,2020-03-18T00:00:00Z,03/17 20:00,82,,2020-03-18T00:00:00Z,,,,2135,,,34696,33894,,,,,,,,,,,53,289,4537,34696,4826,34696,4,0,2eed6a638abd25dcb2a54101ee57f9d662c99c04,0,0,0,0,0,
20200317,WA,1846,,28024,,NaN,29870,,,,,,,,,3/17/2020 00:00,2020-03-17T00:00:00Z,03/16 20:00,78,,2020-03-17T00:00:00Z,,,,1846,,,29870,29154,,,,,,,,,,,53,264,4551,29870,4815,29870,9,0,37221e595b8b10e3545e364bb757f8c2fb6a26ce,0,0,0,0,0,
20200316,WA,1582,,23473,,NaN,25055,,,,,,,,,3/16/2020 00:00,2020-03-16T00:00:00Z,03/15 20:00,69,,2020-03-16T00:00:00Z,,,,1582,,,25055,24516,,,,,,,,,,,53,300,4696,25055,4996,25055,12,0,96b09be714a9f9d8de6e7da41a9cbdeced9133e5,0,0,0,0,0,
20200315,WA,1282,,18777,,NaN,20059,,,,,,,,,3/15/2020 00:00,2020-03-15T00:00:00Z,03/14 20:00,57,,2020-03-15T00:00:00Z,,,,1282,,,20059,19621,,,,,,,,,,,53,108,1635,20059,1743,20059,6,0,9c440357cd2602ca09bd73ee96f5d5138379be11,0,0,0,0,0,
20200314,WA,1174,,17142,,NaN,18316,,,,,,,,,3/14/2020 00:00,2020-03-14T00:00:00Z,03/13 20:00,51,,2020-03-14T00:00:00Z,,,,1174,,,18316,17932,,,,,,,,,,,53,156,2220,18316,2376,18316,4,0,027eb030b2ccd20792f45da60b02bc8b6b850aee,0,0,0,0,0,
20200313,WA,1018,,14922,,NaN,15940,,,,,,,,,3/13/2020 00:00,2020-03-13T00:00:00Z,03/12 20:00,47,,2020-03-13T00:00:00Z,,,,1018,,,15940,15603,,,,,,,,,,,53,217,4109,15940,4326,15940,3,0,d5673f962dc82dcdeb628b97119ae86d02157df0,0,0,0,0,0,
20200312,WA,801,,10813,,NaN,11614,,,,,,,,,3/12/2020 00:00,2020-03-12T00:00:00Z,03/11 20:00,44,,2020-03-12T00:00:00Z,,,,801,,,11614,11369,,,,,,,,,,,53,179,3630,11614,3809,11614,4,0,4f02367cacb818ecd0abda3a5a76192edfdc439a,0,0,0,0,0,
20200311,WA,622,,7183,,NaN,7805,,,,,,,,,3/11/2020 00:00,2020-03-11T00:00:00Z,03/10 20:00,40,,2020-03-11T00:00:00Z,,,,622,,,7805,7605,,,,,,,,,,,53,134,2185,7805,2319,7805,3,0,51a92c96a30433872668ea852de643769da41672,0,0,0,0,0,
20200310,WA,488,,4998,,NaN,5486,,,,,,,,,3/10/2020 00:00,2020-03-10T00:00:00Z,03/09 20:00,37,,2020-03-10T00:00:00Z,,,,488,,,5486,5338,,,,,,,,,,,53,110,1703,5486,1813,5486,2,0,c641577e47dd7f307dd4314c6af2b536e1d3a492,0,0,0,0,0,
20200309,WA,378,,3295,,NaN,3673,,,,,,,,,3/9/2020 00:00,2020-03-09T00:00:00Z,03/08 20:00,35,,2020-03-09T00:00:00Z,,,,378,,,3673,3554,,,,,,,,,,,53,61,980,3673,1041,3673,4,0,37c172ecf3b344b83e56a989f3592ae3a38325e1,0,0,0,0,0,
20200308,WA,317,,2315,60,NaN,2632,,,,,,,,,3/8/2020 00:00,2020-03-08T00:00:00Z,03/07 19:00,31,,2020-03-08T00:00:00Z,,,,317,,,2632,2530,,,,,,,,,,,53,61,479,2692,540,2632,4,0,d95144914531ca887a76e9138cbb0e594ee222a6,0,0,0,0,0,
20200307,WA,256,,1836,66,NaN,2092,,,,,,,,,3/7/2020 00:00,2020-03-07T00:00:00Z,03/06 19:00,27,,2020-03-07T00:00:00Z,,,,256,,,2092,2007,,,,,,,,,,,53,38,387,2158,425,2092,1,0,750542513a929332be009797cfc044ec113432a6,0,0,0,0,0,
20200306,WA,218,,1449,,NaN,1667,,,,,,,,,3/6/2020 00:00,2020-03-06T00:00:00Z,03/05 19:00,26,,2020-03-06T00:00:00Z,,,,218,,,1667,1604,,,,,,,,,,,53,39,472,1667,511,1667,6,0,6898e54f271d869c3d1988da42394ac95f8ec9c8,0,0,0,0,0,
20200305,WA,179,,977,,NaN,1156,,,,,,,,,3/5/2020 00:00,2020-03-05T00:00:00Z,03/04 19:00,20,,2020-03-05T00:00:00Z,,,,179,,,1156,1128,,,,,,,,,,,53,51,323,1156,374,1156,4,0,f8c51471e492a01d5569abab0075ef6e569a5cd9,0,0,0,0,0,
20200304,WA,128,,654,,NaN,782,,,,,,,,,3/4/2020 00:00,2020-03-04T00:00:00Z,03/03 19:00,16,,2020-03-04T00:00:00Z,,,,128,,,782,768,,,,,,,,,,,53,38,213,782,251,782,2,0,f34461ac3470fcbf8dbad178fe7dfed9433885a7,0,0,0,0,0,
20200303,WA,90,,441,,NaN,531,,,,,,,,,3/3/2020 00:00,2020-03-03T00:00:00Z,03/02 19:00,14,,2020-03-03T00:00:00Z,,,,90,,,531,523,,,,,,,,,,,53,25,201,531,226,531,3,0,52ca380a218f4d3f3bda48fb9ce969fe523fb86e,0,0,0,0,0,
20200302,WA,65,,240,,NaN,305,,,,,,,,,3/2/2020 00:00,2020-03-02T00:00:00Z,03/01 19:00,11,,2020-03-02T00:00:00Z,,,,65,,,305,298,,,,,,,,,,,53,31,157,305,188,305,3,0,d0629ed590af3ce58ec04f6aab992b8689c446e8,0,0,0,0,0,
20200301,WA,34,,83,,NaN,117,,,,,,,,,3/1/2020 00:00,2020-03-01T00:00:00Z,02/29 19:00,8,,2020-03-01T00:00:00Z,,,,34,,,117,114,,,,,,,,,,,53,16,59,117,75,117,3,0,d275ed4c6a4cb0bf4d1d8a40f765f6455194c3e9,0,0,0,0,0,
20200229,WA,18,,24,,NaN,42,,,,,,,,,2/29/2020 00:00,2020-02-29T00:00:00Z,02/28 19:00,5,,2020-02-29T00:00:00Z,,,,18,,,42,41,,,,,,,,,,,53,18,24,42,42,42,1,0,a7ce1cfa01974842500338c314f3ed20772b1c1c,0,0,0,0,0,
20200228,WA,0,,0,,NaN,0,,,,,,,,,,,,4,,,,,,0,,,0,,,,,,,,,,,,53,0,0,0,0,0,2,0,cc05c856ea795fe322351249eb5833b72fb0a5c5,0,0,0,0,0,
20200227,WA,0,,0,,NaN,0,,,,,,,,,,,,2,,,,,,0,,,0,,,,,,,,,,,,53,0,0,0,0,0,0,0,3c0980f41eb2c8cf85f51d9eed569a388a20e67e,0,0,0,0,0,
20200226,WA,0,,0,,NaN,0,,,,,,,,,,,,2,,,,,,0,,,0,,,,,,,,,,,,53,0,0,0,0,0,2,0,2413cc2770b5da48bbb2ed0fab4334eaf410fa2e,0,0,0,0,0,
20200225,WA,0,,0,,NaN,0,,,,,,,,,,,,,,,,,,0,,,0,,,,,,,,,,,,53,0,0,0,0,0,0,0,db6b1cdf8dd95059fe200783e201c7be4360ab86,0,0,0,0,0,
20200224,WA,0,,0,,NaN,0,,,,,,,,,,,,,,,,,,0,,,0,,,,,,,,,,,,53,0,0,0,0,0,0,0,7d44b77b6e5de243173992269eb325faccbffae5,0,0,0,0,0,
20200223,WA,0,,0,,NaN,0,,,,,,,,,,,,,,,,,,0,,,0,,,,,,,,,,,,53,0,0,0,0,0,0,0,1f607176b311799891c6fd053752878df4356783,0,0,0,0,0,
20200222,WA,0,,0,,NaN,0,,,,,,,,,,,,,,,,,,0,,,0,,,,,,,,,,,,53,0,0,0,0,0,0,0,ff9e67d7e6b3ba817c1229cd8bb2a5af838457cf,0,0,0,0,0,
20200221,WA,0,,0,,NaN,0,,,,,,,,,,,,,,,,,,0,,,0,,,,,,,,,,,,53,0,0,0,0,0,0,0,c9d2c3df1038239e7dbf1c4c6da42e3e529a2c5d,0,0,0,0,0,
20200220,WA,0,,0,,NaN,0,,,,,,,,,,,,,,,,,,0,,,0,,,,,,,,,,,,53,0,0,0,0,0,0,0,4438fd914857fe5a4c97201c52e637d6578a3035,0,0,0,0,0,
20200219,WA,0,,0,,NaN,0,,,,,,,,,,,,,,,,,,0,,,0,,,,,,,,,,,,53,0,0,0,0,0,0,0,816907a60ab7740be6a9bb072af6256abf05efc0,0,0,0,0,0,
20200218,WA,0,,0,,NaN,0,,,,,,,,,,,,,,,,,,0,,,0,,,,,,,,,,,,53,0,0,0,0,0,0,0,f58eddd88c356f3634b6c97d6c4f345d8a3e633d,0,0,0,0,0,
20200217,WA,0,,0,,NaN,0,,,,,,,,,,,,,,,,,,0,,,0,,,,,,,,,,,,53,0,0,0,0,0,0,0,37e82ddca18f2d9ca6e8ab088b13f585acc0c770,0,0,0,0,0,
20200216,WA,0,,0,,NaN,0,,,,,,,,,,,,,,,,,,0,,,0,,,,,,,,,,,,53,0,0,0,0,0,0,0,7d42ea245e0046bc70b93cc374b4d5ca73647b9b,0,0,0,0,0,
20200215,WA,0,,0,,NaN,0,,,,,,,,,,,,,,,,,,0,,,0,,,,,,,,,,,,53,0,0,0,0,0,0,0,12a7638f35ac4a835ce158d88a208453fd2edf86,0,0,0,0,0,
20200214,WA,0,,0,,NaN,0,,,,,,,,,,,,,,,,,,0,,,0,,,,,,,,,,,,53,0,0,0,0,0,0,0,0209f3c4f1ff1b21d3584f729b1dc23496344b07,0,0,0,0,0,
20200213,WA,0,,0,,NaN,0,,,,,,,,,,,,,,,,,,0,,,0,,,,,,,,,,,,53,0,0,0,0,0,0,0,bb18899951fabd9cab3032a2b5b428e6b9f59645,0,0,0,0,0,
20200212,WA,0,,0,,NaN,0,,,,,,,,,,,,,,,,,,0,,,0,,,,,,,,,,,,53,0,0,0,0,0,0,0,e08137e6d065f47c66483d01cb09353b3ecc34d2,0,0,0,0,0,
20200211,WA,0,,0,,NaN,0,,,,,,,,,,,,,,,,,,0,,,0,,,,,,,,,,,,53,0,0,0,0,0,0,0,5a9e1fc8b4e9b16a80fc31c5d25b139129329304,0,0,0,0,0,
20200210,WA,0,,0,,NaN,0,,,,,,,,,,,,,,,,,,0,,,0,,,,,,,,,,,,53,0,0,0,0,0,0,0,19a4837154e10812358933ceb73f598c05ecd6bb,0,0,0,0,0,
20200209,WA,0,,0,,NaN,0,,,,,,,,,,,,,,,,,,0,,,0,,,,,,,,,,,,53,0,0,0,0,0,0,0,5f853abb1f39b5bc8aefc94afeee951ca896371e,0,0,0,0,0,
20200208,WA,0,,0,,NaN,0,,,,,,,,,,,,,,,,,,0,,,0,,,,,,,,,,,,53,0,0,0,0,0,0,0,ba12baba85f5117e4648a9f0b8a1fc0c7416bee4,0,0,0,0,0,
20200207,WA,0,,0,,NaN,0,,,,,,,,,,,,,,,,,,0,,,0,,,,,,,,,,,,53,0,0,0,0,0,0,0,586117194fbf26e509054837165599e55579fca4,0,0,0,0,0,
20200206,WA,0,,0,,NaN,0,,,,,,,,,,,,,,,,,,0,,,0,,,,,,,,,,,,53,0,0,0,0,0,0,0,13537da7e1546acf9dc78714378a6cbcf8dd1535,0,0,0,0,0,
20200205,WA,0,,0,,NaN,0,,,,,,,,,,,,,,,,,,0,,,0,,,,,,,,,,,,53,0,0,0,0,0,0,0,200c84f28e955493c309547406810227fb6a5bc7,0,0,0,0,0,
20200204,WA,0,,0,,NaN,0,,,,,,,,,,,,,,,,,,0,,,0,,,,,,,,,,,,53,0,0,0,0,0,0,0,73ddba39ff494c9e81ff130a8fafc25c10154a10,0,0,0,0,0,
20200203,WA,0,,0,,NaN,0,,,,,,,,,,,,,,,,,,0,,,0,,,,,,,,,,,,53,0,0,0,0,0,0,0,cb952aa14a0682fb254ef4f96ed8022964daa683,0,0,0,0,0,
20200202,WA,0,,0,,NaN,0,,,,,,,,,,,,,,,,,,0,,,0,,,,,,,,,,,,53,0,0,0,0,0,0,0,06c9449505a5c0c316736b8920f1d30a4db96fba,0,0,0,0,0,
20200201,WA,0,,0,,NaN,0,,,,,,,,,,,,,,,,,,0,,,0,,,,,,,,,,,,53,0,0,0,0,0,0,0,f68a0bf47fe5d085f068be0eb0821440c82a2e70,0,0,0,0,0,
20200131,WA,0,,0,,NaN,0,,,,,,,,,,,,,,,,,,0,,,0,,,,,,,,,,,,53,0,0,0,0,0,0,0,07ddb204bc0ffc86946d03b2334ad046e230c747,0,0,0,0,0,
20200130,WA,0,,0,,NaN,0,,,,,,,,,,,,,,,,,,0,,,0,,,,,,,,,,,,53,0,0,0,0,0,0,0,621877997a8c0ebf143b3afed546b1d51a44bbc4,0,0,0,0,0,
20200129,WA,0,,0,,NaN,0,,,,,,,,,,,,,,,,,,0,,,0,,,,,,,,,,,,53,0,0,0,0,0,0,0,3b9c2d9b612e9926fd0002508dd0a1adfa930c66,0,0,0,0,0,
20200128,WA,0,,0,,NaN,0,,,,,,,,,,,,,,,,,,0,,,0,,,,,,,,,,,,53,0,0,0,0,0,0,0,11416e85108ede757828e60f893fa2d81052fd23,0,0,0,0,0,
20200127,WA,0,,0,,NaN,0,,,,,,,,,,,,,,,,,,0,,,0,,,,,,,,,,,,53,0,0,0,0,0,0,0,bb00b8995b3fcb8cb4da5ec89d9b7f83edb61b0f,0,0,0,0,0,
20200126,WA,0,,0,,NaN,0,,,,,,,,,,,,,,,,,,0,,,0,,,,,,,,,,,,53,0,0,0,0,0,0,0,3867db0372ee80cc0ce4a75bbf61193694f9b48d,0,0,0,0,0,
20200125,WA,0,,0,,NaN,0,,,,,,,,,,,,,,,,,,0,,,0,,,,,,,,,,,,53,0,0,0,0,0,0,0,985e4eac6445ccdb87532e34230a5b1ee58f8da5,0,0,0,0,0,
20200124,WA,0,,0,,NaN,0,,,,,,,,,,,,,,,,,,0,,,0,,,,,,,,,,,,53,0,0,0,0,0,0,0,8cdf0639819fbeab93c916b01ad9cfe0e375383c,0,0,0,0,0,
20200123,WA,0,,0,,NaN,0,,,,,,,,,,,,,,,,,,0,,,0,,,,,,,,,,,,53,0,0,0,0,0,0,0,e4fa220c0193de46d099b725f789c1495867a923,0,0,0,0,0,
20200122,WA,0,,0,,NaN,0,,,,,,,,,,,,,,,,,,0,,,0,,,,,,,,,,,,53,0,0,0,0,0,0,0,95cb55001f7998ee34042082bb368257e9574fb7,0,0,0,0,0,
