[{"date":20201028,"state":"DC","positive":16973,"probableCases":null,"negative":488434,"pending":null,"totalTestResultsSource":"totalTestEncountersViral","totalTestResults":505407,"hospitalizedCurrently":101,"hospitalizedCumulative":null,"inIcuCurrently":25,"inIcuCumulative":null,"onVentilatorCurrently":8,"onVentilatorCumulative":null,"recovered":13276,"dataQualityGrade":"A+","lastUpdateEt":"10/27/2020 00:00","dateModified":"2020-10-27T00:00:00Z","checkTimeEt":"10/26 20:00","death":644,"hospitalized":null,"dateChecked":"2020-10-27T00:00:00Z","totalTestsViral":null,"positiveTestsViral":null,"negativeTestsViral":null,"positiveCasesViral":null,"deathConfirmed":null,"deathProbable":null,"totalTestEncountersViral":505407,"totalTestsPeopleViral":252520,"totalTestsAntibody":null,"positiveTestsAntibody":null,"negativeTestsAntibody":null,"totalTestsPeopleAntibody":null,"positiveTestsPeopleAntibody":null,"negativeTestsPeopleAntibody":null,"totalTestsPeopleAntigen":null,"positiveTestsPeopleAntigen":null,"totalTestsAntigen":null,"positiveTestsAntigen":null,"fips":"11","positiveIncrease":67,"negativeIncrease":2802,"total":505407,"totalTestResultsIncrease":2869,"posNeg":505407,"deathIncrease":0,"hospitalizedIncrease":0,"hash":"bdad116a0d1110f06ad1ae35221283ad12fb877d","commercialScore":0,"negativeRegularScore":0,"negativeScore":0,"positiveScore":0,"score":0,"grade":""},{"date":20201027,"state":"DC","positive":16906,"probableCases":null,"negative":485632,"pending":null,"totalTestResultsSource":"totalTestEncountersViral","totalTestResults":502538,"hospitalizedCurrently":106,"hospitalizedCumulative":null,"inIcuCurrently":26,"inIcuCumulative":null,"onVentilatorCurrently":7,"onVentilatorCumulative":null,"recovered":13215,"dataQualityGrade":"A+","lastUpdateEt":"10/26/2020 00:00","dateModified":"2020-10-26T00:00:00Z","checkTimeEt":"10/25 20:00","death":644,"hospitalized":null,"dateChecked":"2020-10-26T00:00:00Z","totalTestsViral":null,"positiveTestsViral":null,"negativeTestsViral":null,"positiveCasesViral":null,"deathConfirmed":null,"deathProbable":null,"totalTestEncountersViral":502538,"totalTestsPeopleViral":251532,"totalTestsAntibody":null,"positiveTestsAntibody":null,"negativeTestsAntibody":null,"totalTestsPeopleAntibody":null,"positiveTestsPeopleAntibody":null,"negativeTestsPeopleAntibody":null,"totalTestsPeopleAntigen":null,"positiveTestsPeopleAntigen":null,"totalTestsAntigen":null,"positiveTestsAntigen":null,"fips":"11","positiveIncrease":94,"negativeIncrease":4254,"total":502538,"totalTestResultsIncrease":4348,"posNeg":502538,"deathIncrease":2,"hospitalizedIncrease":0,"hash":"21179222012d33bf25c5ea4adbdfbf57625dc801","commercialScore":0,"negativeRegularScore":0,"negativeScore":0,"positiveScore":0,"score":0,"grade":""},{"date":20201026,"state":"DC","positive":16812,"probableCases":null,"negative":481378,"pending":null,"totalTestResultsSource":"totalTestEncountersViral","totalTestResults":498190,"hospitalizedCurrently":98,"hospitalizedCumulative":null,"inIcuCurrently":23,"inIcuCumulative":null,"onVentilatorCurrently":12,"onVentilatorCumulative":null,"recovered":13179,"dataQualityGrade":"A+","lastUpdateEt":"10/25/2020 00:00","dateModified":"2020-10-25T00:00:00Z","checkTimeEt":"10/24 20:00","death":642,"hospitalized":null,"dateChecked":"2020-10-25T00:00:00Z","totalTestsViral":null,"positiveTestsViral":null,"negativeTestsViral":null,"positiveCasesViral":null,"deathConfirmed":null,"deathProbable":null,"totalTestEncountersViral":498190,"totalTestsPeopleViral":250043,"totalTestsAntibody":null,"positiveTestsAntibody":null,"negativeTestsAntibody":null,"totalTestsPeopleAntibody":null,"positiveTestsPeopleAntibody":null,"negativeTestsPeopleAntibody":null,"totalTestsPeopleAntigen":null,"positiveTestsPeopleAntigen":null,"totalTestsAntigen":null,"positiveTestsAntigen":null,"fips":"11","positiveIncrease":45,"negativeIncrease":1913,"total":498190,"totalTestResultsIncrease":1958,"posNeg":498190,"deathIncrease":0,"hospitalizedIncrease":0,"hash":"3d8d44f54a579b4c412e334f366a12ae48690cb4","commercialScore":0,"negativeRegularScore":0,"negativeScore":0,"positiveScore":0,"score":0,"grade":""},{"date":20201025,"state":"DC","positive":16767,"probableCases":null,"negative":479465,"pending":null,"totalTestResultsSource":"totalTestEncountersViral","totalTestResults":496232,"hospitalizedCurrently":95,"hospitalizedCumulative":null,"inIcuCurrently":21,"inIcuCumulative":null,"onVentilatorCurrently":8,"onVentilatorCumulative":null,"recovered":13104,"dataQualityGrade":"A+","lastUpdateEt":"10/24/2020 00:00","dateModified":"2020-10-24T00:00:00Z","checkTimeEt":"10/23 20:00","death":642,"hospitalized":null,"dateChecked":"2020-10-24T00:00:00Z","totalTestsViral":null,"positiveTestsViral":null,"negativeTestsViral":null,"positiveCasesViral":null,"deathConfirmed":null,"deathProbable":null,"totalTestEncountersViral":496232,"totalTestsPeopleViral":249572,"totalTestsAntibody":null,"positiveTestsAntibody":null,"negativeTestsAntibody":null,"totalTestsPeopleAntibody":null,"positiveTestsPeopleAntibody":null,"negativeTestsPeopleAntibody":null,"totalTestsPeopleAntigen":null,"positiveTestsPeopleAntigen":null,"totalTestsAntigen":null,"positiveTestsAntigen":null,"fips":"11","positiveIncrease":61,"negativeIncrease":4618,"total":496232,"totalTestResultsIncrease":4679,"posNeg":496232,"deathIncrease":0,"hospitalizedIncrease":0,"hash":"acbc6e7ce0ba747eb3a86445161ead7810101bf4","commercialScore":0,"negativeRegularScore":0,"negativeScore":0,"positiveScore":0,"score":0,"grade":""},{"date":20201024,"state":"DC","positive":16706,"probableCases":null,"negative":474847,"pending":null,"totalTestResultsSource":"totalTestEncountersViral","totalTestResults":491553,"hospitalizedCurrently":93,"hospitalizedCumulative":null,"inIcuCurrently":21,"inIcuCumulative":null,"onVentilatorCurrently":6,"onVentilatorCumulative":null,"recovered":13068,"dataQualityGrade":"A+","lastUpdateEt":"10/23/2020 00:00","dateModified":"2020-10-23T00:00:00Z","checkTimeEt":"10/22 20:00","death":642,"hospitalized":null,"dateChecked":"2020-10-23T00:00:00Z","totalTestsViral":null,"positiveTestsViral":null,"negativeTestsViral":null,"positiveCasesViral":null,"deathConfirmed":null,"deathProbable":null,"totalTestEncountersViral":491553,"totalTestsPeopleViral":248189,"totalTestsAntibody":null,"positiveTestsAntibody":null,"negativeTestsAntibody":null,"totalTestsPeopleAntibody":null,"positiveTestsPeopleAntibody":null,"negativeTestsPeopleAntibody":null,"totalTestsPeopleAntigen":null,"positiveTestsPeopleAntigen":null,"totalTestsAntigen":null,"positiveTestsAntigen":null,"fips":"11","positiveIncrease":97,"negativeIncrease":5703,"total":491553,"totalTestResultsIncrease":5800,"posNeg":491553,"deathIncrease":0,"hospitalizedIncrease":0,"hash":"535786d1db10bd23bead723d4f4ba63833e6d577","commercialScore":0,"negativeRegularScore":0,"negativeScore":0,"positiveScore":0,"score":0,"grade":""},{"date":20201023,"state":"DC","positive":16609,"probableCases":null,"negative":469144,"pending":null,"totalTestResultsSource":"totalTestEncountersViral","totalTestResults":485753,"hospitalizedCurrently":91,"hospitalizedCumulative":null,"inIcuCurrently":23,"inIcuCumulative":null,"onVentilatorCurrently":8,"onVentilatorCumulative":null,"recovered":13028,"dataQualityGrade":"A+","lastUpdateEt":"10/22/2020 00:00","dateModified":"2020-10-22T00:00:00Z","checkTimeEt":"10/21 20:00","death":642,"hospitalized":null,"dateChecked":"2020-10-22T00:00:00Z","totalTestsViral":null,"positiveTestsViral":null,"negativeTestsViral":null,"positiveCasesViral":null,"deathConfirmed":null,"deathProbable":null,"totalTestEncountersViral":485753,"totalTestsPeopleViral":246627,"totalTestsAntibody":null,"positiveTestsAntibody":null,"negativeTestsAntibody":null,"totalTestsPeopleAntibody":null,"positiveTestsPeopleAntibody":null,"negativeTestsPeopleAntibody":null,"totalTestsPeopleAntigen":null,"positiveTestsPeopleAntigen":null,"totalTestsAntigen":null,"positiveTestsAntigen":null,"fips":"11","positiveIncrease":72,"negativeIncrease":6246,"total":485753,"totalTestResultsIncrease":6318,"posNeg":485753,"deathIncrease":0,"hospitalizedIncrease":0,"hash":"4a0e19aa2977cbaa90988de990c739a8b58eb154","commercialScore":0,"negativeRegularScore":0,"negativeScore":0,"positiveScore":0,"score":0,"grade":""},{"date":20201022,"state":"DC","positive":16537,"probableCases":null,"negative":462898,"pending":null,"totalTestResultsSource":"totalTestEncountersViral","totalTestResults":479435,"hospitalizedCurrently":95,"hospitalizedCumulative":null,"inIcuCurrently":23,"inIcuCumulative":null,"onVentilatorCurrently":9,"onVentilatorCumulative":null,"recovered":12979,"dataQualityGrade":"A+","lastUpdateEt":"10/21/2020 00:00","dateModified":"2020-10-21T00:00:00Z","checkTimeEt":"10/20 20:00","death":642,"hospitalized":null,"dateChecked":"2020-10-21T00:00:00Z","totalTestsViral":null,"positiveTestsViral":null,"negativeTestsViral":null,"positiveCasesViral":null,"deathConfirmed":null,"deathProbable":null,"totalTestEncountersViral":479435,"totalTestsPeopleViral":245551,"totalTestsAntibody":null,"positiveTestsAntibody":null,"negativeTestsAntibody":null,"totalTestsPeopleAntibody":null,"positiveTestsPeopleAntibody":null,"negativeTestsPeopleAntibody":null,"totalTestsPeopleAntigen":null,"positiveTestsPeopleAntigen":null,"totalTestsAntigen":null,"positiveTestsAntigen":null,"fips":"11","positiveIncrease":39,"negativeIncrease":2953,"total":479435,"totalTestResultsIncrease":2992,"posNeg":479435,"deathIncrease":0,"hospitalizedIncrease":0,"hash":"b16d4d45046b210a4cc92fb53daa4450b3a4b8d1","commercialScore":0,"negativeRegularScore":0,"negativeScore":0,"positiveScore":0,"score":0,"grade":""},{"date":20201021,"state":"DC","positive":16498,"probableCases":null,"negative":459945,"pending":null,"totalTestResultsSource":"totalTestEncountersViral","totalTestResults":476443,"hospitalizedCurrently":96,"hospitalizedCumulative":null,"inIcuCurrently":23,"inIcuCumulative":null,"onVentilatorCurrently":9,"onVentilatorCumulative":null,"recovered":12938,"dataQualityGrade":"A+","lastUpdateEt":"10/20/2020 00:00","dateModified":"2020-10-20T00:00:00Z","checkTimeEt":"10/19 20:00","death":642,"hospitalized":null,"dateChecked":"2020-10-20T00:00:00Z","totalTestsViral":null,"positiveTestsViral":null,"negativeTestsViral":null,"positiveCasesViral":null,"deathConfirmed":null,"deathProbable":null,"totalTestEncountersViral":476443,"totalTestsPeopleViral":244181,"totalTestsAntibody":null,"positiveTestsAntibody":null,"negativeTestsAntibody":null,"totalTestsPeopleAntibody":null,"positiveTestsPeopleAntibody":null,"negativeTestsPeopleAntibody":null,"totalTestsPeopleAntigen":null,"positiveTestsPeopleAntigen":null,"totalTestsAntigen":null,"positiveTestsAntigen":null,"fips":"11","positiveIncrease":53,"negativeIncrease":2583,"total":476443,"totalTestResultsIncrease":2636,"posNeg":476443,"deathIncrease":0,"hospitalizedIncrease":0,"hash":"25909985908b88cfa3e9a80575b76171f57e7069","commercialScore":0,"negativeRegularScore":0,"negativeScore":0,"positiveScore":0,"score":0,"grade":""},{"date":20201020,"state":"DC","positive":16445,"probableCases":null,"negative":457362,"pending":null,"totalTestResultsSource":"totalTestEncountersViral","totalTestResults":473807,"hospitalizedCurrently":85,"hospitalizedCumulative":null,"inIcuCurrently":20,"inIcuCumulative":null,"onVentilatorCurrently":9,"onVentilatorCumulative":null,"recovered":12884,"dataQualityGrade":"A+","lastUpdateEt":"10/19/2020 00:00","dateModified":"2020-10-19T00:00:00Z","checkTimeEt":"10/18 20:00","death":642,"hospitalized":null,"dateChecked":"2020-10-19T00:00:00Z","totalTestsViral":null,"positiveTestsViral":null,"negativeTestsViral":null,"positiveCasesViral":null,"deathConfirmed":null,"deathProbable":null,"totalTestEncountersViral":473807,"totalTestsPeopleViral":243299,"totalTestsAntibody":null,"positiveTestsAntibody":null,"negativeTestsAntibody":null,"totalTestsPeopleAntibody":null,"positiveTestsPeopleAntibody":null,"negativeTestsPeopleAntibody":null,"totalTestsPeopleAntigen":null,"positiveTestsPeopleAntigen":null,"totalTestsAntigen":null,"positiveTestsAntigen":null,"fips":"11","positiveIncrease":50,"negativeIncrease":4717,"total":473807,"totalTestResultsIncrease":4767,"posNeg":473807,"deathIncrease":1,"hospitalizedIncrease":0,"hash":"34c2f3c0c7e3db9b0eb623cb758e8ea84ffa1e0e","commercialScore":0,"negativeRegularScore":0,"negativeScore":0,"positiveScore":0,"score":0,"grade":""},{"date":20201019,"state":"DC","positive":16395,"probableCases":null,"negative":452645,"pending":null,"totalTestResultsSource":"totalTestEncountersViral","totalTestResults":469040,"hospitalizedCurrently":84,"hospitalizedCumulative":null,"inIcuCurrently":20,"inIcuCumulative":null,"onVentilatorCurrently":9,"onVentilatorCumulative":null,"recovered":12824,"dataQualityGrade":"A+","lastUpdateEt":"10/18/2020 00:00","dateModified":"2020-10-18T00:00:00Z","checkTimeEt":"10/17 20:00","death":641,"hospitalized":null,"dateChecked":"2020-10-18T00:00:00Z","totalTestsViral":null,"positiveTestsViral":null,"negativeTestsViral":null,"positiveCasesViral":null,"deathConfirmed":null,"deathProbable":null,"totalTestEncountersViral":469040,"totalTestsPeopleViral":241621,"totalTestsAntibody":null,"positiveTestsAntibody":null,"negativeTestsAntibody":null,"totalTestsPeopleAntibody":null,"positiveTestsPeopleAntibody":null,"negativeTestsPeopleAntibody":null,"totalTestsPeopleAntigen":null,"positiveTestsPeopleAntigen":null,"totalTestsAntigen":null,"positiveTestsAntigen":null,"fips":"11","positiveIncrease":25,"negativeIncrease":2210,"total":469040,"totalTestResultsIncrease":2235,"posNeg":469040,"deathIncrease":0,"hospitalizedIncrease":0,"hash":"dc3e0fcffa38ac0f02b914b35c717aae96e7aa85","commercialScore":0,"negativeRegularScore":0,"negativeScore":0,"positiveScore":0,"score":0,"grade":""},{"date":20201018,"state":"DC","positive":16370,"probableCases":null,"negative":450435,"pending":null,"totalTestResultsSource":"totalTestEncountersViral","totalTestResults":466805,"hospitalizedCurrently":78,"hospitalizedCumulative":null,"inIcuCurrently":20,"inIcuCumulative":null,"onVentilatorCurrently":8,"onVentilatorCumulative":null,"recovered":12801,"dataQualityGrade":"A+","lastUpdateEt":"10/17/2020 00:00","dateModified":"2020-10-17T00:00:00Z","checkTimeEt":"10/16 20:00","death":641,"hospitalized":null,"dateChecked":"2020-10-17T00:00:00Z","totalTestsViral":null,"positiveTestsViral":null,"negativeTestsViral":null,"positiveCasesViral":null,"deathConfirmed":null,"deathProbable":null,"totalTestEncountersViral":466805,"totalTestsPeopleViral":240959,"totalTestsAntibody":null,"positiveTestsAntibody":null,"negativeTestsAntibody":null,"totalTestsPeopleAntibody":null,"positiveTestsPeopleAntibody":null,"negativeTestsPeopleAntibody":null,"totalTestsPeopleAntigen":null,"positiveTestsPeopleAntigen":null,"totalTestsAntigen":null,"positiveTestsAntigen":null,"fips":"11","positiveIncrease":36,"negativeIncrease":3801,"total":466805,"totalTestResultsIncrease":3837,"posNeg":466805,"deathIncrease":0,"hospitalizedIncrease":0,"hash":"52b46dd9d9ef2c5b4492f9ca9131819608b9b839","commercialScore":0,"negativeRegularScore":0,"negativeScore":0,"positiveScore":0,"score":0,"grade":""},{"date":20201017,"state":"DC","positive":16334,"probableCases":null,"negative":446634,"pending":null,"totalTestResultsSource":"totalTestEncountersViral","totalTestResults":462968,"hospitalizedCurrently":84,"hospitalizedCumulative":null,"inIcuCurrently":23,"inIcuCumulative":null,"onVentilatorCurrently":8,"onVentilatorCumulative":null,"recovered":12793,"dataQualityGrade":"A+","lastUpdateEt":"10/16/2020 00:00","dateModified":"2020-10-16T00:00:00Z","checkTimeEt":"10/15 20:00","death":641,"hospitalized":null,"dateChecked":"2020-10-16T00:00:00Z","totalTestsViral":null,"positiveTestsViral":null,"negativeTestsViral":null,"positiveCasesViral":null,"deathConfirmed":null,"deathProbable":null,"totalTestEncountersViral":462968,"totalTestsPeopleViral":239835,"totalTestsAntibody":null,"positiveTestsAntibody":null,"negativeTestsAntibody":null,"totalTestsPeopleAntibody":null,"positiveTestsPeopleAntibody":null,"negativeTestsPeopleAntibody":null,"totalTestsPeopleAntigen":null,"positiveTestsPeopleAntigen":null,"totalTestsAntigen":null,"positiveTestsAntigen":null,"fips":"11","positiveIncrease":79,"negativeIncrease":7102,"total":462968,"totalTestResultsIncrease":7181,"posNeg":462968,"deathIncrease":0,"hospitalizedIncrease":0,"hash":"4bd773d57f5bd94f3ec7c68d3fb639d20a7b5223","commercialScore":0,"negativeRegularScore":0,"negativeScore":0,"positiveScore":0,"score":0,"grade":""},{"date":20201016,"state":"DC","positive":16255,"probableCases":null,"negative":439532,"pending":null,"totalTestResultsSource":"totalTestEncountersViral","totalTestResults":455787,"hospitalizedCurrently":86,"hospitalizedCumulative":null,"inIcuCurrently":21,"inIcuCumulative":null,"onVentilatorCurrently":6,"onVentilatorCumulative":null,"recovered":12731,"dataQualityGrade":"A+","lastUpdateEt":"10/15/2020 00:00","dateModified":"2020-10-15T00:00:00Z","checkTimeEt":"10/14 20:00","death":641,"hospitalized":null,"dateChecked":"2020-10-15T00:00:00Z","totalTestsViral":null,"positiveTestsViral":null,"negativeTestsViral":null,"positiveCasesViral":null,"deathConfirmed":null,"deathProbable":null,"totalTestEncountersViral":455787,"totalTestsPeopleViral":237674,"totalTestsAntibody":null,"positiveTestsAntibody":null,"negativeTestsAntibody":null,"totalTestsPeopleAntibody":null,"positiveTestsPeopleAntibody":null,"negativeTestsPeopleAntibody":null,"totalTestsPeopleAntigen":null,"positiveTestsPeopleAntigen":null,"totalTestsAntigen":null,"positiveTestsAntigen":null,"fips":"11","positiveIncrease":89,"negativeIncrease":5084,"total":455787,"totalTestResultsIncrease":5173,"posNeg":455787,"deathIncrease":3,"hospitalizedIncrease":0,"hash":"20b41f49cb6cf94c8c739699137de7d55d41bfde","commercialScore":0,"negativeRegularScore":0,"negativeScore":0,"positiveScore":0,"score":0,"grade":""},{"date":20201015,"state":"DC","positive":16166,"probableCases":null,"negative":434448,"pending":null,"totalTestResultsSource":"totalTestEncountersViral","totalTestResults":450614,"hospitalizedCurrently":88,"hospitalizedCumulative":null,"inIcuCurrently":22,"inIcuCumulative":null,"onVentilatorCurrently":10,"onVentilatorCumulative":null,"recovered":12681,"dataQualityGrade":"A+","lastUpdateEt":"10/14/2020 00:00","dateModified":"2020-10-14T00:00:00Z","checkTimeEt":"10/13 20:00","death":638,"hospitalized":null,"dateChecked":"2020-10-14T00:00:00Z","totalTestsViral":null,"positiveTestsViral":null,"negativeTestsViral":null,"positiveCasesViral":null,"deathConfirmed":null,"deathProbable":null,"totalTestEncountersViral":450614,"totalTestsPeopleViral":235875,"totalTestsAntibody":null,"positiveTestsAntibody":null,"negativeTestsAntibody":null,"totalTestsPeopleAntibody":null,"positiveTestsPeopleAntibody":null,"negativeTestsPeopleAntibody":null,"totalTestsPeopleAntigen":null,"positiveTestsPeopleAntigen":null,"totalTestsAntigen":null,"positiveTestsAntigen":null,"fips":"11","positiveIncrease":34,"negativeIncrease":2318,"total":450614,"totalTestResultsIncrease":2352,"posNeg":450614,"deathIncrease":0,"hospitalizedIncrease":0,"hash":"b6779aac88f5dbfbbbe3acd25b5917d601b77583","commercialScore":0,"negativeRegularScore":0,"negativeScore":0,"positiveScore":0,"score":0,"grade":""},{"date":20201014,"state":"DC","positive":16132,"probableCases":null,"negative":432130,"pending":null,"totalTestResultsSource":"totalTestEncountersViral","totalTestResults":448262,"hospitalizedCurrently":86,"hospitalizedCumulative":null,"inIcuCurrently":24,"inIcuCumulative":null,"onVentilatorCurrently":7,"onVentilatorCumulative":null,"recovered":12627,"dataQualityGrade":"A+","lastUpdateEt":"10/13/2020 00:00","dateModified":"2020-10-13T00:00:00Z","checkTimeEt":"10/12 20:00","death":638,"hospitalized":null,"dateChecked":"2020-10-13T00:00:00Z","totalTestsViral":null,"positiveTestsViral":null,"negativeTestsViral":null,"positiveCasesViral":null,"deathConfirmed":null,"deathProbable":null,"totalTestEncountersViral":448262,"totalTestsPeopleViral":235263,"totalTestsAntibody":null,"positiveTestsAntibody":null,"negativeTestsAntibody":null,"totalTestsPeopleAntibody":null,"positiveTestsPeopleAntibody":null,"negativeTestsPeopleAntibody":null,"totalTestsPeopleAntigen":null,"positiveTestsPeopleAntigen":null,"totalTestsAntigen":null,"positiveTestsAntigen":null,"fips":"11","positiveIncrease":64,"negativeIncrease":5117,"total":448262,"totalTestResultsIncrease":5181,"posNeg":448262,"deathIncrease":1,"hospitalizedIncrease":0,"hash":"510c8d631a14765371552259b3f2b3b4cedf9477","commercialScore":0,"negativeRegularScore":0,"negativeScore":0,"positiveScore":0,"score":0,"grade":""},{"date":20201013,"state":"DC","positive":16068,"probableCases":null,"negative":427013,"pending":null,"totalTestResultsSource":"totalTestEncountersViral","totalTestResults":443081,"hospitalizedCurrently":88,"hospitalizedCumulative":null,"inIcuCurrently":25,"inIcuCumulative":null,"onVentilatorCurrently":7,"onVentilatorCumulative":null,"recovered":12583,"dataQualityGrade":"A+","lastUpdateEt":"10/12/2020 00:00","dateModified":"2020-10-12T00:00:00Z","checkTimeEt":"10/11 20:00","death":637,"hospitalized":null,"dateChecked":"2020-10-12T00:00:00Z","totalTestsViral":null,"positiveTestsViral":null,"negativeTestsViral":null,"positiveCasesViral":null,"deathConfirmed":null,"deathProbable":null,"totalTestEncountersViral":443081,"totalTestsPeopleViral":233450,"totalTestsAntibody":null,"positiveTestsAntibody":null,"negativeTestsAntibody":null,"totalTestsPeopleAntibody":null,"positiveTestsPeopleAntibody":null,"negativeTestsPeopleAntibody":null,"totalTestsPeopleAntigen":null,"positiveTestsPeopleAntigen":null,"totalTestsAntigen":null,"positiveTestsAntigen":null,"fips":"11","positiveIncrease":46,"negativeIncrease":4216,"total":443081,"totalTestResultsIncrease":4262,"posNeg":443081,"deathIncrease":0,"hospitalizedIncrease":0,"hash":"543c7100b500465421e1b802a6cda8bcc26abe56","commercialScore":0,"negativeRegularScore":0,"negativeScore":0,"positiveScore":0,"score":0,"grade":""},{"date":20201012,"state":"DC","positive":16022,"probableCases":null,"negative":422797,"pending":null,"totalTestResultsSource":"totalTestEncountersViral","totalTestResults":438819,"hospitalizedCurrently":87,"hospitalizedCumulative":null,"inIcuCurrently":21,"inIcuCumulative":null,"onVentilatorCurrently":12,"onVentilatorCumulative":null,"recovered":12539,"dataQualityGrade":"A+","lastUpdateEt":"10/11/2020 00:00","dateModified":"2020-10-11T00:00:00Z","checkTimeEt":"10/10 20:00","death":637,"hospitalized":null,"dateChecked":"2020-10-11T00:00:00Z","totalTestsViral":null,"positiveTestsViral":null,"negativeTestsViral":null,"positiveCasesViral":null,"deathConfirmed":null,"deathProbable":null,"totalTestEncountersViral":438819,"totalTestsPeopleViral":231817,"totalTestsAntibody":null,"positiveTestsAntibody":null,"negativeTestsAntibody":null,"totalTestsPeopleAntibody":null,"positiveTestsPeopleAntibody":null,"negativeTestsPeopleAntibody":null,"totalTestsPeopleAntigen":null,"positiveTestsPeopleAntigen":null,"totalTestsAntigen":null,"positiveTestsAntigen":null,"fips":"11","positiveIncrease":38,"negativeIncrease":2614,"total":438819,"totalTestResultsIncrease":2652,"posNeg":438819,"deathIncrease":0,"hospitalizedIncrease":0,"hash":"65b1aff6a6f355d5f925d47695d72d6a107b617a","commercialScore":0,"negativeRegularScore":0,"negativeScore":0,"positiveScore":0,"score":0,"grade":""},{"date":20201011,"state":"DC","positive":15984,"probableCases":null,"negative":420183,"pending":null,"totalTestResultsSource":"totalTestEncountersViral","totalTestResults":436167,"hospitalizedCurrently":86,"hospitalizedCumulative":null,"inIcuCurrently":26,"inIcuCumulative":null,"onVentilatorCurrently":13,"onVentilatorCumulative":null,"recovered":12531,"dataQualityGrade":"A+","lastUpdateEt":"10/10/2020 00:00","dateModified":"2020-10-10T00:00:00Z","checkTimeEt":"10/09 20:00","death":637,"hospitalized":null,"dateChecked":"2020-10-10T00:00:00Z","totalTestsViral":null,"positiveTestsViral":null,"negativeTestsViral":null,"positiveCasesViral":null,"deathConfirmed":null,"deathProbable":null,"totalTestEncountersViral":436167,"totalTestsPeopleViral":230929,"totalTestsAntibody":null,"positiveTestsAntibody":null,"negativeTestsAntibody":null,"totalTestsPeopleAntibody":null,"positiveTestsPeopleAntibody":null,"negativeTestsPeopleAntibody":null,"totalTestsPeopleAntigen":null,"positiveTestsPeopleAntigen":null,"totalTestsAntigen":null,"positiveTestsAntigen":null,"fips":"11","positiveIncrease":66,"negativeIncrease":7002,"total":436167,"totalTestResultsIncrease":7068,"posNeg":436167,"deathIncrease":1,"hospitalizedIncrease":0,"hash":"3275f180f14a598080cef8fc9660cd0bce1dab57","commercialScore":0,"negativeRegularScore":0,"negativeScore":0,"positiveScore":0,"score":0,"grade":""},{"date":20201010,"state":"DC","positive":15918,"probableCases":null,"negative":413181,"pending":null,"totalTestResultsSource":"totalTestEncountersViral","totalTestResults":429099,"hospitalizedCurrently":99,"hospitalizedCumulative":null,"inIcuCurrently":27,"inIcuCumulative":null,"onVentilatorCurrently":14,"onVentilatorCumulative":null,"recovered":12492,"dataQualityGrade":"A+","lastUpdateEt":"10/9/2020 00:00","dateModified":"2020-10-09T00:00:00Z","checkTimeEt":"10/08 20:00","death":636,"hospitalized":null,"dateChecked":"2020-10-09T00:00:00Z","totalTestsViral":null,"positiveTestsViral":null,"negativeTestsViral":null,"positiveCasesViral":null,"deathConfirmed":null,"deathProbable":null,"totalTestEncountersViral":429099,"totalTestsPeopleViral":228668,"totalTestsAntibody":null,"positiveTestsAntibody":null,"negativeTestsAntibody":null,"totalTestsPeopleAntibody":null,"positiveTestsPeopleAntibody":null,"negativeTestsPeopleAntibody":null,"totalTestsPeopleAntigen":null,"positiveTestsPeopleAntigen":null,"totalTestsAntigen":null,"positiveTestsAntigen":null,"fips":"11","positiveIncrease":75,"negativeIncrease":6799,"total":429099,"totalTestResultsIncrease":6874,"posNeg":429099,"deathIncrease":2,"hospitalizedIncrease":0,"hash":"0849560e44bc08f655faa916e6c54ea31c66de36","commercialScore":0,"negativeRegularScore":0,"negativeScore":0,"positiveScore":0,"score":0,"grade":""},{"date":20201009,"state":"DC","positive":15843,"probableCases":null,"negative":406382,"pending":null,"totalTestResultsSource":"totalTestEncountersViral","totalTestResults":422225,"hospitalizedCurrently":99,"hospitalizedCumulative":null,"inIcuCurrently":27,"inIcuCumulative":null,"onVentilatorCurrently":13,"onVentilatorCumulative":null,"recovered":12456,"dataQualityGrade":"A+","lastUpdateEt":"10/8/2020 00:00","dateModified":"2020-10-08T00:00:00Z","checkTimeEt":"10/07 20:00","death":634,"hospitalized":null,"dateChecked":"2020-10-08T00:00:00Z","totalTestsViral":null,"positiveTestsViral":null,"negativeTestsViral":null,"positiveCasesViral":null,"deathConfirmed":null,"deathProbable":null,"totalTestEncountersViral":422225,"totalTestsPeopleViral":227401,"totalTestsAntibody":null,"positiveTestsAntibody":null,"negativeTestsAntibody":null,"totalTestsPeopleAntibody":null,"positiveTestsPeopleAntibody":null,"negativeTestsPeopleAntibody":null,"totalTestsPeopleAntigen":null,"positiveTestsPeopleAntigen":null,"totalTestsAntigen":null,"positiveTestsAntigen":null,"fips":"11","positiveIncrease":78,"negativeIncrease":5331,"total":422225,"totalTestResultsIncrease":5409,"posNeg":422225,"deathIncrease":0,"hospitalizedIncrease":0,"hash":"735bbbf3384aa19697de2041b280d9ba93d38f62","commercialScore":0,"negativeRegularScore":0,"negativeScore":0,"positiveScore":0,"score":0,"grade":""},{"date":20201008,"state":"DC","positive":15765,"probableCases":null,"negative":401051,"pending":null,"totalTestResultsSource":"totalTestEncountersViral","totalTestResults":416816,"hospitalizedCurrently":100,"hospitalizedCumulative":null,"inIcuCurrently":25,"inIcuCumulative":null,"onVentilatorCurrently":15,"onVentilatorCumulative":null,"recovered":12431,"dataQualityGrade":"A+","lastUpdateEt":"10/7/2020 00:00","dateModified":"2020-10-07T00:00:00Z","checkTimeEt":"10/06 20:00","death":634,"hospitalized":null,"dateChecked":"2020-10-07T00:00:00Z","totalTestsViral":null,"positiveTestsViral":null,"negativeTestsViral":null,"positiveCasesViral":null,"deathConfirmed":null,"deathProbable":null,"totalTestEncountersViral":416816,"totalTestsPeopleViral":224978,"totalTestsAntibody":null,"positiveTestsAntibody":null,"negativeTestsAntibody":null,"totalTestsPeopleAntibody":null,"positiveTestsPeopleAntibody":null,"negativeTestsPeopleAntibody":null,"totalTestsPeopleAntigen":null,"positiveTestsPeopleAntigen":null,"totalTestsAntigen":null,"positiveTestsAntigen":null,"fips":"11","positiveIncrease":68,"negativeIncrease":4092,"total":416816,"totalTestResultsIncrease":4160,"posNeg":416816,"deathIncrease":2,"hospitalizedIncrease":0,"hash":"76d18a48c813d0b062ee77d13ed1d784d018fc0e","commercialScore":0,"negativeRegularScore":0,"negativeScore":0,"positiveScore":0,"score":0,"grade":""},{"date":20201007,"state":"DC","positive":15697,"probableCases":null,"negative":396959,"pending":null,"totalTestResultsSource":"totalTestEncountersViral","totalTestResults":412656,"hospitalizedCurrently":103,"hospitalizedCumulative":null,"inIcuCurrently":30,"inIcuCumulative":null,"onVentilatorCurrently":16,"onVentilatorCumulative":null,"recovered":12350,"dataQualityGrade":"A+","lastUpdateEt":"10/6/2020 00:00","dateModified":"2020-10-06T00:00:00Z","checkTimeEt":"10/05 20:00","death":632,"hospitalized":null,"dateChecked":"2020-10-06T00:00:00Z","totalTestsViral":null,"positiveTestsViral":null,"negativeTestsViral":null,"positiveCasesViral":null,"deathConfirmed":null,"deathProbable":null,"totalTestEncountersViral":412656,"totalTestsPeopleViral":223620,"totalTestsAntibody":null,"positiveTestsAntibody":null,"negativeTestsAntibody":null,"totalTestsPeopleAntibody":null,"positiveTestsPeopleAntibody":null,"negativeTestsPeopleAntibody":null,"totalTestsPeopleAntigen":null,"positiveTestsPeopleAntigen":null,"totalTestsAntigen":null,"positiveTestsAntigen":null,"fips":"11","positiveIncrease":45,"negativeIncrease":2582,"total":412656,"totalTestResultsIncrease":2627,"posNeg":412656,"deathIncrease":1,"hospitalizedIncrease":0,"hash":"884226155d37d2e46574773e07b90fe649e23fc7","commercialScore":0,"negativeRegularScore":0,"negativeScore":0,"positiveScore":0,"score":0,"grade":""},{"date":20201006,"state":"DC","positive":15652,"probableCases":null,"negative":394377,"pending":null,"totalTestResultsSource":"totalTestEncountersViral","totalTestResults":410029,"hospitalizedCurrently":105,"hospitalizedCumulative":null,"inIcuCurrently":30,"inIcuCumulative":null,"onVentilatorCurrently":15,"onVentilatorCumulative":null,"recovered":12350,"dataQualityGrade":"A+","lastUpdateEt":"10/5/2020 00:00","dateModified":"2020-10-05T00:00:00Z","checkTimeEt":"10/04 20:00","death":631,"hospitalized":null,"dateChecked":"2020-10-05T00:00:00Z","totalTestsViral":null,"positiveTestsViral":null,"negativeTestsViral":null,"positiveCasesViral":null,"deathConfirmed":null,"deathProbable":null,"totalTestEncountersViral":410029,"totalTestsPeopleViral":222724,"totalTestsAntibody":null,"positiveTestsAntibody":null,"negativeTestsAntibody":null,"totalTestsPeopleAntibody":null,"positiveTestsPeopleAntibody":null,"negativeTestsPeopleAntibody":null,"totalTestsPeopleAntigen":null,"positiveTestsPeopleAntigen":null,"totalTestsAntigen":null,"positiveTestsAntigen":null,"fips":"11","positiveIncrease":105,"negativeIncrease":8356,"total":410029,"totalTestResultsIncrease":8461,"posNeg":410029,"deathIncrease":0,"hospitalizedIncrease":0,"hash":"d2a5ce3e799b045c0fc318ab1bb984787e8df42b","commercialScore":0,"negativeRegularScore":0,"negativeScore":0,"positiveScore":0,"score":0,"grade":""},{"date":20201005,"state":"DC","positive":15547,"probableCases":null,"negative":386021,"pending":null,"totalTestResultsSource":"totalTestEncountersViral","totalTestResults":401568,"hospitalizedCurrently":95,"hospitalizedCumulative":null,"inIcuCurrently":28,"inIcuCumulative":null,"onVentilatorCurrently":12,"onVentilatorCumulative":null,"recovered":12306,"dataQualityGrade":"A+","lastUpdateEt":"10/4/2020 00:00","dateModified":"2020-10-04T00:00:00Z","checkTimeEt":"10/03 20:00","death":631,"hospitalized":null,"dateChecked":"2020-10-04T00:00:00Z","totalTestsViral":null,"positiveTestsViral":null,"negativeTestsViral":null,"positiveCasesViral":null,"deathConfirmed":null,"deathProbable":null,"totalTestEncountersViral":401568,"totalTestsPeopleViral":219912,"totalTestsAntibody":null,"positiveTestsAntibody":null,"negativeTestsAntibody":null,"totalTestsPeopleAntibody":null,"positiveTestsPeopleAntibody":null,"negativeTestsPeopleAntibody":null,"totalTestsPeopleAntigen":null,"positiveTestsPeopleAntigen":null,"totalTestsAntigen":null,"positiveTestsAntigen":null,"fips":"11","positiveIncrease":28,"negativeIncrease":1715,"total":401568,"totalTestResultsIncrease":1743,"posNeg":401568,"deathIncrease":0,"hospitalizedIncrease":0,"hash":"37bbfe5d87b914f08f694045e1672fbfacfdf0c2","commercialScore":0,"negativeRegularScore":0,"negativeScore":0,"positiveScore":0,"score":0,"grade":""},{"date":20201004,"state":"DC","positive":15519,"probableCases":null,"negative":384306,"pending":null,"totalTestResultsSource":"totalTestEncountersViral","totalTestResults":399825,"hospitalizedCurrently":95,"hospitalizedCumulative":null,"inIcuCurrently":29,"inIcuCumulative":null,"onVentilatorCurrently":15,"onVentilatorCumulative":null,"recovered":12299,"dataQualityGrade":"A+","lastUpdateEt":"10/3/2020 00:00","dateModified":"2020-10-03T00:00:00Z","checkTimeEt":"10/02 20:00","death":631,"hospitalized":null,"dateChecked":"2020-10-03T00:00:00Z","totalTestsViral":null,"positiveTestsViral":null,"negativeTestsViral":null,"positiveCasesViral":null,"deathConfirmed":null,"deathProbable":null,"totalTestEncountersViral":399825,"totalTestsPeopleViral":219389,"totalTestsAntibody":null,"positiveTestsAntibody":null,"negativeTestsAntibody":null,"totalTestsPeopleAntibody":null,"positiveTestsPeopleAntibody":null,"negativeTestsPeopleAntibody":null,"totalTestsPeopleAntigen":null,"positiveTestsPeopleAntigen":null,"totalTestsAntigen":null,"positiveTestsAntigen":null,"fips":"11","positiveIncrease":46,"negativeIncrease":2230,"total":399825,"totalTestResultsIncrease":2276,"posNeg":399825,"deathIncrease":2,"hospitalizedIncrease":0,"hash":"cd847a4905b0c738b9683c1735f7d59d81de760e","commercialScore":0,"negativeRegularScore":0,"negativeScore":0,"positiveScore":0,"score":0,"grade":""},{"date":20201003,"state":"DC","positive":15473,"probableCases":null,"negative":382076,"pending":null,"totalTestResultsSource":"totalTestEncountersViral","totalTestResults":397549,"hospitalizedCurrently":86,"hospitalizedCumulative":null,"inIcuCurrently":27,"inIcuCumulative":null,"onVentilatorCurrently":13,"onVentilatorCumulative":null,"recovered":12252,"dataQualityGrade":"A+","lastUpdateEt":"10/2/2020 00:00","dateModified":"2020-10-02T00:00:00Z","checkTimeEt":"10/01 20:00","death":629,"hospitalized":null,"dateChecked":"2020-10-02T00:00:00Z","totalTestsViral":null,"positiveTestsViral":null,"negativeTestsViral":null,"positiveCasesViral":null,"deathConfirmed":null,"deathProbable":null,"totalTestEncountersViral":397549,"totalTestsPeopleViral":218633,"totalTestsAntibody":null,"positiveTestsAntibody":null,"negativeTestsAntibody":null,"totalTestsPeopleAntibody":null,"positiveTestsPeopleAntibody":null,"negativeTestsPeopleAntibody":null,"totalTestsPeopleAntigen":null,"positiveTestsPeopleAntigen":null,"totalTestsAntigen":null,"positiveTestsAntigen":null,"fips":"11","positiveIncrease":50,"negativeIncrease":3381,"total":397549,"totalTestResultsIncrease":3431,"posNeg":397549,"deathIncrease":0,"hospitalizedIncrease":0,"hash":"31706c53943a3eb684706a74690a910f851a2c6b","commercialScore":0,"negativeRegularScore":0,"negativeScore":0,"positiveScore":0,"score":0,"grade":""},{"date":20201002,"state":"DC","positive":15423,"probableCases":null,"negative":378695,"pending":null,"totalTestResultsSource":"totalTestEncountersViral","totalTestResults":394118,"hospitalizedCurrently":101,"hospitalizedCumulative":null,"inIcuCurrently":30,"inIcuCumulative":null,"onVentilatorCurrently":14,"onVentilatorCumulative":null,"recovered":12252,"dataQualityGrade":"A+","lastUpdateEt":"10/1/2020 00:00","dateModified":"2020-10-01T00:00:00Z","checkTimeEt":"09/30 20:00","death":629,"hospitalized":null,"dateChecked":"2020-10-01T00:00:00Z","totalTestsViral":null,"positiveTestsViral":null,"negativeTestsViral":null,"positiveCasesViral":null,"deathConfirmed":null,"deathProbable":null,"totalTestEncountersViral":394118,"totalTestsPeopleViral":217484,"totalTestsAntibody":null,"positiveTestsAntibody":null,"negativeTestsAntibody":null,"totalTestsPeopleAntibody":null,"positiveTestsPeopleAntibody":null,"negativeTestsPeopleAntibody":null,"totalTestsPeopleAntigen":null,"positiveTestsPeopleAntigen":null,"totalTestsAntigen":null,"positiveTestsAntigen":null,"fips":"11","positiveIncrease":65,"negativeIncrease":3873,"total":394118,"totalTestResultsIncrease":3938,"posNeg":394118,"deathIncrease":1,"hospitalizedIncrease":0,"hash":"1ab34551fc6396f63540cfae496bd5cd911d3177","commercialScore":0,"negativeRegularScore":0,"negativeScore":0,"positiveScore":0,"score":0,"grade":""},{"date":20201001,"state":"DC","positive":15358,"probableCases":null,"negative":374822,"pending":null,"totalTestResultsSource":"totalTestEncountersViral","totalTestResults":390180,"hospitalizedCurrently":98,"hospitalizedCumulative":null,"inIcuCurrently":28,"inIcuCumulative":null,"onVentilatorCurrently":12,"onVentilatorCumulative":null,"recovered":12202,"dataQualityGrade":"A+","lastUpdateEt":"9/30/2020 00:00","dateModified":"2020-09-30T00:00:00Z","checkTimeEt":"09/29 20:00","death":628,"hospitalized":null,"dateChecked":"2020-09-30T00:00:00Z","totalTestsViral":null,"positiveTestsViral":null,"negativeTestsViral":null,"positiveCasesViral":null,"deathConfirmed":null,"deathProbable":null,"totalTestEncountersViral":390180,"totalTestsPeopleViral":215920,"totalTestsAntibody":null,"positiveTestsAntibody":null,"negativeTestsAntibody":null,"totalTestsPeopleAntibody":null,"positiveTestsPeopleAntibody":null,"negativeTestsPeopleAntibody":null,"totalTestsPeopleAntigen":null,"positiveTestsPeopleAntigen":null,"totalTestsAntigen":null,"positiveTestsAntigen":null,"fips":"11","positiveIncrease":32,"negativeIncrease":2288,"total":390180,"totalTestResultsIncrease":2320,"posNeg":390180,"deathIncrease":1,"hospitalizedIncrease":0,"hash":"e611b2af30aed15ee063ff253d6d723c0710b848","commercialScore":0,"negativeRegularScore":0,"negativeScore":0,"positiveScore":0,"score":0,"grade":""},{"date":20200930,"state":"DC","positive":15326,"probableCases":null,"negative":372534,"pending":null,"totalTestResultsSource":"totalTestEncountersViral","totalTestResults":387860,"hospitalizedCurrently":95,"hospitalizedCumulative":null,"inIcuCurrently":28,"inIcuCumulative":null,"onVentilatorCurrently":9,"onVentilatorCumulative":null,"recovered":12155,"dataQualityGrade":"A+","lastUpdateEt":"9/29/2020 00:00","dateModified":"2020-09-29T00:00:00Z","checkTimeEt":"09/28 20:00","death":627,"hospitalized":null,"dateChecked":"2020-09-29T00:00:00Z","totalTestsViral":null,"positiveTestsViral":null,"negativeTestsViral":null,"positiveCasesViral":null,"deathConfirmed":null,"deathProbable":null,"totalTestEncountersViral":387860,"totalTestsPeopleViral":215204,"totalTestsAntibody":null,"positiveTestsAntibody":null,"negativeTestsAntibody":null,"totalTestsPeopleAntibody":null,"positiveTestsPeopleAntibody":null,"negativeTestsPeopleAntibody":null,"totalTestsPeopleAntigen":null,"positiveTestsPeopleAntigen":null,"totalTestsAntigen":null,"positiveTestsAntigen":null,"fips":"11","positiveIncrease":26,"negativeIncrease":1438,"total":387860,"totalTestResultsIncrease":1464,"posNeg":387860,"deathIncrease":1,"hospitalizedIncrease":0,"hash":"927754f36d53f744e680936e077dfc08da04b698","commercialScore":0,"negativeRegularScore":0,"negativeScore":0,"positiveScore":0,"score":0,"grade":""},{"date":20200929,"state":"DC","positive":15300,"probableCases":null,"negative":371096,"pending":null,"totalTestResultsSource":"totalTestEncountersViral","totalTestResults":386396,"hospitalizedCurrently":93,"hospitalizedCumulative":null,"inIcuCurrently":23,"inIcuCumulative":null,"onVentilatorCurrently":10,"onVentilatorCumulative":null,"recovered":12115,"dataQualityGrade":"A+","lastUpdateEt":"9/28/2020 00:00","dateModified":"2020-09-28T00:00:00Z","checkTimeEt":"09/27 20:00","death":626,"hospitalized":null,"dateChecked":"2020-09-28T00:00:00Z","totalTestsViral":null,"positiveTestsViral":null,"negativeTestsViral":null,"positiveCasesViral":null,"deathConfirmed":null,"deathProbable":null,"totalTestEncountersViral":386396,"totalTestsPeopleViral":214731,"totalTestsAntibody":null,"positiveTestsAntibody":null,"negativeTestsAntibody":null,"totalTestsPeopleAntibody":null,"positiveTestsPeopleAntibody":null,"negativeTestsPeopleAntibody":null,"totalTestsPeopleAntigen":null,"positiveTestsPeopleAntigen":null,"totalTestsAntigen":null,"positiveTestsAntigen":null,"fips":"11","positiveIncrease":36,"negativeIncrease":3312,"total":386396,"totalTestResultsIncrease":3348,"posNeg":386396,"deathIncrease":2,"hospitalizedIncrease":0,"hash":"c92277f1c8e5b2b0fd797de001833cadd719627b","commercialScore":0,"negativeRegularScore":0,"negativeScore":0,"positiveScore":0,"score":0,"grade":""},{"date":20200928,"state":"DC","positive":15264,"probableCases":null,"negative":367784,"pending":null,"totalTestResultsSource":"totalTestEncountersViral","totalTestResults":383048,"hospitalizedCurrently":90,"hospitalizedCumulative":null,"inIcuCurrently":27,"inIcuCumulative":null,"onVentilatorCurrently":15,"onVentilatorCumulative":null,"recovered":12053,"dataQualityGrade":"A+","lastUpdateEt":"9/27/2020 00:00","dateModified":"2020-09-27T00:00:00Z","checkTimeEt":"09/26 20:00","death":624,"hospitalized":null,"dateChecked":"2020-09-27T00:00:00Z","totalTestsViral":null,"positiveTestsViral":null,"negativeTestsViral":null,"positiveCasesViral":null,"deathConfirmed":null,"deathProbable":null,"totalTestEncountersViral":383048,"totalTestsPeopleViral":213296,"totalTestsAntibody":null,"positiveTestsAntibody":null,"negativeTestsAntibody":null,"totalTestsPeopleAntibody":null,"positiveTestsPeopleAntibody":null,"negativeTestsPeopleAntibody":null,"totalTestsPeopleAntigen":null,"positiveTestsPeopleAntigen":null,"totalTestsAntigen":null,"positiveTestsAntigen":null,"fips":"11","positiveIncrease":14,"negativeIncrease":1875,"total":383048,"totalTestResultsIncrease":1889,"posNeg":383048,"deathIncrease":0,"hospitalizedIncrease":0,"hash":"fd987f689dff83271e6ea777f1381a1b1cb27c96","commercialScore":0,"negativeRegularScore":0,"negativeScore":0,"positiveScore":0,"score":0,"grade":""},{"date":20200927,"state":"DC","positive":15250,"probableCases":null,"negative":365909,"pending":null,"totalTestResultsSource":"totalTestEncountersViral","totalTestResults":381159,"hospitalizedCurrently":96,"hospitalizedCumulative":null,"inIcuCurrently":29,"inIcuCumulative":null,"onVentilatorCurrently":17,"onVentilatorCumulative":null,"recovered":12037,"dataQualityGrade":"A+","lastUpdateEt":"9/26/2020 00:00","dateModified":"2020-09-26T00:00:00Z","checkTimeEt":"09/25 20:00","death":624,"hospitalized":null,"dateChecked":"2020-09-26T00:00:00Z","totalTestsViral":null,"positiveTestsViral":null,"negativeTestsViral":null,"positiveCasesViral":null,"deathConfirmed":null,"deathProbable":null,"totalTestEncountersViral":381159,"totalTestsPeopleViral":212701,"totalTestsAntibody":null,"positiveTestsAntibody":null,"negativeTestsAntibody":null,"totalTestsPeopleAntibody":null,"positiveTestsPeopleAntibody":null,"negativeTestsPeopleAntibody":null,"totalTestsPeopleAntigen":null,"positiveTestsPeopleAntigen":null,"totalTestsAntigen":null,"positiveTestsAntigen":null,"fips":"11","positiveIncrease":35,"negativeIncrease":3145,"total":381159,"totalTestResultsIncrease":3180,"posNeg":381159,"deathIncrease":0,"hospitalizedIncrease":0,"hash":"511472174fd2e9753e12b6be13e4cc366fced631","commercialScore":0,"negativeRegularScore":0,"negativeScore":0,"positiveScore":0,"score":0,"grade":""},{"date":20200926,"state":"DC","positive":15215,"probableCases":null,"negative":362764,"pending":null,"totalTestResultsSource":"totalTestEncountersViral","totalTestResults":377979,"hospitalizedCurrently":101,"hospitalizedCumulative":null,"inIcuCurrently":25,"inIcuCumulative":null,"onVentilatorCurrently":17,"onVentilatorCumulative":null,"recovered":12029,"dataQualityGrade":"A+","lastUpdateEt":"9/25/2020 00:00","dateModified":"2020-09-25T00:00:00Z","checkTimeEt":"09/24 20:00","death":624,"hospitalized":null,"dateChecked":"2020-09-25T00:00:00Z","totalTestsViral":null,"positiveTestsViral":null,"negativeTestsViral":null,"positiveCasesViral":null,"deathConfirmed":null,"deathProbable":null,"totalTestEncountersViral":377979,"totalTestsPeopleViral":211599,"totalTestsAntibody":null,"positiveTestsAntibody":null,"negativeTestsAntibody":null,"totalTestsPeopleAntibody":null,"positiveTestsPeopleAntibody":null,"negativeTestsPeopleAntibody":null,"totalTestsPeopleAntigen":null,"positiveTestsPeopleAntigen":null,"totalTestsAntigen":null,"positiveTestsAntigen":null,"fips":"11","positiveIncrease":52,"negativeIncrease":4341,"total":377979,"totalTestResultsIncrease":4393,"posNeg":377979,"deathIncrease":1,"hospitalizedIncrease":0,"hash":"f78ac0fec09276feea0e5b9225d00c01a6b4a71e","commercialScore":0,"negativeRegularScore":0,"negativeScore":0,"positiveScore":0,"score":0,"grade":""},{"date":20200925,"state":"DC","positive":15163,"probableCases":null,"negative":358423,"pending":null,"totalTestResultsSource":"totalTestEncountersViral","totalTestResults":373586,"hospitalizedCurrently":101,"hospitalizedCumulative":null,"inIcuCurrently":29,"inIcuCumulative":null,"onVentilatorCurrently":17,"onVentilatorCumulative":null,"recovered":11990,"dataQualityGrade":"A+","lastUpdateEt":"9/24/2020 00:00","dateModified":"2020-09-24T00:00:00Z","checkTimeEt":"09/23 20:00","death":623,"hospitalized":null,"dateChecked":"2020-09-24T00:00:00Z","totalTestsViral":null,"positiveTestsViral":null,"negativeTestsViral":null,"positiveCasesViral":null,"deathConfirmed":null,"deathProbable":null,"totalTestEncountersViral":373586,"totalTestsPeopleViral":210143,"totalTestsAntibody":null,"positiveTestsAntibody":null,"negativeTestsAntibody":null,"totalTestsPeopleAntibody":null,"positiveTestsPeopleAntibody":null,"negativeTestsPeopleAntibody":null,"totalTestsPeopleAntigen":null,"positiveTestsPeopleAntigen":null,"totalTestsAntigen":null,"positiveTestsAntigen":null,"fips":"11","positiveIncrease":57,"negativeIncrease":5662,"total":373586,"totalTestResultsIncrease":5719,"posNeg":373586,"deathIncrease":2,"hospitalizedIncrease":0,"hash":"4b911a342704dcc01ee8fef1de7075930603d632","commercialScore":0,"negativeRegularScore":0,"negativeScore":0,"positiveScore":0,"score":0,"grade":""},{"date":20200924,"state":"DC","positive":15106,"probableCases":null,"negative":352761,"pending":null,"totalTestResultsSource":"totalTestEncountersViral","totalTestResults":367867,"hospitalizedCurrently":97,"hospitalizedCumulative":null,"inIcuCurrently":29,"inIcuCumulative":null,"onVentilatorCurrently":21,"onVentilatorCumulative":null,"recovered":11956,"dataQualityGrade":"A+","lastUpdateEt":"9/23/2020 00:00","dateModified":"2020-09-23T00:00:00Z","checkTimeEt":"09/22 20:00","death":621,"hospitalized":null,"dateChecked":"2020-09-23T00:00:00Z","totalTestsViral":null,"positiveTestsViral":null,"negativeTestsViral":null,"positiveCasesViral":null,"deathConfirmed":null,"deathProbable":null,"totalTestEncountersViral":367867,"totalTestsPeopleViral":208447,"totalTestsAntibody":null,"positiveTestsAntibody":null,"negativeTestsAntibody":null,"totalTestsPeopleAntibody":null,"positiveTestsPeopleAntibody":null,"negativeTestsPeopleAntibody":null,"totalTestsPeopleAntigen":null,"positiveTestsPeopleAntigen":null,"totalTestsAntigen":null,"positiveTestsAntigen":null,"fips":"11","positiveIncrease":56,"negativeIncrease":4363,"total":367867,"totalTestResultsIncrease":4419,"posNeg":367867,"deathIncrease":0,"hospitalizedIncrease":0,"hash":"2e7fb80ed5d64df572e634e865ca8261d656e8ff","commercialScore":0,"negativeRegularScore":0,"negativeScore":0,"positiveScore":0,"score":0,"grade":""},{"date":20200923,"state":"DC","positive":15050,"probableCases":null,"negative":348398,"pending":null,"totalTestResultsSource":"totalTestEncountersViral","totalTestResults":363448,"hospitalizedCurrently":92,"hospitalizedCumulative":null,"inIcuCurrently":26,"inIcuCumulative":null,"onVentilatorCurrently":17,"onVentilatorCumulative":null,"recovered":11929,"dataQualityGrade":"A+","lastUpdateEt":"9/22/2020 00:00","dateModified":"2020-09-22T00:00:00Z","checkTimeEt":"09/21 20:00","death":621,"hospitalized":null,"dateChecked":"2020-09-22T00:00:00Z","totalTestsViral":null,"positiveTestsViral":null,"negativeTestsViral":null,"positiveCasesViral":null,"deathConfirmed":null,"deathProbable":null,"totalTestEncountersViral":363448,"totalTestsPeopleViral":206817,"totalTestsAntibody":null,"positiveTestsAntibody":null,"negativeTestsAntibody":null,"totalTestsPeopleAntibody":null,"positiveTestsPeopleAntibody":null,"negativeTestsPeopleAntibody":null,"totalTestsPeopleAntigen":null,"positiveTestsPeopleAntigen":null,"totalTestsAntigen":null,"positiveTestsAntigen":null,"fips":"11","positiveIncrease":29,"negativeIncrease":1786,"total":363448,"totalTestResultsIncrease":1815,"posNeg":363448,"deathIncrease":0,"hospitalizedIncrease":0,"hash":"4fdbafe4b7be149919329ec26cf7032a59632cf4","commercialScore":0,"negativeRegularScore":0,"negativeScore":0,"positiveScore":0,"score":0,"grade":""},{"date":20200922,"state":"DC","positive":15021,"probableCases":null,"negative":346612,"pending":null,"totalTestResultsSource":"totalTestEncountersViral","totalTestResults":361633,"hospitalizedCurrently":95,"hospitalizedCumulative":null,"inIcuCurrently":22,"inIcuCumulative":null,"onVentilatorCurrently":19,"onVentilatorCumulative":null,"recovered":11886,"dataQualityGrade":"A+","lastUpdateEt":"9/21/2020 00:00","dateModified":"2020-09-21T00:00:00Z","checkTimeEt":"09/20 20:00","death":621,"hospitalized":null,"dateChecked":"2020-09-21T00:00:00Z","totalTestsViral":null,"positiveTestsViral":null,"negativeTestsViral":null,"positiveCasesViral":null,"deathConfirmed":null,"deathProbable":null,"totalTestEncountersViral":361633,"totalTestsPeopleViral":206165,"totalTestsAntibody":null,"positiveTestsAntibody":null,"negativeTestsAntibody":null,"totalTestsPeopleAntibody":null,"positiveTestsPeopleAntibody":null,"negativeTestsPeopleAntibody":null,"totalTestsPeopleAntigen":null,"positiveTestsPeopleAntigen":null,"totalTestsAntigen":null,"positiveTestsAntigen":null,"fips":"11","positiveIncrease":43,"negativeIncrease":3846,"total":361633,"totalTestResultsIncrease":3889,"posNeg":361633,"deathIncrease":0,"hospitalizedIncrease":0,"hash":"0a661f06c8898d0aaea6b2d8e28d8d051cdd7458","commercialScore":0,"negativeRegularScore":0,"negativeScore":0,"positiveScore":0,"score":0,"grade":""},{"date":20200921,"state":"DC","positive":14978,"probableCases":null,"negative":342766,"pending":null,"totalTestResultsSource":"totalTestEncountersViral","totalTestResults":357744,"hospitalizedCurrently":88,"hospitalizedCumulative":null,"inIcuCurrently":26,"inIcuCumulative":null,"onVentilatorCurrently":17,"onVentilatorCumulative":null,"recovered":11856,"dataQualityGrade":"A+","lastUpdateEt":"9/20/2020 00:00","dateModified":"2020-09-20T00:00:00Z","checkTimeEt":"09/19 20:00","death":621,"hospitalized":null,"dateChecked":"2020-09-20T00:00:00Z","totalTestsViral":null,"positiveTestsViral":null,"negativeTestsViral":null,"positiveCasesViral":null,"deathConfirmed":null,"deathProbable":null,"totalTestEncountersViral":357744,"totalTestsPeopleViral":204781,"totalTestsAntibody":null,"positiveTestsAntibody":null,"negativeTestsAntibody":null,"totalTestsPeopleAntibody":null,"positiveTestsPeopleAntibody":null,"negativeTestsPeopleAntibody":null,"totalTestsPeopleAntigen":null,"positiveTestsPeopleAntigen":null,"totalTestsAntigen":null,"positiveTestsAntigen":null,"fips":"11","positiveIncrease":23,"negativeIncrease":2577,"total":357744,"totalTestResultsIncrease":2600,"posNeg":357744,"deathIncrease":1,"hospitalizedIncrease":0,"hash":"16ea3fecae7615e7c29b4bae8d223144b79a6243","commercialScore":0,"negativeRegularScore":0,"negativeScore":0,"positiveScore":0,"score":0,"grade":""},{"date":20200920,"state":"DC","positive":14955,"probableCases":null,"negative":340189,"pending":null,"totalTestResultsSource":"totalTestEncountersViral","totalTestResults":355144,"hospitalizedCurrently":86,"hospitalizedCumulative":null,"inIcuCurrently":25,"inIcuCumulative":null,"onVentilatorCurrently":14,"onVentilatorCumulative":null,"recovered":11829,"dataQualityGrade":"A+","lastUpdateEt":"9/19/2020 00:00","dateModified":"2020-09-19T00:00:00Z","checkTimeEt":"09/18 20:00","death":620,"hospitalized":null,"dateChecked":"2020-09-19T00:00:00Z","totalTestsViral":null,"positiveTestsViral":null,"negativeTestsViral":null,"positiveCasesViral":null,"deathConfirmed":null,"deathProbable":null,"totalTestEncountersViral":355144,"totalTestsPeopleViral":204099,"totalTestsAntibody":null,"positiveTestsAntibody":null,"negativeTestsAntibody":null,"totalTestsPeopleAntibody":null,"positiveTestsPeopleAntibody":null,"negativeTestsPeopleAntibody":null,"totalTestsPeopleAntigen":null,"positiveTestsPeopleAntigen":null,"totalTestsAntigen":null,"positiveTestsAntigen":null,"fips":"11","positiveIncrease":53,"negativeIncrease":4214,"total":355144,"totalTestResultsIncrease":4267,"posNeg":355144,"deathIncrease":1,"hospitalizedIncrease":0,"hash":"aef07c56984fe81ac645288a8f8aaac800125e00","commercialScore":0,"negativeRegularScore":0,"negativeScore":0,"positiveScore":0,"score":0,"grade":""},{"date":20200919,"state":"DC","positive":14902,"probableCases":null,"negative":335975,"pending":null,"totalTestResultsSource":"totalTestEncountersViral","totalTestResults":350877,"hospitalizedCurrently":85,"hospitalizedCumulative":null,"inIcuCurrently":23,"inIcuCumulative":null,"onVentilatorCurrently":14,"onVentilatorCumulative":null,"recovered":11823,"dataQualityGrade":"A+","lastUpdateEt":"9/18/2020 00:00","dateModified":"2020-09-18T00:00:00Z","checkTimeEt":"09/17 20:00","death":619,"hospitalized":null,"dateChecked":"2020-09-18T00:00:00Z","totalTestsViral":null,"positiveTestsViral":null,"negativeTestsViral":null,"positiveCasesViral":null,"deathConfirmed":null,"deathProbable":null,"totalTestEncountersViral":350877,"totalTestsPeopleViral":202618,"totalTestsAntibody":null,"positiveTestsAntibody":null,"negativeTestsAntibody":null,"totalTestsPeopleAntibody":null,"positiveTestsPeopleAntibody":null,"negativeTestsPeopleAntibody":null,"totalTestsPeopleAntigen":null,"positiveTestsPeopleAntigen":null,"totalTestsAntigen":null,"positiveTestsAntigen":null,"fips":"11","positiveIncrease":50,"negativeIncrease":3709,"total":350877,"totalTestResultsIncrease":3759,"posNeg":350877,"deathIncrease":0,"hospitalizedIncrease":0,"hash":"a1067479b2509861ace1c2e1c1ea1e76e651ce41","commercialScore":0,"negativeRegularScore":0,"negativeScore":0,"positiveScore":0,"score":0,"grade":""},{"date":20200918,"state":"DC","positive":14852,"probableCases":null,"negative":332266,"pending":null,"totalTestResultsSource":"totalTestEncountersViral","totalTestResults":347118,"hospitalizedCurrently":91,"hospitalizedCumulative":null,"inIcuCurrently":24,"inIcuCumulative":null,"onVentilatorCurrently":13,"onVentilatorCumulative":null,"recovered":11802,"dataQualityGrade":"A+","lastUpdateEt":"9/17/2020 00:00","dateModified":"2020-09-17T00:00:00Z","checkTimeEt":"09/16 20:00","death":619,"hospitalized":null,"dateChecked":"2020-09-17T00:00:00Z","totalTestsViral":null,"positiveTestsViral":null,"negativeTestsViral":null,"positiveCasesViral":null,"deathConfirmed":null,"deathProbable":null,"totalTestEncountersViral":347118,"totalTestsPeopleViral":201379,"totalTestsAntibody":null,"positiveTestsAntibody":null,"negativeTestsAntibody":null,"totalTestsPeopleAntibody":null,"positiveTestsPeopleAntibody":null,"negativeTestsPeopleAntibody":null,"totalTestsPeopleAntigen":null,"positiveTestsPeopleAntigen":null,"totalTestsAntigen":null,"positiveTestsAntigen":null,"fips":"11","positiveIncrease":62,"negativeIncrease":5738,"total":347118,"totalTestResultsIncrease":5800,"posNeg":347118,"deathIncrease":0,"hospitalizedIncrease":0,"hash":"4a935d487609e4da562de481ebac26dd1f9fc7db","commercialScore":0,"negativeRegularScore":0,"negativeScore":0,"positiveScore":0,"score":0,"grade":""},{"date":20200917,"state":"DC","positive":14790,"probableCases":null,"negative":326528,"pending":null,"totalTestResultsSource":"totalTestEncountersViral","totalTestResults":341318,"hospitalizedCurrently":100,"hospitalizedCumulative":null,"inIcuCurrently":22,"inIcuCumulative":null,"onVentilatorCurrently":18,"onVentilatorCumulative":null,"recovered":11763,"dataQualityGrade":"A+","lastUpdateEt":"9/16/2020 00:00","dateModified":"2020-09-16T00:00:00Z","checkTimeEt":"09/15 20:00","death":619,"hospitalized":null,"dateChecked":"2020-09-16T00:00:00Z","totalTestsViral":null,"positiveTestsViral":null,"negativeTestsViral":null,"positiveCasesViral":null,"deathConfirmed":null,"deathProbable":null,"totalTestEncountersViral":341318,"totalTestsPeopleViral":199579,"totalTestsAntibody":null,"positiveTestsAntibody":null,"negativeTestsAntibody":null,"totalTestsPeopleAntibody":null,"positiveTestsPeopleAntibody":null,"negativeTestsPeopleAntibody":null,"totalTestsPeopleAntigen":null,"positiveTestsPeopleAntigen":null,"totalTestsAntigen":null,"positiveTestsAntigen":null,"fips":"11","positiveIncrease":47,"negativeIncrease":3030,"total":341318,"totalTestResultsIncrease":3077,"posNeg":341318,"deathIncrease":2,"hospitalizedIncrease":0,"hash":"86591ef7830496d23768a6a817a254d8704f2635","commercialScore":0,"negativeRegularScore":0,"negativeScore":0,"positiveScore":0,"score":0,"grade":""},{"date":20200916,"state":"DC","positive":14743,"probableCases":null,"negative":323498,"pending":null,"totalTestResultsSource":"totalTestEncountersViral","totalTestResults":338241,"hospitalizedCurrently":91,"hospitalizedCumulative":null,"inIcuCurrently":24,"inIcuCumulative":null,"onVentilatorCurrently":13,"onVentilatorCumulative":null,"recovered":11691,"dataQualityGrade":"A+","lastUpdateEt":"9/15/2020 00:00","dateModified":"2020-09-15T00:00:00Z","checkTimeEt":"09/14 20:00","death":617,"hospitalized":null,"dateChecked":"2020-09-15T00:00:00Z","totalTestsViral":null,"positiveTestsViral":null,"negativeTestsViral":null,"positiveCasesViral":null,"deathConfirmed":null,"deathProbable":null,"totalTestEncountersViral":338241,"totalTestsPeopleViral":198409,"totalTestsAntibody":null,"positiveTestsAntibody":null,"negativeTestsAntibody":null,"totalTestsPeopleAntibody":null,"positiveTestsPeopleAntibody":null,"negativeTestsPeopleAntibody":null,"totalTestsPeopleAntigen":null,"positiveTestsPeopleAntigen":null,"totalTestsAntigen":null,"positiveTestsAntigen":null,"fips":"11","positiveIncrease":56,"negativeIncrease":1905,"total":338241,"totalTestResultsIncrease":1961,"posNeg":338241,"deathIncrease":1,"hospitalizedIncrease":0,"hash":"3f16492ce0ef3fa47836b044210cfd5bd1f9be34","commercialScore":0,"negativeRegularScore":0,"negativeScore":0,"positiveScore":0,"score":0,"grade":""},{"date":20200915,"state":"DC","positive":14687,"probableCases":null,"negative":321593,"pending":null,"totalTestResultsSource":"totalTestEncountersViral","totalTestResults":336280,"hospitalizedCurrently":89,"hospitalizedCumulative":null,"inIcuCurrently":23,"inIcuCumulative":null,"onVentilatorCurrently":11,"onVentilatorCumulative":null,"recovered":11630,"dataQualityGrade":"A+","lastUpdateEt":"9/14/2020 00:00","dateModified":"2020-09-14T00:00:00Z","checkTimeEt":"09/13 20:00","death":616,"hospitalized":null,"dateChecked":"2020-09-14T00:00:00Z","totalTestsViral":null,"positiveTestsViral":null,"negativeTestsViral":null,"positiveCasesViral":null,"deathConfirmed":null,"deathProbable":null,"totalTestEncountersViral":336280,"totalTestsPeopleViral":197726,"totalTestsAntibody":null,"positiveTestsAntibody":null,"negativeTestsAntibody":null,"totalTestsPeopleAntibody":null,"positiveTestsPeopleAntibody":null,"negativeTestsPeopleAntibody":null,"totalTestsPeopleAntigen":null,"positiveTestsPeopleAntigen":null,"totalTestsAntigen":null,"positiveTestsAntigen":null,"fips":"11","positiveIncrease":65,"negativeIncrease":4067,"total":336280,"totalTestResultsIncrease":4132,"posNeg":336280,"deathIncrease":0,"hospitalizedIncrease":0,"hash":"c58144cb5efaf38f57615222e3d9c8c476012930","commercialScore":0,"negativeRegularScore":0,"negativeScore":0,"positiveScore":0,"score":0,"grade":""},{"date":20200914,"state":"DC","positive":14622,"probableCases":null,"negative":317526,"pending":null,"totalTestResultsSource":"totalTestEncountersViral","totalTestResults":332148,"hospitalizedCurrently":91,"hospitalizedCumulative":null,"inIcuCurrently":22,"inIcuCumulative":null,"onVentilatorCurrently":8,"onVentilatorCumulative":null,"recovered":11592,"dataQualityGrade":"A+","lastUpdateEt":"9/13/2020 00:00","dateModified":"2020-09-13T00:00:00Z","checkTimeEt":"09/12 20:00","death":616,"hospitalized":null,"dateChecked":"2020-09-13T00:00:00Z","totalTestsViral":null,"positiveTestsViral":null,"negativeTestsViral":null,"positiveCasesViral":null,"deathConfirmed":null,"deathProbable":null,"totalTestEncountersViral":332148,"totalTestsPeopleViral":195691,"totalTestsAntibody":null,"positiveTestsAntibody":null,"negativeTestsAntibody":null,"totalTestsPeopleAntibody":null,"positiveTestsPeopleAntibody":null,"negativeTestsPeopleAntibody":null,"totalTestsPeopleAntigen":null,"positiveTestsPeopleAntigen":null,"totalTestsAntigen":null,"positiveTestsAntigen":null,"fips":"11","positiveIncrease":30,"negativeIncrease":1477,"total":332148,"totalTestResultsIncrease":1507,"posNeg":332148,"deathIncrease":0,"hospitalizedIncrease":0,"hash":"e7d70b2d96478740144abcbb2ade8a054863bf17","commercialScore":0,"negativeRegularScore":0,"negativeScore":0,"positiveScore":0,"score":0,"grade":""},{"date":20200913,"state":"DC","positive":14592,"probableCases":null,"negative":316049,"pending":null,"totalTestResultsSource":"totalTestEncountersViral","totalTestResults":330641,"hospitalizedCurrently":88,"hospitalizedCumulative":null,"inIcuCurrently":23,"inIcuCumulative":null,"onVentilatorCurrently":11,"onVentilatorCumulative":null,"recovered":11574,"dataQualityGrade":"A+","lastUpdateEt":"9/12/2020 00:00","dateModified":"2020-09-12T00:00:00Z","checkTimeEt":"09/11 20:00","death":616,"hospitalized":null,"dateChecked":"2020-09-12T00:00:00Z","totalTestsViral":null,"positiveTestsViral":null,"negativeTestsViral":null,"positiveCasesViral":null,"deathConfirmed":null,"deathProbable":null,"totalTestEncountersViral":330641,"totalTestsPeopleViral":195160,"totalTestsAntibody":null,"positiveTestsAntibody":null,"negativeTestsAntibody":null,"totalTestsPeopleAntibody":null,"positiveTestsPeopleAntibody":null,"negativeTestsPeopleAntibody":null,"totalTestsPeopleAntigen":null,"positiveTestsPeopleAntigen":null,"totalTestsAntigen":null,"positiveTestsAntigen":null,"fips":"11","positiveIncrease":40,"negativeIncrease":3164,"total":330641,"totalTestResultsIncrease":3204,"posNeg":330641,"deathIncrease":0,"hospitalizedIncrease":0,"hash":"f3f2d767454efc77ada7015d8265ec574afe07b4","commercialScore":0,"negativeRegularScore":0,"negativeScore":0,"positiveScore":0,"score":0,"grade":""},{"date":20200912,"state":"DC","positive":14552,"probableCases":null,"negative":312885,"pending":null,"totalTestResultsSource":"totalTestEncountersViral","totalTestResults":327437,"hospitalizedCurrently":98,"hospitalizedCumulative":null,"inIcuCurrently":24,"inIcuCumulative":null,"onVentilatorCurrently":12,"onVentilatorCumulative":null,"recovered":11561,"dataQualityGrade":"A+","lastUpdateEt":"9/11/2020 00:00","dateModified":"2020-09-11T00:00:00Z","checkTimeEt":"09/10 20:00","death":616,"hospitalized":null,"dateChecked":"2020-09-11T00:00:00Z","totalTestsViral":null,"positiveTestsViral":null,"negativeTestsViral":null,"positiveCasesViral":null,"deathConfirmed":null,"deathProbable":null,"totalTestEncountersViral":327437,"totalTestsPeopleViral":194043,"totalTestsAntibody":null,"positiveTestsAntibody":null,"negativeTestsAntibody":null,"totalTestsPeopleAntibody":null,"positiveTestsPeopleAntibody":null,"negativeTestsPeopleAntibody":null,"totalTestsPeopleAntigen":null,"positiveTestsPeopleAntigen":null,"totalTestsAntigen":null,"positiveTestsAntigen":null,"fips":"11","positiveIncrease":59,"negativeIncrease":5942,"total":327437,"totalTestResultsIncrease":6001,"posNeg":327437,"deathIncrease":0,"hospitalizedIncrease":0,"hash":"a7a52845cbe065c2d3914cc77198412728ec3600","commercialScore":0,"negativeRegularScore":0,"negativeScore":0,"positiveScore":0,"score":0,"grade":""},{"date":20200911,"state":"DC","positive":14493,"probableCases":null,"negative":306943,"pending":null,"totalTestResultsSource":"totalTestEncountersViral","totalTestResults":321436,"hospitalizedCurrently":95,"hospitalizedCumulative":null,"inIcuCurrently":25,"inIcuCumulative":null,"onVentilatorCurrently":8,"onVentilatorCumulative":null,"recovered":11526,"dataQualityGrade":"A+","lastUpdateEt":"9/10/2020 00:00","dateModified":"2020-09-10T00:00:00Z","checkTimeEt":"09/09 20:00","death":616,"hospitalized":null,"dateChecked":"2020-09-10T00:00:00Z","totalTestsViral":null,"positiveTestsViral":null,"negativeTestsViral":null,"positiveCasesViral":null,"deathConfirmed":null,"deathProbable":null,"totalTestEncountersViral":321436,"totalTestsPeopleViral":192235,"totalTestsAntibody":null,"positiveTestsAntibody":null,"negativeTestsAntibody":null,"totalTestsPeopleAntibody":null,"positiveTestsPeopleAntibody":null,"negativeTestsPeopleAntibody":null,"totalTestsPeopleAntigen":null,"positiveTestsPeopleAntigen":null,"totalTestsAntigen":null,"positiveTestsAntigen":null,"fips":"11","positiveIncrease":81,"negativeIncrease":2167,"total":321436,"totalTestResultsIncrease":2248,"posNeg":321436,"deathIncrease":0,"hospitalizedIncrease":0,"hash":"b712839ece7e4224226fe648366e75b169070ba6","commercialScore":0,"negativeRegularScore":0,"negativeScore":0,"positiveScore":0,"score":0,"grade":""},{"date":20200910,"state":"DC","positive":14412,"probableCases":null,"negative":304776,"pending":null,"totalTestResultsSource":"totalTestEncountersViral","totalTestResults":319188,"hospitalizedCurrently":87,"hospitalizedCumulative":null,"inIcuCurrently":20,"inIcuCumulative":null,"onVentilatorCurrently":9,"onVentilatorCumulative":null,"recovered":11498,"dataQualityGrade":"A+","lastUpdateEt":"9/9/2020 00:00","dateModified":"2020-09-09T00:00:00Z","checkTimeEt":"09/08 20:00","death":616,"hospitalized":null,"dateChecked":"2020-09-09T00:00:00Z","totalTestsViral":null,"positiveTestsViral":null,"negativeTestsViral":null,"positiveCasesViral":null,"deathConfirmed":null,"deathProbable":null,"totalTestEncountersViral":319188,"totalTestsPeopleViral":190996,"totalTestsAntibody":null,"positiveTestsAntibody":null,"negativeTestsAntibody":null,"totalTestsPeopleAntibody":null,"positiveTestsPeopleAntibody":null,"negativeTestsPeopleAntibody":null,"totalTestsPeopleAntigen":null,"positiveTestsPeopleAntigen":null,"totalTestsAntigen":null,"positiveTestsAntigen":null,"fips":"11","positiveIncrease":25,"negativeIncrease":1503,"total":319188,"totalTestResultsIncrease":1528,"posNeg":319188,"deathIncrease":1,"hospitalizedIncrease":0,"hash":"83204dd9f6bf4558a9f5295691afcba79805b03d","commercialScore":0,"negativeRegularScore":0,"negativeScore":0,"positiveScore":0,"score":0,"grade":""},{"date":20200909,"state":"DC","positive":14387,"probableCases":null,"negative":303273,"pending":null,"totalTestResultsSource":"totalTestEncountersViral","totalTestResults":317660,"hospitalizedCurrently":93,"hospitalizedCumulative":null,"inIcuCurrently":21,"inIcuCumulative":null,"onVentilatorCurrently":11,"onVentilatorCumulative":null,"recovered":11452,"dataQualityGrade":"A+","lastUpdateEt":"9/8/2020 00:00","dateModified":"2020-09-08T00:00:00Z","checkTimeEt":"09/07 20:00","death":615,"hospitalized":null,"dateChecked":"2020-09-08T00:00:00Z","totalTestsViral":null,"positiveTestsViral":null,"negativeTestsViral":null,"positiveCasesViral":null,"deathConfirmed":null,"deathProbable":null,"totalTestEncountersViral":317660,"totalTestsPeopleViral":190735,"totalTestsAntibody":null,"positiveTestsAntibody":null,"negativeTestsAntibody":null,"totalTestsPeopleAntibody":null,"positiveTestsPeopleAntibody":null,"negativeTestsPeopleAntibody":null,"totalTestsPeopleAntigen":null,"positiveTestsPeopleAntigen":null,"totalTestsAntigen":null,"positiveTestsAntigen":null,"fips":"11","positiveIncrease":25,"negativeIncrease":1037,"total":317660,"totalTestResultsIncrease":1062,"posNeg":317660,"deathIncrease":4,"hospitalizedIncrease":0,"hash":"23c917d928c0965219d0fa54ef40c05aa7398d5c","commercialScore":0,"negativeRegularScore":0,"negativeScore":0,"positiveScore":0,"score":0,"grade":""},{"date":20200908,"state":"DC","positive":14362,"probableCases":null,"negative":302236,"pending":null,"totalTestResultsSource":"totalTestEncountersViral","totalTestResults":316598,"hospitalizedCurrently":85,"hospitalizedCumulative":null,"inIcuCurrently":21,"inIcuCumulative":null,"onVentilatorCurrently":7,"onVentilatorCumulative":null,"recovered":11414,"dataQualityGrade":"A+","lastUpdateEt":"9/7/2020 00:00","dateModified":"2020-09-07T00:00:00Z","checkTimeEt":"09/06 20:00","death":611,"hospitalized":null,"dateChecked":"2020-09-07T00:00:00Z","totalTestsViral":null,"positiveTestsViral":null,"negativeTestsViral":null,"positiveCasesViral":null,"deathConfirmed":null,"deathProbable":null,"totalTestEncountersViral":316598,"totalTestsPeopleViral":190316,"totalTestsAntibody":null,"positiveTestsAntibody":null,"negativeTestsAntibody":null,"totalTestsPeopleAntibody":null,"positiveTestsPeopleAntibody":null,"negativeTestsPeopleAntibody":null,"totalTestsPeopleAntigen":null,"positiveTestsPeopleAntigen":null,"totalTestsAntigen":null,"positiveTestsAntigen":null,"fips":"11","positiveIncrease":47,"negativeIncrease":2836,"total":316598,"totalTestResultsIncrease":2883,"posNeg":316598,"deathIncrease":0,"hospitalizedIncrease":0,"hash":"5187fe8eb503f907ee045e93ea5bd1c96c3f81b2","commercialScore":0,"negativeRegularScore":0,"negativeScore":0,"positiveScore":0,"score":0,"grade":""},{"date":20200907,"state":"DC","positive":14315,"probableCases":null,"negative":299400,"pending":null,"totalTestResultsSource":"totalTestEncountersViral","totalTestResults":313715,"hospitalizedCurrently":85,"hospitalizedCumulative":null,"inIcuCurrently":23,"inIcuCumulative":null,"onVentilatorCurrently":10,"onVentilatorCumulative":null,"recovered":11366,"dataQualityGrade":"A+","lastUpdateEt":"9/6/2020 00:00","dateModified":"2020-09-06T00:00:00Z","checkTimeEt":"09/05 20:00","death":611,"hospitalized":null,"dateChecked":"2020-09-06T00:00:00Z","totalTestsViral":null,"positiveTestsViral":null,"negativeTestsViral":null,"positiveCasesViral":null,"deathConfirmed":null,"deathProbable":null,"totalTestEncountersViral":313715,"totalTestsPeopleViral":189267,"totalTestsAntibody":null,"positiveTestsAntibody":null,"negativeTestsAntibody":null,"totalTestsPeopleAntibody":null,"positiveTestsPeopleAntibody":null,"negativeTestsPeopleAntibody":null,"totalTestsPeopleAntigen":null,"positiveTestsPeopleAntigen":null,"totalTestsAntigen":null,"positiveTestsAntigen":null,"fips":"11","positiveIncrease":36,"negativeIncrease":2169,"total":313715,"totalTestResultsIncrease":2205,"posNeg":313715,"deathIncrease":0,"hospitalizedIncrease":0,"hash":"bb701e276add6a13de0f284bd015c2c091862394","commercialScore":0,"negativeRegularScore":0,"negativeScore":0,"positiveScore":0,"score":0,"grade":""},{"date":20200906,"state":"DC","positive":14279,"probableCases":null,"negative":297231,"pending":null,"totalTestResultsSource":"totalTestEncountersViral","totalTestResults":311510,"hospitalizedCurrently":80,"hospitalizedCumulative":null,"inIcuCurrently":24,"inIcuCumulative":null,"onVentilatorCurrently":10,"onVentilatorCumulative":null,"recovered":11355,"dataQualityGrade":"A+","lastUpdateEt":"9/5/2020 00:00","dateModified":"2020-09-05T00:00:00Z","checkTimeEt":"09/04 20:00","death":611,"hospitalized":null,"dateChecked":"2020-09-05T00:00:00Z","totalTestsViral":null,"positiveTestsViral":null,"negativeTestsViral":null,"positiveCasesViral":null,"deathConfirmed":null,"deathProbable":null,"totalTestEncountersViral":311510,"totalTestsPeopleViral":187619,"totalTestsAntibody":null,"positiveTestsAntibody":null,"negativeTestsAntibody":null,"totalTestsPeopleAntibody":null,"positiveTestsPeopleAntibody":null,"negativeTestsPeopleAntibody":null,"totalTestsPeopleAntigen":null,"positiveTestsPeopleAntigen":null,"totalTestsAntigen":null,"positiveTestsAntigen":null,"fips":"11","positiveIncrease":41,"negativeIncrease":3605,"total":311510,"totalTestResultsIncrease":3646,"posNeg":311510,"deathIncrease":0,"hospitalizedIncrease":0,"hash":"f3945f2008757947d5e05310f1811d355f010c3e","commercialScore":0,"negativeRegularScore":0,"negativeScore":0,"positiveScore":0,"score":0,"grade":""},{"date":20200905,"state":"DC","positive":14238,"probableCases":null,"negative":293626,"pending":null,"totalTestResultsSource":"totalTestEncountersViral","totalTestResults":307864,"hospitalizedCurrently":80,"hospitalizedCumulative":null,"inIcuCurrently":22,"inIcuCumulative":null,"onVentilatorCurrently":16,"onVentilatorCumulative":null,"recovered":11323,"dataQualityGrade":"A+","lastUpdateEt":"9/4/2020 00:00","dateModified":"2020-09-04T00:00:00Z","checkTimeEt":"09/03 20:00","death":611,"hospitalized":null,"dateChecked":"2020-09-04T00:00:00Z","totalTestsViral":null,"positiveTestsViral":null,"negativeTestsViral":null,"positiveCasesViral":null,"deathConfirmed":null,"deathProbable":null,"totalTestEncountersViral":307864,"totalTestsPeopleViral":186236,"totalTestsAntibody":null,"positiveTestsAntibody":null,"negativeTestsAntibody":null,"totalTestsPeopleAntibody":null,"positiveTestsPeopleAntibody":null,"negativeTestsPeopleAntibody":null,"totalTestsPeopleAntigen":null,"positiveTestsPeopleAntigen":null,"totalTestsAntigen":null,"positiveTestsAntigen":null,"fips":"11","positiveIncrease":52,"negativeIncrease":4461,"total":307864,"totalTestResultsIncrease":4513,"posNeg":307864,"deathIncrease":0,"hospitalizedIncrease":0,"hash":"381d6da4c0b90ae19baa513701fddc0f1ce23e94","commercialScore":0,"negativeRegularScore":0,"negativeScore":0,"positiveScore":0,"score":0,"grade":""},{"date":20200904,"state":"DC","positive":14186,"probableCases":null,"negative":289165,"pending":null,"totalTestResultsSource":"totalTestEncountersViral","totalTestResults":303351,"hospitalizedCurrently":75,"hospitalizedCumulative":null,"inIcuCurrently":23,"inIcuCumulative":null,"onVentilatorCurrently":5,"onVentilatorCumulative":null,"recovered":11297,"dataQualityGrade":"A+","lastUpdateEt":"9/3/2020 00:00","dateModified":"2020-09-03T00:00:00Z","checkTimeEt":"09/02 20:00","death":611,"hospitalized":null,"dateChecked":"2020-09-03T00:00:00Z","totalTestsViral":null,"positiveTestsViral":null,"negativeTestsViral":null,"positiveCasesViral":null,"deathConfirmed":null,"deathProbable":null,"totalTestEncountersViral":303351,"totalTestsPeopleViral":184919,"totalTestsAntibody":null,"positiveTestsAntibody":null,"negativeTestsAntibody":null,"totalTestsPeopleAntibody":null,"positiveTestsPeopleAntibody":null,"negativeTestsPeopleAntibody":null,"totalTestsPeopleAntigen":null,"positiveTestsPeopleAntigen":null,"totalTestsAntigen":null,"positiveTestsAntigen":null,"fips":"11","positiveIncrease":51,"negativeIncrease":4541,"total":303351,"totalTestResultsIncrease":4592,"posNeg":303351,"deathIncrease":2,"hospitalizedIncrease":0,"hash":"053ce19a2b548e9aaf8c0e5b1541ab67e47ecbbd","commercialScore":0,"negativeRegularScore":0,"negativeScore":0,"positiveScore":0,"score":0,"grade":""},{"date":20200903,"state":"DC","positive":14135,"probableCases":null,"negative":284624,"pending":null,"totalTestResultsSource":"totalTestEncountersViral","totalTestResults":298759,"hospitalizedCurrently":76,"hospitalizedCumulative":null,"inIcuCurrently":23,"inIcuCumulative":null,"onVentilatorCurrently":12,"onVentilatorCumulative":null,"recovered":11254,"dataQualityGrade":"A+","lastUpdateEt":"9/2/2020 00:00","dateModified":"2020-09-02T00:00:00Z","checkTimeEt":"09/01 20:00","death":609,"hospitalized":null,"dateChecked":"2020-09-02T00:00:00Z","totalTestsViral":null,"positiveTestsViral":null,"negativeTestsViral":null,"positiveCasesViral":null,"deathConfirmed":null,"deathProbable":null,"totalTestEncountersViral":298759,"totalTestsPeopleViral":182922,"totalTestsAntibody":null,"positiveTestsAntibody":null,"negativeTestsAntibody":null,"totalTestsPeopleAntibody":null,"positiveTestsPeopleAntibody":null,"negativeTestsPeopleAntibody":null,"totalTestsPeopleAntigen":null,"positiveTestsPeopleAntigen":null,"totalTestsAntigen":null,"positiveTestsAntigen":null,"fips":"11","positiveIncrease":58,"negativeIncrease":3904,"total":298759,"totalTestResultsIncrease":3962,"posNeg":298759,"deathIncrease":1,"hospitalizedIncrease":0,"hash":"c094b523b82249c601586a028f83d168ebd504cb","commercialScore":0,"negativeRegularScore":0,"negativeScore":0,"positiveScore":0,"score":0,"grade":""},{"date":20200902,"state":"DC","positive":14077,"probableCases":null,"negative":280720,"pending":null,"totalTestResultsSource":"totalTestEncountersViral","totalTestResults":294797,"hospitalizedCurrently":73,"hospitalizedCumulative":null,"inIcuCurrently":22,"inIcuCumulative":null,"onVentilatorCurrently":8,"onVentilatorCumulative":null,"recovered":11211,"dataQualityGrade":"A+","lastUpdateEt":"9/1/2020 00:00","dateModified":"2020-09-01T00:00:00Z","checkTimeEt":"08/31 20:00","death":608,"hospitalized":null,"dateChecked":"2020-09-01T00:00:00Z","totalTestsViral":null,"positiveTestsViral":null,"negativeTestsViral":null,"positiveCasesViral":null,"deathConfirmed":null,"deathProbable":null,"totalTestEncountersViral":294797,"totalTestsPeopleViral":181300,"totalTestsAntibody":null,"positiveTestsAntibody":null,"negativeTestsAntibody":null,"totalTestsPeopleAntibody":null,"positiveTestsPeopleAntibody":null,"negativeTestsPeopleAntibody":null,"totalTestsPeopleAntigen":null,"positiveTestsPeopleAntigen":null,"totalTestsAntigen":null,"positiveTestsAntigen":null,"fips":"11","positiveIncrease":28,"negativeIncrease":1925,"total":294797,"totalTestResultsIncrease":1953,"posNeg":294797,"deathIncrease":1,"hospitalizedIncrease":0,"hash":"9ab5249375aef41f72bb11970cd5bb59af1a101f","commercialScore":0,"negativeRegularScore":0,"negativeScore":0,"positiveScore":0,"score":0,"grade":""},{"date":20200901,"state":"DC","positive":14049,"probableCases":null,"negative":278795,"pending":null,"totalTestResultsSource":"totalTestEncountersViral","totalTestResults":292844,"hospitalizedCurrently":71,"hospitalizedCumulative":null,"inIcuCurrently":22,"inIcuCumulative":null,"onVentilatorCurrently":8,"onVentilatorCumulative":null,"recovered":11150,"dataQualityGrade":"A+","lastUpdateEt":"8/31/2020 00:00","dateModified":"2020-08-31T00:00:00Z","checkTimeEt":"08/30 20:00","death":607,"hospitalized":null,"dateChecked":"2020-08-31T00:00:00Z","totalTestsViral":null,"positiveTestsViral":null,"negativeTestsViral":null,"positiveCasesViral":null,"deathConfirmed":null,"deathProbable":null,"totalTestEncountersViral":292844,"totalTestsPeopleViral":180494,"totalTestsAntibody":null,"positiveTestsAntibody":null,"negativeTestsAntibody":null,"totalTestsPeopleAntibody":null,"positiveTestsPeopleAntibody":null,"negativeTestsPeopleAntibody":null,"totalTestsPeopleAntigen":null,"positiveTestsPeopleAntigen":null,"totalTestsAntigen":null,"positiveTestsAntigen":null,"fips":"11","positiveIncrease":57,"negativeIncrease":2105,"total":292844,"totalTestResultsIncrease":2162,"posNeg":292844,"deathIncrease":0,"hospitalizedIncrease":0,"hash":"ea8f971edb3348392cb42d0d8290e683a9558c84","commercialScore":0,"negativeRegularScore":0,"negativeScore":0,"positiveScore":0,"score":0,"grade":""},{"date":20200831,"state":"DC","positive":13992,"probableCases":null,"negative":276690,"pending":null,"totalTestResultsSource":"totalTestEncountersViral","totalTestResults":290682,"hospitalizedCurrently":70,"hospitalizedCumulative":null,"inIcuCurrently":21,"inIcuCumulative":null,"onVentilatorCurrently":8,"onVentilatorCumulative":null,"recovered":11105,"dataQualityGrade":"A+","lastUpdateEt":"8/30/2020 00:00","dateModified":"2020-08-30T00:00:00Z","checkTimeEt":"08/29 20:00","death":607,"hospitalized":null,"dateChecked":"2020-08-30T00:00:00Z","totalTestsViral":null,"positiveTestsViral":null,"negativeTestsViral":null,"positiveCasesViral":null,"deathConfirmed":null,"deathProbable":null,"totalTestEncountersViral":290682,"totalTestsPeopleViral":179339,"totalTestsAntibody":null,"positiveTestsAntibody":null,"negativeTestsAntibody":null,"totalTestsPeopleAntibody":null,"positiveTestsPeopleAntibody":null,"negativeTestsPeopleAntibody":null,"totalTestsPeopleAntigen":null,"positiveTestsPeopleAntigen":null,"totalTestsAntigen":null,"positiveTestsAntigen":null,"fips":"11","positiveIncrease":33,"negativeIncrease":2560,"total":290682,"totalTestResultsIncrease":2593,"posNeg":290682,"deathIncrease":1,"hospitalizedIncrease":0,"hash":"2620b3be3aaf2c118db6686d36b1caf6975950c9","commercialScore":0,"negativeRegularScore":0,"negativeScore":0,"positiveScore":0,"score":0,"grade":""},{"date":20200830,"state":"DC","positive":13959,"probableCases":null,"negative":274130,"pending":null,"totalTestResultsSource":"totalTestEncountersViral","totalTestResults":288089,"hospitalizedCurrently":69,"hospitalizedCumulative":null,"inIcuCurrently":24,"inIcuCumulative":null,"onVentilatorCurrently":10,"onVentilatorCumulative":null,"recovered":11087,"dataQualityGrade":"A+","lastUpdateEt":"8/29/2020 20:30","dateModified":"2020-08-29T20:30:00Z","checkTimeEt":"08/29 16:30","death":606,"hospitalized":null,"dateChecked":"2020-08-29T20:30:00Z","totalTestsViral":null,"positiveTestsViral":null,"negativeTestsViral":null,"positiveCasesViral":null,"deathConfirmed":null,"deathProbable":null,"totalTestEncountersViral":288089,"totalTestsPeopleViral":178083,"totalTestsAntibody":null,"positiveTestsAntibody":null,"negativeTestsAntibody":null,"totalTestsPeopleAntibody":null,"positiveTestsPeopleAntibody":null,"negativeTestsPeopleAntibody":null,"totalTestsPeopleAntigen":null,"positiveTestsPeopleAntigen":null,"totalTestsAntigen":null,"positiveTestsAntigen":null,"fips":"11","positiveIncrease":34,"negativeIncrease":2299,"total":288089,"totalTestResultsIncrease":2333,"posNeg":288089,"deathIncrease":1,"hospitalizedIncrease":0,"hash":"27306f5e86ffde921c87725b4e76c2dedfcf1fac","commercialScore":0,"negativeRegularScore":0,"negativeScore":0,"positiveScore":0,"score":0,"grade":""},{"date":20200829,"state":"DC","positive":13925,"probableCases":null,"negative":271831,"pending":null,"totalTestResultsSource":"totalTestEncountersViral","totalTestResults":285756,"hospitalizedCurrently":76,"hospitalizedCumulative":null,"inIcuCurrently":25,"inIcuCumulative":null,"onVentilatorCurrently":13,"onVentilatorCumulative":null,"recovered":11046,"dataQualityGrade":"A+","lastUpdateEt":"8/28/2020 00:00","dateModified":"2020-08-28T00:00:00Z","checkTimeEt":"08/27 20:00","death":605,"hospitalized":null,"dateChecked":"2020-08-28T00:00:00Z","totalTestsViral":null,"positiveTestsViral":null,"negativeTestsViral":null,"positiveCasesViral":null,"deathConfirmed":null,"deathProbable":null,"totalTestEncountersViral":285756,"totalTestsPeopleViral":177109,"totalTestsAntibody":null,"positiveTestsAntibody":null,"negativeTestsAntibody":null,"totalTestsPeopleAntibody":null,"positiveTestsPeopleAntibody":null,"negativeTestsPeopleAntibody":null,"totalTestsPeopleAntigen":null,"positiveTestsPeopleAntigen":null,"totalTestsAntigen":null,"positiveTestsAntigen":null,"fips":"11","positiveIncrease":74,"negativeIncrease":4133,"total":285756,"totalTestResultsIncrease":4207,"posNeg":285756,"deathIncrease":0,"hospitalizedIncrease":0,"hash":"2fa873aa79f9a19ca98ffdafff3b0672f0c15c21","commercialScore":0,"negativeRegularScore":0,"negativeScore":0,"positiveScore":0,"score":0,"grade":""},{"date":20200828,"state":"DC","positive":13851,"probableCases":null,"negative":267698,"pending":null,"totalTestResultsSource":"totalTestEncountersViral","totalTestResults":281549,"hospitalizedCurrently":83,"hospitalizedCumulative":null,"inIcuCurrently":22,"inIcuCumulative":null,"onVentilatorCurrently":10,"onVentilatorCumulative":null,"recovered":11010,"dataQualityGrade":"A+","lastUpdateEt":"8/27/2020 00:00","dateModified":"2020-08-27T00:00:00Z","checkTimeEt":"08/26 20:00","death":605,"hospitalized":null,"dateChecked":"2020-08-27T00:00:00Z","totalTestsViral":null,"positiveTestsViral":null,"negativeTestsViral":null,"positiveCasesViral":null,"deathConfirmed":null,"deathProbable":null,"totalTestEncountersViral":281549,"totalTestsPeopleViral":175106,"totalTestsAntibody":null,"positiveTestsAntibody":null,"negativeTestsAntibody":null,"totalTestsPeopleAntibody":null,"positiveTestsPeopleAntibody":null,"negativeTestsPeopleAntibody":null,"totalTestsPeopleAntigen":null,"positiveTestsPeopleAntigen":null,"totalTestsAntigen":null,"positiveTestsAntigen":null,"fips":"11","positiveIncrease":57,"negativeIncrease":4788,"total":281549,"totalTestResultsIncrease":4845,"posNeg":281549,"deathIncrease":0,"hospitalizedIncrease":0,"hash":"a7e8e598255f476a6c382aa16b6b873501056743","commercialScore":0,"negativeRegularScore":0,"negativeScore":0,"positiveScore":0,"score":0,"grade":""},{"date":20200827,"state":"DC","positive":13794,"probableCases":null,"negative":262910,"pending":null,"totalTestResultsSource":"totalTestEncountersViral","totalTestResults":276704,"hospitalizedCurrently":83,"hospitalizedCumulative":null,"inIcuCurrently":24,"inIcuCumulative":null,"onVentilatorCurrently":10,"onVentilatorCumulative":null,"recovered":10986,"dataQualityGrade":"A+","lastUpdateEt":"8/26/2020 00:00","dateModified":"2020-08-26T00:00:00Z","checkTimeEt":"08/25 20:00","death":605,"hospitalized":null,"dateChecked":"2020-08-26T00:00:00Z","totalTestsViral":null,"positiveTestsViral":null,"negativeTestsViral":null,"positiveCasesViral":null,"deathConfirmed":null,"deathProbable":null,"totalTestEncountersViral":276704,"totalTestsPeopleViral":172898,"totalTestsAntibody":null,"positiveTestsAntibody":null,"negativeTestsAntibody":null,"totalTestsPeopleAntibody":null,"positiveTestsPeopleAntibody":null,"negativeTestsPeopleAntibody":null,"totalTestsPeopleAntigen":null,"positiveTestsPeopleAntigen":null,"totalTestsAntigen":null,"positiveTestsAntigen":null,"fips":"11","positiveIncrease":72,"negativeIncrease":2884,"total":276704,"totalTestResultsIncrease":2956,"posNeg":276704,"deathIncrease":0,"hospitalizedIncrease":0,"hash":"de60da565ab7a08759bc757f12955dd6b3a5713f","commercialScore":0,"negativeRegularScore":0,"negativeScore":0,"positiveScore":0,"score":0,"grade":""},{"date":20200826,"state":"DC","positive":13722,"probableCases":null,"negative":260026,"pending":null,"totalTestResultsSource":"totalTestEncountersViral","totalTestResults":273748,"hospitalizedCurrently":77,"hospitalizedCumulative":null,"inIcuCurrently":25,"inIcuCumulative":null,"onVentilatorCurrently":13,"onVentilatorCumulative":null,"recovered":10923,"dataQualityGrade":"A+","lastUpdateEt":"8/25/2020 00:00","dateModified":"2020-08-25T00:00:00Z","checkTimeEt":"08/24 20:00","death":605,"hospitalized":null,"dateChecked":"2020-08-25T00:00:00Z","totalTestsViral":null,"positiveTestsViral":null,"negativeTestsViral":null,"positiveCasesViral":null,"deathConfirmed":null,"deathProbable":null,"totalTestEncountersViral":273748,"totalTestsPeopleViral":171613,"totalTestsAntibody":null,"positiveTestsAntibody":null,"negativeTestsAntibody":null,"totalTestsPeopleAntibody":null,"positiveTestsPeopleAntibody":null,"negativeTestsPeopleAntibody":null,"totalTestsPeopleAntigen":null,"positiveTestsPeopleAntigen":null,"totalTestsAntigen":null,"positiveTestsAntigen":null,"fips":"11","positiveIncrease":38,"negativeIncrease":2088,"total":273748,"totalTestResultsIncrease":2126,"posNeg":273748,"deathIncrease":1,"hospitalizedIncrease":0,"hash":"e51aef07ce9788691aaf7be00ef1554ed5069fa3","commercialScore":0,"negativeRegularScore":0,"negativeScore":0,"positiveScore":0,"score":0,"grade":""},{"date":20200825,"state":"DC","positive":13684,"probableCases":null,"negative":257938,"pending":null,"totalTestResultsSource":"totalTestEncountersViral","totalTestResults":271622,"hospitalizedCurrently":87,"hospitalizedCumulative":null,"inIcuCurrently":28,"inIcuCumulative":null,"onVentilatorCurrently":12,"onVentilatorCumulative":null,"recovered":10885,"dataQualityGrade":"A+","lastUpdateEt":"8/24/2020 00:00","dateModified":"2020-08-24T00:00:00Z","checkTimeEt":"08/23 20:00","death":604,"hospitalized":null,"dateChecked":"2020-08-24T00:00:00Z","totalTestsViral":null,"positiveTestsViral":null,"negativeTestsViral":null,"positiveCasesViral":null,"deathConfirmed":null,"deathProbable":null,"totalTestEncountersViral":271622,"totalTestsPeopleViral":170622,"totalTestsAntibody":null,"positiveTestsAntibody":null,"negativeTestsAntibody":null,"totalTestsPeopleAntibody":null,"positiveTestsPeopleAntibody":null,"negativeTestsPeopleAntibody":null,"totalTestsPeopleAntigen":null,"positiveTestsPeopleAntigen":null,"totalTestsAntigen":null,"positiveTestsAntigen":null,"fips":"11","positiveIncrease":45,"negativeIncrease":2176,"total":271622,"totalTestResultsIncrease":2221,"posNeg":271622,"deathIncrease":0,"hospitalizedIncrease":0,"hash":"a49595c56e5a7b12254765d016fa3cf3ebbf980f","commercialScore":0,"negativeRegularScore":0,"negativeScore":0,"positiveScore":0,"score":0,"grade":""},{"date":20200824,"state":"DC","positive":13639,"probableCases":null,"negative":255762,"pending":null,"totalTestResultsSource":"totalTestEncountersViral","totalTestResults":269401,"hospitalizedCurrently":85,"hospitalizedCumulative":null,"inIcuCurrently":26,"inIcuCumulative":null,"onVentilatorCurrently":13,"onVentilatorCumulative":null,"recovered":10835,"dataQualityGrade":"A+","lastUpdateEt":"8/23/2020 00:00","dateModified":"2020-08-23T00:00:00Z","checkTimeEt":"08/22 20:00","death":604,"hospitalized":null,"dateChecked":"2020-08-23T00:00:00Z","totalTestsViral":null,"positiveTestsViral":null,"negativeTestsViral":null,"positiveCasesViral":null,"deathConfirmed":null,"deathProbable":null,"totalTestEncountersViral":269401,"totalTestsPeopleViral":169346,"totalTestsAntibody":null,"positiveTestsAntibody":null,"negativeTestsAntibody":null,"totalTestsPeopleAntibody":null,"positiveTestsPeopleAntibody":null,"negativeTestsPeopleAntibody":null,"totalTestsPeopleAntigen":null,"positiveTestsPeopleAntigen":null,"totalTestsAntigen":null,"positiveTestsAntigen":null,"fips":"11","positiveIncrease":49,"negativeIncrease":3306,"total":269401,"totalTestResultsIncrease":3355,"posNeg":269401,"deathIncrease":0,"hospitalizedIncrease":0,"hash":"b2f95026cbeef695315e1a8b31825d6ea4531079","commercialScore":0,"negativeRegularScore":0,"negativeScore":0,"positiveScore":0,"score":0,"grade":""},{"date":20200823,"state":"DC","positive":13590,"probableCases":null,"negative":252456,"pending":null,"totalTestResultsSource":"totalTestEncountersViral","totalTestResults":266046,"hospitalizedCurrently":80,"hospitalizedCumulative":null,"inIcuCurrently":27,"inIcuCumulative":null,"onVentilatorCurrently":12,"onVentilatorCumulative":null,"recovered":10812,"dataQualityGrade":"A+","lastUpdateEt":"8/22/2020 00:00","dateModified":"2020-08-22T00:00:00Z","checkTimeEt":"08/21 20:00","death":604,"hospitalized":null,"dateChecked":"2020-08-22T00:00:00Z","totalTestsViral":null,"positiveTestsViral":null,"negativeTestsViral":null,"positiveCasesViral":null,"deathConfirmed":null,"deathProbable":null,"totalTestEncountersViral":266046,"totalTestsPeopleViral":167808,"totalTestsAntibody":null,"positiveTestsAntibody":null,"negativeTestsAntibody":null,"totalTestsPeopleAntibody":null,"positiveTestsPeopleAntibody":null,"negativeTestsPeopleAntibody":null,"totalTestsPeopleAntigen":null,"positiveTestsPeopleAntigen":null,"totalTestsAntigen":null,"positiveTestsAntigen":null,"fips":"11","positiveIncrease":56,"negativeIncrease":3550,"total":266046,"totalTestResultsIncrease":3606,"posNeg":266046,"deathIncrease":0,"hospitalizedIncrease":0,"hash":"1b03ec5c880976f5cbc819b6e9b736344aa1bd6f","commercialScore":0,"negativeRegularScore":0,"negativeScore":0,"positiveScore":0,"score":0,"grade":""},{"date":20200822,"state":"DC","positive":13534,"probableCases":null,"negative":248906,"pending":null,"totalTestResultsSource":"totalTestEncountersViral","totalTestResults":262440,"hospitalizedCurrently":81,"hospitalizedCumulative":null,"inIcuCurrently":26,"inIcuCumulative":null,"onVentilatorCurrently":10,"onVentilatorCumulative":null,"recovered":10800,"dataQualityGrade":"A+","lastUpdateEt":"8/21/2020 00:00","dateModified":"2020-08-21T00:00:00Z","checkTimeEt":"08/20 20:00","death":604,"hospitalized":null,"dateChecked":"2020-08-21T00:00:00Z","totalTestsViral":null,"positiveTestsViral":null,"negativeTestsViral":null,"positiveCasesViral":null,"deathConfirmed":null,"deathProbable":null,"totalTestEncountersViral":262440,"totalTestsPeopleViral":164509,"totalTestsAntibody":null,"positiveTestsAntibody":null,"negativeTestsAntibody":null,"totalTestsPeopleAntibody":null,"positiveTestsPeopleAntibody":null,"negativeTestsPeopleAntibody":null,"totalTestsPeopleAntigen":null,"positiveTestsPeopleAntigen":null,"totalTestsAntigen":null,"positiveTestsAntigen":null,"fips":"11","positiveIncrease":65,"negativeIncrease":3317,"total":262440,"totalTestResultsIncrease":3382,"posNeg":262440,"deathIncrease":2,"hospitalizedIncrease":0,"hash":"02f2b59b31f4738b2c58a0f5a6352d74c8830674","commercialScore":0,"negativeRegularScore":0,"negativeScore":0,"positiveScore":0,"score":0,"grade":""},{"date":20200821,"state":"DC","positive":13469,"probableCases":null,"negative":245589,"pending":null,"totalTestResultsSource":"totalTestEncountersViral","totalTestResults":259058,"hospitalizedCurrently":78,"hospitalizedCumulative":null,"inIcuCurrently":27,"inIcuCumulative":null,"onVentilatorCurrently":12,"onVentilatorCumulative":null,"recovered":10772,"dataQualityGrade":"A+","lastUpdateEt":"8/20/2020 00:00","dateModified":"2020-08-20T00:00:00Z","checkTimeEt":"08/19 20:00","death":602,"hospitalized":null,"dateChecked":"2020-08-20T00:00:00Z","totalTestsViral":null,"positiveTestsViral":null,"negativeTestsViral":null,"positiveCasesViral":null,"deathConfirmed":null,"deathProbable":null,"totalTestEncountersViral":259058,"totalTestsPeopleViral":164509,"totalTestsAntibody":null,"positiveTestsAntibody":null,"negativeTestsAntibody":null,"totalTestsPeopleAntibody":null,"positiveTestsPeopleAntibody":null,"negativeTestsPeopleAntibody":null,"totalTestsPeopleAntigen":null,"positiveTestsPeopleAntigen":null,"totalTestsAntigen":null,"positiveTestsAntigen":null,"fips":"11","positiveIncrease":60,"negativeIncrease":5013,"total":259058,"totalTestResultsIncrease":5073,"posNeg":259058,"deathIncrease":1,"hospitalizedIncrease":0,"hash":"01ce4ec592784fcf02d6c8f3d479bd6abc4c1f33","commercialScore":0,"negativeRegularScore":0,"negativeScore":0,"positiveScore":0,"score":0,"grade":""},{"date":20200820,"state":"DC","positive":13409,"probableCases":null,"negative":240576,"pending":null,"totalTestResultsSource":"totalTestEncountersViral","totalTestResults":253985,"hospitalizedCurrently":78,"hospitalizedCumulative":null,"inIcuCurrently":26,"inIcuCumulative":null,"onVentilatorCurrently":12,"onVentilatorCumulative":null,"recovered":10720,"dataQualityGrade":"A+","lastUpdateEt":"8/19/2020 00:00","dateModified":"2020-08-19T00:00:00Z","checkTimeEt":"08/18 20:00","death":601,"hospitalized":null,"dateChecked":"2020-08-19T00:00:00Z","totalTestsViral":null,"positiveTestsViral":null,"negativeTestsViral":null,"positiveCasesViral":null,"deathConfirmed":null,"deathProbable":null,"totalTestEncountersViral":253985,"totalTestsPeopleViral":162158,"totalTestsAntibody":null,"positiveTestsAntibody":null,"negativeTestsAntibody":null,"totalTestsPeopleAntibody":null,"positiveTestsPeopleAntibody":null,"negativeTestsPeopleAntibody":null,"totalTestsPeopleAntigen":null,"positiveTestsPeopleAntigen":null,"totalTestsAntigen":null,"positiveTestsAntigen":null,"fips":"11","positiveIncrease":55,"negativeIncrease":2271,"total":253985,"totalTestResultsIncrease":2326,"posNeg":253985,"deathIncrease":1,"hospitalizedIncrease":0,"hash":"3b6474a50e0ba9a2c1ca54b9ac7d106067b76fab","commercialScore":0,"negativeRegularScore":0,"negativeScore":0,"positiveScore":0,"score":0,"grade":""},{"date":20200819,"state":"DC","positive":13354,"probableCases":null,"negative":238305,"pending":null,"totalTestResultsSource":"totalTestEncountersViral","totalTestResults":251659,"hospitalizedCurrently":84,"hospitalizedCumulative":null,"inIcuCurrently":30,"inIcuCumulative":null,"onVentilatorCurrently":14,"onVentilatorCumulative":null,"recovered":10596,"dataQualityGrade":"A+","lastUpdateEt":"8/18/2020 00:00","dateModified":"2020-08-18T00:00:00Z","checkTimeEt":"08/17 20:00","death":600,"hospitalized":null,"dateChecked":"2020-08-18T00:00:00Z","totalTestsViral":null,"positiveTestsViral":null,"negativeTestsViral":null,"positiveCasesViral":null,"deathConfirmed":null,"deathProbable":null,"totalTestEncountersViral":251659,"totalTestsPeopleViral":160545,"totalTestsAntibody":null,"positiveTestsAntibody":null,"negativeTestsAntibody":null,"totalTestsPeopleAntibody":null,"positiveTestsPeopleAntibody":null,"negativeTestsPeopleAntibody":null,"totalTestsPeopleAntigen":null,"positiveTestsPeopleAntigen":null,"totalTestsAntigen":null,"positiveTestsAntigen":null,"fips":"11","positiveIncrease":29,"negativeIncrease":2152,"total":251659,"totalTestResultsIncrease":2181,"posNeg":251659,"deathIncrease":1,"hospitalizedIncrease":0,"hash":"0c91e0f978c504333d41ced5f8b8757aeb8b584d","commercialScore":0,"negativeRegularScore":0,"negativeScore":0,"positiveScore":0,"score":0,"grade":""},{"date":20200818,"state":"DC","positive":13325,"probableCases":null,"negative":236153,"pending":null,"totalTestResultsSource":"totalTestEncountersViral","totalTestResults":249478,"hospitalizedCurrently":79,"hospitalizedCumulative":null,"inIcuCurrently":27,"inIcuCumulative":null,"onVentilatorCurrently":14,"onVentilatorCumulative":null,"recovered":10595,"dataQualityGrade":"A+","lastUpdateEt":"8/17/2020 00:00","dateModified":"2020-08-17T00:00:00Z","checkTimeEt":"08/16 20:00","death":599,"hospitalized":null,"dateChecked":"2020-08-17T00:00:00Z","totalTestsViral":null,"positiveTestsViral":null,"negativeTestsViral":null,"positiveCasesViral":null,"deathConfirmed":null,"deathProbable":null,"totalTestEncountersViral":249478,"totalTestsPeopleViral":159943,"totalTestsAntibody":null,"positiveTestsAntibody":null,"negativeTestsAntibody":null,"totalTestsPeopleAntibody":null,"positiveTestsPeopleAntibody":null,"negativeTestsPeopleAntibody":null,"totalTestsPeopleAntigen":null,"positiveTestsPeopleAntigen":null,"totalTestsAntigen":null,"positiveTestsAntigen":null,"fips":"11","positiveIncrease":52,"negativeIncrease":3771,"total":249478,"totalTestResultsIncrease":3823,"posNeg":249478,"deathIncrease":2,"hospitalizedIncrease":0,"hash":"d7cf1d962d54cae05b63ff033b1da4e1cffbb27f","commercialScore":0,"negativeRegularScore":0,"negativeScore":0,"positiveScore":0,"score":0,"grade":""},{"date":20200817,"state":"DC","positive":13273,"probableCases":null,"negative":232382,"pending":null,"totalTestResultsSource":"totalTestEncountersViral","totalTestResults":245655,"hospitalizedCurrently":82,"hospitalizedCumulative":null,"inIcuCurrently":30,"inIcuCumulative":null,"onVentilatorCurrently":15,"onVentilatorCumulative":null,"recovered":10521,"dataQualityGrade":"A+","lastUpdateEt":"8/16/2020 00:00","dateModified":"2020-08-16T00:00:00Z","checkTimeEt":"08/15 20:00","death":597,"hospitalized":null,"dateChecked":"2020-08-16T00:00:00Z","totalTestsViral":null,"positiveTestsViral":null,"negativeTestsViral":null,"positiveCasesViral":null,"deathConfirmed":null,"deathProbable":null,"totalTestEncountersViral":245655,"totalTestsPeopleViral":158319,"totalTestsAntibody":null,"positiveTestsAntibody":null,"negativeTestsAntibody":null,"totalTestsPeopleAntibody":null,"positiveTestsPeopleAntibody":null,"negativeTestsPeopleAntib