[{"date":20201107,"state":"PR","positive":37567,"probableCases":77,"negative":305972,"pending":null,"totalTestResultsSource":"posNeg","totalTestResults":343539,"hospitalizedCurrently":526,"hospitalizedCumulative":null,"inIcuCurrently":69,"inIcuCumulative":null,"onVentilatorCurrently":49,"onVentilatorCumulative":null,"recovered":32475,"dataQualityGrade":"B","lastUpdateEt":"11/7/2020 00:00","dateModified":"2020-11-07T24:00:00Z","checkTimeEt":"11/06 19:00","death":862,"hospitalized":null,"dateChecked":"2020-11-07T24:00:00Z","totalTestsViral":310546,"positiveTestsViral":7002,"negativeTestsViral":303412,"positiveCasesViral":37490,"deathConfirmed":659,"deathProbable":203,"totalTestEncountersViral":null,"totalTestsPeopleViral":null,"totalTestsAntibody":null,"positiveTestsAntibody":33965,"negativeTestsAntibody":null,"totalTestsPeopleAntibody":null,"positiveTestsPeopleAntibody":null,"negativeTestsPeopleAntibody":null,"totalTestsPeopleAntigen":null,"positiveTestsPeopleAntigen":null,"totalTestsAntigen":null,"positiveTestsAntigen":null,"fips":"72","positiveIncrease":663,"negativeIncrease":0,"total":343539,"totalTestResultsIncrease":663,"posNeg":343539,"deathIncrease":0,"hospitalizedIncrease":0,"hash":"ae76d047d1529c49593093dc74ec61ad1a2d6706","commercialScore":0,"negativeRegularScore":0,"negativeScore":0,"positiveScore":0,"score":0,"grade":""},{"date":20201106,"state":"PR","positive":36904,"probableCases":null,"negative":305972,"pending":null,"totalTestResultsSource":"posNeg","totalTestResults":342876,"hospitalizedCurrently":518,"hospitalizedCumulative":null,"inIcuCurrently":68,"inIcuCumulative":null,"onVentilatorCurrently":42,"onVentilatorCumulative":null,"recovered":31915,"dataQualityGrade":"B","lastUpdateEt":"11/6/2020 00:00","dateModified":"2020-11-06T24:00:00Z","checkTimeEt":"11/05 19:00","death":862,"hospitalized":null,"dateChecked":"2020-11-06T24:00:00Z","totalTestsViral":310546,"positiveTestsViral":7002,"negativeTestsViral":303412,"positiveCasesViral":36904,"deathConfirmed":659,"deathProbable":203,"totalTestEncountersViral":null,"totalTestsPeopleViral":null,"totalTestsAntibody":null,"positiveTestsAntibody":33615,"negativeTestsAntibody":null,"totalTestsPeopleAntibody":null,"positiveTestsPeopleAntibody":null,"negativeTestsPeopleAntibody":null,"totalTestsPeopleAntigen":null,"positiveTestsPeopleAntigen":null,"totalTestsAntigen":null,"positiveTestsAntigen":null,"fips":"72","positiveIncrease":803,"negativeIncrease":0,"total":342876,"totalTestResultsIncrease":803,"posNeg":342876,"deathIncrease":7,"hospitalizedIncrease":0,"hash":"fc68a62761243950e64d1b164178c0484cd0ef04","commercialScore":0,"negativeRegularScore":0,"negativeScore":0,"positiveScore":0,"score":0,"grade":""},{"date":20201105,"state":"PR","positive":36101,"probableCases":null,"negative":305972,"pending":null,"totalTestResultsSource":"posNeg","totalTestResults":342073,"hospitalizedCurrently":483,"hospitalizedCumulative":null,"inIcuCurrently":60,"inIcuCumulative":null,"onVentilatorCurrently":40,"onVentilatorCumulative":null,"recovered":31182,"dataQualityGrade":"B","lastUpdateEt":"11/5/2020 00:00","dateModified":"2020-11-05T24:00:00Z","checkTimeEt":"11/04 19:00","death":855,"hospitalized":null,"dateChecked":"2020-11-05T24:00:00Z","totalTestsViral":310546,"positiveTestsViral":7002,"negativeTestsViral":303412,"positiveCasesViral":36101,"deathConfirmed":653,"deathProbable":202,"totalTestEncountersViral":null,"totalTestsPeopleViral":null,"totalTestsAntibody":null,"positiveTestsAntibody":33315,"negativeTestsAntibody":null,"totalTestsPeopleAntibody":null,"positiveTestsPeopleAntibody":null,"negativeTestsPeopleAntibody":null,"totalTestsPeopleAntigen":null,"positiveTestsPeopleAntigen":null,"totalTestsAntigen":null,"positiveTestsAntigen":null,"fips":"72","positiveIncrease":294,"negativeIncrease":0,"total":342073,"totalTestResultsIncrease":294,"posNeg":342073,"deathIncrease":5,"hospitalizedIncrease":0,"hash":"ceafd75969ada491c6fed3ae2fc2bd8a6aa2081e","commercialScore":0,"negativeRegularScore":0,"negativeScore":0,"positiveScore":0,"score":0,"grade":""},{"date":20201104,"state":"PR","positive":35807,"probableCases":null,"negative":305972,"pending":null,"totalTestResultsSource":"posNeg","totalTestResults":341779,"hospitalizedCurrently":459,"hospitalizedCumulative":null,"inIcuCurrently":60,"inIcuCumulative":null,"onVentilatorCurrently":46,"onVentilatorCumulative":null,"recovered":30568,"dataQualityGrade":"B","lastUpdateEt":"11/4/2020 00:00","dateModified":"2020-11-04T24:00:00Z","checkTimeEt":"11/03 19:00","death":850,"hospitalized":null,"dateChecked":"2020-11-04T24:00:00Z","totalTestsViral":310546,"positiveTestsViral":7002,"negativeTestsViral":303412,"positiveCasesViral":35807,"deathConfirmed":648,"deathProbable":202,"totalTestEncountersViral":null,"totalTestsPeopleViral":null,"totalTestsAntibody":null,"positiveTestsAntibody":33213,"negativeTestsAntibody":null,"totalTestsPeopleAntibody":null,"positiveTestsPeopleAntibody":null,"negativeTestsPeopleAntibody":null,"totalTestsPeopleAntigen":null,"positiveTestsPeopleAntigen":null,"totalTestsAntigen":null,"positiveTestsAntigen":null,"fips":"72","positiveIncrease":57,"negativeIncrease":0,"total":341779,"totalTestResultsIncrease":57,"posNeg":341779,"deathIncrease":8,"hospitalizedIncrease":0,"hash":"c708d948821d31c5dd0b2680cd18b1ac50d5a4c1","commercialScore":0,"negativeRegularScore":0,"negativeScore":0,"positiveScore":0,"score":0,"grade":""},{"date":20201103,"state":"PR","positive":35750,"probableCases":null,"negative":305972,"pending":null,"totalTestResultsSource":"posNeg","totalTestResults":341722,"hospitalizedCurrently":421,"hospitalizedCumulative":null,"inIcuCurrently":63,"inIcuCumulative":null,"onVentilatorCurrently":48,"onVentilatorCumulative":null,"recovered":29763,"dataQualityGrade":"B","lastUpdateEt":"11/3/2020 00:00","dateModified":"2020-11-03T24:00:00Z","checkTimeEt":"11/02 19:00","death":842,"hospitalized":null,"dateChecked":"2020-11-03T24:00:00Z","totalTestsViral":310546,"positiveTestsViral":7002,"negativeTestsViral":303412,"positiveCasesViral":35750,"deathConfirmed":642,"deathProbable":200,"totalTestEncountersViral":null,"totalTestsPeopleViral":null,"totalTestsAntibody":null,"positiveTestsAntibody":33193,"negativeTestsAntibody":null,"totalTestsPeopleAntibody":null,"positiveTestsPeopleAntibody":null,"negativeTestsPeopleAntibody":null,"totalTestsPeopleAntigen":null,"positiveTestsPeopleAntigen":null,"totalTestsAntigen":null,"positiveTestsAntigen":null,"fips":"72","positiveIncrease":345,"negativeIncrease":0,"total":341722,"totalTestResultsIncrease":345,"posNeg":341722,"deathIncrease":3,"hospitalizedIncrease":0,"hash":"fa61c08afc5fff1ef8a717303d39a79baf51b490","commercialScore":0,"negativeRegularScore":0,"negativeScore":0,"positiveScore":0,"score":0,"grade":""},{"date":20201102,"state":"PR","positive":35405,"probableCases":null,"negative":305972,"pending":null,"totalTestResultsSource":"posNeg","totalTestResults":341377,"hospitalizedCurrently":443,"hospitalizedCumulative":null,"inIcuCurrently":68,"inIcuCumulative":null,"onVentilatorCurrently":51,"onVentilatorCumulative":null,"recovered":29352,"dataQualityGrade":"B","lastUpdateEt":"11/2/2020 00:00","dateModified":"2020-11-02T24:00:00Z","checkTimeEt":"11/01 19:00","death":839,"hospitalized":null,"dateChecked":"2020-11-02T24:00:00Z","totalTestsViral":310546,"positiveTestsViral":7002,"negativeTestsViral":303412,"positiveCasesViral":35405,"deathConfirmed":639,"deathProbable":200,"totalTestEncountersViral":null,"totalTestsPeopleViral":null,"totalTestsAntibody":null,"positiveTestsAntibody":32767,"negativeTestsAntibody":null,"totalTestsPeopleAntibody":null,"positiveTestsPeopleAntibody":null,"negativeTestsPeopleAntibody":null,"totalTestsPeopleAntigen":null,"positiveTestsPeopleAntigen":null,"totalTestsAntigen":null,"positiveTestsAntigen":null,"fips":"72","positiveIncrease":864,"negativeIncrease":0,"total":341377,"totalTestResultsIncrease":864,"posNeg":341377,"deathIncrease":7,"hospitalizedIncrease":0,"hash":"0fb78c0e5f1c3d7afeb2f0169c27e86b24b3139f","commercialScore":0,"negativeRegularScore":0,"negativeScore":0,"positiveScore":0,"score":0,"grade":""},{"date":20201101,"state":"PR","positive":34541,"probableCases":null,"negative":305972,"pending":null,"totalTestResultsSource":"posNeg","totalTestResults":340513,"hospitalizedCurrently":429,"hospitalizedCumulative":null,"inIcuCurrently":62,"inIcuCumulative":null,"onVentilatorCurrently":43,"onVentilatorCumulative":null,"recovered":29903,"dataQualityGrade":"B","lastUpdateEt":"11/1/2020 00:00","dateModified":"2020-11-01T24:00:00Z","checkTimeEt":"10/31 20:00","death":832,"hospitalized":null,"dateChecked":"2020-11-01T24:00:00Z","totalTestsViral":310546,"positiveTestsViral":7002,"negativeTestsViral":303412,"positiveCasesViral":34541,"deathConfirmed":632,"deathProbable":200,"totalTestEncountersViral":null,"totalTestsPeopleViral":null,"totalTestsAntibody":null,"positiveTestsAntibody":32120,"negativeTestsAntibody":null,"totalTestsPeopleAntibody":null,"positiveTestsPeopleAntibody":null,"negativeTestsPeopleAntibody":null,"totalTestsPeopleAntigen":null,"positiveTestsPeopleAntigen":null,"totalTestsAntigen":null,"positiveTestsAntigen":null,"fips":"72","positiveIncrease":403,"negativeIncrease":0,"total":340513,"totalTestResultsIncrease":403,"posNeg":340513,"deathIncrease":10,"hospitalizedIncrease":0,"hash":"8cba96eab7ad930ae1a5da82741bbe50e14cd380","commercialScore":0,"negativeRegularScore":0,"negativeScore":0,"positiveScore":0,"score":0,"grade":""},{"date":20201031,"state":"PR","positive":34138,"probableCases":null,"negative":305972,"pending":null,"totalTestResultsSource":"posNeg","totalTestResults":340110,"hospitalizedCurrently":430,"hospitalizedCumulative":null,"inIcuCurrently":61,"inIcuCumulative":null,"onVentilatorCurrently":39,"onVentilatorCumulative":null,"recovered":29464,"dataQualityGrade":"B","lastUpdateEt":"10/31/2020 00:00","dateModified":"2020-10-31T24:00:00Z","checkTimeEt":"10/30 20:00","death":822,"hospitalized":null,"dateChecked":"2020-10-31T24:00:00Z","totalTestsViral":310546,"positiveTestsViral":7002,"negativeTestsViral":303412,"positiveCasesViral":34138,"deathConfirmed":626,"deathProbable":196,"totalTestEncountersViral":null,"totalTestsPeopleViral":null,"totalTestsAntibody":null,"positiveTestsAntibody":31990,"negativeTestsAntibody":null,"totalTestsPeopleAntibody":null,"positiveTestsPeopleAntibody":null,"negativeTestsPeopleAntibody":null,"totalTestsPeopleAntigen":null,"positiveTestsPeopleAntigen":null,"totalTestsAntigen":null,"positiveTestsAntigen":null,"fips":"72","positiveIncrease":285,"negativeIncrease":0,"total":340110,"totalTestResultsIncrease":285,"posNeg":340110,"deathIncrease":2,"hospitalizedIncrease":0,"hash":"6ddb137e2afb097a251556bca94f9b7aa2256787","commercialScore":0,"negativeRegularScore":0,"negativeScore":0,"positiveScore":0,"score":0,"grade":""},{"date":20201030,"state":"PR","positive":33853,"probableCases":null,"negative":305972,"pending":null,"totalTestResultsSource":"posNeg","totalTestResults":339825,"hospitalizedCurrently":452,"hospitalizedCumulative":null,"inIcuCurrently":60,"inIcuCumulative":null,"onVentilatorCurrently":38,"onVentilatorCumulative":null,"recovered":28912,"dataQualityGrade":"B","lastUpdateEt":"10/30/2020 00:00","dateModified":"2020-10-30T24:00:00Z","checkTimeEt":"10/29 20:00","death":820,"hospitalized":null,"dateChecked":"2020-10-30T24:00:00Z","totalTestsViral":310546,"positiveTestsViral":7002,"negativeTestsViral":303412,"positiveCasesViral":33853,"deathConfirmed":626,"deathProbable":194,"totalTestEncountersViral":null,"totalTestsPeopleViral":null,"totalTestsAntibody":null,"positiveTestsAntibody":31890,"negativeTestsAntibody":null,"totalTestsPeopleAntibody":null,"positiveTestsPeopleAntibody":null,"negativeTestsPeopleAntibody":null,"totalTestsPeopleAntigen":null,"positiveTestsPeopleAntigen":null,"totalTestsAntigen":null,"positiveTestsAntigen":null,"fips":"72","positiveIncrease":574,"negativeIncrease":0,"total":339825,"totalTestResultsIncrease":574,"posNeg":339825,"deathIncrease":6,"hospitalizedIncrease":0,"hash":"811dce251a7de66ccda7e344d88ec4c203142347","commercialScore":0,"negativeRegularScore":0,"negativeScore":0,"positiveScore":0,"score":0,"grade":""},{"date":20201029,"state":"PR","positive":33279,"probableCases":null,"negative":305972,"pending":null,"totalTestResultsSource":"posNeg","totalTestResults":339251,"hospitalizedCurrently":425,"hospitalizedCumulative":null,"inIcuCurrently":63,"inIcuCumulative":null,"onVentilatorCurrently":39,"onVentilatorCumulative":null,"recovered":28439,"dataQualityGrade":"B","lastUpdateEt":"10/29/2020 00:00","dateModified":"2020-10-29T24:00:00Z","checkTimeEt":"10/28 20:00","death":814,"hospitalized":null,"dateChecked":"2020-10-29T24:00:00Z","totalTestsViral":310546,"positiveTestsViral":7002,"negativeTestsViral":303412,"positiveCasesViral":33279,"deathConfirmed":621,"deathProbable":193,"totalTestEncountersViral":null,"totalTestsPeopleViral":null,"totalTestsAntibody":null,"positiveTestsAntibody":31519,"negativeTestsAntibody":null,"totalTestsPeopleAntibody":null,"positiveTestsPeopleAntibody":null,"negativeTestsPeopleAntibody":null,"totalTestsPeopleAntigen":null,"positiveTestsPeopleAntigen":null,"totalTestsAntigen":null,"positiveTestsAntigen":null,"fips":"72","positiveIncrease":752,"negativeIncrease":0,"total":339251,"totalTestResultsIncrease":752,"posNeg":339251,"deathIncrease":1,"hospitalizedIncrease":0,"hash":"16e156737cab9cb907e9256844f1713a1704a252","commercialScore":0,"negativeRegularScore":0,"negativeScore":0,"positiveScore":0,"score":0,"grade":""},{"date":20201028,"state":"PR","positive":32527,"probableCases":null,"negative":305972,"pending":null,"totalTestResultsSource":"posNeg","totalTestResults":338499,"hospitalizedCurrently":434,"hospitalizedCumulative":null,"inIcuCurrently":61,"inIcuCumulative":null,"onVentilatorCurrently":37,"onVentilatorCumulative":null,"recovered":28021,"dataQualityGrade":"B","lastUpdateEt":"10/28/2020 00:00","dateModified":"2020-10-28T24:00:00Z","checkTimeEt":"10/27 20:00","death":813,"hospitalized":null,"dateChecked":"2020-10-28T24:00:00Z","totalTestsViral":310546,"positiveTestsViral":7002,"negativeTestsViral":303412,"positiveCasesViral":32527,"deathConfirmed":620,"deathProbable":193,"totalTestEncountersViral":null,"totalTestsPeopleViral":null,"totalTestsAntibody":null,"positiveTestsAntibody":31060,"negativeTestsAntibody":null,"totalTestsPeopleAntibody":null,"positiveTestsPeopleAntibody":null,"negativeTestsPeopleAntibody":null,"totalTestsPeopleAntigen":null,"positiveTestsPeopleAntigen":null,"totalTestsAntigen":null,"positiveTestsAntigen":null,"fips":"72","positiveIncrease":66,"negativeIncrease":0,"total":338499,"totalTestResultsIncrease":66,"posNeg":338499,"deathIncrease":5,"hospitalizedIncrease":0,"hash":"a45f4a6938fef2008b6264bfc031134f2bbe8641","commercialScore":0,"negativeRegularScore":0,"negativeScore":0,"positiveScore":0,"score":0,"grade":""},{"date":20201027,"state":"PR","positive":32461,"probableCases":null,"negative":305972,"pending":null,"totalTestResultsSource":"posNeg","totalTestResults":338433,"hospitalizedCurrently":395,"hospitalizedCumulative":null,"inIcuCurrently":59,"inIcuCumulative":null,"onVentilatorCurrently":38,"onVentilatorCumulative":null,"recovered":27607,"dataQualityGrade":"B","lastUpdateEt":"10/27/2020 00:00","dateModified":"2020-10-27T24:00:00Z","checkTimeEt":"10/26 20:00","death":808,"hospitalized":null,"dateChecked":"2020-10-27T24:00:00Z","totalTestsViral":310546,"positiveTestsViral":7002,"negativeTestsViral":303412,"positiveCasesViral":32461,"deathConfirmed":616,"deathProbable":192,"totalTestEncountersViral":null,"totalTestsPeopleViral":null,"totalTestsAntibody":null,"positiveTestsAntibody":31036,"negativeTestsAntibody":null,"totalTestsPeopleAntibody":null,"positiveTestsPeopleAntibody":null,"negativeTestsPeopleAntibody":null,"totalTestsPeopleAntigen":null,"positiveTestsPeopleAntigen":null,"totalTestsAntigen":null,"positiveTestsAntigen":null,"fips":"72","positiveIncrease":263,"negativeIncrease":0,"total":338433,"totalTestResultsIncrease":263,"posNeg":338433,"deathIncrease":4,"hospitalizedIncrease":0,"hash":"dca1f93222973970e16e1866bd27b3529216f91f","commercialScore":0,"negativeRegularScore":0,"negativeScore":0,"positiveScore":0,"score":0,"grade":""},{"date":20201026,"state":"PR","positive":32198,"probableCases":null,"negative":305972,"pending":null,"totalTestResultsSource":"posNeg","totalTestResults":338170,"hospitalizedCurrently":356,"hospitalizedCumulative":null,"inIcuCurrently":58,"inIcuCumulative":null,"onVentilatorCurrently":45,"onVentilatorCumulative":null,"recovered":27603,"dataQualityGrade":"B","lastUpdateEt":"10/26/2020 00:00","dateModified":"2020-10-26T24:00:00Z","checkTimeEt":"10/25 20:00","death":804,"hospitalized":null,"dateChecked":"2020-10-26T24:00:00Z","totalTestsViral":310546,"positiveTestsViral":7002,"negativeTestsViral":303412,"positiveCasesViral":32198,"deathConfirmed":612,"deathProbable":192,"totalTestEncountersViral":null,"totalTestsPeopleViral":null,"totalTestsAntibody":null,"positiveTestsAntibody":30937,"negativeTestsAntibody":null,"totalTestsPeopleAntibody":null,"positiveTestsPeopleAntibody":null,"negativeTestsPeopleAntibody":null,"totalTestsPeopleAntigen":null,"positiveTestsPeopleAntigen":null,"totalTestsAntigen":null,"positiveTestsAntigen":null,"fips":"72","positiveIncrease":461,"negativeIncrease":0,"total":338170,"totalTestResultsIncrease":461,"posNeg":338170,"deathIncrease":3,"hospitalizedIncrease":0,"hash":"14a5ca5d45b8d6f6e4cb3a8ab357b6a570591dc2","commercialScore":0,"negativeRegularScore":0,"negativeScore":0,"positiveScore":0,"score":0,"grade":""},{"date":20201025,"state":"PR","positive":31737,"probableCases":null,"negative":305972,"pending":null,"totalTestResultsSource":"posNeg","totalTestResults":337709,"hospitalizedCurrently":370,"hospitalizedCumulative":null,"inIcuCurrently":60,"inIcuCumulative":null,"onVentilatorCurrently":46,"onVentilatorCumulative":null,"recovered":27348,"dataQualityGrade":"B","lastUpdateEt":"10/25/2020 00:00","dateModified":"2020-10-25T24:00:00Z","checkTimeEt":"10/24 20:00","death":801,"hospitalized":null,"dateChecked":"2020-10-25T24:00:00Z","totalTestsViral":310546,"positiveTestsViral":7002,"negativeTestsViral":303412,"positiveCasesViral":31737,"deathConfirmed":610,"deathProbable":191,"totalTestEncountersViral":null,"totalTestsPeopleViral":null,"totalTestsAntibody":null,"positiveTestsAntibody":30766,"negativeTestsAntibody":null,"totalTestsPeopleAntibody":null,"positiveTestsPeopleAntibody":null,"negativeTestsPeopleAntibody":null,"totalTestsPeopleAntigen":null,"positiveTestsPeopleAntigen":null,"totalTestsAntigen":null,"positiveTestsAntigen":null,"fips":"72","positiveIncrease":665,"negativeIncrease":0,"total":337709,"totalTestResultsIncrease":665,"posNeg":337709,"deathIncrease":7,"hospitalizedIncrease":0,"hash":"d77018fae6bfefde3699ec7bbbd6923bf035408a","commercialScore":0,"negativeRegularScore":0,"negativeScore":0,"positiveScore":0,"score":0,"grade":""},{"date":20201024,"state":"PR","positive":31072,"probableCases":null,"negative":305972,"pending":null,"totalTestResultsSource":"posNeg","totalTestResults":337044,"hospitalizedCurrently":395,"hospitalizedCumulative":null,"inIcuCurrently":60,"inIcuCumulative":null,"onVentilatorCurrently":43,"onVentilatorCumulative":null,"recovered":26866,"dataQualityGrade":"B","lastUpdateEt":"10/24/2020 00:00","dateModified":"2020-10-24T24:00:00Z","checkTimeEt":"10/23 20:00","death":794,"hospitalized":null,"dateChecked":"2020-10-24T24:00:00Z","totalTestsViral":310546,"positiveTestsViral":7002,"negativeTestsViral":303412,"positiveCasesViral":31072,"deathConfirmed":604,"deathProbable":190,"totalTestEncountersViral":null,"totalTestsPeopleViral":null,"totalTestsAntibody":null,"positiveTestsAntibody":30208,"negativeTestsAntibody":null,"totalTestsPeopleAntibody":null,"positiveTestsPeopleAntibody":null,"negativeTestsPeopleAntibody":null,"totalTestsPeopleAntigen":null,"positiveTestsPeopleAntigen":null,"totalTestsAntigen":null,"positiveTestsAntigen":null,"fips":"72","positiveIncrease":116,"negativeIncrease":0,"total":337044,"totalTestResultsIncrease":116,"posNeg":337044,"deathIncrease":3,"hospitalizedIncrease":0,"hash":"a0dda3a153494cd1cc6308a48a83b8b9805200b9","commercialScore":0,"negativeRegularScore":0,"negativeScore":0,"positiveScore":0,"score":0,"grade":""},{"date":20201023,"state":"PR","positive":30956,"probableCases":null,"negative":305972,"pending":null,"totalTestResultsSource":"posNeg","totalTestResults":336928,"hospitalizedCurrently":381,"hospitalizedCumulative":null,"inIcuCurrently":51,"inIcuCumulative":null,"onVentilatorCurrently":39,"onVentilatorCumulative":null,"recovered":26430,"dataQualityGrade":"B","lastUpdateEt":"10/23/2020 00:00","dateModified":"2020-10-23T24:00:00Z","checkTimeEt":"10/22 20:00","death":791,"hospitalized":null,"dateChecked":"2020-10-23T24:00:00Z","totalTestsViral":310546,"positiveTestsViral":7002,"negativeTestsViral":303412,"positiveCasesViral":30956,"deathConfirmed":602,"deathProbable":189,"totalTestEncountersViral":null,"totalTestsPeopleViral":null,"totalTestsAntibody":null,"positiveTestsAntibody":30028,"negativeTestsAntibody":null,"totalTestsPeopleAntibody":null,"positiveTestsPeopleAntibody":null,"negativeTestsPeopleAntibody":null,"totalTestsPeopleAntigen":null,"positiveTestsPeopleAntigen":null,"totalTestsAntigen":null,"positiveTestsAntigen":null,"fips":"72","positiveIncrease":1152,"negativeIncrease":0,"total":336928,"totalTestResultsIncrease":1152,"posNeg":336928,"deathIncrease":8,"hospitalizedIncrease":0,"hash":"bc83171903dfa0cdaa15c382b9f984597326a647","commercialScore":0,"negativeRegularScore":0,"negativeScore":0,"positiveScore":0,"score":0,"grade":""},{"date":20201022,"state":"PR","positive":29804,"probableCases":null,"negative":305972,"pending":null,"totalTestResultsSource":"posNeg","totalTestResults":335776,"hospitalizedCurrently":395,"hospitalizedCumulative":null,"inIcuCurrently":53,"inIcuCumulative":null,"onVentilatorCurrently":44,"onVentilatorCumulative":null,"recovered":26253,"dataQualityGrade":"B","lastUpdateEt":"10/22/2020 00:00","dateModified":"2020-10-22T24:00:00Z","checkTimeEt":"10/21 20:00","death":783,"hospitalized":null,"dateChecked":"2020-10-22T24:00:00Z","totalTestsViral":310546,"positiveTestsViral":7002,"negativeTestsViral":303412,"positiveCasesViral":29804,"deathConfirmed":596,"deathProbable":187,"totalTestEncountersViral":null,"totalTestsPeopleViral":null,"totalTestsAntibody":null,"positiveTestsAntibody":29233,"negativeTestsAntibody":null,"totalTestsPeopleAntibody":null,"positiveTestsPeopleAntibody":null,"negativeTestsPeopleAntibody":null,"totalTestsPeopleAntigen":null,"positiveTestsPeopleAntigen":null,"totalTestsAntigen":null,"positiveTestsAntigen":null,"fips":"72","positiveIncrease":87,"negativeIncrease":0,"total":335776,"totalTestResultsIncrease":87,"posNeg":335776,"deathIncrease":9,"hospitalizedIncrease":0,"hash":"d02120f4ed0df1932dffa8aada2002e1f64161db","commercialScore":0,"negativeRegularScore":0,"negativeScore":0,"positiveScore":0,"score":0,"grade":""},{"date":20201021,"state":"PR","positive":29717,"probableCases":null,"negative":305972,"pending":null,"totalTestResultsSource":"posNeg","totalTestResults":335689,"hospitalizedCurrently":378,"hospitalizedCumulative":null,"inIcuCurrently":62,"inIcuCumulative":null,"onVentilatorCurrently":45,"onVentilatorCumulative":null,"recovered":26018,"dataQualityGrade":"B","lastUpdateEt":"10/21/2020 00:00","dateModified":"2020-10-21T24:00:00Z","checkTimeEt":"10/20 20:00","death":774,"hospitalized":null,"dateChecked":"2020-10-21T24:00:00Z","totalTestsViral":310546,"positiveTestsViral":7002,"negativeTestsViral":303412,"positiveCasesViral":29717,"deathConfirmed":590,"deathProbable":184,"totalTestEncountersViral":null,"totalTestsPeopleViral":null,"totalTestsAntibody":null,"positiveTestsAntibody":29113,"negativeTestsAntibody":null,"totalTestsPeopleAntibody":null,"positiveTestsPeopleAntibody":null,"negativeTestsPeopleAntibody":null,"totalTestsPeopleAntigen":null,"positiveTestsPeopleAntigen":null,"totalTestsAntigen":null,"positiveTestsAntigen":null,"fips":"72","positiveIncrease":132,"negativeIncrease":0,"total":335689,"totalTestResultsIncrease":132,"posNeg":335689,"deathIncrease":5,"hospitalizedIncrease":0,"hash":"55cef4e907c0eedd831c0201ab803d301cbb33a7","commercialScore":0,"negativeRegularScore":0,"negativeScore":0,"positiveScore":0,"score":0,"grade":""},{"date":20201020,"state":"PR","positive":29585,"probableCases":null,"negative":305972,"pending":null,"totalTestResultsSource":"posNeg","totalTestResults":335557,"hospitalizedCurrently":378,"hospitalizedCumulative":null,"inIcuCurrently":61,"inIcuCumulative":null,"onVentilatorCurrently":38,"onVentilatorCumulative":null,"recovered":25947,"dataQualityGrade":"B","lastUpdateEt":"10/20/2020 00:00","dateModified":"2020-10-20T24:00:00Z","checkTimeEt":"10/19 20:00","death":769,"hospitalized":null,"dateChecked":"2020-10-20T24:00:00Z","totalTestsViral":310546,"positiveTestsViral":7002,"negativeTestsViral":303412,"positiveCasesViral":29585,"deathConfirmed":586,"deathProbable":183,"totalTestEncountersViral":null,"totalTestsPeopleViral":null,"totalTestsAntibody":null,"positiveTestsAntibody":29058,"negativeTestsAntibody":null,"totalTestsPeopleAntibody":null,"positiveTestsPeopleAntibody":null,"negativeTestsPeopleAntibody":null,"totalTestsPeopleAntigen":null,"positiveTestsPeopleAntigen":null,"totalTestsAntigen":null,"positiveTestsAntigen":null,"fips":"72","positiveIncrease":447,"negativeIncrease":0,"total":335557,"totalTestResultsIncrease":447,"posNeg":335557,"deathIncrease":1,"hospitalizedIncrease":0,"hash":"7c7af5e988f418a12109d7b978575aed147eff67","commercialScore":0,"negativeRegularScore":0,"negativeScore":0,"positiveScore":0,"score":0,"grade":""},{"date":20201019,"state":"PR","positive":29138,"probableCases":null,"negative":305972,"pending":null,"totalTestResultsSource":"posNeg","totalTestResults":335110,"hospitalizedCurrently":327,"hospitalizedCumulative":null,"inIcuCurrently":64,"inIcuCumulative":null,"onVentilatorCurrently":41,"onVentilatorCumulative":null,"recovered":25939,"dataQualityGrade":"B","lastUpdateEt":"10/19/2020 00:00","dateModified":"2020-10-19T24:00:00Z","checkTimeEt":"10/18 20:00","death":768,"hospitalized":null,"dateChecked":"2020-10-19T24:00:00Z","totalTestsViral":310546,"positiveTestsViral":7002,"negativeTestsViral":303412,"positiveCasesViral":29138,"deathConfirmed":585,"deathProbable":183,"totalTestEncountersViral":null,"totalTestsPeopleViral":null,"totalTestsAntibody":null,"positiveTestsAntibody":28812,"negativeTestsAntibody":null,"totalTestsPeopleAntibody":null,"positiveTestsPeopleAntibody":null,"negativeTestsPeopleAntibody":null,"totalTestsPeopleAntigen":null,"positiveTestsPeopleAntigen":null,"totalTestsAntigen":null,"positiveTestsAntigen":null,"fips":"72","positiveIncrease":427,"negativeIncrease":0,"total":335110,"totalTestResultsIncrease":427,"posNeg":335110,"deathIncrease":2,"hospitalizedIncrease":0,"hash":"c202f4f580b5c77a199f1a7837745b7f8398d801","commercialScore":0,"negativeRegularScore":0,"negativeScore":0,"positiveScore":0,"score":0,"grade":""},{"date":20201018,"state":"PR","positive":28711,"probableCases":null,"negative":305972,"pending":null,"totalTestResultsSource":"posNeg","totalTestResults":334683,"hospitalizedCurrently":292,"hospitalizedCumulative":null,"inIcuCurrently":59,"inIcuCumulative":null,"onVentilatorCurrently":39,"onVentilatorCumulative":null,"recovered":25870,"dataQualityGrade":"B","lastUpdateEt":"10/18/2020 00:00","dateModified":"2020-10-18T24:00:00Z","checkTimeEt":"10/17 20:00","death":766,"hospitalized":null,"dateChecked":"2020-10-18T24:00:00Z","totalTestsViral":310546,"positiveTestsViral":7002,"negativeTestsViral":303412,"positiveCasesViral":28711,"deathConfirmed":583,"deathProbable":183,"totalTestEncountersViral":null,"totalTestsPeopleViral":null,"totalTestsAntibody":null,"positiveTestsAntibody":28582,"negativeTestsAntibody":null,"totalTestsPeopleAntibody":null,"positiveTestsPeopleAntibody":null,"negativeTestsPeopleAntibody":null,"totalTestsPeopleAntigen":null,"positiveTestsPeopleAntigen":null,"totalTestsAntigen":null,"positiveTestsAntigen":null,"fips":"72","positiveIncrease":418,"negativeIncrease":0,"total":334683,"totalTestResultsIncrease":418,"posNeg":334683,"deathIncrease":5,"hospitalizedIncrease":0,"hash":"525e0a900435b80e2150da0b89afeca30bb50a29","commercialScore":0,"negativeRegularScore":0,"negativeScore":0,"positiveScore":0,"score":0,"grade":""},{"date":20201017,"state":"PR","positive":28293,"probableCases":null,"negative":305972,"pending":null,"totalTestResultsSource":"posNeg","totalTestResults":334265,"hospitalizedCurrently":317,"hospitalizedCumulative":null,"inIcuCurrently":56,"inIcuCumulative":null,"onVentilatorCurrently":39,"onVentilatorCumulative":null,"recovered":25645,"dataQualityGrade":"B","lastUpdateEt":"10/17/2020 00:00","dateModified":"2020-10-17T24:00:00Z","checkTimeEt":"10/16 20:00","death":761,"hospitalized":null,"dateChecked":"2020-10-17T24:00:00Z","totalTestsViral":310546,"positiveTestsViral":7002,"negativeTestsViral":303412,"positiveCasesViral":28293,"deathConfirmed":578,"deathProbable":183,"totalTestEncountersViral":null,"totalTestsPeopleViral":null,"totalTestsAntibody":null,"positiveTestsAntibody":28357,"negativeTestsAntibody":null,"totalTestsPeopleAntibody":null,"positiveTestsPeopleAntibody":null,"negativeTestsPeopleAntibody":null,"totalTestsPeopleAntigen":null,"positiveTestsPeopleAntigen":null,"totalTestsAntigen":null,"positiveTestsAntigen":null,"fips":"72","positiveIncrease":119,"negativeIncrease":0,"total":334265,"totalTestResultsIncrease":119,"posNeg":334265,"deathIncrease":3,"hospitalizedIncrease":0,"hash":"26ad243229478b7dd52fffa262d8c08f2f7aed40","commercialScore":0,"negativeRegularScore":0,"negativeScore":0,"positiveScore":0,"score":0,"grade":""},{"date":20201016,"state":"PR","positive":28174,"probableCases":null,"negative":305972,"pending":null,"totalTestResultsSource":"posNeg","totalTestResults":334146,"hospitalizedCurrently":341,"hospitalizedCumulative":null,"inIcuCurrently":64,"inIcuCumulative":null,"onVentilatorCurrently":35,"onVentilatorCumulative":null,"recovered":25298,"dataQualityGrade":"B","lastUpdateEt":"10/16/2020 00:00","dateModified":"2020-10-16T24:00:00Z","checkTimeEt":"10/15 20:00","death":758,"hospitalized":null,"dateChecked":"2020-10-16T24:00:00Z","totalTestsViral":310546,"positiveTestsViral":7002,"negativeTestsViral":303412,"positiveCasesViral":28174,"deathConfirmed":575,"deathProbable":183,"totalTestEncountersViral":null,"totalTestsPeopleViral":null,"totalTestsAntibody":null,"positiveTestsAntibody":28238,"negativeTestsAntibody":null,"totalTestsPeopleAntibody":null,"positiveTestsPeopleAntibody":null,"negativeTestsPeopleAntibody":null,"totalTestsPeopleAntigen":null,"positiveTestsPeopleAntigen":null,"totalTestsAntigen":null,"positiveTestsAntigen":null,"fips":"72","positiveIncrease":227,"negativeIncrease":0,"total":334146,"totalTestResultsIncrease":227,"posNeg":334146,"deathIncrease":15,"hospitalizedIncrease":0,"hash":"c7b3b90b827976918829184bb6aecbc33538ac13","commercialScore":0,"negativeRegularScore":0,"negativeScore":0,"positiveScore":0,"score":0,"grade":""},{"date":20201015,"state":"PR","positive":27947,"probableCases":null,"negative":305972,"pending":null,"totalTestResultsSource":"posNeg","totalTestResults":333919,"hospitalizedCurrently":354,"hospitalizedCumulative":null,"inIcuCurrently":62,"inIcuCumulative":null,"onVentilatorCurrently":37,"onVentilatorCumulative":null,"recovered":25071,"dataQualityGrade":"B","lastUpdateEt":"10/15/2020 00:00","dateModified":"2020-10-15T24:00:00Z","checkTimeEt":"10/14 20:00","death":743,"hospitalized":null,"dateChecked":"2020-10-15T24:00:00Z","totalTestsViral":310546,"positiveTestsViral":7002,"negativeTestsViral":303412,"positiveCasesViral":27947,"deathConfirmed":562,"deathProbable":181,"totalTestEncountersViral":null,"totalTestsPeopleViral":null,"totalTestsAntibody":null,"positiveTestsAntibody":28138,"negativeTestsAntibody":null,"totalTestsPeopleAntibody":null,"positiveTestsPeopleAntibody":null,"negativeTestsPeopleAntibody":null,"totalTestsPeopleAntigen":null,"positiveTestsPeopleAntigen":null,"totalTestsAntigen":null,"positiveTestsAntigen":null,"fips":"72","positiveIncrease":318,"negativeIncrease":0,"total":333919,"totalTestResultsIncrease":318,"posNeg":333919,"deathIncrease":1,"hospitalizedIncrease":0,"hash":"eec0b7f6809e17ed3a08f05f57f5ac0675e033b9","commercialScore":0,"negativeRegularScore":0,"negativeScore":0,"positiveScore":0,"score":0,"grade":""},{"date":20201014,"state":"PR","positive":27629,"probableCases":null,"negative":305972,"pending":null,"totalTestResultsSource":"posNeg","totalTestResults":333601,"hospitalizedCurrently":343,"hospitalizedCumulative":null,"inIcuCurrently":53,"inIcuCumulative":null,"onVentilatorCurrently":37,"onVentilatorCumulative":null,"recovered":24788,"dataQualityGrade":"B","lastUpdateEt":"10/12/2020 00:00","dateModified":"2020-10-12T24:00:00Z","checkTimeEt":"10/11 20:00","death":742,"hospitalized":null,"dateChecked":"2020-10-12T24:00:00Z","totalTestsViral":310546,"positiveTestsViral":7002,"negativeTestsViral":303412,"positiveCasesViral":27629,"deathConfirmed":561,"deathProbable":181,"totalTestEncountersViral":null,"totalTestsPeopleViral":null,"totalTestsAntibody":null,"positiveTestsAntibody":27887,"negativeTestsAntibody":null,"totalTestsPeopleAntibody":null,"positiveTestsPeopleAntibody":null,"negativeTestsPeopleAntibody":null,"totalTestsPeopleAntigen":null,"positiveTestsPeopleAntigen":null,"totalTestsAntigen":null,"positiveTestsAntigen":null,"fips":"72","positiveIncrease":490,"negativeIncrease":0,"total":333601,"totalTestResultsIncrease":490,"posNeg":333601,"deathIncrease":4,"hospitalizedIncrease":0,"hash":"8370bf9f7778fb3f1086fb3a6f22917d9b4a4d56","commercialScore":0,"negativeRegularScore":0,"negativeScore":0,"positiveScore":0,"score":0,"grade":""},{"date":20201013,"state":"PR","positive":27139,"probableCases":null,"negative":305972,"pending":null,"totalTestResultsSource":"posNeg","totalTestResults":333111,"hospitalizedCurrently":303,"hospitalizedCumulative":null,"inIcuCurrently":54,"inIcuCumulative":null,"onVentilatorCurrently":34,"onVentilatorCumulative":null,"recovered":24552,"dataQualityGrade":"B","lastUpdateEt":"10/13/2020 00:00","dateModified":"2020-10-13T24:00:00Z","checkTimeEt":"10/12 20:00","death":738,"hospitalized":null,"dateChecked":"2020-10-13T24:00:00Z","totalTestsViral":310546,"positiveTestsViral":7002,"negativeTestsViral":303412,"positiveCasesViral":27139,"deathConfirmed":557,"deathProbable":181,"totalTestEncountersViral":null,"totalTestsPeopleViral":null,"totalTestsAntibody":null,"positiveTestsAntibody":27401,"negativeTestsAntibody":null,"totalTestsPeopleAntibody":null,"positiveTestsPeopleAntibody":null,"negativeTestsPeopleAntibody":null,"totalTestsPeopleAntigen":null,"positiveTestsPeopleAntigen":null,"totalTestsAntigen":null,"positiveTestsAntigen":null,"fips":"72","positiveIncrease":135,"negativeIncrease":0,"total":333111,"totalTestResultsIncrease":135,"posNeg":333111,"deathIncrease":3,"hospitalizedIncrease":0,"hash":"0a4c9996c7ddc987e3cacc135188896d2a710f09","commercialScore":0,"negativeRegularScore":0,"negativeScore":0,"positiveScore":0,"score":0,"grade":""},{"date":20201012,"state":"PR","positive":27004,"probableCases":null,"negative":305972,"pending":null,"totalTestResultsSource":"posNeg","totalTestResults":332976,"hospitalizedCurrently":314,"hospitalizedCumulative":null,"inIcuCurrently":54,"inIcuCumulative":null,"onVentilatorCurrently":36,"onVentilatorCumulative":null,"recovered":24488,"dataQualityGrade":"B","lastUpdateEt":"10/12/2020 00:00","dateModified":"2020-10-12T24:00:00Z","checkTimeEt":"10/11 20:00","death":735,"hospitalized":null,"dateChecked":"2020-10-12T24:00:00Z","totalTestsViral":310546,"positiveTestsViral":7002,"negativeTestsViral":303412,"positiveCasesViral":27004,"deathConfirmed":554,"deathProbable":181,"totalTestEncountersViral":null,"totalTestsPeopleViral":null,"totalTestsAntibody":null,"positiveTestsAntibody":27230,"negativeTestsAntibody":null,"totalTestsPeopleAntibody":null,"positiveTestsPeopleAntibody":null,"negativeTestsPeopleAntibody":null,"totalTestsPeopleAntigen":null,"positiveTestsPeopleAntigen":null,"totalTestsAntigen":null,"positiveTestsAntigen":null,"fips":"72","positiveIncrease":228,"negativeIncrease":0,"total":332976,"totalTestResultsIncrease":228,"posNeg":332976,"deathIncrease":5,"hospitalizedIncrease":0,"hash":"647c2f9b94f7478dce723552b58c04251bbf2a5d","commercialScore":0,"negativeRegularScore":0,"negativeScore":0,"positiveScore":0,"score":0,"grade":""},{"date":20201011,"state":"PR","positive":26776,"probableCases":null,"negative":305972,"pending":null,"totalTestResultsSource":"posNeg","totalTestResults":332748,"hospitalizedCurrently":324,"hospitalizedCumulative":null,"inIcuCurrently":51,"inIcuCumulative":null,"onVentilatorCurrently":34,"onVentilatorCumulative":null,"recovered":24533,"dataQualityGrade":"B","lastUpdateEt":"10/11/2020 00:00","dateModified":"2020-10-11T24:00:00Z","checkTimeEt":"10/10 20:00","death":730,"hospitalized":null,"dateChecked":"2020-10-11T24:00:00Z","totalTestsViral":310546,"positiveTestsViral":7002,"negativeTestsViral":303412,"positiveCasesViral":26776,"deathConfirmed":551,"deathProbable":179,"totalTestEncountersViral":null,"totalTestsPeopleViral":null,"totalTestsAntibody":null,"positiveTestsAntibody":26895,"negativeTestsAntibody":null,"totalTestsPeopleAntibody":null,"positiveTestsPeopleAntibody":null,"negativeTestsPeopleAntibody":null,"totalTestsPeopleAntigen":null,"positiveTestsPeopleAntigen":null,"totalTestsAntigen":null,"positiveTestsAntigen":null,"fips":"72","positiveIncrease":218,"negativeIncrease":0,"total":332748,"totalTestResultsIncrease":218,"posNeg":332748,"deathIncrease":2,"hospitalizedIncrease":0,"hash":"4578380578c20842a9c67b3ebb7098bd952d98c4","commercialScore":0,"negativeRegularScore":0,"negativeScore":0,"positiveScore":0,"score":0,"grade":""},{"date":20201010,"state":"PR","positive":26558,"probableCases":null,"negative":305972,"pending":null,"totalTestResultsSource":"posNeg","totalTestResults":332530,"hospitalizedCurrently":347,"hospitalizedCumulative":null,"inIcuCurrently":55,"inIcuCumulative":null,"onVentilatorCurrently":31,"onVentilatorCumulative":null,"recovered":24129,"dataQualityGrade":"B","lastUpdateEt":"10/10/2020 00:00","dateModified":"2020-10-10T24:00:00Z","checkTimeEt":"10/09 20:00","death":728,"hospitalized":null,"dateChecked":"2020-10-10T24:00:00Z","totalTestsViral":310546,"positiveTestsViral":7002,"negativeTestsViral":303412,"positiveCasesViral":26558,"deathConfirmed":548,"deathProbable":180,"totalTestEncountersViral":null,"totalTestsPeopleViral":null,"totalTestsAntibody":null,"positiveTestsAntibody":26806,"negativeTestsAntibody":null,"totalTestsPeopleAntibody":null,"positiveTestsPeopleAntibody":null,"negativeTestsPeopleAntibody":null,"totalTestsPeopleAntigen":null,"positiveTestsPeopleAntigen":null,"totalTestsAntigen":null,"positiveTestsAntigen":null,"fips":"72","positiveIncrease":232,"negativeIncrease":0,"total":332530,"totalTestResultsIncrease":232,"posNeg":332530,"deathIncrease":8,"hospitalizedIncrease":0,"hash":"d74d401d1e26babc68a600111774ab1fe4c884a1","commercialScore":0,"negativeRegularScore":0,"negativeScore":0,"positiveScore":0,"score":0,"grade":""},{"date":20201009,"state":"PR","positive":26326,"probableCases":null,"negative":305972,"pending":null,"totalTestResultsSource":"posNeg","totalTestResults":332298,"hospitalizedCurrently":354,"hospitalizedCumulative":null,"inIcuCurrently":55,"inIcuCumulative":null,"onVentilatorCurrently":29,"onVentilatorCumulative":null,"recovered":23603,"dataQualityGrade":"B","lastUpdateEt":"10/9/2020 00:00","dateModified":"2020-10-09T24:00:00Z","checkTimeEt":"10/08 20:00","death":720,"hospitalized":null,"dateChecked":"2020-10-09T24:00:00Z","totalTestsViral":310546,"positiveTestsViral":7002,"negativeTestsViral":303412,"positiveCasesViral":26326,"deathConfirmed":541,"deathProbable":179,"totalTestEncountersViral":null,"totalTestsPeopleViral":null,"totalTestsAntibody":null,"positiveTestsAntibody":26566,"negativeTestsAntibody":null,"totalTestsPeopleAntibody":null,"positiveTestsPeopleAntibody":null,"negativeTestsPeopleAntibody":null,"totalTestsPeopleAntigen":null,"positiveTestsPeopleAntigen":null,"totalTestsAntigen":null,"positiveTestsAntigen":null,"fips":"72","positiveIncrease":316,"negativeIncrease":0,"total":332298,"totalTestResultsIncrease":316,"posNeg":332298,"deathIncrease":5,"hospitalizedIncrease":0,"hash":"bb593b77dbbdccc596693ac7243835039bacc46b","commercialScore":0,"negativeRegularScore":0,"negativeScore":0,"positiveScore":0,"score":0,"grade":""},{"date":20201008,"state":"PR","positive":26010,"probableCases":null,"negative":305972,"pending":null,"totalTestResultsSource":"posNeg","totalTestResults":331982,"hospitalizedCurrently":315,"hospitalizedCumulative":null,"inIcuCurrently":49,"inIcuCumulative":null,"onVentilatorCurrently":27,"onVentilatorCumulative":null,"recovered":22805,"dataQualityGrade":"B","lastUpdateEt":"10/8/2020 00:00","dateModified":"2020-10-08T24:00:00Z","checkTimeEt":"10/07 20:00","death":715,"hospitalized":null,"dateChecked":"2020-10-08T24:00:00Z","totalTestsViral":310546,"positiveTestsViral":7002,"negativeTestsViral":303412,"positiveCasesViral":26010,"deathConfirmed":536,"deathProbable":179,"totalTestEncountersViral":null,"totalTestsPeopleViral":null,"totalTestsAntibody":null,"positiveTestsAntibody":26284,"negativeTestsAntibody":null,"totalTestsPeopleAntibody":null,"positiveTestsPeopleAntibody":null,"negativeTestsPeopleAntibody":null,"totalTestsPeopleAntigen":null,"positiveTestsPeopleAntigen":null,"totalTestsAntigen":null,"positiveTestsAntigen":null,"fips":"72","positiveIncrease":352,"negativeIncrease":0,"total":331982,"totalTestResultsIncrease":352,"posNeg":331982,"deathIncrease":10,"hospitalizedIncrease":0,"hash":"4a4bb1ae2f2a75aa98c37b3958edd979fa21d1a2","commercialScore":0,"negativeRegularScore":0,"negativeScore":0,"positiveScore":0,"score":0,"grade":""},{"date":20201007,"state":"PR","positive":25658,"probableCases":null,"negative":305972,"pending":null,"totalTestResultsSource":"posNeg","totalTestResults":331630,"hospitalizedCurrently":325,"hospitalizedCumulative":null,"inIcuCurrently":51,"inIcuCumulative":null,"onVentilatorCurrently":36,"onVentilatorCumulative":null,"recovered":22346,"dataQualityGrade":"B","lastUpdateEt":"10/7/2020 00:00","dateModified":"2020-10-07T24:00:00Z","checkTimeEt":"10/06 20:00","death":705,"hospitalized":null,"dateChecked":"2020-10-07T24:00:00Z","totalTestsViral":310546,"positiveTestsViral":7002,"negativeTestsViral":303412,"positiveCasesViral":25658,"deathConfirmed":528,"deathProbable":177,"totalTestEncountersViral":null,"totalTestsPeopleViral":null,"totalTestsAntibody":null,"positiveTestsAntibody":26110,"negativeTestsAntibody":null,"totalTestsPeopleAntibody":null,"positiveTestsPeopleAntibody":null,"negativeTestsPeopleAntibody":null,"totalTestsPeopleAntigen":null,"positiveTestsPeopleAntigen":null,"totalTestsAntigen":null,"positiveTestsAntigen":null,"fips":"72","positiveIncrease":23,"negativeIncrease":0,"total":331630,"totalTestResultsIncrease":23,"posNeg":331630,"deathIncrease":9,"hospitalizedIncrease":0,"hash":"a01dee9d809ac4790429862c652c14012ff5e1f3","commercialScore":0,"negativeRegularScore":0,"negativeScore":0,"positiveScore":0,"score":0,"grade":""},{"date":20201006,"state":"PR","positive":25635,"probableCases":null,"negative":305972,"pending":null,"totalTestResultsSource":"posNeg","totalTestResults":331607,"hospitalizedCurrently":322,"hospitalizedCumulative":null,"inIcuCurrently":61,"inIcuCumulative":null,"onVentilatorCurrently":33,"onVentilatorCumulative":null,"recovered":null,"dataQualityGrade":"C","lastUpdateEt":"10/6/2020 00:00","dateModified":"2020-10-06T24:00:00Z","checkTimeEt":"10/05 20:00","death":696,"hospitalized":null,"dateChecked":"2020-10-06T24:00:00Z","totalTestsViral":310546,"positiveTestsViral":7002,"negativeTestsViral":303412,"positiveCasesViral":25635,"deathConfirmed":519,"deathProbable":177,"totalTestEncountersViral":null,"totalTestsPeopleViral":null,"totalTestsAntibody":null,"positiveTestsAntibody":26102,"negativeTestsAntibody":null,"totalTestsPeopleAntibody":null,"positiveTestsPeopleAntibody":null,"negativeTestsPeopleAntibody":null,"totalTestsPeopleAntigen":null,"positiveTestsPeopleAntigen":null,"totalTestsAntigen":null,"positiveTestsAntigen":null,"fips":"72","positiveIncrease":238,"negativeIncrease":0,"total":331607,"totalTestResultsIncrease":238,"posNeg":331607,"deathIncrease":1,"hospitalizedIncrease":0,"hash":"e85a1b3b529c9c63459e1dcaefb1a506b011a83a","commercialScore":0,"negativeRegularScore":0,"negativeScore":0,"positiveScore":0,"score":0,"grade":""},{"date":20201005,"state":"PR","positive":25397,"probableCases":null,"negative":305972,"pending":null,"totalTestResultsSource":"posNeg","totalTestResults":331369,"hospitalizedCurrently":321,"hospitalizedCumulative":null,"inIcuCurrently":56,"inIcuCumulative":null,"onVentilatorCurrently":41,"onVentilatorCumulative":null,"recovered":null,"dataQualityGrade":"C","lastUpdateEt":"10/5/2020 00:00","dateModified":"2020-10-05T24:00:00Z","checkTimeEt":"10/04 20:00","death":695,"hospitalized":null,"dateChecked":"2020-10-05T24:00:00Z","totalTestsViral":310546,"positiveTestsViral":7002,"negativeTestsViral":303412,"positiveCasesViral":25397,"deathConfirmed":518,"deathProbable":177,"totalTestEncountersViral":null,"totalTestsPeopleViral":null,"totalTestsAntibody":null,"positiveTestsAntibody":25908,"negativeTestsAntibody":null,"totalTestsPeopleAntibody":null,"positiveTestsPeopleAntibody":null,"negativeTestsPeopleAntibody":null,"totalTestsPeopleAntigen":null,"positiveTestsPeopleAntigen":null,"totalTestsAntigen":null,"positiveTestsAntigen":null,"fips":"72","positiveIncrease":363,"negativeIncrease":0,"total":331369,"totalTestResultsIncrease":363,"posNeg":331369,"deathIncrease":9,"hospitalizedIncrease":0,"hash":"11b0039637d02ec79295a6de1004ae7c61e100a2","commercialScore":0,"negativeRegularScore":0,"negativeScore":0,"positiveScore":0,"score":0,"grade":""},{"date":20201004,"state":"PR","positive":25034,"probableCases":null,"negative":305972,"pending":null,"totalTestResultsSource":"posNeg","totalTestResults":331006,"hospitalizedCurrently":319,"hospitalizedCumulative":null,"inIcuCurrently":49,"inIcuCumulative":null,"onVentilatorCurrently":41,"onVentilatorCumulative":null,"recovered":null,"dataQualityGrade":"C","lastUpdateEt":"10/4/2020 00:00","dateModified":"2020-10-04T24:00:00Z","checkTimeEt":"10/03 20:00","death":686,"hospitalized":null,"dateChecked":"2020-10-04T24:00:00Z","totalTestsViral":310546,"positiveTestsViral":7002,"negativeTestsViral":303412,"positiveCasesViral":25034,"deathConfirmed":510,"deathProbable":176,"totalTestEncountersViral":null,"totalTestsPeopleViral":null,"totalTestsAntibody":null,"positiveTestsAntibody":25641,"negativeTestsAntibody":null,"totalTestsPeopleAntibody":null,"positiveTestsPeopleAntibody":null,"negativeTestsPeopleAntibody":null,"totalTestsPeopleAntigen":null,"positiveTestsPeopleAntigen":null,"totalTestsAntigen":null,"positiveTestsAntigen":null,"fips":"72","positiveIncrease":230,"negativeIncrease":0,"total":331006,"totalTestResultsIncrease":230,"posNeg":331006,"deathIncrease":5,"hospitalizedIncrease":0,"hash":"a576d0cde64fa6ac2c6091df23b6f82aa067dda5","commercialScore":0,"negativeRegularScore":0,"negativeScore":0,"positiveScore":0,"score":0,"grade":""},{"date":20201003,"state":"PR","positive":24804,"probableCases":null,"negative":305972,"pending":null,"totalTestResultsSource":"posNeg","totalTestResults":330776,"hospitalizedCurrently":348,"hospitalizedCumulative":null,"inIcuCurrently":57,"inIcuCumulative":null,"onVentilatorCurrently":31,"onVentilatorCumulative":null,"recovered":null,"dataQualityGrade":"C","lastUpdateEt":"10/3/2020 00:00","dateModified":"2020-10-03T24:00:00Z","checkTimeEt":"10/02 20:00","death":681,"hospitalized":null,"dateChecked":"2020-10-03T24:00:00Z","totalTestsViral":310546,"positiveTestsViral":7002,"negativeTestsViral":303412,"positiveCasesViral":24804,"deathConfirmed":508,"deathProbable":173,"totalTestEncountersViral":null,"totalTestsPeopleViral":null,"totalTestsAntibody":null,"positiveTestsAntibody":25571,"negativeTestsAntibody":null,"totalTestsPeopleAntibody":null,"positiveTestsPeopleAntibody":null,"negativeTestsPeopleAntibody":null,"totalTestsPeopleAntigen":null,"positiveTestsPeopleAntigen":null,"totalTestsAntigen":null,"positiveTestsAntigen":null,"fips":"72","positiveIncrease":299,"negativeIncrease":0,"total":330776,"totalTestResultsIncrease":299,"posNeg":330776,"deathIncrease":8,"hospitalizedIncrease":0,"hash":"2161a97886ff59e0f8283b795d4b58fa801abbff","commercialScore":0,"negativeRegularScore":0,"negativeScore":0,"positiveScore":0,"score":0,"grade":""},{"date":20201002,"state":"PR","positive":24505,"probableCases":null,"negative":305972,"pending":null,"totalTestResultsSource":"posNeg","totalTestResults":330477,"hospitalizedCurrently":339,"hospitalizedCumulative":null,"inIcuCurrently":59,"inIcuCumulative":null,"onVentilatorCurrently":38,"onVentilatorCumulative":null,"recovered":null,"dataQualityGrade":"C","lastUpdateEt":"10/2/2020 00:00","dateModified":"2020-10-02T24:00:00Z","checkTimeEt":"10/01 20:00","death":673,"hospitalized":null,"dateChecked":"2020-10-02T24:00:00Z","totalTestsViral":310546,"positiveTestsViral":7002,"negativeTestsViral":303412,"positiveCasesViral":24505,"deathConfirmed":500,"deathProbable":173,"totalTestEncountersViral":null,"totalTestsPeopleViral":null,"totalTestsAntibody":null,"positiveTestsAntibody":25242,"negativeTestsAntibody":null,"totalTestsPeopleAntibody":null,"positiveTestsPeopleAntibody":null,"negativeTestsPeopleAntibody":null,"totalTestsPeopleAntigen":null,"positiveTestsPeopleAntigen":null,"totalTestsAntigen":null,"positiveTestsAntigen":null,"fips":"72","positiveIncrease":329,"negativeIncrease":0,"total":330477,"totalTestResultsIncrease":329,"posNeg":330477,"deathIncrease":8,"hospitalizedIncrease":0,"hash":"7e08a05770d1dc3840758f20025aa1aa9a960678","commercialScore":0,"negativeRegularScore":0,"negativeScore":0,"positiveScore":0,"score":0,"grade":""},{"date":20201001,"state":"PR","positive":24176,"probableCases":null,"negative":305972,"pending":null,"totalTestResultsSource":"posNeg","totalTestResults":330148,"hospitalizedCurrently":316,"hospitalizedCumulative":null,"inIcuCurrently":59,"inIcuCumulative":null,"onVentilatorCurrently":38,"onVentilatorCumulative":null,"recovered":null,"dataQualityGrade":"C","lastUpdateEt":"10/1/2020 00:00","dateModified":"2020-10-01T24:00:00Z","checkTimeEt":"09/30 20:00","death":665,"hospitalized":null,"dateChecked":"2020-10-01T24:00:00Z","totalTestsViral":310546,"positiveTestsViral":7002,"negativeTestsViral":303412,"positiveCasesViral":24176,"deathConfirmed":492,"deathProbable":173,"totalTestEncountersViral":null,"totalTestsPeopleViral":null,"totalTestsAntibody":null,"positiveTestsAntibody":24891,"negativeTestsAntibody":null,"totalTestsPeopleAntibody":null,"positiveTestsPeopleAntibody":null,"negativeTestsPeopleAntibody":null,"totalTestsPeopleAntigen":null,"positiveTestsPeopleAntigen":null,"totalTestsAntigen":null,"positiveTestsAntigen":null,"fips":"72","positiveIncrease":176,"negativeIncrease":0,"total":330148,"totalTestResultsIncrease":176,"posNeg":330148,"deathIncrease":4,"hospitalizedIncrease":0,"hash":"b49cc1edb8e8b939da56276e27b1cdb2945d3c56","commercialScore":0,"negativeRegularScore":0,"negativeScore":0,"positiveScore":0,"score":0,"grade":""},{"date":20200930,"state":"PR","positive":24000,"probableCases":null,"negative":305972,"pending":null,"totalTestResultsSource":"posNeg","totalTestResults":329972,"hospitalizedCurrently":327,"hospitalizedCumulative":null,"inIcuCurrently":62,"inIcuCumulative":null,"onVentilatorCurrently":39,"onVentilatorCumulative":null,"recovered":null,"dataQualityGrade":"C","lastUpdateEt":"9/30/2020 00:00","dateModified":"2020-09-30T24:00:00Z","checkTimeEt":"09/29 20:00","death":661,"hospitalized":null,"dateChecked":"2020-09-30T24:00:00Z","totalTestsViral":415664,"positiveTestsViral":20103,"negativeTestsViral":395291,"positiveCasesViral":24000,"deathConfirmed":489,"deathProbable":172,"totalTestEncountersViral":null,"totalTestsPeopleViral":null,"totalTestsAntibody":null,"positiveTestsAntibody":24755,"negativeTestsAntibody":null,"totalTestsPeopleAntibody":null,"positiveTestsPeopleAntibody":null,"negativeTestsPeopleAntibody":null,"totalTestsPeopleAntigen":null,"positiveTestsPeopleAntigen":null,"totalTestsAntigen":null,"positiveTestsAntigen":null,"fips":"72","positiveIncrease":199,"negativeIncrease":0,"total":329972,"totalTestResultsIncrease":199,"posNeg":329972,"deathIncrease":7,"hospitalizedIncrease":0,"hash":"95f8b8a79731182e0e6c51d591275279611a3d99","commercialScore":0,"negativeRegularScore":0,"negativeScore":0,"positiveScore":0,"score":0,"grade":""},{"date":20200929,"state":"PR","positive":23801,"probableCases":null,"negative":305972,"pending":null,"totalTestResultsSource":"posNeg","totalTestResults":329773,"hospitalizedCurrently":353,"hospitalizedCumulative":null,"inIcuCurrently":68,"inIcuCumulative":null,"onVentilatorCurrently":33,"onVentilatorCumulative":null,"recovered":null,"dataQualityGrade":"C","lastUpdateEt":"9/29/2020 00:00","dateModified":"2020-09-29T24:00:00Z","checkTimeEt":"09/28 20:00","death":654,"hospitalized":null,"dateChecked":"2020-09-29T24:00:00Z","totalTestsViral":415664,"positiveTestsViral":20103,"negativeTestsViral":395291,"positiveCasesViral":23801,"deathConfirmed":483,"deathProbable":171,"totalTestEncountersViral":null,"totalTestsPeopleViral":null,"totalTestsAntibody":null,"positiveTestsAntibody":24666,"negativeTestsAntibody":null,"totalTestsPeopleAntibody":null,"positiveTestsPeopleAntibody":null,"negativeTestsPeopleAntibody":null,"totalTestsPeopleAntigen":null,"positiveTestsPeopleAntigen":null,"totalTestsAntigen":null,"positiveTestsAntigen":null,"fips":"72","positiveIncrease":444,"negativeIncrease":0,"total":329773,"totalTestResultsIncrease":444,"posNeg":329773,"deathIncrease":6,"hospitalizedIncrease":0,"hash":"d1820e253038b1c7ab7c4c90443b9934b82f057f","commercialScore":0,"negativeRegularScore":0,"negativeScore":0,"positiveScore":0,"score":0,"grade":""},{"date":20200928,"state":"PR","positive":23357,"probableCases":null,"negative":305972,"pending":null,"totalTestResultsSource":"posNeg","totalTestResults":329329,"hospitalizedCurrently":339,"hospitalizedCumulative":null,"inIcuCurrently":69,"inIcuCumulative":null,"onVentilatorCurrently":38,"onVentilatorCumulative":null,"recovered":null,"dataQualityGrade":"C","lastUpdateEt":"9/28/2020 00:00","dateModified":"2020-09-28T24:00:00Z","checkTimeEt":"09/27 20:00","death":648,"hospitalized":null,"dateChecked":"2020-09-28T24:00:00Z","totalTestsViral":415664,"positiveTestsViral":20103,"negativeTestsViral":395291,"positiveCasesViral":23357,"deathConfirmed":477,"deathProbable":171,"totalTestEncountersViral":null,"totalTestsPeopleViral":null,"totalTestsAntibody":null,"positiveTestsAntibody":24065,"negativeTestsAntibody":null,"totalTestsPeopleAntibody":null,"positiveTestsPeopleAntibody":null,"negativeTestsPeopleAntibody":null,"totalTestsPeopleAntigen":null,"positiveTestsPeopleAntigen":null,"totalTestsAntigen":null,"positiveTestsAntigen":null,"fips":"72","positiveIncrease":660,"negativeIncrease":0,"total":329329,"totalTestResultsIncrease":660,"posNeg":329329,"deathIncrease":4,"hospitalizedIncrease":0,"hash":"f8e0a321d43ec292cd0676581e6ede098c07c3a4","commercialScore":0,"negativeRegularScore":0,"negativeScore":0,"positiveScore":0,"score":0,"grade":""},{"date":20200927,"state":"PR","positive":22697,"probableCases":null,"negative":305972,"pending":null,"totalTestResultsSource":"posNeg","totalTestResults":328669,"hospitalizedCurrently":349,"hospitalizedCumulative":null,"inIcuCurrently":65,"inIcuCumulative":null,"onVentilatorCurrently":38,"onVentilatorCumulative":null,"recovered":null,"dataQualityGrade":"C","lastUpdateEt":"9/27/2020 00:00","dateModified":"2020-09-27T24:00:00Z","checkTimeEt":"09/26 20:00","death":644,"hospitalized":null,"dateChecked":"2020-09-27T24:00:00Z","totalTestsViral":415664,"positiveTestsViral":20103,"negativeTestsViral":395291,"positiveCasesViral":22697,"deathConfirmed":473,"deathProbable":171,"totalTestEncountersViral":null,"totalTestsPeopleViral":null,"totalTestsAntibody":null,"positiveTestsAntibody":23607,"negativeTestsAntibody":null,"totalTestsPeopleAntibody":null,"positiveTestsPeopleAntibody":null,"negativeTestsPeopleAntibody":null,"totalTestsPeopleAntigen":null,"positiveTestsPeopleAntigen":null,"totalTestsAntigen":null,"positiveTestsAntigen":null,"fips":"72","positiveIncrease":533,"negativeIncrease":0,"total":328669,"totalTestResultsIncrease":533,"posNeg":328669,"deathIncrease":2,"hospitalizedIncrease":0,"hash":"ec8eac4c9aed7481b56c415f60182c464932e2fd","commercialScore":0,"negativeRegularScore":0,"negativeScore":0,"positiveScore":0,"score":0,"grade":""},{"date":20200926,"state":"PR","positive":22164,"probableCases":null,"negative":305972,"pending":null,"totalTestResultsSource":"posNeg","totalTestResults":328136,"hospitalizedCurrently":342,"hospitalizedCumulative":null,"inIcuCurrently":59,"inIcuCumulative":null,"onVentilatorCurrently":33,"onVentilatorCumulative":null,"recovered":null,"dataQualityGrade":"C","lastUpdateEt":"9/26/2020 00:00","dateModified":"2020-09-26T24:00:00Z","checkTimeEt":"09/25 20:00","death":642,"hospitalized":null,"dateChecked":"2020-09-26T24:00:00Z","totalTestsViral":415664,"positiveTestsViral":20103,"negativeTestsViral":395291,"positiveCasesViral":22164,"deathConfirmed":471,"deathProbable":171,"totalTestEncountersViral":null,"totalTestsPeopleViral":null,"totalTestsAntibody":null,"positiveTestsAntibody":23249,"negativeTestsAntibody":null,"totalTestsPeopleAntibody":null,"positiveTestsPeopleAntibody":null,"negativeTestsPeopleAntibody":null,"totalTestsPeopleAntigen":null,"positiveTestsPeopleAntigen":null,"totalTestsAntigen":null,"positiveTestsAntigen":null,"fips":"72","positiveIncrease":296,"negativeIncrease":0,"total":328136,"totalTestResultsIncrease":296,"posNeg":328136,"deathIncrease":7,"hospitalizedIncrease":0,"hash":"9e54099a0e62097670958dde09d50bdb9d9eb14e","commercialScore":0,"negativeRegularScore":0,"negativeScore":0,"positiveScore":0,"score":0,"grade":""},{"date":20200925,"state":"PR","positive":21868,"probableCases":null,"negative":305972,"pending":null,"totalTestResultsSource":"posNeg","totalTestResults":327840,"hospitalizedCurrently":376,"hospitalizedCumulative":null,"inIcuCurrently":67,"inIcuCumulative":null,"onVentilatorCurrently":28,"onVentilatorCumulative":null,"recovered":null,"dataQualityGrade":"C","lastUpdateEt":"9/25/2020 00:00","dateModified":"2020-09-25T24:00:00Z","checkTimeEt":"09/24 20:00","death":635,"hospitalized":null,"dateChecked":"2020-09-25T24:00:00Z","totalTestsViral":415664,"positiveTestsViral":20103,"negativeTestsViral":395291,"positiveCasesViral":21868,"deathConfirmed":464,"deathProbable":171,"totalTestEncountersViral":null,"totalTestsPeopleViral":null,"totalTestsAntibody":null,"positiveTestsAntibody":23037,"negativeTestsAntibody":null,"totalTestsPeopleAntibody":null,"positiveTestsPeopleAntibody":null,"negativeTestsPeopleAntibody":null,"totalTestsPeopleAntigen":null,"positiveTestsPeopleAntigen":null,"totalTestsAntigen":null,"positiveTestsAntigen":null,"fips":"72","positiveIncrease":712,"negativeIncrease":0,"total":327840,"totalTestResultsIncrease":712,"posNeg":327840,"deathIncrease":8,"hospitalizedIncrease":0,"hash":"84e89163dc4e75af9a050a653b28651cbdfad983","commercialScore":0,"negativeRegularScore":0,"negativeScore":0,"positiveScore":0,"score":0,"grade":""},{"date":20200924,"state":"PR","positive":21156,"probableCases":null,"negative":305972,"pending":null,"totalTestResultsSource":"posNeg","totalTestResults":327128,"hospitalizedCurrently":364,"hospitalizedCumulative":null,"inIcuCurrently":65,"inIcuCumulative":null,"onVentilatorCurrently":33,"onVentilatorCumulative":null,"recovered":null,"dataQualityGrade":"C","lastUpdateEt":"9/24/2020 00:00","dateModified":"2020-09-24T24:00:00Z","checkTimeEt":"09/23 20:00","death":627,"hospitalized":null,"dateChecked":"2020-09-24T24:00:00Z","totalTestsViral":415664,"positiveTestsViral":20103,"negativeTestsViral":395291,"positiveCasesViral":21156,"deathConfirmed":456,"deathProbable":171,"totalTestEncountersViral":null,"totalTestsPeopleViral":null,"totalTestsAntibody":null,"positiveTestsAntibody":22686,"negativeTestsAntibody":null,"totalTestsPeopleAntibody":null,"positiveTestsPeopleAntibody":null,"negativeTestsPeopleAntibody":null,"totalTestsPeopleAntigen":null,"positiveTestsPeopleAntigen":null,"totalTestsAntigen":null,"positiveTestsAntigen":null,"fips":"72","positiveIncrease":717,"negativeIncrease":0,"total":327128,"totalTestResultsIncrease":717,"posNeg":327128,"deathIncrease":10,"hospitalizedIncrease":0,"hash":"efac0c86a1c42ca0310b7415de0202ffc9bc2127","commercialScore":0,"negativeRegularScore":0,"negativeScore":0,"positiveScore":0,"score":0,"grade":""},{"date":20200923,"state":"PR","positive":20439,"probableCases":null,"negative":305972,"pending":null,"totalTestResultsSource":"posNeg","totalTestResults":326411,"hospitalizedCurrently":376,"hospitalizedCumulative":null,"inIcuCurrently":63,"inIcuCumulative":null,"onVentilatorCurrently":36,"onVentilatorCumulative":null,"recovered":null,"dataQualityGrade":"C","lastUpdateEt":"9/23/2020 00:00","dateModified":"2020-09-23T24:00:00Z","checkTimeEt":"09/22 20:00","death":617,"hospitalized":null,"dateChecked":"2020-09-23T24:00:00Z","totalTestsViral":415664,"positiveTestsViral":20103,"negativeTestsViral":395291,"positiveCasesViral":20439,"deathConfirmed":447,"deathProbable":170,"totalTestEncountersViral":null,"totalTestsPeopleViral":null,"totalTestsAntibody":null,"positiveTestsAntibody":22221,"negativeTestsAntibody":null,"totalTestsPeopleAntibody":null,"positiveTestsPeopleAntibody":null,"negativeTestsPeopleAntibody":null,"totalTestsPeopleAntigen":null,"positiveTestsPeopleAntigen":null,"totalTestsAntigen":null,"positiveTestsAntigen":null,"fips":"72","positiveIncrease":40,"negativeIncrease":0,"total":326411,"totalTestResultsIncrease":40,"posNeg":326411,"deathIncrease":4,"hospitalizedIncrease":0,"hash":"e36114057db8d1933fec29df87fe91c642eb2856","commercialScore":0,"negativeRegularScore":0,"negativeScore":0,"positiveScore":0,"score":0,"grade":""},{"date":20200922,"state":"PR","positive":20399,"probableCases":null,"negative":305972,"pending":null,"totalTestResultsSource":"posNeg","totalTestResults":326371,"hospitalizedCurrently":369,"hospitalizedCumulative":null,"inIcuCurrently":63,"inIcuCumulative":null,"onVentilatorCurrently":42,"onVentilatorCumulative":null,"recovered":null,"dataQualityGrade":"C","lastUpdateEt":"9/22/2020 00:00","dateModified":"2020-09-22T24:00:00Z","checkTimeEt":"09/21 20:00","death":613,"hospitalized":null,"dateChecked":"2020-09-22T24:00:00Z","totalTestsViral":415664,"positiveTestsViral":20103,"negativeTestsViral":395291,"positiveCasesViral":20399,"deathConfirmed":443,"deathProbable":170,"totalTestEncountersViral":null,"totalTestsPeopleViral":null,"totalTestsAntibody":null,"positiveTestsAntibody":22197,"negativeTestsAntibody":null,"totalTestsPeopleAntibody":null,"positiveTestsPeopleAntibody":null,"negativeTestsPeopleAntibody":null,"totalTestsPeopleAntigen":null,"positiveTestsPeopleAntigen":null,"totalTestsAntigen":null,"positiveTestsAntigen":null,"fips":"72","positiveIncrease":88,"negativeIncrease":0,"total":326371,"totalTestResultsIncrease":88,"posNeg":326371,"deathIncrease":4,"hospitalizedIncrease":0,"hash":"82474ec552cb6774ebf7bc5125e90bc30251a0b5","commercialScore":0,"negativeRegularScore":0,"negativeScore":0,"positiveScore":0,"score":0,"grade":""},{"date":20200921,"state":"PR","positive":20311,"probableCases":null,"negative":305972,"pending":null,"totalTestResultsSource":"posNeg","totalTestResults":326283,"hospitalizedCurrently":386,"hospitalizedCumulative":null,"inIcuCurrently":63,"inIcuCumulative":null,"onVentilatorCurrently":41,"onVentilatorCumulative":null,"recovered":null,"dataQualityGrade":"C","lastUpdateEt":"9/21/2020 00:00","dateModified":"2020-09-21T24:00:00Z","checkTimeEt":"09/20 20:00","death":609,"hospitalized":null,"dateChecked":"2020-09-21T24:00:00Z","totalTestsViral":415664,"positiveTestsViral":20103,"negativeTestsViral":395291,"positiveCasesViral":20311,"deathConfirmed":439,"deathProbable":170,"totalTestEncountersViral":null,"totalTestsPeopleViral":null,"totalTestsAntibody":null,"positiveTestsAntibody":22165,"negativeTestsAntibody":null,"totalTestsPeopleAntibody":null,"positiveTestsPeopleAntibody":null,"negativeTestsPeopleAntibody":null,"totalTestsPeopleAntigen":null,"positiveTestsPeopleAntigen":null,"totalTestsAntigen":null,"positiveTestsAntigen":null,"fips":"72","positiveIncrease":242,"negativeIncrease":0,"total":326283,"totalTestResultsIncrease":242,"posNeg":326283,"deathIncrease":1,"hospitalizedIncrease":0,"hash":"f154f27c66dc18c8ece9deb534c5fecd2983b5c2","commercialScore":0,"negativeRegularScore":0,"negativeScore":0,"positiveScore":0,"score":0,"grade":""},{"date":20200920,"state":"PR","positive":20069,"probableCases":null,"negative":305972,"pending":null,"totalTestResultsSource":"posNeg","totalTestResults":326041,"hospitalizedCurrently":384,"hospitalizedCumulative":null,"inIcuCurrently":64,"inIcuCumulative":null,"onVentilatorCurrently":43,"onVentilatorCumulative":null,"recovered":null,"dataQualityGrade":"C","lastUpdateEt":"9/20/2020 00:00","dateModified":"2020-09-20T24:00:00Z","checkTimeEt":"09/19 20:00","death":608,"hospitalized":null,"dateChecked":"2020-09-20T24:00:00Z","totalTestsViral":415664,"positiveTestsViral":20103,"negativeTestsViral":395291,"positiveCasesViral":20069,"deathConfirmed":438,"deathProbable":170,"totalTestEncountersViral":null,"totalTestsPeopleViral":null,"totalTestsAntibody":null,"positiveTestsAntibody":21769,"negativeTestsAntibody":null,"totalTestsPeopleAntibody":null,"positiveTestsPeopleAntibody":null,"negativeTestsPeopleAntibody":null,"totalTestsPeopleAntigen":null,"positiveTestsPeopleAntigen":null,"totalTestsAntigen":null,"positiveTestsAntigen":null,"fips":"72","positiveIncrease":262,"negativeIncrease":0,"total":326041,"totalTestResultsIncrease":262,"posNeg":326041,"deathIncrease":3,"hospitalizedIncrease":0,"hash":"4798b6be5e2999fdb01f595b03ca88cfcb7a5893","commercialScore":0,"negativeRegularScore":0,"negativeScore":0,"positiveScore":0,"score":0,"grade":""},{"date":20200919,"state":"PR","positive":19807,"probableCases":null,"negative":305972,"pending":null,"totalTestResultsSource":"posNeg","totalTestResults":325779,"hospitalizedCurrently":403,"hospitalizedCumulative":null,"inIcuCurrently":61,"inIcuCumulative":null,"onVentilatorCurrently":39,"onVentilatorCumulative":null,"recovered":null,"dataQualityGrade":"C","lastUpdateEt":"9/19/2020 00:00","dateModified":"2020-09-19T24:00:00Z","checkTimeEt":"09/18 20:00","death":605,"hospitalized":null,"dateChecked":"2020-09-19T24:00:00Z","totalTestsViral":415664,"positiveTestsViral":20103,"negativeTestsViral":395291,"positiveCasesViral":19807,"deathConfirmed":435,"deathProbable":170,"totalTestEncountersViral":null,"totalTestsPeopleViral":null,"totalTestsAntibody":null,"positiveTestsAntibody":21186,"negativeTestsAntibody":null,"totalTestsPeopleAntibody":null,"positiveTestsPeopleAntibody":null,"negativeTestsPeopleAntibody":null,"totalTestsPeopleAntigen":null,"positiveTestsPeopleAntigen":null,"totalTestsAntigen":null,"positiveTestsAntigen":null,"fips":"72","positiveIncrease":694,"negativeIncrease":0,"total":325779,"totalTestResultsIncrease":694,"posNeg":325779,"deathIncrease":6,"hospitalizedIncrease":0,"hash":"b8bdcc4ca62e6387bedaaae9df2bdaa40dd0ba10","commercialScore":0,"negativeRegularScore":0,"negativeScore":0,"positiveScore":0,"score":0,"grade":""},{"date":20200918,"state":"PR","positive":19113,"probableCases":null,"negative":305972,"pending":null,"totalTestResultsSource":"posNeg","totalTestResults":325085,"hospitalizedCurrently":435,"hospitalizedCumulative":null,"inIcuCurrently":70,"inIcuCumulative":null,"onVentilatorCurrently":41,"onVentilatorCumulative":null,"recovered":null,"dataQualityGrade":"C","lastUpdateEt":"9/18/2020 00:00","dateModified":"2020-09-18T24:00:00Z","checkTimeEt":"09/17 20:00","death":599,"hospitalized":null,"dateChecked":"2020-09-18T24:00:00Z","totalTestsViral":415664,"positiveTestsViral":20103,"negativeTestsViral":395291,"positiveCasesViral":19113,"deathConfirmed":430,"deathProbable":169,"totalTestEncountersViral":null,"totalTestsPeopleViral":null,"totalTestsAntibody":null,"positiveTestsAntibody":20571,"negativeTestsAntibody":null,"totalTestsPeopleAntibody":null,"positiveTestsPeopleAntibody":null,"negativeTestsPeopleAntibody":null,"totalTestsPeopleAntigen":null,"positiveTestsPeopleAntigen":null,"totalTestsAntigen":null,"positiveTestsAntigen":null,"fips":"72","positiveIncrease":479,"negativeIncrease":0,"total":325085,"totalTestResultsIncrease":479,"posNeg":325085,"deathIncrease":11,"hospitalizedIncrease":0,"hash":"1f5fbbfd686337750e04fd342565e77006605ca3","commercialScore":0,"negativeRegularScore":0,"negativeScore":0,"positiveScore":0,"score":0,"grade":""},{"date":20200917,"state":"PR","positive":18634,"probableCases":null,"negative":305972,"pending":null,"totalTestResultsSource":"posNeg","totalTestResults":324606,"hospitalizedCurrently":444,"hospitalizedCumulative":null,"inIcuCurrently":68,"inIcuCumulative":null,"onVentilatorCurrently":41,"onVentilatorCumulative":null,"recovered":null,"dataQualityGrade":"C","lastUpdateEt":"9/17/2020 00:00","dateModified":"2020-09-17T24:00:00Z","checkTimeEt":"09/16 20:00","death":588,"hospitalized":null,"dateChecked":"2020-09-17T24:00:00Z","totalTestsViral":415664,"positiveTestsViral":20103,"negativeTestsViral":395291,"positiveCasesViral":18634,"deathConfirmed":420,"deathProbable":168,"totalTestEncountersViral":null,"totalTestsPeopleViral":null,"totalTestsAntibody":null,"positiveTestsAntibody":20233,"negativeTestsAntibody":null,"totalTestsPeopleAntibody":null,"positiveTestsPeopleAntibody":null,"negativeTestsPeopleAntibody":null,"totalTestsPeopleAntigen":null,"positiveTestsPeopleAntigen":null,"totalTestsAntigen":null,"positiveTestsAntigen":null,"fips":"72","positiveIncrease":382,"negativeIncrease":0,"total":324606,"totalTestResultsIncrease":382,"posNeg":324606,"deathIncrease":18,"hospitalizedIncrease":0,"hash":"bf9211666b00b41642faca51825464c1765ca92d","commercialScore":0,"negativeRegularScore":0,"negativeScore":0,"positiveScore":0,"score":0,"grade":""},{"date":20200916,"state":"PR","positive":18252,"probableCases":null,"negative":305972,"pending":null,"totalTestResultsSource":"posNeg","totalTestResults":324224,"hospitalizedCurrently":434,"hospitalizedCumulative":null,"inIcuCurrently":68,"inIcuCumulative":null,"onVentilatorCurrently":40,"onVentilatorCumulative":null,"recovered":null,"dataQualityGrade":"C","lastUpdateEt":"9/16/2020 00:00","dateModified":"2020-09-16T24:00:00Z","checkTimeEt":"09/15 20:00","death":570,"hospitalized":null,"dateChecked":"2020-09-16T24:00:00Z","totalTestsViral":415664,"positiveTestsViral":20103,"negativeTestsViral":395291,"positiveCasesViral":18252,"deathConfirmed":403,"deathProbable":167,"totalTestEncountersViral":null,"totalTestsPeopleViral":null,"totalTestsAntibody":null,"positiveTestsAntibody":20032,"negativeTestsAntibody":null,"totalTestsPeopleAntibody":null,"positiveTestsPeopleAntibody":null,"negativeTestsPeopleAntibody":null,"totalTestsPeopleAntigen":null,"positiveTestsPeopleAntigen":null,"totalTestsAntigen":null,"positiveTestsAntigen":null,"fips":"72","positiveIncrease":46,"negativeIncrease":0,"total":324224,"totalTestResultsIncrease":46,"posNeg":324224,"deathIncrease":19,"hospitalizedIncrease":0,"hash":"2bef90bd34a30c19af3822470964636961bf29f2","commercialScore":0,"negativeRegularScore":0,"negativeScore":0,"positiveScore":0,"score":0,"grade":""},{"date":20200915,"state":"PR","positive":18206,"probableCases":null,"negative":305972,"pending":null,"totalTestResultsSource":"posNeg","totalTestResults":324178,"hospitalizedCurrently":408,"hospitalizedCumulative":null,"inIcuCurrently":65,"inIcuCumulative":null,"onVentilatorCurrently":44,"onVentilatorCumulative":null,"recovered":null,"dataQualityGrade":"C","lastUpdateEt":"9/15/2020 00:00","dateModified":"2020-09-15T24:00:00Z","checkTimeEt":"09/14 20:00","death":551,"hospitalized":null,"dateChecked":"2020-09-15T24:00:00Z","totalTestsViral":415664,"positiveTestsViral":20103,"negativeTestsViral":395291,"positiveCasesViral":18206,"deathConfirmed":385,"deathProbable":166,"totalTestEncountersViral":null,"totalTestsPeopleViral":null,"totalTestsAntibody":null,"positiveTestsAntibody":19966,"negativeTestsAntibody":null,"totalTestsPeopleAntibody":null,"positiveTestsPeopleAntibody":null,"negativeTestsPeopleAntibody":null,"totalTestsPeopleAntigen":null,"positiveTestsPeopleAntigen":null,"totalTestsAntigen":null,"positiveTestsAntigen":null,"fips":"72","positiveIncrease":229,"negativeIncrease":0,"total":324178,"totalTestResultsIncrease":229,"posNeg":324178,"deathIncrease":9,"hospitalizedIncrease":0,"hash":"d689094b305c357ee74473f70f34851ae58d410d","commercialScore":0,"negativeRegularScore":0,"negativeScore":0,"positiveScore":0,"score":0,"grade":""},{"date":20200914,"state":"PR","positive":17977,"probableCases":null,"negative":305972,"pending":null,"totalTestResultsSource":"posNeg","totalTestResults":323949,"hospitalizedCurrently":414,"hospitalizedCumulative":null,"inIcuCurrently":63,"inIcuCumulative":null,"onVentilatorCurrently":37,"onVentilatorCumulative":null,"recovered":null,"dataQualityGrade":"C","lastUpdateEt":"9/14/2020 00:00","dateModified":"2020-09-14T24:00:00Z","checkTimeEt":"09/13 20:00","death":542,"hospitalized":null,"dateChecked":"2020-09-14T24:00:00Z","totalTestsViral":415664,"positiveTestsViral":20103,"negativeTestsViral":395291,"positiveCasesViral":17977,"deathConfirmed":376,"deathProbable":166,"totalTestEncountersViral":null,"totalTestsPeopleViral":null,"totalTestsAntibody":null,"positiveTestsAntibody":19773,"negativeTestsAntibody":null,"totalTestsPeopleAntibody":null,"positiveTestsPeopleAntibody":null,"negativeTestsPeopleAntibody":null,"totalTestsPeopleAntigen":null,"positiveTestsPeopleAntigen":null,"totalTestsAntigen":null,"positiveTestsAntigen":null,"fips":"72","positiveIncrease":208,"negativeIncrease":0,"total":323949,"totalTestResultsIncrease":208,"posNeg":323949,"deathIncrease":3,"hospitalizedIncrease":0,"hash":"03f172d57da19af03c516b3a90232c05445d6d3d","commercialScore":0,"negativeRegularScore":0,"negativeScore":0,"positiveScore":0,"score":0,"grade":""},{"date":20200913,"state":"PR","positive":17769,"probableCases":null,"negative":305972,"pending":null,"totalTestResultsSource":"posNeg","totalTestResults":323741,"hospitalizedCurrently":396,"hospitalizedCumulative":null,"inIcuCurrently":67,"inIcuCumulative":null,"onVentilatorCurrently":50,"onVentilatorCumulative":null,"recovered":null,"dataQualityGrade":"C","lastUpdateEt":"9/13/2020 00:00","dateModified":"2020-09-13T24:00:00Z","checkTimeEt":"09/12 20:00","death":539,"hospitalized":null,"dateChecked":"2020-09-13T24:00:00Z","totalTestsViral":415664,"positiveTestsViral":20103,"negativeTestsViral":395291,"positiveCasesViral":17769,"deathConfirmed":373,"deathProbable":166,"totalTestEncountersViral":null,"totalTestsPeopleViral":null,"totalTestsAntibody":null,"positiveTestsAntibody":19611,"negativeTestsAntibody":null,"totalTestsPeopleAntibody":null,"positiveTestsPeopleAntibody":null,"negativeTestsPeopleAntibody":null,"totalTestsPeopleAntigen":null,"positiveTestsPeopleAntigen":null,"totalTestsAntigen":null,"positiveTestsAntigen":null,"fips":"72","positiveIncrease":171,"negativeIncrease":0,"total":323741,"totalTestResultsIncrease":171,"posNeg":323741,"deathIncrease":4,"hospitalizedIncrease":0,"hash":"7e79ab5d692de99125b50393a5df0c7e50ac9078","commercialScore":0,"negativeRegularScore":0,"negativeScore":0,"positiveScore":0,"score":0,"grade":""},{"date":20200912,"state":"PR","positive":17598,"probableCases":null,"negative":305972,"pending":null,"totalTestResultsSource":"posNeg","totalTestResults":323570,"hospitalizedCurrently":420,"hospitalizedCumulative":null,"inIcuCurrently":71,"inIcuCumulative":null,"onVentilatorCurrently":54,"onVentilatorCumulative":null,"recovered":null,"dataQualityGrade":"C","lastUpdateEt":"9/12/2020 00:00","dateModified":"2020-09-12T24:00:00Z","checkTimeEt":"09/11 20:00","death":535,"hospitalized":null,"dateChecked":"2020-09-12T24:00:00Z","totalTestsViral":415664,"positiveTestsViral":20103,"negativeTestsViral":395291,"positiveCasesViral":17598,"deathConfirmed":370,"deathProbable":165,"totalTestEncountersViral":null,"totalTestsPeopleViral":null,"totalTestsAntibody":null,"positiveTestsAntibody":19494,"negativeTestsAntibody":null,"totalTestsPeopleAntibody":null,"positiveTestsPeopleAntibody":null,"negativeTestsPeopleAntibody":null,"totalTestsPeopleAntigen":null,"positiveTestsPeopleAntigen":null,"totalTestsAntigen":null,"positiveTestsAntigen":null,"fips":"72","positiveIncrease":241,"negativeIncrease":0,"total":323570,"totalTestResultsIncrease":241,"posNeg":323570,"deathIncrease":12,"hospitalizedIncrease":0,"hash":"dc0a0bcee01534919a4a6dc02af7e1f1f5eb9c74","commercialScore":0,"negativeRegularScore":0,"negativeScore":0,"positiveScore":0,"score":0,"grade":""},{"date":20200911,"state":"PR","positive":17357,"probableCases":null,"negative":305972,"pending":null,"totalTestResultsSource":"posNeg","totalTestResults":323329,"hospitalizedCurrently":401,"hospitalizedCumulative":null,"inIcuCurrently":68,"inIcuCumulative":null,"onVentilatorCurrently":52,"onVentilatorCumulative":null,"recovered":null,"dataQualityGrade":"C","lastUpdateEt":"9/11/2020 00:00","dateModified":"2020-09-11T24:00:00Z","checkTimeEt":"09/10 20:00","death":523,"hospitalized":null,"dateChecked":"2020-09-11T24:00:00Z","totalTestsViral":415664,"positiveTestsViral":20103,"negativeTestsViral":395291,"positiveCasesViral":17357,"deathConfirmed":359,"deathProbable":164,"totalTestEncountersViral":null,"totalTestsPeopleViral":null,"totalTestsAntibody":null,"positiveTestsAntibody":19224,"negativeTestsAntibody":null,"totalTestsPeopleAntibody":null,"positiveTestsPeopleAntibody":null,"negativeTestsPeopleAntibody":null,"totalTestsPeopleAntigen":null,"positiveTestsPeopleAntigen":null,"totalTestsAntigen":null,"positiveTestsAntigen":null,"fips":"72","positiveIncrease":109,"negativeIncrease":0,"total":323329,"totalTestResultsIncrease":109,"posNeg":323329,"deathIncrease":11,"hospitalizedIncrease":0,"hash":"58f4f97bdb2ee29df50f8e48e08fcf63e78ae766","commercialScore":0,"negativeRegularScore":0,"negativeScore":0,"positiveScore":0,"score":0,"grade":""},{"date":20200910,"state":"PR","positive":17248,"probableCases":null,"negative":305972,"pending":null,"totalTestResultsSource":"posNeg","totalTestResults":323220,"hospitalizedCurrently":421,"hospitalizedCumulative":null,"inIcuCurrently":70,"inIcuCumulative":null,"onVentilatorCurrently":57,"onVentilatorCumulative":null,"recovered":null,"dataQualityGrade":"C","lastUpdateEt":"9/10/2020 00:00","dateModified":"2020-09-10T24:00:00Z","checkTimeEt":"09/09 20:00","death":512,"hospitalized":null,"dateChecked":"2020-09-10T24:00:00Z","totalTestsViral":415664,"positiveTestsViral":20103,"negativeTestsViral":395291,"positiveCasesViral":17248,"deathConfirmed":349,"deathProbable":163,"totalTestEncountersViral":null,"totalTestsPeopleViral":null,"totalTestsAntibody":null,"positiveTestsAntibody":19031,"negativeTestsAntibody":null,"totalTestsPeopleAntibody":null,"positiveTestsPeopleAntibody":null,"negativeTestsPeopleAntibody":null,"totalTestsPeopleAntigen":null,"positiveTestsPeopleAntigen":null,"totalTestsAntigen":null,"positiveTestsAntigen":null,"fips":"72","positiveIncrease":459,"negativeIncrease":0,"total":323220,"totalTestResultsIncrease":459,"posNeg":323220,"deathIncrease":12,"hospitalizedIncrease":0,"hash":"0aa3fa16787e8e1527339b5ffa87f2aae9cf0758","commercialScore":0,"negativeRegularScore":0,"negativeScore":0,"positiveScore":0,"score":0,"grade":""},{"date":20200909,"state":"PR","positive":16789,"probableCases":null,"negative":305972,"pending":null,"totalTestResultsSource":"posNeg","totalTestResults":322761,"hospitalizedCurrently":400,"hospitalizedCumulative":null,"inIcuCurrently":71,"inIcuCumulative":null,"onVentilatorCurrently":56,"onVentilatorCumulative":null,"recovered":null,"dataQualityGrade":"C","lastUpdateEt":"9/9/2020 00:00","dateModified":"2020-09-09T24:00:00Z","checkTimeEt":"09/08 20:00","death":500,"hospitalized":null,"dateChecked":"2020-09-09T24:00:00Z","totalTestsViral":415664,"positiveTestsViral":20103,"negativeTestsViral":395291,"positiveCasesViral":16789,"deathConfirmed":337,"deathProbable":163,"totalTestEncountersViral":null,"totalTestsPeopleViral":null,"totalTestsAntibody":null,"positiveTestsAntibody":18718,"negativeTestsAntibody":null,"totalTestsPeopleAntibody":null,"positiveTestsPeopleAntibody":null,"negativeTestsPeopleAntibody":null,"totalTestsPeopleAntigen":null,"positiveTestsPeopleAntigen":null,"totalTestsAntigen":null,"positiveTestsAntigen":null,"fips":"72","positiveIncrease":1,"negativeIncrease":0,"total":322761,"totalTestResultsIncrease":1,"posNeg":322761,"deathIncrease":18,"hospitalizedIncrease":0,"hash":"d00f5c5a9ab26879458a4558f875367b78bc34d4","commercialScore":0,"negativeRegularScore":0,"negativeScore":0,"positiveScore":0,"score":0,"grade":""},{"date":20200908,"state":"PR","positive":16788,"probableCases":null,"negative":305972,"pending":null,"totalTestResultsSource":"posNeg","totalTestResults":322760,"hospitalizedCurrently":380,"hospitalizedCumulative":null,"inIcuCurrently":81,"inIcuCumulative":null,"onVentilatorCurrently":66,"onVentilatorCumulative":null,"recovered":null,"dataQualityGrade":"C","lastUpdateEt":"9/8/2020 00:00","dateModified":"2020-09-08T24:00:00Z","checkTimeEt":"09/07 20:00","death":482,"hospitalized":null,"dateChecked":"2020-09-08T24:00:00Z","totalTestsViral":415664,"positiveTestsViral":20103,"negativeTestsViral":395291,"positiveCasesViral":16788,"deathConfirmed":319,"deathProbable":163,"totalTestEncountersViral":null,"totalTestsPeopleViral":null,"totalTestsAntibody":null,"positiveTestsAntibody":18716,"negativeTestsAntibody":null,"totalTestsPeopleAntibody":null,"positiveTestsPeopleAntibody":null,"negativeTestsPeopleAntibody":null,"totalTestsPeopleAntigen":null,"positiveTestsPeopleAntigen":null,"totalTestsAntigen":null,"positiveTestsAntigen":null,"fips":"72","positiveIncrease":96,"negativeIncrease":0,"total":322760,"totalTestResultsIncrease":96,"posNeg":322760,"deathIncrease":5,"hospitalizedIncrease":0,"hash":"e4ec6d3ac640220210e0eca2f78b85689298b872","commercialScore":0,"negativeRegularScore":0,"negativeScore":0,"positiveScore":0,"score":0,"grade":""},{"date":20200907,"state":"PR","positive":16692,"probableCases":null,"negative":305972,"pending":null,"totalTestResultsSource":"posNeg","totalTestResults":322664,"hospitalizedCurrently":372,"hospitalizedCumulative":null,"inIcuCurrently":81,"inIcuCumulative":null,"onVentilatorCurrently":72,"onVentilatorCumulative":null,"recovered":null,"dataQualityGrade":"C","lastUpdateEt":"9/7/2020 00:00","dateModified":"2020-09-07T24:00:00Z","checkTimeEt":"09/06 20:00","death":477,"hospitalized":null,"dateChecked":"2020-09-07T24:00:00Z","totalTestsViral":415664,"positiveTestsViral":20103,"negativeTestsViral":395291,"positiveCasesViral":16692,"deathConfirmed":317,"deathProbable":160,"totalTestEncountersViral":null,"totalTestsPeopleViral":null,"totalTestsAntibody":null,"positiveTestsAntibody":18683,"negativeTestsAntibody":null,"totalTestsPeopleAntibody":null,"positiveTestsPeopleAntibody":null,"negativeTestsPeopleAntibody":null,"totalTestsPeopleAntigen":null,"positiveTestsPeopleAntigen":null,"totalTestsAntigen":null,"positiveTestsAntigen":null,"fips":"72","positiveIncrease":423,"negativeIncrease":0,"total":322664,"totalTestResultsIncrease":423,"posNeg":322664,"deathIncrease":0,"hospitalizedIncrease":0,"hash":"3f222fad6a3af307936e147c0a56329efef783ea","commercialScore":0,"negativeRegularScore":0,"negativeScore":0,"positiveScore":0,"score":0,"grade":""},{"date":20200906,"state":"PR","positive":16269,"probableCases":null,"negative":305972,"pending":null,"totalTestResultsSource":"posNeg","totalTestResults":322241,"hospitalizedCurrently":377,"hospitalizedCumulative":null,"inIcuCurrently":73,"inIcuCumulative":null,"onVentilatorCurrently":67,"onVentilatorCumulative":null,"recovered":null,"dataQualityGrade":"C","lastUpdateEt":"9/6/2020 00:00","dateModified":"2020-09-06T24:00:00Z","checkTimeEt":"09/05 20:00","death":477,"hospitalized":null,"dateChecked":"2020-09-06T24:00:00Z","totalTestsViral":415664,"positiveTestsViral":20103,"negativeTestsViral":395291,"positiveCasesViral":16269,"deathConfirmed":317,"deathProbable":160,"totalTestEncountersViral":null,"totalTestsPeopleViral":null,"totalTestsAntibody":null,"positiveTestsAntibody":18264,"negativeTestsAntibody":null,"totalTestsPeopleAntibody":null,"positiveTestsPeopleAntibody":null,"negativeTestsPeopleAntibody":null,"totalTestsPeopleAntigen":null,"positiveTestsPeopleAntigen":null,"totalTestsAntigen":null,"positiveTestsAntigen":null,"fips":"72","positiveIncrease":26,"negativeIncrease":0,"total":322241,"totalTestResultsIncrease":26,"posNeg":322241,"deathIncrease":13,"hospitalizedIncrease":0,"hash":"268f93760d0230ce4de30f054c7cff8fdecbc13b","commercialScore":0,"negativeRegularScore":0,"negativeScore":0,"positiveScore":0,"score":0,"grade":""},{"date":20200905,"state":"PR","positive":16243,"probableCases":null,"negative":305972,"pending":null,"totalTestResultsSource":"posNeg","totalTestResults":322215,"hospitalizedCurrently":369,"hospitalizedCumulative":null,"inIcuCurrently":76,"inIcuCumulative":null,"onVentilatorCurrently":67,"onVentilatorCumulative":null,"recovered":null,"dataQualityGrade":"C","lastUpdateEt":"9/5/2020 00:00","dateModified":"2020-09-05T24:00:00Z","checkTimeEt":"09/04 20:00","death":464,"hospitalized":null,"dateChecked":"2020-09-05T24:00:00Z","totalTestsViral":415664,"positiveTestsViral":20103,"negativeTestsViral":395291,"positiveCasesViral":16243,"deathConfirmed":309,"deathProbable":155,"totalTestEncountersViral":null,"totalTestsPeopleViral":null,"totalTestsAntibody":null,"positiveTestsAntibody":18249,"negativeTestsAntibody":null,"totalTestsPeopleAntibody":null,"positiveTestsPeopleAntibody":null,"negativeTestsPeopleAntibody":null,"totalTestsPeopleAntigen":null,"positiveTestsPeopleAntigen":null,"totalTestsAntigen":null,"positiveTestsAntigen":null,"fips":"72","positiveIncrease":142,"negativeIncrease":0,"total":322215,"totalTestResultsIncrease":142,"posNeg":322215,"deathIncrease":9,"hospitalizedIncrease":0,"hash":"0f45f4ba3e9fd61551cf8b3e96ef5d951c6e1d79","commercialScore":0,"negativeRegularScore":0,"negativeScore":0,"positiveScore":0,"score":0,"grade":""},{"date":20200904,"state":"PR","positive":16101,"probableCases":null,"negative":305972,"pending":null,"totalTestResultsSource":"posNeg","totalTestResults":322073,"hospitalizedCurrently":382,"hospitalizedCumulative":null,"inIcuCurrently":78,"inIcuCumulative":null,"onVentilatorCurrently":60,"onVentilatorCumulative":null,"recovered":null,"dataQualityGrade":"C","lastUpdateEt":"9/4/2020 00:00","dateModified":"2020-09-04T24:00:00Z","checkTimeEt":"09/03 20:00","death":455,"hospitalized":null,"dateChecked":"2020-09-04T24:00:00Z","totalTestsViral":415664,"positiveTestsViral":20103,"negativeTestsViral":395291,"positiveCasesViral":16101,"deathConfirmed":302,"deathProbable":153,"totalTestEncountersViral":null,"totalTestsPeopleViral":null,"totalTestsAntibody":null,"positiveTestsAntibody":18140,"negativeTestsAntibody":null,"totalTestsPeopleAntibody":null,"positiveTestsPeopleAntibody":null,"negativeTestsPeopleAntibody":null,"totalTestsPeopleAntigen":null,"positiveTestsPeopleAntigen":null,"totalTestsAntigen":null,"positiveTestsAntigen":null,"fips":"72","positiveIncrease":32,"negativeIncrease":0,"total":322073,"totalTestResultsIncrease":32,"posNeg":322073,"deathIncrease":7,"hospitalizedIncrease":0,"hash":"0bd109a53c5bb2fd819dd9f8f2550901e56c71f1","commercialScore":0,"negativeRegularScore":0,"negativeScore":0,"positiveScore":0,"score":0,"grade":""},{"date":20200903,"state":"PR","positive":16069,"probableCases":null,"negative":305972,"pending":null,"totalTestResultsSource":"posNeg","totalTestResults":322041,"hospitalizedCurrently":349,"hospitalizedCumulative":null,"inIcuCurrently":73,"inIcuCumulative":null,"onVentilatorCurrently":57,"onVentilatorCumulative":null,"recovered":null,"dataQualityGrade":"C","lastUpdateEt":"9/3/2020 00:00","dateModified":"2020-09-03T24:00:00Z","checkTimeEt":"09/02 20:00","death":448,"hospitalized":null,"dateChecked":"2020-09-03T24:00:00Z","totalTestsViral":415664,"positiveTestsViral":20103,"negativeTestsViral":395291,"positiveCasesViral":16069,"deathConfirmed":296,"deathProbable":152,"totalTestEncountersViral":null,"totalTestsPeopleViral":null,"totalTestsAntibody":null,"positiveTestsAntibody":18129,"negativeTestsAntibody":null,"totalTestsPeopleAntibody":null,"positiveTestsPeopleAntibody":null,"negativeTestsPeopleAntibody":null,"totalTestsPeopleAntigen":null,"positiveTestsPeopleAntigen":null,"totalTestsAntigen":null,"positiveTestsAntigen":null,"fips":"72","positiveIncrease":127,"negativeIncrease":0,"total":322041,"totalTestResultsIncrease":127,"posNeg":322041,"deathIncrease":5,"hospitalizedIncrease":0,"hash":"1c2e0eb63efd1f5ad98d205d5ee71b993247c409","commercialScore":0,"negativeRegularScore":0,"negativeScore":0,"positiveScore":0,"score":0,"grade":""},{"date":20200902,"state":"PR","positive":15942,"probableCases":null,"negative":305972,"pending":null,"totalTestResultsSource":"posNeg","totalTestResults":321914,"hospitalizedCurrently":373,"hospitalizedCumulative":null,"inIcuCurrently":71,"inIcuCumulative":null,"onVentilatorCurrently":53,"onVentilatorCumulative":null,"recovered":null,"dataQualityGrade":"C","lastUpdateEt":"9/2/2020 00:00","dateModified":"2020-09-02T24:00:00Z","checkTimeEt":"09/01 20:00","death":443,"hospitalized":null,"dateChecked":"2020-09-02T24:00:00Z","totalTestsViral":415664,"positiveTestsViral":20103,"negativeTestsViral":395291,"positiveCasesViral":15942,"deathConfirmed":293,"deathProbable":150,"totalTestEncountersViral":null,"totalTestsPeopleViral":null,"totalTestsAntibody":null,"positiveTestsAntibody":18061,"negativeTestsAntibody":null,"totalTestsPeopleAntibody":null,"positiveTestsPeopleAntibody":null,"negativeTestsPeopleAntibody":null,"totalTestsPeopleAntigen":null,"positiveTestsPeopleAntigen":null,"totalTestsAntigen":null,"positiveTestsAntigen":null,"fips":"72","positiveIncrease":358,"negativeIncrease":0,"total":321914,"totalTestResultsIncrease":358,"posNeg":321914,"deathIncrease":8,"hospitalizedIncrease":0,"hash":"882d3e0ed21f9abc50de2ede184f5658c14b68ec","commercialScore":0,"negativeRegularScore":0,"negativeScore":0,"positiveScore":0,"score":0,"grade":""},{"date":20200901,"state":"PR","positive":15584,"probableCases":null,"negative":305972,"pending":null,"totalTestResultsSource":"posNeg","totalTestResults":321556,"hospitalizedCurrently":392,"hospitalizedCumulative":null,"inIcuCurrently":71,"inIcuCumulative":null,"onVentilatorCurrently":51,"onVentilatorCumulative":null,"recovered":null,"dataQualityGrade":"B","lastUpdateEt":"9/1/2020 00:00","dateModified":"2020-09-01T24:00:00Z","checkTimeEt":"08/31 20:00","death":435,"hospitalized":null,"dateChecked":"2020-09-01T24:00:00Z","totalTestsViral":415664,"positiveTestsViral":20103,"negativeTestsViral":395291,"positiveCasesViral":15584,"deathConfirmed":288,"deathProbable":147,"totalTestEncountersViral":null,"totalTestsPeopleViral":null,"totalTestsAntibody":null,"positiveTestsAntibody":17837,"negativeTestsAntibody":null,"totalTestsPeopleAntibody":null,"positiveTestsPeopleAntibody":null,"negativeTestsPeopleAntibody":null,"totalTestsPeopleAntigen":null,"positiveTestsPeopleAntigen":null,"totalTestsAntigen":null,"positiveTestsAntigen":null,"fips":"72","positiveIncrease":108,"negativeIncrease":0,"total":321556,"totalTestResultsIncrease":108,"posNeg":321556,"deathIncrease":1,"hospitalizedIncrease":0,"hash":"1aed05608c4b5813a1146d7d108ec55b71ba1367","commercialScore":0,"negativeRegularScore":0,"negativeScore":0,"positiveScore":0,"score":0,"grade":""},{"date":20200831,"state":"PR","positive":15476,"probableCases":null,"negative":305972,"pending":null,"totalTestResultsSource":"posNeg","totalTestResults":321448,"hospitalizedCurrently":383,"hospitalizedCumulative":null,"inIcuCurrently":65,"inIcuCumulative":null,"onVentilatorCurrently":50,"onVentilatorCumulative":null,"recovered":null,"dataQualityGrade":"B","lastUpdateEt":"8/31/2020 00:00","dateModified":"2020-08-31T24:00:00Z","checkTimeEt":"08/30 20:00","death":434,"hospitalized":null,"dateChecked":"2020-08-31T24:00:00Z","totalTestsViral":415664,"positiveTestsViral":20103,"negativeTestsViral":395291,"positiveCasesViral":15476,"deathConfirmed":287,"deathProbable":147,"totalTestEncountersViral":null,"totalTestsPeopleViral":null,"totalTestsAntibody":null,"positiveTestsAntibody":17723,"negativeTestsAntibody":null,"totalTestsPeopleAntibody":null,"positiveTestsPeopleAntibody":null,"negativeTestsPeopleAntibody":null,"totalTestsPeopleAntigen":null,"positiveTestsPeopleAntigen":null,"totalTestsAntigen":null,"positiveTestsAntigen":null,"fips":"72","positiveIncrease":247,"negativeIncrease":0,"total":321448,"totalTestResultsIncrease":247,"posNeg":321448,"deathIncrease":0,"hospitalizedIncrease":0,"hash":"612719136a5ea294332dd1ea587fbbe2da272495","commercialScore":0,"negativeRegularScore":0,"negativeScore":0,"positiveScore":0,"score":0,"grade":""},{"date":20200830,"state":"PR","positive":15229,"probableCases":null,"negative":305972,"pending":null,"totalTestResultsSource":"posNeg","totalTestResults":321201,"hospitalizedCurrently":365,"hospitalizedCumulative":null,"inIcuCurrently":63,"inIcuCumulative":null,"onVentilatorCurrently":46,"onVentilatorCumulative":null,"recovered":null,"dataQualityGrade":"B","lastUpdateEt":"8/30/2020 00:00","dateModified":"2020-08-30T24:00:00Z","checkTimeEt":"08/29 20:00","death":434,"hospitalized":null,"dateChecked":"2020-08-30T24:00:00Z","totalTestsViral":415664,"positiveTestsViral":20103,"negativeTestsViral":395291,"positiveCasesViral":15229,"deathConfirmed":287,"deathProbable":147,"totalTestEncountersViral":null,"totalTestsPeopleViral":null,"totalTestsAntibody":null,"positiveTestsAntibody":17619,"negativeTestsAntibody":null,"totalTestsPeopleAntibody":null,"positiveTestsPeopleAntibody":null,"negativeTestsPeopleAntibody":null,"totalTestsPeopleAntigen":null,"positiveTestsPeopleAntigen":null,"totalTestsAntigen":null,"positiveTestsAntigen":null,"fips":"72","positiveIncrease":243,"negativeIncrease":0,"total":321201,"totalTestResultsIncrease":243,"posNeg":321201,"deathIncrease":6,"hospitalizedIncrease":0,"hash":"ab2dfc8bee248c805012c01d15580f8343141fba","commercialScore":0,"negativeRegularScore":0,"negativeScore":0,"positiveScore":0,"score":0,"grade":""},{"date":20200829,"state":"PR","positive":14986,"probableCases":null,"negative":305972,"pending":null,"totalTestResultsSource":"posNeg","totalTestResults":320958,"hospitalizedCurrently":365,"hospitalizedCumulative":null,"inIcuCurrently":65,"inIcuCumulative":null,"onVentilatorCurrently":44,"onVentilatorCumulative":null,"recovered":null,"dataQualityGrade":"B","lastUpdateEt":"8/29/2020 00:00","dateModified":"2020-08-29T24:00:00Z","checkTimeEt":"08/28 20:00","death":428,"hospitalized":null,"dateChecked":"2020-08-29T24:00:00Z","totalTestsViral":415664,"positiveTestsViral":20103,"negativeTestsViral":395291,"positiveCasesViral":14986,"deathConfirmed":283,"deathProbable":145,"totalTestEncountersViral":null,"totalTestsPeopleViral":null,"totalTestsAntibody":null,"positiveTestsAntibody":17564,"negativeTestsAntibody":null,"totalTestsPeopleAntibody":null,"positiveTestsPeopleAntibody":null,"negativeTestsPeopleAntibody":null,"totalTestsPeopleAntigen":null,"positiveTestsPeopleAntigen":null,"totalTestsAntigen":null,"positiveTestsAntigen":null,"fips":"72","positiveIncrease":260,"negativeIncrease":0,"total":320958,"totalTestResultsIncrease":260,"posNeg":320958,"deathIncrease":4,"hospitalizedIncrease":0,"hash":"1c0ef474043e83df04ea12888093b28c73023dfc","commercialScore":0,"negativeRegularScore":0,"negativeScore":0,"positiveScore":0,"score":0,"grade":""},{"date":20200828,"state":"PR","positive":14726,"probableCases":null,"negative":305972,"pending":null,"totalTestResultsSource":"posNeg","totalTestResults":320698,"hospitalizedCurrently":409,"hospitalizedCumulative":null,"inIcuCurrently":72,"inIcuCumulative":null,"onVentilatorCurrently":51,"onVentilatorCumulative":null,"recovered":null,"dataQualityGrade":"B","lastUpdateEt":"8/28/2020 00:00","dateModified":"2020-08-28T24:00:00Z","checkTimeEt":"08/27 20:00","death":424,"hospitalized":null,"dateChecked":"2020-08-28T24:00:00Z","totalTestsViral":415664,"positiveTestsViral":20103,"negativeTestsViral":395291,"positiveCasesViral":14726,"deathConfirmed":280,"deathProbable":144,"totalTestEncountersViral":null,"totalTestsPeopleViral":null,"totalTestsAntibody":null,"positiveTestsAntibody":17262,"negativeTestsAntibody":null,"totalTestsPeopleAntibody":null,"positiveTestsPeopleAntibody":null,"negativeTestsPeopleAntibody":null,"totalTestsPeopleAntigen":null,"positiveTestsPeopleAntigen":null,"totalTestsAntigen":null,"positiveTestsAntigen":null,"fips":"72","positiveIncrease":257,"negativeIncrease":0,"total":320698,"totalTestResultsIncrease":257,"posNeg":320698,"deathIncrease":12,"hospitalizedIncrease":0,"hash":"3f6c4bdffba82b752ff8af635a9936605cece2ab","commercialScore":0,"negativeRegularScore":0,"negativeScore":0,"positiveScore":0,"score":0,"grade":""},{"date":20200827,"state":"PR","positive":14469,"probableCases":null,"negative":305972,"pending":null,"totalTestResultsSource":"posNeg","totalTestResults":320441,"hospitalizedCurrently":403,"hospitalizedCumulative":null,"inIcuCurrently":74,"inIcuCumulative":null,"onVentilatorCurrently":41,"onVentilatorCumulative":null,"recovered":null,"dataQualityGrade":"B","lastUpdateEt":"8/27/2020 00:00","dateModified":"2020-08-27T24:00:00Z","checkTimeEt":"08/26 20:00","death":412,"hospitalized":null,"dateChecked":"2020-08-27T24:00:00Z","totalTestsViral":310546,"positiveTestsViral":7002,"negativeTestsViral":303412,"positiveCasesViral":14469,"deathConfirmed":270,"deathProbable":142,"totalTestEncountersViral":null,"totalTestsPeopleViral":null,"totalTestsAntibody":null,"positiveTestsAntibody":16914,"negativeTestsAntibody":null,"totalTestsPeopleAntibody":null,"positiveTestsPeopleAntibody":null,"negativeTestsPeopleAntibody":null,"totalTestsPeopleAntigen":null,"positiveTestsPeopleAntigen":null,"totalTestsAntigen":null,"positiveTestsAntigen":null,"fips":"72","positiveIncrease":459,"negativeIncrease":0,"total":320441,"totalTestResultsIncrease":459,"posNeg":320441,"deathIncrease":8,"hospitalizedIncrease":0,"hash":"61df77782ef54f57a41ad7217f38bc7943be1720","commercialScore":0,"negativeRegularScore":0,"negativeScore":0,"positiveScore":0,"score":0,"grade":""},{"date":20200826,"state":"PR","positive":14010,"probableCases":null,"negative":305972,"pending":null,"totalTestResultsSource":"posNeg","totalTestResults":319982,"hospitalizedCurrently":397,"hospitalizedCumulative":null,"inIcuCurrently":62,"inIcuCumulative":null,"onVentilatorCurrently":44,"onVentilatorCumulative":null,"recovered":null,"dataQualityGrade":"B","lastUpdateEt":"8/26/2020 00:00","dateModified":"2020-08-26T24:00:00Z","checkTimeEt":"08/25 20:00","death":404,"hospitalized":null,"dateChecked":"2020-08-26T24:00:00Z","totalTestsViral":310546,"positiveTestsViral":7002,"negativeTestsViral":303412,"positiveCasesViral":14010,"deathConfirmed":263,"deathProbable":141,"totalTestEncountersViral":null,"totalTestsPeopleViral":null,"totalTestsAntibody":null,"positiveTestsAntibody":16734,"negativeTestsAntibody":null,"totalTestsPeopleAntibody":null,"positiveTestsPeopleAntibody":null,"negativeTestsPeopleAntibody":null,"totalTestsPeopleAntigen":null,"positiveTestsPeopleAntigen":null,"totalTestsAntigen":null,"positiveTestsAntigen":null,"fips":"72","positiveIncrease":18,"negativeIncrea