[{"date":20201028,"state":"NM","positive":43169,"probableCases":null,"negative":1086250,"pending":null,"totalTestResultsSource":"posNeg","totalTestResults":1129419,"hospitalizedCurrently":307,"hospitalizedCumulative":4377,"inIcuCurrently":null,"inIcuCumulative":null,"onVentilatorCurrently":null,"onVentilatorCumulative":null,"recovered":21063,"dataQualityGrade":"B","lastUpdateEt":"10/27/2020 17:50","dateModified":"2020-10-27T17:50:00Z","checkTimeEt":"10/27 13:50","death":980,"hospitalized":4377,"dateChecked":"2020-10-27T17:50:00Z","totalTestsViral":1129419,"positiveTestsViral":null,"negativeTestsViral":null,"positiveCasesViral":43169,"deathConfirmed":null,"deathProbable":null,"totalTestEncountersViral":null,"totalTestsPeopleViral":null,"totalTestsAntibody":null,"positiveTestsAntibody":null,"negativeTestsAntibody":null,"totalTestsPeopleAntibody":null,"positiveTestsPeopleAntibody":null,"negativeTestsPeopleAntibody":null,"totalTestsPeopleAntigen":null,"positiveTestsPeopleAntigen":null,"totalTestsAntigen":null,"positiveTestsAntigen":null,"fips":"35","positiveIncrease":583,"negativeIncrease":3914,"total":1129419,"totalTestResultsIncrease":4497,"posNeg":1129419,"deathIncrease":4,"hospitalizedIncrease":56,"hash":"94660650c98e746bc8b5b6faed2bd00fbef9c65c","commercialScore":0,"negativeRegularScore":0,"negativeScore":0,"positiveScore":0,"score":0,"grade":""},{"date":20201027,"state":"NM","positive":42586,"probableCases":null,"negative":1082336,"pending":null,"totalTestResultsSource":"posNeg","totalTestResults":1124922,"hospitalizedCurrently":289,"hospitalizedCumulative":4321,"inIcuCurrently":null,"inIcuCumulative":null,"onVentilatorCurrently":null,"onVentilatorCumulative":null,"recovered":20910,"dataQualityGrade":"B","lastUpdateEt":"10/26/2020 17:50","dateModified":"2020-10-26T17:50:00Z","checkTimeEt":"10/26 13:50","death":976,"hospitalized":4321,"dateChecked":"2020-10-26T17:50:00Z","totalTestsViral":1124922,"positiveTestsViral":null,"negativeTestsViral":null,"positiveCasesViral":42586,"deathConfirmed":null,"deathProbable":null,"totalTestEncountersViral":null,"totalTestsPeopleViral":null,"totalTestsAntibody":null,"positiveTestsAntibody":null,"negativeTestsAntibody":null,"totalTestsPeopleAntibody":null,"positiveTestsPeopleAntibody":null,"negativeTestsPeopleAntibody":null,"totalTestsPeopleAntigen":null,"positiveTestsPeopleAntigen":null,"totalTestsAntigen":null,"positiveTestsAntigen":null,"fips":"35","positiveIncrease":723,"negativeIncrease":5355,"total":1124922,"totalTestResultsIncrease":6078,"posNeg":1124922,"deathIncrease":9,"hospitalizedIncrease":44,"hash":"630f13d86dffb6b8befcd3b2418b56e0db1fbe0e","commercialScore":0,"negativeRegularScore":0,"negativeScore":0,"positiveScore":0,"score":0,"grade":""},{"date":20201026,"state":"NM","positive":41863,"probableCases":null,"negative":1076981,"pending":null,"totalTestResultsSource":"posNeg","totalTestResults":1118844,"hospitalizedCurrently":287,"hospitalizedCumulative":4277,"inIcuCurrently":null,"inIcuCumulative":null,"onVentilatorCurrently":null,"onVentilatorCumulative":null,"recovered":20837,"dataQualityGrade":"B","lastUpdateEt":"10/25/2020 16:30","dateModified":"2020-10-25T16:30:00Z","checkTimeEt":"10/25 12:30","death":967,"hospitalized":4277,"dateChecked":"2020-10-25T16:30:00Z","totalTestsViral":1118844,"positiveTestsViral":null,"negativeTestsViral":null,"positiveCasesViral":41863,"deathConfirmed":null,"deathProbable":null,"totalTestEncountersViral":null,"totalTestsPeopleViral":null,"totalTestsAntibody":null,"positiveTestsAntibody":null,"negativeTestsAntibody":null,"totalTestsPeopleAntibody":null,"positiveTestsPeopleAntibody":null,"negativeTestsPeopleAntibody":null,"totalTestsPeopleAntigen":null,"positiveTestsPeopleAntigen":null,"totalTestsAntigen":null,"positiveTestsAntigen":null,"fips":"35","positiveIncrease":823,"negativeIncrease":8926,"total":1118844,"totalTestResultsIncrease":9749,"posNeg":1118844,"deathIncrease":2,"hospitalizedIncrease":38,"hash":"6156736f4ba445db1a5ed2ccb99034037758c778","commercialScore":0,"negativeRegularScore":0,"negativeScore":0,"positiveScore":0,"score":0,"grade":""},{"date":20201025,"state":"NM","positive":41040,"probableCases":null,"negative":1068055,"pending":null,"totalTestResultsSource":"posNeg","totalTestResults":1109095,"hospitalizedCurrently":264,"hospitalizedCumulative":4239,"inIcuCurrently":null,"inIcuCumulative":null,"onVentilatorCurrently":null,"onVentilatorCumulative":null,"recovered":20765,"dataQualityGrade":"B","lastUpdateEt":"10/24/2020 17:30","dateModified":"2020-10-24T17:30:00Z","checkTimeEt":"10/24 13:30","death":965,"hospitalized":4239,"dateChecked":"2020-10-24T17:30:00Z","totalTestsViral":1109095,"positiveTestsViral":null,"negativeTestsViral":null,"positiveCasesViral":41040,"deathConfirmed":null,"deathProbable":null,"totalTestEncountersViral":null,"totalTestsPeopleViral":null,"totalTestsAntibody":null,"positiveTestsAntibody":null,"negativeTestsAntibody":null,"totalTestsPeopleAntibody":null,"positiveTestsPeopleAntibody":null,"negativeTestsPeopleAntibody":null,"totalTestsPeopleAntigen":null,"positiveTestsPeopleAntigen":null,"totalTestsAntigen":null,"positiveTestsAntigen":null,"fips":"35","positiveIncrease":872,"negativeIncrease":8739,"total":1109095,"totalTestResultsIncrease":9611,"posNeg":1109095,"deathIncrease":5,"hospitalizedIncrease":70,"hash":"927d48332f172b0b95b30604b2490305f8743846","commercialScore":0,"negativeRegularScore":0,"negativeScore":0,"positiveScore":0,"score":0,"grade":""},{"date":20201024,"state":"NM","positive":40168,"probableCases":null,"negative":1059316,"pending":null,"totalTestResultsSource":"posNeg","totalTestResults":1099484,"hospitalizedCurrently":229,"hospitalizedCumulative":4169,"inIcuCurrently":null,"inIcuCumulative":null,"onVentilatorCurrently":null,"onVentilatorCumulative":null,"recovered":20655,"dataQualityGrade":"B","lastUpdateEt":"10/23/2020 17:50","dateModified":"2020-10-23T17:50:00Z","checkTimeEt":"10/23 13:50","death":960,"hospitalized":4169,"dateChecked":"2020-10-23T17:50:00Z","totalTestsViral":1099484,"positiveTestsViral":null,"negativeTestsViral":null,"positiveCasesViral":40168,"deathConfirmed":null,"deathProbable":null,"totalTestEncountersViral":null,"totalTestsPeopleViral":null,"totalTestsAntibody":null,"positiveTestsAntibody":null,"negativeTestsAntibody":null,"totalTestsPeopleAntibody":null,"positiveTestsPeopleAntibody":null,"negativeTestsPeopleAntibody":null,"totalTestsPeopleAntigen":null,"positiveTestsPeopleAntigen":null,"totalTestsAntigen":null,"positiveTestsAntigen":null,"fips":"35","positiveIncrease":791,"negativeIncrease":9543,"total":1099484,"totalTestResultsIncrease":10334,"posNeg":1099484,"deathIncrease":7,"hospitalizedIncrease":41,"hash":"5f9dd65b5ba16ac8ee9f9530c5b153b4d0d18370","commercialScore":0,"negativeRegularScore":0,"negativeScore":0,"positiveScore":0,"score":0,"grade":""},{"date":20201023,"state":"NM","positive":39377,"probableCases":null,"negative":1049773,"pending":null,"totalTestResultsSource":"posNeg","totalTestResults":1089150,"hospitalizedCurrently":213,"hospitalizedCumulative":4128,"inIcuCurrently":null,"inIcuCumulative":null,"onVentilatorCurrently":null,"onVentilatorCumulative":null,"recovered":20562,"dataQualityGrade":"B","lastUpdateEt":"10/22/2020 17:50","dateModified":"2020-10-22T17:50:00Z","checkTimeEt":"10/22 13:50","death":953,"hospitalized":4128,"dateChecked":"2020-10-22T17:50:00Z","totalTestsViral":1089150,"positiveTestsViral":null,"negativeTestsViral":null,"positiveCasesViral":39377,"deathConfirmed":null,"deathProbable":null,"totalTestEncountersViral":null,"totalTestsPeopleViral":null,"totalTestsAntibody":null,"positiveTestsAntibody":null,"negativeTestsAntibody":null,"totalTestsPeopleAntibody":null,"positiveTestsPeopleAntibody":null,"negativeTestsPeopleAntibody":null,"totalTestsPeopleAntigen":null,"positiveTestsPeopleAntigen":null,"totalTestsAntigen":null,"positiveTestsAntigen":null,"fips":"35","positiveIncrease":662,"negativeIncrease":10401,"total":1089150,"totalTestResultsIncrease":11063,"posNeg":1089150,"deathIncrease":3,"hospitalizedIncrease":49,"hash":"1cab6bd464227344936466f109b286bd8c58a8bf","commercialScore":0,"negativeRegularScore":0,"negativeScore":0,"positiveScore":0,"score":0,"grade":""},{"date":20201022,"state":"NM","positive":38715,"probableCases":null,"negative":1039372,"pending":null,"totalTestResultsSource":"posNeg","totalTestResults":1078087,"hospitalizedCurrently":202,"hospitalizedCumulative":4079,"inIcuCurrently":null,"inIcuCumulative":null,"onVentilatorCurrently":null,"onVentilatorCumulative":null,"recovered":20332,"dataQualityGrade":"B","lastUpdateEt":"10/21/2020 17:50","dateModified":"2020-10-21T17:50:00Z","checkTimeEt":"10/21 13:50","death":950,"hospitalized":4079,"dateChecked":"2020-10-21T17:50:00Z","totalTestsViral":1078087,"positiveTestsViral":null,"negativeTestsViral":null,"positiveCasesViral":38715,"deathConfirmed":null,"deathProbable":null,"totalTestEncountersViral":null,"totalTestsPeopleViral":null,"totalTestsAntibody":null,"positiveTestsAntibody":null,"negativeTestsAntibody":null,"totalTestsPeopleAntibody":null,"positiveTestsPeopleAntibody":null,"negativeTestsPeopleAntibody":null,"totalTestsPeopleAntigen":null,"positiveTestsPeopleAntigen":null,"totalTestsAntigen":null,"positiveTestsAntigen":null,"fips":"35","positiveIncrease":819,"negativeIncrease":6787,"total":1078087,"totalTestResultsIncrease":7606,"posNeg":1078087,"deathIncrease":8,"hospitalizedIncrease":49,"hash":"d98a34a089009ec95997e22430a7fad6a5d85102","commercialScore":0,"negativeRegularScore":0,"negativeScore":0,"positiveScore":0,"score":0,"grade":""},{"date":20201021,"state":"NM","positive":37896,"probableCases":null,"negative":1032585,"pending":null,"totalTestResultsSource":"posNeg","totalTestResults":1070481,"hospitalizedCurrently":205,"hospitalizedCumulative":4030,"inIcuCurrently":null,"inIcuCumulative":null,"onVentilatorCurrently":null,"onVentilatorCumulative":null,"recovered":20165,"dataQualityGrade":"B","lastUpdateEt":"10/20/2020 16:50","dateModified":"2020-10-20T16:50:00Z","checkTimeEt":"10/20 12:50","death":942,"hospitalized":4030,"dateChecked":"2020-10-20T16:50:00Z","totalTestsViral":1070481,"positiveTestsViral":null,"negativeTestsViral":null,"positiveCasesViral":37896,"deathConfirmed":null,"deathProbable":null,"totalTestEncountersViral":null,"totalTestsPeopleViral":null,"totalTestsAntibody":null,"positiveTestsAntibody":null,"negativeTestsAntibody":null,"totalTestsPeopleAntibody":null,"positiveTestsPeopleAntibody":null,"negativeTestsPeopleAntibody":null,"totalTestsPeopleAntigen":null,"positiveTestsPeopleAntigen":null,"totalTestsAntigen":null,"positiveTestsAntigen":null,"fips":"35","positiveIncrease":594,"negativeIncrease":8619,"total":1070481,"totalTestResultsIncrease":9213,"posNeg":1070481,"deathIncrease":7,"hospitalizedIncrease":53,"hash":"c4548bb1529ea6c51d0be57a71f441e344ea2306","commercialScore":0,"negativeRegularScore":0,"negativeScore":0,"positiveScore":0,"score":0,"grade":""},{"date":20201020,"state":"NM","positive":37302,"probableCases":null,"negative":1023966,"pending":null,"totalTestResultsSource":"posNeg","totalTestResults":1061268,"hospitalizedCurrently":183,"hospitalizedCumulative":3977,"inIcuCurrently":null,"inIcuCumulative":null,"onVentilatorCurrently":null,"onVentilatorCumulative":null,"recovered":20001,"dataQualityGrade":"B","lastUpdateEt":"10/19/2020 17:51","dateModified":"2020-10-19T17:51:00Z","checkTimeEt":"10/19 13:51","death":935,"hospitalized":3977,"dateChecked":"2020-10-19T17:51:00Z","totalTestsViral":1061268,"positiveTestsViral":null,"negativeTestsViral":null,"positiveCasesViral":37302,"deathConfirmed":null,"deathProbable":null,"totalTestEncountersViral":null,"totalTestsPeopleViral":null,"totalTestsAntibody":null,"positiveTestsAntibody":null,"negativeTestsAntibody":null,"totalTestsPeopleAntibody":null,"positiveTestsPeopleAntibody":null,"negativeTestsPeopleAntibody":null,"totalTestsPeopleAntigen":null,"positiveTestsPeopleAntigen":null,"totalTestsAntigen":null,"positiveTestsAntigen":null,"fips":"35","positiveIncrease":514,"negativeIncrease":5863,"total":1061268,"totalTestResultsIncrease":6377,"posNeg":1061268,"deathIncrease":1,"hospitalizedIncrease":37,"hash":"c3f17ef687d7bd74bdb59228850f6fabedbc8ad3","commercialScore":0,"negativeRegularScore":0,"negativeScore":0,"positiveScore":0,"score":0,"grade":""},{"date":20201019,"state":"NM","positive":36788,"probableCases":null,"negative":1018103,"pending":null,"totalTestResultsSource":"posNeg","totalTestResults":1054891,"hospitalizedCurrently":171,"hospitalizedCumulative":3940,"inIcuCurrently":null,"inIcuCumulative":null,"onVentilatorCurrently":null,"onVentilatorCumulative":null,"recovered":19894,"dataQualityGrade":"B","lastUpdateEt":"10/18/2020 17:30","dateModified":"2020-10-18T17:30:00Z","checkTimeEt":"10/18 13:30","death":934,"hospitalized":3940,"dateChecked":"2020-10-18T17:30:00Z","totalTestsViral":1054891,"positiveTestsViral":null,"negativeTestsViral":null,"positiveCasesViral":36788,"deathConfirmed":null,"deathProbable":null,"totalTestEncountersViral":null,"totalTestsPeopleViral":null,"totalTestsAntibody":null,"positiveTestsAntibody":null,"negativeTestsAntibody":null,"totalTestsPeopleAntibody":null,"positiveTestsPeopleAntibody":null,"negativeTestsPeopleAntibody":null,"totalTestsPeopleAntigen":null,"positiveTestsPeopleAntigen":null,"totalTestsAntigen":null,"positiveTestsAntigen":null,"fips":"35","positiveIncrease":445,"negativeIncrease":7719,"total":1054891,"totalTestResultsIncrease":8164,"posNeg":1054891,"deathIncrease":5,"hospitalizedIncrease":29,"hash":"ee60425e2162f87be2973d45f369b59e16a09b4e","commercialScore":0,"negativeRegularScore":0,"negativeScore":0,"positiveScore":0,"score":0,"grade":""},{"date":20201018,"state":"NM","positive":36343,"probableCases":null,"negative":1010384,"pending":null,"totalTestResultsSource":"posNeg","totalTestResults":1046727,"hospitalizedCurrently":173,"hospitalizedCumulative":3911,"inIcuCurrently":null,"inIcuCumulative":null,"onVentilatorCurrently":null,"onVentilatorCumulative":null,"recovered":19853,"dataQualityGrade":"B","lastUpdateEt":"10/17/2020 17:20","dateModified":"2020-10-17T17:20:00Z","checkTimeEt":"10/17 13:20","death":929,"hospitalized":3911,"dateChecked":"2020-10-17T17:20:00Z","totalTestsViral":1046727,"positiveTestsViral":null,"negativeTestsViral":null,"positiveCasesViral":36343,"deathConfirmed":null,"deathProbable":null,"totalTestEncountersViral":null,"totalTestsPeopleViral":null,"totalTestsAntibody":null,"positiveTestsAntibody":null,"negativeTestsAntibody":null,"totalTestsPeopleAntibody":null,"positiveTestsPeopleAntibody":null,"negativeTestsPeopleAntibody":null,"totalTestsPeopleAntigen":null,"positiveTestsPeopleAntigen":null,"totalTestsAntigen":null,"positiveTestsAntigen":null,"fips":"35","positiveIncrease":573,"negativeIncrease":10303,"total":1046727,"totalTestResultsIncrease":10876,"posNeg":1046727,"deathIncrease":1,"hospitalizedIncrease":50,"hash":"da767714bd0c405270fbd57ffc44fe5fd5aff2f9","commercialScore":0,"negativeRegularScore":0,"negativeScore":0,"positiveScore":0,"score":0,"grade":""},{"date":20201017,"state":"NM","positive":35770,"probableCases":null,"negative":1000081,"pending":null,"totalTestResultsSource":"posNeg","totalTestResults":1035851,"hospitalizedCurrently":168,"hospitalizedCumulative":3861,"inIcuCurrently":null,"inIcuCumulative":null,"onVentilatorCurrently":null,"onVentilatorCumulative":null,"recovered":19613,"dataQualityGrade":"B","lastUpdateEt":"10/16/2020 17:50","dateModified":"2020-10-16T17:50:00Z","checkTimeEt":"10/16 13:50","death":928,"hospitalized":3861,"dateChecked":"2020-10-16T17:50:00Z","totalTestsViral":1035851,"positiveTestsViral":null,"negativeTestsViral":null,"positiveCasesViral":35770,"deathConfirmed":null,"deathProbable":null,"totalTestEncountersViral":null,"totalTestsPeopleViral":null,"totalTestsAntibody":null,"positiveTestsAntibody":null,"negativeTestsAntibody":null,"totalTestsPeopleAntibody":null,"positiveTestsPeopleAntibody":null,"negativeTestsPeopleAntibody":null,"totalTestsPeopleAntigen":null,"positiveTestsPeopleAntigen":null,"totalTestsAntigen":null,"positiveTestsAntigen":null,"fips":"35","positiveIncrease":812,"negativeIncrease":7647,"total":1035851,"totalTestResultsIncrease":8459,"posNeg":1035851,"deathIncrease":6,"hospitalizedIncrease":42,"hash":"916235e01a64e9c017731d440bf7544dd8f43407","commercialScore":0,"negativeRegularScore":0,"negativeScore":0,"positiveScore":0,"score":0,"grade":""},{"date":20201016,"state":"NM","positive":34958,"probableCases":null,"negative":992434,"pending":null,"totalTestResultsSource":"posNeg","totalTestResults":1027392,"hospitalizedCurrently":150,"hospitalizedCumulative":3819,"inIcuCurrently":null,"inIcuCumulative":null,"onVentilatorCurrently":null,"onVentilatorCumulative":null,"recovered":19457,"dataQualityGrade":"B","lastUpdateEt":"10/15/2020 17:15","dateModified":"2020-10-15T17:15:00Z","checkTimeEt":"10/15 13:15","death":922,"hospitalized":3819,"dateChecked":"2020-10-15T17:15:00Z","totalTestsViral":1027392,"positiveTestsViral":null,"negativeTestsViral":null,"positiveCasesViral":34958,"deathConfirmed":null,"deathProbable":null,"totalTestEncountersViral":null,"totalTestsPeopleViral":null,"totalTestsAntibody":null,"positiveTestsAntibody":null,"negativeTestsAntibody":null,"totalTestsPeopleAntibody":null,"positiveTestsPeopleAntibody":null,"negativeTestsPeopleAntibody":null,"totalTestsPeopleAntigen":null,"positiveTestsPeopleAntigen":null,"totalTestsAntigen":null,"positiveTestsAntigen":null,"fips":"35","positiveIncrease":668,"negativeIncrease":7695,"total":1027392,"totalTestResultsIncrease":8363,"posNeg":1027392,"deathIncrease":1,"hospitalizedIncrease":30,"hash":"2b215357984b2b6cfdbac4668d1cdb9a62af164c","commercialScore":0,"negativeRegularScore":0,"negativeScore":0,"positiveScore":0,"score":0,"grade":""},{"date":20201015,"state":"NM","positive":34290,"probableCases":null,"negative":984739,"pending":null,"totalTestResultsSource":"posNeg","totalTestResults":1019029,"hospitalizedCurrently":145,"hospitalizedCumulative":3789,"inIcuCurrently":null,"inIcuCumulative":null,"onVentilatorCurrently":null,"onVentilatorCumulative":null,"recovered":19127,"dataQualityGrade":"B","lastUpdateEt":"10/14/2020 18:38","dateModified":"2020-10-14T18:38:00Z","checkTimeEt":"10/14 14:38","death":921,"hospitalized":3789,"dateChecked":"2020-10-14T18:38:00Z","totalTestsViral":1019029,"positiveTestsViral":null,"negativeTestsViral":null,"positiveCasesViral":34290,"deathConfirmed":null,"deathProbable":null,"totalTestEncountersViral":null,"totalTestsPeopleViral":null,"totalTestsAntibody":null,"positiveTestsAntibody":null,"negativeTestsAntibody":null,"totalTestsPeopleAntibody":null,"positiveTestsPeopleAntibody":null,"negativeTestsPeopleAntibody":null,"totalTestsPeopleAntigen":null,"positiveTestsPeopleAntigen":null,"totalTestsAntigen":null,"positiveTestsAntigen":null,"fips":"35","positiveIncrease":577,"negativeIncrease":7132,"total":1019029,"totalTestResultsIncrease":7709,"posNeg":1019029,"deathIncrease":3,"hospitalizedIncrease":31,"hash":"ecc453895840ccf29a4ab21b51d7ea008310213b","commercialScore":0,"negativeRegularScore":0,"negativeScore":0,"positiveScore":0,"score":0,"grade":""},{"date":20201014,"state":"NM","positive":33713,"probableCases":null,"negative":977607,"pending":null,"totalTestResultsSource":"posNeg","totalTestResults":1011320,"hospitalizedCurrently":125,"hospitalizedCumulative":3758,"inIcuCurrently":null,"inIcuCumulative":null,"onVentilatorCurrently":null,"onVentilatorCumulative":null,"recovered":18960,"dataQualityGrade":"B","lastUpdateEt":"10/13/2020 17:51","dateModified":"2020-10-13T17:51:00Z","checkTimeEt":"10/13 13:51","death":918,"hospitalized":3758,"dateChecked":"2020-10-13T17:51:00Z","totalTestsViral":1011320,"positiveTestsViral":null,"negativeTestsViral":null,"positiveCasesViral":33713,"deathConfirmed":null,"deathProbable":null,"totalTestEncountersViral":null,"totalTestsPeopleViral":null,"totalTestsAntibody":null,"positiveTestsAntibody":null,"negativeTestsAntibody":null,"totalTestsPeopleAntibody":null,"positiveTestsPeopleAntibody":null,"negativeTestsPeopleAntibody":null,"totalTestsPeopleAntigen":null,"positiveTestsPeopleAntigen":null,"totalTestsAntigen":null,"positiveTestsAntigen":null,"fips":"35","positiveIncrease":351,"negativeIncrease":8063,"total":1011320,"totalTestResultsIncrease":8414,"posNeg":1011320,"deathIncrease":3,"hospitalizedIncrease":23,"hash":"918cde8c88ae699166be951569427054e76d639d","commercialScore":0,"negativeRegularScore":0,"negativeScore":0,"positiveScore":0,"score":0,"grade":""},{"date":20201013,"state":"NM","positive":33362,"probableCases":null,"negative":969544,"pending":null,"totalTestResultsSource":"posNeg","totalTestResults":1002906,"hospitalizedCurrently":127,"hospitalizedCumulative":3735,"inIcuCurrently":null,"inIcuCumulative":null,"onVentilatorCurrently":null,"onVentilatorCumulative":null,"recovered":18791,"dataQualityGrade":"B","lastUpdateEt":"10/12/2020 17:31","dateModified":"2020-10-12T17:31:00Z","checkTimeEt":"10/12 13:31","death":915,"hospitalized":3735,"dateChecked":"2020-10-12T17:31:00Z","totalTestsViral":1002906,"positiveTestsViral":null,"negativeTestsViral":null,"positiveCasesViral":33362,"deathConfirmed":null,"deathProbable":null,"totalTestEncountersViral":null,"totalTestsPeopleViral":null,"totalTestsAntibody":null,"positiveTestsAntibody":null,"negativeTestsAntibody":null,"totalTestsPeopleAntibody":null,"positiveTestsPeopleAntibody":null,"negativeTestsPeopleAntibody":null,"totalTestsPeopleAntigen":null,"positiveTestsPeopleAntigen":null,"totalTestsAntigen":null,"positiveTestsAntigen":null,"fips":"35","positiveIncrease":379,"negativeIncrease":5154,"total":1002906,"totalTestResultsIncrease":5533,"posNeg":1002906,"deathIncrease":4,"hospitalizedIncrease":25,"hash":"38446dd2fa53cce1ab10505f1e9e034cfc1fc62b","commercialScore":0,"negativeRegularScore":0,"negativeScore":0,"positiveScore":0,"score":0,"grade":""},{"date":20201012,"state":"NM","positive":32983,"probableCases":null,"negative":964390,"pending":null,"totalTestResultsSource":"posNeg","totalTestResults":997373,"hospitalizedCurrently":120,"hospitalizedCumulative":3710,"inIcuCurrently":null,"inIcuCumulative":null,"onVentilatorCurrently":null,"onVentilatorCumulative":null,"recovered":18680,"dataQualityGrade":"B","lastUpdateEt":"10/11/2020 17:15","dateModified":"2020-10-11T17:15:00Z","checkTimeEt":"10/11 13:15","death":911,"hospitalized":3710,"dateChecked":"2020-10-11T17:15:00Z","totalTestsViral":997373,"positiveTestsViral":null,"negativeTestsViral":null,"positiveCasesViral":32983,"deathConfirmed":null,"deathProbable":null,"totalTestEncountersViral":null,"totalTestsPeopleViral":null,"totalTestsAntibody":null,"positiveTestsAntibody":null,"negativeTestsAntibody":null,"totalTestsPeopleAntibody":null,"positiveTestsPeopleAntibody":null,"negativeTestsPeopleAntibody":null,"totalTestsPeopleAntigen":null,"positiveTestsPeopleAntigen":null,"totalTestsAntigen":null,"positiveTestsAntigen":null,"fips":"35","positiveIncrease":261,"negativeIncrease":7460,"total":997373,"totalTestResultsIncrease":7721,"posNeg":997373,"deathIncrease":4,"hospitalizedIncrease":6,"hash":"6d4eb906bbfcc555f468b26959646acf1ba9c682","commercialScore":0,"negativeRegularScore":0,"negativeScore":0,"positiveScore":0,"score":0,"grade":""},{"date":20201011,"state":"NM","positive":32722,"probableCases":null,"negative":956930,"pending":null,"totalTestResultsSource":"posNeg","totalTestResults":989652,"hospitalizedCurrently":130,"hospitalizedCumulative":3704,"inIcuCurrently":null,"inIcuCumulative":null,"onVentilatorCurrently":null,"onVentilatorCumulative":null,"recovered":18621,"dataQualityGrade":"B","lastUpdateEt":"10/10/2020 17:20","dateModified":"2020-10-10T17:20:00Z","checkTimeEt":"10/10 13:20","death":907,"hospitalized":3704,"dateChecked":"2020-10-10T17:20:00Z","totalTestsViral":989652,"positiveTestsViral":null,"negativeTestsViral":null,"positiveCasesViral":32722,"deathConfirmed":null,"deathProbable":null,"totalTestEncountersViral":null,"totalTestsPeopleViral":null,"totalTestsAntibody":null,"positiveTestsAntibody":null,"negativeTestsAntibody":null,"totalTestsPeopleAntibody":null,"positiveTestsPeopleAntibody":null,"negativeTestsPeopleAntibody":null,"totalTestsPeopleAntigen":null,"positiveTestsPeopleAntigen":null,"totalTestsAntigen":null,"positiveTestsAntigen":null,"fips":"35","positiveIncrease":481,"negativeIncrease":9118,"total":989652,"totalTestResultsIncrease":9599,"posNeg":989652,"deathIncrease":5,"hospitalizedIncrease":26,"hash":"96c3da443d824cbcf0702ca53ed63b5813b0daee","commercialScore":0,"negativeRegularScore":0,"negativeScore":0,"positiveScore":0,"score":0,"grade":""},{"date":20201010,"state":"NM","positive":32241,"probableCases":null,"negative":947812,"pending":null,"totalTestResultsSource":"posNeg","totalTestResults":980053,"hospitalizedCurrently":133,"hospitalizedCumulative":3678,"inIcuCurrently":null,"inIcuCumulative":null,"onVentilatorCurrently":null,"onVentilatorCumulative":null,"recovered":18335,"dataQualityGrade":"B","lastUpdateEt":"10/9/2020 17:50","dateModified":"2020-10-09T17:50:00Z","checkTimeEt":"10/09 13:50","death":902,"hospitalized":3678,"dateChecked":"2020-10-09T17:50:00Z","totalTestsViral":980053,"positiveTestsViral":null,"negativeTestsViral":null,"positiveCasesViral":32241,"deathConfirmed":null,"deathProbable":null,"totalTestEncountersViral":null,"totalTestsPeopleViral":null,"totalTestsAntibody":null,"positiveTestsAntibody":null,"negativeTestsAntibody":null,"totalTestsPeopleAntibody":null,"positiveTestsPeopleAntibody":null,"negativeTestsPeopleAntibody":null,"totalTestsPeopleAntigen":null,"positiveTestsPeopleAntigen":null,"totalTestsAntigen":null,"positiveTestsAntigen":null,"fips":"35","positiveIncrease":485,"negativeIncrease":5623,"total":980053,"totalTestResultsIncrease":6108,"posNeg":980053,"deathIncrease":3,"hospitalizedIncrease":26,"hash":"b1df3bdd90103038c64e215032c8dcc1dc8f23d2","commercialScore":0,"negativeRegularScore":0,"negativeScore":0,"positiveScore":0,"score":0,"grade":""},{"date":20201009,"state":"NM","positive":31756,"probableCases":null,"negative":942189,"pending":null,"totalTestResultsSource":"posNeg","totalTestResults":973945,"hospitalizedCurrently":119,"hospitalizedCumulative":3652,"inIcuCurrently":null,"inIcuCumulative":null,"onVentilatorCurrently":null,"onVentilatorCumulative":null,"recovered":18045,"dataQualityGrade":"B","lastUpdateEt":"10/8/2020 17:15","dateModified":"2020-10-08T17:15:00Z","checkTimeEt":"10/08 13:15","death":899,"hospitalized":3652,"dateChecked":"2020-10-08T17:15:00Z","totalTestsViral":973945,"positiveTestsViral":null,"negativeTestsViral":null,"positiveCasesViral":31756,"deathConfirmed":null,"deathProbable":null,"totalTestEncountersViral":null,"totalTestsPeopleViral":null,"totalTestsAntibody":null,"positiveTestsAntibody":null,"negativeTestsAntibody":null,"totalTestsPeopleAntibody":null,"positiveTestsPeopleAntibody":null,"negativeTestsPeopleAntibody":null,"totalTestsPeopleAntigen":null,"positiveTestsPeopleAntigen":null,"totalTestsAntigen":null,"positiveTestsAntigen":null,"fips":"35","positiveIncrease":384,"negativeIncrease":8242,"total":973945,"totalTestResultsIncrease":8626,"posNeg":973945,"deathIncrease":3,"hospitalizedIncrease":27,"hash":"afe1840d3c46064f6a6886e8ec4926676b6fc3a2","commercialScore":0,"negativeRegularScore":0,"negativeScore":0,"positiveScore":0,"score":0,"grade":""},{"date":20201008,"state":"NM","positive":31372,"probableCases":null,"negative":933947,"pending":null,"totalTestResultsSource":"posNeg","totalTestResults":965319,"hospitalizedCurrently":109,"hospitalizedCumulative":3625,"inIcuCurrently":null,"inIcuCumulative":null,"onVentilatorCurrently":null,"onVentilatorCumulative":null,"recovered":17766,"dataQualityGrade":"B","lastUpdateEt":"10/7/2020 17:51","dateModified":"2020-10-07T17:51:00Z","checkTimeEt":"10/07 13:51","death":896,"hospitalized":3625,"dateChecked":"2020-10-07T17:51:00Z","totalTestsViral":965319,"positiveTestsViral":null,"negativeTestsViral":null,"positiveCasesViral":31372,"deathConfirmed":null,"deathProbable":null,"totalTestEncountersViral":null,"totalTestsPeopleViral":null,"totalTestsAntibody":null,"positiveTestsAntibody":null,"negativeTestsAntibody":null,"totalTestsPeopleAntibody":null,"positiveTestsPeopleAntibody":null,"negativeTestsPeopleAntibody":null,"totalTestsPeopleAntigen":null,"positiveTestsPeopleAntigen":null,"totalTestsAntigen":null,"positiveTestsAntigen":null,"fips":"35","positiveIncrease":425,"negativeIncrease":3960,"total":965319,"totalTestResultsIncrease":4385,"posNeg":965319,"deathIncrease":2,"hospitalizedIncrease":16,"hash":"a651c524aee49d9705f06c1bea7bb7ef13b72be4","commercialScore":0,"negativeRegularScore":0,"negativeScore":0,"positiveScore":0,"score":0,"grade":""},{"date":20201007,"state":"NM","positive":30947,"probableCases":null,"negative":929987,"pending":null,"totalTestResultsSource":"posNeg","totalTestResults":960934,"hospitalizedCurrently":110,"hospitalizedCumulative":3609,"inIcuCurrently":null,"inIcuCumulative":null,"onVentilatorCurrently":null,"onVentilatorCumulative":null,"recovered":17489,"dataQualityGrade":"B","lastUpdateEt":"10/6/2020 17:51","dateModified":"2020-10-06T17:51:00Z","checkTimeEt":"10/06 13:51","death":894,"hospitalized":3609,"dateChecked":"2020-10-06T17:51:00Z","totalTestsViral":960934,"positiveTestsViral":null,"negativeTestsViral":null,"positiveCasesViral":30947,"deathConfirmed":null,"deathProbable":null,"totalTestEncountersViral":null,"totalTestsPeopleViral":null,"totalTestsAntibody":null,"positiveTestsAntibody":null,"negativeTestsAntibody":null,"totalTestsPeopleAntibody":null,"positiveTestsPeopleAntibody":null,"negativeTestsPeopleAntibody":null,"totalTestsPeopleAntigen":null,"positiveTestsPeopleAntigen":null,"totalTestsAntigen":null,"positiveTestsAntigen":null,"fips":"35","positiveIncrease":315,"negativeIncrease":6023,"total":960934,"totalTestResultsIncrease":6338,"posNeg":960934,"deathIncrease":0,"hospitalizedIncrease":28,"hash":"6a7e86f3e8ef3b89e18252220f049ad12b3605a5","commercialScore":0,"negativeRegularScore":0,"negativeScore":0,"positiveScore":0,"score":0,"grade":""},{"date":20201006,"state":"NM","positive":30632,"probableCases":null,"negative":923964,"pending":null,"totalTestResultsSource":"posNeg","totalTestResults":954596,"hospitalizedCurrently":97,"hospitalizedCumulative":3581,"inIcuCurrently":null,"inIcuCumulative":null,"onVentilatorCurrently":null,"onVentilatorCumulative":null,"recovered":17330,"dataQualityGrade":"C","lastUpdateEt":"10/5/2020 17:50","dateModified":"2020-10-05T17:50:00Z","checkTimeEt":"10/05 13:50","death":894,"hospitalized":3581,"dateChecked":"2020-10-05T17:50:00Z","totalTestsViral":954596,"positiveTestsViral":null,"negativeTestsViral":null,"positiveCasesViral":30632,"deathConfirmed":null,"deathProbable":null,"totalTestEncountersViral":null,"totalTestsPeopleViral":null,"totalTestsAntibody":null,"positiveTestsAntibody":null,"negativeTestsAntibody":null,"totalTestsPeopleAntibody":null,"positiveTestsPeopleAntibody":null,"negativeTestsPeopleAntibody":null,"totalTestsPeopleAntigen":null,"positiveTestsPeopleAntigen":null,"totalTestsAntigen":null,"positiveTestsAntigen":null,"fips":"35","positiveIncrease":155,"negativeIncrease":6496,"total":954596,"totalTestResultsIncrease":6651,"posNeg":954596,"deathIncrease":2,"hospitalizedIncrease":20,"hash":"43c6c59434c9b6da26e029aa1fcfd43f4a2a99b3","commercialScore":0,"negativeRegularScore":0,"negativeScore":0,"positiveScore":0,"score":0,"grade":""},{"date":20201005,"state":"NM","positive":30477,"probableCases":null,"negative":917468,"pending":null,"totalTestResultsSource":"posNeg","totalTestResults":947945,"hospitalizedCurrently":91,"hospitalizedCumulative":3561,"inIcuCurrently":null,"inIcuCumulative":null,"onVentilatorCurrently":null,"onVentilatorCumulative":null,"recovered":17270,"dataQualityGrade":"C","lastUpdateEt":"10/4/2020 17:30","dateModified":"2020-10-04T17:30:00Z","checkTimeEt":"10/04 13:30","death":892,"hospitalized":3561,"dateChecked":"2020-10-04T17:30:00Z","totalTestsViral":947945,"positiveTestsViral":null,"negativeTestsViral":null,"positiveCasesViral":30477,"deathConfirmed":null,"deathProbable":null,"totalTestEncountersViral":null,"totalTestsPeopleViral":null,"totalTestsAntibody":null,"positiveTestsAntibody":null,"negativeTestsAntibody":null,"totalTestsPeopleAntibody":null,"positiveTestsPeopleAntibody":null,"negativeTestsPeopleAntibody":null,"totalTestsPeopleAntigen":null,"positiveTestsPeopleAntigen":null,"totalTestsAntigen":null,"positiveTestsAntigen":null,"fips":"35","positiveIncrease":181,"negativeIncrease":6252,"total":947945,"totalTestResultsIncrease":6433,"posNeg":947945,"deathIncrease":2,"hospitalizedIncrease":12,"hash":"a381c7793ea01f68f5ffe37c2df4a863a516f658","commercialScore":0,"negativeRegularScore":0,"negativeScore":0,"positiveScore":0,"score":0,"grade":""},{"date":20201004,"state":"NM","positive":30296,"probableCases":null,"negative":911216,"pending":null,"totalTestResultsSource":"posNeg","totalTestResults":941512,"hospitalizedCurrently":95,"hospitalizedCumulative":3549,"inIcuCurrently":null,"inIcuCumulative":null,"onVentilatorCurrently":null,"onVentilatorCumulative":null,"recovered":17210,"dataQualityGrade":"C","lastUpdateEt":"10/3/2020 17:30","dateModified":"2020-10-03T17:30:00Z","checkTimeEt":"10/03 13:30","death":890,"hospitalized":3549,"dateChecked":"2020-10-03T17:30:00Z","totalTestsViral":941512,"positiveTestsViral":null,"negativeTestsViral":null,"positiveCasesViral":30296,"deathConfirmed":null,"deathProbable":null,"totalTestEncountersViral":null,"totalTestsPeopleViral":null,"totalTestsAntibody":null,"positiveTestsAntibody":null,"negativeTestsAntibody":null,"totalTestsPeopleAntibody":null,"positiveTestsPeopleAntibody":null,"negativeTestsPeopleAntibody":null,"totalTestsPeopleAntigen":null,"positiveTestsPeopleAntigen":null,"totalTestsAntigen":null,"positiveTestsAntigen":null,"fips":"35","positiveIncrease":296,"negativeIncrease":5815,"total":941512,"totalTestResultsIncrease":6111,"posNeg":941512,"deathIncrease":3,"hospitalizedIncrease":15,"hash":"a76e66f99ab7343bdc2f68264fc1f0b050994224","commercialScore":0,"negativeRegularScore":0,"negativeScore":0,"positiveScore":0,"score":0,"grade":""},{"date":20201003,"state":"NM","positive":30000,"probableCases":null,"negative":905401,"pending":null,"totalTestResultsSource":"posNeg","totalTestResults":935401,"hospitalizedCurrently":89,"hospitalizedCumulative":3534,"inIcuCurrently":null,"inIcuCumulative":null,"onVentilatorCurrently":null,"onVentilatorCumulative":null,"recovered":17055,"dataQualityGrade":"C","lastUpdateEt":"10/2/2020 17:50","dateModified":"2020-10-02T17:50:00Z","checkTimeEt":"10/02 13:50","death":887,"hospitalized":3534,"dateChecked":"2020-10-02T17:50:00Z","totalTestsViral":935401,"positiveTestsViral":null,"negativeTestsViral":null,"positiveCasesViral":30000,"deathConfirmed":null,"deathProbable":null,"totalTestEncountersViral":null,"totalTestsPeopleViral":null,"totalTestsAntibody":null,"positiveTestsAntibody":null,"negativeTestsAntibody":null,"totalTestsPeopleAntibody":null,"positiveTestsPeopleAntibody":null,"negativeTestsPeopleAntibody":null,"totalTestsPeopleAntigen":null,"positiveTestsPeopleAntigen":null,"totalTestsAntigen":null,"positiveTestsAntigen":null,"fips":"35","positiveIncrease":339,"negativeIncrease":6673,"total":935401,"totalTestResultsIncrease":7012,"posNeg":935401,"deathIncrease":5,"hospitalizedIncrease":16,"hash":"9ab599dcb8e7fc3f4e2a158b5a7a48bc40efbb21","commercialScore":0,"negativeRegularScore":0,"negativeScore":0,"positiveScore":0,"score":0,"grade":""},{"date":20201002,"state":"NM","positive":29661,"probableCases":null,"negative":898728,"pending":null,"totalTestResultsSource":"posNeg","totalTestResults":928389,"hospitalizedCurrently":86,"hospitalizedCumulative":3518,"inIcuCurrently":null,"inIcuCumulative":null,"onVentilatorCurrently":null,"onVentilatorCumulative":null,"recovered":16926,"dataQualityGrade":"C","lastUpdateEt":"10/1/2020 17:16","dateModified":"2020-10-01T17:16:00Z","checkTimeEt":"10/01 13:16","death":882,"hospitalized":3518,"dateChecked":"2020-10-01T17:16:00Z","totalTestsViral":928389,"positiveTestsViral":null,"negativeTestsViral":null,"positiveCasesViral":29661,"deathConfirmed":null,"deathProbable":null,"totalTestEncountersViral":null,"totalTestsPeopleViral":null,"totalTestsAntibody":null,"positiveTestsAntibody":null,"negativeTestsAntibody":null,"totalTestsPeopleAntibody":null,"positiveTestsPeopleAntibody":null,"negativeTestsPeopleAntibody":null,"totalTestsPeopleAntigen":null,"positiveTestsPeopleAntigen":null,"totalTestsAntigen":null,"positiveTestsAntigen":null,"fips":"35","positiveIncrease":226,"negativeIncrease":7154,"total":928389,"totalTestResultsIncrease":7380,"posNeg":928389,"deathIncrease":5,"hospitalizedIncrease":23,"hash":"304ff08173aab4408e090d088ba2af64fd0d6b6d","commercialScore":0,"negativeRegularScore":0,"negativeScore":0,"positiveScore":0,"score":0,"grade":""},{"date":20201001,"state":"NM","positive":29435,"probableCases":null,"negative":891574,"pending":null,"totalTestResultsSource":"posNeg","totalTestResults":921009,"hospitalizedCurrently":85,"hospitalizedCumulative":3495,"inIcuCurrently":null,"inIcuCumulative":null,"onVentilatorCurrently":null,"onVentilatorCumulative":null,"recovered":16671,"dataQualityGrade":"C","lastUpdateEt":"9/30/2020 17:51","dateModified":"2020-09-30T17:51:00Z","checkTimeEt":"09/30 13:51","death":877,"hospitalized":3495,"dateChecked":"2020-09-30T17:51:00Z","totalTestsViral":921009,"positiveTestsViral":null,"negativeTestsViral":null,"positiveCasesViral":29435,"deathConfirmed":null,"deathProbable":null,"totalTestEncountersViral":null,"totalTestsPeopleViral":null,"totalTestsAntibody":null,"positiveTestsAntibody":null,"negativeTestsAntibody":null,"totalTestsPeopleAntibody":null,"positiveTestsPeopleAntibody":null,"negativeTestsPeopleAntibody":null,"totalTestsPeopleAntigen":null,"positiveTestsPeopleAntigen":null,"totalTestsAntigen":null,"positiveTestsAntigen":null,"fips":"35","positiveIncrease":278,"negativeIncrease":5745,"total":921009,"totalTestResultsIncrease":6023,"posNeg":921009,"deathIncrease":2,"hospitalizedIncrease":20,"hash":"cb3c8760a288ebf754fb763536dab08e2f0736d6","commercialScore":0,"negativeRegularScore":0,"negativeScore":0,"positiveScore":0,"score":0,"grade":""},{"date":20200930,"state":"NM","positive":29157,"probableCases":null,"negative":885829,"pending":null,"totalTestResultsSource":"posNeg","totalTestResults":914986,"hospitalizedCurrently":80,"hospitalizedCumulative":3475,"inIcuCurrently":null,"inIcuCumulative":null,"onVentilatorCurrently":null,"onVentilatorCumulative":null,"recovered":16565,"dataQualityGrade":"C","lastUpdateEt":"9/29/2020 17:52","dateModified":"2020-09-29T17:52:00Z","checkTimeEt":"09/29 13:52","death":875,"hospitalized":3475,"dateChecked":"2020-09-29T17:52:00Z","totalTestsViral":914986,"positiveTestsViral":null,"negativeTestsViral":null,"positiveCasesViral":29157,"deathConfirmed":null,"deathProbable":null,"totalTestEncountersViral":null,"totalTestsPeopleViral":null,"totalTestsAntibody":null,"positiveTestsAntibody":null,"negativeTestsAntibody":null,"totalTestsPeopleAntibody":null,"positiveTestsPeopleAntibody":null,"negativeTestsPeopleAntibody":null,"totalTestsPeopleAntigen":null,"positiveTestsPeopleAntigen":null,"totalTestsAntigen":null,"positiveTestsAntigen":null,"fips":"35","positiveIncrease":172,"negativeIncrease":5309,"total":914986,"totalTestResultsIncrease":5481,"posNeg":914986,"deathIncrease":2,"hospitalizedIncrease":12,"hash":"5ddec29cd738534e8449773999b87d41183eeb0d","commercialScore":0,"negativeRegularScore":0,"negativeScore":0,"positiveScore":0,"score":0,"grade":""},{"date":20200929,"state":"NM","positive":28985,"probableCases":null,"negative":880520,"pending":null,"totalTestResultsSource":"posNeg","totalTestResults":909505,"hospitalizedCurrently":76,"hospitalizedCumulative":3463,"inIcuCurrently":null,"inIcuCumulative":null,"onVentilatorCurrently":null,"onVentilatorCumulative":null,"recovered":16422,"dataQualityGrade":"C","lastUpdateEt":"9/28/2020 17:50","dateModified":"2020-09-28T17:50:00Z","checkTimeEt":"09/28 13:50","death":873,"hospitalized":3463,"dateChecked":"2020-09-28T17:50:00Z","totalTestsViral":909505,"positiveTestsViral":null,"negativeTestsViral":null,"positiveCasesViral":28985,"deathConfirmed":null,"deathProbable":null,"totalTestEncountersViral":null,"totalTestsPeopleViral":null,"totalTestsAntibody":null,"positiveTestsAntibody":null,"negativeTestsAntibody":null,"totalTestsPeopleAntibody":null,"positiveTestsPeopleAntibody":null,"negativeTestsPeopleAntibody":null,"totalTestsPeopleAntigen":null,"positiveTestsPeopleAntigen":null,"totalTestsAntigen":null,"positiveTestsAntigen":null,"fips":"35","positiveIncrease":141,"negativeIncrease":4035,"total":909505,"totalTestResultsIncrease":4176,"posNeg":909505,"deathIncrease":3,"hospitalizedIncrease":20,"hash":"19878aa815f91d4e17352d64091c494e51ae684f","commercialScore":0,"negativeRegularScore":0,"negativeScore":0,"positiveScore":0,"score":0,"grade":""},{"date":20200928,"state":"NM","positive":28844,"probableCases":null,"negative":876485,"pending":null,"totalTestResultsSource":"posNeg","totalTestResults":905329,"hospitalizedCurrently":66,"hospitalizedCumulative":3443,"inIcuCurrently":null,"inIcuCumulative":null,"onVentilatorCurrently":null,"onVentilatorCumulative":null,"recovered":16301,"dataQualityGrade":"C","lastUpdateEt":"9/27/2020 17:49","dateModified":"2020-09-27T17:49:00Z","checkTimeEt":"09/27 13:49","death":870,"hospitalized":3443,"dateChecked":"2020-09-27T17:49:00Z","totalTestsViral":905329,"positiveTestsViral":null,"negativeTestsViral":null,"positiveCasesViral":28844,"deathConfirmed":null,"deathProbable":null,"totalTestEncountersViral":null,"totalTestsPeopleViral":null,"totalTestsAntibody":null,"positiveTestsAntibody":null,"negativeTestsAntibody":null,"totalTestsPeopleAntibody":null,"positiveTestsPeopleAntibody":null,"negativeTestsPeopleAntibody":null,"totalTestsPeopleAntigen":null,"positiveTestsPeopleAntigen":null,"totalTestsAntigen":null,"positiveTestsAntigen":null,"fips":"35","positiveIncrease":152,"negativeIncrease":5240,"total":905329,"totalTestResultsIncrease":5392,"posNeg":905329,"deathIncrease":0,"hospitalizedIncrease":8,"hash":"ffd24484dea43b6117954311595b9e69bf328d2b","commercialScore":0,"negativeRegularScore":0,"negativeScore":0,"positiveScore":0,"score":0,"grade":""},{"date":20200927,"state":"NM","positive":28692,"probableCases":null,"negative":871245,"pending":null,"totalTestResultsSource":"posNeg","totalTestResults":899937,"hospitalizedCurrently":72,"hospitalizedCumulative":3435,"inIcuCurrently":null,"inIcuCumulative":null,"onVentilatorCurrently":null,"onVentilatorCumulative":null,"recovered":16211,"dataQualityGrade":"C","lastUpdateEt":"9/26/2020 17:30","dateModified":"2020-09-26T17:30:00Z","checkTimeEt":"09/26 13:30","death":870,"hospitalized":3435,"dateChecked":"2020-09-26T17:30:00Z","totalTestsViral":899937,"positiveTestsViral":null,"negativeTestsViral":null,"positiveCasesViral":28692,"deathConfirmed":null,"deathProbable":null,"totalTestEncountersViral":null,"totalTestsPeopleViral":null,"totalTestsAntibody":null,"positiveTestsAntibody":null,"negativeTestsAntibody":null,"totalTestsPeopleAntibody":null,"positiveTestsPeopleAntibody":null,"negativeTestsPeopleAntibody":null,"totalTestsPeopleAntigen":null,"positiveTestsPeopleAntigen":null,"totalTestsAntigen":null,"positiveTestsAntigen":null,"fips":"35","positiveIncrease":205,"negativeIncrease":6243,"total":899937,"totalTestResultsIncrease":6448,"posNeg":899937,"deathIncrease":5,"hospitalizedIncrease":15,"hash":"be7f687b92d21ab48cc1b2c21bce20ec78892e2b","commercialScore":0,"negativeRegularScore":0,"negativeScore":0,"positiveScore":0,"score":0,"grade":""},{"date":20200926,"state":"NM","positive":28487,"probableCases":null,"negative":865002,"pending":null,"totalTestResultsSource":"posNeg","totalTestResults":893489,"hospitalizedCurrently":75,"hospitalizedCumulative":3420,"inIcuCurrently":null,"inIcuCumulative":null,"onVentilatorCurrently":null,"onVentilatorCumulative":null,"recovered":16020,"dataQualityGrade":"C","lastUpdateEt":"9/25/2020 17:50","dateModified":"2020-09-25T17:50:00Z","checkTimeEt":"09/25 13:50","death":865,"hospitalized":3420,"dateChecked":"2020-09-25T17:50:00Z","totalTestsViral":893489,"positiveTestsViral":null,"negativeTestsViral":null,"positiveCasesViral":28487,"deathConfirmed":null,"deathProbable":null,"totalTestEncountersViral":null,"totalTestsPeopleViral":null,"totalTestsAntibody":null,"positiveTestsAntibody":null,"negativeTestsAntibody":null,"totalTestsPeopleAntibody":null,"positiveTestsPeopleAntibody":null,"negativeTestsPeopleAntibody":null,"totalTestsPeopleAntigen":null,"positiveTestsPeopleAntigen":null,"totalTestsAntigen":null,"positiveTestsAntigen":null,"fips":"35","positiveIncrease":263,"negativeIncrease":7853,"total":893489,"totalTestResultsIncrease":8116,"posNeg":893489,"deathIncrease":6,"hospitalizedIncrease":18,"hash":"528604e5de3a8f8e3b8d94bed05f6251059bed64","commercialScore":0,"negativeRegularScore":0,"negativeScore":0,"positiveScore":0,"score":0,"grade":""},{"date":20200925,"state":"NM","positive":28224,"probableCases":null,"negative":857149,"pending":null,"totalTestResultsSource":"posNeg","totalTestResults":885373,"hospitalizedCurrently":66,"hospitalizedCumulative":3402,"inIcuCurrently":null,"inIcuCumulative":null,"onVentilatorCurrently":null,"onVentilatorCumulative":null,"recovered":15825,"dataQualityGrade":"C","lastUpdateEt":"9/24/2020 17:30","dateModified":"2020-09-24T17:30:00Z","checkTimeEt":"09/24 13:30","death":859,"hospitalized":3402,"dateChecked":"2020-09-24T17:30:00Z","totalTestsViral":885373,"positiveTestsViral":null,"negativeTestsViral":null,"positiveCasesViral":28224,"deathConfirmed":null,"deathProbable":null,"totalTestEncountersViral":null,"totalTestsPeopleViral":null,"totalTestsAntibody":null,"positiveTestsAntibody":null,"negativeTestsAntibody":null,"totalTestsPeopleAntibody":null,"positiveTestsPeopleAntibody":null,"negativeTestsPeopleAntibody":null,"totalTestsPeopleAntigen":null,"positiveTestsPeopleAntigen":null,"totalTestsAntigen":null,"positiveTestsAntigen":null,"fips":"35","positiveIncrease":237,"negativeIncrease":6730,"total":885373,"totalTestResultsIncrease":6967,"posNeg":885373,"deathIncrease":2,"hospitalizedIncrease":14,"hash":"ea55fd00f56f6076ee7f6293145605957818f22d","commercialScore":0,"negativeRegularScore":0,"negativeScore":0,"positiveScore":0,"score":0,"grade":""},{"date":20200924,"state":"NM","positive":27987,"probableCases":null,"negative":850419,"pending":null,"totalTestResultsSource":"posNeg","totalTestResults":878406,"hospitalizedCurrently":72,"hospitalizedCumulative":3388,"inIcuCurrently":null,"inIcuCumulative":null,"onVentilatorCurrently":null,"onVentilatorCumulative":null,"recovered":15669,"dataQualityGrade":"C","lastUpdateEt":"9/23/2020 17:51","dateModified":"2020-09-23T17:51:00Z","checkTimeEt":"09/23 13:51","death":857,"hospitalized":3388,"dateChecked":"2020-09-23T17:51:00Z","totalTestsViral":878406,"positiveTestsViral":null,"negativeTestsViral":null,"positiveCasesViral":27987,"deathConfirmed":null,"deathProbable":null,"totalTestEncountersViral":null,"totalTestsPeopleViral":null,"totalTestsAntibody":null,"positiveTestsAntibody":null,"negativeTestsAntibody":null,"totalTestsPeopleAntibody":null,"positiveTestsPeopleAntibody":null,"negativeTestsPeopleAntibody":null,"totalTestsPeopleAntigen":null,"positiveTestsPeopleAntigen":null,"totalTestsAntigen":null,"positiveTestsAntigen":null,"fips":"35","positiveIncrease":197,"negativeIncrease":5878,"total":878406,"totalTestResultsIncrease":6075,"posNeg":878406,"deathIncrease":3,"hospitalizedIncrease":17,"hash":"de088d92448db3e107bfc1f8628e202f1de0ee43","commercialScore":0,"negativeRegularScore":0,"negativeScore":0,"positiveScore":0,"score":0,"grade":""},{"date":20200923,"state":"NM","positive":27790,"probableCases":null,"negative":844541,"pending":null,"totalTestResultsSource":"posNeg","totalTestResults":872331,"hospitalizedCurrently":69,"hospitalizedCumulative":3371,"inIcuCurrently":null,"inIcuCumulative":null,"onVentilatorCurrently":null,"onVentilatorCumulative":null,"recovered":15586,"dataQualityGrade":"C","lastUpdateEt":"9/22/2020 17:12","dateModified":"2020-09-22T17:12:00Z","checkTimeEt":"09/22 13:12","death":854,"hospitalized":3371,"dateChecked":"2020-09-22T17:12:00Z","totalTestsViral":872331,"positiveTestsViral":null,"negativeTestsViral":null,"positiveCasesViral":27790,"deathConfirmed":null,"deathProbable":null,"totalTestEncountersViral":null,"totalTestsPeopleViral":null,"totalTestsAntibody":null,"positiveTestsAntibody":null,"negativeTestsAntibody":null,"totalTestsPeopleAntibody":null,"positiveTestsPeopleAntibody":null,"negativeTestsPeopleAntibody":null,"totalTestsPeopleAntigen":null,"positiveTestsPeopleAntigen":null,"totalTestsAntigen":null,"positiveTestsAntigen":null,"fips":"35","positiveIncrease":107,"negativeIncrease":5541,"total":872331,"totalTestResultsIncrease":5648,"posNeg":872331,"deathIncrease":3,"hospitalizedIncrease":13,"hash":"ba7bbb01af88ad237c04a96228ac101506109d8e","commercialScore":0,"negativeRegularScore":0,"negativeScore":0,"positiveScore":0,"score":0,"grade":""},{"date":20200922,"state":"NM","positive":27683,"probableCases":null,"negative":839000,"pending":null,"totalTestResultsSource":"posNeg","totalTestResults":866683,"hospitalizedCurrently":71,"hospitalizedCumulative":3358,"inIcuCurrently":null,"inIcuCumulative":null,"onVentilatorCurrently":null,"onVentilatorCumulative":null,"recovered":15518,"dataQualityGrade":"B","lastUpdateEt":"9/21/2020 17:50","dateModified":"2020-09-21T17:50:00Z","checkTimeEt":"09/21 13:50","death":851,"hospitalized":3358,"dateChecked":"2020-09-21T17:50:00Z","totalTestsViral":866683,"positiveTestsViral":null,"negativeTestsViral":null,"positiveCasesViral":27683,"deathConfirmed":null,"deathProbable":null,"totalTestEncountersViral":null,"totalTestsPeopleViral":null,"totalTestsAntibody":null,"positiveTestsAntibody":null,"negativeTestsAntibody":null,"totalTestsPeopleAntibody":null,"positiveTestsPeopleAntibody":null,"negativeTestsPeopleAntibody":null,"totalTestsPeopleAntigen":null,"positiveTestsPeopleAntigen":null,"totalTestsAntigen":null,"positiveTestsAntigen":null,"fips":"35","positiveIncrease":104,"negativeIncrease":3680,"total":866683,"totalTestResultsIncrease":3784,"posNeg":866683,"deathIncrease":2,"hospitalizedIncrease":17,"hash":"8f4f920d4f9044ef99eba9bddce323990e716d4e","commercialScore":0,"negativeRegularScore":0,"negativeScore":0,"positiveScore":0,"score":0,"grade":""},{"date":20200921,"state":"NM","positive":27579,"probableCases":null,"negative":835320,"pending":null,"totalTestResultsSource":"posNeg","totalTestResults":862899,"hospitalizedCurrently":64,"hospitalizedCumulative":3341,"inIcuCurrently":null,"inIcuCumulative":null,"onVentilatorCurrently":null,"onVentilatorCumulative":null,"recovered":15412,"dataQualityGrade":"B","lastUpdateEt":"9/20/2020 16:58","dateModified":"2020-09-20T16:58:00Z","checkTimeEt":"09/20 12:58","death":849,"hospitalized":3341,"dateChecked":"2020-09-20T16:58:00Z","totalTestsViral":862899,"positiveTestsViral":null,"negativeTestsViral":null,"positiveCasesViral":27579,"deathConfirmed":null,"deathProbable":null,"totalTestEncountersViral":null,"totalTestsPeopleViral":null,"totalTestsAntibody":null,"positiveTestsAntibody":null,"negativeTestsAntibody":null,"totalTestsPeopleAntibody":null,"positiveTestsPeopleAntibody":null,"negativeTestsPeopleAntibody":null,"totalTestsPeopleAntigen":null,"positiveTestsPeopleAntigen":null,"totalTestsAntigen":null,"positiveTestsAntigen":null,"fips":"35","positiveIncrease":67,"negativeIncrease":5376,"total":862899,"totalTestResultsIncrease":5443,"posNeg":862899,"deathIncrease":2,"hospitalizedIncrease":6,"hash":"937d6f719ebea52ea2f446bd2a19094ea9d6d811","commercialScore":0,"negativeRegularScore":0,"negativeScore":0,"positiveScore":0,"score":0,"grade":""},{"date":20200920,"state":"NM","positive":27512,"probableCases":null,"negative":829944,"pending":null,"totalTestResultsSource":"posNeg","totalTestResults":857456,"hospitalizedCurrently":68,"hospitalizedCumulative":3335,"inIcuCurrently":null,"inIcuCumulative":null,"onVentilatorCurrently":null,"onVentilatorCumulative":null,"recovered":15342,"dataQualityGrade":"B","lastUpdateEt":"9/19/2020 17:30","dateModified":"2020-09-19T17:30:00Z","checkTimeEt":"09/19 13:30","death":847,"hospitalized":3335,"dateChecked":"2020-09-19T17:30:00Z","totalTestsViral":857456,"positiveTestsViral":null,"negativeTestsViral":null,"positiveCasesViral":27512,"deathConfirmed":null,"deathProbable":null,"totalTestEncountersViral":null,"totalTestsPeopleViral":null,"totalTestsAntibody":null,"positiveTestsAntibody":null,"negativeTestsAntibody":null,"totalTestsPeopleAntibody":null,"positiveTestsPeopleAntibody":null,"negativeTestsPeopleAntibody":null,"totalTestsPeopleAntigen":null,"positiveTestsPeopleAntigen":null,"totalTestsAntigen":null,"positiveTestsAntigen":null,"fips":"35","positiveIncrease":162,"negativeIncrease":6331,"total":857456,"totalTestResultsIncrease":6493,"posNeg":857456,"deathIncrease":6,"hospitalizedIncrease":15,"hash":"45acd507ac8dbdebd7c57fed1b82278afdfe6a16","commercialScore":0,"negativeRegularScore":0,"negativeScore":0,"positiveScore":0,"score":0,"grade":""},{"date":20200919,"state":"NM","positive":27350,"probableCases":null,"negative":823613,"pending":null,"totalTestResultsSource":"posNeg","totalTestResults":850963,"hospitalizedCurrently":72,"hospitalizedCumulative":3320,"inIcuCurrently":null,"inIcuCumulative":null,"onVentilatorCurrently":null,"onVentilatorCumulative":null,"recovered":15256,"dataQualityGrade":"B","lastUpdateEt":"9/18/2020 17:50","dateModified":"2020-09-18T17:50:00Z","checkTimeEt":"09/18 13:50","death":841,"hospitalized":3320,"dateChecked":"2020-09-18T17:50:00Z","totalTestsViral":850963,"positiveTestsViral":null,"negativeTestsViral":null,"positiveCasesViral":27350,"deathConfirmed":null,"deathProbable":null,"totalTestEncountersViral":null,"totalTestsPeopleViral":null,"totalTestsAntibody":null,"positiveTestsAntibody":null,"negativeTestsAntibody":null,"totalTestsPeopleAntibody":null,"positiveTestsPeopleAntibody":null,"negativeTestsPeopleAntibody":null,"totalTestsPeopleAntigen":null,"positiveTestsPeopleAntigen":null,"totalTestsAntigen":null,"positiveTestsAntigen":null,"fips":"35","positiveIncrease":151,"negativeIncrease":5645,"total":850963,"totalTestResultsIncrease":5796,"posNeg":850963,"deathIncrease":5,"hospitalizedIncrease":7,"hash":"7cd6bd1edddc874f0a1493d24b89d8c30dd369ee","commercialScore":0,"negativeRegularScore":0,"negativeScore":0,"positiveScore":0,"score":0,"grade":""},{"date":20200918,"state":"NM","positive":27199,"probableCases":null,"negative":817968,"pending":null,"totalTestResultsSource":"posNeg","totalTestResults":845167,"hospitalizedCurrently":69,"hospitalizedCumulative":3313,"inIcuCurrently":null,"inIcuCumulative":null,"onVentilatorCurrently":null,"onVentilatorCumulative":null,"recovered":15106,"dataQualityGrade":"B","lastUpdateEt":"9/16/2020 17:52","dateModified":"2020-09-16T17:52:00Z","checkTimeEt":"09/16 13:52","death":836,"hospitalized":3313,"dateChecked":"2020-09-16T17:52:00Z","totalTestsViral":845167,"positiveTestsViral":null,"negativeTestsViral":null,"positiveCasesViral":27199,"deathConfirmed":null,"deathProbable":null,"totalTestEncountersViral":null,"totalTestsPeopleViral":null,"totalTestsAntibody":null,"positiveTestsAntibody":null,"negativeTestsAntibody":null,"totalTestsPeopleAntibody":null,"positiveTestsPeopleAntibody":null,"negativeTestsPeopleAntibody":null,"totalTestsPeopleAntigen":null,"positiveTestsPeopleAntigen":null,"totalTestsAntigen":null,"positiveTestsAntigen":null,"fips":"35","positiveIncrease":158,"negativeIncrease":7609,"total":845167,"totalTestResultsIncrease":7767,"posNeg":845167,"deathIncrease":4,"hospitalizedIncrease":19,"hash":"83f4386ff190bc2b1ad14535bbcf028151496d49","commercialScore":0,"negativeRegularScore":0,"negativeScore":0,"positiveScore":0,"score":0,"grade":""},{"date":20200917,"state":"NM","positive":27041,"probableCases":null,"negative":810359,"pending":null,"totalTestResultsSource":"posNeg","totalTestResults":837400,"hospitalizedCurrently":59,"hospitalizedCumulative":3294,"inIcuCurrently":null,"inIcuCumulative":null,"onVentilatorCurrently":null,"onVentilatorCumulative":null,"recovered":14842,"dataQualityGrade":"B","lastUpdateEt":"9/16/2020 17:52","dateModified":"2020-09-16T17:52:00Z","checkTimeEt":"09/16 13:52","death":832,"hospitalized":3294,"dateChecked":"2020-09-16T17:52:00Z","totalTestsViral":837400,"positiveTestsViral":null,"negativeTestsViral":null,"positiveCasesViral":27041,"deathConfirmed":null,"deathProbable":null,"totalTestEncountersViral":null,"totalTestsPeopleViral":null,"totalTestsAntibody":null,"positiveTestsAntibody":null,"negativeTestsAntibody":null,"totalTestsPeopleAntibody":null,"positiveTestsPeopleAntibody":null,"negativeTestsPeopleAntibody":null,"totalTestsPeopleAntigen":null,"positiveTestsPeopleAntigen":null,"totalTestsAntigen":null,"positiveTestsAntigen":null,"fips":"35","positiveIncrease":118,"negativeIncrease":5287,"total":837400,"totalTestResultsIncrease":5405,"posNeg":837400,"deathIncrease":2,"hospitalizedIncrease":10,"hash":"86cc2321bf6008f00ab34c37b619cd5e65ee4181","commercialScore":0,"negativeRegularScore":0,"negativeScore":0,"positiveScore":0,"score":0,"grade":""},{"date":20200916,"state":"NM","positive":26923,"probableCases":null,"negative":805072,"pending":null,"totalTestResultsSource":"posNeg","totalTestResults":831995,"hospitalizedCurrently":59,"hospitalizedCumulative":3284,"inIcuCurrently":null,"inIcuCumulative":null,"onVentilatorCurrently":null,"onVentilatorCumulative":null,"recovered":14634,"dataQualityGrade":"B","lastUpdateEt":"9/15/2020 17:50","dateModified":"2020-09-15T17:50:00Z","checkTimeEt":"09/15 13:50","death":830,"hospitalized":3284,"dateChecked":"2020-09-15T17:50:00Z","totalTestsViral":831995,"positiveTestsViral":null,"negativeTestsViral":null,"positiveCasesViral":26923,"deathConfirmed":null,"deathProbable":null,"totalTestEncountersViral":null,"totalTestsPeopleViral":null,"totalTestsAntibody":null,"positiveTestsAntibody":null,"negativeTestsAntibody":null,"totalTestsPeopleAntibody":null,"positiveTestsPeopleAntibody":null,"negativeTestsPeopleAntibody":null,"totalTestsPeopleAntigen":null,"positiveTestsPeopleAntigen":null,"totalTestsAntigen":null,"positiveTestsAntigen":null,"fips":"35","positiveIncrease":81,"negativeIncrease":5295,"total":831995,"totalTestResultsIncrease":5376,"posNeg":831995,"deathIncrease":7,"hospitalizedIncrease":10,"hash":"80edf61c339f7de6412a481968cb5ce14cd63b45","commercialScore":0,"negativeRegularScore":0,"negativeScore":0,"positiveScore":0,"score":0,"grade":""},{"date":20200915,"state":"NM","positive":26842,"probableCases":null,"negative":799777,"pending":null,"totalTestResultsSource":"posNeg","totalTestResults":826619,"hospitalizedCurrently":60,"hospitalizedCumulative":3274,"inIcuCurrently":null,"inIcuCumulative":null,"onVentilatorCurrently":null,"onVentilatorCumulative":null,"recovered":14470,"dataQualityGrade":"B","lastUpdateEt":"9/14/2020 17:50","dateModified":"2020-09-14T17:50:00Z","checkTimeEt":"09/14 13:50","death":823,"hospitalized":3274,"dateChecked":"2020-09-14T17:50:00Z","totalTestsViral":826619,"positiveTestsViral":null,"negativeTestsViral":null,"positiveCasesViral":26842,"deathConfirmed":null,"deathProbable":null,"totalTestEncountersViral":null,"totalTestsPeopleViral":null,"totalTestsAntibody":null,"positiveTestsAntibody":null,"negativeTestsAntibody":null,"totalTestsPeopleAntibody":null,"positiveTestsPeopleAntibody":null,"negativeTestsPeopleAntibody":null,"totalTestsPeopleAntigen":null,"positiveTestsPeopleAntigen":null,"totalTestsAntigen":null,"positiveTestsAntigen":null,"fips":"35","positiveIncrease":81,"negativeIncrease":3393,"total":826619,"totalTestResultsIncrease":3474,"posNeg":826619,"deathIncrease":0,"hospitalizedIncrease":7,"hash":"d68171e488074b5a5e6fcf5ce79ce09d44175298","commercialScore":0,"negativeRegularScore":0,"negativeScore":0,"positiveScore":0,"score":0,"grade":""},{"date":20200914,"state":"NM","positive":26761,"probableCases":null,"negative":796384,"pending":null,"totalTestResultsSource":"posNeg","totalTestResults":823145,"hospitalizedCurrently":59,"hospitalizedCumulative":3267,"inIcuCurrently":null,"inIcuCumulative":null,"onVentilatorCurrently":null,"onVentilatorCumulative":null,"recovered":14407,"dataQualityGrade":"B","lastUpdateEt":"9/13/2020 17:00","dateModified":"2020-09-13T17:00:00Z","checkTimeEt":"09/13 13:00","death":823,"hospitalized":3267,"dateChecked":"2020-09-13T17:00:00Z","totalTestsViral":823145,"positiveTestsViral":null,"negativeTestsViral":null,"positiveCasesViral":26761,"deathConfirmed":null,"deathProbable":null,"totalTestEncountersViral":null,"totalTestsPeopleViral":null,"totalTestsAntibody":null,"positiveTestsAntibody":null,"negativeTestsAntibody":null,"totalTestsPeopleAntibody":null,"positiveTestsPeopleAntibody":null,"negativeTestsPeopleAntibody":null,"totalTestsPeopleAntigen":null,"positiveTestsPeopleAntigen":null,"totalTestsAntigen":null,"positiveTestsAntigen":null,"fips":"35","positiveIncrease":100,"negativeIncrease":5775,"total":823145,"totalTestResultsIncrease":5875,"posNeg":823145,"deathIncrease":2,"hospitalizedIncrease":4,"hash":"28383dd79c1d560da7e9a42f2979046337fe741a","commercialScore":0,"negativeRegularScore":0,"negativeScore":0,"positiveScore":0,"score":0,"grade":""},{"date":20200913,"state":"NM","positive":26661,"probableCases":null,"negative":790609,"pending":null,"totalTestResultsSource":"posNeg","totalTestResults":817270,"hospitalizedCurrently":67,"hospitalizedCumulative":3263,"inIcuCurrently":null,"inIcuCumulative":null,"onVentilatorCurrently":null,"onVentilatorCumulative":null,"recovered":14396,"dataQualityGrade":"B","lastUpdateEt":"9/12/2020 17:30","dateModified":"2020-09-12T17:30:00Z","checkTimeEt":"09/12 13:30","death":821,"hospitalized":3263,"dateChecked":"2020-09-12T17:30:00Z","totalTestsViral":817270,"positiveTestsViral":null,"negativeTestsViral":null,"positiveCasesViral":26661,"deathConfirmed":null,"deathProbable":null,"totalTestEncountersViral":null,"totalTestsPeopleViral":null,"totalTestsAntibody":null,"positiveTestsAntibody":null,"negativeTestsAntibody":null,"totalTestsPeopleAntibody":null,"positiveTestsPeopleAntibody":null,"negativeTestsPeopleAntibody":null,"totalTestsPeopleAntigen":null,"positiveTestsPeopleAntigen":null,"totalTestsAntigen":null,"positiveTestsAntigen":null,"fips":"35","positiveIncrease":98,"negativeIncrease":5122,"total":817270,"totalTestResultsIncrease":5220,"posNeg":817270,"deathIncrease":3,"hospitalizedIncrease":16,"hash":"77eccb0d0d807bd6d8316ce95990a5409e6861ff","commercialScore":0,"negativeRegularScore":0,"negativeScore":0,"positiveScore":0,"score":0,"grade":""},{"date":20200912,"state":"NM","positive":26563,"probableCases":null,"negative":785487,"pending":null,"totalTestResultsSource":"posNeg","totalTestResults":812050,"hospitalizedCurrently":73,"hospitalizedCumulative":3247,"inIcuCurrently":null,"inIcuCumulative":null,"onVentilatorCurrently":null,"onVentilatorCumulative":null,"recovered":14276,"dataQualityGrade":"B","lastUpdateEt":"9/11/2020 17:50","dateModified":"2020-09-11T17:50:00Z","checkTimeEt":"09/11 13:50","death":818,"hospitalized":3247,"dateChecked":"2020-09-11T17:50:00Z","totalTestsViral":812050,"positiveTestsViral":null,"negativeTestsViral":null,"positiveCasesViral":26563,"deathConfirmed":null,"deathProbable":null,"totalTestEncountersViral":null,"totalTestsPeopleViral":null,"totalTestsAntibody":null,"positiveTestsAntibody":null,"negativeTestsAntibody":null,"totalTestsPeopleAntibody":null,"positiveTestsPeopleAntibody":null,"negativeTestsPeopleAntibody":null,"totalTestsPeopleAntigen":null,"positiveTestsPeopleAntigen":null,"totalTestsAntigen":null,"positiveTestsAntigen":null,"fips":"35","positiveIncrease":134,"negativeIncrease":4917,"total":812050,"totalTestResultsIncrease":5051,"posNeg":812050,"deathIncrease":2,"hospitalizedIncrease":9,"hash":"60b66af8e73518a6d5dbc5924bbab8815bd5a7d7","commercialScore":0,"negativeRegularScore":0,"negativeScore":0,"positiveScore":0,"score":0,"grade":""},{"date":20200911,"state":"NM","positive":26429,"probableCases":null,"negative":780570,"pending":null,"totalTestResultsSource":"posNeg","totalTestResults":806999,"hospitalizedCurrently":80,"hospitalizedCumulative":3238,"inIcuCurrently":null,"inIcuCumulative":null,"onVentilatorCurrently":null,"onVentilatorCumulative":null,"recovered":14120,"dataQualityGrade":"B","lastUpdateEt":"9/10/2020 17:50","dateModified":"2020-09-10T17:50:00Z","checkTimeEt":"09/10 13:50","death":816,"hospitalized":3238,"dateChecked":"2020-09-10T17:50:00Z","totalTestsViral":806999,"positiveTestsViral":null,"negativeTestsViral":null,"positiveCasesViral":26429,"deathConfirmed":null,"deathProbable":null,"totalTestEncountersViral":null,"totalTestsPeopleViral":null,"totalTestsAntibody":null,"positiveTestsAntibody":null,"negativeTestsAntibody":null,"totalTestsPeopleAntibody":null,"positiveTestsPeopleAntibody":null,"negativeTestsPeopleAntibody":null,"totalTestsPeopleAntigen":null,"positiveTestsPeopleAntigen":null,"totalTestsAntigen":null,"positiveTestsAntigen":null,"fips":"35","positiveIncrease":161,"negativeIncrease":3737,"total":806999,"totalTestResultsIncrease":3898,"posNeg":806999,"deathIncrease":3,"hospitalizedIncrease":19,"hash":"d3f713ccb234445d2165f7d7c04827fddbb133e8","commercialScore":0,"negativeRegularScore":0,"negativeScore":0,"positiveScore":0,"score":0,"grade":""},{"date":20200910,"state":"NM","positive":26268,"probableCases":null,"negative":776833,"pending":null,"totalTestResultsSource":"posNeg","totalTestResults":803101,"hospitalizedCurrently":77,"hospitalizedCumulative":3219,"inIcuCurrently":null,"inIcuCumulative":null,"onVentilatorCurrently":null,"onVentilatorCumulative":null,"recovered":13928,"dataQualityGrade":"B","lastUpdateEt":"9/9/2020 17:50","dateModified":"2020-09-09T17:50:00Z","checkTimeEt":"09/09 13:50","death":813,"hospitalized":3219,"dateChecked":"2020-09-09T17:50:00Z","totalTestsViral":803101,"positiveTestsViral":null,"negativeTestsViral":null,"positiveCasesViral":26268,"deathConfirmed":null,"deathProbable":null,"totalTestEncountersViral":null,"totalTestsPeopleViral":null,"totalTestsAntibody":null,"positiveTestsAntibody":null,"negativeTestsAntibody":null,"totalTestsPeopleAntibody":null,"positiveTestsPeopleAntibody":null,"negativeTestsPeopleAntibody":null,"totalTestsPeopleAntigen":null,"positiveTestsPeopleAntigen":null,"totalTestsAntigen":null,"positiveTestsAntigen":null,"fips":"35","positiveIncrease":87,"negativeIncrease":3341,"total":803101,"totalTestResultsIncrease":3428,"posNeg":803101,"deathIncrease":6,"hospitalizedIncrease":17,"hash":"6454f142a5381089ef0dff904f45b034c847fd69","commercialScore":0,"negativeRegularScore":0,"negativeScore":0,"positiveScore":0,"score":0,"grade":""},{"date":20200909,"state":"NM","positive":26181,"probableCases":null,"negative":773492,"pending":null,"totalTestResultsSource":"posNeg","totalTestResults":799673,"hospitalizedCurrently":68,"hospitalizedCumulative":3202,"inIcuCurrently":null,"inIcuCumulative":null,"onVentilatorCurrently":null,"onVentilatorCumulative":null,"recovered":13701,"dataQualityGrade":"B","lastUpdateEt":"9/8/2020 17:50","dateModified":"2020-09-08T17:50:00Z","checkTimeEt":"09/08 13:50","death":807,"hospitalized":3202,"dateChecked":"2020-09-08T17:50:00Z","totalTestsViral":799673,"positiveTestsViral":null,"negativeTestsViral":null,"positiveCasesViral":26181,"deathConfirmed":null,"deathProbable":null,"totalTestEncountersViral":null,"totalTestsPeopleViral":null,"totalTestsAntibody":null,"positiveTestsAntibody":null,"negativeTestsAntibody":null,"totalTestsPeopleAntibody":null,"positiveTestsPeopleAntibody":null,"negativeTestsPeopleAntibody":null,"totalTestsPeopleAntigen":null,"positiveTestsPeopleAntigen":null,"totalTestsAntigen":null,"positiveTestsAntigen":null,"fips":"35","positiveIncrease":37,"negativeIncrease":4389,"total":799673,"totalTestResultsIncrease":4426,"posNeg":799673,"deathIncrease":0,"hospitalizedIncrease":7,"hash":"d611b740655b498b677c65b6e594c6a73d63968f","commercialScore":0,"negativeRegularScore":0,"negativeScore":0,"positiveScore":0,"score":0,"grade":""},{"date":20200908,"state":"NM","positive":26144,"probableCases":null,"negative":769103,"pending":null,"totalTestResultsSource":"posNeg","totalTestResults":795247,"hospitalizedCurrently":65,"hospitalizedCumulative":3195,"inIcuCurrently":null,"inIcuCumulative":null,"onVentilatorCurrently":null,"onVentilatorCumulative":null,"recovered":13604,"dataQualityGrade":"B","lastUpdateEt":"9/7/2020 17:15","dateModified":"2020-09-07T17:15:00Z","checkTimeEt":"09/07 13:15","death":807,"hospitalized":3195,"dateChecked":"2020-09-07T17:15:00Z","totalTestsViral":795247,"positiveTestsViral":null,"negativeTestsViral":null,"positiveCasesViral":26144,"deathConfirmed":null,"deathProbable":null,"totalTestEncountersViral":null,"totalTestsPeopleViral":null,"totalTestsAntibody":null,"positiveTestsAntibody":null,"negativeTestsAntibody":null,"totalTestsPeopleAntibody":null,"positiveTestsPeopleAntibody":null,"negativeTestsPeopleAntibody":null,"totalTestsPeopleAntigen":null,"positiveTestsPeopleAntigen":null,"totalTestsAntigen":null,"positiveTestsAntigen":null,"fips":"35","positiveIncrease":37,"negativeIncrease":3374,"total":795247,"totalTestResultsIncrease":3411,"posNeg":795247,"deathIncrease":4,"hospitalizedIncrease":9,"hash":"fb6fbff7a9a35adf509049925163bceef7915ea8","commercialScore":0,"negativeRegularScore":0,"negativeScore":0,"positiveScore":0,"score":0,"grade":""},{"date":20200907,"state":"NM","positive":26107,"probableCases":null,"negative":765729,"pending":null,"totalTestResultsSource":"posNeg","totalTestResults":791836,"hospitalizedCurrently":65,"hospitalizedCumulative":3186,"inIcuCurrently":null,"inIcuCumulative":null,"onVentilatorCurrently":null,"onVentilatorCumulative":null,"recovered":13530,"dataQualityGrade":"B","lastUpdateEt":"9/6/2020 17:30","dateModified":"2020-09-06T17:30:00Z","checkTimeEt":"09/06 13:30","death":803,"hospitalized":3186,"dateChecked":"2020-09-06T17:30:00Z","totalTestsViral":791836,"positiveTestsViral":null,"negativeTestsViral":null,"positiveCasesViral":26107,"deathConfirmed":null,"deathProbable":null,"totalTestEncountersViral":null,"totalTestsPeopleViral":null,"totalTestsAntibody":null,"positiveTestsAntibody":null,"negativeTestsAntibody":null,"totalTestsPeopleAntibody":null,"positiveTestsPeopleAntibody":null,"negativeTestsPeopleAntibody":null,"totalTestsPeopleAntigen":null,"positiveTestsPeopleAntigen":null,"totalTestsAntigen":null,"positiveTestsAntigen":null,"fips":"35","positiveIncrease":59,"negativeIncrease":3966,"total":791836,"totalTestResultsIncrease":4025,"posNeg":791836,"deathIncrease":3,"hospitalizedIncrease":15,"hash":"512ae081cf88648a20ca265c7895f2288471c6fb","commercialScore":0,"negativeRegularScore":0,"negativeScore":0,"positiveScore":0,"score":0,"grade":""},{"date":20200906,"state":"NM","positive":26048,"probableCases":null,"negative":761763,"pending":null,"totalTestResultsSource":"posNeg","totalTestResults":787811,"hospitalizedCurrently":68,"hospitalizedCumulative":3171,"inIcuCurrently":null,"inIcuCumulative":null,"onVentilatorCurrently":null,"onVentilatorCumulative":null,"recovered":13460,"dataQualityGrade":"B","lastUpdateEt":"9/5/2020 17:30","dateModified":"2020-09-05T17:30:00Z","checkTimeEt":"09/05 13:30","death":800,"hospitalized":3171,"dateChecked":"2020-09-05T17:30:00Z","totalTestsViral":787811,"positiveTestsViral":null,"negativeTestsViral":null,"positiveCasesViral":26048,"deathConfirmed":null,"deathProbable":null,"totalTestEncountersViral":null,"totalTestsPeopleViral":null,"totalTestsAntibody":null,"positiveTestsAntibody":null,"negativeTestsAntibody":null,"totalTestsPeopleAntibody":null,"positiveTestsPeopleAntibody":null,"negativeTestsPeopleAntibody":null,"totalTestsPeopleAntigen":null,"positiveTestsPeopleAntigen":null,"totalTestsAntigen":null,"positiveTestsAntigen":null,"fips":"35","positiveIncrease":146,"negativeIncrease":5621,"total":787811,"totalTestResultsIncrease":5767,"posNeg":787811,"deathIncrease":6,"hospitalizedIncrease":0,"hash":"83097b7a952e7c40a03624509c61bfce7ea9ecc4","commercialScore":0,"negativeRegularScore":0,"negativeScore":0,"positiveScore":0,"score":0,"grade":""},{"date":20200905,"state":"NM","positive":25902,"probableCases":null,"negative":756142,"pending":null,"totalTestResultsSource":"posNeg","totalTestResults":782044,"hospitalizedCurrently":69,"hospitalizedCumulative":3171,"inIcuCurrently":null,"inIcuCumulative":null,"onVentilatorCurrently":null,"onVentilatorCumulative":null,"recovered":13412,"dataQualityGrade":"B","lastUpdateEt":"9/4/2020 17:50","dateModified":"2020-09-04T17:50:00Z","checkTimeEt":"09/04 13:50","death":794,"hospitalized":3171,"dateChecked":"2020-09-04T17:50:00Z","totalTestsViral":782044,"positiveTestsViral":null,"negativeTestsViral":null,"positiveCasesViral":25902,"deathConfirmed":null,"deathProbable":null,"totalTestEncountersViral":null,"totalTestsPeopleViral":null,"totalTestsAntibody":null,"positiveTestsAntibody":null,"negativeTestsAntibody":null,"totalTestsPeopleAntibody":null,"positiveTestsPeopleAntibody":null,"negativeTestsPeopleAntibody":null,"totalTestsPeopleAntigen":null,"positiveTestsPeopleAntigen":null,"totalTestsAntigen":null,"positiveTestsAntigen":null,"fips":"35","positiveIncrease":90,"negativeIncrease":5158,"total":782044,"totalTestResultsIncrease":5248,"posNeg":782044,"deathIncrease":3,"hospitalizedIncrease":2,"hash":"09eb417cb7aeb804ec28ae630f133df1586cc7cd","commercialScore":0,"negativeRegularScore":0,"negativeScore":0,"positiveScore":0,"score":0,"grade":""},{"date":20200904,"state":"NM","positive":25812,"probableCases":null,"negative":750984,"pending":null,"totalTestResultsSource":"posNeg","totalTestResults":776796,"hospitalizedCurrently":75,"hospitalizedCumulative":3169,"inIcuCurrently":null,"inIcuCumulative":null,"onVentilatorCurrently":null,"onVentilatorCumulative":null,"recovered":13283,"dataQualityGrade":"B","lastUpdateEt":"9/3/2020 17:50","dateModified":"2020-09-03T17:50:00Z","checkTimeEt":"09/03 13:50","death":791,"hospitalized":3169,"dateChecked":"2020-09-03T17:50:00Z","totalTestsViral":776796,"positiveTestsViral":null,"negativeTestsViral":null,"positiveCasesViral":25812,"deathConfirmed":null,"deathProbable":null,"totalTestEncountersViral":null,"totalTestsPeopleViral":null,"totalTestsAntibody":null,"positiveTestsAntibody":null,"negativeTestsAntibody":null,"totalTestsPeopleAntibody":null,"positiveTestsPeopleAntibody":null,"negativeTestsPeopleAntibody":null,"totalTestsPeopleAntigen":null,"positiveTestsPeopleAntigen":null,"totalTestsAntigen":null,"positiveTestsAntigen":null,"fips":"35","positiveIncrease":200,"negativeIncrease":5637,"total":776796,"totalTestResultsIncrease":5837,"posNeg":776796,"deathIncrease":1,"hospitalizedIncrease":10,"hash":"6adf0d071d05ad1582ee11b0b99d2909be02d93a","commercialScore":0,"negativeRegularScore":0,"negativeScore":0,"positiveScore":0,"score":0,"grade":""},{"date":20200903,"state":"NM","positive":25612,"probableCases":null,"negative":745347,"pending":null,"totalTestResultsSource":"posNeg","totalTestResults":770959,"hospitalizedCurrently":71,"hospitalizedCumulative":3159,"inIcuCurrently":null,"inIcuCumulative":null,"onVentilatorCurrently":null,"onVentilatorCumulative":null,"recovered":13180,"dataQualityGrade":"B","lastUpdateEt":"9/2/2020 17:50","dateModified":"2020-09-02T17:50:00Z","checkTimeEt":"09/02 13:50","death":790,"hospitalized":3159,"dateChecked":"2020-09-02T17:50:00Z","totalTestsViral":770959,"positiveTestsViral":null,"negativeTestsViral":null,"positiveCasesViral":25612,"deathConfirmed":null,"deathProbable":null,"totalTestEncountersViral":null,"totalTestsPeopleViral":null,"totalTestsAntibody":null,"positiveTestsAntibody":null,"negativeTestsAntibody":null,"totalTestsPeopleAntibody":null,"positiveTestsPeopleAntibody":null,"negativeTestsPeopleAntibody":null,"totalTestsPeopleAntigen":null,"positiveTestsPeopleAntigen":null,"totalTestsAntigen":null,"positiveTestsAntigen":null,"fips":"35","positiveIncrease":152,"negativeIncrease":5408,"total":770959,"totalTestResultsIncrease":5560,"posNeg":770959,"deathIncrease":3,"hospitalizedIncrease":8,"hash":"445dbb73b7531b60f95c3f070c5ca5621d7d9b2e","commercialScore":0,"negativeRegularScore":0,"negativeScore":0,"positiveScore":0,"score":0,"grade":""},{"date":20200902,"state":"NM","positive":25460,"probableCases":null,"negative":739939,"pending":null,"totalTestResultsSource":"posNeg","totalTestResults":765399,"hospitalizedCurrently":72,"hospitalizedCumulative":3151,"inIcuCurrently":null,"inIcuCumulative":null,"onVentilatorCurrently":null,"onVentilatorCumulative":null,"recovered":13073,"dataQualityGrade":"B","lastUpdateEt":"9/1/2020 17:50","dateModified":"2020-09-01T17:50:00Z","checkTimeEt":"09/01 13:50","death":787,"hospitalized":3151,"dateChecked":"2020-09-01T17:50:00Z","totalTestsViral":765399,"positiveTestsViral":null,"negativeTestsViral":null,"positiveCasesViral":25460,"deathConfirmed":null,"deathProbable":null,"totalTestEncountersViral":null,"totalTestsPeopleViral":null,"totalTestsAntibody":null,"positiveTestsAntibody":null,"negativeTestsAntibody":null,"totalTestsPeopleAntibody":null,"positiveTestsPeopleAntibody":null,"negativeTestsPeopleAntibody":null,"totalTestsPeopleAntigen":null,"positiveTestsPeopleAntigen":null,"totalTestsAntigen":null,"positiveTestsAntigen":null,"fips":"35","positiveIncrease":108,"negativeIncrease":4417,"total":765399,"totalTestResultsIncrease":4525,"posNeg":765399,"deathIncrease":8,"hospitalizedIncrease":17,"hash":"8a96803ebf650aa80bc907ae4602f8abd46ff02d","commercialScore":0,"negativeRegularScore":0,"negativeScore":0,"positiveScore":0,"score":0,"grade":""},{"date":20200901,"state":"NM","positive":25352,"probableCases":null,"negative":735522,"pending":null,"totalTestResultsSource":"posNeg","totalTestResults":760874,"hospitalizedCurrently":65,"hospitalizedCumulative":3134,"inIcuCurrently":null,"inIcuCumulative":null,"onVentilatorCurrently":null,"onVentilatorCumulative":null,"recovered":12960,"dataQualityGrade":"B","lastUpdateEt":"8/31/2020 17:52","dateModified":"2020-08-31T17:52:00Z","checkTimeEt":"08/31 13:52","death":779,"hospitalized":3134,"dateChecked":"2020-08-31T17:52:00Z","totalTestsViral":760874,"positiveTestsViral":null,"negativeTestsViral":null,"positiveCasesViral":25352,"deathConfirmed":null,"deathProbable":null,"totalTestEncountersViral":null,"totalTestsPeopleViral":null,"totalTestsAntibody":null,"positiveTestsAntibody":null,"negativeTestsAntibody":null,"totalTestsPeopleAntibody":null,"positiveTestsPeopleAntibody":null,"negativeTestsPeopleAntibody":null,"totalTestsPeopleAntigen":null,"positiveTestsPeopleAntigen":null,"totalTestsAntigen":null,"positiveTestsAntigen":null,"fips":"35","positiveIncrease":69,"negativeIncrease":3872,"total":760874,"totalTestResultsIncrease":3941,"posNeg":760874,"deathIncrease":9,"hospitalizedIncrease":8,"hash":"9a94b837725ca004b3c16cb35fc4d9466a507552","commercialScore":0,"negativeRegularScore":0,"negativeScore":0,"positiveScore":0,"score":0,"grade":""},{"date":20200831,"state":"NM","positive":25283,"probableCases":null,"negative":731650,"pending":null,"totalTestResultsSource":"posNeg","totalTestResults":756933,"hospitalizedCurrently":66,"hospitalizedCumulative":3126,"inIcuCurrently":null,"inIcuCumulative":null,"onVentilatorCurrently":null,"onVentilatorCumulative":null,"recovered":12913,"dataQualityGrade":"B","lastUpdateEt":"8/30/2020 17:50","dateModified":"2020-08-30T17:50:00Z","checkTimeEt":"08/30 13:50","death":770,"hospitalized":3126,"dateChecked":"2020-08-30T17:50:00Z","totalTestsViral":756933,"positiveTestsViral":null,"negativeTestsViral":null,"positiveCasesViral":25283,"deathConfirmed":null,"deathProbable":null,"totalTestEncountersViral":null,"totalTestsPeopleViral":null,"totalTestsAntibody":null,"positiveTestsAntibody":null,"negativeTestsAntibody":null,"totalTestsPeopleAntibody":null,"positiveTestsPeopleAntibody":null,"negativeTestsPeopleAntibody":null,"totalTestsPeopleAntigen":null,"positiveTestsPeopleAntigen":null,"totalTestsAntigen":null,"positiveTestsAntigen":null,"fips":"35","positiveIncrease":105,"negativeIncrease":4306,"total":756933,"totalTestResultsIncrease":4411,"posNeg":756933,"deathIncrease":1,"hospitalizedIncrease":10,"hash":"b5b71f53794fb5e72bd4f279c934f47c660797e9","commercialScore":0,"negativeRegularScore":0,"negativeScore":0,"positiveScore":0,"score":0,"grade":""},{"date":20200830,"state":"NM","positive":25178,"probableCases":null,"negative":727344,"pending":null,"totalTestResultsSource":"posNeg","totalTestResults":752522,"hospitalizedCurrently":67,"hospitalizedCumulative":3116,"inIcuCurrently":null,"inIcuCumulative":null,"onVentilatorCurrently":null,"onVentilatorCumulative":null,"recovered":12820,"dataQualityGrade":"B","lastUpdateEt":"8/29/2020 17:50","dateModified":"2020-08-29T17:50:00Z","checkTimeEt":"08/29 13:50","death":769,"hospitalized":3116,"dateChecked":"2020-08-29T17:50:00Z","totalTestsViral":752522,"positiveTestsViral":null,"negativeTestsViral":null,"positiveCasesViral":25178,"deathConfirmed":null,"deathProbable":null,"totalTestEncountersViral":null,"totalTestsPeopleViral":null,"totalTestsAntibody":null,"positiveTestsAntibody":null,"negativeTestsAntibody":null,"totalTestsPeopleAntibody":null,"positiveTestsPeopleAntibody":null,"negativeTestsPeopleAntibody":null,"totalTestsPeopleAntigen":null,"positiveTestsPeopleAntigen":null,"totalTestsAntigen":null,"positiveTestsAntigen":null,"fips":"35","positiveIncrease":136,"negativeIncrease":5109,"total":752522,"totalTestResultsIncrease":5245,"posNeg":752522,"deathIncrease":2,"hospitalizedIncrease":10,"hash":"b343ce4aaac02d063669cfd5eac8f624f802a9d0","commercialScore":0,"negativeRegularScore":0,"negativeScore":0,"positiveScore":0,"score":0,"grade":""},{"date":20200829,"state":"NM","positive":25042,"probableCases":null,"negative":722235,"pending":null,"totalTestResultsSource":"posNeg","totalTestResults":747277,"hospitalizedCurrently":72,"hospitalizedCumulative":3106,"inIcuCurrently":null,"inIcuCumulative":null,"onVentilatorCurrently":null,"onVentilatorCumulative":null,"recovered":12679,"dataQualityGrade":"B","lastUpdateEt":"8/28/2020 17:50","dateModified":"2020-08-28T17:50:00Z","checkTimeEt":"08/28 13:50","death":767,"hospitalized":3106,"dateChecked":"2020-08-28T17:50:00Z","totalTestsViral":747277,"positiveTestsViral":null,"negativeTestsViral":null,"positiveCasesViral":25042,"deathConfirmed":null,"deathProbable":null,"totalTestEncountersViral":null,"totalTestsPeopleViral":null,"totalTestsAntibody":null,"positiveTestsAntibody":null,"negativeTestsAntibody":null,"totalTestsPeopleAntibody":null,"positiveTestsPeopleAntibody":null,"negativeTestsPeopleAntibody":null,"totalTestsPeopleAntigen":null,"positiveTestsPeopleAntigen":null,"totalTestsAntigen":null,"positiveTestsAntigen":null,"fips":"35","positiveIncrease":122,"negativeIncrease":6789,"total":747277,"totalTestResultsIncrease":6911,"posNeg":747277,"deathIncrease":3,"hospitalizedIncrease":15,"hash":"8287541ebe48671d860f4279a170546506a07149","commercialScore":0,"negativeRegularScore":0,"negativeScore":0,"positiveScore":0,"score":0,"grade":""},{"date":20200828,"state":"NM","positive":24920,"probableCases":null,"negative":715446,"pending":null,"totalTestResultsSource":"posNeg","totalTestResults":740366,"hospitalizedCurrently":68,"hospitalizedCumulative":3091,"inIcuCurrently":null,"inIcuCumulative":null,"onVentilatorCurrently":null,"onVentilatorCumulative":null,"recovered":12446,"dataQualityGrade":"B","lastUpdateEt":"8/27/2020 17:15","dateModified":"2020-08-27T17:15:00Z","checkTimeEt":"08/27 13:15","death":764,"hospitalized":3091,"dateChecked":"2020-08-27T17:15:00Z","totalTestsViral":740366,"positiveTestsViral":null,"negativeTestsViral":null,"positiveCasesViral":24920,"deathConfirmed":null,"deathProbable":null,"totalTestEncountersViral":null,"totalTestsPeopleViral":null,"totalTestsAntibody":null,"positiveTestsAntibody":null,"negativeTestsAntibody":null,"totalTestsPeopleAntibody":null,"positiveTestsPeopleAntibody":null,"negativeTestsPeopleAntibody":null,"totalTestsPeopleAntigen":null,"positiveTestsPeopleAntigen":null,"totalTestsAntigen":null,"positiveTestsAntigen":null,"fips":"35","positiveIncrease":188,"negativeIncrease":5958,"total":740366,"totalTestResultsIncrease":6146,"posNeg":740366,"deathIncrease":9,"hospitalizedIncrease":17,"hash":"3b40ba84034ffea1525639a4b089c9e8115b399f","commercialScore":0,"negativeRegularScore":0,"negativeScore":0,"positiveScore":0,"score":0,"grade":""},{"date":20200827,"state":"NM","positive":24732,"probableCases":null,"negative":709488,"pending":null,"totalTestResultsSource":"posNeg","totalTestResults":734220,"hospitalizedCurrently":71,"hospitalizedCumulative":3074,"inIcuCurrently":null,"inIcuCumulative":null,"onVentilatorCurrently":null,"onVentilatorCumulative":null,"recovered":12193,"dataQualityGrade":"B","lastUpdateEt":"8/26/2020 17:50","dateModified":"2020-08-26T17:50:00Z","checkTimeEt":"08/26 13:50","death":755,"hospitalized":3074,"dateChecked":"2020-08-26T17:50:00Z","totalTestsViral":734220,"positiveTestsViral":null,"negativeTestsViral":null,"positiveCasesViral":24732,"deathConfirmed":null,"deathProbable":null,"totalTestEncountersViral":null,"totalTestsPeopleViral":null,"totalTestsAntibody":null,"positiveTestsAntibody":null,"negativeTestsAntibody":null,"totalTestsPeopleAntibody":null,"positiveTestsPeopleAntibody":null,"negativeTestsPeopleAntibody":null,"totalTestsPeopleAntigen":null,"positiveTestsPeopleAntigen":null,"totalTestsAntigen":null,"positiveTestsAntigen":null,"fips":"35","positiveIncrease":197,"negativeIncrease":5396,"total":734220,"totalTestResultsIncrease":5593,"posNeg":734220,"deathIncrease":5,"hospitalizedIncrease":24,"hash":"4470e42f4b823cdcfb36d15ec1dbe9921acb00bd","commercialScore":0,"negativeRegularScore":0,"negativeScore":0,"positiveScore":0,"score":0,"grade":""},{"date":20200826,"state":"NM","positive":24535,"probableCases":null,"negative":704092,"pending":null,"totalTestResultsSource":"posNeg","totalTestResults":728627,"hospitalizedCurrently":64,"hospitalizedCumulative":3050,"inIcuCurrently":null,"inIcuCumulative":null,"onVentilatorCurrently":null,"onVentilatorCumulative":null,"recovered":11909,"dataQualityGrade":"B","lastUpdateEt":"8/25/2020 17:50","dateModified":"2020-08-25T17:50:00Z","checkTimeEt":"08/25 13:50","death":750,"hospitalized":3050,"dateChecked":"2020-08-25T17:50:00Z","totalTestsViral":728627,"positiveTestsViral":null,"negativeTestsViral":null,"positiveCasesViral":24535,"deathConfirmed":null,"deathProbable":null,"totalTestEncountersViral":null,"totalTestsPeopleViral":null,"totalTestsAntibody":null,"positiveTestsAntibody":null,"negativeTestsAntibody":null,"totalTestsPeopleAntibody":null,"positiveTestsPeopleAntibody":null,"negativeTestsPeopleAntibody":null,"totalTestsPeopleAntigen":null,"positiveTestsPeopleAntigen":null,"totalTestsAntigen":null,"positiveTestsAntigen":null,"fips":"35","positiveIncrease":66,"negativeIncrease":4760,"total":728627,"totalTestResultsIncrease":4826,"posNeg":728627,"deathIncrease":3,"hospitalizedIncrease":9,"hash":"24861ad98579f7a0b2b7f78b64aa49c0a026f40e","commercialScore":0,"negativeRegularScore":0,"negativeScore":0,"positiveScore":0,"score":0,"grade":""},{"date":20200825,"state":"NM","positive":24469,"probableCases":null,"negative":699332,"pending":null,"totalTestResultsSource":"posNeg","totalTestResults":723801,"hospitalizedCurrently":68,"hospitalizedCumulative":3041,"inIcuCurrently":null,"inIcuCumulative":null,"onVentilatorCurrently":null,"onVentilatorCumulative":null,"recovered":11668,"dataQualityGrade":"B","lastUpdateEt":"8/24/2020 17:50","dateModified":"2020-08-24T17:50:00Z","checkTimeEt":"08/24 13:50","death":747,"hospitalized":3041,"dateChecked":"2020-08-24T17:50:00Z","totalTestsViral":723801,"positiveTestsViral":null,"negativeTestsViral":null,"positiveCasesViral":24469,"deathConfirmed":null,"deathProbable":null,"totalTestEncountersViral":null,"totalTestsPeopleViral":null,"totalTestsAntibody":null,"positiveTestsAntibody":null,"negativeTestsAntibody":null,"totalTestsPeopleAntibody":null,"positiveTestsPeopleAntibody":null,"negativeTestsPeopleAntibody":null,"totalTestsPeopleAntigen":null,"positiveTestsPeopleAntigen":null,"totalTestsAntigen":null,"positiveTestsAntigen":null,"fips":"35","positiveIncrease":73,"negativeIncrease":4428,"total":723801,"totalTestResultsIncrease":4501,"posNeg":723801,"deathIncrease":2,"hospitalizedIncrease":10,"hash":"4b893d72412816f3a45674cb2419abaa529c5c54","commercialScore":0,"negativeRegularScore":0,"negativeScore":0,"positiveScore":0,"score":0,"grade":""},{"date":20200824,"state":"NM","positive":24396,"probableCases":null,"negative":694904,"pending":null,"totalTestResultsSource":"posNeg","totalTestResults":719300,"hospitalizedCurrently":64,"hospitalizedCumulative":3031,"inIcuCurrently":null,"inIcuCumulative":null,"onVentilatorCurrently":null,"onVentilatorCumulative":null,"recovered":11539,"dataQualityGrade":"B","lastUpdateEt":"8/23/2020 17:50","dateModified":"2020-08-23T17:50:00Z","checkTimeEt":"08/23 13:50","death":745,"hospitalized":3031,"dateChecked":"2020-08-23T17:50:00Z","totalTestsViral":719300,"positiveTestsViral":null,"negativeTestsViral":null,"positiveCasesViral":24396,"deathConfirmed":null,"deathProbable":null,"totalTestEncountersViral":null,"totalTestsPeopleViral":null,"totalTestsAntibody":null,"positiveTestsAntibody":null,"negativeTestsAntibody":null,"totalTestsPeopleAntibody":null,"positiveTestsPeopleAntibody":null,"negativeTestsPeopleAntibody":null,"totalTestsPeopleAntigen":null,"positiveTestsPeopleAntigen":null,"totalTestsAntigen":null,"positiveTestsAntigen":null,"fips":"35","positiveIncrease":94,"negativeIncrease":14044,"total":719300,"totalTestResultsIncrease":14138,"posNeg":719300,"deathIncrease":2,"hospitalizedIncrease":1,"hash":"31979a2cef0da1a924208593cc1e89a1192cadc1","commercialScore":0,"negativeRegularScore":0,"negativeScore":0,"positiveScore":0,"score":0,"grade":""},{"date":20200823,"state":"NM","positive":24302,"probableCases":null,"negative":680860,"pending":null,"totalTestResultsSource":"posNeg","totalTestResults":705162,"hospitalizedCurrently":68,"hospitalizedCumulative":3030,"inIcuCurrently":null,"inIcuCumulative":null,"onVentilatorCurrently":null,"onVentilatorCumulative":null,"recovered":11458,"dataQualityGrade":"B","lastUpdateEt":"8/22/2020 17:49","dateModified":"2020-08-22T17:49:00Z","checkTimeEt":"08/22 13:49","death":743,"hospitalized":3030,"dateChecked":"2020-08-22T17:49:00Z","totalTestsViral":704955,"positiveTestsViral":null,"negativeTestsViral":null,"positiveCasesViral":24302,"deathConfirmed":null,"deathProbable":null,"totalTestEncountersViral":null,"totalTestsPeopleViral":null,"totalTestsAntibody":null,"positiveTestsAntibody":null,"negativeTestsAntibody":null,"totalTestsPeopleAntibody":null,"positiveTestsPeopleAntibody":null,"negativeTestsPeopleAntibody":null,"totalTestsPeopleAntigen":null,"positiveTestsPeopleAntigen":null,"totalTestsAntigen":null,"positiveTestsAntigen":null,"fips":"35","positiveIncrease":207,"negativeIncrease":0,"total":705162,"totalTestResultsIncrease":207,"posNeg":705162,"deathIncrease":4,"hospitalizedIncrease":12,"hash":"261af44187005d529663d1d29e5665541911e028","commercialScore":0,"negativeRegularScore":0,"negativeScore":0,"positiveScore":0,"score":0,"grade":""},{"date":20200822,"state":"NM","positive":24095,"probableCases":null,"negative":680860,"pending":null,"totalTestResultsSource":"posNeg","totalTestResults":704955,"hospitalizedCurrently":65,"hospitalizedCumulative":3018,"inIcuCurrently":null,"inIcuCumulative":null,"onVentilatorCurrently":null,"onVentilatorCumulative":null,"recovered":11312,"dataQualityGrade":"B","lastUpdateEt":"8/21/2020 17:50","dateModified":"2020-08-21T17:50:00Z","checkTimeEt":"08/21 13:50","death":739,"hospitalized":3018,"dateChecked":"2020-08-21T17:50:00Z","totalTestsViral":704955,"positiveTestsViral":null,"negativeTestsViral":null,"positiveCasesViral":24095,"deathConfirmed":null,"deathProbable":null,"totalTestEncountersViral":null,"totalTestsPeopleViral":null,"totalTestsAntibody":null,"positiveTestsAntibody":null,"negativeTestsAntibody":null,"totalTestsPeopleAntibody":null,"positiveTestsPeopleAntibody":null,"negativeTestsPeopleAntibody":null,"totalTestsPeopleAntigen":null,"positiveTestsPeopleAntigen":null,"totalTestsAntigen":null,"positiveTestsAntigen":null,"fips":"35","positiveIncrease":144,"negativeIncrease":9987,"total":704955,"totalTestResultsIncrease":10131,"posNeg":704955,"deathIncrease":5,"hospitalizedIncrease":9,"hash":"00ace071fa771984b91a8f4e824dab83d7eb00ac","commercialScore":0,"negativeRegularScore":0,"negativeScore":0,"positiveScore":0,"score":0,"grade":""},{"date":20200821,"state":"NM","positive":23951,"probableCases":null,"negative":670873,"pending":null,"totalTestResultsSource":"posNeg","totalTestResults":694824,"hospitalizedCurrently":74,"hospitalizedCumulative":3009,"inIcuCurrently":null,"inIcuCumulative":null,"onVentilatorCurrently":null,"onVentilatorCumulative":null,"recovered":11145,"dataQualityGrade":"B","lastUpdateEt":"8/20/2020 17:51","dateModified":"2020-08-20T17:51:00Z","checkTimeEt":"08/20 13:51","death":734,"hospitalized":3009,"dateChecked":"2020-08-20T17:51:00Z","totalTestsViral":694824,"positiveTestsViral":null,"negativeTestsViral":null,"positiveCasesViral":23951,"deathConfirmed":null,"deathProbable":null,"totalTestEncountersViral":null,"totalTestsPeopleViral":null,"totalTestsAntibody":null,"positiveTestsAntibody":null,"negativeTestsAntibody":null,"totalTestsPeopleAntibody":null,"positiveTestsPeopleAntibody":null,"negativeTestsPeopleAntibody":null,"totalTestsPeopleAntigen":null,"positiveTestsPeopleAntigen":null,"totalTestsAntigen":null,"positiveTestsAntigen":null,"fips":"35","positiveIncrease":202,"negativeIncrease":6127,"total":694824,"totalTestResultsIncrease":6329,"posNeg":694824,"deathIncrease":5,"hospitalizedIncrease":7,"hash":"fd71ed9bb9139e13b7f7fc634a67dbb65437e179","commercialScore":0,"negativeRegularScore":0,"negativeScore":0,"positiveScore":0,"score":0,"grade":""},{"date":20200820,"state":"NM","positive":23749,"probableCases":null,"negative":664746,"pending":null,"totalTestResultsSource":"posNeg","totalTestResults":688495,"hospitalizedCurrently":94,"hospitalizedCumulative":3002,"inIcuCurrently":null,"inIcuCumulative":null,"onVentilatorCurrently":null,"onVentilatorCumulative":null,"recovered":10976,"dataQualityGrade":"B","lastUpdateEt":"8/19/2020 17:51","dateModified":"2020-08-19T17:51:00Z","checkTimeEt":"08/19 13:51","death":729,"hospitalized":3002,"dateChecked":"2020-08-19T17:51:00Z","totalTestsViral":688495,"positiveTestsViral":null,"negativeTestsViral":null,"positiveCasesViral":23749,"deathConfirmed":null,"deathProbable":null,"totalTestEncountersViral":null,"totalTestsPeopleViral":null,"totalTestsAntibody":null,"positiveTestsAntibody":null,"negativeTestsAntibody":null,"totalTestsPeopleAntibody":null,"positiveTestsPeopleAntibody":null,"negativeTestsPeopleAntibody":null,"totalTestsPeopleAntigen":null,"positiveTestsPeopleAntigen":null,"totalTestsAntigen":null,"positiveTestsAntigen":null,"fips":"35","positiveIncrease":170,"negativeIncrease":5272,"total":688495,"totalTestResultsIncrease":5442,"posNeg":688495,"deathIncrease":6,"hospitalizedIncrease":4,"hash":"d4b9ed71f06476a9cbb426d128bc2238881f3e5e","commercialScore":0,"negativeRegularScore":0,"negativeScore":0,"positiveScore":0,"score":0,"grade":""},{"date":20200819,"state":"NM","positive":23579,"probableCases":null,"negative":659474,"pending":null,"totalTestResultsSource":"posNeg","totalTestResults":683053,"hospitalizedCurrently":111,"hospitalizedCumulative":2998,"inIcuCurrently":null,"inIcuCumulative":null,"onVentilatorCurrently":null,"onVentilatorCumulative":null,"recovered":10802,"dataQualityGrade":"B","lastUpdateEt":"8/18/2020 19:30","dateModified":"2020-08-18T19:30:00Z","checkTimeEt":"08/18 15:30","death":723,"hospitalized":2998,"dateChecked":"2020-08-18T19:30:00Z","totalTestsViral":683053,"positiveTestsViral":null,"negativeTestsViral":null,"positiveCasesViral":23579,"deathConfirmed":null,"deathProbable":null,"totalTestEncountersViral":null,"totalTestsPeopleViral":null,"totalTestsAntibody":null,"positiveTestsAntibody":null,"negativeTestsAntibody":null,"totalTestsPeopleAntibody":null,"positiveTestsPeopleAntibody":null,"negativeTestsPeopleAntibody":null,"totalTestsPeopleAntigen":null,"positiveTestsPeopleAntigen":null,"totalTestsAntigen":null,"positiveTestsAntigen":null,"fips":"35","positiveIncrease":79,"negativeIncrease":5824,"total":683053,"totalTestResultsIncrease":5903,"posNeg":683053,"deathIncrease":5,"hospitalizedIncrease":14,"hash":"0efe3eaccad0235320e0305b7de88d40697d9e4a","commercialScore":0,"negativeRegularScore":0,"negativeScore":0,"positiveScore":0,"score":0,"grade":""},{"date":20200818,"state":"NM","positive":23500,"probableCases":null,"negative":653650,"pending":null,"totalTestResultsSource":"posNeg","totalTestResults":677150,"hospitalizedCurrently":119,"hospitalizedCumulative":2984,"inIcuCurrently":null,"inIcuCumulative":null,"onVentilatorCurrently":null,"onVentilatorCumulative":null,"recovered":10602,"dataQualityGrade":"B","lastUpdateEt":"8/17/2020 17:50","dateModified":"2020-08-17T17:50:00Z","checkTimeEt":"08/17 13:50","death":718,"hospitalized":2984,"dateChecked":"2020-08-17T17:50:00Z","totalTestsViral":677150,"positiveTestsViral":null,"negativeTestsViral":null,"positiveCasesViral":23500,"deathConfirmed":null,"deathProbable":null,"totalTestEncountersViral":null,"totalTestsPeopleViral":null,"totalTestsAntibody":null,"positiveTestsAntibody":null,"negativeTestsAntibody":null,"totalTestsPeopleAntibody":null,"positiveTestsPeopleAntibody":null,"negativeTestsPeopleAntibody":null,"totalTestsPeopleAntigen":null,"positiveTestsPeopleAntigen":null,"totalTestsAntigen":null,"positiveTestsAntigen":null,"fips":"35","positiveIncrease":92,"negativeIncrease":6485,"total":677150,"totalTestResultsIncrease":6577,"posNeg":677150,"deathIncrease":4,"hospitalizedIncrease":19,"hash":"3f1db23a7b0d6f44faec29756016e710e08dc74a","commercialScore":0,"negativeRegularScore":0,"negativeScore":0,"positiveScore":0,"score":0,"grade":""},{"date":20200817,"state":"NM","positive":23408,"probableCases":null,"negative":647165,"pending":null,"totalTestResultsSource":"posNeg","totalTestResults":670573,"hospitalizedCurrently":109,"hospitalizedCumulative":2965,"inIcuCurrently":null,"inIcuCumulative":null,"onVentilatorCurrently":null,"onVentilatorCumulative":null,"recovered":10481,"dataQualityGrade":"B","lastUpdateEt":"8/16/2020 17:30","dateModified":"2020-08-16T17:30:00Z","checkTimeEt":"08/16 13:30","death":714,"hospitalized":2965,"dateChecked":"2020-08-16T17:30:00Z","totalTestsViral":670573,"positiveTestsViral":null,"negativeTestsViral":null,"positiveCasesViral":23408,"deathConfirmed":null,"deathProbable":null,"totalTestEncountersViral":null,"totalTestsPeopleViral":null,"totalTestsAntibody":null,"positiveTestsAntibody":null,"negativeTestsAntibody":null,"totalTestsPeopleAntibody":null,"positiveTestsPeopleAntibody":null,"negativeTestsPeopleAntibody":null,"totalTestsPeopleAntigen":null,"positiveTestsPeopleAntigen":null,"totalTestsAntigen":null,"positiveTestsAntigen":null,"fips":"35","positiveIncrease":106,"negativeIncrease":5176,"total":670573,"totalTestResultsIncrease":5282,"posNeg":670573,"deathIncrease":3,"hospitalizedIncrease":8,"hash":"4967dfab1a5b08574f58edb94c27aa85557c73f2","commercialScore":0,"negativeRegularScore":0,"negativeScore":0,"positiveScore":0,"score":0,"grade":""},{"date":20200816,"state":"NM","positive":23302,"probableCases":null,"negative":641989,"pending":null,"totalTestResultsSource":"posNeg","totalTestResults":665291,"hospitalizedCurrently":113,"hospitalizedCumulative":2957,"inIcuCurrently":null,"inIcuCumulative":null,"onVentilatorCurrently":null,"onVentilatorCumulative":null,"recovered":10391,"dataQualityGrade":"B","lastUpdateEt":"8/15/2020 17:50","dateModified":"2020-08-15T17:50:00Z","checkTimeEt":"08/15 13:50","death":711,"hospitalized":295