[{"date":20201103,"state":"NV","positive":103025,"probableCases":null,"negative":716871,"pending":null,"totalTestResultsSource":"totalTestEncountersViral","totalTestResults":1277944,"hospitalizedCurrently":695,"hospitalizedCumulative":null,"inIcuCurrently":176,"inIcuCumulative":null,"onVentilatorCurrently":75,"onVentilatorCumulative":null,"recovered":2462,"dataQualityGrade":"A+","lastUpdateEt":"11/3/2020 00:00","dateModified":"2020-11-03T24:00:00Z","checkTimeEt":"11/02 19:00","death":1807,"hospitalized":null,"dateChecked":"2020-11-03T24:00:00Z","totalTestsViral":1154583,"positiveTestsViral":null,"negativeTestsViral":null,"positiveCasesViral":103025,"deathConfirmed":null,"deathProbable":null,"totalTestEncountersViral":1277944,"totalTestsPeopleViral":819896,"totalTestsAntibody":null,"positiveTestsAntibody":null,"negativeTestsAntibody":null,"totalTestsPeopleAntibody":null,"positiveTestsPeopleAntibody":null,"negativeTestsPeopleAntibody":null,"totalTestsPeopleAntigen":null,"positiveTestsPeopleAntigen":null,"totalTestsAntigen":null,"positiveTestsAntigen":null,"fips":"32","positiveIncrease":911,"negativeIncrease":2552,"total":819896,"totalTestResultsIncrease":7301,"posNeg":819896,"deathIncrease":23,"hospitalizedIncrease":0,"hash":"26c50ec439c4bc668e675d582b6cd751c15644f0","commercialScore":0,"negativeRegularScore":0,"negativeScore":0,"positiveScore":0,"score":0,"grade":""},{"date":20201102,"state":"NV","positive":102114,"probableCases":null,"negative":714319,"pending":null,"totalTestResultsSource":"totalTestEncountersViral","totalTestResults":1270643,"hospitalizedCurrently":678,"hospitalizedCumulative":null,"inIcuCurrently":182,"inIcuCumulative":null,"onVentilatorCurrently":64,"onVentilatorCumulative":null,"recovered":2442,"dataQualityGrade":"A+","lastUpdateEt":"11/2/2020 00:00","dateModified":"2020-11-02T24:00:00Z","checkTimeEt":"11/01 19:00","death":1784,"hospitalized":null,"dateChecked":"2020-11-02T24:00:00Z","totalTestsViral":1154583,"positiveTestsViral":null,"negativeTestsViral":null,"positiveCasesViral":102114,"deathConfirmed":null,"deathProbable":null,"totalTestEncountersViral":1270643,"totalTestsPeopleViral":816433,"totalTestsAntibody":null,"positiveTestsAntibody":null,"negativeTestsAntibody":null,"totalTestsPeopleAntibody":null,"positiveTestsPeopleAntibody":null,"negativeTestsPeopleAntibody":null,"totalTestsPeopleAntigen":null,"positiveTestsPeopleAntigen":null,"totalTestsAntigen":null,"positiveTestsAntigen":null,"fips":"32","positiveIncrease":635,"negativeIncrease":2608,"total":816433,"totalTestResultsIncrease":7460,"posNeg":816433,"deathIncrease":3,"hospitalizedIncrease":0,"hash":"b0380463a82ab16b9965be2a2bc88be5ae5fbc7b","commercialScore":0,"negativeRegularScore":0,"negativeScore":0,"positiveScore":0,"score":0,"grade":""},{"date":20201101,"state":"NV","positive":101479,"probableCases":null,"negative":711711,"pending":null,"totalTestResultsSource":"totalTestEncountersViral","totalTestResults":1263183,"hospitalizedCurrently":585,"hospitalizedCumulative":null,"inIcuCurrently":165,"inIcuCumulative":null,"onVentilatorCurrently":58,"onVentilatorCumulative":null,"recovered":2409,"dataQualityGrade":"A+","lastUpdateEt":"11/1/2020 13:00","dateModified":"2020-11-01T13:00:00Z","checkTimeEt":"11/01 08:00","death":1781,"hospitalized":null,"dateChecked":"2020-11-01T13:00:00Z","totalTestsViral":1154583,"positiveTestsViral":null,"negativeTestsViral":null,"positiveCasesViral":101479,"deathConfirmed":null,"deathProbable":null,"totalTestEncountersViral":1263183,"totalTestsPeopleViral":813190,"totalTestsAntibody":null,"positiveTestsAntibody":null,"negativeTestsAntibody":null,"totalTestsPeopleAntibody":null,"positiveTestsPeopleAntibody":null,"negativeTestsPeopleAntibody":null,"totalTestsPeopleAntigen":null,"positiveTestsPeopleAntigen":null,"totalTestsAntigen":null,"positiveTestsAntigen":null,"fips":"32","positiveIncrease":716,"negativeIncrease":3987,"total":813190,"totalTestResultsIncrease":10100,"posNeg":813190,"deathIncrease":4,"hospitalizedIncrease":0,"hash":"11a9de9084bc7bb2b521224aeff1093a652a9915","commercialScore":0,"negativeRegularScore":0,"negativeScore":0,"positiveScore":0,"score":0,"grade":""},{"date":20201031,"state":"NV","positive":100763,"probableCases":null,"negative":707724,"pending":null,"totalTestResultsSource":"totalTestEncountersViral","totalTestResults":1253083,"hospitalizedCurrently":585,"hospitalizedCumulative":null,"inIcuCurrently":165,"inIcuCumulative":null,"onVentilatorCurrently":58,"onVentilatorCumulative":null,"recovered":2409,"dataQualityGrade":"A+","lastUpdateEt":"10/31/2020 00:00","dateModified":"2020-10-31T24:00:00Z","checkTimeEt":"10/30 20:00","death":1777,"hospitalized":null,"dateChecked":"2020-10-31T24:00:00Z","totalTestsViral":1154583,"positiveTestsViral":null,"negativeTestsViral":null,"positiveCasesViral":100763,"deathConfirmed":null,"deathProbable":null,"totalTestEncountersViral":1253083,"totalTestsPeopleViral":808487,"totalTestsAntibody":null,"positiveTestsAntibody":null,"negativeTestsAntibody":null,"totalTestsPeopleAntibody":null,"positiveTestsPeopleAntibody":null,"negativeTestsPeopleAntibody":null,"totalTestsPeopleAntigen":null,"positiveTestsPeopleAntigen":null,"totalTestsAntigen":null,"positiveTestsAntigen":null,"fips":"32","positiveIncrease":977,"negativeIncrease":3925,"total":808487,"totalTestResultsIncrease":10374,"posNeg":808487,"deathIncrease":0,"hospitalizedIncrease":0,"hash":"1d3d138144ab057671edaba80df9ea5fa58f85cb","commercialScore":0,"negativeRegularScore":0,"negativeScore":0,"positiveScore":0,"score":0,"grade":""},{"date":20201030,"state":"NV","positive":99786,"probableCases":null,"negative":703799,"pending":null,"totalTestResultsSource":"totalTestEncountersViral","totalTestResults":1242709,"hospitalizedCurrently":594,"hospitalizedCumulative":null,"inIcuCurrently":163,"inIcuCumulative":null,"onVentilatorCurrently":56,"onVentilatorCumulative":null,"recovered":2409,"dataQualityGrade":"A+","lastUpdateEt":"10/30/2020 00:00","dateModified":"2020-10-30T24:00:00Z","checkTimeEt":"10/29 20:00","death":1777,"hospitalized":null,"dateChecked":"2020-10-30T24:00:00Z","totalTestsViral":1154583,"positiveTestsViral":null,"negativeTestsViral":null,"positiveCasesViral":99786,"deathConfirmed":null,"deathProbable":null,"totalTestEncountersViral":1242709,"totalTestsPeopleViral":803585,"totalTestsAntibody":null,"positiveTestsAntibody":null,"negativeTestsAntibody":null,"totalTestsPeopleAntibody":null,"positiveTestsPeopleAntibody":null,"negativeTestsPeopleAntibody":null,"totalTestsPeopleAntigen":null,"positiveTestsPeopleAntigen":null,"totalTestsAntigen":null,"positiveTestsAntigen":null,"fips":"32","positiveIncrease":1232,"negativeIncrease":3735,"total":803585,"totalTestResultsIncrease":11597,"posNeg":803585,"deathIncrease":8,"hospitalizedIncrease":0,"hash":"3f881b10dd7dbc6c48f0ce45ff27ab81d3277a9a","commercialScore":0,"negativeRegularScore":0,"negativeScore":0,"positiveScore":0,"score":0,"grade":""},{"date":20201029,"state":"NV","positive":98554,"probableCases":null,"negative":700064,"pending":null,"totalTestResultsSource":"totalTestEncountersViral","totalTestResults":1231112,"hospitalizedCurrently":594,"hospitalizedCumulative":null,"inIcuCurrently":162,"inIcuCumulative":null,"onVentilatorCurrently":64,"onVentilatorCumulative":null,"recovered":2409,"dataQualityGrade":"A+","lastUpdateEt":"10/29/2020 00:00","dateModified":"2020-10-29T24:00:00Z","checkTimeEt":"10/28 20:00","death":1769,"hospitalized":null,"dateChecked":"2020-10-29T24:00:00Z","totalTestsViral":1154583,"positiveTestsViral":null,"negativeTestsViral":null,"positiveCasesViral":98554,"deathConfirmed":null,"deathProbable":null,"totalTestEncountersViral":1231112,"totalTestsPeopleViral":798618,"totalTestsAntibody":null,"positiveTestsAntibody":null,"negativeTestsAntibody":null,"totalTestsPeopleAntibody":null,"positiveTestsPeopleAntibody":null,"negativeTestsPeopleAntibody":null,"totalTestsPeopleAntigen":null,"positiveTestsPeopleAntigen":null,"totalTestsAntigen":null,"positiveTestsAntigen":null,"fips":"32","positiveIncrease":1075,"negativeIncrease":-707,"total":798618,"totalTestResultsIncrease":3423,"posNeg":798618,"deathIncrease":3,"hospitalizedIncrease":0,"hash":"f0a01322a69b1bc467ea6fc1ca69cc4e88011bd5","commercialScore":0,"negativeRegularScore":0,"negativeScore":0,"positiveScore":0,"score":0,"grade":""},{"date":20201028,"state":"NV","positive":97479,"probableCases":null,"negative":700771,"pending":null,"totalTestResultsSource":"totalTestEncountersViral","totalTestResults":1227689,"hospitalizedCurrently":565,"hospitalizedCumulative":null,"inIcuCurrently":142,"inIcuCumulative":null,"onVentilatorCurrently":56,"onVentilatorCumulative":null,"recovered":2404,"dataQualityGrade":"A+","lastUpdateEt":"10/28/2020 00:00","dateModified":"2020-10-28T24:00:00Z","checkTimeEt":"10/27 20:00","death":1766,"hospitalized":null,"dateChecked":"2020-10-28T24:00:00Z","totalTestsViral":1154583,"positiveTestsViral":null,"negativeTestsViral":null,"positiveCasesViral":97479,"deathConfirmed":null,"deathProbable":null,"totalTestEncountersViral":1227689,"totalTestsPeopleViral":798250,"totalTestsAntibody":null,"positiveTestsAntibody":null,"negativeTestsAntibody":null,"totalTestsPeopleAntibody":null,"positiveTestsPeopleAntibody":null,"negativeTestsPeopleAntibody":null,"totalTestsPeopleAntigen":null,"positiveTestsPeopleAntigen":null,"totalTestsAntigen":null,"positiveTestsAntigen":null,"fips":"32","positiveIncrease":571,"negativeIncrease":2758,"total":798250,"totalTestResultsIncrease":7246,"posNeg":798250,"deathIncrease":10,"hospitalizedIncrease":0,"hash":"709db797e1169bf85cf39d37f348c76f19af1517","commercialScore":0,"negativeRegularScore":0,"negativeScore":0,"positiveScore":0,"score":0,"grade":""},{"date":20201027,"state":"NV","positive":96908,"probableCases":null,"negative":698013,"pending":null,"totalTestResultsSource":"totalTestEncountersViral","totalTestResults":1220443,"hospitalizedCurrently":568,"hospitalizedCumulative":null,"inIcuCurrently":144,"inIcuCumulative":null,"onVentilatorCurrently":58,"onVentilatorCumulative":null,"recovered":2385,"dataQualityGrade":"A+","lastUpdateEt":"10/27/2020 00:00","dateModified":"2020-10-27T24:00:00Z","checkTimeEt":"10/26 20:00","death":1756,"hospitalized":null,"dateChecked":"2020-10-27T24:00:00Z","totalTestsViral":1154583,"positiveTestsViral":null,"negativeTestsViral":null,"positiveCasesViral":96908,"deathConfirmed":null,"deathProbable":null,"totalTestEncountersViral":1220443,"totalTestsPeopleViral":794921,"totalTestsAntibody":null,"positiveTestsAntibody":null,"negativeTestsAntibody":null,"totalTestsPeopleAntibody":null,"positiveTestsPeopleAntibody":null,"negativeTestsPeopleAntibody":null,"totalTestsPeopleAntigen":null,"positiveTestsPeopleAntigen":null,"totalTestsAntigen":null,"positiveTestsAntigen":null,"fips":"32","positiveIncrease":730,"negativeIncrease":2870,"total":794921,"totalTestResultsIncrease":8006,"posNeg":794921,"deathIncrease":7,"hospitalizedIncrease":0,"hash":"bdcfdac56b14327795bbc1e3851fe9080a765c85","commercialScore":0,"negativeRegularScore":0,"negativeScore":0,"positiveScore":0,"score":0,"grade":""},{"date":20201026,"state":"NV","positive":96178,"probableCases":null,"negative":695143,"pending":null,"totalTestResultsSource":"totalTestEncountersViral","totalTestResults":1212437,"hospitalizedCurrently":531,"hospitalizedCumulative":null,"inIcuCurrently":148,"inIcuCumulative":null,"onVentilatorCurrently":64,"onVentilatorCumulative":null,"recovered":2374,"dataQualityGrade":"A+","lastUpdateEt":"10/26/2020 00:00","dateModified":"2020-10-26T24:00:00Z","checkTimeEt":"10/25 20:00","death":1749,"hospitalized":null,"dateChecked":"2020-10-26T24:00:00Z","totalTestsViral":1154583,"positiveTestsViral":null,"negativeTestsViral":null,"positiveCasesViral":96178,"deathConfirmed":null,"deathProbable":null,"totalTestEncountersViral":1212437,"totalTestsPeopleViral":791321,"totalTestsAntibody":null,"positiveTestsAntibody":null,"negativeTestsAntibody":null,"totalTestsPeopleAntibody":null,"positiveTestsPeopleAntibody":null,"negativeTestsPeopleAntibody":null,"totalTestsPeopleAntigen":null,"positiveTestsPeopleAntigen":null,"totalTestsAntigen":null,"positiveTestsAntigen":null,"fips":"32","positiveIncrease":475,"negativeIncrease":2977,"total":791321,"totalTestResultsIncrease":7691,"posNeg":791321,"deathIncrease":1,"hospitalizedIncrease":0,"hash":"4e8ca96c2d6cdd72a865e40d03a4b172d2f7e474","commercialScore":0,"negativeRegularScore":0,"negativeScore":0,"positiveScore":0,"score":0,"grade":""},{"date":20201025,"state":"NV","positive":95703,"probableCases":null,"negative":692166,"pending":null,"totalTestResultsSource":"totalTestEncountersViral","totalTestResults":1204746,"hospitalizedCurrently":493,"hospitalizedCumulative":null,"inIcuCurrently":134,"inIcuCumulative":null,"onVentilatorCurrently":51,"onVentilatorCumulative":null,"recovered":2358,"dataQualityGrade":"A+","lastUpdateEt":"10/25/2020 00:00","dateModified":"2020-10-25T24:00:00Z","checkTimeEt":"10/24 20:00","death":1748,"hospitalized":null,"dateChecked":"2020-10-25T24:00:00Z","totalTestsViral":1154583,"positiveTestsViral":null,"negativeTestsViral":null,"positiveCasesViral":95703,"deathConfirmed":null,"deathProbable":null,"totalTestEncountersViral":1204746,"totalTestsPeopleViral":787869,"totalTestsAntibody":null,"positiveTestsAntibody":null,"negativeTestsAntibody":null,"totalTestsPeopleAntibody":null,"positiveTestsPeopleAntibody":null,"negativeTestsPeopleAntibody":null,"totalTestsPeopleAntigen":null,"positiveTestsPeopleAntigen":null,"totalTestsAntigen":null,"positiveTestsAntigen":null,"fips":"32","positiveIncrease":891,"negativeIncrease":3271,"total":787869,"totalTestResultsIncrease":8635,"posNeg":787869,"deathIncrease":5,"hospitalizedIncrease":0,"hash":"3d4f5cfb115d4e880ec67a7f4a21a74f5ade1b81","commercialScore":0,"negativeRegularScore":0,"negativeScore":0,"positiveScore":0,"score":0,"grade":""},{"date":20201024,"state":"NV","positive":94812,"probableCases":null,"negative":688895,"pending":null,"totalTestResultsSource":"totalTestEncountersViral","totalTestResults":1196111,"hospitalizedCurrently":493,"hospitalizedCumulative":null,"inIcuCurrently":134,"inIcuCumulative":null,"onVentilatorCurrently":51,"onVentilatorCumulative":null,"recovered":2358,"dataQualityGrade":"A+","lastUpdateEt":"10/24/2020 00:00","dateModified":"2020-10-24T24:00:00Z","checkTimeEt":"10/23 20:00","death":1743,"hospitalized":null,"dateChecked":"2020-10-24T24:00:00Z","totalTestsViral":1154583,"positiveTestsViral":null,"negativeTestsViral":null,"positiveCasesViral":94812,"deathConfirmed":null,"deathProbable":null,"totalTestEncountersViral":1196111,"totalTestsPeopleViral":783707,"totalTestsAntibody":null,"positiveTestsAntibody":null,"negativeTestsAntibody":null,"totalTestsPeopleAntibody":null,"positiveTestsPeopleAntibody":null,"negativeTestsPeopleAntibody":null,"totalTestsPeopleAntigen":null,"positiveTestsPeopleAntigen":null,"totalTestsAntigen":null,"positiveTestsAntigen":null,"fips":"32","positiveIncrease":1146,"negativeIncrease":1914,"total":783707,"totalTestResultsIncrease":11042,"posNeg":783707,"deathIncrease":5,"hospitalizedIncrease":0,"hash":"34b78d135da327ec5f86af1fe848920a40ca9eb2","commercialScore":0,"negativeRegularScore":0,"negativeScore":0,"positiveScore":0,"score":0,"grade":""},{"date":20201023,"state":"NV","positive":93666,"probableCases":null,"negative":686981,"pending":null,"totalTestResultsSource":"totalTestEncountersViral","totalTestResults":1185069,"hospitalizedCurrently":493,"hospitalizedCumulative":null,"inIcuCurrently":134,"inIcuCumulative":null,"onVentilatorCurrently":51,"onVentilatorCumulative":null,"recovered":2358,"dataQualityGrade":"A+","lastUpdateEt":"10/23/2020 00:00","dateModified":"2020-10-23T24:00:00Z","checkTimeEt":"10/22 20:00","death":1738,"hospitalized":null,"dateChecked":"2020-10-23T24:00:00Z","totalTestsViral":1154583,"positiveTestsViral":null,"negativeTestsViral":null,"positiveCasesViral":93666,"deathConfirmed":null,"deathProbable":null,"totalTestEncountersViral":1185069,"totalTestsPeopleViral":780647,"totalTestsAntibody":null,"positiveTestsAntibody":null,"negativeTestsAntibody":null,"totalTestsPeopleAntibody":null,"positiveTestsPeopleAntibody":null,"negativeTestsPeopleAntibody":null,"totalTestsPeopleAntigen":null,"positiveTestsPeopleAntigen":null,"totalTestsAntigen":null,"positiveTestsAntigen":null,"fips":"32","positiveIncrease":813,"negativeIncrease":5739,"total":780647,"totalTestResultsIncrease":9655,"posNeg":780647,"deathIncrease":2,"hospitalizedIncrease":0,"hash":"c16b43730de8c1b61e9fa06f0808af9d9b4d7291","commercialScore":0,"negativeRegularScore":0,"negativeScore":0,"positiveScore":0,"score":0,"grade":""},{"date":20201022,"state":"NV","positive":92853,"probableCases":null,"negative":681242,"pending":null,"totalTestResultsSource":"totalTestEncountersViral","totalTestResults":1175414,"hospitalizedCurrently":520,"hospitalizedCumulative":null,"inIcuCurrently":161,"inIcuCumulative":null,"onVentilatorCurrently":53,"onVentilatorCumulative":null,"recovered":2346,"dataQualityGrade":"A+","lastUpdateEt":"10/22/2020 00:00","dateModified":"2020-10-22T24:00:00Z","checkTimeEt":"10/21 20:00","death":1736,"hospitalized":null,"dateChecked":"2020-10-22T24:00:00Z","totalTestsViral":1154583,"positiveTestsViral":null,"negativeTestsViral":null,"positiveCasesViral":92853,"deathConfirmed":null,"deathProbable":null,"totalTestEncountersViral":1175414,"totalTestsPeopleViral":774095,"totalTestsAntibody":null,"positiveTestsAntibody":null,"negativeTestsAntibody":null,"totalTestsPeopleAntibody":null,"positiveTestsPeopleAntibody":null,"negativeTestsPeopleAntibody":null,"totalTestsPeopleAntigen":null,"positiveTestsPeopleAntigen":null,"totalTestsAntigen":null,"positiveTestsAntigen":null,"fips":"32","positiveIncrease":789,"negativeIncrease":3693,"total":774095,"totalTestResultsIncrease":10000,"posNeg":774095,"deathIncrease":4,"hospitalizedIncrease":0,"hash":"6a299f56b45d045690fc518b386b7f875cd9b9e0","commercialScore":0,"negativeRegularScore":0,"negativeScore":0,"positiveScore":0,"score":0,"grade":""},{"date":20201021,"state":"NV","positive":92064,"probableCases":null,"negative":677549,"pending":null,"totalTestResultsSource":"totalTestEncountersViral","totalTestResults":1165414,"hospitalizedCurrently":535,"hospitalizedCumulative":null,"inIcuCurrently":147,"inIcuCumulative":null,"onVentilatorCurrently":47,"onVentilatorCumulative":null,"recovered":2329,"dataQualityGrade":"A+","lastUpdateEt":"10/21/2020 00:00","dateModified":"2020-10-21T24:00:00Z","checkTimeEt":"10/20 20:00","death":1732,"hospitalized":null,"dateChecked":"2020-10-21T24:00:00Z","totalTestsViral":1154583,"positiveTestsViral":null,"negativeTestsViral":null,"positiveCasesViral":92064,"deathConfirmed":null,"deathProbable":null,"totalTestEncountersViral":1165414,"totalTestsPeopleViral":769613,"totalTestsAntibody":null,"positiveTestsAntibody":null,"negativeTestsAntibody":null,"totalTestsPeopleAntibody":null,"positiveTestsPeopleAntibody":null,"negativeTestsPeopleAntibody":null,"totalTestsPeopleAntigen":null,"positiveTestsPeopleAntigen":null,"totalTestsAntigen":null,"positiveTestsAntigen":null,"fips":"32","positiveIncrease":565,"negativeIncrease":2736,"total":769613,"totalTestResultsIncrease":9385,"posNeg":769613,"deathIncrease":5,"hospitalizedIncrease":0,"hash":"8a5bdb1d8a83b32175d19c1a59d47d8ca46b0971","commercialScore":0,"negativeRegularScore":0,"negativeScore":0,"positiveScore":0,"score":0,"grade":""},{"date":20201020,"state":"NV","positive":91499,"probableCases":null,"negative":674813,"pending":null,"totalTestResultsSource":"totalTestEncountersViral","totalTestResults":1156029,"hospitalizedCurrently":506,"hospitalizedCumulative":null,"inIcuCurrently":141,"inIcuCumulative":null,"onVentilatorCurrently":57,"onVentilatorCumulative":null,"recovered":2336,"dataQualityGrade":"A+","lastUpdateEt":"10/20/2020 00:00","dateModified":"2020-10-20T24:00:00Z","checkTimeEt":"10/19 20:00","death":1727,"hospitalized":null,"dateChecked":"2020-10-20T24:00:00Z","totalTestsViral":1154583,"positiveTestsViral":null,"negativeTestsViral":null,"positiveCasesViral":91499,"deathConfirmed":null,"deathProbable":null,"totalTestEncountersViral":1156029,"totalTestsPeopleViral":766312,"totalTestsAntibody":null,"positiveTestsAntibody":null,"negativeTestsAntibody":null,"totalTestsPeopleAntibody":null,"positiveTestsPeopleAntibody":null,"negativeTestsPeopleAntibody":null,"totalTestsPeopleAntigen":null,"positiveTestsPeopleAntigen":null,"totalTestsAntigen":null,"positiveTestsAntigen":null,"fips":"32","positiveIncrease":656,"negativeIncrease":2454,"total":766312,"totalTestResultsIncrease":28,"posNeg":766312,"deathIncrease":15,"hospitalizedIncrease":0,"hash":"21850de1ba21ff9e6a4f30058cf3a7f5b55400ce","commercialScore":0,"negativeRegularScore":0,"negativeScore":0,"positiveScore":0,"score":0,"grade":""},{"date":20201019,"state":"NV","positive":90843,"probableCases":null,"negative":672359,"pending":null,"totalTestResultsSource":"totalTestEncountersViral","totalTestResults":1156001,"hospitalizedCurrently":485,"hospitalizedCumulative":null,"inIcuCurrently":148,"inIcuCumulative":null,"onVentilatorCurrently":53,"onVentilatorCumulative":null,"recovered":2330,"dataQualityGrade":"A+","lastUpdateEt":"10/19/2020 00:00","dateModified":"2020-10-19T24:00:00Z","checkTimeEt":"10/18 20:00","death":1712,"hospitalized":null,"dateChecked":"2020-10-19T24:00:00Z","totalTestsViral":1154583,"positiveTestsViral":null,"negativeTestsViral":null,"positiveCasesViral":90843,"deathConfirmed":null,"deathProbable":null,"totalTestEncountersViral":1156001,"totalTestsPeopleViral":763202,"totalTestsAntibody":null,"positiveTestsAntibody":null,"negativeTestsAntibody":null,"totalTestsPeopleAntibody":null,"positiveTestsPeopleAntibody":null,"negativeTestsPeopleAntibody":null,"totalTestsPeopleAntigen":null,"positiveTestsPeopleAntigen":null,"totalTestsAntigen":null,"positiveTestsAntigen":null,"fips":"32","positiveIncrease":582,"negativeIncrease":3112,"total":763202,"totalTestResultsIncrease":1348,"posNeg":763202,"deathIncrease":2,"hospitalizedIncrease":0,"hash":"dbc6999e61d6f7aa9494dec0dccf25900871654f","commercialScore":0,"negativeRegularScore":0,"negativeScore":0,"positiveScore":0,"score":0,"grade":""},{"date":20201018,"state":"NV","positive":90261,"probableCases":null,"negative":669247,"pending":null,"totalTestResultsSource":"totalTestEncountersViral","totalTestResults":1154653,"hospitalizedCurrently":503,"hospitalizedCumulative":null,"inIcuCurrently":139,"inIcuCumulative":null,"onVentilatorCurrently":60,"onVentilatorCumulative":null,"recovered":2326,"dataQualityGrade":"A+","lastUpdateEt":"10/18/2020 00:00","dateModified":"2020-10-18T24:00:00Z","checkTimeEt":"10/17 20:00","death":1710,"hospitalized":null,"dateChecked":"2020-10-18T24:00:00Z","totalTestsViral":1154583,"positiveTestsViral":null,"negativeTestsViral":null,"positiveCasesViral":90261,"deathConfirmed":null,"deathProbable":null,"totalTestEncountersViral":1154653,"totalTestsPeopleViral":759508,"totalTestsAntibody":null,"positiveTestsAntibody":null,"negativeTestsAntibody":null,"totalTestsPeopleAntibody":null,"positiveTestsPeopleAntibody":null,"negativeTestsPeopleAntibody":null,"totalTestsPeopleAntigen":null,"positiveTestsPeopleAntigen":null,"totalTestsAntigen":null,"positiveTestsAntigen":null,"fips":"32","positiveIncrease":609,"negativeIncrease":3665,"total":759508,"totalTestResultsIncrease":4230,"posNeg":759508,"deathIncrease":3,"hospitalizedIncrease":0,"hash":"e4b5b2c6fd976bc6f95a0b108edfe06946fef35e","commercialScore":0,"negativeRegularScore":0,"negativeScore":0,"positiveScore":0,"score":0,"grade":""},{"date":20201017,"state":"NV","positive":89652,"probableCases":null,"negative":665582,"pending":null,"totalTestResultsSource":"totalTestEncountersViral","totalTestResults":1150423,"hospitalizedCurrently":503,"hospitalizedCumulative":null,"inIcuCurrently":139,"inIcuCumulative":null,"onVentilatorCurrently":60,"onVentilatorCumulative":null,"recovered":2326,"dataQualityGrade":"A+","lastUpdateEt":"10/17/2020 00:00","dateModified":"2020-10-17T24:00:00Z","checkTimeEt":"10/16 20:00","death":1707,"hospitalized":null,"dateChecked":"2020-10-17T24:00:00Z","totalTestsViral":1154583,"positiveTestsViral":null,"negativeTestsViral":null,"positiveCasesViral":89652,"deathConfirmed":null,"deathProbable":null,"totalTestEncountersViral":1150423,"totalTestsPeopleViral":755234,"totalTestsAntibody":null,"positiveTestsAntibody":null,"negativeTestsAntibody":null,"totalTestsPeopleAntibody":null,"positiveTestsPeopleAntibody":null,"negativeTestsPeopleAntibody":null,"totalTestsPeopleAntigen":null,"positiveTestsPeopleAntigen":null,"totalTestsAntigen":null,"positiveTestsAntigen":null,"fips":"32","positiveIncrease":967,"negativeIncrease":6596,"total":755234,"totalTestResultsIncrease":8160,"posNeg":755234,"deathIncrease":0,"hospitalizedIncrease":0,"hash":"a853db9935e6e23787001552e018e04d1f47cca2","commercialScore":0,"negativeRegularScore":0,"negativeScore":0,"positiveScore":0,"score":0,"grade":""},{"date":20201016,"state":"NV","positive":88685,"probableCases":null,"negative":658986,"pending":null,"totalTestResultsSource":"totalTestEncountersViral","totalTestResults":1142263,"hospitalizedCurrently":469,"hospitalizedCumulative":null,"inIcuCurrently":142,"inIcuCumulative":null,"onVentilatorCurrently":60,"onVentilatorCumulative":null,"recovered":2326,"dataQualityGrade":"A+","lastUpdateEt":"10/16/2020 00:00","dateModified":"2020-10-16T24:00:00Z","checkTimeEt":"10/15 20:00","death":1707,"hospitalized":null,"dateChecked":"2020-10-16T24:00:00Z","totalTestsViral":1154583,"positiveTestsViral":null,"negativeTestsViral":null,"positiveCasesViral":88685,"deathConfirmed":null,"deathProbable":null,"totalTestEncountersViral":1142263,"totalTestsPeopleViral":747671,"totalTestsAntibody":null,"positiveTestsAntibody":null,"negativeTestsAntibody":null,"totalTestsPeopleAntibody":null,"positiveTestsPeopleAntibody":null,"negativeTestsPeopleAntibody":null,"totalTestsPeopleAntigen":null,"positiveTestsPeopleAntigen":null,"totalTestsAntigen":null,"positiveTestsAntigen":null,"fips":"32","positiveIncrease":716,"negativeIncrease":1611,"total":747671,"totalTestResultsIncrease":8475,"posNeg":747671,"deathIncrease":9,"hospitalizedIncrease":0,"hash":"b6f6b036270d44fb594cfb6de3b475fb4e33aaba","commercialScore":0,"negativeRegularScore":0,"negativeScore":0,"positiveScore":0,"score":0,"grade":""},{"date":20201015,"state":"NV","positive":87969,"probableCases":null,"negative":657375,"pending":null,"totalTestResultsSource":"totalTestEncountersViral","totalTestResults":1133788,"hospitalizedCurrently":486,"hospitalizedCumulative":null,"inIcuCurrently":142,"inIcuCumulative":null,"onVentilatorCurrently":63,"onVentilatorCumulative":null,"recovered":2293,"dataQualityGrade":"A+","lastUpdateEt":"10/15/2020 00:00","dateModified":"2020-10-15T24:00:00Z","checkTimeEt":"10/14 20:00","death":1698,"hospitalized":null,"dateChecked":"2020-10-15T24:00:00Z","totalTestsViral":1154583,"positiveTestsViral":null,"negativeTestsViral":null,"positiveCasesViral":87969,"deathConfirmed":null,"deathProbable":null,"totalTestEncountersViral":1133788,"totalTestsPeopleViral":745344,"totalTestsAntibody":null,"positiveTestsAntibody":null,"negativeTestsAntibody":null,"totalTestsPeopleAntibody":null,"positiveTestsPeopleAntibody":null,"negativeTestsPeopleAntibody":null,"totalTestsPeopleAntigen":null,"positiveTestsPeopleAntigen":null,"totalTestsAntigen":null,"positiveTestsAntigen":null,"fips":"32","positiveIncrease":655,"negativeIncrease":-2729,"total":745344,"totalTestResultsIncrease":9280,"posNeg":745344,"deathIncrease":7,"hospitalizedIncrease":0,"hash":"d8863c54ce88ceb8cb16a944c177d8af67f27e0b","commercialScore":0,"negativeRegularScore":0,"negativeScore":0,"positiveScore":0,"score":0,"grade":""},{"date":20201014,"state":"NV","positive":87314,"probableCases":null,"negative":660104,"pending":null,"totalTestResultsSource":"totalTestEncountersViral","totalTestResults":1124508,"hospitalizedCurrently":519,"hospitalizedCumulative":null,"inIcuCurrently":133,"inIcuCumulative":null,"onVentilatorCurrently":64,"onVentilatorCumulative":null,"recovered":2293,"dataQualityGrade":"A+","lastUpdateEt":"10/14/2020 02:59","dateModified":"2020-10-14T02:59:00Z","checkTimeEt":"10/13 22:59","death":1691,"hospitalized":null,"dateChecked":"2020-10-14T02:59:00Z","totalTestsViral":1154583,"positiveTestsViral":null,"negativeTestsViral":null,"positiveCasesViral":87314,"deathConfirmed":null,"deathProbable":null,"totalTestEncountersViral":1124508,"totalTestsPeopleViral":745810,"totalTestsAntibody":null,"positiveTestsAntibody":null,"negativeTestsAntibody":null,"totalTestsPeopleAntibody":null,"positiveTestsPeopleAntibody":null,"negativeTestsPeopleAntibody":null,"totalTestsPeopleAntigen":null,"positiveTestsPeopleAntigen":null,"totalTestsAntigen":null,"positiveTestsAntigen":null,"fips":"32","positiveIncrease":479,"negativeIncrease":3262,"total":747418,"totalTestResultsIncrease":9592,"posNeg":747418,"deathIncrease":17,"hospitalizedIncrease":0,"hash":"788e7a07751209120518185a3744beee1e66edca","commercialScore":0,"negativeRegularScore":0,"negativeScore":0,"positiveScore":0,"score":0,"grade":""},{"date":20201013,"state":"NV","positive":86835,"probableCases":null,"negative":656842,"pending":null,"totalTestResultsSource":"totalTestEncountersViral","totalTestResults":1114916,"hospitalizedCurrently":505,"hospitalizedCumulative":null,"inIcuCurrently":130,"inIcuCumulative":null,"onVentilatorCurrently":61,"onVentilatorCumulative":null,"recovered":2284,"dataQualityGrade":"A+","lastUpdateEt":"10/13/2020 02:59","dateModified":"2020-10-13T02:59:00Z","checkTimeEt":"10/12 22:59","death":1674,"hospitalized":null,"dateChecked":"2020-10-13T02:59:00Z","totalTestsViral":1147363,"positiveTestsViral":null,"negativeTestsViral":null,"positiveCasesViral":86835,"deathConfirmed":null,"deathProbable":null,"totalTestEncountersViral":1114916,"totalTestsPeopleViral":741931,"totalTestsAntibody":null,"positiveTestsAntibody":null,"negativeTestsAntibody":null,"totalTestsPeopleAntibody":null,"positiveTestsPeopleAntibody":null,"negativeTestsPeopleAntibody":null,"totalTestsPeopleAntigen":null,"positiveTestsPeopleAntigen":null,"totalTestsAntigen":null,"positiveTestsAntigen":null,"fips":"32","positiveIncrease":487,"negativeIncrease":2022,"total":743677,"totalTestResultsIncrease":7424,"posNeg":743677,"deathIncrease":10,"hospitalizedIncrease":0,"hash":"26a02eb51cb91b3e1c4c5edc3027bb058de0315f","commercialScore":0,"negativeRegularScore":0,"negativeScore":0,"positiveScore":0,"score":0,"grade":""},{"date":20201012,"state":"NV","positive":86348,"probableCases":null,"negative":654820,"pending":null,"totalTestResultsSource":"totalTestEncountersViral","totalTestResults":1107492,"hospitalizedCurrently":509,"hospitalizedCumulative":null,"inIcuCurrently":136,"inIcuCumulative":null,"onVentilatorCurrently":56,"onVentilatorCumulative":null,"recovered":2270,"dataQualityGrade":"A+","lastUpdateEt":"10/12/2020 02:59","dateModified":"2020-10-12T02:59:00Z","checkTimeEt":"10/11 22:59","death":1664,"hospitalized":null,"dateChecked":"2020-10-12T02:59:00Z","totalTestsViral":1143512,"positiveTestsViral":null,"negativeTestsViral":null,"positiveCasesViral":86348,"deathConfirmed":null,"deathProbable":null,"totalTestEncountersViral":1107492,"totalTestsPeopleViral":740560,"totalTestsAntibody":null,"positiveTestsAntibody":null,"negativeTestsAntibody":null,"totalTestsPeopleAntibody":null,"positiveTestsPeopleAntibody":null,"negativeTestsPeopleAntibody":null,"totalTestsPeopleAntigen":null,"positiveTestsPeopleAntigen":null,"totalTestsAntigen":null,"positiveTestsAntigen":null,"fips":"32","positiveIncrease":569,"negativeIncrease":2295,"total":741168,"totalTestResultsIncrease":2265,"posNeg":741168,"deathIncrease":3,"hospitalizedIncrease":0,"hash":"242128ee096d91a76e135bf2a5c7f4f0cc775012","commercialScore":0,"negativeRegularScore":0,"negativeScore":0,"positiveScore":0,"score":0,"grade":""},{"date":20201011,"state":"NV","positive":85779,"probableCases":null,"negative":652525,"pending":null,"totalTestResultsSource":"totalTestEncountersViral","totalTestResults":1105227,"hospitalizedCurrently":519,"hospitalizedCumulative":null,"inIcuCurrently":133,"inIcuCumulative":null,"onVentilatorCurrently":64,"onVentilatorCumulative":null,"recovered":2270,"dataQualityGrade":"A+","lastUpdateEt":"10/11/2020 02:59","dateModified":"2020-10-11T02:59:00Z","checkTimeEt":"10/10 22:59","death":1661,"hospitalized":null,"dateChecked":"2020-10-11T02:59:00Z","totalTestsViral":1135445,"positiveTestsViral":null,"negativeTestsViral":null,"positiveCasesViral":85779,"deathConfirmed":null,"deathProbable":null,"totalTestEncountersViral":1105227,"totalTestsPeopleViral":736873,"totalTestsAntibody":null,"positiveTestsAntibody":null,"negativeTestsAntibody":null,"totalTestsPeopleAntibody":null,"positiveTestsPeopleAntibody":null,"negativeTestsPeopleAntibody":null,"totalTestsPeopleAntigen":null,"positiveTestsPeopleAntigen":null,"totalTestsAntigen":null,"positiveTestsAntigen":null,"fips":"32","positiveIncrease":380,"negativeIncrease":2981,"total":738304,"totalTestResultsIncrease":4912,"posNeg":738304,"deathIncrease":2,"hospitalizedIncrease":0,"hash":"ed5731318ae6662b27105d060541a60cdcced74b","commercialScore":0,"negativeRegularScore":0,"negativeScore":0,"positiveScore":0,"score":0,"grade":""},{"date":20201010,"state":"NV","positive":85399,"probableCases":null,"negative":649544,"pending":null,"totalTestResultsSource":"totalTestEncountersViral","totalTestResults":1100315,"hospitalizedCurrently":519,"hospitalizedCumulative":null,"inIcuCurrently":133,"inIcuCumulative":null,"onVentilatorCurrently":64,"onVentilatorCumulative":null,"recovered":2270,"dataQualityGrade":"A+","lastUpdateEt":"10/10/2020 02:59","dateModified":"2020-10-10T02:59:00Z","checkTimeEt":"10/09 22:59","death":1659,"hospitalized":null,"dateChecked":"2020-10-10T02:59:00Z","totalTestsViral":1128337,"positiveTestsViral":null,"negativeTestsViral":null,"positiveCasesViral":85399,"deathConfirmed":null,"deathProbable":null,"totalTestEncountersViral":1100315,"totalTestsPeopleViral":733395,"totalTestsAntibody":null,"positiveTestsAntibody":null,"negativeTestsAntibody":null,"totalTestsPeopleAntibody":null,"positiveTestsPeopleAntibody":null,"negativeTestsPeopleAntibody":null,"totalTestsPeopleAntigen":null,"positiveTestsPeopleAntigen":null,"totalTestsAntigen":null,"positiveTestsAntigen":null,"fips":"32","positiveIncrease":806,"negativeIncrease":3903,"total":734943,"totalTestResultsIncrease":8279,"posNeg":734943,"deathIncrease":2,"hospitalizedIncrease":0,"hash":"ce79e3172c3bbcd3d6a75ff4e4e1212f586b355b","commercialScore":0,"negativeRegularScore":0,"negativeScore":0,"positiveScore":0,"score":0,"grade":""},{"date":20201009,"state":"NV","positive":84593,"probableCases":null,"negative":645641,"pending":null,"totalTestResultsSource":"totalTestEncountersViral","totalTestResults":1092036,"hospitalizedCurrently":502,"hospitalizedCumulative":null,"inIcuCurrently":127,"inIcuCumulative":null,"onVentilatorCurrently":63,"onVentilatorCumulative":null,"recovered":2270,"dataQualityGrade":"A+","lastUpdateEt":"10/9/2020 02:59","dateModified":"2020-10-09T02:59:00Z","checkTimeEt":"10/08 22:59","death":1657,"hospitalized":null,"dateChecked":"2020-10-09T02:59:00Z","totalTestsViral":1119083,"positiveTestsViral":null,"negativeTestsViral":null,"positiveCasesViral":84593,"deathConfirmed":null,"deathProbable":null,"totalTestEncountersViral":1092036,"totalTestsPeopleViral":728864,"totalTestsAntibody":null,"positiveTestsAntibody":null,"negativeTestsAntibody":null,"totalTestsPeopleAntibody":null,"positiveTestsPeopleAntibody":null,"negativeTestsPeopleAntibody":null,"totalTestsPeopleAntigen":null,"positiveTestsPeopleAntigen":null,"totalTestsAntigen":null,"positiveTestsAntigen":null,"fips":"32","positiveIncrease":766,"negativeIncrease":5270,"total":730234,"totalTestResultsIncrease":9314,"posNeg":730234,"deathIncrease":8,"hospitalizedIncrease":0,"hash":"4ca2db46a446500d015036dbc2398a924f0eb27d","commercialScore":0,"negativeRegularScore":0,"negativeScore":0,"positiveScore":0,"score":0,"grade":""},{"date":20201008,"state":"NV","positive":83827,"probableCases":null,"negative":640371,"pending":null,"totalTestResultsSource":"totalTestEncountersViral","totalTestResults":1082722,"hospitalizedCurrently":498,"hospitalizedCumulative":null,"inIcuCurrently":130,"inIcuCumulative":null,"onVentilatorCurrently":64,"onVentilatorCumulative":null,"recovered":2261,"dataQualityGrade":"A+","lastUpdateEt":"10/8/2020 02:59","dateModified":"2020-10-08T02:59:00Z","checkTimeEt":"10/07 22:59","death":1649,"hospitalized":null,"dateChecked":"2020-10-08T02:59:00Z","totalTestsViral":1101167,"positiveTestsViral":null,"negativeTestsViral":null,"positiveCasesViral":83827,"deathConfirmed":null,"deathProbable":null,"totalTestEncountersViral":1082722,"totalTestsPeopleViral":722508,"totalTestsAntibody":null,"positiveTestsAntibody":null,"negativeTestsAntibody":null,"totalTestsPeopleAntibody":null,"positiveTestsPeopleAntibody":null,"negativeTestsPeopleAntibody":null,"totalTestsPeopleAntigen":null,"positiveTestsPeopleAntigen":null,"totalTestsAntigen":null,"positiveTestsAntigen":null,"fips":"32","positiveIncrease":480,"negativeIncrease":3209,"total":724198,"totalTestResultsIncrease":8002,"posNeg":724198,"deathIncrease":13,"hospitalizedIncrease":0,"hash":"f2ee9e702946140e2b94beb5223b1823397f990e","commercialScore":0,"negativeRegularScore":0,"negativeScore":0,"positiveScore":0,"score":0,"grade":""},{"date":20201007,"state":"NV","positive":83347,"probableCases":null,"negative":637162,"pending":null,"totalTestResultsSource":"totalTestEncountersViral","totalTestResults":1074720,"hospitalizedCurrently":495,"hospitalizedCumulative":null,"inIcuCurrently":137,"inIcuCumulative":null,"onVentilatorCurrently":67,"onVentilatorCumulative":null,"recovered":2261,"dataQualityGrade":"A+","lastUpdateEt":"10/7/2020 02:59","dateModified":"2020-10-07T02:59:00Z","checkTimeEt":"10/06 22:59","death":1636,"hospitalized":null,"dateChecked":"2020-10-07T02:59:00Z","totalTestsViral":1093978,"positiveTestsViral":null,"negativeTestsViral":null,"positiveCasesViral":83347,"deathConfirmed":null,"deathProbable":null,"totalTestEncountersViral":1074720,"totalTestsPeopleViral":718853,"totalTestsAntibody":null,"positiveTestsAntibody":null,"negativeTestsAntibody":null,"totalTestsPeopleAntibody":null,"positiveTestsPeopleAntibody":null,"negativeTestsPeopleAntibody":null,"totalTestsPeopleAntigen":null,"positiveTestsPeopleAntigen":null,"totalTestsAntigen":null,"positiveTestsAntigen":null,"fips":"32","positiveIncrease":431,"negativeIncrease":1346,"total":720509,"totalTestResultsIncrease":11026,"posNeg":720509,"deathIncrease":7,"hospitalizedIncrease":0,"hash":"f90f3e377c98684897663fa3ac819edd0fc5c035","commercialScore":0,"negativeRegularScore":0,"negativeScore":0,"positiveScore":0,"score":0,"grade":""},{"date":20201006,"state":"NV","positive":82916,"probableCases":null,"negative":635816,"pending":null,"totalTestResultsSource":"totalTestEncountersViral","totalTestResults":1063694,"hospitalizedCurrently":485,"hospitalizedCumulative":null,"inIcuCurrently":125,"inIcuCumulative":null,"onVentilatorCurrently":69,"onVentilatorCumulative":null,"recovered":2242,"dataQualityGrade":"A+","lastUpdateEt":"10/6/2020 02:59","dateModified":"2020-10-06T02:59:00Z","checkTimeEt":"10/05 22:59","death":1629,"hospitalized":null,"dateChecked":"2020-10-06T02:59:00Z","totalTestsViral":1092912,"positiveTestsViral":null,"negativeTestsViral":null,"positiveCasesViral":82916,"deathConfirmed":null,"deathProbable":null,"totalTestEncountersViral":1063694,"totalTestsPeopleViral":717439,"totalTestsAntibody":null,"positiveTestsAntibody":null,"negativeTestsAntibody":null,"totalTestsPeopleAntibody":null,"positiveTestsPeopleAntibody":null,"negativeTestsPeopleAntibody":null,"totalTestsPeopleAntigen":null,"positiveTestsPeopleAntigen":null,"totalTestsAntigen":null,"positiveTestsAntigen":null,"fips":"32","positiveIncrease":479,"negativeIncrease":1689,"total":718732,"totalTestResultsIncrease":7635,"posNeg":718732,"deathIncrease":6,"hospitalizedIncrease":0,"hash":"aa3046f3b17863c6dc18189a1bd25df3c06caff3","commercialScore":0,"negativeRegularScore":0,"negativeScore":0,"positiveScore":0,"score":0,"grade":""},{"date":20201005,"state":"NV","positive":82437,"probableCases":null,"negative":634127,"pending":null,"totalTestResultsSource":"totalTestEncountersViral","totalTestResults":1056059,"hospitalizedCurrently":441,"hospitalizedCumulative":null,"inIcuCurrently":114,"inIcuCumulative":null,"onVentilatorCurrently":64,"onVentilatorCumulative":null,"recovered":2241,"dataQualityGrade":"A+","lastUpdateEt":"10/5/2020 02:59","dateModified":"2020-10-05T02:59:00Z","checkTimeEt":"10/04 22:59","death":1623,"hospitalized":null,"dateChecked":"2020-10-05T02:59:00Z","totalTestsViral":1089057,"positiveTestsViral":null,"negativeTestsViral":null,"positiveCasesViral":82437,"deathConfirmed":null,"deathProbable":null,"totalTestEncountersViral":1056059,"totalTestsPeopleViral":715456,"totalTestsAntibody":null,"positiveTestsAntibody":null,"negativeTestsAntibody":null,"totalTestsPeopleAntibody":null,"positiveTestsPeopleAntibody":null,"negativeTestsPeopleAntibody":null,"totalTestsPeopleAntigen":null,"positiveTestsPeopleAntigen":null,"totalTestsAntigen":null,"positiveTestsAntigen":null,"fips":"32","positiveIncrease":337,"negativeIncrease":2838,"total":716564,"totalTestResultsIncrease":2385,"posNeg":716564,"deathIncrease":0,"hospitalizedIncrease":0,"hash":"29e72a18aa79c4f057ee8af280705068c1354d13","commercialScore":0,"negativeRegularScore":0,"negativeScore":0,"positiveScore":0,"score":0,"grade":""},{"date":20201004,"state":"NV","positive":82100,"probableCases":null,"negative":631289,"pending":null,"totalTestResultsSource":"totalTestEncountersViral","totalTestResults":1053674,"hospitalizedCurrently":442,"hospitalizedCumulative":null,"inIcuCurrently":140,"inIcuCumulative":null,"onVentilatorCurrently":68,"onVentilatorCumulative":null,"recovered":2231,"dataQualityGrade":"A+","lastUpdateEt":"10/4/2020 02:59","dateModified":"2020-10-04T02:59:00Z","checkTimeEt":"10/03 22:59","death":1623,"hospitalized":null,"dateChecked":"2020-10-04T02:59:00Z","totalTestsViral":1082321,"positiveTestsViral":null,"negativeTestsViral":null,"positiveCasesViral":82100,"deathConfirmed":null,"deathProbable":null,"totalTestEncountersViral":1053674,"totalTestsPeopleViral":712204,"totalTestsAntibody":null,"positiveTestsAntibody":null,"negativeTestsAntibody":null,"totalTestsPeopleAntibody":null,"positiveTestsPeopleAntibody":null,"negativeTestsPeopleAntibody":null,"totalTestsPeopleAntigen":null,"positiveTestsPeopleAntigen":null,"totalTestsAntigen":null,"positiveTestsAntigen":null,"fips":"32","positiveIncrease":392,"negativeIncrease":2787,"total":713389,"totalTestResultsIncrease":4767,"posNeg":713389,"deathIncrease":3,"hospitalizedIncrease":0,"hash":"96c78e263ddcfe149c093540319d2a2f33dfaee4","commercialScore":0,"negativeRegularScore":0,"negativeScore":0,"positiveScore":0,"score":0,"grade":""},{"date":20201003,"state":"NV","positive":81708,"probableCases":null,"negative":628502,"pending":null,"totalTestResultsSource":"totalTestEncountersViral","totalTestResults":1048907,"hospitalizedCurrently":442,"hospitalizedCumulative":null,"inIcuCurrently":140,"inIcuCumulative":null,"onVentilatorCurrently":68,"onVentilatorCumulative":null,"recovered":2231,"dataQualityGrade":"A+","lastUpdateEt":"10/3/2020 02:59","dateModified":"2020-10-03T02:59:00Z","checkTimeEt":"10/02 22:59","death":1620,"hospitalized":null,"dateChecked":"2020-10-03T02:59:00Z","totalTestsViral":1075816,"positiveTestsViral":null,"negativeTestsViral":null,"positiveCasesViral":81708,"deathConfirmed":null,"deathProbable":null,"totalTestEncountersViral":1048907,"totalTestsPeopleViral":708992,"totalTestsAntibody":null,"positiveTestsAntibody":null,"negativeTestsAntibody":null,"totalTestsPeopleAntibody":null,"positiveTestsPeopleAntibody":null,"negativeTestsPeopleAntibody":null,"totalTestsPeopleAntigen":null,"positiveTestsPeopleAntigen":null,"totalTestsAntigen":null,"positiveTestsAntigen":null,"fips":"32","positiveIncrease":526,"negativeIncrease":3049,"total":710210,"totalTestResultsIncrease":7341,"posNeg":710210,"deathIncrease":11,"hospitalizedIncrease":0,"hash":"81d746a1c57c9860c89f0588951962afbab75632","commercialScore":0,"negativeRegularScore":0,"negativeScore":0,"positiveScore":0,"score":0,"grade":""},{"date":20201002,"state":"NV","positive":81182,"probableCases":null,"negative":625453,"pending":null,"totalTestResultsSource":"totalTestEncountersViral","totalTestResults":1041566,"hospitalizedCurrently":463,"hospitalizedCumulative":null,"inIcuCurrently":130,"inIcuCumulative":null,"onVentilatorCurrently":73,"onVentilatorCumulative":null,"recovered":2231,"dataQualityGrade":"A+","lastUpdateEt":"10/2/2020 02:59","dateModified":"2020-10-02T02:59:00Z","checkTimeEt":"10/01 22:59","death":1609,"hospitalized":null,"dateChecked":"2020-10-02T02:59:00Z","totalTestsViral":1068802,"positiveTestsViral":null,"negativeTestsViral":null,"positiveCasesViral":81182,"deathConfirmed":null,"deathProbable":null,"totalTestEncountersViral":1041566,"totalTestsPeopleViral":705512,"totalTestsAntibody":null,"positiveTestsAntibody":null,"negativeTestsAntibody":null,"totalTestsPeopleAntibody":null,"positiveTestsPeopleAntibody":null,"negativeTestsPeopleAntibody":null,"totalTestsPeopleAntigen":null,"positiveTestsPeopleAntigen":null,"totalTestsAntigen":null,"positiveTestsAntigen":null,"fips":"32","positiveIncrease":772,"negativeIncrease":4306,"total":706635,"totalTestResultsIncrease":8913,"posNeg":706635,"deathIncrease":6,"hospitalizedIncrease":0,"hash":"2f71d0b5af35a8d16460a81e08c9a6466986d45c","commercialScore":0,"negativeRegularScore":0,"negativeScore":0,"positiveScore":0,"score":0,"grade":""},{"date":20201001,"state":"NV","positive":80410,"probableCases":null,"negative":621147,"pending":null,"totalTestResultsSource":"totalTestEncountersViral","totalTestResults":1032653,"hospitalizedCurrently":449,"hospitalizedCumulative":null,"inIcuCurrently":125,"inIcuCumulative":null,"onVentilatorCurrently":63,"onVentilatorCumulative":null,"recovered":2226,"dataQualityGrade":"A+","lastUpdateEt":"10/1/2020 02:59","dateModified":"2020-10-01T02:59:00Z","checkTimeEt":"09/30 22:59","death":1603,"hospitalized":null,"dateChecked":"2020-10-01T02:59:00Z","totalTestsViral":1058242,"positiveTestsViral":null,"negativeTestsViral":null,"positiveCasesViral":80410,"deathConfirmed":null,"deathProbable":null,"totalTestEncountersViral":1032653,"totalTestsPeopleViral":700415,"totalTestsAntibody":null,"positiveTestsAntibody":null,"negativeTestsAntibody":null,"totalTestsPeopleAntibody":null,"positiveTestsPeopleAntibody":null,"negativeTestsPeopleAntibody":null,"totalTestsPeopleAntigen":null,"positiveTestsPeopleAntigen":null,"totalTestsAntigen":null,"positiveTestsAntigen":null,"fips":"32","positiveIncrease":430,"negativeIncrease":3031,"total":701557,"totalTestResultsIncrease":6366,"posNeg":701557,"deathIncrease":3,"hospitalizedIncrease":0,"hash":"f69f0c7b921d329f84164789c0886756d34679e4","commercialScore":0,"negativeRegularScore":0,"negativeScore":0,"positiveScore":0,"score":0,"grade":""},{"date":20200930,"state":"NV","positive":79980,"probableCases":null,"negative":618116,"pending":null,"totalTestResultsSource":"totalTestEncountersViral","totalTestResults":1026287,"hospitalizedCurrently":452,"hospitalizedCumulative":null,"inIcuCurrently":129,"inIcuCumulative":null,"onVentilatorCurrently":70,"onVentilatorCumulative":null,"recovered":2220,"dataQualityGrade":"A+","lastUpdateEt":"9/30/2020 02:59","dateModified":"2020-09-30T02:59:00Z","checkTimeEt":"09/29 22:59","death":1600,"hospitalized":null,"dateChecked":"2020-09-30T02:59:00Z","totalTestsViral":1052436,"positiveTestsViral":null,"negativeTestsViral":null,"positiveCasesViral":79980,"deathConfirmed":null,"deathProbable":null,"totalTestEncountersViral":1026287,"totalTestsPeopleViral":696997,"totalTestsAntibody":null,"positiveTestsAntibody":null,"negativeTestsAntibody":null,"totalTestsPeopleAntibody":null,"positiveTestsPeopleAntibody":null,"negativeTestsPeopleAntibody":null,"totalTestsPeopleAntigen":null,"positiveTestsPeopleAntigen":null,"totalTestsAntigen":null,"positiveTestsAntigen":null,"fips":"32","positiveIncrease":385,"negativeIncrease":1991,"total":698096,"totalTestResultsIncrease":8989,"posNeg":698096,"deathIncrease":7,"hospitalizedIncrease":0,"hash":"b51196c15a7a30e5504f5cbbe84b7b79b694deef","commercialScore":0,"negativeRegularScore":0,"negativeScore":0,"positiveScore":0,"score":0,"grade":""},{"date":20200929,"state":"NV","positive":79595,"probableCases":null,"negative":616125,"pending":null,"totalTestResultsSource":"totalTestEncountersViral","totalTestResults":1017298,"hospitalizedCurrently":446,"hospitalizedCumulative":null,"inIcuCurrently":136,"inIcuCumulative":null,"onVentilatorCurrently":69,"onVentilatorCumulative":null,"recovered":2093,"dataQualityGrade":"A+","lastUpdateEt":"9/29/2020 02:59","dateModified":"2020-09-29T02:59:00Z","checkTimeEt":"09/28 22:59","death":1593,"hospitalized":null,"dateChecked":"2020-09-29T02:59:00Z","totalTestsViral":1045334,"positiveTestsViral":null,"negativeTestsViral":null,"positiveCasesViral":79595,"deathConfirmed":null,"deathProbable":null,"totalTestEncountersViral":1017298,"totalTestsPeopleViral":694709,"totalTestsAntibody":null,"positiveTestsAntibody":null,"negativeTestsAntibody":null,"totalTestsPeopleAntibody":null,"positiveTestsPeopleAntibody":null,"negativeTestsPeopleAntibody":null,"totalTestsPeopleAntigen":null,"positiveTestsPeopleAntigen":null,"totalTestsAntigen":null,"positiveTestsAntigen":null,"fips":"32","positiveIncrease":404,"negativeIncrease":2643,"total":695720,"totalTestResultsIncrease":7032,"posNeg":695720,"deathIncrease":8,"hospitalizedIncrease":0,"hash":"caf745b662cf31e756907b710933905f6fd69176","commercialScore":0,"negativeRegularScore":0,"negativeScore":0,"positiveScore":0,"score":0,"grade":""},{"date":20200928,"state":"NV","positive":79191,"probableCases":null,"negative":613482,"pending":null,"totalTestResultsSource":"totalTestEncountersViral","totalTestResults":1010266,"hospitalizedCurrently":451,"hospitalizedCumulative":null,"inIcuCurrently":128,"inIcuCumulative":null,"onVentilatorCurrently":68,"onVentilatorCumulative":null,"recovered":2080,"dataQualityGrade":"A+","lastUpdateEt":"9/28/2020 02:59","dateModified":"2020-09-28T02:59:00Z","checkTimeEt":"09/27 22:59","death":1585,"hospitalized":null,"dateChecked":"2020-09-28T02:59:00Z","totalTestsViral":1040432,"positiveTestsViral":null,"negativeTestsViral":null,"positiveCasesViral":79191,"deathConfirmed":null,"deathProbable":null,"totalTestEncountersViral":1010266,"totalTestsPeopleViral":691831,"totalTestsAntibody":null,"positiveTestsAntibody":null,"negativeTestsAntibody":null,"totalTestsPeopleAntibody":null,"positiveTestsPeopleAntibody":null,"negativeTestsPeopleAntibody":null,"totalTestsPeopleAntigen":null,"positiveTestsPeopleAntigen":null,"totalTestsAntigen":null,"positiveTestsAntigen":null,"fips":"32","positiveIncrease":463,"negativeIncrease":3254,"total":692673,"totalTestResultsIncrease":2278,"posNeg":692673,"deathIncrease":0,"hospitalizedIncrease":0,"hash":"31aa50a4493e05e55813962ca768472785f570d3","commercialScore":0,"negativeRegularScore":0,"negativeScore":0,"positiveScore":0,"score":0,"grade":""},{"date":20200927,"state":"NV","positive":78728,"probableCases":null,"negative":610228,"pending":null,"totalTestResultsSource":"totalTestEncountersViral","totalTestResults":1007988,"hospitalizedCurrently":442,"hospitalizedCumulative":null,"inIcuCurrently":125,"inIcuCumulative":null,"onVentilatorCurrently":64,"onVentilatorCumulative":null,"recovered":2075,"dataQualityGrade":"A+","lastUpdateEt":"9/27/2020 02:59","dateModified":"2020-09-27T02:59:00Z","checkTimeEt":"09/26 22:59","death":1585,"hospitalized":null,"dateChecked":"2020-09-27T02:59:00Z","totalTestsViral":1033519,"positiveTestsViral":null,"negativeTestsViral":null,"positiveCasesViral":78728,"deathConfirmed":null,"deathProbable":null,"totalTestEncountersViral":1007988,"totalTestsPeopleViral":688073,"totalTestsAntibody":null,"positiveTestsAntibody":null,"negativeTestsAntibody":null,"totalTestsPeopleAntibody":null,"positiveTestsPeopleAntibody":null,"negativeTestsPeopleAntibody":null,"totalTestsPeopleAntigen":null,"positiveTestsPeopleAntigen":null,"totalTestsAntigen":null,"positiveTestsAntigen":null,"fips":"32","positiveIncrease":373,"negativeIncrease":2905,"total":688956,"totalTestResultsIncrease":3475,"posNeg":688956,"deathIncrease":3,"hospitalizedIncrease":0,"hash":"3da23bfb9b35821652e9d4c8979bb6777e151ffd","commercialScore":0,"negativeRegularScore":0,"negativeScore":0,"positiveScore":0,"score":0,"grade":""},{"date":20200926,"state":"NV","positive":78355,"probableCases":null,"negative":607323,"pending":null,"totalTestResultsSource":"totalTestEncountersViral","totalTestResults":1004513,"hospitalizedCurrently":442,"hospitalizedCumulative":null,"inIcuCurrently":125,"inIcuCumulative":null,"onVentilatorCurrently":64,"onVentilatorCumulative":null,"recovered":2075,"dataQualityGrade":"A+","lastUpdateEt":"9/26/2020 02:59","dateModified":"2020-09-26T02:59:00Z","checkTimeEt":"09/25 22:59","death":1582,"hospitalized":null,"dateChecked":"2020-09-26T02:59:00Z","totalTestsViral":1026486,"positiveTestsViral":null,"negativeTestsViral":null,"positiveCasesViral":78355,"deathConfirmed":null,"deathProbable":null,"totalTestEncountersViral":1004513,"totalTestsPeopleViral":684796,"totalTestsAntibody":null,"positiveTestsAntibody":null,"negativeTestsAntibody":null,"totalTestsPeopleAntibody":null,"positiveTestsPeopleAntibody":null,"negativeTestsPeopleAntibody":null,"totalTestsPeopleAntigen":null,"positiveTestsPeopleAntigen":null,"totalTestsAntigen":null,"positiveTestsAntigen":null,"fips":"32","positiveIncrease":602,"negativeIncrease":3740,"total":685678,"totalTestResultsIncrease":7438,"posNeg":685678,"deathIncrease":9,"hospitalizedIncrease":0,"hash":"09e7f6dc13f62cc604be36ad7caad7464aab3e5d","commercialScore":0,"negativeRegularScore":0,"negativeScore":0,"positiveScore":0,"score":0,"grade":""},{"date":20200925,"state":"NV","positive":77753,"probableCases":null,"negative":603583,"pending":null,"totalTestResultsSource":"totalTestEncountersViral","totalTestResults":997075,"hospitalizedCurrently":460,"hospitalizedCumulative":null,"inIcuCurrently":130,"inIcuCumulative":null,"onVentilatorCurrently":62,"onVentilatorCumulative":null,"recovered":2075,"dataQualityGrade":"A+","lastUpdateEt":"9/25/2020 02:59","dateModified":"2020-09-25T02:59:00Z","checkTimeEt":"09/24 22:59","death":1573,"hospitalized":null,"dateChecked":"2020-09-25T02:59:00Z","totalTestsViral":1017333,"positiveTestsViral":null,"negativeTestsViral":null,"positiveCasesViral":77753,"deathConfirmed":null,"deathProbable":null,"totalTestEncountersViral":997075,"totalTestsPeopleViral":680480,"totalTestsAntibody":null,"positiveTestsAntibody":null,"negativeTestsAntibody":null,"totalTestsPeopleAntibody":null,"positiveTestsPeopleAntibody":null,"negativeTestsPeopleAntibody":null,"totalTestsPeopleAntigen":null,"positiveTestsPeopleAntigen":null,"totalTestsAntigen":null,"positiveTestsAntigen":null,"fips":"32","positiveIncrease":556,"negativeIncrease":5292,"total":681336,"totalTestResultsIncrease":6903,"posNeg":681336,"deathIncrease":9,"hospitalizedIncrease":0,"hash":"c335648ec4703e55a5b29ad76ea12a70512987fd","commercialScore":0,"negativeRegularScore":0,"negativeScore":0,"positiveScore":0,"score":0,"grade":""},{"date":20200924,"state":"NV","positive":77197,"probableCases":null,"negative":598291,"pending":null,"totalTestResultsSource":"totalTestEncountersViral","totalTestResults":990172,"hospitalizedCurrently":468,"hospitalizedCumulative":null,"inIcuCurrently":137,"inIcuCumulative":null,"onVentilatorCurrently":67,"onVentilatorCumulative":null,"recovered":2062,"dataQualityGrade":"A+","lastUpdateEt":"9/24/2020 02:59","dateModified":"2020-09-24T02:59:00Z","checkTimeEt":"09/23 22:59","death":1564,"hospitalized":null,"dateChecked":"2020-09-24T02:59:00Z","totalTestsViral":1004215,"positiveTestsViral":null,"negativeTestsViral":null,"positiveCasesViral":77197,"deathConfirmed":null,"deathProbable":null,"totalTestEncountersViral":990172,"totalTestsPeopleViral":674482,"totalTestsAntibody":null,"positiveTestsAntibody":null,"negativeTestsAntibody":null,"totalTestsPeopleAntibody":null,"positiveTestsPeopleAntibody":null,"negativeTestsPeopleAntibody":null,"totalTestsPeopleAntigen":null,"positiveTestsPeopleAntigen":null,"totalTestsAntigen":null,"positiveTestsAntigen":null,"fips":"32","positiveIncrease":390,"negativeIncrease":3174,"total":675488,"totalTestResultsIncrease":8362,"posNeg":675488,"deathIncrease":8,"hospitalizedIncrease":0,"hash":"52be13415cbe15e9be23af6a6723b4a81dfed819","commercialScore":0,"negativeRegularScore":0,"negativeScore":0,"positiveScore":0,"score":0,"grade":""},{"date":20200923,"state":"NV","positive":76807,"probableCases":null,"negative":595117,"pending":null,"totalTestResultsSource":"totalTestEncountersViral","totalTestResults":981810,"hospitalizedCurrently":479,"hospitalizedCumulative":null,"inIcuCurrently":134,"inIcuCumulative":null,"onVentilatorCurrently":69,"onVentilatorCumulative":null,"recovered":2059,"dataQualityGrade":"A+","lastUpdateEt":"9/23/2020 02:59","dateModified":"2020-09-23T02:59:00Z","checkTimeEt":"09/22 22:59","death":1556,"hospitalized":null,"dateChecked":"2020-09-23T02:59:00Z","totalTestsViral":996307,"positiveTestsViral":null,"negativeTestsViral":null,"positiveCasesViral":76807,"deathConfirmed":null,"deathProbable":null,"totalTestEncountersViral":981810,"totalTestsPeopleViral":670908,"totalTestsAntibody":null,"positiveTestsAntibody":null,"negativeTestsAntibody":null,"totalTestsPeopleAntibody":null,"positiveTestsPeopleAntibody":null,"negativeTestsPeopleAntibody":null,"totalTestsPeopleAntigen":null,"positiveTestsPeopleAntigen":null,"totalTestsAntigen":null,"positiveTestsAntigen":null,"fips":"32","positiveIncrease":509,"negativeIncrease":2341,"total":671924,"totalTestResultsIncrease":10629,"posNeg":671924,"deathIncrease":10,"hospitalizedIncrease":0,"hash":"23c9e154e09e33e6313cb2ac71e55eef91c357ab","commercialScore":0,"negativeRegularScore":0,"negativeScore":0,"positiveScore":0,"score":0,"grade":""},{"date":20200922,"state":"NV","positive":76298,"probableCases":null,"negative":592776,"pending":null,"totalTestResultsSource":"totalTestEncountersViral","totalTestResults":971181,"hospitalizedCurrently":441,"hospitalizedCumulative":null,"inIcuCurrently":140,"inIcuCumulative":null,"onVentilatorCurrently":75,"onVentilatorCumulative":null,"recovered":2052,"dataQualityGrade":"A+","lastUpdateEt":"9/22/2020 02:59","dateModified":"2020-09-22T02:59:00Z","checkTimeEt":"09/21 22:59","death":1546,"hospitalized":null,"dateChecked":"2020-09-22T02:59:00Z","totalTestsViral":991960,"positiveTestsViral":null,"negativeTestsViral":null,"positiveCasesViral":76298,"deathConfirmed":null,"deathProbable":null,"totalTestEncountersViral":971181,"totalTestsPeopleViral":668264,"totalTestsAntibody":null,"positiveTestsAntibody":null,"negativeTestsAntibody":null,"totalTestsPeopleAntibody":null,"positiveTestsPeopleAntibody":null,"negativeTestsPeopleAntibody":null,"totalTestsPeopleAntigen":null,"positiveTestsPeopleAntigen":null,"totalTestsAntigen":null,"positiveTestsAntigen":null,"fips":"32","positiveIncrease":262,"negativeIncrease":2020,"total":669074,"totalTestResultsIncrease":7706,"posNeg":669074,"deathIncrease":15,"hospitalizedIncrease":0,"hash":"988b295a83fb49469b0be935178b40eb65015916","commercialScore":0,"negativeRegularScore":0,"negativeScore":0,"positiveScore":0,"score":0,"grade":""},{"date":20200921,"state":"NV","positive":76036,"probableCases":null,"negative":590756,"pending":null,"totalTestResultsSource":"totalTestEncountersViral","totalTestResults":963475,"hospitalizedCurrently":449,"hospitalizedCumulative":null,"inIcuCurrently":130,"inIcuCumulative":null,"onVentilatorCurrently":81,"onVentilatorCumulative":null,"recovered":2026,"dataQualityGrade":"A+","lastUpdateEt":"9/21/2020 02:59","dateModified":"2020-09-21T02:59:00Z","checkTimeEt":"09/20 22:59","death":1531,"hospitalized":null,"dateChecked":"2020-09-21T02:59:00Z","totalTestsViral":988019,"positiveTestsViral":null,"negativeTestsViral":null,"positiveCasesViral":76036,"deathConfirmed":null,"deathProbable":null,"totalTestEncountersViral":963475,"totalTestsPeopleViral":666062,"totalTestsAntibody":null,"positiveTestsAntibody":null,"negativeTestsAntibody":null,"totalTestsPeopleAntibody":null,"positiveTestsPeopleAntibody":null,"negativeTestsPeopleAntibody":null,"totalTestsPeopleAntigen":null,"positiveTestsPeopleAntigen":null,"totalTestsAntigen":null,"positiveTestsAntigen":null,"fips":"32","positiveIncrease":232,"negativeIncrease":1376,"total":666792,"totalTestResultsIncrease":2104,"posNeg":666792,"deathIncrease":0,"hospitalizedIncrease":0,"hash":"42e1683433397cda2accfae3b5eb8b5b2f5d0132","commercialScore":0,"negativeRegularScore":0,"negativeScore":0,"positiveScore":0,"score":0,"grade":""},{"date":20200920,"state":"NV","positive":75804,"probableCases":null,"negative":589380,"pending":null,"totalTestResultsSource":"totalTestEncountersViral","totalTestResults":961371,"hospitalizedCurrently":443,"hospitalizedCumulative":null,"inIcuCurrently":127,"inIcuCumulative":null,"onVentilatorCurrently":89,"onVentilatorCumulative":null,"recovered":2012,"dataQualityGrade":"A+","lastUpdateEt":"9/20/2020 02:59","dateModified":"2020-09-20T02:59:00Z","checkTimeEt":"09/19 22:59","death":1531,"hospitalized":null,"dateChecked":"2020-09-20T02:59:00Z","totalTestsViral":984667,"positiveTestsViral":null,"negativeTestsViral":null,"positiveCasesViral":75804,"deathConfirmed":null,"deathProbable":null,"totalTestEncountersViral":961371,"totalTestsPeopleViral":664479,"totalTestsAntibody":null,"positiveTestsAntibody":null,"negativeTestsAntibody":null,"totalTestsPeopleAntibody":null,"positiveTestsPeopleAntibody":null,"negativeTestsPeopleAntibody":null,"totalTestsPeopleAntigen":null,"positiveTestsPeopleAntigen":null,"totalTestsAntigen":null,"positiveTestsAntigen":null,"fips":"32","positiveIncrease":385,"negativeIncrease":4113,"total":665184,"totalTestResultsIncrease":3170,"posNeg":665184,"deathIncrease":3,"hospitalizedIncrease":0,"hash":"0f32751c8d90c4da32df58cb039a5b1606525bb7","commercialScore":0,"negativeRegularScore":0,"negativeScore":0,"positiveScore":0,"score":0,"grade":""},{"date":20200919,"state":"NV","positive":75419,"probableCases":null,"negative":585267,"pending":null,"totalTestResultsSource":"totalTestEncountersViral","totalTestResults":958201,"hospitalizedCurrently":443,"hospitalizedCumulative":null,"inIcuCurrently":127,"inIcuCumulative":null,"onVentilatorCurrently":89,"onVentilatorCumulative":null,"recovered":2012,"dataQualityGrade":"A+","lastUpdateEt":"9/19/2020 02:59","dateModified":"2020-09-19T02:59:00Z","checkTimeEt":"09/18 22:59","death":1528,"hospitalized":null,"dateChecked":"2020-09-19T02:59:00Z","totalTestsViral":975887,"positiveTestsViral":null,"negativeTestsViral":null,"positiveCasesViral":75419,"deathConfirmed":null,"deathProbable":null,"totalTestEncountersViral":958201,"totalTestsPeopleViral":659972,"totalTestsAntibody":null,"positiveTestsAntibody":null,"negativeTestsAntibody":null,"totalTestsPeopleAntibody":null,"positiveTestsPeopleAntibody":null,"negativeTestsPeopleAntibody":null,"totalTestsPeopleAntigen":null,"positiveTestsPeopleAntigen":null,"totalTestsAntigen":null,"positiveTestsAntigen":null,"fips":"32","positiveIncrease":323,"negativeIncrease":3762,"total":660686,"totalTestResultsIncrease":7246,"posNeg":660686,"deathIncrease":4,"hospitalizedIncrease":0,"hash":"9387386b04d7b7c1eb1593b5c7d7d87b7440e718","commercialScore":0,"negativeRegularScore":0,"negativeScore":0,"positiveScore":0,"score":0,"grade":""},{"date":20200918,"state":"NV","positive":75096,"probableCases":null,"negative":581505,"pending":null,"totalTestResultsSource":"totalTestEncountersViral","totalTestResults":950955,"hospitalizedCurrently":461,"hospitalizedCumulative":null,"inIcuCurrently":136,"inIcuCumulative":null,"onVentilatorCurrently":85,"onVentilatorCumulative":null,"recovered":2012,"dataQualityGrade":"A+","lastUpdateEt":"9/18/2020 02:59","dateModified":"2020-09-18T02:59:00Z","checkTimeEt":"09/17 22:59","death":1524,"hospitalized":null,"dateChecked":"2020-09-18T02:59:00Z","totalTestsViral":967840,"positiveTestsViral":null,"negativeTestsViral":null,"positiveCasesViral":75096,"deathConfirmed":null,"deathProbable":null,"totalTestEncountersViral":950955,"totalTestsPeopleViral":655860,"totalTestsAntibody":null,"positiveTestsAntibody":null,"negativeTestsAntibody":null,"totalTestsPeopleAntibody":null,"positiveTestsPeopleAntibody":null,"negativeTestsPeopleAntibody":null,"totalTestsPeopleAntigen":null,"positiveTestsPeopleAntigen":null,"totalTestsAntigen":null,"positiveTestsAntigen":null,"fips":"32","positiveIncrease":501,"negativeIncrease":3517,"total":656601,"totalTestResultsIncrease":7788,"posNeg":656601,"deathIncrease":18,"hospitalizedIncrease":0,"hash":"ba0e058a54b60d733e73bbb6ef84b835918b0449","commercialScore":0,"negativeRegularScore":0,"negativeScore":0,"positiveScore":0,"score":0,"grade":""},{"date":20200917,"state":"NV","positive":74595,"probableCases":null,"negative":577988,"pending":null,"totalTestResultsSource":"totalTestEncountersViral","totalTestResults":943167,"hospitalizedCurrently":484,"hospitalizedCumulative":null,"inIcuCurrently":150,"inIcuCumulative":null,"onVentilatorCurrently":98,"onVentilatorCumulative":null,"recovered":1997,"dataQualityGrade":"A+","lastUpdateEt":"9/17/2020 02:59","dateModified":"2020-09-17T02:59:00Z","checkTimeEt":"09/16 22:59","death":1506,"hospitalized":null,"dateChecked":"2020-09-17T02:59:00Z","totalTestsViral":959839,"positiveTestsViral":null,"negativeTestsViral":null,"positiveCasesViral":74595,"deathConfirmed":null,"deathProbable":null,"totalTestEncountersViral":943167,"totalTestsPeopleViral":651900,"totalTestsAntibody":null,"positiveTestsAntibody":null,"negativeTestsAntibody":null,"totalTestsPeopleAntibody":null,"positiveTestsPeopleAntibody":null,"negativeTestsPeopleAntibody":null,"totalTestsPeopleAntigen":null,"positiveTestsPeopleAntigen":null,"totalTestsAntigen":null,"positiveTestsAntigen":null,"fips":"32","positiveIncrease":347,"negativeIncrease":2703,"total":652583,"totalTestResultsIncrease":8095,"posNeg":652583,"deathIncrease":12,"hospitalizedIncrease":0,"hash":"026c9c5dc53223b90d186ea2b243fd7d9ccc6eac","commercialScore":0,"negativeRegularScore":0,"negativeScore":0,"positiveScore":0,"score":0,"grade":""},{"date":20200916,"state":"NV","positive":74248,"probableCases":null,"negative":575285,"pending":null,"totalTestResultsSource":"totalTestEncountersViral","totalTestResults":935072,"hospitalizedCurrently":488,"hospitalizedCumulative":null,"inIcuCurrently":150,"inIcuCumulative":null,"onVentilatorCurrently":97,"onVentilatorCumulative":null,"recovered":1980,"dataQualityGrade":"A+","lastUpdateEt":"9/16/2020 02:59","dateModified":"2020-09-16T02:59:00Z","checkTimeEt":"09/15 22:59","death":1494,"hospitalized":null,"dateChecked":"2020-09-16T02:59:00Z","totalTestsViral":953155,"positiveTestsViral":null,"negativeTestsViral":null,"positiveCasesViral":74248,"deathConfirmed":null,"deathProbable":null,"totalTestEncountersViral":935072,"totalTestsPeopleViral":648814,"totalTestsAntibody":null,"positiveTestsAntibody":null,"negativeTestsAntibody":null,"totalTestsPeopleAntibody":null,"positiveTestsPeopleAntibody":null,"negativeTestsPeopleAntibody":null,"totalTestsPeopleAntigen":null,"positiveTestsPeopleAntigen":null,"totalTestsAntigen":null,"positiveTestsAntigen":null,"fips":"32","positiveIncrease":208,"negativeIncrease":2789,"total":649533,"totalTestResultsIncrease":8746,"posNeg":649533,"deathIncrease":12,"hospitalizedIncrease":0,"hash":"0b53e612cc607a95b74f96a2107605f5434765d8","commercialScore":0,"negativeRegularScore":0,"negativeScore":0,"positiveScore":0,"score":0,"grade":""},{"date":20200915,"state":"NV","positive":74040,"probableCases":null,"negative":572496,"pending":null,"totalTestResultsSource":"totalTestEncountersViral","totalTestResults":926326,"hospitalizedCurrently":483,"hospitalizedCumulative":null,"inIcuCurrently":154,"inIcuCumulative":null,"onVentilatorCurrently":98,"onVentilatorCumulative":null,"recovered":1973,"dataQualityGrade":"A+","lastUpdateEt":"9/15/2020 02:59","dateModified":"2020-09-15T02:59:00Z","checkTimeEt":"09/14 22:59","death":1482,"hospitalized":null,"dateChecked":"2020-09-15T02:59:00Z","totalTestsViral":948184,"positiveTestsViral":null,"negativeTestsViral":null,"positiveCasesViral":74040,"deathConfirmed":null,"deathProbable":null,"totalTestEncountersViral":926326,"totalTestsPeopleViral":645803,"totalTestsAntibody":null,"positiveTestsAntibody":null,"negativeTestsAntibody":null,"totalTestsPeopleAntibody":null,"positiveTestsPeopleAntibody":null,"negativeTestsPeopleAntibody":null,"totalTestsPeopleAntigen":null,"positiveTestsPeopleAntigen":null,"totalTestsAntigen":null,"positiveTestsAntigen":null,"fips":"32","positiveIncrease":226,"negativeIncrease":1439,"total":646536,"totalTestResultsIncrease":8578,"posNeg":646536,"deathIncrease":26,"hospitalizedIncrease":0,"hash":"d1aaf6c9bc93b1e264a39fb83383a691e681310e","commercialScore":0,"negativeRegularScore":0,"negativeScore":0,"positiveScore":0,"score":0,"grade":""},{"date":20200914,"state":"NV","positive":73814,"probableCases":null,"negative":571057,"pending":null,"totalTestResultsSource":"totalTestEncountersViral","totalTestResults":917748,"hospitalizedCurrently":473,"hospitalizedCumulative":null,"inIcuCurrently":158,"inIcuCumulative":null,"onVentilatorCurrently":99,"onVentilatorCumulative":null,"recovered":1938,"dataQualityGrade":"A+","lastUpdateEt":"9/14/2020 02:59","dateModified":"2020-09-14T02:59:00Z","checkTimeEt":"09/13 22:59","death":1456,"hospitalized":null,"dateChecked":"2020-09-14T02:59:00Z","totalTestsViral":945646,"positiveTestsViral":null,"negativeTestsViral":null,"positiveCasesViral":73814,"deathConfirmed":null,"deathProbable":null,"totalTestEncountersViral":917748,"totalTestsPeopleViral":644335,"totalTestsAntibody":null,"positiveTestsAntibody":null,"negativeTestsAntibody":null,"totalTestsPeopleAntibody":null,"positiveTestsPeopleAntibody":null,"negativeTestsPeopleAntibody":null,"totalTestsPeopleAntigen":null,"positiveTestsPeopleAntigen":null,"totalTestsAntigen":null,"positiveTestsAntigen":null,"fips":"32","positiveIncrease":277,"negativeIncrease":2519,"total":644871,"totalTestResultsIncrease":1719,"posNeg":644871,"deathIncrease":4,"hospitalizedIncrease":0,"hash":"ab3d8c6f590b337b732484e62f076ac0ea2f972f","commercialScore":0,"negativeRegularScore":0,"negativeScore":0,"positiveScore":0,"score":0,"grade":""},{"date":20200913,"state":"NV","positive":73537,"probableCases":null,"negative":568538,"pending":null,"totalTestResultsSource":"totalTestEncountersViral","totalTestResults":916029,"hospitalizedCurrently":476,"hospitalizedCumulative":null,"inIcuCurrently":165,"inIcuCumulative":null,"onVentilatorCurrently":102,"onVentilatorCumulative":null,"recovered":1930,"dataQualityGrade":"A+","lastUpdateEt":"9/13/2020 02:59","dateModified":"2020-09-13T02:59:00Z","checkTimeEt":"09/12 22:59","death":1452,"hospitalized":null,"dateChecked":"2020-09-13T02:59:00Z","totalTestsViral":939865,"positiveTestsViral":null,"negativeTestsViral":null,"positiveCasesViral":73537,"deathConfirmed":null,"deathProbable":null,"totalTestEncountersViral":916029,"totalTestsPeopleViral":641532,"totalTestsAntibody":null,"positiveTestsAntibody":null,"negativeTestsAntibody":null,"totalTestsPeopleAntibody":null,"positiveTestsPeopleAntibody":null,"negativeTestsPeopleAntibody":null,"totalTestsPeopleAntigen":null,"positiveTestsPeopleAntigen":null,"totalTestsAntigen":null,"positiveTestsAntigen":null,"fips":"32","positiveIncrease":317,"negativeIncrease":3856,"total":642075,"totalTestResultsIncrease":3115,"posNeg":642075,"deathIncrease":3,"hospitalizedIncrease":0,"hash":"86482f1953ef0d92aae5858088017854065aaf87","commercialScore":0,"negativeRegularScore":0,"negativeScore":0,"positiveScore":0,"score":0,"grade":""},{"date":20200912,"state":"NV","positive":73220,"probableCases":null,"negative":564682,"pending":null,"totalTestResultsSource":"totalTestEncountersViral","totalTestResults":912914,"hospitalizedCurrently":476,"hospitalizedCumulative":null,"inIcuCurrently":165,"inIcuCumulative":null,"onVentilatorCurrently":102,"onVentilatorCumulative":null,"recovered":1930,"dataQualityGrade":"A+","lastUpdateEt":"9/12/2020 02:59","dateModified":"2020-09-12T02:59:00Z","checkTimeEt":"09/11 22:59","death":1449,"hospitalized":null,"dateChecked":"2020-09-12T02:59:00Z","totalTestsViral":931974,"positiveTestsViral":null,"negativeTestsViral":null,"positiveCasesViral":73220,"deathConfirmed":null,"deathProbable":null,"totalTestEncountersViral":912914,"totalTestsPeopleViral":637308,"totalTestsAntibody":null,"positiveTestsAntibody":null,"negativeTestsAntibody":null,"totalTestsPeopleAntibody":null,"positiveTestsPeopleAntibody":null,"negativeTestsPeopleAntibody":null,"totalTestsPeopleAntigen":null,"positiveTestsPeopleAntigen":null,"totalTestsAntigen":null,"positiveTestsAntigen":null,"fips":"32","positiveIncrease":414,"negativeIncrease":4206,"total":637902,"totalTestResultsIncrease":7009,"posNeg":637902,"deathIncrease":10,"hospitalizedIncrease":0,"hash":"27b57dbb3b4f86bccf5f3d5b01990f12de8b90aa","commercialScore":0,"negativeRegularScore":0,"negativeScore":0,"positiveScore":0,"score":0,"grade":""},{"date":20200911,"state":"NV","positive":72806,"probableCases":null,"negative":560476,"pending":null,"totalTestResultsSource":"totalTestEncountersViral","totalTestResults":905905,"hospitalizedCurrently":476,"hospitalizedCumulative":null,"inIcuCurrently":165,"inIcuCumulative":null,"onVentilatorCurrently":102,"onVentilatorCumulative":null,"recovered":1930,"dataQualityGrade":"A+","lastUpdateEt":"9/11/2020 02:59","dateModified":"2020-09-11T02:59:00Z","checkTimeEt":"09/10 22:59","death":1439,"hospitalized":null,"dateChecked":"2020-09-11T02:59:00Z","totalTestsViral":922480,"positiveTestsViral":null,"negativeTestsViral":null,"positiveCasesViral":72806,"deathConfirmed":null,"deathProbable":null,"totalTestEncountersViral":905905,"totalTestsPeopleViral":632668,"totalTestsAntibody":null,"positiveTestsAntibody":null,"negativeTestsAntibody":null,"totalTestsPeopleAntibody":null,"positiveTestsPeopleAntibody":null,"negativeTestsPeopleAntibody":null,"totalTestsPeopleAntigen":null,"positiveTestsPeopleAntigen":null,"totalTestsAntigen":null,"positiveTestsAntigen":null,"fips":"32","positiveIncrease":260,"negativeIncrease":5703,"total":633282,"totalTestResultsIncrease":7043,"posNeg":633282,"deathIncrease":10,"hospitalizedIncrease":0,"hash":"6ee6c4e0c38346a691728c51705c0a6607445ad8","commercialScore":0,"negativeRegularScore":0,"negativeScore":0,"positiveScore":0,"score":0,"grade":""},{"date":20200910,"state":"NV","positive":72546,"probableCases":null,"negative":554773,"pending":null,"totalTestResultsSource":"totalTestEncountersViral","totalTestResults":898862,"hospitalizedCurrently":519,"hospitalizedCumulative":null,"inIcuCurrently":175,"inIcuCumulative":null,"onVentilatorCurrently":112,"onVentilatorCumulative":null,"recovered":1937,"dataQualityGrade":"A+","lastUpdateEt":"9/10/2020 02:59","dateModified":"2020-09-10T02:59:00Z","checkTimeEt":"09/09 22:59","death":1429,"hospitalized":null,"dateChecked":"2020-09-10T02:59:00Z","totalTestsViral":912404,"positiveTestsViral":null,"negativeTestsViral":null,"positiveCasesViral":72546,"deathConfirmed":null,"deathProbable":null,"totalTestEncountersViral":898862,"totalTestsPeopleViral":626590,"totalTestsAntibody":null,"positiveTestsAntibody":null,"negativeTestsAntibody":null,"totalTestsPeopleAntibody":null,"positiveTestsPeopleAntibody":null,"negativeTestsPeopleAntibody":null,"totalTestsPeopleAntigen":null,"positiveTestsPeopleAntigen":null,"totalTestsAntigen":null,"positiveTestsAntigen":null,"fips":"32","positiveIncrease":288,"negativeIncrease":2157,"total":627319,"totalTestResultsIncrease":7552,"posNeg":627319,"deathIncrease":17,"hospitalizedIncrease":0,"hash":"4e3f0fa3a242bdb33d9d31955b9219b0e26ed585","commercialScore":0,"negativeRegularScore":0,"negativeScore":0,"positiveScore":0,"score":0,"grade":""},{"date":20200909,"state":"NV","positive":72258,"probableCases":null,"negative":552616,"pending":null,"totalTestResultsSource":"totalTestEncountersViral","totalTestResults":891310,"hospitalizedCurrently":552,"hospitalizedCumulative":null,"inIcuCurrently":164,"inIcuCumulative":null,"onVentilatorCurrently":110,"onVentilatorCumulative":null,"recovered":1925,"dataQualityGrade":"A+","lastUpdateEt":"9/9/2020 02:59","dateModified":"2020-09-09T02:59:00Z","checkTimeEt":"09/08 22:59","death":1412,"hospitalized":null,"dateChecked":"2020-09-09T02:59:00Z","totalTestsViral":907451,"positiveTestsViral":null,"negativeTestsViral":null,"positiveCasesViral":72258,"deathConfirmed":null,"deathProbable":null,"totalTestEncountersViral":891310,"totalTestsPeopleViral":624152,"totalTestsAntibody":null,"positiveTestsAntibody":null,"negativeTestsAntibody":null,"totalTestsPeopleAntibody":null,"positiveTestsPeopleAntibody":null,"negativeTestsPeopleAntibody":null,"totalTestsPeopleAntigen":null,"positiveTestsPeopleAntigen":null,"totalTestsAntigen":null,"positiveTestsAntigen":null,"fips":"32","positiveIncrease":154,"negativeIncrease":668,"total":624874,"totalTestResultsIncrease":10917,"posNeg":624874,"deathIncrease":19,"hospitalizedIncrease":0,"hash":"e1d3d759c5f08c5d476717fba6053d838123afa2","commercialScore":0,"negativeRegularScore":0,"negativeScore":0,"positiveScore":0,"score":0,"grade":""},{"date":20200908,"state":"NV","positive":72104,"probableCases":null,"negative":551948,"pending":null,"totalTestResultsSource":"totalTestEncountersViral","totalTestResults":880393,"hospitalizedCurrently":538,"hospitalizedCumulative":null,"inIcuCurrently":170,"inIcuCumulative":null,"onVentilatorCurrently":107,"onVentilatorCumulative":null,"recovered":1920,"dataQualityGrade":"A+","lastUpdateEt":"9/8/2020 02:59","dateModified":"2020-09-08T02:59:00Z","checkTimeEt":"09/07 22:59","death":1393,"hospitalized":null,"dateChecked":"2020-09-08T02:59:00Z","totalTestsViral":905525,"positiveTestsViral":null,"negativeTestsViral":null,"positiveCasesViral":72104,"deathConfirmed":null,"deathProbable":null,"totalTestEncountersViral":880393,"totalTestsPeopleViral":623395,"totalTestsAntibody":null,"positiveTestsAntibody":null,"negativeTestsAntibody":null,"totalTestsPeopleAntibody":null,"positiveTestsPeopleAntibody":null,"negativeTestsPeopleAntibody":null,"totalTestsPeopleAntigen":null,"positiveTestsPeopleAntigen":null,"totalTestsAntigen":null,"positiveTestsAntigen":null,"fips":"32","positiveIncrease":137,"negativeIncrease":1273,"total":624052,"totalTestResultsIncrease":2580,"posNeg":624052,"deathIncrease":0,"hospitalizedIncrease":0,"hash":"907b046d2750d29c7a7c769450f74078b87c5470","commercialScore":0,"negativeRegularScore":0,"negativeScore":0,"positiveScore":0,"score":0,"grade":""},{"date":20200907,"state":"NV","positive":71967,"probableCases":null,"negative":550675,"pending":null,"totalTestResultsSource":"totalTestEncountersViral","totalTestResults":877813,"hospitalizedCurrently":597,"hospitalizedCumulative":null,"inIcuCurrently":184,"inIcuCumulative":null,"onVentilatorCurrently":114,"onVentilatorCumulative":null,"recovered":1853,"dataQualityGrade":"A+","lastUpdateEt":"9/7/2020 02:59","dateModified":"2020-09-07T02:59:00Z","checkTimeEt":"09/06 22:59","death":1393,"hospitalized":null,"dateChecked":"2020-09-07T02:59:00Z","totalTestsViral":902801,"positiveTestsViral":null,"negativeTestsViral":null,"positiveCasesViral":71967,"deathConfirmed":null,"deathProbable":null,"totalTestEncountersViral":877813,"totalTestsPeopleViral":621990,"totalTestsAntibody":null,"positiveTestsAntibody":null,"negativeTestsAntibody":null,"totalTestsPeopleAntibody":null,"positiveTestsPeopleAntibody":null,"negativeTestsPeopleAntibody":null,"totalTestsPeopleAntigen":null,"positiveTestsPeopleAntigen":null,"totalTestsAntigen":null,"positiveTestsAntigen":null,"fips":"32","positiveIncrease":357,"negativeIncrease":2803,"total":622642,"totalTestResultsIncrease":1458,"posNeg":622642,"deathIncrease":4,"hospitalizedIncrease":0,"hash":"868e7384aac4828cddc1eeaef326437fd592d837","commercialScore":0,"negativeRegularScore":0,"negativeScore":0,"positiveScore":0,"score":0,"grade":""},{"date":20200906,"state":"NV","positive":71610,"probableCases":null,"negative":547872,"pending":null,"totalTestResultsSource":"totalTestEncountersViral","totalTestResults":876355,"hospitalizedCurrently":597,"hospitalizedCumulative":null,"inIcuCurrently":184,"inIcuCumulative":null,"onVentilatorCurrently":114,"onVentilatorCumulative":null,"recovered":1853,"dataQualityGrade":"A+","lastUpdateEt":"9/6/2020 02:59","dateModified":"2020-09-06T02:59:00Z","checkTimeEt":"09/05 22:59","death":1389,"hospitalized":null,"dateChecked":"2020-09-06T02:59:00Z","totalTestsViral":896316,"positiveTestsViral":null,"negativeTestsViral":null,"positiveCasesViral":71610,"deathConfirmed":null,"deathProbable":null,"totalTestEncountersViral":876355,"totalTestsPeopleViral":618850,"totalTestsAntibody":null,"positiveTestsAntibody":null,"negativeTestsAntibody":null,"totalTestsPeopleAntibody":null,"positiveTestsPeopleAntibody":null,"negativeTestsPeopleAntibody":null,"totalTestsPeopleAntigen":null,"positiveTestsPeopleAntigen":null,"totalTestsAntigen":null,"positiveTestsAntigen":null,"fips":"32","positiveIncrease":508,"negativeIncrease":5970,"total":619482,"totalTestResultsIncrease":4534,"posNeg":619482,"deathIncrease":1,"hospitalizedIncrease":0,"hash":"be9dac1d1f1e198b198ac67acf09c3a39da6696e","commercialScore":0,"negativeRegularScore":0,"negativeScore":0,"positiveScore":0,"score":0,"grade":""},{"date":20200905,"state":"NV","positive":71102,"probableCases":null,"negative":541902,"pending":null,"totalTestResultsSource":"totalTestEncountersViral","totalTestResults":871821,"hospitalizedCurrently":597,"hospitalizedCumulative":null,"inIcuCurrently":184,"inIcuCumulative":null,"onVentilatorCurrently":114,"onVentilatorCumulative":null,"recovered":1853,"dataQualityGrade":"A+","lastUpdateEt":"9/5/2020 02:59","dateModified":"2020-09-05T02:59:00Z","checkTimeEt":"09/04 22:59","death":1388,"hospitalized":null,"dateChecked":"2020-09-05T02:59:00Z","totalTestsViral":885384,"positiveTestsViral":null,"negativeTestsViral":null,"positiveCasesViral":71102,"deathConfirmed":null,"deathProbable":null,"totalTestEncountersViral":871821,"totalTestsPeopleViral":612405,"totalTestsAntibody":null,"positiveTestsAntibody":null,"negativeTestsAntibody":null,"totalTestsPeopleAntibody":null,"positiveTestsPeopleAntibody":null,"negativeTestsPeopleAntibody":null,"totalTestsPeopleAntigen":null,"positiveTestsPeopleAntigen":null,"totalTestsAntigen":null,"positiveTestsAntigen":null,"fips":"32","positiveIncrease":390,"negativeIncrease":3799,"total":613004,"totalTestResultsIncrease":7125,"posNeg":613004,"deathIncrease":13,"hospitalizedIncrease":0,"hash":"99fe2110c735f7204db9b87996a154bae141b021","commercialScore":0,"negativeRegularScore":0,"negativeScore":0,"positiveScore":0,"score":0,"grade":""},{"date":20200904,"state":"NV","positive":70712,"probableCases":null,"negative":538103,"pending":null,"totalTestResultsSource":"totalTestEncountersViral","totalTestResults":864696,"hospitalizedCurrently":611,"hospitalizedCumulative":null,"inIcuCurrently":178,"inIcuCumulative":null,"onVentilatorCurrently":112,"onVentilatorCumulative":null,"recovered":1853,"dataQualityGrade":"A+","lastUpdateEt":"9/4/2020 02:59","dateModified":"2020-09-04T02:59:00Z","checkTimeEt":"09/03 22:59","death":1375,"hospitalized":null,"dateChecked":"2020-09-04T02:59:00Z","totalTestsViral":875292,"positiveTestsViral":null,"negativeTestsViral":null,"positiveCasesViral":70712,"deathConfirmed":null,"deathProbable":null,"totalTestEncountersViral":864696,"totalTestsPeopleViral":608181,"totalTestsAntibody":null,"positiveTestsAntibody":null,"negativeTestsAntibody":null,"totalTestsPeopleAntibody":null,"positiveTestsPeopleAntibody":null,"negativeTestsPeopleAntibody":null,"totalTestsPeopleAntigen":null,"positiveTestsPeopleAntigen":null,"totalTestsAntigen":null,"positiveTestsAntigen":null,"fips":"32","positiveIncrease":489,"negativeIncrease":3058,"total":608815,"totalTestResultsIncrease":8610,"posNeg":608815,"deathIncrease":12,"hospitalizedIncrease":0,"hash":"0e5fd7f464e1b4e0fdc29639f84c98021cd8a693","commercialScore":0,"negativeRegularScore":0,"negativeScore":0,"positiveScore":0,"score":0,"grade":""},{"date":20200903,"state":"NV","positive":70223,"probableCases":null,"negative":535045,"pending":null,"totalTestResultsSource":"totalTestEncountersViral","totalTestResults":856086,"hospitalizedCurrently":631,"hospitalizedCumulative":null,"inIcuCurrently":187,"inIcuCumulative":null,"onVentilatorCurrently":117,"onVentilatorCumulative":null,"recovered":1817,"dataQualityGrade":"A+","lastUpdateEt":"9/3/2020 02:59","dateModified":"2020-09-03T02:59:00Z","checkTimeEt":"09/02 22:59","death":1363,"hospitalized":null,"dateChecked":"2020-09-03T02:59:00Z","totalTestsViral":868028,"positiveTestsViral":null,"negativeTestsViral":null,"positiveCasesViral":70223,"deathConfirmed":null,"deathProbable":null,"totalTestEncountersViral":856086,"totalTestsPeopleViral":604692,"totalTestsAntibody":null,"positiveTestsAntibody":null,"negativeTestsAntibody":null,"totalTestsPeopleAntibody":null,"positiveTestsPeopleAntibody":null,"negativeTestsPeopleAntibody":null,"totalTestsPeopleAntigen":null,"positiveTestsPeopleAntigen":null,"totalTestsAntigen":null,"positiveTestsAntigen":null,"fips":"32","positiveIncrease":351,"negativeIncrease":2609,"total":605268,"totalTestResultsIncrease":8911,"posNeg":605268,"deathIncrease":27,"hospitalizedIncrease":0,"hash":"591ec5812d520bd078d2a3ac055b95d29e63fd1e","commercialScore":0,"negativeRegularScore":0,"negativeScore":0,"positiveScore":0,"score":0,"grade":""},{"date":20200902,"state":"NV","positive":69872,"probableCases":null,"negative":532436,"pending":null,"totalTestResultsSource":"totalTestEncountersViral","totalTestResults":847175,"hospitalizedCurrently":675,"hospitalizedCumulative":null,"inIcuCurrently":199,"inIcuCumulative":null,"onVentilatorCurrently":113,"onVentilatorCumulative":null,"recovered":1817,"dataQualityGrade":"A+","lastUpdateEt":"9/2/2020 02:59","dateModified":"2020-09-02T02:59:00Z","checkTimeEt":"09/01 22:59","death":1336,"hospitalized":null,"dateChecked":"2020-09-02T02:59:00Z","totalTestsViral":862254,"positiveTestsViral":null,"negativeTestsViral":null,"positiveCasesViral":69872,"deathConfirmed":null,"deathProbable":null,"totalTestEncountersViral":847175,"totalTestsPeopleViral":601740,"totalTestsAntibody":null,"positiveTestsAntibody":null,"negativeTestsAntibody":null,"totalTestsPeopleAntibody":null,"positiveTestsPeopleAntibody":null,"negativeTestsPeopleAntibody":null,"totalTestsPeopleAntigen":null,"positiveTestsPeopleAntigen":null,"totalTestsAntigen":null,"positiveTestsAntigen":null,"fips":"32","positiveIncrease":239,"negativeIncrease":1720,"total":602308,"totalTestResultsIncrease":8548,"posNeg":602308,"deathIncrease":23,"hospitalizedIncrease":0,"hash":"6e320d4a7ecffd2ad7639ee375431447ee403fd4","commercialScore":0,"negativeRegularScore":0,"negativeScore":0,"positiveScore":0,"score":0,"grade":""},{"date":20200901,"state":"NV","positive":69633,"probableCases":null,"negative":530716,"pending":null,"totalTestResultsSource":"totalTestEncountersViral","totalTestResults":838627,"hospitalizedCurrently":643,"hospitalizedCumulative":null,"inIcuCurrently":193,"inIcuCumulative":null,"onVentilatorCurrently":119,"onVentilatorCumulative":null,"recovered":1798,"dataQualityGrade":"A+","lastUpdateEt":"9/1/2020 02:59","dateModified":"2020-09-01T02:59:00Z","checkTimeEt":"08/31 22:59","death":1313,"hospitalized":null,"dateChecked":"2020-09-01T02:59:00Z","totalTestsViral":859175,"positiveTestsViral":null,"negativeTestsViral":null,"positiveCasesViral":69633,"deathConfirmed":null,"deathProbable":null,"totalTestEncountersViral":838627,"totalTestsPeopleViral":599812,"totalTestsAntibody":null,"positiveTestsAntibody":null,"negativeTestsAntibody":null,"totalTestsPeopleAntibody":null,"positiveTestsPeopleAntibody":null,"negativeTestsPeopleAntibody":null,"totalTestsPeopleAntigen":null,"positiveTestsPeopleAntigen":null,"totalTestsAntigen":null,"positiveTestsAntigen":null,"fips":"32","positiveIncrease":405,"negativeIncrease":2023,"total":600349,"totalTestResultsIncrease":7765,"posNeg":600349,"deathIncrease":8,"hospitalizedIncrease":0,"hash":"32d0bb60b12f01853a82b3a5c0ddb02dd5f5cf8a","commercialScore":0,"negativeRegularScore":0,"negativeScore":0,"positiveScore":0,"score":0,"grade":""},{"date":20200831,"state":"NV","positive":69228,"probableCases":null,"negative":528693,"pending":null,"totalTestResultsSource":"totalTestEncountersViral","totalTestResults":830862,"hospitalizedCurrently":664,"hospitalizedCumulative":null,"inIcuCurrently":196,"inIcuCumulative":null,"onVentilatorCurrently":106,"onVentilatorCumulative":null,"recovered":1773,"dataQualityGrade":"A+","lastUpdateEt":"8/31/2020 02:59","dateModified":"2020-08-31T02:59:00Z","checkTimeEt":"08/30 22:59","death":1305,"hospitalized":null,"dateChecked":"2020-08-31T02:59:00Z","totalTestsViral":854785,"positiveTestsViral":null,"negativeTestsViral":null,"positiveCasesViral":69228,"deathConfirmed":null,"deathProbable":null,"totalTestEncountersViral":830862,"totalTestsPeopleViral":597508,"totalTestsAntibody":null,"positiveTestsAntibody":null,"negativeTestsAntibody":null,"totalTestsPeopleAntibody":null,"positiveTestsPeopleAntibody":null,"negativeTestsPeopleAntibody":null,"totalTestsPeopleAntigen":null,"positiveTestsPeopleAntigen":null,"totalTestsAntigen":null,"positiveTestsAntigen":null,"fips":"32","positiveIncrease":320,"negativeIncrease":1916,"total":597921,"totalTestResultsIncrease":1510,"posNeg":597921,"deathIncrease":3,"hospitalizedIncrease":0,"hash":"48bbd7c1fa449137e1b372799370037cf63a4d3e","commercialScore":0,"negativeRegularScore":0,"negativeScore":0,"positiveScore":0,"score":0,"grade":""},{"date":20200830,"state":"NV","positive":68908,"probableCases":null,"negative":526777,"pending":null,"totalTestResultsSource":"totalTestEncountersViral","totalTestResults":829352,"hospitalizedCurrently":675,"hospitalizedCumulative":null,"inIcuCurrently":182,"inIcuCumulative":null,"onVentilatorCurrently":102,"onVentilatorCumulative":null,"recovered":1725,"dataQualityGrade":"A+","lastUpdateEt":"8/30/2020 02:59","dateModified":"2020-08-30T02:59:00Z","checkTimeEt":"08/29 22:59","death":1302,"hospitalized":null,"dateChecked":"2020-08-30T02:59:00Z","totalTestsViral":850535,"positiveTestsViral":null,"negativeTestsViral":null,"positiveCasesViral":68908,"deathConfirmed":null,"deathProbable":null,"totalTestEncountersViral":829352,"totalTestsPeopleViral":595273,"totalTestsAntibody":null,"positiveTestsAntibody":null,"negativeTestsAntibody":null,"totalTestsPeopleAntibody":null,"positiveTestsPeopleAntibody":null,"negativeTestsPeopleAntibody":null,"totalTestsPeopleAntigen":null,"positiveTestsPeopleAntigen":null,"totalTestsAntigen":null,"positiveTestsAntigen":null,"fips":"32","positiveIncrease":447,"negativeIncrease":2717,"total":595685,"totalTestResultsIncrease":3502,"posNeg":595685,"deathIncrease":0,"hospitalizedIncrease":0,"hash":"fc0c0dfc22d5dee9d247211769e5bc86bcd0742f","commercialScore":0,"negativeRegularScore":0,"negativeScore":0,"positiveScore":0,"score":0,"grade":""},{"date":20200829,"state":"NV","positive":68461,"probableCases":null,"negative":524060,"pending":null,"totalTestResultsSource":"totalTestEncountersViral","totalTestResults":825850,"hospitalizedCurrently":675,"hospitalizedCumulative":null,"inIcuCurrently":182,"inIcuCumulative":null,"onVentilatorCurrently":102,"onVentilatorCumulative":null,"recovered":1725,"dataQualityGrade":"A+","lastUpdateEt":"8/29/2020 02:59","dateModified":"2020-08-29T02:59:00Z","checkTimeEt":"08/28 22:59","death":1302,"hospitalized":null,"dateChecked":"2020-08-29T02:59:00Z","totalTestsViral":844391,"positiveTestsViral":null,"negativeTestsViral":null,"positiveCasesViral":68461,"deathConfirmed":null,"deathProbable":null,"totalTestEncountersViral":825850,"totalTestsPeopleViral":592115,"totalTestsAntibody":null,"positiveTestsAntibody":null,"negativeTestsAntibody":null,"totalTestsPeopleAntibody":null,"positiveTestsPeopleAntibody":null,"negativeTestsPeopleAntibody":null,"totalTestsPeopleAntigen":null,"positiveTestsPeopleAntigen":null,"totalTestsAntigen":null,"positiveTestsAntigen":null,"fips":"32","positiveIncrease":609,"negativeIncrease":3361,"total":592521,"totalTestResultsIncrease":5691,"posNeg":592521,"deathIncrease":15,"hospitalizedIncrease":0,"hash":"acc3e3c82f9828d68d9c33c00a5370d0eb682f52","commercialScore":0,"negativeRegularScore":0,"negativeScore":0,"positiveScore":0,"score":0,"grade":""},{"date":20200828,"state":"NV","positive":67852,"probableCases":null,"negative":520699,"pending":null,"totalTestResultsSource":"totalTestEncountersViral","totalTestResults":820159,"hospitalizedCurrently":707,"hospitalizedCumulative":null,"inIcuCurrently":197,"inIcuCumulative":null,"onVentilatorCurrently":108,"onVentilatorCumulative":null,"recovered":1725,"dataQualityGrade":"A+","lastUpdateEt":"8/28/2020 02:59","dateModified":"2020-08-28T02:59:00Z","checkTimeEt":"08/27 22:59","death":1287,"hospitalized":null,"dateChecked":"2020-08-28T02:59:00Z","totalTestsViral":837057,"positiveTestsViral":null,"negativeTestsViral":null,"positiveCasesViral":67852,"deathConfirmed":null,"deathProbable":null,"totalTestEncountersViral":820159,"totalTestsPeopleViral":588301,"totalTestsAntibody":null,"positiveTestsAntibody":null,"negativeTestsAntibody":null,"totalTestsPeopleAntibody":null,"positiveTestsPeopleAntibody":null,"negativeTestsPeopleAntibody":null,"totalTestsPeopleAntigen":null,"positiveTestsPeopleAntigen":null,"totalTestsAntigen":null,"positiveTestsAntigen":null,"fips":"32","positiveIncrease":632,"negativeIncrease":3687,"total":588551,"totalTestResultsIncrease":6269,"posNeg":588551,"deathIncrease":16,"hospitalizedIncrease":0,"hash":"e805d3cd640f978bfc8a2609325e1f1f02fa3b8a","commercialScore":0,"negativeRegularScore":0,"negativeScore":0,"positiveScore":0,"score":0,"grade":""},{"date":20200827,"state":"NV","positive":67220,"probableCases":null,"negative":517012,"pending":null,"totalTestResultsSource":"totalTestEncountersViral","totalTestResults":813890,"hospitalizedCurrently":727,"hospitalizedCumulative":null,"inIcuCurrently":207,"inIcuCumulative":null,"onVentilatorCurrently":110,"onVentilatorCumulative":null,"recovered":1718,"dataQualityGrade":"A+","lastUpdateEt":"8/27/2020 02:59","dateModified":"2020-08-27T02:59:00Z","checkTimeEt":"08/26 22:59","death":1271,"hospitalized":null,"dateChecked":"2020-08-27T02:59:00Z","totalTestsViral":828931,"positiveTestsViral":null,"negativeTestsViral":null,"positiveCasesViral":67220,"deathConfirmed":null,"deathProbable":null,"totalTestEncountersViral":813890,"totalTestsPeopleViral":584007,"totalTestsAntibody":null,"positiveTestsAntibody":null,"negativeTestsAntibody":null,"totalTestsPeopleAntibody":null,"positiveTestsPeopleAntibody":null,"negativeTestsPeopleAntibody":null,"totalTestsPeopleAntigen":null,"positiveTestsPeopleAntigen":null,"totalTestsAntigen":null,"positiveTestsAntigen":null,"fips":"32","positiveIncrease":554,"negativeIncrease":2523,"total":584232,"totalTestResultsIncrease":6499,"posNeg":584232,"deathIncrease":21,"hospitalizedIncrease":0,"hash":"f9e71cfe7fd498660704bc60726e11799faf826c","commercialScore":0,"negativeRegularScore":0,"negativeScore":0,"positiveScore":0,"score":0,"grade":""},{"date":20200826,"state":"NV","positive":66666,"probableCases":null,"negative":514489,"pending":null,"totalTestResultsSource":"totalTestEncountersViral","totalTestResults":807391,"hospitalizedCurrently":761,"hospitalizedCumulative":null,"inIcuCurrently":211,"inIcuCumulative":null,"onVentilatorCurrently":118,"onVentilatorCumulative":null,"recovered":1705,"dataQualityGrade":"A+","lastUpdateEt":"8/26/2020 13:00","dateModified":"2020-08-26T13:00:00Z","checkTimeEt":"08/26 09:00","death":1250,"hospitalized":null,"dateChecked":"2020-08-26T13:00:00Z","totalTestsViral":823189,"positiveTestsViral":null,"negativeTestsViral":null,"positiveCasesViral":66666,"deathConfirmed":null,"deathProbable":null,"totalTestEncountersViral":807391,"totalTestsPeopleViral":580996,"totalTestsAntibody":null,"positiveTestsAntibody":null,"negativeTestsAntibody":null,"totalTestsPeopleAntibody":null,"positiveTestsPeopleAntibody":null,"negativeTestsPeopleAntibody":null,"totalTestsPeopleAntigen":null,"positiveTestsPeopleAntigen":null,"totalTestsAntigen":null,"positiveTestsAntigen":null,"fips":"32","positiveIncrease":253,"negativeIncrease":1620,"total":581155,"totalTestResultsIncrease":7626,"posNeg":581155,"deathIncrease":20,"hospitalizedIncrease":0,"hash":"64a5c57ac46bd0544eea4a67b2d50778cc09a8c5","commercialScore":0,"negativeRegularScore":0,"negativeScore":0,"positiveScore":0,"score":0,"grade":""},{"date":20200825,"state":"NV","positive":66413,"probableCases":null,"negative":512869,"pending":null,"totalTestResultsSource":"totalTestEncountersViral","totalTestResults":799765,"hospitalizedCurrently":772,"hospitalizedCumulative":null,"inIcuCurrently":216,"inIcuCumulative":null,"onVentilatorCurrently":122,"onVentilatorCumulative":null,"recovered":1672,"dataQualityGrade":"A+","lastUpdateEt":"8/25/2020 02:59","dateModified":"2020-08-25T02:59:00Z","checkTimeEt":"08/24 22:59","death":1230,"hospitalized":null,"dateChecked":"2020-08-25T02:59:00Z","totalTestsViral":819782,"positiveTestsViral":null,"negativeTestsViral":null,"positiveCasesViral":66413,"deathConfirmed":null,"deathProbable":null,"totalTestEncountersViral":799765,"totalTestsPeopleViral":579176,"totalTestsAntibody":null,"positiveTestsAntibody":null,"negativeTestsAntibody":null,"totalTestsPeopleAntibody":null,"positiveTestsPeopleAntibody":null,"negativeTestsPeopleAntibody":null,"totalTestsPeopleAntigen":null,"positiveTestsPeopleAntigen":null,"totalTestsAntigen":null,"positiveTestsAntigen":null,"fips":"32","positiveIncrease":403,"negativeIncrease":2202,"total":579282,"totalTestResultsIncrease":5618,"posNeg":579282,"deathIncrease":30,"hospitalizedIncrease":0,"hash":"2a402af7f4b324ed8a3a9ace60623bbb5df52423","commercialScore":0,"negativeRegularScore":0,"negativeScore":0,"positiveScore":0,"score":0,"grade":""},{"date":20200824,"state":"NV","positive":66010,"probableCases":null,"negative":510667,"pending":null,"totalTestResultsSource":"totalTestEncountersViral","totalTestResults":794147,"hospitalizedCurrently":771,"hospitalizedCumulative":null,"inIcuCurrently":229,"inIcuCumulative":null,"onVentilatorCurrently":126,"onVentilatorCumulative":null,"recovered":1611,"dataQualityGrade":"A+","lastUpdateEt":"8/24/2020 02:59","dateModified":"2020-08-24T02:59:00Z","checkTimeEt":"08/23 22:59","death":1200,"hospitalized":null,"dateChecked":"2020-08-24T02:59:00Z","totalTestsViral":814793,"positiveTestsViral":null,"negativeTestsViral":null,"positiveCasesViral":66010,"deathConfirmed":null,"deathProbable":null,"totalTestEncountersViral":794147,"totalTestsPeopleViral":576621,"totalTestsAntibody":null,"positiveTestsAntibody":null,"negativeTestsAntibody":null,"totalTestsPeopleAntibody":null,"positiveTestsPeopleAntibody":null,"negativeTestsPeopleAntibody":null,"totalTestsPeopleAntigen":null,"positiveTestsPeopleAntigen":null,"totalTestsAntigen":null,"positiveTestsAntigen":null,"fips":"32","positiveIncrease":409,"negativeIncrease":2039,"total":576677,"totalTestResultsIncrease":1569,"posNeg":576677,"deathIncrease":3,"hospitalizedIncrease":0,"hash":"2d2c78896322d543641a68c90b63a48281f4f356","commercialScore":0,"negativeRegularScore":0,"negativeScore":0,"positiveScore":0,"score":0,"grade":""},{"date":20200823,"state":"NV","positive":65601,"probableCases":null,"negative":508628,"pending":null,"totalTestResultsSource":"totalTestEncountersViral","totalTestResults":792578,"hospitalizedCurrently":825,"hospitalizedCumulative":null,"inIcuCurrently":247,"inIcuCumulative":null,"onVentilatorCurre