[{"date":20201030,"state":"RI","positive":32874,"probableCases":null,"negative":400002,"pending":null,"totalTestResultsSource":"totalTestEncountersViral","totalTestResults":1124307,"hospitalizedCurrently":152,"hospitalizedCumulative":3309,"inIcuCurrently":15,"inIcuCumulative":null,"onVentilatorCurrently":9,"onVentilatorCumulative":null,"recovered":2763,"dataQualityGrade":"A+","lastUpdateEt":"10/30/2020 12:00","dateModified":"2020-10-30T12:00:00Z","checkTimeEt":"10/30 08:00","death":1201,"hospitalized":3309,"dateChecked":"2020-10-30T12:00:00Z","totalTestsViral":null,"positiveTestsViral":43648,"negativeTestsViral":1080659,"positiveCasesViral":32874,"deathConfirmed":null,"deathProbable":null,"totalTestEncountersViral":1124307,"totalTestsPeopleViral":432876,"totalTestsAntibody":null,"positiveTestsAntibody":null,"negativeTestsAntibody":null,"totalTestsPeopleAntibody":null,"positiveTestsPeopleAntibody":null,"negativeTestsPeopleAntibody":null,"totalTestsPeopleAntigen":null,"positiveTestsPeopleAntigen":null,"totalTestsAntigen":null,"positiveTestsAntigen":null,"fips":"44","positiveIncrease":562,"negativeIncrease":2974,"total":432876,"totalTestResultsIncrease":17925,"posNeg":432876,"deathIncrease":6,"hospitalizedIncrease":37,"hash":"9a7238a3923bac50e0a33f373fff3910a28ecdd7","commercialScore":0,"negativeRegularScore":0,"negativeScore":0,"positiveScore":0,"score":0,"grade":""},{"date":20201029,"state":"RI","positive":32312,"probableCases":null,"negative":397028,"pending":null,"totalTestResultsSource":"totalTestEncountersViral","totalTestResults":1106382,"hospitalizedCurrently":139,"hospitalizedCumulative":3272,"inIcuCurrently":16,"inIcuCumulative":null,"onVentilatorCurrently":9,"onVentilatorCumulative":null,"recovered":2741,"dataQualityGrade":"A+","lastUpdateEt":"10/29/2020 12:00","dateModified":"2020-10-29T12:00:00Z","checkTimeEt":"10/29 08:00","death":1195,"hospitalized":3272,"dateChecked":"2020-10-29T12:00:00Z","totalTestsViral":null,"positiveTestsViral":43038,"negativeTestsViral":1063344,"positiveCasesViral":32312,"deathConfirmed":null,"deathProbable":null,"totalTestEncountersViral":1106382,"totalTestsPeopleViral":429340,"totalTestsAntibody":null,"positiveTestsAntibody":null,"negativeTestsAntibody":null,"totalTestsPeopleAntibody":null,"positiveTestsPeopleAntibody":null,"negativeTestsPeopleAntibody":null,"totalTestsPeopleAntigen":null,"positiveTestsPeopleAntigen":null,"totalTestsAntigen":null,"positiveTestsAntigen":null,"fips":"44","positiveIncrease":368,"negativeIncrease":2617,"total":429340,"totalTestResultsIncrease":14394,"posNeg":429340,"deathIncrease":3,"hospitalizedIncrease":16,"hash":"826b63c2ba1f5cac106a425f7c8c314ee02a281a","commercialScore":0,"negativeRegularScore":0,"negativeScore":0,"positiveScore":0,"score":0,"grade":""},{"date":20201028,"state":"RI","positive":31944,"probableCases":null,"negative":394411,"pending":null,"totalTestResultsSource":"totalTestEncountersViral","totalTestResults":1091988,"hospitalizedCurrently":136,"hospitalizedCumulative":3256,"inIcuCurrently":18,"inIcuCumulative":null,"onVentilatorCurrently":8,"onVentilatorCumulative":null,"recovered":2729,"dataQualityGrade":"A+","lastUpdateEt":"10/28/2020 12:00","dateModified":"2020-10-28T12:00:00Z","checkTimeEt":"10/28 08:00","death":1192,"hospitalized":3256,"dateChecked":"2020-10-28T12:00:00Z","totalTestsViral":null,"positiveTestsViral":42535,"negativeTestsViral":1049453,"positiveCasesViral":31944,"deathConfirmed":null,"deathProbable":null,"totalTestEncountersViral":1091988,"totalTestsPeopleViral":426355,"totalTestsAntibody":null,"positiveTestsAntibody":null,"negativeTestsAntibody":null,"totalTestsPeopleAntibody":null,"positiveTestsPeopleAntibody":null,"negativeTestsPeopleAntibody":null,"totalTestsPeopleAntigen":null,"positiveTestsPeopleAntigen":null,"totalTestsAntigen":null,"positiveTestsAntigen":null,"fips":"44","positiveIncrease":499,"negativeIncrease":2387,"total":426355,"totalTestResultsIncrease":14318,"posNeg":426355,"deathIncrease":4,"hospitalizedIncrease":27,"hash":"a6339e5e8c56ac3ad700b680d7ebf6126e81649b","commercialScore":0,"negativeRegularScore":0,"negativeScore":0,"positiveScore":0,"score":0,"grade":""},{"date":20201027,"state":"RI","positive":31445,"probableCases":null,"negative":392024,"pending":null,"totalTestResultsSource":"totalTestEncountersViral","totalTestResults":1077670,"hospitalizedCurrently":168,"hospitalizedCumulative":3229,"inIcuCurrently":14,"inIcuCumulative":null,"onVentilatorCurrently":8,"onVentilatorCumulative":null,"recovered":2672,"dataQualityGrade":"A+","lastUpdateEt":"10/27/2020 12:00","dateModified":"2020-10-27T12:00:00Z","checkTimeEt":"10/27 08:00","death":1188,"hospitalized":3229,"dateChecked":"2020-10-27T12:00:00Z","totalTestsViral":null,"positiveTestsViral":41994,"negativeTestsViral":1035676,"positiveCasesViral":31445,"deathConfirmed":null,"deathProbable":null,"totalTestEncountersViral":1077670,"totalTestsPeopleViral":423469,"totalTestsAntibody":null,"positiveTestsAntibody":null,"negativeTestsAntibody":null,"totalTestsPeopleAntibody":null,"positiveTestsPeopleAntibody":null,"negativeTestsPeopleAntibody":null,"totalTestsPeopleAntigen":null,"positiveTestsPeopleAntigen":null,"totalTestsAntigen":null,"positiveTestsAntigen":null,"fips":"44","positiveIncrease":421,"negativeIncrease":3156,"total":423469,"totalTestResultsIncrease":10528,"posNeg":423469,"deathIncrease":4,"hospitalizedIncrease":21,"hash":"6b85d4c9e03c45f26de9acc50e006c8e945a87a6","commercialScore":0,"negativeRegularScore":0,"negativeScore":0,"positiveScore":0,"score":0,"grade":""},{"date":20201026,"state":"RI","positive":31024,"probableCases":null,"negative":388868,"pending":null,"totalTestResultsSource":"totalTestEncountersViral","totalTestResults":1067142,"hospitalizedCurrently":163,"hospitalizedCumulative":3208,"inIcuCurrently":14,"inIcuCumulative":null,"onVentilatorCurrently":8,"onVentilatorCumulative":null,"recovered":2658,"dataQualityGrade":"A+","lastUpdateEt":"10/26/2020 12:00","dateModified":"2020-10-26T12:00:00Z","checkTimeEt":"10/26 08:00","death":1184,"hospitalized":3208,"dateChecked":"2020-10-26T12:00:00Z","totalTestsViral":null,"positiveTestsViral":41572,"negativeTestsViral":1025570,"positiveCasesViral":31024,"deathConfirmed":null,"deathProbable":null,"totalTestEncountersViral":1067142,"totalTestsPeopleViral":419892,"totalTestsAntibody":null,"positiveTestsAntibody":null,"negativeTestsAntibody":null,"totalTestsPeopleAntibody":null,"positiveTestsPeopleAntibody":null,"negativeTestsPeopleAntibody":null,"totalTestsPeopleAntigen":null,"positiveTestsPeopleAntigen":null,"totalTestsAntigen":null,"positiveTestsAntigen":null,"fips":"44","positiveIncrease":167,"negativeIncrease":1305,"total":419892,"totalTestResultsIncrease":3925,"posNeg":419892,"deathIncrease":1,"hospitalizedIncrease":0,"hash":"edeb50282dcb5fbfb6bf3ae40dd53b65ae0f36cd","commercialScore":0,"negativeRegularScore":0,"negativeScore":0,"positiveScore":0,"score":0,"grade":""},{"date":20201025,"state":"RI","positive":30857,"probableCases":null,"negative":387563,"pending":null,"totalTestResultsSource":"totalTestEncountersViral","totalTestResults":1063217,"hospitalizedCurrently":163,"hospitalizedCumulative":3208,"inIcuCurrently":14,"inIcuCumulative":null,"onVentilatorCurrently":8,"onVentilatorCumulative":null,"recovered":2658,"dataQualityGrade":"A+","lastUpdateEt":"10/26/2020 13:53","dateModified":"2020-10-26T13:53:00Z","checkTimeEt":"10/26 09:53","death":1183,"hospitalized":3208,"dateChecked":"2020-10-26T13:53:00Z","totalTestsViral":null,"positiveTestsViral":41380,"negativeTestsViral":1021837,"positiveCasesViral":30857,"deathConfirmed":null,"deathProbable":null,"totalTestEncountersViral":1063217,"totalTestsPeopleViral":418420,"totalTestsAntibody":null,"positiveTestsAntibody":null,"negativeTestsAntibody":null,"totalTestsPeopleAntibody":null,"positiveTestsPeopleAntibody":null,"negativeTestsPeopleAntibody":null,"totalTestsPeopleAntigen":null,"positiveTestsPeopleAntigen":null,"totalTestsAntigen":null,"positiveTestsAntigen":null,"fips":"44","positiveIncrease":274,"negativeIncrease":2071,"total":418420,"totalTestResultsIncrease":9963,"posNeg":418420,"deathIncrease":0,"hospitalizedIncrease":11,"hash":"7c1ab119e9dbf722cefc62e98399040dfde1574a","commercialScore":0,"negativeRegularScore":0,"negativeScore":0,"positiveScore":0,"score":0,"grade":""},{"date":20201024,"state":"RI","positive":30583,"probableCases":null,"negative":385492,"pending":null,"totalTestResultsSource":"totalTestEncountersViral","totalTestResults":1053254,"hospitalizedCurrently":163,"hospitalizedCumulative":3197,"inIcuCurrently":15,"inIcuCumulative":null,"onVentilatorCurrently":9,"onVentilatorCumulative":null,"recovered":2647,"dataQualityGrade":"A+","lastUpdateEt":"10/26/2020 13:53","dateModified":"2020-10-26T13:53:00Z","checkTimeEt":"10/26 09:53","death":1183,"hospitalized":3197,"dateChecked":"2020-10-26T13:53:00Z","totalTestsViral":null,"positiveTestsViral":41054,"negativeTestsViral":1012200,"positiveCasesViral":30583,"deathConfirmed":null,"deathProbable":null,"totalTestEncountersViral":1053254,"totalTestsPeopleViral":416075,"totalTestsAntibody":null,"positiveTestsAntibody":null,"negativeTestsAntibody":null,"totalTestsPeopleAntibody":null,"positiveTestsPeopleAntibody":null,"negativeTestsPeopleAntibody":null,"totalTestsPeopleAntigen":null,"positiveTestsPeopleAntigen":null,"totalTestsAntigen":null,"positiveTestsAntigen":null,"fips":"44","positiveIncrease":465,"negativeIncrease":2760,"total":416075,"totalTestResultsIncrease":18682,"posNeg":416075,"deathIncrease":6,"hospitalizedIncrease":71,"hash":"08f28f2dedea4f1feca4505ec00af1839e560533","commercialScore":0,"negativeRegularScore":0,"negativeScore":0,"positiveScore":0,"score":0,"grade":""},{"date":20201023,"state":"RI","positive":30118,"probableCases":null,"negative":382732,"pending":null,"totalTestResultsSource":"totalTestEncountersViral","totalTestResults":1034572,"hospitalizedCurrently":140,"hospitalizedCumulative":3126,"inIcuCurrently":13,"inIcuCumulative":null,"onVentilatorCurrently":9,"onVentilatorCumulative":null,"recovered":2602,"dataQualityGrade":"A+","lastUpdateEt":"10/23/2020 12:00","dateModified":"2020-10-23T12:00:00Z","checkTimeEt":"10/23 08:00","death":1177,"hospitalized":3126,"dateChecked":"2020-10-23T12:00:00Z","totalTestsViral":null,"positiveTestsViral":40550,"negativeTestsViral":994022,"positiveCasesViral":30118,"deathConfirmed":null,"deathProbable":null,"totalTestEncountersViral":1034572,"totalTestsPeopleViral":412850,"totalTestsAntibody":null,"positiveTestsAntibody":null,"negativeTestsAntibody":null,"totalTestsPeopleAntibody":null,"positiveTestsPeopleAntibody":null,"negativeTestsPeopleAntibody":null,"totalTestsPeopleAntigen":null,"positiveTestsPeopleAntigen":null,"totalTestsAntigen":null,"positiveTestsAntigen":null,"fips":"44","positiveIncrease":524,"negativeIncrease":4024,"total":412850,"totalTestResultsIncrease":18852,"posNeg":412850,"deathIncrease":4,"hospitalizedIncrease":10,"hash":"0c96a49e30dfb615e1eb58e620f8d8b18ec81cdc","commercialScore":0,"negativeRegularScore":0,"negativeScore":0,"positiveScore":0,"score":0,"grade":""},{"date":20201022,"state":"RI","positive":29594,"probableCases":null,"negative":378708,"pending":null,"totalTestResultsSource":"totalTestEncountersViral","totalTestResults":1015720,"hospitalizedCurrently":140,"hospitalizedCumulative":3116,"inIcuCurrently":13,"inIcuCumulative":null,"onVentilatorCurrently":8,"onVentilatorCumulative":null,"recovered":2595,"dataQualityGrade":"A+","lastUpdateEt":"10/22/2020 12:00","dateModified":"2020-10-22T12:00:00Z","checkTimeEt":"10/22 08:00","death":1173,"hospitalized":3116,"dateChecked":"2020-10-22T12:00:00Z","totalTestsViral":null,"positiveTestsViral":39816,"negativeTestsViral":975904,"positiveCasesViral":29594,"deathConfirmed":null,"deathProbable":null,"totalTestEncountersViral":1015720,"totalTestsPeopleViral":408302,"totalTestsAntibody":null,"positiveTestsAntibody":null,"negativeTestsAntibody":null,"totalTestsPeopleAntibody":null,"positiveTestsPeopleAntibody":null,"negativeTestsPeopleAntibody":null,"totalTestsPeopleAntigen":null,"positiveTestsPeopleAntigen":null,"totalTestsAntigen":null,"positiveTestsAntigen":null,"fips":"44","positiveIncrease":471,"negativeIncrease":3151,"total":408302,"totalTestResultsIncrease":17160,"posNeg":408302,"deathIncrease":4,"hospitalizedIncrease":25,"hash":"7e8548194338778f0a9289aea975f4797952d9db","commercialScore":0,"negativeRegularScore":0,"negativeScore":0,"positiveScore":0,"score":0,"grade":""},{"date":20201021,"state":"RI","positive":29123,"probableCases":null,"negative":375557,"pending":null,"totalTestResultsSource":"totalTestEncountersViral","totalTestResults":998560,"hospitalizedCurrently":130,"hospitalizedCumulative":3091,"inIcuCurrently":14,"inIcuCumulative":null,"onVentilatorCurrently":6,"onVentilatorCumulative":null,"recovered":2580,"dataQualityGrade":"A+","lastUpdateEt":"10/21/2020 12:00","dateModified":"2020-10-21T12:00:00Z","checkTimeEt":"10/21 08:00","death":1169,"hospitalized":3091,"dateChecked":"2020-10-21T12:00:00Z","totalTestsViral":null,"positiveTestsViral":39324,"negativeTestsViral":959236,"positiveCasesViral":29123,"deathConfirmed":null,"deathProbable":null,"totalTestEncountersViral":998560,"totalTestsPeopleViral":404680,"totalTestsAntibody":null,"positiveTestsAntibody":null,"negativeTestsAntibody":null,"totalTestsPeopleAntibody":null,"positiveTestsPeopleAntibody":null,"negativeTestsPeopleAntibody":null,"totalTestsPeopleAntigen":null,"positiveTestsPeopleAntigen":null,"totalTestsAntigen":null,"positiveTestsAntigen":null,"fips":"44","positiveIncrease":474,"negativeIncrease":3151,"total":404680,"totalTestResultsIncrease":13240,"posNeg":404680,"deathIncrease":5,"hospitalizedIncrease":19,"hash":"10d298f0e0ee0e55c894cdd727b7840e4a5558e2","commercialScore":0,"negativeRegularScore":0,"negativeScore":0,"positiveScore":0,"score":0,"grade":""},{"date":20201020,"state":"RI","positive":28649,"probableCases":null,"negative":372406,"pending":null,"totalTestResultsSource":"totalTestEncountersViral","totalTestResults":985320,"hospitalizedCurrently":135,"hospitalizedCumulative":3072,"inIcuCurrently":16,"inIcuCumulative":null,"onVentilatorCurrently":6,"onVentilatorCumulative":null,"recovered":2558,"dataQualityGrade":"A+","lastUpdateEt":"10/20/2020 12:00","dateModified":"2020-10-20T12:00:00Z","checkTimeEt":"10/20 08:00","death":1164,"hospitalized":3072,"dateChecked":"2020-10-20T12:00:00Z","totalTestsViral":null,"positiveTestsViral":38826,"negativeTestsViral":946494,"positiveCasesViral":28649,"deathConfirmed":null,"deathProbable":null,"totalTestEncountersViral":985320,"totalTestsPeopleViral":401055,"totalTestsAntibody":null,"positiveTestsAntibody":null,"negativeTestsAntibody":null,"totalTestsPeopleAntibody":null,"positiveTestsPeopleAntibody":null,"negativeTestsPeopleAntibody":null,"totalTestsPeopleAntigen":null,"positiveTestsPeopleAntigen":null,"totalTestsAntigen":null,"positiveTestsAntigen":null,"fips":"44","positiveIncrease":302,"negativeIncrease":1427,"total":401055,"totalTestResultsIncrease":7409,"posNeg":401055,"deathIncrease":5,"hospitalizedIncrease":22,"hash":"ff34ff9b744379a4012d061cbc8640bb8b2e7ba5","commercialScore":0,"negativeRegularScore":0,"negativeScore":0,"positiveScore":0,"score":0,"grade":""},{"date":20201019,"state":"RI","positive":28347,"probableCases":null,"negative":370979,"pending":null,"totalTestResultsSource":"totalTestEncountersViral","totalTestResults":977911,"hospitalizedCurrently":124,"hospitalizedCumulative":3050,"inIcuCurrently":16,"inIcuCumulative":null,"onVentilatorCurrently":4,"onVentilatorCumulative":null,"recovered":2546,"dataQualityGrade":"A+","lastUpdateEt":"10/19/2020 12:00","dateModified":"2020-10-19T12:00:00Z","checkTimeEt":"10/19 08:00","death":1159,"hospitalized":3050,"dateChecked":"2020-10-19T12:00:00Z","totalTestsViral":null,"positiveTestsViral":38619,"negativeTestsViral":939292,"positiveCasesViral":28347,"deathConfirmed":null,"deathProbable":null,"totalTestEncountersViral":977911,"totalTestsPeopleViral":399326,"totalTestsAntibody":null,"positiveTestsAntibody":null,"negativeTestsAntibody":null,"totalTestsPeopleAntibody":null,"positiveTestsPeopleAntibody":null,"negativeTestsPeopleAntibody":null,"totalTestsPeopleAntigen":null,"positiveTestsPeopleAntigen":null,"totalTestsAntigen":null,"positiveTestsAntigen":null,"fips":"44","positiveIncrease":85,"negativeIncrease":1017,"total":399326,"totalTestResultsIncrease":2927,"posNeg":399326,"deathIncrease":1,"hospitalizedIncrease":0,"hash":"8107c6a77329fdaa7417264bea3c417c1f88306b","commercialScore":0,"negativeRegularScore":0,"negativeScore":0,"positiveScore":0,"score":0,"grade":""},{"date":20201018,"state":"RI","positive":28262,"probableCases":null,"negative":369962,"pending":null,"totalTestResultsSource":"totalTestEncountersViral","totalTestResults":974984,"hospitalizedCurrently":124,"hospitalizedCumulative":3050,"inIcuCurrently":16,"inIcuCumulative":null,"onVentilatorCurrently":4,"onVentilatorCumulative":null,"recovered":2546,"dataQualityGrade":"A+","lastUpdateEt":"10/19/2020 12:08","dateModified":"2020-10-19T12:08:00Z","checkTimeEt":"10/19 08:08","death":1158,"hospitalized":3050,"dateChecked":"2020-10-19T12:08:00Z","totalTestsViral":null,"positiveTestsViral":38515,"negativeTestsViral":936469,"positiveCasesViral":28262,"deathConfirmed":null,"deathProbable":null,"totalTestEncountersViral":974984,"totalTestsPeopleViral":398224,"totalTestsAntibody":null,"positiveTestsAntibody":null,"negativeTestsAntibody":null,"totalTestsPeopleAntibody":null,"positiveTestsPeopleAntibody":null,"negativeTestsPeopleAntibody":null,"totalTestsPeopleAntigen":null,"positiveTestsPeopleAntigen":null,"totalTestsAntigen":null,"positiveTestsAntigen":null,"fips":"44","positiveIncrease":284,"negativeIncrease":3166,"total":398224,"totalTestResultsIncrease":13977,"posNeg":398224,"deathIncrease":0,"hospitalizedIncrease":11,"hash":"2713fc9dd743a31e253344d498be9c676fc29535","commercialScore":0,"negativeRegularScore":0,"negativeScore":0,"positiveScore":0,"score":0,"grade":""},{"date":20201017,"state":"RI","positive":27978,"probableCases":null,"negative":366796,"pending":null,"totalTestResultsSource":"totalTestEncountersViral","totalTestResults":961007,"hospitalizedCurrently":125,"hospitalizedCumulative":3039,"inIcuCurrently":13,"inIcuCumulative":null,"onVentilatorCurrently":4,"onVentilatorCumulative":null,"recovered":2535,"dataQualityGrade":"A+","lastUpdateEt":"10/19/2020 12:08","dateModified":"2020-10-19T12:08:00Z","checkTimeEt":"10/19 08:08","death":1158,"hospitalized":3039,"dateChecked":"2020-10-19T12:08:00Z","totalTestsViral":null,"positiveTestsViral":38180,"negativeTestsViral":922827,"positiveCasesViral":27978,"deathConfirmed":null,"deathProbable":null,"totalTestEncountersViral":961007,"totalTestsPeopleViral":394774,"totalTestsAntibody":null,"positiveTestsAntibody":null,"negativeTestsAntibody":null,"totalTestsPeopleAntibody":null,"positiveTestsPeopleAntibody":null,"negativeTestsPeopleAntibody":null,"totalTestsPeopleAntigen":null,"positiveTestsPeopleAntigen":null,"totalTestsAntigen":null,"positiveTestsAntigen":null,"fips":"44","positiveIncrease":287,"negativeIncrease":4310,"total":394774,"totalTestResultsIncrease":25384,"posNeg":394774,"deathIncrease":6,"hospitalizedIncrease":24,"hash":"c6a48372869ab11c286bdd1ea36772bc6f73e35d","commercialScore":0,"negativeRegularScore":0,"negativeScore":0,"positiveScore":0,"score":0,"grade":""},{"date":20201016,"state":"RI","positive":27691,"probableCases":null,"negative":362486,"pending":null,"totalTestResultsSource":"totalTestEncountersViral","totalTestResults":935623,"hospitalizedCurrently":137,"hospitalizedCumulative":3015,"inIcuCurrently":14,"inIcuCumulative":null,"onVentilatorCurrently":5,"onVentilatorCumulative":null,"recovered":2501,"dataQualityGrade":"A+","lastUpdateEt":"10/16/2020 12:00","dateModified":"2020-10-16T12:00:00Z","checkTimeEt":"10/16 08:00","death":1152,"hospitalized":3015,"dateChecked":"2020-10-16T12:00:00Z","totalTestsViral":null,"positiveTestsViral":37843,"negativeTestsViral":897780,"positiveCasesViral":27691,"deathConfirmed":null,"deathProbable":null,"totalTestEncountersViral":935623,"totalTestsPeopleViral":390177,"totalTestsAntibody":null,"positiveTestsAntibody":null,"negativeTestsAntibody":null,"totalTestsPeopleAntibody":null,"positiveTestsPeopleAntibody":null,"negativeTestsPeopleAntibody":null,"totalTestsPeopleAntigen":null,"positiveTestsPeopleAntigen":null,"totalTestsAntigen":null,"positiveTestsAntigen":null,"fips":"44","positiveIncrease":253,"negativeIncrease":3148,"total":390177,"totalTestResultsIncrease":8439,"posNeg":390177,"deathIncrease":3,"hospitalizedIncrease":16,"hash":"f17a99d8cae20044bfdad576403b20c68f251273","commercialScore":0,"negativeRegularScore":0,"negativeScore":0,"positiveScore":0,"score":0,"grade":""},{"date":20201015,"state":"RI","positive":27438,"probableCases":null,"negative":359338,"pending":null,"totalTestResultsSource":"totalTestEncountersViral","totalTestResults":927184,"hospitalizedCurrently":129,"hospitalizedCumulative":2999,"inIcuCurrently":12,"inIcuCumulative":null,"onVentilatorCurrently":5,"onVentilatorCumulative":null,"recovered":2493,"dataQualityGrade":"A+","lastUpdateEt":"10/15/2020 12:00","dateModified":"2020-10-15T12:00:00Z","checkTimeEt":"10/15 08:00","death":1149,"hospitalized":2999,"dateChecked":"2020-10-15T12:00:00Z","totalTestsViral":null,"positiveTestsViral":37600,"negativeTestsViral":889584,"positiveCasesViral":27438,"deathConfirmed":null,"deathProbable":null,"totalTestEncountersViral":927184,"totalTestsPeopleViral":386776,"totalTestsAntibody":null,"positiveTestsAntibody":null,"negativeTestsAntibody":null,"totalTestsPeopleAntibody":null,"positiveTestsPeopleAntibody":null,"negativeTestsPeopleAntibody":null,"totalTestsPeopleAntigen":null,"positiveTestsPeopleAntigen":null,"totalTestsAntigen":null,"positiveTestsAntigen":null,"fips":"44","positiveIncrease":274,"negativeIncrease":3439,"total":386776,"totalTestResultsIncrease":14925,"posNeg":386776,"deathIncrease":2,"hospitalizedIncrease":15,"hash":"3263e6ebe8a6588fcecbbc7c52ae1f8ee87e0b80","commercialScore":0,"negativeRegularScore":0,"negativeScore":0,"positiveScore":0,"score":0,"grade":""},{"date":20201014,"state":"RI","positive":27164,"probableCases":null,"negative":355899,"pending":null,"totalTestResultsSource":"totalTestEncountersViral","totalTestResults":912259,"hospitalizedCurrently":131,"hospitalizedCumulative":2984,"inIcuCurrently":13,"inIcuCumulative":null,"onVentilatorCurrently":4,"onVentilatorCumulative":null,"recovered":2481,"dataQualityGrade":"A+","lastUpdateEt":"10/14/2020 12:00","dateModified":"2020-10-14T12:00:00Z","checkTimeEt":"10/14 08:00","death":1147,"hospitalized":2984,"dateChecked":"2020-10-14T12:00:00Z","totalTestsViral":null,"positiveTestsViral":37306,"negativeTestsViral":874953,"positiveCasesViral":27164,"deathConfirmed":null,"deathProbable":null,"totalTestEncountersViral":912259,"totalTestsPeopleViral":383063,"totalTestsAntibody":null,"positiveTestsAntibody":null,"negativeTestsAntibody":null,"totalTestsPeopleAntibody":null,"positiveTestsPeopleAntibody":null,"negativeTestsPeopleAntibody":null,"totalTestsPeopleAntigen":null,"positiveTestsPeopleAntigen":null,"totalTestsAntigen":null,"positiveTestsAntigen":null,"fips":"44","positiveIncrease":204,"negativeIncrease":2165,"total":383063,"totalTestResultsIncrease":6610,"posNeg":383063,"deathIncrease":8,"hospitalizedIncrease":23,"hash":"cfdf01281aef6aa5fd3b5b73057bf301c4d9eddc","commercialScore":0,"negativeRegularScore":0,"negativeScore":0,"positiveScore":0,"score":0,"grade":""},{"date":20201013,"state":"RI","positive":26960,"probableCases":null,"negative":353734,"pending":null,"totalTestResultsSource":"totalTestEncountersViral","totalTestResults":905649,"hospitalizedCurrently":126,"hospitalizedCumulative":2961,"inIcuCurrently":13,"inIcuCumulative":null,"onVentilatorCurrently":4,"onVentilatorCumulative":null,"recovered":2463,"dataQualityGrade":"A+","lastUpdateEt":"10/13/2020 12:00","dateModified":"2020-10-13T12:00:00Z","checkTimeEt":"10/13 08:00","death":1139,"hospitalized":2961,"dateChecked":"2020-10-13T12:00:00Z","totalTestsViral":null,"positiveTestsViral":37099,"negativeTestsViral":868550,"positiveCasesViral":26960,"deathConfirmed":null,"deathProbable":null,"totalTestEncountersViral":905649,"totalTestsPeopleViral":380694,"totalTestsAntibody":null,"positiveTestsAntibody":null,"negativeTestsAntibody":null,"totalTestsPeopleAntibody":null,"positiveTestsPeopleAntibody":null,"negativeTestsPeopleAntibody":null,"totalTestsPeopleAntigen":null,"positiveTestsPeopleAntigen":null,"totalTestsAntigen":null,"positiveTestsAntigen":null,"fips":"44","positiveIncrease":129,"negativeIncrease":1465,"total":380694,"totalTestResultsIncrease":5855,"posNeg":380694,"deathIncrease":2,"hospitalizedIncrease":0,"hash":"fa693b43e4f915147c8b6684ae245c4ada945afb","commercialScore":0,"negativeRegularScore":0,"negativeScore":0,"positiveScore":0,"score":0,"grade":""},{"date":20201012,"state":"RI","positive":26831,"probableCases":null,"negative":352269,"pending":null,"totalTestResultsSource":"totalTestEncountersViral","totalTestResults":899794,"hospitalizedCurrently":126,"hospitalizedCumulative":2961,"inIcuCurrently":13,"inIcuCumulative":null,"onVentilatorCurrently":4,"onVentilatorCumulative":null,"recovered":2463,"dataQualityGrade":"A+","lastUpdateEt":"10/12/2020 00:00","dateModified":"2020-10-12T00:00:00Z","checkTimeEt":"10/11 20:00","death":1137,"hospitalized":2961,"dateChecked":"2020-10-12T00:00:00Z","totalTestsViral":null,"positiveTestsViral":36959,"negativeTestsViral":862835,"positiveCasesViral":26831,"deathConfirmed":null,"deathProbable":null,"totalTestEncountersViral":899794,"totalTestsPeopleViral":379100,"totalTestsAntibody":null,"positiveTestsAntibody":null,"negativeTestsAntibody":null,"totalTestsPeopleAntibody":null,"positiveTestsPeopleAntibody":null,"negativeTestsPeopleAntibody":null,"totalTestsPeopleAntigen":null,"positiveTestsPeopleAntigen":null,"totalTestsAntigen":null,"positiveTestsAntigen":null,"fips":"44","positiveIncrease":81,"negativeIncrease":1169,"total":379100,"totalTestResultsIncrease":3344,"posNeg":379100,"deathIncrease":3,"hospitalizedIncrease":11,"hash":"fbecb18f941ad11f57f0102c3eaf7a08b93fdeab","commercialScore":0,"negativeRegularScore":0,"negativeScore":0,"positiveScore":0,"score":0,"grade":""},{"date":20201011,"state":"RI","positive":26750,"probableCases":null,"negative":351100,"pending":null,"totalTestResultsSource":"totalTestEncountersViral","totalTestResults":896450,"hospitalizedCurrently":125,"hospitalizedCumulative":2950,"inIcuCurrently":13,"inIcuCumulative":null,"onVentilatorCurrently":5,"onVentilatorCumulative":null,"recovered":2455,"dataQualityGrade":"A+","lastUpdateEt":"10/11/2020 00:00","dateModified":"2020-10-11T00:00:00Z","checkTimeEt":"10/10 20:00","death":1134,"hospitalized":2950,"dateChecked":"2020-10-11T00:00:00Z","totalTestsViral":null,"positiveTestsViral":36865,"negativeTestsViral":859585,"positiveCasesViral":26750,"deathConfirmed":null,"deathProbable":null,"totalTestEncountersViral":896450,"totalTestsPeopleViral":377850,"totalTestsAntibody":null,"positiveTestsAntibody":null,"negativeTestsAntibody":null,"totalTestsPeopleAntibody":null,"positiveTestsPeopleAntibody":null,"negativeTestsPeopleAntibody":null,"totalTestsPeopleAntigen":null,"positiveTestsPeopleAntigen":null,"totalTestsAntigen":null,"positiveTestsAntigen":null,"fips":"44","positiveIncrease":170,"negativeIncrease":3829,"total":377850,"totalTestResultsIncrease":13700,"posNeg":377850,"deathIncrease":2,"hospitalizedIncrease":16,"hash":"7f0ace4acad9f226f5727065072f348d6196fc92","commercialScore":0,"negativeRegularScore":0,"negativeScore":0,"positiveScore":0,"score":0,"grade":""},{"date":20201010,"state":"RI","positive":26580,"probableCases":null,"negative":347271,"pending":null,"totalTestResultsSource":"totalTestEncountersViral","totalTestResults":882750,"hospitalizedCurrently":119,"hospitalizedCumulative":2934,"inIcuCurrently":12,"inIcuCumulative":null,"onVentilatorCurrently":5,"onVentilatorCumulative":null,"recovered":2446,"dataQualityGrade":"A+","lastUpdateEt":"10/10/2020 00:00","dateModified":"2020-10-10T00:00:00Z","checkTimeEt":"10/09 20:00","death":1132,"hospitalized":2934,"dateChecked":"2020-10-10T00:00:00Z","totalTestsViral":null,"positiveTestsViral":36635,"negativeTestsViral":846115,"positiveCasesViral":26580,"deathConfirmed":null,"deathProbable":null,"totalTestEncountersViral":882750,"totalTestsPeopleViral":373851,"totalTestsAntibody":null,"positiveTestsAntibody":null,"negativeTestsAntibody":null,"totalTestsPeopleAntibody":null,"positiveTestsPeopleAntibody":null,"negativeTestsPeopleAntibody":null,"totalTestsPeopleAntigen":null,"positiveTestsPeopleAntigen":null,"totalTestsAntigen":null,"positiveTestsAntigen":null,"fips":"44","positiveIncrease":286,"negativeIncrease":5504,"total":373851,"totalTestResultsIncrease":18112,"posNeg":373851,"deathIncrease":2,"hospitalizedIncrease":32,"hash":"d45ac43eb91044c95c9cfd91f317ee42e2d29a68","commercialScore":0,"negativeRegularScore":0,"negativeScore":0,"positiveScore":0,"score":0,"grade":""},{"date":20201009,"state":"RI","positive":26294,"probableCases":null,"negative":341767,"pending":null,"totalTestResultsSource":"totalTestEncountersViral","totalTestResults":864638,"hospitalizedCurrently":112,"hospitalizedCumulative":2902,"inIcuCurrently":10,"inIcuCumulative":null,"onVentilatorCurrently":6,"onVentilatorCumulative":null,"recovered":2422,"dataQualityGrade":"A+","lastUpdateEt":"10/9/2020 12:00","dateModified":"2020-10-09T12:00:00Z","checkTimeEt":"10/09 08:00","death":1130,"hospitalized":2902,"dateChecked":"2020-10-09T12:00:00Z","totalTestsViral":null,"positiveTestsViral":36345,"negativeTestsViral":828293,"positiveCasesViral":26294,"deathConfirmed":null,"deathProbable":null,"totalTestEncountersViral":864638,"totalTestsPeopleViral":368061,"totalTestsAntibody":null,"positiveTestsAntibody":null,"negativeTestsAntibody":null,"totalTestsPeopleAntibody":null,"positiveTestsPeopleAntibody":null,"negativeTestsPeopleAntibody":null,"totalTestsPeopleAntigen":null,"positiveTestsPeopleAntigen":null,"totalTestsAntigen":null,"positiveTestsAntigen":null,"fips":"44","positiveIncrease":249,"negativeIncrease":3498,"total":368061,"totalTestResultsIncrease":5209,"posNeg":368061,"deathIncrease":3,"hospitalizedIncrease":13,"hash":"9f15eae2e8f3a25ddecc17f078f452215dc3a90d","commercialScore":0,"negativeRegularScore":0,"negativeScore":0,"positiveScore":0,"score":0,"grade":""},{"date":20201008,"state":"RI","positive":26045,"probableCases":null,"negative":338269,"pending":null,"totalTestResultsSource":"totalTestEncountersViral","totalTestResults":859429,"hospitalizedCurrently":117,"hospitalizedCumulative":2889,"inIcuCurrently":12,"inIcuCumulative":null,"onVentilatorCurrently":6,"onVentilatorCumulative":null,"recovered":2408,"dataQualityGrade":"A+","lastUpdateEt":"10/8/2020 12:00","dateModified":"2020-10-08T12:00:00Z","checkTimeEt":"10/08 08:00","death":1127,"hospitalized":2889,"dateChecked":"2020-10-08T12:00:00Z","totalTestsViral":null,"positiveTestsViral":36145,"negativeTestsViral":823284,"positiveCasesViral":26045,"deathConfirmed":null,"deathProbable":null,"totalTestEncountersViral":859429,"totalTestsPeopleViral":364314,"totalTestsAntibody":null,"positiveTestsAntibody":null,"negativeTestsAntibody":null,"totalTestsPeopleAntibody":null,"positiveTestsPeopleAntibody":null,"negativeTestsPeopleAntibody":null,"totalTestsPeopleAntigen":null,"positiveTestsPeopleAntigen":null,"totalTestsAntigen":null,"positiveTestsAntigen":null,"fips":"44","positiveIncrease":269,"negativeIncrease":6695,"total":364314,"totalTestResultsIncrease":20947,"posNeg":364314,"deathIncrease":1,"hospitalizedIncrease":16,"hash":"f858bf831bfe6d874a9897552d867754fc951911","commercialScore":0,"negativeRegularScore":0,"negativeScore":0,"positiveScore":0,"score":0,"grade":""},{"date":20201007,"state":"RI","positive":25776,"probableCases":null,"negative":331574,"pending":null,"totalTestResultsSource":"totalTestEncountersViral","totalTestResults":838482,"hospitalizedCurrently":107,"hospitalizedCumulative":2873,"inIcuCurrently":10,"inIcuCumulative":null,"onVentilatorCurrently":5,"onVentilatorCumulative":null,"recovered":2402,"dataQualityGrade":"A+","lastUpdateEt":"10/7/2020 12:00","dateModified":"2020-10-07T12:00:00Z","checkTimeEt":"10/07 08:00","death":1126,"hospitalized":2873,"dateChecked":"2020-10-07T12:00:00Z","totalTestsViral":null,"positiveTestsViral":35867,"negativeTestsViral":802615,"positiveCasesViral":25776,"deathConfirmed":null,"deathProbable":null,"totalTestEncountersViral":838482,"totalTestsPeopleViral":357350,"totalTestsAntibody":null,"positiveTestsAntibody":null,"negativeTestsAntibody":null,"totalTestsPeopleAntibody":null,"positiveTestsPeopleAntibody":null,"negativeTestsPeopleAntibody":null,"totalTestsPeopleAntigen":null,"positiveTestsPeopleAntigen":null,"totalTestsAntigen":null,"positiveTestsAntigen":null,"fips":"44","positiveIncrease":180,"negativeIncrease":3089,"total":357350,"totalTestResultsIncrease":10468,"posNeg":357350,"deathIncrease":1,"hospitalizedIncrease":24,"hash":"f4f4576d92a68f2538fc20b4f0f4ce09a424c051","commercialScore":0,"negativeRegularScore":0,"negativeScore":0,"positiveScore":0,"score":0,"grade":""},{"date":20201006,"state":"RI","positive":25596,"probableCases":null,"negative":328485,"pending":null,"totalTestResultsSource":"totalTestEncountersViral","totalTestResults":828014,"hospitalizedCurrently":93,"hospitalizedCumulative":2849,"inIcuCurrently":8,"inIcuCumulative":null,"onVentilatorCurrently":4,"onVentilatorCumulative":null,"recovered":2393,"dataQualityGrade":"A+","lastUpdateEt":"10/6/2020 12:00","dateModified":"2020-10-06T12:00:00Z","checkTimeEt":"10/06 08:00","death":1125,"hospitalized":2849,"dateChecked":"2020-10-06T12:00:00Z","totalTestsViral":null,"positiveTestsViral":35665,"negativeTestsViral":792349,"positiveCasesViral":25596,"deathConfirmed":null,"deathProbable":null,"totalTestEncountersViral":828014,"totalTestsPeopleViral":354081,"totalTestsAntibody":null,"positiveTestsAntibody":null,"negativeTestsAntibody":null,"totalTestsPeopleAntibody":null,"positiveTestsPeopleAntibody":null,"negativeTestsPeopleAntibody":null,"totalTestsPeopleAntigen":null,"positiveTestsPeopleAntigen":null,"totalTestsAntigen":null,"positiveTestsAntigen":null,"fips":"44","positiveIncrease":177,"negativeIncrease":2643,"total":354081,"totalTestResultsIncrease":7709,"posNeg":354081,"deathIncrease":4,"hospitalizedIncrease":14,"hash":"948d69e3ad079ea9700823f1a8c34bc4a6b936d4","commercialScore":0,"negativeRegularScore":0,"negativeScore":0,"positiveScore":0,"score":0,"grade":""},{"date":20201005,"state":"RI","positive":25419,"probableCases":null,"negative":325842,"pending":null,"totalTestResultsSource":"totalTestEncountersViral","totalTestResults":820305,"hospitalizedCurrently":92,"hospitalizedCumulative":2835,"inIcuCurrently":7,"inIcuCumulative":null,"onVentilatorCurrently":4,"onVentilatorCumulative":null,"recovered":2381,"dataQualityGrade":"A+","lastUpdateEt":"10/5/2020 12:00","dateModified":"2020-10-05T12:00:00Z","checkTimeEt":"10/05 08:00","death":1121,"hospitalized":2835,"dateChecked":"2020-10-05T12:00:00Z","totalTestsViral":null,"positiveTestsViral":35503,"negativeTestsViral":784802,"positiveCasesViral":25419,"deathConfirmed":null,"deathProbable":null,"totalTestEncountersViral":820305,"totalTestsPeopleViral":351261,"totalTestsAntibody":null,"positiveTestsAntibody":null,"negativeTestsAntibody":null,"totalTestsPeopleAntibody":null,"positiveTestsPeopleAntibody":null,"negativeTestsPeopleAntibody":null,"totalTestsPeopleAntigen":null,"positiveTestsPeopleAntigen":null,"totalTestsAntigen":null,"positiveTestsAntigen":null,"fips":"44","positiveIncrease":50,"negativeIncrease":641,"total":351261,"totalTestResultsIncrease":1553,"posNeg":351261,"deathIncrease":1,"hospitalizedIncrease":0,"hash":"9f1ab3c0c2553dcc7f2be89c7d8bf528fa8cdccd","commercialScore":0,"negativeRegularScore":0,"negativeScore":0,"positiveScore":0,"score":0,"grade":""},{"date":20201004,"state":"RI","positive":25369,"probableCases":null,"negative":325201,"pending":null,"totalTestResultsSource":"totalTestEncountersViral","totalTestResults":818752,"hospitalizedCurrently":92,"hospitalizedCumulative":2835,"inIcuCurrently":7,"inIcuCumulative":null,"onVentilatorCurrently":4,"onVentilatorCumulative":null,"recovered":2381,"dataQualityGrade":"A+","lastUpdateEt":"10/5/2020 12:00","dateModified":"2020-10-05T12:00:00Z","checkTimeEt":"10/05 08:00","death":1120,"hospitalized":2835,"dateChecked":"2020-10-05T12:00:00Z","totalTestsViral":null,"positiveTestsViral":35441,"negativeTestsViral":783311,"positiveCasesViral":25369,"deathConfirmed":null,"deathProbable":null,"totalTestEncountersViral":818752,"totalTestsPeopleViral":350570,"totalTestsAntibody":null,"positiveTestsAntibody":null,"negativeTestsAntibody":null,"totalTestsPeopleAntibody":null,"positiveTestsPeopleAntibody":null,"negativeTestsPeopleAntibody":null,"totalTestsPeopleAntigen":null,"positiveTestsPeopleAntigen":null,"totalTestsAntigen":null,"positiveTestsAntigen":null,"fips":"44","positiveIncrease":124,"negativeIncrease":1833,"total":350570,"totalTestResultsIncrease":8801,"posNeg":350570,"deathIncrease":1,"hospitalizedIncrease":7,"hash":"cdb29bfea77cdfc4eb6c1089ae40803472f506ac","commercialScore":0,"negativeRegularScore":0,"negativeScore":0,"positiveScore":0,"score":0,"grade":""},{"date":20201003,"state":"RI","positive":25245,"probableCases":null,"negative":323368,"pending":null,"totalTestResultsSource":"totalTestEncountersViral","totalTestResults":809951,"hospitalizedCurrently":94,"hospitalizedCumulative":2828,"inIcuCurrently":6,"inIcuCumulative":null,"onVentilatorCurrently":4,"onVentilatorCumulative":null,"recovered":2374,"dataQualityGrade":"A+","lastUpdateEt":"10/5/2020 12:00","dateModified":"2020-10-05T12:00:00Z","checkTimeEt":"10/05 08:00","death":1119,"hospitalized":2828,"dateChecked":"2020-10-05T12:00:00Z","totalTestsViral":null,"positiveTestsViral":35295,"negativeTestsViral":774656,"positiveCasesViral":25245,"deathConfirmed":null,"deathProbable":null,"totalTestEncountersViral":809951,"totalTestsPeopleViral":348613,"totalTestsAntibody":null,"positiveTestsAntibody":null,"negativeTestsAntibody":null,"totalTestsPeopleAntibody":null,"positiveTestsPeopleAntibody":null,"negativeTestsPeopleAntibody":null,"totalTestsPeopleAntigen":null,"positiveTestsPeopleAntigen":null,"totalTestsAntigen":null,"positiveTestsAntigen":null,"fips":"44","positiveIncrease":169,"negativeIncrease":2535,"total":348613,"totalTestResultsIncrease":12937,"posNeg":348613,"deathIncrease":1,"hospitalizedIncrease":28,"hash":"2d2d2830e0631dfd3863bc97c1fb39382faaa8ac","commercialScore":0,"negativeRegularScore":0,"negativeScore":0,"positiveScore":0,"score":0,"grade":""},{"date":20201002,"state":"RI","positive":25076,"probableCases":null,"negative":320833,"pending":null,"totalTestResultsSource":"totalTestEncountersViral","totalTestResults":797014,"hospitalizedCurrently":96,"hospitalizedCumulative":2800,"inIcuCurrently":7,"inIcuCumulative":null,"onVentilatorCurrently":7,"onVentilatorCumulative":null,"recovered":2346,"dataQualityGrade":"A+","lastUpdateEt":"10/2/2020 12:00","dateModified":"2020-10-02T12:00:00Z","checkTimeEt":"10/02 08:00","death":1118,"hospitalized":2800,"dateChecked":"2020-10-02T12:00:00Z","totalTestsViral":null,"positiveTestsViral":35077,"negativeTestsViral":761937,"positiveCasesViral":25076,"deathConfirmed":null,"deathProbable":null,"totalTestEncountersViral":797014,"totalTestsPeopleViral":345909,"totalTestsAntibody":null,"positiveTestsAntibody":null,"negativeTestsAntibody":null,"totalTestsPeopleAntibody":null,"positiveTestsPeopleAntibody":null,"negativeTestsPeopleAntibody":null,"totalTestsPeopleAntigen":null,"positiveTestsPeopleAntigen":null,"totalTestsAntigen":null,"positiveTestsAntigen":null,"fips":"44","positiveIncrease":162,"negativeIncrease":2248,"total":345909,"totalTestResultsIncrease":10814,"posNeg":345909,"deathIncrease":1,"hospitalizedIncrease":7,"hash":"fcd8e4d9704fb1ebd41055fdfd101fe4464c64b6","commercialScore":0,"negativeRegularScore":0,"negativeScore":0,"positiveScore":0,"score":0,"grade":""},{"date":20201001,"state":"RI","positive":24914,"probableCases":null,"negative":318585,"pending":null,"totalTestResultsSource":"totalTestEncountersViral","totalTestResults":786200,"hospitalizedCurrently":94,"hospitalizedCumulative":2793,"inIcuCurrently":6,"inIcuCumulative":null,"onVentilatorCurrently":7,"onVentilatorCumulative":null,"recovered":2342,"dataQualityGrade":"A+","lastUpdateEt":"10/1/2020 12:00","dateModified":"2020-10-01T12:00:00Z","checkTimeEt":"10/01 08:00","death":1117,"hospitalized":2793,"dateChecked":"2020-10-01T12:00:00Z","totalTestsViral":null,"positiveTestsViral":34906,"negativeTestsViral":751294,"positiveCasesViral":24914,"deathConfirmed":null,"deathProbable":null,"totalTestEncountersViral":786200,"totalTestsPeopleViral":343499,"totalTestsAntibody":null,"positiveTestsAntibody":null,"negativeTestsAntibody":null,"totalTestsPeopleAntibody":null,"positiveTestsPeopleAntibody":null,"negativeTestsPeopleAntibody":null,"totalTestsPeopleAntigen":null,"positiveTestsPeopleAntigen":null,"totalTestsAntigen":null,"positiveTestsAntigen":null,"fips":"44","positiveIncrease":166,"negativeIncrease":2732,"total":343499,"totalTestResultsIncrease":16378,"posNeg":343499,"deathIncrease":3,"hospitalizedIncrease":11,"hash":"1e455a72a5cbae6fcbf0340973b5e64e5d4e2ca3","commercialScore":0,"negativeRegularScore":0,"negativeScore":0,"positiveScore":0,"score":0,"grade":""},{"date":20200930,"state":"RI","positive":24748,"probableCases":null,"negative":315853,"pending":null,"totalTestResultsSource":"totalTestEncountersViral","totalTestResults":769822,"hospitalizedCurrently":103,"hospitalizedCumulative":2782,"inIcuCurrently":7,"inIcuCumulative":null,"onVentilatorCurrently":6,"onVentilatorCumulative":null,"recovered":2322,"dataQualityGrade":"A+","lastUpdateEt":"9/30/2020 12:00","dateModified":"2020-09-30T12:00:00Z","checkTimeEt":"09/30 08:00","death":1114,"hospitalized":2782,"dateChecked":"2020-09-30T12:00:00Z","totalTestsViral":null,"positiveTestsViral":34686,"negativeTestsViral":735136,"positiveCasesViral":24748,"deathConfirmed":null,"deathProbable":null,"totalTestEncountersViral":769822,"totalTestsPeopleViral":340601,"totalTestsAntibody":null,"positiveTestsAntibody":null,"negativeTestsAntibody":null,"totalTestsPeopleAntibody":null,"positiveTestsPeopleAntibody":null,"negativeTestsPeopleAntibody":null,"totalTestsPeopleAntigen":null,"positiveTestsPeopleAntigen":null,"totalTestsAntigen":null,"positiveTestsAntigen":null,"fips":"44","positiveIncrease":192,"negativeIncrease":2511,"total":340601,"totalTestResultsIncrease":9594,"posNeg":340601,"deathIncrease":1,"hospitalizedIncrease":8,"hash":"6fa9e559cc5fef42c954dc57097ffe90d38ac72d","commercialScore":0,"negativeRegularScore":0,"negativeScore":0,"positiveScore":0,"score":0,"grade":""},{"date":20200929,"state":"RI","positive":24556,"probableCases":null,"negative":313342,"pending":null,"totalTestResultsSource":"totalTestEncountersViral","totalTestResults":760228,"hospitalizedCurrently":103,"hospitalizedCumulative":2774,"inIcuCurrently":8,"inIcuCumulative":null,"onVentilatorCurrently":5,"onVentilatorCumulative":null,"recovered":2316,"dataQualityGrade":"A+","lastUpdateEt":"9/29/2020 12:00","dateModified":"2020-09-29T12:00:00Z","checkTimeEt":"09/29 08:00","death":1113,"hospitalized":2774,"dateChecked":"2020-09-29T12:00:00Z","totalTestsViral":null,"positiveTestsViral":34779,"negativeTestsViral":725449,"positiveCasesViral":24556,"deathConfirmed":null,"deathProbable":null,"totalTestEncountersViral":760228,"totalTestsPeopleViral":337898,"totalTestsAntibody":null,"positiveTestsAntibody":null,"negativeTestsAntibody":null,"totalTestsPeopleAntibody":null,"positiveTestsPeopleAntibody":null,"negativeTestsPeopleAntibody":null,"totalTestsPeopleAntigen":null,"positiveTestsPeopleAntigen":null,"totalTestsAntigen":null,"positiveTestsAntigen":null,"fips":"44","positiveIncrease":132,"negativeIncrease":2082,"total":337898,"totalTestResultsIncrease":7072,"posNeg":337898,"deathIncrease":3,"hospitalizedIncrease":49,"hash":"2a76497de10d94d2a063c777936f0c65b18ad88f","commercialScore":0,"negativeRegularScore":0,"negativeScore":0,"positiveScore":0,"score":0,"grade":""},{"date":20200928,"state":"RI","positive":24424,"probableCases":null,"negative":311260,"pending":null,"totalTestResultsSource":"totalTestEncountersViral","totalTestResults":753156,"hospitalizedCurrently":94,"hospitalizedCumulative":2725,"inIcuCurrently":8,"inIcuCumulative":null,"onVentilatorCurrently":4,"onVentilatorCumulative":null,"recovered":2278,"dataQualityGrade":"A+","lastUpdateEt":"9/28/2020 12:00","dateModified":"2020-09-28T12:00:00Z","checkTimeEt":"09/28 08:00","death":1110,"hospitalized":2725,"dateChecked":"2020-09-28T12:00:00Z","totalTestsViral":null,"positiveTestsViral":34601,"negativeTestsViral":718555,"positiveCasesViral":24424,"deathConfirmed":null,"deathProbable":null,"totalTestEncountersViral":753156,"totalTestsPeopleViral":335684,"totalTestsAntibody":null,"positiveTestsAntibody":null,"negativeTestsAntibody":null,"totalTestsPeopleAntibody":null,"positiveTestsPeopleAntibody":null,"negativeTestsPeopleAntibody":null,"totalTestsPeopleAntigen":null,"positiveTestsPeopleAntigen":null,"totalTestsAntigen":null,"positiveTestsAntigen":null,"fips":"44","positiveIncrease":26,"negativeIncrease":538,"total":335684,"totalTestResultsIncrease":2008,"posNeg":335684,"deathIncrease":0,"hospitalizedIncrease":0,"hash":"14ef110f18ebd14d9f8a43a9b6a1c6d155540001","commercialScore":0,"negativeRegularScore":0,"negativeScore":0,"positiveScore":0,"score":0,"grade":""},{"date":20200927,"state":"RI","positive":24398,"probableCases":null,"negative":310722,"pending":null,"totalTestResultsSource":"totalTestEncountersViral","totalTestResults":751148,"hospitalizedCurrently":94,"hospitalizedCumulative":2725,"inIcuCurrently":8,"inIcuCumulative":null,"onVentilatorCurrently":4,"onVentilatorCumulative":null,"recovered":2278,"dataQualityGrade":"A+","lastUpdateEt":"9/27/2020 12:00","dateModified":"2020-09-27T12:00:00Z","checkTimeEt":"09/27 08:00","death":1110,"hospitalized":2725,"dateChecked":"2020-09-27T12:00:00Z","totalTestsViral":null,"positiveTestsViral":34564,"negativeTestsViral":716584,"positiveCasesViral":24398,"deathConfirmed":null,"deathProbable":null,"totalTestEncountersViral":751148,"totalTestsPeopleViral":335120,"totalTestsAntibody":null,"positiveTestsAntibody":null,"negativeTestsAntibody":null,"totalTestsPeopleAntibody":null,"positiveTestsPeopleAntibody":null,"negativeTestsPeopleAntibody":null,"totalTestsPeopleAntigen":null,"positiveTestsPeopleAntigen":null,"totalTestsAntigen":null,"positiveTestsAntigen":null,"fips":"44","positiveIncrease":114,"negativeIncrease":1858,"total":335120,"totalTestResultsIncrease":9185,"posNeg":335120,"deathIncrease":0,"hospitalizedIncrease":0,"hash":"b7a14430af369c635a3ccb064b142f31f30ba7d5","commercialScore":0,"negativeRegularScore":0,"negativeScore":0,"positiveScore":0,"score":0,"grade":""},{"date":20200926,"state":"RI","positive":24284,"probableCases":null,"negative":308864,"pending":null,"totalTestResultsSource":"totalTestEncountersViral","totalTestResults":741963,"hospitalizedCurrently":94,"hospitalizedCumulative":2725,"inIcuCurrently":8,"inIcuCumulative":null,"onVentilatorCurrently":4,"onVentilatorCumulative":null,"recovered":2278,"dataQualityGrade":"A+","lastUpdateEt":"9/26/2020 12:00","dateModified":"2020-09-26T12:00:00Z","checkTimeEt":"09/26 08:00","death":1110,"hospitalized":2725,"dateChecked":"2020-09-26T12:00:00Z","totalTestsViral":null,"positiveTestsViral":34451,"negativeTestsViral":707512,"positiveCasesViral":24284,"deathConfirmed":null,"deathProbable":null,"totalTestEncountersViral":741963,"totalTestsPeopleViral":333148,"totalTestsAntibody":null,"positiveTestsAntibody":null,"negativeTestsAntibody":null,"totalTestsPeopleAntibody":null,"positiveTestsPeopleAntibody":null,"negativeTestsPeopleAntibody":null,"totalTestsPeopleAntigen":null,"positiveTestsPeopleAntigen":null,"totalTestsAntigen":null,"positiveTestsAntigen":null,"fips":"44","positiveIncrease":103,"negativeIncrease":3011,"total":333148,"totalTestResultsIncrease":14494,"posNeg":333148,"deathIncrease":3,"hospitalizedIncrease":0,"hash":"090c5bd11924463312607a63e0d89fcaa4fa6d7c","commercialScore":0,"negativeRegularScore":0,"negativeScore":0,"positiveScore":0,"score":0,"grade":""},{"date":20200925,"state":"RI","positive":24181,"probableCases":null,"negative":305853,"pending":null,"totalTestResultsSource":"totalTestEncountersViral","totalTestResults":727469,"hospitalizedCurrently":94,"hospitalizedCumulative":2725,"inIcuCurrently":8,"inIcuCumulative":null,"onVentilatorCurrently":4,"onVentilatorCumulative":null,"recovered":2278,"dataQualityGrade":"A+","lastUpdateEt":"9/25/2020 12:00","dateModified":"2020-09-25T12:00:00Z","checkTimeEt":"09/25 08:00","death":1107,"hospitalized":2725,"dateChecked":"2020-09-25T12:00:00Z","totalTestsViral":null,"positiveTestsViral":34299,"negativeTestsViral":693170,"positiveCasesViral":24181,"deathConfirmed":null,"deathProbable":null,"totalTestEncountersViral":727469,"totalTestsPeopleViral":330034,"totalTestsAntibody":null,"positiveTestsAntibody":null,"negativeTestsAntibody":null,"totalTestsPeopleAntibody":null,"positiveTestsPeopleAntibody":null,"negativeTestsPeopleAntibody":null,"totalTestsPeopleAntigen":null,"positiveTestsPeopleAntigen":null,"totalTestsAntigen":null,"positiveTestsAntigen":null,"fips":"44","positiveIncrease":-130,"negativeIncrease":2581,"total":330034,"totalTestResultsIncrease":10422,"posNeg":330034,"deathIncrease":1,"hospitalizedIncrease":0,"hash":"a223ae2b1d8ae1edb4357f4fb1d59a956ecf2e0b","commercialScore":0,"negativeRegularScore":0,"negativeScore":0,"positiveScore":0,"score":0,"grade":""},{"date":20200924,"state":"RI","positive":24311,"probableCases":null,"negative":303272,"pending":null,"totalTestResultsSource":"totalTestEncountersViral","totalTestResults":717047,"hospitalizedCurrently":94,"hospitalizedCumulative":2725,"inIcuCurrently":8,"inIcuCumulative":null,"onVentilatorCurrently":4,"onVentilatorCumulative":null,"recovered":2278,"dataQualityGrade":"A+","lastUpdateEt":"9/24/2020 12:00","dateModified":"2020-09-24T12:00:00Z","checkTimeEt":"09/24 08:00","death":1106,"hospitalized":2725,"dateChecked":"2020-09-24T12:00:00Z","totalTestsViral":null,"positiveTestsViral":34111,"negativeTestsViral":682936,"positiveCasesViral":24311,"deathConfirmed":null,"deathProbable":null,"totalTestEncountersViral":717047,"totalTestsPeopleViral":327583,"totalTestsAntibody":null,"positiveTestsAntibody":null,"negativeTestsAntibody":null,"totalTestsPeopleAntibody":null,"positiveTestsPeopleAntibody":null,"negativeTestsPeopleAntibody":null,"totalTestsPeopleAntigen":null,"positiveTestsPeopleAntigen":null,"totalTestsAntigen":null,"positiveTestsAntigen":null,"fips":"44","positiveIncrease":134,"negativeIncrease":2329,"total":327583,"totalTestResultsIncrease":10469,"posNeg":327583,"deathIncrease":4,"hospitalizedIncrease":12,"hash":"d64f2e079ea66bee9c2b2b8a43d86bb870e43cc8","commercialScore":0,"negativeRegularScore":0,"negativeScore":0,"positiveScore":0,"score":0,"grade":""},{"date":20200923,"state":"RI","positive":24177,"probableCases":null,"negative":300943,"pending":null,"totalTestResultsSource":"totalTestEncountersViral","totalTestResults":706578,"hospitalizedCurrently":86,"hospitalizedCumulative":2713,"inIcuCurrently":9,"inIcuCumulative":null,"onVentilatorCurrently":5,"onVentilatorCumulative":null,"recovered":2275,"dataQualityGrade":"A+","lastUpdateEt":"9/23/2020 12:00","dateModified":"2020-09-23T12:00:00Z","checkTimeEt":"09/23 08:00","death":1102,"hospitalized":2713,"dateChecked":"2020-09-23T12:00:00Z","totalTestsViral":null,"positiveTestsViral":33952,"negativeTestsViral":672626,"positiveCasesViral":24177,"deathConfirmed":null,"deathProbable":null,"totalTestEncountersViral":706578,"totalTestsPeopleViral":325120,"totalTestsAntibody":null,"positiveTestsAntibody":null,"negativeTestsAntibody":null,"totalTestsPeopleAntibody":null,"positiveTestsPeopleAntibody":null,"negativeTestsPeopleAntibody":null,"totalTestsPeopleAntigen":null,"positiveTestsPeopleAntigen":null,"totalTestsAntigen":null,"positiveTestsAntigen":null,"fips":"44","positiveIncrease":133,"negativeIncrease":2596,"total":325120,"totalTestResultsIncrease":9770,"posNeg":325120,"deathIncrease":3,"hospitalizedIncrease":9,"hash":"e92b1a1146598457a25534f3f4a0d9378b8d4fa7","commercialScore":0,"negativeRegularScore":0,"negativeScore":0,"positiveScore":0,"score":0,"grade":""},{"date":20200922,"state":"RI","positive":24044,"probableCases":null,"negative":298347,"pending":null,"totalTestResultsSource":"totalTestEncountersViral","totalTestResults":696808,"hospitalizedCurrently":82,"hospitalizedCumulative":2704,"inIcuCurrently":10,"inIcuCumulative":null,"onVentilatorCurrently":7,"onVentilatorCumulative":null,"recovered":2272,"dataQualityGrade":"A+","lastUpdateEt":"9/22/2020 12:00","dateModified":"2020-09-22T12:00:00Z","checkTimeEt":"09/22 08:00","death":1099,"hospitalized":2704,"dateChecked":"2020-09-22T12:00:00Z","totalTestsViral":null,"positiveTestsViral":33791,"negativeTestsViral":663017,"positiveCasesViral":24044,"deathConfirmed":null,"deathProbable":null,"totalTestEncountersViral":696808,"totalTestsPeopleViral":322391,"totalTestsAntibody":null,"positiveTestsAntibody":null,"negativeTestsAntibody":null,"totalTestsPeopleAntibody":null,"positiveTestsPeopleAntibody":null,"negativeTestsPeopleAntibody":null,"totalTestsPeopleAntigen":null,"positiveTestsPeopleAntigen":null,"totalTestsAntigen":null,"positiveTestsAntigen":null,"fips":"44","positiveIncrease":112,"negativeIncrease":1713,"total":322391,"totalTestResultsIncrease":6527,"posNeg":322391,"deathIncrease":2,"hospitalizedIncrease":11,"hash":"a645428649f6c7625738e7af8651e5dbc705d184","commercialScore":0,"negativeRegularScore":0,"negativeScore":0,"positiveScore":0,"score":0,"grade":""},{"date":20200921,"state":"RI","positive":23932,"probableCases":null,"negative":296634,"pending":null,"totalTestResultsSource":"totalTestEncountersViral","totalTestResults":690281,"hospitalizedCurrently":78,"hospitalizedCumulative":2693,"inIcuCurrently":10,"inIcuCumulative":null,"onVentilatorCurrently":4,"onVentilatorCumulative":null,"recovered":2268,"dataQualityGrade":"A+","lastUpdateEt":"9/21/2020 12:00","dateModified":"2020-09-21T12:00:00Z","checkTimeEt":"09/21 08:00","death":1097,"hospitalized":2693,"dateChecked":"2020-09-21T12:00:00Z","totalTestsViral":null,"positiveTestsViral":33671,"negativeTestsViral":656610,"positiveCasesViral":23932,"deathConfirmed":null,"deathProbable":null,"totalTestEncountersViral":690281,"totalTestsPeopleViral":320566,"totalTestsAntibody":null,"positiveTestsAntibody":null,"negativeTestsAntibody":null,"totalTestsPeopleAntibody":null,"positiveTestsPeopleAntibody":null,"negativeTestsPeopleAntibody":null,"totalTestsPeopleAntigen":null,"positiveTestsPeopleAntigen":null,"totalTestsAntigen":null,"positiveTestsAntigen":null,"fips":"44","positiveIncrease":52,"negativeIncrease":711,"total":320566,"totalTestResultsIncrease":2136,"posNeg":320566,"deathIncrease":3,"hospitalizedIncrease":0,"hash":"421a6a8c648aca018b7bd039efc2780b530f9e41","commercialScore":0,"negativeRegularScore":0,"negativeScore":0,"positiveScore":0,"score":0,"grade":""},{"date":20200920,"state":"RI","positive":23880,"probableCases":null,"negative":295923,"pending":null,"totalTestResultsSource":"totalTestEncountersViral","totalTestResults":688145,"hospitalizedCurrently":78,"hospitalizedCumulative":2693,"inIcuCurrently":10,"inIcuCumulative":null,"onVentilatorCurrently":4,"onVentilatorCumulative":null,"recovered":2268,"dataQualityGrade":"A+","lastUpdateEt":"9/20/2020 12:00","dateModified":"2020-09-20T12:00:00Z","checkTimeEt":"09/20 08:00","death":1094,"hospitalized":2693,"dateChecked":"2020-09-20T12:00:00Z","totalTestsViral":null,"positiveTestsViral":33607,"negativeTestsViral":654538,"positiveCasesViral":23880,"deathConfirmed":null,"deathProbable":null,"totalTestEncountersViral":688145,"totalTestsPeopleViral":319803,"totalTestsAntibody":null,"positiveTestsAntibody":null,"negativeTestsAntibody":null,"totalTestsPeopleAntibody":null,"positiveTestsPeopleAntibody":null,"negativeTestsPeopleAntibody":null,"totalTestsPeopleAntigen":null,"positiveTestsPeopleAntigen":null,"totalTestsAntigen":null,"positiveTestsAntigen":null,"fips":"44","positiveIncrease":82,"negativeIncrease":1705,"total":319803,"totalTestResultsIncrease":8291,"posNeg":319803,"deathIncrease":3,"hospitalizedIncrease":6,"hash":"6db841fbe7dfadcff5647a2a64bda7ba2195c370","commercialScore":0,"negativeRegularScore":0,"negativeScore":0,"positiveScore":0,"score":0,"grade":""},{"date":20200919,"state":"RI","positive":23798,"probableCases":null,"negative":294218,"pending":null,"totalTestResultsSource":"totalTestEncountersViral","totalTestResults":679854,"hospitalizedCurrently":75,"hospitalizedCumulative":2687,"inIcuCurrently":11,"inIcuCumulative":null,"onVentilatorCurrently":4,"onVentilatorCumulative":null,"recovered":2265,"dataQualityGrade":"A+","lastUpdateEt":"9/19/2020 12:00","dateModified":"2020-09-19T12:00:00Z","checkTimeEt":"09/19 08:00","death":1091,"hospitalized":2687,"dateChecked":"2020-09-19T12:00:00Z","totalTestsViral":null,"positiveTestsViral":33449,"negativeTestsViral":646405,"positiveCasesViral":23798,"deathConfirmed":null,"deathProbable":null,"totalTestEncountersViral":679854,"totalTestsPeopleViral":318016,"totalTestsAntibody":null,"positiveTestsAntibody":null,"negativeTestsAntibody":null,"totalTestsPeopleAntibody":null,"positiveTestsPeopleAntibody":null,"negativeTestsPeopleAntibody":null,"totalTestsPeopleAntigen":null,"positiveTestsPeopleAntigen":null,"totalTestsAntigen":null,"positiveTestsAntigen":null,"fips":"44","positiveIncrease":178,"negativeIncrease":2283,"total":318016,"totalTestResultsIncrease":4746,"posNeg":318016,"deathIncrease":3,"hospitalizedIncrease":12,"hash":"a3184fb16f04f3d033b18d4a26f6185244473e54","commercialScore":0,"negativeRegularScore":0,"negativeScore":0,"positiveScore":0,"score":0,"grade":""},{"date":20200918,"state":"RI","positive":23620,"probableCases":null,"negative":291935,"pending":null,"totalTestResultsSource":"totalTestEncountersViral","totalTestResults":675108,"hospitalizedCurrently":85,"hospitalizedCumulative":2675,"inIcuCurrently":7,"inIcuCumulative":null,"onVentilatorCurrently":6,"onVentilatorCumulative":null,"recovered":2244,"dataQualityGrade":"A+","lastUpdateEt":"9/18/2020 12:00","dateModified":"2020-09-18T12:00:00Z","checkTimeEt":"09/18 08:00","death":1088,"hospitalized":2675,"dateChecked":"2020-09-18T12:00:00Z","totalTestsViral":null,"positiveTestsViral":33476,"negativeTestsViral":641632,"positiveCasesViral":23620,"deathConfirmed":null,"deathProbable":null,"totalTestEncountersViral":675108,"totalTestsPeopleViral":315555,"totalTestsAntibody":null,"positiveTestsAntibody":null,"negativeTestsAntibody":null,"totalTestsPeopleAntibody":null,"positiveTestsPeopleAntibody":null,"negativeTestsPeopleAntibody":null,"totalTestsPeopleAntigen":null,"positiveTestsPeopleAntigen":null,"totalTestsAntigen":null,"positiveTestsAntigen":null,"fips":"44","positiveIncrease":132,"negativeIncrease":2148,"total":315555,"totalTestResultsIncrease":9182,"posNeg":315555,"deathIncrease":3,"hospitalizedIncrease":7,"hash":"f26450585e374a6531997d6590688fa968cedc52","commercialScore":0,"negativeRegularScore":0,"negativeScore":0,"positiveScore":0,"score":0,"grade":""},{"date":20200917,"state":"RI","positive":23488,"probableCases":null,"negative":289787,"pending":null,"totalTestResultsSource":"totalTestEncountersViral","totalTestResults":665926,"hospitalizedCurrently":88,"hospitalizedCumulative":2668,"inIcuCurrently":9,"inIcuCumulative":null,"onVentilatorCurrently":5,"onVentilatorCumulative":null,"recovered":2236,"dataQualityGrade":"A+","lastUpdateEt":"9/17/2020 12:00","dateModified":"2020-09-17T12:00:00Z","checkTimeEt":"09/17 08:00","death":1085,"hospitalized":2668,"dateChecked":"2020-09-17T12:00:00Z","totalTestsViral":null,"positiveTestsViral":33335,"negativeTestsViral":632591,"positiveCasesViral":23488,"deathConfirmed":null,"deathProbable":null,"totalTestEncountersViral":665926,"totalTestsPeopleViral":313275,"totalTestsAntibody":null,"positiveTestsAntibody":null,"negativeTestsAntibody":null,"totalTestsPeopleAntibody":null,"positiveTestsPeopleAntibody":null,"negativeTestsPeopleAntibody":null,"totalTestsPeopleAntigen":null,"positiveTestsPeopleAntigen":null,"totalTestsAntigen":null,"positiveTestsAntigen":null,"fips":"44","positiveIncrease":130,"negativeIncrease":1801,"total":313275,"totalTestResultsIncrease":11823,"posNeg":313275,"deathIncrease":4,"hospitalizedIncrease":6,"hash":"f769582ceab4786f5051af030ddf9a6dc96c2032","commercialScore":0,"negativeRegularScore":0,"negativeScore":0,"positiveScore":0,"score":0,"grade":""},{"date":20200916,"state":"RI","positive":23358,"probableCases":null,"negative":287986,"pending":null,"totalTestResultsSource":"totalTestEncountersViral","totalTestResults":654103,"hospitalizedCurrently":84,"hospitalizedCumulative":2662,"inIcuCurrently":9,"inIcuCumulative":null,"onVentilatorCurrently":5,"onVentilatorCumulative":null,"recovered":2235,"dataQualityGrade":"A+","lastUpdateEt":"9/16/2020 12:00","dateModified":"2020-09-16T12:00:00Z","checkTimeEt":"09/16 08:00","death":1081,"hospitalized":2662,"dateChecked":"2020-09-16T12:00:00Z","totalTestsViral":null,"positiveTestsViral":33159,"negativeTestsViral":620944,"positiveCasesViral":23358,"deathConfirmed":null,"deathProbable":null,"totalTestEncountersViral":654103,"totalTestsPeopleViral":311344,"totalTestsAntibody":null,"positiveTestsAntibody":null,"negativeTestsAntibody":null,"totalTestsPeopleAntibody":null,"positiveTestsPeopleAntibody":null,"negativeTestsPeopleAntibody":null,"totalTestsPeopleAntigen":null,"positiveTestsPeopleAntigen":null,"totalTestsAntigen":null,"positiveTestsAntigen":null,"fips":"44","positiveIncrease":108,"negativeIncrease":1195,"total":311344,"totalTestResultsIncrease":11536,"posNeg":311344,"deathIncrease":3,"hospitalizedIncrease":12,"hash":"db33ac3f47e7584a686b2cbe821b4939fc8fb505","commercialScore":0,"negativeRegularScore":0,"negativeScore":0,"positiveScore":0,"score":0,"grade":""},{"date":20200915,"state":"RI","positive":23250,"probableCases":null,"negative":286791,"pending":null,"totalTestResultsSource":"totalTestEncountersViral","totalTestResults":642567,"hospitalizedCurrently":81,"hospitalizedCumulative":2650,"inIcuCurrently":9,"inIcuCumulative":null,"onVentilatorCurrently":5,"onVentilatorCumulative":null,"recovered":2228,"dataQualityGrade":"A+","lastUpdateEt":"9/15/2020 12:00","dateModified":"2020-09-15T12:00:00Z","checkTimeEt":"09/15 08:00","death":1078,"hospitalized":2650,"dateChecked":"2020-09-15T12:00:00Z","totalTestsViral":null,"positiveTestsViral":32820,"negativeTestsViral":609747,"positiveCasesViral":23250,"deathConfirmed":null,"deathProbable":null,"totalTestEncountersViral":642567,"totalTestsPeopleViral":310041,"totalTestsAntibody":null,"positiveTestsAntibody":null,"negativeTestsAntibody":null,"totalTestsPeopleAntibody":null,"positiveTestsPeopleAntibody":null,"negativeTestsPeopleAntibody":null,"totalTestsPeopleAntigen":null,"positiveTestsPeopleAntigen":null,"totalTestsAntigen":null,"positiveTestsAntigen":null,"fips":"44","positiveIncrease":120,"negativeIncrease":1724,"total":310041,"totalTestResultsIncrease":6849,"posNeg":310041,"deathIncrease":3,"hospitalizedIncrease":6,"hash":"bb38177431aebd28f2008771d5d38b96db7eae11","commercialScore":0,"negativeRegularScore":0,"negativeScore":0,"positiveScore":0,"score":0,"grade":""},{"date":20200914,"state":"RI","positive":23130,"probableCases":null,"negative":285067,"pending":null,"totalTestResultsSource":"totalTestEncountersViral","totalTestResults":635718,"hospitalizedCurrently":80,"hospitalizedCumulative":2644,"inIcuCurrently":7,"inIcuCumulative":null,"onVentilatorCurrently":4,"onVentilatorCumulative":null,"recovered":2223,"dataQualityGrade":"A+","lastUpdateEt":"9/14/2020 12:00","dateModified":"2020-09-14T12:00:00Z","checkTimeEt":"09/14 08:00","death":1075,"hospitalized":2644,"dateChecked":"2020-09-14T12:00:00Z","totalTestsViral":null,"positiveTestsViral":32706,"negativeTestsViral":603012,"positiveCasesViral":23130,"deathConfirmed":null,"deathProbable":null,"totalTestEncountersViral":635718,"totalTestsPeopleViral":308197,"totalTestsAntibody":null,"positiveTestsAntibody":null,"negativeTestsAntibody":null,"totalTestsPeopleAntibody":null,"positiveTestsPeopleAntibody":null,"negativeTestsPeopleAntibody":null,"totalTestsPeopleAntigen":null,"positiveTestsPeopleAntigen":null,"totalTestsAntigen":null,"positiveTestsAntigen":null,"fips":"44","positiveIncrease":32,"negativeIncrease":682,"total":308197,"totalTestResultsIncrease":2208,"posNeg":308197,"deathIncrease":0,"hospitalizedIncrease":0,"hash":"4e08553de138117b7b0ccc9c083eb1bf0bbf8935","commercialScore":0,"negativeRegularScore":0,"negativeScore":0,"positiveScore":0,"score":0,"grade":""},{"date":20200913,"state":"RI","positive":23098,"probableCases":null,"negative":284385,"pending":null,"totalTestResultsSource":"totalTestEncountersViral","totalTestResults":633510,"hospitalizedCurrently":80,"hospitalizedCumulative":2644,"inIcuCurrently":7,"inIcuCumulative":null,"onVentilatorCurrently":4,"onVentilatorCumulative":null,"recovered":2223,"dataQualityGrade":"A+","lastUpdateEt":"9/12/2020 12:00","dateModified":"2020-09-12T12:00:00Z","checkTimeEt":"09/12 08:00","death":1075,"hospitalized":2644,"dateChecked":"2020-09-12T12:00:00Z","totalTestsViral":null,"positiveTestsViral":32660,"negativeTestsViral":600850,"positiveCasesViral":23098,"deathConfirmed":null,"deathProbable":null,"totalTestEncountersViral":633510,"totalTestsPeopleViral":307483,"totalTestsAntibody":null,"positiveTestsAntibody":null,"negativeTestsAntibody":null,"totalTestsPeopleAntibody":null,"positiveTestsPeopleAntibody":null,"negativeTestsPeopleAntibody":null,"totalTestsPeopleAntigen":null,"positiveTestsPeopleAntigen":null,"totalTestsAntigen":null,"positiveTestsAntigen":null,"fips":"44","positiveIncrease":99,"negativeIncrease":1248,"total":307483,"totalTestResultsIncrease":5419,"posNeg":307483,"deathIncrease":3,"hospitalizedIncrease":5,"hash":"438762efe6e98ee620d914fed8590b5cfbd16949","commercialScore":0,"negativeRegularScore":0,"negativeScore":0,"positiveScore":0,"score":0,"grade":""},{"date":20200912,"state":"RI","positive":22999,"probableCases":null,"negative":283137,"pending":null,"totalTestResultsSource":"totalTestEncountersViral","totalTestResults":628091,"hospitalizedCurrently":80,"hospitalizedCumulative":2639,"inIcuCurrently":8,"inIcuCumulative":null,"onVentilatorCurrently":4,"onVentilatorCumulative":null,"recovered":2220,"dataQualityGrade":"A+","lastUpdateEt":"9/11/2020 12:00","dateModified":"2020-09-11T12:00:00Z","checkTimeEt":"09/11 08:00","death":1072,"hospitalized":2639,"dateChecked":"2020-09-11T12:00:00Z","totalTestsViral":null,"positiveTestsViral":32558,"negativeTestsViral":595533,"positiveCasesViral":22999,"deathConfirmed":null,"deathProbable":null,"totalTestEncountersViral":628091,"totalTestsPeopleViral":306136,"totalTestsAntibody":null,"positiveTestsAntibody":null,"negativeTestsAntibody":null,"totalTestsPeopleAntibody":null,"positiveTestsPeopleAntibody":null,"negativeTestsPeopleAntibody":null,"totalTestsPeopleAntigen":null,"positiveTestsPeopleAntigen":null,"totalTestsAntigen":null,"positiveTestsAntigen":null,"fips":"44","positiveIncrease":94,"negativeIncrease":3019,"total":306136,"totalTestResultsIncrease":12408,"posNeg":306136,"deathIncrease":1,"hospitalizedIncrease":19,"hash":"62fde54a5baeb0ee387470cc5a8893d18f82bc3d","commercialScore":0,"negativeRegularScore":0,"negativeScore":0,"positiveScore":0,"score":0,"grade":""},{"date":20200911,"state":"RI","positive":22905,"probableCases":null,"negative":280118,"pending":null,"totalTestResultsSource":"totalTestEncountersViral","totalTestResults":615683,"hospitalizedCurrently":80,"hospitalizedCumulative":2620,"inIcuCurrently":8,"inIcuCumulative":null,"onVentilatorCurrently":3,"onVentilatorCumulative":null,"recovered":2201,"dataQualityGrade":"A+","lastUpdateEt":"9/11/2020 12:00","dateModified":"2020-09-11T12:00:00Z","checkTimeEt":"09/11 08:00","death":1071,"hospitalized":2620,"dateChecked":"2020-09-11T12:00:00Z","totalTestsViral":null,"positiveTestsViral":32589,"negativeTestsViral":583094,"positiveCasesViral":22905,"deathConfirmed":null,"deathProbable":null,"totalTestEncountersViral":615683,"totalTestsPeopleViral":303023,"totalTestsAntibody":null,"positiveTestsAntibody":null,"negativeTestsAntibody":null,"totalTestsPeopleAntibody":null,"positiveTestsPeopleAntibody":null,"negativeTestsPeopleAntibody":null,"totalTestsPeopleAntigen":null,"positiveTestsPeopleAntigen":null,"totalTestsAntigen":null,"positiveTestsAntigen":null,"fips":"44","positiveIncrease":123,"negativeIncrease":1587,"total":303023,"totalTestResultsIncrease":8777,"posNeg":303023,"deathIncrease":4,"hospitalizedIncrease":9,"hash":"bd6c3d7ff7b191a0c4eb1c5e530ada19a4f66b07","commercialScore":0,"negativeRegularScore":0,"negativeScore":0,"positiveScore":0,"score":0,"grade":""},{"date":20200910,"state":"RI","positive":22782,"probableCases":null,"negative":278531,"pending":null,"totalTestResultsSource":"totalTestEncountersViral","totalTestResults":606906,"hospitalizedCurrently":76,"hospitalizedCumulative":2611,"inIcuCurrently":5,"inIcuCumulative":null,"onVentilatorCurrently":3,"onVentilatorCumulative":null,"recovered":2197,"dataQualityGrade":"A+","lastUpdateEt":"9/10/2020 12:00","dateModified":"2020-09-10T12:00:00Z","checkTimeEt":"09/10 08:00","death":1067,"hospitalized":2611,"dateChecked":"2020-09-10T12:00:00Z","totalTestsViral":null,"positiveTestsViral":32425,"negativeTestsViral":574481,"positiveCasesViral":22782,"deathConfirmed":null,"deathProbable":null,"totalTestEncountersViral":606906,"totalTestsPeopleViral":301313,"totalTestsAntibody":null,"positiveTestsAntibody":null,"negativeTestsAntibody":null,"totalTestsPeopleAntibody":null,"positiveTestsPeopleAntibody":null,"negativeTestsPeopleAntibody":null,"totalTestsPeopleAntigen":null,"positiveTestsPeopleAntigen":null,"totalTestsAntigen":null,"positiveTestsAntigen":null,"fips":"44","positiveIncrease":106,"negativeIncrease":2193,"total":301313,"totalTestResultsIncrease":8589,"posNeg":301313,"deathIncrease":5,"hospitalizedIncrease":7,"hash":"7f156f104cfa71852105d29667f4491526becee6","commercialScore":0,"negativeRegularScore":0,"negativeScore":0,"positiveScore":0,"score":0,"grade":""},{"date":20200909,"state":"RI","positive":22676,"probableCases":null,"negative":276338,"pending":null,"totalTestResultsSource":"totalTestEncountersViral","totalTestResults":598317,"hospitalizedCurrently":82,"hospitalizedCumulative":2604,"inIcuCurrently":4,"inIcuCumulative":null,"onVentilatorCurrently":3,"onVentilatorCumulative":null,"recovered":2185,"dataQualityGrade":"A+","lastUpdateEt":"9/9/2020 12:00","dateModified":"2020-09-09T12:00:00Z","checkTimeEt":"09/09 08:00","death":1062,"hospitalized":2604,"dateChecked":"2020-09-09T12:00:00Z","totalTestsViral":null,"positiveTestsViral":32303,"negativeTestsViral":566014,"positiveCasesViral":22676,"deathConfirmed":null,"deathProbable":null,"totalTestEncountersViral":598317,"totalTestsPeopleViral":299014,"totalTestsAntibody":null,"positiveTestsAntibody":null,"negativeTestsAntibody":null,"totalTestsPeopleAntibody":null,"positiveTestsPeopleAntibody":null,"negativeTestsPeopleAntibody":null,"totalTestsPeopleAntigen":null,"positiveTestsPeopleAntigen":null,"totalTestsAntigen":null,"positiveTestsAntigen":null,"fips":"44","positiveIncrease":84,"negativeIncrease":7491,"total":299014,"totalTestResultsIncrease":15705,"posNeg":299014,"deathIncrease":3,"hospitalizedIncrease":15,"hash":"6942acd58bf40ca57b005269661bcfd3a7319ae3","commercialScore":0,"negativeRegularScore":0,"negativeScore":0,"positiveScore":0,"score":0,"grade":""},{"date":20200908,"state":"RI","positive":22592,"probableCases":null,"negative":268847,"pending":null,"totalTestResultsSource":"totalTestEncountersViral","totalTestResults":582612,"hospitalizedCurrently":73,"hospitalizedCumulative":2589,"inIcuCurrently":5,"inIcuCumulative":null,"onVentilatorCurrently":3,"onVentilatorCumulative":null,"recovered":2179,"dataQualityGrade":"A+","lastUpdateEt":"9/8/2020 12:00","dateModified":"2020-09-08T12:00:00Z","checkTimeEt":"09/08 08:00","death":1059,"hospitalized":2589,"dateChecked":"2020-09-08T12:00:00Z","totalTestsViral":null,"positiveTestsViral":31815,"negativeTestsViral":550797,"positiveCasesViral":22592,"deathConfirmed":null,"deathProbable":null,"totalTestEncountersViral":582612,"totalTestsPeopleViral":291439,"totalTestsAntibody":null,"positiveTestsAntibody":null,"negativeTestsAntibody":null,"totalTestsPeopleAntibody":null,"positiveTestsPeopleAntibody":null,"negativeTestsPeopleAntibody":null,"totalTestsPeopleAntigen":null,"positiveTestsPeopleAntigen":null,"totalTestsAntigen":null,"positiveTestsAntigen":null,"fips":"44","positiveIncrease":20,"negativeIncrease":390,"total":291439,"totalTestResultsIncrease":1438,"posNeg":291439,"deathIncrease":0,"hospitalizedIncrease":0,"hash":"5b303f6e6090d9400e39a1f5c3609f8e536c1ed0","commercialScore":0,"negativeRegularScore":0,"negativeScore":0,"positiveScore":0,"score":0,"grade":""},{"date":20200907,"state":"RI","positive":22572,"probableCases":null,"negative":268457,"pending":null,"totalTestResultsSource":"totalTestEncountersViral","totalTestResults":581174,"hospitalizedCurrently":73,"hospitalizedCumulative":2589,"inIcuCurrently":5,"inIcuCumulative":null,"onVentilatorCurrently":3,"onVentilatorCumulative":null,"recovered":2179,"dataQualityGrade":"A+","lastUpdateEt":"9/7/2020 12:00","dateModified":"2020-09-07T12:00:00Z","checkTimeEt":"09/07 08:00","death":1059,"hospitalized":2589,"dateChecked":"2020-09-07T12:00:00Z","totalTestsViral":null,"positiveTestsViral":31786,"negativeTestsViral":549388,"positiveCasesViral":22572,"deathConfirmed":null,"deathProbable":null,"totalTestEncountersViral":581174,"totalTestsPeopleViral":291029,"totalTestsAntibody":null,"positiveTestsAntibody":null,"negativeTestsAntibody":null,"totalTestsPeopleAntibody":null,"positiveTestsPeopleAntibody":null,"negativeTestsPeopleAntibody":null,"totalTestsPeopleAntigen":null,"positiveTestsPeopleAntigen":null,"totalTestsAntigen":null,"positiveTestsAntigen":null,"fips":"44","positiveIncrease":53,"negativeIncrease":1768,"total":291029,"totalTestResultsIncrease":4011,"posNeg":291029,"deathIncrease":1,"hospitalizedIncrease":2,"hash":"6d0f476b29277f9f4f3720fbbbaf0bb5341990d2","commercialScore":0,"negativeRegularScore":0,"negativeScore":0,"positiveScore":0,"score":0,"grade":""},{"date":20200906,"state":"RI","positive":22519,"probableCases":null,"negative":266689,"pending":null,"totalTestResultsSource":"totalTestEncountersViral","totalTestResults":577163,"hospitalizedCurrently":79,"hospitalizedCumulative":2587,"inIcuCurrently":7,"inIcuCumulative":null,"onVentilatorCurrently":3,"onVentilatorCumulative":null,"recovered":2172,"dataQualityGrade":"A+","lastUpdateEt":"9/7/2020 12:00","dateModified":"2020-09-07T12:00:00Z","checkTimeEt":"09/07 08:00","death":1058,"hospitalized":2587,"dateChecked":"2020-09-07T12:00:00Z","totalTestsViral":null,"positiveTestsViral":31715,"negativeTestsViral":545448,"positiveCasesViral":22519,"deathConfirmed":null,"deathProbable":null,"totalTestEncountersViral":577163,"totalTestsPeopleViral":289208,"totalTestsAntibody":null,"positiveTestsAntibody":null,"negativeTestsAntibody":null,"totalTestsPeopleAntibody":null,"positiveTestsPeopleAntibody":null,"negativeTestsPeopleAntibody":null,"totalTestsPeopleAntigen":null,"positiveTestsPeopleAntigen":null,"totalTestsAntigen":null,"positiveTestsAntigen":null,"fips":"44","positiveIncrease":35,"negativeIncrease":1486,"total":289208,"totalTestResultsIncrease":6234,"posNeg":289208,"deathIncrease":0,"hospitalizedIncrease":6,"hash":"0d9c1a1ce552f46ba705309051f9f069949398fc","commercialScore":0,"negativeRegularScore":0,"negativeScore":0,"positiveScore":0,"score":0,"grade":""},{"date":20200905,"state":"RI","positive":22484,"probableCases":null,"negative":265203,"pending":null,"totalTestResultsSource":"totalTestEncountersViral","totalTestResults":570929,"hospitalizedCurrently":82,"hospitalizedCumulative":2581,"inIcuCurrently":9,"inIcuCumulative":null,"onVentilatorCurrently":4,"onVentilatorCumulative":null,"recovered":2163,"dataQualityGrade":"A+","lastUpdateEt":"9/7/2020 12:00","dateModified":"2020-09-07T12:00:00Z","checkTimeEt":"09/07 08:00","death":1058,"hospitalized":2581,"dateChecked":"2020-09-07T12:00:00Z","totalTestsViral":null,"positiveTestsViral":31667,"negativeTestsViral":539262,"positiveCasesViral":22484,"deathConfirmed":null,"deathProbable":null,"totalTestEncountersViral":570929,"totalTestsPeopleViral":287687,"totalTestsAntibody":null,"positiveTestsAntibody":null,"negativeTestsAntibody":null,"totalTestsPeopleAntibody":null,"positiveTestsPeopleAntibody":null,"negativeTestsPeopleAntibody":null,"totalTestsPeopleAntigen":null,"positiveTestsPeopleAntigen":null,"totalTestsAntigen":null,"positiveTestsAntigen":null,"fips":"44","positiveIncrease":241,"negativeIncrease":3440,"total":287687,"totalTestResultsIncrease":13407,"posNeg":287687,"deathIncrease":3,"hospitalizedIncrease":22,"hash":"2e840cc6285ed69b54e1368c16cbaa27cfc04d71","commercialScore":0,"negativeRegularScore":0,"negativeScore":0,"positiveScore":0,"score":0,"grade":""},{"date":20200904,"state":"RI","positive":22243,"probableCases":null,"negative":261763,"pending":null,"totalTestResultsSource":"totalTestEncountersViral","totalTestResults":557522,"hospitalizedCurrently":76,"hospitalizedCumulative":2559,"inIcuCurrently":8,"inIcuCumulative":null,"onVentilatorCurrently":4,"onVentilatorCumulative":null,"recovered":2147,"dataQualityGrade":"A+","lastUpdateEt":"9/4/2020 12:00","dateModified":"2020-09-04T12:00:00Z","checkTimeEt":"09/04 08:00","death":1055,"hospitalized":2559,"dateChecked":"2020-09-04T12:00:00Z","totalTestsViral":null,"positiveTestsViral":31547,"negativeTestsViral":525975,"positiveCasesViral":22243,"deathConfirmed":null,"deathProbable":null,"totalTestEncountersViral":557522,"totalTestsPeopleViral":284006,"totalTestsAntibody":null,"positiveTestsAntibody":null,"negativeTestsAntibody":null,"totalTestsPeopleAntibody":null,"positiveTestsPeopleAntibody":null,"negativeTestsPeopleAntibody":null,"totalTestsPeopleAntigen":null,"positiveTestsPeopleAntigen":null,"totalTestsAntigen":null,"positiveTestsAntigen":null,"fips":"44","positiveIncrease":100,"negativeIncrease":2273,"total":284006,"totalTestResultsIncrease":9929,"posNeg":284006,"deathIncrease":0,"hospitalizedIncrease":19,"hash":"ca5e5758eac7a0d8a2b7b60d1cf620f747fb4e60","commercialScore":0,"negativeRegularScore":0,"negativeScore":0,"positiveScore":0,"score":0,"grade":""},{"date":20200903,"state":"RI","positive":22143,"probableCases":null,"negative":259490,"pending":null,"totalTestResultsSource":"totalTestEncountersViral","totalTestResults":547593,"hospitalizedCurrently":68,"hospitalizedCumulative":2540,"inIcuCurrently":7,"inIcuCumulative":null,"onVentilatorCurrently":4,"onVentilatorCumulative":null,"recovered":2137,"dataQualityGrade":"A+","lastUpdateEt":"9/3/2020 12:00","dateModified":"2020-09-03T12:00:00Z","checkTimeEt":"09/03 08:00","death":1055,"hospitalized":2540,"dateChecked":"2020-09-03T12:00:00Z","totalTestsViral":null,"positiveTestsViral":31447,"negativeTestsViral":516146,"positiveCasesViral":22143,"deathConfirmed":null,"deathProbable":null,"totalTestEncountersViral":547593,"totalTestsPeopleViral":281633,"totalTestsAntibody":null,"positiveTestsAntibody":null,"negativeTestsAntibody":null,"totalTestsPeopleAntibody":null,"positiveTestsPeopleAntibody":null,"negativeTestsPeopleAntibody":null,"totalTestsPeopleAntigen":null,"positiveTestsPeopleAntigen":null,"totalTestsAntigen":null,"positiveTestsAntigen":null,"fips":"44","positiveIncrease":65,"negativeIncrease":2927,"total":281633,"totalTestResultsIncrease":11454,"posNeg":281633,"deathIncrease":4,"hospitalizedIncrease":-2,"hash":"9669593887fe438eb0817760e701769433b7db3a","commercialScore":0,"negativeRegularScore":0,"negativeScore":0,"positiveScore":0,"score":0,"grade":""},{"date":20200902,"state":"RI","positive":22078,"probableCases":null,"negative":256563,"pending":null,"totalTestResultsSource":"totalTestEncountersViral","totalTestResults":536139,"hospitalizedCurrently":78,"hospitalizedCumulative":2542,"inIcuCurrently":8,"inIcuCumulative":null,"onVentilatorCurrently":4,"onVentilatorCumulative":null,"recovered":2130,"dataQualityGrade":"A+","lastUpdateEt":"9/2/2020 12:00","dateModified":"2020-09-02T12:00:00Z","checkTimeEt":"09/02 08:00","death":1051,"hospitalized":2542,"dateChecked":"2020-09-02T12:00:00Z","totalTestsViral":null,"positiveTestsViral":31362,"negativeTestsViral":504777,"positiveCasesViral":22078,"deathConfirmed":null,"deathProbable":null,"totalTestEncountersViral":536139,"totalTestsPeopleViral":278641,"totalTestsAntibody":null,"positiveTestsAntibody":null,"negativeTestsAntibody":null,"totalTestsPeopleAntibody":null,"positiveTestsPeopleAntibody":null,"negativeTestsPeopleAntibody":null,"totalTestsPeopleAntigen":null,"positiveTestsPeopleAntigen":null,"totalTestsAntigen":null,"positiveTestsAntigen":null,"fips":"44","positiveIncrease":76,"negativeIncrease":2083,"total":278641,"totalTestResultsIncrease":5651,"posNeg":278641,"deathIncrease":1,"hospitalizedIncrease":14,"hash":"3a747ada3006bf68e72f773ff1fc454b7a6365cb","commercialScore":0,"negativeRegularScore":0,"negativeScore":0,"positiveScore":0,"score":0,"grade":""},{"date":20200901,"state":"RI","positive":22002,"probableCases":null,"negative":254480,"pending":null,"totalTestResultsSource":"totalTestEncountersViral","totalTestResults":530488,"hospitalizedCurrently":81,"hospitalizedCumulative":2528,"inIcuCurrently":8,"inIcuCumulative":null,"onVentilatorCurrently":5,"onVentilatorCumulative":null,"recovered":2113,"dataQualityGrade":"A+","lastUpdateEt":"9/1/2020 12:00","dateModified":"2020-09-01T12:00:00Z","checkTimeEt":"09/01 08:00","death":1050,"hospitalized":2528,"dateChecked":"2020-09-01T12:00:00Z","totalTestsViral":null,"positiveTestsViral":31281,"negativeTestsViral":499207,"positiveCasesViral":22002,"deathConfirmed":null,"deathProbable":null,"totalTestEncountersViral":530488,"totalTestsPeopleViral":276482,"totalTestsAntibody":null,"positiveTestsAntibody":null,"negativeTestsAntibody":null,"totalTestsPeopleAntibody":null,"positiveTestsPeopleAntibody":null,"negativeTestsPeopleAntibody":null,"totalTestsPeopleAntigen":null,"positiveTestsPeopleAntigen":null,"totalTestsAntigen":null,"positiveTestsAntigen":null,"fips":"44","positiveIncrease":53,"negativeIncrease":2532,"total":276482,"totalTestResultsIncrease":6074,"posNeg":276482,"deathIncrease":2,"hospitalizedIncrease":9,"hash":"2c31b81f2e40c9262714a15fbbc9f5d3bd28daa9","commercialScore":0,"negativeRegularScore":0,"negativeScore":0,"positiveScore":0,"score":0,"grade":""},{"date":20200831,"state":"RI","positive":21949,"probableCases":null,"negative":251948,"pending":null,"totalTestResultsSource":"totalTestEncountersViral","totalTestResults":524414,"hospitalizedCurrently":77,"hospitalizedCumulative":2519,"inIcuCurrently":9,"inIcuCumulative":null,"onVentilatorCurrently":5,"onVentilatorCumulative":null,"recovered":2108,"dataQualityGrade":"A+","lastUpdateEt":"8/31/2020 12:00","dateModified":"2020-08-31T12:00:00Z","checkTimeEt":"08/31 08:00","death":1048,"hospitalized":2519,"dateChecked":"2020-08-31T12:00:00Z","totalTestsViral":null,"positiveTestsViral":31198,"negativeTestsViral":493216,"positiveCasesViral":21949,"deathConfirmed":null,"deathProbable":null,"totalTestEncountersViral":524414,"totalTestsPeopleViral":273897,"totalTestsAntibody":null,"positiveTestsAntibody":null,"negativeTestsAntibody":null,"totalTestsPeopleAntibody":null,"positiveTestsPeopleAntibody":null,"negativeTestsPeopleAntibody":null,"totalTestsPeopleAntigen":null,"positiveTestsPeopleAntigen":null,"totalTestsAntigen":null,"positiveTestsAntigen":null,"fips":"44","positiveIncrease":46,"negativeIncrease":1835,"total":273897,"totalTestResultsIncrease":3936,"posNeg":273897,"deathIncrease":1,"hospitalizedIncrease":0,"hash":"b8f5d3ee1b44fb09362296513c2fa91c42c2e616","commercialScore":0,"negativeRegularScore":0,"negativeScore":0,"positiveScore":0,"score":0,"grade":""},{"date":20200830,"state":"RI","positive":21903,"probableCases":null,"negative":250113,"pending":null,"totalTestResultsSource":"totalTestEncountersViral","totalTestResults":520478,"hospitalizedCurrently":77,"hospitalizedCumulative":2519,"inIcuCurrently":9,"inIcuCumulative":null,"onVentilatorCurrently":5,"onVentilatorCumulative":null,"recovered":2108,"dataQualityGrade":"A+","lastUpdateEt":"8/30/2020 12:00","dateModified":"2020-08-30T12:00:00Z","checkTimeEt":"08/30 08:00","death":1047,"hospitalized":2519,"dateChecked":"2020-08-30T12:00:00Z","totalTestsViral":null,"positiveTestsViral":31135,"negativeTestsViral":489343,"positiveCasesViral":21903,"deathConfirmed":null,"deathProbable":null,"totalTestEncountersViral":520478,"totalTestsPeopleViral":272016,"totalTestsAntibody":null,"positiveTestsAntibody":null,"negativeTestsAntibody":null,"totalTestsPeopleAntibody":null,"positiveTestsPeopleAntibody":null,"negativeTestsPeopleAntibody":null,"totalTestsPeopleAntigen":null,"positiveTestsPeopleAntigen":null,"totalTestsAntigen":null,"positiveTestsAntigen":null,"fips":"44","positiveIncrease":46,"negativeIncrease":1759,"total":272016,"totalTestResultsIncrease":5336,"posNeg":272016,"deathIncrease":0,"hospitalizedIncrease":5,"hash":"eef4b1a7217db535aea10fc46b2d4901e74d6a15","commercialScore":0,"negativeRegularScore":0,"negativeScore":0,"positiveScore":0,"score":0,"grade":""},{"date":20200829,"state":"RI","positive":21857,"probableCases":null,"negative":248354,"pending":null,"totalTestResultsSource":"totalTestEncountersViral","totalTestResults":515142,"hospitalizedCurrently":80,"hospitalizedCumulative":2514,"inIcuCurrently":8,"inIcuCumulative":null,"onVentilatorCurrently":6,"onVentilatorCumulative":null,"recovered":2101,"dataQualityGrade":"A+","lastUpdateEt":"8/29/2020 12:00","dateModified":"2020-08-29T12:00:00Z","checkTimeEt":"08/29 08:00","death":1047,"hospitalized":2514,"dateChecked":"2020-08-29T12:00:00Z","totalTestsViral":null,"positiveTestsViral":31071,"negativeTestsViral":484071,"positiveCasesViral":21857,"deathConfirmed":null,"deathProbable":null,"totalTestEncountersViral":515142,"totalTestsPeopleViral":270211,"totalTestsAntibody":null,"positiveTestsAntibody":null,"negativeTestsAntibody":null,"totalTestsPeopleAntibody":null,"positiveTestsPeopleAntibody":null,"negativeTestsPeopleAntibody":null,"totalTestsPeopleAntigen":null,"positiveTestsPeopleAntigen":null,"totalTestsAntigen":null,"positiveTestsAntigen":null,"fips":"44","positiveIncrease":174,"negativeIncrease":3246,"total":270211,"totalTestResultsIncrease":10238,"posNeg":270211,"deathIncrease":1,"hospitalizedIncrease":18,"hash":"2599f928b39766781e42e0009c5a30f74e14866a","commercialScore":0,"negativeRegularScore":0,"negativeScore":0,"positiveScore":0,"score":0,"grade":""},{"date":20200828,"state":"RI","positive":21683,"probableCases":null,"negative":245108,"pending":null,"totalTestResultsSource":"totalTestEncountersViral","totalTestResults":504904,"hospitalizedCurrently":81,"hospitalizedCumulative":2496,"inIcuCurrently":8,"inIcuCumulative":null,"onVentilatorCurrently":4,"onVentilatorCumulative":null,"recovered":2084,"dataQualityGrade":"A+","lastUpdateEt":"8/28/2020 12:00","dateModified":"2020-08-28T12:00:00Z","checkTimeEt":"08/28 08:00","death":1046,"hospitalized":2496,"dateChecked":"2020-08-28T12:00:00Z","totalTestsViral":null,"positiveTestsViral":30953,"negativeTestsViral":473951,"positiveCasesViral":21683,"deathConfirmed":null,"deathProbable":null,"totalTestEncountersViral":504904,"totalTestsPeopleViral":266791,"totalTestsAntibody":null,"positiveTestsAntibody":null,"negativeTestsAntibody":null,"totalTestsPeopleAntibody":null,"positiveTestsPeopleAntibody":null,"negativeTestsPeopleAntibody":null,"totalTestsPeopleAntigen":null,"positiveTestsPeopleAntigen":null,"totalTestsAntigen":null,"positiveTestsAntigen":null,"fips":"44","positiveIncrease":94,"negativeIncrease":3284,"total":266791,"totalTestResultsIncrease":9329,"posNeg":266791,"deathIncrease":2,"hospitalizedIncrease":11,"hash":"2e58d35dc44bac3e31b1870fd919e10b8c8c31c8","commercialScore":0,"negativeRegularScore":0,"negativeScore":0,"positiveScore":0,"score":0,"grade":""},{"date":20200827,"state":"RI","positive":21589,"probableCases":null,"negative":241824,"pending":null,"totalTestResultsSource":"totalTestEncountersViral","totalTestResults":495575,"hospitalizedCurrently":82,"hospitalizedCumulative":2485,"inIcuCurrently":10,"inIcuCumulative":null,"onVentilatorCurrently":3,"onVentilatorCumulative":null,"recovered":2073,"dataQualityGrade":"A+","lastUpdateEt":"8/27/2020 12:00","dateModified":"2020-08-27T12:00:00Z","checkTimeEt":"08/27 08:00","death":1044,"hospitalized":2485,"dateChecked":"2020-08-27T12:00:00Z","totalTestsViral":null,"positiveTestsViral":30872,"negativeTestsViral":464703,"positiveCasesViral":21589,"deathConfirmed":null,"deathProbable":null,"totalTestEncountersViral":495575,"totalTestsPeopleViral":263413,"totalTestsAntibody":null,"positiveTestsAntibody":null,"negativeTestsAntibody":null,"totalTestsPeopleAntibody":null,"positiveTestsPeopleAntibody":null,"negativeTestsPeopleAntibody":null,"totalTestsPeopleAntigen":null,"positiveTestsPeopleAntigen":null,"totalTestsAntigen":null,"positiveTestsAntigen":null,"fips":"44","positiveIncrease":135,"negativeIncrease":3648,"total":263413,"totalTestResultsIncrease":10549,"posNeg":263413,"deathIncrease":3,"hospitalizedIncrease":7,"hash":"a52fcc2b4d595874eddb8c447729ea8f084b9290","commercialScore":0,"negativeRegularScore":0,"negativeScore":0,"positiveScore":0,"score":0,"grade":""},{"date":20200826,"state":"RI","positive":21454,"probableCases":null,"negative":238176,"pending":null,"totalTestResultsSource":"totalTestEncountersViral","totalTestResults":485026,"hospitalizedCurrently":80,"hospitalizedCumulative":2478,"inIcuCurrently":11,"inIcuCumulative":null,"onVentilatorCurrently":4,"onVentilatorCumulative":null,"recovered":2069,"dataQualityGrade":"A+","lastUpdateEt":"8/26/2020 12:00","dateModified":"2020-08-26T12:00:00Z","checkTimeEt":"08/26 08:00","death":1041,"hospitalized":2478,"dateChecked":"2020-08-26T12:00:00Z","totalTestsViral":null,"positiveTestsViral":30697,"negativeTestsViral":454329,"positiveCasesViral":21454,"deathConfirmed":null,"deathProbable":null,"totalTestEncountersViral":485026,"totalTestsPeopleViral":259630,"totalTestsAntibody":null,"positiveTestsAntibody":null,"negativeTestsAntibody":null,"totalTestsPeopleAntibody":null,"positiveTestsPeopleAntibody":null,"negativeTestsPeopleAntibody":null,"totalTestsPeopleAntigen":null,"positiveTestsPeopleAntigen":null,"totalTestsAntigen":null,"positiveTestsAntigen":null,"fips":"44","positiveIncrease":82,"negativeIncrease":1759,"total":259630,"totalTestResultsIncrease":5643,"posNeg":259630,"deathIncrease":2,"hospitalizedIncrease":4,"hash":"22bfa0866fb28b40ee80fae030757f1665b1f1bb","commercialScore":0,"negativeRegularScore":0,"negativeScore":0,"positiveScore":0,"score":0,"grade":""},{"date":20200825,"state":"RI","positive":21372,"probableCases":null,"negative":236417,"pending":null,"totalTestResultsSource":"totalTestEncountersViral","totalTestResults":479383,"hospitalizedCurrently":87,"hospitalizedCumulative":2474,"inIcuCurrently":11,"inIcuCumulative":null,"onVentilatorCurrently":2,"onVentilatorCumulative":null,"recovered":2059,"dataQualityGrade":"A+","lastUpdateEt":"8/25/2020 12:00","dateModified":"2020-08-25T12:00:00Z","checkTimeEt":"08/25 08:00","death":1039,"hospitalized":2474,"dateChecked":"2020-08-25T12:00:00Z","totalTestsViral":null,"positiveTestsViral":30440,"negativeTestsViral":448943,"positiveCasesViral":21372,"deathConfirmed":null,"deathProbable":null,"totalTestEncountersViral":479383,"totalTestsPeopleViral":257789,"totalTestsAntibody":null,"positiveTestsAntibody":null,"negativeTestsAntibody":null,"totalTestsPeopleAntibody":null,"positiveTestsPeopleAntibody":null,"negativeTestsPeopleAntibody":null,"totalTestsPeopleAntigen":null,"positiveTestsPeopleAntigen":null,"totalTestsAntigen":null,"positiveTestsAntigen":null,"fips":"44","positiveIncrease":70,"negativeIncrease":3045,"total":257789,"totalTestResultsIncrease":5713,"posNeg":257789,"deathIncrease":4,"hospitalizedIncrease":14,"hash":"9400ad73b2e27142e92b3c564ca6e49ecb687bf7","commercialScore":0,"negativeRegularScore":0,"negativeScore":0,"positiveScore":0,"score":0,"grade":""},{"date":20200824,"state":"RI","positive":21302,"probableCases":null,"negative":233372,"pending":null,"totalTestResultsSource":"totalTestEncountersViral","totalTestResults":473670,"hospitalizedCurrently":80,"hospitalizedCumulative":2460,"inIcuCurrently":11,"inIcuCumulative":null,"onVentilatorCurrently":4,"onVentilatorCumulative":null,"recovered":2052,"dataQualityGrade":"A+","lastUpdateEt":"8/24/2020 12:00","dateModified":"2020-08-24T12:00:00Z","checkTimeEt":"08/24 08:00","death":1035,"hospitalized":2460,"dateChecked":"2020-08-24T12:00:00Z","totalTestsViral":null,"positiveTestsViral":30345,"negativeTestsViral":443325,"positiveCasesViral":21302,"deathConfirmed":null,"deathProbable":null,"totalTestEncountersViral":473670,"totalTestsPeopleViral":254674,"totalTestsAntibody":null,"positiveTestsAntibody":null,"negativeTestsAntibody":null,"totalTestsPeopleAntibody":null,"positiveTestsPeopleAntibody":null,"negativeTestsPeopleAntibody":null,"totalTestsPeopleAntigen":null,"positiveTestsPeopleAntigen":null,"totalTestsAntigen":null,"positiveTestsAntigen":null,"fips":"44","positiveIncrease":39,"negativeIncrease":2064,"total":254674,"totalTestResultsIncrease":3508,"posNeg":254674,"deathIncrease":0,"hospitalizedIncrease":0,"hash":"7cb6d333676d7ad2154e4b19b627d3362d2de8fc","commercialScore":0,"negativeRegularScore":0,"negativeScore":0,"positiveScore":0,"score":0,"grade":""},{"date":20200823,"state":"RI","positive":21263,"probableCases":null,"negative":231308,"pending":null,"totalTestResultsSource":"totalTestEncountersViral","totalTestResults":470162,"hospitalizedCurrently":80,"hospitalizedCumulative":2460,"inIcuCurrently":11,"inIcuCumulative":null,"onVentilatorCurrently":4,"onVentilatorCumulative":null,"recovered":2052,"dataQualityGrade":"A+","lastUpdateEt":"8/23/2020 12:00","dateModified":"2020-08-23T12:00:00Z","checkTimeEt":"08/23 08:00","death":1035,"hospitalized":2460,"dateChecked":"2020-08-23T12:00:00Z","totalTestsViral":null,"positiveTestsViral":30300,"negativeTestsViral":439862,"positiveCasesViral":21263,"deathConfirmed":null,"deathProbable":null,"totalTestEncountersViral":470162,"totalTestsPeopleViral":252571,"totalTestsAntibody":null,"positiveTestsAntibody":null,"negativeTestsAntibody":null,"totalTestsPeopleAntibody":null,"positiveTestsPeopleAntibody":null,"negativeTestsPeopleAntibody":null,"totalTestsPeopleAntigen":null,"positiveTestsPeopleAntigen":null,"totalTestsAntigen":null,"positiveTestsAntigen":null,"fips":"44","positiveIncrease":88,"negativeIncrease":2357,"total":252571,"totalTestResultsIncrease":5490,"posNeg":252571,"deathIncrease":0,"hospitalizedIncrease":5,"hash":"6f2c392cf121423e688c1c54be806fbf8b42d0d3","commercialScore":0,"negativeRegularScore":0,"negativeScore":0,"positiveScore":0,"score":0,"grade":""},{"date":20200822,"state":"RI","positive":21175,"probableCases":null,"negative":228951,"pending":null,"totalTestResultsSource":"totalTestEncountersViral","totalTestResults":464672,"hospitalizedCurrently":87,"hospitalizedCumulative":2455,"inIcuCurrently":9,"inIcuCumulative":null,"onVentilatorCurrently":4,"onVentilatorCumulative":null,"recovered":2040,"dataQualityGrade":"A+","lastUpdateEt":"8/22/2020 12:00","dateModified":"2020-08-22T12:00:00Z","checkTimeEt":"08/22 08:00","death":1035,"hospitalized":2455,"dateChecked":"2020-08-22T12:00:00Z","totalTestsViral":null,"positiveTestsViral":30211,"negativeTestsViral":434461,"positiveCasesViral":21175,"deathConfirmed":null,"deathProbable":null,"totalTestEncountersViral":464672,"totalTestsPeopleViral":250126,"totalTestsAntibody":null,"positiveTestsAntibody":null,"negativeTestsAntibody":null,"totalTestsPeopleAntibody":null,"positiveTestsPeopleAntibody":null,"negativeTestsPeopleAntibody":null,"totalTestsPeopleAntigen":null,"positiveTestsPeopleAntigen":null,"totalTestsAntigen":null,"positiveTestsAntigen":null,"fips":"44","positiveIncrease":153,"negativeIncrease":4119,"total":250126,"totalTestResultsIncrease":9695,"posNeg":250126,"deathIncrease":5,"hospitalizedIncrease":17,"hash":"cf716256ce30f27533ea747f4e31954ab1de7aa8","commercialScore":0,"negativeRegularScore":0,"negativeScore":0,"positiveScore":0,"score":0,"grade":""},{"date":20200821,"state":"RI","positive":21022,"probableCases":null,"negative":224832,"pending":null,"totalTestResultsSource":"totalTestEncountersViral","totalTestResults":454977,"hospitalizedCurrently":81,"hospitalizedCumulative":2438,"inIcuCurrently":9,"inIcuCumulative":null,"onVentilatorCurrently":5,"onVentilatorCumulative":null,"recovered":2031,"dataQualityGrade":"A+","lastUpdateEt":"8/21/2020 12:00","dateModified":"2020-08-21T12:00:00Z","checkTimeEt":"08/21 08:00","death":1030,"hospitalized":2438,"dateChecked":"2020-08-21T12:00:00Z","totalTestsViral":null,"positiveTestsViral":30022,"negativeTestsViral":424955,"positiveCasesViral":21022,"deathConfirmed":null,"deathProbable":null,"totalTestEncountersViral":454977,"totalTestsPeopleViral":245854,"totalTestsAntibody":null,"positiveTestsAntibody":null,"negativeTestsAntibody":null,"totalTestsPeopleAntibody":null,"positiveTestsPeopleAntibody":null,"negativeTestsPeopleAntibody":null,"totalTestsPeopleAntigen":null,"positiveTestsPeopleAntigen":null,"totalTestsAntigen":null,"positiveTestsAntigen":null,"fips":"44","positiveIncrease":151,"negativeIncrease":5940,"total":245854,"totalTestResultsIncrease":10403,"posNeg":245854,"deathIncrease":2,"hospitalizedIncrease":7,"hash":"03716c19e5e1a8178f077ac8dc6286eee20184ef","commercialScore":0,"negativeRegularScore":0,"negativeScore":0,"positiveScore":0,"score":0,"grade":""},{"date":20200820,"state":"RI","positive":20871,"probableCases":null,"negative":218892,"pending":null,"totalTestResultsSource":"totalTestEncountersViral","totalTestResults":444574,"hospitalizedCurrently":84,"hospitalizedCumulative":2431,"inIcuCurrently":8,"inIcuCumulative":null,"onVentilatorCurrently":4,"onVentilatorCumulative":null,"recovered":2021,"dataQualityGrade":"A+","lastUpdateEt":"8/20/2020 12:00","dateModified":"2020-08-20T12:00:00Z","checkTimeEt":"08/20 08:00","death":1028,"hospitalized":2431,"dateChecked":"2020-08-20T12:00:00Z","totalTestsViral":null,"positiveTestsViral":29831,"negativeTestsViral":414743,"positiveCasesViral":20871,"deathConfirmed":null,"deathProbable":null,"totalTestEncountersViral":444574,"totalTestsPeopleViral":239763,"totalTestsAntibody":null,"positiveTestsAntibody":null,"negativeTestsAntibody":null,"totalTestsPeopleAntibody":null,"positiveTestsPeopleAntibody":null,"negativeTestsPeopleAntibody":null,"totalTestsPeopleAntigen":null,"positiveTestsPeopleAntigen":null,"totalTestsAntigen":null,"positiveTestsAntigen":null,"fips":"44","positiveIncrease":76,"negativeIncrease":-18627,"total":239763,"totalTestResultsIncrease":4447,"posNeg":239763,"deathIncrease":1,"hospitalizedIncrease":12,"hash":"129f1dadb4a2775728486b8e73339adb3ad66324","commercialScore":0,"negativeRegularScore":0,"negativeScore":0,"positiveScore":0,"score":0,"grade":""},{"date":20200819,"state":"RI","positive":20795,"probableCases":null,"negative":237519,"pending":null,"totalTestResultsSource":"totalTestEncountersViral","totalTestResults":440127,"hospitalizedCurrently":82,"hospitalizedCumulative":2419,"inIcuCurrently":8,"inIcuCumulative":null,"onVentilatorCurrently":5,"onVentilatorCumulative":null,"recovered":2013,"dataQualityGrade":"A+","lastUpdateEt":"8/19/2020 12:00","dateModified":"2020-08-19T12:00:00Z","checkTimeEt":"08/19 08:00","death":1027,"hospitalized":2419,"dateChecked":"2020-08-19T12:00:00Z","totalTestsViral":null,"pos