[{"date":20201103,"state":"ID","positive":65845,"probableCases":8448,"negative":332894,"pending":null,"totalTestResultsSource":"totalTestsPeopleViral","totalTestResults":390291,"hospitalizedCurrently":155,"hospitalizedCumulative":2643,"inIcuCurrently":55,"inIcuCumulative":555,"onVentilatorCurrently":null,"onVentilatorCumulative":null,"recovered":30525,"dataQualityGrade":"A","lastUpdateEt":"11/2/2020 19:01","dateModified":"2020-11-02T19:01:00Z","checkTimeEt":"11/02 14:01","death":632,"hospitalized":2643,"dateChecked":"2020-11-02T19:01:00Z","totalTestsViral":530779,"positiveTestsViral":null,"negativeTestsViral":null,"positiveCasesViral":57397,"deathConfirmed":588,"deathProbable":44,"totalTestEncountersViral":null,"totalTestsPeopleViral":390291,"totalTestsAntibody":null,"positiveTestsAntibody":null,"negativeTestsAntibody":null,"totalTestsPeopleAntibody":null,"positiveTestsPeopleAntibody":null,"negativeTestsPeopleAntibody":null,"totalTestsPeopleAntigen":null,"positiveTestsPeopleAntigen":null,"totalTestsAntigen":null,"positiveTestsAntigen":null,"fips":"16","positiveIncrease":757,"negativeIncrease":1715,"total":398739,"totalTestResultsIncrease":2356,"posNeg":398739,"deathIncrease":2,"hospitalizedIncrease":28,"hash":"c9092462bcf3662530b0e6670a82a435ac276b0b","commercialScore":0,"negativeRegularScore":0,"negativeScore":0,"positiveScore":0,"score":0,"grade":""},{"date":20201102,"state":"ID","positive":65088,"probableCases":8332,"negative":331179,"pending":null,"totalTestResultsSource":"totalTestsPeopleViral","totalTestResults":387935,"hospitalizedCurrently":263,"hospitalizedCumulative":2615,"inIcuCurrently":74,"inIcuCumulative":552,"onVentilatorCurrently":null,"onVentilatorCumulative":null,"recovered":30218,"dataQualityGrade":"A","lastUpdateEt":"11/1/2020 19:00","dateModified":"2020-11-01T19:00:00Z","checkTimeEt":"11/01 14:00","death":630,"hospitalized":2615,"dateChecked":"2020-11-01T19:00:00Z","totalTestsViral":526012,"positiveTestsViral":null,"negativeTestsViral":null,"positiveCasesViral":56756,"deathConfirmed":586,"deathProbable":44,"totalTestEncountersViral":null,"totalTestsPeopleViral":387935,"totalTestsAntibody":null,"positiveTestsAntibody":null,"negativeTestsAntibody":null,"totalTestsPeopleAntibody":null,"positiveTestsPeopleAntibody":null,"negativeTestsPeopleAntibody":null,"totalTestsPeopleAntigen":null,"positiveTestsPeopleAntigen":null,"totalTestsAntigen":null,"positiveTestsAntigen":null,"fips":"16","positiveIncrease":480,"negativeIncrease":1596,"total":396267,"totalTestResultsIncrease":1953,"posNeg":396267,"deathIncrease":1,"hospitalizedIncrease":21,"hash":"6a8ed6abbd921522ae30be6dd28c03b692c6ea68","commercialScore":0,"negativeRegularScore":0,"negativeScore":0,"positiveScore":0,"score":0,"grade":""},{"date":20201101,"state":"ID","positive":64608,"probableCases":8209,"negative":329583,"pending":null,"totalTestResultsSource":"totalTestsPeopleViral","totalTestResults":385982,"hospitalizedCurrently":263,"hospitalizedCumulative":2594,"inIcuCurrently":74,"inIcuCumulative":551,"onVentilatorCurrently":null,"onVentilatorCumulative":null,"recovered":29867,"dataQualityGrade":"A","lastUpdateEt":"10/31/2020 19:00","dateModified":"2020-10-31T19:00:00Z","checkTimeEt":"10/31 15:00","death":629,"hospitalized":2594,"dateChecked":"2020-10-31T19:00:00Z","totalTestsViral":523318,"positiveTestsViral":null,"negativeTestsViral":null,"positiveCasesViral":56399,"deathConfirmed":585,"deathProbable":44,"totalTestEncountersViral":null,"totalTestsPeopleViral":385982,"totalTestsAntibody":null,"positiveTestsAntibody":null,"negativeTestsAntibody":null,"totalTestsPeopleAntibody":null,"positiveTestsPeopleAntibody":null,"negativeTestsPeopleAntibody":null,"totalTestsPeopleAntigen":null,"positiveTestsPeopleAntigen":null,"totalTestsAntigen":null,"positiveTestsAntigen":null,"fips":"16","positiveIncrease":798,"negativeIncrease":1503,"total":394191,"totalTestResultsIncrease":2068,"posNeg":394191,"deathIncrease":3,"hospitalizedIncrease":22,"hash":"4dffe718ccb00ce2fc66b07657ee0b71c9366250","commercialScore":0,"negativeRegularScore":0,"negativeScore":0,"positiveScore":0,"score":0,"grade":""},{"date":20201031,"state":"ID","positive":63810,"probableCases":7976,"negative":328080,"pending":null,"totalTestResultsSource":"totalTestsPeopleViral","totalTestResults":383914,"hospitalizedCurrently":263,"hospitalizedCumulative":2572,"inIcuCurrently":74,"inIcuCumulative":549,"onVentilatorCurrently":null,"onVentilatorCumulative":null,"recovered":29556,"dataQualityGrade":"A","lastUpdateEt":"10/30/2020 19:00","dateModified":"2020-10-30T19:00:00Z","checkTimeEt":"10/30 15:00","death":626,"hospitalized":2572,"dateChecked":"2020-10-30T19:00:00Z","totalTestsViral":520322,"positiveTestsViral":null,"negativeTestsViral":null,"positiveCasesViral":55834,"deathConfirmed":582,"deathProbable":44,"totalTestEncountersViral":null,"totalTestsPeopleViral":383914,"totalTestsAntibody":null,"positiveTestsAntibody":null,"negativeTestsAntibody":null,"totalTestsPeopleAntibody":null,"positiveTestsPeopleAntibody":null,"negativeTestsPeopleAntibody":null,"totalTestsPeopleAntigen":null,"positiveTestsPeopleAntigen":null,"totalTestsAntigen":null,"positiveTestsAntigen":null,"fips":"16","positiveIncrease":1064,"negativeIncrease":2041,"total":391890,"totalTestResultsIncrease":2906,"posNeg":391890,"deathIncrease":11,"hospitalizedIncrease":23,"hash":"1b52e785a71662cf10863c2460dd12d3d1d06f4b","commercialScore":0,"negativeRegularScore":0,"negativeScore":0,"positiveScore":0,"score":0,"grade":""},{"date":20201030,"state":"ID","positive":62746,"probableCases":7777,"negative":326039,"pending":null,"totalTestResultsSource":"totalTestsPeopleViral","totalTestResults":381008,"hospitalizedCurrently":286,"hospitalizedCumulative":2549,"inIcuCurrently":72,"inIcuCumulative":546,"onVentilatorCurrently":null,"onVentilatorCumulative":null,"recovered":29195,"dataQualityGrade":"A","lastUpdateEt":"10/29/2020 19:00","dateModified":"2020-10-29T19:00:00Z","checkTimeEt":"10/29 15:00","death":615,"hospitalized":2549,"dateChecked":"2020-10-29T19:00:00Z","totalTestsViral":515774,"positiveTestsViral":null,"negativeTestsViral":null,"positiveCasesViral":54969,"deathConfirmed":571,"deathProbable":44,"totalTestEncountersViral":null,"totalTestsPeopleViral":381008,"totalTestsAntibody":null,"positiveTestsAntibody":null,"negativeTestsAntibody":null,"totalTestsPeopleAntibody":null,"positiveTestsPeopleAntibody":null,"negativeTestsPeopleAntibody":null,"totalTestsPeopleAntigen":null,"positiveTestsPeopleAntigen":null,"totalTestsAntigen":null,"positiveTestsAntigen":null,"fips":"16","positiveIncrease":961,"negativeIncrease":2018,"total":388785,"totalTestResultsIncrease":2794,"posNeg":388785,"deathIncrease":16,"hospitalizedIncrease":35,"hash":"d10f013fe167025208b0ca899eff3a8c4ea12843","commercialScore":0,"negativeRegularScore":0,"negativeScore":0,"positiveScore":0,"score":0,"grade":""},{"date":20201029,"state":"ID","positive":61785,"probableCases":7592,"negative":324021,"pending":null,"totalTestResultsSource":"totalTestsPeopleViral","totalTestResults":378214,"hospitalizedCurrently":286,"hospitalizedCumulative":2514,"inIcuCurrently":72,"inIcuCumulative":546,"onVentilatorCurrently":null,"onVentilatorCumulative":null,"recovered":28890,"dataQualityGrade":"A","lastUpdateEt":"10/28/2020 19:00","dateModified":"2020-10-28T19:00:00Z","checkTimeEt":"10/28 15:00","death":599,"hospitalized":2514,"dateChecked":"2020-10-28T19:00:00Z","totalTestsViral":511141,"positiveTestsViral":null,"negativeTestsViral":null,"positiveCasesViral":54193,"deathConfirmed":555,"deathProbable":44,"totalTestEncountersViral":null,"totalTestsPeopleViral":378214,"totalTestsAntibody":null,"positiveTestsAntibody":null,"negativeTestsAntibody":null,"totalTestsPeopleAntibody":null,"positiveTestsPeopleAntibody":null,"negativeTestsPeopleAntibody":null,"totalTestsPeopleAntigen":null,"positiveTestsPeopleAntigen":null,"totalTestsAntigen":null,"positiveTestsAntigen":null,"fips":"16","positiveIncrease":862,"negativeIncrease":2160,"total":385806,"totalTestResultsIncrease":2814,"posNeg":385806,"deathIncrease":14,"hospitalizedIncrease":31,"hash":"7b69ec8d1af7287a27965a03f445500ca585560e","commercialScore":0,"negativeRegularScore":0,"negativeScore":0,"positiveScore":0,"score":0,"grade":""},{"date":20201028,"state":"ID","positive":60923,"probableCases":7384,"negative":321861,"pending":null,"totalTestResultsSource":"totalTestsPeopleViral","totalTestResults":375400,"hospitalizedCurrently":272,"hospitalizedCumulative":2483,"inIcuCurrently":75,"inIcuCumulative":542,"onVentilatorCurrently":null,"onVentilatorCumulative":null,"recovered":28553,"dataQualityGrade":"A","lastUpdateEt":"10/27/2020 19:00","dateModified":"2020-10-27T19:00:00Z","checkTimeEt":"10/27 15:00","death":585,"hospitalized":2483,"dateChecked":"2020-10-27T19:00:00Z","totalTestsViral":507279,"positiveTestsViral":null,"negativeTestsViral":null,"positiveCasesViral":53539,"deathConfirmed":541,"deathProbable":44,"totalTestEncountersViral":null,"totalTestsPeopleViral":375400,"totalTestsAntibody":null,"positiveTestsAntibody":null,"negativeTestsAntibody":null,"totalTestsPeopleAntibody":null,"positiveTestsPeopleAntibody":null,"negativeTestsPeopleAntibody":null,"totalTestsPeopleAntigen":null,"positiveTestsPeopleAntigen":null,"totalTestsAntigen":null,"positiveTestsAntigen":null,"fips":"16","positiveIncrease":882,"negativeIncrease":1370,"total":382784,"totalTestResultsIncrease":2063,"posNeg":382784,"deathIncrease":5,"hospitalizedIncrease":36,"hash":"2412dab47f0b54df4136faaaaee4ccd2de22aac4","commercialScore":0,"negativeRegularScore":0,"negativeScore":0,"positiveScore":0,"score":0,"grade":""},{"date":20201027,"state":"ID","positive":60041,"probableCases":7195,"negative":320491,"pending":null,"totalTestResultsSource":"totalTestsPeopleViral","totalTestResults":373337,"hospitalizedCurrently":272,"hospitalizedCumulative":2447,"inIcuCurrently":75,"inIcuCumulative":539,"onVentilatorCurrently":null,"onVentilatorCumulative":null,"recovered":28309,"dataQualityGrade":"A","lastUpdateEt":"10/26/2020 19:00","dateModified":"2020-10-26T19:00:00Z","checkTimeEt":"10/26 15:00","death":580,"hospitalized":2447,"dateChecked":"2020-10-26T19:00:00Z","totalTestsViral":503424,"positiveTestsViral":null,"negativeTestsViral":null,"positiveCasesViral":52846,"deathConfirmed":536,"deathProbable":44,"totalTestEncountersViral":null,"totalTestsPeopleViral":373337,"totalTestsAntibody":null,"positiveTestsAntibody":null,"negativeTestsAntibody":null,"totalTestsPeopleAntibody":null,"positiveTestsPeopleAntibody":null,"negativeTestsPeopleAntibody":null,"totalTestsPeopleAntigen":null,"positiveTestsPeopleAntigen":null,"totalTestsAntigen":null,"positiveTestsAntigen":null,"fips":"16","positiveIncrease":697,"negativeIncrease":2012,"total":380532,"totalTestResultsIncrease":2596,"posNeg":380532,"deathIncrease":7,"hospitalizedIncrease":16,"hash":"cef66498b408a168375b5baa09caab632530f16f","commercialScore":0,"negativeRegularScore":0,"negativeScore":0,"positiveScore":0,"score":0,"grade":""},{"date":20201026,"state":"ID","positive":59344,"probableCases":7082,"negative":318479,"pending":null,"totalTestResultsSource":"totalTestsPeopleViral","totalTestResults":370741,"hospitalizedCurrently":272,"hospitalizedCumulative":2431,"inIcuCurrently":75,"inIcuCumulative":535,"onVentilatorCurrently":null,"onVentilatorCumulative":null,"recovered":28056,"dataQualityGrade":"A","lastUpdateEt":"10/25/2020 19:00","dateModified":"2020-10-25T19:00:00Z","checkTimeEt":"10/25 15:00","death":573,"hospitalized":2431,"dateChecked":"2020-10-25T19:00:00Z","totalTestsViral":498257,"positiveTestsViral":null,"negativeTestsViral":null,"positiveCasesViral":52262,"deathConfirmed":528,"deathProbable":45,"totalTestEncountersViral":null,"totalTestsPeopleViral":370741,"totalTestsAntibody":null,"positiveTestsAntibody":null,"negativeTestsAntibody":null,"totalTestsPeopleAntibody":null,"positiveTestsPeopleAntibody":null,"negativeTestsPeopleAntibody":null,"totalTestsPeopleAntigen":null,"positiveTestsPeopleAntigen":null,"totalTestsAntigen":null,"positiveTestsAntigen":null,"fips":"16","positiveIncrease":650,"negativeIncrease":1646,"total":377823,"totalTestResultsIncrease":2172,"posNeg":377823,"deathIncrease":1,"hospitalizedIncrease":22,"hash":"5688e5a6dd89b9ea3b606ea5f2493525650e35d4","commercialScore":0,"negativeRegularScore":0,"negativeScore":0,"positiveScore":0,"score":0,"grade":""},{"date":20201025,"state":"ID","positive":58694,"probableCases":6958,"negative":316833,"pending":null,"totalTestResultsSource":"totalTestsPeopleViral","totalTestResults":368569,"hospitalizedCurrently":259,"hospitalizedCumulative":2409,"inIcuCurrently":66,"inIcuCumulative":530,"onVentilatorCurrently":null,"onVentilatorCumulative":null,"recovered":27760,"dataQualityGrade":"A","lastUpdateEt":"10/24/2020 19:00","dateModified":"2020-10-24T19:00:00Z","checkTimeEt":"10/24 15:00","death":572,"hospitalized":2409,"dateChecked":"2020-10-24T19:00:00Z","totalTestsViral":495961,"positiveTestsViral":null,"negativeTestsViral":null,"positiveCasesViral":51736,"deathConfirmed":527,"deathProbable":45,"totalTestEncountersViral":null,"totalTestsPeopleViral":368569,"totalTestsAntibody":null,"positiveTestsAntibody":null,"negativeTestsAntibody":null,"totalTestsPeopleAntibody":null,"positiveTestsPeopleAntibody":null,"negativeTestsPeopleAntibody":null,"totalTestsPeopleAntigen":null,"positiveTestsPeopleAntigen":null,"totalTestsAntigen":null,"positiveTestsAntigen":null,"fips":"16","positiveIncrease":1021,"negativeIncrease":1688,"total":375527,"totalTestResultsIncrease":2522,"posNeg":375527,"deathIncrease":10,"hospitalizedIncrease":22,"hash":"4ee2bf9346f61cb88b3cf90888098fa4a59beee0","commercialScore":0,"negativeRegularScore":0,"negativeScore":0,"positiveScore":0,"score":0,"grade":""},{"date":20201024,"state":"ID","positive":57673,"probableCases":6771,"negative":315145,"pending":null,"totalTestResultsSource":"totalTestsPeopleViral","totalTestResults":366047,"hospitalizedCurrently":259,"hospitalizedCumulative":2387,"inIcuCurrently":66,"inIcuCumulative":527,"onVentilatorCurrently":null,"onVentilatorCumulative":null,"recovered":27509,"dataQualityGrade":"A","lastUpdateEt":"10/23/2020 19:10","dateModified":"2020-10-23T19:10:00Z","checkTimeEt":"10/23 15:10","death":562,"hospitalized":2387,"dateChecked":"2020-10-23T19:10:00Z","totalTestsViral":492461,"positiveTestsViral":null,"negativeTestsViral":null,"positiveCasesViral":50902,"deathConfirmed":518,"deathProbable":44,"totalTestEncountersViral":null,"totalTestsPeopleViral":366047,"totalTestsAntibody":null,"positiveTestsAntibody":null,"negativeTestsAntibody":null,"totalTestsPeopleAntibody":null,"positiveTestsPeopleAntibody":null,"negativeTestsPeopleAntibody":null,"totalTestsPeopleAntigen":null,"positiveTestsPeopleAntigen":null,"totalTestsAntigen":null,"positiveTestsAntigen":null,"fips":"16","positiveIncrease":1073,"negativeIncrease":2078,"total":372818,"totalTestResultsIncrease":2999,"posNeg":372818,"deathIncrease":9,"hospitalizedIncrease":24,"hash":"e3e013bbb280ebea7e246e818cd6a914d583b770","commercialScore":0,"negativeRegularScore":0,"negativeScore":0,"positiveScore":0,"score":0,"grade":""},{"date":20201023,"state":"ID","positive":56600,"probableCases":6619,"negative":313067,"pending":null,"totalTestResultsSource":"totalTestsPeopleViral","totalTestResults":363048,"hospitalizedCurrently":193,"hospitalizedCumulative":2363,"inIcuCurrently":54,"inIcuCumulative":524,"onVentilatorCurrently":null,"onVentilatorCumulative":null,"recovered":27221,"dataQualityGrade":"A","lastUpdateEt":"10/22/2020 19:00","dateModified":"2020-10-22T19:00:00Z","checkTimeEt":"10/22 15:00","death":553,"hospitalized":2363,"dateChecked":"2020-10-22T19:00:00Z","totalTestsViral":487896,"positiveTestsViral":null,"negativeTestsViral":null,"positiveCasesViral":49981,"deathConfirmed":509,"deathProbable":44,"totalTestEncountersViral":null,"totalTestsPeopleViral":363048,"totalTestsAntibody":null,"positiveTestsAntibody":null,"negativeTestsAntibody":null,"totalTestsPeopleAntibody":null,"positiveTestsPeopleAntibody":null,"negativeTestsPeopleAntibody":null,"totalTestsPeopleAntigen":null,"positiveTestsPeopleAntigen":null,"totalTestsAntigen":null,"positiveTestsAntigen":null,"fips":"16","positiveIncrease":950,"negativeIncrease":2110,"total":369667,"totalTestResultsIncrease":2863,"posNeg":369667,"deathIncrease":7,"hospitalizedIncrease":36,"hash":"c9a87b4730475f777111d7db64fd53ccbe0f3313","commercialScore":0,"negativeRegularScore":0,"negativeScore":0,"positiveScore":0,"score":0,"grade":""},{"date":20201022,"state":"ID","positive":55650,"probableCases":6422,"negative":310957,"pending":null,"totalTestResultsSource":"totalTestsPeopleViral","totalTestResults":360185,"hospitalizedCurrently":193,"hospitalizedCumulative":2327,"inIcuCurrently":54,"inIcuCumulative":514,"onVentilatorCurrently":null,"onVentilatorCumulative":null,"recovered":26916,"dataQualityGrade":"A","lastUpdateEt":"10/21/2020 19:25","dateModified":"2020-10-21T19:25:00Z","checkTimeEt":"10/21 15:25","death":546,"hospitalized":2327,"dateChecked":"2020-10-21T19:25:00Z","totalTestsViral":475429,"positiveTestsViral":null,"negativeTestsViral":null,"positiveCasesViral":49228,"deathConfirmed":503,"deathProbable":43,"totalTestEncountersViral":null,"totalTestsPeopleViral":360185,"totalTestsAntibody":null,"positiveTestsAntibody":null,"negativeTestsAntibody":null,"totalTestsPeopleAntibody":null,"positiveTestsPeopleAntibody":null,"negativeTestsPeopleAntibody":null,"totalTestsPeopleAntigen":null,"positiveTestsPeopleAntigen":null,"totalTestsAntigen":null,"positiveTestsAntigen":null,"fips":"16","positiveIncrease":987,"negativeIncrease":1648,"total":366607,"totalTestResultsIncrease":2352,"posNeg":366607,"deathIncrease":11,"hospitalizedIncrease":50,"hash":"1c596ef0d9eb92ae69b15332a49d11efa323c4b8","commercialScore":0,"negativeRegularScore":0,"negativeScore":0,"positiveScore":0,"score":0,"grade":""},{"date":20201021,"state":"ID","positive":54663,"probableCases":6139,"negative":309309,"pending":null,"totalTestResultsSource":"totalTestsPeopleViral","totalTestResults":357833,"hospitalizedCurrently":187,"hospitalizedCumulative":2277,"inIcuCurrently":54,"inIcuCumulative":509,"onVentilatorCurrently":null,"onVentilatorCumulative":null,"recovered":26549,"dataQualityGrade":"A","lastUpdateEt":"10/20/2020 16:25","dateModified":"2020-10-20T16:25:00Z","checkTimeEt":"10/20 12:25","death":535,"hospitalized":2277,"dateChecked":"2020-10-20T16:25:00Z","totalTestsViral":471700,"positiveTestsViral":null,"negativeTestsViral":null,"positiveCasesViral":48524,"deathConfirmed":492,"deathProbable":43,"totalTestEncountersViral":null,"totalTestsPeopleViral":357833,"totalTestsAntibody":null,"positiveTestsAntibody":null,"negativeTestsAntibody":null,"totalTestsPeopleAntibody":null,"positiveTestsPeopleAntibody":null,"negativeTestsPeopleAntibody":null,"totalTestsPeopleAntigen":null,"positiveTestsPeopleAntigen":null,"totalTestsAntigen":null,"positiveTestsAntigen":null,"fips":"16","positiveIncrease":873,"negativeIncrease":1697,"total":363972,"totalTestResultsIncrease":2451,"posNeg":363972,"deathIncrease":4,"hospitalizedIncrease":46,"hash":"ccf76914ab59104a116ae8fc11b473b03d9f65a0","commercialScore":0,"negativeRegularScore":0,"negativeScore":0,"positiveScore":0,"score":0,"grade":""},{"date":20201020,"state":"ID","positive":53790,"probableCases":6020,"negative":307612,"pending":null,"totalTestResultsSource":"totalTestsPeopleViral","totalTestResults":355382,"hospitalizedCurrently":187,"hospitalizedCumulative":2231,"inIcuCurrently":54,"inIcuCumulative":506,"onVentilatorCurrently":null,"onVentilatorCumulative":null,"recovered":26238,"dataQualityGrade":"A","lastUpdateEt":"10/19/2020 19:38","dateModified":"2020-10-19T19:38:00Z","checkTimeEt":"10/19 15:38","death":531,"hospitalized":2231,"dateChecked":"2020-10-19T19:38:00Z","totalTestsViral":467709,"positiveTestsViral":null,"negativeTestsViral":null,"positiveCasesViral":47770,"deathConfirmed":488,"deathProbable":43,"totalTestEncountersViral":null,"totalTestsPeopleViral":355382,"totalTestsAntibody":null,"positiveTestsAntibody":null,"negativeTestsAntibody":null,"totalTestsPeopleAntibody":null,"positiveTestsPeopleAntibody":null,"negativeTestsPeopleAntibody":null,"totalTestsPeopleAntigen":null,"positiveTestsPeopleAntigen":null,"totalTestsAntigen":null,"positiveTestsAntigen":null,"fips":"16","positiveIncrease":698,"negativeIncrease":1597,"total":361402,"totalTestResultsIncrease":2192,"posNeg":361402,"deathIncrease":3,"hospitalizedIncrease":25,"hash":"9e3b1d147b953344f1dcfc1f24d480f7c94f607c","commercialScore":0,"negativeRegularScore":0,"negativeScore":0,"positiveScore":0,"score":0,"grade":""},{"date":20201019,"state":"ID","positive":53092,"probableCases":5917,"negative":306015,"pending":null,"totalTestResultsSource":"totalTestsPeopleViral","totalTestResults":353190,"hospitalizedCurrently":221,"hospitalizedCumulative":2206,"inIcuCurrently":55,"inIcuCumulative":504,"onVentilatorCurrently":null,"onVentilatorCumulative":null,"recovered":25980,"dataQualityGrade":"A","lastUpdateEt":"10/18/2020 19:00","dateModified":"2020-10-18T19:00:00Z","checkTimeEt":"10/18 15:00","death":528,"hospitalized":2206,"dateChecked":"2020-10-18T19:00:00Z","totalTestsViral":463548,"positiveTestsViral":null,"negativeTestsViral":null,"positiveCasesViral":47175,"deathConfirmed":486,"deathProbable":42,"totalTestEncountersViral":null,"totalTestsPeopleViral":353190,"totalTestsAntibody":null,"positiveTestsAntibody":null,"negativeTestsAntibody":null,"totalTestsPeopleAntibody":null,"positiveTestsPeopleAntibody":null,"negativeTestsPeopleAntibody":null,"totalTestsPeopleAntigen":null,"positiveTestsPeopleAntigen":null,"totalTestsAntigen":null,"positiveTestsAntigen":null,"fips":"16","positiveIncrease":510,"negativeIncrease":2457,"total":359107,"totalTestResultsIncrease":2878,"posNeg":359107,"deathIncrease":-1,"hospitalizedIncrease":13,"hash":"1134a18d13efeb7add712e6d5c6fa0982b417fae","commercialScore":0,"negativeRegularScore":0,"negativeScore":0,"positiveScore":0,"score":0,"grade":""},{"date":20201018,"state":"ID","positive":52582,"probableCases":5828,"negative":303558,"pending":null,"totalTestResultsSource":"totalTestsPeopleViral","totalTestResults":350312,"hospitalizedCurrently":221,"hospitalizedCumulative":2193,"inIcuCurrently":55,"inIcuCumulative":503,"onVentilatorCurrently":null,"onVentilatorCumulative":null,"recovered":25679,"dataQualityGrade":"A","lastUpdateEt":"10/17/2020 19:00","dateModified":"2020-10-17T19:00:00Z","checkTimeEt":"10/17 15:00","death":529,"hospitalized":2193,"dateChecked":"2020-10-17T19:00:00Z","totalTestsViral":460230,"positiveTestsViral":null,"negativeTestsViral":null,"positiveCasesViral":46754,"deathConfirmed":487,"deathProbable":42,"totalTestEncountersViral":null,"totalTestsPeopleViral":350312,"totalTestsAntibody":null,"positiveTestsAntibody":null,"negativeTestsAntibody":null,"totalTestsPeopleAntibody":null,"positiveTestsPeopleAntibody":null,"negativeTestsPeopleAntibody":null,"totalTestsPeopleAntigen":null,"positiveTestsPeopleAntigen":null,"totalTestsAntigen":null,"positiveTestsAntigen":null,"fips":"16","positiveIncrease":878,"negativeIncrease":1126,"total":356140,"totalTestResultsIncrease":1794,"posNeg":356140,"deathIncrease":6,"hospitalizedIncrease":19,"hash":"dbb4571ff43dcba63f7ff6c31bd916f31c09ed30","commercialScore":0,"negativeRegularScore":0,"negativeScore":0,"positiveScore":0,"score":0,"grade":""},{"date":20201017,"state":"ID","positive":51704,"probableCases":5618,"negative":302432,"pending":null,"totalTestResultsSource":"totalTestsPeopleViral","totalTestResults":348518,"hospitalizedCurrently":221,"hospitalizedCumulative":2174,"inIcuCurrently":55,"inIcuCumulative":495,"onVentilatorCurrently":null,"onVentilatorCumulative":null,"recovered":25457,"dataQualityGrade":"A","lastUpdateEt":"10/16/2020 19:00","dateModified":"2020-10-16T19:00:00Z","checkTimeEt":"10/16 15:00","death":523,"hospitalized":2174,"dateChecked":"2020-10-16T19:00:00Z","totalTestsViral":457644,"positiveTestsViral":null,"negativeTestsViral":null,"positiveCasesViral":46086,"deathConfirmed":482,"deathProbable":41,"totalTestEncountersViral":null,"totalTestsPeopleViral":348518,"totalTestsAntibody":null,"positiveTestsAntibody":null,"negativeTestsAntibody":null,"totalTestsPeopleAntibody":null,"positiveTestsPeopleAntibody":null,"negativeTestsPeopleAntibody":null,"totalTestsPeopleAntigen":null,"positiveTestsPeopleAntigen":null,"totalTestsAntigen":null,"positiveTestsAntigen":null,"fips":"16","positiveIncrease":1094,"negativeIncrease":2070,"total":354136,"totalTestResultsIncrease":2933,"posNeg":354136,"deathIncrease":6,"hospitalizedIncrease":37,"hash":"1714ba81d82df80693e823a292e64ba21cbc4245","commercialScore":0,"negativeRegularScore":0,"negativeScore":0,"positiveScore":0,"score":0,"grade":""},{"date":20201016,"state":"ID","positive":50610,"probableCases":5387,"negative":300362,"pending":null,"totalTestResultsSource":"totalTestsPeopleViral","totalTestResults":345585,"hospitalizedCurrently":219,"hospitalizedCumulative":2137,"inIcuCurrently":56,"inIcuCumulative":494,"onVentilatorCurrently":null,"onVentilatorCumulative":null,"recovered":25214,"dataQualityGrade":"A","lastUpdateEt":"10/15/2020 19:17","dateModified":"2020-10-15T19:17:00Z","checkTimeEt":"10/15 15:17","death":517,"hospitalized":2137,"dateChecked":"2020-10-15T19:17:00Z","totalTestsViral":452701,"positiveTestsViral":null,"negativeTestsViral":null,"positiveCasesViral":45223,"deathConfirmed":476,"deathProbable":41,"totalTestEncountersViral":null,"totalTestsPeopleViral":345585,"totalTestsAntibody":null,"positiveTestsAntibody":null,"negativeTestsAntibody":null,"totalTestsPeopleAntibody":null,"positiveTestsPeopleAntibody":null,"negativeTestsPeopleAntibody":null,"totalTestsPeopleAntigen":null,"positiveTestsPeopleAntigen":null,"totalTestsAntigen":null,"positiveTestsAntigen":null,"fips":"16","positiveIncrease":718,"negativeIncrease":2143,"total":350972,"totalTestResultsIncrease":2715,"posNeg":350972,"deathIncrease":1,"hospitalizedIncrease":15,"hash":"dfc8a5125ade4ccac75667af5747d2b3ee8e5909","commercialScore":0,"negativeRegularScore":0,"negativeScore":0,"positiveScore":0,"score":0,"grade":""},{"date":20201015,"state":"ID","positive":49892,"probableCases":5241,"negative":298219,"pending":null,"totalTestResultsSource":"totalTestsPeopleViral","totalTestResults":342870,"hospitalizedCurrently":219,"hospitalizedCumulative":2122,"inIcuCurrently":56,"inIcuCumulative":492,"onVentilatorCurrently":null,"onVentilatorCumulative":null,"recovered":24983,"dataQualityGrade":"A","lastUpdateEt":"10/14/2020 19:00","dateModified":"2020-10-14T19:00:00Z","checkTimeEt":"10/14 15:00","death":516,"hospitalized":2122,"dateChecked":"2020-10-14T19:00:00Z","totalTestsViral":null,"positiveTestsViral":null,"negativeTestsViral":null,"positiveCasesViral":44651,"deathConfirmed":475,"deathProbable":41,"totalTestEncountersViral":null,"totalTestsPeopleViral":342870,"totalTestsAntibody":null,"positiveTestsAntibody":null,"negativeTestsAntibody":null,"totalTestsPeopleAntibody":null,"positiveTestsPeopleAntibody":null,"negativeTestsPeopleAntibody":null,"totalTestsPeopleAntigen":null,"positiveTestsPeopleAntigen":null,"totalTestsAntigen":null,"positiveTestsAntigen":null,"fips":"16","positiveIncrease":645,"negativeIncrease":1603,"total":348111,"totalTestResultsIncrease":2094,"posNeg":348111,"deathIncrease":4,"hospitalizedIncrease":36,"hash":"61e7b9e5c934c2b7812058bdd0bdd4c8577d069e","commercialScore":0,"negativeRegularScore":0,"negativeScore":0,"positiveScore":0,"score":0,"grade":""},{"date":20201014,"state":"ID","positive":49247,"probableCases":5087,"negative":296616,"pending":null,"totalTestResultsSource":"totalTestsPeopleViral","totalTestResults":340776,"hospitalizedCurrently":187,"hospitalizedCumulative":2086,"inIcuCurrently":54,"inIcuCumulative":487,"onVentilatorCurrently":null,"onVentilatorCumulative":null,"recovered":24699,"dataQualityGrade":"A","lastUpdateEt":"10/13/2020 19:06","dateModified":"2020-10-13T19:06:00Z","checkTimeEt":"10/13 15:06","death":512,"hospitalized":2086,"dateChecked":"2020-10-13T19:06:00Z","totalTestsViral":null,"positiveTestsViral":null,"negativeTestsViral":null,"positiveCasesViral":44160,"deathConfirmed":471,"deathProbable":41,"totalTestEncountersViral":null,"totalTestsPeopleViral":340776,"totalTestsAntibody":null,"positiveTestsAntibody":null,"negativeTestsAntibody":null,"totalTestsPeopleAntibody":null,"positiveTestsPeopleAntibody":null,"negativeTestsPeopleAntibody":null,"totalTestsPeopleAntigen":null,"positiveTestsPeopleAntigen":null,"totalTestsAntigen":null,"positiveTestsAntigen":null,"fips":"16","positiveIncrease":584,"negativeIncrease":2276,"total":345863,"totalTestResultsIncrease":2776,"posNeg":345863,"deathIncrease":2,"hospitalizedIncrease":28,"hash":"7275d946f1e357ec1b8b5c46e9ef5ca307ef7b7e","commercialScore":0,"negativeRegularScore":0,"negativeScore":0,"positiveScore":0,"score":0,"grade":""},{"date":20201013,"state":"ID","positive":48663,"probableCases":5003,"negative":294340,"pending":null,"totalTestResultsSource":"totalTestsPeopleViral","totalTestResults":338000,"hospitalizedCurrently":187,"hospitalizedCumulative":2058,"inIcuCurrently":54,"inIcuCumulative":481,"onVentilatorCurrently":null,"onVentilatorCumulative":null,"recovered":24523,"dataQualityGrade":"A","lastUpdateEt":"10/12/2020 19:00","dateModified":"2020-10-12T19:00:00Z","checkTimeEt":"10/12 15:00","death":510,"hospitalized":2058,"dateChecked":"2020-10-12T19:00:00Z","totalTestsViral":null,"positiveTestsViral":null,"negativeTestsViral":null,"positiveCasesViral":43660,"deathConfirmed":469,"deathProbable":41,"totalTestEncountersViral":null,"totalTestsPeopleViral":338000,"totalTestsAntibody":null,"positiveTestsAntibody":null,"negativeTestsAntibody":null,"totalTestsPeopleAntibody":null,"positiveTestsPeopleAntibody":null,"negativeTestsPeopleAntibody":null,"totalTestsPeopleAntigen":null,"positiveTestsPeopleAntigen":null,"totalTestsAntigen":null,"positiveTestsAntigen":null,"fips":"16","positiveIncrease":597,"negativeIncrease":1783,"total":343003,"totalTestResultsIncrease":2330,"posNeg":343003,"deathIncrease":3,"hospitalizedIncrease":17,"hash":"18f1232afb27fd236f5ef85333fbc21aeed7f804","commercialScore":0,"negativeRegularScore":0,"negativeScore":0,"positiveScore":0,"score":0,"grade":""},{"date":20201012,"state":"ID","positive":48066,"probableCases":4953,"negative":292557,"pending":null,"totalTestResultsSource":"totalTestsPeopleViral","totalTestResults":335670,"hospitalizedCurrently":192,"hospitalizedCumulative":2041,"inIcuCurrently":45,"inIcuCumulative":479,"onVentilatorCurrently":null,"onVentilatorCumulative":null,"recovered":24304,"dataQualityGrade":"A","lastUpdateEt":"10/11/2020 19:00","dateModified":"2020-10-11T19:00:00Z","checkTimeEt":"10/11 15:00","death":507,"hospitalized":2041,"dateChecked":"2020-10-11T19:00:00Z","totalTestsViral":null,"positiveTestsViral":null,"negativeTestsViral":null,"positiveCasesViral":43113,"deathConfirmed":466,"deathProbable":41,"totalTestEncountersViral":null,"totalTestsPeopleViral":335670,"totalTestsAntibody":null,"positiveTestsAntibody":null,"negativeTestsAntibody":null,"totalTestsPeopleAntibody":null,"positiveTestsPeopleAntibody":null,"negativeTestsPeopleAntibody":null,"totalTestsPeopleAntigen":null,"positiveTestsPeopleAntigen":null,"totalTestsAntigen":null,"positiveTestsAntigen":null,"fips":"16","positiveIncrease":365,"negativeIncrease":1488,"total":340623,"totalTestResultsIncrease":1831,"posNeg":340623,"deathIncrease":0,"hospitalizedIncrease":10,"hash":"800dc4e825c43cd57fe048f186bef11194ec378f","commercialScore":0,"negativeRegularScore":0,"negativeScore":0,"positiveScore":0,"score":0,"grade":""},{"date":20201011,"state":"ID","positive":47701,"probableCases":4931,"negative":291069,"pending":null,"totalTestResultsSource":"totalTestsPeopleViral","totalTestResults":333839,"hospitalizedCurrently":192,"hospitalizedCumulative":2031,"inIcuCurrently":45,"inIcuCumulative":478,"onVentilatorCurrently":null,"onVentilatorCumulative":null,"recovered":24089,"dataQualityGrade":"A","lastUpdateEt":"10/10/2020 19:00","dateModified":"2020-10-10T19:00:00Z","checkTimeEt":"10/10 15:00","death":507,"hospitalized":2031,"dateChecked":"2020-10-10T19:00:00Z","totalTestsViral":null,"positiveTestsViral":null,"negativeTestsViral":null,"positiveCasesViral":42770,"deathConfirmed":466,"deathProbable":41,"totalTestEncountersViral":null,"totalTestsPeopleViral":333839,"totalTestsAntibody":null,"positiveTestsAntibody":null,"negativeTestsAntibody":null,"totalTestsPeopleAntibody":null,"positiveTestsPeopleAntibody":null,"negativeTestsPeopleAntibody":null,"totalTestsPeopleAntigen":null,"positiveTestsPeopleAntigen":null,"totalTestsAntigen":null,"positiveTestsAntigen":null,"fips":"16","positiveIncrease":613,"negativeIncrease":2367,"total":338770,"totalTestResultsIncrease":2877,"posNeg":338770,"deathIncrease":1,"hospitalizedIncrease":18,"hash":"27c55225d1dd0ebac6fc0b89224d2bd0786b377a","commercialScore":0,"negativeRegularScore":0,"negativeScore":0,"positiveScore":0,"score":0,"grade":""},{"date":20201010,"state":"ID","positive":47088,"probableCases":4828,"negative":288702,"pending":null,"totalTestResultsSource":"totalTestsPeopleViral","totalTestResults":330962,"hospitalizedCurrently":192,"hospitalizedCumulative":2013,"inIcuCurrently":45,"inIcuCumulative":475,"onVentilatorCurrently":null,"onVentilatorCumulative":null,"recovered":23881,"dataQualityGrade":"A","lastUpdateEt":"10/9/2020 19:00","dateModified":"2020-10-09T19:00:00Z","checkTimeEt":"10/09 15:00","death":506,"hospitalized":2013,"dateChecked":"2020-10-09T19:00:00Z","totalTestsViral":null,"positiveTestsViral":null,"negativeTestsViral":null,"positiveCasesViral":42260,"deathConfirmed":464,"deathProbable":42,"totalTestEncountersViral":null,"totalTestsPeopleViral":330962,"totalTestsAntibody":null,"positiveTestsAntibody":null,"negativeTestsAntibody":null,"totalTestsPeopleAntibody":null,"positiveTestsPeopleAntibody":null,"negativeTestsPeopleAntibody":null,"totalTestsPeopleAntigen":null,"positiveTestsPeopleAntigen":null,"totalTestsAntigen":null,"positiveTestsAntigen":null,"fips":"16","positiveIncrease":662,"negativeIncrease":3653,"total":335790,"totalTestResultsIncrease":4173,"posNeg":335790,"deathIncrease":3,"hospitalizedIncrease":16,"hash":"91ac8396bd4146af8107e9cfe5084b65c67d070f","commercialScore":0,"negativeRegularScore":0,"negativeScore":0,"positiveScore":0,"score":0,"grade":""},{"date":20201009,"state":"ID","positive":46426,"probableCases":4686,"negative":285049,"pending":null,"totalTestResultsSource":"totalTestsPeopleViral","totalTestResults":326789,"hospitalizedCurrently":191,"hospitalizedCumulative":1997,"inIcuCurrently":41,"inIcuCumulative":474,"onVentilatorCurrently":null,"onVentilatorCumulative":null,"recovered":23678,"dataQualityGrade":"A","lastUpdateEt":"10/8/2020 19:00","dateModified":"2020-10-08T19:00:00Z","checkTimeEt":"10/08 15:00","death":503,"hospitalized":1997,"dateChecked":"2020-10-08T19:00:00Z","totalTestsViral":null,"positiveTestsViral":null,"negativeTestsViral":null,"positiveCasesViral":41740,"deathConfirmed":462,"deathProbable":41,"totalTestEncountersViral":null,"totalTestsPeopleViral":326789,"totalTestsAntibody":null,"positiveTestsAntibody":null,"negativeTestsAntibody":null,"totalTestsPeopleAntibody":null,"positiveTestsPeopleAntibody":null,"negativeTestsPeopleAntibody":null,"totalTestsPeopleAntigen":null,"positiveTestsPeopleAntigen":null,"totalTestsAntigen":null,"positiveTestsAntigen":null,"fips":"16","positiveIncrease":673,"negativeIncrease":1941,"total":331475,"totalTestResultsIncrease":2461,"posNeg":331475,"deathIncrease":3,"hospitalizedIncrease":25,"hash":"71608398c3bf34b74ed05c51d1c162e3d5dfdd1a","commercialScore":0,"negativeRegularScore":0,"negativeScore":0,"positiveScore":0,"score":0,"grade":""},{"date":20201008,"state":"ID","positive":45753,"probableCases":4533,"negative":283108,"pending":null,"totalTestResultsSource":"totalTestsPeopleViral","totalTestResults":324328,"hospitalizedCurrently":191,"hospitalizedCumulative":1972,"inIcuCurrently":41,"inIcuCumulative":470,"onVentilatorCurrently":null,"onVentilatorCumulative":null,"recovered":23475,"dataQualityGrade":"A","lastUpdateEt":"10/7/2020 19:00","dateModified":"2020-10-07T19:00:00Z","checkTimeEt":"10/07 15:00","death":500,"hospitalized":1972,"dateChecked":"2020-10-07T19:00:00Z","totalTestsViral":null,"positiveTestsViral":null,"negativeTestsViral":null,"positiveCasesViral":41220,"deathConfirmed":459,"deathProbable":41,"totalTestEncountersViral":null,"totalTestsPeopleViral":324328,"totalTestsAntibody":null,"positiveTestsAntibody":null,"negativeTestsAntibody":null,"totalTestsPeopleAntibody":null,"positiveTestsPeopleAntibody":null,"negativeTestsPeopleAntibody":null,"totalTestsPeopleAntigen":null,"positiveTestsPeopleAntigen":null,"totalTestsAntigen":null,"positiveTestsAntigen":null,"fips":"16","positiveIncrease":671,"negativeIncrease":1999,"total":328861,"totalTestResultsIncrease":2534,"posNeg":328861,"deathIncrease":8,"hospitalizedIncrease":40,"hash":"c7eded37dd4b00d9885a7c0b2fd2a579b01ad477","commercialScore":0,"negativeRegularScore":0,"negativeScore":0,"positiveScore":0,"score":0,"grade":""},{"date":20201007,"state":"ID","positive":45082,"probableCases":4397,"negative":281109,"pending":null,"totalTestResultsSource":"totalTestsPeopleViral","totalTestResults":321794,"hospitalizedCurrently":151,"hospitalizedCumulative":1932,"inIcuCurrently":36,"inIcuCumulative":468,"onVentilatorCurrently":null,"onVentilatorCumulative":null,"recovered":23288,"dataQualityGrade":"A","lastUpdateEt":"10/6/2020 19:00","dateModified":"2020-10-06T19:00:00Z","checkTimeEt":"10/06 15:00","death":492,"hospitalized":1932,"dateChecked":"2020-10-06T19:00:00Z","totalTestsViral":null,"positiveTestsViral":null,"negativeTestsViral":null,"positiveCasesViral":40685,"deathConfirmed":452,"deathProbable":40,"totalTestEncountersViral":null,"totalTestsPeopleViral":321794,"totalTestsAntibody":null,"positiveTestsAntibody":null,"negativeTestsAntibody":null,"totalTestsPeopleAntibody":null,"positiveTestsPeopleAntibody":null,"negativeTestsPeopleAntibody":null,"totalTestsPeopleAntigen":null,"positiveTestsPeopleAntigen":null,"totalTestsAntigen":null,"positiveTestsAntigen":null,"fips":"16","positiveIncrease":660,"negativeIncrease":1295,"total":326191,"totalTestResultsIncrease":1849,"posNeg":326191,"deathIncrease":5,"hospitalizedIncrease":21,"hash":"6b8b38a913bf65a0b2e5c2d0e2fb5fa019ac5dd5","commercialScore":0,"negativeRegularScore":0,"negativeScore":0,"positiveScore":0,"score":0,"grade":""},{"date":20201006,"state":"ID","positive":44422,"probableCases":4291,"negative":279814,"pending":null,"totalTestResultsSource":"totalTestsPeopleViral","totalTestResults":319945,"hospitalizedCurrently":151,"hospitalizedCumulative":1911,"inIcuCurrently":36,"inIcuCumulative":466,"onVentilatorCurrently":null,"onVentilatorCumulative":null,"recovered":23115,"dataQualityGrade":"A","lastUpdateEt":"10/5/2020 19:00","dateModified":"2020-10-05T19:00:00Z","checkTimeEt":"10/05 15:00","death":487,"hospitalized":1911,"dateChecked":"2020-10-05T19:00:00Z","totalTestsViral":null,"positiveTestsViral":null,"negativeTestsViral":null,"positiveCasesViral":40131,"deathConfirmed":447,"deathProbable":40,"totalTestEncountersViral":null,"totalTestsPeopleViral":319945,"totalTestsAntibody":null,"positiveTestsAntibody":null,"negativeTestsAntibody":null,"totalTestsPeopleAntibody":null,"positiveTestsPeopleAntibody":null,"negativeTestsPeopleAntibody":null,"totalTestsPeopleAntigen":null,"positiveTestsPeopleAntigen":null,"totalTestsAntigen":null,"positiveTestsAntigen":null,"fips":"16","positiveIncrease":458,"negativeIncrease":1369,"total":324236,"totalTestResultsIncrease":1778,"posNeg":324236,"deathIncrease":5,"hospitalizedIncrease":8,"hash":"42c20ed522e4ce1eff3976164f21f07a2203b375","commercialScore":0,"negativeRegularScore":0,"negativeScore":0,"positiveScore":0,"score":0,"grade":""},{"date":20201005,"state":"ID","positive":43964,"probableCases":4242,"negative":278445,"pending":null,"totalTestResultsSource":"totalTestsPeopleViral","totalTestResults":318167,"hospitalizedCurrently":152,"hospitalizedCumulative":1903,"inIcuCurrently":49,"inIcuCumulative":466,"onVentilatorCurrently":null,"onVentilatorCumulative":null,"recovered":22930,"dataQualityGrade":"A","lastUpdateEt":"10/5/2020 13:59","dateModified":"2020-10-05T13:59:00Z","checkTimeEt":"10/05 09:59","death":482,"hospitalized":1903,"dateChecked":"2020-10-05T13:59:00Z","totalTestsViral":null,"positiveTestsViral":null,"negativeTestsViral":null,"positiveCasesViral":39722,"deathConfirmed":442,"deathProbable":40,"totalTestEncountersViral":null,"totalTestsPeopleViral":318167,"totalTestsAntibody":null,"positiveTestsAntibody":null,"negativeTestsAntibody":null,"totalTestsPeopleAntibody":null,"positiveTestsPeopleAntibody":null,"negativeTestsPeopleAntibody":null,"totalTestsPeopleAntigen":null,"positiveTestsPeopleAntigen":null,"totalTestsAntigen":null,"positiveTestsAntigen":null,"fips":"16","positiveIncrease":262,"negativeIncrease":1569,"total":322409,"totalTestResultsIncrease":1797,"posNeg":322409,"deathIncrease":2,"hospitalizedIncrease":3,"hash":"e810c4300d68e880cf290996b80b1cb357b5fbe3","commercialScore":0,"negativeRegularScore":0,"negativeScore":0,"positiveScore":0,"score":0,"grade":""},{"date":20201004,"state":"ID","positive":43702,"probableCases":4208,"negative":276876,"pending":null,"totalTestResultsSource":"totalTestsPeopleViral","totalTestResults":316370,"hospitalizedCurrently":152,"hospitalizedCumulative":1900,"inIcuCurrently":49,"inIcuCumulative":465,"onVentilatorCurrently":null,"onVentilatorCumulative":null,"recovered":22744,"dataQualityGrade":"A","lastUpdateEt":"10/3/2020 18:55","dateModified":"2020-10-03T18:55:00Z","checkTimeEt":"10/03 14:55","death":480,"hospitalized":1900,"dateChecked":"2020-10-03T18:55:00Z","totalTestsViral":null,"positiveTestsViral":null,"negativeTestsViral":null,"positiveCasesViral":39494,"deathConfirmed":440,"deathProbable":40,"totalTestEncountersViral":null,"totalTestsPeopleViral":316370,"totalTestsAntibody":null,"positiveTestsAntibody":null,"negativeTestsAntibody":null,"totalTestsPeopleAntibody":null,"positiveTestsPeopleAntibody":null,"negativeTestsPeopleAntibody":null,"totalTestsPeopleAntigen":null,"positiveTestsPeopleAntigen":null,"totalTestsAntigen":null,"positiveTestsAntigen":null,"fips":"16","positiveIncrease":464,"negativeIncrease":1571,"total":320578,"totalTestResultsIncrease":1928,"posNeg":320578,"deathIncrease":6,"hospitalizedIncrease":7,"hash":"23864df6effa18675b35f4dedcd3dcc4a9960314","commercialScore":0,"negativeRegularScore":0,"negativeScore":0,"positiveScore":0,"score":0,"grade":""},{"date":20201003,"state":"ID","positive":43238,"probableCases":4101,"negative":275305,"pending":null,"totalTestResultsSource":"totalTestsPeopleViral","totalTestResults":314442,"hospitalizedCurrently":152,"hospitalizedCumulative":1893,"inIcuCurrently":49,"inIcuCumulative":462,"onVentilatorCurrently":null,"onVentilatorCumulative":null,"recovered":22568,"dataQualityGrade":"A","lastUpdateEt":"10/2/2020 19:00","dateModified":"2020-10-02T19:00:00Z","checkTimeEt":"10/02 15:00","death":474,"hospitalized":1893,"dateChecked":"2020-10-02T19:00:00Z","totalTestsViral":null,"positiveTestsViral":null,"negativeTestsViral":null,"positiveCasesViral":39137,"deathConfirmed":435,"deathProbable":39,"totalTestEncountersViral":null,"totalTestsPeopleViral":314442,"totalTestsAntibody":null,"positiveTestsAntibody":null,"negativeTestsAntibody":null,"totalTestsPeopleAntibody":null,"positiveTestsPeopleAntibody":null,"negativeTestsPeopleAntibody":null,"totalTestsPeopleAntigen":null,"positiveTestsPeopleAntigen":null,"totalTestsAntigen":null,"positiveTestsAntigen":null,"fips":"16","positiveIncrease":677,"negativeIncrease":2552,"total":318543,"totalTestResultsIncrease":3105,"posNeg":318543,"deathIncrease":2,"hospitalizedIncrease":20,"hash":"add5638db5278ed814e90ef9822b049d5f87e9eb","commercialScore":0,"negativeRegularScore":0,"negativeScore":0,"positiveScore":0,"score":0,"grade":""},{"date":20201002,"state":"ID","positive":42561,"probableCases":3977,"negative":272753,"pending":null,"totalTestResultsSource":"totalTestsPeopleViral","totalTestResults":311337,"hospitalizedCurrently":135,"hospitalizedCumulative":1873,"inIcuCurrently":36,"inIcuCumulative":460,"onVentilatorCurrently":null,"onVentilatorCumulative":null,"recovered":22371,"dataQualityGrade":"A","lastUpdateEt":"10/1/2020 19:03","dateModified":"2020-10-01T19:03:00Z","checkTimeEt":"10/01 15:03","death":472,"hospitalized":1873,"dateChecked":"2020-10-01T19:03:00Z","totalTestsViral":null,"positiveTestsViral":null,"negativeTestsViral":null,"positiveCasesViral":38584,"deathConfirmed":433,"deathProbable":39,"totalTestEncountersViral":null,"totalTestsPeopleViral":311337,"totalTestsAntibody":null,"positiveTestsAntibody":null,"negativeTestsAntibody":null,"totalTestsPeopleAntibody":null,"positiveTestsPeopleAntibody":null,"negativeTestsPeopleAntibody":null,"totalTestsPeopleAntigen":null,"positiveTestsPeopleAntigen":null,"totalTestsAntigen":null,"positiveTestsAntigen":null,"fips":"16","positiveIncrease":513,"negativeIncrease":1783,"total":315314,"totalTestResultsIncrease":2181,"posNeg":315314,"deathIncrease":3,"hospitalizedIncrease":14,"hash":"3ce4579a3e9d0a7d2bc09872610e9f7a710321e5","commercialScore":0,"negativeRegularScore":0,"negativeScore":0,"positiveScore":0,"score":0,"grade":""},{"date":20201001,"state":"ID","positive":42048,"probableCases":3862,"negative":270970,"pending":null,"totalTestResultsSource":"totalTestsPeopleViral","totalTestResults":309156,"hospitalizedCurrently":135,"hospitalizedCumulative":1859,"inIcuCurrently":36,"inIcuCumulative":457,"onVentilatorCurrently":null,"onVentilatorCumulative":null,"recovered":22180,"dataQualityGrade":"A","lastUpdateEt":"9/30/2020 19:00","dateModified":"2020-09-30T19:00:00Z","checkTimeEt":"09/30 15:00","death":469,"hospitalized":1859,"dateChecked":"2020-09-30T19:00:00Z","totalTestsViral":null,"positiveTestsViral":null,"negativeTestsViral":null,"positiveCasesViral":38186,"deathConfirmed":431,"deathProbable":38,"totalTestEncountersViral":null,"totalTestsPeopleViral":309156,"totalTestsAntibody":null,"positiveTestsAntibody":null,"negativeTestsAntibody":null,"totalTestsPeopleAntibody":null,"positiveTestsPeopleAntibody":null,"negativeTestsPeopleAntibody":null,"totalTestsPeopleAntigen":null,"positiveTestsPeopleAntigen":null,"totalTestsAntigen":null,"positiveTestsAntigen":null,"fips":"16","positiveIncrease":614,"negativeIncrease":1963,"total":313018,"totalTestResultsIncrease":2450,"posNeg":313018,"deathIncrease":5,"hospitalizedIncrease":12,"hash":"0e89a6e8ba5dd40ce8b4ed2fa5a967fe91260822","commercialScore":0,"negativeRegularScore":0,"negativeScore":0,"positiveScore":0,"score":0,"grade":""},{"date":20200930,"state":"ID","positive":41434,"probableCases":3735,"negative":269007,"pending":null,"totalTestResultsSource":"totalTestsPeopleViral","totalTestResults":306706,"hospitalizedCurrently":137,"hospitalizedCumulative":1847,"inIcuCurrently":38,"inIcuCumulative":457,"onVentilatorCurrently":null,"onVentilatorCumulative":null,"recovered":21976,"dataQualityGrade":"A","lastUpdateEt":"9/29/2020 19:00","dateModified":"2020-09-29T19:00:00Z","checkTimeEt":"09/29 15:00","death":464,"hospitalized":1847,"dateChecked":"2020-09-29T19:00:00Z","totalTestsViral":null,"positiveTestsViral":null,"negativeTestsViral":null,"positiveCasesViral":37699,"deathConfirmed":427,"deathProbable":37,"totalTestEncountersViral":null,"totalTestsPeopleViral":306706,"totalTestsAntibody":null,"positiveTestsAntibody":null,"negativeTestsAntibody":null,"totalTestsPeopleAntibody":null,"positiveTestsPeopleAntibody":null,"negativeTestsPeopleAntibody":null,"totalTestsPeopleAntigen":null,"positiveTestsPeopleAntigen":null,"totalTestsAntigen":null,"positiveTestsAntigen":null,"fips":"16","positiveIncrease":511,"negativeIncrease":1388,"total":310441,"totalTestResultsIncrease":1815,"posNeg":310441,"deathIncrease":4,"hospitalizedIncrease":15,"hash":"a74df0cb5d6c3886d19109b5c6ba467bca4c8349","commercialScore":0,"negativeRegularScore":0,"negativeScore":0,"positiveScore":0,"score":0,"grade":""},{"date":20200929,"state":"ID","positive":40923,"probableCases":3651,"negative":267619,"pending":null,"totalTestResultsSource":"totalTestsPeopleViral","totalTestResults":304891,"hospitalizedCurrently":135,"hospitalizedCumulative":1832,"inIcuCurrently":44,"inIcuCumulative":454,"onVentilatorCurrently":null,"onVentilatorCumulative":null,"recovered":21796,"dataQualityGrade":"A","lastUpdateEt":"9/28/2020 19:00","dateModified":"2020-09-28T19:00:00Z","checkTimeEt":"09/28 15:00","death":460,"hospitalized":1832,"dateChecked":"2020-09-28T19:00:00Z","totalTestsViral":null,"positiveTestsViral":null,"negativeTestsViral":null,"positiveCasesViral":37272,"deathConfirmed":423,"deathProbable":37,"totalTestEncountersViral":null,"totalTestsPeopleViral":304891,"totalTestsAntibody":null,"positiveTestsAntibody":null,"negativeTestsAntibody":null,"totalTestsPeopleAntibody":null,"positiveTestsPeopleAntibody":null,"negativeTestsPeopleAntibody":null,"totalTestsPeopleAntigen":null,"positiveTestsPeopleAntigen":null,"totalTestsAntigen":null,"positiveTestsAntigen":null,"fips":"16","positiveIncrease":422,"negativeIncrease":1266,"total":308542,"totalTestResultsIncrease":1639,"posNeg":308542,"deathIncrease":0,"hospitalizedIncrease":18,"hash":"a4d7a9579c256df03386dabeb0e0c06a7878bf91","commercialScore":0,"negativeRegularScore":0,"negativeScore":0,"positiveScore":0,"score":0,"grade":""},{"date":20200928,"state":"ID","positive":40501,"probableCases":3602,"negative":266353,"pending":null,"totalTestResultsSource":"totalTestsPeopleViral","totalTestResults":303252,"hospitalizedCurrently":135,"hospitalizedCumulative":1814,"inIcuCurrently":44,"inIcuCumulative":452,"onVentilatorCurrently":null,"onVentilatorCumulative":null,"recovered":21630,"dataQualityGrade":"A","lastUpdateEt":"9/27/2020 19:00","dateModified":"2020-09-27T19:00:00Z","checkTimeEt":"09/27 15:00","death":460,"hospitalized":1814,"dateChecked":"2020-09-27T19:00:00Z","totalTestsViral":null,"positiveTestsViral":null,"negativeTestsViral":null,"positiveCasesViral":36899,"deathConfirmed":423,"deathProbable":37,"totalTestEncountersViral":null,"totalTestsPeopleViral":303252,"totalTestsAntibody":null,"positiveTestsAntibody":null,"negativeTestsAntibody":null,"totalTestsPeopleAntibody":null,"positiveTestsPeopleAntibody":null,"negativeTestsPeopleAntibody":null,"totalTestsPeopleAntigen":null,"positiveTestsPeopleAntigen":null,"totalTestsAntigen":null,"positiveTestsAntigen":null,"fips":"16","positiveIncrease":205,"negativeIncrease":1868,"total":306854,"totalTestResultsIncrease":2046,"posNeg":306854,"deathIncrease":0,"hospitalizedIncrease":3,"hash":"88c27fec8df159b6230afe49ab0bd97ed3cc5669","commercialScore":0,"negativeRegularScore":0,"negativeScore":0,"positiveScore":0,"score":0,"grade":""},{"date":20200927,"state":"ID","positive":40296,"probableCases":3575,"negative":264485,"pending":null,"totalTestResultsSource":"totalTestsPeopleViral","totalTestResults":301206,"hospitalizedCurrently":135,"hospitalizedCumulative":1811,"inIcuCurrently":44,"inIcuCumulative":451,"onVentilatorCurrently":null,"onVentilatorCumulative":null,"recovered":21468,"dataQualityGrade":"A","lastUpdateEt":"9/26/2020 19:00","dateModified":"2020-09-26T19:00:00Z","checkTimeEt":"09/26 15:00","death":460,"hospitalized":1811,"dateChecked":"2020-09-26T19:00:00Z","totalTestsViral":null,"positiveTestsViral":null,"negativeTestsViral":null,"positiveCasesViral":36721,"deathConfirmed":423,"deathProbable":37,"totalTestEncountersViral":null,"totalTestsPeopleViral":301206,"totalTestsAntibody":null,"positiveTestsAntibody":null,"negativeTestsAntibody":null,"totalTestsPeopleAntibody":null,"positiveTestsPeopleAntibody":null,"negativeTestsPeopleAntibody":null,"totalTestsPeopleAntigen":null,"positiveTestsPeopleAntigen":null,"totalTestsAntigen":null,"positiveTestsAntigen":null,"fips":"16","positiveIncrease":539,"negativeIncrease":2065,"total":304781,"totalTestResultsIncrease":2554,"posNeg":304781,"deathIncrease":2,"hospitalizedIncrease":16,"hash":"c41cd659b82e701de11b1dfe6a736ba70df359dc","commercialScore":0,"negativeRegularScore":0,"negativeScore":0,"positiveScore":0,"score":0,"grade":""},{"date":20200926,"state":"ID","positive":39757,"probableCases":3525,"negative":262420,"pending":null,"totalTestResultsSource":"totalTestsPeopleViral","totalTestResults":298652,"hospitalizedCurrently":135,"hospitalizedCumulative":1795,"inIcuCurrently":44,"inIcuCumulative":451,"onVentilatorCurrently":null,"onVentilatorCumulative":null,"recovered":21291,"dataQualityGrade":"A","lastUpdateEt":"9/25/2020 18:55","dateModified":"2020-09-25T18:55:00Z","checkTimeEt":"09/25 14:55","death":458,"hospitalized":1795,"dateChecked":"2020-09-25T18:55:00Z","totalTestsViral":null,"positiveTestsViral":null,"negativeTestsViral":null,"positiveCasesViral":36232,"deathConfirmed":421,"deathProbable":37,"totalTestEncountersViral":null,"totalTestsPeopleViral":298652,"totalTestsAntibody":null,"positiveTestsAntibody":null,"negativeTestsAntibody":null,"totalTestsPeopleAntibody":null,"positiveTestsPeopleAntibody":null,"negativeTestsPeopleAntibody":null,"totalTestsPeopleAntigen":null,"positiveTestsPeopleAntigen":null,"totalTestsAntigen":null,"positiveTestsAntigen":null,"fips":"16","positiveIncrease":523,"negativeIncrease":1772,"total":302177,"totalTestResultsIncrease":2240,"posNeg":302177,"deathIncrease":1,"hospitalizedIncrease":29,"hash":"c5a6572060dc2ecfe7256cb15bcafda97c492aba","commercialScore":0,"negativeRegularScore":0,"negativeScore":0,"positiveScore":0,"score":0,"grade":""},{"date":20200925,"state":"ID","positive":39234,"probableCases":3470,"negative":260648,"pending":null,"totalTestResultsSource":"totalTestsPeopleViral","totalTestResults":296412,"hospitalizedCurrently":147,"hospitalizedCumulative":1766,"inIcuCurrently":40,"inIcuCumulative":449,"onVentilatorCurrently":null,"onVentilatorCumulative":null,"recovered":21105,"dataQualityGrade":"A","lastUpdateEt":"9/24/2020 18:54","dateModified":"2020-09-24T18:54:00Z","checkTimeEt":"09/24 14:54","death":457,"hospitalized":1766,"dateChecked":"2020-09-24T18:54:00Z","totalTestsViral":null,"positiveTestsViral":null,"negativeTestsViral":null,"positiveCasesViral":35764,"deathConfirmed":419,"deathProbable":38,"totalTestEncountersViral":null,"totalTestsPeopleViral":296412,"totalTestsAntibody":null,"positiveTestsAntibody":null,"negativeTestsAntibody":null,"totalTestsPeopleAntibody":null,"positiveTestsPeopleAntibody":null,"negativeTestsPeopleAntibody":null,"totalTestsPeopleAntigen":null,"positiveTestsPeopleAntigen":null,"totalTestsAntigen":null,"positiveTestsAntigen":null,"fips":"16","positiveIncrease":491,"negativeIncrease":1948,"total":299882,"totalTestResultsIncrease":2349,"posNeg":299882,"deathIncrease":3,"hospitalizedIncrease":12,"hash":"44452e7585e03404672c56d5e18aeafc60285fe1","commercialScore":0,"negativeRegularScore":0,"negativeScore":0,"positiveScore":0,"score":0,"grade":""},{"date":20200924,"state":"ID","positive":38743,"probableCases":3380,"negative":258700,"pending":null,"totalTestResultsSource":"totalTestsPeopleViral","totalTestResults":294063,"hospitalizedCurrently":147,"hospitalizedCumulative":1754,"inIcuCurrently":40,"inIcuCumulative":448,"onVentilatorCurrently":null,"onVentilatorCumulative":null,"recovered":20901,"dataQualityGrade":"A","lastUpdateEt":"9/23/2020 19:00","dateModified":"2020-09-23T19:00:00Z","checkTimeEt":"09/23 15:00","death":454,"hospitalized":1754,"dateChecked":"2020-09-23T19:00:00Z","totalTestsViral":null,"positiveTestsViral":null,"negativeTestsViral":null,"positiveCasesViral":35363,"deathConfirmed":416,"deathProbable":38,"totalTestEncountersViral":null,"totalTestsPeopleViral":294063,"totalTestsAntibody":null,"positiveTestsAntibody":null,"negativeTestsAntibody":null,"totalTestsPeopleAntibody":null,"positiveTestsPeopleAntibody":null,"negativeTestsPeopleAntibody":null,"totalTestsPeopleAntigen":null,"positiveTestsPeopleAntigen":null,"totalTestsAntigen":null,"positiveTestsAntigen":null,"fips":"16","positiveIncrease":396,"negativeIncrease":1646,"total":297443,"totalTestResultsIncrease":1904,"posNeg":297443,"deathIncrease":3,"hospitalizedIncrease":14,"hash":"23ff459df6a2d9f66e66e03e95d583d5ea6136b9","commercialScore":0,"negativeRegularScore":0,"negativeScore":0,"positiveScore":0,"score":0,"grade":""},{"date":20200923,"state":"ID","positive":38347,"probableCases":3242,"negative":257054,"pending":null,"totalTestResultsSource":"totalTestsPeopleViral","totalTestResults":292159,"hospitalizedCurrently":130,"hospitalizedCumulative":1740,"inIcuCurrently":39,"inIcuCumulative":447,"onVentilatorCurrently":null,"onVentilatorCumulative":null,"recovered":20674,"dataQualityGrade":"A","lastUpdateEt":"9/22/2020 19:00","dateModified":"2020-09-22T19:00:00Z","checkTimeEt":"09/22 15:00","death":451,"hospitalized":1740,"dateChecked":"2020-09-22T19:00:00Z","totalTestsViral":null,"positiveTestsViral":null,"negativeTestsViral":null,"positiveCasesViral":35105,"deathConfirmed":413,"deathProbable":38,"totalTestEncountersViral":null,"totalTestsPeopleViral":292159,"totalTestsAntibody":null,"positiveTestsAntibody":null,"negativeTestsAntibody":null,"totalTestsPeopleAntibody":null,"positiveTestsPeopleAntibody":null,"negativeTestsPeopleAntibody":null,"totalTestsPeopleAntigen":null,"positiveTestsPeopleAntigen":null,"totalTestsAntigen":null,"positiveTestsAntigen":null,"fips":"16","positiveIncrease":446,"negativeIncrease":884,"total":295401,"totalTestResultsIncrease":1248,"posNeg":295401,"deathIncrease":4,"hospitalizedIncrease":14,"hash":"9e61f52b2c6190653cc621c09094d5caee3787a3","commercialScore":0,"negativeRegularScore":0,"negativeScore":0,"positiveScore":0,"score":0,"grade":""},{"date":20200922,"state":"ID","positive":37901,"probableCases":3160,"negative":256170,"pending":null,"totalTestResultsSource":"totalTestsPeopleViral","totalTestResults":290911,"hospitalizedCurrently":130,"hospitalizedCumulative":1726,"inIcuCurrently":39,"inIcuCumulative":446,"onVentilatorCurrently":null,"onVentilatorCumulative":null,"recovered":20485,"dataQualityGrade":"A","lastUpdateEt":"9/21/2020 19:00","dateModified":"2020-09-21T19:00:00Z","checkTimeEt":"09/21 15:00","death":447,"hospitalized":1726,"dateChecked":"2020-09-21T19:00:00Z","totalTestsViral":null,"positiveTestsViral":null,"negativeTestsViral":null,"positiveCasesViral":34741,"deathConfirmed":409,"deathProbable":38,"totalTestEncountersViral":null,"totalTestsPeopleViral":290911,"totalTestsAntibody":null,"positiveTestsAntibody":null,"negativeTestsAntibody":null,"totalTestsPeopleAntibody":null,"positiveTestsPeopleAntibody":null,"negativeTestsPeopleAntibody":null,"totalTestsPeopleAntigen":null,"positiveTestsPeopleAntigen":null,"totalTestsAntigen":null,"positiveTestsAntigen":null,"fips":"16","positiveIncrease":410,"negativeIncrease":1375,"total":294071,"totalTestResultsIncrease":1748,"posNeg":294071,"deathIncrease":4,"hospitalizedIncrease":8,"hash":"97d058d3c2166fd56d6953e32f841fa1c43f5c55","commercialScore":0,"negativeRegularScore":0,"negativeScore":0,"positiveScore":0,"score":0,"grade":""},{"date":20200921,"state":"ID","positive":37491,"probableCases":3123,"negative":254795,"pending":null,"totalTestResultsSource":"totalTestsPeopleViral","totalTestResults":289163,"hospitalizedCurrently":146,"hospitalizedCumulative":1718,"inIcuCurrently":51,"inIcuCumulative":443,"onVentilatorCurrently":null,"onVentilatorCumulative":null,"recovered":20304,"dataQualityGrade":"A","lastUpdateEt":"9/20/2020 19:00","dateModified":"2020-09-20T19:00:00Z","checkTimeEt":"09/20 15:00","death":443,"hospitalized":1718,"dateChecked":"2020-09-20T19:00:00Z","totalTestsViral":null,"positiveTestsViral":null,"negativeTestsViral":null,"positiveCasesViral":34368,"deathConfirmed":405,"deathProbable":38,"totalTestEncountersViral":null,"totalTestsPeopleViral":289163,"totalTestsAntibody":null,"positiveTestsAntibody":null,"negativeTestsAntibody":null,"totalTestsPeopleAntibody":null,"positiveTestsPeopleAntibody":null,"negativeTestsPeopleAntibody":null,"totalTestsPeopleAntigen":null,"positiveTestsPeopleAntigen":null,"totalTestsAntigen":null,"positiveTestsAntigen":null,"fips":"16","positiveIncrease":244,"negativeIncrease":2114,"total":292286,"totalTestResultsIncrease":2333,"posNeg":292286,"deathIncrease":2,"hospitalizedIncrease":7,"hash":"616e7b6a3c69a3c0855548e1411399863e8877a0","commercialScore":0,"negativeRegularScore":0,"negativeScore":0,"positiveScore":0,"score":0,"grade":""},{"date":20200920,"state":"ID","positive":37247,"probableCases":3098,"negative":252681,"pending":null,"totalTestResultsSource":"totalTestsPeopleViral","totalTestResults":286830,"hospitalizedCurrently":146,"hospitalizedCumulative":1711,"inIcuCurrently":51,"inIcuCumulative":442,"onVentilatorCurrently":null,"onVentilatorCumulative":null,"recovered":20105,"dataQualityGrade":"A","lastUpdateEt":"9/19/2020 19:00","dateModified":"2020-09-19T19:00:00Z","checkTimeEt":"09/19 15:00","death":441,"hospitalized":1711,"dateChecked":"2020-09-19T19:00:00Z","totalTestsViral":null,"positiveTestsViral":null,"negativeTestsViral":null,"positiveCasesViral":34149,"deathConfirmed":403,"deathProbable":38,"totalTestEncountersViral":null,"totalTestsPeopleViral":286830,"totalTestsAntibody":null,"positiveTestsAntibody":null,"negativeTestsAntibody":null,"totalTestsPeopleAntibody":null,"positiveTestsPeopleAntibody":null,"negativeTestsPeopleAntibody":null,"totalTestsPeopleAntigen":null,"positiveTestsPeopleAntigen":null,"totalTestsAntigen":null,"positiveTestsAntigen":null,"fips":"16","positiveIncrease":288,"negativeIncrease":1445,"total":289928,"totalTestResultsIncrease":1693,"posNeg":289928,"deathIncrease":3,"hospitalizedIncrease":10,"hash":"527dcd22348897eeeb4a373ea9e5bcbb2d2fd17e","commercialScore":0,"negativeRegularScore":0,"negativeScore":0,"positiveScore":0,"score":0,"grade":""},{"date":20200919,"state":"ID","positive":36959,"probableCases":3058,"negative":251236,"pending":null,"totalTestResultsSource":"totalTestsPeopleViral","totalTestResults":285137,"hospitalizedCurrently":146,"hospitalizedCumulative":1701,"inIcuCurrently":51,"inIcuCumulative":441,"onVentilatorCurrently":null,"onVentilatorCumulative":null,"recovered":19915,"dataQualityGrade":"A","lastUpdateEt":"9/18/2020 19:00","dateModified":"2020-09-18T19:00:00Z","checkTimeEt":"09/18 15:00","death":438,"hospitalized":1701,"dateChecked":"2020-09-18T19:00:00Z","totalTestsViral":null,"positiveTestsViral":null,"negativeTestsViral":null,"positiveCasesViral":33901,"deathConfirmed":400,"deathProbable":38,"totalTestEncountersViral":null,"totalTestsPeopleViral":285137,"totalTestsAntibody":null,"positiveTestsAntibody":null,"negativeTestsAntibody":null,"totalTestsPeopleAntibody":null,"positiveTestsPeopleAntibody":null,"negativeTestsPeopleAntibody":null,"totalTestsPeopleAntigen":null,"positiveTestsPeopleAntigen":null,"totalTestsAntigen":null,"positiveTestsAntigen":null,"fips":"16","positiveIncrease":470,"negativeIncrease":2173,"total":288195,"totalTestResultsIncrease":2615,"posNeg":288195,"deathIncrease":4,"hospitalizedIncrease":19,"hash":"f9cf49fc8853ebd6a57679082f26e7b211b4dca5","commercialScore":0,"negativeRegularScore":0,"negativeScore":0,"positiveScore":0,"score":0,"grade":""},{"date":20200918,"state":"ID","positive":36489,"probableCases":3000,"negative":249063,"pending":null,"totalTestResultsSource":"totalTestsPeopleViral","totalTestResults":282522,"hospitalizedCurrently":123,"hospitalizedCumulative":1682,"inIcuCurrently":54,"inIcuCumulative":438,"onVentilatorCurrently":null,"onVentilatorCumulative":null,"recovered":19691,"dataQualityGrade":"A","lastUpdateEt":"9/17/2020 19:00","dateModified":"2020-09-17T19:00:00Z","checkTimeEt":"09/17 15:00","death":434,"hospitalized":1682,"dateChecked":"2020-09-17T19:00:00Z","totalTestsViral":null,"positiveTestsViral":null,"negativeTestsViral":null,"positiveCasesViral":33489,"deathConfirmed":396,"deathProbable":38,"totalTestEncountersViral":null,"totalTestsPeopleViral":282522,"totalTestsAntibody":null,"positiveTestsAntibody":null,"negativeTestsAntibody":null,"totalTestsPeopleAntibody":null,"positiveTestsPeopleAntibody":null,"negativeTestsPeopleAntibody":null,"totalTestsPeopleAntigen":null,"positiveTestsPeopleAntigen":null,"totalTestsAntigen":null,"positiveTestsAntigen":null,"fips":"16","positiveIncrease":396,"negativeIncrease":1791,"total":285552,"totalTestResultsIncrease":2096,"posNeg":285552,"deathIncrease":5,"hospitalizedIncrease":24,"hash":"2ca0d588f9d8b1186c2a7ed3fb35221b42fbdaa2","commercialScore":0,"negativeRegularScore":0,"negativeScore":0,"positiveScore":0,"score":0,"grade":""},{"date":20200917,"state":"ID","positive":36093,"probableCases":2939,"negative":247272,"pending":null,"totalTestResultsSource":"totalTestsPeopleViral","totalTestResults":280426,"hospitalizedCurrently":123,"hospitalizedCumulative":1658,"inIcuCurrently":54,"inIcuCumulative":433,"onVentilatorCurrently":null,"onVentilatorCumulative":null,"recovered":19405,"dataQualityGrade":"A","lastUpdateEt":"9/17/2020 15:44","dateModified":"2020-09-17T15:44:00Z","checkTimeEt":"09/17 11:44","death":429,"hospitalized":1658,"dateChecked":"2020-09-17T15:44:00Z","totalTestsViral":null,"positiveTestsViral":null,"negativeTestsViral":null,"positiveCasesViral":33154,"deathConfirmed":391,"deathProbable":38,"totalTestEncountersViral":null,"totalTestsPeopleViral":280426,"totalTestsAntibody":null,"positiveTestsAntibody":null,"negativeTestsAntibody":null,"totalTestsPeopleAntibody":null,"positiveTestsPeopleAntibody":null,"negativeTestsPeopleAntibody":null,"totalTestsPeopleAntigen":null,"positiveTestsPeopleAntigen":null,"totalTestsAntigen":null,"positiveTestsAntigen":null,"fips":"16","positiveIncrease":283,"negativeIncrease":1440,"total":283365,"totalTestResultsIncrease":1647,"posNeg":283365,"deathIncrease":6,"hospitalizedIncrease":27,"hash":"35d0aad7354864683938add05f6fe9f6b9ee3dc5","commercialScore":0,"negativeRegularScore":0,"negativeScore":0,"positiveScore":0,"score":0,"grade":""},{"date":20200916,"state":"ID","positive":35810,"probableCases":2863,"negative":245832,"pending":null,"totalTestResultsSource":"totalTestsPeopleViral","totalTestResults":278779,"hospitalizedCurrently":105,"hospitalizedCumulative":1631,"inIcuCurrently":34,"inIcuCumulative":426,"onVentilatorCurrently":null,"onVentilatorCumulative":null,"recovered":19075,"dataQualityGrade":"A","lastUpdateEt":"9/15/2020 19:00","dateModified":"2020-09-15T19:00:00Z","checkTimeEt":"09/15 15:00","death":423,"hospitalized":1631,"dateChecked":"2020-09-15T19:00:00Z","totalTestsViral":null,"positiveTestsViral":null,"negativeTestsViral":null,"positiveCasesViral":32947,"deathConfirmed":385,"deathProbable":38,"totalTestEncountersViral":null,"totalTestsPeopleViral":278779,"totalTestsAntibody":null,"positiveTestsAntibody":null,"negativeTestsAntibody":null,"totalTestsPeopleAntibody":null,"positiveTestsPeopleAntibody":null,"negativeTestsPeopleAntibody":null,"totalTestsPeopleAntigen":null,"positiveTestsPeopleAntigen":null,"totalTestsAntigen":null,"positiveTestsAntigen":null,"fips":"16","positiveIncrease":278,"negativeIncrease":1194,"total":281642,"totalTestResultsIncrease":1411,"posNeg":281642,"deathIncrease":4,"hospitalizedIncrease":19,"hash":"b5bc0d3ef2307c160a7c7610863d08a3ed588a28","commercialScore":0,"negativeRegularScore":0,"negativeScore":0,"positiveScore":0,"score":0,"grade":""},{"date":20200915,"state":"ID","positive":35532,"probableCases":2802,"negative":244638,"pending":null,"totalTestResultsSource":"totalTestsPeopleViral","totalTestResults":277368,"hospitalizedCurrently":105,"hospitalizedCumulative":1612,"inIcuCurrently":34,"inIcuCumulative":424,"onVentilatorCurrently":null,"onVentilatorCumulative":null,"recovered":18826,"dataQualityGrade":"A+","lastUpdateEt":"9/14/2020 19:00","dateModified":"2020-09-14T19:00:00Z","checkTimeEt":"09/14 15:00","death":419,"hospitalized":1612,"dateChecked":"2020-09-14T19:00:00Z","totalTestsViral":null,"positiveTestsViral":null,"negativeTestsViral":null,"positiveCasesViral":32730,"deathConfirmed":382,"deathProbable":37,"totalTestEncountersViral":null,"totalTestsPeopleViral":277368,"totalTestsAntibody":null,"positiveTestsAntibody":null,"negativeTestsAntibody":null,"totalTestsPeopleAntibody":null,"positiveTestsPeopleAntibody":null,"negativeTestsPeopleAntibody":null,"totalTestsPeopleAntigen":null,"positiveTestsPeopleAntigen":null,"totalTestsAntigen":null,"positiveTestsAntigen":null,"fips":"16","positiveIncrease":253,"negativeIncrease":1304,"total":280170,"totalTestResultsIncrease":1528,"posNeg":280170,"deathIncrease":4,"hospitalizedIncrease":8,"hash":"9d632e803b90433644d9f4dc6631c7e87720169f","commercialScore":0,"negativeRegularScore":0,"negativeScore":0,"positiveScore":0,"score":0,"grade":""},{"date":20200914,"state":"ID","positive":35279,"probableCases":2773,"negative":243334,"pending":null,"totalTestResultsSource":"totalTestsPeopleViral","totalTestResults":275840,"hospitalizedCurrently":165,"hospitalizedCumulative":1604,"inIcuCurrently":46,"inIcuCumulative":423,"onVentilatorCurrently":null,"onVentilatorCumulative":null,"recovered":18619,"dataQualityGrade":"A+","lastUpdateEt":"9/13/2020 19:00","dateModified":"2020-09-13T19:00:00Z","checkTimeEt":"09/13 15:00","death":415,"hospitalized":1604,"dateChecked":"2020-09-13T19:00:00Z","totalTestsViral":null,"positiveTestsViral":null,"negativeTestsViral":null,"positiveCasesViral":32506,"deathConfirmed":378,"deathProbable":37,"totalTestEncountersViral":null,"totalTestsPeopleViral":275840,"totalTestsAntibody":null,"positiveTestsAntibody":null,"negativeTestsAntibody":null,"totalTestsPeopleAntibody":null,"positiveTestsPeopleAntibody":null,"negativeTestsPeopleAntibody":null,"totalTestsPeopleAntigen":null,"positiveTestsPeopleAntigen":null,"totalTestsAntigen":null,"positiveTestsAntigen":null,"fips":"16","positiveIncrease":112,"negativeIncrease":1378,"total":278613,"totalTestResultsIncrease":1473,"posNeg":278613,"deathIncrease":0,"hospitalizedIncrease":8,"hash":"7323ebb9ee7766f3407abe7c038849eeaf854322","commercialScore":0,"negativeRegularScore":0,"negativeScore":0,"positiveScore":0,"score":0,"grade":""},{"date":20200913,"state":"ID","positive":35167,"probableCases":2756,"negative":241956,"pending":null,"totalTestResultsSource":"totalTestsPeopleViral","totalTestResults":274367,"hospitalizedCurrently":165,"hospitalizedCumulative":1596,"inIcuCurrently":46,"inIcuCumulative":422,"onVentilatorCurrently":null,"onVentilatorCumulative":null,"recovered":18406,"dataQualityGrade":"A+","lastUpdateEt":"9/12/2020 18:57","dateModified":"2020-09-12T18:57:00Z","checkTimeEt":"09/12 14:57","death":415,"hospitalized":1596,"dateChecked":"2020-09-12T18:57:00Z","totalTestsViral":null,"positiveTestsViral":null,"negativeTestsViral":null,"positiveCasesViral":32411,"deathConfirmed":378,"deathProbable":37,"totalTestEncountersViral":null,"totalTestsPeopleViral":274367,"totalTestsAntibody":null,"positiveTestsAntibody":null,"negativeTestsAntibody":null,"totalTestsPeopleAntibody":null,"positiveTestsPeopleAntibody":null,"negativeTestsPeopleAntibody":null,"totalTestsPeopleAntigen":null,"positiveTestsPeopleAntigen":null,"totalTestsAntigen":null,"positiveTestsAntigen":null,"fips":"16","positiveIncrease":217,"negativeIncrease":1296,"total":277123,"totalTestResultsIncrease":1479,"posNeg":277123,"deathIncrease":3,"hospitalizedIncrease":27,"hash":"652b4ab10fe8e5538b215f283a3e1f7d70bfc982","commercialScore":0,"negativeRegularScore":0,"negativeScore":0,"positiveScore":0,"score":0,"grade":""},{"date":20200912,"state":"ID","positive":34950,"probableCases":2722,"negative":240660,"pending":null,"totalTestResultsSource":"totalTestsPeopleViral","totalTestResults":272888,"hospitalizedCurrently":165,"hospitalizedCumulative":1569,"inIcuCurrently":46,"inIcuCumulative":412,"onVentilatorCurrently":null,"onVentilatorCumulative":null,"recovered":18052,"dataQualityGrade":"A+","lastUpdateEt":"9/11/2020 19:00","dateModified":"2020-09-11T19:00:00Z","checkTimeEt":"09/11 15:00","death":412,"hospitalized":1569,"dateChecked":"2020-09-11T19:00:00Z","totalTestsViral":null,"positiveTestsViral":null,"negativeTestsViral":null,"positiveCasesViral":32228,"deathConfirmed":375,"deathProbable":37,"totalTestEncountersViral":null,"totalTestsPeopleViral":272888,"totalTestsAntibody":null,"positiveTestsAntibody":null,"negativeTestsAntibody":null,"totalTestsPeopleAntibody":null,"positiveTestsPeopleAntibody":null,"negativeTestsPeopleAntibody":null,"totalTestsPeopleAntigen":null,"positiveTestsPeopleAntigen":null,"totalTestsAntigen":null,"positiveTestsAntigen":null,"fips":"16","positiveIncrease":333,"negativeIncrease":1461,"total":275610,"totalTestResultsIncrease":1746,"posNeg":275610,"deathIncrease":5,"hospitalizedIncrease":18,"hash":"e4ba6619d419beefcb9f4550ae99dbaefe9d7293","commercialScore":0,"negativeRegularScore":0,"negativeScore":0,"positiveScore":0,"score":0,"grade":""},{"date":20200911,"state":"ID","positive":34617,"probableCases":2674,"negative":239199,"pending":null,"totalTestResultsSource":"totalTestsPeopleViral","totalTestResults":271142,"hospitalizedCurrently":158,"hospitalizedCumulative":1551,"inIcuCurrently":51,"inIcuCumulative":407,"onVentilatorCurrently":null,"onVentilatorCumulative":null,"recovered":17599,"dataQualityGrade":"A+","lastUpdateEt":"9/10/2020 19:00","dateModified":"2020-09-10T19:00:00Z","checkTimeEt":"09/10 15:00","death":407,"hospitalized":1551,"dateChecked":"2020-09-10T19:00:00Z","totalTestsViral":null,"positiveTestsViral":null,"negativeTestsViral":null,"positiveCasesViral":31943,"deathConfirmed":369,"deathProbable":37,"totalTestEncountersViral":null,"totalTestsPeopleViral":271142,"totalTestsAntibody":null,"positiveTestsAntibody":null,"negativeTestsAntibody":null,"totalTestsPeopleAntibody":null,"positiveTestsPeopleAntibody":null,"negativeTestsPeopleAntibody":null,"totalTestsPeopleAntigen":null,"positiveTestsPeopleAntigen":null,"totalTestsAntigen":null,"positiveTestsAntigen":null,"fips":"16","positiveIncrease":307,"negativeIncrease":1345,"total":273816,"totalTestResultsIncrease":1600,"posNeg":273816,"deathIncrease":1,"hospitalizedIncrease":15,"hash":"ee9f6148cc87988620a2d2662527f49ac3fbf15c","commercialScore":0,"negativeRegularScore":0,"negativeScore":0,"positiveScore":0,"score":0,"grade":""},{"date":20200910,"state":"ID","positive":34310,"probableCases":2622,"negative":237854,"pending":null,"totalTestResultsSource":"totalTestsPeopleViral","totalTestResults":269542,"hospitalizedCurrently":158,"hospitalizedCumulative":1536,"inIcuCurrently":51,"inIcuCumulative":406,"onVentilatorCurrently":null,"onVentilatorCumulative":null,"recovered":17304,"dataQualityGrade":"A+","lastUpdateEt":"9/9/2020 19:00","dateModified":"2020-09-09T19:00:00Z","checkTimeEt":"09/09 15:00","death":406,"hospitalized":1536,"dateChecked":"2020-09-09T19:00:00Z","totalTestsViral":null,"positiveTestsViral":null,"negativeTestsViral":null,"positiveCasesViral":31688,"deathConfirmed":369,"deathProbable":37,"totalTestEncountersViral":null,"totalTestsPeopleViral":269542,"totalTestsAntibody":null,"positiveTestsAntibody":null,"negativeTestsAntibody":null,"totalTestsPeopleAntibody":null,"positiveTestsPeopleAntibody":null,"negativeTestsPeopleAntibody":null,"totalTestsPeopleAntigen":null,"positiveTestsPeopleAntigen":null,"totalTestsAntigen":null,"positiveTestsAntigen":null,"fips":"16","positiveIncrease":329,"negativeIncrease":1301,"total":272164,"totalTestResultsIncrease":1546,"posNeg":272164,"deathIncrease":17,"hospitalizedIncrease":34,"hash":"9c03d979d0d04794c7ee43b3cf2ddf589572d47b","commercialScore":0,"negativeRegularScore":0,"negativeScore":0,"positiveScore":0,"score":0,"grade":""},{"date":20200909,"state":"ID","positive":33981,"probableCases":2538,"negative":236553,"pending":null,"totalTestResultsSource":"totalTestsPeopleViral","totalTestResults":267996,"hospitalizedCurrently":114,"hospitalizedCumulative":1502,"inIcuCurrently":35,"inIcuCumulative":399,"onVentilatorCurrently":null,"onVentilatorCumulative":null,"recovered":16956,"dataQualityGrade":"A+","lastUpdateEt":"9/8/2020 19:00","dateModified":"2020-09-08T19:00:00Z","checkTimeEt":"09/08 15:00","death":389,"hospitalized":1502,"dateChecked":"2020-09-08T19:00:00Z","totalTestsViral":null,"positiveTestsViral":null,"negativeTestsViral":null,"positiveCasesViral":31443,"deathConfirmed":353,"deathProbable":36,"totalTestEncountersViral":null,"totalTestsPeopleViral":267996,"totalTestsAntibody":null,"positiveTestsAntibody":null,"negativeTestsAntibody":null,"totalTestsPeopleAntibody":null,"positiveTestsPeopleAntibody":null,"negativeTestsPeopleAntibody":null,"totalTestsPeopleAntigen":null,"positiveTestsPeopleAntigen":null,"totalTestsAntigen":null,"positiveTestsAntigen":null,"fips":"16","positiveIncrease":240,"negativeIncrease":1056,"total":270534,"totalTestResultsIncrease":1254,"posNeg":270534,"deathIncrease":4,"hospitalizedIncrease":34,"hash":"863e2391b25f63bafb2f804e28a951d753fac94b","commercialScore":0,"negativeRegularScore":0,"negativeScore":0,"positiveScore":0,"score":0,"grade":""},{"date":20200908,"state":"ID","positive":33741,"probableCases":2496,"negative":235497,"pending":null,"totalTestResultsSource":"totalTestsPeopleViral","totalTestResults":266742,"hospitalizedCurrently":114,"hospitalizedCumulative":1468,"inIcuCurrently":35,"inIcuCumulative":394,"onVentilatorCurrently":null,"onVentilatorCumulative":null,"recovered":16760,"dataQualityGrade":"A+","lastUpdateEt":"9/7/2020 19:00","dateModified":"2020-09-07T19:00:00Z","checkTimeEt":"09/07 15:00","death":385,"hospitalized":1468,"dateChecked":"2020-09-07T19:00:00Z","totalTestsViral":null,"positiveTestsViral":null,"negativeTestsViral":null,"positiveCasesViral":31245,"deathConfirmed":349,"deathProbable":36,"totalTestEncountersViral":null,"totalTestsPeopleViral":266742,"totalTestsAntibody":null,"positiveTestsAntibody":null,"negativeTestsAntibody":null,"totalTestsPeopleAntibody":null,"positiveTestsPeopleAntibody":null,"negativeTestsPeopleAntibody":null,"totalTestsPeopleAntigen":null,"positiveTestsPeopleAntigen":null,"totalTestsAntigen":null,"positiveTestsAntigen":null,"fips":"16","positiveIncrease":74,"negativeIncrease":975,"total":269238,"totalTestResultsIncrease":1039,"posNeg":269238,"deathIncrease":0,"hospitalizedIncrease":2,"hash":"8b8c5b6082f015a164d9d06012461dbe06e0e0b6","commercialScore":0,"negativeRegularScore":0,"negativeScore":0,"positiveScore":0,"score":0,"grade":""},{"date":20200907,"state":"ID","positive":33667,"probableCases":2486,"negative":234522,"pending":null,"totalTestResultsSource":"totalTestsPeopleViral","totalTestResults":265703,"hospitalizedCurrently":151,"hospitalizedCumulative":1466,"inIcuCurrently":50,"inIcuCumulative":394,"onVentilatorCurrently":null,"onVentilatorCumulative":null,"recovered":16554,"dataQualityGrade":"A+","lastUpdateEt":"9/6/2020 19:00","dateModified":"2020-09-06T19:00:00Z","checkTimeEt":"09/06 15:00","death":385,"hospitalized":1466,"dateChecked":"2020-09-06T19:00:00Z","totalTestsViral":null,"positiveTestsViral":null,"negativeTestsViral":null,"positiveCasesViral":31181,"deathConfirmed":349,"deathProbable":36,"totalTestEncountersViral":null,"totalTestsPeopleViral":265703,"totalTestsAntibody":null,"positiveTestsAntibody":null,"negativeTestsAntibody":null,"totalTestsPeopleAntibody":null,"positiveTestsPeopleAntibody":null,"negativeTestsPeopleAntibody":null,"totalTestsPeopleAntigen":null,"positiveTestsPeopleAntigen":null,"totalTestsAntigen":null,"positiveTestsAntigen":null,"fips":"16","positiveIncrease":190,"negativeIncrease":827,"total":268189,"totalTestResultsIncrease":1009,"posNeg":268189,"deathIncrease":1,"hospitalizedIncrease":0,"hash":"f18f0ffe8c971d04955cd3182fe9215811f74292","commercialScore":0,"negativeRegularScore":0,"negativeScore":0,"positiveScore":0,"score":0,"grade":""},{"date":20200906,"state":"ID","positive":33477,"probableCases":2478,"negative":233695,"pending":null,"totalTestResultsSource":"totalTestsPeopleViral","totalTestResults":264694,"hospitalizedCurrently":151,"hospitalizedCumulative":1466,"inIcuCurrently":50,"inIcuCumulative":394,"onVentilatorCurrently":null,"onVentilatorCumulative":null,"recovered":16339,"dataQualityGrade":"A+","lastUpdateEt":"9/5/2020 19:00","dateModified":"2020-09-05T19:00:00Z","checkTimeEt":"09/05 15:00","death":384,"hospitalized":1466,"dateChecked":"2020-09-05T19:00:00Z","totalTestsViral":null,"positiveTestsViral":null,"negativeTestsViral":null,"positiveCasesViral":30999,"deathConfirmed":348,"deathProbable":36,"totalTestEncountersViral":null,"totalTestsPeopleViral":264694,"totalTestsAntibody":null,"positiveTestsAntibody":null,"negativeTestsAntibody":null,"totalTestsPeopleAntibody":null,"positiveTestsPeopleAntibody":null,"negativeTestsPeopleAntibody":null,"totalTestsPeopleAntigen":null,"positiveTestsPeopleAntigen":null,"totalTestsAntigen":null,"positiveTestsAntigen":null,"fips":"16","positiveIncrease":281,"negativeIncrease":1246,"total":267172,"totalTestResultsIncrease":1511,"posNeg":267172,"deathIncrease":2,"hospitalizedIncrease":5,"hash":"61dd9c265e32206a957c18d9b18bb1ac7f476509","commercialScore":0,"negativeRegularScore":0,"negativeScore":0,"positiveScore":0,"score":0,"grade":""},{"date":20200905,"state":"ID","positive":33196,"probableCases":2462,"negative":232449,"pending":null,"totalTestResultsSource":"totalTestsPeopleViral","totalTestResults":263183,"hospitalizedCurrently":151,"hospitalizedCumulative":1461,"inIcuCurrently":50,"inIcuCumulative":394,"onVentilatorCurrently":null,"onVentilatorCumulative":null,"recovered":16071,"dataQualityGrade":"A+","lastUpdateEt":"9/4/2020 19:00","dateModified":"2020-09-04T19:00:00Z","checkTimeEt":"09/04 15:00","death":382,"hospitalized":1461,"dateChecked":"2020-09-04T19:00:00Z","totalTestsViral":null,"positiveTestsViral":null,"negativeTestsViral":null,"positiveCasesViral":30734,"deathConfirmed":346,"deathProbable":36,"totalTestEncountersViral":null,"totalTestsPeopleViral":263183,"totalTestsAntibody":null,"positiveTestsAntibody":null,"negativeTestsAntibody":null,"totalTestsPeopleAntibody":null,"positiveTestsPeopleAntibody":null,"negativeTestsPeopleAntibody":null,"totalTestsPeopleAntigen":null,"positiveTestsPeopleAntigen":null,"totalTestsAntigen":null,"positiveTestsAntigen":null,"fips":"16","positiveIncrease":269,"negativeIncrease":1649,"total":265645,"totalTestResultsIncrease":1894,"posNeg":265645,"deathIncrease":10,"hospitalizedIncrease":19,"hash":"2dcb5f3ea6ff177f38e15e4e596422a3cc927790","commercialScore":0,"negativeRegularScore":0,"negativeScore":0,"positiveScore":0,"score":0,"grade":""},{"date":20200904,"state":"ID","positive":32927,"probableCases":2438,"negative":230800,"pending":null,"totalTestResultsSource":"totalTestsPeopleViral","totalTestResults":261289,"hospitalizedCurrently":171,"hospitalizedCumulative":1442,"inIcuCurrently":45,"inIcuCumulative":392,"onVentilatorCurrently":null,"onVentilatorCumulative":null,"recovered":15787,"dataQualityGrade":"A+","lastUpdateEt":"9/3/2020 19:00","dateModified":"2020-09-03T19:00:00Z","checkTimeEt":"09/03 15:00","death":372,"hospitalized":1442,"dateChecked":"2020-09-03T19:00:00Z","totalTestsViral":null,"positiveTestsViral":null,"negativeTestsViral":null,"positiveCasesViral":30489,"deathConfirmed":336,"deathProbable":36,"totalTestEncountersViral":null,"totalTestsPeopleViral":261289,"totalTestsAntibody":null,"positiveTestsAntibody":null,"negativeTestsAntibody":null,"totalTestsPeopleAntibody":null,"positiveTestsPeopleAntibody":null,"negativeTestsPeopleAntibody":null,"totalTestsPeopleAntigen":null,"positiveTestsPeopleAntigen":null,"totalTestsAntigen":null,"positiveTestsAntigen":null,"fips":"16","positiveIncrease":263,"negativeIncrease":2064,"total":263727,"totalTestResultsIncrease":2326,"posNeg":263727,"deathIncrease":0,"hospitalizedIncrease":7,"hash":"8e494e2902785895df87a5cd50ce7f5f5f629c71","commercialScore":0,"negativeRegularScore":0,"negativeScore":0,"positiveScore":0,"score":0,"grade":""},{"date":20200903,"state":"ID","positive":32664,"probableCases":2437,"negative":228736,"pending":null,"totalTestResultsSource":"totalTestsPeopleViral","totalTestResults":258963,"hospitalizedCurrently":171,"hospitalizedCumulative":1435,"inIcuCurrently":45,"inIcuCumulative":388,"onVentilatorCurrently":null,"onVentilatorCumulative":null,"recovered":15585,"dataQualityGrade":"A+","lastUpdateEt":"9/2/2020 19:00","dateModified":"2020-09-02T19:00:00Z","checkTimeEt":"09/02 15:00","death":372,"hospitalized":1435,"dateChecked":"2020-09-02T19:00:00Z","totalTestsViral":null,"positiveTestsViral":null,"negativeTestsViral":null,"positiveCasesViral":30227,"deathConfirmed":336,"deathProbable":36,"totalTestEncountersViral":null,"totalTestsPeopleViral":258963,"totalTestsAntibody":null,"positiveTestsAntibody":null,"negativeTestsAntibody":null,"totalTestsPeopleAntibody":null,"positiveTestsPeopleAntibody":null,"negativeTestsPeopleAntibody":null,"totalTestsPeopleAntigen":null,"positiveTestsPeopleAntigen":null,"totalTestsAntigen":null,"positiveTestsAntigen":null,"fips":"16","positiveIncrease":296,"negativeIncrease":2008,"total":261400,"totalTestResultsIncrease":2266,"posNeg":261400,"deathIncrease":4,"hospitalizedIncrease":41,"hash":"56f9015e3bcc2e3ed60228c436354442e1ed66cf","commercialScore":0,"negativeRegularScore":0,"negativeScore":0,"positiveScore":0,"score":0,"grade":""},{"date":20200902,"state":"ID","positive":32368,"probableCases":2399,"negative":226728,"pending":null,"totalTestResultsSource":"totalTestsPeopleViral","totalTestResults":256697,"hospitalizedCurrently":162,"hospitalizedCumulative":1394,"inIcuCurrently":46,"inIcuCumulative":381,"onVentilatorCurrently":null,"onVentilatorCumulative":null,"recovered":15212,"dataQualityGrade":"A+","lastUpdateEt":"9/1/2020 19:00","dateModified":"2020-09-01T19:00:00Z","checkTimeEt":"09/01 15:00","death":368,"hospitalized":1394,"dateChecked":"2020-09-01T19:00:00Z","totalTestsViral":null,"positiveTestsViral":null,"negativeTestsViral":null,"positiveCasesViral":29969,"deathConfirmed":333,"deathProbable":35,"totalTestEncountersViral":null,"totalTestsPeopleViral":256697,"totalTestsAntibody":null,"positiveTestsAntibody":null,"negativeTestsAntibody":null,"totalTestsPeopleAntibody":null,"positiveTestsPeopleAntibody":null,"negativeTestsPeopleAntibody":null,"totalTestsPeopleAntigen":null,"positiveTestsPeopleAntigen":null,"totalTestsAntigen":null,"positiveTestsAntigen":null,"fips":"16","positiveIncrease":280,"negativeIncrease":1127,"total":259096,"totalTestResultsIncrease":1349,"posNeg":259096,"deathIncrease":7,"hospitalizedIncrease":0,"hash":"e2797cc59c1a50d2e262761a0f28a709040d061a","commercialScore":0,"negativeRegularScore":0,"negativeScore":0,"positiveScore":0,"score":0,"grade":""},{"date":20200901,"state":"ID","positive":32088,"probableCases":2341,"negative":225601,"pending":null,"totalTestResultsSource":"totalTestsPeopleViral","totalTestResults":255348,"hospitalizedCurrently":162,"hospitalizedCumulative":1394,"inIcuCurrently":46,"inIcuCumulative":379,"onVentilatorCurrently":null,"onVentilatorCumulative":null,"recovered":14963,"dataQualityGrade":"A+","lastUpdateEt":"8/31/2020 19:05","dateModified":"2020-08-31T19:05:00Z","checkTimeEt":"08/31 15:05","death":361,"hospitalized":1394,"dateChecked":"2020-08-31T19:05:00Z","totalTestsViral":null,"positiveTestsViral":null,"negativeTestsViral":null,"positiveCasesViral":29747,"deathConfirmed":327,"deathProbable":34,"totalTestEncountersViral":null,"totalTestsPeopleViral":255348,"totalTestsAntibody":null,"positiveTestsAntibody":null,"negativeTestsAntibody":null,"totalTestsPeopleAntibody":null,"positiveTestsPeopleAntibody":null,"negativeTestsPeopleAntibody":null,"totalTestsPeopleAntigen":null,"positiveTestsPeopleAntigen":null,"totalTestsAntigen":null,"positiveTestsAntigen":null,"fips":"16","positiveIncrease":221,"negativeIncrease":1455,"total":257689,"totalTestResultsIncrease":1646,"posNeg":257689,"deathIncrease":2,"hospitalizedIncrease":25,"hash":"1a4375d1fc2f4162ccc73debde9083e625838cfb","commercialScore":0,"negativeRegularScore":0,"negativeScore":0,"positiveScore":0,"score":0,"grade":""},{"date":20200831,"state":"ID","positive":31867,"probableCases":2311,"negative":224146,"pending":null,"totalTestResultsSource":"totalTestsPeopleViral","totalTestResults":253702,"hospitalizedCurrently":181,"hospitalizedCumulative":1369,"inIcuCurrently":52,"inIcuCumulative":375,"onVentilatorCurrently":null,"onVentilatorCumulative":null,"recovered":14712,"dataQualityGrade":"A+","lastUpdateEt":"8/30/2020 19:00","dateModified":"2020-08-30T19:00:00Z","checkTimeEt":"08/30 15:00","death":359,"hospitalized":1369,"dateChecked":"2020-08-30T19:00:00Z","totalTestsViral":null,"positiveTestsViral":null,"negativeTestsViral":null,"positiveCasesViral":29556,"deathConfirmed":325,"deathProbable":34,"totalTestEncountersViral":null,"totalTestsPeopleViral":253702,"totalTestsAntibody":null,"positiveTestsAntibody":null,"negativeTestsAntibody":null,"totalTestsPeopleAntibody":null,"positiveTestsPeopleAntibody":null,"negativeTestsPeopleAntibody":null,"totalTestsPeopleAntigen":null,"positiveTestsPeopleAntigen":null,"totalTestsAntigen":null,"positiveTestsAntigen":null,"fips":"16","positiveIncrease":190,"negativeIncrease":1498,"total":256013,"totalTestResultsIncrease":1680,"posNeg":256013,"deathIncrease":1,"hospitalizedIncrease":4,"hash":"609ecdf10ccba930c84185eb6f92edfc88e26390","commercialScore":0,"negativeRegularScore":0,"negativeScore":0,"positiveScore":0,"score":0,"grade":""},{"date":20200830,"state":"ID","positive":31677,"probableCases":2303,"negative":222648,"pending":null,"totalTestResultsSource":"totalTestsPeopleViral","totalTestResults":252022,"hospitalizedCurrently":181,"hospitalizedCumulative":1365,"inIcuCurrently":52,"inIcuCumulative":374,"onVentilatorCurrently":null,"onVentilatorCumulative":null,"recovered":14490,"dataQualityGrade":"A+","lastUpdateEt":"8/29/2020 19:00","dateModified":"2020-08-29T19:00:00Z","checkTimeEt":"08/29 15:00","death":358,"hospitalized":1365,"dateChecked":"2020-08-29T19:00:00Z","totalTestsViral":null,"positiveTestsViral":null,"negativeTestsViral":null,"positiveCasesViral":29374,"deathConfirmed":324,"deathProbable":34,"totalTestEncountersViral":null,"totalTestsPeopleViral":252022,"totalTestsAntibody":null,"positiveTestsAntibody":null,"negativeTestsAntibody":null,"totalTestsPeopleAntibody":null,"positiveTestsPeopleAntibody":null,"negativeTestsPeopleAntibody":null,"totalTestsPeopleAntigen":null,"positiveTestsPeopleAntigen":null,"totalTestsAntigen":null,"positiveTestsAntigen":null,"fips":"16","positiveIncrease":293,"negativeIncrease":2982,"total":254325,"totalTestResultsIncrease":3268,"posNeg":254325,"deathIncrease":5,"hospitalizedIncrease":16,"hash":"74f31a7da0be42d4ea3f237b111a6fe26f80f698","commercialScore":0,"negativeRegularScore":0,"negativeScore":0,"positiveScore":0,"score":0,"grade":""},{"date":20200829,"state":"ID","positive":31384,"probableCases":2296,"negative":219666,"pending":null,"totalTestResultsSource":"totalTestsPeopleViral","totalTestResults":248754,"hospitalizedCurrently":181,"hospitalizedCumulative":1349,"inIcuCurrently":52,"inIcuCumulative":369,"onVentilatorCurrently":null,"onVentilatorCumulative":null,"recovered":14175,"dataQualityGrade":"A+","lastUpdateEt":"8/28/2020 19:00","dateModified":"2020-08-28T19:00:00Z","checkTimeEt":"08/28 15:00","death":353,"hospitalized":1349,"dateChecked":"2020-08-28T19:00:00Z","totalTestsViral":null,"positiveTestsViral":null,"negativeTestsViral":null,"positiveCasesViral":29088,"deathConfirmed":319,"deathProbable":34,"totalTestEncountersViral":null,"totalTestsPeopleViral":248754,"totalTestsAntibody":null,"positiveTestsAntibody":null,"negativeTestsAntibody":null,"totalTestsPeopleAntibody":null,"positiveTestsPeopleAntibody":null,"negativeTestsPeopleAntibody":null,"totalTestsPeopleAntigen":null,"positiveTestsPeopleAntigen":null,"totalTestsAntigen":null,"positiveTestsAntigen":null,"fips":"16","positiveIncrease":262,"negativeIncrease":1601,"total":251050,"totalTestResultsIncrease":1848,"posNeg":251050,"deathIncrease":10,"hospitalizedIncrease":21,"hash":"689eaf63b58d3e7cd03b70e7c67b191fa55c024c","commercialScore":0,"negativeRegularScore":0,"negativeScore":0,"positiveScore":0,"score":0,"grade":""},{"date":20200828,"state":"ID","positive":31122,"probableCases":2281,"negative":218065,"pending":null,"totalTestResultsSource":"totalTestsPeopleViral","totalTestResults":246906,"hospitalizedCurrently":176,"hospitalizedCumulative":1328,"inIcuCurrently":53,"inIcuCumulative":366,"onVentilatorCurrently":null,"onVentilatorCumulative":null,"recovered":13928,"dataQualityGrade":"A","lastUpdateEt":"8/27/2020 19:00","dateModified":"2020-08-27T19:00:00Z","checkTimeEt":"08/27 15:00","death":343,"hospitalized":1328,"dateChecked":"2020-08-27T19:00:00Z","totalTestsViral":null,"positiveTestsViral":null,"negativeTestsViral":null,"positiveCasesViral":28841,"deathConfirmed":309,"deathProbable":34,"totalTestEncountersViral":null,"totalTestsPeopleViral":246906,"totalTestsAntibody":null,"positiveTestsAntibody":null,"negativeTestsAntibody":null,"totalTestsPeopleAntibody":null,"positiveTestsPeopleAntibody":null,"negativeTestsPeopleAntibody":null,"totalTestsPeopleAntigen":null,"positiveTestsPeopleAntigen":null,"totalTestsAntigen":null,"positiveTestsAntigen":null,"fips":"16","positiveIncrease":342,"negativeIncrease":2174,"total":249187,"totalTestResultsIncrease":2459,"posNeg":249187,"deathIncrease":6,"hospitalizedIncrease":24,"hash":"61bd5932205db72e9a52b53e8bc165714056541b","commercialScore":0,"negativeRegularScore":0,"negativeScore":0,"positiveScore":0,"score":0,"grade":""},{"date":20200827,"state":"ID","positive":30780,"probableCases":2224,"negative":215891,"pending":null,"totalTestResultsSource":"totalTestsPeopleViral","totalTestResults":244447,"hospitalizedCurrently":176,"hospitalizedCumulative":1304,"inIcuCurrently":53,"inIcuCumulative":363,"onVentilatorCurrently":null,"onVentilatorCumulative":null,"recovered":13657,"dataQualityGrade":"A","lastUpdateEt":"8/26/2020 19:00","dateModified":"2020-08-26T19:00:00Z","checkTimeEt":"08/26 15:00","death":337,"hospitalized":1304,"dateChecked":"2020-08-26T19:00:00Z","totalTestsViral":null,"positiveTestsViral":null,"negativeTestsViral":null,"positiveCasesViral":28556,"deathConfirmed":304,"deathProbable":33,"totalTestEncountersViral":null,"totalTestsPeopleViral":244447,"totalTestsAntibody":null,"positiveTestsAntibody":null,"negativeTestsAntibody":null,"totalTestsPeopleAntibody":null,"positiveTestsPeopleAntibody":null,"negativeTestsPeopleAntibody":null,"totalTestsPeopleAntigen":null,"positiveTestsPeopleAntigen":null,"totalTestsAntigen":null,"positiveTestsAntigen":null,"fips":"16","positiveIncrease":305,"negativeIncrease":1504,"total":246671,"totalTestResultsIncrease":1728,"posNeg":246671,"deathIncrease":11,"hospitalizedIncrease":19,"hash":"c804b5b6a33af4f01a3ff4a818982684d3e072fd","commercialScore":0,"negativeRegularScore":0,"negativeScore":0,"positiveScore":0,"score":0,"grade":""},{"date":20200826,"state":"ID","positive":30475,"probableCases":2143,"negative":214387,"pending":null,"totalTestResultsSource":"totalTestsPeopleViral","totalTestResults":242719,"hospitalizedCurrently":160,"hospitalizedCumulative":1285,"inIcuCurrently":47,"inIcuCumulative":359,"onVentilatorCurrently":null,"onVentilatorCumulative":null,"recovered":13353,"dataQualityGrade":"A","lastUpdateEt":"8/25/2020 18:59","dateModified":"2020-08-25T18:59:00Z","checkTimeEt":"08/25 14:59","death":326,"hospitalized":1285,"dateChecked":"2020-08-25T18:59:00Z","totalTestsViral":null,"positiveTestsViral":null,"negativeTestsViral":null,"positiveCasesViral":28332,"deathConfirmed":293,"deathProbable":33,"totalTestEncountersViral":null,"totalTestsPeopleViral":242719,"totalTestsAntibody":null,"positiveTestsAntibody":null,"negativeTestsAntibody":null,"totalTestsPeopleAntibody":null,"positiveTestsPeopleAntibody":null,"negativeTestsPeopleAntibody":null,"totalTestsPeopleAntigen":null,"positiveTestsPeopleAntigen":null,"totalTestsAntigen":null,"positiveTestsAntigen":null,"fips":"16","positiveIncrease":405,"negativeIncrease":4362,"total":244862,"totalTestResultsIncrease":4705,"posNeg":244862,"deathIncrease":12,"hospitalizedIncrease":16,"hash":"fa04b9a5e8930111365a9a7a837327ba8f60b7cf","commercialScore":0,"negativeRegularScore":0,"negativeScore":0,"positiveScore":0,"score":0,"grade":""},{"date":20200825,"state":"ID","positive":30070,"probableCases":2081,"negative":210025,"pending":null,"totalTestResultsSource":"totalTestsPeopleViral","totalTestResults":238014,"hospitalizedCurrently":160,"hospitalizedCumulative":1269,"inIcuCurrently":47,"inIcuCumulative":350,"onVentilatorCurrently":null,"onVentilatorCumulative":null,"recovered":13081,"dataQualityGrade":"A","lastUpdateEt":"8/24/2020 19:04","dateModified":"2020-08-24T19:04:00Z","checkTimeEt":"08/24 15:04","death":314,"hospitalized":1269,"dateChecked":"2020-08-24T19:04:00Z","totalTestsViral":null,"positiveTestsViral":null,"negativeTestsViral":null,"positiveCasesViral":27989,"deathConfirmed":285,"deathProbable":29,"totalTestEncountersViral":null,"totalTestsPeopleViral":238014,"totalTestsAntibody":null,"positiveTestsAntibody":null,"negativeTestsAntibody":null,"totalTestsPeopleAntibody":null,"positiveTestsPeopleAntibody":null,"negativeTestsPeopleAntibody":null,"totalTestsPeopleAntigen":null,"positiveTestsPeopleAntigen":null,"totalTestsAntigen":null,"positiveTestsAntigen":null,"fips":"16","positiveIncrease":217,"negativeIncrease":1293,"total":240095,"totalTestResultsIncrease":1467,"posNeg":240095,"deathIncrease":7,"hospitalizedIncrease":13,"hash":"10975da2cb239d5035d6688725cf48a453067b8f","commercialScore":0,"negativeRegularScore":0,"negativeScore":0,"positiveScore":0,"score":0,"grade":""},{"date":20200824,"state":"ID","positive":29853,"probableCases":2038,"negative":208732,"pending":null,"totalTestResultsSource":"totalTestsPeopleViral","totalTestResults":236547,"hospitalizedCurrently":192,"hospitalizedCumulative":1256,"inIcuCurrently":52,"inIcuCumulative":347,"onVentilatorCurrently":null,"onVentilatorCumulative":null,"recovered":12867,"dataQualityGrade":"A","lastUpdateEt":"8/23/2020 19:00","dateModified":"2020-08-23T19:00:00Z","checkTimeEt":"08/23 15:00","death":307,"hospitalized":1256,"dateChecked":"2020-08-23T19:00:00Z","totalTestsViral":null,"positiveTestsViral":null,"negativeTestsViral":null,"positiveCasesViral":27815,"deathConfirmed":278,"deathProbable":29,"totalTestEncountersViral":null,"totalTestsPeopleViral":236547,"totalTestsAntibody":null,"positiveTestsAntibody":null,"negativeTestsAntibody":null,"totalTestsPeopleAntibody":null,"positiveTestsPeopleAntibody":null,"negativeTestsPeopleAntibody":null,"totalTestsPeopleAntigen":null,"positiveTestsPeopleAntigen":null,"totalTestsAntigen":null,"positiveTestsAntigen":null,"fips":"16","positiveIncrease":191,"negativeIncrease":1114,"total":238585,"totalTestResultsIncrease":1292,"posNeg":238585,"deathIncrease":1,"hospitalizedIncrease":10,"hash":"a207dc2ec39d7b0d63798e92cb5737fc2c458e07","commercialScore":0,"negativeRegularScore":0,"negativeScore":0,"positiveScore":0,"score":0,"grade":""},{"date":20200823,"state":"ID","positive":29662,"probableCases":2025,"negative":207618,"pending":null,"totalTestResultsSource":"totalTestsPeopleViral","totalTestResults":235255,"hospitalizedCurrently":192,"hospitalizedCumulative":1246,"inIcuCurrently":52,"inIcuCumulative":346,"onVentilatorCurrently":null,"onVentilatorCumulative":null,"recovered":12606,"dataQualityGrade":"A","lastUpdateEt":"8/22/2020 18:55","dateModified":"2020-08-22T18:55:00Z","checkTimeEt":"08/22 14:55","death":306,"hospitalized":1246,"dateChecked":"2020-08-22T18:55:00Z","totalTestsViral":null,"positiveTestsViral":null,"negativeTestsViral":null,"positiveCasesViral":27637,"deathConfirmed":277,"deathProbable":29,"totalTestEncountersViral":null,"totalTestsPeopleViral":235255,"totalTestsAntibody":null,"positiveTestsAntibody":null,"negativeTestsAntibody":null,"totalTestsPeopleAntibody":null,"positiveTestsPeopleAntibody":null,"negativeTestsPeopleAntibody":null,"totalTestsPeopleAntigen":null,"positiveTestsPeopleAntigen":null,"totalTestsAntigen":null,"positiveTestsAntigen":null,"fips":"16","positiveIncrease":293,"negativeIncrease":1134,"total":237280,"totalTestResultsIncre