date,state,positive,probableCases,negative,pending,totalTestResultsSource,totalTestResults,hospitalizedCurrently,hospitalizedCumulative,inIcuCurrently,inIcuCumulative,onVentilatorCurrently,onVentilatorCumulative,recovered,dataQualityGrade,lastUpdateEt,dateModified,checkTimeEt,death,hospitalized,dateChecked,totalTestsViral,positiveTestsViral,negativeTestsViral,positiveCasesViral,deathConfirmed,deathProbable,totalTestEncountersViral,totalTestsPeopleViral,totalTestsAntibody,positiveTestsAntibody,negativeTestsAntibody,totalTestsPeopleAntibody,positiveTestsPeopleAntibody,negativeTestsPeopleAntibody,totalTestsPeopleAntigen,positiveTestsPeopleAntigen,totalTestsAntigen,positiveTestsAntigen,fips,positiveIncrease,negativeIncrease,total,totalTestResultsIncrease,posNeg,deathIncrease,hospitalizedIncrease,hash,commercialScore,negativeRegularScore,negativeScore,positiveScore,score,grade
20201027,MP,92,,15993,,posNeg,16085,,4,,,,,29,D,10/27/2020 00:00,2020-10-27T00:00:00Z,10/26 20:00,2,4,2020-10-27T00:00:00Z,22633,,,92,2,,,16085,,,,,,,,,,,69,0,270,16085,270,16085,0,0,544c65a14e022532cc26f58759937802d1d4fa83,0,0,0,0,0,
20201026,MP,92,,15723,,posNeg,15815,,4,,,,,29,D,10/26/2020 00:00,2020-10-26T00:00:00Z,10/25 20:00,2,4,2020-10-26T00:00:00Z,22212,,,92,2,,,15811,,,,,,,,,,,69,4,0,15815,4,15815,0,0,ec48e04f1bba913d1b3cbfbc54ff2de0a6a908ce,0,0,0,0,0,
20201025,MP,88,,15723,,posNeg,15811,,4,,,,,29,D,10/23/2020 00:00,2020-10-23T00:00:00Z,10/22 20:00,2,4,2020-10-23T00:00:00Z,22212,,,88,2,,,15811,,,,,,,,,,,69,0,0,15811,0,15811,0,0,1802c3228274c42ef00cb9e3d2c8a33f588ee658,0,0,0,0,0,
20201024,MP,88,,15723,,posNeg,15811,,4,,,,,29,D,10/23/2020 00:00,2020-10-23T00:00:00Z,10/22 20:00,2,4,2020-10-23T00:00:00Z,22212,,,88,2,,,15811,,,,,,,,,,,69,0,0,15811,0,15811,0,0,472a853fb641cc7b704e13715f4ff03def98555c,0,0,0,0,0,
20201023,MP,88,,15723,,posNeg,15811,,4,,,,,29,D,10/23/2020 00:00,2020-10-23T00:00:00Z,10/22 20:00,2,4,2020-10-23T00:00:00Z,22212,,,88,2,,,15811,,,,,,,,,,,69,0,0,15811,0,15811,0,0,edb0967ba13606a0dc389a0d7f588db96fac2e4a,0,0,0,0,0,
20201022,MP,88,,15723,,posNeg,15811,,4,,,,,29,D,10/19/2020 00:00,2020-10-19T00:00:00Z,10/18 20:00,2,4,2020-10-19T00:00:00Z,22212,,,88,2,,,15811,,,,,,,,,,,69,0,0,15811,0,15811,0,0,5c1f91560cb81099790f30c8c47bd989e793a362,0,0,0,0,0,
20201021,MP,88,,15723,,posNeg,15811,,4,,,,,29,D,10/19/2020 00:00,2020-10-19T00:00:00Z,10/18 20:00,2,4,2020-10-19T00:00:00Z,22212,,,88,2,,,15811,,,,,,,,,,,69,0,0,15811,0,15811,0,0,ed9a1235a611ebaffa2bb65f85072c82159b818f,0,0,0,0,0,
20201020,MP,88,,15723,,posNeg,15811,,4,,,,,29,D,10/19/2020 00:00,2020-10-19T00:00:00Z,10/18 20:00,2,4,2020-10-19T00:00:00Z,22212,,,88,2,,,15811,,,,,,,,,,,69,2,267,15811,269,15811,0,0,13828da7570624f8f94485a4a50aa535389d3721,0,0,0,0,0,
20201019,MP,86,,15456,,posNeg,15542,,4,,,,,29,D,10/17/2020 00:00,2020-10-17T00:00:00Z,10/16 20:00,2,4,2020-10-17T00:00:00Z,19835,,,86,2,,,15533,,,,,,,,,,,69,0,0,15542,0,15542,0,0,3fedc694b23957d09abb915836c4de95f29ae18d,0,0,0,0,0,
20201018,MP,86,,15456,,posNeg,15542,,4,,,,,29,D,10/17/2020 00:00,2020-10-17T00:00:00Z,10/16 20:00,2,4,2020-10-17T00:00:00Z,19835,,,86,2,,,15533,,,,,,,,,,,69,0,0,15542,0,15542,0,0,1e87831d2edc90c3099160e3f80586a05b7805e5,0,0,0,0,0,
20201017,MP,86,,15456,,posNeg,15542,,4,,,,,29,D,10/17/2020 00:00,2020-10-17T00:00:00Z,10/16 20:00,2,4,2020-10-17T00:00:00Z,19835,,,86,2,,,15533,,,,,,,,,,,69,6,0,15542,6,15542,0,0,4dae368643a66c9c855673bf2d837fb52db4eab4,0,0,0,0,0,
20201016,MP,80,,15456,,posNeg,15536,,4,,,,,29,D,10/15/2020 00:00,2020-10-15T00:00:00Z,10/14 20:00,2,4,2020-10-15T00:00:00Z,21290,,,80,2,,,15533,,,,,,,,,,,69,3,0,15536,3,15536,0,0,9b60c9dea949a7cd0e612230ec4d246217efae96,0,0,0,0,0,
20201015,MP,77,,15456,,posNeg,15533,,4,,,,,29,D,10/15/2020 00:00,2020-10-15T00:00:00Z,10/14 20:00,2,4,2020-10-15T00:00:00Z,21290,,,77,2,,,15533,,,,,,,,,,,69,0,0,15533,0,15533,0,0,ef88eb14cdc1bd178b3f36f4a4255d3e83219748,0,0,0,0,0,
20201014,MP,77,,15456,,posNeg,15533,,4,,,,,29,D,10/13/2020 00:00,2020-10-13T00:00:00Z,10/12 20:00,2,4,2020-10-13T00:00:00Z,21290,,,77,2,,,15533,,,,,,,,,,,69,0,335,15533,335,15533,0,0,52fabf3ad9f4a6fddf49b3f3f5aa670ea4560d79,0,0,0,0,0,
20201013,MP,77,,15121,,posNeg,15198,,4,,,,,29,D,10/13/2020 00:00,2020-10-13T00:00:00Z,10/12 20:00,2,4,2020-10-13T00:00:00Z,19835,,,77,2,,,15196,,,,,,,,,,,69,0,0,15198,0,15198,0,0,f0a4abce8ab1ebd2ffe2cfdfde46f7e99458c083,0,0,0,0,0,
20201012,MP,77,,15121,,posNeg,15198,,4,,,,,29,D,10/10/2020 00:00,2020-10-10T00:00:00Z,10/09 20:00,2,4,2020-10-10T00:00:00Z,19835,,,77,2,,,15196,,,,,,,,,,,69,0,0,15198,0,15198,0,0,05d85ae9830d7630241e6598002c44e69114c6f1,0,0,0,0,0,
20201011,MP,77,,15121,,posNeg,15198,,4,,,,,29,D,10/10/2020 00:00,2020-10-10T00:00:00Z,10/09 20:00,2,4,2020-10-10T00:00:00Z,19835,,,77,2,,,15196,,,,,,,,,,,69,0,0,15198,0,15198,0,0,14cf66ce16737b07fd09df7f4b27cc83b100ddc2,0,0,0,0,0,
20201010,MP,77,,15121,,posNeg,15198,,4,,,,,29,D,10/10/2020 00:00,2020-10-10T00:00:00Z,10/09 20:00,2,4,2020-10-10T00:00:00Z,19835,,,77,2,,,15196,,,,,,,,,,,69,2,0,15198,2,15198,0,0,89385ce585122881b5085992840680bcb01e81ed,0,0,0,0,0,
20201009,MP,75,,15121,,posNeg,15196,,4,,,,,29,D,10/8/2020 00:00,2020-10-08T00:00:00Z,10/07 20:00,2,4,2020-10-08T00:00:00Z,20709,,,75,2,,,15196,,,,,,,,,,,69,0,0,15196,0,15196,0,0,5e838df3b1340e6a77d4fc892021033a03b7c0b3,0,0,0,0,0,
20201008,MP,75,,15121,,posNeg,15196,,4,,,,,29,D,10/6/2020 00:00,2020-10-06T00:00:00Z,10/05 20:00,2,4,2020-10-06T00:00:00Z,20709,,,75,2,,,15196,,,,,,,,,,,69,0,0,15196,0,15196,0,0,f52b2811d54ee9f49348e157c8b24bf17ab2bc1f,0,0,0,0,0,
20201007,MP,75,,15121,,posNeg,15196,,4,,,,,29,D,10/6/2020 00:00,2020-10-06T00:00:00Z,10/05 20:00,2,4,2020-10-06T00:00:00Z,20709,,,75,2,,,15196,,,,,,,,,,,69,0,0,15196,0,15196,0,0,385a20a4424955dbb56b31d9318071c899a356ce,0,0,0,0,0,
20201006,MP,75,,15121,,posNeg,15196,,4,,,,,29,D,10/6/2020 00:00,2020-10-06T00:00:00Z,10/05 20:00,2,4,2020-10-06T00:00:00Z,20709,,,75,2,,,15196,,,,,,,,,,,69,0,0,15196,0,15196,0,0,f8a9171f8feb2698a29e82d0ff5b857cdbd96b78,0,0,0,0,0,
20201005,MP,75,,15121,,posNeg,15196,,4,,,,,29,D,10/5/2020 00:00,2020-10-05T00:00:00Z,10/04 20:00,2,4,2020-10-05T00:00:00Z,20709,,,75,2,,,15196,,,,,,,,,,,69,2,9,15196,11,15196,0,0,40df75152f4c65bc12ce331bb028e0eab63974f1,0,0,0,0,0,
20201004,MP,73,,15112,,posNeg,15185,,4,,,,,29,D,10/2/2020 00:00,2020-10-02T00:00:00Z,10/01 20:00,2,4,2020-10-02T00:00:00Z,20419,,,73,2,,,15182,,,,,,,,,,,69,0,0,15185,0,15185,0,0,c396aa436c6a2d90eea6c88700b7d697cdb4831b,0,0,0,0,0,
20201003,MP,73,,15112,,posNeg,15185,,4,,,,,29,D,10/2/2020 00:00,2020-10-02T00:00:00Z,10/01 20:00,2,4,2020-10-02T00:00:00Z,20419,,,73,2,,,15182,,,,,,,,,,,69,0,0,15185,0,15185,0,0,343c10c829d63ef37633cbb2a166900705c7713a,0,0,0,0,0,
20201002,MP,73,,15112,,posNeg,15185,,4,,,,,29,D,10/2/2020 00:00,2020-10-02T00:00:00Z,10/01 20:00,2,4,2020-10-02T00:00:00Z,20419,,,73,2,,,15182,,,,,,,,,,,69,3,0,15185,3,15185,0,0,f35b8fb2f5eae7b1952e2977a5e5203f7efcf4f6,0,0,0,0,0,
20201001,MP,70,,15112,,posNeg,15182,,4,,,,,29,D,10/1/2020 00:00,2020-10-01T00:00:00Z,09/30 20:00,2,4,2020-10-01T00:00:00Z,20419,,,70,2,,,15182,,,,,,,,,,,69,0,0,15182,0,15182,0,0,3611561c7e25a4fab32dffb165a878cd24578ed7,0,0,0,0,0,
20200930,MP,70,,15112,,posNeg,15182,,4,,,,,29,D,9/30/2020 00:00,2020-09-30T00:00:00Z,09/29 20:00,2,4,2020-09-30T00:00:00Z,20419,,,70,2,,,15182,,,,,,,,,,,69,0,336,15182,336,15182,0,0,f231f4fb4428beb7f6a1e503334eda134af73a5e,0,0,0,0,0,
20200929,MP,70,,14776,,posNeg,14846,,4,,,,,29,D,9/29/2020 00:00,2020-09-29T00:00:00Z,09/28 20:00,2,4,2020-09-29T00:00:00Z,19835,,,70,2,,,14845,,,,,,,,,,,69,0,0,14846,0,14846,0,0,8bdcd8117b465b1811d914b65255e633d4ca6c2c,0,0,0,0,0,
20200928,MP,70,,14776,,posNeg,14846,,4,,,,,29,D,9/28/2020 00:00,2020-09-28T00:00:00Z,09/27 20:00,2,4,2020-09-28T00:00:00Z,19835,,,70,2,,,14845,,,,,,,,,,,69,0,0,14846,0,14846,0,0,639c12aedac4cc6a9651d36cd3e122b41b0aff84,0,0,0,0,0,
20200927,MP,70,,14776,,posNeg,14846,,4,,,,,29,D,9/26/2020 00:00,2020-09-26T00:00:00Z,09/25 20:00,2,4,2020-09-26T00:00:00Z,19835,,,70,2,,,14845,,,,,,,,,,,69,1,0,14846,1,14846,0,0,a2a3b7becbf3b612bf3af667937a2ff915743112,0,0,0,0,0,
20200926,MP,69,,14776,,posNeg,14845,,4,,,,,29,D,9/25/2020 00:00,2020-09-25T00:00:00Z,09/24 20:00,2,4,2020-09-25T00:00:00Z,19835,,,69,2,,,14845,,,,,,,,,,,69,0,0,14845,0,14845,0,0,15fe4e30ea3aef59938cab507d1558d536ad92e7,0,0,0,0,0,
20200925,MP,69,,14776,,posNeg,14845,,4,,,,,29,D,9/25/2020 00:00,2020-09-25T00:00:00Z,09/24 20:00,2,4,2020-09-25T00:00:00Z,19835,,,69,2,,,14845,,,,,,,,,,,69,0,0,14845,0,14845,0,0,1d800b2e8ce754b50cd198e8a4c5aa22492ed659,0,0,0,0,0,
20200924,MP,69,,14776,,posNeg,14845,,4,,,,,29,D,9/23/2020 00:00,2020-09-23T00:00:00Z,09/22 20:00,2,4,2020-09-23T00:00:00Z,19835,,,69,2,,,14845,,,,,,,,,,,69,0,0,14845,0,14845,0,0,dc440801172023e460fe2c2b0911d4dd4e4463f2,0,0,0,0,0,
20200923,MP,69,,14776,,posNeg,14845,,4,,,,,29,D,9/22/2020 00:00,2020-09-22T00:00:00Z,09/21 20:00,2,4,2020-09-22T00:00:00Z,19835,,,69,2,,,14845,,,,,,,,,,,69,0,460,14845,460,14845,0,0,2b2395e9ab4afcbce074ad98961a866f14f1fb77,0,0,0,0,0,
20200922,MP,69,,14316,,posNeg,14385,,4,,,,,29,D,9/21/2020 00:00,2020-09-21T00:00:00Z,09/20 20:00,2,4,2020-09-21T00:00:00Z,18915,,,69,2,,,14375,,,,,,,,,,,69,0,0,14385,0,14385,0,0,b4affaa08119df89a36fa6d68729da06707fdae1,0,0,0,0,0,
20200921,MP,69,,14316,,posNeg,14385,,4,,,,,29,D,9/21/2020 00:00,2020-09-21T00:00:00Z,09/20 20:00,2,4,2020-09-21T00:00:00Z,18915,,,69,2,,,14375,,,,,,,,,,,69,1,0,14385,1,14385,0,0,ef68bb254b30c44fb8017a2d3ca8390d0009455d,0,0,0,0,0,
20200920,MP,68,,14316,,posNeg,14384,,4,,,,,29,D,9/20/2020 00:00,2020-09-20T00:00:00Z,09/19 20:00,2,4,2020-09-20T00:00:00Z,18915,,,68,2,,,14375,,,,,,,,,,,69,6,0,14384,6,14384,0,0,95c64dfcc1db165fe077974ffbe7265e228495ac,0,0,0,0,0,
20200919,MP,62,,14316,,posNeg,14378,,4,,,,,29,D,9/17/2020 00:00,2020-09-17T00:00:00Z,09/16 20:00,2,4,2020-09-17T00:00:00Z,18915,,,62,2,,,14375,,,,,,,,,,,69,0,0,14378,0,14378,0,0,5dc735765d919c5d31163a828fef091501740555,0,0,0,0,0,
20200918,MP,62,,14316,,posNeg,14378,,4,,,,,29,D,9/17/2020 00:00,2020-09-17T00:00:00Z,09/16 20:00,2,4,2020-09-17T00:00:00Z,18915,,,62,2,,,14375,,,,,,,,,,,69,0,0,14378,0,14378,0,0,172f8fbeff9c9ba48fe8a0129aeb9850068b6535,0,0,0,0,0,
20200917,MP,62,,14316,,posNeg,14378,,4,,,,,29,D,9/17/2020 00:00,2020-09-17T00:00:00Z,09/16 20:00,2,4,2020-09-17T00:00:00Z,18915,,,62,2,,,14375,,,,,,,,,,,69,1,0,14378,1,14378,0,0,21a8164c57c686d3a1df3dcb329ffd33083b63a2,0,0,0,0,0,
20200916,MP,61,,14316,,posNeg,14377,,4,,,,,29,D,9/14/2020 00:00,2020-09-14T00:00:00Z,09/13 20:00,2,4,2020-09-14T00:00:00Z,18915,,,61,2,,,14375,,,,,,,,,,,69,0,0,14377,0,14377,0,0,78eea676bafb22f8454b90c5692d9ea03636e254,0,0,0,0,0,
20200915,MP,61,,14316,,posNeg,14377,,4,,,,,29,C,9/14/2020 00:00,2020-09-14T00:00:00Z,09/13 20:00,2,4,2020-09-14T00:00:00Z,18915,,,61,2,,,14375,,,,,,,,,,,69,0,0,14377,0,14377,0,0,462a6296e3a9bd270f8de4a09e2ce9288d05864e,0,0,0,0,0,
20200914,MP,61,,14316,,posNeg,14377,,4,,,,,29,C,9/14/2020 00:00,2020-09-14T00:00:00Z,09/13 20:00,2,4,2020-09-14T00:00:00Z,18915,,,61,2,,,14375,,,,,,,,,,,69,1,0,14377,1,14377,0,0,cfae8d2fa1e0bedd93625cd028c887266e08a600,0,0,0,0,0,
20200913,MP,60,,14316,,posNeg,14376,,4,,,,,29,C,9/12/2020 00:00,2020-09-12T00:00:00Z,09/11 20:00,2,4,2020-09-12T00:00:00Z,18915,,,60,2,,,14375,,,,,,,,,,,69,0,0,14376,0,14376,0,0,4c3f0b8a001109b122808eab0afbdcf7e2aeee3f,0,0,0,0,0,
20200912,MP,60,,14316,,posNeg,14376,,4,,,,,29,C,9/8/2020 00:00,2020-09-08T00:00:00Z,09/07 20:00,2,4,2020-09-08T00:00:00Z,18915,,,60,2,,,14375,,,,,,,,,,,69,1,0,14376,1,14376,0,0,da896db4f007cb3fff8cf5d290b980921f583e4a,0,0,0,0,0,
20200911,MP,59,,14316,,posNeg,14375,,4,,,,,29,C,9/8/2020 00:00,2020-09-08T00:00:00Z,09/07 20:00,2,4,2020-09-08T00:00:00Z,18915,,,59,2,,,14375,,,,,,,,,,,69,0,0,14375,0,14375,0,0,7f477d5c7f9e5b784614f47467f7d683df4a2581,0,0,0,0,0,
20200910,MP,59,,14316,,posNeg,14375,,4,,,,,29,C,9/8/2020 00:00,2020-09-08T00:00:00Z,09/07 20:00,2,4,2020-09-08T00:00:00Z,18915,,,59,2,,,14375,,,,,,,,,,,69,0,832,14375,832,14375,0,0,eae17f11b90a1c1062f428160ea29df2e28ecc0b,0,0,0,0,0,
20200909,MP,59,,13484,,posNeg,13543,,4,,,,,29,C,9/1/2020 00:00,2020-09-01T00:00:00Z,08/31 20:00,2,4,2020-09-01T00:00:00Z,17626,,,59,2,,,13540,,,,,,,,,,,69,0,0,13543,0,13543,0,0,7470a999a3e01321d9724cbcd8798ba8b08f70da,0,0,0,0,0,
20200908,MP,59,,13484,,posNeg,13543,,4,,,,,29,C,9/1/2020 00:00,2020-09-01T00:00:00Z,08/31 20:00,2,4,2020-09-01T00:00:00Z,17626,,,59,2,,,13540,,,,,,,,,,,69,1,0,13543,1,13543,0,0,489d63ca1220bcf46746fce70f46afd721d84fcd,0,0,0,0,0,
20200907,MP,58,,13484,,posNeg,13542,,4,,,,,29,C,9/1/2020 00:00,2020-09-01T00:00:00Z,08/31 20:00,2,4,2020-09-01T00:00:00Z,17626,,,58,2,,,13540,,,,,,,,,,,69,0,0,13542,0,13542,0,0,54bb29bfdeb26ebfb228c0dd408dd17d3e945822,0,0,0,0,0,
20200906,MP,58,,13484,,posNeg,13542,,4,,,,,29,C,9/1/2020 00:00,2020-09-01T00:00:00Z,08/31 20:00,2,4,2020-09-01T00:00:00Z,17626,,,58,2,,,13540,,,,,,,,,,,69,0,0,13542,0,13542,0,0,ee793b5739d1f6688120baa6f6d83b1070019408,0,0,0,0,0,
20200905,MP,58,,13484,,posNeg,13542,,4,,,,,29,C,9/1/2020 00:00,2020-09-01T00:00:00Z,08/31 20:00,2,4,2020-09-01T00:00:00Z,17626,,,58,2,,,13540,,,,,,,,,,,69,1,0,13542,1,13542,0,0,1767ca6b8cf0bb1cf24bcb602f8f12070391c9d5,0,0,0,0,0,
20200904,MP,57,,13484,,posNeg,13541,,4,,,,,29,C,9/1/2020 00:00,2020-09-01T00:00:00Z,08/31 20:00,2,4,2020-09-01T00:00:00Z,17626,,,57,2,,,13540,,,,,,,,,,,69,0,0,13541,0,13541,0,0,4b4e10dea14e39b2b439473cbc94bb541d89f836,0,0,0,0,0,
20200903,MP,57,,13484,,posNeg,13541,,4,,,,,29,C,9/1/2020 00:00,2020-09-01T00:00:00Z,08/31 20:00,2,4,2020-09-01T00:00:00Z,17626,,,57,2,,,13540,,,,,,,,,,,69,0,0,13541,0,13541,0,0,3d099d48ab5692578815e9213eb982059520b1f4,0,0,0,0,0,
20200902,MP,57,,13484,,posNeg,13541,,4,,,,,29,C,9/1/2020 00:00,2020-09-01T00:00:00Z,08/31 20:00,2,4,2020-09-01T00:00:00Z,17626,,,57,2,,,13540,,,,,,,,,,,69,0,0,13541,0,13541,0,0,629e8990f1f5b815f68480232061f628c2db250d,0,0,0,0,0,
20200901,MP,57,,13484,,posNeg,13541,,4,,,,,29,C,9/1/2020 00:00,2020-09-01T00:00:00Z,08/31 20:00,2,4,2020-09-01T00:00:00Z,17626,,,57,2,,,13540,,,,,,,,,,,69,1,0,13541,1,13541,0,0,062292463e35d3e98a0db8f89ee6a38605d26336,0,0,0,0,0,
20200831,MP,56,,13484,,posNeg,13540,,4,,,,,29,C,8/26/2020 23:49,2020-08-26T23:49:00Z,08/26 19:49,2,4,2020-08-26T23:49:00Z,17626,,,56,2,,,13540,,,,,,,,,,,69,0,0,13540,0,13540,0,0,b3ebf01f8375219c82bae848e21b720f27ae8d71,0,0,0,0,0,
20200830,MP,56,,13484,,posNeg,13540,,4,,,,,29,C,8/26/2020 23:49,2020-08-26T23:49:00Z,08/26 19:49,2,4,2020-08-26T23:49:00Z,17626,,,56,2,,,13540,,,,,,,,,,,69,0,-2,13540,-2,13540,0,0,89d4e445a79f6e0000e9e9b389a6aab70e77b0a9,0,0,0,0,0,
20200829,MP,56,,13486,,posNeg,13542,,4,,,,,29,C,8/26/2020 23:49,2020-08-26T23:49:00Z,08/26 19:49,2,4,2020-08-26T23:49:00Z,17626,,,56,2,,,13540,,,,,,,,,,,69,2,0,13542,2,13542,0,0,12221ee9b5fbdbe3232819dc48da83a3c4483ccf,0,0,0,0,0,
20200828,MP,54,,13486,,posNeg,13540,,4,,,,,29,D,8/26/2020 23:49,2020-08-26T23:49:00Z,08/26 19:49,2,4,2020-08-26T23:49:00Z,17626,,,54,2,,,13540,,,,,,,,,,,69,0,0,13540,0,13540,0,0,5858effe4a0fed2d6be24534dcfb78678d6f86cd,0,0,0,0,0,
20200827,MP,54,,13486,,posNeg,13540,,4,,,,,29,D,8/26/2020 23:49,2020-08-26T23:49:00Z,08/26 19:49,2,4,2020-08-26T23:49:00Z,17626,,,54,2,,,13540,,,,,,,,,,,69,0,619,13540,619,13540,0,0,ba2412d6343bc5201d092747f97fe743c3f0dcdf,0,0,0,0,0,
20200826,MP,54,,12867,,posNeg,12921,,4,,,,,29,D,8/17/2020 19:35,2020-08-17T19:35:00Z,08/17 15:35,2,4,2020-08-17T19:35:00Z,16453,,,54,2,,,12920,,,,,,,,,,,69,0,0,12921,0,12921,0,0,f54e163b13ddd980f1126ae1ab52271e02de4841,0,0,0,0,0,
20200825,MP,54,,12867,,posNeg,12921,,4,,,,,29,D,8/17/2020 19:35,2020-08-17T19:35:00Z,08/17 15:35,2,4,2020-08-17T19:35:00Z,16453,,,54,2,,,12920,,,,,,,,,,,69,0,0,12921,0,12921,0,0,91d38a2a4228d98e5d141e5c77587e50caaef088,0,0,0,0,0,
20200824,MP,54,,12867,,posNeg,12921,,4,,,,,29,D,8/17/2020 19:35,2020-08-17T19:35:00Z,08/17 15:35,2,4,2020-08-17T19:35:00Z,16453,,,54,2,,,12920,,,,,,,,,,,69,0,0,12921,0,12921,0,0,fcd076f5d9e7eb11329e1a80044e46cc553ee72a,0,0,0,0,0,
20200823,MP,54,,12867,,posNeg,12921,,4,,,,,29,D,8/17/2020 19:35,2020-08-17T19:35:00Z,08/17 15:35,2,4,2020-08-17T19:35:00Z,16453,,,54,2,,,12920,,,,,,,,,,,69,0,0,12921,0,12921,0,0,adaa93a8ee49612430d042b071b82d32fa8f1cf5,0,0,0,0,0,
20200822,MP,54,,12867,,posNeg,12921,,4,,,,,29,D,8/17/2020 19:35,2020-08-17T19:35:00Z,08/17 15:35,2,4,2020-08-17T19:35:00Z,16453,,,54,2,,,12920,,,,,,,,,,,69,0,0,12921,0,12921,0,0,547012ca4af96f57e1874f1efa0eda0659414c91,0,0,0,0,0,
20200821,MP,54,,12867,,posNeg,12921,,4,,,,,29,D,8/17/2020 19:35,2020-08-17T19:35:00Z,08/17 15:35,2,4,2020-08-17T19:35:00Z,16453,,,54,2,,,12920,,,,,,,,,,,69,0,0,12921,0,12921,0,0,e5589aa146da4f9eb7632891ceca07c593aa9681,0,0,0,0,0,
20200820,MP,54,,12867,,posNeg,12921,,4,,,,,29,D,8/17/2020 19:35,2020-08-17T19:35:00Z,08/17 15:35,2,4,2020-08-17T19:35:00Z,16453,,,54,2,,,12920,,,,,,,,,,,69,0,1,12921,1,12921,0,0,8a89643d6c0e7e1dd43f8ac52d583d844fc104bf,0,0,0,0,0,
20200819,MP,54,,12866,,posNeg,12920,,4,,,,,29,D,8/17/2020 19:35,2020-08-17T19:35:00Z,08/17 15:35,2,4,2020-08-17T19:35:00Z,16453,,,54,2,,,12920,,,,,,,,,,,69,0,0,12920,0,12920,0,0,9f2942efbdfc48fbf8a95c6196b243c12f0c5afe,0,0,0,0,0,
20200818,MP,54,,12866,,posNeg,12920,,4,,,,,29,D,8/17/2020 19:35,2020-08-17T19:35:00Z,08/17 15:35,2,4,2020-08-17T19:35:00Z,16453,,,54,,,,12920,,,,,,,,,,,69,1,-1,12920,0,12920,0,0,6a97a5f6fafc2a27a95b8e7cc592f9fdeb9b4fd5,0,0,0,0,0,
20200817,MP,53,,12867,,posNeg,12920,,4,,,,,29,D,8/17/2020 04:04,2020-08-17T04:04:00Z,08/17 00:04,2,4,2020-08-17T04:04:00Z,16453,,,53,,,,12920,,,,,,,,,,,69,3,615,12920,618,12920,0,0,8b9bb6d99f9a755d36e3914db411f11290615ea1,0,0,0,0,0,
20200816,MP,50,,12252,,posNeg,12302,,4,,,,,29,D,8/14/2020 04:04,2020-08-14T04:04:00Z,08/14 00:04,2,4,2020-08-14T04:04:00Z,14419,,,50,,,,12301,,,,,,,,,,,69,0,0,12302,0,12302,0,0,edda2b0b8c80ccb2b93f68b4719461a1aadd7ffe,0,0,0,0,0,
20200815,MP,50,,12252,,posNeg,12302,,4,,,,,29,D,8/14/2020 04:04,2020-08-14T04:04:00Z,08/14 00:04,2,4,2020-08-14T04:04:00Z,14419,,,50,,,,12301,,,,,,,,,,,69,0,0,12302,0,12302,0,0,8177159c53dfbcd68075a3d4d58b2c94cefaf116,0,0,0,0,0,
20200814,MP,50,,12252,,posNeg,12302,,4,,,,,29,D,8/14/2020 04:04,2020-08-14T04:04:00Z,08/14 00:04,2,4,2020-08-14T04:04:00Z,14419,,,50,,,,12301,,,,,,,,,,,69,1,0,12302,1,12302,0,0,edd2337dcabafff959acac013c583b1ae75e3ac7,0,0,0,0,0,
20200813,MP,49,,12252,,posNeg,12301,,4,,,,,29,D,8/10/2020 17:54,2020-08-10T17:54:00Z,08/10 13:54,2,4,2020-08-10T17:54:00Z,14419,,,49,,,,12301,,,,,,,,,,,69,0,0,12301,0,12301,0,0,2977ecfb897786be82880de4fd494d57f5a11559,0,0,0,0,0,
20200812,MP,49,,12252,,posNeg,12301,,4,,,,,29,D,8/10/2020 17:54,2020-08-10T17:54:00Z,08/10 13:54,2,4,2020-08-10T17:54:00Z,14419,,,49,,,,12301,,,,,,,,,,,69,0,0,12301,0,12301,0,0,7769912dbff6f00120fed1f5ac7016309cad8116,0,0,0,0,0,
20200811,MP,49,,12252,,posNeg,12301,,4,,,,,29,D,8/10/2020 17:54,2020-08-10T17:54:00Z,08/10 13:54,2,4,2020-08-10T17:54:00Z,14419,,,49,,,,12301,,,,,,,,,,,69,0,0,12301,0,12301,0,0,bd1e9eecb61739f153b703f2302a35d98b2819f3,0,0,0,0,0,
20200810,MP,49,,12252,,posNeg,12301,,4,,,,,29,D,8/9/2020 00:59,2020-08-09T00:59:00Z,08/08 20:59,2,4,2020-08-09T00:59:00Z,14419,,,49,,,,12301,,,,,,,,,,,69,1,-1,12301,0,12301,0,0,314d90c7459340e974e5462c3364bf3e94198410,0,0,0,0,0,
20200809,MP,48,,12253,,posNeg,12301,,4,,,,,29,D,8/9/2020 00:59,2020-08-09T00:59:00Z,08/08 20:59,2,4,2020-08-09T00:59:00Z,14419,,,48,,,,12301,,,,,,,,,,,69,0,0,12301,0,12301,0,0,c6dfbd98ab3c858abd8cb4491190e77e5cf01d5d,0,0,0,0,0,
20200808,MP,48,,12253,,posNeg,12301,,4,,,,,29,D,8/9/2020 00:59,2020-08-09T00:59:00Z,08/08 20:59,2,4,2020-08-09T00:59:00Z,14419,,,48,,,,12301,,,,,,,,,,,69,1,-1,12301,0,12301,0,0,7a2f41df56d591af12946b0714b29a807a767b08,0,0,0,0,0,
20200807,MP,47,,12254,,posNeg,12301,,4,,,,,29,D,8/6/2020 04:01,2020-08-06T04:01:00Z,08/06 00:01,2,4,2020-08-06T04:01:00Z,14419,,,47,,,,12301,,,,,,,,,,,69,0,0,12301,0,12301,0,0,84f82cb3452ef8ecf487da32f575a39e5cb6f602,0,0,0,0,0,
20200806,MP,47,,12254,,posNeg,12301,,4,,,,,29,D,8/6/2020 04:01,2020-08-06T04:01:00Z,08/06 00:01,2,4,2020-08-06T04:01:00Z,14419,,,47,,,,12301,,,,,,,,,,,69,1,-1,12301,0,12301,0,0,d87cebc2373c01c8a4bc3f1dbfb5e041088a30d6,0,0,0,0,0,
20200805,MP,46,,12255,,posNeg,12301,,4,,,,,29,D,8/5/2020 00:22,2020-08-05T00:22:00Z,08/04 20:22,2,4,2020-08-05T00:22:00Z,14419,,,46,,,,12301,,,,,,,,,,,69,0,0,12301,0,12301,0,0,21a387bac52e82ce716647f02e8503e0045fbad0,0,0,0,0,0,
20200804,MP,46,,12255,,posNeg,12301,,4,,,,,29,D,8/3/2020 03:26,2020-08-03T03:26:00Z,08/02 23:26,2,4,2020-08-03T03:26:00Z,14419,,,46,,,,12301,,,,,,,,,,,69,0,0,12301,0,12301,0,0,38570467816ae0f98b8513f26b29d41637350178,0,0,0,0,0,
20200803,MP,46,,12255,,posNeg,12301,,4,,,,,29,D,8/3/2020 03:26,2020-08-03T03:26:00Z,08/02 23:26,2,4,2020-08-03T03:26:00Z,14419,,,46,,,,12301,,,,,,,,,,,69,1,536,12301,537,12301,0,0,d0608b580b0a28c9389acce10bd8060bb828e650,0,0,0,0,0,
20200802,MP,45,,11719,,posNeg,11764,,4,,,,,29,D,8/1/2020 11:33,2020-08-01T11:33:00Z,08/01 07:33,2,4,2020-08-01T11:33:00Z,12745,,,45,,,,11759,,,,,,,,,,,69,3,0,11764,3,11764,0,0,47bbe2335ebe4ac7d9d854992688560fe04ce447,0,0,0,0,0,
20200801,MP,42,,11719,,posNeg,11761,,4,,,,,29,D,7/30/2020 02:49,2020-07-30T02:49:00Z,07/29 22:49,2,4,2020-07-30T02:49:00Z,12745,,,42,,,,11759,,,,,,,,,,,69,0,0,11761,0,11761,0,0,aff08a193edee8426249d3b4e8cb9821c3e2a73a,0,0,0,0,0,
20200731,MP,42,,11719,,posNeg,11761,,4,,,,,29,D,7/29/2020 23:49,2020-07-29T23:49:00Z,07/29 19:49,2,4,2020-07-29T23:49:00Z,12745,,,42,,,,11759,,,,,,,,,,,69,0,0,11761,0,11761,0,0,f488708c05dc81a3c8c2bc6b6fa8b47514409f73,0,0,0,0,0,
20200730,MP,42,,11719,,posNeg,11761,,4,,,,,29,D,7/29/2020 23:49,2020-07-29T23:49:00Z,07/29 19:49,2,4,2020-07-29T23:49:00Z,12745,,,42,,,,11759,,,,,,,,,,,69,2,0,11761,2,11761,0,0,e0fb3b789320fc4cf869f4d451e3fbc45d8b29d1,0,0,0,0,0,
20200729,MP,40,,11719,,posNeg,11759,,4,,,,,29,D,7/29/2020 02:48,2020-07-29T02:48:00Z,07/28 22:48,2,4,2020-07-29T02:48:00Z,12745,,,40,,,,11759,,,,,,,,,,,69,0,0,11759,0,11759,0,0,8cf38cc2ecf41fd53258b4c41ec7b5241d7c1fa3,0,0,0,0,0,
20200728,MP,40,,11719,,posNeg,11759,,4,,,,,29,D,7/28/2020 01:35,2020-07-28T01:35:00Z,07/27 21:35,2,4,2020-07-28T01:35:00Z,12745,,,40,,,,11759,,,,,,,,,,,69,0,0,11759,0,11759,0,0,2ae15b31af0785a164b3539237624a8b8e5576ba,0,0,0,0,0,
20200727,MP,40,,11719,,posNeg,11759,,4,,,,,29,D,7/27/2020 03:22,2020-07-27T03:22:00Z,07/26 23:22,2,4,2020-07-27T03:22:00Z,12745,,,40,,,,11759,,,,,,,,,,,69,0,419,11759,419,11759,0,0,dbb77b59cba18237a7c9cbaa78a0e7c2891b3e43,0,0,0,0,0,
20200726,MP,40,,11300,,posNeg,11340,,4,,,,,29,D,7/25/2020 23:05,2020-07-25T23:05:00Z,07/25 19:05,2,4,2020-07-25T23:05:00Z,12745,,,40,,,,11338,,,,,,,,,,,69,1,0,11340,1,11340,0,0,0bab6a668264f229c0f748eafbf66830c0c8dc41,0,0,0,0,0,
20200725,MP,39,,11300,,posNeg,11339,,4,,,,,29,D,7/25/2020 07:47,2020-07-25T07:47:00Z,07/25 03:47,2,4,2020-07-25T07:47:00Z,12745,,,39,,,,11338,,,,,,,,,,,69,1,0,11339,1,11339,0,0,bae6e6ac1644ae4154b5877c3ee3fab381139254,0,0,0,0,0,
20200724,MP,38,,11300,,posNeg,11338,,4,,,,,29,D,7/24/2020 02:47,2020-07-24T02:47:00Z,07/23 22:47,2,4,2020-07-24T02:47:00Z,12745,,,38,,,,11338,,,,,,,,,,,69,0,0,11338,0,11338,0,0,ff9098b8b720d75fffdff5adda80a9053b92cbd9,0,0,0,0,0,
20200723,MP,38,,11300,,posNeg,11338,,4,,,,,29,D,7/22/2020 19:22,2020-07-22T19:22:00Z,07/22 15:22,2,4,2020-07-22T19:22:00Z,12745,,,38,,,,11338,,,,,,,,,,,69,0,-1407,11338,-1407,11338,0,0,90ba6d942cddf7edbe9915a61e972835ee277e0a,0,0,0,0,0,
20200722,MP,38,,12707,,posNeg,12745,,4,,,,,29,D,7/21/2020 08:46,2020-07-21T08:46:00Z,07/21 04:46,2,4,2020-07-21T08:46:00Z,12745,,,38,,,,11338,,,,,,,,,,,69,0,1652,12745,1652,12745,0,0,bdf0ec8409e149e7f82783674acfb7d52db75948,0,0,0,0,0,
20200721,MP,38,,11055,,posNeg,11093,,4,,,,,29,D,7/20/2020 19:53,2020-07-20T19:53:00Z,07/20 15:53,2,4,2020-07-20T19:53:00Z,12236,,,38,,,,11092,,,,,,,,,,,69,1,0,11093,1,11093,0,0,8abfaedccb14e74ed86a2bba1f1a512d82099f57,0,0,0,0,0,
20200720,MP,37,,11055,,posNeg,11092,,4,,,,,29,D,7/19/2020 19:55,2020-07-19T19:55:00Z,07/19 15:55,2,4,2020-07-19T19:55:00Z,12236,,,37,,,,11092,,,,,,,,,,,69,0,391,11092,391,11092,0,0,a4cab6591fc434fbef8949df247aeac4e9c9ed87,0,0,0,0,0,
20200719,MP,37,,10664,,posNeg,10701,,4,,,,,29,D,7/16/2020 19:06,2020-07-16T19:06:00Z,07/16 15:06,2,4,2020-07-16T19:06:00Z,11335,,,37,,,,10697,,,,,,,,,,,69,0,0,10701,0,10701,0,0,631963842b7c7bc6200bfb768840f05d8f43e2fa,0,0,0,0,0,
20200718,MP,37,,10664,,posNeg,10701,,4,,,,,29,D,7/16/2020 19:06,2020-07-16T19:06:00Z,07/16 15:06,2,4,2020-07-16T19:06:00Z,11335,,,37,,,,10697,,,,,,,,,,,69,0,0,10701,0,10701,0,0,da04b23895f07270981057525814e43e9078f431,0,0,0,0,0,
20200717,MP,37,,10664,,posNeg,10701,,4,,,,,29,D,7/16/2020 19:06,2020-07-16T19:06:00Z,07/16 15:06,2,4,2020-07-16T19:06:00Z,11335,,,37,,,,10697,,,,,,,,,,,69,1,0,10701,1,10701,0,0,a6cefe41b9e6af1bc372e68e26f38a69311c3ad0,0,0,0,0,0,
20200716,MP,36,,10664,,posNeg,10700,,4,,,,,29,D,7/13/2020 18:48,2020-07-13T18:48:00Z,07/13 14:48,2,4,2020-07-13T18:48:00Z,11335,,,36,,,,10697,,,,,,,,,,,69,0,0,10700,0,10700,0,0,89bf39b1667c9a5eefd87921be6ce74b1e384e09,0,0,0,0,0,
20200715,MP,36,,10664,,posNeg,10700,,4,,,,,29,D,7/14/2020 04:48,2020-07-14T04:48:00Z,07/14 00:48,2,4,2020-07-14T04:48:00Z,11335,,,36,,,,10697,,,,,,,,,,,69,3,0,10700,3,10700,0,0,b88f1b1de1cb0321cada4bd2c16bd33093b4c2c8,0,0,0,0,0,
20200714,MP,33,,10664,,posNeg,10697,,4,,,,,19,D,7/12/2020 13:16,2020-07-12T13:16:00Z,07/12 09:16,2,4,2020-07-12T13:16:00Z,11335,,,33,,,,10697,,,,,,,,,,,69,0,-70,10697,-70,10697,0,0,9e1dba6942afba6acef15cb7f48faf9f46ca7ae7,0,0,0,0,0,
20200713,MP,33,,10734,,posNeg,10767,,4,,,,,19,D,7/12/2020 13:16,2020-07-12T13:16:00Z,07/12 09:16,2,4,2020-07-12T13:16:00Z,11335,,,33,,,,10697,,,,,,,,,,,69,0,0,10767,0,10767,0,0,5ecdabe9287dd3592593e302a1daa10405fdac92,0,0,0,0,0,
20200712,MP,33,,10734,,posNeg,10767,,4,,,,,19,D,7/11/2020 07:01,2020-07-11T07:01:00Z,07/11 03:01,2,4,2020-07-11T07:01:00Z,11335,,,33,,,,10697,,,,,,,,,,,69,2,0,10767,2,10767,0,0,d408ec8e7cdc889f68d04b4badd440522cba8885,0,0,0,0,0,
20200711,MP,31,,10734,,posNeg,10765,,4,,,,,19,D,7/9/2020 11:36,2020-07-09T11:36:00Z,07/09 07:36,2,4,2020-07-09T11:36:00Z,11335,,,31,,,,10697,,,,,,,,,,,69,0,0,10765,0,10765,0,0,ba8b46cfddc446cd22ad2755e2582d9e1bcfbf47,0,0,0,0,0,
20200710,MP,31,,10734,,posNeg,10765,,4,,,,,19,D,7/9/2020 11:36,2020-07-09T11:36:00Z,07/09 07:36,2,4,2020-07-09T11:36:00Z,11335,,,31,,,,10697,,,,,,,,,,,69,0,0,10765,0,10765,0,0,e7bd3543ba3b8d6cf72f3bdcfbc66d619ce05b29,0,0,0,0,0,
20200709,MP,31,,10734,,posNeg,10765,,4,,,,,19,D,7/8/2020 12:50,2020-07-08T12:50:00Z,07/08 08:50,2,4,2020-07-08T12:50:00Z,11335,,,31,,,,10697,,,,,,,,,,,69,0,0,10765,0,10765,0,4,bf87e7ba8e0ee0245ebc98a9653d9d77814383fa,0,0,0,0,0,
20200708,MP,31,,10734,,posNeg,10765,,,,,,,19,D,7/8/2020 00:01,2020-07-08T00:01:00Z,07/07 20:01,2,,2020-07-08T00:01:00Z,10765,,,31,,,,,,,,,,,,,,,69,0,2547,10765,2547,10765,0,0,054837bec2f475e93886fd739f25f629d45f5317,0,0,0,0,0,
20200707,MP,31,,8187,,posNeg,8218,,,,,,,19,D,7/5/2020 02:01,2020-07-05T02:01:00Z,07/04 22:01,2,,2020-07-05T02:01:00Z,8217,,,31,,,,,,,,,,,,,,,69,0,0,8218,0,8218,0,0,bfeb9f29883e4da78ec50be1b0c4a38455fcf633,0,0,0,0,0,
20200706,MP,31,,8187,,posNeg,8218,,,,,,,19,D,7/4/2020 14:01,2020-07-04T14:01:00Z,07/04 10:01,2,,2020-07-04T14:01:00Z,8217,,,31,,,,,,,,,,,,,,,69,0,0,8218,0,8218,0,0,347c9b66d3681ead0712a6b08a5163bec5d85834,0,0,0,0,0,
20200705,MP,31,,8187,,posNeg,8218,,,,,,,19,D,7/4/2020 14:01,2020-07-04T14:01:00Z,07/04 10:01,2,,2020-07-04T14:01:00Z,8217,,,31,,,,,,,,,,,,,,,69,0,0,8218,0,8218,0,0,65ab81269aeb5d1144b6266a951d2907dc99776e,0,0,0,0,0,
20200704,MP,31,,8187,,posNeg,8218,,,,,,,19,D,7/2/2020 18:23,2020-07-02T18:23:00Z,07/02 14:23,2,,2020-07-02T18:23:00Z,8217,,,31,,,,,,,,,,,,,,,69,0,0,8218,0,8218,0,0,eadb6df28d4dae39702a51ec12e037fbefa52b3f,0,0,0,0,0,
20200703,MP,31,,8187,,posNeg,8218,,,,,,,19,D,7/2/2020 18:23,2020-07-02T18:23:00Z,07/02 14:23,2,,2020-07-02T18:23:00Z,8217,,,31,,,,,,,,,,,,,,,69,1,0,8218,1,8218,0,0,2169c52e91b886bace1ee4385d758bbe584a100a,0,0,0,0,0,
20200702,MP,30,,8187,,posNeg,8217,,,,,,,19,D,6/26/2020 00:22,2020-06-26T00:22:00Z,06/25 20:22,2,,2020-06-26T00:22:00Z,8217,,,30,,,,,,,,,,,,,,,69,0,0,8217,0,8217,0,0,f66bb82006ebb53da79e6071df3387b888def6c0,0,0,0,0,0,
20200701,MP,30,,8187,,posNeg,8217,,,,,,,19,D,6/26/2020 00:22,2020-06-26T00:22:00Z,06/25 20:22,2,,2020-06-26T00:22:00Z,8217,,,30,,,,,,,,,,,,,,,69,0,0,8217,0,8217,0,0,db71e2cacda9d951ee5ad9abf4bdde88507bd284,0,0,0,0,0,
20200630,MP,30,,8187,,posNeg,8217,,,,,,,19,D,6/26/2020 00:22,2020-06-26T00:22:00Z,06/25 20:22,2,,2020-06-26T00:22:00Z,8217,,,30,,,,,,,,,,,,,,,69,0,0,8217,0,8217,0,0,b30008a6f54a934a538afb2f7ef995edd9d97ad1,0,0,0,0,0,
20200629,MP,30,,8187,,posNeg,8217,,,,,,,19,D,6/26/2020 00:22,2020-06-26T00:22:00Z,06/25 20:22,2,,2020-06-26T00:22:00Z,8217,,,30,,,,,,,,,,,,,,,69,0,0,8217,0,8217,0,0,fd3462e71e77c1ab2085cfcc88e9490784caf40e,0,0,0,0,0,
20200628,MP,30,,8187,,posNeg,8217,,,,,,,19,D,6/26/2020 00:22,2020-06-26T00:22:00Z,06/25 20:22,2,,2020-06-26T00:22:00Z,8217,,,30,,,,,,,,,,,,,,,69,0,0,8217,0,8217,0,0,2c08e7a0d9c6467cadfd24f63d02ed018ee17305,0,0,0,0,0,
20200627,MP,30,,8187,,posNeg,8217,,,,,,,19,D,6/26/2020 00:22,2020-06-26T00:22:00Z,06/25 20:22,2,,2020-06-26T00:22:00Z,8217,,,30,,,,,,,,,,,,,,,69,0,0,8217,0,8217,0,0,0adcfced20e6cb0435d1d5d9c84435bc8548eb09,0,0,0,0,0,
20200626,MP,30,,8187,,posNeg,8217,,,,,,,19,D,6/26/2020 00:22,2020-06-26T00:22:00Z,06/25 20:22,2,,2020-06-26T00:22:00Z,8217,,,30,,,,,,,,,,,,,,,69,0,0,8217,0,8217,0,0,eda6844718a295993dbc6311be33e9bb78979487,0,0,0,0,0,
20200625,MP,30,,8187,,posNeg,8217,,,,,,,19,D,6/25/2020 03:22,2020-06-25T03:22:00Z,06/24 23:22,2,,2020-06-25T03:22:00Z,8217,,,30,,,,,,,,,,,,,,,69,0,0,8217,0,8217,0,0,122e39865cebf8fd880ab8a987ca163568120415,0,0,0,0,0,
20200624,MP,30,,8187,,posNeg,8217,,,,,,,19,D,6/23/2020 23:16,2020-06-23T23:16:00Z,06/23 19:16,2,,2020-06-23T23:16:00Z,8217,,,30,,,,,,,,,,,,,,,69,0,0,8217,0,8217,0,0,0c1b52ef7e2d5508618baccfa3f75dd18bad3ef8,0,0,0,0,0,
20200623,MP,30,,8187,,posNeg,8217,,,,,,,19,D,6/22/2020 21:40,2020-06-22T21:40:00Z,06/22 17:40,2,,2020-06-22T21:40:00Z,8217,,,30,,,,,,,,,,,,,,,69,0,48,8217,48,8217,0,0,b2cb36367146531255d8024f3d6bd96bf47d0e39,0,0,0,0,0,
20200622,MP,30,,8139,,posNeg,8169,,,,,,,19,D,6/21/2020 19:46,2020-06-21T19:46:00Z,06/21 15:46,2,,2020-06-21T19:46:00Z,8169,,,30,,,,,,,,,,,,,,,69,0,0,8169,0,8169,0,0,3b1072a7f06a302f6e2b6c90972e9518bb321efa,0,0,0,0,0,
20200621,MP,30,,8139,,posNeg,8169,,,,,,,19,D,6/18/2020 21:18,2020-06-18T21:18:00Z,06/18 17:18,2,,2020-06-18T21:18:00Z,8169,,,30,,,,,,,,,,,,,,,69,0,0,8169,0,8169,0,0,723e0a04148acdaa2d74395eb126b527a937ea9c,0,0,0,0,0,
20200620,MP,30,,8139,,posNeg,8169,,,,,,,19,D,6/18/2020 21:18,2020-06-18T21:18:00Z,06/18 17:18,2,,2020-06-18T21:18:00Z,8169,,,30,,,,,,,,,,,,,,,69,0,0,8169,0,8169,0,0,a0861a91c11bd80f7dc4f2f3ec88c63ac2502e7a,0,0,0,0,0,
20200619,MP,30,,8139,,posNeg,8169,,,,,,,19,D,6/18/2020 21:18,2020-06-18T21:18:00Z,06/18 17:18,2,,2020-06-18T21:18:00Z,8169,,,30,,,,,,,,,,,,,,,69,0,0,8169,0,8169,0,0,9bd64ce192dfba3eac8e556a798252fc76c8dfb3,0,0,0,0,0,
20200618,MP,30,,8139,,posNeg,8169,,,,,,,19,D,6/16/2020 18:09,2020-06-16T18:09:00Z,06/16 14:09,2,,2020-06-16T18:09:00Z,8169,,,30,,,,,,,,,,,,,,,69,0,0,8169,0,8169,0,0,a2c1df7772176b204fb6e85e57f9ca7fefdc942a,0,0,0,0,0,
20200617,MP,30,,8139,,posNeg,8169,,,,,,,19,D,6/16/2020 18:09,2020-06-16T18:09:00Z,06/16 14:09,2,,2020-06-16T18:09:00Z,8169,,,30,,,,,,,,,,,,,,,69,0,0,8169,0,8169,0,0,3b6fae2a2216f63ae4336109dbfc980bd0ecfaf2,0,0,0,0,0,
20200616,MP,30,,8139,,posNeg,8169,,,,,,,19,D,6/15/2020 18:09,2020-06-15T18:09:00Z,06/15 14:09,2,,2020-06-15T18:09:00Z,8169,,,30,,,,,,,,,,,,,,,69,0,0,8169,0,8169,0,0,93ec1c27d8ac3c5e81cb21ab0cbf4a146883a83f,0,0,0,0,0,
20200615,MP,30,,8139,,posNeg,8169,,,,,,,19,D,6/14/2020 18:09,2020-06-14T18:09:00Z,06/14 14:09,2,,2020-06-14T18:09:00Z,8169,,,30,,,,,,,,,,,,,,,69,0,0,8169,0,8169,0,0,61ed29e7d09c7016843822bd7855bf8073f5e274,0,0,0,0,0,
20200614,MP,30,,8139,,posNeg,8169,,,,,,,19,D,6/14/2020 01:43,2020-06-14T01:43:00Z,06/13 21:43,2,,2020-06-14T01:43:00Z,8169,,,30,,,,,,,,,,,,,,,69,0,233,8169,233,8169,0,0,dab06f2df7a0c7db2dd239127f5473991fb4013f,0,0,0,0,0,
20200613,MP,30,,7906,,posNeg,7936,,,,,,,19,D,6/12/2020 18:18,2020-06-12T18:18:00Z,06/12 14:18,2,,2020-06-12T18:18:00Z,7936,,,30,,,,,,,,,,,,,,,69,0,174,7936,174,7936,0,0,05ceb3fd57850a194cec653de34bbb072c6e256f,0,0,0,0,0,
20200612,MP,30,,7732,,posNeg,7762,,,,,,,19,D,6/12/2020 01:20,2020-06-12T01:20:00Z,06/11 21:20,2,,2020-06-12T01:20:00Z,7762,,,30,,,,,,,,,,,,,,,69,0,181,7762,181,7762,0,0,fc69699b7ab06e330806297a4ba9b9c535d357af,0,0,0,0,0,
20200611,MP,30,,7551,,posNeg,7581,,,,,,,19,D,6/10/2020 18:00,2020-06-10T18:00:00Z,06/10 14:00,2,,2020-06-10T18:00:00Z,7581,,,30,,,,,,,,,,,,,,,69,0,58,7581,58,7581,0,0,04b8c788540fd83e84ad59c5d45a6f1ec77d3554,0,0,0,0,0,
20200610,MP,30,,7493,,posNeg,7523,,,,,,,19,D,6/9/2020 18:13,2020-06-09T18:13:00Z,06/09 14:13,2,,2020-06-09T18:13:00Z,7523,,,30,,,,,,,,,,,,,,,69,0,0,7523,0,7523,0,0,2ed6cf2afeb4ef8cffaf5bb71430832e3185ea7a,0,0,0,0,0,
20200609,MP,30,,7493,,posNeg,7523,,,,,,,19,D,6/9/2020 00:00,2020-06-09T00:00:00Z,06/08 20:00,2,,2020-06-09T00:00:00Z,7523,,,30,,,,,,,,,,,,,,,69,2,279,7523,281,7523,0,0,9c9e5aadfe8058761e906f296cdfced6e3cc666b,0,0,0,0,0,
20200608,MP,28,,7214,,posNeg,7242,,,,,,,19,D,6/8/2020 00:00,2020-06-08T00:00:00Z,06/07 20:00,2,,2020-06-08T00:00:00Z,7241,,,28,,,,,,,,,,,,,,,69,1,0,7242,1,7242,0,0,4c88c1ddebc4a0a9d97f8fd756dd421ca82f3d2c,0,0,0,0,0,
20200607,MP,27,,7214,,posNeg,7241,,,,,,,19,D,6/7/2020 00:00,2020-06-07T00:00:00Z,06/06 20:00,2,,2020-06-07T00:00:00Z,7241,,,27,,,,,,,,,,,,,,,69,1,545,7241,546,7241,0,0,ae5e4a8921858072bdab495e5ac0d60b5de8ebd8,0,0,0,0,0,
20200606,MP,26,,6669,,posNeg,6695,,,,,,,16,D,6/4/2020 19:04,2020-06-04T19:04:00Z,06/04 15:04,2,,2020-06-04T19:04:00Z,6695,,,26,,,,,,,,,,,,,,,69,0,0,6695,0,6695,0,0,b6fde6ad0bac50a71b5d5b7169c312f41ad0ff82,0,0,0,0,0,
20200605,MP,26,,6669,,posNeg,6695,,,,,,,16,D,6/4/2020 19:04,2020-06-04T19:04:00Z,06/04 15:04,2,,2020-06-04T19:04:00Z,6695,,,26,,,,,,,,,,,,,,,69,0,0,6695,0,6695,0,0,37ece02f7365f43da209231c6e1cc42df681c4f7,0,0,0,0,0,
20200604,MP,26,,6669,,posNeg,6695,,,,,,,16,D,6/4/2020 02:45,2020-06-04T02:45:00Z,06/03 22:45,2,,2020-06-04T02:45:00Z,6695,,,26,,,,,,,,,,,,,,,69,3,135,6695,138,6695,0,0,05c79a003f7f690d6e18dae6d20dd14c0f72984e,0,0,0,0,0,
20200603,MP,23,,6534,,posNeg,6557,,,,,,,16,D,6/3/2020 00:00,2020-06-03T00:00:00Z,06/02 20:00,2,,2020-06-03T00:00:00Z,6557,,,23,,,,,,,,,,,,,,,69,0,0,6557,0,6557,0,0,b4b175908e40fbdb23cbe0fefa6f844c6377bf29,0,0,0,0,0,
20200602,MP,23,,6534,,posNeg,6557,,,,,,,16,D,6/2/2020 00:00,2020-06-02T00:00:00Z,06/01 20:00,2,,2020-06-02T00:00:00Z,6557,,,23,,,,,,,,,,,,,,,69,1,222,6557,223,6557,0,0,cc9f176bd825b37993e50c07bbef4d4c767c7f03,0,0,0,0,0,
20200601,MP,22,,6312,,posNeg,6334,,,,,,,16,D,6/1/2020 00:00,2020-06-01T00:00:00Z,05/31 20:00,2,,2020-06-01T00:00:00Z,6334,,,22,,,,,,,,,,,,,,,69,0,161,6334,161,6334,0,0,4dc3b0b941dac5601c7a8f3425bdd86506908e39,0,0,0,0,0,
20200531,MP,22,,6151,,posNeg,6173,,,,,,,15,D,5/30/2020 00:00,2020-05-30T00:00:00Z,05/29 20:00,2,,2020-05-30T00:00:00Z,6173,,,22,,,,,,,,,,,,,,,69,0,165,6173,165,6173,0,0,5165cc32771861d8254f159370d4663d520a1f33,0,0,0,0,0,
20200530,MP,22,,5986,,posNeg,6008,,,,,,,15,D,5/29/2020 20:27,2020-05-29T20:27:00Z,05/29 16:27,2,,2020-05-29T20:27:00Z,6008,,,22,,,,,,,,,,,,,,,69,0,324,6008,324,6008,0,0,a90251983e1a26f5db5d1aaa8a43ca9127d38969,0,0,0,0,0,
20200529,MP,22,,5662,,posNeg,5684,,,,,,,13,D,5/29/2020 00:00,2020-05-29T00:00:00Z,05/28 20:00,2,,2020-05-29T00:00:00Z,5684,,,22,,,,,,,,,,,,,,,69,0,261,5684,261,5684,0,0,6530bac409c91f3d1d1e6ab12b1502b9c92c99c6,0,0,0,0,0,
20200528,MP,22,,5401,,posNeg,5423,,,,,,,13,D,5/28/2020 00:00,2020-05-28T00:00:00Z,05/27 20:00,2,,2020-05-28T00:00:00Z,5423,,,22,,,,,,,,,,,,,,,69,0,223,5423,223,5423,0,0,a865668f45e6b73c54df9b4d0ccaad24f199e529,0,0,0,0,0,
20200527,MP,22,,5178,,posNeg,5200,,,,,,,13,D,5/27/2020 00:00,2020-05-27T00:00:00Z,05/26 20:00,2,,2020-05-27T00:00:00Z,5200,,,22,,,,,,,,,,,,,,,69,0,260,5200,260,5200,0,0,3fc024168a527cfdffbe2bb6cfef6e3324ec2655,0,0,0,0,0,
20200526,MP,22,,4918,,posNeg,4940,,,,,,,13,D,5/26/2020 00:00,2020-05-26T00:00:00Z,05/25 20:00,2,,2020-05-26T00:00:00Z,4940,,,22,,,,,,,,,,,,,,,69,0,183,4940,183,4940,0,0,cbf5276cd6269b63daed7afe474db4e7bcdd7316,0,0,0,0,0,
20200525,MP,22,,4735,,posNeg,4757,,,,,,,13,D,5/24/2020 00:07,2020-05-24T00:07:00Z,05/23 20:07,2,,2020-05-24T00:07:00Z,4757,,,22,,,,,,,,,,,,,,,69,0,0,4757,0,4757,0,0,107f9e9321488106885cc7e21633253195dd9f86,0,0,0,0,0,
20200524,MP,22,,4735,,posNeg,4757,,,,,,,13,D,5/24/2020 00:00,2020-05-24T00:00:00Z,05/23 20:00,2,,2020-05-24T00:00:00Z,4757,,,22,,,,,,,,,,,,,,,69,0,439,4757,439,4757,0,0,c84b5b48d62225be9064384574918cab63f304b7,0,0,0,0,0,
20200523,MP,22,,4296,,posNeg,4318,,,,,,,13,D,5/22/2020 00:00,2020-05-22T00:00:00Z,05/21 20:00,2,,2020-05-22T00:00:00Z,4318,,,22,,,,,,,,,,,,,,,69,0,0,4318,0,4318,0,0,0568c1fdbdfcff9620aa52949d814f488913b524,0,0,0,0,0,
20200522,MP,22,,4296,,posNeg,4318,,,,,,,13,D,5/22/2020 00:00,2020-05-22T00:00:00Z,05/21 20:00,2,,2020-05-22T00:00:00Z,4318,,,22,,,,,,,,,,,,,,,69,0,229,4318,229,4318,0,0,291508f0960ce68c0ff544a5b37e1f3cd02e7a64,0,0,0,0,0,
20200521,MP,22,,4067,,posNeg,4089,,,,,,,13,D,5/21/2020 00:00,2020-05-21T00:00:00Z,05/20 20:00,2,,2020-05-21T00:00:00Z,4089,,,22,,,,,,,,,,,,,,,69,1,271,4089,272,4089,0,0,6adc924f7eb0573137e8d8a5b5c14f9b1024aca7,0,0,0,0,0,
20200520,MP,21,,3796,,posNeg,3817,,,,,,,13,D,5/20/2020 00:00,2020-05-20T00:00:00Z,05/19 20:00,2,,2020-05-20T00:00:00Z,3817,,,21,,,,,,,,,,,,,,,69,0,0,3817,0,3817,0,0,82c9e4de35b444e4bd2940faa7651128e60e1e53,0,0,0,0,0,
20200519,MP,21,,3796,,posNeg,3817,,,,,,,13,D,5/19/2020 00:00,2020-05-19T00:00:00Z,05/18 20:00,2,,2020-05-19T00:00:00Z,3817,,,21,,,,,,,,,,,,,,,69,0,397,3817,397,3817,0,0,8e64b62f8676df28fd57552a562281f7784ccce5,0,0,0,0,0,
20200518,MP,21,,3399,,posNeg,3420,,,,,,,12,D,5/18/2020 00:00,2020-05-18T00:00:00Z,05/17 20:00,2,,2020-05-18T00:00:00Z,3420,,,21,,,,,,,,,,,,,,,69,0,81,3420,81,3420,0,0,63d88116f6c2018221cacec9c7c869cd11c26420,0,0,0,0,0,
20200517,MP,21,,3318,,posNeg,3339,,,,,,,12,D,5/16/2020 00:00,2020-05-16T00:00:00Z,05/15 20:00,2,,2020-05-16T00:00:00Z,,,,21,,,,,,,,,,,,,,,69,0,0,3339,0,3339,0,0,37d923d9a9f7c959000c45825e133e05d90cf66b,0,0,0,0,0,
20200516,MP,21,,3318,,posNeg,3339,,,,,,,12,D,5/16/2020 00:00,2020-05-16T00:00:00Z,05/15 20:00,2,,2020-05-16T00:00:00Z,3339,,,21,,,,,,,,,,,,,,,69,2,12,3339,14,3339,0,0,7cd88b401a28cdc24942ce8f930f6f01d4e2886e,0,0,0,0,0,
20200515,MP,19,,3306,,posNeg,3325,,,,,,,12,D,5/15/2020 00:00,2020-05-15T00:00:00Z,05/14 20:00,2,,2020-05-15T00:00:00Z,3325,,,19,,,,,,,,,,,,,,,69,0,0,3325,0,3325,0,0,fdf2d8cec60c0ce8c942467a5e75b2d6755caa09,0,0,0,0,0,
20200514,MP,19,,3306,,posNeg,3325,,,,,,,12,D,5/14/2020 00:00,2020-05-14T00:00:00Z,05/13 20:00,2,,2020-05-14T00:00:00Z,3325,,,19,,,,,,,,,,,,,,,69,0,285,3325,285,3325,0,0,558bebc4123e51cf46928ff5073bc4372d92e70e,0,0,0,0,0,
20200513,MP,19,,3021,,posNeg,3040,,,,,,,12,D,5/13/2020 00:00,2020-05-13T00:00:00Z,05/12 20:00,2,,2020-05-13T00:00:00Z,3040,,,19,,,,,,,,,,,,,,,69,0,167,3040,167,3040,0,0,e19939b4a6173d22f0d987717de75690e773ff91,0,0,0,0,0,
20200512,MP,19,,2854,,posNeg,2873,,,,,,,12,D,5/12/2020 00:00,2020-05-12T00:00:00Z,05/11 20:00,2,,2020-05-12T00:00:00Z,2873,,,19,,,,,,,,,,,,,,,69,0,178,2873,178,2873,0,0,0d2a0a7edbd9bc116308054d9643acd7d388c344,0,0,0,0,0,
20200511,MP,19,,2676,,posNeg,2695,,,,,,,12,D,5/11/2020 00:00,2020-05-11T00:00:00Z,05/10 20:00,2,,2020-05-11T00:00:00Z,2695,,,19,,,,,,,,,,,,,,,69,3,355,2695,358,2695,0,0,5418d78d01bd897842a062fbecfc9aa4f48e4144,0,0,0,0,0,
20200510,MP,16,,2321,,posNeg,2337,,,,,,,12,D,5/9/2020 00:00,2020-05-09T00:00:00Z,05/08 20:00,2,,2020-05-09T00:00:00Z,2336,,,16,,,,,,,,,,,,,,,69,0,0,2337,0,2337,0,0,57a8d9954acee37689aae985ab5887ea82ddc1e0,0,0,0,0,0,
20200509,MP,16,,2321,,posNeg,2337,,,,,,,12,D,5/9/2020 00:00,2020-05-09T00:00:00Z,05/08 20:00,2,,2020-05-09T00:00:00Z,2336,,,16,,,,,,,,,,,,,,,69,1,0,2337,1,2337,0,0,bd27c09d5f55d5ec12e801aea637eaba5bab10a7,0,0,0,0,0,
20200508,MP,15,,2321,,posNeg,2336,,,,,,,12,D,5/8/2020 00:00,2020-05-08T00:00:00Z,05/07 20:00,2,,2020-05-08T00:00:00Z,2336,,,15,,,,,,,,,,,,,,,69,0,538,2336,538,2336,0,0,c696ecfd30f658f1647462a654bd5745e5780fdf,0,0,0,0,0,
20200507,MP,15,,1783,,posNeg,1798,,,,,,,12,D,5/6/2020 00:00,2020-05-06T00:00:00Z,05/05 20:00,2,,2020-05-06T00:00:00Z,1797,,,15,,,,,,,,,,,,,,,69,0,0,1798,0,1798,0,0,ac39b4cbdf04b422001104ce1805ddbb99cfeadf,0,0,0,0,0,
20200506,MP,15,,1783,,posNeg,1798,,,,,,,12,D,5/6/2020 00:00,2020-05-06T00:00:00Z,05/05 20:00,2,,2020-05-06T00:00:00Z,1797,,,15,,,,,,,,,,,,,,,69,1,0,1798,1,1798,0,0,137463477eaee3137f5a80f2aacbc09b2e1e5af4,0,0,0,0,0,
20200505,MP,14,,1783,,posNeg,1797,,,,,,,12,D,5/5/2020 00:00,2020-05-05T00:00:00Z,05/04 20:00,2,,2020-05-05T00:00:00Z,,,,14,,,,,,,,,,,,,,,69,0,462,1797,462,1797,0,0,98cc56946251d5aab7494dc9a25dc0747005b0d0,0,0,0,0,0,
20200504,MP,14,,1321,,posNeg,1335,,,,,,,12,D,5/4/2020 00:00,2020-05-04T00:00:00Z,05/03 20:00,2,,2020-05-04T00:00:00Z,,,,14,,,,,,,,,,,,,,,69,0,0,1335,0,1335,0,0,1174f06c448d8df07b766bfa7289f6750d5f8527,0,0,0,0,0,
20200503,MP,14,,1321,,posNeg,1335,,,,,,,12,D,5/3/2020 00:00,2020-05-03T00:00:00Z,05/02 20:00,2,,2020-05-03T00:00:00Z,,,,14,,,,,,,,,,,,,,,69,0,387,1335,387,1335,0,0,8f5afa208577f2a9b82a5d0dcfd0e8c59a14e5f1,0,0,0,0,0,
20200502,MP,14,,934,,posNeg,948,,,,,,,12,D,5/2/2020 06:37,2020-05-02T06:37:00Z,05/02 02:37,2,,2020-05-02T06:37:00Z,,,,,,,,,,,,,,,,,,,69,0,185,948,185,948,0,0,f0c116b4976b0ea894618ad5771ee57ba8bfd803,0,0,0,0,0,
20200501,MP,14,,749,,posNeg,763,,,,,,,12,D,5/1/2020 06:27,2020-05-01T06:27:00Z,05/01 02:27,2,,2020-05-01T06:27:00Z,,,,,,,,,,,,,,,,,,,69,0,164,763,164,763,0,0,9d98ddd27a70e3dc802996bcae9e1e5a098100aa,0,0,0,0,0,
20200430,MP,14,,585,,posNeg,599,,,,,,,12,D,4/30/2020 07:00,2020-04-30T07:00:00Z,04/30 03:00,2,,2020-04-30T07:00:00Z,,,,,,,,,,,,,,,,,,,69,0,375,599,375,599,0,0,2bd12ede2db9b9dc294c70c470dc52c76c0be0fa,0,0,0,0,0,
20200429,MP,14,,210,,posNeg,224,,,,,,,12,D,4/29/2020 02:30,2020-04-29T02:30:00Z,04/28 22:30,2,,2020-04-29T02:30:00Z,,,,,,,,,,,,,,,,,,,69,0,159,224,159,224,0,0,4a0e591730469b5c338fa6ada6603ba680c6d0d9,0,0,0,0,0,
20200428,MP,14,,51,,posNeg,65,,,,,,,12,D,4/28/2020 00:00,2020-04-28T00:00:00Z,04/27 20:00,2,,2020-04-28T00:00:00Z,,,,,,,,,,,,,,,,,,,69,0,0,65,0,65,0,0,af8a2660bb387c6c865fb591c6b00b1cd2916c58,0,0,0,0,0,
20200427,MP,14,,51,,posNeg,65,,,,,,,11,D,4/27/2020 00:00,2020-04-27T00:00:00Z,04/26 20:00,2,,2020-04-27T00:00:00Z,,,,,,,,,,,,,,,,,,,69,0,0,65,0,65,0,0,7dda1bfd5840c0f688f946a3c6dfffe96e638559,0,0,0,0,0,
20200426,MP,14,,51,,posNeg,65,,,,,,,11,D,4/26/2020 00:00,2020-04-26T00:00:00Z,04/25 20:00,2,,2020-04-26T00:00:00Z,,,,,,,,,,,,,,,,,,,69,0,0,65,0,65,0,0,9fc53faf534a32f36a140f296581c7691ad5b799,0,0,0,0,0,
20200425,MP,14,,51,,posNeg,65,,,,,,,11,D,4/25/2020 00:00,2020-04-25T00:00:00Z,04/24 20:00,2,,2020-04-25T00:00:00Z,,,,,,,,,,,,,,,,,,,69,0,0,65,0,65,0,0,2c24e065d2bb871a154333bc59db8ff73d83633f,0,0,0,0,0,
20200424,MP,14,,51,,posNeg,65,,,,,,,11,,4/24/2020 00:00,2020-04-24T00:00:00Z,04/23 20:00,2,,2020-04-24T00:00:00Z,,,,,,,,,,,,,,,,,,,69,0,0,65,0,65,0,0,7fd27e164af433fb8cd8b0515311158f38596ee5,0,0,0,0,0,
20200423,MP,14,,51,,posNeg,65,,,,,,,11,,4/23/2020 22:35,2020-04-23T22:35:00Z,04/23 18:35,2,,2020-04-23T22:35:00Z,,,,,,,,,,,,,,,,,,,69,0,0,65,0,65,0,0,e637e0fe98796548c3c0a3ab4a165e0638f31b43,0,0,0,0,0,
20200422,MP,14,,51,,posNeg,65,,,,,,,11,,4/23/2020 00:00,2020-04-23T00:00:00Z,04/22 20:00,2,,2020-04-23T00:00:00Z,,,,,,,,,,,,,,,,,,,69,0,0,65,0,65,0,0,8d6719108fb4cde2da129ce615a6ec20b2e66ad7,0,0,0,0,0,
20200421,MP,14,,51,,posNeg,65,,,,,,,11,,4/21/2020 19:25,2020-04-21T19:25:00Z,04/21 15:25,2,,2020-04-21T19:25:00Z,,,,,,,,,,,,,,,,,,,69,0,0,65,0,65,0,0,9348ac8faa895d26a531ff84066914e627fa37fa,0,0,0,0,0,
20200420,MP,14,,51,,posNeg,65,,,,,,,11,,4/20/2020 00:00,2020-04-20T00:00:00Z,04/19 20:00,2,,2020-04-20T00:00:00Z,,,,,,,,,,,,,,,,,,,69,0,9,65,9,65,0,0,707e1626285b118ccd5b1c2effeaac1e08cb03b8,0,0,0,0,0,
20200419,MP,14,,42,4,posNeg,56,,,,,,,9,,4/19/2020 00:00,2020-04-19T00:00:00Z,04/18 20:00,2,,2020-04-19T00:00:00Z,,,,,,,,,,,,,,,,,,,69,0,0,60,0,56,0,0,e1404ea6cbc8c150aeb9f6116a2701baa57c956b,0,0,0,0,0,
20200418,MP,14,,42,4,posNeg,56,,,,,,,9,,4/17/2020 19:15,2020-04-17T19:15:00Z,04/17 15:15,2,,2020-04-17T19:15:00Z,,,,,,,,,,,,,,,,,,,69,1,0,60,1,56,0,0,a5f5a17507e01c551a55d5989de3b2ee643087fc,0,0,0,0,0,
20200417,MP,13,,42,4,posNeg,55,,,,,,,,,4/17/2020 19:15,2020-04-17T19:15:00Z,04/17 15:15,2,,2020-04-17T19:15:00Z,,,,,,,,,,,,,,,,,,,69,0,15,59,15,55,0,0,8d3fe8183bc47680133ca99a2357d542a3c9fc02,0,0,0,0,0,
20200416,MP,13,,27,7,posNeg,40,,,,,,,,,4/15/2020 00:00,2020-04-15T00:00:00Z,04/14 20:00,2,,2020-04-15T00:00:00Z,,,,,,,,,,,,,,,,,,,69,0,0,47,0,40,0,0,5e4832123cb3e1e4ce9ec9b49ea81348a446b6b9,0,0,0,0,0,
20200415,MP,13,,27,7,posNeg,40,,,,,,,,,4/14/2020 00:00,2020-04-14T00:00:00Z,04/13 20:00,2,,2020-04-14T00:00:00Z,,,,,,,,,,,,,,,,,,,69,0,0,47,0,40,0,0,bebf0a3f57af897655c66601bee87c728df682dc,0,0,0,0,0,
20200414,MP,13,,27,7,posNeg,40,,,,,,,,,4/14/2020 00:00,2020-04-14T00:00:00Z,04/13 20:00,2,,2020-04-14T00:00:00Z,,,,,,,,,,,,,,,,,,,69,2,0,47,2,40,0,0,8caa182b4a16e9f92a3c6a663c04d5d57089e4b4,0,0,0,0,0,
20200413,MP,11,,27,9,posNeg,38,,,,,,,,,4/12/2020 00:00,2020-04-12T00:00:00Z,04/11 20:00,2,,2020-04-12T00:00:00Z,,,,,,,,,,,,,,,,,,,69,0,0,47,0,38,0,0,e4cb76a0445753b1afcf52f0871b32e85b337325,0,0,0,0,0,
20200412,MP,11,,27,9,posNeg,38,,,,,,,,,4/11/2020 00:00,2020-04-11T00:00:00Z,04/10 20:00,2,,2020-04-11T00:00:00Z,,,,,,,,,,,,,,,,,,,69,0,0,47,0,38,0,0,0840dc41291f78648f83dcd5cebb661b91ad85b1,0,0,0,0,0,
20200411,MP,11,,27,9,posNeg,38,,,,,,,,,4/11/2020 00:00,2020-04-11T00:00:00Z,04/10 20:00,2,,2020-04-11T00:00:00Z,,,,,,,,,,,,,,,,,,,69,0,0,47,0,38,0,0,1353c608857b2afdd9b10577c257fb403ae09101,0,0,0,0,0,
20200410,MP,11,,27,9,posNeg,38,,,,,,,,,4/10/2020 00:00,2020-04-10T00:00:00Z,04/09 20:00,2,,2020-04-10T00:00:00Z,,,,,,,,,,,,,,,,,,,69,0,0,47,0,38,0,0,1c1d96eab16fc4c677b21bf36bdfc9fde1a19737,0,0,0,0,0,
20200409,MP,11,,27,9,posNeg,38,,,,,,,,,4/8/2020 00:00,2020-04-08T00:00:00Z,04/07 20:00,2,,2020-04-08T00:00:00Z,,,,,,,,,,,,,,,,,,,69,0,0,47,0,38,0,0,d7753082fc565668d2d4ec2fbb1865ce77d32738,0,0,0,0,0,
20200408,MP,11,,27,9,posNeg,38,,,,,,,,,4/8/2020 00:00,2020-04-08T00:00:00Z,04/07 20:00,2,,2020-04-08T00:00:00Z,,,,,,,,,,,,,,,,,,,69,3,12,47,15,38,0,0,ed88636ab010eb778ee22ebce059e2981429421a,0,0,0,0,0,
20200407,MP,8,,15,,posNeg,23,,,,,,,,,4/7/2020 05:39,2020-04-07T05:39:00Z,04/07 01:39,2,,2020-04-07T05:39:00Z,,,,,,,,,,,,,,,,,,,69,0,2,23,2,23,1,0,ed25aa4ba9887e8d82088d1ef1a6c3dd85341026,0,0,0,0,0,
20200406,MP,8,,13,10,posNeg,21,,,,,,,,,4/6/2020 02:57,2020-04-06T02:57:00Z,04/05 22:57,1,,2020-04-06T02:57:00Z,,,,,,,,,,,,,,,,,,,69,0,0,31,0,21,0,0,498a3898e5394ca5ac5d8c7db5d83853eebe838d,0,0,0,0,0,
20200405,MP,8,,13,10,posNeg,21,,,,,,,,,4/4/2020 18:30,2020-04-04T18:30:00Z,04/04 14:30,1,,2020-04-04T18:30:00Z,,,,,,,,,,,,,,,,,,,69,0,0,31,0,21,0,0,e7c8a1745f85007d549a29ed2bd95c36e4393600,0,0,0,0,0,
20200404,MP,8,,13,10,posNeg,21,,,,,,,,,4/3/2020 13:30,2020-04-03T13:30:00Z,04/03 09:30,1,,2020-04-03T13:30:00Z,,,,,,,,,,,,,,,,,,,69,0,0,31,0,21,0,0,5968341cf1db681bdaebd8dd29e912242e1d1523,0,0,0,0,0,
20200403,MP,8,,13,10,posNeg,21,,,,,,,,,4/2/2020 18:30,2020-04-02T18:30:00Z,04/02 14:30,1,,2020-04-02T18:30:00Z,,,,,,,,,,,,,,,,,,,69,0,0,31,0,21,0,0,e76d3ce30c517ac937f5b55aa5a2d3ce37f6d191,0,0,0,0,0,
20200402,MP,8,,13,12,posNeg,21,,,,,,,,,4/2/2020 03:00,2020-04-02T03:00:00Z,04/01 23:00,1,,2020-04-02T03:00:00Z,,,,,,,,,,,,,,,,,,,69,2,13,33,15,21,1,0,aff930db2c56489003f769fe144cbd8da6ae33c9,0,0,0,0,0,
20200401,MP,6,,,,posNeg,6,,,,,,,,,3/31/2020 21:50,2020-03-31T21:50:00Z,03/31 17:50,,,2020-03-31T21:50:00Z,,,,,,,,,,,,,,,,,,,69,4,0,6,4,6,0,0,379608c7f4167ed7d1470ec686283eba656f4510,0,0,0,0,0,
20200331,MP,2,,,,posNeg,2,,,,,,,,,3/30/2020 18:30,2020-03-30T18:30:00Z,03/30 14:30,,,2020-03-30T18:30:00Z,,,,,,,,,,,,,,,,,,,69,0,0,2,0,2,0,0,f8c12e48476d88feef912151cf41e1941a0625ab,0,0,0,0,0,
20200330,MP,2,,,,posNeg,2,,,,,,,,,3/30/2020 01:30,2020-03-30T01:30:00Z,03/29 21:30,,,2020-03-30T01:30:00Z,,,,,,,,,,,,,,,,,,,69,0,0,2,0,2,0,0,b4e7a8ac195603fb04ac4eed43f136c88e21bb77,0,0,0,0,0,
20200329,MP,2,,,,posNeg,2,,,,,,,,,3/29/2020 01:30,2020-03-29T01:30:00Z,03/28 21:30,,,2020-03-29T01:30:00Z,,,,,,,,,,,,,,,,,,,69,0,0,2,0,2,0,0,ca565977fae752720310c3326df1d95048779017,0,0,0,0,0,
20200328,MP,2,,,,posNeg,2,,,,,,,,,3/28/2020 04:30,2020-03-28T04:30:00Z,03/28 00:30,,,2020-03-28T04:30:00Z,,,,,,,,,,,,,,,,,,,69,2,0,2,2,2,0,0,60c5fe303e714aa184c5568d5af2068fdd98661d,0,0,0,0,0,
20200327,MP,0,,,,posNeg,0,,,,,,,,,3/26/2020 13:30,2020-03-26T13:30:00Z,03/26 09:30,0,,2020-03-26T13:30:00Z,,,,,,,,,,,,,,,,,,,69,0,0,0,0,0,0,0,be6363a7bbb4d74dadd0c5a1c1a9160f957b0a8e,0,0,0,0,0,
20200326,MP,0,,,,posNeg,0,,,,,,,,,3/26/2020 01:30,2020-03-26T01:30:00Z,03/25 21:30,0,,2020-03-26T01:30:00Z,,,,,,,,,,,,,,,,,,,69,0,0,0,0,0,0,0,974f2315324163269cc1ffee5851fc761aec4bc4,0,0,0,0,0,
20200325,MP,0,,,,posNeg,0,,,,,,,,,3/24/2020 18:30,2020-03-24T18:30:00Z,03/24 14:30,0,,2020-03-24T18:30:00Z,,,,,,,,,,,,,,,,,,,69,0,0,0,0,0,0,0,cb8c8c0abda1bfdc2a0188723c4f0295d0022a8d,0,0,0,0,0,
20200324,MP,0,,,,posNeg,0,,,,,,,,,3/23/2020 01:30,2020-03-23T01:30:00Z,03/22 21:30,0,,2020-03-23T01:30:00Z,,,,,,,,,,,,,,,,,,,69,0,0,0,0,0,0,0,28ef178f7ae9c6149a8e469c9e452933bbe28720,0,0,0,0,0,
20200323,MP,0,,,,posNeg,0,,,,,,,,,3/23/2020 01:30,2020-03-23T01:30:00Z,03/22 21:30,0,,2020-03-23T01:30:00Z,,,,,,,,,,,,,,,,,,,69,0,0,0,0,0,0,0,92be2a547ff29adfd3878348d93f8f3070691e8a,0,0,0,0,0,
20200322,MP,0,,,,posNeg,0,,,,,,,,,3/22/2020 01:30,2020-03-22T01:30:00Z,03/21 21:30,0,,2020-03-22T01:30:00Z,,,,,,,,,,,,,,,,,,,69,0,0,0,0,0,0,0,9c8984b61f98845a3ee95c49db8cb094ddbe3620,0,0,0,0,0,
20200321,MP,0,,,,posNeg,0,,,,,,,,,3/21/2020 02:30,2020-03-21T02:30:00Z,03/20 22:30,0,,2020-03-21T02:30:00Z,,,,,,,,,,,,,,,,,,,69,0,0,0,0,0,0,0,4d9777b071575034badb4fe57fc611d4bfb3e334,0,0,0,0,0,
20200320,MP,0,,,,posNeg,0,,,,,,,,,3/20/2020 01:30,2020-03-20T01:30:00Z,03/19 21:30,0,,2020-03-20T01:30:00Z,,,,,,,,,,,,,,,,,,,69,0,0,0,0,0,0,0,7507367daf19d721f9ddc0fd0f74cafa98185b7d,0,0,0,0,0,
20200319,MP,0,,,,posNeg,0,,,,,,,,,3/19/2020 01:30,2020-03-19T01:30:00Z,03/18 21:30,0,,2020-03-19T01:30:00Z,,,,,,,,,,,,,,,,,,,69,0,0,0,0,0,0,0,599b20146e161a51149a720529b1262755c5bc74,0,0,0,0,0,
20200318,MP,0,,,,posNeg,0,,,,,,,,,3/18/2020 03:30,2020-03-18T03:30:00Z,03/17 23:30,0,,2020-03-18T03:30:00Z,,,,,,,,,,,,,,,,,,,69,0,0,0,0,0,0,0,e62d83fb9659249bc813bb725b035a6de64e6de8,0,0,0,0,0,
20200317,MP,0,,,,posNeg,0,,,,,,,,,3/17/2020 01:30,2020-03-17T01:30:00Z,03/16 21:30,,,2020-03-17T01:30:00Z,,,,,,,,,,,,,,,,,,,69,0,0,0,0,0,0,0,d274d54bc6f49d48b7fb1043907233fdbd2e1bad,0,0,0,0,0,
20200316,MP,0,,,,posNeg,0,,,,,,,,,3/16/2020 15:55,2020-03-16T15:55:00Z,03/16 11:55,,,2020-03-16T15:55:00Z,,,,,,,,,,,,,,,,,,,69,0,0,0,0,0,0,0,c738e451a1fb26523fcdd22dd5af6d94387e49a1,0,0,0,0,0,
