date,state,positive,probableCases,negative,pending,totalTestResultsSource,totalTestResults,hospitalizedCurrently,hospitalizedCumulative,inIcuCurrently,inIcuCumulative,onVentilatorCurrently,onVentilatorCumulative,recovered,dataQualityGrade,lastUpdateEt,dateModified,checkTimeEt,death,hospitalized,dateChecked,totalTestsViral,positiveTestsViral,negativeTestsViral,positiveCasesViral,deathConfirmed,deathProbable,totalTestEncountersViral,totalTestsPeopleViral,totalTestsAntibody,positiveTestsAntibody,negativeTestsAntibody,totalTestsPeopleAntibody,positiveTestsPeopleAntibody,negativeTestsPeopleAntibody,totalTestsPeopleAntigen,positiveTestsPeopleAntigen,totalTestsAntigen,positiveTestsAntigen,fips,positiveIncrease,negativeIncrease,total,totalTestResultsIncrease,posNeg,deathIncrease,hospitalizedIncrease,hash,commercialScore,negativeRegularScore,negativeScore,positiveScore,score,grade
20201029,HI,15039,205,295153,,totalTestEncountersViral,517005,61,1081,15,,12,,11605,B,10/28/2020 18:00,2020-10-28T18:00:00Z,10/28 14:00,213,1081,2020-10-28T18:00:00Z,,14776,,14834,,,517005,308090,,,,,,,,,,,15,61,0,310192,4393,310192,-2,8,526eb99ad8506805bb59f7c862af6efb9c577f11,0,0,0,0,0,
20201028,HI,14978,205,295153,,totalTestEncountersViral,512612,61,1073,15,,12,,11523,B,10/27/2020 18:00,2020-10-27T18:00:00Z,10/27 14:00,215,1073,2020-10-27T18:00:00Z,,14717,,14773,,,512612,308090,,,,,,,,,,,15,64,0,310131,4122,310131,3,6,8fdb5f852c920a7a00845e2140af0717e21fe4c5,0,0,0,0,0,
20201027,HI,14914,205,295153,,totalTestEncountersViral,508490,64,1067,15,,10,,11444,B,10/26/2020 18:00,2020-10-26T18:00:00Z,10/26 14:00,212,1067,2020-10-26T18:00:00Z,,14655,,14709,,,508490,308090,,,,,,,,,,,15,37,0,310067,3235,310067,0,2,c863229768efb63c3317d31386942894f242745d,0,0,0,0,0,
20201026,HI,14877,205,295153,,totalTestEncountersViral,505255,64,1065,15,,10,,11405,B,10/25/2020 18:00,2020-10-25T18:00:00Z,10/25 14:00,212,1065,2020-10-25T18:00:00Z,,14617,,14672,,,505255,308090,,,,,,,,,,,15,119,0,310030,4799,310030,0,0,65eeffafd19c14f65d09b80feef7ac19dea3628e,0,0,0,0,0,
20201025,HI,14758,205,295153,,totalTestEncountersViral,500456,64,1065,15,,10,,11346,B,10/24/2020 18:00,2020-10-24T18:00:00Z,10/24 14:00,212,1065,2020-10-24T18:00:00Z,,14497,,14553,,,500456,308090,,,,,,,,,,,15,89,0,309911,4163,309911,3,8,060fe2d98d8dbe3fdfc5c03c6ebc8e9eac74bf31,0,0,0,0,0,
20201024,HI,14669,205,295153,,totalTestEncountersViral,496293,71,1057,18,,11,,11292,B,10/23/2020 18:00,2020-10-23T18:00:00Z,10/23 14:00,209,1057,2020-10-23T18:00:00Z,,14409,,14464,,,496293,308090,,,,,,,,,,,15,140,0,309822,4843,309822,3,12,22270f190314cc38a2c035381f94d3604803ac10,0,0,0,0,0,
20201023,HI,14529,194,295153,,totalTestEncountersViral,491450,75,1045,18,,13,,11232,B,10/22/2020 18:00,2020-10-22T18:00:00Z,10/22 14:00,206,1045,2020-10-22T18:00:00Z,,14282,,14335,,,491450,308090,,,,,,,,,,,15,102,0,309682,4139,309682,3,12,218a294743f1a327d699750708ec576c0df1648f,0,0,0,0,0,
20201022,HI,14427,194,295153,,totalTestEncountersViral,487311,75,1033,18,,15,,11188,B,10/21/2020 18:00,2020-10-21T18:00:00Z,10/21 14:00,203,1033,2020-10-21T18:00:00Z,,14180,,14233,,,487311,308090,,,,,,,,,,,15,77,0,309580,4329,309580,14,8,f168fe38779d117eb0e62c7211e4efec81d26f8b,0,0,0,0,0,
20201021,HI,14350,194,295153,,totalTestEncountersViral,482982,81,1025,19,,13,,11150,B,10/20/2020 18:00,2020-10-20T18:00:00Z,10/20 14:00,189,1025,2020-10-20T18:00:00Z,,14097,,14156,,,482982,308090,,,,,,,,,,,15,88,0,309503,3681,309503,2,13,70f681b53aa624001cd1b7821c325b4669ddb29b,0,0,0,0,0,
20201020,HI,14262,194,295153,,totalTestEncountersViral,479301,96,1012,22,,15,,11078,B,10/19/2020 18:00,2020-10-19T18:00:00Z,10/19 14:00,187,1012,2020-10-19T18:00:00Z,,14014,,14068,,,479301,308090,,,,,,,,,,,15,37,0,309415,1985,309415,0,7,f3af922481bf6ce607eff37955572f90d2626022,0,0,0,0,0,
20201019,HI,14225,194,295153,,totalTestEncountersViral,477316,96,1005,22,,15,,11044,B,10/18/2020 18:00,2020-10-18T18:00:00Z,10/18 14:00,187,1005,2020-10-18T18:00:00Z,,13975,,14031,,,477316,308090,,,,,,,,,,,15,82,0,309378,3735,309378,1,4,ec7603a08f7d6defaef04654ecf247c5a03d43d3,0,0,0,0,0,
20201018,HI,14143,194,295153,,totalTestEncountersViral,473581,96,1001,22,,15,,10995,B,10/17/2020 18:00,2020-10-17T18:00:00Z,10/17 14:00,186,1001,2020-10-17T18:00:00Z,,13890,,13949,,,473581,308090,,,,,,,,,,,15,96,0,309296,3897,309296,1,13,aa28485510ab043771b792dacb7283f5739e8b24,0,0,0,0,0,
20201017,HI,14047,194,295153,,totalTestEncountersViral,469684,100,988,25,,14,,10947,B,10/16/2020 18:00,2020-10-16T18:00:00Z,10/16 14:00,185,988,2020-10-16T18:00:00Z,,13794,,13853,,,469684,308090,,,,,,,,,,,15,85,0,309200,3654,309200,1,10,9e8e4c115427c3f4012a8ab999c23f492a6b7f40,0,0,0,0,0,
20201016,HI,13962,198,295153,,totalTestEncountersViral,466030,103,978,23,,5,,10915,B,10/15/2020 18:00,2020-10-15T18:00:00Z,10/15 14:00,184,978,2020-10-15T18:00:00Z,,13703,,13764,,,466030,308090,,,,,,,,,,,15,90,0,309115,3489,309115,1,17,8a963ed63e5732a68eff128fd01741699fe7a8ee,0,0,0,0,0,
20201015,HI,13872,198,295153,,totalTestEncountersViral,462541,105,961,27,,9,,10883,B,10/14/2020 18:00,2020-10-14T18:00:00Z,10/14 14:00,183,961,2020-10-14T18:00:00Z,,13613,,13674,,,462541,308090,,,,,,,,,,,15,99,0,309025,4069,309025,10,10,cd60073a706042ac6c64e20a583e7e9dbf80b882,0,0,0,0,0,
20201014,HI,13773,198,295153,,totalTestEncountersViral,458472,109,951,26,,14,,10834,B,10/13/2020 18:00,2020-10-13T18:00:00Z,10/13 14:00,173,951,2020-10-13T18:00:00Z,,13520,,13575,,,458472,308090,,,,,,,,,,,15,61,0,308926,2354,308926,4,12,61d1416d0e231b63c9bb43b39e212a2e361108b9,0,0,0,0,0,
20201013,HI,13712,198,295153,,totalTestEncountersViral,456118,103,939,34,,18,,10781,B,10/12/2020 18:00,2020-10-12T18:00:00Z,10/12 14:00,169,939,2020-10-12T18:00:00Z,,13466,,13514,,,456118,308090,,,,,,,,,,,15,42,0,308865,1405,308865,0,4,cb73c91e79d639b64ebc58c7ebf37f94511c0984,0,0,0,0,0,
20201012,HI,13670,198,295153,,totalTestEncountersViral,454713,103,935,34,,18,,10750,B,10/11/2020 18:00,2020-10-11T18:00:00Z,10/11 14:00,169,935,2020-10-11T18:00:00Z,,13426,,13472,,,454713,308090,,,,,,,,,,,15,101,0,308823,0,308823,1,6,11ef40989de67d417c989fe87031715ba6792d41,0,0,0,0,0,
20201011,HI,13569,198,295153,,totalTestEncountersViral,454713,103,929,34,,18,,10713,B,10/10/2020 18:00,2020-10-10T18:00:00Z,10/10 14:00,168,929,2020-10-10T18:00:00Z,,13426,,13371,,,454713,308090,,,,,,,,,,,15,71,0,308722,6903,308722,2,18,4165bd9315eac62574e57466514edf480b8b9af1,0,0,0,0,0,
20201010,HI,13498,198,295153,,totalTestEncountersViral,447810,106,911,29,,18,,10651,B,10/9/2020 18:00,2020-10-09T18:00:00Z,10/09 14:00,166,911,2020-10-09T18:00:00Z,,13244,,13300,,,447810,308090,,,,,,,,,,,15,165,0,308651,3818,308651,2,11,3e2a04c29045c354c0e64f8243948fc16ee193d1,0,0,0,0,0,
20201009,HI,13333,187,295153,,totalTestEncountersViral,443992,111,900,32,,18,,10604,B,10/8/2020 18:00,2020-10-08T18:00:00Z,10/08 14:00,164,900,2020-10-08T18:00:00Z,,13021,,13146,,,443992,308090,,,,,,,,,,,15,101,0,308486,3903,308486,1,6,75076917d9daab6bd1af65aeb072a36411f67ab6,0,0,0,0,0,
20201008,HI,13232,187,295153,,totalTestEncountersViral,440089,109,894,35,,18,,10573,B,10/7/2020 18:00,2020-10-07T18:00:00Z,10/07 14:00,163,894,2020-10-07T18:00:00Z,,12998,,13045,,,440089,308090,,,,,,,,,,,15,108,0,308385,3591,308385,3,5,51c2544630a125fec06741f96ed168d9dfb78668,0,0,0,0,0,
20201007,HI,13124,187,295153,,totalTestEncountersViral,436498,115,889,35,,18,,10526,B,10/6/2020 18:00,2020-10-06T18:00:00Z,10/06 14:00,160,889,2020-10-06T18:00:00Z,441593,12910,,12937,,,436498,308090,,,,,,,,,,,15,83,1166,308277,3344,308277,3,0,e31f05ac832443af5052f1a3c09bfa5acd54b1d7,0,0,0,0,0,
20201006,HI,13041,187,293987,,totalTestEncountersViral,433154,128,889,39,,29,,10470,B,10/5/2020 18:00,2020-10-05T18:00:00Z,10/05 14:00,157,889,2020-10-05T18:00:00Z,438212,12819,,12854,,,433154,306841,,,,,,,,,,,15,50,866,307028,1750,307028,1,0,c671f5769f1dc12fc4412c8f3f22d62ba6da27cd,0,0,0,0,0,
20201005,HI,12991,187,293121,,totalTestEncountersViral,431404,128,889,39,,29,,10446,B,10/4/2020 18:00,2020-10-04T18:00:00Z,10/04 14:00,156,889,2020-10-04T18:00:00Z,436462,12770,,12804,,,431404,305925,,,,,,,,,,,15,70,1893,306112,3561,306112,3,4,0d5c61a8cf3d7c2c3fbb396501de53af3c9713bb,0,0,0,0,0,
20201004,HI,12921,187,291228,,totalTestEncountersViral,427843,128,885,39,,29,,10415,B,10/3/2020 18:00,2020-10-03T18:00:00Z,10/03 14:00,153,885,2020-10-03T18:00:00Z,432711,12696,,12734,,,427843,303962,,,,,,,,,,,15,133,1803,304149,4982,304149,11,5,204914e2131d34eb310313073cf5d4d25d10dae0,0,0,0,0,0,
20201003,HI,12788,187,289425,,totalTestEncountersViral,422861,125,880,40,,27,,10389,B,10/2/2020 18:00,2020-10-02T18:00:00Z,10/02 14:00,142,880,2020-10-02T18:00:00Z,427746,12567,,12601,,,422861,302026,,,,,,,,,,,15,94,1660,302213,3665,302213,3,18,21f7564b5962be54e2272b95b8d352f96072250a,0,0,0,0,0,
20201002,HI,12694,179,287765,,totalTestEncountersViral,419196,130,862,45,,21,,10340,B,10/1/2020 18:00,2020-10-01T18:00:00Z,10/01 14:00,139,862,2020-10-01T18:00:00Z,424242,12478,,12515,,,419196,300280,,,,,,,,,,,15,105,1712,300459,3229,300459,3,15,caccfa73b16ce11f78d5310540b27a07fdcc7a94,0,0,0,0,0,
20201001,HI,12589,179,286053,,totalTestEncountersViral,415967,140,847,47,,33,,10298,B,9/30/2020 18:00,2020-09-30T18:00:00Z,09/30 14:00,136,847,2020-09-30T18:00:00Z,420433,12381,,12410,,,415967,298463,,,,,,,,,,,15,120,1842,298642,4583,298642,4,15,75efc7290f3c4a77db489b4f9f4831f24a0effff,0,0,0,0,0,
20200930,HI,12469,179,284211,,totalTestEncountersViral,411384,147,832,44,,12,,10256,B,9/29/2020 18:00,2020-09-29T18:00:00Z,09/29 14:00,132,832,2020-09-29T18:00:00Z,415940,12257,,12290,,,411384,296414,,,,,,,,,,,15,87,0,296680,3424,296680,0,13,0cb6b5556ad4cc813692264d1fd223cc1f8a7241,0,0,0,0,0,
20200929,HI,12382,179,284211,,totalTestEncountersViral,407960,147,819,44,,12,,10215,B,9/28/2020 18:00,2020-09-28T18:00:00Z,09/28 14:00,132,819,2020-09-28T18:00:00Z,412790,12168,,12203,,,407960,296414,,,,,,,,,,,15,87,2765,296593,2429,296593,0,3,abda52d1c0f41c60c0911f9d0e1466d73ff52e35,0,0,0,0,0,
20200928,HI,12295,179,281446,,totalTestEncountersViral,405531,148,816,48,,31,,10155,B,9/27/2020 18:00,2020-09-27T18:00:00Z,09/27 14:00,132,816,2020-09-27T18:00:00Z,410341,12078,,12116,,,405531,293562,,,,,,,,,,,15,98,1807,293741,4280,293741,1,14,dcbabdd3c75b2b8eb68356f2baa19b0f39f89b58,0,0,0,0,0,
20200927,HI,12197,179,279639,,totalTestEncountersViral,401251,150,802,48,,31,,10126,B,9/26/2020 18:00,2020-09-26T18:00:00Z,09/26 14:00,131,802,2020-09-26T18:00:00Z,406092,11979,,12018,,,401251,291657,,,,,,,,,,,15,127,1563,291836,4255,291836,4,15,f5e939db437775a09685b512d02e2d6e9a6f980f,0,0,0,0,0,
20200926,HI,12070,179,278076,,totalTestEncountersViral,396996,150,787,55,,30,,5397,B,9/25/2020 18:00,2020-09-25T18:00:00Z,09/25 14:00,127,787,2020-09-25T18:00:00Z,402010,11853,,11891,,,396996,289967,,,,,,,,,,,15,132,2980,290146,3275,290146,3,8,661b37d839084950e2b35a25f76fbfc78d42e224,0,0,0,0,0,
20200925,HI,11938,159,275096,,totalTestEncountersViral,393721,150,779,55,,30,,5265,B,9/24/2020 18:00,2020-09-24T18:00:00Z,09/24 14:00,124,779,2020-09-24T18:00:00Z,398945,11743,,11779,,,393721,286785,,,,,,,,,,,15,90,0,287034,3361,287034,2,16,65958a50ff641121b7f382c2520a7c8b066fce98,0,0,0,0,0,
20200924,HI,11848,159,275096,,totalTestEncountersViral,390360,162,763,54,,34,,5125,B,9/23/2020 18:00,2020-09-23T18:00:00Z,09/23 14:00,122,763,2020-09-23T18:00:00Z,395503,11640,,11689,,,390360,286785,,,,,,,,,,,15,167,2549,286944,5108,286944,2,14,e3b098f131ebf1d55745b473b1a266dad26c68b1,0,0,0,0,0,
20200923,HI,11681,159,272547,,totalTestEncountersViral,385252,181,749,61,,39,,4992,B,9/22/2020 18:00,2020-09-22T18:00:00Z,09/22 14:00,120,749,2020-09-22T18:00:00Z,390003,11469,,11522,,,385252,284069,,,,,,,,,,,15,63,1426,284228,3079,284228,0,14,8225d279ffa78580e6093c756dea3aa803b70ce0,0,0,0,0,0,
20200922,HI,11618,159,271121,,totalTestEncountersViral,382173,185,735,51,,40,,4888,B,9/21/2020 18:00,2020-09-21T18:00:00Z,09/21 14:00,120,735,2020-09-21T18:00:00Z,387200,11410,,11459,,,382173,282580,,,,,,,,,,,15,56,1106,282739,1865,282739,0,5,1003cafb663777c65a23fedf9f8d17cdbac41cd5,0,0,0,0,0,
20200921,HI,11562,159,270015,,totalTestEncountersViral,380308,185,730,51,,40,,4759,B,9/20/2020 18:00,2020-09-20T18:00:00Z,09/20 14:00,120,730,2020-09-20T18:00:00Z,385103,11356,,11403,,,380308,281418,,,,,,,,,,,15,77,1492,281577,3654,281577,0,4,fc55792d72d718d0fd8e9e04bdc39c912e14deea,0,0,0,0,0,
20200920,HI,11485,159,268523,,totalTestEncountersViral,376654,185,726,51,,40,,4622,B,9/19/2020 18:00,2020-09-19T18:00:00Z,09/19 14:00,120,726,2020-09-19T18:00:00Z,381571,11273,,11326,,,376654,279740,,,,,,,,,,,15,109,0,280008,9252,280008,0,26,bf98d84a6ff3a81248abafd22e71c033176467ea,0,0,0,0,0,
20200919,HI,11376,159,268523,,totalTestEncountersViral,367402,200,700,52,,34,,4394,B,9/18/2020 18:00,2020-09-18T18:00:00Z,09/18 14:00,120,700,2020-09-18T18:00:00Z,372617,11152,,11217,,,367402,279740,,,,,,,,,,,15,137,10299,279899,6975,279899,13,15,137a007a08b2754e7be3eaadf1a7d1a49fa5a8b2,0,0,0,0,0,
20200918,HI,11239,134,258224,,totalTestEncountersViral,360427,197,685,51,,31,,4248,B,9/17/2020 18:00,2020-09-17T18:00:00Z,09/17 14:00,107,685,2020-09-17T18:00:00Z,365690,11041,,11105,,,360427,269329,,,,,,,,,,,15,159,3670,269463,4600,269463,4,18,b9c0ee4f35bf83ceaf3eb7d954a4d52ca6070bb6,0,0,0,0,0,
20200917,HI,11080,134,254554,,totalTestEncountersViral,355827,210,667,56,,38,,4105,B,9/16/2020 18:00,2020-09-16T18:00:00Z,09/16 14:00,103,667,2020-09-16T18:00:00Z,358335,10930,,10946,,,355827,265500,,,,,,,,,,,15,102,2390,265634,6453,265634,3,13,9ad07ef88bbc667e8201166a6c9d6d633d8654f4,0,0,0,0,0,
20200916,HI,10978,134,252164,,totalTestEncountersViral,349374,222,654,60,,48,,3885,C,9/15/2020 18:00,2020-09-15T18:00:00Z,09/15 14:00,100,654,2020-09-15T18:00:00Z,354450,10792,,10844,,,349374,263008,,,,,,,,,,,15,65,1036,263142,2853,263142,1,16,330b51845b446a59fe1b12df95ac41e3c4f08b86,0,0,0,0,0,
20200915,HI,10913,134,251128,,totalTestEncountersViral,346521,225,638,53,,31,,3693,C,9/14/2020 18:00,2020-09-14T18:00:00Z,09/14 14:00,99,638,2020-09-14T18:00:00Z,352137,10720,,10779,,,346521,261907,,,,,,,,,,,15,79,2297,262041,3545,262041,0,2,434b612dbcd12e8f72effe4f3423b88514eeed5f,0,0,0,0,0,
20200914,HI,10834,134,248831,,totalTestEncountersViral,342976,225,636,53,,31,,3565,C,9/13/2020 18:00,2020-09-13T18:00:00Z,09/13 14:00,99,636,2020-09-13T18:00:00Z,348561,10644,,10700,,,342976,259531,,,,,,,,,,,15,112,4020,259665,6406,259665,2,1,b1c8810f1275a32d88ca02731ba5c335f7c304aa,0,0,0,0,0,
20200913,HI,10722,134,244811,,totalTestEncountersViral,336570,220,635,51,,41,,3418,C,9/12/2020 18:00,2020-09-12T18:00:00Z,09/12 14:00,97,635,2020-09-12T18:00:00Z,342202,10531,,10588,,,336570,255399,,,,,,,,,,,15,129,5231,255533,7349,255533,1,13,75c04161d525610dafd2838ae368c1caaf0a9ae8,0,0,0,0,0,
20200912,HI,10593,134,239580,,totalTestEncountersViral,329221,220,622,51,,41,,3334,C,9/11/2020 18:00,2020-09-11T18:00:00Z,09/11 14:00,96,622,2020-09-11T18:00:00Z,334756,10398,,10459,,,329221,250039,,,,,,,,,,,15,170,3389,250173,5724,250173,2,12,79dc2e2772e7676db1be512b9a83fd175328bba4,0,0,0,0,0,
20200911,HI,10423,131,236191,,totalTestEncountersViral,323497,240,610,52,,29,,3176,C,9/10/2020 18:00,2020-09-10T18:00:00Z,09/10 14:00,94,610,2020-09-10T18:00:00Z,329209,10240,,10292,,,323497,246483,,,,,,,,,,,15,169,7042,246614,9914,246614,3,6,9464221991ce11f7a39e99e000f16777a4ef68cf,0,0,0,0,0,
20200910,HI,10254,131,229149,,totalTestEncountersViral,313583,240,604,53,,40,,3120,C,9/9/2020 18:00,2020-09-09T18:00:00Z,09/09 14:00,91,604,2020-09-09T18:00:00Z,319350,10069,,10123,,,313583,239272,,,,,,,,,,,15,98,1388,239403,2710,239403,3,5,54acb0093ca77a10b77f5d1970528263297a7ebf,0,0,0,0,0,
20200909,HI,10156,131,227761,,totalTestEncountersViral,310873,257,599,47,,29,,3063,C,9/8/2020 18:00,2020-09-08T18:00:00Z,09/08 14:00,88,599,2020-09-08T18:00:00Z,316505,9964,,10025,,,310873,237786,,,,,,,,,,,15,197,708,237917,1244,237917,2,1,9499df108225d88e6dfdac27896a7e9ef7606d47,0,0,0,0,0,
20200908,HI,9959,,227053,,totalTestEncountersViral,309629,265,598,50,,37,,3028,C,9/7/2020 18:00,2020-09-07T18:00:00Z,09/07 14:00,86,598,2020-09-07T18:00:00Z,315191,9903,,,,,309629,237012,,,,,,,,,,,15,104,2005,237012,3159,237012,1,1,748e069300ef230d5bd8b786219621d20181d889,0,0,0,0,0,
20200907,HI,9855,,225048,,totalTestEncountersViral,306470,265,597,50,,37,,2991,C,9/6/2020 18:00,2020-09-06T18:00:00Z,09/06 14:00,85,597,2020-09-06T18:00:00Z,311961,9802,,,,,306470,234903,,,,,,,,,,,15,162,4945,234903,6899,234903,1,5,e811624b944a636a3f7078c800f771e782899b61,0,0,0,0,0,
20200906,HI,9693,,220103,,totalTestEncountersViral,299571,265,592,50,,37,,2931,C,9/5/2020 18:00,2020-09-05T18:00:00Z,09/05 14:00,84,592,2020-09-05T18:00:00Z,305226,9639,,,,,299571,229796,,,,,,,,,,,15,220,8185,229796,10725,229796,3,9,c5c89f3dafba749e2b1364792d133520b7241bbb,0,0,0,0,0,
20200905,HI,9473,,211918,,totalTestEncountersViral,288846,265,583,50,,37,,2855,C,9/4/2020 18:00,2020-09-04T18:00:00Z,09/04 14:00,81,583,2020-09-04T18:00:00Z,294102,9430,,,,,288846,221391,,,,,,,,,,,15,271,7398,221391,9986,221391,2,10,4536fb537c2856eb3542ded19375c4e4df79404f,0,0,0,0,0,
20200904,HI,9202,,204520,,totalTestEncountersViral,278860,277,573,51,,31,,2778,C,9/3/2020 05:59,2020-09-03T05:59:00Z,09/03 01:59,79,573,2020-09-03T05:59:00Z,284177,9149,,,,,278860,213722,,,,,,,,,,,15,211,6080,213722,8482,213722,4,21,9809a5244031ee71e040c06ad2bee616c403f048,0,0,0,0,0,
20200903,HI,8991,,198440,,totalTestEncountersViral,270378,276,552,47,,27,,2689,C,9/2/2020 05:59,2020-09-02T05:59:00Z,09/02 01:59,75,552,2020-09-02T05:59:00Z,275704,8947,,,,,270378,207431,,,,,,,,,,,15,338,4907,207431,7309,207431,1,20,7b0b314db8d876e35ef4b6afca2309f2a41be008,0,0,0,0,0,
20200902,HI,8653,,193533,,totalTestEncountersViral,263069,288,532,48,,27,,2634,C,9/1/2020 05:59,2020-09-01T05:59:00Z,09/01 01:59,74,532,2020-09-01T05:59:00Z,268461,8699,,,,,263069,202186,,,,,,,,,,,15,181,3823,202186,5368,202186,4,24,025816cf8b19688258d8da5a7a1826b0164cf1bd,0,0,0,0,0,
20200901,HI,8472,,189710,,totalTestEncountersViral,257701,297,508,57,,42,,2578,C,8/31/2020 05:59,2020-08-31T05:59:00Z,08/31 01:59,70,508,2020-08-31T05:59:00Z,263187,8519,,,,,257701,198182,,,,,,,,,,,15,133,1330,198182,2002,198182,7,3,6f315f2af292c1e15356a0a99f4dd996470fc28b,0,0,0,0,0,
20200831,HI,8339,,188380,,totalTestEncountersViral,255699,272,505,57,,42,,2520,C,8/30/2020 05:59,2020-08-30T05:59:00Z,08/30 01:59,63,505,2020-08-30T05:59:00Z,260737,8392,,,,,255699,196719,,,,,,,,,,,15,200,2584,196719,4322,196719,1,8,be07338c8a1cdc80f004cb7e3a36d3383698626c,0,0,0,0,0,
20200830,HI,8139,,185796,,totalTestEncountersViral,251377,272,497,57,,42,,2477,C,8/29/2020 05:59,2020-08-29T05:59:00Z,08/29 01:59,62,497,2020-08-29T05:59:00Z,256650,8197,,,,,251377,193935,,,,,,,,,,,15,309,2716,193935,5310,193935,3,12,8a9cb8792c6a6f9a3a656c8cf90b1f46a2b3c37d,0,0,0,0,0,
20200829,HI,7830,,183080,,totalTestEncountersViral,246067,279,485,55,,38,,2410,C,8/28/2020 05:59,2020-08-28T05:59:00Z,08/28 01:59,59,485,2020-08-28T05:59:00Z,251710,7877,,,,,246067,190910,,,,,,,,,,,15,264,2493,190910,4582,190910,4,23,561a7ef6d68e46ab629d955b0f8f8b89f0084fd6,0,0,0,0,0,
20200828,HI,7566,,180587,,totalTestEncountersViral,241485,286,462,56,,39,,2371,C,8/27/2020 05:59,2020-08-27T05:59:00Z,08/27 01:59,55,462,2020-08-27T05:59:00Z,247017,7591,,,,,241485,188153,,,,,,,,,,,15,306,2172,188153,3682,188153,4,18,6f5b80a2257f9e5d7b4fda511b967bb0457189fa,0,0,0,0,0,
20200827,HI,7260,,178415,,totalTestEncountersViral,237803,291,444,54,,35,,2288,C,8/26/2020 05:59,2020-08-26T05:59:00Z,08/26 01:59,51,444,2020-08-26T05:59:00Z,243154,7276,,,,,237803,185675,,,,,,,,,,,15,276,2242,185675,4064,185675,2,25,4a98ba7b693bcfde6e3e5801eec495e7e5f77ad1,0,0,0,0,0,
20200826,HI,6984,,176173,,totalTestEncountersViral,233739,270,419,50,,19,,2236,C,8/25/2020 05:59,2020-08-25T05:59:00Z,08/25 01:59,49,419,2020-08-25T05:59:00Z,239269,6987,,,,,233739,183157,,,,,,,,,,,15,0,2307,183157,3364,183157,0,0,91bc07e791098db972ebc7b7bb11b7e3939c2c77,0,0,0,0,0,
20200825,HI,6984,,173866,,totalTestEncountersViral,230375,250,419,35,,19,,2236,C,8/25/2020 05:59,2020-08-25T05:59:00Z,08/25 01:59,49,419,2020-08-25T05:59:00Z,239269,6775,,,,,230375,180850,,,,,,,,,,,15,384,1642,180850,3087,180850,2,23,affd7e36ede95136ce302a2c305026531bbc32f6,0,0,0,0,0,
20200824,HI,6600,,172224,,totalTestEncountersViral,227288,192,396,35,,19,,2143,C,8/23/2020 18:00,2020-08-23T18:00:00Z,08/23 14:00,47,396,2020-08-23T18:00:00Z,232334,6615,,,,,227288,178824,,,,,,,,,,,15,244,2396,178824,3841,178824,0,19,4156a0debca3721039d091595261682eef450940,0,0,0,0,0,
20200823,HI,6356,,169828,,totalTestEncountersViral,223447,192,377,35,,19,,2107,C,8/22/2020 18:00,2020-08-22T18:00:00Z,08/22 14:00,47,377,2020-08-22T18:00:00Z,228381,6369,,,,,223447,176184,,,,,,,,,,,15,284,2350,176184,4390,176184,1,40,ad276d70909ceadd04e6fba79d7f1d4b90f3dc85,0,0,0,0,0,
20200822,HI,6072,,167478,,totalTestEncountersViral,219057,227,337,44,,23,,2072,C,8/21/2020 00:00,2020-08-21T00:00:00Z,08/20 20:00,46,337,2020-08-21T00:00:00Z,223985,6050,,,,,219057,173550,,,,,,,,,,,15,228,4650,173550,3806,173550,1,20,61ebe408554f8367ea3deeea29d0c8c8160ea5d7,0,0,0,0,0,
20200821,HI,5844,,162828,,totalTestEncountersViral,215251,165,317,29,,19,,2031,C,8/20/2020 23:24,2020-08-20T23:24:00Z,08/20 19:24,45,317,2020-08-20T23:24:00Z,219986,5825,,,,,215251,171184,,,,,,,,,,,15,0,0,168672,3520,168672,0,0,f31f783a91e589dadc68fb675d023672c68f74d6,0,0,0,0,0,
20200820,HI,5844,,162828,,totalTestEncountersViral,211731,187,317,33,,20,,2031,C,8/19/2020 23:29,2020-08-19T23:29:00Z,08/19 19:29,45,317,2020-08-19T23:29:00Z,219986,5596,,,,,211731,168672,,,,,,,,,,,15,235,2324,168672,3741,168672,3,14,e9e774a33f164ae58f8aa98ff9d221c05074800e,0,0,0,0,0,
20200819,HI,5609,,160504,,totalTestEncountersViral,207990,205,303,39,,22,,1977,C,8/19/2020 00:52,2020-08-19T00:52:00Z,08/18 20:52,42,303,2020-08-19T00:52:00Z,216120,5341,,,,,207990,166113,,,,,,,,,,,15,394,1520,166113,2719,166113,2,15,27b5f81f361969e2cf1451b43c8cbc4372f34bb7,0,0,0,0,0,
20200818,HI,5215,,158984,,totalTestEncountersViral,205271,175,288,35,,25,,1868,C,8/17/2020 22:55,2020-08-17T22:55:00Z,08/17 18:55,40,288,2020-08-17T22:55:00Z,209529,5193,,,,,205271,164199,,,,,,,,,,,15,173,2078,164199,3246,164199,0,5,49642b6dc49115775e46f2b8de34547382acb81d,0,0,0,0,0,
20200817,HI,5042,,156906,,totalTestEncountersViral,202025,143,283,35,,25,,1841,C,8/16/2020 00:00,2020-08-16T00:00:00Z,08/15 20:00,40,283,2020-08-16T00:00:00Z,206537,5017,,,,,202025,161948,,,,,,,,,,,15,217,2432,161948,3840,161948,0,4,46f5207add503daa53bf68a32cf58a051dc1b449,0,0,0,0,0,
20200816,HI,4825,,154474,,totalTestEncountersViral,198185,143,279,35,,25,,1808,C,8/14/2020 22:38,2020-08-14T22:38:00Z,08/14 18:38,40,279,2020-08-14T22:38:00Z,202753,4806,,,,,198185,159299,,,,,,,,,,,15,282,2751,159299,4379,159299,0,2,193144b9f3858631dc1ad65b954c7e44f87923db,0,0,0,0,0,
20200815,HI,4543,,151723,,totalTestEncountersViral,193806,173,277,41,,22,,1756,C,8/14/2020 22:38,2020-08-14T22:38:00Z,08/14 18:38,40,277,2020-08-14T22:38:00Z,198152,4512,,,,,193806,156266,,,,,,,,,,,15,231,2418,156266,3675,156266,0,10,277c37fa224665a97289fa0b1e6ed86a9904ce4f,0,0,0,0,0,
20200814,HI,4312,,149305,,totalTestEncountersViral,190131,146,267,29,,22,,1716,C,8/13/2020 23:15,2020-08-13T23:15:00Z,08/13 19:15,40,267,2020-08-13T23:15:00Z,194351,4278,,,,,190131,153617,,,,,,,,,,,15,0,3030,153617,4649,153617,0,0,e6aa30508b56d8feccb2ebf56b5cf7408e779fea,0,0,0,0,0,
20200813,HI,4312,,146275,,totalTestEncountersViral,185482,132,267,33,,24,,1716,C,8/13/2020 16:28,2020-08-13T16:28:00Z,08/13 12:28,40,267,2020-08-13T16:28:00Z,194351,3937,,,,,185482,150233,,,,,,,,,,,15,354,0,150587,3648,150587,2,7,828d5339050645d238410a4726d681ab6ea98780,0,0,0,0,0,
20200812,HI,3958,,146275,,totalTestEncountersViral,181834,166,260,31,,23,,1665,C,8/11/2020 23:06,2020-08-11T23:06:00Z,08/11 19:06,38,260,2020-08-11T23:06:00Z,189492,3745,,,,,181834,150233,,,,,,,,,,,15,320,4077,150233,2412,150233,4,18,773ce21d722b6073b6182461dcbe2f951badd9b8,0,0,0,0,0,
20200811,HI,3638,,142198,,totalTestEncountersViral,179422,105,242,24,,15,,1586,C,8/10/2020 23:37,2020-08-10T23:37:00Z,08/10 19:37,34,242,2020-08-10T23:37:00Z,183508,3605,,,,,179422,145836,,,,,,,,,,,15,140,3600,145836,2442,145836,3,3,13650e1843e50270e94868cb47eee9cbd25ae646,0,0,0,0,0,
20200810,HI,3498,,138598,,totalTestEncountersViral,176980,105,239,24,,15,,1548,C,8/8/2020 20:40,2020-08-08T20:40:00Z,08/08 16:40,31,239,2020-08-08T20:40:00Z,181000,3461,,,,,176980,141944,,,,,,,,,,,15,152,0,142096,2746,142096,0,2,a1f9bbf0fbb0848aa9ebf849b1ba5734a559990d,0,0,0,0,0,
20200809,HI,3346,,138598,,totalTestEncountersViral,174234,105,237,24,,15,,1511,C,8/8/2020 20:40,2020-08-08T20:40:00Z,08/08 16:40,31,237,2020-08-08T20:40:00Z,178211,3319,,,,,174234,141944,,,,,,,,,,,15,231,2467,141944,3129,141944,0,6,d0d59238d0d8b726477a8913bac70298d9cbf281,0,0,0,0,0,
20200808,HI,3115,,136131,,totalTestEncountersViral,171105,102,231,24,,19,,1467,C,8/7/2020 23:38,2020-08-07T23:38:00Z,08/07 19:38,31,231,2020-08-07T23:38:00Z,174717,3107,,,,,171105,139246,,,,,,,,,,,15,201,3761,139246,2975,139246,2,6,7ab505faa5a53c3a583dce17e24068966094f877,0,0,0,0,0,
20200807,HI,2914,,132370,,totalTestEncountersViral,168130,117,225,21,,14,,1440,C,8/6/2020 23:37,2020-08-06T23:37:00Z,08/06 19:37,29,225,2020-08-06T23:37:00Z,172699,2893,,,,,168130,135284,,,,,,,,,,,15,151,224,135284,3403,135284,2,11,4227e68312e4dfae3b56f5275264fdf2eef4501c,0,0,0,0,0,
20200806,HI,2763,,132146,,totalTestEncountersViral,164727,83,214,15,,13,,1402,C,8/5/2020 23:10,2020-08-05T23:10:00Z,08/05 19:10,27,214,2020-08-05T23:10:00Z,168422,2717,,,,,164727,134909,,,,,,,,,,,15,172,2211,134909,3327,134909,0,6,6e79e60e56cd85e9ec984226f3a28afb86830a83,0,0,0,0,0,
20200805,HI,2591,,129935,,totalTestEncountersViral,161400,83,208,15,,13,,1354,C,8/4/2020 23:22,2020-08-04T23:22:00Z,08/04 19:22,27,208,2020-08-04T23:22:00Z,165176,2561,,,,,161400,132526,,,,,,,,,,,15,143,1671,132526,2307,132526,1,7,31a99d27e1368e3ff5872b9db21abbf3dc0184f2,0,0,0,0,0,
20200804,HI,2448,,128264,,totalTestEncountersViral,159093,138,201,15,,10,,1315,C,8/3/2020 22:53,2020-08-03T22:53:00Z,08/03 18:53,26,201,2020-08-03T22:53:00Z,162785,2407,,,,,159093,130712,,,,,,,,,,,15,206,3227,130712,1789,130712,0,2,a4217210209ea77f65265fdeafed6c9d2e8dab72,0,0,0,0,0,
20200803,HI,2242,,125037,,totalTestEncountersViral,157304,75,199,15,,10,,1294,C,8/2/2020 22:32,2020-08-02T22:32:00Z,08/02 18:32,26,199,2020-08-02T22:32:00Z,158188,2284,,,,,157304,127279,,,,,,,,,,,15,45,593,127279,2790,127279,0,5,b039dc167ebf7536bcdb6ce4a60c040d8e3dbaea,0,0,0,0,0,
20200802,HI,2197,,124444,,totalTestEncountersViral,154514,75,194,15,,10,,1269,C,8/1/2020 21:25,2020-08-01T21:25:00Z,08/01 17:25,26,194,2020-08-01T21:25:00Z,157291,2166,,,,,154514,126641,,,,,,,,,,,15,86,3304,126641,2428,126641,0,15,02f31b1a45356b4ab6fa8cb8d58276253e7d65f0,0,0,0,0,0,
20200801,HI,2111,,121140,,totalTestEncountersViral,152086,75,179,15,,10,,1243,C,7/31/2020 23:31,2020-07-31T23:31:00Z,07/31 19:31,26,179,2020-07-31T23:31:00Z,152976,2072,,,,,152086,123251,,,,,,,,,,,15,122,1761,123251,2690,123251,0,2,4020e19d7a6e795e388b94319bedeeab3af8a84d,0,0,0,0,0,
20200731,HI,1989,,119379,,totalTestEncountersViral,149396,65,177,14,,10,,1226,C,7/30/2020 23:30,2020-07-30T23:30:00Z,07/30 19:30,26,177,2020-07-30T23:30:00Z,150394,1941,,,,,149396,121368,,,,,,,,,,,15,124,2032,121368,2500,121368,0,4,9384cf230d77230782f26aaadfba32742ad4549b,0,0,0,0,0,
20200730,HI,1865,,117347,,totalTestEncountersViral,146896,61,173,11,,9,,1215,C,7/29/2020 18:00,2020-07-29T18:00:00Z,07/29 14:00,26,173,2020-07-29T18:00:00Z,147553,1826,,,,,146896,119212,,,,,,,,,,,15,108,1545,119212,2740,119212,0,6,e2c82fd11cc2031b59678d8d69d43d15dd2e4902,0,0,0,0,0,
20200729,HI,1757,,115802,,totalTestEncountersViral,144156,47,167,,,,,1205,D,7/28/2020 23:04,2020-07-28T23:04:00Z,07/28 19:04,26,167,2020-07-28T23:04:00Z,145404,1719,,,,,144156,117559,,,,,,,,,,,15,46,1126,117559,1031,117559,0,2,02aaa0c2054be1bfe3f00a55f381bb534571e6be,0,0,0,0,0,
20200728,HI,1711,,114676,,totalTestEncountersViral,143125,39,165,,,,,1191,D,7/28/2020 00:00,2020-07-28T00:00:00Z,07/27 20:00,26,165,2020-07-28T00:00:00Z,143791,1680,,,,,143125,116387,,,,,,,,,,,15,28,2244,116387,1234,116387,0,2,df76339b77754e09e00dcee0f751180b9ccfe594,0,0,0,0,0,
20200727,HI,1683,,112432,,totalTestEncountersViral,141891,26,163,,,,,1179,D,7/27/2020 00:00,2020-07-27T00:00:00Z,07/26 20:00,26,163,2020-07-27T00:00:00Z,142900,1635,,,,,141891,114052,,,,,,,,,,,15,63,0,114115,2541,114115,0,2,f4dd18f406f230fecf24856f3232dab998f7d4b0,0,0,0,0,0,
20200726,HI,1620,,112432,,totalTestEncountersViral,139350,29,161,,,,,1167,D,7/25/2020 18:39,2020-07-25T18:39:00Z,07/25 14:39,26,161,2020-07-25T18:39:00Z,140442,1572,,,,,139350,114052,,,,,,,,,,,15,71,1191,114052,2247,114052,0,5,bfe86d91513438fdf6231e467ac572ed82f929a7,0,0,0,0,0,
20200725,HI,1549,,111241,,totalTestEncountersViral,137103,29,156,,,,,1148,D,7/24/2020 18:00,2020-07-24T18:00:00Z,07/24 14:00,26,156,2020-07-24T18:00:00Z,138354,1502,,,,,137103,112790,,,,,,,,,,,15,59,1440,112790,1951,112790,0,1,d9aae75e3571e3f00965fc83776226ebc961c5a5,0,0,0,0,0,
20200724,HI,1490,,109801,,totalTestEncountersViral,135152,39,155,,,,,1125,D,7/23/2020 18:00,2020-07-23T18:00:00Z,07/23 14:00,26,155,2020-07-23T18:00:00Z,136008,1445,,,,,135152,111291,,,,,,,,,,,15,55,2423,111291,2412,111291,1,1,6f79e6b3a55883407d9fc538c174014c14bae612,0,0,0,0,0,
20200723,HI,1435,,107378,,totalTestEncountersViral,132740,39,154,,,,,1113,D,7/22/2020 18:00,2020-07-22T18:00:00Z,07/22 14:00,25,154,2020-07-22T18:00:00Z,132361,1399,,,,,132740,108813,,,,,,,,,,,15,17,614,108813,2614,108813,1,3,d956bb6503a6edf0ce21964fe7cb6eec0743e81f,0,0,0,0,0,
20200722,HI,1418,,106764,,totalTestEncountersViral,130126,47,151,,,,,1084,D,7/21/2020 00:00,2020-07-21T00:00:00Z,07/20 20:00,24,151,2020-07-21T00:00:00Z,131371,1374,,,,,130126,108182,,,,,,,,,,,15,25,1374,108182,1668,108182,0,1,0c2136030e68927145cb26073c6b3d09bcd8ec6b,0,0,0,0,0,
20200721,HI,1393,,105390,,totalTestEncountersViral,128458,46,150,,,,,1057,D,7/20/2020 00:00,2020-07-20T00:00:00Z,07/19 20:00,24,150,2020-07-20T00:00:00Z,129510,1348,,,,,128458,106783,,,,,,,,,,,15,12,815,106783,1240,106783,0,0,61b81b01ec55bbd1dd7430e22ae13b837ddbd326,0,0,0,0,0,
20200720,HI,1381,,104575,,totalTestEncountersViral,127218,33,150,,,,,1043,D,7/19/2020 00:00,2020-07-19T00:00:00Z,07/18 20:00,24,150,2020-07-19T00:00:00Z,128374,1336,,,,,127218,105956,,,,,,,,,,,15,27,1294,105956,1983,105956,0,10,eff33cd20538fa853ab9c00e39ef97ba28a91552,0,0,0,0,0,
20200719,HI,1354,,103281,,totalTestEncountersViral,125235,39,140,,,,,1019,D,7/18/2020 18:00,2020-07-18T18:00:00Z,07/18 14:00,24,140,2020-07-18T18:00:00Z,126454,1309,,,,,125235,104635,,,,,,,,,,,15,20,1620,104635,2368,104635,1,1,696b6c85c6586a99d32f88acc15890e6d8d8c0db,0,0,0,0,0,
20200718,HI,1334,,101661,,totalTestEncountersViral,122867,39,139,,,,,994,D,7/17/2020 18:00,2020-07-17T18:00:00Z,07/17 14:00,23,139,2020-07-17T18:00:00Z,124068,1287,,,,,122867,102995,,,,,,,,,,,15,23,1768,102995,2420,102995,1,1,7b436deaa501bd332f857672e33ed0359dcf5790,0,0,0,0,0,
20200717,HI,1311,,99893,,totalTestEncountersViral,120447,39,138,,,,,975,D,7/16/2020 18:00,2020-07-16T18:00:00Z,07/16 14:00,22,138,2020-07-16T18:00:00Z,121512,1267,,,,,120447,101204,,,,,,,,,,,15,19,1798,101204,2417,101204,0,1,74913d7a138085a77d2dbe6b39998816d0ecdebe,0,0,0,0,0,
20200716,HI,1292,,98095,,totalTestEncountersViral,118030,40,137,,,,,951,D,7/15/2020 18:00,2020-07-15T18:00:00Z,07/15 14:00,22,137,2020-07-15T18:00:00Z,118842,1246,,,,,118030,99387,,,,,,,,,,,15,28,1802,99387,2805,99387,0,4,498507a830756fb1412e4182574530abe0a1273a,0,0,0,0,0,
20200715,HI,1264,,96293,,totalTestEncountersViral,115225,31,133,,,,,921,D,7/14/2020 18:00,2020-07-14T18:00:00Z,07/14 14:00,22,133,2020-07-14T18:00:00Z,116275,1219,,,,,115225,97557,,,,,,,,,,,15,21,1466,97557,1724,97557,0,5,30ca495e9ad968623b361b74436c4658e7be9870,0,0,0,0,0,
20200714,HI,1243,,94827,,totalTestEncountersViral,113501,23,128,,,,,911,D,7/13/2020 18:00,2020-07-13T18:00:00Z,07/13 14:00,22,128,2020-07-13T18:00:00Z,114109,1198,,,,,113501,96070,,,,,,,,,,,15,23,877,96070,1200,96070,3,3,9aef8918aa4e2d778019a3c36944a3b822f03283,0,0,0,0,0,
20200713,HI,1220,,93950,,totalTestEncountersViral,112301,,125,,,,,890,D,7/12/2020 00:00,2020-07-12T00:00:00Z,07/11 20:00,19,125,2020-07-12T00:00:00Z,112882,1174,,,,,112301,95170,,,,,,,,,,,15,20,1230,95170,1896,95170,0,0,ef14659bc5a071f609d2de6c3420de3fd054f26c,0,0,0,0,0,
20200712,HI,1200,,92720,,totalTestEncountersViral,110405,,125,,,,,872,D,7/11/2020 18:00,2020-07-11T18:00:00Z,07/11 14:00,19,125,2020-07-11T18:00:00Z,111318,1154,,,,,110405,93920,,,,,,,,,,,15,42,1644,93920,1999,93920,0,0,9cba3bb3c37356ff1c22c2af827d4bed965562ba,0,0,0,0,0,
20200711,HI,1158,,91076,,totalTestEncountersViral,108406,,125,,,,,847,D,7/10/2020 18:00,2020-07-10T18:00:00Z,07/10 14:00,19,125,2020-07-10T18:00:00Z,109096,1114,,,,,108406,92234,,,,,,,,,,,15,28,1611,92234,1975,92234,0,2,9ef6ee39abfbab07df94beea5c512eb9167c5a80,0,0,0,0,0,
20200710,HI,1130,,89465,,totalTestEncountersViral,106431,,123,,,,,840,D,7/9/2020 18:00,2020-07-09T18:00:00Z,07/09 14:00,19,123,2020-07-09T18:00:00Z,107009,1086,,,,,106431,90595,,,,,,,,,,,15,36,1407,90595,2245,90595,0,1,05a223311f57c8788e73cbfd85b76016061b0c73,0,0,0,0,0,
20200709,HI,1094,,88058,,totalTestEncountersViral,104186,,122,,,,,811,D,7/8/2020 18:00,2020-07-08T18:00:00Z,07/08 14:00,19,122,2020-07-08T18:00:00Z,105290,1053,,,,,104186,89152,,,,,,,,,,,15,23,2033,89152,2068,89152,0,3,17387407a169644e1f954082795eb71a3505f65d,0,0,0,0,0,
20200708,HI,1071,,86025,,totalTestEncountersViral,102118,,119,,,,,797,D,7/7/2020 18:00,2020-07-07T18:00:00Z,07/07 14:00,19,119,2020-07-07T18:00:00Z,102674,1032,,,,,102118,87096,,,,,,,,,,,15,41,1382,87096,1539,87096,0,0,f2aa57e385530ff1bc0bc57bb84411e134960ae0,0,0,0,0,0,
20200707,HI,1030,,84643,,totalTestEncountersViral,100579,,119,,,,,781,D,7/6/2020 18:00,2020-07-06T18:00:00Z,07/06 14:00,19,119,2020-07-06T18:00:00Z,100888,993,,,,,100579,85673,,,,,,,,,,,15,7,608,85673,666,85673,0,1,15c3e3bf514958527fdafc81cc8cba6f85ecf89f,0,0,0,0,0,
20200706,HI,1023,,84035,,totalTestEncountersViral,99913,,118,,,,,777,D,7/5/2020 18:00,2020-07-05T18:00:00Z,07/05 14:00,19,118,2020-07-05T18:00:00Z,100110,983,,,,,99913,85058,,,,,,,,,,,15,24,709,85058,1135,85058,0,0,0b6814ed541b2fc5ae8b5be9353331b71393b5b5,0,0,0,0,0,
20200705,HI,999,,83326,,totalTestEncountersViral,98778,,118,,,,,756,D,7/4/2020 18:00,2020-07-04T18:00:00Z,07/04 14:00,19,118,2020-07-04T18:00:00Z,99282,958,,,,,98778,84325,,,,,,,,,,,15,24,825,84325,1424,84325,0,0,6527d5ea6b7cb4106b09ee09bc07e64f94fa018b,0,0,0,0,0,
20200704,HI,975,,82501,,totalTestEncountersViral,97354,,118,,,,,754,D,7/3/2020 18:00,2020-07-03T18:00:00Z,07/03 14:00,19,118,2020-07-03T18:00:00Z,98278,935,,,,,97354,83476,,,,,,,,,,,15,29,1829,83476,1963,83476,1,2,9aee384579459738ce144f398e0e3727c50abffc,0,0,0,0,0,
20200703,HI,946,,80672,,totalTestEncountersViral,95391,,116,,,,,746,D,7/2/2020 18:00,2020-07-02T18:00:00Z,07/02 14:00,18,116,2020-07-02T18:00:00Z,95866,904,,,,,95391,81618,,,,,,,,,,,15,20,1308,81618,1698,81618,0,0,65e16ddd5f4cf7058f6883b7b313014fc71d43f1,0,0,0,0,0,
20200702,HI,926,,79364,,totalTestEncountersViral,93693,,116,,,,,741,D,7/1/2020 18:00,2020-07-01T18:00:00Z,07/01 14:00,18,116,2020-07-01T18:00:00Z,94160,887,,,,,93693,80290,,,,,,,,,,,15,9,1223,80290,2001,80290,0,3,cb3699048e4bb216b39d1c06a5e17042c4e29cae,0,0,0,0,0,
20200701,HI,917,,78141,,totalTestEncountersViral,91692,,113,,,,,736,D,6/30/2020 18:00,2020-06-30T18:00:00Z,06/30 14:00,18,113,2020-06-30T18:00:00Z,92225,878,,,,,91692,79058,,,,,,,,,,,15,17,1298,79058,1454,79058,0,2,0110174f37f327bb99adc84ed5e0719b7359da1d,0,0,0,0,0,
20200630,HI,900,,76843,,totalTestEncountersViral,90238,,111,,,,,722,D,6/29/2020 18:00,2020-06-29T18:00:00Z,06/29 14:00,18,111,2020-06-29T18:00:00Z,90577,860,,,,,90238,77743,,,,,,,,,,,15,1,587,77743,880,77743,0,0,1978a3a2555209d80e0a0acd89bcf078969f2efb,0,0,0,0,0,
20200629,HI,899,,76256,,totalTestEncountersViral,89358,,111,,,,,719,D,6/28/2020 18:00,2020-06-28T18:00:00Z,06/28 14:00,18,111,2020-06-28T18:00:00Z,89866,859,,,,,89358,77155,,,,,,,,,,,15,27,1650,77155,1901,77155,0,1,f7b012c186e8a3b96f57c93254c0d571d3725a86,0,0,0,0,0,
20200628,HI,872,,74606,,totalTestEncountersViral,87457,,110,,,,,714,D,6/27/2020 18:00,2020-06-27T18:00:00Z,06/27 14:00,18,110,2020-06-27T18:00:00Z,87882,833,,,,,87457,75478,,,,,,,,,,,15,6,1171,75478,1457,75478,1,1,1a82faa29885e491a4c1c72a2052332beb41b085,0,0,0,0,0,
20200627,HI,866,,73435,,totalTestEncountersViral,86000,,109,,,,,705,D,6/26/2020 18:00,2020-06-26T18:00:00Z,06/26 14:00,17,109,2020-06-26T18:00:00Z,86464,828,,,,,86000,74301,,,,,,,,,,,15,16,1280,74301,1630,74301,0,0,6007f0530cf07a3bc0a24ae1224183c6f2c51e48,0,0,0,0,0,
20200626,HI,850,,72155,,totalTestEncountersViral,84370,,109,,,,,696,D,6/25/2020 18:00,2020-06-25T18:00:00Z,06/25 14:00,17,109,2020-06-25T18:00:00Z,84910,812,,,,,84370,73005,,,,,,,,,,,15,15,1055,73005,1569,73005,0,4,a4da3e72b23b2fa38565c326424cd370a19194a2,0,0,0,0,0,
20200625,HI,835,,71100,,totalTestEncountersViral,82801,,105,,,,,686,D,6/24/2020 18:00,2020-06-24T18:00:00Z,06/24 14:00,17,105,2020-06-24T18:00:00Z,83301,793,,,,,82801,71935,,,,,,,,,,,15,16,1380,71935,2046,71935,0,1,12bb33dd47dfdb36596fd45bad675ea4e200656d,0,0,0,0,0,
20200624,HI,819,,69720,,totalTestEncountersViral,80755,,104,,,,,673,D,6/23/2020 18:00,2020-06-23T18:00:00Z,06/23 14:00,17,104,2020-06-23T18:00:00Z,81648,782,,,,,80755,70539,,,,,,,,,,,15,3,1196,70539,1275,70539,0,5,8ef8873b6196bc2e7eada96fbbc58153b2820c59,0,0,0,0,0,
20200623,HI,816,,68524,,totalTestEncountersViral,79480,,99,,,,,669,D,6/22/2020 18:00,2020-06-22T18:00:00Z,06/22 14:00,17,99,2020-06-22T18:00:00Z,80394,778,,,,,79480,69340,,,,,,,,,,,15,2,627,69340,707,69340,0,2,b42d5afd6daf35725aa0cd8878e30d2cdbbfd093,0,0,0,0,0,
20200622,HI,814,,67897,,totalTestEncountersViral,78773,,97,,,,,651,D,6/21/2020 18:00,2020-06-21T18:00:00Z,06/21 14:00,17,97,2020-06-21T18:00:00Z,79795,774,,,,,78773,68711,,,,,,,,,,,15,11,840,68711,1436,68711,0,1,d3e3bb9cd064ddcd69d4e2a26694fb5c91445928,0,0,0,0,0,
20200621,HI,803,,67057,,totalTestEncountersViral,77337,,96,,,,,644,D,6/20/2020 18:00,2020-06-20T18:00:00Z,06/20 14:00,17,96,2020-06-20T18:00:00Z,78744,765,,,,,77337,67860,,,,,,,,,,,15,14,1112,67860,1282,67860,0,0,4f6a8077911ecbdf39f73f5d5b94fdb61ca8c260,0,0,0,0,0,
20200620,HI,789,,65945,,totalTestEncountersViral,76055,,96,,,,,642,D,6/19/2020 18:00,2020-06-19T18:00:00Z,06/19 14:00,17,96,2020-06-19T18:00:00Z,77620,753,,,,,76055,66734,,,,,,,,,,,15,27,963,66734,1361,66734,0,1,88251e70a1df5f1e9b1ff7e9a1b58a24342f1948,0,0,0,0,0,
20200619,HI,762,,64982,,totalTestEncountersViral,74694,,95,,,,,640,D,6/18/2020 18:00,2020-06-18T18:00:00Z,06/18 14:00,17,95,2020-06-18T18:00:00Z,76340,727,,,,,74694,65744,,,,,,,,,,,15,18,1352,65744,1890,65744,0,0,c96b629ce58ea0d611e34767908fc77debb71cbd,0,0,0,0,0,
20200618,HI,744,,63630,,totalTestEncountersViral,72804,,95,,,,,639,D,6/17/2020 18:00,2020-06-17T18:00:00Z,06/17 14:00,17,95,2020-06-17T18:00:00Z,74533,709,,,,,72804,64374,,,,,,,,,,,15,4,1127,64374,1452,64374,0,3,70acb27c24b271bd37cd402c43884a2a5b5da785,0,0,0,0,0,
20200617,HI,740,,62503,,totalTestEncountersViral,71352,,92,,,,,637,D,6/16/2020 18:00,2020-06-16T18:00:00Z,06/16 14:00,17,92,2020-06-16T18:00:00Z,73078,703,,,,,71352,63243,,,,,,,,,,,15,4,1211,63243,1198,63243,0,1,cbce10c7e8717fac5b7770fbc0c37d9c24d95190,0,0,0,0,0,
20200616,HI,736,,61292,,totalTestEncountersViral,70154,,91,,,,,630,D,6/15/2020 18:00,2020-06-15T18:00:00Z,06/15 14:00,17,91,2020-06-15T18:00:00Z,71575,699,,,,,70154,62028,,,,,,,,,,,15,8,546,62028,671,62028,0,0,27094501a67853035963fe46422071f49cc837d6,0,0,0,0,0,
20200615,HI,728,,60746,,totalTestEncountersViral,69483,,91,,,,,629,D,6/14/2020 18:00,2020-06-14T18:00:00Z,06/14 14:00,17,91,2020-06-14T18:00:00Z,70877,691,,,,,69483,61474,,,,,,,,,,,15,5,1147,61474,1202,61474,0,2,e20a30c3d80f748a318ba4230fd0888e7695f221,0,0,0,0,0,
20200614,HI,723,,59599,,totalTestEncountersViral,68281,,89,,,,,628,D,6/13/2020 18:00,2020-06-13T18:00:00Z,06/13 14:00,17,89,2020-06-13T18:00:00Z,69512,675,,,,,68281,60322,,,,,,,,,,,15,17,967,60322,1205,60322,0,2,aff14a3eb300b568f7a9feb0ce7682a27d09b477,0,0,0,0,0,
20200613,HI,706,,58632,,totalTestEncountersViral,67076,,87,,,,,627,D,6/12/2020 18:00,2020-06-12T18:00:00Z,06/12 14:00,17,87,2020-06-12T18:00:00Z,68738,659,,,,,67076,59338,,,,,,,,,,,15,14,745,59338,949,59338,0,1,92f9340351d3c526127ab03c04c1a35ee60ae727,0,0,0,0,0,
20200612,HI,692,,57887,,totalTestEncountersViral,66127,,86,,,,,623,D,6/11/2020 18:00,2020-06-11T18:00:00Z,06/11 14:00,17,86,2020-06-11T18:00:00Z,67392,655,,,,,66127,58579,,,,,,,,,,,15,7,1277,58579,1464,58579,0,1,9cd9523a510f6cde5d114df739dc21a01e35375f,0,0,0,0,0,
20200611,HI,685,,56610,,totalTestEncountersViral,64663,,85,,,,,622,D,6/10/2020 18:00,2020-06-10T18:00:00Z,06/10 14:00,17,85,2020-06-10T18:00:00Z,65852,649,,,,,64663,57295,,,,,,,,,,,15,3,1119,57295,1508,57295,0,1,74b158ad9615d7d6644fe48b7632d2be48ad4104,0,0,0,0,0,
20200610,HI,682,,55491,,totalTestEncountersViral,63155,,84,,,,,621,D,6/9/2020 18:00,2020-06-09T18:00:00Z,06/09 14:00,17,84,2020-06-09T18:00:00Z,64501,644,,,,,63155,56173,,,,,,,,,,,15,6,693,56173,895,56173,0,0,244324332014232f0949a433d31778b5d46e683f,0,0,0,0,0,
20200609,HI,676,,54798,,totalTestEncountersViral,62260,,84,,,,,618,D,6/8/2020 18:00,2020-06-08T18:00:00Z,06/08 14:00,17,84,2020-06-08T18:00:00Z,63533,638,,,,,62260,55474,,,,,,,,,,,15,1,326,55474,611,55474,0,0,770e5d970e2d8644303cde6fcfbbf74e855d8a4e,0,0,0,0,0,
20200608,HI,675,,54472,,totalTestEncountersViral,61649,,84,,,,,617,D,6/7/2020 18:00,2020-06-07T18:00:00Z,06/07 14:00,17,84,2020-06-07T18:00:00Z,63259,637,,,,,61649,55147,,,,,,,,,,,15,2,1090,55147,945,55147,0,1,e788896e46a4fdfae08d57f3ed6ac26b948f3f64,0,0,0,0,0,
20200607,HI,673,,53382,,totalTestEncountersViral,60704,,83,,,,,616,D,6/6/2020 18:00,2020-06-06T18:00:00Z,06/06 14:00,17,83,2020-06-06T18:00:00Z,62005,636,,,,,60704,,,,,,,,,,,,15,9,789,54055,1031,54055,0,0,49e8ed9e1a8c178857b564c1c85ef7bf26f5e438,0,0,0,0,0,
20200606,HI,664,,52593,,totalTestEncountersViral,59673,,83,,,,,614,D,6/5/2020 18:00,2020-06-05T18:00:00Z,06/05 14:00,17,83,2020-06-05T18:00:00Z,60985,626,,,,,59673,,,,,,,,,,,,15,9,912,53257,1137,53257,0,0,0e6dba97a684f7e1b780d8b739196ae78a357172,0,0,0,0,0,
20200605,HI,655,,51681,,totalTestEncountersViral,58536,,83,,,,,611,D,6/4/2020 18:00,2020-06-04T18:00:00Z,06/04 14:00,17,83,2020-06-04T18:00:00Z,59842,622,,,,,58536,,,,,,,,,,,,15,2,1696,52336,1790,52336,0,0,4008886640e337ee62f5d7bb666faffd70c9581e,0,0,0,0,0,
20200604,HI,653,,49985,,totalTestEncountersViral,56746,,83,,,,,612,D,6/3/2020 18:00,2020-06-03T18:00:00Z,06/03 14:00,17,83,2020-06-03T18:00:00Z,57942,621,,,,,56746,,,,,,,,,,,,15,0,1130,50638,1301,50638,0,0,fd74726ab39c6d866a86fd32a7dc72b991b4ee7e,0,0,0,0,0,
20200603,HI,653,,48855,,totalTestEncountersViral,55445,,83,,,,,609,D,6/2/2020 18:00,2020-06-02T18:00:00Z,06/02 14:00,17,83,2020-06-02T18:00:00Z,56569,620,,,,,55445,,,,,,,,,,,,15,1,586,49508,817,49508,0,0,48b3fe69447f81aac805fdd193289bb03db014ff,0,0,0,0,0,
20200602,HI,652,,48269,,totalTestEncountersViral,54628,,83,,,,,608,D,6/1/2020 18:00,2020-06-01T18:00:00Z,06/01 14:00,17,83,2020-06-01T18:00:00Z,55719,620,,,,,54628,,,,,,,,,,,,15,0,434,48921,524,48921,0,0,f5ea8e96d387e71e6d8e1aaebe8ac66a7944a0a2,0,0,0,0,0,
20200601,HI,652,,47835,,totalTestEncountersViral,54104,,83,,,,,608,D,5/31/2020 18:00,2020-05-31T18:00:00Z,05/31 14:00,17,83,2020-05-31T18:00:00Z,55336,620,,,,,54104,,,,,,,,,,,,15,1,-6134,48487,725,48487,0,0,7b76c6d8d42f30e69048321b5bf782d017126238,0,0,0,0,0,
20200531,HI,651,,53969,,totalTestEncountersViral,53379,,83,,,,,606,D,5/30/2020 18:00,2020-05-30T18:00:00Z,05/30 14:00,17,83,2020-05-30T18:00:00Z,54620,618,,,,,53379,,,,,,,,,,,,15,2,604,54620,829,54620,0,0,25e91005207069c4cb271ab915a4d4e0779caea2,0,0,0,0,0,
20200530,HI,649,,53365,,totalTestEncountersViral,52550,,83,,,,,605,D,5/29/2020 18:00,2020-05-29T18:00:00Z,05/29 14:00,17,83,2020-05-29T18:00:00Z,54014,616,,,,,52550,,,,,,,,,,,,15,2,1188,54014,980,54014,0,0,f01021c0abc5ef689a413737f696f33372448b82,0,0,0,0,0,
20200529,HI,647,,52177,,totalTestEncountersViral,51570,,83,,,,,604,D,5/28/2020 00:00,2020-05-28T00:00:00Z,05/27 20:00,17,83,2020-05-28T00:00:00Z,52824,613,,,,,51570,,,,,,,,,,,,15,3,982,52824,898,52824,0,0,4bc44f6917382ce2acca748c66373f6e661404dc,0,0,0,0,0,
20200528,HI,644,,51195,,totalTestEncountersViral,50672,,83,,,,,600,D,5/27/2020 18:00,2020-05-27T18:00:00Z,05/27 14:00,17,83,2020-05-27T18:00:00Z,51839,611,,,,,50672,,,,,,,,,,,,15,1,636,51839,610,51839,0,0,a7e02c285540869dccac16b40768b49ef03b0393,0,0,0,0,0,
20200527,HI,643,,50559,,totalTestEncountersViral,50062,,83,,,,,593,D,5/26/2020 00:00,2020-05-26T00:00:00Z,05/25 20:00,17,83,2020-05-26T00:00:00Z,51202,610,,,,,50062,,,,,,,,,,,,15,0,831,51202,454,51202,0,-1,e0418d1c1d8016cb2c5473dbd1757e62900e1522,0,0,0,0,0,
20200526,HI,643,,49728,,totalTestEncountersViral,49608,,84,,,,,592,C,5/25/2020 18:00,2020-05-25T18:00:00Z,05/25 14:00,17,84,2020-05-25T18:00:00Z,50371,610,,,,,49608,,,,,,,,,,,,15,0,0,50371,445,50371,0,0,f2204d2ec447b6478c0557f309a87ba660b39bf4,0,0,0,0,0,
20200525,HI,643,,49728,,totalTestEncountersViral,49163,,84,,,,,591,C,5/24/2020 18:00,2020-05-24T18:00:00Z,05/24 14:00,17,84,2020-05-24T18:00:00Z,50371,610,,,,,49163,,,,,,,,,,,,15,0,799,50371,724,50371,0,0,bd3c35b8406ddc6310f308a8c26e87af7ed271b4,0,0,0,0,0,
20200524,HI,643,,48929,,totalTestEncountersViral,48439,,84,,,,,589,C,5/23/2020 18:00,2020-05-23T18:00:00Z,05/23 14:00,17,84,2020-05-23T18:00:00Z,49572,610,,,,,48439,,,,,,,,,,,,15,1,750,49572,846,49572,0,0,1a86eed225c3ef0a51508acf41bb280d01a938c6,0,0,0,0,0,
20200523,HI,642,,48179,,totalTestEncountersViral,47593,,84,,,,,585,C,5/22/2020 18:00,2020-05-22T18:00:00Z,05/22 14:00,17,84,2020-05-22T18:00:00Z,48821,610,,,,,47593,,,,,,,,,,,,15,-5,841,48821,738,48821,0,1,0c72b9c4e760b17e7801affd6bba613d87ed6fe5,0,0,0,0,0,
20200522,HI,647,,47338,,totalTestEncountersViral,46855,,83,,,,,579,C,5/21/2020 00:00,2020-05-21T00:00:00Z,05/20 20:00,17,83,2020-05-21T00:00:00Z,,610,,,,,46855,47985,,,,,,,,,,,15,4,832,47985,886,47985,0,1,ecea75e42dff612bab8bdd92cab05938dabf2575,0,0,0,0,0,
20200521,HI,643,,46506,,totalTestEncountersViral,45969,,82,,,,,578,C,5/20/2020 18:00,2020-05-20T18:00:00Z,05/20 14:00,17,82,2020-05-20T18:00:00Z,,606,,,,,45969,47149,,,,,,,,,,,15,2,843,47149,1033,47149,0,0,6d47fdcba2bfe439715b6f0aafb80e2b342bc86b,0,0,0,0,0,
20200520,HI,641,,45663,,totalTestEncountersViral,44936,,82,,,,,578,C,5/19/2020 18:00,2020-05-19T18:00:00Z,05/19 14:00,17,82,2020-05-19T18:00:00Z,,606,,,,,44936,46304,,,,,,,,,,,15,1,1280,46304,836,46304,0,0,acf05f4892cc04fe18900bdf06933b582c6acad3,0,0,0,0,0,
20200519,HI,640,,44383,,totalTestEncountersViral,44100,,82,,,,,574,B,5/17/2020 00:00,2020-05-17T00:00:00Z,05/16 20:00,17,82,2020-05-17T00:00:00Z,,604,,,,,44100,45023,,,,,,,,,,,15,0,2978,45023,478,45023,0,0,0c17915dfe4f3615e02a8c43f3c76fd0b62e9a92,0,0,0,0,0,
20200518,HI,640,,41405,,totalTestEncountersViral,43622,,82,,,,,573,B,5/17/2020 00:00,2020-05-17T00:00:00Z,05/16 20:00,17,82,2020-05-17T00:00:00Z,,604,,,,,43622,42524,,,,,,,,,,,15,1,370,42045,717,42045,0,0,f49aec8107936b39163ce372dd23029ad9809b8d,0,0,0,0,0,
20200517,HI,639,,41035,,totalTestEncountersViral,42905,,82,,,,,572,B,5/16/2020 18:00,2020-05-16T18:00:00Z,05/16 14:00,17,82,2020-05-16T18:00:00Z,,601,,,,,42905,41778,,,,,,,,,,,15,1,790,41674,745,41674,0,1,977575070d70bfeff3a98043c78facf8ba6c2ecd,0,0,0,0,0,
20200516,HI,638,,40245,,totalTestEncountersViral,42160,,81,,,,,565,B,5/15/2020 18:00,2020-05-15T18:00:00Z,05/15 14:00,17,81,2020-05-15T18:00:00Z,,600,,,,,42160,40990,,,,,,,,,,,15,1,2106,40883,739,40883,0,0,aefb56a8431d700a9e3b795aae7472335b3a2dd9,0,0,0,0,0,
20200515,HI,637,,38139,,totalTestEncountersViral,41421,,81,,,,,564,B,5/14/2020 18:00,2020-05-14T18:00:00Z,05/14 14:00,17,81,2020-05-14T18:00:00Z,,600,,,,,41421,39767,,,,,,,,,,,15,-1,-104,38776,832,38776,0,0,86907666555781628ff888ca92a185ca779fecec,0,0,0,0,0,
20200514,HI,638,,38243,,totalTestEncountersViral,40589,,81,,,,,563,B,5/13/2020 18:00,2020-05-13T18:00:00Z,05/13 14:00,17,81,2020-05-13T18:00:00Z,,599,,,,,40589,38467,,,,,,,,,,,15,3,513,38881,756,38881,0,0,6bfcda0c98812172d9ba2732b374cdf854964b3e,0,0,0,0,0,
20200513,HI,635,,37730,,totalTestEncountersViral,39833,,81,,,,,563,B,5/12/2020 18:00,2020-05-12T18:00:00Z,05/12 14:00,17,81,2020-05-12T18:00:00Z,,596,,,,,39833,38042,,,,,,,,,,,15,1,425,38365,641,38365,0,0,7a48e9e743dc21c300e768e98c17f55e1353276e,0,0,0,0,0,
20200512,HI,634,,37305,,totalTestEncountersViral,39192,,81,,,,,561,B,5/11/2020 18:00,2020-05-11T18:00:00Z,05/11 14:00,17,81,2020-05-11T18:00:00Z,,595,,,,,39192,,,,,,,,,,,,15,2,254,37939,270,37939,0,0,4ff5eeeaed0b28afa4005d8d8bcbdf58c15c4c1d,0,0,0,0,0,
20200511,HI,632,,37051,,totalTestEncountersViral,38922,,81,,,,,561,B,5/10/2020 18:00,2020-05-10T18:00:00Z,05/10 14:00,17,81,2020-05-10T18:00:00Z,,593,,,,,38922,,,,,,,,,,,,15,1,412,37683,685,37683,0,0,214823a9c8bf6ce67749ea6dcf3f4aea934bf1a1,0,0,0,0,0,
20200510,HI,631,,36639,,totalTestEncountersViral,38237,,81,,,,,551,B,5/9/2020 18:00,2020-05-09T18:00:00Z,05/09 14:00,17,81,2020-05-09T18:00:00Z,,592,,,,,38237,,,,,,,,,,,,15,2,1006,37270,569,37270,0,0,063eb8228ea4f5ce7843923f0306aa1608b51b55,0,0,0,0,0,
20200509,HI,629,,35633,,totalTestEncountersViral,37668,,81,,,,,566,C,5/8/2020 00:00,2020-05-08T00:00:00Z,05/07 20:00,17,81,2020-05-08T00:00:00Z,,589,,,,,37668,,,,,,,,,,,,15,0,-356,36262,670,36262,0,7,f0c51094eb7f58f7b061d969dc3e6f46be207b4c,0,0,0,0,0,
20200508,HI,629,,35989,,totalTestEncountersViral,36998,,74,,,,,565,B,5/7/2020 00:00,2020-05-07T00:00:00Z,05/06 20:00,17,74,2020-05-07T00:00:00Z,,588,,,,,36998,,,,,,,,,,,,15,3,1074,36618,686,36618,0,0,7cf85cea80555dd57119f108580c216d91c1bc2f,0,0,0,0,0,
20200507,HI,626,,34915,,totalTestEncountersViral,36312,,74,,,,,558,B,5/6/2020 18:00,2020-05-06T18:00:00Z,05/06 14:00,17,74,2020-05-06T18:00:00Z,,586,,,,,36312,,,,,,,,,,,,15,1,341,35541,587,35541,0,1,f3d6d6b84de03a412126a2e8b9dc02b0c328a7cd,0,0,0,0,0,
20200506,HI,625,,34574,,totalTestEncountersViral,35725,,73,,,,,551,B,5/5/2020 18:00,2020-05-05T18:00:00Z,05/05 14:00,17,73,2020-05-05T18:00:00Z,,584,,,,,35725,,,,,,,,,,,,15,4,1196,35199,863,35199,0,0,6ddf1e13079e502631fdd53e0077106c1a919c45,0,0,0,0,0,
20200505,HI,621,,33378,,totalTestEncountersViral,34862,,73,,,,,548,B,5/4/2020 18:00,2020-05-04T18:00:00Z,05/04 14:00,17,73,2020-05-04T18:00:00Z,,580,,,,,34862,,,,,,,,,,,,15,1,132,33999,498,33999,0,0,0e6bf8538582b67ad39672d3febed2eb56393508,0,0,0,0,0,
20200504,HI,620,,33246,,totalTestEncountersViral,34364,,73,,,,,544,B,5/3/2020 18:00,2020-05-03T18:00:00Z,05/03 14:00,17,73,2020-05-03T18:00:00Z,,579,,,,,34364,,,,,,,,,,,,15,0,916,33866,510,33866,1,1,13586e6bce0d49ee6f1419a90a038e4f7ed24939,0,0,0,0,0,
20200503,HI,620,,32330,,totalTestEncountersViral,33854,,72,,,,,541,B,5/2/2020 00:00,2020-05-02T00:00:00Z,05/01 20:00,16,72,2020-05-02T00:00:00Z,,576,,,,,33854,,,,,,,,,,,,15,1,964,32950,614,32950,0,0,f02f9a60fce083ea75a5e214aeaac8b8348815a7,0,0,0,0,0,
20200502,HI,619,,31366,,totalTestEncountersViral,33240,,72,,,,,532,B,5/1/2020 00:00,2020-05-01T00:00:00Z,04/30 20:00,16,72,2020-05-01T00:00:00Z,,576,,,,,33240,,,,,,,,,,,,15,1,890,31985,867,31985,0,2,33f7ac4ffab85d9e44fe9e4c237cd783297b895c,0,0,0,0,0,
20200501,HI,618,,30476,,totalTestEncountersViral,32373,,70,,,,,526,B,4/30/2020 00:00,2020-04-30T00:00:00Z,04/29 20:00,16,70,2020-04-30T00:00:00Z,,571,,,,,32373,,,,,,,,,,,,15,5,449,31094,736,31094,0,1,0a62c21d1e62e2e6260587c6d8ce6c4faeb23c77,0,0,0,0,0,
20200430,HI,613,,30027,,totalTestEncountersViral,31637,,69,,,,,516,B,4/29/2020 18:00,2020-04-29T18:00:00Z,04/29 14:00,16,69,2020-04-29T18:00:00Z,,567,,,,,31637,,,,,,,,,,,,15,4,1018,30640,1324,30640,0,0,a5e34b59417c883c8918e5b66812bb2d606854de,0,0,0,0,0,
20200429,HI,609,,29009,,totalTestEncountersViral,30313,,69,,,,,505,B,4/28/2020 18:00,2020-04-28T18:00:00Z,04/28 14:00,16,69,2020-04-28T18:00:00Z,,562,27632,,,,30313,,,,,,,,,,,,15,2,433,29618,306,29618,0,1,b46b398bb8a895761c0c1571103966a6d875f54d,0,0,0,0,0,
20200428,HI,607,,28576,,totalTestEncountersViral,30007,,68,,,,,493,C,4/27/2020 18:00,2020-04-27T18:00:00Z,04/27 14:00,16,68,2020-04-27T18:00:00Z,,558,,,,,30007,,,,,,,,,,,,15,1,172,29183,249,29183,2,0,7b458218748102fb2e4f698719adc648f5c6733d,0,0,0,0,0,
20200427,HI,606,,28404,,totalTestEncountersViral,29758,,68,,,,,488,C,4/26/2020 18:00,2020-04-26T18:00:00Z,04/26 14:00,14,68,2020-04-26T18:00:00Z,,557,,,,,29758,,,,,,,,,,,,15,3,524,29010,576,29010,0,0,6973e243963d2ff1a1590f5b91a2434c9d356224,0,0,0,0,0,
20200426,HI,603,,27880,,totalTestEncountersViral,29182,,68,,,,,482,C,4/25/2020 18:00,2020-04-25T18:00:00Z,04/25 14:00,14,68,2020-04-25T18:00:00Z,,554,,,,,29182,,,,,,,,,,,,15,2,441,28483,617,28483,1,1,95f8d90ea36ed96cc5cbcafc2ea03fe4200647d2,0,0,0,0,0,
20200425,HI,601,,27439,,totalTestEncountersViral,28565,,67,,,,,463,C,4/24/2020 18:00,2020-04-24T18:00:00Z,04/24 14:00,13,67,2020-04-24T18:00:00Z,,549,,,,,28565,,,,,,,,,,,,15,5,1148,28040,727,28040,1,4,2c652479d6c8eb5207f5ec8180099191337f6383,0,0,0,0,0,
20200424,HI,596,,26291,,totalTestEncountersViral,27838,,63,,,,,455,A,4/24/2020 18:00,2020-04-24T18:00:00Z,04/24 14:00,12,63,2020-04-24T18:00:00Z,,545,,,,,27838,,,,,,,,,,,,15,4,755,26887,837,26887,0,0,43b7395c96f6685a7aaeccecabcbe2bc26d2d997,0,0,0,0,0,
20200423,HI,592,,25536,,totalTestEncountersViral,27001,,63,,,,,444,A,4/22/2020 18:00,2020-04-22T18:00:00Z,04/22 14:00,12,63,2020-04-22T18:00:00Z,,540,,,,,27001,,,,,,,,,,,,15,6,776,26128,802,26128,0,7,e69fc7e348cf18dbe66dd18dbeb14e557699bfac,0,0,0,0,0,
20200422,HI,586,,24760,,totalTestEncountersViral,26199,,56,,,,,437,A,4/22/2020 18:00,2020-04-22T18:00:00Z,04/22 14:00,12,56,2020-04-22T18:00:00Z,,529,,,,,26199,,,,,,,,,,,,15,2,648,25346,543,25346,2,1,99688d85a08aaf0eb9e17289693f04d6f6c1195d,0,0,0,0,0,
20200421,HI,584,,24112,,totalTestEncountersViral,25656,,55,,,,,423,A,4/21/2020 19:30,2020-04-21T19:30:00Z,04/21 15:30,10,55,2020-04-21T19:30:00Z,,527,,,,,25656,,,,,,,,,,,,15,4,517,24696,647,24696,0,3,c83511f2d14040eb09de939675aa6f462b03d3e3,0,0,0,0,0,
20200420,HI,580,,23595,,totalTestEncountersViral,25009,,52,,,,,414,A,4/19/2020 18:00,2020-04-19T18:00:00Z,04/19 14:00,10,52,2020-04-19T18:00:00Z,,523,,,,,25009,,,,,,,,,,,,15,6,699,24175,913,24175,1,1,8a7ce36b1fc8b52bf643a526f186144891841d3a,0,0,0,0,0,
20200419,HI,574,,22896,,totalTestEncountersViral,24096,,51,,,,,410,A,4/19/2020 18:00,2020-04-19T18:00:00Z,04/19 14:00,9,51,2020-04-19T18:00:00Z,,516,,,,,24096,,,,,,,,,,,,15,21,1106,23470,942,23470,0,3,45360880a3810b254980e815cdc5c22672d49900,0,0,0,0,0,
20200418,HI,553,,21790,,totalTestEncountersViral,23154,,48,,,,,390,A,4/17/2020 18:30,2020-04-17T18:30:00Z,04/17 14:30,9,48,2020-04-17T18:30:00Z,,496,,,,,23154,,,,,,,,,,,,15,12,474,22343,716,22343,0,3,92bb791599362d2284b167e3f0a1464896feaf0f,0,0,0,0,0,
20200417,HI,541,,21316,,totalTestEncountersViral,22438,,45,,,,,374,A,4/17/2020 18:30,2020-04-17T18:30:00Z,04/17 14:30,9,45,2020-04-17T18:30:00Z,,487,,,,,22438,,,,,,,,,,,,15,11,1146,21857,1292,21857,0,0,13678f333658572107c4156cfcbf6ab791a48238,0,0,0,0,0,
20200416,HI,530,,20170,,totalTestEncountersViral,21146,,45,,,,,359,A,4/16/2020 18:00,2020-04-16T18:00:00Z,04/16 14:00,9,45,2020-04-16T18:00:00Z,,478,,,,,21146,,,,,,,,,,,,15,13,884,20700,905,20700,0,0,ced2e1a72145d80d9be2254c08ad8cdb4b468173,0,0,0,0,0,
20200415,HI,517,,19286,,totalTestEncountersViral,20241,,45,,,,,333,A,4/14/2020 18:00,2020-04-14T18:00:00Z,04/14 14:00,9,45,2020-04-14T18:00:00Z,,462,,,,,20241,,,,,,,,,,,,15,13,370,19803,404,19803,0,1,ef5dfdd2ea52d4a58350b09c7efb0053b3f1cd04,0,0,0,0,0,
20200414,HI,504,,18916,,totalTestEncountersViral,19837,,44,,,,,315,A,4/14/2020 18:00,2020-04-14T18:00:00Z,04/14 14:00,9,44,2020-04-14T18:00:00Z,,457,,,,,19837,,,,,,,,,,,,15,5,571,19420,702,19420,0,0,4632ec270d6c9bc8bb53cb095a346e2919bcecbd,0,0,0,0,0,
20200413,HI,499,,18345,,totalTestEncountersViral,19135,,44,,6,,2,310,A,4/13/2020 18:00,2020-04-13T18:00:00Z,04/13 14:00,9,44,2020-04-13T18:00:00Z,,452,,,,,19135,,,,,,,,,,,,15,13,863,18844,867,18844,1,0,a17bb8edfe26f030ae5d7815ee57bdc0b33dbf63,0,0,0,0,0,
20200412,HI,486,,17482,,totalTestEncountersViral,18268,,44,,6,,2,300,A,4/11/2020 18:00,2020-04-11T18:00:00Z,04/11 14:00,8,44,2020-04-11T18:00:00Z,,440,,,,,18268,,,,,,,,,,,,15,21,416,17968,1013,17968,0,1,03434d2c56c9d5879dcf009f17425dfd5781e4c1,0,0,0,0,0,
20200411,HI,465,,17066,,totalTestEncountersViral,17255,,43,,6,,2,284,A,4/10/2020 18:00,2020-04-10T18:00:00Z,04/10 14:00,8,43,2020-04-10T18:00:00Z,,420,,,,,17255,,,,,,,,,,,,15,23,1359,17531,717,17531,2,1,ba34a3fddfc6ccfe0f78f27de75181d224768aca,0,0,0,0,0,
20200410,HI,442,,15707,,totalTestEncountersViral,16538,,42,,6,,2,251,A,4/9/2020 18:00,2020-04-09T18:00:00Z,04/09 14:00,6,42,2020-04-09T18:00:00Z,,410,,,,,16538,,,,,,,,,,,,15,7,391,16149,553,16149,1,0,e00fdcb3875a2af2f9d3ce2eab52104d995517f7,0,0,0,0,0,
20200409,HI,435,,15316,,totalTestEncountersViral,15985,,42,,6,,,113,A,4/8/2020 18:00,2020-04-08T18:00:00Z,04/08 14:00,5,42,2020-04-08T18:00:00Z,,401,,,,,15985,,,,,,,,,,,,15,25,577,15751,756,15751,0,0,3ccea53195e7fb14450c54f430340b428b035ca3,0,0,0,0,0,
20200408,HI,410,,14739,,totalTestEncountersViral,15229,,42,,6,,,113,A,4/7/2020 18:00,2020-04-07T18:00:00Z,04/07 14:00,5,42,2020-04-07T18:00:00Z,,372,,,,,15229,,,,,,,,,,,,15,23,1584,15149,830,15149,0,16,b19babab3df802e406d768f6c7b180814e3901b7,0,0,0,0,0,
20200407,HI,387,,13155,,totalTestEncountersViral,14399,,26,,6,,,89,A,4/6/2020 18:00,2020-04-06T18:00:00Z,04/06 14:00,5,26,2020-04-06T18:00:00Z,,347,,,,,14399,,,,,,,,,,,,15,16,0,13542,701,13542,1,5,0d83c3ea32364ee777dc9eef55721741fb52e2ac,0,0,0,0,0,
20200406,HI,371,,13155,,totalTestEncountersViral,13698,,21,,6,,,85,A,4/5/2020 18:00,2020-04-05T18:00:00Z,04/05 14:00,4,21,2020-04-05T18:00:00Z,,330,,,,,13698,,,,,,,,,,,,15,20,551,13526,450,13526,0,2,4c75f66e4a9c97a0b30d1c93b280d5cb7880fb33,0,0,0,0,0,
20200405,HI,351,,12604,,totalTestEncountersViral,13248,,19,,6,,,82,A,4/4/2020 18:00,2020-04-04T18:00:00Z,04/04 14:00,4,19,2020-04-04T18:00:00Z,,317,,,,,13248,,,,,,,,,,,,15,32,645,12955,760,12955,1,1,44c0ac80b81dfbd0413603f072f8e9a47b211b5c,0,0,0,0,0,
20200404,HI,319,,11959,,totalTestEncountersViral,12488,,18,,6,,,78,A,4/3/2020 18:00,2020-04-03T18:00:00Z,04/03 14:00,3,18,2020-04-03T18:00:00Z,,300,,,,,12488,,,,,,,,,,,,15,34,1753,12278,915,12278,1,3,57b4b85f887cea313229ef0db638f9943d6eeaa1,0,0,0,0,0,
20200403,HI,285,,10206,,totalTestEncountersViral,11573,,15,,6,,,72,A,4/2/2020 18:00,2020-04-02T18:00:00Z,04/02 14:00,2,15,2020-04-02T18:00:00Z,,273,,,,,11573,,,,,,,,,,,,15,27,0,10491,917,10491,1,0,7a70a4145ae118c7e3213e365bafdd6a48b61224,0,0,0,0,0,
20200402,HI,258,,10206,,totalTestEncountersViral,10656,,15,,6,,,69,A,4/1/2020 18:00,2020-04-01T18:00:00Z,04/01 14:00,1,15,2020-04-01T18:00:00Z,,248,,,,,10656,,,,,,,,,,,,15,50,1485,10464,1338,10464,0,2,b21f6f6d2551618dd9f8a5a8a8ec42bc0a46b1f5,0,0,0,0,0,
20200401,HI,208,,8721,,totalTestEncountersViral,9318,,13,,6,,,58,A,3/31/2020 18:00,2020-03-31T18:00:00Z,03/31 14:00,1,13,2020-03-31T18:00:00Z,,219,,,,,9318,,,,,,,,,,,,15,4,250,8929,488,8929,1,1,5713d6534af0a3ef5f377f0c39969f4523c591d8,0,0,0,0,0,
20200331,HI,204,,8471,,totalTestEncountersViral,8830,,12,,6,,,49,A,3/30/2020 18:00,2020-03-30T18:00:00Z,03/30 14:00,,12,2020-03-30T18:00:00Z,,202,,,,,8830,,,,,,,,,,,,15,29,646,8675,685,8675,0,0,c28898f55a73c1a3aff9766ea918000c1013f9ec,0,0,0,0,0,
20200330,HI,175,,7825,,totalTestEncountersViral,8145,,12,,,,,,A,3/29/2020 18:00,2020-03-29T18:00:00Z,03/29 14:00,,12,2020-03-29T18:00:00Z,,175,,,,,8145,,,,,,,,,,,,15,24,976,8000,1190,8000,0,0,915a3e6c9fb468c243112c97ef5a9451e20cb7dd,0,0,0,0,0,
20200329,HI,151,,6849,,totalTestEncountersViral,6955,,12,,,,,,A,3/28/2020 18:00,2020-03-28T18:00:00Z,03/28 14:00,,12,2020-03-28T18:00:00Z,,146,,,,,6955,,,,,,,,,,,,15,31,2492,7000,1158,7000,0,4,12aceb408c23896b23a71dde8885934e09ba760e,0,0,0,0,0,
20200328,HI,120,,4357,,totalTestEncountersViral,5797,,8,,,,,,A,3/27/2020 18:00,2020-03-27T18:00:00Z,03/27 14:00,,8,2020-03-27T18:00:00Z,,118,,,,,5797,,,,,,,,,,,,15,14,0,4477,729,4477,0,1,7d15fd3cd0fcc0a5c71fce8b57eb12f4e6c75091,0,0,0,0,0,
20200327,HI,106,,4357,,totalTestEncountersViral,5068,,7,,,,,,A,3/26/2020 18:00,2020-03-26T18:00:00Z,03/26 14:00,,7,2020-03-26T18:00:00Z,,104,,,,,5068,,,,,,,,,,,,15,11,0,4463,514,4463,0,2,4f67da7629a2036ce226fb4e8d59a1be5f9fd72d,0,0,0,0,0,
20200326,HI,95,,4357,,totalTestEncountersViral,4554,,5,,,,,,A,3/25/2020 18:00,2020-03-25T18:00:00Z,03/25 14:00,,5,2020-03-25T18:00:00Z,,92,,,,,4554,,,,,,,,,,,,15,5,0,4452,337,4452,0,-1,97dc23d3c0986a52adabc7be368fc2abd1158e6e,0,0,0,0,0,
20200325,HI,90,,4357,,totalTestEncountersViral,4217,,6,,,,,,A,3/24/2020 18:00,2020-03-24T18:00:00Z,03/24 14:00,,6,2020-03-24T18:00:00Z,,84,,,,,4217,,,,,,,,,,,,15,13,768,4447,553,4447,0,2,d6c34773d9d6a329814151d2a712778c39186248,0,0,0,0,0,
20200324,HI,77,,3589,,totalTestEncountersViral,3664,,4,,,,,,A,3/23/2020 18:00,2020-03-23T18:00:00Z,03/23 14:00,,4,2020-03-23T18:00:00Z,,69,,,,,3664,,,,,,,,,,,,15,21,634,3666,606,3666,0,4,0f582216577aaa71d81e6bfbf787469a366c0785,0,0,0,0,0,
20200323,HI,56,,2955,,totalTestEncountersViral,3058,,,,,,,,A,3/22/2020 18:00,2020-03-22T18:00:00Z,03/22 14:00,,,2020-03-22T18:00:00Z,,54,,,,,3058,,,,,,,,,,,,15,8,2692,3011,487,3011,0,0,2252a4ecd86146a2d3f1923483799ab037c2132d,0,0,0,0,0,
20200322,HI,48,,263,,totalTestEncountersViral,2571,,,,,,,,,3/21/2020 18:00,2020-03-21T18:00:00Z,03/21 14:00,,,2020-03-21T18:00:00Z,,47,,,,,2571,,,,,,,,,,,,15,11,139,311,762,311,0,0,4108a05a53fb62153b35de3f221cbe79fc97af76,0,0,0,0,0,
20200321,HI,37,,124,,totalTestEncountersViral,1809,,,,,,,,,3/20/2020 18:00,2020-03-20T18:00:00Z,03/20 14:00,,,2020-03-20T18:00:00Z,,37,,,,,1809,,,,,,,,,,,,15,11,0,161,652,161,0,0,f3e6aad4253cc3f266c16c44c1fb3e33669daa40,0,0,0,0,0,
20200320,HI,26,,124,,totalTestEncountersViral,1157,,,,,,,,,3/19/2020 18:00,2020-03-19T18:00:00Z,03/19 14:00,,,2020-03-19T18:00:00Z,,22,,,,,1157,,,,,,,,,,,,15,10,31,150,438,150,0,0,0c4781ded02e3a36c6b31661d9f90e7f4578a237,0,0,0,0,0,
20200319,HI,16,,93,,totalTestEncountersViral,719,,,,,,,,,3/18/2020 18:00,2020-03-18T18:00:00Z,03/18 14:00,,,2020-03-18T18:00:00Z,,15,,,,,719,,,,,,,,,,,,15,2,0,109,233,109,0,0,addfde0c51169fc0460d8ddfca998f076f9335bf,0,0,0,0,0,
20200318,HI,14,,93,,totalTestEncountersViral,486,,,,,,,,,3/17/2020 20:00,2020-03-17T20:00:00Z,03/17 16:00,,,2020-03-17T20:00:00Z,,11,,,,,486,,,,,,,,,,,,15,4,93,107,180,107,0,0,1c09412eeaf78995997acf73d71135d3380b38e0,0,0,0,0,0,
20200317,HI,10,,,,totalTestEncountersViral,306,,,,,,,,,3/16/2020 18:00,2020-03-16T18:00:00Z,03/16 14:00,,,2020-03-16T18:00:00Z,,10,,,,,306,,,,,,,,,,,,15,3,0,10,117,10,0,0,24d170f8e6d65e263e31b4b3b23a363e9161ed89,0,0,0,0,0,
20200316,HI,7,,,,totalTestEncountersViral,189,,,,,,,,,3/16/2020 15:39,2020-03-16T15:39:00Z,03/16 11:39,,,2020-03-16T15:39:00Z,,7,,,,,189,,,,,,,,,,,,15,5,0,7,130,7,0,0,381054f159932c955a8862a6f03547020ded7f66,0,0,0,0,0,
20200315,HI,2,,,,totalTestEncountersViral,59,,,,,,,,,3/13/2020 00:00,2020-03-13T00:00:00Z,03/12 20:00,,,2020-03-13T00:00:00Z,,4,,,,,59,,,,,,,,,,,,15,0,0,2,31,2,0,0,8f48d221f860b86e228ac37c2cfdfb59aa19a55d,0,0,0,0,0,
20200314,HI,2,,,,totalTestEncountersViral,28,,,,,,,,,3/13/2020 00:00,2020-03-13T00:00:00Z,03/12 20:00,,,2020-03-13T00:00:00Z,,2,,,,,28,,,,,,,,,,,,15,0,0,2,7,2,0,0,241b205f01a91c5d0f106829aa038778e91ca37f,0,0,0,0,0,
20200313,HI,2,,,,totalTestEncountersViral,21,,,,,,,,,3/12/2020 00:00,2020-03-12T00:00:00Z,03/11 20:00,,,2020-03-12T00:00:00Z,,2,,,,,21,,,,,,,,,,,,15,0,0,2,5,2,0,0,797be4366e1be6b7e528e350741e3a7d0031d0ae,0,0,0,0,0,
20200312,HI,2,,,,totalTestEncountersViral,16,,,,,,,,,3/11/2020 00:00,2020-03-11T00:00:00Z,03/10 20:00,,,2020-03-11T00:00:00Z,,2,,,,,16,,,,,,,,,,,,15,0,0,2,1,2,0,0,d1f9834a4aac54b8232d548acefb2247319cc35c,0,0,0,0,0,
20200311,HI,2,,,,totalTestEncountersViral,15,,,,,,,,,,,,,,,,2,,,,,15,,,,,,,,,,,,15,0,0,2,3,2,0,0,8d5f705a156279e9b1a47eab9bcfc6db3b7e0050,0,0,0,0,0,
20200310,HI,2,,,,totalTestEncountersViral,12,,,,,,,,,,,,,,,,2,,,,,12,,,,,,,,,,,,15,0,0,2,1,2,0,0,09f5b9858f71abfba4f3e8d1b3f5734f507e983d,0,0,0,0,0,
20200309,HI,2,,,,totalTestEncountersViral,11,,,,,,,,,,,,,,,,1,,,,,11,,,,,,,,,,,,15,1,0,2,2,2,0,0,730a5ac9b26ebeccb882f22ff4d52d31289fc663,0,0,0,0,0,
20200308,HI,1,,,,totalTestEncountersViral,9,,,,,,,,,,,,,,,,1,,,,,9,,,,,,,,,,,,15,0,0,1,2,1,0,0,fe4bde6c849598adbda28649128d588e49071d1e,0,0,0,0,0,
20200307,HI,1,,,,totalTestEncountersViral,7,,,,,,,,,,,,,,,,0,,,,,7,,,,,,,,,,,,15,1,0,1,0,1,0,0,aa119da6ecf34a20d9532eb480b71d250a5cdc97,0,0,0,0,0,
20200306,HI,,,,,totalTestEncountersViral,7,,,,,,,,,,,,,,,,0,,,,,7,,,,,,,,,,,,15,0,0,0,4,0,0,0,5b2674a196e0ad691e3698fef9c16a7b60ac7d95,0,0,0,0,0,
20200305,HI,,,,,totalTestEncountersViral,3,,,,,,,,,,,,,,,,0,,,,,3,,,,,,,,,,,,15,0,0,0,1,0,0,0,64aa84e648bbdd29aa5d8705632f34a01e08d901,0,0,0,0,0,
20200304,HI,,,,,totalTestEncountersViral,2,,,,,,,,,,,,,,,,0,,,,,2,,,,,,,,,,,,15,0,0,0,0,0,0,0,5c654654ce9fcd703a76c92dc3dd2ed971e52e66,0,0,0,0,0,
