[{"date":20201108,"state":"NC","positive":293339,"probableCases":13126,"negative":4071722,"pending":null,"totalTestResultsSource":"posNeg","totalTestResults":4365061,"hospitalizedCurrently":1147,"hospitalizedCumulative":null,"inIcuCurrently":311,"inIcuCumulative":null,"onVentilatorCurrently":null,"onVentilatorCumulative":null,"recovered":246318,"dataQualityGrade":"A+","lastUpdateEt":"11/8/2020 11:00","dateModified":"2020-11-08T11:00:00Z","checkTimeEt":"11/08 06:00","death":4607,"hospitalized":null,"dateChecked":"2020-11-08T11:00:00Z","totalTestsViral":4351935,"positiveTestsViral":null,"negativeTestsViral":null,"positiveCasesViral":280213,"deathConfirmed":4513,"deathProbable":94,"totalTestEncountersViral":null,"totalTestsPeopleViral":null,"totalTestsAntibody":null,"positiveTestsAntibody":null,"negativeTestsAntibody":null,"totalTestsPeopleAntibody":null,"positiveTestsPeopleAntibody":null,"negativeTestsPeopleAntibody":null,"totalTestsPeopleAntigen":null,"positiveTestsPeopleAntigen":null,"totalTestsAntigen":48655,"positiveTestsAntigen":null,"fips":"37","positiveIncrease":2094,"negativeIncrease":38811,"total":4365061,"totalTestResultsIncrease":40905,"posNeg":4365061,"deathIncrease":2,"hospitalizedIncrease":0,"hash":"28b2a4994c85cc6fdcb121d301233382e397fdc3","commercialScore":0,"negativeRegularScore":0,"negativeScore":0,"positiveScore":0,"score":0,"grade":""},{"date":20201107,"state":"NC","positive":291245,"probableCases":13045,"negative":4032911,"pending":null,"totalTestResultsSource":"posNeg","totalTestResults":4324156,"hospitalizedCurrently":1196,"hospitalizedCumulative":null,"inIcuCurrently":327,"inIcuCumulative":null,"onVentilatorCurrently":null,"onVentilatorCumulative":null,"recovered":246318,"dataQualityGrade":"A+","lastUpdateEt":"11/7/2020 11:20","dateModified":"2020-11-07T11:20:00Z","checkTimeEt":"11/07 06:20","death":4605,"hospitalized":null,"dateChecked":"2020-11-07T11:20:00Z","totalTestsViral":4311111,"positiveTestsViral":null,"negativeTestsViral":null,"positiveCasesViral":278200,"deathConfirmed":4511,"deathProbable":94,"totalTestEncountersViral":null,"totalTestsPeopleViral":null,"totalTestsAntibody":null,"positiveTestsAntibody":null,"negativeTestsAntibody":null,"totalTestsPeopleAntibody":null,"positiveTestsPeopleAntibody":null,"negativeTestsPeopleAntibody":null,"totalTestsPeopleAntigen":null,"positiveTestsPeopleAntigen":null,"totalTestsAntigen":47403,"positiveTestsAntigen":null,"fips":"37","positiveIncrease":2676,"negativeIncrease":44104,"total":4324156,"totalTestResultsIncrease":46780,"posNeg":4324156,"deathIncrease":23,"hospitalizedIncrease":0,"hash":"721f4c125cd38cc0faa0bfc7a2246f963d5b570e","commercialScore":0,"negativeRegularScore":0,"negativeScore":0,"positiveScore":0,"score":0,"grade":""},{"date":20201106,"state":"NC","positive":288569,"probableCases":12779,"negative":3988807,"pending":null,"totalTestResultsSource":"posNeg","totalTestResults":4277376,"hospitalizedCurrently":1161,"hospitalizedCumulative":null,"inIcuCurrently":311,"inIcuCumulative":null,"onVentilatorCurrently":null,"onVentilatorCumulative":null,"recovered":246318,"dataQualityGrade":"A+","lastUpdateEt":"11/6/2020 11:20","dateModified":"2020-11-06T11:20:00Z","checkTimeEt":"11/06 06:20","death":4582,"hospitalized":null,"dateChecked":"2020-11-06T11:20:00Z","totalTestsViral":4264597,"positiveTestsViral":null,"negativeTestsViral":null,"positiveCasesViral":275790,"deathConfirmed":4489,"deathProbable":93,"totalTestEncountersViral":null,"totalTestsPeopleViral":null,"totalTestsAntibody":null,"positiveTestsAntibody":null,"negativeTestsAntibody":null,"totalTestsPeopleAntibody":null,"positiveTestsPeopleAntibody":null,"negativeTestsPeopleAntibody":null,"totalTestsPeopleAntigen":null,"positiveTestsPeopleAntigen":null,"totalTestsAntigen":45126,"positiveTestsAntigen":null,"fips":"37","positiveIncrease":2908,"negativeIncrease":47526,"total":4277376,"totalTestResultsIncrease":50434,"posNeg":4277376,"deathIncrease":34,"hospitalizedIncrease":0,"hash":"b388d48dda6d778d1411a4eed4313b048f21efe6","commercialScore":0,"negativeRegularScore":0,"negativeScore":0,"positiveScore":0,"score":0,"grade":""},{"date":20201105,"state":"NC","positive":285661,"probableCases":12488,"negative":3941281,"pending":null,"totalTestResultsSource":"posNeg","totalTestResults":4226942,"hospitalizedCurrently":1193,"hospitalizedCumulative":null,"inIcuCurrently":323,"inIcuCumulative":null,"onVentilatorCurrently":null,"onVentilatorCumulative":null,"recovered":246318,"dataQualityGrade":"A+","lastUpdateEt":"11/5/2020 11:30","dateModified":"2020-11-05T11:30:00Z","checkTimeEt":"11/05 06:30","death":4548,"hospitalized":null,"dateChecked":"2020-11-05T11:30:00Z","totalTestsViral":4214454,"positiveTestsViral":null,"negativeTestsViral":null,"positiveCasesViral":273173,"deathConfirmed":4457,"deathProbable":91,"totalTestEncountersViral":null,"totalTestsPeopleViral":null,"totalTestsAntibody":null,"positiveTestsAntibody":null,"negativeTestsAntibody":null,"totalTestsPeopleAntibody":null,"positiveTestsPeopleAntibody":null,"negativeTestsPeopleAntibody":null,"totalTestsPeopleAntigen":null,"positiveTestsPeopleAntigen":null,"totalTestsAntigen":41718,"positiveTestsAntigen":null,"fips":"37","positiveIncrease":2859,"negativeIncrease":39825,"total":4226942,"totalTestResultsIncrease":42684,"posNeg":4226942,"deathIncrease":41,"hospitalizedIncrease":0,"hash":"b293d7a1b0c3e31fd5a9abaad106d0c218f232ad","commercialScore":0,"negativeRegularScore":0,"negativeScore":0,"positiveScore":0,"score":0,"grade":""},{"date":20201104,"state":"NC","positive":282802,"probableCases":12127,"negative":3901456,"pending":null,"totalTestResultsSource":"posNeg","totalTestResults":4184258,"hospitalizedCurrently":1186,"hospitalizedCumulative":null,"inIcuCurrently":327,"inIcuCumulative":null,"onVentilatorCurrently":null,"onVentilatorCumulative":null,"recovered":246318,"dataQualityGrade":"A+","lastUpdateEt":"11/4/2020 11:45","dateModified":"2020-11-04T11:45:00Z","checkTimeEt":"11/04 06:45","death":4507,"hospitalized":null,"dateChecked":"2020-11-04T11:45:00Z","totalTestsViral":4172131,"positiveTestsViral":null,"negativeTestsViral":null,"positiveCasesViral":270675,"deathConfirmed":4418,"deathProbable":89,"totalTestEncountersViral":null,"totalTestsPeopleViral":null,"totalTestsAntibody":null,"positiveTestsAntibody":null,"negativeTestsAntibody":null,"totalTestsPeopleAntibody":null,"positiveTestsPeopleAntibody":null,"negativeTestsPeopleAntibody":null,"totalTestsPeopleAntigen":null,"positiveTestsPeopleAntigen":null,"totalTestsAntigen":39185,"positiveTestsAntigen":null,"fips":"37","positiveIncrease":2425,"negativeIncrease":24355,"total":4184258,"totalTestResultsIncrease":26780,"posNeg":4184258,"deathIncrease":50,"hospitalizedIncrease":0,"hash":"f23bf254484b07b87bd33d352ab80c9523310e82","commercialScore":0,"negativeRegularScore":0,"negativeScore":0,"positiveScore":0,"score":0,"grade":""},{"date":20201103,"state":"NC","positive":280377,"probableCases":11764,"negative":3877101,"pending":null,"totalTestResultsSource":"posNeg","totalTestResults":4157478,"hospitalizedCurrently":1175,"hospitalizedCumulative":null,"inIcuCurrently":331,"inIcuCumulative":null,"onVentilatorCurrently":null,"onVentilatorCumulative":null,"recovered":246318,"dataQualityGrade":"A+","lastUpdateEt":"11/3/2020 11:25","dateModified":"2020-11-03T11:25:00Z","checkTimeEt":"11/03 06:25","death":4457,"hospitalized":null,"dateChecked":"2020-11-03T11:25:00Z","totalTestsViral":4145714,"positiveTestsViral":null,"negativeTestsViral":null,"positiveCasesViral":268613,"deathConfirmed":4371,"deathProbable":86,"totalTestEncountersViral":null,"totalTestsPeopleViral":null,"totalTestsAntibody":null,"positiveTestsAntibody":null,"negativeTestsAntibody":null,"totalTestsPeopleAntibody":null,"positiveTestsPeopleAntibody":null,"negativeTestsPeopleAntibody":null,"totalTestsPeopleAntigen":null,"positiveTestsPeopleAntigen":null,"totalTestsAntigen":35890,"positiveTestsAntigen":null,"fips":"37","positiveIncrease":2349,"negativeIncrease":27533,"total":4157478,"totalTestResultsIncrease":29882,"posNeg":4157478,"deathIncrease":67,"hospitalizedIncrease":0,"hash":"86222d9d400c0dc3ab7046eeb7a571caaf3741ff","commercialScore":0,"negativeRegularScore":0,"negativeScore":0,"positiveScore":0,"score":0,"grade":""},{"date":20201102,"state":"NC","positive":278028,"probableCases":11577,"negative":3849568,"pending":null,"totalTestResultsSource":"posNeg","totalTestResults":4127596,"hospitalizedCurrently":1146,"hospitalizedCumulative":null,"inIcuCurrently":344,"inIcuCumulative":null,"onVentilatorCurrently":null,"onVentilatorCumulative":null,"recovered":246318,"dataQualityGrade":"A+","lastUpdateEt":"11/2/2020 11:15","dateModified":"2020-11-02T11:15:00Z","checkTimeEt":"11/02 06:15","death":4390,"hospitalized":null,"dateChecked":"2020-11-02T11:15:00Z","totalTestsViral":4116019,"positiveTestsViral":null,"negativeTestsViral":null,"positiveCasesViral":266451,"deathConfirmed":4313,"deathProbable":77,"totalTestEncountersViral":null,"totalTestsPeopleViral":null,"totalTestsAntibody":null,"positiveTestsAntibody":null,"negativeTestsAntibody":null,"totalTestsPeopleAntibody":null,"positiveTestsPeopleAntibody":null,"negativeTestsPeopleAntibody":null,"totalTestsPeopleAntigen":null,"positiveTestsPeopleAntigen":null,"totalTestsAntigen":33792,"positiveTestsAntigen":null,"fips":"37","positiveIncrease":1336,"negativeIncrease":30895,"total":4127596,"totalTestResultsIncrease":32231,"posNeg":4127596,"deathIncrease":7,"hospitalizedIncrease":0,"hash":"cb93e4218e1e52b30fa120ebbe66733b6b82b9a8","commercialScore":0,"negativeRegularScore":0,"negativeScore":0,"positiveScore":0,"score":0,"grade":""},{"date":20201101,"state":"NC","positive":276692,"probableCases":11521,"negative":3818673,"pending":null,"totalTestResultsSource":"posNeg","totalTestResults":4095365,"hospitalizedCurrently":1122,"hospitalizedCumulative":null,"inIcuCurrently":328,"inIcuCumulative":null,"onVentilatorCurrently":null,"onVentilatorCumulative":null,"recovered":231611,"dataQualityGrade":"A+","lastUpdateEt":"11/1/2020 11:00","dateModified":"2020-11-01T11:00:00Z","checkTimeEt":"11/01 06:00","death":4383,"hospitalized":null,"dateChecked":"2020-11-01T11:00:00Z","totalTestsViral":4083844,"positiveTestsViral":null,"negativeTestsViral":null,"positiveCasesViral":265171,"deathConfirmed":4306,"deathProbable":77,"totalTestEncountersViral":null,"totalTestsPeopleViral":null,"totalTestsAntibody":null,"positiveTestsAntibody":null,"negativeTestsAntibody":null,"totalTestsPeopleAntibody":null,"positiveTestsPeopleAntibody":null,"negativeTestsPeopleAntibody":null,"totalTestsPeopleAntigen":null,"positiveTestsPeopleAntigen":null,"totalTestsAntigen":33369,"positiveTestsAntigen":null,"fips":"37","positiveIncrease":2057,"negativeIncrease":38152,"total":4095365,"totalTestResultsIncrease":40209,"posNeg":4095365,"deathIncrease":5,"hospitalizedIncrease":0,"hash":"b08f188fd5d181218fa7bc407c94f4f65fa47243","commercialScore":0,"negativeRegularScore":0,"negativeScore":0,"positiveScore":0,"score":0,"grade":""},{"date":20201031,"state":"NC","positive":274635,"probableCases":11458,"negative":3780521,"pending":null,"totalTestResultsSource":"posNeg","totalTestResults":4055156,"hospitalizedCurrently":1184,"hospitalizedCumulative":null,"inIcuCurrently":345,"inIcuCumulative":null,"onVentilatorCurrently":null,"onVentilatorCumulative":null,"recovered":231611,"dataQualityGrade":"A+","lastUpdateEt":"10/31/2020 11:35","dateModified":"2020-10-31T11:35:00Z","checkTimeEt":"10/31 07:35","death":4378,"hospitalized":null,"dateChecked":"2020-10-31T11:35:00Z","totalTestsViral":4043698,"positiveTestsViral":null,"negativeTestsViral":null,"positiveCasesViral":263177,"deathConfirmed":4301,"deathProbable":77,"totalTestEncountersViral":null,"totalTestsPeopleViral":null,"totalTestsAntibody":null,"positiveTestsAntibody":null,"negativeTestsAntibody":null,"totalTestsPeopleAntibody":null,"positiveTestsPeopleAntibody":null,"negativeTestsPeopleAntibody":null,"totalTestsPeopleAntigen":null,"positiveTestsPeopleAntigen":null,"totalTestsAntigen":32124,"positiveTestsAntigen":null,"fips":"37","positiveIncrease":2805,"negativeIncrease":46560,"total":4055156,"totalTestResultsIncrease":49365,"posNeg":4055156,"deathIncrease":46,"hospitalizedIncrease":0,"hash":"81d09ae359fdb7412726a2dd2a8fb0a1e9887a2a","commercialScore":0,"negativeRegularScore":0,"negativeScore":0,"positiveScore":0,"score":0,"grade":""},{"date":20201030,"state":"NC","positive":271830,"probableCases":11121,"negative":3733961,"pending":null,"totalTestResultsSource":"posNeg","totalTestResults":4005791,"hospitalizedCurrently":1196,"hospitalizedCumulative":null,"inIcuCurrently":343,"inIcuCumulative":null,"onVentilatorCurrently":null,"onVentilatorCumulative":null,"recovered":231611,"dataQualityGrade":"A+","lastUpdateEt":"10/30/2020 11:30","dateModified":"2020-10-30T11:30:00Z","checkTimeEt":"10/30 07:30","death":4332,"hospitalized":null,"dateChecked":"2020-10-30T11:30:00Z","totalTestsViral":3994670,"positiveTestsViral":null,"negativeTestsViral":null,"positiveCasesViral":260709,"deathConfirmed":4257,"deathProbable":75,"totalTestEncountersViral":null,"totalTestsPeopleViral":null,"totalTestsAntibody":null,"positiveTestsAntibody":null,"negativeTestsAntibody":null,"totalTestsPeopleAntibody":null,"positiveTestsPeopleAntibody":null,"negativeTestsPeopleAntibody":null,"totalTestsPeopleAntigen":null,"positiveTestsPeopleAntigen":null,"totalTestsAntigen":29700,"positiveTestsAntigen":null,"fips":"37","positiveIncrease":2809,"negativeIncrease":41639,"total":4005791,"totalTestResultsIncrease":44448,"posNeg":4005791,"deathIncrease":49,"hospitalizedIncrease":0,"hash":"af4af4bc94aaf628896c32555418db46754fe4bc","commercialScore":0,"negativeRegularScore":0,"negativeScore":0,"positiveScore":0,"score":0,"grade":""},{"date":20201029,"state":"NC","positive":269021,"probableCases":10702,"negative":3692322,"pending":null,"totalTestResultsSource":"posNeg","totalTestResults":3961343,"hospitalizedCurrently":1181,"hospitalizedCumulative":null,"inIcuCurrently":340,"inIcuCumulative":null,"onVentilatorCurrently":null,"onVentilatorCumulative":null,"recovered":231611,"dataQualityGrade":"A+","lastUpdateEt":"10/29/2020 11:05","dateModified":"2020-10-29T11:05:00Z","checkTimeEt":"10/29 07:05","death":4283,"hospitalized":null,"dateChecked":"2020-10-29T11:05:00Z","totalTestsViral":3950641,"positiveTestsViral":null,"negativeTestsViral":null,"positiveCasesViral":258319,"deathConfirmed":4210,"deathProbable":73,"totalTestEncountersViral":null,"totalTestsPeopleViral":null,"totalTestsAntibody":null,"positiveTestsAntibody":null,"negativeTestsAntibody":null,"totalTestsPeopleAntibody":null,"positiveTestsPeopleAntibody":null,"negativeTestsPeopleAntibody":null,"totalTestsPeopleAntigen":null,"positiveTestsPeopleAntigen":null,"totalTestsAntigen":27145,"positiveTestsAntigen":null,"fips":"37","positiveIncrease":2885,"negativeIncrease":35416,"total":3961343,"totalTestResultsIncrease":38301,"posNeg":3961343,"deathIncrease":38,"hospitalizedIncrease":0,"hash":"62bfbbf2e6a65bb3ec12860a066de51309382137","commercialScore":0,"negativeRegularScore":0,"negativeScore":0,"positiveScore":0,"score":0,"grade":""},{"date":20201028,"state":"NC","positive":266136,"probableCases":10443,"negative":3656906,"pending":null,"totalTestResultsSource":"posNeg","totalTestResults":3923042,"hospitalizedCurrently":1193,"hospitalizedCumulative":null,"inIcuCurrently":329,"inIcuCumulative":null,"onVentilatorCurrently":null,"onVentilatorCumulative":null,"recovered":231611,"dataQualityGrade":"A+","lastUpdateEt":"10/28/2020 11:00","dateModified":"2020-10-28T11:00:00Z","checkTimeEt":"10/28 07:00","death":4245,"hospitalized":null,"dateChecked":"2020-10-28T11:00:00Z","totalTestsViral":3912599,"positiveTestsViral":null,"negativeTestsViral":null,"positiveCasesViral":255693,"deathConfirmed":4176,"deathProbable":69,"totalTestEncountersViral":null,"totalTestsPeopleViral":null,"totalTestsAntibody":null,"positiveTestsAntibody":null,"negativeTestsAntibody":null,"totalTestsPeopleAntibody":null,"positiveTestsPeopleAntibody":null,"negativeTestsPeopleAntibody":null,"totalTestsPeopleAntigen":null,"positiveTestsPeopleAntigen":null,"totalTestsAntigen":24967,"positiveTestsAntigen":null,"fips":"37","positiveIncrease":2253,"negativeIncrease":30025,"total":3923042,"totalTestResultsIncrease":32278,"posNeg":3923042,"deathIncrease":34,"hospitalizedIncrease":0,"hash":"58fbf1d0c24cbe88a12461b7eae785ad6625287d","commercialScore":0,"negativeRegularScore":0,"negativeScore":0,"positiveScore":0,"score":0,"grade":""},{"date":20201027,"state":"NC","positive":263883,"probableCases":10036,"negative":3626881,"pending":null,"totalTestResultsSource":"posNeg","totalTestResults":3890764,"hospitalizedCurrently":1214,"hospitalizedCumulative":null,"inIcuCurrently":329,"inIcuCumulative":null,"onVentilatorCurrently":null,"onVentilatorCumulative":null,"recovered":231611,"dataQualityGrade":"A+","lastUpdateEt":"10/27/2020 11:25","dateModified":"2020-10-27T11:25:00Z","checkTimeEt":"10/27 07:25","death":4211,"hospitalized":null,"dateChecked":"2020-10-27T11:25:00Z","totalTestsViral":3890764,"positiveTestsViral":null,"negativeTestsViral":null,"positiveCasesViral":253847,"deathConfirmed":4144,"deathProbable":67,"totalTestEncountersViral":null,"totalTestsPeopleViral":null,"totalTestsAntibody":null,"positiveTestsAntibody":null,"negativeTestsAntibody":null,"totalTestsPeopleAntibody":null,"positiveTestsPeopleAntibody":null,"negativeTestsPeopleAntibody":null,"totalTestsPeopleAntigen":null,"positiveTestsPeopleAntigen":null,"totalTestsAntigen":23444,"positiveTestsAntigen":null,"fips":"37","positiveIncrease":2141,"negativeIncrease":15710,"total":3890764,"totalTestResultsIncrease":17851,"posNeg":3890764,"deathIncrease":41,"hospitalizedIncrease":0,"hash":"b32996da839ee1fbe9574da54f7f0227db92853f","commercialScore":0,"negativeRegularScore":0,"negativeScore":0,"positiveScore":0,"score":0,"grade":""},{"date":20201026,"state":"NC","positive":261742,"probableCases":9805,"negative":3611171,"pending":null,"totalTestResultsSource":"posNeg","totalTestResults":3872913,"hospitalizedCurrently":1193,"hospitalizedCumulative":null,"inIcuCurrently":332,"inIcuCumulative":null,"onVentilatorCurrently":null,"onVentilatorCumulative":null,"recovered":231611,"dataQualityGrade":"A+","lastUpdateEt":"10/26/2020 11:55","dateModified":"2020-10-26T11:55:00Z","checkTimeEt":"10/26 07:55","death":4170,"hospitalized":null,"dateChecked":"2020-10-26T11:55:00Z","totalTestsViral":3863108,"positiveTestsViral":null,"negativeTestsViral":null,"positiveCasesViral":251937,"deathConfirmed":4108,"deathProbable":62,"totalTestEncountersViral":null,"totalTestsPeopleViral":null,"totalTestsAntibody":null,"positiveTestsAntibody":null,"negativeTestsAntibody":null,"totalTestsPeopleAntibody":null,"positiveTestsPeopleAntibody":null,"negativeTestsPeopleAntibody":null,"totalTestsPeopleAntigen":null,"positiveTestsPeopleAntigen":null,"totalTestsAntigen":22972,"positiveTestsAntigen":null,"fips":"37","positiveIncrease":1643,"negativeIncrease":26817,"total":3872913,"totalTestResultsIncrease":28460,"posNeg":3872913,"deathIncrease":13,"hospitalizedIncrease":0,"hash":"29ce4ef940aee4273bc119edfd7e66cf592cc483","commercialScore":0,"negativeRegularScore":0,"negativeScore":0,"positiveScore":0,"score":0,"grade":""},{"date":20201025,"state":"NC","positive":260099,"probableCases":9767,"negative":3584354,"pending":null,"totalTestResultsSource":"posNeg","totalTestResults":3844453,"hospitalizedCurrently":1148,"hospitalizedCumulative":null,"inIcuCurrently":321,"inIcuCumulative":null,"onVentilatorCurrently":null,"onVentilatorCumulative":null,"recovered":218541,"dataQualityGrade":"A+","lastUpdateEt":"10/25/2020 11:00","dateModified":"2020-10-25T11:00:00Z","checkTimeEt":"10/25 07:00","death":4157,"hospitalized":null,"dateChecked":"2020-10-25T11:00:00Z","totalTestsViral":3834686,"positiveTestsViral":null,"negativeTestsViral":null,"positiveCasesViral":250332,"deathConfirmed":4097,"deathProbable":60,"totalTestEncountersViral":null,"totalTestsPeopleViral":null,"totalTestsAntibody":null,"positiveTestsAntibody":null,"negativeTestsAntibody":null,"totalTestsPeopleAntibody":null,"positiveTestsPeopleAntibody":null,"negativeTestsPeopleAntibody":null,"totalTestsPeopleAntigen":null,"positiveTestsPeopleAntigen":null,"totalTestsAntigen":22622,"positiveTestsAntigen":null,"fips":"37","positiveIncrease":1807,"negativeIncrease":33569,"total":3844453,"totalTestResultsIncrease":35376,"posNeg":3844453,"deathIncrease":13,"hospitalizedIncrease":0,"hash":"cbbc38e698289b3bd6a89a4a3b019594adee2c74","commercialScore":0,"negativeRegularScore":0,"negativeScore":0,"positiveScore":0,"score":0,"grade":""},{"date":20201024,"state":"NC","positive":258292,"probableCases":9672,"negative":3550785,"pending":null,"totalTestResultsSource":"posNeg","totalTestResults":3809077,"hospitalizedCurrently":1182,"hospitalizedCumulative":null,"inIcuCurrently":338,"inIcuCumulative":null,"onVentilatorCurrently":null,"onVentilatorCumulative":null,"recovered":218541,"dataQualityGrade":"A+","lastUpdateEt":"10/24/2020 12:00","dateModified":"2020-10-24T12:00:00Z","checkTimeEt":"10/24 08:00","death":4144,"hospitalized":null,"dateChecked":"2020-10-24T12:00:00Z","totalTestsViral":3799405,"positiveTestsViral":null,"negativeTestsViral":null,"positiveCasesViral":248620,"deathConfirmed":4085,"deathProbable":59,"totalTestEncountersViral":null,"totalTestsPeopleViral":null,"totalTestsAntibody":null,"positiveTestsAntibody":null,"negativeTestsAntibody":null,"totalTestsPeopleAntibody":null,"positiveTestsPeopleAntibody":null,"negativeTestsPeopleAntibody":null,"totalTestsPeopleAntigen":null,"positiveTestsPeopleAntigen":null,"totalTestsAntigen":21790,"positiveTestsAntigen":null,"fips":"37","positiveIncrease":2584,"negativeIncrease":43178,"total":3809077,"totalTestResultsIncrease":45762,"posNeg":3809077,"deathIncrease":30,"hospitalizedIncrease":0,"hash":"e701a95ad7c61cfb55884c3384756961938195d0","commercialScore":0,"negativeRegularScore":0,"negativeScore":0,"positiveScore":0,"score":0,"grade":""},{"date":20201023,"state":"NC","positive":255708,"probableCases":9362,"negative":3507607,"pending":null,"totalTestResultsSource":"posNeg","totalTestResults":3763315,"hospitalizedCurrently":1181,"hospitalizedCumulative":null,"inIcuCurrently":325,"inIcuCumulative":null,"onVentilatorCurrently":null,"onVentilatorCumulative":null,"recovered":218541,"dataQualityGrade":"A+","lastUpdateEt":"10/23/2020 17:58","dateModified":"2020-10-23T17:58:00Z","checkTimeEt":"10/23 13:58","death":4114,"hospitalized":null,"dateChecked":"2020-10-23T17:58:00Z","totalTestsViral":3753953,"positiveTestsViral":null,"negativeTestsViral":null,"positiveCasesViral":246346,"deathConfirmed":4058,"deathProbable":56,"totalTestEncountersViral":null,"totalTestsPeopleViral":null,"totalTestsAntibody":null,"positiveTestsAntibody":null,"negativeTestsAntibody":null,"totalTestsPeopleAntibody":null,"positiveTestsPeopleAntibody":null,"negativeTestsPeopleAntibody":null,"totalTestsPeopleAntigen":null,"positiveTestsPeopleAntigen":null,"totalTestsAntigen":19839,"positiveTestsAntigen":null,"fips":"37","positiveIncrease":2716,"negativeIncrease":32924,"total":3763315,"totalTestResultsIncrease":35640,"posNeg":3763315,"deathIncrease":32,"hospitalizedIncrease":0,"hash":"c9f1d9fd9c8939fefaa8c4f0b88642ac2e380b34","commercialScore":0,"negativeRegularScore":0,"negativeScore":0,"positiveScore":0,"score":0,"grade":""},{"date":20201022,"state":"NC","positive":252992,"probableCases":9069,"negative":3474683,"pending":null,"totalTestResultsSource":"posNeg","totalTestResults":3727675,"hospitalizedCurrently":1205,"hospitalizedCumulative":null,"inIcuCurrently":333,"inIcuCumulative":null,"onVentilatorCurrently":null,"onVentilatorCumulative":null,"recovered":218541,"dataQualityGrade":"A+","lastUpdateEt":"10/22/2020 12:20","dateModified":"2020-10-22T12:20:00Z","checkTimeEt":"10/22 08:20","death":4082,"hospitalized":null,"dateChecked":"2020-10-22T12:20:00Z","totalTestsViral":3718606,"positiveTestsViral":null,"negativeTestsViral":null,"positiveCasesViral":243923,"deathConfirmed":4028,"deathProbable":54,"totalTestEncountersViral":null,"totalTestsPeopleViral":null,"totalTestsAntibody":null,"positiveTestsAntibody":null,"negativeTestsAntibody":null,"totalTestsPeopleAntibody":null,"positiveTestsPeopleAntibody":null,"negativeTestsPeopleAntibody":null,"totalTestsPeopleAntigen":null,"positiveTestsPeopleAntigen":null,"totalTestsAntigen":18776,"positiveTestsAntigen":null,"fips":"37","positiveIncrease":2400,"negativeIncrease":33232,"total":3727675,"totalTestResultsIncrease":35632,"posNeg":3727675,"deathIncrease":50,"hospitalizedIncrease":0,"hash":"b73ec5ddb72f2883f3acf3e51237050220873bf6","commercialScore":0,"negativeRegularScore":0,"negativeScore":0,"positiveScore":0,"score":0,"grade":""},{"date":20201021,"state":"NC","positive":250592,"probableCases":8800,"negative":3441451,"pending":null,"totalTestResultsSource":"posNeg","totalTestResults":3692043,"hospitalizedCurrently":1219,"hospitalizedCumulative":null,"inIcuCurrently":337,"inIcuCumulative":null,"onVentilatorCurrently":null,"onVentilatorCumulative":null,"recovered":218541,"dataQualityGrade":"A+","lastUpdateEt":"10/21/2020 13:10","dateModified":"2020-10-21T13:10:00Z","checkTimeEt":"10/21 09:10","death":4032,"hospitalized":null,"dateChecked":"2020-10-21T13:10:00Z","totalTestsViral":3683243,"positiveTestsViral":null,"negativeTestsViral":null,"positiveCasesViral":241792,"deathConfirmed":3981,"deathProbable":51,"totalTestEncountersViral":null,"totalTestsPeopleViral":null,"totalTestsAntibody":null,"positiveTestsAntibody":null,"negativeTestsAntibody":null,"totalTestsPeopleAntibody":null,"positiveTestsPeopleAntibody":null,"negativeTestsPeopleAntibody":null,"totalTestsPeopleAntigen":null,"positiveTestsPeopleAntigen":null,"totalTestsAntigen":17543,"positiveTestsAntigen":null,"fips":"37","positiveIncrease":1842,"negativeIncrease":18408,"total":3692043,"totalTestResultsIncrease":20250,"posNeg":3692043,"deathIncrease":40,"hospitalizedIncrease":0,"hash":"15daa50c76e7372a114253ec2723089f6066f105","commercialScore":0,"negativeRegularScore":0,"negativeScore":0,"positiveScore":0,"score":0,"grade":""},{"date":20201020,"state":"NC","positive":248750,"probableCases":8453,"negative":3423043,"pending":null,"totalTestResultsSource":"posNeg","totalTestResults":3671793,"hospitalizedCurrently":1203,"hospitalizedCumulative":null,"inIcuCurrently":326,"inIcuCumulative":null,"onVentilatorCurrently":null,"onVentilatorCumulative":null,"recovered":218541,"dataQualityGrade":"A+","lastUpdateEt":"10/20/2020 12:28","dateModified":"2020-10-20T12:28:00Z","checkTimeEt":"10/20 08:28","death":3992,"hospitalized":null,"dateChecked":"2020-10-20T12:28:00Z","totalTestsViral":3663340,"positiveTestsViral":null,"negativeTestsViral":null,"positiveCasesViral":240297,"deathConfirmed":3941,"deathProbable":51,"totalTestEncountersViral":null,"totalTestsPeopleViral":null,"totalTestsAntibody":null,"positiveTestsAntibody":null,"negativeTestsAntibody":null,"totalTestsPeopleAntibody":null,"positiveTestsPeopleAntibody":null,"negativeTestsPeopleAntibody":null,"totalTestsPeopleAntigen":null,"positiveTestsPeopleAntigen":null,"totalTestsAntigen":16457,"positiveTestsAntigen":null,"fips":"37","positiveIncrease":1578,"negativeIncrease":21851,"total":3671793,"totalTestResultsIncrease":23429,"posNeg":3671793,"deathIncrease":53,"hospitalizedIncrease":0,"hash":"b3c031c6f75a01cdcfc2d9c46d760ff74c14e3ba","commercialScore":0,"negativeRegularScore":0,"negativeScore":0,"positiveScore":0,"score":0,"grade":""},{"date":20201019,"state":"NC","positive":247172,"probableCases":8278,"negative":3401192,"pending":null,"totalTestResultsSource":"posNeg","totalTestResults":3648364,"hospitalizedCurrently":1142,"hospitalizedCumulative":null,"inIcuCurrently":311,"inIcuCumulative":null,"onVentilatorCurrently":null,"onVentilatorCumulative":null,"recovered":218541,"dataQualityGrade":"A+","lastUpdateEt":"10/19/2020 12:05","dateModified":"2020-10-19T12:05:00Z","checkTimeEt":"10/19 08:05","death":3939,"hospitalized":null,"dateChecked":"2020-10-19T12:05:00Z","totalTestsViral":3640086,"positiveTestsViral":null,"negativeTestsViral":null,"positiveCasesViral":238894,"deathConfirmed":3892,"deathProbable":47,"totalTestEncountersViral":null,"totalTestsPeopleViral":null,"totalTestsAntibody":null,"positiveTestsAntibody":null,"negativeTestsAntibody":null,"totalTestsPeopleAntibody":null,"positiveTestsPeopleAntibody":null,"negativeTestsPeopleAntibody":null,"totalTestsPeopleAntigen":null,"positiveTestsPeopleAntigen":null,"totalTestsAntigen":15544,"positiveTestsAntigen":null,"fips":"37","positiveIncrease":1144,"negativeIncrease":29962,"total":3648364,"totalTestResultsIncrease":31106,"posNeg":3648364,"deathIncrease":5,"hospitalizedIncrease":0,"hash":"bcf92c6e1375725f27fd14660365161cf6ff83f7","commercialScore":0,"negativeRegularScore":0,"negativeScore":0,"positiveScore":0,"score":0,"grade":""},{"date":20201018,"state":"NC","positive":246028,"probableCases":8223,"negative":3371230,"pending":null,"totalTestResultsSource":"posNeg","totalTestResults":3617258,"hospitalizedCurrently":1129,"hospitalizedCumulative":null,"inIcuCurrently":310,"inIcuCumulative":null,"onVentilatorCurrently":null,"onVentilatorCumulative":null,"recovered":206471,"dataQualityGrade":"A+","lastUpdateEt":"10/18/2020 11:20","dateModified":"2020-10-18T11:20:00Z","checkTimeEt":"10/18 07:20","death":3934,"hospitalized":null,"dateChecked":"2020-10-18T11:20:00Z","totalTestsViral":3609035,"positiveTestsViral":null,"negativeTestsViral":null,"positiveCasesViral":237805,"deathConfirmed":3887,"deathProbable":47,"totalTestEncountersViral":null,"totalTestsPeopleViral":null,"totalTestsAntibody":null,"positiveTestsAntibody":null,"negativeTestsAntibody":null,"totalTestsPeopleAntibody":null,"positiveTestsPeopleAntibody":null,"negativeTestsPeopleAntibody":null,"totalTestsPeopleAntigen":null,"positiveTestsPeopleAntigen":null,"totalTestsAntigen":15275,"positiveTestsAntigen":null,"fips":"37","positiveIncrease":2303,"negativeIncrease":32383,"total":3617258,"totalTestResultsIncrease":34686,"posNeg":3617258,"deathIncrease":5,"hospitalizedIncrease":0,"hash":"2fc1698446867b7b1540aae72a4deff7dd65da06","commercialScore":0,"negativeRegularScore":0,"negativeScore":0,"positiveScore":0,"score":0,"grade":""},{"date":20201017,"state":"NC","positive":243725,"probableCases":8128,"negative":3338847,"pending":null,"totalTestResultsSource":"posNeg","totalTestResults":3582572,"hospitalizedCurrently":1140,"hospitalizedCumulative":null,"inIcuCurrently":316,"inIcuCumulative":null,"onVentilatorCurrently":null,"onVentilatorCumulative":null,"recovered":206471,"dataQualityGrade":"A+","lastUpdateEt":"10/17/2020 10:30","dateModified":"2020-10-17T10:30:00Z","checkTimeEt":"10/17 06:30","death":3929,"hospitalized":null,"dateChecked":"2020-10-17T10:30:00Z","totalTestsViral":3574444,"positiveTestsViral":null,"negativeTestsViral":null,"positiveCasesViral":235597,"deathConfirmed":3882,"deathProbable":47,"totalTestEncountersViral":null,"totalTestsPeopleViral":null,"totalTestsAntibody":null,"positiveTestsAntibody":null,"negativeTestsAntibody":null,"totalTestsPeopleAntibody":null,"positiveTestsPeopleAntibody":null,"negativeTestsPeopleAntibody":null,"totalTestsPeopleAntigen":null,"positiveTestsPeopleAntigen":null,"totalTestsAntigen":14658,"positiveTestsAntigen":null,"fips":"37","positiveIncrease":2102,"negativeIncrease":40739,"total":3582572,"totalTestResultsIncrease":42841,"posNeg":3582572,"deathIncrease":19,"hospitalizedIncrease":0,"hash":"f774238d6c8657bbbfc8d58c1bf44bf4a961d74f","commercialScore":0,"negativeRegularScore":0,"negativeScore":0,"positiveScore":0,"score":0,"grade":""},{"date":20201016,"state":"NC","positive":241623,"probableCases":7891,"negative":3298108,"pending":null,"totalTestResultsSource":"posNeg","totalTestResults":3539731,"hospitalizedCurrently":1148,"hospitalizedCumulative":null,"inIcuCurrently":299,"inIcuCumulative":null,"onVentilatorCurrently":null,"onVentilatorCumulative":null,"recovered":206471,"dataQualityGrade":"A+","lastUpdateEt":"10/16/2020 12:00","dateModified":"2020-10-16T12:00:00Z","checkTimeEt":"10/16 08:00","death":3910,"hospitalized":null,"dateChecked":"2020-10-16T12:00:00Z","totalTestsViral":3531840,"positiveTestsViral":null,"negativeTestsViral":null,"positiveCasesViral":233732,"deathConfirmed":3864,"deathProbable":46,"totalTestEncountersViral":null,"totalTestsPeopleViral":null,"totalTestsAntibody":null,"positiveTestsAntibody":null,"negativeTestsAntibody":null,"totalTestsPeopleAntibody":null,"positiveTestsPeopleAntibody":null,"negativeTestsPeopleAntibody":null,"totalTestsPeopleAntigen":null,"positiveTestsPeopleAntigen":null,"totalTestsAntigen":13588,"positiveTestsAntigen":null,"fips":"37","positiveIncrease":2684,"negativeIncrease":36284,"total":3539731,"totalTestResultsIncrease":38968,"posNeg":3539731,"deathIncrease":36,"hospitalizedIncrease":0,"hash":"c40725b1cfcefc310e4df8b5ce252d9596e8e388","commercialScore":0,"negativeRegularScore":0,"negativeScore":0,"positiveScore":0,"score":0,"grade":""},{"date":20201015,"state":"NC","positive":238939,"probableCases":7577,"negative":3261824,"pending":null,"totalTestResultsSource":"posNeg","totalTestResults":3500763,"hospitalizedCurrently":1140,"hospitalizedCumulative":null,"inIcuCurrently":296,"inIcuCumulative":null,"onVentilatorCurrently":null,"onVentilatorCumulative":null,"recovered":206471,"dataQualityGrade":"A+","lastUpdateEt":"10/15/2020 11:45","dateModified":"2020-10-15T11:45:00Z","checkTimeEt":"10/15 07:45","death":3874,"hospitalized":null,"dateChecked":"2020-10-15T11:45:00Z","totalTestsViral":3493186,"positiveTestsViral":null,"negativeTestsViral":null,"positiveCasesViral":231362,"deathConfirmed":3831,"deathProbable":43,"totalTestEncountersViral":null,"totalTestsPeopleViral":null,"totalTestsAntibody":null,"positiveTestsAntibody":null,"negativeTestsAntibody":null,"totalTestsPeopleAntibody":null,"positiveTestsPeopleAntibody":null,"negativeTestsPeopleAntibody":null,"totalTestsPeopleAntigen":null,"positiveTestsPeopleAntigen":null,"totalTestsAntigen":12872,"positiveTestsAntigen":null,"fips":"37","positiveIncrease":2532,"negativeIncrease":30996,"total":3500763,"totalTestResultsIncrease":33528,"posNeg":3500763,"deathIncrease":18,"hospitalizedIncrease":0,"hash":"a4277eb88f934771e9151fc317b56ac7f0cc4ea9","commercialScore":0,"negativeRegularScore":0,"negativeScore":0,"positiveScore":0,"score":0,"grade":""},{"date":20201014,"state":"NC","positive":236407,"probableCases":7292,"negative":3230828,"pending":null,"totalTestResultsSource":"posNeg","totalTestResults":3467235,"hospitalizedCurrently":1152,"hospitalizedCumulative":null,"inIcuCurrently":300,"inIcuCumulative":null,"onVentilatorCurrently":null,"onVentilatorCumulative":null,"recovered":206471,"dataQualityGrade":"A+","lastUpdateEt":"10/14/2020 11:30","dateModified":"2020-10-14T11:30:00Z","checkTimeEt":"10/14 07:30","death":3856,"hospitalized":null,"dateChecked":"2020-10-14T11:30:00Z","totalTestsViral":3459943,"positiveTestsViral":null,"negativeTestsViral":null,"positiveCasesViral":229115,"deathConfirmed":3813,"deathProbable":43,"totalTestEncountersViral":null,"totalTestsPeopleViral":null,"totalTestsAntibody":null,"positiveTestsAntibody":null,"negativeTestsAntibody":null,"totalTestsPeopleAntibody":null,"positiveTestsPeopleAntibody":null,"negativeTestsPeopleAntibody":null,"totalTestsPeopleAntigen":null,"positiveTestsPeopleAntigen":null,"totalTestsAntigen":11616,"positiveTestsAntigen":null,"fips":"37","positiveIncrease":1926,"negativeIncrease":20726,"total":3467235,"totalTestResultsIncrease":22652,"posNeg":3467235,"deathIncrease":40,"hospitalizedIncrease":0,"hash":"97a6e1ee2f4ece79dcb9f131e3391aa8043aa603","commercialScore":0,"negativeRegularScore":0,"negativeScore":0,"positiveScore":0,"score":0,"grade":""},{"date":20201013,"state":"NC","positive":234481,"probableCases":6985,"negative":3210102,"pending":null,"totalTestResultsSource":"posNeg","totalTestResults":3444583,"hospitalizedCurrently":1103,"hospitalizedCumulative":null,"inIcuCurrently":306,"inIcuCumulative":null,"onVentilatorCurrently":null,"onVentilatorCumulative":null,"recovered":206471,"dataQualityGrade":"A+","lastUpdateEt":"10/13/2020 11:10","dateModified":"2020-10-13T11:10:00Z","checkTimeEt":"10/13 07:10","death":3816,"hospitalized":null,"dateChecked":"2020-10-13T11:10:00Z","totalTestsViral":3437598,"positiveTestsViral":null,"negativeTestsViral":null,"positiveCasesViral":227496,"deathConfirmed":3774,"deathProbable":42,"totalTestEncountersViral":null,"totalTestsPeopleViral":null,"totalTestsAntibody":null,"positiveTestsAntibody":null,"negativeTestsAntibody":null,"totalTestsPeopleAntibody":null,"positiveTestsPeopleAntibody":null,"negativeTestsPeopleAntibody":null,"totalTestsPeopleAntigen":null,"positiveTestsPeopleAntigen":null,"totalTestsAntigen":10173,"positiveTestsAntigen":null,"fips":"37","positiveIncrease":1734,"negativeIncrease":25035,"total":3444583,"totalTestResultsIncrease":26769,"posNeg":3444583,"deathIncrease":43,"hospitalizedIncrease":0,"hash":"0f9dcc9bc66b014654a4fb1a25e3af61de745759","commercialScore":0,"negativeRegularScore":0,"negativeScore":0,"positiveScore":0,"score":0,"grade":""},{"date":20201012,"state":"NC","positive":232747,"probableCases":6788,"negative":3185067,"pending":null,"totalTestResultsSource":"posNeg","totalTestResults":3417814,"hospitalizedCurrently":1109,"hospitalizedCumulative":null,"inIcuCurrently":314,"inIcuCumulative":null,"onVentilatorCurrently":null,"onVentilatorCumulative":null,"recovered":206471,"dataQualityGrade":"A+","lastUpdateEt":"10/12/2020 12:25","dateModified":"2020-10-12T12:25:00Z","checkTimeEt":"10/12 08:25","death":3773,"hospitalized":null,"dateChecked":"2020-10-12T12:25:00Z","totalTestsViral":3411026,"positiveTestsViral":null,"negativeTestsViral":null,"positiveCasesViral":225959,"deathConfirmed":3738,"deathProbable":35,"totalTestEncountersViral":null,"totalTestsPeopleViral":null,"totalTestsAntibody":null,"positiveTestsAntibody":null,"negativeTestsAntibody":null,"totalTestsPeopleAntibody":null,"positiveTestsPeopleAntibody":null,"negativeTestsPeopleAntibody":null,"totalTestsPeopleAntigen":null,"positiveTestsPeopleAntigen":null,"totalTestsAntigen":9950,"positiveTestsAntigen":null,"fips":"37","positiveIncrease":1276,"negativeIncrease":28288,"total":3417814,"totalTestResultsIncrease":29564,"posNeg":3417814,"deathIncrease":3,"hospitalizedIncrease":0,"hash":"bf02a7170694d08f4fce374ade8aa530417e9846","commercialScore":0,"negativeRegularScore":0,"negativeScore":0,"positiveScore":0,"score":0,"grade":""},{"date":20201011,"state":"NC","positive":231471,"probableCases":6744,"negative":3156779,"pending":null,"totalTestResultsSource":"posNeg","totalTestResults":3388250,"hospitalizedCurrently":1046,"hospitalizedCumulative":null,"inIcuCurrently":288,"inIcuCumulative":null,"onVentilatorCurrently":null,"onVentilatorCumulative":null,"recovered":192644,"dataQualityGrade":"A+","lastUpdateEt":"10/11/2020 13:00","dateModified":"2020-10-11T13:00:00Z","checkTimeEt":"10/11 09:00","death":3770,"hospitalized":null,"dateChecked":"2020-10-11T13:00:00Z","totalTestsViral":3381506,"positiveTestsViral":null,"negativeTestsViral":null,"positiveCasesViral":224727,"deathConfirmed":3735,"deathProbable":35,"totalTestEncountersViral":null,"totalTestsPeopleViral":null,"totalTestsAntibody":null,"positiveTestsAntibody":null,"negativeTestsAntibody":null,"totalTestsPeopleAntibody":null,"positiveTestsPeopleAntibody":null,"negativeTestsPeopleAntibody":null,"totalTestsPeopleAntigen":null,"positiveTestsPeopleAntigen":null,"totalTestsAntigen":9655,"positiveTestsAntigen":null,"fips":"37","positiveIncrease":1719,"negativeIncrease":35716,"total":3388250,"totalTestResultsIncrease":37435,"posNeg":3388250,"deathIncrease":5,"hospitalizedIncrease":0,"hash":"0a2fc76d7eddd6f2fa1fd1e862a61af68fa98354","commercialScore":0,"negativeRegularScore":0,"negativeScore":0,"positiveScore":0,"score":0,"grade":""},{"date":20201010,"state":"NC","positive":229752,"probableCases":6663,"negative":3121063,"pending":null,"totalTestResultsSource":"posNeg","totalTestResults":3350815,"hospitalizedCurrently":1034,"hospitalizedCumulative":null,"inIcuCurrently":281,"inIcuCumulative":null,"onVentilatorCurrently":null,"onVentilatorCumulative":null,"recovered":192644,"dataQualityGrade":"A+","lastUpdateEt":"10/10/2020 12:00","dateModified":"2020-10-10T12:00:00Z","checkTimeEt":"10/10 08:00","death":3765,"hospitalized":null,"dateChecked":"2020-10-10T12:00:00Z","totalTestsViral":3344152,"positiveTestsViral":null,"negativeTestsViral":null,"positiveCasesViral":223089,"deathConfirmed":3731,"deathProbable":34,"totalTestEncountersViral":null,"totalTestsPeopleViral":null,"totalTestsAntibody":null,"positiveTestsAntibody":null,"negativeTestsAntibody":null,"totalTestsPeopleAntibody":null,"positiveTestsPeopleAntibody":null,"negativeTestsPeopleAntibody":null,"totalTestsPeopleAntigen":null,"positiveTestsPeopleAntigen":null,"totalTestsAntigen":9135,"positiveTestsAntigen":null,"fips":"37","positiveIncrease":2321,"negativeIncrease":37209,"total":3350815,"totalTestResultsIncrease":39530,"posNeg":3350815,"deathIncrease":18,"hospitalizedIncrease":0,"hash":"ebb12afe006ee0d97d6e96bd28a43ba8caf3b8d5","commercialScore":0,"negativeRegularScore":0,"negativeScore":0,"positiveScore":0,"score":0,"grade":""},{"date":20201009,"state":"NC","positive":227431,"probableCases":6466,"negative":3083854,"pending":null,"totalTestResultsSource":"posNeg","totalTestResults":3311285,"hospitalizedCurrently":1065,"hospitalizedCumulative":null,"inIcuCurrently":299,"inIcuCumulative":null,"onVentilatorCurrently":null,"onVentilatorCumulative":null,"recovered":192644,"dataQualityGrade":"A+","lastUpdateEt":"10/9/2020 12:15","dateModified":"2020-10-09T12:15:00Z","checkTimeEt":"10/09 08:15","death":3747,"hospitalized":null,"dateChecked":"2020-10-09T12:15:00Z","totalTestsViral":3304819,"positiveTestsViral":null,"negativeTestsViral":null,"positiveCasesViral":220965,"deathConfirmed":3713,"deathProbable":34,"totalTestEncountersViral":null,"totalTestsPeopleViral":null,"totalTestsAntibody":null,"positiveTestsAntibody":null,"negativeTestsAntibody":null,"totalTestsPeopleAntibody":null,"positiveTestsPeopleAntibody":null,"negativeTestsPeopleAntibody":null,"totalTestsPeopleAntigen":null,"positiveTestsPeopleAntigen":null,"totalTestsAntigen":8219,"positiveTestsAntigen":null,"fips":"37","positiveIncrease":2034,"negativeIncrease":40296,"total":3311285,"totalTestResultsIncrease":42330,"posNeg":3311285,"deathIncrease":25,"hospitalizedIncrease":0,"hash":"935acf9ebb8ab832ff6bbc418fc67c3e3a94b6fd","commercialScore":0,"negativeRegularScore":0,"negativeScore":0,"positiveScore":0,"score":0,"grade":""},{"date":20201008,"state":"NC","positive":225397,"probableCases":6235,"negative":3043558,"pending":null,"totalTestResultsSource":"posNeg","totalTestResults":3268955,"hospitalizedCurrently":1051,"hospitalizedCumulative":null,"inIcuCurrently":296,"inIcuCumulative":null,"onVentilatorCurrently":null,"onVentilatorCumulative":null,"recovered":192644,"dataQualityGrade":"A+","lastUpdateEt":"10/8/2020 12:00","dateModified":"2020-10-08T12:00:00Z","checkTimeEt":"10/08 08:00","death":3722,"hospitalized":null,"dateChecked":"2020-10-08T12:00:00Z","totalTestsViral":3262720,"positiveTestsViral":null,"negativeTestsViral":null,"positiveCasesViral":219162,"deathConfirmed":3689,"deathProbable":33,"totalTestEncountersViral":null,"totalTestsPeopleViral":null,"totalTestsAntibody":null,"positiveTestsAntibody":null,"negativeTestsAntibody":null,"totalTestsPeopleAntibody":null,"positiveTestsPeopleAntibody":null,"negativeTestsPeopleAntibody":null,"totalTestsPeopleAntigen":null,"positiveTestsPeopleAntigen":null,"totalTestsAntigen":6114,"positiveTestsAntigen":null,"fips":"37","positiveIncrease":2428,"negativeIncrease":31254,"total":3268955,"totalTestResultsIncrease":33682,"posNeg":3268955,"deathIncrease":29,"hospitalizedIncrease":0,"hash":"21139ebdb35c3d738de79013dc19081d66fec54c","commercialScore":0,"negativeRegularScore":0,"negativeScore":0,"positiveScore":0,"score":0,"grade":""},{"date":20201007,"state":"NC","positive":222969,"probableCases":6026,"negative":3012304,"pending":null,"totalTestResultsSource":"posNeg","totalTestResults":3235273,"hospitalizedCurrently":1028,"hospitalizedCumulative":null,"inIcuCurrently":288,"inIcuCumulative":null,"onVentilatorCurrently":null,"onVentilatorCumulative":null,"recovered":192644,"dataQualityGrade":"A+","lastUpdateEt":"10/7/2020 12:10","dateModified":"2020-10-07T12:10:00Z","checkTimeEt":"10/07 08:10","death":3693,"hospitalized":null,"dateChecked":"2020-10-07T12:10:00Z","totalTestsViral":3229247,"positiveTestsViral":null,"negativeTestsViral":null,"positiveCasesViral":216943,"deathConfirmed":3661,"deathProbable":32,"totalTestEncountersViral":null,"totalTestsPeopleViral":null,"totalTestsAntibody":null,"positiveTestsAntibody":null,"negativeTestsAntibody":null,"totalTestsPeopleAntibody":null,"positiveTestsPeopleAntibody":null,"negativeTestsPeopleAntibody":null,"totalTestsPeopleAntigen":null,"positiveTestsPeopleAntigen":null,"totalTestsAntigen":5101,"positiveTestsAntigen":null,"fips":"37","positiveIncrease":1711,"negativeIncrease":16876,"total":3235273,"totalTestResultsIncrease":18587,"posNeg":3235273,"deathIncrease":23,"hospitalizedIncrease":0,"hash":"b45b6511acb5f42b89d4427e381eb113ff2801a4","commercialScore":0,"negativeRegularScore":0,"negativeScore":0,"positiveScore":0,"score":0,"grade":""},{"date":20201006,"state":"NC","positive":221258,"probableCases":5781,"negative":2995428,"pending":null,"totalTestResultsSource":"posNeg","totalTestResults":3216686,"hospitalizedCurrently":1013,"hospitalizedCumulative":null,"inIcuCurrently":290,"inIcuCumulative":null,"onVentilatorCurrently":null,"onVentilatorCumulative":null,"recovered":192644,"dataQualityGrade":"A+","lastUpdateEt":"10/6/2020 12:58","dateModified":"2020-10-06T12:58:00Z","checkTimeEt":"10/06 08:58","death":3670,"hospitalized":null,"dateChecked":"2020-10-06T12:58:00Z","totalTestsViral":3210905,"positiveTestsViral":null,"negativeTestsViral":null,"positiveCasesViral":215477,"deathConfirmed":3639,"deathProbable":31,"totalTestEncountersViral":null,"totalTestsPeopleViral":null,"totalTestsAntibody":null,"positiveTestsAntibody":null,"negativeTestsAntibody":null,"totalTestsPeopleAntibody":null,"positiveTestsPeopleAntibody":null,"negativeTestsPeopleAntibody":null,"totalTestsPeopleAntigen":null,"positiveTestsPeopleAntigen":null,"totalTestsAntigen":4508,"positiveTestsAntigen":null,"fips":"37","positiveIncrease":1504,"negativeIncrease":21266,"total":3216686,"totalTestResultsIncrease":22770,"posNeg":3216686,"deathIncrease":33,"hospitalizedIncrease":0,"hash":"2c8291e8ca732878a1de3b453513dbb15a6f5379","commercialScore":0,"negativeRegularScore":0,"negativeScore":0,"positiveScore":0,"score":0,"grade":""},{"date":20201005,"state":"NC","positive":219754,"probableCases":5545,"negative":2974162,"pending":null,"totalTestResultsSource":"posNeg","totalTestResults":3193916,"hospitalizedCurrently":971,"hospitalizedCumulative":null,"inIcuCurrently":274,"inIcuCumulative":null,"onVentilatorCurrently":null,"onVentilatorCumulative":null,"recovered":192644,"dataQualityGrade":"A+","lastUpdateEt":"10/5/2020 12:20","dateModified":"2020-10-05T12:20:00Z","checkTimeEt":"10/05 08:20","death":3637,"hospitalized":null,"dateChecked":"2020-10-05T12:20:00Z","totalTestsViral":3188371,"positiveTestsViral":null,"negativeTestsViral":null,"positiveCasesViral":214209,"deathConfirmed":3606,"deathProbable":31,"totalTestEncountersViral":null,"totalTestsPeopleViral":null,"totalTestsAntibody":null,"positiveTestsAntibody":null,"negativeTestsAntibody":null,"totalTestsPeopleAntibody":null,"positiveTestsPeopleAntibody":null,"negativeTestsPeopleAntibody":null,"totalTestsPeopleAntigen":null,"positiveTestsPeopleAntigen":null,"totalTestsAntigen":4175,"positiveTestsAntigen":null,"fips":"37","positiveIncrease":2258,"negativeIncrease":30690,"total":3193916,"totalTestResultsIncrease":32948,"posNeg":3193916,"deathIncrease":3,"hospitalizedIncrease":0,"hash":"d3703a550cea1dd4502d9916ea0d0cad10646d72","commercialScore":0,"negativeRegularScore":0,"negativeScore":0,"positiveScore":0,"score":0,"grade":""},{"date":20201004,"state":"NC","positive":217496,"probableCases":5535,"negative":2943472,"pending":null,"totalTestResultsSource":"posNeg","totalTestResults":3160968,"hospitalizedCurrently":907,"hospitalizedCumulative":null,"inIcuCurrently":266,"inIcuCumulative":null,"onVentilatorCurrently":null,"onVentilatorCumulative":null,"recovered":184422,"dataQualityGrade":"A+","lastUpdateEt":"10/4/2020 12:00","dateModified":"2020-10-04T12:00:00Z","checkTimeEt":"10/04 08:00","death":3634,"hospitalized":null,"dateChecked":"2020-10-04T12:00:00Z","totalTestsViral":3155433,"positiveTestsViral":null,"negativeTestsViral":null,"positiveCasesViral":211961,"deathConfirmed":3603,"deathProbable":31,"totalTestEncountersViral":null,"totalTestsPeopleViral":null,"totalTestsAntibody":null,"positiveTestsAntibody":null,"negativeTestsAntibody":null,"totalTestsPeopleAntibody":null,"positiveTestsPeopleAntibody":null,"negativeTestsPeopleAntibody":null,"totalTestsPeopleAntigen":null,"positiveTestsPeopleAntigen":null,"totalTestsAntigen":3996,"positiveTestsAntigen":null,"fips":"37","positiveIncrease":610,"negativeIncrease":24092,"total":3160968,"totalTestResultsIncrease":24702,"posNeg":3160968,"deathIncrease":5,"hospitalizedIncrease":0,"hash":"067026767fbaa7035fbbea8cfc5e6828f5bfe205","commercialScore":0,"negativeRegularScore":0,"negativeScore":0,"positiveScore":0,"score":0,"grade":""},{"date":20201003,"state":"NC","positive":216886,"probableCases":5483,"negative":2919380,"pending":null,"totalTestResultsSource":"posNeg","totalTestResults":3136266,"hospitalizedCurrently":921,"hospitalizedCumulative":null,"inIcuCurrently":273,"inIcuCumulative":null,"onVentilatorCurrently":null,"onVentilatorCumulative":null,"recovered":184422,"dataQualityGrade":"A+","lastUpdateEt":"10/3/2020 11:45","dateModified":"2020-10-03T11:45:00Z","checkTimeEt":"10/03 07:45","death":3629,"hospitalized":null,"dateChecked":"2020-10-03T11:45:00Z","totalTestsViral":3130783,"positiveTestsViral":null,"negativeTestsViral":null,"positiveCasesViral":211403,"deathConfirmed":3600,"deathProbable":29,"totalTestEncountersViral":null,"totalTestsPeopleViral":null,"totalTestsAntibody":null,"positiveTestsAntibody":null,"negativeTestsAntibody":null,"totalTestsPeopleAntibody":null,"positiveTestsPeopleAntibody":null,"negativeTestsPeopleAntibody":null,"totalTestsPeopleAntigen":null,"positiveTestsPeopleAntigen":null,"totalTestsAntigen":3527,"positiveTestsAntigen":null,"fips":"37","positiveIncrease":2202,"negativeIncrease":34360,"total":3136266,"totalTestResultsIncrease":36562,"posNeg":3136266,"deathIncrease":21,"hospitalizedIncrease":0,"hash":"392d8a5d531a4043c0a29418741ef740552435df","commercialScore":0,"negativeRegularScore":0,"negativeScore":0,"positiveScore":0,"score":0,"grade":""},{"date":20201002,"state":"NC","positive":214684,"probableCases":5287,"negative":2885020,"pending":null,"totalTestResultsSource":"posNeg","totalTestResults":3099704,"hospitalizedCurrently":921,"hospitalizedCumulative":null,"inIcuCurrently":278,"inIcuCumulative":null,"onVentilatorCurrently":null,"onVentilatorCumulative":null,"recovered":184422,"dataQualityGrade":"A+","lastUpdateEt":"10/2/2020 11:20","dateModified":"2020-10-02T11:20:00Z","checkTimeEt":"10/02 07:20","death":3608,"hospitalized":null,"dateChecked":"2020-10-02T11:20:00Z","totalTestsViral":3094417,"positiveTestsViral":null,"negativeTestsViral":null,"positiveCasesViral":209397,"deathConfirmed":3579,"deathProbable":29,"totalTestEncountersViral":null,"totalTestsPeopleViral":null,"totalTestsAntibody":null,"positiveTestsAntibody":null,"negativeTestsAntibody":null,"totalTestsPeopleAntibody":null,"positiveTestsPeopleAntibody":null,"negativeTestsPeopleAntibody":null,"totalTestsPeopleAntigen":null,"positiveTestsPeopleAntigen":null,"totalTestsAntigen":3063,"positiveTestsAntigen":null,"fips":"37","positiveIncrease":1775,"negativeIncrease":34268,"total":3099704,"totalTestResultsIncrease":36043,"posNeg":3099704,"deathIncrease":29,"hospitalizedIncrease":0,"hash":"95b0cb5a9c62b7c6e0d290cad9ca30d471fd33ee","commercialScore":0,"negativeRegularScore":0,"negativeScore":0,"positiveScore":0,"score":0,"grade":""},{"date":20201001,"state":"NC","positive":212909,"probableCases":5120,"negative":2850752,"pending":null,"totalTestResultsSource":"posNeg","totalTestResults":3063661,"hospitalizedCurrently":939,"hospitalizedCumulative":null,"inIcuCurrently":297,"inIcuCumulative":null,"onVentilatorCurrently":null,"onVentilatorCumulative":null,"recovered":184422,"dataQualityGrade":"A+","lastUpdateEt":"10/1/2020 12:00","dateModified":"2020-10-01T12:00:00Z","checkTimeEt":"10/01 08:00","death":3579,"hospitalized":null,"dateChecked":"2020-10-01T12:00:00Z","totalTestsViral":3058541,"positiveTestsViral":null,"negativeTestsViral":null,"positiveCasesViral":207789,"deathConfirmed":3551,"deathProbable":28,"totalTestEncountersViral":null,"totalTestsPeopleViral":null,"totalTestsAntibody":null,"positiveTestsAntibody":null,"negativeTestsAntibody":null,"totalTestsPeopleAntibody":null,"positiveTestsPeopleAntibody":null,"negativeTestsPeopleAntibody":null,"totalTestsPeopleAntigen":null,"positiveTestsPeopleAntigen":null,"totalTestsAntigen":2721,"positiveTestsAntigen":null,"fips":"37","positiveIncrease":2277,"negativeIncrease":26513,"total":3063661,"totalTestResultsIncrease":28790,"posNeg":3063661,"deathIncrease":47,"hospitalizedIncrease":0,"hash":"743812b3dfa7255e3dca8b0a68a72e81ebe7d4e2","commercialScore":0,"negativeRegularScore":0,"negativeScore":0,"positiveScore":0,"score":0,"grade":""},{"date":20200930,"state":"NC","positive":210632,"probableCases":4929,"negative":2824239,"pending":null,"totalTestResultsSource":"posNeg","totalTestResults":3034871,"hospitalizedCurrently":956,"hospitalizedCumulative":null,"inIcuCurrently":297,"inIcuCumulative":null,"onVentilatorCurrently":null,"onVentilatorCumulative":null,"recovered":184422,"dataQualityGrade":"A+","lastUpdateEt":"9/30/2020 12:00","dateModified":"2020-09-30T12:00:00Z","checkTimeEt":"09/30 08:00","death":3532,"hospitalized":null,"dateChecked":"2020-09-30T12:00:00Z","totalTestsViral":3029942,"positiveTestsViral":null,"negativeTestsViral":null,"positiveCasesViral":205703,"deathConfirmed":3505,"deathProbable":27,"totalTestEncountersViral":null,"totalTestsPeopleViral":null,"totalTestsAntibody":null,"positiveTestsAntibody":null,"negativeTestsAntibody":null,"totalTestsPeopleAntibody":null,"positiveTestsPeopleAntibody":null,"negativeTestsPeopleAntibody":null,"totalTestsPeopleAntigen":null,"positiveTestsPeopleAntigen":null,"totalTestsAntigen":2337,"positiveTestsAntigen":null,"fips":"37","positiveIncrease":1495,"negativeIncrease":13790,"total":3034871,"totalTestResultsIncrease":15285,"posNeg":3034871,"deathIncrease":38,"hospitalizedIncrease":0,"hash":"49533b2ddfc5f1f1c2b09456d29251b532267b11","commercialScore":0,"negativeRegularScore":0,"negativeScore":0,"positiveScore":0,"score":0,"grade":""},{"date":20200929,"state":"NC","positive":209137,"probableCases":4806,"negative":2810449,"pending":null,"totalTestResultsSource":"posNeg","totalTestResults":3019586,"hospitalizedCurrently":950,"hospitalizedCumulative":null,"inIcuCurrently":287,"inIcuCumulative":null,"onVentilatorCurrently":null,"onVentilatorCumulative":null,"recovered":184422,"dataQualityGrade":"A+","lastUpdateEt":"9/29/2020 12:45","dateModified":"2020-09-29T12:45:00Z","checkTimeEt":"09/29 08:45","death":3494,"hospitalized":null,"dateChecked":"2020-09-29T12:45:00Z","totalTestsViral":3014780,"positiveTestsViral":null,"negativeTestsViral":null,"positiveCasesViral":204331,"deathConfirmed":3467,"deathProbable":27,"totalTestEncountersViral":null,"totalTestsPeopleViral":null,"totalTestsAntibody":null,"positiveTestsAntibody":null,"negativeTestsAntibody":null,"totalTestsPeopleAntibody":null,"positiveTestsPeopleAntibody":null,"negativeTestsPeopleAntibody":null,"totalTestsPeopleAntigen":null,"positiveTestsPeopleAntigen":null,"totalTestsAntigen":null,"positiveTestsAntigen":null,"fips":"37","positiveIncrease":889,"negativeIncrease":14164,"total":3019586,"totalTestResultsIncrease":15053,"posNeg":3019586,"deathIncrease":49,"hospitalizedIncrease":0,"hash":"2358679beba88c3856ced935fa1beb0853fc5b16","commercialScore":0,"negativeRegularScore":0,"negativeScore":0,"positiveScore":0,"score":0,"grade":""},{"date":20200928,"state":"NC","positive":208248,"probableCases":4680,"negative":2796285,"pending":null,"totalTestResultsSource":"posNeg","totalTestResults":3004533,"hospitalizedCurrently":897,"hospitalizedCumulative":null,"inIcuCurrently":271,"inIcuCumulative":null,"onVentilatorCurrently":null,"onVentilatorCumulative":null,"recovered":184422,"dataQualityGrade":"A+","lastUpdateEt":"9/28/2020 12:00","dateModified":"2020-09-28T12:00:00Z","checkTimeEt":"09/28 08:00","death":3445,"hospitalized":null,"dateChecked":"2020-09-28T12:00:00Z","totalTestsViral":2999853,"positiveTestsViral":null,"negativeTestsViral":null,"positiveCasesViral":203568,"deathConfirmed":3418,"deathProbable":27,"totalTestEncountersViral":null,"totalTestsPeopleViral":null,"totalTestsAntibody":null,"positiveTestsAntibody":null,"negativeTestsAntibody":null,"totalTestsPeopleAntibody":null,"positiveTestsPeopleAntibody":null,"negativeTestsPeopleAntibody":null,"totalTestsPeopleAntigen":null,"positiveTestsPeopleAntigen":null,"totalTestsAntigen":null,"positiveTestsAntigen":null,"fips":"37","positiveIncrease":868,"negativeIncrease":24937,"total":3004533,"totalTestResultsIncrease":25805,"posNeg":3004533,"deathIncrease":4,"hospitalizedIncrease":0,"hash":"082eb2ffd3677ab6a91fa5ae723979c9be27aca0","commercialScore":0,"negativeRegularScore":0,"negativeScore":0,"positiveScore":0,"score":0,"grade":""},{"date":20200927,"state":"NC","positive":207380,"probableCases":4676,"negative":2771348,"pending":null,"totalTestResultsSource":"posNeg","totalTestResults":2978728,"hospitalizedCurrently":917,"hospitalizedCumulative":null,"inIcuCurrently":269,"inIcuCumulative":null,"onVentilatorCurrently":null,"onVentilatorCumulative":null,"recovered":176422,"dataQualityGrade":"A+","lastUpdateEt":"9/27/2020 12:05","dateModified":"2020-09-27T12:05:00Z","checkTimeEt":"09/27 08:05","death":3441,"hospitalized":null,"dateChecked":"2020-09-27T12:05:00Z","totalTestsViral":2974052,"positiveTestsViral":null,"negativeTestsViral":null,"positiveCasesViral":202704,"deathConfirmed":3414,"deathProbable":27,"totalTestEncountersViral":null,"totalTestsPeopleViral":null,"totalTestsAntibody":null,"positiveTestsAntibody":null,"negativeTestsAntibody":null,"totalTestsPeopleAntibody":null,"positiveTestsPeopleAntibody":null,"negativeTestsPeopleAntibody":null,"totalTestsPeopleAntigen":null,"positiveTestsPeopleAntigen":null,"totalTestsAntigen":null,"positiveTestsAntigen":null,"fips":"37","positiveIncrease":1290,"negativeIncrease":29635,"total":2978728,"totalTestResultsIncrease":30925,"posNeg":2978728,"deathIncrease":1,"hospitalizedIncrease":0,"hash":"90b158423e3829a3cdc4c680e64b1070c19bbbf1","commercialScore":0,"negativeRegularScore":0,"negativeScore":0,"positiveScore":0,"score":0,"grade":""},{"date":20200926,"state":"NC","positive":206090,"probableCases":4659,"negative":2741713,"pending":null,"totalTestResultsSource":"posNeg","totalTestResults":2947803,"hospitalizedCurrently":914,"hospitalizedCumulative":null,"inIcuCurrently":272,"inIcuCumulative":null,"onVentilatorCurrently":null,"onVentilatorCumulative":null,"recovered":176422,"dataQualityGrade":"A+","lastUpdateEt":"9/26/2020 12:00","dateModified":"2020-09-26T12:00:00Z","checkTimeEt":"09/26 08:00","death":3440,"hospitalized":null,"dateChecked":"2020-09-26T12:00:00Z","totalTestsViral":2943144,"positiveTestsViral":null,"negativeTestsViral":null,"positiveCasesViral":201431,"deathConfirmed":3413,"deathProbable":27,"totalTestEncountersViral":null,"totalTestsPeopleViral":null,"totalTestsAntibody":null,"positiveTestsAntibody":null,"negativeTestsAntibody":null,"totalTestsPeopleAntibody":null,"positiveTestsPeopleAntibody":null,"negativeTestsPeopleAntibody":null,"totalTestsPeopleAntigen":null,"positiveTestsPeopleAntigen":null,"totalTestsAntigen":null,"positiveTestsAntigen":null,"fips":"37","positiveIncrease":1759,"negativeIncrease":38427,"total":2947803,"totalTestResultsIncrease":40186,"posNeg":2947803,"deathIncrease":31,"hospitalizedIncrease":0,"hash":"8927a6e9fe33c745155515c99879da3047d9e315","commercialScore":0,"negativeRegularScore":0,"negativeScore":0,"positiveScore":0,"score":0,"grade":""},{"date":20200925,"state":"NC","positive":204331,"probableCases":4563,"negative":2703286,"pending":null,"totalTestResultsSource":"posNeg","totalTestResults":2907617,"hospitalizedCurrently":903,"hospitalizedCumulative":null,"inIcuCurrently":281,"inIcuCumulative":null,"onVentilatorCurrently":null,"onVentilatorCumulative":null,"recovered":176422,"dataQualityGrade":"A+","lastUpdateEt":"9/25/2020 13:30","dateModified":"2020-09-25T13:30:00Z","checkTimeEt":"09/25 09:30","death":3409,"hospitalized":null,"dateChecked":"2020-09-25T13:30:00Z","totalTestsViral":2903054,"positiveTestsViral":null,"negativeTestsViral":null,"positiveCasesViral":199768,"deathConfirmed":3409,"deathProbable":null,"totalTestEncountersViral":null,"totalTestsPeopleViral":null,"totalTestsAntibody":null,"positiveTestsAntibody":null,"negativeTestsAntibody":null,"totalTestsPeopleAntibody":null,"positiveTestsPeopleAntibody":null,"negativeTestsPeopleAntibody":null,"totalTestsPeopleAntigen":null,"positiveTestsPeopleAntigen":null,"totalTestsAntigen":null,"positiveTestsAntigen":null,"fips":"37","positiveIncrease":6142,"negativeIncrease":31284,"total":2907617,"totalTestResultsIncrease":37426,"posNeg":2907617,"deathIncrease":53,"hospitalizedIncrease":0,"hash":"70b1905ef28989961e7a6852892943e84d2d2e03","commercialScore":0,"negativeRegularScore":0,"negativeScore":0,"positiveScore":0,"score":0,"grade":""},{"date":20200924,"state":"NC","positive":198189,"probableCases":null,"negative":2672002,"pending":null,"totalTestResultsSource":"posNeg","totalTestResults":2870191,"hospitalizedCurrently":902,"hospitalizedCumulative":null,"inIcuCurrently":279,"inIcuCumulative":null,"onVentilatorCurrently":null,"onVentilatorCumulative":null,"recovered":176422,"dataQualityGrade":"A+","lastUpdateEt":"9/24/2020 11:50","dateModified":"2020-09-24T11:50:00Z","checkTimeEt":"09/24 07:50","death":3356,"hospitalized":null,"dateChecked":"2020-09-24T11:50:00Z","totalTestsViral":2870191,"positiveTestsViral":null,"negativeTestsViral":null,"positiveCasesViral":198189,"deathConfirmed":3356,"deathProbable":null,"totalTestEncountersViral":null,"totalTestsPeopleViral":null,"totalTestsAntibody":null,"positiveTestsAntibody":null,"negativeTestsAntibody":null,"totalTestsPeopleAntibody":null,"positiveTestsPeopleAntibody":null,"negativeTestsPeopleAntibody":null,"totalTestsPeopleAntigen":null,"positiveTestsPeopleAntigen":null,"totalTestsAntigen":null,"positiveTestsAntigen":null,"fips":"37","positiveIncrease":1688,"negativeIncrease":26076,"total":2870191,"totalTestResultsIncrease":27764,"posNeg":2870191,"deathIncrease":40,"hospitalizedIncrease":0,"hash":"b34f55f10b1086265904dd7a692eb434e371755f","commercialScore":0,"negativeRegularScore":0,"negativeScore":0,"positiveScore":0,"score":0,"grade":""},{"date":20200923,"state":"NC","positive":196501,"probableCases":null,"negative":2645926,"pending":null,"totalTestResultsSource":"posNeg","totalTestResults":2842427,"hospitalizedCurrently":912,"hospitalizedCumulative":null,"inIcuCurrently":281,"inIcuCumulative":null,"onVentilatorCurrently":null,"onVentilatorCumulative":null,"recovered":176422,"dataQualityGrade":"A+","lastUpdateEt":"9/23/2020 12:10","dateModified":"2020-09-23T12:10:00Z","checkTimeEt":"09/23 08:10","death":3316,"hospitalized":null,"dateChecked":"2020-09-23T12:10:00Z","totalTestsViral":2842427,"positiveTestsViral":null,"negativeTestsViral":null,"positiveCasesViral":196501,"deathConfirmed":3316,"deathProbable":null,"totalTestEncountersViral":null,"totalTestsPeopleViral":null,"totalTestsAntibody":null,"positiveTestsAntibody":null,"negativeTestsAntibody":null,"totalTestsPeopleAntibody":null,"positiveTestsPeopleAntibody":null,"negativeTestsPeopleAntibody":null,"totalTestsPeopleAntigen":null,"positiveTestsPeopleAntigen":null,"totalTestsAntigen":null,"positiveTestsAntigen":null,"fips":"37","positiveIncrease":952,"negativeIncrease":16546,"total":2842427,"totalTestResultsIncrease":17498,"posNeg":2842427,"deathIncrease":30,"hospitalizedIncrease":0,"hash":"980345bd6dc2b57f3accaeaf693aff253618b698","commercialScore":0,"negativeRegularScore":0,"negativeScore":0,"positiveScore":0,"score":0,"grade":""},{"date":20200922,"state":"NC","positive":195549,"probableCases":null,"negative":2629380,"pending":null,"totalTestResultsSource":"posNeg","totalTestResults":2824929,"hospitalizedCurrently":905,"hospitalizedCumulative":null,"inIcuCurrently":277,"inIcuCumulative":null,"onVentilatorCurrently":null,"onVentilatorCumulative":null,"recovered":176422,"dataQualityGrade":"A+","lastUpdateEt":"9/22/2020 12:05","dateModified":"2020-09-22T12:05:00Z","checkTimeEt":"09/22 08:05","death":3286,"hospitalized":null,"dateChecked":"2020-09-22T12:05:00Z","totalTestsViral":2824929,"positiveTestsViral":null,"negativeTestsViral":null,"positiveCasesViral":195549,"deathConfirmed":3286,"deathProbable":null,"totalTestEncountersViral":null,"totalTestsPeopleViral":null,"totalTestsAntibody":null,"positiveTestsAntibody":null,"negativeTestsAntibody":null,"totalTestsPeopleAntibody":null,"positiveTestsPeopleAntibody":null,"negativeTestsPeopleAntibody":null,"totalTestsPeopleAntigen":null,"positiveTestsPeopleAntigen":null,"totalTestsAntigen":null,"positiveTestsAntigen":null,"fips":"37","positiveIncrease":1168,"negativeIncrease":6222,"total":2824929,"totalTestResultsIncrease":7390,"posNeg":2824929,"deathIncrease":39,"hospitalizedIncrease":0,"hash":"11fc2bb2a649ddaab7d7f79d191342c31a07bb5c","commercialScore":0,"negativeRegularScore":0,"negativeScore":0,"positiveScore":0,"score":0,"grade":""},{"date":20200921,"state":"NC","positive":194381,"probableCases":null,"negative":2623158,"pending":null,"totalTestResultsSource":"posNeg","totalTestResults":2817539,"hospitalizedCurrently":885,"hospitalizedCumulative":null,"inIcuCurrently":277,"inIcuCumulative":null,"onVentilatorCurrently":null,"onVentilatorCumulative":null,"recovered":176422,"dataQualityGrade":"A+","lastUpdateEt":"9/21/2020 12:15","dateModified":"2020-09-21T12:15:00Z","checkTimeEt":"09/21 08:15","death":3247,"hospitalized":null,"dateChecked":"2020-09-21T12:15:00Z","totalTestsViral":2817539,"positiveTestsViral":null,"negativeTestsViral":null,"positiveCasesViral":194381,"deathConfirmed":3247,"deathProbable":null,"totalTestEncountersViral":null,"totalTestsPeopleViral":null,"totalTestsAntibody":null,"positiveTestsAntibody":null,"negativeTestsAntibody":null,"totalTestsPeopleAntibody":null,"positiveTestsPeopleAntibody":null,"negativeTestsPeopleAntibody":null,"totalTestsPeopleAntigen":null,"positiveTestsPeopleAntigen":null,"totalTestsAntigen":null,"positiveTestsAntigen":null,"fips":"37","positiveIncrease":800,"negativeIncrease":11921,"total":2817539,"totalTestResultsIncrease":12721,"posNeg":2817539,"deathIncrease":4,"hospitalizedIncrease":0,"hash":"af8d7c612d4063c4d1f21acfebe0ca3ba89111cc","commercialScore":0,"negativeRegularScore":0,"negativeScore":0,"positiveScore":0,"score":0,"grade":""},{"date":20200920,"state":"NC","positive":193581,"probableCases":null,"negative":2611237,"pending":null,"totalTestResultsSource":"posNeg","totalTestResults":2804818,"hospitalizedCurrently":889,"hospitalizedCumulative":null,"inIcuCurrently":292,"inIcuCumulative":null,"onVentilatorCurrently":null,"onVentilatorCumulative":null,"recovered":167257,"dataQualityGrade":"A+","lastUpdateEt":"9/20/2020 11:50","dateModified":"2020-09-20T11:50:00Z","checkTimeEt":"09/20 07:50","death":3243,"hospitalized":null,"dateChecked":"2020-09-20T11:50:00Z","totalTestsViral":2804818,"positiveTestsViral":null,"negativeTestsViral":null,"positiveCasesViral":193581,"deathConfirmed":3243,"deathProbable":null,"totalTestEncountersViral":null,"totalTestsPeopleViral":null,"totalTestsAntibody":null,"positiveTestsAntibody":null,"negativeTestsAntibody":null,"totalTestsPeopleAntibody":null,"positiveTestsPeopleAntibody":null,"negativeTestsPeopleAntibody":null,"totalTestsPeopleAntigen":null,"positiveTestsPeopleAntigen":null,"totalTestsAntigen":null,"positiveTestsAntigen":null,"fips":"37","positiveIncrease":1333,"negativeIncrease":32465,"total":2804818,"totalTestResultsIncrease":33798,"posNeg":2804818,"deathIncrease":8,"hospitalizedIncrease":0,"hash":"2f4378f52aebf59267a897d543fdbda7ade8d162","commercialScore":0,"negativeRegularScore":0,"negativeScore":0,"positiveScore":0,"score":0,"grade":""},{"date":20200919,"state":"NC","positive":192248,"probableCases":null,"negative":2578772,"pending":null,"totalTestResultsSource":"posNeg","totalTestResults":2771020,"hospitalizedCurrently":882,"hospitalizedCumulative":null,"inIcuCurrently":293,"inIcuCumulative":null,"onVentilatorCurrently":null,"onVentilatorCumulative":null,"recovered":167257,"dataQualityGrade":"A+","lastUpdateEt":"9/19/2020 11:45","dateModified":"2020-09-19T11:45:00Z","checkTimeEt":"09/19 07:45","death":3235,"hospitalized":null,"dateChecked":"2020-09-19T11:45:00Z","totalTestsViral":2771020,"positiveTestsViral":null,"negativeTestsViral":null,"positiveCasesViral":192248,"deathConfirmed":3235,"deathProbable":null,"totalTestEncountersViral":null,"totalTestsPeopleViral":null,"totalTestsAntibody":null,"positiveTestsAntibody":null,"negativeTestsAntibody":null,"totalTestsPeopleAntibody":null,"positiveTestsPeopleAntibody":null,"negativeTestsPeopleAntibody":null,"totalTestsPeopleAntigen":null,"positiveTestsPeopleAntigen":null,"totalTestsAntigen":null,"positiveTestsAntigen":null,"fips":"37","positiveIncrease":1229,"negativeIncrease":20771,"total":2771020,"totalTestResultsIncrease":22000,"posNeg":2771020,"deathIncrease":28,"hospitalizedIncrease":0,"hash":"71e346a5c8a158d401c7d842f19d20b9973b61d3","commercialScore":0,"negativeRegularScore":0,"negativeScore":0,"positiveScore":0,"score":0,"grade":""},{"date":20200918,"state":"NC","positive":191019,"probableCases":null,"negative":2558001,"pending":null,"totalTestResultsSource":"posNeg","totalTestResults":2749020,"hospitalizedCurrently":904,"hospitalizedCumulative":null,"inIcuCurrently":283,"inIcuCumulative":null,"onVentilatorCurrently":null,"onVentilatorCumulative":null,"recovered":167257,"dataQualityGrade":"A+","lastUpdateEt":"9/18/2020 11:00","dateModified":"2020-09-18T11:00:00Z","checkTimeEt":"09/18 07:00","death":3207,"hospitalized":null,"dateChecked":"2020-09-18T11:00:00Z","totalTestsViral":2749020,"positiveTestsViral":null,"negativeTestsViral":null,"positiveCasesViral":191019,"deathConfirmed":3207,"deathProbable":null,"totalTestEncountersViral":null,"totalTestsPeopleViral":null,"totalTestsAntibody":null,"positiveTestsAntibody":null,"negativeTestsAntibody":null,"totalTestsPeopleAntibody":null,"positiveTestsPeopleAntibody":null,"negativeTestsPeopleAntibody":null,"totalTestsPeopleAntigen":null,"positiveTestsPeopleAntigen":null,"totalTestsAntigen":null,"positiveTestsAntigen":null,"fips":"37","positiveIncrease":1443,"negativeIncrease":33402,"total":2749020,"totalTestResultsIncrease":34845,"posNeg":2749020,"deathIncrease":27,"hospitalizedIncrease":0,"hash":"e0846de94d5dac3498ee3f98ed21cde02a3677b4","commercialScore":0,"negativeRegularScore":0,"negativeScore":0,"positiveScore":0,"score":0,"grade":""},{"date":20200917,"state":"NC","positive":189576,"probableCases":null,"negative":2524599,"pending":null,"totalTestResultsSource":"posNeg","totalTestResults":2714175,"hospitalizedCurrently":894,"hospitalizedCumulative":null,"inIcuCurrently":286,"inIcuCumulative":null,"onVentilatorCurrently":null,"onVentilatorCumulative":null,"recovered":167257,"dataQualityGrade":"A+","lastUpdateEt":"9/17/2020 11:00","dateModified":"2020-09-17T11:00:00Z","checkTimeEt":"09/17 07:00","death":3180,"hospitalized":null,"dateChecked":"2020-09-17T11:00:00Z","totalTestsViral":2714175,"positiveTestsViral":null,"negativeTestsViral":null,"positiveCasesViral":189576,"deathConfirmed":3180,"deathProbable":null,"totalTestEncountersViral":null,"totalTestsPeopleViral":null,"totalTestsAntibody":null,"positiveTestsAntibody":null,"negativeTestsAntibody":null,"totalTestsPeopleAntibody":null,"positiveTestsPeopleAntibody":null,"negativeTestsPeopleAntibody":null,"totalTestsPeopleAntigen":null,"positiveTestsPeopleAntigen":null,"totalTestsAntigen":null,"positiveTestsAntigen":null,"fips":"37","positiveIncrease":1552,"negativeIncrease":29239,"total":2714175,"totalTestResultsIncrease":30791,"posNeg":2714175,"deathIncrease":31,"hospitalizedIncrease":0,"hash":"44850dbe962fac015af0430ace5f74aa58eccc85","commercialScore":0,"negativeRegularScore":0,"negativeScore":0,"positiveScore":0,"score":0,"grade":""},{"date":20200916,"state":"NC","positive":188024,"probableCases":null,"negative":2495360,"pending":null,"totalTestResultsSource":"posNeg","totalTestResults":2683384,"hospitalizedCurrently":918,"hospitalizedCumulative":null,"inIcuCurrently":297,"inIcuCumulative":null,"onVentilatorCurrently":null,"onVentilatorCumulative":null,"recovered":167257,"dataQualityGrade":"A+","lastUpdateEt":"9/16/2020 11:15","dateModified":"2020-09-16T11:15:00Z","checkTimeEt":"09/16 07:15","death":3149,"hospitalized":null,"dateChecked":"2020-09-16T11:15:00Z","totalTestsViral":2683384,"positiveTestsViral":null,"negativeTestsViral":null,"positiveCasesViral":188024,"deathConfirmed":3149,"deathProbable":null,"totalTestEncountersViral":null,"totalTestsPeopleViral":null,"totalTestsAntibody":null,"positiveTestsAntibody":null,"negativeTestsAntibody":null,"totalTestsPeopleAntibody":null,"positiveTestsPeopleAntibody":null,"negativeTestsPeopleAntibody":null,"totalTestsPeopleAntigen":null,"positiveTestsPeopleAntigen":null,"totalTestsAntigen":null,"positiveTestsAntigen":null,"fips":"37","positiveIncrease":1137,"negativeIncrease":29807,"total":2683384,"totalTestResultsIncrease":30944,"posNeg":2683384,"deathIncrease":38,"hospitalizedIncrease":0,"hash":"d661a8f4ed05d8c197592931fed085827771a00f","commercialScore":0,"negativeRegularScore":0,"negativeScore":0,"positiveScore":0,"score":0,"grade":""},{"date":20200915,"state":"NC","positive":186887,"probableCases":null,"negative":2465553,"pending":null,"totalTestResultsSource":"posNeg","totalTestResults":2652440,"hospitalizedCurrently":916,"hospitalizedCumulative":null,"inIcuCurrently":297,"inIcuCumulative":null,"onVentilatorCurrently":null,"onVentilatorCumulative":null,"recovered":167257,"dataQualityGrade":"A+","lastUpdateEt":"9/15/2020 10:55","dateModified":"2020-09-15T10:55:00Z","checkTimeEt":"09/15 06:55","death":3111,"hospitalized":null,"dateChecked":"2020-09-15T10:55:00Z","totalTestsViral":2652440,"positiveTestsViral":null,"negativeTestsViral":null,"positiveCasesViral":186887,"deathConfirmed":3111,"deathProbable":null,"totalTestEncountersViral":null,"totalTestsPeopleViral":null,"totalTestsAntibody":null,"positiveTestsAntibody":null,"negativeTestsAntibody":null,"totalTestsPeopleAntibody":null,"positiveTestsPeopleAntibody":null,"negativeTestsPeopleAntibody":null,"totalTestsPeopleAntigen":null,"positiveTestsPeopleAntigen":null,"totalTestsAntigen":null,"positiveTestsAntigen":null,"fips":"37","positiveIncrease":1106,"negativeIncrease":16515,"total":2652440,"totalTestResultsIncrease":17621,"posNeg":2652440,"deathIncrease":51,"hospitalizedIncrease":0,"hash":"83779ab33c12afc56e81484082d5398ec5b804f9","commercialScore":0,"negativeRegularScore":0,"negativeScore":0,"positiveScore":0,"score":0,"grade":""},{"date":20200914,"state":"NC","positive":185781,"probableCases":null,"negative":2449038,"pending":null,"totalTestResultsSource":"posNeg","totalTestResults":2634819,"hospitalizedCurrently":895,"hospitalizedCumulative":null,"inIcuCurrently":293,"inIcuCumulative":null,"onVentilatorCurrently":null,"onVentilatorCumulative":null,"recovered":167257,"dataQualityGrade":"A+","lastUpdateEt":"9/14/2020 11:50","dateModified":"2020-09-14T11:50:00Z","checkTimeEt":"09/14 07:50","death":3060,"hospitalized":null,"dateChecked":"2020-09-14T11:50:00Z","totalTestsViral":2634819,"positiveTestsViral":null,"negativeTestsViral":null,"positiveCasesViral":185781,"deathConfirmed":3060,"deathProbable":null,"totalTestEncountersViral":null,"totalTestsPeopleViral":null,"totalTestsAntibody":null,"positiveTestsAntibody":null,"negativeTestsAntibody":null,"totalTestsPeopleAntibody":null,"positiveTestsPeopleAntibody":null,"negativeTestsPeopleAntibody":null,"totalTestsPeopleAntigen":null,"positiveTestsPeopleAntigen":null,"totalTestsAntigen":null,"positiveTestsAntigen":null,"fips":"37","positiveIncrease":845,"negativeIncrease":17866,"total":2634819,"totalTestResultsIncrease":18711,"posNeg":2634819,"deathIncrease":8,"hospitalizedIncrease":0,"hash":"bc83944b5eeaed166f9efe4a7bb9c1235b0d4891","commercialScore":0,"negativeRegularScore":0,"negativeScore":0,"positiveScore":0,"score":0,"grade":""},{"date":20200913,"state":"NC","positive":184936,"probableCases":null,"negative":2431172,"pending":null,"totalTestResultsSource":"posNeg","totalTestResults":2616108,"hospitalizedCurrently":831,"hospitalizedCumulative":null,"inIcuCurrently":270,"inIcuCumulative":null,"onVentilatorCurrently":null,"onVentilatorCumulative":null,"recovered":156652,"dataQualityGrade":"A+","lastUpdateEt":"9/13/2020 11:50","dateModified":"2020-09-13T11:50:00Z","checkTimeEt":"09/13 07:50","death":3052,"hospitalized":null,"dateChecked":"2020-09-13T11:50:00Z","totalTestsViral":2616108,"positiveTestsViral":null,"negativeTestsViral":null,"positiveCasesViral":184936,"deathConfirmed":3052,"deathProbable":null,"totalTestEncountersViral":null,"totalTestsPeopleViral":null,"totalTestsAntibody":null,"positiveTestsAntibody":null,"negativeTestsAntibody":null,"totalTestsPeopleAntibody":null,"positiveTestsPeopleAntibody":null,"negativeTestsPeopleAntibody":null,"totalTestsPeopleAntigen":null,"positiveTestsPeopleAntigen":null,"totalTestsAntigen":null,"positiveTestsAntigen":null,"fips":"37","positiveIncrease":1196,"negativeIncrease":33780,"total":2616108,"totalTestResultsIncrease":34976,"posNeg":2616108,"deathIncrease":5,"hospitalizedIncrease":0,"hash":"bd2c5e5b518c2136f6f5650da167dba6a10b9a6c","commercialScore":0,"negativeRegularScore":0,"negativeScore":0,"positiveScore":0,"score":0,"grade":""},{"date":20200912,"state":"NC","positive":183740,"probableCases":null,"negative":2397392,"pending":null,"totalTestResultsSource":"posNeg","totalTestResults":2581132,"hospitalizedCurrently":870,"hospitalizedCumulative":null,"inIcuCurrently":287,"inIcuCumulative":null,"onVentilatorCurrently":null,"onVentilatorCumulative":null,"recovered":156652,"dataQualityGrade":"A+","lastUpdateEt":"9/12/2020 12:25","dateModified":"2020-09-12T12:25:00Z","checkTimeEt":"09/12 08:25","death":3047,"hospitalized":null,"dateChecked":"2020-09-12T12:25:00Z","totalTestsViral":2581132,"positiveTestsViral":null,"negativeTestsViral":null,"positiveCasesViral":183740,"deathConfirmed":3047,"deathProbable":null,"totalTestEncountersViral":null,"totalTestsPeopleViral":null,"totalTestsAntibody":null,"positiveTestsAntibody":null,"negativeTestsAntibody":null,"totalTestsPeopleAntibody":null,"positiveTestsPeopleAntibody":null,"negativeTestsPeopleAntibody":null,"totalTestsPeopleAntigen":null,"positiveTestsPeopleAntigen":null,"totalTestsAntigen":null,"positiveTestsAntigen":null,"fips":"37","positiveIncrease":1454,"negativeIncrease":21024,"total":2581132,"totalTestResultsIncrease":22478,"posNeg":2581132,"deathIncrease":24,"hospitalizedIncrease":0,"hash":"4c2943eafe33aa6d45e9b5842805a97d71890859","commercialScore":0,"negativeRegularScore":0,"negativeScore":0,"positiveScore":0,"score":0,"grade":""},{"date":20200911,"state":"NC","positive":182286,"probableCases":null,"negative":2376368,"pending":null,"totalTestResultsSource":"posNeg","totalTestResults":2558654,"hospitalizedCurrently":938,"hospitalizedCumulative":null,"inIcuCurrently":292,"inIcuCumulative":null,"onVentilatorCurrently":null,"onVentilatorCumulative":null,"recovered":156652,"dataQualityGrade":"A+","lastUpdateEt":"9/11/2020 12:50","dateModified":"2020-09-11T12:50:00Z","checkTimeEt":"09/11 08:50","death":3023,"hospitalized":null,"dateChecked":"2020-09-11T12:50:00Z","totalTestsViral":2558654,"positiveTestsViral":null,"negativeTestsViral":null,"positiveCasesViral":182286,"deathConfirmed":3023,"deathProbable":null,"totalTestEncountersViral":null,"totalTestsPeopleViral":null,"totalTestsAntibody":null,"positiveTestsAntibody":null,"negativeTestsAntibody":null,"totalTestsPeopleAntibody":null,"positiveTestsPeopleAntibody":null,"negativeTestsPeopleAntibody":null,"totalTestsPeopleAntigen":null,"positiveTestsPeopleAntigen":null,"totalTestsAntigen":null,"positiveTestsAntigen":null,"fips":"37","positiveIncrease":1532,"negativeIncrease":35283,"total":2558654,"totalTestResultsIncrease":36815,"posNeg":2558654,"deathIncrease":33,"hospitalizedIncrease":0,"hash":"7e0409e7129140df69f9ba681d00a73ca6b4b660","commercialScore":0,"negativeRegularScore":0,"negativeScore":0,"positiveScore":0,"score":0,"grade":""},{"date":20200910,"state":"NC","positive":180754,"probableCases":null,"negative":2341085,"pending":null,"totalTestResultsSource":"posNeg","totalTestResults":2521839,"hospitalizedCurrently":928,"hospitalizedCumulative":null,"inIcuCurrently":291,"inIcuCumulative":null,"onVentilatorCurrently":null,"onVentilatorCumulative":null,"recovered":156652,"dataQualityGrade":"A+","lastUpdateEt":"9/10/2020 11:30","dateModified":"2020-09-10T11:30:00Z","checkTimeEt":"09/10 07:30","death":2990,"hospitalized":null,"dateChecked":"2020-09-10T11:30:00Z","totalTestsViral":2521839,"positiveTestsViral":null,"negativeTestsViral":null,"positiveCasesViral":180754,"deathConfirmed":2990,"deathProbable":null,"totalTestEncountersViral":null,"totalTestsPeopleViral":null,"totalTestsAntibody":null,"positiveTestsAntibody":null,"negativeTestsAntibody":null,"totalTestsPeopleAntibody":null,"positiveTestsPeopleAntibody":null,"negativeTestsPeopleAntibody":null,"totalTestsPeopleAntigen":null,"positiveTestsPeopleAntigen":null,"totalTestsAntigen":null,"positiveTestsAntigen":null,"fips":"37","positiveIncrease":1222,"negativeIncrease":30504,"total":2521839,"totalTestResultsIncrease":31726,"posNeg":2521839,"deathIncrease":32,"hospitalizedIncrease":0,"hash":"349db61bf7a7b07a574c7ceb1050f6bbfa854f83","commercialScore":0,"negativeRegularScore":0,"negativeScore":0,"positiveScore":0,"score":0,"grade":""},{"date":20200909,"state":"NC","positive":179532,"probableCases":null,"negative":2310581,"pending":null,"totalTestResultsSource":"posNeg","totalTestResults":2490113,"hospitalizedCurrently":916,"hospitalizedCumulative":null,"inIcuCurrently":296,"inIcuCumulative":null,"onVentilatorCurrently":null,"onVentilatorCumulative":null,"recovered":156652,"dataQualityGrade":"A+","lastUpdateEt":"9/9/2020 11:40","dateModified":"2020-09-09T11:40:00Z","checkTimeEt":"09/09 07:40","death":2958,"hospitalized":null,"dateChecked":"2020-09-09T11:40:00Z","totalTestsViral":2490113,"positiveTestsViral":null,"negativeTestsViral":null,"positiveCasesViral":179532,"deathConfirmed":2958,"deathProbable":null,"totalTestEncountersViral":null,"totalTestsPeopleViral":null,"totalTestsAntibody":null,"positiveTestsAntibody":null,"negativeTestsAntibody":null,"totalTestsPeopleAntibody":null,"positiveTestsPeopleAntibody":null,"negativeTestsPeopleAntibody":null,"totalTestsPeopleAntigen":null,"positiveTestsPeopleAntigen":null,"totalTestsAntigen":null,"positiveTestsAntigen":null,"fips":"37","positiveIncrease":897,"negativeIncrease":19239,"total":2490113,"totalTestResultsIncrease":20136,"posNeg":2490113,"deathIncrease":49,"hospitalizedIncrease":0,"hash":"d1bb78fbcaa2d16ba11f088e98a520b1fcaaf254","commercialScore":0,"negativeRegularScore":0,"negativeScore":0,"positiveScore":0,"score":0,"grade":""},{"date":20200908,"state":"NC","positive":178635,"probableCases":null,"negative":2291342,"pending":null,"totalTestResultsSource":"posNeg","totalTestResults":2469977,"hospitalizedCurrently":827,"hospitalizedCumulative":null,"inIcuCurrently":262,"inIcuCumulative":null,"onVentilatorCurrently":null,"onVentilatorCumulative":null,"recovered":156652,"dataQualityGrade":"A+","lastUpdateEt":"9/8/2020 12:05","dateModified":"2020-09-08T12:05:00Z","checkTimeEt":"09/08 08:05","death":2909,"hospitalized":null,"dateChecked":"2020-09-08T12:05:00Z","totalTestsViral":2469977,"positiveTestsViral":null,"negativeTestsViral":null,"positiveCasesViral":178635,"deathConfirmed":2909,"deathProbable":null,"totalTestEncountersViral":null,"totalTestsPeopleViral":null,"totalTestsAntibody":null,"positiveTestsAntibody":null,"negativeTestsAntibody":null,"totalTestsPeopleAntibody":null,"positiveTestsPeopleAntibody":null,"negativeTestsPeopleAntibody":null,"totalTestsPeopleAntigen":null,"positiveTestsPeopleAntigen":null,"totalTestsAntigen":null,"positiveTestsAntigen":null,"fips":"37","positiveIncrease":716,"negativeIncrease":9679,"total":2469977,"totalTestResultsIncrease":10395,"posNeg":2469977,"deathIncrease":12,"hospitalizedIncrease":0,"hash":"ebb2fa122cc25fce6747d1b13ebf3446d4d89dce","commercialScore":0,"negativeRegularScore":0,"negativeScore":0,"positiveScore":0,"score":0,"grade":""},{"date":20200907,"state":"NC","positive":177919,"probableCases":null,"negative":2281663,"pending":null,"totalTestResultsSource":"posNeg","totalTestResults":2459582,"hospitalizedCurrently":765,"hospitalizedCumulative":null,"inIcuCurrently":248,"inIcuCumulative":null,"onVentilatorCurrently":null,"onVentilatorCumulative":null,"recovered":156652,"dataQualityGrade":"A+","lastUpdateEt":"9/6/2020 11:25","dateModified":"2020-09-06T11:25:00Z","checkTimeEt":"09/06 07:25","death":2897,"hospitalized":null,"dateChecked":"2020-09-06T11:25:00Z","totalTestsViral":2459582,"positiveTestsViral":null,"negativeTestsViral":null,"positiveCasesViral":177919,"deathConfirmed":2897,"deathProbable":null,"totalTestEncountersViral":null,"totalTestsPeopleViral":null,"totalTestsAntibody":null,"positiveTestsAntibody":null,"negativeTestsAntibody":null,"totalTestsPeopleAntibody":null,"positiveTestsPeopleAntibody":null,"negativeTestsPeopleAntibody":null,"totalTestsPeopleAntigen":null,"positiveTestsPeopleAntigen":null,"totalTestsAntigen":null,"positiveTestsAntigen":null,"fips":"37","positiveIncrease":1018,"negativeIncrease":15614,"total":2459582,"totalTestResultsIncrease":16632,"posNeg":2459582,"deathIncrease":7,"hospitalizedIncrease":0,"hash":"449266349915a4ed3bac3d00823241d205469b72","commercialScore":0,"negativeRegularScore":0,"negativeScore":0,"positiveScore":0,"score":0,"grade":""},{"date":20200906,"state":"NC","positive":176901,"probableCases":null,"negative":2266049,"pending":null,"totalTestResultsSource":"posNeg","totalTestResults":2442950,"hospitalizedCurrently":830,"hospitalizedCumulative":null,"inIcuCurrently":250,"inIcuCumulative":null,"onVentilatorCurrently":null,"onVentilatorCumulative":null,"recovered":145884,"dataQualityGrade":"A+","lastUpdateEt":"9/6/2020 11:25","dateModified":"2020-09-06T11:25:00Z","checkTimeEt":"09/06 07:25","death":2890,"hospitalized":null,"dateChecked":"2020-09-06T11:25:00Z","totalTestsViral":2442950,"positiveTestsViral":null,"negativeTestsViral":null,"positiveCasesViral":176901,"deathConfirmed":2890,"deathProbable":null,"totalTestEncountersViral":null,"totalTestsPeopleViral":null,"totalTestsAntibody":null,"positiveTestsAntibody":null,"negativeTestsAntibody":null,"totalTestsPeopleAntibody":null,"positiveTestsPeopleAntibody":null,"negativeTestsPeopleAntibody":null,"totalTestsPeopleAntigen":null,"positiveTestsPeopleAntigen":null,"totalTestsAntigen":null,"positiveTestsAntigen":null,"fips":"37","positiveIncrease":1086,"negativeIncrease":30993,"total":2442950,"totalTestResultsIncrease":32079,"posNeg":2442950,"deathIncrease":1,"hospitalizedIncrease":0,"hash":"d4f482a601e82e8ce1fddef6102081308863b4b5","commercialScore":0,"negativeRegularScore":0,"negativeScore":0,"positiveScore":0,"score":0,"grade":""},{"date":20200905,"state":"NC","positive":175815,"probableCases":null,"negative":2235056,"pending":null,"totalTestResultsSource":"posNeg","totalTestResults":2410871,"hospitalizedCurrently":831,"hospitalizedCumulative":null,"inIcuCurrently":254,"inIcuCumulative":null,"onVentilatorCurrently":null,"onVentilatorCumulative":null,"recovered":145884,"dataQualityGrade":"A+","lastUpdateEt":"9/5/2020 12:00","dateModified":"2020-09-05T12:00:00Z","checkTimeEt":"09/05 08:00","death":2889,"hospitalized":null,"dateChecked":"2020-09-05T12:00:00Z","totalTestsViral":2410871,"positiveTestsViral":null,"negativeTestsViral":null,"positiveCasesViral":175815,"deathConfirmed":2889,"deathProbable":null,"totalTestEncountersViral":null,"totalTestsPeopleViral":null,"totalTestsAntibody":null,"positiveTestsAntibody":null,"negativeTestsAntibody":null,"totalTestsPeopleAntibody":null,"positiveTestsPeopleAntibody":null,"negativeTestsPeopleAntibody":null,"totalTestsPeopleAntigen":null,"positiveTestsPeopleAntigen":null,"totalTestsAntigen":null,"positiveTestsAntigen":null,"fips":"37","positiveIncrease":1561,"negativeIncrease":20214,"total":2410871,"totalTestResultsIncrease":21775,"posNeg":2410871,"deathIncrease":50,"hospitalizedIncrease":0,"hash":"7a0abb5f12bc7e40a5a580221b95f4171822e8c0","commercialScore":0,"negativeRegularScore":0,"negativeScore":0,"positiveScore":0,"score":0,"grade":""},{"date":20200904,"state":"NC","positive":174254,"probableCases":null,"negative":2214842,"pending":null,"totalTestResultsSource":"posNeg","totalTestResults":2389096,"hospitalizedCurrently":955,"hospitalizedCumulative":null,"inIcuCurrently":281,"inIcuCumulative":null,"onVentilatorCurrently":null,"onVentilatorCumulative":null,"recovered":145884,"dataQualityGrade":"A+","lastUpdateEt":"9/4/2020 12:10","dateModified":"2020-09-04T12:10:00Z","checkTimeEt":"09/04 08:10","death":2839,"hospitalized":null,"dateChecked":"2020-09-04T12:10:00Z","totalTestsViral":2389096,"positiveTestsViral":null,"negativeTestsViral":null,"positiveCasesViral":174254,"deathConfirmed":2839,"deathProbable":null,"totalTestEncountersViral":null,"totalTestsPeopleViral":null,"totalTestsAntibody":null,"positiveTestsAntibody":null,"negativeTestsAntibody":null,"totalTestsPeopleAntibody":null,"positiveTestsPeopleAntibody":null,"negativeTestsPeopleAntibody":null,"totalTestsPeopleAntigen":null,"positiveTestsPeopleAntigen":null,"totalTestsAntigen":null,"positiveTestsAntigen":null,"fips":"37","positiveIncrease":2045,"negativeIncrease":39214,"total":2389096,"totalTestResultsIncrease":41259,"posNeg":2389096,"deathIncrease":36,"hospitalizedIncrease":0,"hash":"ecf32e22b62ffa5d877b2c4496feac21899595a7","commercialScore":0,"negativeRegularScore":0,"negativeScore":0,"positiveScore":0,"score":0,"grade":""},{"date":20200903,"state":"NC","positive":172209,"probableCases":null,"negative":2175628,"pending":null,"totalTestResultsSource":"posNeg","totalTestResults":2347837,"hospitalizedCurrently":858,"hospitalizedCumulative":null,"inIcuCurrently":257,"inIcuCumulative":null,"onVentilatorCurrently":null,"onVentilatorCumulative":null,"recovered":145884,"dataQualityGrade":"A+","lastUpdateEt":"9/3/2020 12:15","dateModified":"2020-09-03T12:15:00Z","checkTimeEt":"09/03 08:15","death":2803,"hospitalized":null,"dateChecked":"2020-09-03T12:15:00Z","totalTestsViral":2347837,"positiveTestsViral":null,"negativeTestsViral":null,"positiveCasesViral":172209,"deathConfirmed":2803,"deathProbable":null,"totalTestEncountersViral":null,"totalTestsPeopleViral":null,"totalTestsAntibody":null,"positiveTestsAntibody":null,"negativeTestsAntibody":null,"totalTestsPeopleAntibody":null,"positiveTestsPeopleAntibody":null,"negativeTestsPeopleAntibody":null,"totalTestsPeopleAntigen":null,"positiveTestsPeopleAntigen":null,"totalTestsAntigen":null,"positiveTestsAntigen":null,"fips":"37","positiveIncrease":1656,"negativeIncrease":30871,"total":2347837,"totalTestResultsIncrease":32527,"posNeg":2347837,"deathIncrease":24,"hospitalizedIncrease":0,"hash":"357c201c50d00bbe3b3177c2efbb185d1297bd61","commercialScore":0,"negativeRegularScore":0,"negativeScore":0,"positiveScore":0,"score":0,"grade":""},{"date":20200902,"state":"NC","positive":170553,"probableCases":null,"negative":2144757,"pending":null,"totalTestResultsSource":"posNeg","totalTestResults":2315310,"hospitalizedCurrently":858,"hospitalizedCumulative":null,"inIcuCurrently":270,"inIcuCumulative":null,"onVentilatorCurrently":null,"onVentilatorCumulative":null,"recovered":145884,"dataQualityGrade":"A+","lastUpdateEt":"9/2/2020 13:05","dateModified":"2020-09-02T13:05:00Z","checkTimeEt":"09/02 09:05","death":2779,"hospitalized":null,"dateChecked":"2020-09-02T13:05:00Z","totalTestsViral":2315310,"positiveTestsViral":null,"negativeTestsViral":null,"positiveCasesViral":170553,"deathConfirmed":2779,"deathProbable":null,"totalTestEncountersViral":null,"totalTestsPeopleViral":null,"totalTestsAntibody":null,"positiveTestsAntibody":null,"negativeTestsAntibody":null,"totalTestsPeopleAntibody":null,"positiveTestsPeopleAntibody":null,"negativeTestsPeopleAntibody":null,"totalTestsPeopleAntigen":null,"positiveTestsPeopleAntigen":null,"totalTestsAntigen":null,"positiveTestsAntigen":null,"fips":"37","positiveIncrease":1129,"negativeIncrease":18483,"total":2315310,"totalTestResultsIncrease":19612,"posNeg":2315310,"deathIncrease":38,"hospitalizedIncrease":0,"hash":"d75faba125b0bd93ff91162cbfbd52b6b647bf52","commercialScore":0,"negativeRegularScore":0,"negativeScore":0,"positiveScore":0,"score":0,"grade":""},{"date":20200901,"state":"NC","positive":169424,"probableCases":null,"negative":2126274,"pending":null,"totalTestResultsSource":"posNeg","totalTestResults":2295698,"hospitalizedCurrently":946,"hospitalizedCumulative":null,"inIcuCurrently":270,"inIcuCumulative":null,"onVentilatorCurrently":null,"onVentilatorCumulative":null,"recovered":145884,"dataQualityGrade":"A+","lastUpdateEt":"9/1/2020 12:20","dateModified":"2020-09-01T12:20:00Z","checkTimeEt":"09/01 08:20","death":2741,"hospitalized":null,"dateChecked":"2020-09-01T12:20:00Z","totalTestsViral":2295698,"positiveTestsViral":null,"negativeTestsViral":null,"positiveCasesViral":169424,"deathConfirmed":2741,"deathProbable":null,"totalTestEncountersViral":null,"totalTestsPeopleViral":null,"totalTestsAntibody":null,"positiveTestsAntibody":null,"negativeTestsAntibody":null,"totalTestsPeopleAntibody":null,"positiveTestsPeopleAntibody":null,"negativeTestsPeopleAntibody":null,"totalTestsPeopleAntigen":null,"positiveTestsPeopleAntigen":null,"totalTestsAntigen":null,"positiveTestsAntigen":null,"fips":"37","positiveIncrease":2111,"negativeIncrease":37415,"total":2295698,"totalTestResultsIncrease":39526,"posNeg":2295698,"deathIncrease":39,"hospitalizedIncrease":0,"hash":"8e6e6f8c20add838f0e994f36a1ff82d1c84988f","commercialScore":0,"negativeRegularScore":0,"negativeScore":0,"positiveScore":0,"score":0,"grade":""},{"date":20200831,"state":"NC","positive":167313,"probableCases":null,"negative":2088859,"pending":null,"totalTestResultsSource":"posNeg","totalTestResults":2256172,"hospitalizedCurrently":923,"hospitalizedCumulative":null,"inIcuCurrently":244,"inIcuCumulative":null,"onVentilatorCurrently":null,"onVentilatorCumulative":null,"recovered":145884,"dataQualityGrade":"A+","lastUpdateEt":"8/31/2020 12:15","dateModified":"2020-08-31T12:15:00Z","checkTimeEt":"08/31 08:15","death":2702,"hospitalized":null,"dateChecked":"2020-08-31T12:15:00Z","totalTestsViral":2256172,"positiveTestsViral":null,"negativeTestsViral":null,"positiveCasesViral":167313,"deathConfirmed":2702,"deathProbable":null,"totalTestEncountersViral":null,"totalTestsPeopleViral":null,"totalTestsAntibody":null,"positiveTestsAntibody":null,"negativeTestsAntibody":null,"totalTestsPeopleAntibody":null,"positiveTestsPeopleAntibody":null,"negativeTestsPeopleAntibody":null,"totalTestsPeopleAntigen":null,"positiveTestsPeopleAntigen":null,"totalTestsAntigen":null,"positiveTestsAntigen":null,"fips":"37","positiveIncrease":1186,"negativeIncrease":11713,"total":2256172,"totalTestResultsIncrease":12899,"posNeg":2256172,"deathIncrease":10,"hospitalizedIncrease":0,"hash":"d61c2e37bbe88d94c7965c0ec5b795125050417d","commercialScore":0,"negativeRegularScore":0,"negativeScore":0,"positiveScore":0,"score":0,"grade":""},{"date":20200830,"state":"NC","positive":166127,"probableCases":null,"negative":2077146,"pending":null,"totalTestResultsSource":"posNeg","totalTestResults":2243273,"hospitalizedCurrently":917,"hospitalizedCumulative":null,"inIcuCurrently":260,"inIcuCumulative":null,"onVentilatorCurrently":null,"onVentilatorCumulative":null,"recovered":136630,"dataQualityGrade":"A+","lastUpdateEt":"8/30/2020 11:55","dateModified":"2020-08-30T11:55:00Z","checkTimeEt":"08/30 07:55","death":2692,"hospitalized":null,"dateChecked":"2020-08-30T11:55:00Z","totalTestsViral":2243273,"positiveTestsViral":null,"negativeTestsViral":null,"positiveCasesViral":166127,"deathConfirmed":2692,"deathProbable":null,"totalTestEncountersViral":null,"totalTestsPeopleViral":null,"totalTestsAntibody":null,"positiveTestsAntibody":null,"negativeTestsAntibody":null,"totalTestsPeopleAntibody":null,"positiveTestsPeopleAntibody":null,"negativeTestsPeopleAntibody":null,"totalTestsPeopleAntigen":null,"positiveTestsPeopleAntigen":null,"totalTestsAntigen":null,"positiveTestsAntigen":null,"fips":"37","positiveIncrease":1051,"negativeIncrease":24073,"total":2243273,"totalTestResultsIncrease":25124,"posNeg":2243273,"deathIncrease":9,"hospitalizedIncrease":0,"hash":"5f2ce18d0c5b90b8d660460e5de1ecb44ef1f035","commercialScore":0,"negativeRegularScore":0,"negativeScore":0,"positiveScore":0,"score":0,"grade":""},{"date":20200829,"state":"NC","positive":165076,"probableCases":null,"negative":2053073,"pending":null,"totalTestResultsSource":"posNeg","totalTestResults":2218149,"hospitalizedCurrently":965,"hospitalizedCumulative":null,"inIcuCurrently":264,"inIcuCumulative":null,"onVentilatorCurrently":null,"onVentilatorCumulative":null,"recovered":136630,"dataQualityGrade":"A+","lastUpdateEt":"8/29/2020 12:35","dateModified":"2020-08-29T12:35:00Z","checkTimeEt":"08/29 08:35","death":2683,"hospitalized":null,"dateChecked":"2020-08-29T12:35:00Z","totalTestsViral":2218149,"positiveTestsViral":null,"negativeTestsViral":null,"positiveCasesViral":165076,"deathConfirmed":2683,"deathProbable":null,"totalTestEncountersViral":null,"totalTestsPeopleViral":null,"totalTestsAntibody":null,"positiveTestsAntibody":null,"negativeTestsAntibody":null,"totalTestsPeopleAntibody":null,"positiveTestsPeopleAntibody":null,"negativeTestsPeopleAntibody":null,"totalTestsPeopleAntigen":null,"positiveTestsPeopleAntigen":null,"totalTestsAntigen":null,"positiveTestsAntigen":null,"fips":"37","positiveIncrease":2585,"negativeIncrease":32673,"total":2218149,"totalTestResultsIncrease":35258,"posNeg":2218149,"deathIncrease":31,"hospitalizedIncrease":0,"hash":"b7b2b79e47058d45ac3a355231a8acb6d723c834","commercialScore":0,"negativeRegularScore":0,"negativeScore":0,"positiveScore":0,"score":0,"grade":""},{"date":20200828,"state":"NC","positive":162491,"probableCases":null,"negative":2020400,"pending":null,"totalTestResultsSource":"posNeg","totalTestResults":2182891,"hospitalizedCurrently":970,"hospitalizedCumulative":null,"inIcuCurrently":278,"inIcuCumulative":null,"onVentilatorCurrently":null,"onVentilatorCumulative":null,"recovered":136630,"dataQualityGrade":"A+","lastUpdateEt":"8/28/2020 12:00","dateModified":"2020-08-28T12:00:00Z","checkTimeEt":"08/28 08:00","death":2652,"hospitalized":null,"dateChecked":"2020-08-28T12:00:00Z","totalTestsViral":2182891,"positiveTestsViral":null,"negativeTestsViral":null,"positiveCasesViral":162491,"deathConfirmed":2652,"deathProbable":null,"totalTestEncountersViral":null,"totalTestsPeopleViral":null,"totalTestsAntibody":null,"positiveTestsAntibody":null,"negativeTestsAntibody":null,"totalTestsPeopleAntibody":null,"positiveTestsPeopleAntibody":null,"negativeTestsPeopleAntibody":null,"totalTestsPeopleAntigen":null,"positiveTestsPeopleAntigen":null,"totalTestsAntigen":null,"posit