date,state,positive,probableCases,negative,pending,totalTestResultsSource,totalTestResults,hospitalizedCurrently,hospitalizedCumulative,inIcuCurrently,inIcuCumulative,onVentilatorCurrently,onVentilatorCumulative,recovered,dataQualityGrade,lastUpdateEt,dateModified,checkTimeEt,death,hospitalized,dateChecked,totalTestsViral,positiveTestsViral,negativeTestsViral,positiveCasesViral,deathConfirmed,deathProbable,totalTestEncountersViral,totalTestsPeopleViral,totalTestsAntibody,positiveTestsAntibody,negativeTestsAntibody,totalTestsPeopleAntibody,positiveTestsPeopleAntibody,negativeTestsPeopleAntibody,totalTestsPeopleAntigen,positiveTestsPeopleAntigen,totalTestsAntigen,positiveTestsAntigen,fips,positiveIncrease,negativeIncrease,total,totalTestResultsIncrease,posNeg,deathIncrease,hospitalizedIncrease,hash,commercialScore,negativeRegularScore,negativeScore,positiveScore,score,grade
20201101,AK,16705,,587852,,totalTestsViral,604207,98,,,,5,,7104,A,11/1/2020 03:59,2020-11-01T03:59:00Z,10/31 23:59,83,,2020-11-01T03:59:00Z,604207,14906,588975,16705,83,,,,,,,,,,,,,,02,350,0,604557,0,604557,1,0,0fe81cb4b3a17588cfde8bbd309c3f0f2e786fd2,0,0,0,0,0,
20201031,AK,16355,,587852,,totalTestsViral,604207,94,,,,6,,7099,A,10/31/2020 03:59,2020-10-31T03:59:00Z,10/30 23:59,82,,2020-10-31T03:59:00Z,604207,14906,588975,16355,82,,,,,,,,,,,,,,02,447,17437,604207,17884,604207,1,0,4fd1e9352fd403f75cd0f4b8c7d420de8eb73f0b,0,0,0,0,0,
20201030,AK,15908,,570415,,totalTestsViral,586323,90,,,,6,,7096,A,10/30/2020 03:59,2020-10-30T03:59:00Z,10/29 23:59,81,,2020-10-30T03:59:00Z,586323,13775,572229,15908,81,,,,,,,,,,,,,,02,386,1669,586323,2055,586323,4,0,f02fcc28ab30329793653f2d5759c257699cb0de,0,0,0,0,0,
20201029,AK,15522,,568746,,totalTestsViral,584268,89,,,,6,,7094,A,10/29/2020 03:59,2020-10-29T03:59:00Z,10/28 23:59,77,,2020-10-29T03:59:00Z,584268,13641,570308,15522,77,,,,,,,,,,,,,,02,367,3302,584268,3669,584268,6,0,01d32bd4e56cdbdb3ce1f28f13f4d195e46fc6af,0,0,0,0,0,
20201028,AK,15155,,565444,,totalTestsViral,580599,80,,,,8,,7067,A,10/28/2020 03:59,2020-10-28T03:59:00Z,10/27 23:59,71,,2020-10-28T03:59:00Z,580599,13393,566887,15155,71,,,,,,,,,,,,,,02,357,2813,580599,3170,580599,1,0,f0f48cae1ff48cce0b1dfa2a67c30709261bf7f5,0,0,0,0,0,
20201027,AK,14798,,562631,,totalTestsViral,577429,81,,,,8,,7016,A,10/27/2020 03:59,2020-10-27T03:59:00Z,10/26 23:59,70,,2020-10-27T03:59:00Z,577429,13245,563865,14798,70,,,,,,,,,,,,,,02,385,6200,577429,6585,577429,2,0,7e2c10c46a59bf7b86096ce9df6bc962cab5cb74,0,0,0,0,0,
20201026,AK,14413,,556431,,totalTestsViral,570844,50,,,,9,,6948,A,10/26/2020 03:59,2020-10-26T03:59:00Z,10/25 23:59,68,,2020-10-26T03:59:00Z,570844,12773,557753,14413,68,,,,,,,,,,,,,,02,349,10526,570844,10875,570844,0,0,bdc83c3de27e4bccecb579b6c18fcf65677f28d6,0,0,0,0,0,
20201025,AK,14064,,545905,,totalTestsViral,559969,58,,,,9,,6946,A,10/25/2020 03:59,2020-10-25T03:59:00Z,10/24 23:59,68,,2020-10-25T03:59:00Z,559969,12110,547543,14064,68,,,,,,,,,,,,,,02,529,6320,559969,7223,559969,0,0,175a4f70a15c098ac277246bff6ae33838f66029,0,0,0,0,0,
20201024,AK,13535,,539585,,totalTestsViral,552746,58,,,,8,,6939,A,10/24/2020 03:59,2020-10-24T03:59:00Z,10/23 23:59,68,,2020-10-24T03:59:00Z,552746,11644,540786,13535,68,,,,,,,,,,,,,,02,374,0,553120,0,553120,0,0,280ee400bd797c20b77218c9e54a0b6615f91a53,0,0,0,0,0,
20201023,AK,13161,,539585,,totalTestsViral,552746,59,,,,7,,6915,A,10/23/2020 03:59,2020-10-23T03:59:00Z,10/22 23:59,68,,2020-10-23T03:59:00Z,552746,11644,540786,13161,68,,,,,,,,,,,,,,02,284,3753,552746,4037,552746,0,0,1b73fb16c097754ce2024af0e49f9d9514248af0,0,0,0,0,0,
20201022,AK,12877,,535832,,totalTestsViral,548709,41,,,,5,,6812,A,10/22/2020 03:59,2020-10-22T03:59:00Z,10/21 23:59,68,,2020-10-22T03:59:00Z,548709,11348,537045,12877,68,,,,,,,,,,,,,,02,233,1336,548709,1569,548709,0,0,28c731e31dacc3059dc3484060ecfc4139686eff,0,0,0,0,0,
20201021,AK,12644,,534496,,totalTestsViral,547140,41,,,,8,,6751,A,10/21/2020 03:59,2020-10-21T03:59:00Z,10/20 23:59,68,,2020-10-21T03:59:00Z,547140,11195,535629,12644,68,,,,,,,,,,,,,,02,212,403,547140,615,547140,1,0,4d2eabde0cdfbe86ede9f58509002a80af61be19,0,0,0,0,0,
20201020,AK,12432,,534093,,totalTestsViral,546525,38,,,,10,,6681,A,10/20/2020 03:59,2020-10-20T03:59:00Z,10/19 23:59,67,,2020-10-20T03:59:00Z,546525,11169,535040,12432,67,,,,,,,,,,,,,,02,212,10090,546525,10302,546525,0,0,c0e44ad8d86fcc1e637484d963ee4b2a44cca93c,0,0,0,0,0,
20201019,AK,12220,,524003,,totalTestsViral,536223,65,,,,8,,6516,A,10/19/2020 03:59,2020-10-19T03:59:00Z,10/18 23:59,67,,2020-10-19T03:59:00Z,536223,10859,525048,12220,67,,,,,,,,,,,,,,02,204,3308,536223,3512,536223,0,0,69b847e0fe9b05ba3cc485d576949b9ea2f59cfb,0,0,0,0,0,
20201018,AK,12016,,520695,,totalTestsViral,532711,73,,,,11,,6488,A,10/18/2020 03:59,2020-10-18T03:59:00Z,10/17 23:59,67,,2020-10-18T03:59:00Z,532711,10729,521666,12016,67,,,,,,,,,,,,,,02,224,1987,532711,2211,532711,0,0,5027a691aeb0aa29ef550e6a6d15d41dbf37d81a,0,0,0,0,0,
20201017,AK,11792,,518708,,totalTestsViral,530500,68,,,,9,,6448,A,10/17/2020 03:59,2020-10-17T03:59:00Z,10/16 23:59,67,,2020-10-17T03:59:00Z,530500,10678,519506,11792,67,,,,,,,,,,,,,,02,216,7620,530500,7836,530500,1,0,34f7d794ca2dc852c63951de1bab49c928bc8476,0,0,0,0,0,
20201016,AK,11576,,511088,,totalTestsViral,522664,59,,,,8,,6237,A,10/16/2020 03:59,2020-10-16T03:59:00Z,10/15 23:59,66,,2020-10-16T03:59:00Z,522664,10337,512012,11576,66,,,,,,,,,,,,,,02,228,2975,522664,3203,522664,1,0,2c4822280720e8cf03c9895422404d7df6cf546a,0,0,0,0,0,
20201015,AK,11348,,508113,,totalTestsViral,519461,60,,,,7,,6066,A,10/15/2020 03:59,2020-10-15T03:59:00Z,10/14 23:59,65,,2020-10-15T03:59:00Z,519461,10178,508970,11348,65,,,,,,,,,,,,,,02,165,2119,519461,2284,519461,1,0,be25105ae62bda9a8c21c7821ab39f0ecd847747,0,0,0,0,0,
20201014,AK,11183,,505994,,totalTestsViral,517177,56,,,,7,,5950,A,10/14/2020 03:59,2020-10-14T03:59:00Z,10/13 23:59,64,,2020-10-14T03:59:00Z,517177,10109,506755,11183,64,,,,,,,,,,,,,,02,144,2244,517177,2388,517177,4,0,05f4128c2a5c0755656f5b5f17e0dc77a57d35a8,0,0,0,0,0,
20201013,AK,11039,,503750,,totalTestsViral,514789,59,,,,8,,5909,A,10/13/2020 03:59,2020-10-13T03:59:00Z,10/12 23:59,60,,2020-10-13T03:59:00Z,514789,10057,504419,11039,60,,,,,,,,,,,,,,02,155,8707,514789,8862,514789,0,0,7a2a126927a7da726f260546d05a2625535f2d17,0,0,0,0,0,
20201012,AK,10884,,495043,,totalTestsViral,505927,52,,,,8,,5802,A,10/12/2020 03:59,2020-10-12T03:59:00Z,10/11 23:59,60,,2020-10-12T03:59:00Z,505927,9748,495867,10884,60,,,,,,,,,,,,,,02,198,2732,505927,2930,505927,0,0,65724fc5c462a82f2b81b03affd3b948f3800c18,0,0,0,0,0,
20201011,AK,10686,,492311,,totalTestsViral,502997,57,,,,7,,5789,A,10/11/2020 03:59,2020-10-11T03:59:00Z,10/10 23:59,60,,2020-10-11T03:59:00Z,502997,9620,493071,10686,60,,,,,,,,,,,,,,02,258,3486,502997,3744,502997,0,0,d57c80035c9ce817f69196fb7abb4ee98a510b2a,0,0,0,0,0,
20201010,AK,10428,,488825,,totalTestsViral,499253,66,,,,10,,5761,A,10/10/2020 03:59,2020-10-10T03:59:00Z,10/09 23:59,60,,2020-10-10T03:59:00Z,499253,9466,489481,10428,60,,,,,,,,,,,,,,02,252,5931,499253,6183,499253,0,0,10f3c8646cdfaa11f8c1a48a2ddb2d34f5f0ded3,0,0,0,0,0,
20201009,AK,10176,,482894,,totalTestsViral,493070,51,,,,6,,5734,A,10/9/2020 03:59,2020-10-09T03:59:00Z,10/08 23:59,60,,2020-10-09T03:59:00Z,493070,9256,483521,10176,60,,,,,,,,,,,,,,02,180,1719,493070,1899,493070,0,0,e6a6806fd13cc0ca973d5b0f42edb201e4138649,0,0,0,0,0,
20201008,AK,9996,,481175,,totalTestsViral,491171,46,,,,6,,5672,A,10/8/2020 03:59,2020-10-08T03:59:00Z,10/07 23:59,60,,2020-10-08T03:59:00Z,491171,9133,481745,9996,60,,,,,,,,,,,,,,02,135,962,491171,1097,491171,1,0,a44f72ccd9cab67a3ec643915c414a1ccb65ae8b,0,0,0,0,0,
20201007,AK,9861,,480213,,totalTestsViral,490074,46,,,,6,,5626,A,10/7/2020 03:59,2020-10-07T03:59:00Z,10/06 23:59,59,,2020-10-07T03:59:00Z,490074,9099,480682,9861,59,,,,,,,,,,,,,,02,274,10426,490074,10700,490074,1,0,0f2645eab077ba0fd0432dbc360fac92a617d34e,0,0,0,0,0,
20201006,AK,9587,,469787,,totalTestsViral,479374,45,,,,6,,5455,A,10/6/2020 16:00,2020-10-06T16:00:00Z,10/06 12:00,58,,2020-10-06T16:00:00Z,479374,8790,470291,9587,58,,,,,,,,,,,,,,02,0,0,479374,0,479374,0,0,549e73f1de5f53df99e8155f4cf61a826ea7bdfa,0,0,0,0,0,
20201005,AK,9587,,469787,,totalTestsViral,479374,45,,,,6,,5455,A,10/5/2020 03:59,2020-10-05T03:59:00Z,10/04 23:59,58,,2020-10-05T03:59:00Z,479374,8790,470291,9587,58,,,,,,,,,,,,,,02,211,2345,479374,2556,479374,0,0,70a660a63bc272dc0dec0363ed6e940ed96e5ad4,0,0,0,0,0,
20201004,AK,9376,,467442,,totalTestsViral,476818,51,,,,6,,5281,A,10/4/2020 03:59,2020-10-04T03:59:00Z,10/03 23:59,58,,2020-10-04T03:59:00Z,476818,8642,467883,9376,58,,,,,,,,,,,,,,02,189,3373,476818,3562,476818,0,0,cdf5b9f66e348fed22eb41a01cd381b560c77145,0,0,0,0,0,
20201003,AK,9187,,464069,,totalTestsViral,473256,39,,,,5,,5199,A,10/3/2020 03:59,2020-10-03T03:59:00Z,10/02 23:59,58,,2020-10-03T03:59:00Z,473256,8446,464517,9187,58,,,,,,,,,,,,,,02,147,3819,473256,3966,473256,1,0,fc24e105984f027fea211672f5ce69b8a7f4a902,0,0,0,0,0,
20201002,AK,9040,,460250,,totalTestsViral,469290,41,,,,6,,5042,A,10/2/2020 03:59,2020-10-02T03:59:00Z,10/01 23:59,57,,2020-10-02T03:59:00Z,469290,8201,460796,9040,57,,,,,,,,,,,,,,02,128,6839,469290,6967,469290,0,0,2862bd5c1cd2f1b8493cc9c89a17e032a98faf2e,0,0,0,0,0,
20201001,AK,8912,,453411,,totalTestsViral,462323,42,,,,6,,4838,A,10/1/2020 03:59,2020-10-01T03:59:00Z,09/30 23:59,57,,2020-10-01T03:59:00Z,462323,8002,454030,8912,57,,,,,,,,,,,,,,02,132,4984,462323,5116,462323,1,0,4d7a9ec738b919db55f7a4a0a37dea5f328ef5c1,0,0,0,0,0,
20200930,AK,8780,,448427,,totalTestsViral,457207,53,,,,7,,4555,A,9/30/2020 03:59,2020-09-30T03:59:00Z,09/29 23:59,56,,2020-09-30T03:59:00Z,457207,7807,449109,8780,56,,,,,,,,,,,,,,02,106,6045,457207,6151,457207,0,0,f88c199e43fc61bc54331b817f4557ec372c1811,0,0,0,0,0,
20200929,AK,8674,,442382,,totalTestsViral,451056,49,,,,7,,4324,A,9/29/2020 03:59,2020-09-29T03:59:00Z,09/28 23:59,56,,2020-09-29T03:59:00Z,451056,7606,443163,8674,56,,,,,,,,,,,,,,02,125,6140,451056,6265,451056,0,0,56ec70ab908bf65441237a58a0d0ef88aadc04db,0,0,0,0,0,
20200928,AK,8549,,436242,,totalTestsViral,444791,43,,,,14,,3771,A,9/28/2020 03:59,2020-09-28T03:59:00Z,09/27 23:59,56,,2020-09-28T03:59:00Z,444791,7487,437017,8549,56,,,,,,,,,,,,,,02,118,1688,444791,1922,444791,0,0,54ac76f1f03a1ca76d7d8e05b61d6f876a296bdc,0,0,0,0,0,
20200927,AK,8431,,434554,,totalTestsViral,442869,43,,,,14,,3502,A,9/27/2020 03:59,2020-09-27T03:59:00Z,09/26 23:59,56,,2020-09-27T03:59:00Z,442869,7411,435171,8431,56,,,,,,,,,,,,,,02,116,0,442985,0,442985,4,0,405d6ae0e1223f7a89c22819ef5f27aa34705d68,0,0,0,0,0,
20200926,AK,8315,,434554,,totalTestsViral,442869,43,,,,14,,3267,A,9/26/2020 03:59,2020-09-26T03:59:00Z,09/25 23:59,52,,2020-09-26T03:59:00Z,442869,7411,435171,8315,52,,,,,,,,,,,,,,02,113,1424,442869,1537,442869,1,0,8a5fe468e745dcef4fd2b1467c5e9b9b6b6acfa4,0,0,0,0,0,
20200925,AK,8202,,433130,,totalTestsViral,441332,43,,,,14,,3042,A,9/25/2020 03:59,2020-09-25T03:59:00Z,09/24 23:59,51,,2020-09-25T03:59:00Z,441332,7357,433688,8202,51,,,,,,,,,,,,,,02,261,7873,441332,8134,441332,6,0,3ec0ba17637926c59b5c633ab946dd4abdc255d0,0,0,0,0,0,
20200924,AK,7941,,425257,,totalTestsViral,433198,43,,,,14,,2731,A,9/23/2020 03:59,2020-09-23T03:59:00Z,09/22 23:59,45,,2020-09-23T03:59:00Z,433198,7180,425736,7941,45,,,,,,,,,,,,,,02,0,0,433198,0,433198,0,0,6cc2e164359b83e81dceefdd566274023b140052,0,0,0,0,0,
20200923,AK,7941,,425257,,totalTestsViral,433198,43,,,,14,,2731,A,9/23/2020 03:59,2020-09-23T03:59:00Z,09/22 23:59,45,,2020-09-23T03:59:00Z,433198,7180,425736,7941,45,,,,,,,,,,,,,,02,55,1952,433198,2007,433198,0,0,6869e2e793c510e7e4810857d8306ae0f9520180,0,0,0,0,0,
20200922,AK,7886,,423305,,totalTestsViral,431191,43,,,,14,,2668,A,9/22/2020 03:59,2020-09-22T03:59:00Z,09/21 23:59,45,,2020-09-22T03:59:00Z,431191,7147,423762,7886,45,,,,,,,,,,,,,,02,48,2498,431191,2546,431191,0,0,c2f0fa00ca3b13bddde598eb3cf6c53425f22b57,0,0,0,0,0,
20200921,AK,7838,,420807,,totalTestsViral,428645,47,,,,13,,2439,A,9/21/2020 03:59,2020-09-21T03:59:00Z,09/20 23:59,45,,2020-09-21T03:59:00Z,428645,7089,421275,7838,45,,,,,,,,,,,,,,02,71,1649,428645,1720,428645,0,0,c008bd0ba38832c1b68616905d9d944a9677e932,0,0,0,0,0,
20200920,AK,7767,,419158,,totalTestsViral,426925,43,,,,13,,2438,A,9/20/2020 03:59,2020-09-20T03:59:00Z,09/19 23:59,45,,2020-09-20T03:59:00Z,426925,7061,419584,7767,45,,,,,,,,,,,,,,02,93,3982,426925,4075,426925,0,0,3476cefe1fe30d2fa790001be545fc94c1dbdbdd,0,0,0,0,0,
20200919,AK,7674,,415176,,totalTestsViral,422850,41,,,,13,,2438,A,9/19/2020 03:59,2020-09-19T03:59:00Z,09/18 23:59,45,,2020-09-19T03:59:00Z,422850,6970,415600,7674,45,,,,,,,,,,,,,,02,87,4470,422850,4557,422850,0,0,1a8c7de6575f87bc98dc0e0698ea6098753ccb86,0,0,0,0,0,
20200918,AK,7587,,410706,,totalTestsViral,418293,36,,,,13,,2422,A,9/18/2020 03:59,2020-09-18T03:59:00Z,09/17 23:59,45,,2020-09-18T03:59:00Z,418293,6865,411148,7587,45,,,,,,,,,,,,,,02,116,2314,418293,2430,418293,1,0,ecf1bb90a681df964dca0d54da1621d67468c0dd,0,0,0,0,0,
20200917,AK,7471,,408392,,totalTestsViral,415863,41,,,,13,,2408,A,9/17/2020 03:59,2020-09-17T03:59:00Z,09/16 23:59,44,,2020-09-17T03:59:00Z,415863,6814,408769,7471,44,,,,,,,,,,,,,,02,106,7193,415863,7299,415863,0,0,feb19147ff0b5dd1f78a8dd3f539404b854e80bd,0,0,0,0,0,
20200916,AK,7365,,401199,,totalTestsViral,408564,45,,,,9,,2407,A,9/16/2020 03:59,2020-09-16T03:59:00Z,09/15 23:59,44,,2020-09-16T03:59:00Z,408564,6669,401615,7365,44,,,,,,,,,,,,,,02,52,1388,408564,1440,408564,0,0,34401e3548d52f32a1041b680c2bcf0f552faa6b,0,0,0,0,0,
20200915,AK,7313,,399811,,totalTestsViral,407124,44,,,,8,,2402,A,9/15/2020 03:59,2020-09-15T03:59:00Z,09/14 23:59,44,,2020-09-15T03:59:00Z,407124,6637,400207,7313,44,,,,,,,,,,,,,,02,43,3668,407124,3711,407124,0,0,c4f5cfe9b303585ec5b384bb03bedf8dcc3b510e,0,0,0,0,0,
20200914,AK,7270,,396143,,totalTestsViral,403413,37,,,,8,,2377,A,9/14/2020 03:59,2020-09-14T03:59:00Z,09/13 23:59,44,,2020-09-14T03:59:00Z,403413,6533,396600,7270,44,,,,,,,,,,,,,,02,77,2123,403413,2200,403413,0,0,01aa2c20ff2cc70810bd89bc8d257da0488f1aa1,0,0,0,0,0,
20200913,AK,7193,,394020,,totalTestsViral,401213,35,,,,8,,2377,A,9/13/2020 03:59,2020-09-13T03:59:00Z,09/12 23:59,44,,2020-09-13T03:59:00Z,401213,6481,394452,7193,44,,,,,,,,,,,,,,02,62,1522,401213,1584,401213,0,0,fe761e1eb1fe063986acd2d74b11e4fb1340ee49,0,0,0,0,0,
20200912,AK,7131,,392498,,totalTestsViral,399629,32,,,,8,,2377,A,9/12/2020 03:59,2020-09-12T03:59:00Z,09/11 23:59,44,,2020-09-12T03:59:00Z,399629,6428,392921,7131,44,,,,,,,,,,,,,,02,107,4936,399629,5043,399629,1,0,7e307f2d7e799160f60a3c7ffe1917cfc61992d5,0,0,0,0,0,
20200911,AK,7024,,387562,,totalTestsViral,394586,44,,,,7,,2359,A,9/11/2020 03:59,2020-09-11T03:59:00Z,09/10 23:59,43,,2020-09-11T03:59:00Z,394586,6340,387966,7024,43,,,,,,,,,,,,,,02,109,1400,394586,1509,394586,1,0,7a1ccd8e3288e06c93b76def48ff00009075472f,0,0,0,0,0,
20200910,AK,6915,,386162,,totalTestsViral,393077,42,,,,10,,2351,A,9/10/2020 03:59,2020-09-10T03:59:00Z,09/09 23:59,42,,2020-09-10T03:59:00Z,393077,6316,386481,6915,42,,,,,,,,,,,,,,02,125,1015,393077,1140,393077,0,0,38831b3c91e5421b610c75e04c2e40aa7c7a7ac3,0,0,0,0,0,
20200909,AK,6790,,385147,,totalTestsViral,391937,40,,,,10,,2340,A,9/9/2020 03:59,2020-09-09T03:59:00Z,09/08 23:59,42,,2020-09-09T03:59:00Z,391937,6305,385352,6790,42,,,,,,,,,,,,,,02,66,215,391937,281,391937,0,0,a5fca180836e8cd517124c310075ddb8cf6254e2,0,0,0,0,0,
20200908,AK,6724,,384932,,totalTestsViral,391656,41,,,,8,,2339,A,9/8/2020 03:59,2020-09-08T03:59:00Z,09/07 23:59,42,,2020-09-08T03:59:00Z,391656,6302,385074,6724,42,,,,,,,,,,,,,,02,34,3001,391656,3035,391656,0,0,563d6f4b98add8752e2b31f4e8c9a7e26470bf82,0,0,0,0,0,
20200907,AK,6690,,381931,,totalTestsViral,388621,36,,,,8,,2323,A,9/7/2020 03:59,2020-09-07T03:59:00Z,09/06 23:59,42,,2020-09-07T03:59:00Z,388621,6236,382106,6690,42,,,,,,,,,,,,,,02,34,1530,388621,1564,388621,0,0,914fdcf4b24c465fbbba97db718fae1ea1ef6300,0,0,0,0,0,
20200906,AK,6656,,380401,,totalTestsViral,387057,41,,,,7,,2323,A,9/6/2020 03:59,2020-09-06T03:59:00Z,09/05 23:59,42,,2020-09-06T03:59:00Z,387057,6210,380568,6656,42,,,,,,,,,,,,,,02,89,1966,387057,2055,387057,0,0,18da74b50a3dbee2b13076ac846a09190e2ff770,0,0,0,0,0,
20200905,AK,6567,,378435,,totalTestsViral,385002,36,,,,8,,2321,A,9/5/2020 03:59,2020-09-05T03:59:00Z,09/04 23:59,42,,2020-09-05T03:59:00Z,385002,6169,378554,6567,42,,,,,,,,,,,,,,02,98,2967,385002,3065,385002,2,0,1c41fc071f4e4b6f97f031721c55c87c44403dbf,0,0,0,0,0,
20200904,AK,6469,,375468,,totalTestsViral,381937,43,,,,4,,2295,A,9/4/2020 03:59,2020-09-04T03:59:00Z,09/03 23:59,40,,2020-09-04T03:59:00Z,381937,6115,375546,6469,40,,,,,,,,,,,,,,02,130,3871,381937,4001,381937,0,0,0fc2975b359bef8d4dc00a6babf29ee8a261afbe,0,0,0,0,0,
20200903,AK,6339,,371597,,totalTestsViral,377936,43,,,,8,,2288,A,9/3/2020 03:59,2020-09-03T03:59:00Z,09/02 23:59,40,,2020-09-03T03:59:00Z,377936,6022,371638,6339,40,,,,,,,,,,,,,,02,106,946,377936,1052,377936,1,0,1472c11a97e895699d1af5686041f3f2a14b6f92,0,0,0,0,0,
20200902,AK,6233,,370651,,totalTestsViral,376884,46,,,,10,,2281,A,9/2/2020 03:59,2020-09-02T03:59:00Z,09/01 23:59,39,,2020-09-02T03:59:00Z,376884,6010,370557,6233,39,,,,,,,,,,,,,,02,73,2556,376884,2629,376884,0,0,e67a7b86f053367641d50838297a7ad803f9ad98,0,0,0,0,0,
20200901,AK,6160,,368095,,totalTestsViral,374255,41,,,,9,,2246,A,9/1/2020 03:59,2020-09-01T03:59:00Z,08/31 23:59,39,,2020-09-01T03:59:00Z,374255,5974,367949,6160,39,,,,,,,,,,,,,,02,35,25590,374255,25625,374255,2,0,1f3ee63f30b2fdc9cc4081534529059a5cd368cf,0,0,0,0,0,
20200831,AK,6125,,342505,,totalTestsViral,348630,39,,,,8,,2238,A,8/31/2020 03:59,2020-08-31T03:59:00Z,08/30 23:59,37,,2020-08-31T03:59:00Z,348630,5598,342703,6125,37,,,,,,,,,,,,,,02,39,1752,348630,1791,348630,0,0,1f6183824cc3af841a23808aa0a6657d48675b99,0,0,0,0,0,
20200830,AK,6086,,340753,,totalTestsViral,346839,41,,,,8,,2233,A,8/31/2020 03:59,2020-08-31T03:59:00Z,08/30 23:59,37,,2020-08-31T03:59:00Z,346839,5568,340942,6086,37,,,,,,,,,,,,,,02,51,1093,346839,1144,346839,0,0,7dce6491fa8172a470a213506eb7d3224f1fd23c,0,0,0,0,0,
20200829,AK,6035,,339660,,totalTestsViral,345695,43,,,,7,,2201,A,8/29/2020 03:59,2020-08-29T03:59:00Z,08/28 23:59,37,,2020-08-29T03:59:00Z,345695,5558,339808,6035,37,,,,,,,,,,,,,,02,112,6045,345695,6157,345695,0,0,493e81b094c86ae7de80b1bef3fac6987473473d,0,0,0,0,0,
20200828,AK,5923,,333615,,totalTestsViral,339538,37,,,,8,,2183,A,8/28/2020 03:59,2020-08-28T03:59:00Z,08/27 23:59,37,,2020-08-28T03:59:00Z,339538,5359,333850,5923,37,,,,,,,,,,,,,,02,122,3196,339538,3318,339538,0,0,5d70e8f957e7a49d238f872eed14040f4738f2ef,0,0,0,0,0,
20200827,AK,5801,,330419,,totalTestsViral,336220,43,,,,9,,2109,A,8/27/2020 03:59,2020-08-27T03:59:00Z,08/26 23:59,37,,2020-08-27T03:59:00Z,336220,5324,330567,5801,37,,,,,,,,,,,,,,02,82,1334,336220,1416,336220,0,0,bb2236700a1b5f339ef3c3a634b4bcdd6c227920,0,0,0,0,0,
20200826,AK,5719,,329085,,totalTestsViral,334804,44,,,,6,,2088,A,8/26/2020 03:59,2020-08-26T03:59:00Z,08/25 23:59,37,,2020-08-26T03:59:00Z,334804,5305,329171,5719,37,,,,,,,,,,,,,,02,53,920,334804,973,334804,1,0,b0871103f0ddb845dafa57cc2ba8935583b24c22,0,0,0,0,0,
20200825,AK,5666,,328165,,totalTestsViral,333831,46,,,,6,,1967,A,8/25/2020 03:59,2020-08-25T03:59:00Z,08/24 23:59,36,,2020-08-25T03:59:00Z,333831,5270,328233,5666,36,,,,,,,,,,,,,,02,38,3290,333831,3328,333831,4,0,6cc315aae93fa41813b28543ca06b8bcaf7c8f3c,0,0,0,0,0,
20200824,AK,5628,,324875,,totalTestsViral,330503,43,,,,8,,1861,A,8/24/2020 03:59,2020-08-24T03:59:00Z,08/23 23:59,32,,2020-08-24T03:59:00Z,330503,5221,324954,5628,32,,,,,,,,,,,,,,02,70,2993,330503,3063,330503,0,0,add985eed9afaae02f31763ea385c764ecacf395,0,0,0,0,0,
20200823,AK,5558,,321882,,totalTestsViral,327440,48,,,,7,,1745,A,8/23/2020 03:59,2020-08-23T03:59:00Z,08/22 23:59,32,,2020-08-23T03:59:00Z,327440,5170,321943,5558,32,,,,,,,,,,,,,,02,64,1089,327440,1153,327440,1,0,8313baf9e8f85230cbf5d98c7be5e06bf1200f4a,0,0,0,0,0,
20200822,AK,5494,,320793,,totalTestsViral,326287,46,,,,6,,1686,A,8/22/2020 03:59,2020-08-22T03:59:00Z,08/21 23:59,31,,2020-08-22T03:59:00Z,326287,5151,320811,5494,31,,,,,,,,,,,,,,02,91,4661,326287,4752,326287,1,0,72fcbd486f6b932e14ba71a5001b5d3d31c83986,0,0,0,0,0,
20200821,AK,5403,,316132,,totalTestsViral,321535,46,,,,6,,1601,A,8/21/2020 00:00,2020-08-21T00:00:00Z,08/20 20:00,30,,2020-08-21T00:00:00Z,321535,5073,316141,5403,30,,,,,,,,,,,,,,02,71,8817,321535,8888,321535,1,0,661e617bbfc3a24f2815c1d89b8e163f3eabb003,0,0,0,0,0,
20200820,AK,5332,,307315,,totalTestsViral,312647,51,,,,6,,1513,A,8/20/2020 00:00,2020-08-20T00:00:00Z,08/19 20:00,29,,2020-08-20T00:00:00Z,312647,4970,307360,5332,29,,,,,,,,,,,,,,02,85,1713,312647,1798,312647,0,0,679d075942395a0d3aea0e7bfb06a4b274c419ce,0,0,0,0,0,
20200819,AK,5247,,305602,,totalTestsViral,310849,56,,,,6,,1501,A,8/19/2020 00:00,2020-08-19T00:00:00Z,08/18 20:00,29,,2020-08-19T00:00:00Z,310849,4950,305582,5247,29,,,,,,,,,,,,,,02,70,770,310849,840,310849,0,0,5038baf4ef5e2bb4bf52b394d7a133f518fcf62d,0,0,0,0,0,
20200818,AK,5177,,304832,,totalTestsViral,310009,47,,,,7,,1468,A,8/18/2020 00:00,2020-08-18T00:00:00Z,08/17 20:00,29,,2020-08-18T00:00:00Z,310009,4925,304767,5177,29,,,,,,,,,,,,,,02,67,4294,310009,4361,310009,1,0,a13594448d238cc9713a90206957219d5293ba3f,0,0,0,0,0,
20200817,AK,5110,,300538,,totalTestsViral,305648,33,,,,4,,1432,A,8/17/2020 00:00,2020-08-17T00:00:00Z,08/16 20:00,28,,2020-08-17T00:00:00Z,305648,4838,300493,5110,28,,,,,,,,,,,,,,02,50,4083,305648,4133,305648,0,0,cd91ead45fba122bb8ef61b6676c00136eb00302,0,0,0,0,0,
20200816,AK,5060,,296455,,totalTestsViral,301515,42,,,,3,,1418,A,8/16/2020 00:00,2020-08-16T00:00:00Z,08/15 20:00,28,,2020-08-16T00:00:00Z,301515,4777,296426,5060,28,,,,,,,,,,,,,,02,106,4732,301515,4838,301515,0,0,5a5bb27044cb4a684da384d69a5d0050bc50bacc,0,0,0,0,0,
20200815,AK,4954,,291723,,totalTestsViral,296677,36,,,,4,,1384,A,8/15/2020 00:00,2020-08-15T00:00:00Z,08/14 20:00,28,,2020-08-15T00:00:00Z,296677,4706,291666,4954,28,,,,,,,,,,,,,,02,85,663,296677,748,296677,1,0,57e71b98fbafeac67fde7bc3902597610ee1882e,0,0,0,0,0,
20200814,AK,4869,,291060,,totalTestsViral,295929,38,,,,3,,1371,A,8/14/2020 00:00,2020-08-14T00:00:00Z,08/13 20:00,27,,2020-08-14T00:00:00Z,295929,4698,290927,4869,27,,,,,,,,,,,,,,02,119,1757,295929,1876,295929,0,0,0dd0b4e83e3cb0648e851a40978f244a53f5b2e1,0,0,0,0,0,
20200813,AK,4750,,289303,,totalTestsViral,294053,46,,,,3,,1360,A,8/13/2020 00:00,2020-08-13T00:00:00Z,08/12 20:00,27,,2020-08-13T00:00:00Z,294053,4662,289088,4750,27,,,,,,,,,,,,,,02,95,1376,294053,1471,294053,0,0,3b8247da302aa14bc98794171849956d8188739a,0,0,0,0,0,
20200812,AK,4655,,287927,,totalTestsViral,292582,39,,,,3,,1359,A,8/12/2020 00:00,2020-08-12T00:00:00Z,08/11 20:00,27,,2020-08-12T00:00:00Z,292582,4646,287633,4655,27,,,,,,,,,,,,,,02,66,1772,292582,1838,292582,1,0,5ee8a635a75a393f04cbd4b38d3e766af55e5a02,0,0,0,0,0,
20200811,AK,4589,,286155,,totalTestsViral,290744,39,,,,4,,1344,A,8/11/2020 00:00,2020-08-11T00:00:00Z,08/10 20:00,26,,2020-08-11T00:00:00Z,290744,4628,285813,4589,26,,,,,,,,,,,,,,02,50,10351,290744,10401,290744,0,0,d374ae0555e865a323442c76afa9870c98abafdd,0,0,0,0,0,
20200810,AK,4539,,275804,,totalTestsViral,280343,37,,,,3,,1332,A,8/10/2020 00:00,2020-08-10T00:00:00Z,08/09 20:00,26,,2020-08-10T00:00:00Z,280343,4290,272428,4539,26,,,,,,,,,,,,,,02,66,2358,280343,2424,280343,0,0,b74513d2b6662bec7c6034ee53dd7cf94d3edc52,0,0,0,0,0,
20200809,AK,4473,,273446,,totalTestsViral,277919,40,,,,4,,1269,A,8/9/2020 00:00,2020-08-09T00:00:00Z,08/08 20:00,26,,2020-08-09T00:00:00Z,277919,4274,270039,4473,26,,,,,,,,,,,,,,02,100,4226,277919,4326,277919,0,0,83f52d4b1d639e42f4c1fff47d317ec4a9a501e8,0,0,0,0,0,
20200808,AK,4373,,269220,,totalTestsViral,273593,37,,,,4,,1254,A,8/8/2020 00:00,2020-08-08T00:00:00Z,08/07 20:00,26,,2020-08-08T00:00:00Z,273593,4195,265804,4373,26,,,,,,,,,,,,,,02,85,4657,273593,4742,273593,1,0,8b57c44d4d207ed9e07a9bc56c6534b00ff66c31,0,0,0,0,0,
20200807,AK,4288,,264563,,totalTestsViral,268851,37,,,,3,,1238,A,8/7/2020 00:00,2020-08-07T00:00:00Z,08/06 20:00,25,,2020-08-07T00:00:00Z,268851,4124,261152,4288,25,,,,,,,,,,,,,,02,65,7214,268851,7279,268851,0,0,82f1fe9c9d704a02bb8a5460c98ebbb0fa8d8806,0,0,0,0,0,
20200806,AK,4223,,257349,,totalTestsViral,261572,42,,,,2,,1220,A,8/6/2020 00:00,2020-08-06T00:00:00Z,08/05 20:00,25,,2020-08-06T00:00:00Z,261572,4024,253987,4223,25,,,,,,,,,,,,,,02,40,4253,261572,4293,261572,0,0,93fdb21062afca182cc8577986a4cf2696ea259a,0,0,0,0,0,
20200805,AK,4183,,253096,,totalTestsViral,257279,38,,,,2,,1017,A,8/5/2020 00:00,2020-08-05T00:00:00Z,08/04 20:00,25,,2020-08-05T00:00:00Z,257279,,,4183,25,,,,,,,,,,,,,,02,58,4572,257279,4630,257279,0,0,498f72f1e20194b78cd3acd736d8044eae9e3fb7,0,0,0,0,0,
20200804,AK,4125,,248524,,totalTestsViral,252649,33,,,,2,,987,A,8/4/2020 00:00,2020-08-04T00:00:00Z,08/03 20:00,25,,2020-08-04T00:00:00Z,252649,,,4125,25,,,,,,,,,,,,,,02,61,6781,252649,6842,252649,0,0,44dff328d1e92b8fc8b7efb96b7dd05253c845ed,0,0,0,0,0,
20200803,AK,4064,,241743,,totalTestsViral,245807,38,,,,4,,946,A,8/3/2020 00:00,2020-08-03T00:00:00Z,08/02 20:00,25,,2020-08-03T00:00:00Z,245807,,,4064,25,,,,,,,,,,,,,,02,80,2637,245807,2717,245807,1,0,f27d3bae4d601d7b4db0aaf45c46f428dde2c9a9,0,0,0,0,0,
20200802,AK,3984,,239106,,totalTestsViral,243090,39,,,,3,,932,A,8/2/2020 00:00,2020-08-02T00:00:00Z,08/01 20:00,24,,2020-08-02T00:00:00Z,243090,,,3984,24,,,,,,,,,,,,,,02,157,4300,243090,4457,243090,0,0,1d3e5cf876cdb4e73681a266b531d5088c2e0729,0,0,0,0,0,
20200801,AK,3827,,234806,,totalTestsViral,238633,37,,,,3,,930,A,8/1/2020 00:00,2020-08-01T00:00:00Z,07/31 20:00,24,,2020-08-01T00:00:00Z,238633,,,3827,24,,,,,,,,,,,,,,02,150,5377,238633,5527,238633,1,0,a27b8946462b7355c0190f89398844a85bd31bde,0,0,0,0,0,
20200731,AK,3677,,229429,,totalTestsViral,233106,40,,,,3,,898,A,7/31/2020 00:00,2020-07-31T00:00:00Z,07/30 20:00,23,,2020-07-31T00:00:00Z,233106,,,3677,23,,,,,,,,,,,,,,02,118,7931,233106,8049,233106,0,0,fdee60e27e5d90521cfa0673999543f17c7298bc,0,0,0,0,0,
20200730,AK,3559,,221498,,totalTestsViral,225057,45,,,,3,,885,A,7/30/2020 00:00,2020-07-30T00:00:00Z,07/29 20:00,23,,2020-07-30T00:00:00Z,225057,,,3559,23,,,,,,,,,,,,,,02,117,1276,225057,1393,225057,1,0,ecf4c6f704cce1629f602526f584c9769bb80068,0,0,0,0,0,
20200729,AK,3442,,220222,,totalTestsViral,223664,45,,,,3,,854,A,7/29/2020 00:00,2020-07-29T00:00:00Z,07/28 20:00,22,,2020-07-29T00:00:00Z,223664,,,3442,22,,,,,,,,,,,,,,02,92,9697,223664,9789,223664,0,0,27c7347ec22076e8cfeeb5e44f4bcbcfbc36b509,0,0,0,0,0,
20200728,AK,3350,,210525,,totalTestsViral,213875,44,,,,4,,836,A,7/28/2020 00:00,2020-07-28T00:00:00Z,07/27 20:00,22,,2020-07-28T00:00:00Z,213875,,,3350,22,,,,,,,,,,,,,,02,144,6363,213875,6611,213875,1,0,8c48aaebf1fac5167bc90c5ff36df37df5d17e10,0,0,0,0,0,
20200727,AK,3206,,204162,,totalTestsViral,207264,38,,,,3,,817,A,7/27/2020 00:00,2020-07-27T00:00:00Z,07/26 20:00,21,,2020-07-27T00:00:00Z,207264,,,3206,21,,,,,,,,,,,,,,02,104,0,207368,0,207368,1,0,16c6a4dce25e750532cdce16a4c62b2c2d8a6c20,0,0,0,0,0,
20200726,AK,3102,,204162,,totalTestsViral,207264,43,,,,4,,817,A,7/26/2020 00:00,2020-07-26T00:00:00Z,07/25 20:00,20,,2020-07-26T00:00:00Z,207264,,,3102,20,,,,,,,,,,,,,,02,234,1964,207264,2198,207264,0,0,b16fcc871ec58ddb472708fcbf2eb1e5e8bdb7dd,0,0,0,0,0,
20200725,AK,2868,,202198,,totalTestsViral,205066,38,,,,2,,815,A,7/25/2020 00:00,2020-07-25T00:00:00Z,07/24 20:00,20,,2020-07-25T00:00:00Z,205066,,,2868,20,,,,,,,,,,,,,,02,120,4374,205066,4494,205066,1,0,52da7a653e7520b8aaa42f4098205354bfcc1734,0,0,0,0,0,
20200724,AK,2748,,197824,,totalTestsViral,200572,37,,,,1,,800,A,7/24/2020 00:00,2020-07-24T00:00:00Z,07/23 20:00,19,,2020-07-24T00:00:00Z,200572,,,2748,19,,,,,,,,,,,,,,02,64,10999,200572,11063,200572,0,0,1667ec3e99822d8ec697e2e67ff849316600a4cd,0,0,0,0,0,
20200723,AK,2684,,186825,,totalTestsViral,189509,36,,,,1,,787,A,7/23/2020 00:00,2020-07-23T00:00:00Z,07/22 20:00,19,,2020-07-23T00:00:00Z,189509,,,2684,19,,,,,,,,,,,,,,02,65,4111,189509,4176,189509,0,0,28d0de01324bdea853ba1b2ec23659e8added0a0,0,0,0,0,0,
20200722,AK,2619,,182714,,totalTestsViral,185333,34,,,,1,,753,A,7/22/2020 00:00,2020-07-22T00:00:00Z,07/21 20:00,19,,2020-07-22T00:00:00Z,185333,,,2619,19,,,,,,,,,,,,,,02,94,6613,185333,6707,185333,1,0,a2350aa03f71c9b9906ca7a4b4d9279dd900be30,0,0,0,0,0,
20200721,AK,2525,,176101,,totalTestsViral,178626,32,,,,1,,737,A,7/21/2020 00:00,2020-07-21T00:00:00Z,07/20 20:00,18,,2020-07-21T00:00:00Z,178626,,,2525,18,,,,,,,,,,,,,,02,111,2929,178626,3040,178626,0,0,bdc62202cb21067625d3ae98a36828f24d0911fc,0,0,0,0,0,
20200720,AK,2414,,173172,,totalTestsViral,175586,29,,,,0,,712,A,7/20/2020 00:00,2020-07-20T00:00:00Z,07/19 20:00,18,,2020-07-20T00:00:00Z,175586,,,2414,18,,,,,,,,,,,,,,02,137,2439,175586,2576,175586,0,0,84586a465a0637387ef6d8b2613efb9ec593d614,0,0,0,0,0,
20200719,AK,2277,,170733,,totalTestsViral,173010,27,,,,1,,712,A,7/19/2020 00:00,2020-07-19T00:00:00Z,07/18 20:00,18,,2020-07-19T00:00:00Z,173010,,,2277,18,,,,,,,,,,,,,,02,118,4529,173010,4647,173010,0,0,19f08ba48e2e087876c42b984e9e4d903eb85313,0,0,0,0,0,
20200718,AK,2159,,166204,,totalTestsViral,168363,26,,,,1,,708,A,7/18/2020 00:00,2020-07-18T00:00:00Z,07/17 20:00,18,,2020-07-18T00:00:00Z,168363,,,2159,18,,,,,,,,,,,,,,02,78,2871,168363,2949,168363,1,0,9c83903ed308a810ff597d8dd1210c8f13b08fef,0,0,0,0,0,
20200717,AK,2081,,163333,,totalTestsViral,165414,32,,,,0,,697,A,7/17/2020 00:00,2020-07-17T00:00:00Z,07/16 20:00,17,,2020-07-17T00:00:00Z,165414,,,2081,17,,,,,,,,,,,,,,02,49,2343,165414,2392,165414,0,0,d13e4dfeae497d95e41df0675408e44cc4ba75df,0,0,0,0,0,
20200716,AK,2032,,160990,,totalTestsViral,163022,32,,,,0,,688,A,7/16/2020 00:00,2020-07-16T00:00:00Z,07/15 20:00,17,,2020-07-16T00:00:00Z,163022,,,2032,17,,,,,,,,,,,,,,02,401,6528,163022,6929,163022,0,0,2f8c6cfca3ed26531f3d27bb781d0adc1ab81d2c,0,0,0,0,0,
20200715,AK,1631,,154462,,totalTestsViral,156093,32,,,,0,,669,A,7/15/2020 00:00,2020-07-15T00:00:00Z,07/14 20:00,17,,2020-07-15T00:00:00Z,156093,,,1631,17,,,,,,,,,,,,,,02,52,6568,156093,6620,156093,0,0,d35e9664a2b059e18b0ffa131e7d8178f3d1d1bd,0,0,0,0,0,
20200714,AK,1579,,147894,,totalTestsViral,149473,25,,,,1,,642,A,7/14/2020 00:00,2020-07-14T00:00:00Z,07/13 20:00,17,,2020-07-14T00:00:00Z,149473,,,1579,17,,,,,,,,,,,,,,02,40,2843,149473,2883,149473,0,0,2b5b66b320a5f7fc2cf2d1d4378cba0783bf67d8,0,0,0,0,0,
20200713,AK,1539,,145051,,totalTestsViral,146590,22,,,,0,,620,A,7/13/2020 00:00,2020-07-13T00:00:00Z,07/12 20:00,17,,2020-07-13T00:00:00Z,146590,,,1539,17,,,,,,,,,,,,,,02,60,1055,146590,1115,146590,0,0,e124bf9c1ebc15ba5a75dbdc62fe1152dbb86a60,0,0,0,0,0,
20200712,AK,1479,,143996,,totalTestsViral,145475,27,,,,0,,615,A,7/12/2020 00:00,2020-07-12T00:00:00Z,07/11 20:00,17,,2020-07-12T00:00:00Z,145475,,,1479,17,,,,,,,,,,,,,,02,94,2005,145475,2099,145475,0,0,ac8ef949ff9e3a0d73abd49714be005a90bed977,0,0,0,0,0,
20200711,AK,1385,,141991,,totalTestsViral,143376,31,,,,1,,598,A,7/11/2020 00:00,2020-07-11T00:00:00Z,07/10 20:00,17,,2020-07-11T00:00:00Z,143376,,,1385,17,,,,,,,,,,,,,,02,62,1383,143376,1445,143376,0,0,9d42aabf69f3b765f4fd68b67b8abb1372acdae1,0,0,0,0,0,
20200710,AK,1323,,140608,,totalTestsViral,141931,30,,,,0,,588,A,7/10/2020 00:00,2020-07-10T00:00:00Z,07/09 20:00,17,,2020-07-10T00:00:00Z,141931,,,1323,17,,,,,,,,,,,,,,02,51,6136,141931,6187,141931,0,0,7349dc3feee1f4afcf2e7d38f8f0abaca402077e,0,0,0,0,0,
20200709,AK,1272,,134472,,totalTestsViral,135744,28,,,,0,,571,A,7/9/2020 00:00,2020-07-09T00:00:00Z,07/08 20:00,17,,2020-07-09T00:00:00Z,135744,,,1272,17,,,,,,,,,,,,,,02,46,2297,135744,2343,135744,0,0,7139c1d4b0c89fe4fb25bf79abff7f188d95f221,0,0,0,0,0,
20200708,AK,1226,,132175,,totalTestsViral,133401,30,,,,0,,563,A,7/8/2020 00:00,2020-07-08T00:00:00Z,07/07 20:00,17,,2020-07-08T00:00:00Z,133401,,,1226,17,,,,,,,,,,,,,,02,42,1939,133401,1981,133401,0,0,e7bc47fe0ffd463835afd463a2717daa950465f6,0,0,0,0,0,
20200707,AK,1184,,130236,,totalTestsViral,131420,25,,,,1,,560,A,7/6/2020 00:00,2020-07-06T00:00:00Z,07/05 20:00,17,,2020-07-06T00:00:00Z,131420,,,1184,17,,,,,,,,,,,,,,02,46,7621,131420,7667,131420,1,0,53094c02ec6810a3d9c9204d2510507c9e68152e,0,0,0,0,0,
20200706,AK,1138,,122615,,totalTestsViral,123753,19,,,,3,,548,A,7/5/2020 00:00,2020-07-05T00:00:00Z,07/04 20:00,16,,2020-07-05T00:00:00Z,123753,,,1138,16,,,,,,,,,,,,,,02,0,0,123753,0,123753,0,0,66a6584bc5807789013d6198f4186cde91035410,0,0,0,0,0,
20200705,AK,1138,,122615,,totalTestsViral,123753,19,,,,3,,548,A,7/4/2020 00:00,2020-07-04T00:00:00Z,07/03 20:00,16,,2020-07-04T00:00:00Z,123753,,,1138,16,,,,,,,,,,,,,,02,27,994,123753,1021,123753,0,0,012594cf0249cd801af864b7f5f3bfa80b023854,0,0,0,0,0,
20200704,AK,1111,,121621,,totalTestsViral,122732,23,,,,3,,544,A,7/4/2020 00:00,2020-07-04T00:00:00Z,07/03 20:00,16,,2020-07-04T00:00:00Z,122732,,,1111,16,,,,,,,,,,,,,,02,48,2476,122732,2524,122732,1,0,218c1a8893cf54c10b93711c267e758edda4aef3,0,0,0,0,0,
20200703,AK,1063,,119145,,totalTestsViral,120208,25,,,,3,,539,A,7/3/2020 00:00,2020-07-03T00:00:00Z,07/02 20:00,15,,2020-07-03T00:00:00Z,120208,,,1063,15,,,,,,,,,,,,,,02,46,4253,120208,4299,120208,1,0,5c2bcccfff4179c0330293d3656c470c513bbe17,0,0,0,0,0,
20200702,AK,1017,,114892,,totalTestsViral,115909,18,,,,1,,535,A,7/2/2020 00:00,2020-07-02T00:00:00Z,07/01 20:00,14,,2020-07-02T00:00:00Z,115909,,,1017,14,,,,,,,,,,,,,,02,39,1470,115909,1509,115909,0,0,234ced65f3928b95b1416e98feda36cfcefac118,0,0,0,0,0,
20200701,AK,978,,113422,,totalTestsViral,114400,20,,,,2,,528,A,7/1/2020 00:00,2020-07-01T00:00:00Z,06/30 20:00,14,,2020-07-01T00:00:00Z,114400,,,978,14,,,,,,,,,,,,,,02,38,2177,114400,2215,114400,0,0,aa233ffc7f8eee1bc0dd3133b66bbfd64ea609fe,0,0,0,0,0,
20200630,AK,940,,111245,,totalTestsViral,112185,18,,,,1,,526,A,6/29/2020 00:00,2020-06-29T00:00:00Z,06/28 20:00,14,,2020-06-29T00:00:00Z,112185,,,940,14,,,,,,,,,,,,,,02,36,3440,112185,3476,112185,0,0,b749a669c7b7425f8b35a51f8d8d45932ddfe7f2,0,0,0,0,0,
20200629,AK,904,,107805,,totalTestsViral,108709,16,,,,1,,525,A,6/29/2020 00:00,2020-06-29T00:00:00Z,06/28 20:00,14,,2020-06-29T00:00:00Z,108709,,,904,14,,,,,,,,,,,,,,02,21,388,108709,409,108709,0,0,9df0f9b25231e5aa4278220d2eaec89431819614,0,0,0,0,0,
20200628,AK,883,,107417,,totalTestsViral,108300,12,,,,1,,521,A,6/28/2020 00:00,2020-06-28T00:00:00Z,06/27 20:00,14,,2020-06-28T00:00:00Z,108300,,,883,14,,,,,,,,,,,,,,02,29,2690,108300,2719,108300,0,0,c9006d1e0194a0acb00a0a7c258c5ee86e2bc51c,0,0,0,0,0,
20200627,AK,854,,104727,,totalTestsViral,105581,11,,,,1,,521,A,6/27/2020 00:00,2020-06-27T00:00:00Z,06/26 20:00,14,,2020-06-27T00:00:00Z,105581,,,854,14,,,,,,,,,,,,,,02,18,3771,105581,3789,105581,0,0,2fbeb65c89b04f3c1698b82d2c5e16c137a84f06,0,0,0,0,0,
20200626,AK,836,,100956,,totalTestsViral,101792,12,,,,2,,519,A,6/26/2020 00:00,2020-06-26T00:00:00Z,06/25 20:00,14,,2020-06-26T00:00:00Z,101792,,,836,14,,,,,,,,,,,,,,02,20,2320,101792,2340,101792,2,0,dd308479171e6ad2464b677e71457fb0a89b0745,0,0,0,0,0,
20200625,AK,816,,98636,,totalTestsViral,99452,14,,,,2,,513,A,6/25/2020 00:00,2020-06-25T00:00:00Z,06/24 20:00,12,,2020-06-25T00:00:00Z,99452,,,816,12,,,,,,,,,,,,,,02,24,3332,99452,3356,99452,0,0,2ed2778f7217068f7dc7f3232a3ba81da8f75f80,0,0,0,0,0,
20200624,AK,792,,95304,,totalTestsViral,96096,16,,,,2,,507,A,6/24/2020 00:00,2020-06-24T00:00:00Z,06/23 20:00,12,,2020-06-24T00:00:00Z,96096,,,792,12,,,,,,,,,,,,,,02,14,3135,96096,3149,96096,0,0,8a131d116dcc7f45205916ba84b01d57c5ebcb22,0,0,0,0,0,
20200623,AK,778,,92169,,totalTestsViral,92947,14,,,,1,,502,A,6/23/2020 00:00,2020-06-23T00:00:00Z,06/22 20:00,12,,2020-06-23T00:00:00Z,92947,,,778,12,,,,,,,,,,,,,,02,17,2106,92947,2123,92947,0,0,39a5246008992054a40f1014c16ab2e57c076ce9,0,0,0,0,0,
20200622,AK,761,,90063,,totalTestsViral,90824,13,,,,1,,491,A,6/22/2020 00:00,2020-06-22T00:00:00Z,06/21 20:00,12,,2020-06-22T00:00:00Z,90824,,,761,12,,,,,,,,,,,,,,02,6,2767,90824,2773,90824,0,0,06b18de9b81d51feff26b5a36753db0c6458b547,0,0,0,0,0,
20200621,AK,755,,87296,,totalTestsViral,88051,15,,,,1,,475,A,6/21/2020 00:00,2020-06-21T00:00:00Z,06/20 20:00,12,,2020-06-21T00:00:00Z,88051,,,755,12,,,,,,,,,,,,,,02,12,1121,88051,1133,88051,0,0,e600b38f18b3551739a116dbc2614efde1b60dd0,0,0,0,0,0,
20200620,AK,743,,86175,,totalTestsViral,86918,16,,,,1,,464,A,6/20/2020 00:00,2020-06-20T00:00:00Z,06/19 20:00,12,,2020-06-20T00:00:00Z,86918,,,743,12,,,,,,,,,,,,,,02,21,3266,86918,3287,86918,0,0,4ca730ccfd480b35b5cb7ada6d3ff753574d788d,0,0,0,0,0,
20200619,AK,722,,82909,,totalTestsViral,83631,18,,,,1,,457,A,6/19/2020 00:00,2020-06-19T00:00:00Z,06/18 20:00,12,,2020-06-19T00:00:00Z,83631,,,722,12,,,,,,,,,,,,,,02,14,2432,83631,2446,83631,0,0,9ed282877a2ebc0e03a32c53aa8a9fc509279a6d,0,0,0,0,0,
20200618,AK,708,,80477,,totalTestsViral,81185,18,,,,0,,449,A,6/18/2020 00:00,2020-06-18T00:00:00Z,06/17 20:00,12,,2020-06-18T00:00:00Z,81185,,,708,12,,,,,,,,,,,,,,02,12,3464,81185,3476,81185,0,0,780e3832d748aa20da4d95acf0985544067e33a5,0,0,0,0,0,
20200617,AK,696,,77013,,totalTestsViral,77709,23,,,,0,,438,A,6/17/2020 00:00,2020-06-17T00:00:00Z,06/16 20:00,12,,2020-06-17T00:00:00Z,77709,,,696,12,,,,,,,,,,,,,,02,20,1474,77709,1494,77709,0,0,e4f15798557d4396a517281dd2c4915ca5240e9e,0,0,0,0,0,
20200616,AK,676,,75539,,totalTestsViral,76215,22,,,,2,,429,A,6/16/2020 00:00,2020-06-16T00:00:00Z,06/15 20:00,12,,2020-06-16T00:00:00Z,76215,,,676,12,,,,,,,,,,,,,,02,12,1766,76215,1778,76215,0,0,2e3ee1f38ec33471864bcdf33bc33eab388d38f4,0,0,0,0,0,
20200615,AK,664,,73773,,totalTestsViral,74437,21,,,,3,,417,A,6/15/2020 00:00,2020-06-15T00:00:00Z,06/14 20:00,12,,2020-06-15T00:00:00Z,74437,,,664,12,,,,,,,,,,,,,,02,3,967,74437,970,74437,0,0,fd92bda7866f70f88a60a69d613b0e16925edac1,0,0,0,0,0,
20200614,AK,661,,72806,,totalTestsViral,73467,11,,,,1,,411,A,6/14/2020 00:00,2020-06-14T00:00:00Z,06/13 20:00,12,,2020-06-14T00:00:00Z,73467,,,661,12,,,,,,,,,,,,,,02,7,1657,73467,1664,73467,0,0,5efe9d44061711a8d421208415a784901de978a5,0,0,0,0,0,
20200613,AK,654,,71149,,totalTestsViral,71803,12,,,,2,,405,A,6/13/2020 00:00,2020-06-13T00:00:00Z,06/12 20:00,12,,2020-06-13T00:00:00Z,71803,,,654,12,,,,,,,,,,,,,,02,29,894,71803,923,71803,0,0,cf62aa646ab5cfe510c24ed0d4adf08bae139d5b,0,0,0,0,0,
20200612,AK,625,,70255,,totalTestsViral,70880,15,,,,3,,403,A,6/12/2020 00:00,2020-06-12T00:00:00Z,06/11 20:00,12,,2020-06-12T00:00:00Z,70880,,,625,12,,,,,,,,,,,,,,02,14,1855,70880,1869,70880,1,0,bfcb84372bafe0590b420687b741243c3a0f1bf5,0,0,0,0,0,
20200611,AK,611,,68400,,totalTestsViral,69011,18,,,,4,,397,A,6/11/2020 00:00,2020-06-11T00:00:00Z,06/10 20:00,11,,2020-06-11T00:00:00Z,69011,,,611,11,,,,,,,,,,,,,,02,18,1273,69011,1291,69011,0,0,64a82e4cac5a3823ec8fba941b09933b6745a639,0,0,0,0,0,
20200610,AK,593,,67127,,totalTestsViral,67720,22,,,,3,,392,A,6/10/2020 00:00,2020-06-10T00:00:00Z,06/09 20:00,11,,2020-06-10T00:00:00Z,67720,,,593,11,,,,,,,,,,,,,,02,20,810,67720,830,67720,0,0,f4cdbaa149021005420d5cb468c9e4e4dd743108,0,0,0,0,0,
20200609,AK,573,,66317,,totalTestsViral,66890,12,,,,1,,389,A,6/9/2020 00:00,2020-06-09T00:00:00Z,06/08 20:00,11,,2020-06-09T00:00:00Z,66890,,,573,11,,,,,,,,,,,,,,02,10,968,66890,978,66890,1,0,23341ad5ac60aee307cc0eb7775966829b1e0845,0,0,0,0,0,
20200608,AK,563,,65349,,totalTestsViral,65912,7,,,,0,,384,B,6/8/2020 00:00,2020-06-08T00:00:00Z,06/07 20:00,10,,2020-06-08T00:00:00Z,65912,,,563,10,,,,,,,,,,,,,,02,19,989,65912,1008,65912,0,0,9ef4525f1b1866dea52206e512e2ee229c915742,0,0,0,0,0,
20200607,AK,544,,64360,,totalTestsViral,64904,7,,,,1,,382,B,6/7/2020 00:00,2020-06-07T00:00:00Z,06/06 20:00,10,,2020-06-07T00:00:00Z,64904,,,544,10,,,,,,,,,,,,,,02,8,995,64904,1003,64904,0,-48,38c8b9b477230ac29e5bb3d114ce83ee6b0894a4,0,0,0,0,0,
20200606,AK,536,,63365,,totalTestsViral,63901,7,48,,,1,,382,A,6/6/2020 00:00,2020-06-06T00:00:00Z,06/05 20:00,10,48,2020-06-06T00:00:00Z,63901,,,536,10,,,,,,,,,,,,,,02,12,2899,63901,2911,63901,0,48,822226fcf393bb4d44c36f4c7320dc984f687c01,0,0,0,0,0,
20200605,AK,524,,60466,,totalTestsViral,60990,8,,,,1,,380,A,6/5/2020 00:00,2020-06-05T00:00:00Z,06/04 20:00,10,,2020-06-05T00:00:00Z,60990,,,524,10,,,,,,,,,,,,,,02,11,882,60990,893,60990,0,0,dd8e1c8126874a88838a8140299fe3b1daba86e5,0,0,0,0,0,
20200604,AK,513,,59584,,totalTestsViral,60097,13,,,,1,,376,A,6/4/2020 00:00,2020-06-04T00:00:00Z,06/03 20:00,10,,2020-06-04T00:00:00Z,60097,,,513,10,,,,,,,,,,,,,,02,8,1907,60097,1915,60097,0,0,0648b55e11b7612de4a01227383535272d9c81be,0,0,0,0,0,
20200603,AK,505,,57677,,totalTestsViral,58182,11,,,,0,,373,A,6/3/2020 00:00,2020-06-03T00:00:00Z,06/02 20:00,10,,2020-06-03T00:00:00Z,58182,,,505,10,,,,,,,,,,,,,,02,18,1961,58182,1979,58182,0,0,6a181bd23e01f9fd2b96665820bf123f12113495,0,0,0,0,0,
20200602,AK,487,,55716,,totalTestsViral,56203,10,,,,0,,371,A,6/2/2020 00:00,2020-06-02T00:00:00Z,06/01 20:00,10,,2020-06-02T00:00:00Z,56203,,,487,10,,,,,,,,,,,,,,02,20,1993,56203,2013,56203,0,0,38b231f2e6d996b22eb93bc36354edf869ddcff4,0,0,0,0,0,
20200601,AK,467,,53723,,totalTestsViral,54190,10,,,,1,,368,A,6/1/2020 00:00,2020-06-01T00:00:00Z,05/31 20:00,10,,2020-06-01T00:00:00Z,54190,,,467,10,,,,,,,,,,,,,,02,33,2462,54190,2495,54190,0,0,ba055daf70557be2034150ebdd0ec2015b8cc64d,0,0,0,0,0,
20200531,AK,434,,51261,,totalTestsViral,51695,14,,,,2,,368,A,5/30/2020 00:00,2020-05-30T00:00:00Z,05/29 20:00,10,,2020-05-30T00:00:00Z,51695,,,434,10,,,,,,,,,,,,,,02,0,0,51695,0,51695,0,0,a5b48aee97cd6917ab55e093f21af3f0d6766942,0,0,0,0,0,
20200530,AK,434,,51261,,totalTestsViral,51695,14,,,,2,,368,A,5/30/2020 00:00,2020-05-30T00:00:00Z,05/29 20:00,10,,2020-05-30T00:00:00Z,51695,,,434,10,,,,,,,,,,,,,,02,4,2252,51695,2256,51695,0,0,30f59a0c264864785179ac7a86d6b4609c40405d,0,0,0,0,0,
20200529,AK,430,,49009,,totalTestsViral,49439,14,,,,1,,367,A,5/29/2020 00:00,2020-05-29T00:00:00Z,05/28 20:00,10,,2020-05-29T00:00:00Z,49439,,,430,10,,,,,,,,,,,,,,02,5,1464,49439,1469,49439,0,0,cc70597cae22499033fd9928285b30ec911a8cdc,0,0,0,0,0,
20200528,AK,425,,47545,,totalTestsViral,47970,10,,,,,,366,B,5/28/2020 00:00,2020-05-28T00:00:00Z,05/27 20:00,10,,2020-05-28T00:00:00Z,47970,,,425,10,,,,,,,,,,,,,,02,13,1594,47970,1607,47970,0,0,14b85413c7a43b75e21757bb356dbd69d99c4a07,0,0,0,0,0,
20200527,AK,412,,45951,,totalTestsViral,46363,14,,,,,,364,C,5/27/2020 00:00,2020-05-27T00:00:00Z,05/26 20:00,10,,2020-05-27T00:00:00Z,46363,,,412,10,,,,,,,,,,,,,,02,1,1398,46363,1399,46363,0,0,6258e243b95c916f5961d18c5504e8d2f9630b6f,0,0,0,0,0,
20200526,AK,411,,44553,,totalTestsViral,44964,12,,,,,,362,C,5/26/2020 00:00,2020-05-26T00:00:00Z,05/25 20:00,10,,2020-05-26T00:00:00Z,44964,,,411,10,,,,,,,,,,,,,,02,2,490,44964,492,44964,0,0,0e7f3b47e6695f630e2796173114f32e38757078,0,0,0,0,0,
20200525,AK,409,,44063,,totalTestsViral,44472,10,,,,,,361,C,5/25/2020 00:00,2020-05-25T00:00:00Z,05/24 20:00,10,,2020-05-25T00:00:00Z,44472,,,409,10,,,,,,,,,,,,,,02,1,964,44472,965,44472,0,0,24f38380519773f3a3ae3a90ad450e64b078f72b,0,0,0,0,0,
20200524,AK,408,,43099,,totalTestsViral,43507,10,,,,,,358,C,5/24/2020 00:00,2020-05-24T00:00:00Z,05/23 20:00,10,,2020-05-24T00:00:00Z,43507,,,408,10,,,,,,,,,,,,,,02,0,1156,43507,1156,43507,0,0,d75307b17c84def372568bc916a6eab48db07447,0,0,0,0,0,
20200523,AK,408,,41943,,totalTestsViral,42351,10,,,,,,358,C,5/23/2020 15:00,2020-05-23T15:00:00Z,05/23 11:00,10,,2020-05-23T15:00:00Z,42351,,,408,10,,,,,,,,,,,,,,02,4,901,42351,905,42351,0,0,461dc4897e3b66110b67dcfd63d4b05bf4206b13,0,0,0,0,0,
20200522,AK,404,,41042,,totalTestsViral,41446,15,,,,,,356,C,5/22/2020 00:00,2020-05-22T00:00:00Z,05/21 20:00,10,,2020-05-22T00:00:00Z,41446,,,404,10,,,,,,,,,,,,,,02,2,1899,41446,1901,41446,0,0,d2958f2fe4bf109fbc1d9a50c7ce74c2e85e3a12,0,0,0,0,0,
20200521,AK,402,,39143,,totalTestsViral,39545,19,,,,,,356,C,5/21/2020 00:00,2020-05-21T00:00:00Z,05/20 20:00,10,,2020-05-21T00:00:00Z,39545,,,402,10,,,,,,,,,,,,,,02,0,2500,39545,2500,39545,0,0,35c0d99916df15598538988ac3fe15aefd18726b,0,0,0,0,0,
20200520,AK,402,,36643,,totalTestsViral,37045,16,,,,,,352,C,5/20/2020 00:00,2020-05-20T00:00:00Z,05/19 20:00,10,,2020-05-20T00:00:00Z,37045,,,402,10,,,,,,,,,,,,,,02,3,662,37045,665,37045,0,0,cc9495cad3e91083ce071fd24f910461d15cbed5,0,0,0,0,0,
20200519,AK,399,,35981,,totalTestsViral,36380,16,,,,,,348,B,5/19/2020 00:00,2020-05-19T00:00:00Z,05/18 20:00,10,,2020-05-19T00:00:00Z,36380,,,399,10,,,,,,,,,,,,,,02,0,769,36380,769,36380,0,0,319991fc88ab93628d43ff3c60b2b08df936fefc,0,0,0,0,0,
20200518,AK,399,,35212,,totalTestsViral,35611,9,,,,,,345,B,5/18/2020 00:00,2020-05-18T00:00:00Z,05/17 20:00,10,,2020-05-18T00:00:00Z,35611,,,399,10,,,,,,,,,,,,,,02,3,957,35611,960,35611,0,0,bae8231053622aa8cc03d542bc9dffb3cb9ebed0,0,0,0,0,0,
20200517,AK,396,,34255,,totalTestsViral,34651,13,,,,,,344,B,5/17/2020 00:00,2020-05-17T00:00:00Z,05/16 20:00,10,,2020-05-17T00:00:00Z,34651,,,396,10,,,,,,,,,,,,,,02,4,1366,34651,1370,34651,0,0,87c09f26b4a858c0e2e30c38e8db89413deaebcc,0,0,0,0,0,
20200516,AK,392,,32889,,totalTestsViral,33281,10,,,,,,344,B,5/16/2020 00:00,2020-05-16T00:00:00Z,05/15 20:00,10,,2020-05-16T00:00:00Z,33281,,,392,10,,,,,,,,,,,,,,02,4,859,33281,863,33281,0,0,7afc358f514bbf3895d1be91a7d11c8bafbf1c53,0,0,0,0,0,
20200515,AK,388,,32030,,totalTestsViral,32418,8,,,,,,343,B,5/14/2020 00:00,2020-05-14T00:00:00Z,05/13 20:00,10,,2020-05-14T00:00:00Z,32418,,,388,10,,,,,,,,,,,,,,02,1,655,32418,656,32418,0,0,47112999bfda5f791e95985b3abedf42e06e059d,0,0,0,0,0,
20200514,AK,387,,31375,,totalTestsViral,31762,12,,,,,,339,B,5/14/2020 00:00,2020-05-14T00:00:00Z,05/13 20:00,10,,2020-05-14T00:00:00Z,31762,,,387,10,,,,,,,,,,,,,,02,4,1109,31762,1113,31762,0,0,e49fc47a7cae8c00757c28a613e3e7271bc5fe9a,0,0,0,0,0,
20200513,AK,383,,30266,,totalTestsViral,30649,12,,,,,,338,B,5/13/2020 00:00,2020-05-13T00:00:00Z,05/12 20:00,10,,2020-05-13T00:00:00Z,30649,,,383,10,,,,,,,,,,,,,,02,0,688,30649,688,30649,0,0,b3724dd402f306b2e36e9301648a50e518885d78,0,0,0,0,0,
20200512,AK,383,,29578,,totalTestsViral,29961,10,,,,,,334,B,5/12/2020 00:00,2020-05-12T00:00:00Z,05/11 20:00,10,,2020-05-12T00:00:00Z,29961,,,383,10,,,,,,,,,,,,,,02,2,1279,29961,1281,29961,0,0,318475f6f136b567a6960b0952ff53962dea95d5,0,0,0,0,0,
20200511,AK,381,,28299,,totalTestsViral,28680,7,,,,,,328,C,5/11/2020 00:00,2020-05-11T00:00:00Z,05/10 20:00,10,,2020-05-11T00:00:00Z,28680,,,381,10,,,,,,,,,,,,,,02,2,1314,28680,1316,28680,0,0,2a34dc7623127ba7276775fe5c04580e0970a4a1,0,0,0,0,0,
20200510,AK,379,,26985,,totalTestsViral,27364,8,,,,,,324,C,5/10/2020 14:00,2020-05-10T14:00:00Z,05/10 10:00,10,,2020-05-10T14:00:00Z,27364,,,379,10,,,,,,,,,,,,,,02,1,914,27364,915,27364,0,0,eb60328159f52073239532a31c620a6c01e87c93,0,0,0,0,0,
20200509,AK,378,,26071,,totalTestsViral,26449,8,,,,,,318,C,5/9/2020 00:00,2020-05-09T00:00:00Z,05/08 20:00,10,,2020-05-09T00:00:00Z,26449,,,378,10,,,,,,,,,,,,,,02,1,975,26449,976,26449,0,0,f0c96289c1015d4ea76faf3ce22625117b0290e7,0,0,0,0,0,
20200508,AK,377,,25096,,totalTestsViral,25473,16,,,,,,305,C,5/8/2020 00:00,2020-05-08T00:00:00Z,05/07 20:00,10,,2020-05-08T00:00:00Z,25473,,,377,10,,,,,,,,,,,,,,02,3,1129,25473,1132,25473,0,0,f69720a79b27567842fbd8712a87777367e0ec93,0,0,0,0,0,
20200507,AK,374,,23967,,totalTestsViral,24341,12,,,,,,291,C,5/7/2020 00:00,2020-05-07T00:00:00Z,05/06 20:00,10,,2020-05-07T00:00:00Z,24341,,,374,10,,,,,,,,,,,,,,02,2,684,24341,686,24341,0,0,b73f63859fd24fe37cf5545173e91d1bebf14ab1,0,0,0,0,0,
20200506,AK,372,,23283,,totalTestsViral,23655,8,,,,,,284,C,5/6/2020 00:00,2020-05-06T00:00:00Z,05/05 20:00,10,,2020-05-06T00:00:00Z,23655,,,372,10,,,,,,,,,,,,,,02,1,962,23655,963,23655,1,0,4ca7d2253f361638f0fee0a88659a75999e7325f,0,0,0,0,0,
20200505,AK,371,,22321,,totalTestsViral,22692,13,,,,,,277,C,5/5/2020 00:00,2020-05-05T00:00:00Z,05/04 20:00,9,,2020-05-05T00:00:00Z,22692,,,371,9,,,,,,,,,,,,,,02,1,968,22692,969,22692,0,0,5b4131abb50a0db8d3f3cb5037b69ac70296d34a,0,0,0,0,0,
20200504,AK,370,,21353,,totalTestsViral,21723,12,,,,,,263,C,5/4/2020 00:00,2020-05-04T00:00:00Z,05/03 20:00,9,,2020-05-04T00:00:00Z,21723,,,370,9,,,,,,,,,,,,,,02,2,143,21723,145,21723,0,0,8b1531c039d61881c10a055b559eb8220148c915,0,0,0,0,0,
20200503,AK,368,,21210,,totalTestsViral,21578,12,,,,,,262,C,5/3/2020 14:15,2020-05-03T14:15:00Z,05/03 10:15,9,,2020-05-03T14:15:00Z,21578,,,368,9,,,,,,,,,,,,,,02,3,176,21578,179,21578,0,0,c47151295cc974fe1a79d06f3e6e2305741e76bd,0,0,0,0,0,
20200502,AK,365,,21034,,totalTestsViral,21399,10,,,,,,261,C,5/2/2020 00:00,2020-05-02T00:00:00Z,05/01 20:00,9,,2020-05-02T00:00:00Z,21399,,,365,,,,,,,,,,,,,,,02,1,1073,21399,1074,21399,0,0,87c61267f90b25ff376ba9e6dcffc2458ce330ed,0,0,0,0,0,
20200501,AK,364,,19961,,totalTestsViral,20325,25,,,,,,254,C,5/1/2020 14:00,2020-05-01T14:00:00Z,05/01 10:00,9,,2020-05-01T14:00:00Z,20325,,,364,,,,,,,,,,,,,,,02,9,1197,20325,1206,20325,0,0,e95966da00cd314db34744b43875df076126d78a,0,0,0,0,0,
20200430,AK,355,,18764,,totalTestsViral,19119,19,,,,,,252,C,4/30/2020 15:00,2020-04-30T15:00:00Z,04/30 11:00,9,,2020-04-30T15:00:00Z,19119,,,355,,,,,,,,,,,,,,,02,0,0,19119,0,19119,0,0,5921b6b9fe3c2b5a096b498415f70c6818edc722,0,0,0,0,0,
20200429,AK,355,,18764,,totalTestsViral,19119,14,,,,,,240,B,4/28/2020 14:50,2020-04-28T14:50:00Z,04/28 10:50,9,,2020-04-28T14:50:00Z,19119,,,355,,,,,,,,,,,,,,,02,4,2026,19119,2030,19119,0,0,4087ef78a2605d2738b188a378951eb7335437ba,0,0,0,0,0,
20200428,AK,351,,16738,,totalTestsViral,17089,16,,,,,,228,B,4/28/2020 14:50,2020-04-28T14:50:00Z,04/28 10:50,9,,2020-04-28T14:50:00Z,17089,,,351,,,,,,,,,,,,,,,02,6,827,17089,833,17089,0,0,343c9443e3205e56c6510c4be3dc1128839d5e5f,0,0,0,0,0,
20200427,AK,345,,15911,,totalTestsViral,16256,10,,,,,,218,B,4/27/2020 14:00,2020-04-27T14:00:00Z,04/27 10:00,9,,2020-04-27T14:00:00Z,16256,,,345,,,,,,,,,,,,,,,02,4,75,16256,79,16256,0,0,85bffcfecac0b7d9d29ccaf0bda802dd0ffb1fc6,0,0,0,0,0,
20200426,AK,341,,15836,,totalTestsViral,16177,14,,,,,,217,B,4/26/2020 14:15,2020-04-26T14:15:00Z,04/26 10:15,9,,2020-04-26T14:15:00Z,16177,,,341,,,,,,,,,,,,,,,02,2,443,16177,445,16177,0,0,e08018dd033ddad2570e7694473f23afaedbb402,0,0,0,0,0,
20200425,AK,339,,15393,,totalTestsViral,15732,32,,,,,,217,B,4/25/2020 16:00,2020-04-25T16:00:00Z,04/25 12:00,9,,2020-04-25T16:00:00Z,15732,,,339,,,,,,,,,,,,,,,02,0,3451,15732,3451,15732,0,0,a86080a7fc29b38c5b4b3066db8447bf11c36a94,0,0,0,0,0,
20200424,AK,339,,11942,,totalTestsViral,12281,36,,,,,,208,A,4/24/2020 15:00,2020-04-24T15:00:00Z,04/24 11:00,9,,2020-04-24T15:00:00Z,12281,,,339,,,,,,,,,,,,,,,02,2,118,12281,120,12281,0,0,f97ccf94bbeca6a780f1ab4c5485c95aa5c0603e,0,0,0,0,0,
20200423,AK,337,,11824,,totalTestsViral,12161,42,,,,,,209,A,4/23/2020 14:00,2020-04-23T14:00:00Z,04/23 10:00,9,,2020-04-23T14:00:00Z,12161,,,337,,,,,,,,,,,,,,,02,2,0,12161,2,12161,0,-36,44a203914dba2f101676b5eeac4042bf6f94bb9e,0,0,0,0,0,
20200422,AK,335,,11824,,totalTestsViral,12159,39,36,,,,,196,A,4/22/2020 14:00,2020-04-22T14:00:00Z,04/22 10:00,9,36,2020-04-22T14:00:00Z,12159,,,335,,,,,,,,,,,,,,,02,6,1034,12159,1040,12159,0,0,3deecbb2c148a2ea71b9c44dcf79027b775d56f2,0,0,0,0,0,
20200421,AK,329,,10790,,totalTestsViral,11119,42,36,,,,,168,A,4/21/2020 15:15,2020-04-21T15:15:00Z,04/21 11:15,9,36,2020-04-21T15:15:00Z,11119,,,329,,,,,,,,,,,,,,,02,8,987,11119,995,11119,0,0,bbbacc5d2de2c21f24958bcedf39eba86c51ab7b,0,0,0,0,0,
20200420,AK,321,,9803,,totalTestsViral,10124,46,36,,,,,161,A,4/20/2020 14:00,2020-04-20T14:00:00Z,04/20 10:00,9,36,2020-04-20T14:00:00Z,10124,,,321,,,,,,,,,,,,,,,02,2,227,10124,229,10124,0,0,03c6d882dd191543f3b648e07178cb243faf90cf,0,0,0,0,0,
20200419,AK,319,,9576,,totalTestsViral,9895,37,36,,,,,153,A,4/18/2020 17:45,2020-04-18T17:45:00Z,04/18 13:45,9,36,2020-04-18T17:45:00Z,9895,,,319,,,,,,,,,,,,,,,02,5,235,9895,240,9895,0,0,12bb6719fe7d4b4a80938a1f48c53843ff0db6e9,0,0,0,0,0,
20200418,AK,314,,9341,,totalTestsViral,9655,39,36,,,,,147,A,4/18/2020 14:15,2020-04-18T14:15:00Z,04/18 10:15,9,36,2020-04-18T14:15:00Z,9655,,,314,,,,,,,,,,,,,,,02,5,200,9655,205,9655,0,0,60022cc51dc3a7b344a94f5d48f25689a4e61b2e,0,0,0,0,0,
20200417,AK,309,,9141,,totalTestsViral,9450,,36,,,,,128,A,4/16/2020 00:00,2020-04-16T00:00:00Z,04/15 20:00,9,36,2020-04-16T00:00:00Z,9450,,,309,,,,,,,,,,,,,,,02,9,706,9450,715,9450,0,1,38c35054739da253724cfdadd17df082b7de12f5,0,0,0,0,0,
20200416,AK,300,,8435,,totalTestsViral,8735,,35,,,,,110,A,4/16/2020 15:30,2020-04-16T15:30:00Z,04/16 11:30,9,35,2020-04-16T15:30:00Z,8735,,,300,,,,,,,,,,,,,,,02,7,64,8735,71,8735,0,1,5f1fef306f964fc5043a4d3ea5c4ec39667ce3c4,0,0,0,0,0,
20200415,AK,293,,8371,,totalTestsViral,8664,,34,,,,,106,A,4/15/2020 15:15,2020-04-15T15:15:00Z,04/15 11:15,9,34,2020-04-15T15:15:00Z,8664,,,293,,,,,,,,,,,,,,,02,8,308,8664,316,8664,0,2,13668aa438aaf3e16dd7b4ad1a0441870b15bfa1,0,0,0,0,0,
20200414,AK,285,,8063,,totalTestsViral,8348,,32,,,,,98,A,4/14/2020 14:15,2020-04-14T14:15:00Z,04/14 10:15,9,32,2020-04-14T14:15:00Z,8348,,,285,,,,,,,,,,,,,,,02,8,510,8348,518,8348,1,0,9243142c4b80c6b72602f6335475bdbb6c56d7cd,0,0,0,0,0,
20200413,AK,277,,7553,,totalTestsViral,7830,,32,,,,,85,A,4/13/2020 00:00,2020-04-13T00:00:00Z,04/12 20:00,8,32,2020-04-13T00:00:00Z,7830,,,277,,,,,,,,,,,,,,,02,5,-213,7830,-208,7830,0,1,05c2b16e4de9a6ac0bde837f378959a0a46c5eba,0,0,0,0,0,
20200412,AK,272,,7766,,totalTestsViral,8038,,31,,,,,66,A,4/12/2020 14:50,2020-04-12T14:50:00Z,04/12 10:50,8,31,2020-04-12T14:50:00Z,8038,,,272,,,,,,,,,,,,,,,02,15,291,8038,306,8038,0,0,8228011d4358a66f75bd95d3026c151ebb682519,0,0,0,0,0,
20200411,AK,257,,7475,,totalTestsViral,7732,,31,,,,,63,A,4/11/2020 14:45,2020-04-11T14:45:00Z,04/11 10:45,8,31,2020-04-11T14:45:00Z,7732,,,257,,,,,,,,,,,,,,,02,11,289,7732,300,7732,1,3,b399533c6f8fb36e1928c0a24c3c854f00c82d66,0,0,0,0,0,
20200410,AK,246,,7186,,totalTestsViral,7432,,28,,,,,55,A,4/10/2020 15:30,2020-04-10T15:30:00Z,04/10 11:30,7,28,2020-04-10T15:30:00Z,7432,,,246,,,,,,,,,,,,,,,02,11,198,7432,209,7432,0,1,4069e55749634b0f747727ae6f3dce2224e54dd8,0,0,0,0,0,
20200409,AK,235,,6988,,totalTestsViral,7223,,27,,,,,49,A,4/9/2020 16:00,2020-04-09T16:00:00Z,04/09 12:00,7,27,2020-04-09T16:00:00Z,7223,,,235,,,,,,,,,,,,,,,02,9,146,7223,155,7223,0,0,c22f6705481e652c5b2f3e810eba8febd7652e10,0,0,0,0,0,
20200408,AK,226,,6842,,totalTestsViral,7068,,27,,,,,32,A,4/8/2020 15:00,2020-04-08T15:00:00Z,04/08 11:00,7,27,2020-04-08T15:00:00Z,7068,,,226,,,,,,,,,,,,,,,02,13,142,7068,155,7068,1,4,30a334e750a3340c8a71cbd5b2657b87291d4382,0,0,0,0,0,
20200407,AK,213,,6700,,totalTestsViral,6913,,23,,,,,29,A,4/7/2020 15:15,2020-04-07T15:15:00Z,04/07 11:15,6,23,2020-04-07T15:15:00Z,6913,,,213,,,,,,,,,,,,,,,02,22,8,6913,30,6913,0,0,3076e56fdffac9c99ac9be089caa5008da15c2f7,0,0,0,0,0,
20200406,AK,191,,6692,,totalTestsViral,6883,,23,,,,,,A,4/6/2020 14:45,2020-04-06T14:45:00Z,04/06 10:45,6,23,2020-04-06T14:45:00Z,6883,,,191,,,,,,,,,,,,,,,02,6,593,6883,599,6883,0,3,f8ad86a636e6fb62dd775f9201fc392d052967d8,0,0,0,0,0,
20200405,AK,185,,6099,,totalTestsViral,6284,,20,,,,,,A,4/5/2020 00:00,2020-04-05T00:00:00Z,04/04 20:00,6,20,2020-04-05T00:00:00Z,6284,,,185,,,,,,,,,,,,,,,02,14,230,6284,244,6284,1,4,273dd600a475bcf3f390a8b942a8576c25918e24,0,0,0,0,0,
20200404,AK,171,,5869,,totalTestsViral,6040,,16,,,,,,A,4/4/2020 16:00,2020-04-04T16:00:00Z,04/04 12:00,5,16,2020-04-04T16:00:00Z,6040,,,171,,,,,,,,,,,,,,,02,14,10,6040,24,6040,2,1,1ae0a25799a1299758e0f632b2e2ada242a570e2,0,0,0,0,0,
20200403,AK,157,,5859,,totalTestsViral,6016,,15,,,,,,A,4/3/2020 16:00,2020-04-03T16:00:00Z,04/03 12:00,3,15,2020-04-03T16:00:00Z,6016,,,157,,,,,,,,,,,,,,,02,14,980,6016,994,6016,0,6,3c504db2a32f70907b03fb1d187c6ebb82f99680,0,0,0,0,0,
20200402,AK,143,,4879,,totalTestsViral,5022,,9,,,,,,A,4/1/2020 21:00,2020-04-01T21:00:00Z,04/01 17:00,3,9,2020-04-01T21:00:00Z,5022,,,143,,,,,,,,,,,,,,,02,10,409,5022,419,5022,0,0,8ef0b6a6255cc8a72b4ed6a053f5121d5798fed3,0,0,0,0,0,
20200401,AK,133,,4470,,totalTestsViral,4603,,9,,,,,,A,3/31/2020 19:00,2020-03-31T19:00:00Z,03/31 15:00,3,9,2020-03-31T19:00:00Z,4603,,,133,,,,,,,,,,,,,,,02,14,876,4603,890,4603,0,2,6ad72f36baeba5d06beb482aa95316640c21b6ff,0,0,0,0,0,
20200331,AK,119,,3594,,totalTestsViral,3713,,7,,,,,,A,3/30/2020 19:00,2020-03-30T19:00:00Z,03/30 15:00,3,7,2020-03-30T19:00:00Z,3713,,,119,,,,,,,,,,,,,,,02,5,54,3713,59,3713,0,0,645327319e8941661d7497d907fe737180861b84,0,0,0,0,0,
20200330,AK,114,,3540,,totalTestsViral,3654,,7,,,,,,A,3/29/2020 19:00,2020-03-29T19:00:00Z,03/29 15:00,3,7,2020-03-29T19:00:00Z,3654,,,114,,,,,,,,,,,,,,,02,12,308,3654,320,3654,1,1,e5011d89a7dd512691caae4c92a351ec784f062f,0,0,0,0,0,
20200329,AK,102,,3232,,totalTestsViral,3334,,6,,,,,,A,3/28/2020 19:00,2020-03-28T19:00:00Z,03/28 15:00,2,6,2020-03-28T19:00:00Z,3334,,,102,,,,,,,,,,,,,,,02,17,396,3334,413,3334,0,1,83b0121c11466c406718ec62f22332ee77aca88e,0,0,0,0,0,
20200328,AK,85,,2836,,totalTestsViral,2921,,5,,,,,,A,3/27/2020 19:00,2020-03-27T19:00:00Z,03/27 15:00,2,5,2020-03-27T19:00:00Z,2921,,,85,,,,,,,,,,,,,,,02,16,517,2921,533,2921,1,2,a95251ea0b0220e7c4602b86cef0809820fcd71f,0,0,0,0,0,
20200327,AK,69,,2319,13,totalTestsViral,2388,,3,,,,,,A,3/26/2020 21:00,2020-03-26T21:00:00Z,03/26 17:00,1,3,2020-03-26T21:00:00Z,2388,,,69,,,,,,,,,,,,,,,02,10,518,2401,528,2388,0,0,d29d960bc67d90d9778326acaa8551dd6320c8d6,0,0,0,0,0,
20200326,AK,59,,1801,,totalTestsViral,1860,,3,,,,,,A,3/25/2020 21:00,2020-03-25T21:00:00Z,03/25 17:00,1,3,2020-03-25T21:00:00Z,1860,,,59,,,,,,,,,,,,,,,02,17,152,1860,169,1860,0,2,1eb2cbcbbbd1e191d92593d2564ffd06c2b01fe0,0,0,0,0,0,
20200325,AK,42,,1649,,totalTestsViral,1691,,1,,,,,,A,3/24/2020 21:00,2020-03-24T21:00:00Z,03/24 17:00,1,1,2020-03-24T21:00:00Z,1691,,,42,,,,,,,,,,,,,,,02,6,663,1691,669,1691,1,1,1945bf03a35ff4de9b48d9f87453708491c953be,0,0,0,0,0,
20200324,AK,36,,986,,totalTestsViral,1022,,0,,,,,,A,3/23/2020 19:00,2020-03-23T19:00:00Z,03/23 15:00,0,0,2020-03-23T19:00:00Z,1022,,,36,,,,,,,,,,,,,,,02,14,40,1022,54,1022,0,0,749774c149fda350c44cf0cded9a2d7afabd8e95,0,0,0,0,0,
20200323,AK,22,,946,,totalTestsViral,968,,0,,,,,,A,3/21/2020 16:30,2020-03-21T16:30:00Z,03/21 12:30,0,0,2020-03-21T16:30:00Z,968,,,22,,,,,,,,,,,,,,,02,0,0,968,0,968,0,0,ffb885d3189ec7b5c62504d15ef592759bbe21ff,0,0,0,0,0,
20200322,AK,22,,946,,totalTestsViral,968,,0,,,,,,,3/21/2020 16:30,2020-03-21T16:30:00Z,03/21 12:30,0,0,2020-03-21T16:30:00Z,968,,,22,,,,,,,,,,,,,,,02,8,188,968,196,968,0,0,f4f248a83e102cf3137949daff78395300270ac8,0,0,0,0,0,
20200321,AK,14,,758,,totalTestsViral,772,,0,,,,,,,3/21/2020 16:30,2020-03-21T16:30:00Z,03/21 12:30,0,0,2020-03-21T16:30:00Z,772,,,14,,,,,,,,,,,,,,,02,2,72,772,74,772,0,0,4c951fd50d3cea65c687df2f2ecd47f9885673b6,0,0,0,0,0,
20200320,AK,12,,686,,totalTestsViral,698,,,,,,,,,3/20/2020 16:30,2020-03-20T16:30:00Z,03/20 12:30,0,,2020-03-20T16:30:00Z,698,,,12,,,,,,,,,,,,,,,02,6,254,698,260,698,0,0,c909c4560a5da5a77bf582c3dcbac5a7af9a2633,0,0,0,0,0,
20200319,AK,6,,432,,totalTestsViral,438,,,,,,,,,3/18/2020 16:30,2020-03-18T16:30:00Z,03/18 12:30,0,,2020-03-18T16:30:00Z,438,,,6,,,,,,,,,,,,,,,02,0,26,438,26,438,0,0,86569b9f53aae18935370c933facad83b9cd08dc,0,0,0,0,0,
20200318,AK,6,,406,,totalTestsViral,412,,,,,,,,,3/17/2020 23:00,2020-03-17T23:00:00Z,03/17 19:00,0,,2020-03-17T23:00:00Z,412,,,6,,,,,,,,,,,,,,,02,3,72,412,75,412,0,0,7e1f4a08faa46918c3eb7d8db55fb4899fe135c2,0,0,0,0,0,
20200317,AK,3,,334,,totalTestsViral,337,,,,,,,,,3/17/2020 00:01,2020-03-17T00:01:00Z,03/16 20:01,0,,2020-03-17T00:01:00Z,337,,,3,,,,,,,,,,,,,,,02,2,191,337,193,337,0,0,b0ddb1e93b564ecedfc5bc29b033f969a096b992,0,0,0,0,0,
20200316,AK,1,,143,,totalTestsViral,144,,,,,,,,,3/16/2020 15:06,2020-03-16T15:06:00Z,03/16 11:06,0,,2020-03-16T15:06:00Z,144,,,1,,,,,,,,,,,,,,,02,0,0,144,0,144,0,0,89362bef802d778f5feac10fe91c7e76305e0dda,0,0,0,0,0,
20200315,AK,1,,143,,totalTestsViral,144,,,,,,,,,3/13/2020 16:30,2020-03-13T16:30:00Z,03/13 12:30,0,,2020-03-13T16:30:00Z,144,,,1,,,,,,,,,,,,,,,02,0,0,144,0,144,0,0,20ff42a9a6746813b2e4740d12007672da79f0b1,0,0,0,0,0,
20200314,AK,1,,143,,totalTestsViral,144,,,,,,,,,3/13/2020 16:30,2020-03-13T16:30:00Z,03/13 12:30,0,,2020-03-13T16:30:00Z,144,,,1,,,,,,,,,,,,,,,02,0,84,144,84,144,0,0,9095162b76033bbf20e99d60036d5f0484e73ad9,0,0,0,0,0,
20200313,AK,1,,59,,totalTestsViral,60,,,,,,,,,3/13/2020 00:00,2020-03-13T00:00:00Z,03/12 20:00,0,,2020-03-13T00:00:00Z,60,,,1,,,,,,,,,,,,,,,02,1,13,60,14,60,0,0,da0d14ad8168df478404be396e7c7eea3303692d,0,0,0,0,0,
20200312,AK,0,,46,14,totalTestsViral,46,,,,,,,,,3/11/2020 16:30,2020-03-11T16:30:00Z,03/11 12:30,0,,2020-03-11T16:30:00Z,46,,,0,,,,,,,,,,,,,,,02,0,0,60,0,46,0,0,a14ea2a6cc14f63a0d9996359403de06e41f1376,0,0,0,0,0,
20200311,AK,0,,46,14,totalTestsViral,46,,,,,,,,,,,,0,,,46,,,0,,,,,,,,,,,,,,,02,0,23,60,23,46,0,0,c00f2202130d39651ce01d7980a4a40537e30de6,0,0,0,0,0,
20200310,AK,0,,23,9,totalTestsViral,23,,,,,,,,,,,,0,,,23,,,0,,,,,,,,,,,,,,,02,0,0,32,0,23,0,0,9af72269be1687612d5dc7b05cceda6720e26bea,0,0,0,0,0,
20200309,AK,0,,23,9,totalTestsViral,23,,,,,,,,,,,,0,,,23,,,0,,,,,,,,,,,,,,,02,0,9,32,9,23,0,0,86accfdf59fadb3eb66cdddd86813c3994074d19,0,0,0,0,0,
20200308,AK,0,,14,6,totalTestsViral,14,,,,,,,,,,,,0,,,14,,,0,,,,,,,,,,,,,,,02,0,2,20,2,14,0,0,17e452792d42ceda21781d3dad341decc8879e38,0,0,0,0,0,
20200307,AK,0,,12,2,totalTestsViral,12,,,,,,,,,,,,0,,,12,,,0,,,,,,,,,,,,,,,02,0,4,14,4,12,0,0,20bf64c192a4a66709303ea3193f483abd6d9ba5,0,0,0,0,0,
20200306,AK,0,,8,1,totalTestsViral,8,,,,,,,,,,,,0,,,8,,,0,,,,,,,,,,,,,,,02,0,0,9,0,8,0,0,3db9e267da2402142b3db8fff2b94e5b2c1323f0,0,0,0,0,0,
