state,notes,covid19Site,covid19SiteSecondary,covid19SiteTertiary,twitter,covid19SiteOld,name,fips,pui,pum
AK,"Total tests are taken from the annotations on the charts on the page. 
Negatives = (Totals – Positives)
Positives occasionally update before totals do; do not revise negatives down, keep the last calculated negative.
Last Updated (Local Time) = (today's date + time = 00:00) 
As of May 16, Alaska reports specimens tested; because some people may be tested more than once, this number may be higher than the number of people tested.",http://dhss.alaska.gov/dph/Epi/id/Pages/COVID-19/monitoring.aspx,http://dhss.alaska.gov/dph/Epi/id/Pages/COVID-19/default.aspx,,@Alaska_DHSS,http://dhss.alaska.gov/dph/Epi/id/Pages/COVID-19/default.aspx,Alaska,02,,false
