[{"date":20201022,"state":"DE","positive":23528,"probableCases":1116,"negative":309531,"pending":null,"totalTestResultsSource":null,"totalTestResults":333059,"hospitalizedCurrently":110,"hospitalizedCumulative":null,"inIcuCurrently":25,"inIcuCumulative":null,"onVentilatorCurrently":null,"onVentilatorCumulative":null,"recovered":12410,"dataQualityGrade":"A+","lastUpdateEt":"10/21/2020 18:00","dateModified":"2020-10-21T18:00:00Z","checkTimeEt":"10/21 14:00","death":670,"hospitalized":null,"dateChecked":"2020-10-21T18:00:00Z","totalTestsViral":519743,"positiveTestsViral":null,"negativeTestsViral":null,"positiveCasesViral":22412,"deathConfirmed":589,"deathProbable":81,"totalTestEncountersViral":null,"totalTestsPeopleViral":333059,"totalTestsAntibody":null,"positiveTestsAntibody":null,"negativeTestsAntibody":null,"totalTestsPeopleAntibody":null,"positiveTestsPeopleAntibody":null,"negativeTestsPeopleAntibody":null,"totalTestsPeopleAntigen":null,"positiveTestsPeopleAntigen":null,"totalTestsAntigen":null,"positiveTestsAntigen":null,"fips":"10","positiveIncrease":153,"negativeIncrease":1426,"total":333059,"totalTestResultsIncrease":1579,"posNeg":333059,"deathIncrease":0,"hospitalizedIncrease":0,"hash":"774cd562c6687d6aee7f1d75d54b485e5cc8ed42","commercialScore":0,"negativeRegularScore":0,"negativeScore":0,"positiveScore":0,"score":0,"grade":""},{"date":20201021,"state":"DE","positive":23375,"probableCases":1112,"negative":308105,"pending":null,"totalTestResultsSource":null,"totalTestResults":331480,"hospitalizedCurrently":99,"hospitalizedCumulative":null,"inIcuCurrently":23,"inIcuCumulative":null,"onVentilatorCurrently":null,"onVentilatorCumulative":null,"recovered":12335,"dataQualityGrade":"A+","lastUpdateEt":"10/20/2020 18:00","dateModified":"2020-10-20T18:00:00Z","checkTimeEt":"10/20 14:00","death":670,"hospitalized":null,"dateChecked":"2020-10-20T18:00:00Z","totalTestsViral":518486,"positiveTestsViral":null,"negativeTestsViral":null,"positiveCasesViral":22263,"deathConfirmed":589,"deathProbable":81,"totalTestEncountersViral":null,"totalTestsPeopleViral":331480,"totalTestsAntibody":null,"positiveTestsAntibody":null,"negativeTestsAntibody":null,"totalTestsPeopleAntibody":null,"positiveTestsPeopleAntibody":null,"negativeTestsPeopleAntibody":null,"totalTestsPeopleAntigen":null,"positiveTestsPeopleAntigen":null,"totalTestsAntigen":null,"positiveTestsAntigen":null,"fips":"10","positiveIncrease":50,"negativeIncrease":704,"total":331480,"totalTestResultsIncrease":754,"posNeg":331480,"deathIncrease":2,"hospitalizedIncrease":0,"hash":"e07f6fb72e369e58ad1e6e53599d9bb72d73d893","commercialScore":0,"negativeRegularScore":0,"negativeScore":0,"positiveScore":0,"score":0,"grade":""},{"date":20201020,"state":"DE","positive":23325,"probableCases":1105,"negative":307401,"pending":null,"totalTestResultsSource":null,"totalTestResults":330726,"hospitalizedCurrently":107,"hospitalizedCumulative":null,"inIcuCurrently":25,"inIcuCumulative":null,"onVentilatorCurrently":null,"onVentilatorCumulative":null,"recovered":12245,"dataQualityGrade":"A+","lastUpdateEt":"10/19/2020 18:00","dateModified":"2020-10-19T18:00:00Z","checkTimeEt":"10/19 14:00","death":668,"hospitalized":null,"dateChecked":"2020-10-19T18:00:00Z","totalTestsViral":515223,"positiveTestsViral":null,"negativeTestsViral":null,"positiveCasesViral":22220,"deathConfirmed":587,"deathProbable":81,"totalTestEncountersViral":null,"totalTestsPeopleViral":330726,"totalTestsAntibody":null,"positiveTestsAntibody":null,"negativeTestsAntibody":null,"totalTestsPeopleAntibody":null,"positiveTestsPeopleAntibody":null,"negativeTestsPeopleAntibody":null,"totalTestsPeopleAntigen":null,"positiveTestsPeopleAntigen":null,"totalTestsAntigen":null,"positiveTestsAntigen":null,"fips":"10","positiveIncrease":129,"negativeIncrease":1579,"total":330726,"totalTestResultsIncrease":1708,"posNeg":330726,"deathIncrease":2,"hospitalizedIncrease":0,"hash":"92496b3a06c06cb39c1e87ce27cf8674bce0b845","commercialScore":0,"negativeRegularScore":0,"negativeScore":0,"positiveScore":0,"score":0,"grade":""},{"date":20201019,"state":"DE","positive":23196,"probableCases":1098,"negative":305822,"pending":null,"totalTestResultsSource":null,"totalTestResults":329018,"hospitalizedCurrently":107,"hospitalizedCumulative":null,"inIcuCurrently":19,"inIcuCumulative":null,"onVentilatorCurrently":null,"onVentilatorCumulative":null,"recovered":12113,"dataQualityGrade":"A+","lastUpdateEt":"10/18/2020 18:00","dateModified":"2020-10-18T18:00:00Z","checkTimeEt":"10/18 14:00","death":666,"hospitalized":null,"dateChecked":"2020-10-18T18:00:00Z","totalTestsViral":512407,"positiveTestsViral":null,"negativeTestsViral":null,"positiveCasesViral":22098,"deathConfirmed":585,"deathProbable":81,"totalTestEncountersViral":null,"totalTestsPeopleViral":329018,"totalTestsAntibody":null,"positiveTestsAntibody":null,"negativeTestsAntibody":null,"totalTestsPeopleAntibody":null,"positiveTestsPeopleAntibody":null,"negativeTestsPeopleAntibody":null,"totalTestsPeopleAntigen":null,"positiveTestsPeopleAntigen":null,"totalTestsAntigen":null,"positiveTestsAntigen":null,"fips":"10","positiveIncrease":103,"negativeIncrease":1619,"total":329018,"totalTestResultsIncrease":1722,"posNeg":329018,"deathIncrease":1,"hospitalizedIncrease":0,"hash":"aab073a458f48a91a055fb213d5ce86b3ce2ac05","commercialScore":0,"negativeRegularScore":0,"negativeScore":0,"positiveScore":0,"score":0,"grade":""},{"date":20201018,"state":"DE","positive":23093,"probableCases":1096,"negative":304203,"pending":null,"totalTestResultsSource":null,"totalTestResults":327296,"hospitalizedCurrently":106,"hospitalizedCumulative":null,"inIcuCurrently":21,"inIcuCumulative":null,"onVentilatorCurrently":null,"onVentilatorCumulative":null,"recovered":12018,"dataQualityGrade":"A+","lastUpdateEt":"10/17/2020 18:00","dateModified":"2020-10-17T18:00:00Z","checkTimeEt":"10/17 14:00","death":665,"hospitalized":null,"dateChecked":"2020-10-17T18:00:00Z","totalTestsViral":506109,"positiveTestsViral":null,"negativeTestsViral":null,"positiveCasesViral":21997,"deathConfirmed":584,"deathProbable":81,"totalTestEncountersViral":null,"totalTestsPeopleViral":327296,"totalTestsAntibody":null,"positiveTestsAntibody":null,"negativeTestsAntibody":null,"totalTestsPeopleAntibody":null,"positiveTestsPeopleAntibody":null,"negativeTestsPeopleAntibody":null,"totalTestsPeopleAntigen":null,"positiveTestsPeopleAntigen":null,"totalTestsAntigen":null,"positiveTestsAntigen":null,"fips":"10","positiveIncrease":151,"negativeIncrease":2676,"total":327296,"totalTestResultsIncrease":2827,"posNeg":327296,"deathIncrease":1,"hospitalizedIncrease":0,"hash":"339f5a4112d3c6b5b90203ce9a2d90bc49f5b8c5","commercialScore":0,"negativeRegularScore":0,"negativeScore":0,"positiveScore":0,"score":0,"grade":""},{"date":20201017,"state":"DE","positive":22942,"probableCases":1093,"negative":301527,"pending":null,"totalTestResultsSource":null,"totalTestResults":324469,"hospitalizedCurrently":101,"hospitalizedCumulative":null,"inIcuCurrently":26,"inIcuCumulative":null,"onVentilatorCurrently":null,"onVentilatorCumulative":null,"recovered":11928,"dataQualityGrade":"A+","lastUpdateEt":"10/16/2020 18:00","dateModified":"2020-10-16T18:00:00Z","checkTimeEt":"10/16 14:00","death":664,"hospitalized":null,"dateChecked":"2020-10-16T18:00:00Z","totalTestsViral":499403,"positiveTestsViral":null,"negativeTestsViral":null,"positiveCasesViral":21849,"deathConfirmed":583,"deathProbable":81,"totalTestEncountersViral":null,"totalTestsPeopleViral":324469,"totalTestsAntibody":null,"positiveTestsAntibody":null,"negativeTestsAntibody":null,"totalTestsPeopleAntibody":null,"positiveTestsPeopleAntibody":null,"negativeTestsPeopleAntibody":null,"totalTestsPeopleAntigen":null,"positiveTestsPeopleAntigen":null,"totalTestsAntigen":null,"positiveTestsAntigen":null,"fips":"10","positiveIncrease":218,"negativeIncrease":3109,"total":324469,"totalTestResultsIncrease":3327,"posNeg":324469,"deathIncrease":2,"hospitalizedIncrease":0,"hash":"275609a10fce282251b6be858a1e251005a930c7","commercialScore":0,"negativeRegularScore":0,"negativeScore":0,"positiveScore":0,"score":0,"grade":""},{"date":20201016,"state":"DE","positive":22724,"probableCases":1089,"negative":298418,"pending":null,"totalTestResultsSource":null,"totalTestResults":321142,"hospitalizedCurrently":104,"hospitalizedCumulative":null,"inIcuCurrently":26,"inIcuCumulative":null,"onVentilatorCurrently":null,"onVentilatorCumulative":null,"recovered":11818,"dataQualityGrade":"A+","lastUpdateEt":"10/15/2020 18:00","dateModified":"2020-10-15T18:00:00Z","checkTimeEt":"10/15 14:00","death":662,"hospitalized":null,"dateChecked":"2020-10-15T18:00:00Z","totalTestsViral":494635,"positiveTestsViral":null,"negativeTestsViral":null,"positiveCasesViral":21635,"deathConfirmed":581,"deathProbable":81,"totalTestEncountersViral":null,"totalTestsPeopleViral":321142,"totalTestsAntibody":null,"positiveTestsAntibody":null,"negativeTestsAntibody":null,"totalTestsPeopleAntibody":null,"positiveTestsPeopleAntibody":null,"negativeTestsPeopleAntibody":null,"totalTestsPeopleAntigen":null,"positiveTestsPeopleAntigen":null,"totalTestsAntigen":null,"positiveTestsAntigen":null,"fips":"10","positiveIncrease":164,"negativeIncrease":2345,"total":321142,"totalTestResultsIncrease":2509,"posNeg":321142,"deathIncrease":1,"hospitalizedIncrease":0,"hash":"0e7e5a967dd1c96877c758aad2425aca31fc9fca","commercialScore":0,"negativeRegularScore":0,"negativeScore":0,"positiveScore":0,"score":0,"grade":""},{"date":20201015,"state":"DE","positive":22560,"probableCases":1087,"negative":296073,"pending":null,"totalTestResultsSource":null,"totalTestResults":318633,"hospitalizedCurrently":111,"hospitalizedCumulative":null,"inIcuCurrently":28,"inIcuCumulative":null,"onVentilatorCurrently":null,"onVentilatorCumulative":null,"recovered":11724,"dataQualityGrade":"A+","lastUpdateEt":"10/14/2020 18:00","dateModified":"2020-10-14T18:00:00Z","checkTimeEt":"10/14 14:00","death":661,"hospitalized":null,"dateChecked":"2020-10-14T18:00:00Z","totalTestsViral":491430,"positiveTestsViral":null,"negativeTestsViral":null,"positiveCasesViral":21473,"deathConfirmed":580,"deathProbable":81,"totalTestEncountersViral":null,"totalTestsPeopleViral":318633,"totalTestsAntibody":null,"positiveTestsAntibody":null,"negativeTestsAntibody":null,"totalTestsPeopleAntibody":null,"positiveTestsPeopleAntibody":null,"negativeTestsPeopleAntibody":null,"totalTestsPeopleAntigen":null,"positiveTestsPeopleAntigen":null,"totalTestsAntigen":null,"positiveTestsAntigen":null,"fips":"10","positiveIncrease":95,"negativeIncrease":1715,"total":318633,"totalTestResultsIncrease":1810,"posNeg":318633,"deathIncrease":1,"hospitalizedIncrease":0,"hash":"be0e1c614af3d2ae59e9fb53bdeec64b5d323fd7","commercialScore":0,"negativeRegularScore":0,"negativeScore":0,"positiveScore":0,"score":0,"grade":""},{"date":20201014,"state":"DE","positive":22465,"probableCases":1085,"negative":294358,"pending":null,"totalTestResultsSource":null,"totalTestResults":316823,"hospitalizedCurrently":116,"hospitalizedCumulative":null,"inIcuCurrently":22,"inIcuCumulative":null,"onVentilatorCurrently":null,"onVentilatorCumulative":null,"recovered":11665,"dataQualityGrade":"A+","lastUpdateEt":"10/13/2020 18:00","dateModified":"2020-10-13T18:00:00Z","checkTimeEt":"10/13 14:00","death":660,"hospitalized":null,"dateChecked":"2020-10-13T18:00:00Z","totalTestsViral":490160,"positiveTestsViral":null,"negativeTestsViral":null,"positiveCasesViral":21380,"deathConfirmed":580,"deathProbable":80,"totalTestEncountersViral":null,"totalTestsPeopleViral":316823,"totalTestsAntibody":null,"positiveTestsAntibody":null,"negativeTestsAntibody":null,"totalTestsPeopleAntibody":null,"positiveTestsPeopleAntibody":null,"negativeTestsPeopleAntibody":null,"totalTestsPeopleAntigen":null,"positiveTestsPeopleAntigen":null,"totalTestsAntigen":null,"positiveTestsAntigen":null,"fips":"10","positiveIncrease":71,"negativeIncrease":1000,"total":316823,"totalTestResultsIncrease":1071,"posNeg":316823,"deathIncrease":1,"hospitalizedIncrease":0,"hash":"7bcb58769d60b20b57931cb1b07adad95f8ed57b","commercialScore":0,"negativeRegularScore":0,"negativeScore":0,"positiveScore":0,"score":0,"grade":""},{"date":20201013,"state":"DE","positive":22394,"probableCases":1083,"negative":293358,"pending":null,"totalTestResultsSource":null,"totalTestResults":315752,"hospitalizedCurrently":112,"hospitalizedCumulative":null,"inIcuCurrently":19,"inIcuCumulative":null,"onVentilatorCurrently":null,"onVentilatorCumulative":null,"recovered":11588,"dataQualityGrade":"A+","lastUpdateEt":"10/12/2020 18:00","dateModified":"2020-10-12T18:00:00Z","checkTimeEt":"10/12 14:00","death":659,"hospitalized":null,"dateChecked":"2020-10-12T18:00:00Z","totalTestsViral":489504,"positiveTestsViral":null,"negativeTestsViral":null,"positiveCasesViral":21311,"deathConfirmed":579,"deathProbable":80,"totalTestEncountersViral":null,"totalTestsPeopleViral":315752,"totalTestsAntibody":null,"positiveTestsAntibody":null,"negativeTestsAntibody":null,"totalTestsPeopleAntibody":null,"positiveTestsPeopleAntibody":null,"negativeTestsPeopleAntibody":null,"totalTestsPeopleAntigen":null,"positiveTestsPeopleAntigen":null,"totalTestsAntigen":null,"positiveTestsAntigen":null,"fips":"10","positiveIncrease":105,"negativeIncrease":1366,"total":315752,"totalTestResultsIncrease":1471,"posNeg":315752,"deathIncrease":3,"hospitalizedIncrease":0,"hash":"20c93d4d8fad831563764de46127e7df03edee9b","commercialScore":0,"negativeRegularScore":0,"negativeScore":0,"positiveScore":0,"score":0,"grade":""},{"date":20201012,"state":"DE","positive":22289,"probableCases":1080,"negative":291992,"pending":null,"totalTestResultsSource":null,"totalTestResults":314281,"hospitalizedCurrently":105,"hospitalizedCumulative":null,"inIcuCurrently":25,"inIcuCumulative":null,"onVentilatorCurrently":null,"onVentilatorCumulative":null,"recovered":11493,"dataQualityGrade":"A+","lastUpdateEt":"10/11/2020 18:00","dateModified":"2020-10-11T18:00:00Z","checkTimeEt":"10/11 14:00","death":656,"hospitalized":null,"dateChecked":"2020-10-11T18:00:00Z","totalTestsViral":null,"positiveTestsViral":null,"negativeTestsViral":null,"positiveCasesViral":21209,"deathConfirmed":576,"deathProbable":80,"totalTestEncountersViral":null,"totalTestsPeopleViral":314281,"totalTestsAntibody":null,"positiveTestsAntibody":null,"negativeTestsAntibody":null,"totalTestsPeopleAntibody":null,"positiveTestsPeopleAntibody":null,"negativeTestsPeopleAntibody":null,"totalTestsPeopleAntigen":null,"positiveTestsPeopleAntigen":null,"totalTestsAntigen":null,"positiveTestsAntigen":null,"fips":"10","positiveIncrease":159,"negativeIncrease":3552,"total":314281,"totalTestResultsIncrease":3711,"posNeg":314281,"deathIncrease":2,"hospitalizedIncrease":0,"hash":"6352946e606999264516d8723b43e2350ca2f4e1","commercialScore":0,"negativeRegularScore":0,"negativeScore":0,"positiveScore":0,"score":0,"grade":""},{"date":20201011,"state":"DE","positive":22130,"probableCases":1080,"negative":288440,"pending":null,"totalTestResultsSource":null,"totalTestResults":310570,"hospitalizedCurrently":108,"hospitalizedCumulative":null,"inIcuCurrently":24,"inIcuCumulative":null,"onVentilatorCurrently":null,"onVentilatorCumulative":null,"recovered":11430,"dataQualityGrade":"A+","lastUpdateEt":"10/10/2020 18:00","dateModified":"2020-10-10T18:00:00Z","checkTimeEt":"10/10 14:00","death":654,"hospitalized":null,"dateChecked":"2020-10-10T18:00:00Z","totalTestsViral":null,"positiveTestsViral":null,"negativeTestsViral":null,"positiveCasesViral":21050,"deathConfirmed":574,"deathProbable":80,"totalTestEncountersViral":null,"totalTestsPeopleViral":310570,"totalTestsAntibody":null,"positiveTestsAntibody":null,"negativeTestsAntibody":null,"totalTestsPeopleAntibody":null,"positiveTestsPeopleAntibody":null,"negativeTestsPeopleAntibody":null,"totalTestsPeopleAntigen":null,"positiveTestsPeopleAntigen":null,"totalTestsAntigen":null,"positiveTestsAntigen":null,"fips":"10","positiveIncrease":132,"negativeIncrease":2793,"total":310570,"totalTestResultsIncrease":2925,"posNeg":310570,"deathIncrease":1,"hospitalizedIncrease":0,"hash":"13466a1bfc8e5c48441ffff8cdd1a8fc23529faf","commercialScore":0,"negativeRegularScore":0,"negativeScore":0,"positiveScore":0,"score":0,"grade":""},{"date":20201010,"state":"DE","positive":21998,"probableCases":1081,"negative":285647,"pending":null,"totalTestResultsSource":null,"totalTestResults":307645,"hospitalizedCurrently":103,"hospitalizedCumulative":null,"inIcuCurrently":21,"inIcuCumulative":null,"onVentilatorCurrently":null,"onVentilatorCumulative":null,"recovered":11338,"dataQualityGrade":"A+","lastUpdateEt":"10/9/2020 18:00","dateModified":"2020-10-09T18:00:00Z","checkTimeEt":"10/09 14:00","death":653,"hospitalized":null,"dateChecked":"2020-10-09T18:00:00Z","totalTestsViral":null,"positiveTestsViral":null,"negativeTestsViral":null,"positiveCasesViral":20917,"deathConfirmed":573,"deathProbable":80,"totalTestEncountersViral":null,"totalTestsPeopleViral":307645,"totalTestsAntibody":null,"positiveTestsAntibody":null,"negativeTestsAntibody":null,"totalTestsPeopleAntibody":null,"positiveTestsPeopleAntibody":null,"negativeTestsPeopleAntibody":null,"totalTestsPeopleAntigen":null,"positiveTestsPeopleAntigen":null,"totalTestsAntigen":null,"positiveTestsAntigen":null,"fips":"10","positiveIncrease":171,"negativeIncrease":3107,"total":307645,"totalTestResultsIncrease":3278,"posNeg":307645,"deathIncrease":2,"hospitalizedIncrease":0,"hash":"1056bb10cda4eb66be5d9b8004633d2937eb79b6","commercialScore":0,"negativeRegularScore":0,"negativeScore":0,"positiveScore":0,"score":0,"grade":""},{"date":20201009,"state":"DE","positive":21827,"probableCases":1079,"negative":282540,"pending":null,"totalTestResultsSource":null,"totalTestResults":304367,"hospitalizedCurrently":104,"hospitalizedCumulative":null,"inIcuCurrently":21,"inIcuCumulative":null,"onVentilatorCurrently":null,"onVentilatorCumulative":null,"recovered":11236,"dataQualityGrade":"A+","lastUpdateEt":"10/8/2020 18:00","dateModified":"2020-10-08T18:00:00Z","checkTimeEt":"10/08 14:00","death":651,"hospitalized":null,"dateChecked":"2020-10-08T18:00:00Z","totalTestsViral":null,"positiveTestsViral":null,"negativeTestsViral":null,"positiveCasesViral":20748,"deathConfirmed":571,"deathProbable":80,"totalTestEncountersViral":null,"totalTestsPeopleViral":304367,"totalTestsAntibody":null,"positiveTestsAntibody":null,"negativeTestsAntibody":null,"totalTestsPeopleAntibody":null,"positiveTestsPeopleAntibody":null,"negativeTestsPeopleAntibody":null,"totalTestsPeopleAntigen":null,"positiveTestsPeopleAntigen":null,"totalTestsAntigen":null,"positiveTestsAntigen":null,"fips":"10","positiveIncrease":145,"negativeIncrease":2720,"total":304367,"totalTestResultsIncrease":2865,"posNeg":304367,"deathIncrease":0,"hospitalizedIncrease":0,"hash":"f79e5bcce4b30715f435f3770de5ded0a556e561","commercialScore":0,"negativeRegularScore":0,"negativeScore":0,"positiveScore":0,"score":0,"grade":""},{"date":20201008,"state":"DE","positive":21682,"probableCases":1078,"negative":279820,"pending":null,"totalTestResultsSource":null,"totalTestResults":301502,"hospitalizedCurrently":101,"hospitalizedCumulative":null,"inIcuCurrently":21,"inIcuCumulative":null,"onVentilatorCurrently":null,"onVentilatorCumulative":null,"recovered":11146,"dataQualityGrade":"A+","lastUpdateEt":"10/7/2020 18:00","dateModified":"2020-10-07T18:00:00Z","checkTimeEt":"10/07 14:00","death":651,"hospitalized":null,"dateChecked":"2020-10-07T18:00:00Z","totalTestsViral":null,"positiveTestsViral":null,"negativeTestsViral":null,"positiveCasesViral":20604,"deathConfirmed":571,"deathProbable":80,"totalTestEncountersViral":null,"totalTestsPeopleViral":301502,"totalTestsAntibody":null,"positiveTestsAntibody":null,"negativeTestsAntibody":null,"totalTestsPeopleAntibody":null,"positiveTestsPeopleAntibody":null,"negativeTestsPeopleAntibody":null,"totalTestsPeopleAntigen":null,"positiveTestsPeopleAntigen":null,"totalTestsAntigen":null,"positiveTestsAntigen":null,"fips":"10","positiveIncrease":132,"negativeIncrease":2197,"total":301502,"totalTestResultsIncrease":2329,"posNeg":301502,"deathIncrease":2,"hospitalizedIncrease":0,"hash":"8a592e1f6a2bed2893119fddb9443653fd8c64fd","commercialScore":0,"negativeRegularScore":0,"negativeScore":0,"positiveScore":0,"score":0,"grade":""},{"date":20201007,"state":"DE","positive":21550,"probableCases":1076,"negative":277623,"pending":null,"totalTestResultsSource":null,"totalTestResults":299173,"hospitalizedCurrently":89,"hospitalizedCumulative":null,"inIcuCurrently":18,"inIcuCumulative":null,"onVentilatorCurrently":null,"onVentilatorCumulative":null,"recovered":11071,"dataQualityGrade":"A+","lastUpdateEt":"10/6/2020 18:00","dateModified":"2020-10-06T18:00:00Z","checkTimeEt":"10/06 14:00","death":649,"hospitalized":null,"dateChecked":"2020-10-06T18:00:00Z","totalTestsViral":null,"positiveTestsViral":null,"negativeTestsViral":null,"positiveCasesViral":20474,"deathConfirmed":569,"deathProbable":80,"totalTestEncountersViral":null,"totalTestsPeopleViral":299173,"totalTestsAntibody":null,"positiveTestsAntibody":null,"negativeTestsAntibody":null,"totalTestsPeopleAntibody":null,"positiveTestsPeopleAntibody":null,"negativeTestsPeopleAntibody":null,"totalTestsPeopleAntigen":null,"positiveTestsPeopleAntigen":null,"totalTestsAntigen":null,"positiveTestsAntigen":null,"fips":"10","positiveIncrease":84,"negativeIncrease":1576,"total":299173,"totalTestResultsIncrease":1660,"posNeg":299173,"deathIncrease":3,"hospitalizedIncrease":0,"hash":"01ba59cb8900a4cf121d698fe313336326c56057","commercialScore":0,"negativeRegularScore":0,"negativeScore":0,"positiveScore":0,"score":0,"grade":""},{"date":20201006,"state":"DE","positive":21466,"probableCases":1074,"negative":276047,"pending":null,"totalTestResultsSource":null,"totalTestResults":297513,"hospitalizedCurrently":87,"hospitalizedCumulative":null,"inIcuCurrently":20,"inIcuCumulative":null,"onVentilatorCurrently":null,"onVentilatorCumulative":null,"recovered":10990,"dataQualityGrade":"A+","lastUpdateEt":"10/5/2020 18:00","dateModified":"2020-10-05T18:00:00Z","checkTimeEt":"10/05 14:00","death":646,"hospitalized":null,"dateChecked":"2020-10-05T18:00:00Z","totalTestsViral":null,"positiveTestsViral":null,"negativeTestsViral":null,"positiveCasesViral":20392,"deathConfirmed":566,"deathProbable":80,"totalTestEncountersViral":null,"totalTestsPeopleViral":297513,"totalTestsAntibody":null,"positiveTestsAntibody":null,"negativeTestsAntibody":null,"totalTestsPeopleAntibody":null,"positiveTestsPeopleAntibody":null,"negativeTestsPeopleAntibody":null,"totalTestsPeopleAntigen":null,"positiveTestsPeopleAntigen":null,"totalTestsAntigen":null,"positiveTestsAntigen":null,"fips":"10","positiveIncrease":103,"negativeIncrease":1575,"total":297513,"totalTestResultsIncrease":1678,"posNeg":297513,"deathIncrease":1,"hospitalizedIncrease":0,"hash":"1337ac325fa27aaec4a51953940e3c7af231a438","commercialScore":0,"negativeRegularScore":0,"negativeScore":0,"positiveScore":0,"score":0,"grade":""},{"date":20201005,"state":"DE","positive":21363,"probableCases":1076,"negative":274472,"pending":null,"totalTestResultsSource":null,"totalTestResults":295835,"hospitalizedCurrently":81,"hospitalizedCumulative":null,"inIcuCurrently":20,"inIcuCumulative":null,"onVentilatorCurrently":null,"onVentilatorCumulative":null,"recovered":10880,"dataQualityGrade":"A+","lastUpdateEt":"10/4/2020 18:00","dateModified":"2020-10-04T18:00:00Z","checkTimeEt":"10/04 14:00","death":645,"hospitalized":null,"dateChecked":"2020-10-04T18:00:00Z","totalTestsViral":null,"positiveTestsViral":null,"negativeTestsViral":null,"positiveCasesViral":20287,"deathConfirmed":565,"deathProbable":80,"totalTestEncountersViral":null,"totalTestsPeopleViral":295835,"totalTestsAntibody":null,"positiveTestsAntibody":null,"negativeTestsAntibody":null,"totalTestsPeopleAntibody":null,"positiveTestsPeopleAntibody":null,"negativeTestsPeopleAntibody":null,"totalTestsPeopleAntigen":null,"positiveTestsPeopleAntigen":null,"totalTestsAntigen":null,"positiveTestsAntigen":null,"fips":"10","positiveIncrease":120,"negativeIncrease":1626,"total":295835,"totalTestResultsIncrease":1746,"posNeg":295835,"deathIncrease":0,"hospitalizedIncrease":0,"hash":"a6ef90b118e325831be8f6fad53d5c12ff57aff2","commercialScore":0,"negativeRegularScore":0,"negativeScore":0,"positiveScore":0,"score":0,"grade":""},{"date":20201004,"state":"DE","positive":21243,"probableCases":1076,"negative":272846,"pending":null,"totalTestResultsSource":null,"totalTestResults":294089,"hospitalizedCurrently":82,"hospitalizedCumulative":null,"inIcuCurrently":20,"inIcuCumulative":null,"onVentilatorCurrently":null,"onVentilatorCumulative":null,"recovered":10806,"dataQualityGrade":"A+","lastUpdateEt":"10/3/2020 18:00","dateModified":"2020-10-03T18:00:00Z","checkTimeEt":"10/03 14:00","death":645,"hospitalized":null,"dateChecked":"2020-10-03T18:00:00Z","totalTestsViral":null,"positiveTestsViral":null,"negativeTestsViral":null,"positiveCasesViral":20167,"deathConfirmed":565,"deathProbable":80,"totalTestEncountersViral":null,"totalTestsPeopleViral":294089,"totalTestsAntibody":null,"positiveTestsAntibody":null,"negativeTestsAntibody":null,"totalTestsPeopleAntibody":null,"positiveTestsPeopleAntibody":null,"negativeTestsPeopleAntibody":null,"totalTestsPeopleAntigen":null,"positiveTestsPeopleAntigen":null,"totalTestsAntigen":null,"positiveTestsAntigen":null,"fips":"10","positiveIncrease":118,"negativeIncrease":1513,"total":294089,"totalTestResultsIncrease":1631,"posNeg":294089,"deathIncrease":0,"hospitalizedIncrease":0,"hash":"f725a030e7d17316924da951013520c12cbba2e1","commercialScore":0,"negativeRegularScore":0,"negativeScore":0,"positiveScore":0,"score":0,"grade":""},{"date":20201003,"state":"DE","positive":21125,"probableCases":1107,"negative":271333,"pending":null,"totalTestResultsSource":null,"totalTestResults":292458,"hospitalizedCurrently":83,"hospitalizedCumulative":null,"inIcuCurrently":21,"inIcuCumulative":null,"onVentilatorCurrently":null,"onVentilatorCumulative":null,"recovered":10748,"dataQualityGrade":"A+","lastUpdateEt":"10/2/2020 18:00","dateModified":"2020-10-02T18:00:00Z","checkTimeEt":"10/02 14:00","death":645,"hospitalized":null,"dateChecked":"2020-10-02T18:00:00Z","totalTestsViral":null,"positiveTestsViral":null,"negativeTestsViral":null,"positiveCasesViral":20018,"deathConfirmed":565,"deathProbable":80,"totalTestEncountersViral":null,"totalTestsPeopleViral":292458,"totalTestsAntibody":null,"positiveTestsAntibody":null,"negativeTestsAntibody":null,"totalTestsPeopleAntibody":null,"positiveTestsPeopleAntibody":null,"negativeTestsPeopleAntibody":null,"totalTestsPeopleAntigen":null,"positiveTestsPeopleAntigen":null,"totalTestsAntigen":null,"positiveTestsAntigen":null,"fips":"10","positiveIncrease":188,"negativeIncrease":1987,"total":292458,"totalTestResultsIncrease":2175,"posNeg":292458,"deathIncrease":3,"hospitalizedIncrease":0,"hash":"79cb56a34a217b0a1206f5a2b81c54a5c4313ffc","commercialScore":0,"negativeRegularScore":0,"negativeScore":0,"positiveScore":0,"score":0,"grade":""},{"date":20201002,"state":"DE","positive":20937,"probableCases":1098,"negative":269346,"pending":null,"totalTestResultsSource":null,"totalTestResults":290283,"hospitalizedCurrently":83,"hospitalizedCumulative":null,"inIcuCurrently":16,"inIcuCumulative":null,"onVentilatorCurrently":null,"onVentilatorCumulative":null,"recovered":10678,"dataQualityGrade":"A+","lastUpdateEt":"10/1/2020 18:00","dateModified":"2020-10-01T18:00:00Z","checkTimeEt":"10/01 14:00","death":642,"hospitalized":null,"dateChecked":"2020-10-01T18:00:00Z","totalTestsViral":null,"positiveTestsViral":null,"negativeTestsViral":null,"positiveCasesViral":19839,"deathConfirmed":562,"deathProbable":80,"totalTestEncountersViral":null,"totalTestsPeopleViral":290283,"totalTestsAntibody":null,"positiveTestsAntibody":null,"negativeTestsAntibody":null,"totalTestsPeopleAntibody":null,"positiveTestsPeopleAntibody":null,"negativeTestsPeopleAntibody":null,"totalTestsPeopleAntigen":null,"positiveTestsPeopleAntigen":null,"totalTestsAntigen":null,"positiveTestsAntigen":null,"fips":"10","positiveIncrease":150,"negativeIncrease":1916,"total":290283,"totalTestResultsIncrease":2066,"posNeg":290283,"deathIncrease":6,"hospitalizedIncrease":0,"hash":"1b0272d112a79c1c0d76d238962acb1db34799ce","commercialScore":0,"negativeRegularScore":0,"negativeScore":0,"positiveScore":0,"score":0,"grade":""},{"date":20201001,"state":"DE","positive":20787,"probableCases":1097,"negative":267430,"pending":null,"totalTestResultsSource":null,"totalTestResults":288217,"hospitalizedCurrently":78,"hospitalizedCumulative":null,"inIcuCurrently":17,"inIcuCumulative":null,"onVentilatorCurrently":null,"onVentilatorCumulative":null,"recovered":10648,"dataQualityGrade":"A+","lastUpdateEt":"9/30/2020 18:00","dateModified":"2020-09-30T18:00:00Z","checkTimeEt":"09/30 14:00","death":636,"hospitalized":null,"dateChecked":"2020-09-30T18:00:00Z","totalTestsViral":null,"positiveTestsViral":null,"negativeTestsViral":null,"positiveCasesViral":19690,"deathConfirmed":559,"deathProbable":77,"totalTestEncountersViral":null,"totalTestsPeopleViral":288217,"totalTestsAntibody":null,"positiveTestsAntibody":null,"negativeTestsAntibody":null,"totalTestsPeopleAntibody":null,"positiveTestsPeopleAntibody":null,"negativeTestsPeopleAntibody":null,"totalTestsPeopleAntigen":null,"positiveTestsPeopleAntigen":null,"totalTestsAntigen":null,"positiveTestsAntigen":null,"fips":"10","positiveIncrease":174,"negativeIncrease":1481,"total":288217,"totalTestResultsIncrease":1655,"posNeg":288217,"deathIncrease":0,"hospitalizedIncrease":0,"hash":"208a87973e582ada937821ab923519bbb1d34e0b","commercialScore":0,"negativeRegularScore":0,"negativeScore":0,"positiveScore":0,"score":0,"grade":""},{"date":20200930,"state":"DE","positive":20613,"probableCases":1073,"negative":265949,"pending":null,"totalTestResultsSource":null,"totalTestResults":286562,"hospitalizedCurrently":72,"hospitalizedCumulative":null,"inIcuCurrently":15,"inIcuCumulative":null,"onVentilatorCurrently":null,"onVentilatorCumulative":null,"recovered":10622,"dataQualityGrade":"A+","lastUpdateEt":"9/29/2020 18:00","dateModified":"2020-09-29T18:00:00Z","checkTimeEt":"09/29 14:00","death":636,"hospitalized":null,"dateChecked":"2020-09-29T18:00:00Z","totalTestsViral":null,"positiveTestsViral":null,"negativeTestsViral":null,"positiveCasesViral":19540,"deathConfirmed":559,"deathProbable":77,"totalTestEncountersViral":null,"totalTestsPeopleViral":286562,"totalTestsAntibody":null,"positiveTestsAntibody":null,"negativeTestsAntibody":null,"totalTestsPeopleAntibody":null,"positiveTestsPeopleAntibody":null,"negativeTestsPeopleAntibody":null,"totalTestsPeopleAntigen":null,"positiveTestsPeopleAntigen":null,"totalTestsAntigen":null,"positiveTestsAntigen":null,"fips":"10","positiveIncrease":82,"negativeIncrease":992,"total":286562,"totalTestResultsIncrease":1074,"posNeg":286562,"deathIncrease":1,"hospitalizedIncrease":0,"hash":"74ae7a04876c22b5b9f938da17762816c6c4e84b","commercialScore":0,"negativeRegularScore":0,"negativeScore":0,"positiveScore":0,"score":0,"grade":""},{"date":20200929,"state":"DE","positive":20531,"probableCases":1066,"negative":264957,"pending":null,"totalTestResultsSource":null,"totalTestResults":285488,"hospitalizedCurrently":64,"hospitalizedCumulative":null,"inIcuCurrently":12,"inIcuCumulative":null,"onVentilatorCurrently":null,"onVentilatorCumulative":null,"recovered":10599,"dataQualityGrade":"A+","lastUpdateEt":"9/28/2020 18:00","dateModified":"2020-09-28T18:00:00Z","checkTimeEt":"09/28 14:00","death":635,"hospitalized":null,"dateChecked":"2020-09-28T18:00:00Z","totalTestsViral":null,"positiveTestsViral":null,"negativeTestsViral":null,"positiveCasesViral":19465,"deathConfirmed":558,"deathProbable":77,"totalTestEncountersViral":null,"totalTestsPeopleViral":285488,"totalTestsAntibody":null,"positiveTestsAntibody":null,"negativeTestsAntibody":null,"totalTestsPeopleAntibody":null,"positiveTestsPeopleAntibody":null,"negativeTestsPeopleAntibody":null,"totalTestsPeopleAntigen":null,"positiveTestsPeopleAntigen":null,"totalTestsAntigen":null,"positiveTestsAntigen":null,"fips":"10","positiveIncrease":142,"negativeIncrease":1531,"total":285488,"totalTestResultsIncrease":1673,"posNeg":285488,"deathIncrease":1,"hospitalizedIncrease":0,"hash":"c63720d9c9de3b95a6362e12155cdb8111f2fb46","commercialScore":0,"negativeRegularScore":0,"negativeScore":0,"positiveScore":0,"score":0,"grade":""},{"date":20200928,"state":"DE","positive":20389,"probableCases":1055,"negative":263426,"pending":null,"totalTestResultsSource":null,"totalTestResults":283815,"hospitalizedCurrently":60,"hospitalizedCumulative":null,"inIcuCurrently":13,"inIcuCumulative":null,"onVentilatorCurrently":null,"onVentilatorCumulative":null,"recovered":10577,"dataQualityGrade":"A+","lastUpdateEt":"9/27/2020 18:00","dateModified":"2020-09-27T18:00:00Z","checkTimeEt":"09/27 14:00","death":634,"hospitalized":null,"dateChecked":"2020-09-27T18:00:00Z","totalTestsViral":null,"positiveTestsViral":null,"negativeTestsViral":null,"positiveCasesViral":19334,"deathConfirmed":557,"deathProbable":77,"totalTestEncountersViral":null,"totalTestsPeopleViral":283815,"totalTestsAntibody":null,"positiveTestsAntibody":null,"negativeTestsAntibody":null,"totalTestsPeopleAntibody":null,"positiveTestsPeopleAntibody":null,"negativeTestsPeopleAntibody":null,"totalTestsPeopleAntigen":null,"positiveTestsPeopleAntigen":null,"totalTestsAntigen":null,"positiveTestsAntigen":null,"fips":"10","positiveIncrease":129,"negativeIncrease":1662,"total":283815,"totalTestResultsIncrease":1791,"posNeg":283815,"deathIncrease":1,"hospitalizedIncrease":0,"hash":"6ed899fd7ee9d728e958e0403f3aa046c97dcf3d","commercialScore":0,"negativeRegularScore":0,"negativeScore":0,"positiveScore":0,"score":0,"grade":""},{"date":20200927,"state":"DE","positive":20260,"probableCases":1053,"negative":261764,"pending":null,"totalTestResultsSource":null,"totalTestResults":282024,"hospitalizedCurrently":60,"hospitalizedCumulative":null,"inIcuCurrently":16,"inIcuCumulative":null,"onVentilatorCurrently":null,"onVentilatorCumulative":null,"recovered":10557,"dataQualityGrade":"A+","lastUpdateEt":"9/26/2020 18:00","dateModified":"2020-09-26T18:00:00Z","checkTimeEt":"09/26 14:00","death":633,"hospitalized":null,"dateChecked":"2020-09-26T18:00:00Z","totalTestsViral":null,"positiveTestsViral":null,"negativeTestsViral":null,"positiveCasesViral":19207,"deathConfirmed":556,"deathProbable":77,"totalTestEncountersViral":null,"totalTestsPeopleViral":282024,"totalTestsAntibody":null,"positiveTestsAntibody":null,"negativeTestsAntibody":null,"totalTestsPeopleAntibody":null,"positiveTestsPeopleAntibody":null,"negativeTestsPeopleAntibody":null,"totalTestsPeopleAntigen":null,"positiveTestsPeopleAntigen":null,"totalTestsAntigen":null,"positiveTestsAntigen":null,"fips":"10","positiveIncrease":104,"negativeIncrease":1521,"total":282024,"totalTestResultsIncrease":1625,"posNeg":282024,"deathIncrease":0,"hospitalizedIncrease":0,"hash":"85e5e6d7749b8b378d3cf4c9165ed3383181b716","commercialScore":0,"negativeRegularScore":0,"negativeScore":0,"positiveScore":0,"score":0,"grade":""},{"date":20200926,"state":"DE","positive":20156,"probableCases":1053,"negative":260243,"pending":null,"totalTestResultsSource":null,"totalTestResults":280399,"hospitalizedCurrently":57,"hospitalizedCumulative":null,"inIcuCurrently":10,"inIcuCumulative":null,"onVentilatorCurrently":null,"onVentilatorCumulative":null,"recovered":10541,"dataQualityGrade":"A+","lastUpdateEt":"9/25/2020 18:00","dateModified":"2020-09-25T18:00:00Z","checkTimeEt":"09/25 14:00","death":633,"hospitalized":null,"dateChecked":"2020-09-25T18:00:00Z","totalTestsViral":null,"positiveTestsViral":null,"negativeTestsViral":null,"positiveCasesViral":19103,"deathConfirmed":556,"deathProbable":77,"totalTestEncountersViral":null,"totalTestsPeopleViral":280399,"totalTestsAntibody":null,"positiveTestsAntibody":null,"negativeTestsAntibody":null,"totalTestsPeopleAntibody":null,"positiveTestsPeopleAntibody":null,"negativeTestsPeopleAntibody":null,"totalTestsPeopleAntigen":null,"positiveTestsPeopleAntigen":null,"totalTestsAntigen":null,"positiveTestsAntigen":null,"fips":"10","positiveIncrease":71,"negativeIncrease":954,"total":280399,"totalTestResultsIncrease":1025,"posNeg":280399,"deathIncrease":2,"hospitalizedIncrease":0,"hash":"0de1274d559bed6ead5ceda613999aaecba5adcf","commercialScore":0,"negativeRegularScore":0,"negativeScore":0,"positiveScore":0,"score":0,"grade":""},{"date":20200925,"state":"DE","positive":20085,"probableCases":1041,"negative":259289,"pending":null,"totalTestResultsSource":null,"totalTestResults":279374,"hospitalizedCurrently":53,"hospitalizedCumulative":null,"inIcuCurrently":11,"inIcuCumulative":null,"onVentilatorCurrently":null,"onVentilatorCumulative":null,"recovered":10517,"dataQualityGrade":"A+","lastUpdateEt":"9/24/2020 18:00","dateModified":"2020-09-24T18:00:00Z","checkTimeEt":"09/24 14:00","death":631,"hospitalized":null,"dateChecked":"2020-09-24T18:00:00Z","totalTestsViral":null,"positiveTestsViral":null,"negativeTestsViral":null,"positiveCasesViral":19044,"deathConfirmed":554,"deathProbable":77,"totalTestEncountersViral":null,"totalTestsPeopleViral":279374,"totalTestsAntibody":null,"positiveTestsAntibody":null,"negativeTestsAntibody":null,"totalTestsPeopleAntibody":null,"positiveTestsPeopleAntibody":null,"negativeTestsPeopleAntibody":null,"totalTestsPeopleAntigen":null,"positiveTestsPeopleAntigen":null,"totalTestsAntigen":null,"positiveTestsAntigen":null,"fips":"10","positiveIncrease":138,"negativeIncrease":1320,"total":279374,"totalTestResultsIncrease":1458,"posNeg":279374,"deathIncrease":1,"hospitalizedIncrease":0,"hash":"b27f5a4e0a40ff80effdac3e8847ae4b9ee5e01e","commercialScore":0,"negativeRegularScore":0,"negativeScore":0,"positiveScore":0,"score":0,"grade":""},{"date":20200924,"state":"DE","positive":19947,"probableCases":1031,"negative":257969,"pending":null,"totalTestResultsSource":null,"totalTestResults":277916,"hospitalizedCurrently":57,"hospitalizedCumulative":null,"inIcuCurrently":12,"inIcuCumulative":null,"onVentilatorCurrently":null,"onVentilatorCumulative":null,"recovered":10487,"dataQualityGrade":"A+","lastUpdateEt":"9/23/2020 18:00","dateModified":"2020-09-23T18:00:00Z","checkTimeEt":"09/23 14:00","death":630,"hospitalized":null,"dateChecked":"2020-09-23T18:00:00Z","totalTestsViral":null,"positiveTestsViral":null,"negativeTestsViral":null,"positiveCasesViral":18916,"deathConfirmed":553,"deathProbable":77,"totalTestEncountersViral":null,"totalTestsPeopleViral":277916,"totalTestsAntibody":null,"positiveTestsAntibody":null,"negativeTestsAntibody":null,"totalTestsPeopleAntibody":null,"positiveTestsPeopleAntibody":null,"negativeTestsPeopleAntibody":null,"totalTestsPeopleAntigen":null,"positiveTestsPeopleAntigen":null,"totalTestsAntigen":null,"positiveTestsAntigen":null,"fips":"10","positiveIncrease":117,"negativeIncrease":1755,"total":277916,"totalTestResultsIncrease":1872,"posNeg":277916,"deathIncrease":1,"hospitalizedIncrease":0,"hash":"ecf60fc4eb7cd27413ca516148143d0712a473f6","commercialScore":0,"negativeRegularScore":0,"negativeScore":0,"positiveScore":0,"score":0,"grade":""},{"date":20200923,"state":"DE","positive":19830,"probableCases":1032,"negative":256214,"pending":null,"totalTestResultsSource":null,"totalTestResults":276044,"hospitalizedCurrently":61,"hospitalizedCumulative":null,"inIcuCurrently":12,"inIcuCumulative":null,"onVentilatorCurrently":null,"onVentilatorCumulative":null,"recovered":10443,"dataQualityGrade":"A+","lastUpdateEt":"9/22/2020 18:00","dateModified":"2020-09-22T18:00:00Z","checkTimeEt":"09/22 14:00","death":629,"hospitalized":null,"dateChecked":"2020-09-22T18:00:00Z","totalTestsViral":null,"positiveTestsViral":null,"negativeTestsViral":null,"positiveCasesViral":18798,"deathConfirmed":552,"deathProbable":77,"totalTestEncountersViral":null,"totalTestsPeopleViral":276044,"totalTestsAntibody":null,"positiveTestsAntibody":null,"negativeTestsAntibody":null,"totalTestsPeopleAntibody":null,"positiveTestsPeopleAntibody":null,"negativeTestsPeopleAntibody":null,"totalTestsPeopleAntigen":null,"positiveTestsPeopleAntigen":null,"totalTestsAntigen":null,"positiveTestsAntigen":null,"fips":"10","positiveIncrease":69,"negativeIncrease":1138,"total":276044,"totalTestResultsIncrease":1207,"posNeg":276044,"deathIncrease":1,"hospitalizedIncrease":0,"hash":"7e446d58e4c8cc8776691dee28aec0e572c60ff7","commercialScore":0,"negativeRegularScore":0,"negativeScore":0,"positiveScore":0,"score":0,"grade":""},{"date":20200922,"state":"DE","positive":19761,"probableCases":1028,"negative":255076,"pending":null,"totalTestResultsSource":null,"totalTestResults":274837,"hospitalizedCurrently":62,"hospitalizedCumulative":null,"inIcuCurrently":14,"inIcuCumulative":null,"onVentilatorCurrently":null,"onVentilatorCumulative":null,"recovered":10411,"dataQualityGrade":"A+","lastUpdateEt":"9/21/2020 18:00","dateModified":"2020-09-21T18:00:00Z","checkTimeEt":"09/21 14:00","death":628,"hospitalized":null,"dateChecked":"2020-09-21T18:00:00Z","totalTestsViral":null,"positiveTestsViral":null,"negativeTestsViral":null,"positiveCasesViral":18733,"deathConfirmed":551,"deathProbable":77,"totalTestEncountersViral":null,"totalTestsPeopleViral":274837,"totalTestsAntibody":null,"positiveTestsAntibody":null,"negativeTestsAntibody":null,"totalTestsPeopleAntibody":null,"positiveTestsPeopleAntibody":null,"negativeTestsPeopleAntibody":null,"totalTestsPeopleAntigen":null,"positiveTestsPeopleAntigen":null,"totalTestsAntigen":null,"positiveTestsAntigen":null,"fips":"10","positiveIncrease":94,"negativeIncrease":1530,"total":274837,"totalTestResultsIncrease":1624,"posNeg":274837,"deathIncrease":1,"hospitalizedIncrease":0,"hash":"2e4e927c9a9874be2a3c4def39ffee06996fc591","commercialScore":0,"negativeRegularScore":0,"negativeScore":0,"positiveScore":0,"score":0,"grade":""},{"date":20200921,"state":"DE","positive":19667,"probableCases":1019,"negative":253546,"pending":null,"totalTestResultsSource":null,"totalTestResults":273213,"hospitalizedCurrently":53,"hospitalizedCumulative":null,"inIcuCurrently":17,"inIcuCumulative":null,"onVentilatorCurrently":null,"onVentilatorCumulative":null,"recovered":10376,"dataQualityGrade":"A+","lastUpdateEt":"9/20/2020 18:00","dateModified":"2020-09-20T18:00:00Z","checkTimeEt":"09/20 14:00","death":627,"hospitalized":null,"dateChecked":"2020-09-20T18:00:00Z","totalTestsViral":null,"positiveTestsViral":null,"negativeTestsViral":null,"positiveCasesViral":18648,"deathConfirmed":550,"deathProbable":77,"totalTestEncountersViral":null,"totalTestsPeopleViral":273213,"totalTestsAntibody":null,"positiveTestsAntibody":null,"negativeTestsAntibody":null,"totalTestsPeopleAntibody":null,"positiveTestsPeopleAntibody":null,"negativeTestsPeopleAntibody":null,"totalTestsPeopleAntigen":null,"positiveTestsPeopleAntigen":null,"totalTestsAntigen":null,"positiveTestsAntigen":null,"fips":"10","positiveIncrease":101,"negativeIncrease":1691,"total":273213,"totalTestResultsIncrease":1792,"posNeg":273213,"deathIncrease":6,"hospitalizedIncrease":0,"hash":"2ca0a208e5bfb1d4dc21d8b2a6d7e5543bf3379b","commercialScore":0,"negativeRegularScore":0,"negativeScore":0,"positiveScore":0,"score":0,"grade":""},{"date":20200920,"state":"DE","positive":19566,"probableCases":1019,"negative":251855,"pending":null,"totalTestResultsSource":null,"totalTestResults":271421,"hospitalizedCurrently":60,"hospitalizedCumulative":null,"inIcuCurrently":14,"inIcuCumulative":null,"onVentilatorCurrently":null,"onVentilatorCumulative":null,"recovered":10299,"dataQualityGrade":"A+","lastUpdateEt":"9/19/2020 18:00","dateModified":"2020-09-19T18:00:00Z","checkTimeEt":"09/19 14:00","death":621,"hospitalized":null,"dateChecked":"2020-09-19T18:00:00Z","totalTestsViral":null,"positiveTestsViral":null,"negativeTestsViral":null,"positiveCasesViral":18547,"deathConfirmed":548,"deathProbable":73,"totalTestEncountersViral":null,"totalTestsPeopleViral":271421,"totalTestsAntibody":null,"positiveTestsAntibody":null,"negativeTestsAntibody":null,"totalTestsPeopleAntibody":null,"positiveTestsPeopleAntibody":null,"negativeTestsPeopleAntibody":null,"totalTestsPeopleAntigen":null,"positiveTestsPeopleAntigen":null,"totalTestsAntigen":null,"positiveTestsAntigen":null,"fips":"10","positiveIncrease":117,"negativeIncrease":1593,"total":271421,"totalTestResultsIncrease":1710,"posNeg":271421,"deathIncrease":0,"hospitalizedIncrease":0,"hash":"22e5a87637543376f898b087dda396b5e4a6d0db","commercialScore":0,"negativeRegularScore":0,"negativeScore":0,"positiveScore":0,"score":0,"grade":""},{"date":20200919,"state":"DE","positive":19449,"probableCases":1020,"negative":250262,"pending":null,"totalTestResultsSource":null,"totalTestResults":269711,"hospitalizedCurrently":53,"hospitalizedCumulative":null,"inIcuCurrently":15,"inIcuCumulative":null,"onVentilatorCurrently":null,"onVentilatorCumulative":null,"recovered":10257,"dataQualityGrade":"A+","lastUpdateEt":"9/18/2020 18:00","dateModified":"2020-09-18T18:00:00Z","checkTimeEt":"09/18 14:00","death":621,"hospitalized":null,"dateChecked":"2020-09-18T18:00:00Z","totalTestsViral":null,"positiveTestsViral":null,"negativeTestsViral":null,"positiveCasesViral":18429,"deathConfirmed":548,"deathProbable":73,"totalTestEncountersViral":null,"totalTestsPeopleViral":269711,"totalTestsAntibody":null,"positiveTestsAntibody":null,"negativeTestsAntibody":null,"totalTestsPeopleAntibody":null,"positiveTestsPeopleAntibody":null,"negativeTestsPeopleAntibody":null,"totalTestsPeopleAntigen":null,"positiveTestsPeopleAntigen":null,"totalTestsAntigen":null,"positiveTestsAntigen":null,"fips":"10","positiveIncrease":83,"negativeIncrease":990,"total":269711,"totalTestResultsIncrease":1073,"posNeg":269711,"deathIncrease":1,"hospitalizedIncrease":0,"hash":"862f3ff355be9c2a4cea6244ab71812fc5def10f","commercialScore":0,"negativeRegularScore":0,"negativeScore":0,"positiveScore":0,"score":0,"grade":""},{"date":20200918,"state":"DE","positive":19366,"probableCases":1003,"negative":249272,"pending":null,"totalTestResultsSource":null,"totalTestResults":268638,"hospitalizedCurrently":58,"hospitalizedCumulative":null,"inIcuCurrently":17,"inIcuCumulative":null,"onVentilatorCurrently":null,"onVentilatorCumulative":null,"recovered":10201,"dataQualityGrade":"A+","lastUpdateEt":"9/17/2020 18:00","dateModified":"2020-09-17T18:00:00Z","checkTimeEt":"09/17 14:00","death":620,"hospitalized":null,"dateChecked":"2020-09-17T18:00:00Z","totalTestsViral":null,"positiveTestsViral":null,"negativeTestsViral":null,"positiveCasesViral":18363,"deathConfirmed":547,"deathProbable":73,"totalTestEncountersViral":null,"totalTestsPeopleViral":268638,"totalTestsAntibody":null,"positiveTestsAntibody":null,"negativeTestsAntibody":null,"totalTestsPeopleAntibody":null,"positiveTestsPeopleAntibody":null,"negativeTestsPeopleAntibody":null,"totalTestsPeopleAntigen":null,"positiveTestsPeopleAntigen":null,"totalTestsAntigen":null,"positiveTestsAntigen":null,"fips":"10","positiveIncrease":48,"negativeIncrease":1422,"total":268638,"totalTestResultsIncrease":1470,"posNeg":268638,"deathIncrease":1,"hospitalizedIncrease":0,"hash":"9d65fe772a63effa462b4d6d26cde9aea488d027","commercialScore":0,"negativeRegularScore":0,"negativeScore":0,"positiveScore":0,"score":0,"grade":""},{"date":20200917,"state":"DE","positive":19318,"probableCases":999,"negative":247850,"pending":null,"totalTestResultsSource":null,"totalTestResults":267168,"hospitalizedCurrently":66,"hospitalizedCumulative":null,"inIcuCurrently":18,"inIcuCumulative":null,"onVentilatorCurrently":null,"onVentilatorCumulative":null,"recovered":10193,"dataQualityGrade":"A+","lastUpdateEt":"9/16/2020 18:00","dateModified":"2020-09-16T18:00:00Z","checkTimeEt":"09/16 14:00","death":619,"hospitalized":null,"dateChecked":"2020-09-16T18:00:00Z","totalTestsViral":null,"positiveTestsViral":null,"negativeTestsViral":null,"positiveCasesViral":18319,"deathConfirmed":547,"deathProbable":72,"totalTestEncountersViral":null,"totalTestsPeopleViral":267168,"totalTestsAntibody":null,"positiveTestsAntibody":null,"negativeTestsAntibody":null,"totalTestsPeopleAntibody":null,"positiveTestsPeopleAntibody":null,"negativeTestsPeopleAntibody":null,"totalTestsPeopleAntigen":null,"positiveTestsPeopleAntigen":null,"totalTestsAntigen":null,"positiveTestsAntigen":null,"fips":"10","positiveIncrease":84,"negativeIncrease":1179,"total":267168,"totalTestResultsIncrease":1263,"posNeg":267168,"deathIncrease":0,"hospitalizedIncrease":0,"hash":"3ad81912bf2f697e108d7d258ffa25e410e50309","commercialScore":0,"negativeRegularScore":0,"negativeScore":0,"positiveScore":0,"score":0,"grade":""},{"date":20200916,"state":"DE","positive":19234,"probableCases":999,"negative":246671,"pending":null,"totalTestResultsSource":null,"totalTestResults":265905,"hospitalizedCurrently":58,"hospitalizedCumulative":null,"inIcuCurrently":11,"inIcuCumulative":null,"onVentilatorCurrently":null,"onVentilatorCumulative":null,"recovered":10189,"dataQualityGrade":"A+","lastUpdateEt":"9/15/2020 18:00","dateModified":"2020-09-15T18:00:00Z","checkTimeEt":"09/15 14:00","death":619,"hospitalized":null,"dateChecked":"2020-09-15T18:00:00Z","totalTestsViral":null,"positiveTestsViral":null,"negativeTestsViral":null,"positiveCasesViral":18235,"deathConfirmed":547,"deathProbable":72,"totalTestEncountersViral":null,"totalTestsPeopleViral":265905,"totalTestsAntibody":null,"positiveTestsAntibody":null,"negativeTestsAntibody":null,"totalTestsPeopleAntibody":null,"positiveTestsPeopleAntibody":null,"negativeTestsPeopleAntibody":null,"totalTestsPeopleAntigen":null,"positiveTestsPeopleAntigen":null,"totalTestsAntigen":null,"positiveTestsAntigen":null,"fips":"10","positiveIncrease":97,"negativeIncrease":1649,"total":265905,"totalTestResultsIncrease":1746,"posNeg":265905,"deathIncrease":1,"hospitalizedIncrease":0,"hash":"236d5a964ec2648c27e0c00fa8d3034eabf0e240","commercialScore":0,"negativeRegularScore":0,"negativeScore":0,"positiveScore":0,"score":0,"grade":""},{"date":20200915,"state":"DE","positive":19137,"probableCases":999,"negative":245022,"pending":null,"totalTestResultsSource":null,"totalTestResults":264159,"hospitalizedCurrently":61,"hospitalizedCumulative":null,"inIcuCurrently":20,"inIcuCumulative":null,"onVentilatorCurrently":null,"onVentilatorCumulative":null,"recovered":10165,"dataQualityGrade":"A+","lastUpdateEt":"9/14/2020 18:00","dateModified":"2020-09-14T18:00:00Z","checkTimeEt":"09/14 14:00","death":618,"hospitalized":null,"dateChecked":"2020-09-14T18:00:00Z","totalTestsViral":null,"positiveTestsViral":null,"negativeTestsViral":null,"positiveCasesViral":18138,"deathConfirmed":546,"deathProbable":72,"totalTestEncountersViral":null,"totalTestsPeopleViral":264159,"totalTestsAntibody":null,"positiveTestsAntibody":null,"negativeTestsAntibody":null,"totalTestsPeopleAntibody":null,"positiveTestsPeopleAntibody":null,"negativeTestsPeopleAntibody":null,"totalTestsPeopleAntigen":null,"positiveTestsPeopleAntigen":null,"totalTestsAntigen":null,"positiveTestsAntigen":null,"fips":"10","positiveIncrease":200,"negativeIncrease":1455,"total":264159,"totalTestResultsIncrease":1655,"posNeg":264159,"deathIncrease":1,"hospitalizedIncrease":0,"hash":"86a67923d3495f25aaa5971f4768b2aa76aa0548","commercialScore":0,"negativeRegularScore":0,"negativeScore":0,"positiveScore":0,"score":0,"grade":""},{"date":20200914,"state":"DE","positive":18937,"probableCases":992,"negative":243567,"pending":null,"totalTestResultsSource":null,"totalTestResults":262504,"hospitalizedCurrently":64,"hospitalizedCumulative":null,"inIcuCurrently":18,"inIcuCumulative":null,"onVentilatorCurrently":null,"onVentilatorCumulative":null,"recovered":10091,"dataQualityGrade":"A+","lastUpdateEt":"9/13/2020 18:00","dateModified":"2020-09-13T18:00:00Z","checkTimeEt":"09/13 14:00","death":617,"hospitalized":null,"dateChecked":"2020-09-13T18:00:00Z","totalTestsViral":null,"positiveTestsViral":null,"negativeTestsViral":null,"positiveCasesViral":17945,"deathConfirmed":545,"deathProbable":72,"totalTestEncountersViral":null,"totalTestsPeopleViral":262504,"totalTestsAntibody":null,"positiveTestsAntibody":null,"negativeTestsAntibody":null,"totalTestsPeopleAntibody":null,"positiveTestsPeopleAntibody":null,"negativeTestsPeopleAntibody":null,"totalTestsPeopleAntigen":null,"positiveTestsPeopleAntigen":null,"totalTestsAntigen":null,"positiveTestsAntigen":null,"fips":"10","positiveIncrease":88,"negativeIncrease":1120,"total":262504,"totalTestResultsIncrease":1208,"posNeg":262504,"deathIncrease":2,"hospitalizedIncrease":0,"hash":"0369373af53d4cb63a9361d0df2a68802f7e6597","commercialScore":0,"negativeRegularScore":0,"negativeScore":0,"positiveScore":0,"score":0,"grade":""},{"date":20200913,"state":"DE","positive":18849,"probableCases":992,"negative":242447,"pending":null,"totalTestResultsSource":null,"totalTestResults":261296,"hospitalizedCurrently":68,"hospitalizedCumulative":null,"inIcuCurrently":17,"inIcuCumulative":null,"onVentilatorCurrently":null,"onVentilatorCumulative":null,"recovered":10077,"dataQualityGrade":"A+","lastUpdateEt":"9/12/2020 18:00","dateModified":"2020-09-12T18:00:00Z","checkTimeEt":"09/12 14:00","death":615,"hospitalized":null,"dateChecked":"2020-09-12T18:00:00Z","totalTestsViral":null,"positiveTestsViral":null,"negativeTestsViral":null,"positiveCasesViral":17857,"deathConfirmed":543,"deathProbable":72,"totalTestEncountersViral":null,"totalTestsPeopleViral":261296,"totalTestsAntibody":null,"positiveTestsAntibody":null,"negativeTestsAntibody":null,"totalTestsPeopleAntibody":null,"positiveTestsPeopleAntibody":null,"negativeTestsPeopleAntibody":null,"totalTestsPeopleAntigen":null,"positiveTestsPeopleAntigen":null,"totalTestsAntigen":null,"positiveTestsAntigen":null,"fips":"10","positiveIncrease":123,"negativeIncrease":1588,"total":261296,"totalTestResultsIncrease":1711,"posNeg":261296,"deathIncrease":2,"hospitalizedIncrease":0,"hash":"2bdb331271461ae74addc862712aa6b0ef413bfc","commercialScore":0,"negativeRegularScore":0,"negativeScore":0,"positiveScore":0,"score":0,"grade":""},{"date":20200912,"state":"DE","positive":18726,"probableCases":992,"negative":240859,"pending":null,"totalTestResultsSource":null,"totalTestResults":259585,"hospitalizedCurrently":66,"hospitalizedCumulative":null,"inIcuCurrently":15,"inIcuCumulative":null,"onVentilatorCurrently":null,"onVentilatorCumulative":null,"recovered":10063,"dataQualityGrade":"A+","lastUpdateEt":"9/11/2020 18:00","dateModified":"2020-09-11T18:00:00Z","checkTimeEt":"09/11 14:00","death":613,"hospitalized":null,"dateChecked":"2020-09-11T18:00:00Z","totalTestsViral":null,"positiveTestsViral":null,"negativeTestsViral":null,"positiveCasesViral":17734,"deathConfirmed":541,"deathProbable":72,"totalTestEncountersViral":null,"totalTestsPeopleViral":259585,"totalTestsAntibody":null,"positiveTestsAntibody":null,"negativeTestsAntibody":null,"totalTestsPeopleAntibody":null,"positiveTestsPeopleAntibody":null,"negativeTestsPeopleAntibody":null,"totalTestsPeopleAntigen":null,"positiveTestsPeopleAntigen":null,"totalTestsAntigen":null,"positiveTestsAntigen":null,"fips":"10","positiveIncrease":260,"negativeIncrease":2627,"total":259585,"totalTestResultsIncrease":2887,"posNeg":259585,"deathIncrease":0,"hospitalizedIncrease":0,"hash":"8aa4b1a447ef947fd30e914e1c5c122e85908635","commercialScore":0,"negativeRegularScore":0,"negativeScore":0,"positiveScore":0,"score":0,"grade":""},{"date":20200911,"state":"DE","positive":18466,"probableCases":991,"negative":238232,"pending":null,"totalTestResultsSource":null,"totalTestResults":256698,"hospitalizedCurrently":66,"hospitalizedCumulative":null,"inIcuCurrently":14,"inIcuCumulative":null,"onVentilatorCurrently":null,"onVentilatorCumulative":null,"recovered":10027,"dataQualityGrade":"A+","lastUpdateEt":"9/10/2020 18:00","dateModified":"2020-09-10T18:00:00Z","checkTimeEt":"09/10 14:00","death":613,"hospitalized":null,"dateChecked":"2020-09-10T18:00:00Z","totalTestsViral":null,"positiveTestsViral":null,"negativeTestsViral":null,"positiveCasesViral":17475,"deathConfirmed":541,"deathProbable":72,"totalTestEncountersViral":null,"totalTestsPeopleViral":256698,"totalTestsAntibody":null,"positiveTestsAntibody":null,"negativeTestsAntibody":null,"totalTestsPeopleAntibody":null,"positiveTestsPeopleAntibody":null,"negativeTestsPeopleAntibody":null,"totalTestsPeopleAntigen":null,"positiveTestsPeopleAntigen":null,"totalTestsAntigen":null,"positiveTestsAntigen":null,"fips":"10","positiveIncrease":0,"negativeIncrease":0,"total":256698,"totalTestResultsIncrease":0,"posNeg":256698,"deathIncrease":0,"hospitalizedIncrease":0,"hash":"11b401ed0b53ab209637643fe67f945a3d954e0c","commercialScore":0,"negativeRegularScore":0,"negativeScore":0,"positiveScore":0,"score":0,"grade":""},{"date":20200910,"state":"DE","positive":18466,"probableCases":991,"negative":238232,"pending":null,"totalTestResultsSource":null,"totalTestResults":256698,"hospitalizedCurrently":66,"hospitalizedCumulative":null,"inIcuCurrently":14,"inIcuCumulative":null,"onVentilatorCurrently":null,"onVentilatorCumulative":null,"recovered":10027,"dataQualityGrade":"A+","lastUpdateEt":"9/9/2020 18:00","dateModified":"2020-09-09T18:00:00Z","checkTimeEt":"09/09 14:00","death":613,"hospitalized":null,"dateChecked":"2020-09-09T18:00:00Z","totalTestsViral":null,"positiveTestsViral":null,"negativeTestsViral":null,"positiveCasesViral":17475,"deathConfirmed":541,"deathProbable":72,"totalTestEncountersViral":null,"totalTestsPeopleViral":256698,"totalTestsAntibody":null,"positiveTestsAntibody":null,"negativeTestsAntibody":null,"totalTestsPeopleAntibody":null,"positiveTestsPeopleAntibody":null,"negativeTestsPeopleAntibody":null,"totalTestsPeopleAntigen":null,"positiveTestsPeopleAntigen":null,"totalTestsAntigen":null,"positiveTestsAntigen":null,"fips":"10","positiveIncrease":158,"negativeIncrease":2570,"total":256698,"totalTestResultsIncrease":2728,"posNeg":256698,"deathIncrease":4,"hospitalizedIncrease":0,"hash":"8846bc9e22505d1b1be4dff8041796d7e2b24d81","commercialScore":0,"negativeRegularScore":0,"negativeScore":0,"positiveScore":0,"score":0,"grade":""},{"date":20200909,"state":"DE","positive":18308,"probableCases":991,"negative":235662,"pending":null,"totalTestResultsSource":null,"totalTestResults":253970,"hospitalizedCurrently":53,"hospitalizedCumulative":null,"inIcuCurrently":12,"inIcuCumulative":null,"onVentilatorCurrently":null,"onVentilatorCumulative":null,"recovered":9920,"dataQualityGrade":"A+","lastUpdateEt":"9/7/2020 18:00","dateModified":"2020-09-07T18:00:00Z","checkTimeEt":"09/07 14:00","death":609,"hospitalized":null,"dateChecked":"2020-09-07T18:00:00Z","totalTestsViral":null,"positiveTestsViral":null,"negativeTestsViral":null,"positiveCasesViral":17317,"deathConfirmed":537,"deathProbable":72,"totalTestEncountersViral":null,"totalTestsPeopleViral":253970,"totalTestsAntibody":null,"positiveTestsAntibody":null,"negativeTestsAntibody":null,"totalTestsPeopleAntibody":null,"positiveTestsPeopleAntibody":null,"negativeTestsPeopleAntibody":null,"totalTestsPeopleAntigen":null,"positiveTestsPeopleAntigen":null,"totalTestsAntigen":null,"positiveTestsAntigen":null,"fips":"10","positiveIncrease":0,"negativeIncrease":0,"total":253970,"totalTestResultsIncrease":0,"posNeg":253970,"deathIncrease":0,"hospitalizedIncrease":0,"hash":"2326238fa2101b339717e6067ead10a40b99f2be","commercialScore":0,"negativeRegularScore":0,"negativeScore":0,"positiveScore":0,"score":0,"grade":""},{"date":20200908,"state":"DE","positive":18308,"probableCases":991,"negative":235662,"pending":null,"totalTestResultsSource":null,"totalTestResults":253970,"hospitalizedCurrently":53,"hospitalizedCumulative":null,"inIcuCurrently":12,"inIcuCumulative":null,"onVentilatorCurrently":null,"onVentilatorCumulative":null,"recovered":9920,"dataQualityGrade":"A+","lastUpdateEt":"9/7/2020 18:00","dateModified":"2020-09-07T18:00:00Z","checkTimeEt":"09/07 14:00","death":609,"hospitalized":null,"dateChecked":"2020-09-07T18:00:00Z","totalTestsViral":null,"positiveTestsViral":null,"negativeTestsViral":null,"positiveCasesViral":17317,"deathConfirmed":537,"deathProbable":72,"totalTestEncountersViral":null,"totalTestsPeopleViral":253970,"totalTestsAntibody":null,"positiveTestsAntibody":null,"negativeTestsAntibody":null,"totalTestsPeopleAntibody":null,"positiveTestsPeopleAntibody":null,"negativeTestsPeopleAntibody":null,"totalTestsPeopleAntigen":null,"positiveTestsPeopleAntigen":null,"totalTestsAntigen":null,"positiveTestsAntigen":null,"fips":"10","positiveIncrease":59,"negativeIncrease":1309,"total":253970,"totalTestResultsIncrease":1368,"posNeg":253970,"deathIncrease":0,"hospitalizedIncrease":0,"hash":"11db4e5588e581e3f5e5302c93d540c80e3aa0a1","commercialScore":0,"negativeRegularScore":0,"negativeScore":0,"positiveScore":0,"score":0,"grade":""},{"date":20200907,"state":"DE","positive":18249,"probableCases":990,"negative":234353,"pending":null,"totalTestResultsSource":null,"totalTestResults":252602,"hospitalizedCurrently":53,"hospitalizedCumulative":null,"inIcuCurrently":14,"inIcuCumulative":null,"onVentilatorCurrently":null,"onVentilatorCumulative":null,"recovered":9847,"dataQualityGrade":"A+","lastUpdateEt":"9/6/2020 18:00","dateModified":"2020-09-06T18:00:00Z","checkTimeEt":"09/06 14:00","death":609,"hospitalized":null,"dateChecked":"2020-09-06T18:00:00Z","totalTestsViral":null,"positiveTestsViral":null,"negativeTestsViral":null,"positiveCasesViral":17259,"deathConfirmed":537,"deathProbable":72,"totalTestEncountersViral":null,"totalTestsPeopleViral":252602,"totalTestsAntibody":null,"positiveTestsAntibody":null,"negativeTestsAntibody":null,"totalTestsPeopleAntibody":null,"positiveTestsPeopleAntibody":null,"negativeTestsPeopleAntibody":null,"totalTestsPeopleAntigen":null,"positiveTestsPeopleAntigen":null,"totalTestsAntigen":null,"positiveTestsAntigen":null,"fips":"10","positiveIncrease":206,"negativeIncrease":1613,"total":252602,"totalTestResultsIncrease":1819,"posNeg":252602,"deathIncrease":0,"hospitalizedIncrease":0,"hash":"bcc37174399a672fd944d97833da96523bdbb53c","commercialScore":0,"negativeRegularScore":0,"negativeScore":0,"positiveScore":0,"score":0,"grade":""},{"date":20200906,"state":"DE","positive":18043,"probableCases":990,"negative":232740,"pending":null,"totalTestResultsSource":null,"totalTestResults":250783,"hospitalizedCurrently":62,"hospitalizedCumulative":null,"inIcuCurrently":13,"inIcuCumulative":null,"onVentilatorCurrently":null,"onVentilatorCumulative":null,"recovered":9696,"dataQualityGrade":"A+","lastUpdateEt":"9/5/2020 18:00","dateModified":"2020-09-05T18:00:00Z","checkTimeEt":"09/05 14:00","death":609,"hospitalized":null,"dateChecked":"2020-09-05T18:00:00Z","totalTestsViral":null,"positiveTestsViral":null,"negativeTestsViral":null,"positiveCasesViral":17053,"deathConfirmed":537,"deathProbable":72,"totalTestEncountersViral":null,"totalTestsPeopleViral":250783,"totalTestsAntibody":null,"positiveTestsAntibody":null,"negativeTestsAntibody":null,"totalTestsPeopleAntibody":null,"positiveTestsPeopleAntibody":null,"negativeTestsPeopleAntibody":null,"totalTestsPeopleAntigen":null,"positiveTestsPeopleAntigen":null,"totalTestsAntigen":null,"positiveTestsAntigen":null,"fips":"10","positiveIncrease":151,"negativeIncrease":2000,"total":250783,"totalTestResultsIncrease":2151,"posNeg":250783,"deathIncrease":1,"hospitalizedIncrease":0,"hash":"77b694c74d47bd023b1270547285af848d2c588b","commercialScore":0,"negativeRegularScore":0,"negativeScore":0,"positiveScore":0,"score":0,"grade":""},{"date":20200905,"state":"DE","positive":17892,"probableCases":990,"negative":230740,"pending":null,"totalTestResultsSource":null,"totalTestResults":248632,"hospitalizedCurrently":58,"hospitalizedCumulative":null,"inIcuCurrently":12,"inIcuCumulative":null,"onVentilatorCurrently":null,"onVentilatorCumulative":null,"recovered":9641,"dataQualityGrade":"A+","lastUpdateEt":"9/4/2020 18:00","dateModified":"2020-09-04T18:00:00Z","checkTimeEt":"09/04 14:00","death":608,"hospitalized":null,"dateChecked":"2020-09-04T18:00:00Z","totalTestsViral":null,"positiveTestsViral":null,"negativeTestsViral":null,"positiveCasesViral":16902,"deathConfirmed":536,"deathProbable":72,"totalTestEncountersViral":null,"totalTestsPeopleViral":248632,"totalTestsAntibody":null,"positiveTestsAntibody":null,"negativeTestsAntibody":null,"totalTestsPeopleAntibody":null,"positiveTestsPeopleAntibody":null,"negativeTestsPeopleAntibody":null,"totalTestsPeopleAntigen":null,"positiveTestsPeopleAntigen":null,"totalTestsAntigen":null,"positiveTestsAntigen":null,"fips":"10","positiveIncrease":140,"negativeIncrease":1850,"total":248632,"totalTestResultsIncrease":1990,"posNeg":248632,"deathIncrease":2,"hospitalizedIncrease":0,"hash":"ef0c61185270ef4d6afd9fc29698bfec95e945a4","commercialScore":0,"negativeRegularScore":0,"negativeScore":0,"positiveScore":0,"score":0,"grade":""},{"date":20200904,"state":"DE","positive":17752,"probableCases":990,"negative":228890,"pending":null,"totalTestResultsSource":null,"totalTestResults":246642,"hospitalizedCurrently":58,"hospitalizedCumulative":null,"inIcuCurrently":12,"inIcuCumulative":null,"onVentilatorCurrently":null,"onVentilatorCumulative":null,"recovered":9582,"dataQualityGrade":"A+","lastUpdateEt":"9/3/2020 18:00","dateModified":"2020-09-03T18:00:00Z","checkTimeEt":"09/03 14:00","death":606,"hospitalized":null,"dateChecked":"2020-09-03T18:00:00Z","totalTestsViral":null,"positiveTestsViral":null,"negativeTestsViral":null,"positiveCasesViral":16762,"deathConfirmed":534,"deathProbable":72,"totalTestEncountersViral":null,"totalTestsPeopleViral":246642,"totalTestsAntibody":null,"positiveTestsAntibody":null,"negativeTestsAntibody":null,"totalTestsPeopleAntibody":null,"positiveTestsPeopleAntibody":null,"negativeTestsPeopleAntibody":null,"totalTestsPeopleAntigen":null,"positiveTestsPeopleAntigen":null,"totalTestsAntigen":null,"positiveTestsAntigen":null,"fips":"10","positiveIncrease":99,"negativeIncrease":1995,"total":246642,"totalTestResultsIncrease":2094,"posNeg":246642,"deathIncrease":0,"hospitalizedIncrease":0,"hash":"5a6a2578592465e508fde373aa8e3463fe36a3ce","commercialScore":0,"negativeRegularScore":0,"negativeScore":0,"positiveScore":0,"score":0,"grade":""},{"date":20200903,"state":"DE","positive":17653,"probableCases":990,"negative":226895,"pending":null,"totalTestResultsSource":null,"totalTestResults":244548,"hospitalizedCurrently":60,"hospitalizedCumulative":null,"inIcuCurrently":12,"inIcuCumulative":null,"onVentilatorCurrently":null,"onVentilatorCumulative":null,"recovered":9514,"dataQualityGrade":"A+","lastUpdateEt":"9/2/2020 18:00","dateModified":"2020-09-02T18:00:00Z","checkTimeEt":"09/02 14:00","death":606,"hospitalized":null,"dateChecked":"2020-09-02T18:00:00Z","totalTestsViral":null,"positiveTestsViral":null,"negativeTestsViral":null,"positiveCasesViral":16663,"deathConfirmed":534,"deathProbable":72,"totalTestEncountersViral":null,"totalTestsPeopleViral":244548,"totalTestsAntibody":null,"positiveTestsAntibody":null,"negativeTestsAntibody":null,"totalTestsPeopleAntibody":null,"positiveTestsPeopleAntibody":null,"negativeTestsPeopleAntibody":null,"totalTestsPeopleAntigen":null,"positiveTestsPeopleAntigen":null,"totalTestsAntigen":null,"positiveTestsAntigen":null,"fips":"10","positiveIncrease":104,"negativeIncrease":3914,"total":244548,"totalTestResultsIncrease":4018,"posNeg":244548,"deathIncrease":0,"hospitalizedIncrease":0,"hash":"5b3b934289cf2c27aca43624a841e907543d195e","commercialScore":0,"negativeRegularScore":0,"negativeScore":0,"positiveScore":0,"score":0,"grade":""},{"date":20200902,"state":"DE","positive":17549,"probableCases":992,"negative":222981,"pending":null,"totalTestResultsSource":null,"totalTestResults":240530,"hospitalizedCurrently":62,"hospitalizedCumulative":null,"inIcuCurrently":9,"inIcuCumulative":null,"onVentilatorCurrently":null,"onVentilatorCumulative":null,"recovered":9467,"dataQualityGrade":"A+","lastUpdateEt":"9/1/2020 18:00","dateModified":"2020-09-01T18:00:00Z","checkTimeEt":"09/01 14:00","death":606,"hospitalized":null,"dateChecked":"2020-09-01T18:00:00Z","totalTestsViral":null,"positiveTestsViral":null,"negativeTestsViral":null,"positiveCasesViral":16557,"deathConfirmed":534,"deathProbable":72,"totalTestEncountersViral":null,"totalTestsPeopleViral":240530,"totalTestsAntibody":null,"positiveTestsAntibody":null,"negativeTestsAntibody":null,"totalTestsPeopleAntibody":null,"positiveTestsPeopleAntibody":null,"negativeTestsPeopleAntibody":null,"totalTestsPeopleAntigen":null,"positiveTestsPeopleAntigen":null,"totalTestsAntigen":null,"positiveTestsAntigen":null,"fips":"10","positiveIncrease":14,"negativeIncrease":2093,"total":240530,"totalTestResultsIncrease":2107,"posNeg":240530,"deathIncrease":1,"hospitalizedIncrease":0,"hash":"83e98e9fd0b57dfa96dc2b7bad84ddcee47b66a6","commercialScore":0,"negativeRegularScore":0,"negativeScore":0,"positiveScore":0,"score":0,"grade":""},{"date":20200901,"state":"DE","positive":17535,"probableCases":998,"negative":220888,"pending":null,"totalTestResultsSource":null,"totalTestResults":238423,"hospitalizedCurrently":64,"hospitalizedCumulative":null,"inIcuCurrently":11,"inIcuCumulative":null,"onVentilatorCurrently":null,"onVentilatorCumulative":null,"recovered":9419,"dataQualityGrade":"A+","lastUpdateEt":"8/31/2020 18:00","dateModified":"2020-08-31T18:00:00Z","checkTimeEt":"08/31 14:00","death":605,"hospitalized":null,"dateChecked":"2020-08-31T18:00:00Z","totalTestsViral":null,"positiveTestsViral":null,"negativeTestsViral":null,"positiveCasesViral":16537,"deathConfirmed":533,"deathProbable":72,"totalTestEncountersViral":null,"totalTestsPeopleViral":238423,"totalTestsAntibody":null,"positiveTestsAntibody":null,"negativeTestsAntibody":null,"totalTestsPeopleAntibody":null,"positiveTestsPeopleAntibody":null,"negativeTestsPeopleAntibody":null,"totalTestsPeopleAntigen":null,"positiveTestsPeopleAntigen":null,"totalTestsAntigen":null,"positiveTestsAntigen":null,"fips":"10","positiveIncrease":106,"negativeIncrease":1468,"total":238423,"totalTestResultsIncrease":1574,"posNeg":238423,"deathIncrease":0,"hospitalizedIncrease":0,"hash":"22f0e2a7e2b153bb04f8ea9b720cdfd064844af2","commercialScore":0,"negativeRegularScore":0,"negativeScore":0,"positiveScore":0,"score":0,"grade":""},{"date":20200831,"state":"DE","positive":17429,"probableCases":998,"negative":219420,"pending":null,"totalTestResultsSource":null,"totalTestResults":236849,"hospitalizedCurrently":58,"hospitalizedCumulative":null,"inIcuCurrently":16,"inIcuCumulative":null,"onVentilatorCurrently":null,"onVentilatorCumulative":null,"recovered":9381,"dataQualityGrade":"A+","lastUpdateEt":"8/30/2020 18:00","dateModified":"2020-08-30T18:00:00Z","checkTimeEt":"08/30 14:00","death":605,"hospitalized":null,"dateChecked":"2020-08-30T18:00:00Z","totalTestsViral":null,"positiveTestsViral":null,"negativeTestsViral":null,"positiveCasesViral":16431,"deathConfirmed":533,"deathProbable":72,"totalTestEncountersViral":null,"totalTestsPeopleViral":236849,"totalTestsAntibody":null,"positiveTestsAntibody":null,"negativeTestsAntibody":null,"totalTestsPeopleAntibody":null,"positiveTestsPeopleAntibody":null,"negativeTestsPeopleAntibody":null,"totalTestsPeopleAntigen":null,"positiveTestsPeopleAntigen":null,"totalTestsAntigen":null,"positiveTestsAntigen":null,"fips":"10","positiveIncrease":86,"negativeIncrease":2102,"total":236849,"totalTestResultsIncrease":2188,"posNeg":236849,"deathIncrease":1,"hospitalizedIncrease":0,"hash":"46086dae4c9623b0ca5db3ae669e75107a9dc357","commercialScore":0,"negativeRegularScore":0,"negativeScore":0,"positiveScore":0,"score":0,"grade":""},{"date":20200830,"state":"DE","positive":17343,"probableCases":997,"negative":217318,"pending":null,"totalTestResultsSource":null,"totalTestResults":234661,"hospitalizedCurrently":55,"hospitalizedCumulative":null,"inIcuCurrently":16,"inIcuCumulative":null,"onVentilatorCurrently":null,"onVentilatorCumulative":null,"recovered":9318,"dataQualityGrade":"A+","lastUpdateEt":"8/29/2020 18:00","dateModified":"2020-08-29T18:00:00Z","checkTimeEt":"08/29 14:00","death":604,"hospitalized":null,"dateChecked":"2020-08-29T18:00:00Z","totalTestsViral":null,"positiveTestsViral":null,"negativeTestsViral":null,"positiveCasesViral":16346,"deathConfirmed":533,"deathProbable":71,"totalTestEncountersViral":null,"totalTestsPeopleViral":234661,"totalTestsAntibody":null,"positiveTestsAntibody":null,"negativeTestsAntibody":null,"totalTestsPeopleAntibody":null,"positiveTestsPeopleAntibody":null,"negativeTestsPeopleAntibody":null,"totalTestsPeopleAntigen":null,"positiveTestsPeopleAntigen":null,"totalTestsAntigen":null,"positiveTestsAntigen":null,"fips":"10","positiveIncrease":-6,"negativeIncrease":1783,"total":234661,"totalTestResultsIncrease":1777,"posNeg":234661,"deathIncrease":0,"hospitalizedIncrease":0,"hash":"9e0abc5006785fa4a5f3fae4fbda39d8a2794fff","commercialScore":0,"negativeRegularScore":0,"negativeScore":0,"positiveScore":0,"score":0,"grade":""},{"date":20200829,"state":"DE","positive":17349,"probableCases":1013,"negative":215535,"pending":null,"totalTestResultsSource":null,"totalTestResults":232884,"hospitalizedCurrently":61,"hospitalizedCumulative":null,"inIcuCurrently":14,"inIcuCumulative":null,"onVentilatorCurrently":null,"onVentilatorCumulative":null,"recovered":9271,"dataQualityGrade":"A+","lastUpdateEt":"8/28/2020 18:00","dateModified":"2020-08-28T18:00:00Z","checkTimeEt":"08/28 14:00","death":604,"hospitalized":null,"dateChecked":"2020-08-28T18:00:00Z","totalTestsViral":null,"positiveTestsViral":null,"negativeTestsViral":null,"positiveCasesViral":16336,"deathConfirmed":533,"deathProbable":71,"totalTestEncountersViral":null,"totalTestsPeopleViral":232884,"totalTestsAntibody":null,"positiveTestsAntibody":null,"negativeTestsAntibody":null,"totalTestsPeopleAntibody":null,"positiveTestsPeopleAntibody":null,"negativeTestsPeopleAntibody":null,"totalTestsPeopleAntigen":null,"positiveTestsPeopleAntigen":null,"totalTestsAntigen":null,"positiveTestsAntigen":null,"fips":"10","positiveIncrease":266,"negativeIncrease":1577,"total":232884,"totalTestResultsIncrease":1843,"posNeg":232884,"deathIncrease":0,"hospitalizedIncrease":0,"hash":"69a4155196f3c32b73ccbf0d070929d1d30a54f8","commercialScore":0,"negativeRegularScore":0,"negativeScore":0,"positiveScore":0,"score":0,"grade":""},{"date":20200828,"state":"DE","positive":17083,"probableCases":991,"negative":213958,"pending":null,"totalTestResultsSource":null,"totalTestResults":231041,"hospitalizedCurrently":57,"hospitalizedCumulative":null,"inIcuCurrently":12,"inIcuCumulative":null,"onVentilatorCurrently":null,"onVentilatorCumulative":null,"recovered":9156,"dataQualityGrade":"A+","lastUpdateEt":"8/27/2020 18:00","dateModified":"2020-08-27T18:00:00Z","checkTimeEt":"08/27 14:00","death":604,"hospitalized":null,"dateChecked":"2020-08-27T18:00:00Z","totalTestsViral":null,"positiveTestsViral":null,"negativeTestsViral":null,"positiveCasesViral":16092,"deathConfirmed":533,"deathProbable":71,"totalTestEncountersViral":null,"totalTestsPeopleViral":231041,"totalTestsAntibody":null,"positiveTestsAntibody":null,"negativeTestsAntibody":null,"totalTestsPeopleAntibody":null,"positiveTestsPeopleAntibody":null,"negativeTestsPeopleAntibody":null,"totalTestsPeopleAntigen":null,"positiveTestsPeopleAntigen":null,"totalTestsAntigen":null,"positiveTestsAntigen":null,"fips":"10","positiveIncrease":107,"negativeIncrease":2875,"total":231041,"totalTestResultsIncrease":2982,"posNeg":231041,"deathIncrease":0,"hospitalizedIncrease":0,"hash":"0e10023e91d2db21c425ecec6ff763e003a23213","commercialScore":0,"negativeRegularScore":0,"negativeScore":0,"positiveScore":0,"score":0,"grade":""},{"date":20200827,"state":"DE","positive":16976,"probableCases":989,"negative":211083,"pending":null,"totalTestResultsSource":null,"totalTestResults":228059,"hospitalizedCurrently":57,"hospitalizedCumulative":null,"inIcuCurrently":15,"inIcuCumulative":null,"onVentilatorCurrently":null,"onVentilatorCumulative":null,"recovered":9101,"dataQualityGrade":"A+","lastUpdateEt":"8/26/2020 18:00","dateModified":"2020-08-26T18:00:00Z","checkTimeEt":"08/26 14:00","death":604,"hospitalized":null,"dateChecked":"2020-08-26T18:00:00Z","totalTestsViral":null,"positiveTestsViral":null,"negativeTestsViral":null,"positiveCasesViral":15987,"deathConfirmed":533,"deathProbable":71,"totalTestEncountersViral":null,"totalTestsPeopleViral":228059,"totalTestsAntibody":null,"positiveTestsAntibody":null,"negativeTestsAntibody":null,"totalTestsPeopleAntibody":null,"positiveTestsPeopleAntibody":null,"negativeTestsPeopleAntibody":null,"totalTestsPeopleAntigen":null,"positiveTestsPeopleAntigen":null,"totalTestsAntigen":null,"positiveTestsAntigen":null,"fips":"10","positiveIncrease":-10,"negativeIncrease":974,"total":228059,"totalTestResultsIncrease":964,"posNeg":228059,"deathIncrease":0,"hospitalizedIncrease":0,"hash":"bb1c43ab28ad10b4182a63007e0e569bcd8dd720","commercialScore":0,"negativeRegularScore":0,"negativeScore":0,"positiveScore":0,"score":0,"grade":""},{"date":20200826,"state":"DE","positive":16986,"probableCases":995,"negative":210109,"pending":null,"totalTestResultsSource":null,"totalTestResults":227095,"hospitalizedCurrently":50,"hospitalizedCumulative":null,"inIcuCurrently":13,"inIcuCumulative":null,"onVentilatorCurrently":null,"onVentilatorCumulative":null,"recovered":9050,"dataQualityGrade":"A+","lastUpdateEt":"8/25/2020 18:00","dateModified":"2020-08-25T18:00:00Z","checkTimeEt":"08/25 14:00","death":604,"hospitalized":null,"dateChecked":"2020-08-25T18:00:00Z","totalTestsViral":null,"positiveTestsViral":null,"negativeTestsViral":null,"positiveCasesViral":15991,"deathConfirmed":533,"deathProbable":71,"totalTestEncountersViral":null,"totalTestsPeopleViral":227095,"totalTestsAntibody":null,"positiveTestsAntibody":null,"negativeTestsAntibody":null,"totalTestsPeopleAntibody":null,"positiveTestsPeopleAntibody":null,"negativeTestsPeopleAntibody":null,"totalTestsPeopleAntigen":null,"positiveTestsPeopleAntigen":null,"totalTestsAntigen":null,"positiveTestsAntigen":null,"fips":"10","positiveIncrease":24,"negativeIncrease":1743,"total":227095,"totalTestResultsIncrease":1767,"posNeg":227095,"deathIncrease":1,"hospitalizedIncrease":0,"hash":"9eb836ceb6dd960464a9bbec75a5d0ac7bbade40","commercialScore":0,"negativeRegularScore":0,"negativeScore":0,"positiveScore":0,"score":0,"grade":""},{"date":20200825,"state":"DE","positive":16962,"probableCases":1002,"negative":208366,"pending":null,"totalTestResultsSource":null,"totalTestResults":225328,"hospitalizedCurrently":40,"hospitalizedCumulative":null,"inIcuCurrently":12,"inIcuCumulative":null,"onVentilatorCurrently":null,"onVentilatorCumulative":null,"recovered":9010,"dataQualityGrade":"A+","lastUpdateEt":"8/24/2020 18:00","dateModified":"2020-08-24T18:00:00Z","checkTimeEt":"08/24 14:00","death":603,"hospitalized":null,"dateChecked":"2020-08-24T18:00:00Z","totalTestsViral":null,"positiveTestsViral":null,"negativeTestsViral":null,"positiveCasesViral":15960,"deathConfirmed":531,"deathProbable":72,"totalTestEncountersViral":null,"totalTestsPeopleViral":225328,"totalTestsAntibody":null,"positiveTestsAntibody":null,"negativeTestsAntibody":null,"totalTestsPeopleAntibody":null,"positiveTestsPeopleAntibody":null,"negativeTestsPeopleAntibody":null,"totalTestsPeopleAntigen":null,"positiveTestsPeopleAntigen":null,"totalTestsAntigen":null,"positiveTestsAntigen":null,"fips":"10","positiveIncrease":20,"negativeIncrease":1807,"total":225328,"totalTestResultsIncrease":1827,"posNeg":225328,"deathIncrease":-1,"hospitalizedIncrease":0,"hash":"16b112f607ba7728df0438b03291759bda1b73ba","commercialScore":0,"negativeRegularScore":0,"negativeScore":0,"positiveScore":0,"score":0,"grade":""},{"date":20200824,"state":"DE","positive":16942,"probableCases":1012,"negative":206559,"pending":null,"totalTestResultsSource":null,"totalTestResults":223501,"hospitalizedCurrently":38,"hospitalizedCumulative":null,"inIcuCurrently":7,"inIcuCumulative":null,"onVentilatorCurrently":null,"onVentilatorCumulative":null,"recovered":8972,"dataQualityGrade":"A+","lastUpdateEt":"8/23/2020 18:00","dateModified":"2020-08-23T18:00:00Z","checkTimeEt":"08/23 14:00","death":604,"hospitalized":null,"dateChecked":"2020-08-23T18:00:00Z","totalTestsViral":null,"positiveTestsViral":null,"negativeTestsViral":null,"positiveCasesViral":15930,"deathConfirmed":532,"deathProbable":72,"totalTestEncountersViral":null,"totalTestsPeopleViral":223501,"totalTestsAntibody":null,"positiveTestsAntibody":null,"negativeTestsAntibody":null,"totalTestsPeopleAntibody":null,"positiveTestsPeopleAntibody":null,"negativeTestsPeopleAntibody":null,"totalTestsPeopleAntigen":null,"positiveTestsPeopleAntigen":null,"totalTestsAntigen":null,"positiveTestsAntigen":null,"fips":"10","positiveIncrease":47,"negativeIncrease":1609,"total":223501,"totalTestResultsIncrease":1656,"posNeg":223501,"deathIncrease":4,"hospitalizedIncrease":0,"hash":"8f98a2172ebe98cb1942fc5d9e5e9ce791245b0c","commercialScore":0,"negativeRegularScore":0,"negativeScore":0,"positiveScore":0,"score":0,"grade":""},{"date":20200823,"state":"DE","positive":16895,"probableCases":1014,"negative":204950,"pending":null,"totalTestResultsSource":null,"totalTestResults":221845,"hospitalizedCurrently":44,"hospitalizedCumulative":null,"inIcuCurrently":8,"inIcuCumulative":null,"onVentilatorCurrently":null,"onVentilatorCumulative":null,"recovered":8936,"dataQualityGrade":"A+","lastUpdateEt":"8/22/2020 18:00","dateModified":"2020-08-22T18:00:00Z","checkTimeEt":"08/22 14:00","death":600,"hospitalized":null,"dateChecked":"2020-08-22T18:00:00Z","totalTestsViral":null,"positiveTestsViral":null,"negativeTestsViral":null,"positiveCasesViral":15881,"deathConfirmed":531,"deathProbable":69,"totalTestEncountersViral":null,"totalTestsPeopleViral":221845,"totalTestsAntibody":null,"positiveTestsAntibody":null,"negativeTestsAntibody":null,"totalTestsPeopleAntibody":null,"positiveTestsPeopleAntibody":null,"negativeTestsPeopleAntibody":null,"totalTestsPeopleAntigen":null,"positiveTestsPeopleAntigen":null,"totalTestsAntigen":null,"positiveTestsAntigen":null,"fips":"10","positiveIncrease":67,"negativeIncrease":1902,"total":221845,"totalTestResultsIncrease":1969,"posNeg":221845,"deathIncrease":0,"hospitalizedIncrease":0,"hash":"c5b9d2a63aa3fe6f739bbe66feec897472ea4b23","commercialScore":0,"negativeRegularScore":0,"negativeScore":0,"positiveScore":0,"score":0,"grade":""},{"date":20200822,"state":"DE","positive":16828,"probableCases":1008,"negative":203048,"pending":null,"totalTestResultsSource":null,"totalTestResults":219876,"hospitalizedCurrently":44,"hospitalizedCumulative":null,"inIcuCurrently":11,"inIcuCumulative":null,"onVentilatorCurrently":null,"onVentilatorCumulative":null,"recovered":8923,"dataQualityGrade":"A+","lastUpdateEt":"8/21/2020 18:00","dateModified":"2020-08-21T18:00:00Z","checkTimeEt":"08/21 14:00","death":600,"hospitalized":null,"dateChecked":"2020-08-21T18:00:00Z","totalTestsViral":null,"positiveTestsViral":null,"negativeTestsViral":null,"positiveCasesViral":15820,"deathConfirmed":531,"deathProbable":69,"totalTestEncountersViral":null,"totalTestsPeopleViral":219876,"totalTestsAntibody":null,"positiveTestsAntibody":null,"negativeTestsAntibody":null,"totalTestsPeopleAntibody":null,"positiveTestsPeopleAntibody":null,"negativeTestsPeopleAntibody":null,"totalTestsPeopleAntigen":null,"positiveTestsPeopleAntigen":null,"totalTestsAntigen":null,"positiveTestsAntigen":null,"fips":"10","positiveIncrease":58,"negativeIncrease":1810,"total":219876,"totalTestResultsIncrease":1868,"posNeg":219876,"deathIncrease":0,"hospitalizedIncrease":0,"hash":"91e0187642fd07578cfe2ba65f902e5b239d1fdd","commercialScore":0,"negativeRegularScore":0,"negativeScore":0,"positiveScore":0,"score":0,"grade":""},{"date":20200821,"state":"DE","positive":16770,"probableCases":1004,"negative":201238,"pending":null,"totalTestResultsSource":null,"totalTestResults":218008,"hospitalizedCurrently":37,"hospitalizedCumulative":null,"inIcuCurrently":10,"inIcuCumulative":null,"onVentilatorCurrently":null,"onVentilatorCumulative":null,"recovered":8839,"dataQualityGrade":"A+","lastUpdateEt":"8/20/2020 18:00","dateModified":"2020-08-20T18:00:00Z","checkTimeEt":"08/20 14:00","death":600,"hospitalized":null,"dateChecked":"2020-08-20T18:00:00Z","totalTestsViral":null,"positiveTestsViral":null,"negativeTestsViral":null,"positiveCasesViral":15766,"deathConfirmed":531,"deathProbable":69,"totalTestEncountersViral":null,"totalTestsPeopleViral":218008,"totalTestsAntibody":null,"positiveTestsAntibody":null,"negativeTestsAntibody":null,"totalTestsPeopleAntibody":null,"positiveTestsPeopleAntibody":null,"negativeTestsPeopleAntibody":null,"totalTestsPeopleAntigen":null,"positiveTestsPeopleAntigen":null,"totalTestsAntigen":null,"positiveTestsAntigen":null,"fips":"10","positiveIncrease":52,"negativeIncrease":1000,"total":218008,"totalTestResultsIncrease":1052,"posNeg":218008,"deathIncrease":5,"hospitalizedIncrease":0,"hash":"c5d6e47c24d7b82fb02c5c59b727d35d13c4f339","commercialScore":0,"negativeRegularScore":0,"negativeScore":0,"positiveScore":0,"score":0,"grade":""},{"date":20200820,"state":"DE","positive":16718,"probableCases":1004,"negative":200238,"pending":null,"totalTestResultsSource":null,"totalTestResults":216956,"hospitalizedCurrently":40,"hospitalizedCumulative":null,"inIcuCurrently":10,"inIcuCumulative":null,"onVentilatorCurrently":null,"onVentilatorCumulative":null,"recovered":8809,"dataQualityGrade":"A+","lastUpdateEt":"8/19/2020 18:00","dateModified":"2020-08-19T18:00:00Z","checkTimeEt":"08/19 14:00","death":595,"hospitalized":null,"dateChecked":"2020-08-19T18:00:00Z","totalTestsViral":null,"positiveTestsViral":null,"negativeTestsViral":null,"positiveCasesViral":15714,"deathConfirmed":526,"deathProbable":69,"totalTestEncountersViral":null,"totalTestsPeopleViral":216956,"totalTestsAntibody":null,"positiveTestsAntibody":null,"negativeTestsAntibody":null,"totalTestsPeopleAntibody":null,"positiveTestsPeopleAntibody":null,"negativeTestsPeopleAntibody":null,"totalTestsPeopleAntigen":null,"positiveTestsPeopleAntigen":null,"totalTestsAntigen":null,"positiveTestsAntigen":null,"fips":"10","positiveIncrease":75,"negativeIncrease":2012,"total":216956,"totalTestResultsIncrease":2087,"posNeg":216956,"deathIncrease":0,"hospitalizedIncrease":0,"hash":"5fa7a3e3c2985b4cc9c71962efaefbdd938d034e","commercialScore":0,"negativeRegularScore":0,"negativeScore":0,"positiveScore":0,"score":0,"grade":""},{"date":20200819,"state":"DE","positive":16643,"probableCases":1004,"negative":198226,"pending":null,"totalTestResultsSource":null,"totalTestResults":214869,"hospitalizedCurrently":32,"hospitalizedCumulative":null,"inIcuCurrently":7,"inIcuCumulative":null,"onVentilatorCurrently":null,"onVentilatorCumulative":null,"recovered":8780,"dataQualityGrade":"A+","lastUpdateEt":"8/18/2020 18:00","dateModified":"2020-08-18T18:00:00Z","checkTimeEt":"08/18 14:00","death":595,"hospitalized":null,"dateChecked":"2020-08-18T18:00:00Z","totalTestsViral":null,"positiveTestsViral":null,"negativeTestsViral":null,"positiveCasesViral":15639,"deathConfirmed":526,"deathProbable":69,"totalTestEncountersViral":null,"totalTestsPeopleViral":214869,"totalTestsAntibody":null,"positiveTestsAntibody":null,"negativeTestsAntibody":null,"totalTestsPeopleAntibody":null,"positiveTestsPeopleAntibody":null,"negativeTestsPeopleAntibody":null,"totalTestsPeopleAntigen":null,"positiveTestsPeopleAntigen":null,"totalTestsAntigen":null,"positiveTestsAntigen":null,"fips":"10","positiveIncrease":50,"negativeIncrease":974,"total":214869,"totalTestResultsIncrease":1024,"posNeg":214869,"deathIncrease":2,"hospitalizedIncrease":0,"hash":"03611cca6e58d9d290ef7d5cd4ef10bf1ef03192","commercialScore":0,"negativeRegularScore":0,"negativeScore":0,"positiveScore":0,"score":0,"grade":""},{"date":20200818,"state":"DE","positive":16593,"probableCases":1004,"negative":197252,"pending":null,"totalTestResultsSource":null,"totalTestResults":213845,"hospitalizedCurrently":32,"hospitalizedCumulative":null,"inIcuCurrently":7,"inIcuCumulative":null,"onVentilatorCurrently":null,"onVentilatorCumulative":null,"recovered":8749,"dataQualityGrade":"A+","lastUpdateEt":"8/17/2020 18:00","dateModified":"2020-08-17T18:00:00Z","checkTimeEt":"08/17 14:00","death":593,"hospitalized":null,"dateChecked":"2020-08-17T18:00:00Z","totalTestsViral":null,"positiveTestsViral":null,"negativeTestsViral":null,"positiveCasesViral":15589,"deathConfirmed":524,"deathProbable":69,"totalTestEncountersViral":null,"totalTestsPeopleViral":213845,"totalTestsAntibody":null,"positiveTestsAntibody":null,"negativeTestsAntibody":null,"totalTestsPeopleAntibody":null,"positiveTestsPeopleAntibody":null,"negativeTestsPeopleAntibody":null,"totalTestsPeopleAntigen":null,"positiveTestsPeopleAntigen":null,"totalTestsAntigen":null,"positiveTestsAntigen":null,"fips":"10","positiveIncrease":57,"negativeIncrease":1150,"total":213845,"totalTestResultsIncrease":1207,"posNeg":213845,"deathIncrease":0,"hospitalizedIncrease":0,"hash":"2842b807579d27b005bf53ebbc625bcb18063136","commercialScore":0,"negativeRegularScore":0,"negativeScore":0,"positiveScore":0,"score":0,"grade":""},{"date":20200817,"state":"DE","positive":16536,"probableCases":1004,"negative":196102,"pending":null,"totalTestResultsSource":null,"totalTestResults":212638,"hospitalizedCurrently":29,"hospitalizedCumulative":null,"inIcuCurrently":7,"inIcuCumulative":null,"onVentilatorCurrently":null,"onVentilatorCumulative":null,"recovered":8713,"dataQualityGrade":"A+","lastUpdateEt":"8/16/2020 18:00","dateModified":"2020-08-16T18:00:00Z","checkTimeEt":"08/16 14:00","death":593,"hospitalized":null,"dateChecked":"2020-08-16T18:00:00Z","totalTestsViral":null,"positiveTestsViral":null,"negativeTestsViral":null,"positiveCasesViral":15532,"deathConfirmed":524,"deathProbable":69,"totalTestEncountersViral":null,"totalTestsPeopleViral":212638,"totalTestsAntibody":null,"positiveTestsAntibody":null,"negativeTestsAntibody":null,"totalTestsPeopleAntibody":null,"positiveTestsPeopleAntibody":null,"negativeTestsPeopleAntibody":null,"totalTestsPeopleAntigen":null,"positiveTestsPeopleAntigen":null,"totalTestsAntigen":null,"positiveTestsAntigen":null,"fips":"10","positiveIncrease":85,"negativeIncrease":2168,"total":212638,"totalTestResultsIncrease":2253,"posNeg":212638,"deathIncrease":0,"hospitalizedIncrease":0,"hash":"e6d74220bb78dc6b00a0f2f18809d3706a50efbf","commercialScore":0,"negativeRegularScore":0,"negativeScore":0,"positiveScore":0,"score":0,"grade":""},{"date":20200816,"state":"DE","positive":16451,"probableCases":1003,"negative":193934,"pending":null,"totalTestResultsSource":null,"totalTestResults":210385,"hospitalizedCurrently":30,"hospitalizedCumulative":null,"inIcuCurrently":8,"inIcuCumulative":null,"onVentilatorCurrently":null,"onVentilatorCumulative":null,"recovered":8671,"dataQualityGrade":"A+","lastUpdateEt":"8/15/2020 18:00","dateModified":"2020-08-15T18:00:00Z","checkTimeEt":"08/15 14:00","death":593,"hospitalized":null,"dateChecked":"2020-08-15T18:00:00Z","totalTestsViral":null,"positiveTestsViral":null,"negativeTestsViral":null,"positiveCasesViral":15448,"deathConfirmed":524,"deathProbable":69,"totalTestEncountersViral":null,"totalTestsPeopleViral":210385,"totalTestsAntibody":null,"positiveTestsAntibody":null,"negativeTestsAntibody":null,"totalTestsPeopleAntibody":null,"positiveTestsPeopleAntibody":null,"negativeTestsPeopleAntibody":null,"totalTestsPeopleAntigen":null,"positiveTestsPeopleAntigen":null,"totalTestsAntigen":null,"positiveTestsAntigen":null,"fips":"10","positiveIncrease":55,"negativeIncrease":1569,"total":210385,"totalTestResultsIncrease":1624,"posNeg":210385,"deathIncrease":0,"hospitalizedIncrease":0,"hash":"12abc5fc266de38aaea9b5850e682734bb585cd2","commercialScore":0,"negativeRegularScore":0,"negativeScore":0,"positiveScore":0,"score":0,"grade":""},{"date":20200815,"state":"DE","positive":16396,"probableCases":1004,"negative":192365,"pending":null,"totalTestResultsSource":null,"totalTestResults":208761,"hospitalizedCurrently":32,"hospitalizedCumulative":null,"inIcuCurrently":10,"inIcuCumulative":null,"onVentilatorCurrently":null,"onVentilatorCumulative":null,"recovered":8649,"dataQualityGrade":"A+","lastUpdateEt":"8/14/2020 18:00","dateModified":"2020-08-14T18:00:00Z","checkTimeEt":"08/14 14:00","death":593,"hospitalized":null,"dateChecked":"2020-08-14T18:00:00Z","totalTestsViral":null,"positiveTestsViral":null,"negativeTestsViral":null,"positiveCasesViral":15392,"deathConfirmed":524,"deathProbable":69,"totalTestEncountersViral":null,"totalTestsPeopleViral":208761,"totalTestsAntibody":null,"positiveTestsAntibody":null,"negativeTestsAntibody":null,"totalTestsPeopleAntibody":null,"positiveTestsPeopleAntibody":null,"negativeTestsPeopleAntibody":null,"totalTestsPeopleAntigen":null,"positiveTestsPeopleAntigen":null,"totalTestsAntigen":null,"positiveTestsAntigen":null,"fips":"10","positiveIncrease":56,"negativeIncrease":1230,"total":208761,"totalTestResultsIncrease":1286,"posNeg":208761,"deathIncrease":0,"hospitalizedIncrease":0,"hash":"45ab639b5f6c461cda0c605196f9a8105840cb87","commercialScore":0,"negativeRegularScore":0,"negativeScore":0,"positiveScore":0,"score":0,"grade":""},{"date":20200814,"state":"DE","positive":16340,"probableCases":1000,"negative":191135,"pending":null,"totalTestResultsSource":null,"totalTestResults":207475,"hospitalizedCurrently":38,"hospitalizedCumulative":null,"inIcuCurrently":10,"inIcuCumulative":null,"onVentilatorCurrently":null,"onVentilatorCumulative":null,"recovered":8613,"dataQualityGrade":"A+","lastUpdateEt":"8/13/2020 18:00","dateModified":"2020-08-13T18:00:00Z","checkTimeEt":"08/13 14:00","death":593,"hospitalized":null,"dateChecked":"2020-08-13T18:00:00Z","totalTestsViral":null,"positiveTestsViral":null,"negativeTestsViral":null,"positiveCasesViral":15340,"deathConfirmed":524,"deathProbable":69,"totalTestEncountersViral":null,"totalTestsPeopleViral":207475,"totalTestsAntibody":null,"positiveTestsAntibody":null,"negativeTestsAntibody":null,"totalTestsPeopleAntibody":null,"positiveTestsPeopleAntibody":null,"negativeTestsPeopleAntibody":null,"totalTestsPeopleAntigen":null,"positiveTestsPeopleAntigen":null,"totalTestsAntigen":null,"positiveTestsAntigen":null,"fips":"10","positiveIncrease":373,"negativeIncrease":1474,"total":207475,"totalTestResultsIncrease":1847,"posNeg":207475,"deathIncrease":0,"hospitalizedIncrease":0,"hash":"4cd40c5d6418f89ab1977e557188a3fc93857af7","commercialScore":0,"negativeRegularScore":0,"negativeScore":0,"positiveScore":0,"score":0,"grade":""},{"date":20200813,"state":"DE","positive":15967,"probableCases":999,"negative":189661,"pending":null,"totalTestResultsSource":null,"totalTestResults":205628,"hospitalizedCurrently":37,"hospitalizedCumulative":null,"inIcuCurrently":10,"inIcuCumulative":null,"onVentilatorCurrently":null,"onVentilatorCumulative":null,"recovered":8587,"dataQualityGrade":"A+","lastUpdateEt":"8/12/2020 18:00","dateModified":"2020-08-12T18:00:00Z","checkTimeEt":"08/12 14:00","death":593,"hospitalized":null,"dateChecked":"2020-08-12T18:00:00Z","totalTestsViral":null,"positiveTestsViral":null,"negativeTestsViral":null,"positiveCasesViral":14968,"deathConfirmed":524,"deathProbable":69,"totalTestEncountersViral":null,"totalTestsPeopleViral":205628,"totalTestsAntibody":null,"positiveTestsAntibody":null,"negativeTestsAntibody":null,"totalTestsPeopleAntibody":null,"positiveTestsPeopleAntibody":null,"negativeTestsPeopleAntibody":null,"totalTestsPeopleAntigen":null,"positiveTestsPeopleAntigen":null,"totalTestsAntigen":null,"positiveTestsAntigen":null,"fips":"10","positiveIncrease":268,"negativeIncrease":3160,"total":205628,"totalTestResultsIncrease":3428,"posNeg":205628,"deathIncrease":2,"hospitalizedIncrease":0,"hash":"6014547742e73b6b3b78e592138980efc55164a9","commercialScore":0,"negativeRegularScore":0,"negativeScore":0,"positiveScore":0,"score":0,"grade":""},{"date":20200812,"state":"DE","positive":15699,"probableCases":999,"negative":186501,"pending":null,"totalTestResultsSource":null,"totalTestResults":202200,"hospitalizedCurrently":35,"hospitalizedCumulative":null,"inIcuCurrently":13,"inIcuCumulative":null,"onVentilatorCurrently":null,"onVentilatorCumulative":null,"recovered":8519,"dataQualityGrade":"A+","lastUpdateEt":"8/11/2020 18:00","dateModified":"2020-08-11T18:00:00Z","checkTimeEt":"08/11 14:00","death":591,"hospitalized":null,"dateChecked":"2020-08-11T18:00:00Z","totalTestsViral":null,"positiveTestsViral":null,"negativeTestsViral":null,"positiveCasesViral":14700,"deathConfirmed":521,"deathProbable":70,"totalTestEncountersViral":null,"totalTestsPeopleViral":202200,"totalTestsAntibody":null,"positiveTestsAntibody":null,"negativeTestsAntibody":null,"totalTestsPeopleAntibody":null,"positiveTestsPeopleAntibody":null,"negativeTestsPeopleAntibody":null,"totalTestsPeopleAntigen":null,"positiveTestsPeopleAntigen":null,"totalTestsAntigen":null,"positiveTestsAntigen":null,"fips":"10","positiveIncrease":0,"negativeIncrease":0,"total":202200,"totalTestResultsIncrease":0,"posNeg":202200,"deathIncrease":0,"hospitalizedIncrease":0,"hash":"d38b07c66ead53a5783dc41eb5da9ddc7fd0de76","commercialScore":0,"negativeRegularScore":0,"negativeScore":0,"positiveScore":0,"score":0,"grade":""},{"date":20200811,"state":"DE","positive":15699,"probableCases":999,"negative":186501,"pending":null,"totalTestResultsSource":null,"totalTestResults":202200,"hospitalizedCurrently":35,"hospitalizedCumulative":null,"inIcuCurrently":13,"inIcuCumulative":null,"onVentilatorCurrently":null,"onVentilatorCumulative":null,"recovered":8519,"dataQualityGrade":"A+","lastUpdateEt":"8/10/2020 18:00","dateModified":"2020-08-10T18:00:00Z","checkTimeEt":"08/10 14:00","death":591,"hospitalized":null,"dateChecked":"2020-08-10T18:00:00Z","totalTestsViral":null,"positiveTestsViral":null,"negativeTestsViral":null,"positiveCasesViral":14700,"deathConfirmed":521,"deathProbable":70,"totalTestEncountersViral":null,"totalTestsPeopleViral":202200,"totalTestsAntibody":null,"positiveTestsAntibody":null,"negativeTestsAntibody":null,"totalTestsPeopleAntibody":null,"positiveTestsPeopleAntibody":null,"negativeTestsPeopleAntibody":null,"totalTestsPeopleAntigen":null,"positiveTestsPeopleAntigen":null,"totalTestsAntigen":null,"positiveTestsAntigen":null,"fips":"10","positiveIncrease":65,"negativeIncrease":1463,"total":202200,"totalTestResultsIncrease":1528,"posNeg":202200,"deathIncrease":0,"hospitalizedIncrease":0,"hash":"ad392eafce522609316058fbc0a07852748d7490","commercialScore":0,"negativeRegularScore":0,"negativeScore":0,"positiveScore":0,"score":0,"grade":""},{"date":20200810,"state":"DE","positive":15634,"probableCases":998,"negative":185038,"pending":null,"totalTestResultsSource":null,"totalTestResults":200672,"hospitalizedCurrently":34,"hospitalizedCumulative":null,"inIcuCurrently":12,"inIcuCumulative":null,"onVentilatorCurrently":null,"onVentilatorCumulative":null,"recovered":8500,"dataQualityGrade":"A+","lastUpdateEt":"8/9/2020 18:00","dateModified":"2020-08-09T18:00:00Z","checkTimeEt":"08/09 14:00","death":591,"hospitalized":null,"dateChecked":"2020-08-09T18:00:00Z","totalTestsViral":null,"positiveTestsViral":null,"negativeTestsViral":null,"positiveCasesViral":14636,"deathConfirmed":521,"deathProbable":70,"totalTestEncountersViral":null,"totalTestsPeopleViral":200672,"totalTestsAntibody":null,"positiveTestsAntibody":null,"negativeTestsAntibody":null,"totalTestsPeopleAntibody":null,"positiveTestsPeopleAntibody":null,"negativeTestsPeopleAntibody":null,"totalTestsPeopleAntigen":null,"positiveTestsPeopleAntigen":null,"totalTestsAntigen":null,"positiveTestsAntigen":null,"fips":"10","positiveIncrease":59,"negativeIncrease":2494,"total":200672,"totalTestResultsIncrease":2553,"posNeg":200672,"deathIncrease":0,"hospitalizedIncrease":0,"hash":"cec9ec238e438218e31bd5040ac341bef089fb44","commercialScore":0,"negativeRegularScore":0,"negativeScore":0,"positiv