date,state,positive,probableCases,negative,pending,totalTestResultsSource,totalTestResults,hospitalizedCurrently,hospitalizedCumulative,inIcuCurrently,inIcuCumulative,onVentilatorCurrently,onVentilatorCumulative,recovered,dataQualityGrade,lastUpdateEt,dateModified,checkTimeEt,death,hospitalized,dateChecked,totalTestsViral,positiveTestsViral,negativeTestsViral,positiveCasesViral,deathConfirmed,deathProbable,totalTestEncountersViral,totalTestsPeopleViral,totalTestsAntibody,positiveTestsAntibody,negativeTestsAntibody,totalTestsPeopleAntibody,positiveTestsPeopleAntibody,negativeTestsPeopleAntibody,totalTestsPeopleAntigen,positiveTestsPeopleAntigen,totalTestsAntigen,positiveTestsAntigen,fips,positiveIncrease,negativeIncrease,total,totalTestResultsIncrease,posNeg,deathIncrease,hospitalizedIncrease,hash,commercialScore,negativeRegularScore,negativeScore,positiveScore,score,grade
20201106,MI,222509,20940,4984958,,posNeg,5207467,2425,,484,,,,121093,A+,11/6/2020 00:00,2020-11-06T24:00:00Z,11/05 19:00,7880,,2020-11-06T24:00:00Z,5251313,266355,4984958,201569,7513,367,,,336396,,,,,,,,,,26,4246,48339,5207467,52585,5207467,47,0,2357e4bf46614a48b0cda066c2125759973ac242,0,0,0,0,0,
20201105,MI,218263,20457,4936619,,posNeg,5154882,2280,,475,,194,,121093,A+,11/5/2020 00:00,2020-11-05T24:00:00Z,11/04 19:00,7833,,2020-11-05T24:00:00Z,5135947,260736,4936619,197806,7470,363,,,333334,,,,,,,,,,26,6103,55103,5154882,61206,5154882,51,0,e0e9a98f2fd3027be7f7c7bc858f45a282d95c56,0,0,0,0,0,
20201104,MI,212160,20064,4881516,,posNeg,5093676,2215,,470,,199,,121093,A+,11/4/2020 00:00,2020-11-04T24:00:00Z,11/03 19:00,7782,,2020-11-04T24:00:00Z,5135947,254431,4881516,192096,7419,363,,,333334,,,,,,,,,,26,4397,38789,5093676,43186,5093676,21,0,7960009a93bc6c92842a95601e7733455ec7d036,0,0,0,0,0,
20201103,MI,207763,19768,4842727,,posNeg,5050490,2059,,444,,183,,121093,A+,11/3/2020 00:00,2020-11-03T24:00:00Z,11/02 19:00,7761,,2020-11-03T24:00:00Z,5092680,249953,4842727,187995,7400,361,,,332703,,,,,,,,,,26,3437,38754,5050490,42191,5050490,45,0,3be65d02a1cd45d49f164c7be7921e22ecc7ab86,0,0,0,0,0,
20201102,MI,204326,19437,4803973,,posNeg,5008299,1966,,428,,180,,121093,A+,11/2/2020 00:00,2020-11-02T24:00:00Z,11/01 19:00,7716,,2020-11-02T24:00:00Z,5049428,245455,4803973,184889,7357,359,,,331012,,,,,,,,,,26,6920,89787,5008299,96707,5008299,17,0,558f5d930186434cbe3032318de8b3bd05aa1199,0,0,0,0,0,
20201101,MI,197406,19226,4714186,,posNeg,4911592,1728,,398,,167,,121093,A+,10/31/2020 00:00,2020-10-31T24:00:00Z,10/30 20:00,7699,,2020-10-31T24:00:00Z,4952466,238280,4714186,178180,7340,359,,,329831,,,,,,,,,,26,0,0,4911592,0,4911592,0,0,a62e0f9b573785c108eb639005cfab44a26eb0b5,0,0,0,0,0,
20201031,MI,197406,19226,4714186,,posNeg,4911592,1728,,398,,167,,121093,A+,10/31/2020 00:00,2020-10-31T24:00:00Z,10/30 20:00,7699,,2020-10-31T24:00:00Z,4952466,238280,4714186,178180,7340,359,,,329831,,,,,,,,,,26,4018,45491,4911592,49509,4911592,34,0,dc68d550160ad452b227fb2776e92a9054b4a5a8,0,0,0,0,0,
20201030,MI,193388,19000,4668695,,posNeg,4862083,1728,,398,,167,,114939,A+,10/30/2020 00:00,2020-10-30T24:00:00Z,10/29 20:00,7665,,2020-10-30T24:00:00Z,4902392,233697,4668695,174388,7309,356,,,328693,,,,,,,,,,26,3345,58021,4862083,61366,4862083,12,0,3136008295712212387ce3a49dc040efa934dd48,0,0,0,0,0,
20201029,MI,190043,18823,4610674,,posNeg,4800717,1332,,320,,153,,114939,A+,10/29/2020 00:00,2020-10-29T24:00:00Z,10/28 20:00,7653,,2020-10-29T24:00:00Z,4840289,229615,4610674,171220,7298,355,,,327051,,,,,,,,,,26,4109,48606,4800717,52715,4800717,47,0,12bdec5f9e0fc0bc432d2f370a24aa21dafd3d9c,0,0,0,0,0,
20201028,MI,185934,18389,4562068,,posNeg,4748002,1332,,320,,153,,114939,A+,10/28/2020 00:00,2020-10-28T24:00:00Z,10/27 20:00,7606,,2020-10-28T24:00:00Z,4732725,225150,4562068,167545,7257,349,,,323494,,,,,,,,,,26,3590,50942,4748002,54532,4748002,21,0,decdc3f3bc18e8c090494b75b3818b937d192054,0,0,0,0,0,
20201027,MI,182344,18070,4511126,,posNeg,4693470,1332,,320,,146,,114939,A+,10/27/2020 00:00,2020-10-27T24:00:00Z,10/26 20:00,7585,,2020-10-27T24:00:00Z,4732725,221599,4511126,164274,7239,346,,,323494,,,,,,,,,,26,2675,38407,4693470,41082,4693470,33,0,cd11e0ff51f8076b9f6eacb5047eb4fa2714f882,0,0,0,0,0,
20201026,MI,179669,17762,4472719,,posNeg,4652388,1332,,320,,140,,114939,A+,10/26/2020 00:00,2020-10-26T24:00:00Z,10/25 20:00,7552,,2020-10-26T24:00:00Z,4691479,218760,4472719,161907,7211,341,,,322810,,,,,,,,,,26,4057,68340,4652388,72397,4652388,30,0,0e843da9c0e7ee6e8319835860914a3c66ededf9,0,0,0,0,0,
20201025,MI,175612,17586,4404379,,posNeg,4579991,1182,,273,,121,,114939,A+,10/24/2020 00:00,2020-10-24T24:00:00Z,10/23 20:00,7522,,2020-10-24T24:00:00Z,4618562,214183,4404379,158026,7182,340,,,321825,,,,,,,,,,26,0,0,4579991,0,4579991,0,0,0c289bdf1607216ee3f559a5a53ae7952521749d,0,0,0,0,0,
20201024,MI,175612,17586,4404379,,posNeg,4579991,1182,,273,,121,,114939,A+,10/24/2020 00:00,2020-10-24T24:00:00Z,10/23 20:00,7522,,2020-10-24T24:00:00Z,4618562,214183,4404379,158026,7182,340,,,321825,,,,,,,,,,26,3490,50615,4579991,54105,4579991,38,0,953661840296accbdc647732fa62d6f96164d72a,0,0,0,0,0,
20201023,MI,172122,17434,4353764,,posNeg,4525886,1182,,273,,121,,109539,A+,10/23/2020 00:00,2020-10-23T24:00:00Z,10/22 20:00,7484,,2020-10-23T24:00:00Z,4565069,211305,4353764,154688,7147,337,,,318590,,,,,,,,,,26,2046,54977,4525886,57023,4525886,20,0,6e4dad2bde6c8980708be3287defc1b82248c5a4,0,0,0,0,0,
20201022,MI,170076,17214,4298787,,posNeg,4468863,1182,,273,,112,,109539,A+,10/22/2020 00:00,2020-10-22T24:00:00Z,10/21 20:00,7464,,2020-10-22T24:00:00Z,4506888,208101,4298787,152862,7129,335,,,317645,,,,,,,,,,26,2204,45828,4468863,48032,4468863,46,0,707d27e7bba8cf64972e76bc358dd5cd4d290517,0,0,0,0,0,
20201021,MI,167872,16883,4252959,,posNeg,4420831,1050,,267,,112,,109539,A+,10/21/2020 00:00,2020-10-21T24:00:00Z,10/20 20:00,7418,,2020-10-21T24:00:00Z,4458664,205705,4252959,150989,7086,332,,,316762,,,,,,,,,,26,1878,33162,4420831,35040,4420831,35,0,53d8a1e995dba88905c8cfc5b69ef116fa216067,0,0,0,0,0,
20201020,MI,165994,16602,4219797,,posNeg,4385791,1050,,267,,106,,109539,A+,10/20/2020 00:00,2020-10-20T24:00:00Z,10/19 20:00,7383,,2020-10-20T24:00:00Z,4423487,203690,4219797,149392,7053,330,,,316115,,,,,,,,,,26,1871,48296,4385791,50167,4385791,20,0,9ec2d9624502c7ba2055a68314c56bac1b30a77a,0,0,0,0,0,
20201019,MI,164123,16317,4171501,,posNeg,4335624,1050,,267,,95,,109539,A+,10/19/2020 00:00,2020-10-19T24:00:00Z,10/18 20:00,7363,,2020-10-19T24:00:00Z,4372735,201234,4171501,147806,7031,332,,,315661,,,,,,,,,,26,5004,59863,4335624,64867,4335624,46,0,aa4c403bfc04bb1ab6ceb570c1848523b0ba19ce,0,0,0,0,0,
20201018,MI,159119,16013,4111638,,posNeg,4270757,1000,,254,,94,,109539,A+,10/17/2020 00:00,2020-10-17T24:00:00Z,10/16 20:00,7317,,2020-10-17T24:00:00Z,4261714,197889,4111638,143106,6987,330,,,310344,,,,,,,,,,26,0,0,4270757,0,4270757,0,0,11ed3722c5f4bfc178498540dbc5435c662b8960,0,0,0,0,0,
20201017,MI,159119,16013,4111638,,posNeg,4270757,1000,,254,,94,,109539,A+,10/17/2020 00:00,2020-10-17T24:00:00Z,10/16 20:00,7317,,2020-10-17T24:00:00Z,4261714,197889,4111638,143106,6987,330,,,310344,,,,,,,,,,26,0,45347,4270757,45347,4270757,0,0,e9f9b6ce1903c7aff9c490c0f2944438cf7ccb92,0,0,0,0,0,
20201016,MI,159119,16013,4066291,,posNeg,4225410,1000,,254,,94,,104271,A+,10/16/2020 00:00,2020-10-16T24:00:00Z,10/15 20:00,7317,,2020-10-16T24:00:00Z,4261714,195423,4066291,143106,6987,330,,,310344,,,,,,,,,,26,2206,51215,4225410,53421,4225410,15,0,47ebe0d819e19de992bd5d80c3c852c3c043f361,0,0,0,0,0,
20201015,MI,156913,15822,4015076,,posNeg,4171989,1000,,254,,95,,104271,A+,10/15/2020 00:00,2020-10-15T24:00:00Z,10/14 20:00,7302,,2020-10-15T24:00:00Z,4208358,193282,4015076,141091,6973,329,,,309383,,,,,,,,,,26,2458,40119,4171989,42577,4171989,34,0,2f9ee61754344aea4e3c56c1d985bb152fe5969f,0,0,0,0,0,
20201014,MI,154455,15394,3974957,,posNeg,4129412,899,,230,,95,,104271,A+,10/14/2020 00:00,2020-10-14T24:00:00Z,10/13 20:00,7268,,2020-10-14T24:00:00Z,4166236,191279,3974957,139061,6941,327,,,308581,,,,,,,,,,26,1593,28260,4129412,29853,4129412,13,0,c9efe9db747cca2af8bb5336cb29d60a7fe6993e,0,0,0,0,0,
20201013,MI,152862,15160,3946697,,posNeg,4099559,899,,230,,95,,104271,A+,10/13/2020 00:00,2020-10-13T24:00:00Z,10/12 20:00,7255,,2020-10-13T24:00:00Z,4136648,189951,3946697,137702,6928,327,,,308055,,,,,,,,,,26,1466,36996,4099559,38462,4099559,30,0,92cfcf4db9794bb1aae674c50cc1b8a311651c78,0,0,0,0,0,
20201012,MI,151396,14931,3909701,,posNeg,4061097,899,,230,,105,,104271,A+,10/12/2020 00:00,2020-10-12T24:00:00Z,10/11 20:00,7225,,2020-10-12T24:00:00Z,4097809,188108,3909701,136465,6898,327,,,307599,,,,,,,,,,26,1932,48856,4061097,50788,4061097,6,0,fac353e4cbb82e3cdb3fc607655253b8160e9be7,0,0,0,0,0,
20201011,MI,149464,14808,3860845,,posNeg,4010309,862,,220,,85,,104271,A+,10/10/2020 00:00,2020-10-10T24:00:00Z,10/09 20:00,7219,,2020-10-10T24:00:00Z,4046782,185937,3860845,134656,6891,328,,,306564,,,,,,,,,,26,0,0,4010309,0,4010309,0,0,adc8188235fb7e753cd30172e4a93b4177b18fdd,0,0,0,0,0,
20201010,MI,149464,14808,3860845,,posNeg,4010309,862,,220,,85,,104271,A+,10/10/2020 00:00,2020-10-10T24:00:00Z,10/09 20:00,7219,,2020-10-10T24:00:00Z,4046782,185937,3860845,134656,6891,328,,,306564,,,,,,,,,,26,1648,43645,4010309,45293,4010309,19,0,0dd53354d7946a14976b9c316aaa8a00e5f03727,0,0,0,0,0,
20201009,MI,147816,14682,3817200,,posNeg,3965016,862,,220,,85,,99521,A+,10/9/2020 00:00,2020-10-09T24:00:00Z,10/08 20:00,7200,,2020-10-09T24:00:00Z,4001264,184064,3817200,133134,6876,324,,,303491,,,,,,,,,,26,1323,41853,3965016,43176,3965016,7,0,e24052a92c11759636b006e7697a0902258bb65f,0,0,0,0,0,
20201008,MI,146493,14454,3775347,,posNeg,3921840,862,,220,,85,,99521,A+,10/8/2020 00:00,2020-10-08T24:00:00Z,10/07 20:00,7193,,2020-10-08T24:00:00Z,3957766,182419,3775347,132039,6869,324,,,302572,,,,,,,,,,26,1401,40804,3921840,42205,3921840,24,0,9a136d88414c968d51b4a380f96f6e4f0d7e18d5,0,0,0,0,0,
20201007,MI,145092,14250,3734543,,posNeg,3879635,687,,201,,88,,99521,A+,10/7/2020 00:00,2020-10-07T24:00:00Z,10/06 20:00,7169,,2020-10-07T24:00:00Z,3915651,181108,3734543,130842,6847,322,,,301600,,,,,,,,,,26,1214,33459,3879635,34673,3879635,8,0,5291a9ad7f4c73c99fb28ae699e11ed43f24ab2c,0,0,0,0,0,
20201006,MI,143878,14052,3701084,,posNeg,3844962,678,,158,,75,,99521,A+,10/6/2020 00:00,2020-10-06T24:00:00Z,10/05 20:00,7161,,2020-10-06T24:00:00Z,3880970,179886,3701084,129826,6838,323,,,300923,,,,,,,,,,26,1152,24983,3844962,26135,3844962,22,0,f558f6efea1af78f178241a020f5ae10fcd2dd36,0,0,0,0,0,
20201005,MI,142726,13803,3676101,,posNeg,3818827,678,,158,,67,,99521,A+,10/5/2020 00:00,2020-10-05T24:00:00Z,10/04 20:00,7139,,2020-10-05T24:00:00Z,3855106,179005,3676101,128923,6816,323,,,299146,,,,,,,,,,26,1455,53098,3818827,54553,3818827,15,0,8a7a80c11c596d4975ee439f8b14c4c616854fb0,0,0,0,0,0,
20201004,MI,141271,13755,3623003,,posNeg,3764274,678,,158,,62,,99521,A+,10/3/2020 00:00,2020-10-03T24:00:00Z,10/02 20:00,7124,,2020-10-03T24:00:00Z,3800035,177032,3623003,127516,6801,323,,,297983,,,,,,,,,,26,0,0,3764274,0,3764274,0,0,a0c81d6eb35e7a065852c36a81d40f5d21cdb054,0,0,0,0,0,
20201003,MI,141271,13755,3623003,,posNeg,3764274,678,,158,,62,,99521,A+,10/3/2020 00:00,2020-10-03T24:00:00Z,10/02 20:00,7124,,2020-10-03T24:00:00Z,3800035,177032,3623003,127516,6801,323,,,297983,,,,,,,,,,26,1275,39251,3764274,40526,3764274,14,0,780583ad3b6ff1841b88b38180ade481cf6caa6d,0,0,0,0,0,
20201002,MI,139996,13638,3583752,,posNeg,3723748,678,,158,,62,,95051,A+,10/2/2020 00:00,2020-10-02T24:00:00Z,10/01 20:00,7110,,2020-10-02T24:00:00Z,3759598,175846,3583752,126358,6788,322,,,296844,,,,,,,,,,26,984,39183,3723748,40167,3723748,8,0,8e354756b3080219bd6ee8d56535a54d35598fb5,0,0,0,0,0,
20201001,MI,139012,13434,3544569,,posNeg,3683581,678,,158,,67,,95051,A+,10/1/2020 00:00,2020-10-01T24:00:00Z,09/30 20:00,7102,,2020-10-01T24:00:00Z,3719187,174618,3544569,125578,6781,321,,,295830,,,,,,,,,,26,998,34721,3683581,35719,3683581,19,0,1af736dc064d1fbf6401f29e55488e2905af2bd2,0,0,0,0,0,
20200930,MI,138014,13327,3509848,,posNeg,3647862,557,,137,,59,,95051,A+,9/30/2020 00:00,2020-09-30T24:00:00Z,09/29 20:00,7083,,2020-09-30T24:00:00Z,3683262,173414,3509848,124687,6762,321,,,294558,,,,,,,,,,26,1194,28584,3647862,29778,3647862,11,0,8a90e3e70e5ead4ed544285f3cb05e0d72cf6ca3,0,0,0,0,0,
20200929,MI,136820,13187,3481264,,posNeg,3618084,557,,137,,60,,95051,A+,9/29/2020 00:00,2020-09-29T24:00:00Z,09/28 20:00,7072,,2020-09-29T24:00:00Z,3653724,172460,3481264,123633,6751,321,,,292652,,,,,,,,,,26,1118,22976,3618084,24094,3618084,21,0,e3bd74e62b2f22855d84a8d027ba0116a369fca8,0,0,0,0,0,
20200928,MI,135702,12967,3458288,,posNeg,3593990,557,,137,,51,,95051,A+,9/28/2020 00:00,2020-09-28T24:00:00Z,09/27 20:00,7051,,2020-09-28T24:00:00Z,3629903,171615,3458288,122735,6731,320,,,292255,,,,,,,,,,26,1329,49604,3593990,50933,3593990,7,0,259777794c22458ce4fc14587b69c93014cc818e,0,0,0,0,0,
20200927,MI,134373,12946,3408684,,posNeg,3543057,558,,139,,52,,95051,A+,9/26/2020 00:00,2020-09-26T24:00:00Z,09/25 20:00,7044,,2020-09-26T24:00:00Z,3578584,169900,3408684,121427,6723,321,,,291180,,,,,,,,,,26,0,0,3543057,0,3543057,0,0,a6ab444651c029b6511a85d118bcd355870bc8ad,0,0,0,0,0,
20200926,MI,134373,12946,3408684,,posNeg,3543057,558,,139,,52,,95051,A+,9/26/2020 00:00,2020-09-26T24:00:00Z,09/25 20:00,7044,,2020-09-26T24:00:00Z,3578584,169900,3408684,121427,6723,321,,,291180,,,,,,,,,,26,996,39749,3543057,40745,3543057,17,0,f420b771b8305b0bb5aa9e58f004ec99d449789e,0,0,0,0,0,
20200925,MI,133377,12851,3368935,,posNeg,3502312,558,,139,,52,,90216,A+,9/25/2020 00:00,2020-09-25T24:00:00Z,09/24 20:00,7027,,2020-09-25T24:00:00Z,3537643,168708,3368935,120526,6708,319,,,289151,,,,,,,,,,26,1040,38448,3502312,39488,3502312,8,0,4414ff0b3e21ad7e3ab809f1ba8c523786aae9c8,0,0,0,0,0,
20200924,MI,132337,12740,3330487,,posNeg,3462824,558,,139,,50,,90216,A+,9/24/2020 00:00,2020-09-24T24:00:00Z,09/23 20:00,7019,,2020-09-24T24:00:00Z,3498071,167584,3330487,119597,6700,319,,,288257,,,,,,,,,,26,1078,36639,3462824,37717,3462824,6,0,d036f3aef9753342e9c3f7b447c4a8ca31537243,0,0,0,0,0,
20200923,MI,131259,12644,3293848,,posNeg,3425107,501,,146,,58,,90216,A+,9/23/2020 00:00,2020-09-23T24:00:00Z,09/22 20:00,7013,,2020-09-23T24:00:00Z,3460290,166442,3293848,118615,6692,321,,,287162,,,,,,,,,,26,902,33327,3425107,34229,3425107,16,0,989491696dc597c45424f4ad62556bcc211dfb05,0,0,0,0,0,
20200922,MI,130357,12447,3260521,,posNeg,3390878,501,,146,,56,,90216,A+,9/22/2020 00:00,2020-09-22T24:00:00Z,09/21 20:00,6997,,2020-09-22T24:00:00Z,3425958,165437,3260521,117910,6680,317,,,285455,,,,,,,,,,26,695,19516,3390878,20211,3390878,16,0,f5f21c68658cc5de9d587e11249c2d40416629b4,0,0,0,0,0,
20200921,MI,129662,12256,3241005,,posNeg,3370667,501,,146,,64,,90216,A+,9/21/2020 00:00,2020-09-21T24:00:00Z,09/20 20:00,6981,,2020-09-21T24:00:00Z,3405774,164769,3241005,117406,6665,316,,,285076,,,,,,,,,,26,1575,50623,3370667,52198,3370667,12,0,fd7290162fd4ba301daa1a3a44cb9de2adec2e95,0,0,0,0,0,
20200920,MI,128087,12217,3190382,,posNeg,3318469,557,,150,,64,,90216,A+,9/19/2020 00:00,2020-09-19T24:00:00Z,09/18 20:00,6969,,2020-09-19T24:00:00Z,3353686,163304,3190382,115870,6653,316,,,283882,,,,,,,,,,26,0,0,3318469,0,3318469,0,0,bb810ea16f6d53454ed0e1da3d837ae561669a2a,0,0,0,0,0,
20200919,MI,128087,12217,3190382,,posNeg,3318469,557,,150,,64,,90216,A+,9/19/2020 00:00,2020-09-19T24:00:00Z,09/18 20:00,6969,,2020-09-19T24:00:00Z,3353686,163304,3190382,115870,6653,316,,,283882,,,,,,,,,,26,587,32852,3318469,33439,3318469,15,0,dddc90e19ffc19824ff029089e228b8bbcc86708,0,0,0,0,0,
20200918,MI,127500,12113,3157530,,posNeg,3285030,557,,150,,64,,85513,A+,9/18/2020 00:00,2020-09-18T24:00:00Z,09/17 20:00,6954,,2020-09-18T24:00:00Z,3319787,162257,3157530,115387,6638,316,,,282669,,,,,,,,,,26,778,32521,3285030,33299,3285030,-1,0,3eb50a84c5a841af9a191dc9dfbb25c75c5b5295,0,0,0,0,0,
20200917,MI,126722,12030,3125009,,posNeg,3251731,590,,152,,67,,85513,A+,9/17/2020 00:00,2020-09-17T24:00:00Z,09/16 20:00,6955,,2020-09-17T24:00:00Z,3286221,161212,3125009,114692,6632,323,,,279980,,,,,,,,,,26,980,32290,3251731,33270,3251731,12,0,b4569c1f68c6dec2e2dc8543b05e466b5ef1a075,0,0,0,0,0,
20200916,MI,125742,11879,3092719,,posNeg,3218461,590,,152,,65,,85513,A+,9/16/2020 00:00,2020-09-16T24:00:00Z,09/15 20:00,6943,,2020-09-16T24:00:00Z,3252947,160228,3092719,113863,6623,320,,,270746,,,,,,,,,,26,773,30067,3218461,30840,3218461,11,0,9c9acd560b7c58b6c085b2f0627a74f0626ef8a4,0,0,0,0,0,
20200915,MI,124969,11786,3062652,,posNeg,3187621,590,,152,,68,,85513,A+,9/15/2020 00:00,2020-09-15T24:00:00Z,09/14 20:00,6932,,2020-09-15T24:00:00Z,3221906,159254,3062652,113183,6612,320,,,270031,,,,,,,,,,26,682,24852,3187621,25534,3187621,11,0,b8a1cbda9ffd91c3cd3d7ec9fc2d09dafbb16461,0,0,0,0,0,
20200914,MI,124287,11675,3037800,,posNeg,3162087,590,,152,,82,,85513,A+,9/14/2020 00:00,2020-09-14T24:00:00Z,09/13 20:00,6921,,2020-09-14T24:00:00Z,3196127,158327,3037800,112612,6601,320,,,269507,,,,,,,,,,26,1229,50248,3162087,51477,3162087,10,0,858900003a069b1972fa7ffd1eb63743a4caee65,0,0,0,0,0,
20200913,MI,123058,11534,2987552,,posNeg,3110610,627,,172,,77,,85513,A+,9/12/2020 00:00,2020-09-12T24:00:00Z,09/11 20:00,6911,,2020-09-12T24:00:00Z,3144491,156939,2987552,111524,6591,320,,,268368,,,,,,,,,,26,0,0,3110610,0,3110610,0,0,5c008adc776f0706c5490789792fd0b79a09a4ad,0,0,0,0,0,
20200912,MI,123058,11534,2987552,,posNeg,3110610,627,,172,,77,,85513,A+,9/12/2020 00:00,2020-09-12T24:00:00Z,09/11 20:00,6911,,2020-09-12T24:00:00Z,3144491,156939,2987552,111524,6591,320,,,268368,,,,,,,,,,26,807,37017,3110610,37824,3110610,11,0,ef639f7ec37d7ec162a03a5dd0a96d8250fe98b8,0,0,0,0,0,
20200911,MI,122251,11419,2950535,,posNeg,3072786,627,,172,,77,,80678,A+,9/11/2020 00:00,2020-09-11T24:00:00Z,09/10 20:00,6900,,2020-09-11T24:00:00Z,3106168,155633,2950535,110832,6578,322,,,267328,,,,,,,,,,26,1405,34933,3072786,36338,3072786,6,0,30973e329496810e8277ec8e074a21fdcf6d0740,0,0,0,0,0,
20200910,MI,120846,11327,2915602,,posNeg,3036448,627,,172,,75,,80678,A+,9/10/2020 00:00,2020-09-10T24:00:00Z,09/09 20:00,6894,,2020-09-10T24:00:00Z,3069695,154093,2915602,109519,6569,325,,,266151,,,,,,,,,,26,983,32188,3036448,33171,3036448,7,0,0256c6b162b09adfd1caed29abf35f35de7f3e4d,0,0,0,0,0,
20200909,MI,119863,11268,2883414,,posNeg,3003277,616,,158,,70,,80678,A+,9/9/2020 00:00,2020-09-09T24:00:00Z,09/08 20:00,6887,,2020-09-09T24:00:00Z,3036493,153079,2883414,108595,6552,335,,,265430,,,,,,,,,,26,961,22232,3003277,23193,3003277,76,0,98b8bef74660fb4d0da721ab24a769f79ed16ef6,0,0,0,0,0,
20200908,MI,118902,11090,2861182,,posNeg,2980084,616,,158,,76,,80678,A+,9/8/2020 00:00,2020-09-08T24:00:00Z,09/07 20:00,6811,,2020-09-08T24:00:00Z,3013356,152174,2861182,107812,6539,272,,,264994,,,,,,,,,,26,499,16907,2980084,17406,2980084,1,0,2ca726f5501c855387d9a88a7f362797d50f07b5,0,0,0,0,0,
20200907,MI,118403,11032,2844275,,posNeg,2962678,616,,158,,71,,80678,A+,9/7/2020 00:00,2020-09-07T24:00:00Z,09/06 20:00,6810,,2020-09-07T24:00:00Z,2995886,151611,2844275,107371,6538,272,,,264881,,,,,,,,,,26,1212,42464,2962678,43676,2962678,4,0,7c0760da77452b29ca43368bd8cc147b06ce3a15,0,0,0,0,0,
20200906,MI,117191,10976,2801811,,posNeg,2919002,616,,158,,71,,80678,A+,9/5/2020 00:00,2020-09-05T24:00:00Z,09/04 20:00,6806,,2020-09-05T24:00:00Z,2951815,150004,2801811,106215,6534,272,,,263721,,,,,,,,,,26,0,0,2919002,0,2919002,0,0,2f3d22f911934c08b632d1642f096a22607e279c,0,0,0,0,0,
20200905,MI,117191,10976,2801811,,posNeg,2919002,616,,158,,71,,80678,A+,9/5/2020 00:00,2020-09-05T24:00:00Z,09/04 20:00,6806,,2020-09-05T24:00:00Z,2951815,150004,2801811,106215,6534,272,,,263721,,,,,,,,,,26,896,40125,2919002,41021,2919002,8,0,459ef8c9c6b3b87a88dd6b264e41df669b95d5e9,0,0,0,0,0,
20200904,MI,116295,10918,2761686,,posNeg,2877981,616,,158,,75,,76151,A+,9/4/2020 00:00,2020-09-04T24:00:00Z,09/03 20:00,6798,,2020-09-04T24:00:00Z,2910912,148506,2761686,105377,6526,272,,,262033,,,,,,,,,,26,1053,27477,2877981,28530,2877981,7,0,3df237daca446a8c00a7d6e180b2af6c30da3546,0,0,0,0,0,
20200903,MI,115242,10847,2734209,,posNeg,2849451,616,,158,,75,,76151,A+,9/3/2020 00:00,2020-09-03T24:00:00Z,09/02 20:00,6791,,2020-09-03T24:00:00Z,2881707,147498,2734209,104395,6519,272,,,261011,,,,,,,,,,26,774,31861,2849451,32635,2849451,10,0,642e4709d530f4c538ee1a65374416ed58af104a,0,0,0,0,0,
20200902,MI,114468,10758,2702348,,posNeg,2816816,629,,156,,78,,76151,A+,9/2/2020 00:00,2020-09-02T24:00:00Z,09/01 20:00,6781,,2020-09-02T24:00:00Z,2848852,146504,2702348,103710,6509,272,,,259606,,,,,,,,,,26,648,26761,2816816,27409,2816816,14,0,3176c7055fff7acc3e5375c5fff828a190b0cc58,0,0,0,0,0,
20200901,MI,113820,10634,2675587,,posNeg,2789407,629,,156,,83,,76151,A+,9/1/2020 00:00,2020-09-01T24:00:00Z,08/31 20:00,6767,,2020-09-01T24:00:00Z,2821258,145671,2675587,103186,6495,272,,,258577,,,,,,,,,,26,795,24181,2789407,24976,2789407,14,0,c2f6920c20a7b877b5d2068b1fe77ec4b9d7e4c3,0,0,0,0,0,
20200831,MI,113025,10557,2651406,,posNeg,2764431,629,,156,,90,,76151,A+,8/31/2020 00:00,2020-08-31T24:00:00Z,08/30 20:00,6753,,2020-08-31T24:00:00Z,2796262,144856,2651406,102468,6480,273,,,257840,,,,,,,,,,26,499,19138,2764431,19637,2764431,5,0,96802f89070efdec92993d9920ff0df6c8e49d50,0,0,0,0,0,
20200830,MI,112526,10509,2632268,,posNeg,2744794,669,,184,,93,,76151,A+,8/30/2020 00:00,2020-08-30T24:00:00Z,08/29 20:00,6748,,2020-08-30T24:00:00Z,2776497,144229,2632268,102017,6473,275,,,257397,,,,,,,,,,26,1390,59530,2744794,60920,2744794,36,0,14319717acfaa54f61ad7bf3e712cd12dce5465b,0,0,0,0,0,
20200829,MI,111136,10437,2572738,,posNeg,2683874,669,,184,,93,,76151,A+,8/29/2020 00:00,2020-08-29T24:00:00Z,08/28 20:00,6712,,2020-08-29T24:00:00Z,2749406,142390,2572738,100699,6446,266,,,256585,,,,,,,,,,26,0,0,2683874,0,2683874,0,0,e90bdfb47c789afba52819ad603d72ba379334f5,0,0,0,0,0,
20200828,MI,111136,10437,2572738,,posNeg,2683874,669,,184,,93,,72580,A+,8/28/2020 00:00,2020-08-28T24:00:00Z,08/27 20:00,6712,,2020-08-28T24:00:00Z,2715128,142390,2572738,100699,6446,266,,,253766,,,,,,,,,,26,793,32250,2683874,33043,2683874,6,0,2aea32fbd5a02da9bc503e9900cd0fdee912023d,0,0,0,0,0,
20200827,MI,110343,10385,2540488,,posNeg,2650831,669,,184,,85,,72580,A+,8/27/2020 00:00,2020-08-27T24:00:00Z,08/26 20:00,6706,,2020-08-27T24:00:00Z,2681786,141298,2540488,99958,6440,266,,,252101,,,,,,,,,,26,863,29616,2650831,30479,2650831,16,0,14e453427319e23ccb9367eccdc0b9e6557f0f5e,0,0,0,0,0,
20200826,MI,109480,10280,2510872,,posNeg,2620352,637,,186,,93,,72580,A+,8/26/2020 00:00,2020-08-26T24:00:00Z,08/25 20:00,6690,,2020-08-26T24:00:00Z,2651069,140197,2510872,99200,6424,266,,,250244,,,,,,,,,,26,843,40334,2620352,41177,2620352,6,0,0c1fab565892ad264227658390fa1a1e38e9f4e5,0,0,0,0,0,
20200825,MI,108637,10198,2470538,,posNeg,2579175,637,,186,,86,,72580,A+,8/25/2020 00:00,2020-08-25T24:00:00Z,08/24 20:00,6684,,2020-08-25T24:00:00Z,2609724,139186,2470538,98439,6417,267,,,249056,,,,,,,,,,26,951,23330,2579175,24281,2579175,21,0,e76f22b560eb906f32882e2275ea9a17d64ba0a9,0,0,0,0,0,
20200824,MI,107686,10026,2447208,,posNeg,2554894,637,,186,,86,,72580,A+,8/24/2020 00:00,2020-08-24T24:00:00Z,08/23 20:00,6663,,2020-08-24T24:00:00Z,2585426,138218,2447208,97660,6397,266,,,248310,,,,,,,,,,26,878,20544,2554894,21422,2554894,4,0,2b55ad11236f9031679255bb19fabe623083390b,0,0,0,0,0,
20200823,MI,106808,10016,2426664,,posNeg,2533472,646,,173,,95,,72580,A+,8/23/2020 00:00,2020-08-23T24:00:00Z,08/22 20:00,6659,,2020-08-23T24:00:00Z,2564334,137670,2426664,96792,6393,266,,,247944,,,,,,,,,,26,764,73669,2533472,74433,2533472,4,0,032b28af3376218d0d2d1e4addd5339371e38d47,0,0,0,0,0,
20200822,MI,106044,10020,2352995,,posNeg,2459039,646,,173,,95,,72580,A+,8/22/2020 00:00,2020-08-22T24:00:00Z,08/21 20:00,6655,,2020-08-22T24:00:00Z,2488205,135210,2352995,96024,6389,266,,,244940,,,,,,,,,,26,1426,31911,2459039,33337,2459039,21,0,9e431bbb6dce3bbf084f112409eb603c91047873,0,0,0,0,0,
20200821,MI,104618,9921,2321084,,posNeg,2425702,646,,173,,95,,67778,A+,8/20/2020 00:00,2020-08-20T24:00:00Z,08/19 20:00,6634,,2020-08-20T24:00:00Z,2455187,134103,2321084,94697,6368,266,,,243222,,,,,,,,,,26,0,0,2425702,0,2425702,0,0,14ee8db85dccb16bdc73a96e7655d8ee4c3b4058,0,0,0,0,0,
20200820,MI,104618,9921,2321084,,posNeg,2425702,646,,173,,81,,67778,A+,8/20/2020 00:00,2020-08-20T24:00:00Z,08/19 20:00,6634,,2020-08-20T24:00:00Z,2455187,134103,2321084,94697,6368,266,,,243222,,,,,,,,,,26,527,29987,2425702,30514,2425702,16,0,a1ba2152d05651dd61917dc272eba765f20a616b,0,0,0,0,0,
20200819,MI,104091,9813,2291097,,posNeg,2395188,653,,169,,82,,67778,A+,8/19/2020 00:00,2020-08-19T24:00:00Z,08/18 20:00,6618,,2020-08-19T24:00:00Z,2424004,132907,2291097,94278,6349,269,,,240643,,,,,,,,,,26,688,31975,2395188,32663,2395188,10,0,2c37d51107cd829b0aba2228b5ec210c9960162b,0,0,0,0,0,
20200818,MI,103403,9741,2259122,,posNeg,2362525,653,,169,,89,,67778,A+,8/18/2020 00:00,2020-08-18T24:00:00Z,08/17 20:00,6608,,2020-08-18T24:00:00Z,2391049,131927,2259122,93662,6340,268,,,239798,,,,,,,,,,26,654,21664,2362525,22318,2362525,16,0,d4ebce94bb1bef68348cfaf351d24bf2cf1e2a48,0,0,0,0,0,
20200817,MI,102749,9564,2237458,,posNeg,2340207,653,,169,,89,,67778,A+,8/17/2020 00:00,2020-08-17T24:00:00Z,08/16 20:00,6592,,2020-08-17T24:00:00Z,2368782,131324,2237458,93185,6325,267,,,238946,,,,,,,,,,26,490,18667,2340207,19157,2340207,0,0,b21f960b1e97dc16f6a344bbab8927945d657607,0,0,0,0,0,
20200816,MI,102259,9539,2218791,,posNeg,2321050,713,,184,,87,,67778,A+,8/16/2020 00:00,2020-08-16T24:00:00Z,08/15 20:00,6592,,2020-08-16T24:00:00Z,2349431,130640,2218791,92720,6324,268,,,238181,,,,,,,,,,26,477,28794,2321050,29271,2321050,6,0,4637422bfd547ecba384c15e8d6d3c252b79427b,0,0,0,0,0,
20200815,MI,101782,9627,2189997,,posNeg,2291779,713,,184,,87,,67778,A+,8/15/2020 00:00,2020-08-15T24:00:00Z,08/14 20:00,6586,,2020-08-15T24:00:00Z,2319557,129560,2189997,92155,6318,268,,,237323,,,,,,,,,,26,1058,29570,2291779,30628,2291779,20,0,36cbff86a188964019de6698ab1c92f4feab99b2,0,0,0,0,0,
20200814,MI,100724,9584,2160427,,posNeg,2261151,713,,184,,87,,63636,A+,8/14/2020 00:00,2020-08-14T24:00:00Z,08/13 20:00,6566,,2020-08-14T24:00:00Z,2288733,128306,2160427,91140,6300,266,,,235572,,,,,,,,,,26,868,37897,2261151,38765,2261151,11,0,9387573fd42f61420507273d7551d2a0905af0e4,0,0,0,0,0,
20200813,MI,99856,9464,2122530,,posNeg,2222386,713,,184,,90,,63636,A+,8/13/2020 00:00,2020-08-13T24:00:00Z,08/12 20:00,6555,,2020-08-13T24:00:00Z,2249441,126911,2122530,90392,6289,266,,,233568,,,,,,,,,,26,1167,39378,2222386,40545,2222386,16,0,a9a1cdb0eca009bf4062021984f6d365a510ad3a,0,0,0,0,0,
20200812,MI,98689,9418,2083152,,posNeg,2181841,640,,185,,84,,63636,A+,8/12/2020 00:00,2020-08-12T24:00:00Z,08/11 20:00,6539,,2020-08-12T24:00:00Z,2208812,125660,2083152,89271,6273,266,,,231232,,,,,,,,,,26,476,34811,2181841,35287,2181841,6,0,12cd25b93dc038d9b631cdc2bd7c1f42a2069625,0,0,0,0,0,
20200811,MI,98213,9457,2048341,,posNeg,2146554,640,,185,,85,,63636,A+,8/11/2020 00:00,2020-08-11T24:00:00Z,08/10 20:00,6533,,2020-08-11T24:00:00Z,2172898,124557,2048341,88756,6264,269,,,230011,,,,,,,,,,26,907,23058,2146554,23965,2146554,7,0,11fb46e642d8077ac5aabf935b2186f572bd4006,0,0,0,0,0,
20200810,MI,97306,9346,2025283,,posNeg,2122589,640,,185,,132,,63636,A+,8/10/2020 00:00,2020-08-10T24:00:00Z,08/09 20:00,6526,,2020-08-10T24:00:00Z,2148786,123503,2025283,87960,6257,269,,,229030,,,,,,,,,,26,580,20677,2122589,21257,2122589,7,0,b36f40924f8e3d112ed585fdf44037ec789548ac,0,0,0,0,0,
20200809,MI,96726,9323,2004606,,posNeg,2101332,694,,232,,132,,63636,A+,8/9/2020 00:00,2020-08-09T24:00:00Z,08/08 20:00,6519,,2020-08-09T24:00:00Z,2127348,122742,2004606,87403,6249,270,,,228519,,,,,,,,,,26,535,25676,2101332,26211,2101332,-1,0,9c41291919ee1e150aa06b662365fe9753275905,0,0,0,0,0,
20200808,MI,96191,9302,1978930,,posNeg,2075121,694,,232,,132,,63636,A+,8/8/2020 00:00,2020-08-08T24:00:00Z,08/07 20:00,6520,,2020-08-08T24:00:00Z,2100848,121918,1978930,86889,6250,270,,,227521,,,,,,,,,,26,721,37805,2075121,38526,2075121,-4,0,551456ae3f3cf01e145a11578300e012c9d49b3e,0,0,0,0,0,
20200807,MI,95470,9279,1941125,,posNeg,2036595,694,,232,,132,,60022,A+,8/7/2020 00:00,2020-08-07T24:00:00Z,08/06 20:00,6524,,2020-08-07T24:00:00Z,2061956,120831,1941125,86191,6247,277,,,225674,,,,,,,,,,26,814,29203,2036595,30017,2036595,18,0,775d473ec70fd9b1017e72bf43e9cb145777d271,0,0,0,0,0,
20200806,MI,94656,9227,1911922,,posNeg,2006578,694,,232,,132,,60022,A+,8/6/2020 00:00,2020-08-06T24:00:00Z,08/05 20:00,6506,,2020-08-06T24:00:00Z,2031654,119732,1911922,85429,6247,259,,,223982,,,,,,,,,,26,763,25343,2006578,26106,2006578,28,0,03e195bd91c24e1053ce5475d09672cb03912d87,0,0,0,0,0,
20200805,MI,93893,9186,1886579,,posNeg,1980472,694,,232,,132,,60022,A+,8/5/2020 00:00,2020-08-05T24:00:00Z,08/04 20:00,6478,,2020-08-05T24:00:00Z,2005494,118915,1886579,84707,6221,257,,,222019,,,,,,,,,,26,718,25339,1980472,26057,1980472,7,0,c95603915c364cc13e1b5fdec3d6d4dee616ef4e,0,0,0,0,0,
20200804,MI,93175,9125,1861240,,posNeg,1954415,694,,232,,132,,60022,A+,8/4/2020 00:00,2020-08-04T24:00:00Z,08/03 20:00,6471,,2020-08-04T24:00:00Z,1979257,118017,1861240,84050,6219,252,,,220799,,,,,,,,,,26,801,26791,1954415,27592,1954415,8,0,03600563696a20c41ee566b2147aa151812a2151,0,0,0,0,0,
20200803,MI,92374,8988,1834449,,posNeg,1926823,694,,232,,132,,60022,A+,8/3/2020 00:00,2020-08-03T24:00:00Z,08/02 20:00,6463,,2020-08-03T24:00:00Z,1951555,117106,1834449,83386,6212,251,,,218538,,,,,,,,,,26,613,24369,1926823,24982,1926823,6,0,72272899b78c5b8e7ad6746d0a852d8fc09c5bad,0,0,0,0,0,
20200802,MI,91761,8979,1810080,,posNeg,1901841,727,,238,,144,,60022,A+,8/2/2020 00:00,2020-08-02T24:00:00Z,08/01 20:00,6457,,2020-08-02T24:00:00Z,1926348,116268,1810080,82782,6206,251,,,217937,,,,,,,,,,26,429,24582,1901841,25011,1901841,0,0,41204be183c84dfe786b7b5e2be9680f56822825,0,0,0,0,0,
20200801,MI,91332,8976,1785498,,posNeg,1876830,727,,238,,144,,60022,A+,8/1/2020 00:00,2020-08-01T24:00:00Z,07/31 20:00,6457,,2020-08-01T24:00:00Z,1900915,115417,1785498,82356,6206,251,,,216608,,,,,,,,,,26,758,31625,1876830,32383,1876830,7,0,91d9338481b1b1a91a4ff41d33a4aedfafe9ce67,0,0,0,0,0,
20200731,MI,90574,8953,1753873,,posNeg,1844447,727,,238,,144,,57502,A+,7/31/2020 00:00,2020-07-31T24:00:00Z,07/30 20:00,6450,,2020-07-31T24:00:00Z,1868156,114283,1753873,81621,6199,251,,,214923,,,,,,,,,,26,793,30476,1844447,31269,1844447,7,0,0fce993722786fa5d09d94ca705b62559bf62b70,0,0,0,0,0,
20200730,MI,89781,8894,1723397,,posNeg,1813178,727,,238,,153,,57502,A+,7/30/2020 00:00,2020-07-30T24:00:00Z,07/29 20:00,6443,,2020-07-30T24:00:00Z,1836584,113187,1723397,80887,6191,252,,,212732,,,,,,,,,,26,807,19138,1813178,19945,1813178,21,0,4a664d6f8f125015c6d8930ff17cadb9a853e20e,0,0,0,0,0,
20200729,MI,88974,8802,1704259,,posNeg,1793233,670,,195,,135,,57502,A+,7/29/2020 00:00,2020-07-29T24:00:00Z,07/28 20:00,6422,,2020-07-29T24:00:00Z,1819805,115546,1704259,80172,6172,250,,,210763,,,,,,,,,,26,1016,64335,1793233,65351,1793233,1,0,29307691d4e42952bf4e0740ec9c92a4879aeae1,0,0,0,0,0,
20200728,MI,87958,8782,1639924,,posNeg,1727882,670,,195,,135,,57502,A+,7/28/2020 00:00,2020-07-28T24:00:00Z,07/27 20:00,6421,,2020-07-28T24:00:00Z,1751875,111951,1639924,79176,6170,251,,,209655,,,,,,,,,,26,785,26608,1727882,27393,1727882,16,0,afa9d828343e3ceda27008c1283dbb95de1623b7,0,0,0,0,0,
20200727,MI,87173,8666,1613316,,posNeg,1700489,670,,195,,113,,57502,A+,7/27/2020 00:00,2020-07-27T24:00:00Z,07/26 20:00,6405,,2020-07-27T24:00:00Z,1723892,110576,1613316,78507,6154,251,,,208729,,,,,,,,,,26,512,29233,1700489,29745,1700489,5,0,4da04bb762932f34761831919b69e1e663726a4d,0,0,0,0,0,
20200726,MI,86661,8642,1584083,,posNeg,1670744,680,,210,,113,,57502,A+,7/26/2020 00:00,2020-07-26T24:00:00Z,07/25 20:00,6400,,2020-07-26T24:00:00Z,1693712,109629,1584083,78019,6149,251,,,207540,,,,,,,,,,26,1589,54509,1670744,56098,1670744,0,0,3292cb1ee8de8f59c84d900061006701a1a05e70,0,0,0,0,0,
20200725,MI,85072,8531,1529574,,posNeg,1614646,751,,215,,113,,55162,A+,7/24/2020 00:00,2020-07-24T24:00:00Z,07/23 20:00,6400,,2020-07-24T24:00:00Z,1637017,107443,1529574,76541,6151,249,,,204810,,,,,,,,,,26,0,0,1614646,0,1614646,0,0,a75ff4c639975886977e977a1cb689f7a0561412,0,0,0,0,0,
20200724,MI,85072,8531,1529574,,posNeg,1614646,751,,215,,113,,55162,A+,7/24/2020 00:00,2020-07-24T24:00:00Z,07/23 20:00,6400,,2020-07-24T24:00:00Z,1637017,107443,1529574,76541,6151,249,,,204810,,,,,,,,,,26,641,27281,1614646,27922,1614646,5,0,573f9e0906dfd2a3771b82540adc7a101d1147b6,0,0,0,0,0,
20200723,MI,84431,8484,1502293,,posNeg,1586724,680,,210,,120,,55162,A+,7/23/2020 00:00,2020-07-23T24:00:00Z,07/22 20:00,6395,,2020-07-23T24:00:00Z,1608660,106367,1502293,75947,6148,247,,,202720,,,,,,,,,,26,701,26410,1586724,27111,1586724,7,0,00da267f831df9aab38f8d945b5e71f8e5822f1a,0,0,0,0,0,
20200722,MI,83730,8482,1475883,,posNeg,1559613,680,,210,,120,,55162,A+,7/22/2020 00:00,2020-07-22T24:00:00Z,07/21 20:00,6388,,2020-07-22T24:00:00Z,1581285,105402,1475883,75248,6141,247,,,200528,,,,,,,,,,26,671,29567,1559613,30238,1559613,6,0,6653b6298f075163a04034d9a2ca48a5ceff6a5c,0,0,0,0,0,
20200721,MI,83059,8334,1446316,,posNeg,1529375,680,,210,,130,,55162,A+,7/21/2020 00:00,2020-07-21T24:00:00Z,07/20 20:00,6382,,2020-07-21T24:00:00Z,1550697,104381,1446316,74725,6135,247,,,199230,,,,,,,,,,26,664,21922,1529375,22586,1529375,9,0,69fc7cfe9e35df9baaf986459dd186122e49d832,0,0,0,0,0,
20200720,MI,82395,8243,1424394,,posNeg,1506789,680,,210,,102,,55162,A+,7/20/2020 00:00,2020-07-20T24:00:00Z,07/19 20:00,6373,,2020-07-20T24:00:00Z,1527804,103410,1424394,74152,6126,247,,,198479,,,,,,,,,,26,527,21803,1506789,22330,1506789,7,0,1c5e0ef5aceb9b0d9436d668066ac2a0e68b8eed,0,0,0,0,0,
20200719,MI,81868,8205,1402591,,posNeg,1484459,680,,201,,102,,55162,A+,7/19/2020 00:00,2020-07-19T24:00:00Z,07/18 20:00,6366,,2020-07-19T24:00:00Z,1505204,102613,1402591,73663,6119,247,,,197569,,,,,,,,,,26,530,27851,1484459,28381,1484459,2,0,ea4ee916af1713d5a614a84d80b9a20b71da6345,0,0,0,0,0,
20200718,MI,81338,8158,1374740,,posNeg,1456078,680,,201,,102,,55162,A+,7/18/2020 00:00,2020-07-18T24:00:00Z,07/17 20:00,6364,,2020-07-18T24:00:00Z,1476385,101645,1374740,73180,6117,247,,,195843,,,,,,,,,,26,745,29827,1456078,30572,1456078,9,0,cb504191fb2be5b3f68f3bec0921fa8facf98d41,0,0,0,0,0,
20200717,MI,80593,8091,1344913,,posNeg,1425506,680,,201,,88,,53867,A+,7/17/2020 00:00,2020-07-17T24:00:00Z,07/16 20:00,6355,,2020-07-17T24:00:00Z,1445361,100448,1344913,72502,6108,247,,,192929,,,,,,,,,,26,754,29598,1425506,30352,1425506,7,0,9e925fb46b87451acbf44f2e425982ad340701c0,0,0,0,0,0,
20200716,MI,79839,7997,1315315,,posNeg,1395154,680,,201,,107,,53867,A+,7/16/2020 00:00,2020-07-16T24:00:00Z,07/15 20:00,6348,,2020-07-16T24:00:00Z,1414802,99487,1315315,71842,6101,247,,,190043,,,,,,,,,,26,926,26309,1395154,27235,1395154,18,0,ce17f8908bfdbafff955e523624f41050b79f05d,0,0,0,0,0,
20200715,MI,78913,7716,1289006,,posNeg,1367919,543,,184,,107,,53867,A+,7/15/2020 00:00,2020-07-15T24:00:00Z,07/14 20:00,6330,,2020-07-15T24:00:00Z,1387545,98539,1289006,71197,6085,245,,,187617,,,,,,,,,,26,1049,33084,1367919,34133,1367919,4,0,c02e974a41c86067305f2cd6f56dca16c4494d4d,0,0,0,0,0,
20200714,MI,77864,7558,1255922,,posNeg,1333786,543,,184,,109,,53867,A+,7/14/2020 00:00,2020-07-14T24:00:00Z,07/13 20:00,6326,,2020-07-14T24:00:00Z,1353182,97260,1255922,70306,6081,245,,,186178,,,,,,,,,,26,666,19693,1333786,20359,1333786,5,0,b752d1065ceb6430a104933da0093ecec34698d4,0,0,0,0,0,
20200713,MI,77198,7476,1236229,,posNeg,1313427,543,,184,,113,,53867,A+,7/13/2020 00:00,2020-07-13T24:00:00Z,07/12 20:00,6321,,2020-07-13T24:00:00Z,1332667,96438,1236229,69722,6075,246,,,185189,,,,,,,,,,26,422,16850,1313427,17272,1313427,7,0,4f4684aa42c873ea434706da2035b67c7c61d3e6,0,0,0,0,0,
20200712,MI,76776,7438,1219379,,posNeg,1296155,505,,174,,99,,53867,A+,7/12/2020 00:00,2020-07-12T24:00:00Z,07/11 20:00,6314,,2020-07-12T24:00:00Z,1315305,95926,1219379,69338,6068,246,,,183784,,,,,,,,,,26,406,21627,1296155,22033,1296155,1,0,5ea24b2b45da14a6d8d12c546a85b05455ff3acb,0,0,0,0,0,
20200711,MI,76370,7422,1197752,,posNeg,1274122,505,,174,,99,,53867,A+,7/11/2020 00:00,2020-07-11T24:00:00Z,07/10 20:00,6313,,2020-07-11T24:00:00Z,1292951,95199,1197752,68948,6067,246,,,182310,,,,,,,,,,26,685,26632,1274122,27317,1274122,28,0,cb6315fac6252d171352cd2623236d6bd0ed006d,0,0,0,0,0,
20200710,MI,75685,7390,1171120,,posNeg,1246805,505,,174,,92,,52841,A+,7/10/2020 00:00,2020-07-10T24:00:00Z,07/09 20:00,6285,,2020-07-10T24:00:00Z,1265344,94224,1171120,68295,6039,246,,,179789,,,,,,,,,,26,622,22630,1246805,23252,1246805,14,0,bea149efea69b9c5d2e03d9974889c4f6550852d,0,0,0,0,0,
20200709,MI,75063,7380,1148490,,posNeg,1223553,505,,174,,93,,52841,A+,7/9/2020 00:00,2020-07-09T24:00:00Z,07/08 20:00,6271,,2020-07-09T24:00:00Z,1241962,93472,1148490,67683,6024,247,,,177549,,,,,,,,,,26,512,23038,1223553,23550,1223553,9,0,7e787b4392d70b559924111f4d6ec23af7aa890d,0,0,0,0,0,
20200708,MI,74551,7314,1125452,,posNeg,1200003,505,,174,,93,,52841,A+,7/8/2020 00:00,2020-07-08T24:00:00Z,07/07 20:00,6262,,2020-07-08T24:00:00Z,1218053,92601,1125452,67237,6015,247,,,174840,,,,,,,,,,26,651,22841,1200003,23492,1200003,11,0,50785578df82e199b43c2d0083bcb1539ed29668,0,0,0,0,0,
20200707,MI,73900,7273,1102611,,posNeg,1176511,505,,174,,99,,52841,A+,7/7/2020 00:00,2020-07-07T24:00:00Z,07/06 20:00,6251,,2020-07-07T24:00:00Z,1194318,91707,1102611,66627,6005,246,,,173395,,,,,,,,,,26,631,16517,1176511,17148,1176511,30,0,1df614a9c3dfedcb5c8b2fcbfb3b5bc86b58bbcc,0,0,0,0,0,
20200706,MI,73269,7096,1086094,,posNeg,1159363,505,,174,,92,,52841,A+,7/6/2020 00:00,2020-07-06T24:00:00Z,07/05 20:00,6221,,2020-07-06T24:00:00Z,1177247,91153,1086094,66173,5975,246,,,172386,,,,,,,,,,26,328,12216,1159363,12544,1159363,3,0,d0b9cd286e017230b05b5726496ba9382b5fd152,0,0,0,0,0,
20200705,MI,72941,7065,1073878,,posNeg,1146819,548,,193,,92,,52841,A+,7/5/2020 00:00,2020-07-05T24:00:00Z,07/04 20:00,6218,,2020-07-05T24:00:00Z,1164666,90788,1073878,65876,5972,246,,,172203,,,,,,,,,,26,360,16305,1146819,16665,1146819,0,0,284a938a3ec3f994d61789214792917675cc52f8,0,0,0,0,0,
20200704,MI,72581,7048,1057573,,posNeg,1130154,548,,193,,92,,52841,A+,7/4/2020 00:00,2020-07-04T24:00:00Z,07/03 20:00,6218,,2020-07-04T24:00:00Z,1147836,90263,1057573,65533,5972,246,,,170893,,,,,,,,,,26,406,21483,1130154,21889,1130154,3,0,26f42764576e76480d36a289cd7ac54337947d15,0,0,0,0,0,
20200703,MI,72175,7040,1036090,,posNeg,1108265,548,,193,,92,,51099,A+,7/3/2020 00:00,2020-07-03T24:00:00Z,07/02 20:00,6215,,2020-07-03T24:00:00Z,1125738,89648,1036090,65135,5969,246,,,168588,,,,,,,,,,26,497,22631,1108265,23128,1108265,3,0,a6ab9e1e2984dd8973e25d385829db41b024bb6a,0,0,0,0,0,
20200702,MI,71678,7003,1013459,,posNeg,1085137,548,,193,,103,,51099,A+,7/2/2020 00:00,2020-07-02T24:00:00Z,07/01 20:00,6212,,2020-07-02T24:00:00Z,1102412,88953,1013459,64675,5966,246,,,165567,,,,,,,,,,26,589,22689,1085137,23278,1085137,14,0,844c9c343f2f6f78f571dc352f91b77b2ee34f6b,0,0,0,0,0,
20200701,MI,71089,6957,990770,,posNeg,1061859,471,,179,,103,,51099,A+,7/1/2020 00:00,2020-07-01T24:00:00Z,06/30 20:00,6198,,2020-07-01T24:00:00Z,1078989,88219,990770,64132,5951,247,,,162911,,,,,,,,,,26,361,16441,1061859,16802,1061859,5,0,ef6c054d30c8f5ad0a3fa03e40d172f13843d0ba,0,0,0,0,0,
20200630,MI,70728,6858,974329,,posNeg,1045057,471,,179,,98,,51099,A+,6/30/2020 00:00,2020-06-30T24:00:00Z,06/29 20:00,6193,,2020-06-30T24:00:00Z,1062116,87787,974329,63870,5947,246,,,160431,,,,,,,,,,26,505,15177,1045057,15682,1045057,32,0,d335a1df37f9aeea835768fb3f978cf2a94df534,0,0,0,0,0,
20200629,MI,70223,6726,959152,,posNeg,1029375,557,,193,,106,,51099,A+,6/29/2020 00:00,2020-06-29T24:00:00Z,06/28 20:00,6161,,2020-06-29T24:00:00Z,1046545,87393,959152,63497,5915,246,,,158486,,,,,,,,,,26,277,12419,1029375,12696,1029375,3,0,a59c7792ee46d805c667f670c5447b9aa4052377,0,0,0,0,0,
20200628,MI,69946,6685,946733,,posNeg,1016679,557,,193,,106,,51099,A+,6/28/2020 00:00,2020-06-28T24:00:00Z,06/27 20:00,6158,,2020-06-28T24:00:00Z,1033820,87087,946733,63261,5912,246,,,156996,,,,,,,,,,26,267,15591,1016679,15858,1016679,5,0,25cb2df49940e920e78c2f8c881481a65e47a619,0,0,0,0,0,
20200627,MI,69679,6670,931142,,posNeg,1000821,557,,193,,106,,51099,A+,6/27/2020 00:00,2020-06-27T24:00:00Z,06/26 20:00,6153,,2020-06-27T24:00:00Z,1017855,86713,931142,63009,5907,246,,,154909,,,,,,,,,,26,350,18765,1000821,19115,1000821,19,0,35fd9b1cdba4f375f9332a1c3d9d44e2df4f1132,0,0,0,0,0,
20200626,MI,69329,6634,912377,,posNeg,981706,557,,193,,106,,49290,A+,6/26/2020 00:00,2020-06-26T24:00:00Z,06/25 20:00,6134,,2020-06-26T24:00:00Z,998490,86113,912377,62695,5888,246,,,151973,,,,,,,,,,26,340,18527,981706,18867,981706,1,0,1c9738290f8f808f050f6ac2086e2564937ae346,0,0,0,0,0,
20200625,MI,68989,6683,893850,,posNeg,962839,557,,193,,115,,49290,A+,6/25/2020 00:00,2020-06-25T24:00:00Z,06/24 20:00,6133,,2020-06-25T24:00:00Z,979418,85568,893850,62306,5886,247,,,148912,,,,,,,,,,26,434,17600,962839,18034,962839,19,0,dd1bda46ee65dd078b446e442530e9e022d90ade,0,0,0,0,0,
20200624,MI,68555,6602,876250,,posNeg,944805,557,,209,,124,,49290,A+,6/24/2020 00:00,2020-06-24T24:00:00Z,06/23 20:00,6114,,2020-06-24T24:00:00Z,961368,85118,876250,61953,5868,246,,,146035,,,,,,,,,,26,358,15779,944805,16137,944805,5,0,680311a1fd29087b1af2f361b804926073af7ad1,0,0,0,0,0,
20200623,MI,68197,6567,860471,,posNeg,928668,557,,209,,99,,49290,A+,6/23/2020 00:00,2020-06-23T24:00:00Z,06/22 20:00,6109,,2020-06-23T24:00:00Z,945209,84738,860471,61630,5864,245,,,144088,,,,,,,,,,26,240,10411,928668,10651,928668,12,0,9cae313d81af7d8b110ca7c8ca4270a50becb2af,0,0,0,0,0,
20200622,MI,67957,6548,850060,,posNeg,918017,557,,209,,99,,49290,A+,6/21/2020 00:00,2020-06-21T24:00:00Z,06/20 20:00,6097,,2020-06-21T24:00:00Z,934545,84485,850060,61409,5853,244,,,143099,,,,,,,,,,26,246,10345,918017,10591,918017,7,0,8c9970edf5defd6883a904cc54e097d29b229f3f,0,0,0,0,0,
20200621,MI,67711,6481,839715,,posNeg,907426,557,,209,,99,,49290,A+,6/21/2020 00:00,2020-06-21T24:00:00Z,06/20 20:00,6090,,2020-06-21T24:00:00Z,923961,84246,839715,61230,5846,244,,,141941,,,,,,,,,,26,166,12626,907426,12792,907426,3,0,1b1b085aaff7dd49f6895d27a0aff584536e130a,0,0,0,0,0,
20200620,MI,67545,6461,827089,,posNeg,894634,557,,209,,99,,49290,A+,6/20/2020 00:00,2020-06-20T24:00:00Z,06/19 20:00,6087,,2020-06-20T24:00:00Z,911028,83939,827089,61084,5843,244,,,140185,,,,,,,,,,26,448,14258,894634,14706,894634,20,0,efee0fa4bc377dac1f16f0d0c385a74ac3d2944f,0,0,0,0,0,
20200619,MI,67097,6268,812831,,posNeg,879928,557,,209,,99,,44964,A+,6/19/2020 00:00,2020-06-19T24:00:00Z,06/18 20:00,6067,,2020-06-19T24:00:00Z,896382,83551,812831,60829,5823,244,,,137858,,,,,,,,,,26,299,29443,879928,29742,879928,6,0,4259c5fc7e8b44c7a611d49cbbe4289414c6a61d,0,0,0,0,0,
20200618,MI,66798,6180,783388,,posNeg,850186,557,,209,,101,,44964,A+,6/18/2020 00:00,2020-06-18T24:00:00Z,06/17 20:00,6061,,2020-06-18T24:00:00Z,866277,82889,783388,60618,5818,243,,,132227,,,,,,,,,,26,301,0,850186,301,850186,25,0,b07898f6e356ff7f44319a3c3df6ffeb3e5d5524,0,0,0,0,0,
20200617,MI,66497,6104,783388,,posNeg,849885,562,,210,,131,,44964,A+,6/17/2020 00:00,2020-06-17T24:00:00Z,06/16 20:00,6036,,2020-06-17T24:00:00Z,866277,82889,783388,60393,5792,244,,,132227,,,,,,,,,,26,228,14123,849885,14351,849885,2,0,e3aedbe1983241e344873d333ce01243872498e9,0,0,0,0,0,
20200616,MI,66269,6080,769265,,posNeg,835534,562,,210,,131,,44964,A+,6/16/2020 00:00,2020-06-16T24:00:00Z,06/15 20:00,6034,,2020-06-16T24:00:00Z,851830,82565,769265,60189,5790,244,,,130254,,,,,,,,,,26,184,11313,835534,11497,835534,17,0,781cc0a5d016535f3095e940ff3c81a5584b37c0,0,0,0,0,0,
20200615,MI,66085,6021,757952,,posNeg,824037,562,,210,,139,,44964,A+,6/15/2020 00:00,2020-06-15T24:00:00Z,06/14 20:00,6017,,2020-06-15T24:00:00Z,839866,82274,757952,60064,5772,245,,,128657,,,,,,,,,,26,31,10508,824037,10539,824037,1,0,168f4b6622ed09908fa2ce070b270eb0840952e4,0,0,0,0,0,
20200614,MI,66054,6064,747444,,posNeg,813498,636,,253,,139,,44964,A+,6/14/2020 00:00,2020-06-14T24:00:00Z,06/13 20:00,6016,,2020-06-14T24:00:00Z,829523,82079,747444,59990,5771,245,,,127842,,,,,,,,,,26,218,13797,813498,14015,813498,3,0,85ac6298b07e1933dcac031f2ef38f14ee5bdeb8,0,0,0,0,0,
20200613,MI,65836,6035,733647,,posNeg,799483,636,,253,,139,,44964,A+,6/13/2020 00:00,2020-06-13T24:00:00Z,06/12 20:00,6013,,2020-06-13T24:00:00Z,815374,81727,733647,59801,5768,245,,,125950,,,,,,,,,,26,164,13032,799483,13196,799483,23,0,e39dd7104ef5553c61213f5a71e2eb43787fa806,0,0,0,0,0,
20200612,MI,65672,6051,720615,,posNeg,786287,636,,253,,139,,42041,A+,6/12/2020 00:00,2020-06-12T24:00:00Z,06/11 20:00,5990,,2020-06-12T24:00:00Z,802036,81421,720615,59621,5745,245,,,122843,,,,,,,,,,26,223,15544,786287,15767,786287,5,0,3154c6f1c8f597b6f199c88d57f8d5dc71abe02d,0,0,0,0,0,
20200611,MI,65449,5953,705071,,posNeg,770520,661,,249,,150,,42041,A+,6/11/2020 00:00,2020-06-11T24:00:00Z,06/10 20:00,5985,,2020-06-11T24:00:00Z,786154,81083,705071,59496,5738,247,,,120796,,,,,,,,,,26,267,14202,770520,14469,770520,33,0,06ed51e98de7844f1c1c86a0b3b49c340a35d014,0,0,0,0,0,
20200610,MI,65182,5904,690869,,posNeg,756051,661,,249,,150,,42041,A+,6/10/2020 00:00,2020-06-10T24:00:00Z,06/09 20:00,5952,,2020-06-10T24:00:00Z,771552,80683,690869,59278,5708,244,,,116586,,,,,,,,,,26,15,0,756051,15,756051,1,0,9f780ff7490593382e890194fcfad710214ebb83,0,0,0,0,0,
20200609,MI,65167,5902,690869,,posNeg,756036,661,,249,,150,,42041,A+,6/9/2020 00:00,2020-06-09T24:00:00Z,06/08 20:00,5951,,2020-06-09T24:00:00Z,771552,80683,690869,59265,5708,244,,,116586,,,,,,,,,,26,63,16809,756036,16872,756036,9,0,b97aa88390504881f5b972aa2c9edc5437ab3916,0,0,0,0,0,
20200608,MI,65104,5893,674060,,posNeg,739164,661,,249,,191,,42041,A+,6/8/2020 00:00,2020-06-08T24:00:00Z,06/07 20:00,5942,,2020-06-08T24:00:00Z,754408,80348,674060,59211,5707,244,,,114914,,,,,,,,,,26,135,12804,739164,12939,739164,15,0,b1ddcd14e60732bb5b73952ea05f1a5a406566ac,0,0,0,0,0,
20200607,MI,64969,5862,661256,,posNeg,726225,864,,315,,191,,42041,A+,6/7/2020 00:00,2020-06-07T24:00:00Z,06/06 20:00,5927,,2020-06-07T24:00:00Z,741368,80112,661256,59107,5698,244,,,113451,,,,,,,,,,26,55,10314,726225,10369,726225,11,0,611c46eb7504ecd6fc6941a0da399bd470192f83,0,0,0,0,0,
20200606,MI,64914,5841,650942,,posNeg,715856,864,,315,,191,,42041,A+,6/6/2020 00:00,2020-06-06T24:00:00Z,06/05 20:00,5916,,2020-06-06T24:00:00Z,730837,79895,650942,59073,5683,244,,,111125,,,,,,,,,,26,93,10492,715856,10585,715856,7,0,11c551ee6eb86a2b673e85a7886da1edbdc9b6ea,0,0,0,0,0,
20200605,MI,64821,5820,640450,,posNeg,705271,617,,321,,205,,38099,A+,6/5/2020 00:00,2020-06-05T24:00:00Z,06/04 20:00,5909,,2020-06-05T24:00:00Z,720088,79638,640450,59001,5672,244,,,104273,,,,,,,,,,26,205,12543,705271,12748,705271,8,0,0c79725182e64d5bb202e613e741ad52a306a2b7,0,0,0,0,0,
20200604,MI,64616,5738,627907,,posNeg,692523,617,,321,,205,,38099,A+,6/4/2020 11:00,2020-06-04T11:00:00Z,06/04 07:00,5901,,2020-06-04T11:00:00Z,707130,79223,627907,58878,5665,244,,,101172,,,,,,,,,,26,234,14734,692523,14968,692523,17,0,7fd18bff77704614d63b54213f560b2067b644e8,0,0,0,0,0,
20200603,MI,64382,5622,613173,,posNeg,677555,646,,328,,224,,38099,A+,6/3/2020 11:00,2020-06-03T11:00:00Z,06/03 07:00,5884,,2020-06-03T11:00:00Z,692016,78843,613173,58760,5657,243,,,98953,,,,,,,,,,26,279,16101,677555,16380,677555,15,0,e0d5b2e3c0d1403f6761450cf81875477c367d2d,0,0,0,0,0,
20200602,MI,64103,5509,597072,,posNeg,661175,674,,346,,240,,38099,A+,6/2/2020 11:00,2020-06-02T11:00:00Z,06/02 07:00,5869,,2020-06-02T11:00:00Z,675320,78248,597072,58594,5641,242,,,97108,,,,,,,,,,26,290,15648,661175,15938,661175,26,0,19a8aa2fd976039e71608f583eb17c683bbc6ea9,0,0,0,0,0,
20200601,MI,63813,5396,581424,,posNeg,645237,674,,346,,240,,38099,A+,6/1/2020 11:00,2020-06-01T11:00:00Z,06/01 07:00,5843,,2020-06-01T11:00:00Z,659153,77729,581424,58417,5627,242,,,67783,,,,,,,,,,26,245,14232,645237,14477,645237,25,0,ffdeeb93d1d9bf7c5ce7877798fa83abdef7074e,0,0,0,0,0,
20200531,MI,63568,5314,567192,,posNeg,630760,774,,371,,250,,38099,A+,5/31/2020 11:00,2020-05-31T11:00:00Z,05/31 07:00,5818,,2020-05-31T11:00:00Z,644519,77327,567192,58254,5601,240,,,67783,,,,,,,,,,26,247,12683,630760,12930,630760,16,0,d4bad792e8d4615806e97c9043d5aeac55b4fa1c,0,0,0,0,0,
20200530,MI,63321,5256,554509,,posNeg,617830,774,,371,,250,,38099,A+,5/30/2020 11:00,2020-05-30T11:00:00Z,05/30 07:00,5802,,2020-05-30T11:00:00Z,631367,76858,554509,58065,5578,240,,,67783,,,,,,,,,,26,205,15641,617830,15846,617830,24,0,708c5f641242103bbed2410bb4bf2869c8003667,0,0,0,0,0,
20200529,MI,63116,5212,538868,,posNeg,601984,774,,371,,250,,33168,A+,5/29/2020 00:00,2020-05-29T24:00:00Z,05/28 20:00,5778,,2020-05-29T24:00:00Z,615138,76270,538868,57904,5562,240,,,67783,,,,,,,,,,26,319,16205,601984,16524,601984,27,0,f2bafe74eb2299cf5155ac695ba694c461ee2459,0,0,0,0,0,
20200528,MI,62797,5102,522663,,posNeg,585460,860,,405,,251,,33168,A+,5/28/2020 11:00,2020-05-28T11:00:00Z,05/28 07:00,5751,,2020-05-28T11:00:00Z,597828,75165,522663,57695,5538,240,,,67783,,,,,,,,,,26,336,17054,585460,17390,585460,24,0,facc7e58b53bda7bc37419093f2a1ba12a071423,0,0,0,0,0,
20200527,MI,62461,4984,505609,,posNeg,568070,882,,388,,272,,33168,A+,5/27/2020 11:00,2020-05-27T11:00:00Z,05/27 07:00,5727,,2020-05-27T11:00:00Z,579682,74073,505609,57477,5511,240,,,67783,,,,,,,,,,26,386,17703,568070,18089,568070,24,0,9e187a315682ce3c7b8d1b0bdce248678cadc915,0,0,0,0,0,
20200526,MI,62075,4870,487906,,posNeg,549981,953,,449,,319,,33168,A+,5/26/2020 11:00,2020-05-26T11:00:00Z,05/26 07:00,5703,,2020-05-26T11:00:00Z,561095,73189,487906,57205,5487,240,,,67783,,,,,,,,,,26,443,11581,549981,12024,549981,25,0,8cedfc8f8cb3496dd4195c16a1bfcf5dbcc1a0a8,0,0,0,0,0,
20200525,MI,61632,4740,476325,,posNeg,537957,953,,449,,319,,33168,A+,5/25/2020 11:00,2020-05-25T11:00:00Z,05/25 07:00,5678,,2020-05-25T11:00:00Z,549107,72782,476325,56892,5463,238,,,67783,,,,,,,,,,26,175,9238,537957,9413,537957,38,0,7867f4e3eaaaf3bc2ab80798d3de0e466a5cfaa5,0,0,0,0,0,
20200524,MI,61457,4716,467087,,posNeg,528544,953,,449,,319,,33168,A+,5/24/2020 11:00,2020-05-24T11:00:00Z,05/24 07:00,5640,,2020-05-24T11:00:00Z,539550,72463,467087,56741,5440,238,,,61973,,,,,,,,,,26,164,11531,528544,11695,528544,28,0,85c79b1353eac9b24d8300eac6a82f5355c0e066,0,0,0,0,0,
20200523,MI,61293,4681,455556,,posNeg,516849,953,,449,,319,,33168,A+,5/22/2020 11:00,2020-05-22T11:00:00Z,05/22 07:00,5612,,2020-05-22T11:00:00Z,527621,72065,455556,56612,5402,237,,,61973,,,,,,,,,,26,218,14274,516849,14492,516849,26,0,58c2c099fbff73f9238d020d41ef09e4e23f9916,0,0,0,0,0,
20200522,MI,61075,4630,441282,,posNeg,502357,955,,470,,348,,28234,A+,5/22/2020 11:00,2020-05-22T11:00:00Z,05/22 07:00,5586,,2020-05-22T11:00:00Z,512752,71470,441282,56445,5375,237,,,,,,,,,,,,,26,465,19494,502357,19959,502357,31,0,5cd02b798236bdba4ae85d9f6044be2a202442cb,0,0,0,0,0,
20200521,MI,60610,4478,421788,,posNeg,482398,1054,,472,,361,,28234,A+,5/21/2020 11:00,2020-05-21T11:00:00Z,05/21 07:00,5555,,2020-05-21T11:00:00Z,492412,70624,421788,56132,5349,237,,,,,,,,,,,,,26,459,15940,482398,16399,482398,41,0,7df63060f5b931235dc3e511d158a949698666b7,0,0,0,0,0,
20200520,MI,60151,4313,405848,,posNeg,465999,1066,,492,,332,,28234,A+,5/20/2020 11:00,2020-05-20T11:00:00Z,05/20 07:00,5514,,2020-05-20T11:00:00Z,475714,69866,405848,55838,5318,236,,,,,,,,,,,,,26,575,13640,465999,14215,465999,44,0,271b7aa45e388a8fcdc41bdf9b02d84f5b57146b,0,0,0,0,0,
20200519,MI,59576,4115,392208,,posNeg,451784,1079,,486,,351,,28234,A+,5/19/2020 11:00,2020-05-19T11:00:00Z,05/19 07:00,5470,,2020-05-19T11:00:00Z,461365,69157,392208,55461,5278,233,,,,,,,,,,,,,26,764,16093,451784,16857,451784,43,0,c0c268a94630d49843e791c7f685173099235e10,0,0,0,0,0,
20200518,MI,58812,3940,376115,,posNeg,434927,1075,,473,,418,,28234,A+,5/18/2020 11:00,2020-05-18T11:00:00Z,05/18 07:00,5427,,2020-05-18T11:00:00Z,444305,68190,376115,54872,5237,233,,,,,,,,,,,,,26,534,12567,434927,13101,434927,31,0,db62b21cc77d9740e765a89d5a58bcfa1ed69536,0,0,0,0,0,
20200517,MI,58278,3821,363548,,posNeg,421826,1114,,488,,434,,28234,A+,5/16/2020 11:00,2020-05-16T11:00:00Z,05/16 07:00,5396,,2020-05-16T11:00:00Z,430802,67254,363548,54457,5194,233,,,,,,,,,,,,,26,255,10392,421826,10647,421826,39,0,2aba25523f6cfdc1f7597024650a9ca4c29af43b,0,0,0,0,0,
20200516,MI,58023,3777,353156,,posNeg,411179,1256,,532,,440,,28234,A+,5/16/2020 11:00,2020-05-16T11:00:00Z,05/16 07:00,5357,,2020-05-16T11:00:00Z,419366,66210,353156,54246,5163,233,,,,,,,,,,,,,26,336,11329,411179,11665,411179,32,0,99e22a133af7eda326edb01781ebf31c6b981fb3,0,0,0,0,0,
20200515,MI,57687,3731,341827,,posNeg,399514,1256,,532,,440,,22686,A+,5/14/2020 11:00,2020-05-14T11:00:00Z,05/14 07:00,5325,,2020-05-14T11:00:00Z,407180,65353,341827,53956,5124,233,,,,,,,,,,,,,26,651,15170,399514,15821,399514,47,0,1ddfbb7460a68f394cfd797c7c1968e83c9445ae,0,0,0,0,0,
20200514,MI,57036,3585,326657,,posNeg,383693,1330,,653,,515,,22686,A+,5/14/2020 11:00,2020-05-14T11:00:00Z,05/14 07:00,5278,,2020-05-14T11:00:00Z,391176,64519,326657,53451,5092,232,,,,,,,,,,,,,26,578,16415,383693,16993,383693,46,0,bd9dfda1d823dbfd13bf5bacf9cfb4bc2eca09b0,0,0,0,0,0,
20200513,MI,56458,3428,310242,,posNeg,366700,1384,,693,,525,,22686,A+,5/13/2020 11:00,2020-05-13T11:00:00Z,05/13 07:00,5232,,2020-05-13T11:00:00Z,373484,63242,310242,53030,5046,231,,,,,,,,,,,,,26,817,18541,366700,19358,366700,44,0,2b7a96e4bb63f4dfdd58091d696294dd080eaed9,0,0,0,0,0,
20200512,MI,55641,3242,291701,,posNeg,347342,1384,,693,,525,,22686,A+,5/12/2020 11:00,2020-05-12T11:00:00Z,05/12 07:00,5188,,2020-05-12T11:00:00Z,353909,62208,291701,52399,5001,230,,,,,,,,,,,,,26,1637,13408,347342,15045,347342,49,0,c1251597a7e0255a75e956fef2952542f2a81e1e,0,0,0,0,0,
20200511,MI,54004,3079,278293,,posNeg,332297,1424,,685,,557,,22686,A+,5/11/2020 11:00,2020-05-11T11:00:00Z,05/11 07:00,5139,,2020-05-11T11:00:00Z,339843,61550,278293,50925,4958,228,,,,,,,,,,,,,26,971,10876,332297,11847,332297,58,0,87038e0db8260d80b4922e7249393a69284d0827,0,0,0,0,0,
20200510,MI,53033,2904,267417,,posNeg,320450,1437,,674,,536,,22686,A+,5/10/2020 11:00,2020-05-10T11:00:00Z,05/10 07:00,5081,,2020-05-10T11:00:00Z,328334,60917,267417,50129,4911,228,,,,,,,,,,,,,26,301,8152,320450,8453,320450,45,0,3958b81d1b630d94c5d0afde816d350e60205c59,0,0,0,0,0,
20200509,MI,52732,2861,259265,,posNeg,311997,1531,,683,,539,,22686,A+,5/9/2020 11:00,2020-05-09T11:00:00Z,05/09 07:00,5036,,2020-05-09T11:00:00Z,319680,60415,259265,49871,4853,227,,,,,,,,,,,,,26,383,11123,311997,11506,311997,49,0,a68dbe3371588b4487143d01770a3b0a31497e12,0,0,0,0,0,
20200508,MI,52349,2784,248142,,posNeg,300491,1637,,725,,570,,15659,A+,5/8/2020 11:00,2020-05-08T11:00:00Z,05/08 07:00,4987,,2020-05-08T11:00:00Z,307801,59659,248142,49565,4809,215,,,,,,,,,,,,,26,618,11958,300491,12576,300491,62,0,01dbe0b6162957983c982bb9535ae609b8c530c8,0,0,0,0,0,
20200507,MI,51731,2667,236184,,posNeg,287915,1697,,753,,612,,15659,A+,5/7/2020 11:00,2020-05-07T11:00:00Z,05/07 07:00,4925,,2020-05-07T11:00:00Z,295016,58832,236184,49064,4772,211,,,,,,,,,,,,,26,600,11621,287915,12221,287915,86,0,d383ff37eebed3dec13053417feae0088aa56bfd,0,0,0,0,0,
20200506,MI,51131,2559,224563,,posNeg,275694,1818,,794,,617,,15659,A+,5/6/2020 11:00,2020-05-06T11:00:00Z,05/06 07:00,4839,,2020-05-06T11:00:00Z,282451,57888,224563,48572,4714,209,,,,,,,,,,,,,26,634,11472,275694,12106,275694,58,0,b663795d9f018fc356de9a6b86f00579b9951813,0,0,0,0,0,
20200505,MI,50497,2463,213091,,posNeg,263588,1948,,839,,670,,15659,A+,5/5/2020 11:00,2020-05-05T11:00:00Z,05/05 07:00,4781,,2020-05-05T11:00:00Z,269955,56864,213091,48034,4630,208,,,,,,,,,,,,,26,688,10420,263588,11108,263588,59,0,a214c7390df7178ef18670f711712b8f9ac23098,0,0,0,0,0,
20200504,MI,49809,2358,202671,,posNeg,252480,1948,,839,,670,,15659,A+,5/3/2020 11:00,2020-05-03T11:00:00Z,05/03 07:00,4722,,2020-05-03T11:00:00Z,258536,55865,202671,47451,4573,206,,,,,,,,,,,,,26,780,7310,252480,8090,252480,81,0,49d4870c98c86afb1cd82514ab8b984d11169dec,0,0,0,0,0,
20200503,MI,49029,2246,195361,,posNeg,244390,2100,,850,,713,,15659,A+,5/3/2020 11:00,2020-05-03T11:00:00Z,05/03 07:00,4641,,2020-05-03T11:00:00Z,250589,55228,195361,46783,4516,205,,,,,,,,,,,,,26,357,6648,244390,7005,244390,62,0,9cef101bd05f3ce91dbd3e000dc8ff297484b433,0,0,0,0,0,
20200502,MI,48672,2217,188713,,posNeg,237385,2100,,850,,713,,15659,A+,5/2/2020 11:00,2020-05-02T11:00:00Z,05/02 07:00,4579,,2020-05-02T11:00:00Z,243366,54653,188713,46455,4436,203,,,,,,,,,,,,,26,432,9906,237385,10338,237385,59,0,4eaec63dc448e018f16a09d3fee576e1be8735b2,0,0,0,0,0,
20200501,MI,48240,2168,178807,,posNeg,227047,2319,,966,,760,,8342,A+,5/1/2020 11:00,2020-05-01T11:00:00Z,05/01 07:00,4520,,2020-05-01T11:00:00Z,232528,53721,178807,46072,4376,203,,,,,,,,,,,,,26,735,9863,227047,10598,227047,86,0,a1317815a702d2233463a41b752bfe6420b02040,0,0,0,0,0,
20200430,MI,47505,2099,168944,,posNeg,216449,2319,,966,,760,,8342,A+,4/30/2020 11:00,2020-04-30T11:00:00Z,04/30 07:00,4434,,2020-04-30T11:00:00Z,221578,52634,168944,45406,4317,202,,,,,,,,,,,,,26,1017,10571,216449,11588,216449,99,0,b72244a4f32d4b0dd0b1d91f0468f641e31bead8,0,0,0,0,0,
20200429,MI,46488,1980,158373,,posNeg,204861,2498,,997,,778,,8342,A+,4/29/2020 11:00,2020-04-29T11:00:00Z,04/29 07:00,4335,,2020-04-29T11:00:00Z,209855,51482,158373,44508,4232,199,,,,,,,,,,,,,26,950,9463,204861,10413,204861,88,0,3dd3d5337af5e0090763b5f6569d50331b98786c,0,0,0,0,0,
20200428,MI,45538,1904,148910,,posNeg,194448,2623,,1027,,801,,8342,A+,4/28/2020 11:00,2020-04-28T11:00:00Z,04/28 07:00,4247,,2020-04-28T11:00:00Z,199206,50296,148910,43634,4136,198,,,,,,,,,,,,,26,829,7938,194448,8767,194448,99,0,3dfd8c039869922cc7a886629761d86bd97560dc,0,0,0,0,0,
20200427,MI,44709,1824,140972,,posNeg,185681,2667,,1059,,832,,8342,A+,4/27/2020 11:00,2020-04-27T11:00:00Z,04/27 07:00,4148,,2020-04-27T11:00:00Z,190156,49184,140972,42885,4049,191,,,,,,,,,,,,,26,920,6541,185681,7461,185681,112,0,23e443a52f288af271e99ac65ec9b055e46f4a91,0,0,0,0,0,
20200426,MI,43789,1762,134431,,posNeg,178220,2757,,1099,,871,,8342,A+,4/26/2020 11:00,2020-04-26T11:00:00Z,04/26 07:00,4036,,2020-04-26T11:00:00Z,182757,48326,134431,42027,3957,190,,,,,,,,,,,,,26,526,5476,178220,6002,178220,107,0,ec882c5c72193a9d3f7509461c30b2f9e771c662,0,0,0,0,0,
20200425,MI,43263,1715,128955,,posNeg,172218,2889,,1164,,934,,8342,A+,4/25/2020 11:00,2020-04-25T11:00:00Z,04/25 07:00,3929,,2020-04-25T11:00:00Z,176663,47708,128955,41548,3846,184,,,,,,,,,,,,,26,533,5901,172218,6434,172218,111,0,cb47764ef0707aa11f5fbaf45b3e08e17d1b8cdc,0,0,0,0,0,
20200424,MI,42730,1664,123054,,posNeg,165784,3022,,1176,,965,,3237,B,4/24/2020 11:00,2020-04-24T11:00:00Z,04/24 07:00,3818,,2020-04-24T11:00:00Z,169942,46888,123054,41066,3745,182,,,,,,,,,,,,,26,1036,8049,165784,9085,165784,107,0,704a751c8605c90132ff6cf1f2a8d99a9fbf6de1,0,0,0,0,0,
20200423,MI,41694,1549,115005,,posNeg,156699,3611,,1148,,1027,,3237,B,4/23/2020 16:00,2020-04-23T16:00:00Z,04/23 12:00,3711,,2020-04-23T16:00:00Z,160853,45848,115005,40145,3636,180,,,,,,,,,,,,,26,989,8352,156699,9341,156699,109,0,306cf3bc80d0d352efa7dd5493753bbb0614425e,0,0,0,0,0,
20200422,MI,40705,1438,106653,,posNeg,147358,3305,,1350,,1065,,3237,B,4/22/2020 11:00,2020-04-22T11:00:00Z,04/22 07:00,3602,,2020-04-22T11:00:00Z,151154,44501,106653,39267,3531,174,,,,,,,,,,,,,26,1116,6986,147358,8102,147358,131,0,e7794274ba2961bd73f815d3145c4e3dd2057c23,0,0,0,0,0,
20200421,MI,39589,1381,99667,,posNeg,139256,3357,,1346,,1107,,3237,B,4/21/2020 11:00,2020-04-21T11:00:00Z,04/21 07:00,3471,,2020-04-21T11:00:00Z,142813,43146,99667,38208,3428,171,,,,,,,,,,,,,26,1095,6274,139256,7369,139256,124,0,ff9154a73aea5ed7b42039fdd41d7f8c5ff90ff7,0,0,0,0,0,
20200420,MI,38494,1324,93393,,posNeg,131887,3374,,1346,,1102,,3237,B,4/20/2020 11:00,2020-04-20T11:00:00Z,04/20 07:00,3347,,2020-04-20T11:00:00Z,135204,41811,93393,37170,3300,169,,,,,,,,,,,,,26,937,3635,131887,4572,131887,111,0,df7d91dea336d23a6e013abddbadeddc61261211,0,0,0,0,0,
20200419,MI,37557,1264,89758,,posNeg,127315,3403,,1344,,1115,,3237,B,4/19/2020 11:00,2020-04-19T11:00:00Z,04/19 07:00,3236,,2020-04-19T11:00:00Z,130677,40919,89758,36293,3178,160,,,,,,,,,,,,,26,528,2644,127315,3172,127315,129,0,f5de9c6488bf1e39a481ce0b22874b119863930f,0,0,0,0,0,
20200418,MI,37029,1240,87114,,posNeg,124143,3634,,1423,,1203,,3237,B,4/18/2020 11:00,2020-04-18T11:00:00Z,04/18 07:00,3107,,2020-04-18T11:00:00Z,127391,40277,87114,35789,3076,152,,,,,,,,,,,,,26,709,3846,124143,4555,124143,123,0,ea4720760017c0ac8b06361f2e007d4648cecc92,0,0,0,0,0,
20200417,MI,36320,1202,83268,,posNeg,119588,3674,,1428,,1167,,629,B,4/17/2020 11:00,2020-04-17T11:00:00Z,04/17 07:00,2984,,2020-04-17T11:00:00Z,122507,39239,83268,35118,2955,148,,,,,,,,,,,,,26,865,4994,119588,5859,119588,143,0,24e9075d86fede38dacb88c647dba516b84a5d1f,0,0,0,0,0,
20200416,MI,35455,1157,78274,,posNeg,113729,3809,,1447,,1211,,617,B,4/16/2020 11:00,2020-04-16T11:00:00Z,04/16 07:00,2841,,2020-04-16T11:00:00Z,116440,38166,78274,34298,2836,140,,,,,,,,,,,,,26,922,4446,113729,5368,113729,169,0,3983ce423e26673b0079833926315b04b8aeb73a,0,0,0,0,0,
20200415,MI,34533,1085,73828,,posNeg,108361,3918,,1468,,1212,,452,B,4/15/2020 11:00,2020-04-15T11:00:00Z,04/15 07:00,2672,,2020-04-15T11:00:00Z,110766,36938,73828,33448,2701,135,,,,,,,,,,,,,26,920,3153,108361,4073,108361,140,0,b564c8026f42b37669d1de6490980ebf43c31b87,0,0,0,0,0,
20200414,MI,33613,1041,70675,,posNeg,104288,3910,,1497,,1235,,452,B,4/14/2020 11:00,2020-04-14T11:00:00Z,04/14 07:00,2532,,2020-04-14T11:00:00Z,106183,35508,70675,32572,2537,131,,,,,,,,,,,,,26,911,3612,104288,4523,104288,141,0,fe3929762c23ec1275de3aecdc985aa3e7985946,0,0,0,0,0,
20200413,MI,32702,987,67063,,posNeg,99765,3986,,1570,,1365,,447,B,4/13/2020 11:00,2020-04-13T11:00:00Z,04/13 07:00,2391,,2020-04-13T11:00:00Z,101183,34120,67063,31715,2401,122,,,,,,,,,,,,,26,1036,2508,99765,3544,99765,142,0,20c03b735f1a542b7f677f2dcf8261ce5d90acdb,0,0,0,0,0,
20200412,MI,31666,939,64555,,posNeg,96221,3636,,1582,,1441,,433,B,4/12/2020 11:00,2020-04-12T11:00:00Z,04/12 07:00,2249,,2020-04-12T11:00:00Z,97593,33038,64555,30727,2269,113,,,,,,,,,,,,,26,686,2314,96221,3000,96221,168,0,035c8ea646e01d265d3fcbd66fac2ef349bcc26b,0,0,0,0,0,
20200411,MI,30980,895,62241,,posNeg,93221,3636,,1582,,1441,,595,B,4/11/2020 11:00,2020-04-11T11:00:00Z,04/11 07:00,2081,,2020-04-11T11:00:00Z,94307,32066,62241,30085,2136,103,,,,,,,,,,,,,26,808,2644,93221,3452,93221,164,0,cb6a34bd1660380bc67c5ebf85b17b6ed7c98fdf,0,0,0,0,0,
20200410,MI,30172,845,59597,,posNeg,89769,3823,,1663,,1394,,56,B,4/10/2020 11:00,2020-04-10T11:00:00Z,04/10 07:00,1917,,2020-04-10T11:00:00Z,90552,30955,59597,29327,1978,95,,,,,,,,,,,,,26,1076,3167,89769,4243,89769,161,0,ed1ef113d34b838e5a51c6d874b0a94f3cd3cdb2,0,0,0,0,0,
20200409,MI,29096,793,56430,,posNeg,85526,3826,,1628,,1434,,56,B,4/9/2020 11:00,2020-04-09T11:00:00Z,04/09 07:00,1756,,2020-04-09T11:00:00Z,85972,29542,56430,28303,1822,88,,,,,,,,,,,,,26,1032,3254,85526,4286,85526,156,0,582497f36c1552af5575ffd5276b6f4186e3e5da,0,0,0,0,0,
20200408,MI,28064,730,53176,,posNeg,81240,,,,,,,56,B,4/8/2020 11:00,2020-04-08T11:00:00Z,04/08 07:00,1600,,2020-04-08T11:00:00Z,81186,28010,53176,27334,1668,78,,,,,,,,,,,,,26,1100,2832,81240,3932,81240,151,0,206566c24b0d81940e432b3c8b0d81aa9dee7feb,0,0,0,0,0,
20200407,MI,26964,674,50344,,posNeg,77308,,,,,,,56,B,4/7/2020 11:00,2020-04-07T11:00:00Z,04/07 07:00,1449,,2020-04-07T11:00:00Z,77133,26789,50344,26290,1522,72,,,,,,,,,,,,,26,1179,3082,77308,4261,77308,158,0,3a469b996eb7ead12f181db77bb8a7a45a21f6be,0,0,0,0,0,
20200406,MI,25785,599,47262,,posNeg,73047,,,,,,,56,B,4/6/2020 11:00,2020-04-06T11:00:00Z,04/06 07:00,1291,,2020-04-06T11:00:00Z,72281,25019,47262,25186,1377,66,,,,,,,,,,,,,26,1327,3108,73047,4435,73047,141,0,cccfd9330312a872e5eb84d0fc29f1899b8bafda,0,0,0,0,0,
20200405,MI,24458,550,44154,,posNeg,68612,,,,,,,56,B,4/5/2020 11:00,2020-04-05T11:00:00Z,04/05 07:00,1150,,2020-04-05T11:00:00Z,67055,22901,44154,23908,1225,58,,,,,,,,,,,,,26,877,2949,68612,3826,68612,120,0,f02a7f14cac06ff943a0a8495fcaa2444ffd5852,0,0,0,0,0,
20200404,MI,23581,510,41205,,posNeg,64786,,,,,,,56,B,4/4/2020 11:00,2020-04-04T11:00:00Z,04/04 07:00,1030,,2020-04-04T11:00:00Z,62205,21000,41205,23071,1092,45,,,,,,,,,,,,,26,1002,4145,64786,5147,64786,112,0,12f4ddaf7249a0ac43f57d7b01e7e0c8d20659ab,0,0,0,0,0,
20200403,MI,22579,477,37060,,posNeg,59639,,,,,,,56,B,4/3/2020 11:00,2020-04-03T11:00:00Z,04/03 07:00,918,,2020-04-03T11:00:00Z,55096,18036,37060,22102,985,39,,,,,,,,,,,,,26,1203,3617,59639,4820,59639,117,0,13c707d9b53705a4e59b8b1a4de933614db5c80f,0,0,0,0,0,
20200402,MI,21376,439,33443,,posNeg,54819,,,,,,,,B,4/2/2020 11:00,2020-04-02T11:00:00Z,04/02 07:00,801,,2020-04-02T11:00:00Z,49095,15652,33443,20937,879,36,,,,,,,,,,,,,26,1130,3492,54819,4622,54819,125,0,1a8f8e16821d3a7f329cb12bf4e5046aa556b81a,0,0,0,0,0,
20200401,MI,20246,402,29951,,posNeg,50197,,,,,,,,B,4/1/2020 16:00,2020-04-01T16:00:00Z,04/01 12:00,676,,2020-04-01T16:00:00Z,43188,13237,29951,19844,765,35,,,,,,,,,,,,,26,1592,3617,50197,5209,50197,125,0,f535cbe785749be2d9975f2e12c3eb172a4fa937,0,0,0,0,0,
20200331,MI,18654,336,26334,,posNeg,44988,,,,,,,,B,3/31/2020 11:00,2020-03-31T11:00:00Z,03/31 07:00,551,,2020-03-31T11:00:00Z,37055,10721,26334,18318,641,33,,,,,,,,,,,,,26,1291,3071,44988,4362,44988,114,0,883aa5a3a24dc2cdfb2c7e144eda5c2f93efc9c4,0,0,0,0,0,
20200330,MI,17363,305,23263,,posNeg,40626,,,,,,,,B,3/30/2020 16:00,2020-03-30T16:00:00Z,03/30 12:00,437,,2020-03-30T16:00:00Z,32172,8909,23263,17058,518,29,,,,,,,,,,,,,26,1579,5846,40626,7425,40626,86,0,bd190d61686795394b49abb8e7e677df362cb27a,0,0,0,0,0,
20200329,MI,15784,265,17417,,posNeg,33201,,,,,,,,B,3/28/2020 14:00,2020-03-28T14:00:00Z,03/28 10:00,351,,2020-03-28T14:00:00Z,24312,6895,17417,15519,408,25,,,,,,,,,,,,,26,919,1515,33201,2434,33201,68,0,fb0d4873a81038d4b9d7017ffb799e872e98ff1e,0,0,0,0,0,
20200328,MI,14865,240,15902,,posNeg,30767,,,,,,,,B,3/27/2020 16:00,2020-03-27T16:00:00Z,03/27 12:00,283,,2020-03-27T16:00:00Z,21920,6018,15902,14625,326,19,,,,,,,,,,,,,26,1066,1762,30767,2828,30767,71,0,cc4500f22b597ae1a8d6f4bc5e25578fbd0c396a,0,0,0,0,0,
20200327,MI,13799,214,14140,,posNeg,27939,,,,,,,,B,3/27/2020 11:00,2020-03-27T11:00:00Z,03/27 07:00,212,,2020-03-27T11:00:00Z,19133,4993,14140,13585,264,15,,,,,,,,,,,,,26,1324,2410,27939,3734,27939,53,0,0b5160ba4dd10ca4f39fcc2259c5f8db98cf8095,0,0,0,0,0,
20200326,MI,12475,187,11730,,posNeg,24205,,,,,,,,D,3/26/2020 11:00,2020-03-26T11:00:00Z,03/26 07:00,159,,2020-03-26T11:00:00Z,15597,3867,11730,12288,197,10,,,,,,,,,,,,,26,1140,2888,24205,4028,24205,48,0,4a103eaf05fa9634a0bf3d92da3fb07ddaa1663c,0,0,0,0,0,
20200325,MI,11335,172,8842,,posNeg,20177,,,,,,,,D,3/25/2020 15:00,2020-03-25T15:00:00Z,03/25 11:00,111,,2020-03-25T15:00:00Z,11782,2940,8842,11163,149,8,,,,,,,,,,,,,26,1180,1853,20177,3033,20177,25,0,12ede9982c441f2c365d5d17a53f02d684f7bd4b,0,0,0,0,0,
20200324,MI,10155,149,6989,,posNeg,17144,,,,,,,,D,3/24/2020 11:00,2020-03-24T11:00:00Z,03/24 07:00,86,,2020-03-24T11:00:00Z,9356,2367,6989,10006,103,7,,,,,,,,,,,,,26,1093,1142,17144,2235,17144,29,0,9b2920a594626796ee1c02e2403e1ebac1cb0e5a,0,0,0,0,0,
20200323,MI,9062,125,5847,,posNeg,14909,,,,,,,,D,3/23/2020 11:00,2020-03-23T11:00:00Z,03/23 07:00,57,,2020-03-23T11:00:00Z,7676,1829,5847,8937,79,3,,,,,,,,,,,,,26,1240,1056,14909,2296,14909,21,0,60b95f1c0918349a33e7c0984009883b777b41d7,0,0,0,0,0,
20200322,MI,7822,96,4791,,posNeg,12613,,,,,,,,,3/22/2020 15:00,2020-03-22T15:00:00Z,03/22 11:00,36,,2020-03-22T15:00:00Z,6223,1432,4791,7726,54,3,,,,,,,,,,,,,26,799,705,12613,1504,12613,13,0,7ab20697460c898911b6abc2c658506fbb9499ef,0,0,0,0,0,
20200321,MI,7023,85,4086,,posNeg,11109,,,,,,,,,3/21/2020 13:44,2020-03-21T13:44:00Z,03/21 09:44,23,,2020-03-21T13:44:00Z,5203,1117,4086,6938,33,3,,,,,,,,,,,,,26,804,1045,11109,1849,11109,10,0,471335913726647b9ca7a26f065f575bf2a83891,0,0,0,0,0,
20200320,MI,6219,69,3041,,posNeg,9260,,,,,,,,,3/20/2020 15:00,2020-03-20T15:00:00Z,03/20 11:00,13,,2020-03-20T15:00:00Z,3845,804,3041,6150,20,2,,,,,,,,,,,,,26,943,990,9260,1933,9260,3,0,fe5e1a161b8abe50baa31baff6064b410b8ca441,0,0,0,0,0,
20200319,MI,5276,55,2051,,posNeg,7327,,,,,,,,,3/19/2020 15:00,2020-03-19T15:00:00Z,03/19 11:00,10,,2020-03-19T15:00:00Z,2590,539,2051,5221,11,1,,,,,,,,,,,,,26,745,573,7327,1318,7327,5,0,bedd27981dea9d5d88dd8d100a743d7045102784,0,0,0,0,0,
20200318,MI,4531,40,1478,,posNeg,6009,,,,,,,,,3/18/2020 14:00,2020-03-18T14:00:00Z,03/18 10:00,5,,2020-03-18T14:00:00Z,1852,374,1478,4491,9,1,,,,,,,,,,,,,26,872,599,6009,1471,6009,3,0,732061529085413738cde6407e3bebb224bec50d,0,0,0,0,0,
20200317,MI,3659,27,879,,posNeg,4538,,,,,,,,,3/17/2020 14:00,2020-03-17T14:00:00Z,03/17 10:00,2,,2020-03-17T14:00:00Z,1100,221,879,3632,4,1,,,,,,,,,,,,,26,764,607,4538,1371,4538,2,0,353b19e5f470436fc301c2f02c2796c6759da606,0,0,0,0,0,
20200316,MI,2895,22,272,30,posNeg,3167,,,,,,,,,3/16/2020 15:52,2020-03-16T15:52:00Z,03/16 11:52,,,2020-03-16T15:52:00Z,,,,2873,1,1,,,,,,,,,,,,,26,707,67,3197,774,3167,0,0,e445f783d6a8c8a11cb366d4619b6b9d55469dde,0,0,0,0,0,
20200315,MI,2188,13,205,26,posNeg,2393,,,,,,,,,3/14/2020 00:00,2020-03-14T24:00:00Z,03/13 20:00,,,2020-03-14T24:00:00Z,,,,2175,0,1,,,,,,,,,,,,,26,460,0,2419,460,2393,0,0,d330b625da3be8cf6a8b652bfe4d990ab7201f4d,0,0,0,0,0,
20200314,MI,1728,11,205,26,posNeg,1933,,,,,,,,,3/13/2020 00:00,2020-03-13T24:00:00Z,03/12 20:00,,,2020-03-13T24:00:00Z,,,,1717,0,1,,,,,,,,,,,,,26,367,72,1959,439,1933,0,0,eb230a89d060889bfb2708b49d9744cd5ccace23,0,0,0,0,0,
20200313,MI,1361,8,133,26,posNeg,1494,,,,,,,,,3/13/2020 00:00,2020-03-13T24:00:00Z,03/12 20:00,,,2020-03-13T24:00:00Z,,,,1353,0,1,,,,,,,,,,,,,26,364,42,1520,406,1494,0,0,ef60256110f73fcf76ebc82f60c0cd82728f3248,0,0,0,0,0,
20200312,MI,997,1,91,27,posNeg,1088,,,,,,,,,3/11/2020 19:00,2020-03-11T19:00:00Z,03/11 15:00,,,2020-03-11T19:00:00Z,,,,996,0,1,,,,,,,,,,,,,26,270,34,1115,304,1088,0,0,4f27e3d0f0dc5a80b195ed6d5869c445e0cf0a67,0,0,0,0,0,
20200311,MI,727,0,57,18,posNeg,784,,,,,,,,,,,,,,,,,,727,0,0,,,,,,,,,,,,,26,199,18,802,217,784,0,0,309df507a8a0eafce92ec13695f38fbc77f397a7,0,0,0,0,0,
20200310,MI,528,0,39,24,posNeg,567,,,,,,,,,,,,,,,,,,528,0,0,,,,,,,,,,,,,26,156,3,591,159,567,0,0,25b1d8734abb323cc5442ec32d4d05249fffe46f,0,0,0,0,0,
20200309,MI,372,0,36,11,posNeg,408,,,,,,,,,,,,,,,,,,372,0,0,,,,,,,,,,,,,26,121,10,419,131,408,0,0,3cbe18c4623a267bb1ad9575d53c19b434a9d036,0,0,0,0,0,
20200308,MI,251,0,26,10,posNeg,277,,,,,,,,,,,,,,,,,,251,0,0,,,,,,,,,,,,,26,63,8,287,71,277,0,0,ed27ae68d188559661cf2b891de49ade1967b608,0,0,0,0,0,
20200307,MI,188,0,18,9,posNeg,206,,,,,,,,,,,,,,,,,,188,0,0,,,,,,,,,,,,,26,48,10,215,58,206,0,0,ce366fbc988dfe3aadb759584d2c1891e5a2d196,0,0,0,0,0,
20200306,MI,140,0,8,8,posNeg,148,,,,,,,,,,,,,,,,,,140,0,0,,,,,,,,,,,,,26,40,0,156,40,148,0,0,b01f1160276022977b985a9e90f7d9971288aa23,0,0,0,0,0,
20200305,MI,100,0,8,0,posNeg,108,,,,,,,,,,,,,,,,,,100,0,0,,,,,,,,,,,,,26,26,8,108,34,108,0,0,62a35cbc99bc8b6bde4aa107ed368da882517808,0,0,0,0,0,
20200304,MI,74,0,,,posNeg,74,,,,,,,,,,,,,,,,,,74,0,0,,,,,,,,,,,,,26,24,0,74,24,74,0,0,c33bcac4e79f837fce6517c132cb2fab64525f01,0,0,0,0,0,
20200303,MI,50,0,,,posNeg,50,,,,,,,,,,,,,,,,,,50,,0,,,,,,,,,,,,,26,23,0,50,23,50,0,0,a15e8c7839b4200e79db9e8de52b8aca5c29814a,0,0,0,0,0,
20200302,MI,27,0,,,posNeg,27,,,,,,,,,,,,,,,,,,27,,0,,,,,,,,,,,,,26,13,0,27,13,27,0,0,3992d63c3887bdeec4cb0b35f0ad0c3e4ff4a7b5,0,0,0,0,0,
20200301,MI,14,0,,,posNeg,14,,,,,,,,,,,,,,,,,,14,0,0,,,,,,,,,,,,,26,0,0,14,0,14,0,0,a0c9709b84c601caa7314facf3d00767163c85f8,0,0,0,0,0,
