[{"date":20200728,"state":"CA","positive":466550,"negative":6951316,"pending":null,"hospitalizedCurrently":8317,"hospitalizedCumulative":null,"inIcuCurrently":2198,"inIcuCumulative":null,"onVentilatorCurrently":null,"onVentilatorCumulative":null,"recovered":null,"dataQualityGrade":"B","lastUpdateEt":"7/28/2020 00:00","dateModified":"2020-07-28T00:00:00Z","checkTimeEt":"07/27 20:00","death":8518,"hospitalized":null,"dateChecked":"2020-07-28T00:00:00Z","totalTestsViral":7417866,"positiveTestsViral":null,"negativeTestsViral":null,"positiveCasesViral":466550,"deathConfirmed":null,"deathProbable":null,"fips":"06","positiveIncrease":6000,"negativeIncrease":115288,"total":7417866,"totalTestResults":7417866,"totalTestResultsIncrease":121288,"posNeg":7417866,"deathIncrease":73,"hospitalizedIncrease":0,"hash":"e9a53bd0b34d58e584d33393a1acc8673d8e9b05","commercialScore":0,"negativeRegularScore":0,"negativeScore":0,"positiveScore":0,"score":0,"grade":""},{"date":20200727,"state":"CA","positive":460550,"negative":6836028,"pending":null,"hospitalizedCurrently":8820,"hospitalizedCumulative":null,"inIcuCurrently":2284,"inIcuCumulative":null,"onVentilatorCurrently":null,"onVentilatorCumulative":null,"recovered":null,"dataQualityGrade":"B","lastUpdateEt":"7/27/2020 00:00","dateModified":"2020-07-27T00:00:00Z","checkTimeEt":"07/26 20:00","death":8445,"hospitalized":null,"dateChecked":"2020-07-27T00:00:00Z","totalTestsViral":7296578,"positiveTestsViral":null,"negativeTestsViral":null,"positiveCasesViral":460550,"deathConfirmed":null,"deathProbable":null,"fips":"06","positiveIncrease":6891,"negativeIncrease":121548,"total":7296578,"totalTestResults":7296578,"totalTestResultsIncrease":128439,"posNeg":7296578,"deathIncrease":29,"hospitalizedIncrease":0,"hash":"b8931466ea5a52fb64e1683aec4d3e4c412f1f7e","commercialScore":0,"negativeRegularScore":0,"negativeScore":0,"positiveScore":0,"score":0,"grade":""},{"date":20200726,"state":"CA","positive":453659,"negative":6714480,"pending":null,"hospitalizedCurrently":8820,"hospitalizedCumulative":null,"inIcuCurrently":2284,"inIcuCumulative":null,"onVentilatorCurrently":null,"onVentilatorCumulative":null,"recovered":null,"dataQualityGrade":"B","lastUpdateEt":"7/26/2020 00:00","dateModified":"2020-07-26T00:00:00Z","checkTimeEt":"07/25 20:00","death":8416,"hospitalized":null,"dateChecked":"2020-07-26T00:00:00Z","totalTestsViral":7168139,"positiveTestsViral":null,"negativeTestsViral":null,"positiveCasesViral":453659,"deathConfirmed":null,"deathProbable":null,"fips":"06","positiveIncrease":8259,"negativeIncrease":112525,"total":7168139,"totalTestResults":7168139,"totalTestResultsIncrease":120784,"posNeg":7168139,"deathIncrease":79,"hospitalizedIncrease":0,"hash":"2de2a3bb3e4a36be3abf85f9636ed9b58cbf4df4","commercialScore":0,"negativeRegularScore":0,"negativeScore":0,"positiveScore":0,"score":0,"grade":""},{"date":20200725,"state":"CA","positive":445400,"negative":6601955,"pending":null,"hospitalizedCurrently":8820,"hospitalizedCumulative":null,"inIcuCurrently":2284,"inIcuCumulative":null,"onVentilatorCurrently":null,"onVentilatorCumulative":null,"recovered":null,"dataQualityGrade":"B","lastUpdateEt":"7/25/2020 00:00","dateModified":"2020-07-25T00:00:00Z","checkTimeEt":"07/24 20:00","death":8337,"hospitalized":null,"dateChecked":"2020-07-25T00:00:00Z","totalTestsViral":7047355,"positiveTestsViral":null,"negativeTestsViral":null,"positiveCasesViral":445400,"deathConfirmed":null,"deathProbable":null,"fips":"06","positiveIncrease":10066,"negativeIncrease":121413,"total":7047355,"totalTestResults":7047355,"totalTestResultsIncrease":131479,"posNeg":7047355,"deathIncrease":151,"hospitalizedIncrease":0,"hash":"1c3c5e5d7d8a78e1027e606bc3fe62b193ea414e","commercialScore":0,"negativeRegularScore":0,"negativeScore":0,"positiveScore":0,"score":0,"grade":""},{"date":20200724,"state":"CA","positive":435334,"negative":6480542,"pending":null,"hospitalizedCurrently":8820,"hospitalizedCumulative":null,"inIcuCurrently":2284,"inIcuCumulative":null,"onVentilatorCurrently":null,"onVentilatorCumulative":null,"recovered":null,"dataQualityGrade":"B","lastUpdateEt":"7/24/2020 00:00","dateModified":"2020-07-24T00:00:00Z","checkTimeEt":"07/23 20:00","death":8186,"hospitalized":null,"dateChecked":"2020-07-24T00:00:00Z","totalTestsViral":6915876,"positiveTestsViral":null,"negativeTestsViral":null,"positiveCasesViral":435334,"deathConfirmed":null,"deathProbable":null,"fips":"06","positiveIncrease":9718,"negativeIncrease":127854,"total":6915876,"totalTestResults":6915876,"totalTestResultsIncrease":137572,"posNeg":6915876,"deathIncrease":159,"hospitalizedIncrease":0,"hash":"00c84b97e9b372b477ce7feeb37b6a9b5f3f1be4","commercialScore":0,"negativeRegularScore":0,"negativeScore":0,"positiveScore":0,"score":0,"grade":""},{"date":20200723,"state":"CA","positive":425616,"negative":6352688,"pending":null,"hospitalizedCurrently":8820,"hospitalizedCumulative":null,"inIcuCurrently":2284,"inIcuCumulative":null,"onVentilatorCurrently":null,"onVentilatorCumulative":null,"recovered":null,"dataQualityGrade":"B","lastUpdateEt":"7/23/2020 00:00","dateModified":"2020-07-23T00:00:00Z","checkTimeEt":"07/22 20:00","death":8027,"hospitalized":null,"dateChecked":"2020-07-23T00:00:00Z","totalTestsViral":6778304,"positiveTestsViral":null,"negativeTestsViral":null,"positiveCasesViral":425616,"deathConfirmed":null,"deathProbable":null,"fips":"06","positiveIncrease":12040,"negativeIncrease":101845,"total":6778304,"totalTestResults":6778304,"totalTestResultsIncrease":113885,"posNeg":6778304,"deathIncrease":157,"hospitalizedIncrease":0,"hash":"682fff550ee553f1a82d03c82deaf07c520373df","commercialScore":0,"negativeRegularScore":0,"negativeScore":0,"positiveScore":0,"score":0,"grade":""},{"date":20200722,"state":"CA","positive":413576,"negative":6250843,"pending":null,"hospitalizedCurrently":8820,"hospitalizedCumulative":null,"inIcuCurrently":2284,"inIcuCumulative":null,"onVentilatorCurrently":null,"onVentilatorCumulative":null,"recovered":null,"dataQualityGrade":"B","lastUpdateEt":"7/22/2020 00:00","dateModified":"2020-07-22T00:00:00Z","checkTimeEt":"07/21 20:00","death":7870,"hospitalized":null,"dateChecked":"2020-07-22T00:00:00Z","totalTestsViral":6664419,"positiveTestsViral":null,"negativeTestsViral":null,"positiveCasesViral":413576,"deathConfirmed":null,"deathProbable":null,"fips":"06","positiveIncrease":12807,"negativeIncrease":114680,"total":6664419,"totalTestResults":6664419,"totalTestResultsIncrease":127487,"posNeg":6664419,"deathIncrease":115,"hospitalizedIncrease":0,"hash":"9e07fb0a4bb5e4616284aebc1d201ad7133c049a","commercialScore":0,"negativeRegularScore":0,"negativeScore":0,"positiveScore":0,"score":0,"grade":""},{"date":20200721,"state":"CA","positive":400769,"negative":6136163,"pending":null,"hospitalizedCurrently":8681,"hospitalizedCumulative":null,"inIcuCurrently":2226,"inIcuCumulative":null,"onVentilatorCurrently":null,"onVentilatorCumulative":null,"recovered":null,"dataQualityGrade":"B","lastUpdateEt":"7/21/2020 00:00","dateModified":"2020-07-21T00:00:00Z","checkTimeEt":"07/20 20:00","death":7755,"hospitalized":null,"dateChecked":"2020-07-21T00:00:00Z","totalTestsViral":6536932,"positiveTestsViral":null,"negativeTestsViral":null,"positiveCasesViral":400769,"deathConfirmed":null,"deathProbable":null,"fips":"06","positiveIncrease":9231,"negativeIncrease":113380,"total":6536932,"totalTestResults":6536932,"totalTestResultsIncrease":122611,"posNeg":6536932,"deathIncrease":61,"hospitalizedIncrease":0,"hash":"c5f9f05c2b366e3f77d195585f936816c1359e2f","commercialScore":0,"negativeRegularScore":0,"negativeScore":0,"positiveScore":0,"score":0,"grade":""},{"date":20200720,"state":"CA","positive":391538,"negative":6022783,"pending":null,"hospitalizedCurrently":8419,"hospitalizedCumulative":null,"inIcuCurrently":2157,"inIcuCumulative":null,"onVentilatorCurrently":null,"onVentilatorCumulative":null,"recovered":null,"dataQualityGrade":"B","lastUpdateEt":"7/20/2020 00:00","dateModified":"2020-07-20T00:00:00Z","checkTimeEt":"07/19 20:00","death":7694,"hospitalized":null,"dateChecked":"2020-07-20T00:00:00Z","totalTestsViral":6414321,"positiveTestsViral":null,"negativeTestsViral":null,"positiveCasesViral":391538,"deathConfirmed":null,"deathProbable":null,"fips":"06","positiveIncrease":6846,"negativeIncrease":120623,"total":6414321,"totalTestResults":6414321,"totalTestResultsIncrease":127469,"posNeg":6414321,"deathIncrease":9,"hospitalizedIncrease":0,"hash":"cd6be133298352ecb8fde204fba59b39e15b0f80","commercialScore":0,"negativeRegularScore":0,"negativeScore":0,"positiveScore":0,"score":0,"grade":""},{"date":20200719,"state":"CA","positive":384692,"negative":5902160,"pending":null,"hospitalizedCurrently":8398,"hospitalizedCumulative":null,"inIcuCurrently":2107,"inIcuCumulative":null,"onVentilatorCurrently":null,"onVentilatorCumulative":null,"recovered":null,"dataQualityGrade":"B","lastUpdateEt":"7/19/2020 00:00","dateModified":"2020-07-19T00:00:00Z","checkTimeEt":"07/18 20:00","death":7685,"hospitalized":null,"dateChecked":"2020-07-19T00:00:00Z","totalTestsViral":6286852,"positiveTestsViral":null,"negativeTestsViral":null,"positiveCasesViral":384692,"deathConfirmed":null,"deathProbable":null,"fips":"06","positiveIncrease":9329,"negativeIncrease":110305,"total":6286852,"totalTestResults":6286852,"totalTestResultsIncrease":119634,"posNeg":6286852,"deathIncrease":90,"hospitalizedIncrease":0,"hash":"679f115e835cebf3d0107f1d0394d362db540399","commercialScore":0,"negativeRegularScore":0,"negativeScore":0,"positiveScore":0,"score":0,"grade":""},{"date":20200718,"state":"CA","positive":375363,"negative":5791855,"pending":null,"hospitalizedCurrently":8502,"hospitalizedCumulative":null,"inIcuCurrently":2125,"inIcuCumulative":null,"onVentilatorCurrently":null,"onVentilatorCumulative":null,"recovered":null,"dataQualityGrade":"B","lastUpdateEt":"7/18/2020 00:00","dateModified":"2020-07-18T00:00:00Z","checkTimeEt":"07/17 20:00","death":7595,"hospitalized":null,"dateChecked":"2020-07-18T00:00:00Z","totalTestsViral":6167218,"positiveTestsViral":null,"negativeTestsViral":null,"positiveCasesViral":375363,"deathConfirmed":null,"deathProbable":null,"fips":"06","positiveIncrease":9199,"negativeIncrease":113920,"total":6167218,"totalTestResults":6167218,"totalTestResultsIncrease":123119,"posNeg":6167218,"deathIncrease":120,"hospitalizedIncrease":0,"hash":"c7ccfc309a1cc4b49de9e979a64e516a5ae76e3e","commercialScore":0,"negativeRegularScore":0,"negativeScore":0,"positiveScore":0,"score":0,"grade":""},{"date":20200717,"state":"CA","positive":366164,"negative":5677935,"pending":null,"hospitalizedCurrently":8450,"hospitalizedCumulative":null,"inIcuCurrently":2153,"inIcuCumulative":null,"onVentilatorCurrently":null,"onVentilatorCumulative":null,"recovered":null,"dataQualityGrade":"B","lastUpdateEt":"7/17/2020 00:00","dateModified":"2020-07-17T00:00:00Z","checkTimeEt":"07/16 20:00","death":7475,"hospitalized":null,"dateChecked":"2020-07-17T00:00:00Z","totalTestsViral":6044099,"positiveTestsViral":null,"negativeTestsViral":null,"positiveCasesViral":366164,"deathConfirmed":null,"deathProbable":null,"fips":"06","positiveIncrease":9986,"negativeIncrease":118605,"total":6044099,"totalTestResults":6044099,"totalTestResultsIncrease":128591,"posNeg":6044099,"deathIncrease":130,"hospitalizedIncrease":0,"hash":"fc67eb477c9c738f23fb314ab228a3e376877d8a","commercialScore":0,"negativeRegularScore":0,"negativeScore":0,"positiveScore":0,"score":0,"grade":""},{"date":20200716,"state":"CA","positive":356178,"negative":5559330,"pending":null,"hospitalizedCurrently":8363,"hospitalizedCumulative":null,"inIcuCurrently":2120,"inIcuCumulative":null,"onVentilatorCurrently":null,"onVentilatorCumulative":null,"recovered":null,"dataQualityGrade":"B","lastUpdateEt":"7/16/2020 00:00","dateModified":"2020-07-16T00:00:00Z","checkTimeEt":"07/15 20:00","death":7345,"hospitalized":null,"dateChecked":"2020-07-16T00:00:00Z","totalTestsViral":5915508,"positiveTestsViral":null,"negativeTestsViral":null,"positiveCasesViral":356178,"deathConfirmed":null,"deathProbable":null,"fips":"06","positiveIncrease":8544,"negativeIncrease":113688,"total":5915508,"totalTestResults":5915508,"totalTestResultsIncrease":122232,"posNeg":5915508,"deathIncrease":118,"hospitalizedIncrease":0,"hash":"5036fe722b685c1518e7feb4bce0c3f170c8d10e","commercialScore":0,"negativeRegularScore":0,"negativeScore":0,"positiveScore":0,"score":0,"grade":""},{"date":20200715,"state":"CA","positive":347634,"negative":5445642,"pending":null,"hospitalizedCurrently":8353,"hospitalizedCumulative":null,"inIcuCurrently":2110,"inIcuCumulative":null,"onVentilatorCurrently":null,"onVentilatorCumulative":null,"recovered":null,"dataQualityGrade":"B","lastUpdateEt":"7/15/2020 00:00","dateModified":"2020-07-15T00:00:00Z","checkTimeEt":"07/14 20:00","death":7227,"hospitalized":null,"dateChecked":"2020-07-15T00:00:00Z","totalTestsViral":5793276,"positiveTestsViral":null,"negativeTestsViral":null,"positiveCasesViral":347634,"deathConfirmed":null,"deathProbable":null,"fips":"06","positiveIncrease":11126,"negativeIncrease":107195,"total":5793276,"totalTestResults":5793276,"totalTestResultsIncrease":118321,"posNeg":5793276,"deathIncrease":140,"hospitalizedIncrease":0,"hash":"3284751051687e53d0dfa857b8524346100ec888","commercialScore":0,"negativeRegularScore":0,"negativeScore":0,"positiveScore":0,"score":0,"grade":""},{"date":20200714,"state":"CA","positive":336508,"negative":5338447,"pending":null,"hospitalizedCurrently":8145,"hospitalizedCumulative":null,"inIcuCurrently":2083,"inIcuCumulative":null,"onVentilatorCurrently":null,"onVentilatorCumulative":null,"recovered":null,"dataQualityGrade":"B","lastUpdateEt":"7/14/2020 00:00","dateModified":"2020-07-14T00:00:00Z","checkTimeEt":"07/13 20:00","death":7087,"hospitalized":null,"dateChecked":"2020-07-14T00:00:00Z","totalTestsViral":5674955,"positiveTestsViral":null,"negativeTestsViral":null,"positiveCasesViral":336508,"deathConfirmed":null,"deathProbable":null,"fips":"06","positiveIncrease":7346,"negativeIncrease":123244,"total":5674955,"totalTestResults":5674955,"totalTestResultsIncrease":130590,"posNeg":5674955,"deathIncrease":47,"hospitalizedIncrease":0,"hash":"d823ee4c4b51f7f10f134b0f71e7fdb61ec5b3fa","commercialScore":0,"negativeRegularScore":0,"negativeScore":0,"positiveScore":0,"score":0,"grade":""},{"date":20200713,"state":"CA","positive":329162,"negative":5215203,"pending":null,"hospitalizedCurrently":7895,"hospitalizedCumulative":null,"inIcuCurrently":2021,"inIcuCumulative":null,"onVentilatorCurrently":null,"onVentilatorCumulative":null,"recovered":null,"dataQualityGrade":"B","lastUpdateEt":"7/13/2020 00:00","dateModified":"2020-07-13T00:00:00Z","checkTimeEt":"07/12 20:00","death":7040,"hospitalized":null,"dateChecked":"2020-07-13T00:00:00Z","totalTestsViral":5544365,"positiveTestsViral":null,"negativeTestsViral":null,"positiveCasesViral":329162,"deathConfirmed":null,"deathProbable":null,"fips":"06","positiveIncrease":8358,"negativeIncrease":129408,"total":5544365,"totalTestResults":5544365,"totalTestResultsIncrease":137766,"posNeg":5544365,"deathIncrease":23,"hospitalizedIncrease":0,"hash":"c0dfd793447c8645bea4f9658759aa42a854b63a","commercialScore":0,"negativeRegularScore":0,"negativeScore":0,"positiveScore":0,"score":0,"grade":""},{"date":20200712,"state":"CA","positive":320804,"negative":5085795,"pending":null,"hospitalizedCurrently":7854,"hospitalizedCumulative":null,"inIcuCurrently":2020,"inIcuCumulative":null,"onVentilatorCurrently":null,"onVentilatorCumulative":null,"recovered":null,"dataQualityGrade":"B","lastUpdateEt":"7/12/2020 00:00","dateModified":"2020-07-12T00:00:00Z","checkTimeEt":"07/11 20:00","death":7017,"hospitalized":null,"dateChecked":"2020-07-12T00:00:00Z","totalTestsViral":5406599,"positiveTestsViral":null,"negativeTestsViral":null,"positiveCasesViral":320804,"deathConfirmed":null,"deathProbable":null,"fips":"06","positiveIncrease":8460,"negativeIncrease":122444,"total":5406599,"totalTestResults":5406599,"totalTestResultsIncrease":130904,"posNeg":5406599,"deathIncrease":72,"hospitalizedIncrease":0,"hash":"7f0a7ef4ab2864dfe91670dbd8db994e291b0d65","commercialScore":0,"negativeRegularScore":0,"negativeScore":0,"positiveScore":0,"score":0,"grade":""},{"date":20200711,"state":"CA","positive":312344,"negative":4963351,"pending":null,"hospitalizedCurrently":7904,"hospitalizedCumulative":null,"inIcuCurrently":2021,"inIcuCumulative":null,"onVentilatorCurrently":null,"onVentilatorCumulative":null,"recovered":null,"dataQualityGrade":"B","lastUpdateEt":"7/11/2020 00:00","dateModified":"2020-07-11T00:00:00Z","checkTimeEt":"07/10 20:00","death":6945,"hospitalized":null,"dateChecked":"2020-07-11T00:00:00Z","totalTestsViral":5275695,"positiveTestsViral":null,"negativeTestsViral":null,"positiveCasesViral":312344,"deathConfirmed":null,"deathProbable":null,"fips":"06","positiveIncrease":8047,"negativeIncrease":91911,"total":5275695,"totalTestResults":5275695,"totalTestResultsIncrease":99958,"posNeg":5275695,"deathIncrease":94,"hospitalizedIncrease":0,"hash":"be5241e551c19c99f87be6429800baa947d24cf6","commercialScore":0,"negativeRegularScore":0,"negativeScore":0,"positiveScore":0,"score":0,"grade":""},{"date":20200710,"state":"CA","positive":304297,"negative":4871440,"pending":null,"hospitalizedCurrently":7896,"hospitalizedCumulative":null,"inIcuCurrently":2005,"inIcuCumulative":null,"onVentilatorCurrently":null,"onVentilatorCumulative":null,"recovered":null,"dataQualityGrade":"B","lastUpdateEt":"7/10/2020 00:00","dateModified":"2020-07-10T00:00:00Z","checkTimeEt":"07/09 20:00","death":6851,"hospitalized":null,"dateChecked":"2020-07-10T00:00:00Z","totalTestsViral":5175737,"positiveTestsViral":null,"negativeTestsViral":null,"positiveCasesViral":304297,"deathConfirmed":null,"deathProbable":null,"fips":"06","positiveIncrease":7798,"negativeIncrease":89505,"total":5175737,"totalTestResults":5175737,"totalTestResultsIncrease":97303,"posNeg":5175737,"deathIncrease":140,"hospitalizedIncrease":0,"hash":"7ed43229bfbe0897133758f20cc575329e2daa9e","commercialScore":0,"negativeRegularScore":0,"negativeScore":0,"positiveScore":0,"score":0,"grade":""},{"date":20200709,"state":"CA","positive":296499,"negative":4781935,"pending":null,"hospitalizedCurrently":7821,"hospitalizedCumulative":null,"inIcuCurrently":1957,"inIcuCumulative":null,"onVentilatorCurrently":null,"onVentilatorCumulative":null,"recovered":null,"dataQualityGrade":"B","lastUpdateEt":"7/9/2020 00:00","dateModified":"2020-07-09T00:00:00Z","checkTimeEt":"07/08 20:00","death":6711,"hospitalized":null,"dateChecked":"2020-07-09T00:00:00Z","totalTestsViral":5078434,"positiveTestsViral":null,"negativeTestsViral":null,"positiveCasesViral":296499,"deathConfirmed":null,"deathProbable":null,"fips":"06","positiveIncrease":7031,"negativeIncrease":75228,"total":5078434,"totalTestResults":5078434,"totalTestResultsIncrease":82259,"posNeg":5078434,"deathIncrease":149,"hospitalizedIncrease":0,"hash":"2f769b0e0429da6b96c7d0480d6d59b1b1e0781b","commercialScore":0,"negativeRegularScore":0,"negativeScore":0,"positiveScore":0,"score":0,"grade":""},{"date":20200708,"state":"CA","positive":289468,"negative":4706707,"pending":null,"hospitalizedCurrently":7705,"hospitalizedCumulative":null,"inIcuCurrently":1976,"inIcuCumulative":null,"onVentilatorCurrently":null,"onVentilatorCumulative":null,"recovered":null,"dataQualityGrade":"B","lastUpdateEt":"7/8/2020 00:00","dateModified":"2020-07-08T00:00:00Z","checkTimeEt":"07/07 20:00","death":6562,"hospitalized":null,"dateChecked":"2020-07-08T00:00:00Z","totalTestsViral":4996175,"positiveTestsViral":null,"negativeTestsViral":null,"positiveCasesViral":289468,"deathConfirmed":null,"deathProbable":null,"fips":"06","positiveIncrease":11694,"negativeIncrease":88111,"total":4996175,"totalTestResults":4996175,"totalTestResultsIncrease":99805,"posNeg":4996175,"deathIncrease":114,"hospitalizedIncrease":0,"hash":"3537046bf4188b187fc618317db06c2d9f345e87","commercialScore":0,"negativeRegularScore":0,"negativeScore":0,"positiveScore":0,"score":0,"grade":""},{"date":20200707,"state":"CA","positive":277774,"negative":4618596,"pending":null,"hospitalizedCurrently":7499,"hospitalizedCumulative":null,"inIcuCurrently":1984,"inIcuCumulative":null,"onVentilatorCurrently":null,"onVentilatorCumulative":null,"recovered":null,"dataQualityGrade":"B","lastUpdateEt":"7/7/2020 00:00","dateModified":"2020-07-07T00:00:00Z","checkTimeEt":"07/06 20:00","death":6448,"hospitalized":null,"dateChecked":"2020-07-07T00:00:00Z","totalTestsViral":4896370,"positiveTestsViral":null,"negativeTestsViral":null,"positiveCasesViral":277774,"deathConfirmed":null,"deathProbable":null,"fips":"06","positiveIncrease":6090,"negativeIncrease":96927,"total":4896370,"totalTestResults":4896370,"totalTestResultsIncrease":103017,"posNeg":4896370,"deathIncrease":111,"hospitalizedIncrease":0,"hash":"bda260afa5a8b8762b2c464b5619cecb3c5358c6","commercialScore":0,"negativeRegularScore":0,"negativeScore":0,"positiveScore":0,"score":0,"grade":""},{"date":20200706,"state":"CA","positive":271684,"negative":4521669,"pending":null,"hospitalizedCurrently":7278,"hospitalizedCumulative":null,"inIcuCurrently":1937,"inIcuCumulative":null,"onVentilatorCurrently":null,"onVentilatorCumulative":null,"recovered":null,"dataQualityGrade":"B","lastUpdateEt":"7/6/2020 00:00","dateModified":"2020-07-06T00:00:00Z","checkTimeEt":"07/05 20:00","death":6337,"hospitalized":null,"dateChecked":"2020-07-06T00:00:00Z","totalTestsViral":4793353,"positiveTestsViral":null,"negativeTestsViral":null,"positiveCasesViral":271684,"deathConfirmed":null,"deathProbable":null,"fips":"06","positiveIncrease":5699,"negativeIncrease":107516,"total":4793353,"totalTestResults":4793353,"totalTestResultsIncrease":113215,"posNeg":4793353,"deathIncrease":6,"hospitalizedIncrease":0,"hash":"c954e75ad41457f13666ee43673ca235c36136ab","commercialScore":0,"negativeRegularScore":0,"negativeScore":0,"positiveScore":0,"score":0,"grade":""},{"date":20200705,"state":"CA","positive":265985,"negative":4414153,"pending":null,"hospitalizedCurrently":7149,"hospitalizedCumulative":null,"inIcuCurrently":1907,"inIcuCumulative":null,"onVentilatorCurrently":null,"onVentilatorCumulative":null,"recovered":null,"dataQualityGrade":"B","lastUpdateEt":"7/5/2020 00:00","dateModified":"2020-07-05T00:00:00Z","checkTimeEt":"07/04 20:00","death":6331,"hospitalized":null,"dateChecked":"2020-07-05T00:00:00Z","totalTestsViral":4680138,"positiveTestsViral":null,"negativeTestsViral":null,"positiveCasesViral":265985,"deathConfirmed":null,"deathProbable":null,"fips":"06","positiveIncrease":8597,"negativeIncrease":118510,"total":4680138,"totalTestResults":4680138,"totalTestResultsIncrease":127107,"posNeg":4680138,"deathIncrease":18,"hospitalizedIncrease":0,"hash":"e58c6bb8c8c40f33280485e9929bedfdb1c48e4d","commercialScore":0,"negativeRegularScore":0,"negativeScore":0,"positiveScore":0,"score":0,"grade":""},{"date":20200704,"state":"CA","positive":257388,"negative":4295643,"pending":null,"hospitalizedCurrently":7092,"hospitalizedCumulative":null,"inIcuCurrently":1888,"inIcuCumulative":null,"onVentilatorCurrently":null,"onVentilatorCumulative":null,"recovered":null,"dataQualityGrade":"B","lastUpdateEt":"7/4/2020 00:00","dateModified":"2020-07-04T00:00:00Z","checkTimeEt":"07/03 20:00","death":6313,"hospitalized":null,"dateChecked":"2020-07-04T00:00:00Z","totalTestsViral":4553031,"positiveTestsViral":null,"negativeTestsViral":null,"positiveCasesViral":257388,"deathConfirmed":null,"deathProbable":null,"fips":"06","positiveIncrease":9153,"negativeIncrease":95702,"total":4553031,"totalTestResults":4553031,"totalTestResultsIncrease":104855,"posNeg":4553031,"deathIncrease":50,"hospitalizedIncrease":0,"hash":"50c3899f3c1e5cfcf40b1fab75473abb27bdf182","commercialScore":0,"negativeRegularScore":0,"negativeScore":0,"positiveScore":0,"score":0,"grade":""},{"date":20200703,"state":"CA","positive":248235,"negative":4199941,"pending":null,"hospitalizedCurrently":7024,"hospitalizedCumulative":null,"inIcuCurrently":1871,"inIcuCumulative":null,"onVentilatorCurrently":null,"onVentilatorCumulative":null,"recovered":null,"dataQualityGrade":"B","lastUpdateEt":"7/3/2020 00:00","dateModified":"2020-07-03T00:00:00Z","checkTimeEt":"07/02 20:00","death":6263,"hospitalized":null,"dateChecked":"2020-07-03T00:00:00Z","totalTestsViral":4448176,"positiveTestsViral":null,"negativeTestsViral":null,"positiveCasesViral":248235,"deathConfirmed":null,"deathProbable":null,"fips":"06","positiveIncrease":5688,"negativeIncrease":103770,"total":4448176,"totalTestResults":4448176,"totalTestResultsIncrease":109458,"posNeg":4448176,"deathIncrease":100,"hospitalizedIncrease":0,"hash":"288d9cb57e0d996943af02bf914d2ab40280dee9","commercialScore":0,"negativeRegularScore":0,"negativeScore":0,"positiveScore":0,"score":0,"grade":""},{"date":20200702,"state":"CA","positive":242547,"negative":4096171,"pending":null,"hospitalizedCurrently":6812,"hospitalizedCumulative":null,"inIcuCurrently":1934,"inIcuCumulative":null,"onVentilatorCurrently":null,"onVentilatorCumulative":null,"recovered":null,"dataQualityGrade":"B","lastUpdateEt":"7/2/2020 00:00","dateModified":"2020-07-02T00:00:00Z","checkTimeEt":"07/01 20:00","death":6163,"hospitalized":null,"dateChecked":"2020-07-02T00:00:00Z","totalTestsViral":4338718,"positiveTestsViral":null,"negativeTestsViral":null,"positiveCasesViral":242547,"deathConfirmed":null,"deathProbable":null,"fips":"06","positiveIncrease":6408,"negativeIncrease":78134,"total":4338718,"totalTestResults":4338718,"totalTestResultsIncrease":84542,"posNeg":4338718,"deathIncrease":73,"hospitalizedIncrease":0,"hash":"30a53c472a365ea5018d2cb51c61e922ef5dd04f","commercialScore":0,"negativeRegularScore":0,"negativeScore":0,"positiveScore":0,"score":0,"grade":""},{"date":20200701,"state":"CA","positive":236139,"negative":4018037,"pending":null,"hospitalizedCurrently":6612,"hospitalizedCumulative":null,"inIcuCurrently":1859,"inIcuCumulative":null,"onVentilatorCurrently":null,"onVentilatorCumulative":null,"recovered":null,"dataQualityGrade":"B","lastUpdateEt":"7/1/2020 00:00","dateModified":"2020-07-01T00:00:00Z","checkTimeEt":"06/30 20:00","death":6090,"hospitalized":null,"dateChecked":"2020-07-01T00:00:00Z","totalTestsViral":4254176,"positiveTestsViral":null,"negativeTestsViral":null,"positiveCasesViral":236139,"deathConfirmed":null,"deathProbable":null,"fips":"06","positiveIncrease":7407,"negativeIncrease":79630,"total":4254176,"totalTestResults":4254176,"totalTestResultsIncrease":87037,"posNeg":4254176,"deathIncrease":110,"hospitalizedIncrease":0,"hash":"a99f685fd7118ed94d6bdb48e670776ab0d9bd52","commercialScore":0,"negativeRegularScore":0,"negativeScore":0,"positiveScore":0,"score":0,"grade":""},{"date":20200630,"state":"CA","positive":228732,"negative":3938407,"pending":null,"hospitalizedCurrently":6466,"hospitalizedCumulative":null,"inIcuCurrently":1751,"inIcuCumulative":null,"onVentilatorCurrently":null,"onVentilatorCumulative":null,"recovered":null,"dataQualityGrade":"B","lastUpdateEt":"6/30/2020 00:00","dateModified":"2020-06-30T00:00:00Z","checkTimeEt":"06/29 20:00","death":5980,"hospitalized":null,"dateChecked":"2020-06-30T00:00:00Z","totalTestsViral":4167139,"positiveTestsViral":null,"negativeTestsViral":null,"positiveCasesViral":228732,"deathConfirmed":null,"deathProbable":null,"fips":"06","positiveIncrease":9480,"negativeIncrease":95967,"total":4167139,"totalTestResults":4167139,"totalTestResultsIncrease":105447,"posNeg":4167139,"deathIncrease":44,"hospitalizedIncrease":0,"hash":"7393c11e8cd90a84c9a5fd2f7d416ce81c313dc3","commercialScore":0,"negativeRegularScore":0,"negativeScore":0,"positiveScore":0,"score":0,"grade":""},{"date":20200629,"state":"CA","positive":219252,"negative":3842440,"pending":null,"hospitalizedCurrently":6179,"hospitalizedCumulative":null,"inIcuCurrently":1686,"inIcuCumulative":null,"onVentilatorCurrently":null,"onVentilatorCumulative":null,"recovered":null,"dataQualityGrade":"B","lastUpdateEt":"6/29/2020 00:00","dateModified":"2020-06-29T00:00:00Z","checkTimeEt":"06/28 20:00","death":5936,"hospitalized":null,"dateChecked":"2020-06-29T00:00:00Z","totalTestsViral":4061692,"positiveTestsViral":null,"negativeTestsViral":null,"positiveCasesViral":219252,"deathConfirmed":null,"deathProbable":null,"fips":"06","positiveIncrease":8009,"negativeIncrease":97731,"total":4061692,"totalTestResults":4061692,"totalTestResultsIncrease":105740,"posNeg":4061692,"deathIncrease":31,"hospitalizedIncrease":0,"hash":"ddf39a941cea7d69094aee5a2d1fe25498cea597","commercialScore":0,"negativeRegularScore":0,"negativeScore":0,"positiveScore":0,"score":0,"grade":""},{"date":20200628,"state":"CA","positive":211243,"negative":3744709,"pending":null,"hospitalizedCurrently":5956,"hospitalizedCumulative":null,"inIcuCurrently":1602,"inIcuCumulative":null,"onVentilatorCurrently":null,"onVentilatorCumulative":null,"recovered":null,"dataQualityGrade":"B","lastUpdateEt":"6/28/2020 00:00","dateModified":"2020-06-28T00:00:00Z","checkTimeEt":"06/27 20:00","death":5905,"hospitalized":null,"dateChecked":"2020-06-28T00:00:00Z","totalTestsViral":3955952,"positiveTestsViral":null,"negativeTestsViral":null,"positiveCasesViral":211243,"deathConfirmed":null,"deathProbable":null,"fips":"06","positiveIncrease":4810,"negativeIncrease":88832,"total":3955952,"totalTestResults":3955952,"totalTestResultsIncrease":93642,"posNeg":3955952,"deathIncrease":33,"hospitalizedIncrease":0,"hash":"535bc444805fde24ff7c1f083bc452c4f2c4d336","commercialScore":0,"negativeRegularScore":0,"negativeScore":0,"positiveScore":0,"score":0,"grade":""},{"date":20200627,"state":"CA","positive":206433,"negative":3655877,"pending":null,"hospitalizedCurrently":5790,"hospitalizedCumulative":null,"inIcuCurrently":1562,"inIcuCumulative":null,"onVentilatorCurrently":null,"onVentilatorCumulative":null,"recovered":null,"dataQualityGrade":"B","lastUpdateEt":"6/27/2020 00:00","dateModified":"2020-06-27T00:00:00Z","checkTimeEt":"06/26 20:00","death":5872,"hospitalized":null,"dateChecked":"2020-06-27T00:00:00Z","totalTestsViral":3862310,"positiveTestsViral":null,"negativeTestsViral":null,"positiveCasesViral":206433,"deathConfirmed":null,"deathProbable":null,"fips":"06","positiveIncrease":5972,"negativeIncrease":85024,"total":3862310,"totalTestResults":3862310,"totalTestResultsIncrease":90996,"posNeg":3862310,"deathIncrease":60,"hospitalizedIncrease":0,"hash":"101c022c04a2829fef937a0f17c413e5a8fb334c","commercialScore":0,"negativeRegularScore":0,"negativeScore":0,"positiveScore":0,"score":0,"grade":""},{"date":20200626,"state":"CA","positive":200461,"negative":3570853,"pending":null,"hospitalizedCurrently":5639,"hospitalizedCumulative":null,"inIcuCurrently":1570,"inIcuCumulative":null,"onVentilatorCurrently":null,"onVentilatorCumulative":null,"recovered":null,"dataQualityGrade":"B","lastUpdateEt":"6/26/2020 00:00","dateModified":"2020-06-26T00:00:00Z","checkTimeEt":"06/25 20:00","death":5812,"hospitalized":null,"dateChecked":"2020-06-26T00:00:00Z","totalTestsViral":3771314,"positiveTestsViral":null,"negativeTestsViral":null,"positiveCasesViral":200461,"deathConfirmed":null,"deathProbable":null,"fips":"06","positiveIncrease":4890,"negativeIncrease":72079,"total":3771314,"totalTestResults":3771314,"totalTestResultsIncrease":76969,"posNeg":3771314,"deathIncrease":79,"hospitalizedIncrease":0,"hash":"2763b419337eb1c55424e3b5e9cd01e493ba5d7d","commercialScore":0,"negativeRegularScore":0,"negativeScore":0,"positiveScore":0,"score":0,"grade":""},{"date":20200625,"state":"CA","positive":195571,"negative":3498774,"pending":null,"hospitalizedCurrently":5522,"hospitalizedCumulative":null,"inIcuCurrently":1523,"inIcuCumulative":null,"onVentilatorCurrently":null,"onVentilatorCumulative":null,"recovered":null,"dataQualityGrade":"B","lastUpdateEt":"6/25/2020 00:00","dateModified":"2020-06-25T00:00:00Z","checkTimeEt":"06/24 20:00","death":5733,"hospitalized":null,"dateChecked":"2020-06-25T00:00:00Z","totalTestsViral":3694345,"positiveTestsViral":null,"negativeTestsViral":null,"positiveCasesViral":195571,"deathConfirmed":null,"deathProbable":null,"fips":"06","positiveIncrease":5349,"negativeIncrease":96097,"total":3694345,"totalTestResults":3694345,"totalTestResultsIncrease":101446,"posNeg":3694345,"deathIncrease":101,"hospitalizedIncrease":0,"hash":"86ee252c23e4ecff94da6d010772f278aafa9728","commercialScore":0,"negativeRegularScore":0,"negativeScore":0,"positiveScore":0,"score":0,"grade":""},{"date":20200624,"state":"CA","positive":190222,"negative":3402677,"pending":null,"hospitalizedCurrently":5399,"hospitalizedCumulative":null,"inIcuCurrently":1487,"inIcuCumulative":null,"onVentilatorCurrently":null,"onVentilatorCumulative":null,"recovered":null,"dataQualityGrade":"B","lastUpdateEt":"6/24/2020 00:00","dateModified":"2020-06-24T00:00:00Z","checkTimeEt":"06/23 20:00","death":5632,"hospitalized":null,"dateChecked":"2020-06-24T00:00:00Z","totalTestsViral":3592899,"positiveTestsViral":null,"negativeTestsViral":null,"positiveCasesViral":190222,"deathConfirmed":null,"deathProbable":null,"fips":"06","positiveIncrease":7149,"negativeIncrease":88821,"total":3592899,"totalTestResults":3592899,"totalTestResultsIncrease":95970,"posNeg":3592899,"deathIncrease":52,"hospitalizedIncrease":0,"hash":"6ae63ff7d41202c448630c98a9e6fab11262da46","commercialScore":0,"negativeRegularScore":0,"negativeScore":0,"positiveScore":0,"score":0,"grade":""},{"date":20200623,"state":"CA","positive":183073,"negative":3313856,"pending":null,"hospitalizedCurrently":5065,"hospitalizedCumulative":null,"inIcuCurrently":1421,"inIcuCumulative":null,"onVentilatorCurrently":null,"onVentilatorCumulative":null,"recovered":null,"dataQualityGrade":"B","lastUpdateEt":"6/23/2020 00:00","dateModified":"2020-06-23T00:00:00Z","checkTimeEt":"06/22 20:00","death":5580,"hospitalized":null,"dateChecked":"2020-06-23T00:00:00Z","totalTestsViral":3496929,"positiveTestsViral":null,"negativeTestsViral":null,"positiveCasesViral":183073,"deathConfirmed":null,"deathProbable":null,"fips":"06","positiveIncrease":5019,"negativeIncrease":80224,"total":3496929,"totalTestResults":3496929,"totalTestResultsIncrease":85243,"posNeg":3496929,"deathIncrease":65,"hospitalizedIncrease":0,"hash":"4aa0e22ff29295f9726bcdb344239c334115e7bf","commercialScore":0,"negativeRegularScore":0,"negativeScore":0,"positiveScore":0,"score":0,"grade":""},{"date":20200622,"state":"CA","positive":178054,"negative":3233632,"pending":null,"hospitalizedCurrently":4804,"hospitalizedCumulative":null,"inIcuCurrently":1412,"inIcuCumulative":null,"onVentilatorCurrently":null,"onVentilatorCumulative":null,"recovered":null,"dataQualityGrade":"B","lastUpdateEt":"6/22/2020 00:00","dateModified":"2020-06-22T00:00:00Z","checkTimeEt":"06/21 20:00","death":5515,"hospitalized":null,"dateChecked":"2020-06-22T00:00:00Z","totalTestsViral":3411686,"positiveTestsViral":null,"negativeTestsViral":null,"positiveCasesViral":178054,"deathConfirmed":null,"deathProbable":null,"fips":"06","positiveIncrease":4230,"negativeIncrease":88200,"total":3411686,"totalTestResults":3411686,"totalTestResultsIncrease":92430,"posNeg":3411686,"deathIncrease":20,"hospitalizedIncrease":0,"hash":"2f80f43769731ffcb4bf360082792ce0d12d3b3f","commercialScore":0,"negativeRegularScore":0,"negativeScore":0,"positiveScore":0,"score":0,"grade":""},{"date":20200621,"state":"CA","positive":173824,"negative":3145432,"pending":null,"hospitalizedCurrently":4679,"hospitalizedCumulative":null,"inIcuCurrently":1366,"inIcuCumulative":null,"onVentilatorCurrently":null,"onVentilatorCumulative":null,"recovered":null,"dataQualityGrade":"B","lastUpdateEt":"6/21/2020 00:00","dateModified":"2020-06-21T00:00:00Z","checkTimeEt":"06/20 20:00","death":5495,"hospitalized":null,"dateChecked":"2020-06-21T00:00:00Z","totalTestsViral":3319256,"positiveTestsViral":null,"negativeTestsViral":null,"positiveCasesViral":173824,"deathConfirmed":null,"deathProbable":null,"fips":"06","positiveIncrease":4515,"negativeIncrease":80329,"total":3319256,"totalTestResults":3319256,"totalTestResultsIncrease":84844,"posNeg":3319256,"deathIncrease":71,"hospitalizedIncrease":0,"hash":"5b76645e9abaf943ea11326bcf7e7c415e28ecda","commercialScore":0,"negativeRegularScore":0,"negativeScore":0,"positiveScore":0,"score":0,"grade":""},{"date":20200620,"state":"CA","positive":169309,"negative":3065103,"pending":null,"hospitalizedCurrently":4582,"hospitalizedCumulative":null,"inIcuCurrently":1332,"inIcuCumulative":null,"onVentilatorCurrently":null,"onVentilatorCumulative":null,"recovered":null,"dataQualityGrade":"B","lastUpdateEt":"6/20/2020 00:00","dateModified":"2020-06-20T00:00:00Z","checkTimeEt":"06/19 20:00","death":5424,"hospitalized":null,"dateChecked":"2020-06-20T00:00:00Z","totalTestsViral":3234412,"positiveTestsViral":null,"negativeTestsViral":null,"positiveCasesViral":169309,"deathConfirmed":null,"deathProbable":null,"fips":"06","positiveIncrease":3893,"negativeIncrease":74817,"total":3234412,"totalTestResults":3234412,"totalTestResultsIncrease":78710,"posNeg":3234412,"deathIncrease":64,"hospitalizedIncrease":0,"hash":"27e1289df64c400a77b11d65cf8dfcc48b784aaa","commercialScore":0,"negativeRegularScore":0,"negativeScore":0,"positiveScore":0,"score":0,"grade":""},{"date":20200619,"state":"CA","positive":165416,"negative":2990286,"pending":null,"hospitalizedCurrently":4587,"hospitalizedCumulative":null,"inIcuCurrently":1329,"inIcuCumulative":null,"onVentilatorCurrently":null,"onVentilatorCumulative":null,"recovered":null,"dataQualityGrade":"B","lastUpdateEt":"6/19/2020 00:00","dateModified":"2020-06-19T00:00:00Z","checkTimeEt":"06/18 20:00","death":5360,"hospitalized":null,"dateChecked":"2020-06-19T00:00:00Z","totalTestsViral":3155702,"positiveTestsViral":null,"negativeTestsViral":null,"positiveCasesViral":165416,"deathConfirmed":null,"deathProbable":null,"fips":"06","positiveIncrease":4317,"negativeIncrease":76855,"total":3155702,"totalTestResults":3155702,"totalTestResultsIncrease":81172,"posNeg":3155702,"deathIncrease":70,"hospitalizedIncrease":0,"hash":"81796732408a82a6e5a15fd73cb7b299262d0c08","commercialScore":0,"negativeRegularScore":0,"negativeScore":0,"positiveScore":0,"score":0,"grade":""},{"date":20200618,"state":"CA","positive":161099,"negative":2913431,"pending":null,"hospitalizedCurrently":4584,"hospitalizedCumulative":null,"inIcuCurrently":1298,"inIcuCumulative":null,"onVentilatorCurrently":null,"onVentilatorCumulative":null,"recovered":null,"dataQualityGrade":"B","lastUpdateEt":"6/18/2020 00:00","dateModified":"2020-06-18T00:00:00Z","checkTimeEt":"06/17 20:00","death":5290,"hospitalized":null,"dateChecked":"2020-06-18T00:00:00Z","totalTestsViral":3074530,"positiveTestsViral":null,"negativeTestsViral":null,"positiveCasesViral":161099,"deathConfirmed":null,"deathProbable":null,"fips":"06","positiveIncrease":4084,"negativeIncrease":72458,"total":3074530,"totalTestResults":3074530,"totalTestResultsIncrease":76542,"posNeg":3074530,"deathIncrease":82,"hospitalizedIncrease":0,"hash":"207bc7e2be498c52be2ee7736c608ade01ed93e2","commercialScore":0,"negativeRegularScore":0,"negativeScore":0,"positiveScore":0,"score":0,"grade":""},{"date":20200617,"state":"CA","positive":157015,"negative":2840973,"pending":null,"hospitalizedCurrently":4522,"hospitalizedCumulative":null,"inIcuCurrently":1318,"inIcuCumulative":null,"onVentilatorCurrently":null,"onVentilatorCumulative":null,"recovered":null,"dataQualityGrade":"B","lastUpdateEt":"6/17/2020 00:00","dateModified":"2020-06-17T00:00:00Z","checkTimeEt":"06/16 20:00","death":5208,"hospitalized":null,"dateChecked":"2020-06-17T00:00:00Z","totalTestsViral":2997988,"positiveTestsViral":null,"negativeTestsViral":null,"positiveCasesViral":157015,"deathConfirmed":null,"deathProbable":null,"fips":"06","positiveIncrease":3455,"negativeIncrease":56778,"total":2997988,"totalTestResults":2997988,"totalTestResultsIncrease":60233,"posNeg":2997988,"deathIncrease":87,"hospitalizedIncrease":0,"hash":"f287d36a27e59e6d7e926c40e19ad924b558a566","commercialScore":0,"negativeRegularScore":0,"negativeScore":0,"positiveScore":0,"score":0,"grade":""},{"date":20200616,"state":"CA","positive":153560,"negative":2784195,"pending":null,"hospitalizedCurrently":4462,"hospitalizedCumulative":null,"inIcuCurrently":1272,"inIcuCumulative":null,"onVentilatorCurrently":null,"onVentilatorCumulative":null,"recovered":null,"dataQualityGrade":"B","lastUpdateEt":"6/16/2020 00:00","dateModified":"2020-06-16T00:00:00Z","checkTimeEt":"06/15 20:00","death":5121,"hospitalized":null,"dateChecked":"2020-06-16T00:00:00Z","totalTestsViral":2937755,"positiveTestsViral":null,"negativeTestsViral":null,"positiveCasesViral":153560,"deathConfirmed":null,"deathProbable":null,"fips":"06","positiveIncrease":2108,"negativeIncrease":67465,"total":2937755,"totalTestResults":2937755,"totalTestResultsIncrease":69573,"posNeg":2937755,"deathIncrease":32,"hospitalizedIncrease":0,"hash":"bbecf62da64e135065a031546930384e864a08a2","commercialScore":0,"negativeRegularScore":0,"negativeScore":0,"positiveScore":0,"score":0,"grade":""},{"date":20200615,"state":"CA","positive":151452,"negative":2716730,"pending":null,"hospitalizedCurrently":4323,"hospitalizedCumulative":null,"inIcuCurrently":1270,"inIcuCumulative":null,"onVentilatorCurrently":null,"onVentilatorCumulative":null,"recovered":null,"dataQualityGrade":"B","lastUpdateEt":"6/15/2020 00:00","dateModified":"2020-06-15T00:00:00Z","checkTimeEt":"06/14 20:00","death":5089,"hospitalized":null,"dateChecked":"2020-06-15T00:00:00Z","totalTestsViral":2868182,"positiveTestsViral":null,"negativeTestsViral":null,"positiveCasesViral":151452,"deathConfirmed":null,"deathProbable":null,"fips":"06","positiveIncrease":2597,"negativeIncrease":63589,"total":2868182,"totalTestResults":2868182,"totalTestResultsIncrease":66186,"posNeg":2868182,"deathIncrease":26,"hospitalizedIncrease":0,"hash":"2e6ce0e33c44caacc8824988a01ba961ae12b335","commercialScore":0,"negativeRegularScore":0,"negativeScore":0,"positiveScore":0,"score":0,"grade":""},{"date":20200614,"state":"CA","positive":148855,"negative":2653141,"pending":null,"hospitalizedCurrently":4247,"hospitalizedCumulative":null,"inIcuCurrently":1280,"inIcuCumulative":null,"onVentilatorCurrently":null,"onVentilatorCumulative":null,"recovered":null,"dataQualityGrade":"B","lastUpdateEt":"6/14/2020 00:00","dateModified":"2020-06-14T00:00:00Z","checkTimeEt":"06/13 20:00","death":5063,"hospitalized":null,"dateChecked":"2020-06-14T00:00:00Z","totalTestsViral":2801996,"positiveTestsViral":null,"negativeTestsViral":null,"positiveCasesViral":148855,"deathConfirmed":null,"deathProbable":null,"fips":"06","positiveIncrease":3212,"negativeIncrease":74391,"total":2801996,"totalTestResults":2801996,"totalTestResultsIncrease":77603,"posNeg":2801996,"deathIncrease":74,"hospitalizedIncrease":0,"hash":"8ec10caaa34501147ee55810f4615452ad787716","commercialScore":0,"negativeRegularScore":0,"negativeScore":0,"positiveScore":0,"score":0,"grade":""},{"date":20200613,"state":"CA","positive":145643,"negative":2578750,"pending":null,"hospitalizedCurrently":4411,"hospitalizedCumulative":null,"inIcuCurrently":1313,"inIcuCumulative":null,"onVentilatorCurrently":null,"onVentilatorCumulative":null,"recovered":null,"dataQualityGrade":"B","lastUpdateEt":"6/13/2020 00:00","dateModified":"2020-06-13T00:00:00Z","checkTimeEt":"06/12 20:00","death":4989,"hospitalized":null,"dateChecked":"2020-06-13T00:00:00Z","totalTestsViral":2724393,"positiveTestsViral":null,"negativeTestsViral":null,"positiveCasesViral":145643,"deathConfirmed":null,"deathProbable":null,"fips":"06","positiveIncrease":3660,"negativeIncrease":58475,"total":2724393,"totalTestResults":2724393,"totalTestResultsIncrease":62135,"posNeg":2724393,"deathIncrease":46,"hospitalizedIncrease":0,"hash":"8abe61c9a2edacdf1ae9dd658c2e504f85b1e7e4","commercialScore":0,"negativeRegularScore":0,"negativeScore":0,"positiveScore":0,"score":0,"grade":""},{"date":20200612,"state":"CA","positive":141983,"negative":2520275,"pending":null,"hospitalizedCurrently":4480,"hospitalizedCumulative":null,"inIcuCurrently":1310,"inIcuCumulative":null,"onVentilatorCurrently":null,"onVentilatorCumulative":null,"recovered":null,"dataQualityGrade":"B","lastUpdateEt":"6/12/2020 00:00","dateModified":"2020-06-12T00:00:00Z","checkTimeEt":"06/11 20:00","death":4943,"hospitalized":null,"dateChecked":"2020-06-12T00:00:00Z","totalTestsViral":2662258,"positiveTestsViral":null,"negativeTestsViral":null,"positiveCasesViral":141983,"deathConfirmed":null,"deathProbable":null,"fips":"06","positiveIncrease":2702,"negativeIncrease":61909,"total":2662258,"totalTestResults":2662258,"totalTestResultsIncrease":64611,"posNeg":2662258,"deathIncrease":62,"hospitalizedIncrease":0,"hash":"24c6a347b087bc38e68bd2ab7fa5ed107644be5f","commercialScore":0,"negativeRegularScore":0,"negativeScore":0,"positiveScore":0,"score":0,"grade":""},{"date":20200611,"state":"CA","positive":139281,"negative":2458366,"pending":null,"hospitalizedCurrently":4534,"hospitalizedCumulative":null,"inIcuCurrently":1325,"inIcuCumulative":null,"onVentilatorCurrently":null,"onVentilatorCumulative":null,"recovered":null,"dataQualityGrade":"B","lastUpdateEt":"6/11/2020 00:00","dateModified":"2020-06-11T00:00:00Z","checkTimeEt":"06/10 20:00","death":4881,"hospitalized":null,"dateChecked":"2020-06-11T00:00:00Z","totalTestsViral":2597647,"positiveTestsViral":null,"negativeTestsViral":null,"positiveCasesViral":139281,"deathConfirmed":null,"deathProbable":null,"fips":"06","positiveIncrease":3090,"negativeIncrease":53759,"total":2597647,"totalTestResults":2597647,"totalTestResultsIncrease":56849,"posNeg":2597647,"deathIncrease":105,"hospitalizedIncrease":0,"hash":"c9a1819cb8e18b1313267a65be074454ffb63b4a","commercialScore":0,"negativeRegularScore":0,"negativeScore":0,"positiveScore":0,"score":0,"grade":""},{"date":20200610,"state":"CA","positive":136191,"negative":2404607,"pending":null,"hospitalizedCurrently":4719,"hospitalizedCumulative":null,"inIcuCurrently":1326,"inIcuCumulative":null,"onVentilatorCurrently":null,"onVentilatorCumulative":null,"recovered":null,"dataQualityGrade":"B","lastUpdateEt":"6/10/2020 00:00","dateModified":"2020-06-10T00:00:00Z","checkTimeEt":"06/09 20:00","death":4776,"hospitalized":null,"dateChecked":"2020-06-10T00:00:00Z","totalTestsViral":2540798,"positiveTestsViral":null,"negativeTestsViral":null,"positiveCasesViral":136191,"deathConfirmed":null,"deathProbable":null,"fips":"06","positiveIncrease":2702,"negativeIncrease":51851,"total":2540798,"totalTestResults":2540798,"totalTestResultsIncrease":54553,"posNeg":2540798,"deathIncrease":79,"hospitalizedIncrease":0,"hash":"d11845ea84afcc5a81d1089a4e3cec47402177fe","commercialScore":0,"negativeRegularScore":0,"negativeScore":0,"positiveScore":0,"score":0,"grade":""},{"date":20200609,"state":"CA","positive":133489,"negative":2352756,"pending":null,"hospitalizedCurrently":4583,"hospitalizedCumulative":null,"inIcuCurrently":1345,"inIcuCumulative":null,"onVentilatorCurrently":null,"onVentilatorCumulative":null,"recovered":null,"dataQualityGrade":"B","lastUpdateEt":"6/9/2020 00:00","dateModified":"2020-06-09T00:00:00Z","checkTimeEt":"06/08 20:00","death":4697,"hospitalized":null,"dateChecked":"2020-06-09T00:00:00Z","totalTestsViral":2486245,"positiveTestsViral":null,"negativeTestsViral":null,"positiveCasesViral":133489,"deathConfirmed":null,"deathProbable":null,"fips":"06","positiveIncrease":2170,"negativeIncrease":52885,"total":2486245,"totalTestResults":2486245,"totalTestResultsIncrease":55055,"posNeg":2486245,"deathIncrease":44,"hospitalizedIncrease":0,"hash":"063024cda4b333f8e99436f74235abc3e82c0ebe","commercialScore":0,"negativeRegularScore":0,"negativeScore":0,"positiveScore":0,"score":0,"grade":""},{"date":20200608,"state":"CA","positive":131319,"negative":2299871,"pending":null,"hospitalizedCurrently":4506,"hospitalizedCumulative":null,"inIcuCurrently":1301,"inIcuCumulative":null,"onVentilatorCurrently":null,"onVentilatorCumulative":null,"recovered":null,"dataQualityGrade":"B","lastUpdateEt":"6/8/2020 00:00","dateModified":"2020-06-08T00:00:00Z","checkTimeEt":"06/07 20:00","death":4653,"hospitalized":null,"dateChecked":"2020-06-08T00:00:00Z","totalTestsViral":2431190,"positiveTestsViral":null,"negativeTestsViral":null,"positiveCasesViral":131319,"deathConfirmed":null,"deathProbable":null,"fips":"06","positiveIncrease":2507,"negativeIncrease":66465,"total":2431190,"totalTestResults":2431190,"totalTestResultsIncrease":68972,"posNeg":2431190,"deathIncrease":27,"hospitalizedIncrease":0,"hash":"e57f0dda19d844877e6d34b3368c458fb7f88e7a","commercialScore":0,"negativeRegularScore":0,"negativeScore":0,"positiveScore":0,"score":0,"grade":""},{"date":20200607,"state":"CA","positive":128812,"negative":2233406,"pending":null,"hospitalizedCurrently":4525,"hospitalizedCumulative":null,"inIcuCurrently":1288,"inIcuCumulative":null,"onVentilatorCurrently":null,"onVentilatorCumulative":null,"recovered":null,"dataQualityGrade":"B","lastUpdateEt":"6/7/2020 00:00","dateModified":"2020-06-07T00:00:00Z","checkTimeEt":"06/06 20:00","death":4626,"hospitalized":null,"dateChecked":"2020-06-07T00:00:00Z","totalTestsViral":2362218,"positiveTestsViral":null,"negativeTestsViral":null,"positiveCasesViral":128812,"deathConfirmed":null,"deathProbable":null,"fips":"06","positiveIncrease":2796,"negativeIncrease":51122,"total":2362218,"totalTestResults":2362218,"totalTestResultsIncrease":53918,"posNeg":2362218,"deathIncrease":67,"hospitalizedIncrease":0,"hash":"a9074dad4b53d68e181fb234509e1fc516672f92","commercialScore":0,"negativeRegularScore":0,"negativeScore":0,"positiveScore":0,"score":0,"grade":""},{"date":20200606,"state":"CA","positive":126016,"negative":2182284,"pending":null,"hospitalizedCurrently":4526,"hospitalizedCumulative":null,"inIcuCurrently":1315,"inIcuCumulative":null,"onVentilatorCurrently":null,"onVentilatorCumulative":null,"recovered":null,"dataQualityGrade":"B","lastUpdateEt":"6/6/2020 00:00","dateModified":"2020-06-06T00:00:00Z","checkTimeEt":"06/05 20:00","death":4559,"hospitalized":null,"dateChecked":"2020-06-06T00:00:00Z","totalTestsViral":2308300,"positiveTestsViral":null,"negativeTestsViral":null,"positiveCasesViral":126016,"deathConfirmed":null,"deathProbable":null,"fips":"06","positiveIncrease":3115,"negativeIncrease":66722,"total":2308300,"totalTestResults":2308300,"totalTestResultsIncrease":69837,"posNeg":2308300,"deathIncrease":74,"hospitalizedIncrease":0,"hash":"54fa7b7a53ac5f8197193c74810e60a948317003","commercialScore":0,"negativeRegularScore":0,"negativeScore":0,"positiveScore":0,"score":0,"grade":""},{"date":20200605,"state":"CA","positive":122901,"negative":2115562,"pending":null,"hospitalizedCurrently":4625,"hospitalizedCumulative":null,"inIcuCurrently":1333,"inIcuCumulative":null,"onVentilatorCurrently":null,"onVentilatorCumulative":null,"recovered":null,"dataQualityGrade":"B","lastUpdateEt":"6/5/2020 00:00","dateModified":"2020-06-05T00:00:00Z","checkTimeEt":"06/04 20:00","death":4485,"hospitalized":null,"dateChecked":"2020-06-05T00:00:00Z","totalTestsViral":2238463,"positiveTestsViral":null,"negativeTestsViral":null,"positiveCasesViral":122901,"deathConfirmed":null,"deathProbable":null,"fips":"06","positiveIncrease":3094,"negativeIncrease":52698,"total":2238463,"totalTestResults":2238463,"totalTestResultsIncrease":55792,"posNeg":2238463,"deathIncrease":63,"hospitalizedIncrease":0,"hash":"79211c2762df45886774e0e7642ac77a8f53b034","commercialScore":0,"negativeRegularScore":0,"negativeScore":0,"positiveScore":0,"score":0,"grade":""},{"date":20200604,"state":"CA","positive":119807,"negative":2062864,"pending":null,"hospitalizedCurrently":4455,"hospitalizedCumulative":null,"inIcuCurrently":1279,"inIcuCumulative":null,"onVentilatorCurrently":null,"onVentilatorCumulative":null,"recovered":null,"dataQualityGrade":"B","lastUpdateEt":"6/4/2020 00:00","dateModified":"2020-06-04T00:00:00Z","checkTimeEt":"06/03 20:00","death":4422,"hospitalized":null,"dateChecked":"2020-06-04T00:00:00Z","totalTestsViral":2182671,"positiveTestsViral":null,"negativeTestsViral":null,"positiveCasesViral":119807,"deathConfirmed":null,"deathProbable":null,"fips":"06","positiveIncrease":2120,"negativeIncrease":49257,"total":2182671,"totalTestResults":2182671,"totalTestResultsIncrease":51377,"posNeg":2182671,"deathIncrease":61,"hospitalizedIncrease":0,"hash":"3ef40da3656dc1b10d2148ff6c8f341c6dc239fb","commercialScore":0,"negativeRegularScore":0,"negativeScore":0,"positiveScore":0,"score":0,"grade":""},{"date":20200603,"state":"CA","positive":117687,"negative":2013607,"pending":null,"hospitalizedCurrently":4458,"hospitalizedCumulative":null,"inIcuCurrently":1313,"inIcuCumulative":null,"onVentilatorCurrently":null,"onVentilatorCumulative":null,"recovered":null,"dataQualityGrade":"B","lastUpdateEt":"6/3/2020 00:00","dateModified":"2020-06-03T00:00:00Z","checkTimeEt":"06/02 20:00","death":4361,"hospitalized":null,"dateChecked":"2020-06-03T00:00:00Z","totalTestsViral":2131294,"positiveTestsViral":null,"negativeTestsViral":null,"positiveCasesViral":117687,"deathConfirmed":null,"deathProbable":null,"fips":"06","positiveIncrease":2377,"negativeIncrease":57326,"total":2131294,"totalTestResults":2131294,"totalTestResultsIncrease":59703,"posNeg":2131294,"deathIncrease":75,"hospitalizedIncrease":0,"hash":"0cff5a0753bf42cff26db5c54aec1d15938e1d99","commercialScore":0,"negativeRegularScore":0,"negativeScore":0,"positiveScore":0,"score":0,"grade":""},{"date":20200602,"state":"CA","positive":115310,"negative":1956281,"pending":null,"hospitalizedCurrently":4393,"hospitalizedCumulative":null,"inIcuCurrently":1286,"inIcuCumulative":null,"onVentilatorCurrently":null,"onVentilatorCumulative":null,"recovered":null,"dataQualityGrade":"B","lastUpdateEt":"6/2/2020 00:00","dateModified":"2020-06-02T00:00:00Z","checkTimeEt":"06/01 20:00","death":4286,"hospitalized":null,"dateChecked":"2020-06-02T00:00:00Z","totalTestsViral":2071591,"positiveTestsViral":null,"negativeTestsViral":null,"positiveCasesViral":115310,"deathConfirmed":null,"deathProbable":null,"fips":"06","positiveIncrease":2304,"negativeIncrease":56704,"total":2071591,"totalTestResults":2071591,"totalTestResultsIncrease":59008,"posNeg":2071591,"deathIncrease":35,"hospitalizedIncrease":0,"hash":"1f2fff2a36adb955b826d147bb4560d7355979ef","commercialScore":0,"negativeRegularScore":0,"negativeScore":0,"positiveScore":0,"score":0,"grade":""},{"date":20200601,"state":"CA","positive":113006,"negative":1899577,"pending":null,"hospitalizedCurrently":4258,"hospitalizedCumulative":null,"inIcuCurrently":1273,"inIcuCumulative":null,"onVentilatorCurrently":null,"onVentilatorCumulative":null,"recovered":null,"dataQualityGrade":"B","lastUpdateEt":"6/1/2020 00:00","dateModified":"2020-06-01T00:00:00Z","checkTimeEt":"05/31 20:00","death":4251,"hospitalized":null,"dateChecked":"2020-06-01T00:00:00Z","totalTestsViral":2012583,"positiveTestsViral":null,"negativeTestsViral":null,"positiveCasesViral":113006,"deathConfirmed":null,"deathProbable":null,"fips":"06","positiveIncrease":2423,"negativeIncrease":65312,"total":2012583,"totalTestResults":2012583,"totalTestResultsIncrease":67735,"posNeg":2012583,"deathIncrease":38,"hospitalizedIncrease":0,"hash":"2193019b91df5b12464561939c3cf7900dd28640","commercialScore":0,"negativeRegularScore":0,"negativeScore":0,"positiveScore":0,"score":0,"grade":""},{"date":20200531,"state":"CA","positive":110583,"negative":1834265,"pending":null,"hospitalizedCurrently":4331,"hospitalizedCumulative":null,"inIcuCurrently":1324,"inIcuCumulative":null,"onVentilatorCurrently":null,"onVentilatorCumulative":null,"recovered":null,"dataQualityGrade":"B","lastUpdateEt":"5/30/2020 00:00","dateModified":"2020-05-30T00:00:00Z","checkTimeEt":"05/29 20:00","death":4213,"hospitalized":null,"dateChecked":"2020-05-30T00:00:00Z","totalTestsViral":1944848,"positiveTestsViral":null,"negativeTestsViral":null,"positiveCasesViral":110583,"deathConfirmed":null,"deathProbable":null,"fips":"06","positiveIncrease":3705,"negativeIncrease":52548,"total":1944848,"totalTestResults":1944848,"totalTestResultsIncrease":56253,"posNeg":1944848,"deathIncrease":57,"hospitalizedIncrease":0,"hash":"9d05cc6041f3cb39003a37ad06f59cd31600c4c0","commercialScore":0,"negativeRegularScore":0,"negativeScore":0,"positiveScore":0,"score":0,"grade":""},{"date":20200530,"state":"CA","positive":106878,"negative":1781717,"pending":null,"hospitalizedCurrently":4215,"hospitalizedCumulative":null,"inIcuCurrently":1273,"inIcuCumulative":null,"onVentilatorCurrently":null,"onVentilatorCumulative":null,"recovered":null,"dataQualityGrade":"B","lastUpdateEt":"5/30/2020 00:00","dateModified":"2020-05-30T00:00:00Z","checkTimeEt":"05/29 20:00","death":4156,"hospitalized":null,"dateChecked":"2020-05-30T00:00:00Z","totalTestsViral":1888595,"positiveTestsViral":null,"negativeTestsViral":null,"positiveCasesViral":106878,"deathConfirmed":null,"deathProbable":null,"fips":"06","positiveIncrease":2992,"negativeIncrease":50125,"total":1888595,"totalTestResults":1888595,"totalTestResultsIncrease":53117,"posNeg":1888595,"deathIncrease":88,"hospitalizedIncrease":0,"hash":"eef8f25c19a54d0605a215343a64dbcc70e1c3d1","commercialScore":0,"negativeRegularScore":0,"negativeScore":0,"positiveScore":0,"score":0,"grade":""},{"date":20200529,"state":"CA","positive":103886,"negative":1731592,"pending":null,"hospitalizedCurrently":4414,"hospitalizedCumulative":null,"inIcuCurrently":1328,"inIcuCumulative":null,"onVentilatorCurrently":null,"onVentilatorCumulative":null,"recovered":null,"dataQualityGrade":"B","lastUpdateEt":"5/29/2020 00:00","dateModified":"2020-05-29T00:00:00Z","checkTimeEt":"05/28 20:00","death":4068,"hospitalized":null,"dateChecked":"2020-05-29T00:00:00Z","totalTestsViral":1835478,"positiveTestsViral":null,"negativeTestsViral":null,"positiveCasesViral":103886,"deathConfirmed":null,"deathProbable":null,"fips":"06","positiveIncrease":2189,"negativeIncrease":42730,"total":1835478,"totalTestResults":1835478,"totalTestResultsIncrease":44919,"posNeg":1835478,"deathIncrease":95,"hospitalizedIncrease":0,"hash":"117892ac08269231630752958470be8b061bf8ad","commercialScore":0,"negativeRegularScore":0,"negativeScore":0,"positiveScore":0,"score":0,"grade":""},{"date":20200528,"state":"CA","positive":101697,"negative":1688862,"pending":null,"hospitalizedCurrently":4529,"hospitalizedCumulative":null,"inIcuCurrently":1325,"inIcuCumulative":null,"onVentilatorCurrently":null,"onVentilatorCumulative":null,"recovered":null,"dataQualityGrade":"B","lastUpdateEt":"5/28/2020 00:00","dateModified":"2020-05-28T00:00:00Z","checkTimeEt":"05/27 20:00","death":3973,"hospitalized":null,"dateChecked":"2020-05-28T00:00:00Z","totalTestsViral":1790559,"positiveTestsViral":null,"negativeTestsViral":null,"positiveCasesViral":101697,"deathConfirmed":null,"deathProbable":null,"fips":"06","positiveIncrease":2717,"negativeIncrease":50948,"total":1790559,"totalTestResults":1790559,"totalTestResultsIncrease":53665,"posNeg":1790559,"deathIncrease":89,"hospitalizedIncrease":0,"hash":"02913d05ac38d628d14ce40e6d94aceb4ee61da3","commercialScore":0,"negativeRegularScore":0,"negativeScore":0,"positiveScore":0,"score":0,"grade":""},{"date":20200527,"state":"CA","positive":98980,"negative":1637914,"pending":null,"hospitalizedCurrently":4544,"hospitalizedCumulative":null,"inIcuCurrently":1407,"inIcuCumulative":null,"onVentilatorCurrently":null,"onVentilatorCumulative":null,"recovered":null,"dataQualityGrade":"B","lastUpdateEt":"5/27/2020 00:00","dateModified":"2020-05-27T00:00:00Z","checkTimeEt":"05/26 20:00","death":3884,"hospitalized":null,"dateChecked":"2020-05-27T00:00:00Z","totalTestsViral":1736894,"positiveTestsViral":null,"negativeTestsViral":null,"positiveCasesViral":98980,"deathConfirmed":null,"deathProbable":null,"fips":"06","positiveIncrease":2247,"negativeIncrease":38251,"total":1736894,"totalTestResults":1736894,"totalTestResultsIncrease":40498,"posNeg":1736894,"deathIncrease":70,"hospitalizedIncrease":0,"hash":"6e629184b1d556ec4999dc2faf8b235fd42d25d6","commercialScore":0,"negativeRegularScore":0,"negativeScore":0,"positiveScore":0,"score":0,"grade":""},{"date":20200526,"state":"CA","positive":96733,"negative":1599663,"pending":null,"hospitalizedCurrently":4404,"hospitalizedCumulative":null,"inIcuCurrently":1392,"inIcuCumulative":null,"onVentilatorCurrently":null,"onVentilatorCumulative":null,"recovered":null,"dataQualityGrade":"B","lastUpdateEt":"5/26/2020 00:00","dateModified":"2020-05-26T00:00:00Z","checkTimeEt":"05/25 20:00","death":3814,"hospitalized":null,"dateChecked":"2020-05-26T00:00:00Z","totalTestsViral":1696396,"positiveTestsViral":null,"negativeTestsViral":null,"positiveCasesViral":96733,"deathConfirmed":null,"deathProbable":null,"fips":"06","positiveIncrease":2175,"negativeIncrease":50119,"total":1696396,"totalTestResults":1696396,"totalTestResultsIncrease":52294,"posNeg":1696396,"deathIncrease":19,"hospitalizedIncrease":0,"hash":"c38db978f5993f65aa585c071edecf614b809897","commercialScore":0,"negativeRegularScore":0,"negativeScore":0,"positiveScore":0,"score":0,"grade":""},{"date":20200525,"state":"CA","positive":94558,"negative":1549544,"pending":null,"hospitalizedCurrently":4306,"hospitalizedCumulative":null,"inIcuCurrently":1301,"inIcuCumulative":null,"onVentilatorCurrently":null,"onVentilatorCumulative":null,"recovered":null,"dataQualityGrade":"B","lastUpdateEt":"5/25/2020 00:00","dateModified":"2020-05-25T00:00:00Z","checkTimeEt":"05/24 20:00","death":3795,"hospitalized":null,"dateChecked":"2020-05-25T00:00:00Z","totalTestsViral":1644102,"positiveTestsViral":null,"negativeTestsViral":null,"positiveCasesViral":94558,"deathConfirmed":null,"deathProbable":null,"fips":"06","positiveIncrease":1848,"negativeIncrease":59509,"total":1644102,"totalTestResults":1644102,"totalTestResultsIncrease":61357,"posNeg":1644102,"deathIncrease":21,"hospitalizedIncrease":0,"hash":"9fbe0f7312537d1a011479112cf5a82f16732d4f","commercialScore":0,"negativeRegularScore":0,"negativeScore":0,"positiveScore":0,"score":0,"grade":""},{"date":20200524,"state":"CA","positive":92710,"negative":1490035,"pending":null,"hospitalizedCurrently":4300,"hospitalizedCumulative":null,"inIcuCurrently":1315,"inIcuCumulative":null,"onVentilatorCurrently":null,"onVentilatorCumulative":null,"recovered":null,"dataQualityGrade":"B","lastUpdateEt":"5/24/2020 00:00","dateModified":"2020-05-24T00:00:00Z","checkTimeEt":"05/23 20:00","death":3774,"hospitalized":null,"dateChecked":"2020-05-24T00:00:00Z","totalTestsViral":1582745,"positiveTestsViral":null,"negativeTestsViral":null,"positiveCasesViral":92710,"deathConfirmed":null,"deathProbable":null,"fips":"06","positiveIncrease":2079,"negativeIncrease":65360,"total":1582745,"totalTestResults":1582745,"totalTestResultsIncrease":67439,"posNeg":1582745,"deathIncrease":66,"hospitalizedIncrease":0,"hash":"4515fbe92f5db42221d328351093c9b5113347ad","commercialScore":0,"negativeRegularScore":0,"negativeScore":0,"positiveScore":0,"score":0,"grade":""},{"date":20200523,"state":"CA","positive":90631,"negative":1424675,"pending":null,"hospitalizedCurrently":4342,"hospitalizedCumulative":null,"inIcuCurrently":1312,"inIcuCumulative":null,"onVentilatorCurrently":null,"onVentilatorCumulative":null,"recovered":null,"dataQualityGrade":"B","lastUpdateEt":"5/23/2020 00:00","dateModified":"2020-05-23T00:00:00Z","checkTimeEt":"05/22 20:00","death":3708,"hospitalized":null,"dateChecked":"2020-05-23T00:00:00Z","totalTestsViral":1515306,"positiveTestsViral":null,"negativeTestsViral":null,"positiveCasesViral":90631,"deathConfirmed":null,"deathProbable":null,"fips":"06","positiveIncrease":2187,"negativeIncrease":46346,"total":1515306,"totalTestResults":1515306,"totalTestResultsIncrease":48533,"posNeg":1515306,"deathIncrease":78,"hospitalizedIncrease":0,"hash":"5f32a18d0fc8a826617cd4f5ebdbc87c53a59cc1","commercialScore":0,"negativeRegularScore":0,"negativeScore":0,"positiveScore":0,"score":0,"grade":""},{"date":20200522,"state":"CA","positive":88444,"negative":1378329,"pending":null,"hospitalizedCurrently":4762,"hospitalizedCumulative":null,"inIcuCurrently":1317,"inIcuCumulative":null,"onVentilatorCurrently":null,"onVentilatorCumulative":null,"recovered":null,"dataQualityGrade":"B","lastUpdateEt":"5/21/2020 00:00","dateModified":"2020-05-21T00:00:00Z","checkTimeEt":"05/20 20:00","death":3630,"hospitalized":null,"dateChecked":"2020-05-21T00:00:00Z","totalTestsViral":1466773,"positiveTestsViral":null,"negativeTestsViral":null,"positiveCasesViral":88444,"deathConfirmed":null,"deathProbable":null,"fips":"06","positiveIncrease":2247,"negativeIncrease":43399,"total":1466773,"totalTestResults":1466773,"totalTestResultsIncrease":45646,"posNeg":1466773,"deathIncrease":88,"hospitalizedIncrease":0,"hash":"2451cb2b8fea14dcfd00951bd73ea884cf04deea","commercialScore":0,"negativeRegularScore":0,"negativeScore":0,"positiveScore":0,"score":0,"grade":""},{"date":20200521,"state":"CA","positive":86197,"negative":1334930,"pending":null,"hospitalizedCurrently":4735,"hospitalizedCumulative":null,"inIcuCurrently":1310,"inIcuCumulative":null,"onVentilatorCurrently":null,"onVentilatorCumulative":null,"recovered":null,"dataQualityGrade":"B","lastUpdateEt":"5/21/2020 00:00","dateModified":"2020-05-21T00:00:00Z","checkTimeEt":"05/20 20:00","death":3542,"hospitalized":null,"dateChecked":"2020-05-21T00:00:00Z","totalTestsViral":1421127,"positiveTestsViral":null,"negativeTestsViral":null,"positiveCasesViral":86197,"deathConfirmed":null,"deathProbable":null,"fips":"06","positiveIncrease":2140,"negativeIncrease":38867,"total":1421127,"totalTestResults":1421127,"totalTestResultsIncrease":41007,"posNeg":1421127,"deathIncrease":106,"hospitalizedIncrease":0,"hash":"19598ce6bacccc5f4d33f829214444dd82832353","commercialScore":0,"negativeRegularScore":0,"negativeScore":0,"positiveScore":0,"score":0,"grade":""},{"date":20200520,"state":"CA","positive":84057,"negative":1296063,"pending":null,"hospitalizedCurrently":4681,"hospitalizedCumulative":null,"inIcuCurrently":1345,"inIcuCumulative":null,"onVentilatorCurrently":null,"onVentilatorCumulative":null,"recovered":null,"dataQualityGrade":"B","lastUpdateEt":"5/20/2020 00:00","dateModified":"2020-05-20T00:00:00Z","checkTimeEt":"05/19 20:00","death":3436,"hospitalized":null,"dateChecked":"2020-05-20T00:00:00Z","totalTestsViral":1380120,"positiveTestsViral":null,"negativeTestsViral":null,"positiveCasesViral":84057,"deathConfirmed":null,"deathProbable":null,"fips":"06","positiveIncrease":2262,"negativeIncrease":38542,"total":1380120,"totalTestResults":1380120,"totalTestResultsIncrease":40804,"posNeg":1380120,"deathIncrease":102,"hospitalizedIncrease":0,"hash":"5da3ce82fc96aa345a76a945008c379968918f9b","commercialScore":0,"negativeRegularScore":0,"negativeScore":0,"positiveScore":0,"score":0,"grade":""},{"date":20200519,"state":"CA","positive":81795,"negative":1257521,"pending":null,"hospitalizedCurrently":4363,"hospitalizedCumulative":null,"inIcuCurrently":1307,"inIcuCumulative":null,"onVentilatorCurrently":null,"onVentilatorCumulative":null,"recovered":null,"dataQualityGrade":"B","lastUpdateEt":"5/19/2020 00:00","dateModified":"2020-05-19T00:00:00Z","checkTimeEt":"05/18 20:00","death":3334,"hospitalized":null,"dateChecked":"2020-05-19T00:00:00Z","totalTestsViral":1339316,"positiveTestsViral":null,"negativeTestsViral":null,"positiveCasesViral":81795,"deathConfirmed":null,"deathProbable":null,"fips":"06","positiveIncrease":1365,"negativeIncrease":45279,"total":1339316,"totalTestResults":1339316,"totalTestResultsIncrease":46644,"posNeg":1339316,"deathIncrease":32,"hospitalizedIncrease":0,"hash":"e92fe20b31ac1e874e6e17552049ff3de6721027","commercialScore":0,"negativeRegularScore":0,"negativeScore":0,"positiveScore":0,"score":0,"grade":""},{"date":20200518,"state":"CA","positive":80430,"negative":1212242,"pending":null,"hospitalizedCurrently":4391,"hospitalizedCumulative":null,"inIcuCurrently":1325,"inIcuCumulative":null,"onVentilatorCurrently":null,"onVentilatorCumulative":null,"recovered":null,"dataQualityGrade":"B","lastUpdateEt":"5/17/2020 00:00","dateModified":"2020-05-17T00:00:00Z","checkTimeEt":"05/16 20:00","death":3302,"hospitalized":null,"dateChecked":"2020-05-17T00:00:00Z","totalTestsViral":1292672,"positiveTestsViral":null,"negativeTestsViral":null,"positiveCasesViral":80430,"deathConfirmed":null,"deathProbable":null,"fips":"06","positiveIncrease":1591,"negativeIncrease":55838,"total":1292672,"totalTestResults":1292672,"totalTestResultsIncrease":57429,"posNeg":1292672,"deathIncrease":41,"hospitalizedIncrease":0,"hash":"653d8766f30c9e58f78c43aaa0ee1578f58e7c48","commercialScore":0,"negativeRegularScore":0,"negativeScore":0,"positiveScore":0,"score":0,"grade":""},{"date":20200517,"state":"CA","positive":78839,"negative":1156404,"pending":null,"hospitalizedCurrently":4291,"hospitalizedCumulative":null,"inIcuCurrently":1293,"inIcuCumulative":null,"onVentilatorCurrently":null,"onVentilatorCumulative":null,"recovered":null,"dataQualityGrade":"B","lastUpdateEt":"5/17/2020 00:00","dateModified":"2020-05-17T00:00:00Z","checkTimeEt":"05/16 20:00","death":3261,"hospitalized":null,"dateChecked":"2020-05-17T00:00:00Z","totalTestsViral":1235243,"positiveTestsViral":null,"negativeTestsViral":null,"positiveCasesViral":78839,"deathConfirmed":null,"deathProbable":null,"fips":"06","positiveIncrease":2046,"negativeIncrease":54071,"total":1235243,"totalTestResults":1235243,"totalTestResultsIncrease":56117,"posNeg":1235243,"deathIncrease":57,"hospitalizedIncrease":0,"hash":"9020a9024bef06b6867c5b78a7df790ccfcb0f3e","commercialScore":0,"negativeRegularScore":0,"negativeScore":0,"positiveScore":0,"score":0,"grade":""},{"date":20200516,"state":"CA","positive":76793,"negative":1102333,"pending":null,"hospitalizedCurrently":4424,"hospitalizedCumulative":null,"inIcuCurrently":1313,"inIcuCumulative":null,"onVentilatorCurrently":null,"onVentilatorCumulative":null,"recovered":null,"dataQualityGrade":"B","lastUpdateEt":"5/16/2020 00:00","dateModified":"2020-05-16T00:00:00Z","checkTimeEt":"05/15 20:00","death":3204,"hospitalized":null,"dateChecked":"2020-05-16T00:00:00Z","totalTestsViral":1179126,"positiveTestsViral":null,"negativeTestsViral":null,"positiveCasesViral":76793,"deathConfirmed":null,"deathProbable":null,"fips":"06","positiveIncrease":1857,"negativeIncrease":43363,"total":1179126,"totalTestResults":1179126,"totalTestResultsIncrease":45220,"posNeg":1179126,"deathIncrease":96,"hospitalizedIncrease":0,"hash":"7c5ea7e3cb4780ba8536faf15ab5abe41c073a32","commercialScore":0,"negativeRegularScore":0,"negativeScore":0,"positiveScore":0,"score":0,"grade":""},{"date":20200515,"state":"CA","positive":74936,"negative":1058970,"pending":null,"hospitalizedCurrently":4519,"hospitalizedCumulative":null,"inIcuCurrently":1324,"inIcuCumulative":null,"onVentilatorCurrently":null,"onVentilatorCumulative":null,"recovered":null,"dataQualityGrade":"B","lastUpdateEt":"5/14/2020 00:00","dateModified":"2020-05-14T00:00:00Z","checkTimeEt":"05/13 20:00","death":3108,"hospitalized":null,"dateChecked":"2020-05-14T00:00:00Z","totalTestsViral":1133906,"positiveTestsViral":null,"negativeTestsViral":null,"positiveCasesViral":74936,"deathConfirmed":null,"deathProbable":null,"fips":"06","positiveIncrease":1772,"negativeIncrease":27483,"total":1133906,"totalTestResults":1133906,"totalTestResultsIncrease":29255,"posNeg":1133906,"deathIncrease":76,"hospitalizedIncrease":0,"hash":"90715a2259b4225cac42f59d07ad76f3d4c22910","commercialScore":0,"negativeRegularScore":0,"negativeScore":0,"positiveScore":0,"score":0,"grade":""},{"date":20200514,"state":"CA","positive":73164,"negative":1031487,"pending":null,"hospitalizedCurrently":4655,"hospitalizedCumulative":null,"inIcuCurrently":1324,"inIcuCumulative":null,"onVentilatorCurrently":null,"onVentilatorCumulative":null,"recovered":null,"dataQualityGrade":"B","lastUpdateEt":"5/14/2020 00:00","dateModified":"2020-05-14T00:00:00Z","checkTimeEt":"05/13 20:00","death":3032,"hospitalized":null,"dateChecked":"2020-05-14T00:00:00Z","totalTestsViral":1104651,"positiveTestsViral":null,"negativeTestsViral":null,"positiveCasesViral":73164,"deathConfirmed":null,"deathProbable":null,"fips":"06","positiveIncrease":2023,"negativeIncrease":37036,"total":1104651,"totalTestResults":1104651,"totalTestResultsIncrease":39059,"posNeg":1104651,"deathIncrease":98,"hospitalizedIncrease":0,"hash":"c033ef2dde856fb66c674148154ea68942a9b5f3","commercialScore":0,"negativeRegularScore":0,"negativeScore":0,"positiveScore":0,"score":0,"grade":""},{"date":20200513,"state":"CA","positive":71141,"negative":994451,"pending":null,"hospitalizedCurrently":4545,"hospitalizedCumulative":null,"inIcuCurrently":1314,"inIcuCumulative":null,"onVentilatorCurrently":null,"onVentilatorCumulative":null,"recovered":null,"dataQualityGrade":"B","lastUpdateEt":"5/13/2020 00:00","dateModified":"2020-05-13T00:00:00Z","checkTimeEt":"05/12 20:00","death":2934,"hospitalized":null,"dateChecked":"2020-05-13T00:00:00Z","totalTestsViral":1065592,"positiveTestsViral":null,"negativeTestsViral":null,"positiveCasesViral":71141,"deathConfirmed":null,"deathProbable":null,"fips":"06","positiveIncrease":1759,"negativeIncrease":30463,"total":1065592,"totalTestResults":1065592,"totalTestResultsIncrease":32222,"posNeg":1065592,"deathIncrease":87,"hospitalizedIncrease":0,"hash":"8e187e828d63eaee485f416d303f6477e5642705","commercialScore":0,"negativeRegularScore":0,"negativeScore":0,"positiveScore":0,"score":0,"grade":""},{"date":20200512,"state":"CA","positive":69382,"negative":963988,"pending":null,"hospitalizedCurrently":4544,"hospitalizedCumulative":null,"inIcuCurrently":1349,"inIcuCumulative":null,"onVentilatorCurrently":null,"onVentilatorCumulative":null,"recovered":null,"dataQualityGrade":"B","lastUpdateEt":"5/12/2020 00:00","dateModified":"2020-05-12T00:00:00Z","checkTimeEt":"05/11 20:00","death":2847,"hospitalized":null,"dateChecked":"2020-05-12T00:00:00Z","totalTestsViral":1033370,"positiveTestsViral":null,"negativeTestsViral":null,"positiveCasesViral":69382,"deathConfirmed":null,"deathProbable":null,"fips":"06","positiveIncrease":1443,"negativeIncrease":40030,"total":1033370,"totalTestResults":1033370,"totalTestResultsIncrease":41473,"posNeg":1033370,"deathIncrease":77,"hospitalizedIncrease":0,"hash":"6b8c86d4a692db0c8e724e6b7f516673643657f4","commercialScore":0,"negativeRegularScore":0,"negativeScore":0,"positiveScore":0,"score":0,"grade":""},{"date":20200511,"state":"CA","positive":67939,"negative":923958,"pending":null,"hospitalizedCurrently":4549,"hospitalizedCumulative":null,"inIcuCurrently":1329,"inIcuCumulative":null,"onVentilatorCurrently":null,"onVentilatorCumulative":null,"recovered":null,"dataQualityGrade":"B","lastUpdateEt":"5/11/2020 00:00","dateModified":"2020-05-11T00:00:00Z","checkTimeEt":"05/10 20:00","death":2770,"hospitalized":null,"dateChecked":"2020-05-11T00:00:00Z","totalTestsViral":991897,"positiveTestsViral":null,"negativeTestsViral":null,"positiveCasesViral":67939,"deathConfirmed":null,"deathProbable":null,"fips":"06","positiveIncrease":1259,"negativeIncrease":34974,"total":991897,"totalTestResults":991897,"totalTestResultsIncrease":36233,"posNeg":991897,"deathIncrease":25,"hospitalizedIncrease":0,"hash":"12b426f187253cd231cb50d09ec703983131f3e6","commercialScore":0,"negativeRegularScore":0,"negativeScore":0,"positiveScore":0,"score":0,"grade":""},{"date":20200510,"state":"CA","positive":66680,"negative":888984,"pending":null,"hospitalizedCurrently":4555,"hospitalizedCumulative":null,"inIcuCurrently":1328,"inIcuCumulative":null,"onVentilatorCurrently":null,"onVentilatorCumulative":null,"recovered":null,"dataQualityGrade":"B","lastUpdateEt":"5/10/2020 00:00","dateModified":"2020-05-10T00:00:00Z","checkTimeEt":"05/09 20:00","death":2745,"hospitalized":null,"dateChecked":"2020-05-10T00:00:00Z","totalTestsViral":955664,"positiveTestsViral":null,"negativeTestsViral":null,"positiveCasesViral":66680,"deathConfirmed":null,"deathProbable":null,"fips":"06","positiveIncrease":2119,"negativeIncrease":40975,"total":955664,"totalTestResults":955664,"totalTestResultsIncrease":43094,"posNeg":955664,"deathIncrease":67,"hospitalizedIncrease":0,"hash":"eb2e8da2b3c51f8d14b74d55da8862a8f1419100","commercialScore":0,"negativeRegularScore":0,"negativeScore":0,"positiveScore":0,"score":0,"grade":""},{"date":20200509,"state":"CA","positive":64561,"negative":848009,"pending":null,"hospitalizedCurrently":4538,"hospitalizedCumulative":null,"inIcuCurrently":1349,"inIcuCumulative":null,"onVentilatorCurrently":null,"onVentilatorCumulative":null,"recovered":null,"dataQualityGrade":"B","lastUpdateEt":"5/9/2020 14:00","dateModified":"2020-05-09T14:00:00Z","checkTimeEt":"05/09 10:00","death":2678,"hospitalized":null,"dateChecked":"2020-05-09T14:00:00Z","totalTestsViral":912570,"positiveTestsViral":null,"negativeTestsViral":null,"positiveCasesViral":64561,"deathConfirmed":null,"deathProbable":null,"fips":"06","positiveIncrease":2049,"negativeIncrease":35249,"total":912570,"totalTestResults":912570,"totalTestResultsIncrease":37298,"posNeg":912570,"deathIncrease":93,"hospitalizedIncrease":0,"hash":"33e01fa656732cd4fce3a2e81d3d5d691aa1cf06","commercialScore":0,"negativeRegularScore":0,"negativeScore":0,"positiveScore":0,"score":0,"grade":""},{"date":20200508,"state":"CA","positive":62512,"negative":812760,"pending":null,"hospitalizedCurrently":4514,"hospitalizedCumulative":null,"inIcuCurrently":1342,"inIcuCumulative":null,"onVentilatorCurrently":null,"onVentilatorCumulative":null,"recovered":null,"dataQualityGrade":"B","lastUpdateEt":"5/8/2020 14:00","dateModified":"2020-05-08T14:00:00Z","checkTimeEt":"05/08 10:00","death":2585,"hospitalized":null,"dateChecked":"2020-05-08T14:00:00Z","totalTestsViral":875272,"positiveTestsViral":null,"negativeTestsViral":null,"positiveCasesViral":62512,"deathConfirmed":null,"deathProbable":null,"fips":"06","positiveIncrease":1898,"negativeIncrease":30500,"total":875272,"totalTestResults":875272,"totalTestResultsIncrease":32398,"posNeg":875272,"deathIncrease":81,"hospitalizedIncrease":0,"hash":"c1ee26c12f682cb4095f4f8f4c22fe53d96e2d3e","commercialScore":0,"negativeRegularScore":0,"negativeScore":0,"positiveScore":0,"score":0,"grade":""},{"date":20200507,"state":"CA","positive":60614,"negative":782260,"pending":null,"hospitalizedCurrently":4560,"hospitalizedCumulative":null,"inIcuCurrently":1374,"inIcuCumulative":null,"onVentilatorCurrently":null,"onVentilatorCumulative":null,"recovered":null,"dataQualityGrade":"B","lastUpdateEt":"5/7/2020 14:00","dateModified":"2020-05-07T14:00:00Z","checkTimeEt":"05/07 10:00","death":2504,"hospitalized":null,"dateChecked":"2020-05-07T14:00:00Z","totalTestsViral":842874,"positiveTestsViral":null,"negativeTestsViral":null,"positiveCasesViral":60614,"deathConfirmed":null,"deathProbable":null,"fips":"06","positiveIncrease":1799,"negativeIncrease":32039,"total":842874,"totalTestResults":842874,"totalTestResultsIncrease":33838,"posNeg":842874,"deathIncrease":92,"hospitalizedIncrease":0,"hash":"a74b7a19547a641dc60af89bd28e9c229eda72a7","commercialScore":0,"negativeRegularScore":0,"negativeScore":0,"positiveScore":0,"score":0,"grade":""},{"date":20200506,"state":"CA","positive":58815,"negative":750221,"pending":null,"hospitalizedCurrently":4681,"hospitalizedCumulative":null,"inIcuCurrently":1415,"inIcuCumulative":null,"onVentilatorCurrently":null,"onVentilatorCumulative":null,"recovered":null,"dataQualityGrade":"B","lastUpdateEt":"5/5/2020 14:00","dateModified":"2020-05-05T14:00:00Z","checkTimeEt":"05/05 10:00","death":2412,"hospitalized":null,"dateChecked":"2020-05-05T14:00:00Z","totalTestsViral":809036,"positiveTestsViral":null,"negativeTestsViral":null,"positiveCasesViral":58815,"deathConfirmed":null,"deathProbable":null,"fips":"06","positiveIncrease":2603,"negativeIncrease":26531,"total":809036,"totalTestResults":809036,"totalTestResultsIncrease":29134,"posNeg":809036,"deathIncrease":95,"hospitalizedIncrease":0,"hash":"982b6dde71bd120abc2e9e35dec1d0cf9993c29a","commercialScore":0,"negativeRegularScore":0,"negativeScore":0,"positiveScore":0,"score":0,"grade":""},{"date":20200505,"state":"CA","positive":56212,"negative":723690,"pending":null,"hospitalizedCurrently":4622,"hospitalizedCumulative":null,"inIcuCurrently":1388,"inIcuCumulative":null,"onVentilatorCurrently":null,"onVentilatorCumulative":null,"recovered":null,"dataQualityGrade":"B","lastUpdateEt":"5/5/2020 14:00","dateModified":"2020-05-05T14:00:00Z","checkTimeEt":"05/05 10:00","death":2317,"hospitalized":null,"dateChecked":"2020-05-05T14:00:00Z","totalTestsViral":779902,"positiveTestsViral":null,"negativeTestsViral":null,"positiveCasesViral":56212,"deathConfirmed":null,"deathProbable":null,"fips":"06","positiveIncrease":1275,"negativeIncrease":30753,"total":779902,"totalTestResults":779902,"totalTestResultsIncrease":32028,"posNeg":779902,"deathIncrease":63,"hospitalizedIncrease":0,"hash":"e0e17582844634d37e6d5ae5b38893188c22b5e0","commercialScore":0,"negativeRegularScore":0,"negativeScore":0,"positiveScore":0,"score":0,"grade":""},{"date":20200504,"state":"CA","positive":54937,"negative":692937,"pending":null,"hospitalizedCurrently":4616,"hospitalizedCumulative":null,"inIcuCurrently":1464,"inIcuCumulative":null,"onVentilatorCurrently":null,"onVentilatorCumulative":null,"recovered":null,"dataQualityGrade":"B","lastUpdateEt":"5/4/2020 14:00","dateModified":"2020-05-04T14:00:00Z","checkTimeEt":"05/04 10:00","death":2254,"hospitalized":null,"dateChecked":"2020-05-04T14:00:00Z","totalTestsViral":747874,"positiveTestsViral":null,"negativeTestsViral":null,"positiveCasesViral":54937,"deathConfirmed":null,"deathProbable":null,"fips":"06","positiveIncrease":1321,"negativeIncrease":30802,"total":747874,"totalTestResults":747874,"totalTestResultsIncrease":32123,"posNeg":747874,"deathIncrease":39,"hospitalizedIncrease":0,"hash":"b5ab431ab0f8d9ef7184dc095dacc8b75bc668d8","commercialScore":0,"negativeRegularScore":0,"negativeScore":0,"positiveScore":0,"score":0,"grade":""},{"date":20200503,"state":"CA","positive":53616,"negative":662135,"pending":null,"hospitalizedCurrently":4734,"hospitalizedCumulative":null,"inIcuCurrently":1468,"inIcuCumulative":null,"onVentilatorCurrently":null,"onVentilatorCumulative":null,"recovered":null,"dataQualityGrade":"B","lastUpdateEt":"5/3/2020 14:00","dateModified":"2020-05-03T14:00:00Z","checkTimeEt":"05/03 10:00","death":2215,"hospitalized":null,"dateChecked":"2020-05-03T14:00:00Z","totalTestsViral":715751,"positiveTestsViral":null,"negativeTestsViral":null,"positiveCasesViral":53616,"deathConfirmed":null,"deathProbable":null,"fips":"06","positiveIncrease":1419,"negativeIncrease":27529,"total":715751,"totalTestResults":715751,"totalTestResultsIncrease":28948,"posNeg":715751,"deathIncrease":44,"hospitalizedIncrease":0,"hash":"fcd137590002d89dba05ccfe7f9b63bda4e8c78b","commercialScore":0,"negativeRegularScore":0,"negativeScore":0,"positiveScore":0,"score":0,"grade":""},{"date":20200502,"state":"CA","positive":52197,"negative":634606,"pending":null,"hospitalizedCurrently":4722,"hospitalizedCumulative":null,"inIcuCurrently":1433,"inIcuCumulative":null,"onVentilatorCurrently":null,"onVentilatorCumulative":null,"recovered":null,"dataQualityGrade":"B","lastUpdateEt":"5/1/2020 00:00","dateModified":"2020-05-01T00:00:00Z","checkTimeEt":"04/30 20:00","death":2171,"hospitalized":null,"dateChecked":"2020-05-01T00:00:00Z","totalTestsViral":685048,"positiveTestsViral":null,"negativeTestsViral":null,"positiveCasesViral":52197,"deathConfirmed":null,"deathProbable":null,"fips":"06","positiveIncrease":1755,"negativeIncrease":30063,"total":686803,"totalTestResults":686803,"totalTestResultsIncrease":31818,"posNeg":686803,"deathIncrease":98,"hospitalizedIncrease":0,"hash":"0f3ba3b7291f9c6b238da50e569f965e4678b08d","commercialScore":0,"negativeRegularScore":0,"negativeScore":0,"positiveScore":0,"score":0,"grade":""},{"date":20200501,"state":"CA","positive":50442,"negative":604543,"pending":null,"hospitalizedCurrently":4706,"hospitalizedCumulative":null,"inIcuCurrently":1434,"inIcuCumulative":null,"onVentilatorCurrently":null,"onVentilatorCumulative":null,"recovered":null,"dataQualityGrade":"B","lastUpdateEt":"4/30/2020 00:00","dateModified":"2020-04-30T00:00:00Z","checkTimeEt":"04/29 20:00","death":2073,"hospitalized":null,"dateChecked":"2020-04-30T00:00:00Z","totalTestsViral":654985,"positiveTestsViral":null,"negativeTestsViral":null,"positiveCasesViral":50442,"deathConfirmed":null,"deathProbable":null,"fips":"06","positiveIncrease":1525,"negativeIncrease":28123,"total":654985,"totalTestResults":654985,"totalTestResultsIncrease":29648,"posNeg":654985,"deathIncrease":91,"hospitalizedIncrease":0,"hash":"82760deb442447d5b522a6fa7205cdb5bcc8c8ab","commercialScore":0,"negativeRegularScore":0,"negativeScore":0,"positiveScore":0,"score":0,"grade":""},{"date":20200430,"state":"CA","positive":48917,"negative":576420,"pending":null,"hospitalizedCurrently":4981,"hospitalizedCumulative":null,"inIcuCurrently":1473,"inIcuCumulative":null,"onVentilatorCurrently":null,"onVentilatorCumulative":null,"recovered":null,"dataQualityGrade":"B","lastUpdateEt":"4/29/2020 00:00","dateModified":"2020-04-29T00:00:00Z","checkTimeEt":"04/28 20:00","death":1982,"hospitalized":null,"dateChecked":"2020-04-29T00:00:00Z","totalTestsViral":625337,"positiveTestsViral":null,"negativeTestsViral":null,"positiveCasesViral":48917,"deathConfirmed":null,"deathProbable":null,"fips":"06","positiveIncrease":2417,"negativeIncrease":19781,"total":625337,"totalTestResults":625337,"totalTestResultsIncrease":22198,"posNeg":625337,"deathIncrease":95,"hospitalizedIncrease":0,"hash":"7aafbf7210f7cb231bd89ed687141f7bae85827c","commercialScore":0,"negativeRegularScore":0,"negativeScore":0,"positiveScore":0,"score":0,"grade":""},{"date":20200429,"state":"CA","positive":46500,"negative":556639,"pending":null,"hospitalizedCurrently":5011,"hospitalizedCumulative":null,"inIcuCurrently":1512,"inIcuCumulative":null,"onVentilatorCurrently":null,"onVentilatorCumulative":null,"recovered":null,"dataQualityGrade":"B","lastUpdateEt":"4/29/2020 00:00","dateModified":"2020-04-29T00:00:00Z","checkTimeEt":"04/28 20:00","death":1887,"hospitalized":null,"dateChecked":"2020-04-29T00:00:00Z","totalTestsViral":603139,"positiveTestsViral":null,"negativeTestsViral":null,"positiveCasesViral":46500,"deathConfirmed":null,"deathProbable":null,"fips":"06","positiveIncrease":1469,"negativeIncrease":24062,"total":603139,"totalTestResults":603139,"totalTestResultsIncrease":25531,"posNeg":603139,"deathIncrease":78,"hospitalizedIncrease":0,"hash":"9296990871a4793bab1b9eb7d0401ab29b298da9","commercialScore":0,"negativeRegularScore":0,"negativeScore":0,"positiveScore":0,"score":0,"grade":""},{"date":20200428,"state":"CA","positive":45031,"negative":532577,"pending":null,"hospitalizedCurrently":4983,"hospitalizedCumulative":null,"inIcuCurrently":1485,"inIcuCumulative":null,"onVentilatorCurrently":null,"onVentilatorCumulative":null,"recovered":null,"dataQualityGrade":"B","lastUpdateEt":"4/27/2020 00:00","dateModified":"2020-04-27T00:00:00Z","checkTimeEt":"04/26 20:00","death":1809,"hospitalized":null,"dateChecked":"2020-04-27T00:00:00Z","totalTestsViral":577608,"positiveTestsViral":null,"negativeTestsViral":null,"positiveCasesViral":null,"deathConfirmed":null,"deathProbable":null,"fips":"06","positiveIncrease":1567,"negativeIncrease":22632,"total":577608,"totalTestResults":577608,"totalTestResultsIncrease":24199,"posNeg":577608,"deathIncrease":54,"hospitalizedIncrease":0,"hash":"8085981ca237ff96cbb02c4e93c0f4fd9e7ced06","commercialScore":0,"negativeRegularScore":0,"negativeScore":0,"positiveScore":0,"score":0,"grade":""},{"date":20200427,"state":"CA","positive":43464,"negative":509945,"pending":null,"hospitalizedCurrently":4878,"hospitalizedCumulative":null,"inIcuCurrently":1499,"inIcuCumulative":null,"onVentilatorCurrently":null,"onVentilatorCumulative":null,"recovered":null,"dataQualityGrade":"B","lastUpdateEt":"4/27/2020 00:00","dateModified":"2020-04-27T00:00:00Z","checkTimeEt":"04/26 20:00","death":1755,"hospitalized":null,"dateChecked":"2020-04-27T00:00:00Z","totalTestsViral":553409,"positiveTestsViral":null,"negativeTestsViral":null,"positiveCasesViral":null,"deathConfirmed":null,"deathProbable":null,"fips":"06","positiveIncrease":1300,"negativeIncrease":26025,"total":553409,"totalTestResults":553409,"totalTestResultsIncrease":27325,"posNeg":553409,"deathIncrease":45,"hospitalizedIncrease":0,"hash":"ec6b3726017c1cd3cffb26779fde00a0b4b84ac2","commercialScore":0,"negativeRegularScore":0,"negativeScore":0,"positiveScore":0,"score":0,"grade":""},{"date":20200426,"state":"CA","positive":42164,"negative":483920,"pending":null,"hospitalizedCurrently":4928,"hospitalizedCumulative":null,"inIcuCurrently":1473,"inIcuCumulative":null,"onVentilatorCurrently":null,"onVentilatorCumulative":null,"recovered":null,"dataQualityGrade":"B","lastUpdateEt":"4/25/2020 00:00","dateModified":"2020-04-25T00:00:00Z","checkTimeEt":"04/24 20:00","death":1710,"hospitalized":null,"dateChecked":"2020-04-25T00:00:00Z","totalTestsViral":526084,"positiveTestsViral":null,"negativeTestsViral":null,"positiveCasesViral":null,"deathConfirmed":null,"deathProbable":null,"fips":"06","positiveIncrease":1027,"negativeIncrease":19022,"total":526084,"totalTestResults":526084,"totalTestResultsIncrease":20049,"posNeg":526084,"deathIncrease":59,"hospitalizedIncrease":0,"hash":"2aed19c4de6ecf96de47ecc07e3772777253d65e","commercialScore":0,"negativeRegularScore":0,"negativeScore":0,"positiveScore":0,"score":0,"grade":""},{"date":20200425,"state":"CA","positive":41137,"negative":464898,"pending":null,"hospitalizedCurrently":4847,"hospitalizedCumulative":null,"inIcuCurrently":1458,"inIcuCumulative":null,"onVentilatorCurrently":null,"onVentilatorCumulative":null,"recovered":null,"dataQualityGrade":"B","lastUpdateEt":"4/23/2020 00:00","dateModified":"2020-04-23T00:00:00Z","checkTimeEt":"04/22 20:00","death":1651,"hospitalized":null,"dateChecked":"2020-04-23T00:00:00Z","totalTestsViral":506035,"positiveTestsViral":null,"negativeTestsViral":null,"positiveCasesViral":null,"deathConfirmed":null,"deathProbable":null,"fips":"06","positiveIncrease":1883,"negativeIncrease":9979,"total":506035,"totalTestResults":506035,"totalTestResultsIncrease":11862,"posNeg":506035,"deathIncrease":89,"hospitalizedIncrease":0,"hash":"297bae396fb5905171d683986a1bd104e16c7444","commercialScore":0,"negativeRegularScore":0,"negativeScore":0,"positiveScore":0,"score":0,"grade":""},{"date":20200424,"state":"CA","positive":39254,"negative":454919,"pending":null,"hospitalizedCurrently":4880,"hospitalizedCumulative":null,"inIcuCurrently":1521,"inIcuCumulative":null,"onVentilatorCurrently":null,"onVentilatorCumulative":null,"recovered":null,"dataQualityGrade":"B","lastUpdateEt":"4/23/2020 00:00","dateModified":"2020-04-23T00:00:00Z","checkTimeEt":"04/22 20:00","death":1562,"hospitalized":null,"dateChecked":"2020-04-23T00:00:00Z","totalTestsViral":494173,"positiveTestsViral":null,"negativeTestsViral":null,"positiveCasesViral":null,"deathConfirmed":null,"deathProbable":null,"fips":"06","positiveIncrease":1885,"negativeIncrease":10191,"total":494173,"totalTestResults":494173,"totalTestResultsIncrease":12076,"posNeg":494173,"deathIncrease":93,"hospitalizedIncrease":0,"hash":"f6545a11ae5ad37cb5338214613735287c2ad6fd","commercialScore":0,"negativeRegularScore":0,"negativeScore":0,"positiveScore":0,"score":0,"grade":""},{"date":20200423,"state":"CA","positive":37369,"negative":444728,"pending":null,"hospitalizedCurrently":4929,"hospitalizedCumulative":null,"inIcuCurrently":1531,"inIcuCumulative":null,"onVentilatorCurrently":null,"onVentilatorCumulative":null,"recovered":null,"dataQualityGrade":"B","lastUpdateEt":"4/22/2020 00:00","dateModified":"2020-04-22T00:00:00Z","checkTimeEt":"04/21 20:00","death":1469,"hospitalized":null,"dateChecked":"2020-04-22T00:00:00Z","totalTestsViral":482097,"positiveTestsViral":null,"negativeTestsViral":null,"positiveCasesViral":null,"deathConfirmed":null,"deathProbable":null,"fips":"06","positiveIncrease":1973,"negativeIncrease":14797,"total":482097,"totalTestResults":482097,"totalTestResultsIncrease":16770,"posNeg":482097,"deathIncrease":115,"hospitalizedIncrease":0,"hash":"a2f09940d362d5097ea1a9f3bdea4767e868b07c","commercialScore":0,"negativeRegularScore":0,"negativeScore":0,"positiveScore":0,"score":0,"grade":""},{"date":20200422,"state":"CA","positive":35396,"negative":429931,"pending":null,"hospitalizedCurrently":4984,"hospitalizedCumulative":null,"inIcuCurrently":1551,"inIcuCumulative":null,"onVentilatorCurrently":null,"onVentilatorCumulative":null,"recovered":null,"dataQualityGrade":"B","lastUpdateEt":"4/21/2020 00:00","dateModified":"2020-04-21T00:00:00Z","checkTimeEt":"04/20 20:00","death":1354,"hospitalized":null,"dateChecked":"2020-04-21T00:00:00Z","totalTestsViral":465327,"positiveTestsViral":null,"negativeTestsViral":null,"positiveCasesViral":null,"deathConfirmed":null,"deathProbable":null,"fips":"06","positiveIncrease":2135,"negativeIncrease":163092,"total":465327,"totalTestResults":465327,"totalTestResultsIncrease":165227,"posNeg":465327,"deathIncrease":86,"hospitalizedIncrease":0,"hash":"b222074c9f1f02967543e001bd826b9cac4074ae","commercialScore":0,"negativeRegularScore":0,"negativeScore":0,"positiveScore":0,"score":0,"grade":""},{"date":20200421,"state":"CA","positive":33261,"negative":266839,"pending":null,"hospitalizedCurrently":4886,"hospitalizedCumulative":null,"inIcuCurrently":1502,"inIcuCumulative":null,"onVentilatorCurrently":null,"onVentilatorCumulative":null,"recovered":null,"dataQualityGrade":"B","lastUpdateEt":"4/21/2020 00:00","dateModified":"2020-04-21T00:00:00Z","checkTimeEt":"04/20 20:00","death":1268,"hospitalized":null,"dateChecked":"2020-04-21T00:00:00Z","totalTestsViral":300100,"positiveTestsViral":null,"negativeTestsViral":null,"positiveCasesViral":null,"deathConfirmed":null,"deathProbable":null,"fips":"06","positiveIncrease":2283,"negativeIncrease":7317,"total":300100,"totalTestResults":300100,"totalTestResultsIncrease":9600,"posNeg":300100,"deathIncrease":60,"hospitalizedIncrease":0,"hash":"6077b23b722ba8e1029616eeb309b8f5f2372173","commercialScore":0,"negativeRegularScore":0,"negativeScore":0,"positiveScore":0,"score":0,"grade":""},{"date":20200420,"state":"CA","positive":30978,"negative":259522,"pending":null,"hospitalizedCurrently":4674,"hospitalizedCumulative":null,"inIcuCurrently":1480,"inIcuCumulative":null,"onVentilatorCurrently":null,"onVentilatorCumulative":null,"recovered":null,"dataQualityGrade":"B","lastUpdateEt":"4/19/2020 00:00","dateModified":"2020-04-19T00:00:00Z","checkTimeEt":"04/18 20:00","death":1208,"hospitalized":null,"dateChecked":"2020-04-19T00:00:00Z","totalTestsViral":290500,"positiveTestsViral":null,"negativeTestsViral":null,"positiveCasesViral":null,"deathConfirmed":null,"deathProbable":null,"fips":"06","positiveIncrease":645,"negativeIncrease":8955,"total":290500,"totalTestResults":290500,"totalTestResultsIncrease":9600,"posNeg":290500,"deathIncrease":42,"hospitalizedIncrease":0,"hash":"6efd4f0dc19e577a50f233758f4c0a795b7a7676","commercialScore":0,"negativeRegularScore":0,"negativeScore":0,"positiveScore":0,"score":0,"grade":""},{"date":20200419,"state":"CA","positive":30333,"negative":250567,"pending":7200,"hospitalizedCurrently":4731,"hospitalizedCumulative":null,"inIcuCurrently":1457,"inIcuCumulative":null,"onVentilatorCurrently":null,"onVentilatorCumulative":null,"recovered":null,"dataQualityGrade":"B","lastUpdateEt":"4/18/2020 00:00","dateModified":"2020-04-18T00:00:00Z","checkTimeEt":"04/17 20:00","death":1166,"hospitalized":null,"dateChecked":"2020-04-18T00:00:00Z","totalTestsViral":280900,"positiveTestsViral":null,"negativeTestsViral":null,"positiveCasesViral":null,"deathConfirmed":null,"deathProbable":null,"fips":"06","positiveIncrease":1370,"negativeIncrease":19864,"total":288100,"totalTestResults":280900,"totalTestResultsIncrease":21234,"posNeg":280900,"deathIncrease":94,"hospitalizedIncrease":0,"hash":"aefe53022ee601d5c7bc8e96c131f786ac1989af","commercialScore":0,"negativeRegularScore":0,"negativeScore":0,"positiveScore":0,"score":0,"grade":""},{"date":20200418,"state":"CA","positive":28963,"negative":230703,"pending":7200,"hospitalizedCurrently":4936,"hospitalizedCumulative":null,"inIcuCurrently":1490,"inIcuCumulative":null,"onVentilatorCurrently":null,"onVentilatorCumulative":null,"recovered":null,"dataQualityGrade":"B","lastUpdateEt":"4/17/2020 00:00","dateModified":"2020-04-17T00:00:00Z","checkTimeEt":"04/16 20:00","death":1072,"hospitalized":null,"dateChecked":"2020-04-17T00:00:00Z","totalTestsViral":259666,"positiveTestsViral":null,"negativeTestsViral":null,"positiveCasesViral":null,"deathConfirmed":null,"deathProbable":null,"fips":"06","positiveIncrease":1435,"negativeIncrease":6617,"total":266866,"totalTestResults":259666,"totalTestResultsIncrease":8052,"posNeg":259666,"deathIncrease":87,"hospitalizedIncrease":0,"hash":"388f377fc05c1dc26258519dae74101bcf082752","commercialScore":0,"negativeRegularScore":0,"negativeScore":0,"positiveScore":0,"score":0,"grade":""},{"date":20200417,"state":"CA","positive":27528,"negative":224086,"pending":7200,"hospitalizedCurrently":4892,"hospitalizedCumulative":null,"inIcuCurrently":1484,"inIcuCumulative":null,"onVentilatorCurrently":null,"onVentilatorCumulative":null,"recovered":null,"dataQualityGrade":"B","lastUpdateEt":"4/17/2020 00:00","dateModified":"2020-04-17T00:00:00Z","checkTimeEt":"04/16 20:00","death":985,"hospitalized":null,"dateChecked":"2020-04-17T00:00:00Z","totalTestsViral":251614,"positiveTestsViral":null,"negativeTestsViral":null,"positiveCasesViral":null,"deathConfirmed":null,"deathProbable":null,"fips":"06","positiveIncrease":1346,"negativeIncrease":3868,"total":258814,"totalTestResults":251614,"totalTestResultsIncrease":5214,"posNeg":251614,"deathIncrease":95,"hospitalizedIncrease":0,"hash":"33416e551bd16ec718e5d6f4632491c5ab36b792","commercialScore":0,"negativeRegularScore":0,"negativeScore":0,"positiveScore":0,"score":0,"grade":""},{"date":20200416,"state":"CA","positive":26182,"negative":220218,"pending":13200,"hospitalizedCurrently":5031,"hospitalizedCumulative":null,"inIcuCurrently":1568,"inIcuCumulative":null,"onVentilatorCurrently":null,"onVentilatorCumulative":null,"recovered":null,"dataQualityGrade":"B","lastUpdateEt":"4/15/2020 00:00","dateModified":"2020-04-15T00:00:00Z","checkTimeEt":"04/14 20:00","death":890,"hospitalized":null,"dateChecked":"2020-04-15T00:00:00Z","totalTestsViral":246400,"positiveTestsViral":null,"negativeTestsViral":null,"positiveCasesViral":null,"deathConfirmed":null,"deathProbable":null,"fips":"06","positiveIncrease":1758,"negativeIncrease":28156,"total":259600,"totalTestResults":246400,"totalTestResultsIncrease":29914,"posNeg":246400,"deathIncrease":69,"hospitalizedIncrease":0,"hash":"a786fea49de1c181d1d6bd8354191685b1415df7","commercialScore":0,"negativeRegularScore":0,"negativeScore":0,"positiveScore":0,"score":0,"grade":""},{"date":20200415,"state":"CA","positive":24424,"negative":192062,"pending":13200,"hospitalizedCurrently":5163,"hospitalizedCumulative":null,"inIcuCurrently":1175,"inIcuCumulative":null,"onVentilatorCurrently":null,"onVentilatorCumulative":null,"recovered":null,"dataQualityGrade":"B","lastUpdateEt":"4/14/2020 00:00","dateModified":"2020-04-14T00:00:00Z","checkTimeEt":"04/13 20:00","death":821,"hospitalized":null,"dateChecked":"2020-04-14T00:00:00Z","totalTestsViral":216486,"positiveTestsViral":null,"negativeTestsViral":null,"positiveCasesViral":null,"deathConfirmed":null,"deathProbable":null,"fips":"06","positiveIncrease":1086,"negativeIncrease":13192,"total":229686,"totalTestResults":216486,"totalTestResultsIncrease":14278,"posNeg":216486,"deathIncrease":63,"hospitalizedIncrease":0,"hash":"283208d3f0cb6099ca42e0be44c413f17e6cf20a","commercialScore":0,"negativeRegularScore":0,"negativeScore":0,"positiveScore":0,"score":0,"grade":""},{"date":20200414,"state":"CA","pos