[{"date":20201022,"state":"ME","positive":6064,"probableCases":653,"negative":561318,"pending":null,"totalTestResultsSource":null,"totalTestResults":567382,"hospitalizedCurrently":7,"hospitalizedCumulative":473,"inIcuCurrently":0,"inIcuCumulative":null,"onVentilatorCurrently":0,"onVentilatorCumulative":null,"recovered":5269,"dataQualityGrade":"A+","lastUpdateEt":"10/21/2020 23:59","dateModified":"2020-10-21T23:59:00Z","checkTimeEt":"10/21 19:59","death":146,"hospitalized":473,"dateChecked":"2020-10-21T23:59:00Z","totalTestsViral":566729,"positiveTestsViral":6758,"negativeTestsViral":559643,"positiveCasesViral":5411,"deathConfirmed":145,"deathProbable":1,"totalTestEncountersViral":null,"totalTestsPeopleViral":null,"totalTestsAntibody":10410,"positiveTestsAntibody":347,"negativeTestsAntibody":10051,"totalTestsPeopleAntibody":null,"positiveTestsPeopleAntibody":null,"negativeTestsPeopleAntibody":null,"totalTestsPeopleAntigen":null,"positiveTestsPeopleAntigen":null,"totalTestsAntigen":null,"positiveTestsAntigen":null,"fips":"23","positiveIncrease":37,"negativeIncrease":6535,"total":567382,"totalTestResultsIncrease":6572,"posNeg":567382,"deathIncrease":0,"hospitalizedIncrease":3,"hash":"86576a9d342fb2ec10a3a12f64d619325d959803","commercialScore":0,"negativeRegularScore":0,"negativeScore":0,"positiveScore":0,"score":0,"grade":""},{"date":20201021,"state":"ME","positive":6027,"probableCases":646,"negative":554783,"pending":null,"totalTestResultsSource":null,"totalTestResults":560810,"hospitalizedCurrently":7,"hospitalizedCumulative":470,"inIcuCurrently":0,"inIcuCumulative":null,"onVentilatorCurrently":0,"onVentilatorCumulative":null,"recovered":5244,"dataQualityGrade":"A+","lastUpdateEt":"10/20/2020 23:59","dateModified":"2020-10-20T23:59:00Z","checkTimeEt":"10/20 19:59","death":146,"hospitalized":470,"dateChecked":"2020-10-20T23:59:00Z","totalTestsViral":560164,"positiveTestsViral":6715,"negativeTestsViral":553123,"positiveCasesViral":5381,"deathConfirmed":145,"deathProbable":1,"totalTestEncountersViral":null,"totalTestsPeopleViral":null,"totalTestsAntibody":10394,"positiveTestsAntibody":346,"negativeTestsAntibody":10036,"totalTestsPeopleAntibody":null,"positiveTestsPeopleAntibody":null,"negativeTestsPeopleAntibody":null,"totalTestsPeopleAntigen":null,"positiveTestsPeopleAntigen":null,"totalTestsAntigen":null,"positiveTestsAntigen":null,"fips":"23","positiveIncrease":38,"negativeIncrease":6678,"total":560810,"totalTestResultsIncrease":6716,"posNeg":560810,"deathIncrease":0,"hospitalizedIncrease":1,"hash":"e71e624119bd654f866d53d9b5676ebf48ee1f29","commercialScore":0,"negativeRegularScore":0,"negativeScore":0,"positiveScore":0,"score":0,"grade":""},{"date":20201020,"state":"ME","positive":5989,"probableCases":648,"negative":548105,"pending":null,"totalTestResultsSource":null,"totalTestResults":554094,"hospitalizedCurrently":9,"hospitalizedCumulative":469,"inIcuCurrently":1,"inIcuCumulative":null,"onVentilatorCurrently":0,"onVentilatorCumulative":null,"recovered":5206,"dataQualityGrade":"A+","lastUpdateEt":"10/19/2020 23:59","dateModified":"2020-10-19T23:59:00Z","checkTimeEt":"10/19 19:59","death":146,"hospitalized":469,"dateChecked":"2020-10-19T23:59:00Z","totalTestsViral":553446,"positiveTestsViral":6676,"negativeTestsViral":546444,"positiveCasesViral":5341,"deathConfirmed":145,"deathProbable":1,"totalTestEncountersViral":null,"totalTestsPeopleViral":null,"totalTestsAntibody":10382,"positiveTestsAntibody":345,"negativeTestsAntibody":10025,"totalTestsPeopleAntibody":null,"positiveTestsPeopleAntibody":null,"negativeTestsPeopleAntibody":null,"totalTestsPeopleAntigen":null,"positiveTestsPeopleAntigen":null,"totalTestsAntigen":null,"positiveTestsAntigen":null,"fips":"23","positiveIncrease":27,"negativeIncrease":4590,"total":554094,"totalTestResultsIncrease":4617,"posNeg":554094,"deathIncrease":0,"hospitalizedIncrease":0,"hash":"9676307f3d047e6c2c06dc80dba1533f6c395213","commercialScore":0,"negativeRegularScore":0,"negativeScore":0,"positiveScore":0,"score":0,"grade":""},{"date":20201019,"state":"ME","positive":5962,"probableCases":639,"negative":543515,"pending":null,"totalTestResultsSource":null,"totalTestResults":549477,"hospitalizedCurrently":8,"hospitalizedCumulative":469,"inIcuCurrently":0,"inIcuCumulative":null,"onVentilatorCurrently":0,"onVentilatorCumulative":null,"recovered":5175,"dataQualityGrade":"A+","lastUpdateEt":"10/18/2020 23:59","dateModified":"2020-10-18T23:59:00Z","checkTimeEt":"10/18 19:59","death":146,"hospitalized":469,"dateChecked":"2020-10-18T23:59:00Z","totalTestsViral":548838,"positiveTestsViral":6630,"negativeTestsViral":541884,"positiveCasesViral":5323,"deathConfirmed":145,"deathProbable":1,"totalTestEncountersViral":null,"totalTestsPeopleViral":null,"totalTestsAntibody":10379,"positiveTestsAntibody":345,"negativeTestsAntibody":10022,"totalTestsPeopleAntibody":null,"positiveTestsPeopleAntibody":null,"negativeTestsPeopleAntibody":null,"totalTestsPeopleAntigen":null,"positiveTestsPeopleAntigen":null,"totalTestsAntigen":null,"positiveTestsAntigen":null,"fips":"23","positiveIncrease":23,"negativeIncrease":15739,"total":549477,"totalTestResultsIncrease":15762,"posNeg":549477,"deathIncrease":0,"hospitalizedIncrease":1,"hash":"f476efd4ec6338c7815eb01e7e2f46316ec9cee4","commercialScore":0,"negativeRegularScore":0,"negativeScore":0,"positiveScore":0,"score":0,"grade":""},{"date":20201018,"state":"ME","positive":5939,"probableCases":630,"negative":527776,"pending":null,"totalTestResultsSource":null,"totalTestResults":533715,"hospitalizedCurrently":11,"hospitalizedCumulative":468,"inIcuCurrently":5,"inIcuCumulative":null,"onVentilatorCurrently":1,"onVentilatorCumulative":null,"recovered":5145,"dataQualityGrade":"A+","lastUpdateEt":"10/17/2020 23:59","dateModified":"2020-10-17T23:59:00Z","checkTimeEt":"10/17 19:59","death":146,"hospitalized":468,"dateChecked":"2020-10-17T23:59:00Z","totalTestsViral":533019,"positiveTestsViral":6563,"negativeTestsViral":526133,"positiveCasesViral":5309,"deathConfirmed":145,"deathProbable":1,"totalTestEncountersViral":null,"totalTestsPeopleViral":null,"totalTestsAntibody":10353,"positiveTestsAntibody":344,"negativeTestsAntibody":9979,"totalTestsPeopleAntibody":null,"positiveTestsPeopleAntibody":null,"negativeTestsPeopleAntibody":null,"totalTestsPeopleAntigen":null,"positiveTestsPeopleAntigen":null,"totalTestsAntigen":null,"positiveTestsAntigen":null,"fips":"23","positiveIncrease":26,"negativeIncrease":0,"total":533715,"totalTestResultsIncrease":26,"posNeg":533715,"deathIncrease":0,"hospitalizedIncrease":1,"hash":"3b69c9e0131ca09a0bbc098bbfd276621847cb72","commercialScore":0,"negativeRegularScore":0,"negativeScore":0,"positiveScore":0,"score":0,"grade":""},{"date":20201017,"state":"ME","positive":5913,"probableCases":630,"negative":527776,"pending":null,"totalTestResultsSource":null,"totalTestResults":533689,"hospitalizedCurrently":11,"hospitalizedCumulative":467,"inIcuCurrently":5,"inIcuCumulative":null,"onVentilatorCurrently":1,"onVentilatorCumulative":null,"recovered":5112,"dataQualityGrade":"A+","lastUpdateEt":"10/16/2020 23:59","dateModified":"2020-10-16T23:59:00Z","checkTimeEt":"10/16 19:59","death":146,"hospitalized":467,"dateChecked":"2020-10-16T23:59:00Z","totalTestsViral":533019,"positiveTestsViral":6563,"negativeTestsViral":526133,"positiveCasesViral":5283,"deathConfirmed":145,"deathProbable":1,"totalTestEncountersViral":null,"totalTestsPeopleViral":null,"totalTestsAntibody":10353,"positiveTestsAntibody":344,"negativeTestsAntibody":9979,"totalTestsPeopleAntibody":null,"positiveTestsPeopleAntibody":null,"negativeTestsPeopleAntibody":null,"totalTestsPeopleAntigen":null,"positiveTestsPeopleAntigen":null,"totalTestsAntigen":null,"positiveTestsAntigen":null,"fips":"23","positiveIncrease":48,"negativeIncrease":0,"total":533689,"totalTestResultsIncrease":48,"posNeg":533689,"deathIncrease":1,"hospitalizedIncrease":1,"hash":"4f9a1682042ce845897b475c3d27c0f9e438aa48","commercialScore":0,"negativeRegularScore":0,"negativeScore":0,"positiveScore":0,"score":0,"grade":""},{"date":20201016,"state":"ME","positive":5865,"probableCases":622,"negative":527776,"pending":null,"totalTestResultsSource":null,"totalTestResults":533641,"hospitalizedCurrently":11,"hospitalizedCumulative":466,"inIcuCurrently":5,"inIcuCumulative":null,"onVentilatorCurrently":1,"onVentilatorCumulative":null,"recovered":5099,"dataQualityGrade":"A+","lastUpdateEt":"10/15/2020 23:59","dateModified":"2020-10-15T23:59:00Z","checkTimeEt":"10/15 19:59","death":145,"hospitalized":466,"dateChecked":"2020-10-15T23:59:00Z","totalTestsViral":533019,"positiveTestsViral":6563,"negativeTestsViral":526133,"positiveCasesViral":5243,"deathConfirmed":144,"deathProbable":1,"totalTestEncountersViral":null,"totalTestsPeopleViral":null,"totalTestsAntibody":10353,"positiveTestsAntibody":344,"negativeTestsAntibody":9979,"totalTestsPeopleAntibody":null,"positiveTestsPeopleAntibody":null,"negativeTestsPeopleAntibody":null,"totalTestsPeopleAntigen":null,"positiveTestsPeopleAntigen":null,"totalTestsAntigen":null,"positiveTestsAntigen":null,"fips":"23","positiveIncrease":29,"negativeIncrease":7545,"total":533641,"totalTestResultsIncrease":7574,"posNeg":533641,"deathIncrease":1,"hospitalizedIncrease":2,"hash":"522e81f3c16268017ea206107c79af9708760e2b","commercialScore":0,"negativeRegularScore":0,"negativeScore":0,"positiveScore":0,"score":0,"grade":""},{"date":20201015,"state":"ME","positive":5836,"probableCases":630,"negative":520231,"pending":null,"totalTestResultsSource":null,"totalTestResults":526067,"hospitalizedCurrently":11,"hospitalizedCumulative":464,"inIcuCurrently":5,"inIcuCumulative":null,"onVentilatorCurrently":1,"onVentilatorCumulative":null,"recovered":5070,"dataQualityGrade":"A+","lastUpdateEt":"10/14/2020 23:59","dateModified":"2020-10-14T23:59:00Z","checkTimeEt":"10/14 19:59","death":144,"hospitalized":464,"dateChecked":"2020-10-14T23:59:00Z","totalTestsViral":525437,"positiveTestsViral":6523,"negativeTestsViral":518593,"positiveCasesViral":5206,"deathConfirmed":143,"deathProbable":1,"totalTestEncountersViral":null,"totalTestsPeopleViral":null,"totalTestsAntibody":10335,"positiveTestsAntibody":344,"negativeTestsAntibody":9979,"totalTestsPeopleAntibody":null,"positiveTestsPeopleAntibody":null,"negativeTestsPeopleAntibody":null,"totalTestsPeopleAntigen":null,"positiveTestsPeopleAntigen":null,"totalTestsAntigen":null,"positiveTestsAntigen":null,"fips":"23","positiveIncrease":20,"negativeIncrease":5645,"total":526067,"totalTestResultsIncrease":5665,"posNeg":526067,"deathIncrease":1,"hospitalizedIncrease":1,"hash":"bede558801f5c9f398d112bf24e5fd888f011f39","commercialScore":0,"negativeRegularScore":0,"negativeScore":0,"positiveScore":0,"score":0,"grade":""},{"date":20201014,"state":"ME","positive":5816,"probableCases":625,"negative":514586,"pending":null,"totalTestResultsSource":null,"totalTestResults":520402,"hospitalizedCurrently":8,"hospitalizedCumulative":463,"inIcuCurrently":3,"inIcuCumulative":null,"onVentilatorCurrently":0,"onVentilatorCumulative":null,"recovered":5052,"dataQualityGrade":"A+","lastUpdateEt":"10/13/2020 23:59","dateModified":"2020-10-13T23:59:00Z","checkTimeEt":"10/13 19:59","death":143,"hospitalized":463,"dateChecked":"2020-10-13T23:59:00Z","totalTestsViral":519777,"positiveTestsViral":6492,"negativeTestsViral":512968,"positiveCasesViral":5191,"deathConfirmed":142,"deathProbable":1,"totalTestEncountersViral":null,"totalTestsPeopleViral":null,"totalTestsAntibody":10510,"positiveTestsAntibody":349,"negativeTestsAntibody":10149,"totalTestsPeopleAntibody":null,"positiveTestsPeopleAntibody":null,"negativeTestsPeopleAntibody":null,"totalTestsPeopleAntigen":null,"positiveTestsPeopleAntigen":null,"totalTestsAntigen":null,"positiveTestsAntigen":null,"fips":"23","positiveIncrease":36,"negativeIncrease":6088,"total":520402,"totalTestResultsIncrease":6124,"posNeg":520402,"deathIncrease":0,"hospitalizedIncrease":0,"hash":"73bf4561cae341c36ef55a95b7d4eb6cf699fdad","commercialScore":0,"negativeRegularScore":0,"negativeScore":0,"positiveScore":0,"score":0,"grade":""},{"date":20201013,"state":"ME","positive":5780,"probableCases":620,"negative":508498,"pending":null,"totalTestResultsSource":null,"totalTestResults":514278,"hospitalizedCurrently":8,"hospitalizedCumulative":463,"inIcuCurrently":3,"inIcuCumulative":null,"onVentilatorCurrently":0,"onVentilatorCumulative":null,"recovered":5006,"dataQualityGrade":"A+","lastUpdateEt":"10/12/2020 23:59","dateModified":"2020-10-12T23:59:00Z","checkTimeEt":"10/12 19:59","death":143,"hospitalized":463,"dateChecked":"2020-10-12T23:59:00Z","totalTestsViral":513658,"positiveTestsViral":6462,"negativeTestsViral":506879,"positiveCasesViral":5160,"deathConfirmed":142,"deathProbable":1,"totalTestEncountersViral":null,"totalTestsPeopleViral":null,"totalTestsAntibody":10498,"positiveTestsAntibody":347,"negativeTestsAntibody":10139,"totalTestsPeopleAntibody":null,"positiveTestsPeopleAntibody":null,"negativeTestsPeopleAntibody":null,"totalTestsPeopleAntigen":null,"positiveTestsPeopleAntigen":null,"totalTestsAntigen":null,"positiveTestsAntigen":null,"fips":"23","positiveIncrease":28,"negativeIncrease":23112,"total":514278,"totalTestResultsIncrease":23140,"posNeg":514278,"deathIncrease":0,"hospitalizedIncrease":0,"hash":"6ce46763b8f4a41ea8c7241a95f198d7672b59fa","commercialScore":0,"negativeRegularScore":0,"negativeScore":0,"positiveScore":0,"score":0,"grade":""},{"date":20201012,"state":"ME","positive":5752,"probableCases":608,"negative":485386,"pending":null,"totalTestResultsSource":null,"totalTestResults":491138,"hospitalizedCurrently":7,"hospitalizedCumulative":463,"inIcuCurrently":5,"inIcuCumulative":null,"onVentilatorCurrently":0,"onVentilatorCumulative":null,"recovered":4998,"dataQualityGrade":"A+","lastUpdateEt":"10/11/2020 23:59","dateModified":"2020-10-11T23:59:00Z","checkTimeEt":"10/11 19:59","death":143,"hospitalized":463,"dateChecked":"2020-10-11T23:59:00Z","totalTestsViral":490461,"positiveTestsViral":7005,"negativeTestsViral":483143,"positiveCasesViral":5144,"deathConfirmed":142,"deathProbable":1,"totalTestEncountersViral":null,"totalTestsPeopleViral":null,"totalTestsAntibody":10559,"positiveTestsAntibody":530,"negativeTestsAntibody":10015,"totalTestsPeopleAntibody":null,"positiveTestsPeopleAntibody":null,"negativeTestsPeopleAntibody":null,"totalTestsPeopleAntigen":null,"positiveTestsPeopleAntigen":null,"totalTestsAntigen":null,"positiveTestsAntigen":null,"fips":"23","positiveIncrease":29,"negativeIncrease":0,"total":491138,"totalTestResultsIncrease":29,"posNeg":491138,"deathIncrease":0,"hospitalizedIncrease":0,"hash":"0aa9060febdcb6f3ee1973c9efcb433419a007cd","commercialScore":0,"negativeRegularScore":0,"negativeScore":0,"positiveScore":0,"score":0,"grade":""},{"date":20201011,"state":"ME","positive":5723,"probableCases":595,"negative":485386,"pending":null,"totalTestResultsSource":null,"totalTestResults":491109,"hospitalizedCurrently":7,"hospitalizedCumulative":463,"inIcuCurrently":5,"inIcuCumulative":null,"onVentilatorCurrently":0,"onVentilatorCumulative":null,"recovered":4970,"dataQualityGrade":"A+","lastUpdateEt":"10/10/2020 23:59","dateModified":"2020-10-10T23:59:00Z","checkTimeEt":"10/10 19:59","death":143,"hospitalized":463,"dateChecked":"2020-10-10T23:59:00Z","totalTestsViral":490461,"positiveTestsViral":7005,"negativeTestsViral":483143,"positiveCasesViral":5128,"deathConfirmed":142,"deathProbable":1,"totalTestEncountersViral":null,"totalTestsPeopleViral":null,"totalTestsAntibody":10559,"positiveTestsAntibody":530,"negativeTestsAntibody":10015,"totalTestsPeopleAntibody":null,"positiveTestsPeopleAntibody":null,"negativeTestsPeopleAntibody":null,"totalTestsPeopleAntigen":null,"positiveTestsPeopleAntigen":null,"totalTestsAntigen":null,"positiveTestsAntigen":null,"fips":"23","positiveIncrease":27,"negativeIncrease":0,"total":491109,"totalTestResultsIncrease":27,"posNeg":491109,"deathIncrease":0,"hospitalizedIncrease":1,"hash":"14369b8ba3b7195984cdeadf1bc09e31e485a10b","commercialScore":0,"negativeRegularScore":0,"negativeScore":0,"positiveScore":0,"score":0,"grade":""},{"date":20201010,"state":"ME","positive":5696,"probableCases":591,"negative":485386,"pending":null,"totalTestResultsSource":null,"totalTestResults":491082,"hospitalizedCurrently":7,"hospitalizedCumulative":462,"inIcuCurrently":5,"inIcuCumulative":null,"onVentilatorCurrently":0,"onVentilatorCumulative":null,"recovered":4951,"dataQualityGrade":"A+","lastUpdateEt":"10/9/2020 23:59","dateModified":"2020-10-09T23:59:00Z","checkTimeEt":"10/09 19:59","death":143,"hospitalized":462,"dateChecked":"2020-10-09T23:59:00Z","totalTestsViral":490461,"positiveTestsViral":7005,"negativeTestsViral":483143,"positiveCasesViral":5105,"deathConfirmed":142,"deathProbable":1,"totalTestEncountersViral":null,"totalTestsPeopleViral":null,"totalTestsAntibody":10559,"positiveTestsAntibody":530,"negativeTestsAntibody":10015,"totalTestsPeopleAntibody":null,"positiveTestsPeopleAntibody":null,"negativeTestsPeopleAntibody":null,"totalTestsPeopleAntigen":null,"positiveTestsPeopleAntigen":null,"totalTestsAntigen":null,"positiveTestsAntigen":null,"fips":"23","positiveIncrease":30,"negativeIncrease":0,"total":491082,"totalTestResultsIncrease":30,"posNeg":491082,"deathIncrease":0,"hospitalizedIncrease":2,"hash":"1172a921fa9d9d8ae9d9b8286171e74a36a62cad","commercialScore":0,"negativeRegularScore":0,"negativeScore":0,"positiveScore":0,"score":0,"grade":""},{"date":20201009,"state":"ME","positive":5666,"probableCases":591,"negative":485386,"pending":null,"totalTestResultsSource":null,"totalTestResults":491052,"hospitalizedCurrently":7,"hospitalizedCumulative":460,"inIcuCurrently":5,"inIcuCumulative":null,"onVentilatorCurrently":0,"onVentilatorCumulative":null,"recovered":4933,"dataQualityGrade":"A+","lastUpdateEt":"10/8/2020 23:59","dateModified":"2020-10-08T23:59:00Z","checkTimeEt":"10/08 19:59","death":143,"hospitalized":460,"dateChecked":"2020-10-08T23:59:00Z","totalTestsViral":490461,"positiveTestsViral":7005,"negativeTestsViral":483143,"positiveCasesViral":5075,"deathConfirmed":142,"deathProbable":1,"totalTestEncountersViral":null,"totalTestsPeopleViral":null,"totalTestsAntibody":10559,"positiveTestsAntibody":530,"negativeTestsAntibody":10015,"totalTestsPeopleAntibody":null,"positiveTestsPeopleAntibody":null,"negativeTestsPeopleAntibody":null,"totalTestsPeopleAntigen":null,"positiveTestsPeopleAntigen":null,"totalTestsAntigen":null,"positiveTestsAntigen":null,"fips":"23","positiveIncrease":27,"negativeIncrease":8410,"total":491052,"totalTestResultsIncrease":8437,"posNeg":491052,"deathIncrease":1,"hospitalizedIncrease":1,"hash":"4f059217d1af090253e0a7f0f2898ac64bb772ba","commercialScore":0,"negativeRegularScore":0,"negativeScore":0,"positiveScore":0,"score":0,"grade":""},{"date":20201008,"state":"ME","positive":5639,"probableCases":591,"negative":476976,"pending":null,"totalTestResultsSource":null,"totalTestResults":482615,"hospitalizedCurrently":7,"hospitalizedCumulative":459,"inIcuCurrently":1,"inIcuCumulative":null,"onVentilatorCurrently":0,"onVentilatorCumulative":null,"recovered":4900,"dataQualityGrade":"A+","lastUpdateEt":"10/7/2020 23:59","dateModified":"2020-10-07T23:59:00Z","checkTimeEt":"10/07 19:59","death":142,"hospitalized":459,"dateChecked":"2020-10-07T23:59:00Z","totalTestsViral":482024,"positiveTestsViral":6967,"negativeTestsViral":474748,"positiveCasesViral":5048,"deathConfirmed":141,"deathProbable":1,"totalTestEncountersViral":null,"totalTestsPeopleViral":null,"totalTestsAntibody":10529,"positiveTestsAntibody":528,"negativeTestsAntibody":9987,"totalTestsPeopleAntibody":null,"positiveTestsPeopleAntibody":null,"negativeTestsPeopleAntibody":null,"totalTestsPeopleAntigen":null,"positiveTestsPeopleAntigen":null,"totalTestsAntigen":null,"positiveTestsAntigen":null,"fips":"23","positiveIncrease":35,"negativeIncrease":6831,"total":482615,"totalTestResultsIncrease":6866,"posNeg":482615,"deathIncrease":0,"hospitalizedIncrease":0,"hash":"562812f6cf6f7cccb90957286c4c4c262a73670d","commercialScore":0,"negativeRegularScore":0,"negativeScore":0,"positiveScore":0,"score":0,"grade":""},{"date":20201007,"state":"ME","positive":5604,"probableCases":593,"negative":470145,"pending":null,"totalTestResultsSource":null,"totalTestResults":475749,"hospitalizedCurrently":9,"hospitalizedCumulative":459,"inIcuCurrently":2,"inIcuCumulative":null,"onVentilatorCurrently":0,"onVentilatorCumulative":null,"recovered":4880,"dataQualityGrade":"A+","lastUpdateEt":"10/6/2020 23:59","dateModified":"2020-10-06T23:59:00Z","checkTimeEt":"10/06 19:59","death":142,"hospitalized":459,"dateChecked":"2020-10-06T23:59:00Z","totalTestsViral":475156,"positiveTestsViral":6930,"negativeTestsViral":467918,"positiveCasesViral":5011,"deathConfirmed":141,"deathProbable":1,"totalTestEncountersViral":null,"totalTestsPeopleViral":null,"totalTestsAntibody":10506,"positiveTestsAntibody":528,"negativeTestsAntibody":9964,"totalTestsPeopleAntibody":null,"positiveTestsPeopleAntibody":null,"negativeTestsPeopleAntibody":null,"totalTestsPeopleAntigen":null,"positiveTestsPeopleAntigen":null,"totalTestsAntigen":null,"positiveTestsAntigen":null,"fips":"23","positiveIncrease":39,"negativeIncrease":6490,"total":475749,"totalTestResultsIncrease":6529,"posNeg":475749,"deathIncrease":0,"hospitalizedIncrease":2,"hash":"189fb6c21cb3aebf05d07639b6316f28f75ea1e7","commercialScore":0,"negativeRegularScore":0,"negativeScore":0,"positiveScore":0,"score":0,"grade":""},{"date":20201006,"state":"ME","positive":5565,"probableCases":582,"negative":463655,"pending":null,"totalTestResultsSource":null,"totalTestResults":469220,"hospitalizedCurrently":7,"hospitalizedCumulative":457,"inIcuCurrently":1,"inIcuCumulative":null,"onVentilatorCurrently":0,"onVentilatorCumulative":null,"recovered":4839,"dataQualityGrade":"A+","lastUpdateEt":"10/5/2020 23:59","dateModified":"2020-10-05T23:59:00Z","checkTimeEt":"10/05 19:59","death":142,"hospitalized":457,"dateChecked":"2020-10-05T23:59:00Z","totalTestsViral":468638,"positiveTestsViral":6877,"negativeTestsViral":461455,"positiveCasesViral":4983,"deathConfirmed":141,"deathProbable":1,"totalTestEncountersViral":null,"totalTestsPeopleViral":null,"totalTestsAntibody":10494,"positiveTestsAntibody":528,"negativeTestsAntibody":9952,"totalTestsPeopleAntibody":null,"positiveTestsPeopleAntibody":null,"negativeTestsPeopleAntibody":null,"totalTestsPeopleAntigen":null,"positiveTestsPeopleAntigen":null,"totalTestsAntigen":null,"positiveTestsAntigen":null,"fips":"23","positiveIncrease":20,"negativeIncrease":2518,"total":469220,"totalTestResultsIncrease":2538,"posNeg":469220,"deathIncrease":0,"hospitalizedIncrease":3,"hash":"9d4bbbc44867afd6a5cc65e3dd442a8cac8eebff","commercialScore":0,"negativeRegularScore":0,"negativeScore":0,"positiveScore":0,"score":0,"grade":""},{"date":20201005,"state":"ME","positive":5545,"probableCases":582,"negative":461137,"pending":null,"totalTestResultsSource":null,"totalTestResults":466682,"hospitalizedCurrently":10,"hospitalizedCumulative":454,"inIcuCurrently":1,"inIcuCumulative":null,"onVentilatorCurrently":1,"onVentilatorCumulative":null,"recovered":4807,"dataQualityGrade":"A+","lastUpdateEt":"10/4/2020 23:59","dateModified":"2020-10-04T23:59:00Z","checkTimeEt":"10/04 19:59","death":142,"hospitalized":454,"dateChecked":"2020-10-04T23:59:00Z","totalTestsViral":466100,"positiveTestsViral":6860,"negativeTestsViral":458935,"positiveCasesViral":4963,"deathConfirmed":141,"deathProbable":1,"totalTestEncountersViral":null,"totalTestsPeopleViral":null,"totalTestsAntibody":10487,"positiveTestsAntibody":528,"negativeTestsAntibody":9945,"totalTestsPeopleAntibody":null,"positiveTestsPeopleAntibody":null,"negativeTestsPeopleAntibody":null,"totalTestsPeopleAntigen":null,"positiveTestsPeopleAntigen":null,"totalTestsAntigen":null,"positiveTestsAntigen":null,"fips":"23","positiveIncrease":26,"negativeIncrease":17315,"total":466682,"totalTestResultsIncrease":17341,"posNeg":466682,"deathIncrease":0,"hospitalizedIncrease":0,"hash":"e298a22d4bc445850082ac9e59ae0c9a45dfa2d8","commercialScore":0,"negativeRegularScore":0,"negativeScore":0,"positiveScore":0,"score":0,"grade":""},{"date":20201004,"state":"ME","positive":5519,"probableCases":575,"negative":443822,"pending":null,"totalTestResultsSource":null,"totalTestResults":449341,"hospitalizedCurrently":11,"hospitalizedCumulative":454,"inIcuCurrently":2,"inIcuCumulative":null,"onVentilatorCurrently":1,"onVentilatorCumulative":null,"recovered":4782,"dataQualityGrade":"A+","lastUpdateEt":"10/3/2020 23:59","dateModified":"2020-10-03T23:59:00Z","checkTimeEt":"10/03 19:59","death":142,"hospitalized":454,"dateChecked":"2020-10-03T23:59:00Z","totalTestsViral":448722,"positiveTestsViral":6769,"negativeTestsViral":441655,"positiveCasesViral":4944,"deathConfirmed":141,"deathProbable":1,"totalTestEncountersViral":null,"totalTestsPeopleViral":null,"totalTestsAntibody":10445,"positiveTestsAntibody":525,"negativeTestsAntibody":9906,"totalTestsPeopleAntibody":null,"positiveTestsPeopleAntibody":null,"negativeTestsPeopleAntibody":null,"totalTestsPeopleAntigen":null,"positiveTestsPeopleAntigen":null,"totalTestsAntigen":null,"positiveTestsAntigen":null,"fips":"23","positiveIncrease":33,"negativeIncrease":0,"total":449341,"totalTestResultsIncrease":33,"posNeg":449341,"deathIncrease":0,"hospitalizedIncrease":0,"hash":"d07946d95e5c59f0d56a4c0169d0360e8f71be1b","commercialScore":0,"negativeRegularScore":0,"negativeScore":0,"positiveScore":0,"score":0,"grade":""},{"date":20201003,"state":"ME","positive":5486,"probableCases":566,"negative":443822,"pending":null,"totalTestResultsSource":null,"totalTestResults":449308,"hospitalizedCurrently":11,"hospitalizedCumulative":454,"inIcuCurrently":2,"inIcuCumulative":null,"onVentilatorCurrently":1,"onVentilatorCumulative":null,"recovered":4763,"dataQualityGrade":"A+","lastUpdateEt":"10/2/2020 23:59","dateModified":"2020-10-02T23:59:00Z","checkTimeEt":"10/02 19:59","death":142,"hospitalized":454,"dateChecked":"2020-10-02T23:59:00Z","totalTestsViral":448722,"positiveTestsViral":6769,"negativeTestsViral":441655,"positiveCasesViral":4920,"deathConfirmed":141,"deathProbable":1,"totalTestEncountersViral":null,"totalTestsPeopleViral":null,"totalTestsAntibody":10445,"positiveTestsAntibody":525,"negativeTestsAntibody":9906,"totalTestsPeopleAntibody":null,"positiveTestsPeopleAntibody":null,"negativeTestsPeopleAntibody":null,"totalTestsPeopleAntigen":null,"positiveTestsPeopleAntigen":null,"totalTestsAntigen":null,"positiveTestsAntigen":null,"fips":"23","positiveIncrease":18,"negativeIncrease":0,"total":449308,"totalTestResultsIncrease":18,"posNeg":449308,"deathIncrease":0,"hospitalizedIncrease":2,"hash":"7da9a2d2e1413111ad7b7ec4a6b7846586a36363","commercialScore":0,"negativeRegularScore":0,"negativeScore":0,"positiveScore":0,"score":0,"grade":""},{"date":20201002,"state":"ME","positive":5468,"probableCases":568,"negative":443822,"pending":null,"totalTestResultsSource":null,"totalTestResults":449290,"hospitalizedCurrently":11,"hospitalizedCumulative":452,"inIcuCurrently":2,"inIcuCumulative":null,"onVentilatorCurrently":1,"onVentilatorCumulative":null,"recovered":4741,"dataQualityGrade":"A+","lastUpdateEt":"10/1/2020 23:59","dateModified":"2020-10-01T23:59:00Z","checkTimeEt":"10/01 19:59","death":142,"hospitalized":452,"dateChecked":"2020-10-01T23:59:00Z","totalTestsViral":448722,"positiveTestsViral":6769,"negativeTestsViral":441655,"positiveCasesViral":4900,"deathConfirmed":141,"deathProbable":1,"totalTestEncountersViral":null,"totalTestsPeopleViral":null,"totalTestsAntibody":10445,"positiveTestsAntibody":525,"negativeTestsAntibody":9906,"totalTestsPeopleAntibody":null,"positiveTestsPeopleAntibody":null,"negativeTestsPeopleAntibody":null,"totalTestsPeopleAntigen":null,"positiveTestsPeopleAntigen":null,"totalTestsAntigen":null,"positiveTestsAntigen":null,"fips":"23","positiveIncrease":37,"negativeIncrease":6862,"total":449290,"totalTestResultsIncrease":6899,"posNeg":449290,"deathIncrease":0,"hospitalizedIncrease":1,"hash":"2ecefb374fc8b1aa1e9104ddd920a199d60e0db7","commercialScore":0,"negativeRegularScore":0,"negativeScore":0,"positiveScore":0,"score":0,"grade":""},{"date":20201001,"state":"ME","positive":5431,"probableCases":566,"negative":436960,"pending":null,"totalTestResultsSource":null,"totalTestResults":442391,"hospitalizedCurrently":12,"hospitalizedCumulative":451,"inIcuCurrently":2,"inIcuCumulative":null,"onVentilatorCurrently":1,"onVentilatorCumulative":null,"recovered":4704,"dataQualityGrade":"A+","lastUpdateEt":"9/30/2020 23:59","dateModified":"2020-09-30T23:59:00Z","checkTimeEt":"09/30 19:59","death":142,"hospitalized":451,"dateChecked":"2020-09-30T23:59:00Z","totalTestsViral":441825,"positiveTestsViral":6721,"negativeTestsViral":434806,"positiveCasesViral":4865,"deathConfirmed":141,"deathProbable":1,"totalTestEncountersViral":null,"totalTestsPeopleViral":null,"totalTestsAntibody":10427,"positiveTestsAntibody":523,"negativeTestsAntibody":9890,"totalTestsPeopleAntibody":null,"positiveTestsPeopleAntibody":null,"negativeTestsPeopleAntibody":null,"totalTestsPeopleAntigen":null,"positiveTestsPeopleAntigen":null,"totalTestsAntigen":null,"positiveTestsAntigen":null,"fips":"23","positiveIncrease":40,"negativeIncrease":7251,"total":442391,"totalTestResultsIncrease":7291,"posNeg":442391,"deathIncrease":1,"hospitalizedIncrease":2,"hash":"b0cf0a473ef11c42a60d1240d51919f5de1b730e","commercialScore":0,"negativeRegularScore":0,"negativeScore":0,"positiveScore":0,"score":0,"grade":""},{"date":20200930,"state":"ME","positive":5391,"probableCases":567,"negative":429709,"pending":null,"totalTestResultsSource":null,"totalTestResults":435100,"hospitalizedCurrently":13,"hospitalizedCumulative":449,"inIcuCurrently":7,"inIcuCumulative":null,"onVentilatorCurrently":1,"onVentilatorCumulative":null,"recovered":4678,"dataQualityGrade":"A+","lastUpdateEt":"9/29/2020 23:59","dateModified":"2020-09-29T23:59:00Z","checkTimeEt":"09/29 19:59","death":141,"hospitalized":449,"dateChecked":"2020-09-29T23:59:00Z","totalTestsViral":434533,"positiveTestsViral":6668,"negativeTestsViral":427569,"positiveCasesViral":4824,"deathConfirmed":140,"deathProbable":1,"totalTestEncountersViral":null,"totalTestsPeopleViral":null,"totalTestsAntibody":10398,"positiveTestsAntibody":522,"negativeTestsAntibody":9862,"totalTestsPeopleAntibody":null,"positiveTestsPeopleAntibody":null,"negativeTestsPeopleAntibody":null,"totalTestsPeopleAntigen":null,"positiveTestsPeopleAntigen":null,"totalTestsAntigen":null,"positiveTestsAntigen":null,"fips":"23","positiveIncrease":54,"negativeIncrease":6992,"total":435100,"totalTestResultsIncrease":7046,"posNeg":435100,"deathIncrease":0,"hospitalizedIncrease":2,"hash":"1a6ed1edd1bb76e8c3bef1ba4c266d8d2139f97b","commercialScore":0,"negativeRegularScore":0,"negativeScore":0,"positiveScore":0,"score":0,"grade":""},{"date":20200929,"state":"ME","positive":5337,"probableCases":560,"negative":422717,"pending":null,"totalTestResultsSource":null,"totalTestResults":428054,"hospitalizedCurrently":8,"hospitalizedCumulative":447,"inIcuCurrently":5,"inIcuCumulative":null,"onVentilatorCurrently":1,"onVentilatorCumulative":null,"recovered":4629,"dataQualityGrade":"A+","lastUpdateEt":"9/28/2020 23:59","dateModified":"2020-09-28T23:59:00Z","checkTimeEt":"09/28 19:59","death":141,"hospitalized":447,"dateChecked":"2020-09-28T23:59:00Z","totalTestsViral":427494,"positiveTestsViral":6602,"negativeTestsViral":420597,"positiveCasesViral":4777,"deathConfirmed":140,"deathProbable":1,"totalTestEncountersViral":null,"totalTestsPeopleViral":null,"totalTestsAntibody":10384,"positiveTestsAntibody":522,"negativeTestsAntibody":9848,"totalTestsPeopleAntibody":null,"positiveTestsPeopleAntibody":null,"negativeTestsPeopleAntibody":null,"totalTestsPeopleAntigen":null,"positiveTestsPeopleAntigen":null,"totalTestsAntigen":null,"positiveTestsAntigen":null,"fips":"23","positiveIncrease":37,"negativeIncrease":4621,"total":428054,"totalTestResultsIncrease":4658,"posNeg":428054,"deathIncrease":1,"hospitalizedIncrease":1,"hash":"ba6a1b5c4fb2486b9dafdaa21732f957d25d0ca3","commercialScore":0,"negativeRegularScore":0,"negativeScore":0,"positiveScore":0,"score":0,"grade":""},{"date":20200928,"state":"ME","positive":5300,"probableCases":545,"negative":418096,"pending":null,"totalTestResultsSource":null,"totalTestResults":423396,"hospitalizedCurrently":8,"hospitalizedCumulative":446,"inIcuCurrently":2,"inIcuCumulative":null,"onVentilatorCurrently":0,"onVentilatorCumulative":null,"recovered":4599,"dataQualityGrade":"A+","lastUpdateEt":"9/27/2020 23:59","dateModified":"2020-09-27T23:59:00Z","checkTimeEt":"09/27 19:59","death":140,"hospitalized":446,"dateChecked":"2020-09-27T23:59:00Z","totalTestsViral":422851,"positiveTestsViral":6574,"negativeTestsViral":415985,"positiveCasesViral":4755,"deathConfirmed":139,"deathProbable":1,"totalTestEncountersViral":null,"totalTestsPeopleViral":null,"totalTestsAntibody":10317,"positiveTestsAntibody":521,"negativeTestsAntibody":9782,"totalTestsPeopleAntibody":null,"positiveTestsPeopleAntibody":null,"negativeTestsPeopleAntibody":null,"totalTestsPeopleAntigen":null,"positiveTestsPeopleAntigen":null,"totalTestsAntigen":null,"positiveTestsAntigen":null,"fips":"23","positiveIncrease":12,"negativeIncrease":2188,"total":423396,"totalTestResultsIncrease":2200,"posNeg":423396,"deathIncrease":0,"hospitalizedIncrease":1,"hash":"3fcd2db632989a0c1069a71bf1ddc794a3f2b24d","commercialScore":0,"negativeRegularScore":0,"negativeScore":0,"positiveScore":0,"score":0,"grade":""},{"date":20200927,"state":"ME","positive":5288,"probableCases":547,"negative":415908,"pending":null,"totalTestResultsSource":null,"totalTestResults":421196,"hospitalizedCurrently":11,"hospitalizedCumulative":445,"inIcuCurrently":2,"inIcuCumulative":null,"onVentilatorCurrently":0,"onVentilatorCumulative":null,"recovered":4567,"dataQualityGrade":"A+","lastUpdateEt":"9/26/2020 23:59","dateModified":"2020-09-26T23:59:00Z","checkTimeEt":"09/26 19:59","death":140,"hospitalized":445,"dateChecked":"2020-09-26T23:59:00Z","totalTestsViral":420649,"positiveTestsViral":6560,"negativeTestsViral":413798,"positiveCasesViral":4741,"deathConfirmed":139,"deathProbable":1,"totalTestEncountersViral":null,"totalTestsPeopleViral":null,"totalTestsAntibody":10312,"positiveTestsAntibody":521,"negativeTestsAntibody":9777,"totalTestsPeopleAntibody":null,"positiveTestsPeopleAntibody":null,"negativeTestsPeopleAntibody":null,"totalTestsPeopleAntigen":null,"positiveTestsPeopleAntigen":null,"totalTestsAntigen":null,"positiveTestsAntigen":null,"fips":"23","positiveIncrease":28,"negativeIncrease":14749,"total":421196,"totalTestResultsIncrease":14777,"posNeg":421196,"deathIncrease":0,"hospitalizedIncrease":2,"hash":"32c508860180d8aefcaef69453a50006fda08d36","commercialScore":0,"negativeRegularScore":0,"negativeScore":0,"positiveScore":0,"score":0,"grade":""},{"date":20200926,"state":"ME","positive":5260,"probableCases":547,"negative":401159,"pending":null,"totalTestResultsSource":null,"totalTestResults":406419,"hospitalizedCurrently":8,"hospitalizedCumulative":443,"inIcuCurrently":1,"inIcuCumulative":null,"onVentilatorCurrently":0,"onVentilatorCumulative":null,"recovered":4538,"dataQualityGrade":"A+","lastUpdateEt":"9/25/2020 23:59","dateModified":"2020-09-25T23:59:00Z","checkTimeEt":"09/25 19:59","death":140,"hospitalized":443,"dateChecked":"2020-09-25T23:59:00Z","totalTestsViral":405850,"positiveTestsViral":6490,"negativeTestsViral":399070,"positiveCasesViral":4713,"deathConfirmed":139,"deathProbable":1,"totalTestEncountersViral":null,"totalTestsPeopleViral":null,"totalTestsAntibody":10270,"positiveTestsAntibody":516,"negativeTestsAntibody":9740,"totalTestsPeopleAntibody":null,"positiveTestsPeopleAntibody":null,"negativeTestsPeopleAntibody":null,"totalTestsPeopleAntigen":null,"positiveTestsPeopleAntigen":null,"totalTestsAntigen":null,"positiveTestsAntigen":null,"fips":"23","positiveIncrease":25,"negativeIncrease":0,"total":406419,"totalTestResultsIncrease":25,"posNeg":406419,"deathIncrease":0,"hospitalizedIncrease":1,"hash":"94193740a27d6e9b9c2c34e4af25eac11f4e1857","commercialScore":0,"negativeRegularScore":0,"negativeScore":0,"positiveScore":0,"score":0,"grade":""},{"date":20200925,"state":"ME","positive":5235,"probableCases":544,"negative":401159,"pending":null,"totalTestResultsSource":null,"totalTestResults":406394,"hospitalizedCurrently":10,"hospitalizedCumulative":442,"inIcuCurrently":2,"inIcuCumulative":null,"onVentilatorCurrently":0,"onVentilatorCumulative":null,"recovered":4507,"dataQualityGrade":"A+","lastUpdateEt":"9/24/2020 23:59","dateModified":"2020-09-24T23:59:00Z","checkTimeEt":"09/24 19:59","death":140,"hospitalized":442,"dateChecked":"2020-09-24T23:59:00Z","totalTestsViral":405850,"positiveTestsViral":6490,"negativeTestsViral":399070,"positiveCasesViral":4691,"deathConfirmed":139,"deathProbable":1,"totalTestEncountersViral":null,"totalTestsPeopleViral":null,"totalTestsAntibody":10270,"positiveTestsAntibody":516,"negativeTestsAntibody":9740,"totalTestsPeopleAntibody":null,"positiveTestsPeopleAntibody":null,"negativeTestsPeopleAntibody":null,"totalTestsPeopleAntigen":null,"positiveTestsPeopleAntigen":null,"totalTestsAntigen":null,"positiveTestsAntigen":null,"fips":"23","positiveIncrease":20,"negativeIncrease":6408,"total":406394,"totalTestResultsIncrease":6428,"posNeg":406394,"deathIncrease":0,"hospitalizedIncrease":0,"hash":"992195676dfc17bf523d3fc1c2ab1573979c85ef","commercialScore":0,"negativeRegularScore":0,"negativeScore":0,"positiveScore":0,"score":0,"grade":""},{"date":20200924,"state":"ME","positive":5215,"probableCases":538,"negative":394751,"pending":null,"totalTestResultsSource":null,"totalTestResults":399966,"hospitalizedCurrently":14,"hospitalizedCumulative":442,"inIcuCurrently":1,"inIcuCumulative":null,"onVentilatorCurrently":0,"onVentilatorCumulative":null,"recovered":4478,"dataQualityGrade":"A+","lastUpdateEt":"9/23/2020 23:59","dateModified":"2020-09-23T23:59:00Z","checkTimeEt":"09/23 19:59","death":140,"hospitalized":442,"dateChecked":"2020-09-23T23:59:00Z","totalTestsViral":399428,"positiveTestsViral":6470,"negativeTestsViral":392670,"positiveCasesViral":4677,"deathConfirmed":139,"deathProbable":1,"totalTestEncountersViral":null,"totalTestsPeopleViral":null,"totalTestsAntibody":10241,"positiveTestsAntibody":515,"negativeTestsAntibody":9712,"totalTestsPeopleAntibody":null,"positiveTestsPeopleAntibody":null,"negativeTestsPeopleAntibody":null,"totalTestsPeopleAntigen":null,"positiveTestsPeopleAntigen":null,"totalTestsAntigen":null,"positiveTestsAntigen":null,"fips":"23","positiveIncrease":44,"negativeIncrease":13887,"total":399966,"totalTestResultsIncrease":13931,"posNeg":399966,"deathIncrease":0,"hospitalizedIncrease":1,"hash":"fff5fb2ad471ef67a8d5eba79266dec10e06ce00","commercialScore":0,"negativeRegularScore":0,"negativeScore":0,"positiveScore":0,"score":0,"grade":""},{"date":20200923,"state":"ME","positive":5171,"probableCases":528,"negative":380864,"pending":null,"totalTestResultsSource":null,"totalTestResults":386035,"hospitalizedCurrently":14,"hospitalizedCumulative":441,"inIcuCurrently":2,"inIcuCumulative":null,"onVentilatorCurrently":0,"onVentilatorCumulative":null,"recovered":4445,"dataQualityGrade":"A+","lastUpdateEt":"9/22/2020 23:59","dateModified":"2020-09-22T23:59:00Z","checkTimeEt":"09/22 19:59","death":140,"hospitalized":441,"dateChecked":"2020-09-22T23:59:00Z","totalTestsViral":391331,"positiveTestsViral":6426,"negativeTestsViral":384620,"positiveCasesViral":4643,"deathConfirmed":139,"deathProbable":1,"totalTestEncountersViral":null,"totalTestsPeopleViral":null,"totalTestsAntibody":10218,"positiveTestsAntibody":515,"negativeTestsAntibody":9689,"totalTestsPeopleAntibody":null,"positiveTestsPeopleAntibody":null,"negativeTestsPeopleAntibody":null,"totalTestsPeopleAntigen":null,"positiveTestsPeopleAntigen":null,"totalTestsAntigen":null,"positiveTestsAntigen":null,"fips":"23","positiveIncrease":25,"negativeIncrease":10578,"total":386035,"totalTestResultsIncrease":10603,"posNeg":386035,"deathIncrease":0,"hospitalizedIncrease":-1,"hash":"485d7be4e9e0ac4a65f31e6ba6fe2aa59594e212","commercialScore":0,"negativeRegularScore":0,"negativeScore":0,"positiveScore":0,"score":0,"grade":""},{"date":20200922,"state":"ME","positive":5146,"probableCases":529,"negative":370286,"pending":null,"totalTestResultsSource":null,"totalTestResults":375432,"hospitalizedCurrently":17,"hospitalizedCumulative":442,"inIcuCurrently":4,"inIcuCumulative":null,"onVentilatorCurrently":0,"onVentilatorCumulative":null,"recovered":4407,"dataQualityGrade":"A+","lastUpdateEt":"9/21/2020 23:59","dateModified":"2020-09-21T23:59:00Z","checkTimeEt":"09/21 19:59","death":140,"hospitalized":442,"dateChecked":"2020-09-21T23:59:00Z","totalTestsViral":385507,"positiveTestsViral":6396,"negativeTestsViral":378826,"positiveCasesViral":4617,"deathConfirmed":139,"deathProbable":1,"totalTestEncountersViral":null,"totalTestsPeopleViral":null,"totalTestsAntibody":10205,"positiveTestsAntibody":515,"negativeTestsAntibody":9676,"totalTestsPeopleAntibody":null,"positiveTestsPeopleAntibody":null,"negativeTestsPeopleAntibody":null,"totalTestsPeopleAntigen":null,"positiveTestsPeopleAntigen":null,"totalTestsAntigen":null,"positiveTestsAntigen":null,"fips":"23","positiveIncrease":40,"negativeIncrease":0,"total":375432,"totalTestResultsIncrease":40,"posNeg":375432,"deathIncrease":0,"hospitalizedIncrease":2,"hash":"253f1a579d876870befbfe2078a9307191130ce5","commercialScore":0,"negativeRegularScore":0,"negativeScore":0,"positiveScore":0,"score":0,"grade":""},{"date":20200921,"state":"ME","positive":5106,"probableCases":520,"negative":370286,"pending":null,"totalTestResultsSource":null,"totalTestResults":375392,"hospitalizedCurrently":17,"hospitalizedCumulative":440,"inIcuCurrently":6,"inIcuCumulative":null,"onVentilatorCurrently":1,"onVentilatorCumulative":null,"recovered":4384,"dataQualityGrade":"A+","lastUpdateEt":"9/20/2020 23:59","dateModified":"2020-09-20T23:59:00Z","checkTimeEt":"09/20 19:59","death":140,"hospitalized":440,"dateChecked":"2020-09-20T23:59:00Z","totalTestsViral":374872,"positiveTestsViral":6327,"negativeTestsViral":368266,"positiveCasesViral":4586,"deathConfirmed":139,"deathProbable":1,"totalTestEncountersViral":null,"totalTestsPeopleViral":null,"totalTestsAntibody":10192,"positiveTestsAntibody":513,"negativeTestsAntibody":9665,"totalTestsPeopleAntibody":null,"positiveTestsPeopleAntibody":null,"negativeTestsPeopleAntibody":null,"totalTestsPeopleAntigen":null,"positiveTestsPeopleAntigen":null,"totalTestsAntigen":null,"positiveTestsAntigen":null,"fips":"23","positiveIncrease":27,"negativeIncrease":1227,"total":375392,"totalTestResultsIncrease":1254,"posNeg":375392,"deathIncrease":1,"hospitalizedIncrease":1,"hash":"5a20f5e5ea51f83aaae48525906dc68c835fa254","commercialScore":0,"negativeRegularScore":0,"negativeScore":0,"positiveScore":0,"score":0,"grade":""},{"date":20200920,"state":"ME","positive":5079,"probableCases":517,"negative":369059,"pending":null,"totalTestResultsSource":null,"totalTestResults":374138,"hospitalizedCurrently":16,"hospitalizedCumulative":439,"inIcuCurrently":4,"inIcuCumulative":null,"onVentilatorCurrently":1,"onVentilatorCumulative":null,"recovered":4364,"dataQualityGrade":"A+","lastUpdateEt":"9/19/2020 23:59","dateModified":"2020-09-19T23:59:00Z","checkTimeEt":"09/19 19:59","death":139,"hospitalized":439,"dateChecked":"2020-09-19T23:59:00Z","totalTestsViral":373621,"positiveTestsViral":6301,"negativeTestsViral":367041,"positiveCasesViral":4562,"deathConfirmed":138,"deathProbable":1,"totalTestEncountersViral":null,"totalTestsPeopleViral":null,"totalTestsAntibody":10190,"positiveTestsAntibody":512,"negativeTestsAntibody":9664,"totalTestsPeopleAntibody":null,"positiveTestsPeopleAntibody":null,"negativeTestsPeopleAntibody":null,"totalTestsPeopleAntigen":null,"positiveTestsPeopleAntigen":null,"totalTestsAntigen":null,"positiveTestsAntigen":null,"fips":"23","positiveIncrease":44,"negativeIncrease":2907,"total":374138,"totalTestResultsIncrease":2951,"posNeg":374138,"deathIncrease":0,"hospitalizedIncrease":0,"hash":"77595d7c4b2a9c1b6760e8070abddd170fd9c139","commercialScore":0,"negativeRegularScore":0,"negativeScore":0,"positiveScore":0,"score":0,"grade":""},{"date":20200919,"state":"ME","positive":5035,"probableCases":513,"negative":366152,"pending":null,"totalTestResultsSource":null,"totalTestResults":371187,"hospitalizedCurrently":14,"hospitalizedCumulative":439,"inIcuCurrently":5,"inIcuCumulative":null,"onVentilatorCurrently":1,"onVentilatorCumulative":null,"recovered":4346,"dataQualityGrade":"A+","lastUpdateEt":"9/18/2020 23:59","dateModified":"2020-09-18T23:59:00Z","checkTimeEt":"09/18 19:59","death":139,"hospitalized":439,"dateChecked":"2020-09-18T23:59:00Z","totalTestsViral":370674,"positiveTestsViral":6280,"negativeTestsViral":364115,"positiveCasesViral":4522,"deathConfirmed":138,"deathProbable":1,"totalTestEncountersViral":null,"totalTestsPeopleViral":null,"totalTestsAntibody":10164,"positiveTestsAntibody":509,"negativeTestsAntibody":9641,"totalTestsPeopleAntibody":null,"positiveTestsPeopleAntibody":null,"negativeTestsPeopleAntibody":null,"totalTestsPeopleAntigen":null,"positiveTestsPeopleAntigen":null,"totalTestsAntigen":null,"positiveTestsAntigen":null,"fips":"23","positiveIncrease":30,"negativeIncrease":6733,"total":371187,"totalTestResultsIncrease":6763,"posNeg":371187,"deathIncrease":1,"hospitalizedIncrease":2,"hash":"848bdf7aefc224631f2900d58f568bd1a3c33d01","commercialScore":0,"negativeRegularScore":0,"negativeScore":0,"positiveScore":0,"score":0,"grade":""},{"date":20200918,"state":"ME","positive":5005,"probableCases":513,"negative":359419,"pending":null,"totalTestResultsSource":null,"totalTestResults":364424,"hospitalizedCurrently":11,"hospitalizedCumulative":437,"inIcuCurrently":5,"inIcuCumulative":null,"onVentilatorCurrently":1,"onVentilatorCumulative":null,"recovered":4335,"dataQualityGrade":"A+","lastUpdateEt":"9/17/2020 23:59","dateModified":"2020-09-17T23:59:00Z","checkTimeEt":"09/17 19:59","death":138,"hospitalized":437,"dateChecked":"2020-09-17T23:59:00Z","totalTestsViral":363911,"positiveTestsViral":6240,"negativeTestsViral":357397,"positiveCasesViral":4492,"deathConfirmed":137,"deathProbable":1,"totalTestEncountersViral":null,"totalTestsPeopleViral":null,"totalTestsAntibody":10147,"positiveTestsAntibody":509,"negativeTestsAntibody":9624,"totalTestsPeopleAntibody":null,"positiveTestsPeopleAntibody":null,"negativeTestsPeopleAntibody":null,"totalTestsPeopleAntigen":null,"positiveTestsPeopleAntigen":null,"totalTestsAntigen":null,"positiveTestsAntigen":null,"fips":"23","positiveIncrease":43,"negativeIncrease":13003,"total":364424,"totalTestResultsIncrease":13046,"posNeg":364424,"deathIncrease":0,"hospitalizedIncrease":1,"hash":"e1fe5abc72d31a226c635418a7c9b2b314890f40","commercialScore":0,"negativeRegularScore":0,"negativeScore":0,"positiveScore":0,"score":0,"grade":""},{"date":20200917,"state":"ME","positive":4962,"probableCases":504,"negative":346416,"pending":null,"totalTestResultsSource":null,"totalTestResults":351378,"hospitalizedCurrently":12,"hospitalizedCumulative":436,"inIcuCurrently":5,"inIcuCumulative":null,"onVentilatorCurrently":0,"onVentilatorCumulative":null,"recovered":4317,"dataQualityGrade":"A+","lastUpdateEt":"9/16/2020 23:59","dateModified":"2020-09-16T23:59:00Z","checkTimeEt":"09/16 19:59","death":138,"hospitalized":436,"dateChecked":"2020-09-16T23:59:00Z","totalTestsViral":350874,"positiveTestsViral":6190,"negativeTestsViral":344419,"positiveCasesViral":4458,"deathConfirmed":137,"deathProbable":1,"totalTestEncountersViral":null,"totalTestsPeopleViral":null,"totalTestsAntibody":10133,"positiveTestsAntibody":509,"negativeTestsAntibody":9610,"totalTestsPeopleAntibody":null,"positiveTestsPeopleAntibody":null,"negativeTestsPeopleAntibody":null,"totalTestsPeopleAntigen":null,"positiveTestsPeopleAntigen":null,"totalTestsAntigen":null,"positiveTestsAntigen":null,"fips":"23","positiveIncrease":21,"negativeIncrease":9170,"total":351378,"totalTestResultsIncrease":9191,"posNeg":351378,"deathIncrease":0,"hospitalizedIncrease":3,"hash":"b016dbefd8992a91ade6b8fd7b3c9142046a02a3","commercialScore":0,"negativeRegularScore":0,"negativeScore":0,"positiveScore":0,"score":0,"grade":""},{"date":20200916,"state":"ME","positive":4941,"probableCases":507,"negative":337246,"pending":null,"totalTestResultsSource":null,"totalTestResults":342187,"hospitalizedCurrently":10,"hospitalizedCumulative":433,"inIcuCurrently":5,"inIcuCumulative":null,"onVentilatorCurrently":0,"onVentilatorCumulative":null,"recovered":4307,"dataQualityGrade":"A+","lastUpdateEt":"9/15/2020 23:59","dateModified":"2020-09-15T23:59:00Z","checkTimeEt":"09/15 19:59","death":138,"hospitalized":433,"dateChecked":"2020-09-15T23:59:00Z","totalTestsViral":341680,"positiveTestsViral":6161,"negativeTestsViral":335257,"positiveCasesViral":4434,"deathConfirmed":137,"deathProbable":1,"totalTestEncountersViral":null,"totalTestsPeopleViral":null,"totalTestsAntibody":10060,"positiveTestsAntibody":504,"negativeTestsAntibody":9542,"totalTestsPeopleAntibody":null,"positiveTestsPeopleAntibody":null,"negativeTestsPeopleAntibody":null,"totalTestsPeopleAntigen":null,"positiveTestsPeopleAntigen":null,"totalTestsAntigen":null,"positiveTestsAntigen":null,"fips":"23","positiveIncrease":23,"negativeIncrease":5675,"total":342187,"totalTestResultsIncrease":5698,"posNeg":342187,"deathIncrease":1,"hospitalizedIncrease":1,"hash":"86c41db85d53459f2f53f71c2153e0bb2be111cc","commercialScore":0,"negativeRegularScore":0,"negativeScore":0,"positiveScore":0,"score":0,"grade":""},{"date":20200915,"state":"ME","positive":4918,"probableCases":503,"negative":331571,"pending":null,"totalTestResultsSource":null,"totalTestResults":336489,"hospitalizedCurrently":10,"hospitalizedCumulative":432,"inIcuCurrently":5,"inIcuCumulative":null,"onVentilatorCurrently":0,"onVentilatorCumulative":null,"recovered":4280,"dataQualityGrade":"A+","lastUpdateEt":"9/14/2020 23:59","dateModified":"2020-09-14T23:59:00Z","checkTimeEt":"09/14 19:59","death":137,"hospitalized":432,"dateChecked":"2020-09-14T23:59:00Z","totalTestsViral":335986,"positiveTestsViral":6130,"negativeTestsViral":329596,"positiveCasesViral":4415,"deathConfirmed":136,"deathProbable":1,"totalTestEncountersViral":null,"totalTestsPeopleViral":null,"totalTestsAntibody":10020,"positiveTestsAntibody":503,"negativeTestsAntibody":9503,"totalTestsPeopleAntibody":null,"positiveTestsPeopleAntibody":null,"negativeTestsPeopleAntibody":null,"totalTestsPeopleAntigen":null,"positiveTestsPeopleAntigen":null,"totalTestsAntigen":null,"positiveTestsAntigen":null,"fips":"23","positiveIncrease":15,"negativeIncrease":2697,"total":336489,"totalTestResultsIncrease":2712,"posNeg":336489,"deathIncrease":1,"hospitalizedIncrease":1,"hash":"0d64d3b996a350b2eeb922fbe55b568c3e5a7789","commercialScore":0,"negativeRegularScore":0,"negativeScore":0,"positiveScore":0,"score":0,"grade":""},{"date":20200914,"state":"ME","positive":4903,"probableCases":502,"negative":328874,"pending":null,"totalTestResultsSource":null,"totalTestResults":333777,"hospitalizedCurrently":9,"hospitalizedCumulative":431,"inIcuCurrently":5,"inIcuCumulative":null,"onVentilatorCurrently":3,"onVentilatorCumulative":null,"recovered":4237,"dataQualityGrade":"A+","lastUpdateEt":"9/13/2020 23:59","dateModified":"2020-09-13T23:59:00Z","checkTimeEt":"09/13 19:59","death":136,"hospitalized":431,"dateChecked":"2020-09-13T23:59:00Z","totalTestsViral":333275,"positiveTestsViral":6110,"negativeTestsViral":326907,"positiveCasesViral":4401,"deathConfirmed":135,"deathProbable":1,"totalTestEncountersViral":null,"totalTestsPeopleViral":null,"totalTestsAntibody":9995,"positiveTestsAntibody":503,"negativeTestsAntibody":9478,"totalTestsPeopleAntibody":null,"positiveTestsPeopleAntibody":null,"negativeTestsPeopleAntibody":null,"totalTestsPeopleAntigen":null,"positiveTestsPeopleAntigen":null,"totalTestsAntigen":null,"positiveTestsAntigen":null,"fips":"23","positiveIncrease":40,"negativeIncrease":3569,"total":333777,"totalTestResultsIncrease":3609,"posNeg":333777,"deathIncrease":0,"hospitalizedIncrease":0,"hash":"7aace9ecae0bdc484a640084daaf86424e87117f","commercialScore":0,"negativeRegularScore":0,"negativeScore":0,"positiveScore":0,"score":0,"grade":""},{"date":20200913,"state":"ME","positive":4863,"probableCases":487,"negative":325305,"pending":null,"totalTestResultsSource":null,"totalTestResults":330168,"hospitalizedCurrently":11,"hospitalizedCumulative":431,"inIcuCurrently":6,"inIcuCumulative":null,"onVentilatorCurrently":3,"onVentilatorCumulative":null,"recovered":4226,"dataQualityGrade":"A+","lastUpdateEt":"9/12/2020 23:59","dateModified":"2020-09-12T23:59:00Z","checkTimeEt":"09/12 19:59","death":136,"hospitalized":431,"dateChecked":"2020-09-12T23:59:00Z","totalTestsViral":329681,"positiveTestsViral":6081,"negativeTestsViral":323343,"positiveCasesViral":4376,"deathConfirmed":135,"deathProbable":1,"totalTestEncountersViral":null,"totalTestsPeopleViral":null,"totalTestsAntibody":9990,"positiveTestsAntibody":503,"negativeTestsAntibody":9473,"totalTestsPeopleAntibody":null,"positiveTestsPeopleAntibody":null,"negativeTestsPeopleAntibody":null,"totalTestsPeopleAntigen":null,"positiveTestsPeopleAntigen":null,"totalTestsAntigen":null,"positiveTestsAntigen":null,"fips":"23","positiveIncrease":29,"negativeIncrease":5136,"total":330168,"totalTestResultsIncrease":5165,"posNeg":330168,"deathIncrease":1,"hospitalizedIncrease":0,"hash":"d3f5dc6569abc46bb34a7706b1453a8eac95e6b6","commercialScore":0,"negativeRegularScore":0,"negativeScore":0,"positiveScore":0,"score":0,"grade":""},{"date":20200912,"state":"ME","positive":4834,"probableCases":485,"negative":320169,"pending":null,"totalTestResultsSource":null,"totalTestResults":325003,"hospitalizedCurrently":10,"hospitalizedCumulative":431,"inIcuCurrently":6,"inIcuCumulative":null,"onVentilatorCurrently":4,"onVentilatorCumulative":null,"recovered":4211,"dataQualityGrade":"A+","lastUpdateEt":"9/11/2020 23:59","dateModified":"2020-09-11T23:59:00Z","checkTimeEt":"09/11 19:59","death":135,"hospitalized":431,"dateChecked":"2020-09-11T23:59:00Z","totalTestsViral":324518,"positiveTestsViral":6048,"negativeTestsViral":318215,"positiveCasesViral":4349,"deathConfirmed":134,"deathProbable":1,"totalTestEncountersViral":null,"totalTestsPeopleViral":null,"totalTestsAntibody":9957,"positiveTestsAntibody":503,"negativeTestsAntibody":9440,"totalTestsPeopleAntibody":null,"positiveTestsPeopleAntibody":null,"negativeTestsPeopleAntibody":null,"totalTestsPeopleAntigen":null,"positiveTestsPeopleAntigen":null,"totalTestsAntigen":null,"positiveTestsAntigen":null,"fips":"23","positiveIncrease":42,"negativeIncrease":4953,"total":325003,"totalTestResultsIncrease":4995,"posNeg":325003,"deathIncrease":1,"hospitalizedIncrease":-1,"hash":"27f8705ece363e04918d6c7e1bc4c44acacc7532","commercialScore":0,"negativeRegularScore":0,"negativeScore":0,"positiveScore":0,"score":0,"grade":""},{"date":20200911,"state":"ME","positive":4792,"probableCases":475,"negative":315216,"pending":null,"totalTestResultsSource":null,"totalTestResults":320008,"hospitalizedCurrently":10,"hospitalizedCumulative":432,"inIcuCurrently":6,"inIcuCumulative":null,"onVentilatorCurrently":5,"onVentilatorCumulative":null,"recovered":4191,"dataQualityGrade":"A+","lastUpdateEt":"9/10/2020 23:59","dateModified":"2020-09-10T23:59:00Z","checkTimeEt":"09/10 19:59","death":134,"hospitalized":432,"dateChecked":"2020-09-10T23:59:00Z","totalTestsViral":319533,"positiveTestsViral":6013,"negativeTestsViral":313267,"positiveCasesViral":4317,"deathConfirmed":133,"deathProbable":1,"totalTestEncountersViral":null,"totalTestsPeopleViral":null,"totalTestsAntibody":9943,"positiveTestsAntibody":503,"negativeTestsAntibody":9426,"totalTestsPeopleAntibody":null,"positiveTestsPeopleAntibody":null,"negativeTestsPeopleAntibody":null,"totalTestsPeopleAntigen":null,"positiveTestsPeopleAntigen":null,"totalTestsAntigen":null,"positiveTestsAntigen":null,"fips":"23","positiveIncrease":32,"negativeIncrease":6067,"total":320008,"totalTestResultsIncrease":6099,"posNeg":320008,"deathIncrease":0,"hospitalizedIncrease":1,"hash":"03c32cbc6e5eb86d97a29c810b4b3c1db1d35a22","commercialScore":0,"negativeRegularScore":0,"negativeScore":0,"positiveScore":0,"score":0,"grade":""},{"date":20200910,"state":"ME","positive":4760,"probableCases":473,"negative":309149,"pending":null,"totalTestResultsSource":null,"totalTestResults":313909,"hospitalizedCurrently":11,"hospitalizedCumulative":431,"inIcuCurrently":7,"inIcuCumulative":null,"onVentilatorCurrently":3,"onVentilatorCumulative":null,"recovered":4153,"dataQualityGrade":"A+","lastUpdateEt":"9/9/2020 23:59","dateModified":"2020-09-09T23:59:00Z","checkTimeEt":"09/09 19:59","death":134,"hospitalized":431,"dateChecked":"2020-09-09T23:59:00Z","totalTestsViral":313436,"positiveTestsViral":5965,"negativeTestsViral":307221,"positiveCasesViral":4287,"deathConfirmed":133,"deathProbable":1,"totalTestEncountersViral":null,"totalTestsPeopleViral":null,"totalTestsAntibody":9931,"positiveTestsAntibody":500,"negativeTestsAntibody":9417,"totalTestsPeopleAntibody":null,"positiveTestsPeopleAntibody":null,"negativeTestsPeopleAntibody":null,"totalTestsPeopleAntigen":null,"positiveTestsPeopleAntigen":null,"totalTestsAntigen":null,"positiveTestsAntigen":null,"fips":"23","positiveIncrease":26,"negativeIncrease":4158,"total":313909,"totalTestResultsIncrease":4184,"posNeg":313909,"deathIncrease":0,"hospitalizedIncrease":2,"hash":"336566470e5f2d68661940717521af9c057c0e9a","commercialScore":0,"negativeRegularScore":0,"negativeScore":0,"positiveScore":0,"score":0,"grade":""},{"date":20200909,"state":"ME","positive":4734,"probableCases":476,"negative":304991,"pending":null,"totalTestResultsSource":null,"totalTestResults":309725,"hospitalizedCurrently":9,"hospitalizedCumulative":429,"inIcuCurrently":7,"inIcuCumulative":null,"onVentilatorCurrently":3,"onVentilatorCumulative":null,"recovered":4135,"dataQualityGrade":"A+","lastUpdateEt":"9/8/2020 23:59","dateModified":"2020-09-08T23:59:00Z","checkTimeEt":"09/08 19:59","death":134,"hospitalized":429,"dateChecked":"2020-09-08T23:59:00Z","totalTestsViral":309249,"positiveTestsViral":5920,"negativeTestsViral":303080,"positiveCasesViral":4258,"deathConfirmed":133,"deathProbable":1,"totalTestEncountersViral":null,"totalTestsPeopleViral":null,"totalTestsAntibody":9907,"positiveTestsAntibody":499,"negativeTestsAntibody":9395,"totalTestsPeopleAntibody":null,"positiveTestsPeopleAntibody":null,"negativeTestsPeopleAntibody":null,"totalTestsPeopleAntigen":null,"positiveTestsPeopleAntigen":null,"totalTestsAntigen":null,"positiveTestsAntigen":null,"fips":"23","positiveIncrease":21,"negativeIncrease":6998,"total":309725,"totalTestResultsIncrease":7019,"posNeg":309725,"deathIncrease":0,"hospitalizedIncrease":0,"hash":"0d945e71c06f5d849f4a6e86ba222daf3d421b81","commercialScore":0,"negativeRegularScore":0,"negativeScore":0,"positiveScore":0,"score":0,"grade":""},{"date":20200908,"state":"ME","positive":4713,"probableCases":469,"negative":297993,"pending":null,"totalTestResultsSource":null,"totalTestResults":302706,"hospitalizedCurrently":7,"hospitalizedCumulative":429,"inIcuCurrently":6,"inIcuCumulative":null,"onVentilatorCurrently":2,"onVentilatorCumulative":null,"recovered":4086,"dataQualityGrade":"A+","lastUpdateEt":"9/7/2020 23:59","dateModified":"2020-09-07T23:59:00Z","checkTimeEt":"09/07 19:59","death":134,"hospitalized":429,"dateChecked":"2020-09-07T23:59:00Z","totalTestsViral":302237,"positiveTestsViral":5895,"negativeTestsViral":296094,"positiveCasesViral":4244,"deathConfirmed":133,"deathProbable":1,"totalTestEncountersViral":null,"totalTestsPeopleViral":null,"totalTestsAntibody":9906,"positiveTestsAntibody":499,"negativeTestsAntibody":9394,"totalTestsPeopleAntibody":null,"positiveTestsPeopleAntibody":null,"negativeTestsPeopleAntibody":null,"totalTestsPeopleAntigen":null,"positiveTestsPeopleAntigen":null,"totalTestsAntigen":null,"positiveTestsAntigen":null,"fips":"23","positiveIncrease":12,"negativeIncrease":2662,"total":302706,"totalTestResultsIncrease":2674,"posNeg":302706,"deathIncrease":0,"hospitalizedIncrease":2,"hash":"a4337bfce295ec610eb3cba97ae3f1519fdcd427","commercialScore":0,"negativeRegularScore":0,"negativeScore":0,"positiveScore":0,"score":0,"grade":""},{"date":20200907,"state":"ME","positive":4701,"probableCases":471,"negative":295331,"pending":null,"totalTestResultsSource":null,"totalTestResults":300032,"hospitalizedCurrently":8,"hospitalizedCumulative":427,"inIcuCurrently":3,"inIcuCumulative":null,"onVentilatorCurrently":2,"onVentilatorCumulative":null,"recovered":4076,"dataQualityGrade":"A+","lastUpdateEt":"9/6/2020 23:59","dateModified":"2020-09-06T23:59:00Z","checkTimeEt":"09/06 19:59","death":134,"hospitalized":427,"dateChecked":"2020-09-06T23:59:00Z","totalTestsViral":299561,"positiveTestsViral":5874,"negativeTestsViral":293439,"positiveCasesViral":4230,"deathConfirmed":133,"deathProbable":1,"totalTestEncountersViral":null,"totalTestsPeopleViral":null,"totalTestsAntibody":9904,"positiveTestsAntibody":499,"negativeTestsAntibody":9392,"totalTestsPeopleAntibody":null,"positiveTestsPeopleAntibody":null,"negativeTestsPeopleAntibody":null,"totalTestsPeopleAntigen":null,"positiveTestsPeopleAntigen":null,"totalTestsAntigen":null,"positiveTestsAntigen":null,"fips":"23","positiveIncrease":19,"negativeIncrease":3159,"total":300032,"totalTestResultsIncrease":3178,"posNeg":300032,"deathIncrease":0,"hospitalizedIncrease":3,"hash":"4983b6ebdae20148bbf76b84f1bfdd84e634c122","commercialScore":0,"negativeRegularScore":0,"negativeScore":0,"positiveScore":0,"score":0,"grade":""},{"date":20200906,"state":"ME","positive":4682,"probableCases":472,"negative":292172,"pending":null,"totalTestResultsSource":null,"totalTestResults":296854,"hospitalizedCurrently":6,"hospitalizedCumulative":424,"inIcuCurrently":2,"inIcuCumulative":null,"onVentilatorCurrently":2,"onVentilatorCumulative":null,"recovered":4049,"dataQualityGrade":"A+","lastUpdateEt":"9/5/2020 23:59","dateModified":"2020-09-05T23:59:00Z","checkTimeEt":"09/05 19:59","death":134,"hospitalized":424,"dateChecked":"2020-09-05T23:59:00Z","totalTestsViral":296382,"positiveTestsViral":5853,"negativeTestsViral":290281,"positiveCasesViral":4210,"deathConfirmed":133,"deathProbable":1,"totalTestEncountersViral":null,"totalTestsPeopleViral":null,"totalTestsAntibody":9760,"positiveTestsAntibody":491,"negativeTestsAntibody":9256,"totalTestsPeopleAntibody":null,"positiveTestsPeopleAntibody":null,"negativeTestsPeopleAntibody":null,"totalTestsPeopleAntigen":null,"positiveTestsPeopleAntigen":null,"totalTestsAntigen":null,"positiveTestsAntigen":null,"fips":"23","positiveIncrease":15,"negativeIncrease":4864,"total":296854,"totalTestResultsIncrease":4879,"posNeg":296854,"deathIncrease":0,"hospitalizedIncrease":0,"hash":"41efe2dec18376beb45b9bf8f46f6d30240116e6","commercialScore":0,"negativeRegularScore":0,"negativeScore":0,"positiveScore":0,"score":0,"grade":""},{"date":20200905,"state":"ME","positive":4667,"probableCases":470,"negative":287308,"pending":null,"totalTestResultsSource":null,"totalTestResults":291975,"hospitalizedCurrently":5,"hospitalizedCumulative":424,"inIcuCurrently":2,"inIcuCumulative":null,"onVentilatorCurrently":2,"onVentilatorCumulative":null,"recovered":4037,"dataQualityGrade":"A+","lastUpdateEt":"9/4/2020 23:59","dateModified":"2020-09-04T23:59:00Z","checkTimeEt":"09/04 19:59","death":134,"hospitalized":424,"dateChecked":"2020-09-04T23:59:00Z","totalTestsViral":291505,"positiveTestsViral":5837,"negativeTestsViral":285420,"positiveCasesViral":4197,"deathConfirmed":133,"deathProbable":1,"totalTestEncountersViral":null,"totalTestsPeopleViral":null,"totalTestsAntibody":9738,"positiveTestsAntibody":488,"negativeTestsAntibody":9237,"totalTestsPeopleAntibody":null,"positiveTestsPeopleAntibody":null,"negativeTestsPeopleAntibody":null,"totalTestsPeopleAntigen":null,"positiveTestsPeopleAntigen":null,"totalTestsAntigen":null,"positiveTestsAntigen":null,"fips":"23","positiveIncrease":35,"negativeIncrease":5337,"total":291975,"totalTestResultsIncrease":5372,"posNeg":291975,"deathIncrease":0,"hospitalizedIncrease":1,"hash":"1906d46aa7bcdc5d8a96b97b163fd88c0a9ea499","commercialScore":0,"negativeRegularScore":0,"negativeScore":0,"positiveScore":0,"score":0,"grade":""},{"date":20200904,"state":"ME","positive":4632,"probableCases":468,"negative":281971,"pending":null,"totalTestResultsSource":null,"totalTestResults":286603,"hospitalizedCurrently":9,"hospitalizedCumulative":423,"inIcuCurrently":5,"inIcuCumulative":null,"onVentilatorCurrently":2,"onVentilatorCumulative":null,"recovered":4006,"dataQualityGrade":"A+","lastUpdateEt":"9/3/2020 23:59","dateModified":"2020-09-03T23:59:00Z","checkTimeEt":"09/03 19:59","death":134,"hospitalized":423,"dateChecked":"2020-09-03T23:59:00Z","totalTestsViral":286135,"positiveTestsViral":5800,"negativeTestsViral":280089,"positiveCasesViral":4164,"deathConfirmed":133,"deathProbable":1,"totalTestEncountersViral":null,"totalTestsPeopleViral":null,"totalTestsAntibody":9722,"positiveTestsAntibody":484,"negativeTestsAntibody":9225,"totalTestsPeopleAntibody":null,"positiveTestsPeopleAntibody":null,"negativeTestsPeopleAntibody":null,"totalTestsPeopleAntigen":null,"positiveTestsPeopleAntigen":null,"totalTestsAntigen":null,"positiveTestsAntigen":null,"fips":"23","positiveIncrease":15,"negativeIncrease":5535,"total":286603,"totalTestResultsIncrease":5550,"posNeg":286603,"deathIncrease":1,"hospitalizedIncrease":-1,"hash":"0b3178dae5627d08725e1c5f6f1b036b34e14fbe","commercialScore":0,"negativeRegularScore":0,"negativeScore":0,"positiveScore":0,"score":0,"grade":""},{"date":20200903,"state":"ME","positive":4617,"probableCases":472,"negative":276436,"pending":null,"totalTestResultsSource":null,"totalTestResults":281053,"hospitalizedCurrently":9,"hospitalizedCumulative":424,"inIcuCurrently":4,"inIcuCumulative":null,"onVentilatorCurrently":1,"onVentilatorCumulative":null,"recovered":3988,"dataQualityGrade":"A+","lastUpdateEt":"9/2/2020 23:59","dateModified":"2020-09-02T23:59:00Z","checkTimeEt":"09/02 19:59","death":133,"hospitalized":424,"dateChecked":"2020-09-02T23:59:00Z","totalTestsViral":280581,"positiveTestsViral":5771,"negativeTestsViral":274564,"positiveCasesViral":4145,"deathConfirmed":132,"deathProbable":1,"totalTestEncountersViral":null,"totalTestsPeopleViral":null,"totalTestsAntibody":9700,"positiveTestsAntibody":482,"negativeTestsAntibody":9205,"totalTestsPeopleAntibody":null,"positiveTestsPeopleAntibody":null,"negativeTestsPeopleAntibody":null,"totalTestsPeopleAntigen":null,"positiveTestsPeopleAntigen":null,"totalTestsAntigen":null,"positiveTestsAntigen":null,"fips":"23","positiveIncrease":50,"negativeIncrease":7971,"total":281053,"totalTestResultsIncrease":8021,"posNeg":281053,"deathIncrease":0,"hospitalizedIncrease":1,"hash":"490c839f794e73a2699f2f673d009de345c69cfe","commercialScore":0,"negativeRegularScore":0,"negativeScore":0,"positiveScore":0,"score":0,"grade":""},{"date":20200902,"state":"ME","positive":4567,"probableCases":467,"negative":268465,"pending":null,"totalTestResultsSource":null,"totalTestResults":273032,"hospitalizedCurrently":11,"hospitalizedCumulative":423,"inIcuCurrently":6,"inIcuCumulative":null,"onVentilatorCurrently":1,"onVentilatorCumulative":null,"recovered":3978,"dataQualityGrade":"A+","lastUpdateEt":"9/1/2020 23:59","dateModified":"2020-09-01T23:59:00Z","checkTimeEt":"09/01 19:59","death":133,"hospitalized":423,"dateChecked":"2020-09-01T23:59:00Z","totalTestsViral":272565,"positiveTestsViral":5717,"negativeTestsViral":266604,"positiveCasesViral":4100,"deathConfirmed":132,"deathProbable":1,"totalTestEncountersViral":null,"totalTestsPeopleViral":null,"totalTestsAntibody":9646,"positiveTestsAntibody":480,"negativeTestsAntibody":9153,"totalTestsPeopleAntibody":null,"positiveTestsPeopleAntibody":null,"negativeTestsPeopleAntibody":null,"totalTestsPeopleAntigen":null,"positiveTestsPeopleAntigen":null,"totalTestsAntigen":null,"positiveTestsAntigen":null,"fips":"23","positiveIncrease":19,"negativeIncrease":4278,"total":273032,"totalTestResultsIncrease":4297,"posNeg":273032,"deathIncrease":1,"hospitalizedIncrease":2,"hash":"145375069c312990b6a83004a77442f7f03996a0","commercialScore":0,"negativeRegularScore":0,"negativeScore":0,"positiveScore":0,"score":0,"grade":""},{"date":20200901,"state":"ME","positive":4548,"probableCases":467,"negative":264187,"pending":null,"totalTestResultsSource":null,"totalTestResults":268735,"hospitalizedCurrently":9,"hospitalizedCumulative":421,"inIcuCurrently":5,"inIcuCumulative":null,"onVentilatorCurrently":1,"onVentilatorCumulative":null,"recovered":3945,"dataQualityGrade":"A+","lastUpdateEt":"8/31/2020 23:59","dateModified":"2020-08-31T23:59:00Z","checkTimeEt":"08/31 19:59","death":132,"hospitalized":421,"dateChecked":"2020-08-31T23:59:00Z","totalTestsViral":268268,"positiveTestsViral":5686,"negativeTestsViral":262339,"positiveCasesViral":4081,"deathConfirmed":131,"deathProbable":1,"totalTestEncountersViral":null,"totalTestsPeopleViral":null,"totalTestsAntibody":9581,"positiveTestsAntibody":479,"negativeTestsAntibody":9089,"totalTestsPeopleAntibody":null,"positiveTestsPeopleAntibody":null,"negativeTestsPeopleAntibody":null,"totalTestsPeopleAntigen":null,"positiveTestsPeopleAntigen":null,"totalTestsAntigen":null,"positiveTestsAntigen":null,"fips":"23","positiveIncrease":22,"negativeIncrease":5778,"total":268735,"totalTestResultsIncrease":5800,"posNeg":268735,"deathIncrease":0,"hospitalizedIncrease":1,"hash":"fcdb1884f84f02e593f0c7df17272075e11ec044","commercialScore":0,"negativeRegularScore":0,"negativeScore":0,"positiveScore":0,"score":0,"grade":""},{"date":20200831,"state":"ME","positive":4526,"probableCases":466,"negative":258409,"pending":null,"totalTestResultsSource":null,"totalTestResults":262935,"hospitalizedCurrently":6,"hospitalizedCumulative":420,"inIcuCurrently":4,"inIcuCumulative":null,"onVentilatorCurrently":1,"onVentilatorCumulative":null,"recovered":3923,"dataQualityGrade":"A+","lastUpdateEt":"8/30/2020 23:59","dateModified":"2020-08-30T23:59:00Z","checkTimeEt":"08/30 19:59","death":132,"hospitalized":420,"dateChecked":"2020-08-30T23:59:00Z","totalTestsViral":262469,"positiveTestsViral":5652,"negativeTestsViral":256576,"positiveCasesViral":4060,"deathConfirmed":131,"deathProbable":1,"totalTestEncountersViral":null,"totalTestsPeopleViral":null,"totalTestsAntibody":9548,"positiveTestsAntibody":479,"negativeTestsAntibody":9056,"totalTestsPeopleAntibody":null,"positiveTestsPeopleAntibody":null,"negativeTestsPeopleAntibody":null,"totalTestsPeopleAntigen":null,"positiveTestsPeopleAntigen":null,"totalTestsAntigen":null,"positiveTestsAntigen":null,"fips":"23","positiveIncrease":14,"negativeIncrease":3260,"total":262935,"totalTestResultsIncrease":3274,"posNeg":262935,"deathIncrease":0,"hospitalizedIncrease":0,"hash":"4f3e97a8fbc0d9019a4aed88bd0c0998e23e356b","commercialScore":0,"negativeRegularScore":0,"negativeScore":0,"positiveScore":0,"score":0,"grade":""},{"date":20200830,"state":"ME","positive":4512,"probableCases":465,"negative":255149,"pending":null,"totalTestResultsSource":null,"totalTestResults":259661,"hospitalizedCurrently":7,"hospitalizedCumulative":420,"inIcuCurrently":4,"inIcuCumulative":null,"onVentilatorCurrently":1,"onVentilatorCumulative":null,"recovered":3910,"dataQualityGrade":"A+","lastUpdateEt":"8/29/2020 23:59","dateModified":"2020-08-29T23:59:00Z","checkTimeEt":"08/29 19:59","death":132,"hospitalized":420,"dateChecked":"2020-08-29T23:59:00Z","totalTestsViral":259196,"positiveTestsViral":5638,"negativeTestsViral":253317,"positiveCasesViral":4047,"deathConfirmed":131,"deathProbable":1,"totalTestEncountersViral":null,"totalTestsPeopleViral":null,"totalTestsAntibody":9537,"positiveTestsAntibody":479,"negativeTestsAntibody":9045,"totalTestsPeopleAntibody":null,"positiveTestsPeopleAntibody":null,"negativeTestsPeopleAntibody":null,"totalTestsPeopleAntigen":null,"positiveTestsPeopleAntigen":null,"totalTestsAntigen":null,"positiveTestsAntigen":null,"fips":"23","positiveIncrease":23,"negativeIncrease":4280,"total":259661,"totalTestResultsIncrease":4303,"posNeg":259661,"deathIncrease":0,"hospitalizedIncrease":2,"hash":"fa69f8e59d26dfdfda44216b896cb749aada6c96","commercialScore":0,"negativeRegularScore":0,"negativeScore":0,"positiveScore":0,"score":0,"grade":""},{"date":20200829,"state":"ME","positive":4489,"probableCases":457,"negative":250869,"pending":null,"totalTestResultsSource":null,"totalTestResults":255358,"hospitalizedCurrently":8,"hospitalizedCumulative":418,"inIcuCurrently":2,"inIcuCumulative":null,"onVentilatorCurrently":1,"onVentilatorCumulative":null,"recovered":3899,"dataQualityGrade":"A+","lastUpdateEt":"8/28/2020 23:59","dateModified":"2020-08-28T23:59:00Z","checkTimeEt":"08/28 19:59","death":132,"hospitalized":418,"dateChecked":"2020-08-28T23:59:00Z","totalTestsViral":254901,"positiveTestsViral":5613,"negativeTestsViral":249049,"positiveCasesViral":4032,"deathConfirmed":131,"deathProbable":1,"totalTestEncountersViral":null,"totalTestsPeopleViral":null,"totalTestsAntibody":9507,"positiveTestsAntibody":478,"negativeTestsAntibody":9016,"totalTestsPeopleAntibody":null,"positiveTestsPeopleAntibody":null,"negativeTestsPeopleAntibody":null,"totalTestsPeopleAntigen":null,"positiveTestsPeopleAntigen":null,"totalTestsAntigen":null,"positiveTestsAntigen":null,"fips":"23","positiveIncrease":53,"negativeIncrease":4132,"total":255358,"totalTestResultsIncrease":4185,"posNeg":255358,"deathIncrease":0,"hospitalizedIncrease":1,"hash":"1acc727aebb32121772c68e684c4224cc1fe792b","commercialScore":0,"negativeRegularScore":0,"negativeScore":0,"positiveScore":0,"score":0,"grade":""},{"date":20200828,"state":"ME","positive":4436,"probableCases":455,"negative":246737,"pending":null,"totalTestResultsSource":null,"totalTestResults":251173,"hospitalizedCurrently":10,"hospitalizedCumulative":417,"inIcuCurrently":6,"inIcuCumulative":null,"onVentilatorCurrently":1,"onVentilatorCumulative":null,"recovered":3887,"dataQualityGrade":"A+","lastUpdateEt":"8/27/2020 23:59","dateModified":"2020-08-27T23:59:00Z","checkTimeEt":"08/27 19:59","death":132,"hospitalized":417,"dateChecked":"2020-08-27T23:59:00Z","totalTestsViral":250718,"positiveTestsViral":5568,"negativeTestsViral":244911,"positiveCasesViral":3981,"deathConfirmed":131,"deathProbable":1,"totalTestEncountersViral":null,"totalTestsPeopleViral":null,"totalTestsAntibody":9491,"positiveTestsAntibody":477,"negativeTestsAntibody":9001,"totalTestsPeopleAntibody":null,"positiveTestsPeopleAntibody":null,"negativeTestsPeopleAntibody":null,"totalTestsPeopleAntigen":null,"positiveTestsPeopleAntigen":null,"totalTestsAntigen":null,"positiveTestsAntigen":null,"fips":"23","positiveIncrease":22,"negativeIncrease":5224,"total":251173,"totalTestResultsIncrease":5246,"posNeg":251173,"deathIncrease":0,"hospitalizedIncrease":2,"hash":"6dc67e8b7a254c896af3284e348c8d9d281439d8","commercialScore":0,"negativeRegularScore":0,"negativeScore":0,"positiveScore":0,"score":0,"grade":""},{"date":20200827,"state":"ME","positive":4414,"probableCases":453,"negative":241513,"pending":null,"totalTestResultsSource":null,"totalTestResults":245927,"hospitalizedCurrently":9,"hospitalizedCumulative":415,"inIcuCurrently":4,"inIcuCumulative":null,"onVentilatorCurrently":1,"onVentilatorCumulative":null,"recovered":3847,"dataQualityGrade":"A+","lastUpdateEt":"8/26/2020 23:59","dateModified":"2020-08-26T23:59:00Z","checkTimeEt":"08/26 19:59","death":132,"hospitalized":415,"dateChecked":"2020-08-26T23:59:00Z","totalTestsViral":245474,"positiveTestsViral":5529,"negativeTestsViral":239707,"positiveCasesViral":3961,"deathConfirmed":131,"deathProbable":1,"totalTestEncountersViral":null,"totalTestsPeopleViral":null,"totalTestsAntibody":9469,"positiveTestsAntibody":474,"negativeTestsAntibody":8982,"totalTestsPeopleAntibody":null,"positiveTestsPeopleAntibody":null,"negativeTestsPeopleAntibody":null,"totalTestsPeopleAntigen":null,"positiveTestsPeopleAntigen":null,"totalTestsAntigen":null,"positiveTestsAntigen":null,"fips":"23","positiveIncrease":25,"negativeIncrease":3906,"total":245927,"totalTestResultsIncrease":3931,"posNeg":245927,"deathIncrease":0,"hospitalizedIncrease":3,"hash":"6531eaee01b294276e6d68dd74a47e82d4e30bbc","commercialScore":0,"negativeRegularScore":0,"negativeScore":0,"positiveScore":0,"score":0,"grade":""},{"date":20200826,"state":"ME","positive":4389,"probableCases":447,"negative":237607,"pending":null,"totalTestResultsSource":null,"totalTestResults":241996,"hospitalizedCurrently":8,"hospitalizedCumulative":412,"inIcuCurrently":5,"inIcuCumulative":null,"onVentilatorCurrently":1,"onVentilatorCumulative":null,"recovered":3818,"dataQualityGrade":"A+","lastUpdateEt":"8/25/2020 23:59","dateModified":"2020-08-25T23:59:00Z","checkTimeEt":"08/25 19:59","death":132,"hospitalized":412,"dateChecked":"2020-08-25T23:59:00Z","totalTestsViral":241549,"positiveTestsViral":5502,"negativeTestsViral":235811,"positiveCasesViral":3942,"deathConfirmed":131,"deathProbable":1,"totalTestEncountersViral":null,"totalTestsPeopleViral":null,"totalTestsAntibody":9431,"positiveTestsAntibody":474,"negativeTestsAntibody":8944,"totalTestsPeopleAntibody":null,"positiveTestsPeopleAntibody":null,"negativeTestsPeopleAntibody":null,"totalTestsPeopleAntigen":null,"positiveTestsPeopleAntigen":null,"totalTestsAntigen":null,"positiveTestsAntigen":null,"fips":"23","positiveIncrease":21,"negativeIncrease":4601,"total":241996,"totalTestResultsIncrease":4622,"posNeg":241996,"deathIncrease":1,"hospitalizedIncrease":2,"hash":"2351ccd133c64455ed1f972adc29943b9c004a93","commercialScore":0,"negativeRegularScore":0,"negativeScore":0,"positiveScore":0,"score":0,"grade":""},{"date":20200825,"state":"ME","positive":4368,"probableCases":449,"negative":233006,"pending":null,"totalTestResultsSource":null,"totalTestResults":237374,"hospitalizedCurrently":8,"hospitalizedCumulative":410,"inIcuCurrently":5,"inIcuCumulative":null,"onVentilatorCurrently":1,"onVentilatorCumulative":null,"recovered":3784,"dataQualityGrade":"A+","lastUpdateEt":"8/24/2020 23:59","dateModified":"2020-08-24T23:59:00Z","checkTimeEt":"08/24 19:59","death":131,"hospitalized":410,"dateChecked":"2020-08-24T23:59:00Z","totalTestsViral":236925,"positiveTestsViral":5472,"negativeTestsViral":231219,"positiveCasesViral":3919,"deathConfirmed":130,"deathProbable":1,"totalTestEncountersViral":null,"totalTestsPeopleViral":null,"totalTestsAntibody":9411,"positiveTestsAntibody":472,"negativeTestsAntibody":8926,"totalTestsPeopleAntibody":null,"positiveTestsPeopleAntibody":null,"negativeTestsPeopleAntibody":null,"totalTestsPeopleAntigen":null,"positiveTestsPeopleAntigen":null,"totalTestsAntigen":null,"positiveTestsAntigen":null,"fips":"23","positiveIncrease":12,"negativeIncrease":2506,"total":237374,"totalTestResultsIncrease":2518,"posNeg":237374,"deathIncrease":0,"hospitalizedIncrease":1,"hash":"8a8f8b373f0d58bae5813c4e4e9e55c1808d0e96","commercialScore":0,"negativeRegularScore":0,"negativeScore":0,"positiveScore":0,"score":0,"grade":""},{"date":20200824,"state":"ME","positive":4356,"probableCases":446,"negative":230500,"pending":null,"totalTestResultsSource":null,"totalTestResults":234856,"hospitalizedCurrently":6,"hospitalizedCumulative":409,"inIcuCurrently":5,"inIcuCumulative":null,"onVentilatorCurrently":1,"onVentilatorCumulative":null,"recovered":3762,"dataQualityGrade":"A+","lastUpdateEt":"8/23/2020 23:59","dateModified":"2020-08-23T23:59:00Z","checkTimeEt":"08/23 19:59","death":131,"hospitalized":409,"dateChecked":"2020-08-23T23:59:00Z","totalTestsViral":234410,"positiveTestsViral":5458,"negativeTestsViral":228718,"positiveCasesViral":3910,"deathConfirmed":130,"deathProbable":1,"totalTestEncountersViral":null,"totalTestsPeopleViral":null,"totalTestsAntibody":9409,"positiveTestsAntibody":470,"negativeTestsAntibody":8926,"totalTestsPeopleAntibody":null,"positiveTestsPeopleAntibody":null,"negativeTestsPeopleAntibody":null,"totalTestsPeopleAntigen":null,"positiveTestsPeopleAntigen":null,"totalTestsAntigen":null,"positiveTestsAntigen":null,"fips":"23","positiveIncrease":21,"negativeIncrease":3134,"total":234856,"totalTestResultsIncrease":3155,"posNeg":234856,"deathIncrease":0,"hospitalizedIncrease":1,"hash":"c742d4cbdc2df5d979218f40d49cfecea09e5ac0","commercialScore":0,"negativeRegularScore":0,"negativeScore":0,"positiveScore":0,"score":0,"grade":""},{"date":20200823,"state":"ME","positive":4335,"probableCases":445,"negative":227366,"pending":null,"totalTestResultsSource":null,"totalTestResults":231701,"hospitalizedCurrently":4,"hospitalizedCumulative":408,"inIcuCurrently":2,"inIcuCumulative":null,"onVentilatorCurrently":1,"onVentilatorCumulative":null,"recovered":3734,"dataQualityGrade":"A+","lastUpdateEt":"8/22/2020 23:59","dateModified":"2020-08-22T23:59:00Z","checkTimeEt":"08/22 19:59","death":131,"hospitalized":408,"dateChecked":"2020-08-22T23:59:00Z","totalTestsViral":231256,"positiveTestsViral":5436,"negativeTestsViral":225587,"positiveCasesViral":3890,"deathConfirmed":130,"deathProbable":1,"totalTestEncountersViral":null,"totalTestsPeopleViral":null,"totalTestsAntibody":9400,"positiveTestsAntibody":470,"negativeTestsAntibody":8917,"totalTestsPeopleAntibody":null,"positiveTestsPeopleAntibody":null,"negativeTestsPeopleAntibody":null,"totalTestsPeopleAntigen":null,"positiveTestsPeopleAntigen":null,"totalTestsAntigen":null,"positiveTestsAntigen":null,"fips":"23","positiveIncrease":18,"negativeIncrease":3932,"total":231701,"totalTestResultsIncrease":3950,"posNeg":231701,"deathIncrease":1,"hospitalizedIncrease":1,"hash":"687a269d98d1dbb2349d2c34e4ca0fbebcac7086","commercialScore":0,"negativeRegularScore":0,"negativeScore":0,"positiveScore":0,"score":0,"grade":""},{"date":20200822,"state":"ME","positive":4317,"probableCases":445,"negative":223434,"pending":null,"totalTestResultsSource":null,"totalTestResults":227751,"hospitalizedCurrently":4,"hospitalizedCumulative":407,"inIcuCurrently":1,"inIcuCumulative":null,"onVentilatorCurrently":1,"onVentilatorCumulative":null,"recovered":3718,"dataQualityGrade":"A+","lastUpdateEt":"8/21/2020 23:59","dateModified":"2020-08-21T23:59:00Z","checkTimeEt":"08/21 19:59","death":130,"hospitalized":407,"dateChecked":"2020-08-21T23:59:00Z","totalTestsViral":227306,"positiveTestsViral":5409,"negativeTestsViral":221664,"positiveCasesViral":3872,"deathConfirmed":129,"deathProbable":1,"totalTestEncountersViral":null,"totalTestsPeopleViral":null,"totalTestsAntibody":9365,"positiveTestsAntibody":467,"negativeTestsAntibody":8885,"totalTestsPeopleAntibody":null,"positiveTestsPeopleAntibody":null,"negativeTestsPeopleAntibody":null,"totalTestsPeopleAntigen":null,"positiveTestsPeopleAntigen":null,"totalTestsAntigen":null,"positiveTestsAntigen":null,"fips":"23","positiveIncrease":32,"negativeIncrease":3854,"total":227751,"totalTestResultsIncrease":3886,"posNeg":227751,"deathIncrease":1,"hospitalizedIncrease":0,"hash":"20d790c549c87d9bf6a8308972b7c87404056443","commercialScore":0,"negativeRegularScore":0,"negativeScore":0,"positiveScore":0,"score":0,"grade":""},{"date":20200821,"state":"ME","positive":4285,"probableCases":438,"negative":219580,"pending":null,"totalTestResultsSource":null,"totalTestResults":223865,"hospitalizedCurrently":7,"hospitalizedCumulative":407,"inIcuCurrently":1,"inIcuCumulative":null,"onVentilatorCurrently":1,"onVentilatorCumulative":null,"recovered":3698,"dataQualityGrade":"A+","lastUpdateEt":"8/20/2020 23:59","dateModified":"2020-08-20T23:59:00Z","checkTimeEt":"08/20 19:59","death":129,"hospitalized":407,"dateChecked":"2020-08-20T23:59:00Z","totalTestsViral":223427,"positiveTestsViral":5375,"negativeTestsViral":217820,"positiveCasesViral":3847,"deathConfirmed":128,"deathProbable":1,"totalTestEncountersViral":null,"totalTestsPeopleViral":null,"totalTestsAntibody":9342,"positiveTestsAntibody":467,"negativeTestsAntibody":8862,"totalTestsPeopleAntibody":null,"positiveTestsPeopleAntibody":null,"negativeTestsPeopleAntibody":null,"totalTestsPeopleAntigen":null,"positiveTestsPeopleAntigen":null,"totalTestsAntigen":null,"positiveTestsAntigen":null,"fips":"23","positiveIncrease":32,"negativeIncrease":3648,"total":223865,"totalTestResultsIncrease":3680,"posNeg":223865,"deathIncrease":1,"hospitalizedIncrease":2,"hash":"f647a5bcd216de874e88c8292cbbb0ea971f5ac8","commercialScore":0,"negativeRegularScore":0,"negativeScore":0,"positiveScore":0,"score":0,"grade":""},{"date":20200820,"state":"ME","positive":4253,"probableCases":441,"negative":215932,"pending":null,"totalTestResultsSource":null,"totalTestResults":220185,"hospitalizedCurrently":7,"hospitalizedCumulative":405,"inIcuCurrently":1,"inIcuCumulative":null,"onVentilatorCurrently":1,"onVentilatorCumulative":null,"recovered":3679,"dataQualityGrade":"A+","lastUpdateEt":"8/19/2020 23:59","dateModified":"2020-08-19T23:59:00Z","checkTimeEt":"08/19 19:59","death":128,"hospitalized":405,"dateChecked":"2020-08-19T23:59:00Z","totalTestsViral":219744,"positiveTestsViral":5330,"negativeTestsViral":214185,"positiveCasesViral":3812,"deathConfirmed":127,"deathProbable":1,"totalTestEncountersViral":null,"totalTestsPeopleViral":null,"totalTestsAntibody":9311,"positiveTestsAntibody":460,"negativeTestsAntibody":8838,"totalTestsPeopleAntibody":null,"positiveTestsPeopleAntibody":null,"negativeTestsPeopleAntibody":null,"totalTestsPeopleAntigen":null,"positiveTestsPeopleAntigen":null,"totalTestsAntigen":null,"positiveTestsAntigen":null,"fips":"23","positiveIncrease":19,"negativeIncrease":2924,"total":220185,"totalTestResultsIncrease":2943,"posNeg":220185,"deathIncrease":1,"hospitalizedIncrease":2,"hash":"6cb14e0eaa53c9769113b8f01941d5f6bd2add56","commercialScore":0,"negativeRegularScore":0,"negativeScore":0,"positiveScore":0,"score":0,"grade":""},{"date":20200819,"state":"ME","positive":4234,"probableCases":435,"negative":213008,"pending":null,"totalTestResultsSource":null,"totalTestResults":217242,"hospitalizedCurrently":9,"hospitalizedCumulative":403,"inIcuCurrently":2,"inIcuCumulative":null,"onVentilatorCurrently":1,"onVentilatorCumulative":null,"recovered":3662,"dataQualityGrade":"A+","lastUpdateEt":"8/18/2020 23:59","dateModified":"2020-08-18T23:59:00Z","checkTimeEt":"08/18 19:59","death":127,"hospitalized":403,"dateChecked":"2020-08-18T23:59:00Z","totalTestsViral":216807,"positiveTestsViral":5311,"negativeTestsViral":211267,"positiveCasesViral":3799,"deathConfirmed":126,"deathProbable":1,"totalTestEncountersViral":null,"totalTestsPeopleViral":null,"totalTestsAntibody":9285,"positiveTestsAntibody":459,"negativeTestsAntibody":8813,"totalTestsPeopleAntibody":null,"positiveTestsPeopleAntibody":null,"negativeTestsPeopleAntibody":null,"totalTestsPeopleAntigen":null,"positiveTestsPeopleAntigen":null,"totalTestsAntigen":null,"positiveTestsAntigen":null,"fips":"23","positiveIncrease":21,"negativeIncrease":2895,"total":217242,"totalTestResultsIncrease":2916,"posNeg":217242,"deathIncrease":0,"hospitalizedIncrease":2,"hash":"07d2c7855ad1dbdd3a6271600f7e4cc8c4d911be","commercialScore":0,"negativeRegularScore":0,"negativeScore":0,"positiveScore":0,"score":0,"grade":""},{"date":20200818,"state":"ME","positive":4213,"probableCases":432,"negative":210113,"pending":null,"totalTestResultsSource":null,"totalTestResults":214326,"hospitalizedCurrently":10,"hospitalizedCumulative":401,"inIcuCurrently":5,"inIcuCumulative":null,"onVentilatorCurrently":1,"onVentilatorCumulative":null,"recovered":3649,"dataQualityGrade":"A+","lastUpdateEt":"8/17/2020 23:59","dateModified":"2020-08-17T23:59:00Z","checkTimeEt":"08/17 19:59","death":127,"hospitalized":401,"dateChecked":"2020-08-17T23:59:00Z","totalTestsViral":213894,"positiveTestsViral":5283,"negativeTestsViral":208383,"positiveCasesViral":3781,"deathConfirmed":126,"deathProbable":1,"totalTestEncountersViral":null,"totalTestsPeopleViral":null,"totalTestsAntibody":9268,"positiveTestsAntibody":456,"negativeTestsAntibody":8799,"totalTestsPeopleAntibody":null,"positiveTestsPeopleAntibody":null,"negativeTestsPeopleAntibody":null,"totalTestsPeopleAntigen":null,"positiveTestsPeopleAntigen":null,"totalTestsAntigen":null,"positiveTestsAntigen":null,"fips":"23","positiveIncrease":16,"negativeIncrease":1756,"total":214326,"totalTestResultsIncrease":1772,"posNeg":214326,"deathIncrease":0,"hospitalizedIncrease":2,"hash":"35013d791bee5ee7c87edbdfc62132c4304a7248","commercialScore":0,"negativeRegularScore":0,"negativeScore":0,"positiveScore":0,"score":0,"grade":""},{"date":20200817,"state":"ME","positive":4197,"probableCases":430,"negative":208357,"pending":null,"totalTestResultsSource":null,"totalTestResults":212554,"hospitalizedCurrently":10,"hospitalizedCumulative":399,"inIcuCurrently":3,"inIcuCumulative":null,"onVentilatorCurrently":1,"onVentilatorCumulative":null,"recovered":3638,"dataQualityGrade":"A+","lastUpdateEt":"8/16/2020 23:59","dateModified":"2020-08-16T23:59:00Z","checkTimeEt":"08/16 19:59","death":127,"hospitalized":399,"dateChecked":"2020-08-16T23:59:00Z","totalTestsViral":212124,"positiveTestsViral":5261,"negativeTestsViral":206635,"positiveCasesViral":3767,"deathConfirmed":126,"deathProbable":1,"totalTestEncountersViral":null,"totalTestsPeopleViral":null,"totalTestsAntibody":9260,"positiveTestsAntibody":456,"negativeTestsAntibody":8791,"totalTestsPeopleAntibody":null,"positiveTestsPeopleAntibody":null,"negativeTestsPeopleAntibody":null,"totalTestsPeopleAntigen":null,"positiveTestsPeopleAntigen":null,"totalTestsAntigen":null,"positiveTestsAntigen":null,"fips":"23","positiveIncrease":29,"negativeIncrease":2302,"total":212554,"totalTestResultsIncrease":2331,"posNeg":212554,"deathIncrease":0,"hospitalizedIncrease":-1,"hash":"cdd44892c5335ea0cedf6bddc67d578d452fb7c2","commercialScore":0,"negativeRegularScore":0,"negativeScore":0,"positiveScore":0,"score":0,"grade":""},{"date":20200816,"state":"ME","positive":4168,"probableCases":421,"negative":206055,"pending":null,"totalTestResultsSource":null,"totalTestResults":210223,"hospitalizedCurrently":9,"hospitalizedCumulative":400,"inIcuCurrently":2,"inIcuCumulative":null,"onVentilatorCurrently":1,"onVentilatorCumulative":null,"recovered":3624,"dataQualityGrade":"A+","lastUpdateEt":"8/15/2020 23:59","dateModified":"2020-08-15T23:59:00Z","checkTimeEt":"08/15 19:59","death":127,"hospitalized":400,"dateChecked":"2020-08-15T23:59:00Z","totalTestsViral":209802,"positiveTestsViral":5241,"negativeTestsViral":204335,"positiveCasesViral":3747,"deathConfirmed":126,"deathProbable":1,"totalTestEncountersViral":null,"totalTestsPeopleViral":null,"totalTestsAntibody":9254,"positiveTestsAntibody":454,"negativeTestsAntibody":8787,"totalTestsPeopleAntibody":null,"positiveTestsPeopleAntibody":null,"negativeTestsPeopleAntibody":null,"totalTestsPeopleAntigen":null,"positiveTestsPeopleAntigen":null,"totalTestsAntigen":null,"positiveTestsAntigen":null,"fips":"23","positiveIncrease":24,"negativeIncrease":2845,"total":210223,"totalTestResultsIncrease":2869,"posNeg":210223,"deathIncrease":0,"hospitalizedIncrease":1,"hash":"7ecd09986ad5a51cd53823d6a7db0452bd8809ac","commercialScore":0,"negativeRegularScore":0,"negativeScore":0,"positiveScore":0,"score":0,"grade":""},{"date":20200815,"state":"ME","positive":4144,"probableCases":418,"negative":203210,"pending":null,"totalTestResultsSource":null,"totalTestResults":207354,"hospitalizedCurrently":5,"hospitalizedCumulative":399,"inIcuCurrently":2,"inIcuCumulative":null,"onVentilatorCurrently":1,"onVentilatorCumulative":null,"recovered":3616,"dataQualityGrade":"A+","lastUpdateEt":"8/14/2020 23:59","dateModified":"2020-08-14T23:59:00Z","checkTimeEt":"08/14 19:59","death":127,"hospitalized":399,"dateChecked":"2020-08-14T23:59:00Z","totalTestsViral":206936,"positiveTestsViral":5215,"negativeTestsViral":201496,"positiveCasesViral":3726,"deathConfirmed":126,"deathProbable":1,"totalTestEncountersViral":null,"totalTestsPeopleViral":null,"totalTestsAntibody":9208,"positiveTestsAntibody":454,"negativeTestsAntibody":8741,"totalTestsPeopleAntibody":null,"positiveTestsPeopleAntibody":null,"negativeTestsPeopleAntibody":null,"totalTestsPeopleAntigen":null,"positiveTestsPeopleAntigen":null,"totalTestsAntigen":null,"positiveTestsAntigen":null,"fips":"23","positiveIncrease":29,"negativeIncrease":2282,"total":207354,"totalTestResultsIncrease":2311,"posNeg":207354,"deathIncrease":1,"hospitalizedIncrease":0,"hash":"6b59b3e3650ab358ba5700ce62638e17222ffb54","commercialScore":0,"negativeRegularScore":0,"negativeScore":0,"positiveScore":0,"score":0,"grade":""},{"date":20200814,"state":"ME","positive":4115,"probableCases":418,"negative":200928,"pending":null,"totalTestResultsSource":null,"totalTestResults":205043,"hospitalizedCurrently":6,"hospitalizedCumulative":399,"inIcuCurrently":2,"inIcuCumulative":null,"onVentilatorCurrently":1,"onVentilatorCumulative":null,"recovered":3604,"dataQualityGrade":"A+","lastUpdateEt":"8/13/2020 23:59","dateModified":"2020-08-13T23:59:00Z","checkTimeEt":"08/13 19:59","death":126,"hospitalized":399,"dateChecked":"2020-08-13T23:59:00Z","totalTestsViral":204625,"positiveTestsViral":5183,"negativeTestsViral":199219,"positiveCasesViral":3697,"deathConfirmed":125,"deathProbable":1,"totalTestEncountersViral":null,"totalTestsPeopleViral":null,"totalTestsAntibody":9186,"positiveTestsAntibody":450,"negativeTestsAntibody":8723,"totalTestsPeopleAntibody":null,"positiveTestsPeopleAntibody":null,"negativeTestsPeopleAntibody":null,"totalTestsPeopleAntigen":null,"positiveTestsPeopleAntigen":null,"totalTestsAntigen":null,"positiveTestsAntigen":null,"fips":"23","positiveIncrease":26,"negativeIncrease":2733,"total":205043,"totalTestResultsIncrease":2759,"posNeg":205043,"deathIncrease":0,"hospitalizedIncrease":4,"hash":"cf7434e5f56ed9da6ab0587668840551a5d50290","commercialScore":0,"negativeRegularScore":0,"negativeScore":0,"positiveScore":0,"score":0,"grade":""},{"date":20200813,"state":"ME","positive":4089,"probableCases":410,"negative":198195,"pending":null,"totalTestResultsSource":null,"totalTestResults":202284,"hospitalizedCurrently":11,"hospitalizedCumulative":395,"inIcuCurrently":5,"inIcuCumulative":null,"onVentilatorCurrently":3,"onVentilatorCumulative":null,"recovered":3592,"dataQualityGrade":"A+","lastUpdateEt":"8/12/2020 23:59","dateModified":"2020-08-12T23:59:00Z","checkTimeEt":"08/12 19:59","death":126,"hospitalized":395,"dateChecked":"2020-08-12T23:59:00Z","totalTestsViral":201874,"positiveTestsViral":5165,"negativeTestsViral":196488,"positiveCasesViral":3679,"deathConfirmed":125,"deathProbable":1,"totalTestEncountersViral":null,"totalTestsPeopleViral":null,"totalTestsAntibody":9165,"positiveTestsAntibody":446,"negativeTestsAntibody":8706,"totalTestsPeopleAntibody":null,"positiveTestsPeopleAntibody":null,"negativeTestsPeopleAntibody":null,"totalTestsPeopleAntigen":null,"positiveTestsPeopleAntigen":null,"totalTestsAntigen":null,"positiveTestsAntigen":null,"fips":"23","positiveIncrease":19,"negativeIncrease":3147,"total":202284,"totalTestResultsIncrease":3166,"posNeg":202284,"deathIncrease":0,"hospitalizedIncrease":1,"hash":"bd571136672bd41a038da9e2d2df8b0c991f97cc","commercialScore":0,"negativeRegularScore":0,"negativeScore":0,"positiveScore":0,"score":0,"grade":""},{"date":20200812,"state":"ME","positive":4070,"probableCases":408,"negative":195048,"pending":null,"totalTestResultsSource":null,"totalTestResults":199118,"hospitalizedCurrently":9,"hospitalizedCumulative":394,"inIcuCurrently":4,"inIcuCumulative":null,"onVentilatorCurrently":1,"onVentilatorCumulative":null,"recovered":3579,"dataQualityGrade":"A+","lastUpdateEt":"8/11/2020 23:59","dateModified":"2020-08-11T23:59:00Z","checkTimeEt":"08/11 19:59","death":126,"hospitalized":394,"dateChecked":"2020-08-11T23:59:00Z","totalTestsViral":198710,"positiveTestsViral":5138,"negativeTestsViral":193353,"positiveCasesViral":3662,"deathConfirmed":125,"deathProbable":1,"totalTestEncountersViral":null,"totalTestsPeopleViral":null,"totalTestsAntibody":9133,"positiveTestsAntibody":441,"negativeTestsAntibody":8679,"totalTestsPeopleAntibody":null,"positiveTestsPeopleAntibody":null,"negativeTestsPeopleAntibody":null,"totalTestsPeopleAntigen":null,"positiveTestsPeopleAntigen":null,"totalTestsAntigen":null,"positiveTestsAntigen":null,"fips":"23","positiveIncrease":20,"negativeIncrease":6645,"total":199118,"totalTestResultsIncrease":6665,"posNeg":199118,"deathIncrease":0,"hospitalizedIncrease":0,"hash":"9b6f095344d28af60e72d5c5e84723d01e442f01","commercialScore":0,"negativeRegularScore":0,"negativeScore":0,"positiveScore":0,"score":0,"grade":""},{"date":20200811,"state":"ME","positive":4050,"probableCases":406,"negative":188403,"pending":null,"totalTestResultsSource":null,"totalTestResults":192453,"hospitalizedCurrently":9,"hospitalizedCumulative":394,"inIcuCurrently":4,"inIcuCumulative":null,"onVentilatorCurrently":1,"onVentilatorCumulative":null,"recovered":3560,"dataQualityGrade":"A+","lastUpdateEt":"8/10/2020 23:59","dateModified":"2020-08-10T23:59:00Z","checkTimeEt":"08/10 19:59","death":126,"hospitalized":394,"dateChecked":"2020-08-10T23:59:00Z","totalTestsViral":192047,"positiveTestsViral":5105,"negativeTestsViral":186723,"positiveCasesViral":3644,"deathConfirmed":125,"deathProbable":1,"totalTestEncountersViral":null,"totalTestsPeopleViral":null,"totalTestsAntibody":9117,"positiveTestsAntibody":441,"negativeTestsAntibody":8663,"totalTestsPeopleAntibody":null,"positiveTestsPeopleAntibody":null,"negativeTestsPeopleAntibody":null,"totalTestsPeopleAntigen":null,"positiveTestsPeopleAntigen":null,"totalTestsAntigen":null,"positiveTestsAntigen":null,"fips":"23","positiveIncrease":1,"negativeIncrease":1546,"total":192453,"totalTestResultsIncrease":1547,"posNeg":192453,"deathIncrease":1,"hospitalizedIncrease":1,"hash":"1c4a3a93422ad6eb3f09746d974aff44a455cadd","commercialScore":0,"negativeRegularScore":0,"negativeScore":0,"positiveScore":0,"score":0,"grade":""},{"date":20200810,"state":"ME","positive":4049,"probableCases":408,"negative":186857,"pending":null,"totalTestResultsSource":null,"totalTestResults":190906,"hospitalizedCurrently":8,"hospitalizedCumulative":393,"inIcuCurrently":3,"inIcuCumulative":null,"onVentilatorCurrently":1,"onVentilatorCumulative":null,"recovered":3537,"dataQualityGrade":"A+","lastUpdateEt":"8/9/2020 23:59","dateModified":"2020-08-09T23:59:00Z","checkTimeEt":"08/09 19:59","death":125,"hospitalized":393,"dateChecked":"2020-08-09T23:59:00Z","totalTestsViral":190498,"positiveTestsViral":5093,"negativeTestsViral":185189,"positiveCasesViral":3641,"deathConfirmed":124,"deathProbable":1,"totalTestEncountersViral":null,"totalTestsPeopleViral":null,"totalTestsAntibody":9110,"positiveTestsAntibody":440,"negativeTestsAntibody":8657,"totalTestsPeopleAntibody":null,"positiveTestsPeopleAntibody":null,"negativeTestsPeopleAntibody":null,"totalTestsPeopleAntigen":null,"positiveTestsPeopleAntigen":null,"totalTestsAntigen":null,"positiveTestsAntigen":null,"fips":"23","positiveIncrease":7,"negativeIncrease":1913,"total":190906,"totalTestResultsIncrease":1920,"posNeg":190906,"deathIncrease":0,"hospitalizedIncrease":0,"hash":"82359276a326976879dd5d369287e5813ecf5372","commercialScore":0,"negativeRegularScore":0,"negativeScore":0,"positiveScore":0,"score":0,"grade":""},{"date":20200809,"state":"ME","positive":4042,"probableCases":417,"negative":184944,"pending":null,"totalTestResultsSource":null,"totalTestResults":188986,"hospitalizedCurrently":9,"hospitalizedCumulative":393,"inIcuCurrently":3,"inIcuCumulative":null,"onVentilatorCurrently":1,"onVentilatorCumulative":null,"recovered":3512,"dataQualityGrade":"A+","lastUpdateEt":"8/8/2020 23:59","dateModified":"2020-08-08T23:59:00Z","checkTimeEt":"08/08 19:59","death":125,"hospitalized":393,"dateChecked":"2020-08-08T23:59:00Z","totalTestsViral":188569,"positiveTestsViral":5076,"negativeTestsViral":183277,"positiveCasesViral":3625,"deathConfirmed":124,"deathProbable":1,"totalTestEncountersViral":null,"totalTestsPeopleViral