date,state,positive,probableCases,negative,pending,totalTestResultsSource,totalTestResults,hospitalizedCurrently,hospitalizedCumulative,inIcuCurrently,inIcuCumulative,onVentilatorCurrently,onVentilatorCumulative,recovered,dataQualityGrade,lastUpdateEt,dateModified,checkTimeEt,death,hospitalized,dateChecked,totalTestsViral,positiveTestsViral,negativeTestsViral,positiveCasesViral,deathConfirmed,deathProbable,totalTestEncountersViral,totalTestsPeopleViral,totalTestsAntibody,positiveTestsAntibody,negativeTestsAntibody,totalTestsPeopleAntibody,positiveTestsPeopleAntibody,negativeTestsPeopleAntibody,totalTestsPeopleAntigen,positiveTestsPeopleAntigen,totalTestsAntigen,positiveTestsAntigen,fips,positiveIncrease,negativeIncrease,total,totalTestResultsIncrease,posNeg,deathIncrease,hospitalizedIncrease,hash,commercialScore,negativeRegularScore,negativeScore,positiveScore,score,grade
20201025,MT,27880,,437727,,posNeg,465607,357,1229,,,,,17832,C,10/25/2020 01:59,2020-10-25T01:59:00Z,10/24 21:59,297,1229,2020-10-25T01:59:00Z,465607,,,27880,,,,,,,,,,,,,,,30,738,837,465607,1575,465607,3,49,066ce03e81235c473570131c1036c20071315991,0,0,0,0,0,
20201024,MT,27142,,436890,,posNeg,464032,348,1180,,,,,17436,C,10/24/2020 01:59,2020-10-24T01:59:00Z,10/23 21:59,294,1180,2020-10-24T01:59:00Z,464032,,,27142,,,,,,,,,,,,,,,30,639,2393,464032,3032,464032,12,10,08f96b0821047923d9eb656f669202f8132f04e9,0,0,0,0,0,
20201023,MT,26503,,434497,,posNeg,461000,351,1170,,,,,16611,C,10/23/2020 01:59,2020-10-23T01:59:00Z,10/22 21:59,282,1170,2020-10-23T01:59:00Z,461000,,,26503,,,,,,,,,,,,,,,30,863,7291,461000,8154,461000,4,79,90d17c8a1eae716f3e960faf77f3f5141b4b18ac,0,0,0,0,0,
20201022,MT,25640,,427206,,posNeg,452846,353,1091,,,,,16266,C,10/22/2020 01:59,2020-10-22T01:59:00Z,10/21 21:59,278,1091,2020-10-22T01:59:00Z,452846,,,25640,,,,,,,,,,,,,,,30,928,3924,452846,4852,452846,3,23,a04e1bfd42409db1c41d439a638a06080fde0f09,0,0,0,0,0,
20201021,MT,24712,,423282,,posNeg,447994,345,1068,,,,,15085,C,10/21/2020 01:59,2020-10-21T01:59:00Z,10/20 21:59,275,1068,2020-10-21T01:59:00Z,447994,,,24712,,,,,,,,,,,,,,,30,619,2354,447994,2973,447994,23,13,b2458af130fd0ccc9c00d18ece85984706ebff8f,0,0,0,0,0,
20201020,MT,24093,,420928,,posNeg,445021,360,1055,,,,,14842,C,10/20/2020 01:59,2020-10-20T01:59:00Z,10/19 21:59,252,1055,2020-10-20T01:59:00Z,445021,,,24093,,,,,,,,,,,,,,,30,703,1952,445021,2655,445021,11,35,95d0117fd74cf85cb30fc07db9f37522b58687a0,0,0,0,0,0,
20201019,MT,23390,,418976,,posNeg,442366,339,1020,,,,,13538,C,10/19/2020 01:59,2020-10-19T01:59:00Z,10/18 21:59,241,1020,2020-10-19T01:59:00Z,442366,,,23390,,,,,,,,,,,,,,,30,569,10663,442366,11232,442366,0,10,df5c10975e20e433181db4bcb0bbb29ad7e5ca9c,0,0,0,0,0,
20201018,MT,22821,,408313,,posNeg,431134,331,1010,,,,,13441,C,10/18/2020 01:59,2020-10-18T01:59:00Z,10/17 21:59,241,1010,2020-10-18T01:59:00Z,431134,,,22821,,,,,,,,,,,,,,,30,588,2418,431134,3006,431134,1,9,58db0847adef7b441d0a902f15a703aa683504ce,0,0,0,0,0,
20201017,MT,22233,,405895,,posNeg,428128,324,1001,,,,,13395,C,10/17/2020 01:59,2020-10-17T01:59:00Z,10/16 21:59,240,1001,2020-10-17T01:59:00Z,428128,,,22233,,,,,,,,,,,,,,,30,638,2028,428128,2666,428128,5,15,d6a064d5c46e93951646d8564b032ab5f4a9bbea,0,0,0,0,0,
20201016,MT,21595,,403867,,posNeg,425462,319,986,,,,,13212,C,10/16/2020 01:59,2020-10-16T01:59:00Z,10/15 21:59,235,986,2020-10-16T01:59:00Z,425462,,,21595,,,,,,,,,,,,,,,30,662,4968,425462,5630,425462,5,27,c3656de495b0dff195f867c8e31f7080bbab103d,0,0,0,0,0,
20201015,MT,20933,,398899,,posNeg,419832,301,959,,,,,12854,C,10/15/2020 01:59,2020-10-15T01:59:00Z,10/14 21:59,230,959,2020-10-15T01:59:00Z,419832,,,20933,,,,,,,,,,,,,,,30,723,4530,419832,5253,419832,5,39,bc2907bae62896e2fa800e82103a851dce9bbd1b,0,0,0,0,0,
20201014,MT,20210,,394369,,posNeg,414579,292,920,,,,,12068,C,10/14/2020 01:59,2020-10-14T01:59:00Z,10/13 21:59,225,920,2020-10-14T01:59:00Z,414579,,,20210,,,,,,,,,,,,,,,30,599,4329,414579,4928,414579,8,9,f2b801f7367c7e36f3c62394252212fda501d3b1,0,0,0,0,0,
20201013,MT,19611,,390040,,posNeg,409651,294,911,,,,,11620,C,10/13/2020 01:59,2020-10-13T01:59:00Z,10/12 21:59,217,911,2020-10-13T01:59:00Z,409651,,,19611,,,,,,,,,,,,,,,30,486,8707,409651,9193,409651,5,7,d4a42daca1f90657a2836f0a393a29f91a774c9f,0,0,0,0,0,
20201012,MT,19125,,381333,,posNeg,400458,291,904,,,,,11481,C,10/12/2020 01:59,2020-10-12T01:59:00Z,10/11 21:59,212,904,2020-10-12T01:59:00Z,400458,,,19125,,,,,,,,,,,,,,,30,423,9777,400458,10200,400458,2,12,2ebfef12baacedc81de6502d728cd55b48050a6f,0,0,0,0,0,
20201011,MT,18702,,371556,,posNeg,390258,286,892,,,,,11361,C,10/11/2020 01:59,2020-10-11T01:59:00Z,10/10 21:59,210,892,2020-10-11T01:59:00Z,390258,,,18702,,,,,,,,,,,,,,,30,585,1024,390258,1609,390258,1,7,ebe8a5506462729202d098ddd24a2ac7dbdd4116,0,0,0,0,0,
20201010,MT,18117,,370532,,posNeg,388649,280,885,,,,,11361,C,10/10/2020 01:59,2020-10-10T01:59:00Z,10/09 21:59,209,885,2020-10-10T01:59:00Z,388649,,,18117,,,,,,,,,,,,,,,30,718,1185,388649,1903,388649,3,17,1e2b0a89ba5e9a54d7d1d39c518a9ea906941682,0,0,0,0,0,
20201009,MT,17399,,369347,,posNeg,386746,266,868,,,,,10863,C,10/9/2020 01:59,2020-10-09T01:59:00Z,10/08 21:59,206,868,2020-10-09T01:59:00Z,386746,,,17399,,,,,,,,,,,,,,,30,722,4359,386746,5081,386746,9,17,a3f49729746a800dd302829cd2bae062e9fc69ff,0,0,0,0,0,
20201008,MT,16677,,364988,,posNeg,381665,263,851,,,,,10656,C,10/8/2020 01:59,2020-10-08T01:59:00Z,10/07 21:59,197,851,2020-10-08T01:59:00Z,381665,,,16677,,,,,,,,,,,,,,,30,614,4875,381665,5489,381665,4,31,297cb108426cb6732af25f5107c91523feb4dcc9,0,0,0,0,0,
20201007,MT,16063,,360113,,posNeg,376176,235,820,,,,,10518,C,10/7/2020 01:59,2020-10-07T01:59:00Z,10/06 21:59,193,820,2020-10-07T01:59:00Z,376176,,,16063,,,,,,,,,,,,,,,30,716,2740,376176,3456,376176,1,47,5b8e24cc3a249fbbeac17cfbffebffb632bb1e9e,0,0,0,0,0,
20201006,MT,15347,,357373,,posNeg,372720,216,773,,,,,10172,C,10/6/2020 01:59,2020-10-06T01:59:00Z,10/05 21:59,192,773,2020-10-06T01:59:00Z,372720,,,15347,,,,,,,,,,,,,,,30,500,2245,372720,2745,372720,2,19,63943dae87d76962dde3ea8166eec90af0ee8543,0,0,0,0,0,
20201005,MT,14847,,355128,,posNeg,369975,201,754,,,,,9649,C,10/5/2020 01:59,2020-10-05T01:59:00Z,10/04 21:59,190,754,2020-10-05T01:59:00Z,369975,,,14847,,,,,,,,,,,,,,,30,212,12350,369975,12562,369975,3,10,be051ec65b1066aa47bbbb4362cd0c6eff6f5973,0,0,0,0,0,
20201004,MT,14635,,342778,,posNeg,357413,191,744,,,,,9597,C,10/4/2020 01:59,2020-10-04T01:59:00Z,10/03 21:59,187,744,2020-10-04T01:59:00Z,357413,,,14635,,,,,,,,,,,,,,,30,279,2351,357413,2630,357413,1,3,e9df74d80867b2d3574e4825fe0b9fde4b330bab,0,0,0,0,0,
20201003,MT,14356,,340427,,posNeg,354783,189,741,,,,,9601,C,10/3/2020 01:59,2020-10-03T01:59:00Z,10/02 21:59,186,741,2020-10-03T01:59:00Z,354783,,,14356,,,,,,,,,,,,,,,30,501,920,354783,1421,354783,0,12,829c3b407058efa943f1d9dc0f525befcfa7eb16,0,0,0,0,0,
20201002,MT,13855,,339507,,posNeg,353362,177,729,,,,,9569,C,10/2/2020 01:59,2020-10-02T01:59:00Z,10/01 21:59,186,729,2020-10-02T01:59:00Z,353362,,,13855,,,,,,,,,,,,,,,30,355,4298,353362,4653,353362,5,2,4c25a3a5a8eeae177604b3161c8bc749ce8a4c17,0,0,0,0,0,
20201001,MT,13500,,335209,,posNeg,348709,178,727,,,,,9428,C,10/1/2020 01:59,2020-10-01T01:59:00Z,09/30 21:59,181,727,2020-10-01T01:59:00Z,348709,,,13500,,,,,,,,,,,,,,,30,429,5122,348709,5551,348709,1,10,1e9e4dc38a98f70e259e99e2c1f3525a232ed48e,0,0,0,0,0,
20200930,MT,13071,,330087,,posNeg,343158,170,717,,,,,9256,C,9/30/2020 01:59,2020-09-30T01:59:00Z,09/29 21:59,180,717,2020-09-30T01:59:00Z,343158,,,13071,,,,,,,,,,,,,,,30,347,2885,343158,3232,343158,3,8,740e1b1960e0d3256230cd761f5e5ad4e606daf2,0,0,0,0,0,
20200929,MT,12724,,327202,,posNeg,339926,166,709,,,,,9093,C,9/29/2020 01:59,2020-09-29T01:59:00Z,09/28 21:59,177,709,2020-09-29T01:59:00Z,339926,,,12724,,,,,,,,,,,,,,,30,311,2419,339926,2730,339926,3,11,2577149fd3cb0ddab4a9dd9dc1b5836d75397cf1,0,0,0,0,0,
20200928,MT,12413,,324783,,posNeg,337196,158,698,,,,,8839,C,9/28/2020 01:59,2020-09-28T01:59:00Z,09/27 21:59,174,698,2020-09-28T01:59:00Z,337196,,,12413,,,,,,,,,,,,,,,30,306,6583,337196,6889,337196,1,11,5d9ba76be7ae71b2ab835d2d78430a4b2ebea1fc,0,0,0,0,0,
20200927,MT,12107,,318200,,posNeg,330307,148,687,,,,,8779,C,9/27/2020 01:59,2020-09-27T01:59:00Z,09/26 21:59,173,687,2020-09-27T01:59:00Z,330307,,,12107,,,,,,,,,,,,,,,30,200,822,330307,1022,330307,2,3,c2349bb0eab51ce39a40b6dfb25c957fa38fb346,0,0,0,0,0,
20200926,MT,11907,,317378,,posNeg,329285,147,684,,,,,8749,C,9/26/2020 01:59,2020-09-26T01:59:00Z,09/25 21:59,171,684,2020-09-26T01:59:00Z,329285,,,11907,,,,,,,,,,,,,,,30,343,2826,329285,3169,329285,1,9,872cd22f1c4f9cd7e020f59fa72c8d337e55ece7,0,0,0,0,0,
20200925,MT,11564,,314552,,posNeg,326116,140,675,,,,,8681,C,9/25/2020 01:59,2020-09-25T01:59:00Z,09/24 21:59,170,675,2020-09-25T01:59:00Z,326116,,,11564,,,,,,,,,,,,,,,30,322,4276,326116,4598,326116,5,25,a56bedf58d05ac59414485ed9fe687191007279f,0,0,0,0,0,
20200924,MT,11242,,310276,,posNeg,321518,128,650,,,,,8634,C,9/24/2020 01:59,2020-09-24T01:59:00Z,09/23 21:59,165,650,2020-09-24T01:59:00Z,321518,,,11242,,,,,,,,,,,,,,,30,330,4028,321518,4358,321518,0,49,0d1334c096b7b77bdd5368f3650a6751a84db1a0,0,0,0,0,0,
20200923,MT,10912,,306248,,posNeg,317160,124,601,,,,,8510,C,9/23/2020 01:59,2020-09-23T01:59:00Z,09/22 21:59,165,601,2020-09-23T01:59:00Z,317160,,,10912,,,,,,,,,,,,,,,30,212,2939,317160,3151,317160,2,17,1e21583d1f700d7c5ef28f2053f291eede7b474f,0,0,0,0,0,
20200922,MT,10700,,303309,,posNeg,314009,111,584,,,,,7937,C,9/22/2020 01:59,2020-09-22T01:59:00Z,09/21 21:59,163,584,2020-09-22T01:59:00Z,314009,,,10700,,,,,,,,,,,,,,,30,271,2476,314009,2747,314009,3,8,a08da01d2b3cd019118bd11c37f30c6f200c3aa9,0,0,0,0,0,
20200921,MT,10429,,300833,,posNeg,311262,108,576,,,,,7876,C,9/21/2020 01:59,2020-09-21T01:59:00Z,09/20 21:59,160,576,2020-09-21T01:59:00Z,311262,,,10429,,,,,,,,,,,,,,,30,130,8319,311262,8449,311262,3,6,d9412db4ee68b6abdd01529b4b1b2352b49710b9,0,0,0,0,0,
20200920,MT,10299,,292514,,posNeg,302813,104,570,,,,,7807,C,9/20/2020 01:59,2020-09-20T01:59:00Z,09/19 21:59,157,570,2020-09-20T01:59:00Z,302813,,,10299,,,,,,,,,,,,,,,30,136,1837,302813,1973,302813,1,3,9d838878fbdad35a5571724b109816a05d800e17,0,0,0,0,0,
20200919,MT,10163,,290677,,posNeg,300840,104,567,,,,,7553,C,9/19/2020 01:59,2020-09-19T01:59:00Z,09/18 21:59,156,567,2020-09-19T01:59:00Z,300840,,,10163,,,,,,,,,,,,,,,30,292,1993,300840,2285,300840,10,12,ad0d44795756aa4a4aeefb060df4104e873916db,0,0,0,0,0,
20200918,MT,9871,,288684,,posNeg,298555,105,555,,,,,7500,C,9/18/2020 01:59,2020-09-18T01:59:00Z,09/17 21:59,146,555,2020-09-18T01:59:00Z,298555,,,9871,,,,,,,,,,,,,,,30,224,3032,298555,3256,298555,3,6,07f7d94f8a6cea5f196a29ebf8d4c735693d880b,0,0,0,0,0,
20200917,MT,9647,,285652,,posNeg,295299,107,549,,,,,7401,C,9/17/2020 01:59,2020-09-17T01:59:00Z,09/16 21:59,143,549,2020-09-17T01:59:00Z,295299,,,9647,,,,,,,,,,,,,,,30,216,2682,295299,2898,295299,2,6,1cf078b662237a7d2f2472a23ddbd2a604da39f4,0,0,0,0,0,
20200916,MT,9431,,282970,,posNeg,292401,106,543,,,,,7186,C,9/16/2020 01:59,2020-09-16T01:59:00Z,09/15 21:59,141,543,2020-09-16T01:59:00Z,292401,,,9431,,,,,,,,,,,,,,,30,187,2846,292401,3033,292401,1,4,7b23ba8fed69cfb109507e05a5e4b29726ee5fed,0,0,0,0,0,
20200915,MT,9244,,280124,,posNeg,289368,109,539,,,,,7150,B,9/15/2020 01:59,2020-09-15T01:59:00Z,09/14 21:59,140,539,2020-09-15T01:59:00Z,289368,,,9244,,,,,,,,,,,,,,,30,137,3361,289368,3498,289368,2,8,82077e0232cb5325877a81191587b1785275fc21,0,0,0,0,0,
20200914,MT,9107,,276763,,posNeg,285870,144,531,,,,,6842,B,9/14/2020 01:59,2020-09-14T01:59:00Z,09/13 21:59,138,531,2020-09-14T01:59:00Z,285870,,,9107,,,,,,,,,,,,,,,30,86,5660,285870,5746,285870,3,6,dfab8346b27f527ce42ecd9ffb0677e2f1d438d4,0,0,0,0,0,
20200913,MT,9021,,271103,,posNeg,280124,145,525,,,,,6830,B,9/13/2020 01:59,2020-09-13T01:59:00Z,09/12 21:59,135,525,2020-09-13T01:59:00Z,280124,,,9021,,,,,,,,,,,,,,,30,96,1300,280124,1396,280124,2,4,ac4acb1b965935452d19f2c74a20d8f08e20eaac,0,0,0,0,0,
20200912,MT,8925,,269803,,posNeg,278728,144,521,,,,,6824,B,9/12/2020 01:59,2020-09-12T01:59:00Z,09/11 21:59,133,521,2020-09-12T01:59:00Z,278728,,,8925,,,,,,,,,,,,,,,30,140,3930,278728,4070,278728,2,3,143c87af0cbe75b020022cc941c2e0adea5fa5da,0,0,0,0,0,
20200911,MT,8785,,265873,,posNeg,274658,142,518,,,,,6795,B,9/11/2020 01:59,2020-09-11T01:59:00Z,09/10 21:59,131,518,2020-09-11T01:59:00Z,274658,,,8785,,,,,,,,,,,,,,,30,122,1183,274658,1305,274658,8,6,386dcdabf14f83cc00562395113cf7697af95f29,0,0,0,0,0,
20200910,MT,8663,,264690,,posNeg,273353,163,512,,,,,6732,B,9/10/2020 01:59,2020-09-10T01:59:00Z,09/09 21:59,123,512,2020-09-10T01:59:00Z,273353,,,8663,,,,,,,,,,,,,,,30,195,2008,273353,2203,273353,1,3,bf46c322faaf03a5e2b7df9521032391e9b981e3,0,0,0,0,0,
20200909,MT,8468,,262682,,posNeg,271150,163,509,,,,,6318,B,9/9/2020 01:59,2020-09-09T01:59:00Z,09/08 21:59,122,509,2020-09-09T01:59:00Z,271150,,,8468,,,,,,,,,,,,,,,30,87,2283,271150,2370,271150,3,7,259485c279fc0d93f99c6a9097db3402c60364c3,0,0,0,0,0,
20200908,MT,8381,,260399,,posNeg,268780,161,502,,,,,6270,B,9/8/2020 01:59,2020-09-08T01:59:00Z,09/07 21:59,119,502,2020-09-08T01:59:00Z,268780,,,8381,,,,,,,,,,,,,,,30,65,1590,268780,1655,268780,1,4,6b5de280d8939deb836065e0e4d1071f3d26bfb8,0,0,0,0,0,
20200907,MT,8316,,258809,,posNeg,267125,163,498,,,,,6246,B,9/7/2020 01:59,2020-09-07T01:59:00Z,09/06 21:59,118,498,2020-09-07T01:59:00Z,267125,,,8316,,,,,,,,,,,,,,,30,52,5047,267125,5099,267125,1,12,1cb761bd3dec6c02e1f6b62e20165959afdd63f4,0,0,0,0,0,
20200906,MT,8264,,253762,,posNeg,262026,156,486,,,,,6243,B,9/6/2020 01:59,2020-09-06T01:59:00Z,09/05 21:59,117,486,2020-09-06T01:59:00Z,262026,,,8264,,,,,,,,,,,,,,,30,100,876,262026,976,262026,1,9,1bdb433f7bff91629fba4eb9fb56285b6890a4ab,0,0,0,0,0,
20200905,MT,8164,,252886,,posNeg,261050,151,477,,,,,6219,B,9/5/2020 01:59,2020-09-05T01:59:00Z,09/04 21:59,116,477,2020-09-05T01:59:00Z,261050,,,8164,,,,,,,,,,,,,,,30,145,917,261050,1062,261050,2,3,d63911fe393b1e4711d935986b7852c02262df8a,0,0,0,0,0,
20200904,MT,8019,,251969,,posNeg,259988,150,474,,,,,5821,B,9/4/2020 01:59,2020-09-04T01:59:00Z,09/03 21:59,114,474,2020-09-04T01:59:00Z,259988,,,8019,,,,,,,,,,,,,,,30,148,4180,259988,4328,259988,3,2,d9b9d391fe16204709f5d04d9cbc85fa5e3028cf,0,0,0,0,0,
20200903,MT,7871,,247789,,posNeg,255660,151,472,,,,,5727,B,9/3/2020 01:59,2020-09-03T01:59:00Z,09/02 21:59,111,472,2020-09-03T01:59:00Z,255660,,,7871,,,,,,,,,,,,,,,30,180,1607,255660,1787,255660,2,11,5327046f24aeabb6ae42c411499ec2c3136e2ca2,0,0,0,0,0,
20200902,MT,7691,,246182,,posNeg,253873,150,461,,,,,5584,B,9/2/2020 01:59,2020-09-02T01:59:00Z,09/01 21:59,109,461,2020-09-02T01:59:00Z,253873,,,7691,,,,,,,,,,,,,,,30,182,1395,253873,1577,253873,4,14,aac2a1183969dc67cf3dec609b0cb64879431cda,0,0,0,0,0,
20200901,MT,7509,,244787,,posNeg,252296,140,447,,,,,5459,B,9/1/2020 01:59,2020-09-01T01:59:00Z,08/31 21:59,105,447,2020-09-01T01:59:00Z,252296,,,7509,,,,,,,,,,,,,,,30,88,1970,252296,2058,252296,1,11,a590931dc2b29896a0a90cfaf6a492b880525827,0,0,0,0,0,
20200831,MT,7421,,242817,,posNeg,250238,134,436,,,,,5330,B,8/31/2020 01:59,2020-08-31T01:59:00Z,08/30 21:59,104,436,2020-08-31T01:59:00Z,250238,,,7421,,,,,,,,,,,,,,,30,81,3496,250238,3577,250238,0,4,b33b77239a607eac72518044c24b0a9115a7f0d0,0,0,0,0,0,
20200830,MT,7340,,239321,,posNeg,246661,131,432,,,,,5283,B,8/30/2020 01:59,2020-08-30T01:59:00Z,08/29 21:59,104,432,2020-08-30T01:59:00Z,246661,,,7340,,,,,,,,,,,,,,,30,89,1191,246661,1280,246661,0,3,2af0304ac243ab42643e4b9d222c2aee79726f59,0,0,0,0,0,
20200829,MT,7251,,238130,,posNeg,245381,128,429,,,,,5278,B,8/29/2020 01:59,2020-08-29T01:59:00Z,08/28 21:59,104,429,2020-08-29T01:59:00Z,245381,,,7251,,,,,,,,,,,,,,,30,188,2318,245381,2506,245381,4,12,1c77184f2d10c27baf2db579ee8a893bf86fec1d,0,0,0,0,0,
20200828,MT,7063,,235812,,posNeg,242875,121,417,,,,,5172,C,8/28/2020 01:59,2020-08-28T01:59:00Z,08/27 21:59,100,417,2020-08-28T01:59:00Z,242875,,,7063,,,,,,,,,,,,,,,30,134,2082,242875,2216,242875,2,5,163dc358bd0d2dced6fbc8b0f486efa4168a2599,0,0,0,0,0,
20200827,MT,6929,,233730,,posNeg,240659,119,412,,,,,5024,C,8/27/2020 01:59,2020-08-27T01:59:00Z,08/26 21:59,98,412,2020-08-27T01:59:00Z,240659,,,6929,,,,,,,,,,,,,,,30,144,2255,240659,2399,240659,0,10,d8a9ab23446cd37227790c3475c5e7e459758799,0,0,0,0,0,
20200826,MT,6785,,231475,,posNeg,238260,125,402,,,,,4983,C,8/26/2020 01:59,2020-08-26T01:59:00Z,08/25 21:59,98,402,2020-08-26T01:59:00Z,238260,,,6785,,,,,,,,,,,,,,,30,161,1592,238260,1753,238260,1,8,8f8549f1f8d52b11c8f30c52d6bd8f3079ca57a7,0,0,0,0,0,
20200825,MT,6624,,229883,,posNeg,236507,119,394,,,,,4891,C,8/25/2020 01:59,2020-08-25T01:59:00Z,08/24 21:59,97,394,2020-08-25T01:59:00Z,236507,,,6624,,,,,,,,,,,,,,,30,135,2699,236507,2834,236507,6,11,3f1ec22aceba14d249010d33cd093977de2159e2,0,0,0,0,0,
20200824,MT,6489,,227184,,posNeg,233673,114,383,,,,,4842,C,8/24/2020 01:59,2020-08-24T01:59:00Z,08/23 21:59,91,383,2020-08-24T01:59:00Z,233673,,,6489,,,,,,,,,,,,,,,30,60,22864,233673,22924,233673,1,4,09ac9d8f4d2cd002dc4984ffd46c103b55f84974,0,0,0,0,0,
20200823,MT,6429,,204320,,posNeg,210749,111,379,,,,,4816,C,8/23/2020 01:59,2020-08-23T01:59:00Z,08/22 21:59,90,379,2020-08-23T01:59:00Z,210749,,,6429,,,,,,,,,,,,,,,30,53,980,210749,1033,210749,0,1,bc92cef18a4658992a170937ca7c099517ea4159,0,0,0,0,0,
20200822,MT,6376,,203340,,posNeg,209716,110,378,,,,,4815,C,8/22/2020 01:59,2020-08-22T01:59:00Z,08/21 21:59,90,378,2020-08-22T01:59:00Z,209716,,,6376,,,,,,,,,,,,,,,30,160,929,209716,1089,209716,1,15,ba6d6226bcd15adfe676cda760292b55e1a30bf8,0,0,0,0,0,
20200821,MT,6216,,202411,,posNeg,208627,97,363,,,,,4798,C,8/21/2020 00:00,2020-08-21T00:00:00Z,08/20 20:00,89,363,2020-08-21T00:00:00Z,208627,,,6216,,,,,,,,,,,,,,,30,144,923,208627,1067,208627,0,6,b0e17bd5e5297291f9743e27648018a1cd53558b,0,0,0,0,0,
20200820,MT,6072,,201488,,posNeg,207560,101,357,,,,,4434,C,8/20/2020 00:00,2020-08-20T00:00:00Z,08/19 20:00,89,357,2020-08-20T00:00:00Z,207560,,,6072,,,,,,,,,,,,,,,30,116,911,207560,1027,207560,5,9,0c300d118dee51c39f74f161a4a317dcdde3ec17,0,0,0,0,0,
20200819,MT,5956,,200577,,posNeg,206533,102,348,,,,,4357,C,8/19/2020 00:00,2020-08-19T00:00:00Z,08/18 20:00,84,348,2020-08-19T00:00:00Z,206533,,,5956,,,,,,,,,,,,,,,30,110,911,206533,1021,206533,0,9,beaad7f0f9b2a4b0d09295d6435db3ea06a0634b,0,0,0,0,0,
20200818,MT,5846,,199666,,posNeg,205512,97,339,,,,,4206,C,8/18/2020 00:00,2020-08-18T00:00:00Z,08/17 20:00,84,339,2020-08-18T00:00:00Z,205512,,,5846,,,,,,,,,,,,,,,30,54,733,205512,787,205512,2,9,17ce814cc66245e7813bebc5973bfe75e9ea6020,0,0,0,0,0,
20200817,MT,5792,,198933,,posNeg,204725,94,330,,,,,4162,C,8/17/2020 00:00,2020-08-17T00:00:00Z,08/16 20:00,82,330,2020-08-17T00:00:00Z,204725,,,5792,,,,,,,,,,,,,,,30,42,2759,204725,2801,204725,0,4,36f9d5bfbecef6ecd2f0ecddb739cbb961e1f6fd,0,0,0,0,0,
20200816,MT,5750,,196174,,posNeg,201924,90,326,,,,,4145,C,8/16/2020 00:00,2020-08-16T00:00:00Z,08/15 20:00,82,326,2020-08-16T00:00:00Z,201924,,,5750,,,,,,,,,,,,,,,30,91,897,201924,988,201924,0,2,250a145b4b31854f237009d83c51577773891ba4,0,0,0,0,0,
20200815,MT,5659,,195277,,posNeg,200936,90,324,,,,,4123,C,8/15/2020 00:00,2020-08-15T00:00:00Z,08/14 20:00,82,324,2020-08-15T00:00:00Z,200936,,,5659,,,,,,,,,,,,,,,30,118,957,200936,1075,200936,1,5,e13ba17e6d87d41a4163e1f27873331efecc199e,0,0,0,0,0,
20200814,MT,5541,,194320,,posNeg,199861,86,319,,,,,4011,C,8/14/2020 00:00,2020-08-14T00:00:00Z,08/13 20:00,81,319,2020-08-14T00:00:00Z,199861,,,5541,,,,,,,,,,,,,,,30,134,1907,199861,2041,199861,0,4,67fe6f818bb20468d202d91f8ddac86073b1f229,0,0,0,0,0,
20200813,MT,5407,,192413,,posNeg,197820,101,315,,,,,3937,C,8/12/2020 00:00,2020-08-12T00:00:00Z,08/11 20:00,81,315,2020-08-12T00:00:00Z,197820,,,5407,,,,,,,,,,,,,,,30,139,1645,197820,1784,197820,1,14,b6ffc9be301bb7328d7952ac8f556844ab3ef805,0,0,0,0,0,
20200812,MT,5268,,190768,,posNeg,196036,97,301,,,,,3598,C,8/12/2020 00:00,2020-08-12T00:00:00Z,08/11 20:00,80,301,2020-08-12T00:00:00Z,196036,,,5268,,,,,,,,,,,,,,,30,164,1460,196036,1624,196036,3,25,e586abd3c599c69987e4fa87b9f3bf8c692161f2,0,0,0,0,0,
20200811,MT,5104,,189308,,posNeg,194412,77,276,,,,,3542,C,8/11/2020 00:00,2020-08-11T00:00:00Z,08/10 20:00,77,276,2020-08-11T00:00:00Z,194412,,,5104,,,,,,,,,,,,,,,30,87,920,194412,1007,194412,2,3,457c37da827e766a9d674a868f503ec2293836f7,0,0,0,0,0,
20200810,MT,5017,,188388,,posNeg,193405,80,273,,,,,3413,C,8/10/2020 00:00,2020-08-10T00:00:00Z,08/09 20:00,75,273,2020-08-10T00:00:00Z,193405,,,5017,,,,,,,,,,,,,,,30,65,3394,193405,3459,193405,0,1,123aff855020a825b235bf55ddfdf9a5a72c80a3,0,0,0,0,0,
20200809,MT,4952,,184994,,posNeg,189946,83,272,,,,,3275,C,8/9/2020 00:00,2020-08-09T00:00:00Z,08/08 20:00,75,272,2020-08-09T00:00:00Z,189946,,,4952,,,,,,,,,,,,,,,30,63,1037,189946,1100,189946,0,4,567c8b6bf366cc4434c352a482410ae6b1a8141d,0,0,0,0,0,
20200808,MT,4889,,183957,,posNeg,188846,81,268,,,,,3255,C,8/8/2020 00:00,2020-08-08T00:00:00Z,08/07 20:00,75,268,2020-08-08T00:00:00Z,188846,,,4889,,,,,,,,,,,,,,,30,132,958,188846,1090,188846,5,4,2ef3dc2d668fa9985d453de3361cbbdc2f054d77,0,0,0,0,0,
20200807,MT,4757,,182999,,posNeg,187756,84,264,,,,,3122,C,8/7/2020 00:00,2020-08-07T00:00:00Z,08/06 20:00,70,264,2020-08-07T00:00:00Z,187756,,,4757,,,,,,,,,,,,,,,30,155,1786,187756,1941,187756,5,5,3f083f92dc4cafe43366305a37c97a52a9d41157,0,0,0,0,0,
20200806,MT,4602,,181213,,posNeg,185815,87,259,,,,,2964,C,8/6/2020 00:00,2020-08-06T00:00:00Z,08/05 20:00,65,259,2020-08-06T00:00:00Z,185815,,,4602,,,,,,,,,,,,,,,30,173,2518,185815,2691,185815,0,11,c6ef4c541f5599ca8cc7faefee81eef4df1a7b1c,0,0,0,0,0,
20200805,MT,4429,,178695,,posNeg,183124,79,248,,,,,2820,C,8/5/2020 00:00,2020-08-05T00:00:00Z,08/04 20:00,65,248,2020-08-05T00:00:00Z,183124,,,4429,,,,,,,,,,,,,,,30,115,1773,183124,1888,183124,1,10,1b0763baae89bccade1fcf735584a625b77cbcc2,0,0,0,0,0,
20200804,MT,4314,,176922,,posNeg,181236,70,238,,,,,2766,C,8/4/2020 00:00,2020-08-04T00:00:00Z,08/03 20:00,64,238,2020-08-04T00:00:00Z,181236,,,4314,,,,,,,,,,,,,,,30,81,1647,181236,1728,181236,0,2,361f00af61d0b981dea07e5f0430a1baab9f155d,0,0,0,0,0,
20200803,MT,4233,,175275,,posNeg,179508,69,236,,,,,2653,C,8/3/2020 00:00,2020-08-03T00:00:00Z,08/02 20:00,64,236,2020-08-03T00:00:00Z,179508,,,4233,,,,,,,,,,,,,,,30,40,5173,179508,5213,179508,3,3,71d6d0bf1a4eee4341b7d3df4a4ba5e09981b29a,0,0,0,0,0,
20200802,MT,4193,,170102,,posNeg,174295,72,233,,,,,2466,C,8/2/2020 00:00,2020-08-02T00:00:00Z,08/01 20:00,61,233,2020-08-02T00:00:00Z,174295,,,4193,,,,,,,,,,,,,,,30,112,2630,174295,2742,174295,0,3,9fe4d334532227c1d4c120fb26fea5e55c64b828,0,0,0,0,0,
20200801,MT,4081,,167472,,posNeg,171553,71,230,,,,,2456,C,8/1/2020 00:00,2020-08-01T00:00:00Z,07/31 20:00,61,230,2020-08-01T00:00:00Z,171553,,,4081,,,,,,,,,,,,,,,30,116,1467,171553,1583,171553,1,0,46905a7402498144c38bf7bc3f3c39868d386707,0,0,0,0,0,
20200731,MT,3965,,166005,,posNeg,169970,71,230,,,,,2331,C,7/31/2020 00:00,2020-07-31T00:00:00Z,07/30 20:00,60,230,2020-07-31T00:00:00Z,169970,,,3965,,,,,,,,,,,,,,,30,151,1203,169970,1354,169970,5,9,d0aae0a0f04b028701e4ad24f588095ffd531f68,0,0,0,0,0,
20200730,MT,3814,,164802,,posNeg,168616,69,221,,,,,2240,C,7/30/2020 00:00,2020-07-30T00:00:00Z,07/29 20:00,55,221,2020-07-30T00:00:00Z,168616,,,3814,,,,,,,,,,,,,,,30,138,3123,168616,3261,168616,1,10,0522708a8cc74fa9d96b113e0278088f861641d0,0,0,0,0,0,
20200729,MT,3676,,161679,,posNeg,165355,59,211,,,,,2212,C,7/29/2020 00:00,2020-07-29T00:00:00Z,07/28 20:00,54,211,2020-07-29T00:00:00Z,165355,,,3676,,,,,,,,,,,,,,,30,201,3746,165355,3947,165355,3,6,054ba8f73cd260bfc5c200d673d0a607f1e84021,0,0,0,0,0,
20200728,MT,3475,,157933,,posNeg,161408,62,205,,,,,2104,C,7/28/2020 00:00,2020-07-28T00:00:00Z,07/27 20:00,51,205,2020-07-28T00:00:00Z,161408,,,3475,,,,,,,,,,,,,,,30,94,2659,161408,2753,161408,4,4,222fe193917d9cd391d5bddc0d187a02379bf6ed,0,0,0,0,0,
20200727,MT,3381,,155274,,posNeg,158655,61,201,,,,,2090,C,7/27/2020 00:00,2020-07-27T00:00:00Z,07/26 20:00,47,201,2020-07-27T00:00:00Z,158655,,,3381,,,,,,,,,,,,,,,30,39,6301,158655,6340,158655,1,2,172c479b13c42b5a3afb300a9d73b43be5180fd3,0,0,0,0,0,
20200726,MT,3342,,148973,,posNeg,152315,62,199,,,,,2079,C,7/26/2020 00:00,2020-07-26T00:00:00Z,07/25 20:00,46,199,2020-07-26T00:00:00Z,152315,,,3342,,,,,,,,,,,,,,,30,82,1218,152315,1300,152315,0,4,1bbcb5c80fe423efebd444dffb1a184671346a4f,0,0,0,0,0,
20200725,MT,3260,,147755,,posNeg,151015,59,195,,,,,1977,C,7/25/2020 00:00,2020-07-25T00:00:00Z,07/24 20:00,46,195,2020-07-25T00:00:00Z,151015,,,3260,,,,,,,,,,,,,,,30,221,1594,151015,1815,151015,0,4,e840b2871a1812e3f7a655f3d694f9dbdba5b2bc,0,0,0,0,0,
20200724,MT,3039,,146161,,posNeg,149200,56,191,,,,,1815,C,7/24/2020 00:00,2020-07-24T00:00:00Z,07/23 20:00,46,191,2020-07-24T00:00:00Z,149200,,,3039,,,,,,,,,,,,,,,30,129,2853,149200,2982,149200,3,8,616d1d88cf787795d0f7fac9b284d4fa3a26332d,0,0,0,0,0,
20200723,MT,2910,,143308,,posNeg,146218,54,183,,,,,1587,C,7/23/2020 00:00,2020-07-23T00:00:00Z,07/22 20:00,43,183,2020-07-23T00:00:00Z,146218,,,2910,,,,,,,,,,,,,,,30,97,2603,146218,2700,146218,1,4,6af746da918a4747d66d99827a0783077b9e29e6,0,0,0,0,0,
20200722,MT,2813,,140705,,posNeg,143518,52,179,,,,,1543,C,7/22/2020 00:00,2020-07-22T00:00:00Z,07/21 20:00,42,179,2020-07-22T00:00:00Z,143518,,,2813,,,,,,,,,,,,,,,30,101,2415,143518,2516,143518,2,5,abb05f0bd83967078c1e731d6f5ceb066ec7a4a8,0,0,0,0,0,
20200721,MT,2712,,138290,,posNeg,141002,49,174,,,,,1493,C,7/21/2020 00:00,2020-07-21T00:00:00Z,07/20 20:00,40,174,2020-07-21T00:00:00Z,141002,,,2712,,,,,,,,,,,,,,,30,91,1869,141002,1960,141002,1,7,7f482345e2d6698a2cea2332dc11de283cfa292e,0,0,0,0,0,
20200720,MT,2621,,136421,,posNeg,139042,48,167,,,,,1334,C,7/20/2020 00:00,2020-07-20T00:00:00Z,07/19 20:00,39,167,2020-07-20T00:00:00Z,139042,,,2621,,,,,,,,,,,,,,,30,88,5795,139042,5883,139042,2,2,1e45750bdae4c212763f79a5a947e6964cda4a8b,0,0,0,0,0,
20200719,MT,2533,,130626,,posNeg,133159,47,165,,,,,1075,C,7/19/2020 00:00,2020-07-19T00:00:00Z,07/18 20:00,37,165,2020-07-19T00:00:00Z,133159,,,2533,,,,,,,,,,,,,,,30,62,1218,133159,1280,133159,0,1,c48dc98fecff926ccc61b7a20e569dd0475a0c18,0,0,0,0,0,
20200718,MT,2471,,129408,,posNeg,131879,46,164,,,,,1075,C,7/18/2020 00:00,2020-07-18T00:00:00Z,07/17 20:00,37,164,2020-07-18T00:00:00Z,131879,,,2471,,,,,,,,,,,,,,,30,105,1370,131879,1475,131879,0,5,b4a4513b172965e7e9d0e71bfc9b518b38b5ec22,0,0,0,0,0,
20200717,MT,2366,,128038,,posNeg,130404,45,159,,,,,992,C,7/17/2020 00:00,2020-07-17T00:00:00Z,07/16 20:00,37,159,2020-07-17T00:00:00Z,130404,,,2366,,,,,,,,,,,,,,,30,135,2429,130404,2564,130404,2,9,c5b7917a12dbf1c438295af0950db7c4b8d25dae,0,0,0,0,0,
20200716,MT,2231,,125609,,posNeg,127840,37,150,,,,,970,C,7/16/2020 00:00,2020-07-16T00:00:00Z,07/15 20:00,35,150,2020-07-16T00:00:00Z,127840,,,2231,,,,,,,,,,,,,,,30,135,3947,127840,4082,127840,1,5,9f38ce72587ac1521e2d280430f75653f2c5ce46,0,0,0,0,0,
20200715,MT,2096,,121662,,posNeg,123758,37,145,,,,,915,C,7/15/2020 00:00,2020-07-15T00:00:00Z,07/14 20:00,34,145,2020-07-15T00:00:00Z,123758,,,2096,,,,,,,,,,,,,,,30,144,2218,123758,2362,123758,0,9,646d5f2e1de4d4fac2cd292d11fc543c0abf5097,0,0,0,0,0,
20200714,MT,1952,,119444,,posNeg,121396,29,136,,,,,884,C,7/14/2020 00:00,2020-07-14T00:00:00Z,07/13 20:00,34,136,2020-07-14T00:00:00Z,121396,,,1952,,,,,,,,,,,,,,,30,109,2592,121396,2701,121396,2,3,53f29eda821edda072c5a62dabc9c9a4fb03fe2f,0,0,0,0,0,
20200713,MT,1843,,116852,,posNeg,118695,28,133,,,,,875,C,7/13/2020 00:00,2020-07-13T00:00:00Z,07/12 20:00,32,133,2020-07-13T00:00:00Z,118695,,,1843,,,,,,,,,,,,,,,30,85,3949,118695,4034,118695,3,5,7677899e46ca079a14cd87a10c62c4be8e5e23c3,0,0,0,0,0,
20200712,MT,1758,,112903,,posNeg,114661,26,128,,,,,865,C,7/12/2020 00:00,2020-07-12T00:00:00Z,07/11 20:00,29,128,2020-07-12T00:00:00Z,114661,,,1758,,,,,,,,,,,,,,,30,81,1221,114661,1302,114661,0,1,988bb87507bc31e0c4d847a6f558a64745892a7f,0,0,0,0,0,
20200711,MT,1677,,111682,,posNeg,113359,24,127,,,,,864,C,7/11/2020 00:00,2020-07-11T00:00:00Z,07/10 20:00,29,127,2020-07-11T00:00:00Z,113359,,,1677,,,,,,,,,,,,,,,30,84,1097,113359,1181,113359,1,4,68d2198f351da24b0ed914dec733e183f56c9fce,0,0,0,0,0,
20200710,MT,1593,,110585,,posNeg,112178,21,123,,,,,855,C,7/10/2020 00:00,2020-07-10T00:00:00Z,07/09 20:00,28,123,2020-07-10T00:00:00Z,112178,,,1593,,,,,,,,,,,,,,,30,127,3286,112178,3413,112178,3,3,c62468219bb698bed99a5fa58741bd9a2db8cf04,0,0,0,0,0,
20200709,MT,1466,,107299,,posNeg,108765,24,120,,,,,796,C,7/9/2020 00:00,2020-07-09T00:00:00Z,07/08 20:00,25,120,2020-07-09T00:00:00Z,108765,,,1466,,,,,,,,,,,,,,,30,95,2249,108765,2344,108765,2,3,875f444a1b4918ec54c3a7a866f2f1bce3d77a86,0,0,0,0,0,
20200708,MT,1371,,105050,,posNeg,106421,22,117,,,,,759,C,7/8/2020 00:00,2020-07-08T00:00:00Z,07/07 20:00,23,117,2020-07-08T00:00:00Z,106421,,,1371,,,,,,,,,,,,,,,30,44,1050,106421,1094,106421,0,0,fed33910f9c0c14ede3ac979e36cc86756b5be86,0,0,0,0,0,
20200707,MT,1327,,104000,,posNeg,105327,22,117,,,,,716,C,7/7/2020 00:00,2020-07-07T00:00:00Z,07/06 20:00,23,117,2020-07-07T00:00:00Z,105327,,,1327,,,,,,,,,,,,,,,30,78,2323,105327,2401,105327,0,5,2789da9399c21e79aabdf561a2454d4e86663e42,0,0,0,0,0,
20200706,MT,1249,,101677,,posNeg,102926,20,112,,,,,678,C,7/6/2020 00:00,2020-07-06T00:00:00Z,07/05 20:00,23,112,2020-07-06T00:00:00Z,102926,,,1249,,,,,,,,,,,,,,,30,37,2783,102926,2820,102926,0,0,769da2d9365a87ee4387b11ba1ff422280fe6834,0,0,0,0,0,
20200705,MT,1212,,98894,,posNeg,100106,20,112,,,,,678,C,7/5/2020 00:00,2020-07-05T00:00:00Z,07/04 20:00,23,112,2020-07-05T00:00:00Z,100106,,,1212,,,,,,,,,,,,,,,30,45,1111,100106,1156,100106,0,0,5454d341197c301a819cb0e1f852986453b14543,0,0,0,0,0,
20200704,MT,1167,,97783,,posNeg,98950,20,112,,,,,678,C,7/4/2020 00:00,2020-07-04T00:00:00Z,07/03 20:00,23,112,2020-07-04T00:00:00Z,98950,,,1167,,,,,,,,,,,,,,,30,39,1408,98950,1447,98950,0,3,16c4da27634b61d8a8ef75fa366446f4a737ed34,0,0,0,0,0,
20200703,MT,1128,,96375,,posNeg,97503,17,109,,,,,678,C,7/3/2020 00:00,2020-07-03T00:00:00Z,07/02 20:00,23,109,2020-07-03T00:00:00Z,97503,,,1128,,,,,,,,,,,,,,,30,45,2309,97503,2354,97503,1,3,c4e2c287799f4cb7ed807a50fe69c679e0a84cdb,0,0,0,0,0,
20200702,MT,1083,,94066,,posNeg,95149,14,106,,,,,672,C,7/2/2020 00:00,2020-07-02T00:00:00Z,07/01 20:00,22,106,2020-07-02T00:00:00Z,95149,,,1083,,,,,,,,,,,,,,,30,67,1752,95149,1819,95149,0,1,0c9bcdaa472f03f288b268911375902f1a4db0b8,0,0,0,0,0,
20200701,MT,1016,,92314,,posNeg,93330,14,105,,,,,658,C,7/1/2020 00:00,2020-07-01T00:00:00Z,06/30 20:00,22,105,2020-07-01T00:00:00Z,93330,,,1016,,,,,,,,,,,,,,,30,49,2420,93330,2469,93330,0,4,514a19c7c6df7c13a9a7f1ec0bd4830aae66b9fa,0,0,0,0,0,
20200630,MT,967,,89894,,posNeg,90861,12,101,,,,,642,C,6/30/2020 00:00,2020-06-30T00:00:00Z,06/29 20:00,22,101,2020-06-30T00:00:00Z,90861,,,967,,,,,,,,,,,,,,,30,48,2070,90861,2118,90861,0,1,c3916dd14df8733a3cfea8591e62d6d9b73e0904,0,0,0,0,0,
20200629,MT,919,,87824,,posNeg,88743,13,100,,,,,609,C,6/29/2020 00:00,2020-06-29T00:00:00Z,06/28 20:00,22,100,2020-06-29T00:00:00Z,88743,,,919,,,,,,,,,,,,,,,30,56,6213,88743,6269,88743,0,3,7f65479b12d008eb26930fd2a4028899a91765c2,0,0,0,0,0,
20200628,MT,863,,81611,,posNeg,82474,11,97,,,,,604,C,6/28/2020 00:00,2020-06-28T00:00:00Z,06/27 20:00,22,97,2020-06-28T00:00:00Z,82474,,,863,,,,,,,,,,,,,,,30,11,1216,82474,1227,82474,0,2,de53ac87c50c5f0aa95837acd332833c2cd194db,0,0,0,0,0,
20200627,MT,852,,80395,,posNeg,81247,9,95,,,,,604,C,6/27/2020 00:00,2020-06-27T00:00:00Z,06/26 20:00,22,95,2020-06-27T00:00:00Z,81247,,,852,,,,,,,,,,,,,,,30,23,1063,81247,1086,81247,0,0,0d82ecd109011bb13e3c33fc6445c2f41f39750f,0,0,0,0,0,
20200626,MT,829,,79332,,posNeg,80161,14,95,,,,,589,C,6/26/2020 00:00,2020-06-26T00:00:00Z,06/25 20:00,22,95,2020-06-26T00:00:00Z,80161,,,829,,,,,,,,,,,,,,,30,26,1803,80161,1829,80161,1,2,3e3bb95627e977a2187b8734c5edbdd2b2fb2c5a,0,0,0,0,0,
20200625,MT,803,,77529,,posNeg,78332,15,93,,,,,572,C,6/25/2020 00:00,2020-06-25T00:00:00Z,06/24 20:00,21,93,2020-06-25T00:00:00Z,78332,,,803,,,,,,,,,,,,,,,30,37,3229,78332,3266,78332,0,0,23bef43edc6481cc26c7f096cd544ac4d1bbb47a,0,0,0,0,0,
20200624,MT,766,,74300,,posNeg,75066,17,93,,,,,571,C,6/24/2020 00:00,2020-06-24T00:00:00Z,06/23 20:00,21,93,2020-06-24T00:00:00Z,75066,,,766,,,,,,,,,,,,,,,30,23,1120,75066,1143,75066,0,2,3b9cb32853bc3e97efa6afe60aa03f872efe5bc6,0,0,0,0,0,
20200623,MT,743,,73180,,posNeg,73923,15,91,,,,,566,C,6/23/2020 00:00,2020-06-23T00:00:00Z,06/22 20:00,21,91,2020-06-23T00:00:00Z,73923,,,743,,,,,,,,,,,,,,,30,3,2615,73923,2618,73923,0,1,00a7360a64360f42e537530fbb93cdceb952c33a,0,0,0,0,0,
20200622,MT,740,,70565,,posNeg,71305,15,90,,,,,548,C,6/22/2020 00:00,2020-06-22T00:00:00Z,06/21 20:00,21,90,2020-06-22T00:00:00Z,71305,,,740,,,,,,,,,,,,,,,30,23,925,71305,948,71305,1,1,4d3ba53c02ef3b3cc6695338d58f90518c805701,0,0,0,0,0,
20200621,MT,717,,69640,,posNeg,70357,15,89,,,,,548,C,6/21/2020 00:00,2020-06-21T00:00:00Z,06/20 20:00,20,89,2020-06-21T00:00:00Z,70357,,,717,,,,,,,,,,,,,,,30,19,808,70357,827,70357,0,4,3e76cd6d7d53b1f9fb1064001a51a8550167fa94,0,0,0,0,0,
20200620,MT,698,,68832,,posNeg,69530,10,85,,,,,548,C,6/20/2020 13:30,2020-06-20T13:30:00Z,06/20 09:30,20,85,2020-06-20T13:30:00Z,69530,,,698,,,,,,,,,,,,,,,30,32,1076,69530,1108,69530,0,3,b3b77656dc1ba0a28a00356dbb863e83560c9d35,0,0,0,0,0,
20200619,MT,666,,67756,,posNeg,68422,9,82,,,,,546,C,6/19/2020 00:00,2020-06-19T00:00:00Z,06/18 20:00,20,82,2020-06-19T00:00:00Z,68422,,,666,,,,,,,,,,,,,,,30,11,1541,68422,1552,68422,0,1,148e00b3174511973fa412bd339366c34afa0017,0,0,0,0,0,
20200618,MT,655,,66215,,posNeg,66870,8,81,,,,,545,C,6/18/2020 00:00,2020-06-18T00:00:00Z,06/17 20:00,20,81,2020-06-18T00:00:00Z,66870,,,655,,,,,,,,,,,,,,,30,25,1330,66870,1355,66870,0,3,ccb18b547faf8d0d39a13768b95532b39ef5d970,0,0,0,0,0,
20200617,MT,630,,64885,,posNeg,65515,5,78,,,,,538,C,6/17/2020 00:00,2020-06-17T00:00:00Z,06/16 20:00,20,78,2020-06-17T00:00:00Z,65515,,,630,,,,,,,,,,,,,,,30,16,1922,65515,1938,65515,1,-1,409555a3981d2681d253f555b10659c15a113b85,0,0,0,0,0,
20200616,MT,614,,62963,,posNeg,63577,8,79,,,,,535,C,6/16/2020 00:00,2020-06-16T00:00:00Z,06/15 20:00,19,79,2020-06-16T00:00:00Z,63577,,,614,,,,,,,,,,,,,,,30,5,2635,63577,2640,63577,0,1,86e5e65afe13ac87de9354303bac93108599faa5,0,0,0,0,0,
20200615,MT,609,,60328,,posNeg,60937,7,78,,,,,510,C,6/15/2020 00:00,2020-06-15T00:00:00Z,06/14 20:00,19,78,2020-06-15T00:00:00Z,60937,,,609,,,,,,,,,,,,,,,30,8,2022,60937,2030,60937,0,1,2d99368ed1c4480e73b42830d62fcb920a76177f,0,0,0,0,0,
20200614,MT,601,,58306,,posNeg,58907,6,77,,,,,510,C,6/14/2020 00:00,2020-06-14T00:00:00Z,06/13 20:00,19,77,2020-06-14T00:00:00Z,58907,,,601,,,,,,,,,,,,,,,30,13,890,58907,903,58907,1,0,b77c10804813dc0cb24172a783f3fdf9df2f5882,0,0,0,0,0,
20200613,MT,588,,57416,,posNeg,58004,7,77,,,,,510,C,6/13/2020 00:00,2020-06-13T00:00:00Z,06/12 20:00,18,77,2020-06-13T00:00:00Z,58004,,,588,,,,,,,,,,,,,,,30,15,967,58004,982,58004,0,0,83493bbfd266c36a377d07ab0ed0a1341810fe62,0,0,0,0,0,
20200612,MT,573,,56449,,posNeg,57022,7,77,,,,,489,C,6/12/2020 00:00,2020-06-12T00:00:00Z,06/11 20:00,18,77,2020-06-12T00:00:00Z,57022,,,573,,,,,,,,,,,,,,,30,10,1235,57022,1245,57022,0,3,68a0b7b768b598d5e61c8d362e80d131a92906b7,0,0,0,0,0,
20200611,MT,563,,55214,,posNeg,55777,7,74,,,,,487,C,6/11/2020 11:53,2020-06-11T11:53:00Z,06/11 07:53,18,74,2020-06-11T11:53:00Z,55777,,,563,,,,,,,,,,,,,,,30,2,1159,55777,1161,55777,0,0,1db55efef135d4febb8830fce2c3a32f4f87d71e,0,0,0,0,0,
20200610,MT,561,,54055,,posNeg,54616,7,74,,,,,487,C,6/10/2020 00:00,2020-06-10T00:00:00Z,06/09 20:00,18,74,2020-06-10T00:00:00Z,54616,,,561,,,,,,,,,,,,,,,30,7,1425,54616,1432,54616,0,2,763d06601675cb76aea4b731da631ad26674752e,0,0,0,0,0,
20200609,MT,554,,52630,,posNeg,53184,5,72,,,,,485,C,6/9/2020 00:00,2020-06-09T00:00:00Z,06/08 20:00,18,72,2020-06-09T00:00:00Z,53184,,,554,,,,,,,,,,,,,,,30,6,1586,53184,1592,53184,0,3,9bfdb68081505773042b7e572896403918a4df9f,0,0,0,0,0,
20200608,MT,548,,51044,,posNeg,51592,2,69,,,,,475,C,6/8/2020 00:00,2020-06-08T00:00:00Z,06/07 20:00,18,69,2020-06-08T00:00:00Z,51592,,,548,,,,,,,,,,,,,,,30,3,4211,51592,4214,51592,0,0,ed9538c942195eaf8937ffe26ee56a3130d2e535,0,0,0,0,0,
20200607,MT,545,,46833,,posNeg,47378,2,69,,,,,475,C,6/7/2020 00:00,2020-06-07T00:00:00Z,06/06 20:00,18,69,2020-06-07T00:00:00Z,47378,,,545,,,,,,,,,,,,,,,30,5,619,47378,624,47378,0,1,d8b3e1f33581b04513540a31b5acf276562ebc2c,0,0,0,0,0,
20200606,MT,540,,46214,,posNeg,46754,1,68,,,,,472,C,6/6/2020 00:00,2020-06-06T00:00:00Z,06/05 20:00,18,68,2020-06-06T00:00:00Z,46754,,,540,,,,,,,,,,,,,,,30,-1,867,46754,866,46754,0,0,3363822ee508e3238219238d5ce07ec2bdc30989,0,0,0,0,0,
20200605,MT,541,,45347,,posNeg,45888,1,68,,,,,470,C,6/5/2020 00:00,2020-06-05T00:00:00Z,06/04 20:00,18,68,2020-06-05T00:00:00Z,45888,,,541,,,,,,,,,,,,,,,30,2,1244,45888,1246,45888,1,0,083267aa7361e2abdbe81e2a23911d6d336a731c,0,0,0,0,0,
20200604,MT,539,,44103,,posNeg,44642,1,68,,,,,467,C,6/4/2020 00:00,2020-06-04T00:00:00Z,06/03 20:00,17,68,2020-06-04T00:00:00Z,44642,,,539,,,,,,,,,,,,,,,30,14,1180,44642,1194,44642,0,0,1e3ccdafd23631f98e055421727c7e755e4fcce4,0,0,0,0,0,
20200603,MT,525,,42923,,posNeg,43448,1,68,,,,,464,C,6/3/2020 00:00,2020-06-03T00:00:00Z,06/02 20:00,17,68,2020-06-03T00:00:00Z,43448,,,525,,,,,,,,,,,,,,,30,2,1234,43448,1236,43448,0,1,f87cbeab549707c5cd49d14ae266c0ee765e32fb,0,0,0,0,0,
20200602,MT,523,,41689,,posNeg,42212,1,67,,,,,462,C,6/2/2020 00:00,2020-06-02T00:00:00Z,06/01 20:00,17,67,2020-06-02T00:00:00Z,42212,,,523,,,,,,,,,,,,,,,30,4,1551,42212,1555,42212,0,0,f2b4edccca2e991f0e9f9945a6d0bf64026c6ca1,0,0,0,0,0,
20200601,MT,519,,40138,,posNeg,40657,2,67,,,,,461,C,6/1/2020 00:00,2020-06-01T00:00:00Z,05/31 20:00,17,67,2020-06-01T00:00:00Z,40657,,,519,,,,,,,,,,,,,,,30,4,855,40657,859,40657,0,0,dc2d6d3b29db4782df53ec0466fcbc349e93b588,0,0,0,0,0,
20200531,MT,515,,39283,,posNeg,39798,2,67,,,,,456,C,5/31/2020 00:00,2020-05-31T00:00:00Z,05/30 20:00,17,67,2020-05-31T00:00:00Z,39798,,,515,,,,,,,,,,,,,,,30,10,504,39798,514,39798,0,0,65cfd078214f77590be7bc85ee5633dae0261380,0,0,0,0,0,
20200530,MT,505,,38779,,posNeg,39284,2,67,,,,,448,C,5/30/2020 00:00,2020-05-30T00:00:00Z,05/29 20:00,17,67,2020-05-30T00:00:00Z,39284,,,493,,,,,,,,,,,,,,,30,12,743,39284,755,39284,0,0,f8595a7808599580960c4aa252926407c758081e,0,0,0,0,0,
20200529,MT,493,,38036,,posNeg,38529,2,67,,,,,448,C,5/29/2020 00:00,2020-05-29T00:00:00Z,05/28 20:00,17,67,2020-05-29T00:00:00Z,38529,,,493,,,,,,,,,,,,,,,30,8,1728,38529,1736,38529,0,1,4f8ba4f1829b5f09da39363c9a4f6268d9d9513e,0,0,0,0,0,
20200528,MT,485,,36308,,posNeg,36793,1,66,,,,,445,C,5/28/2020 00:00,2020-05-28T00:00:00Z,05/27 20:00,17,66,2020-05-28T00:00:00Z,36793,,,485,,,,,,,,,,,,,,,30,4,1146,36793,1150,36793,0,0,ef296f637aff47a9375bc38a1f3e44bd4ee7620c,0,0,0,0,0,
20200527,MT,481,,35162,,posNeg,35643,2,66,,,,,444,C,5/27/2020 00:00,2020-05-27T00:00:00Z,05/26 20:00,17,66,2020-05-27T00:00:00Z,35643,,,481,,,,,,,,,,,,,,,30,2,1807,35643,1809,35643,0,1,f710db89ed1e0cbf923c2b842fb072123b75f2aa,0,0,0,0,0,
20200526,MT,479,,33355,,posNeg,33834,2,65,,,,,441,C,5/26/2020 00:00,2020-05-26T00:00:00Z,05/25 20:00,17,65,2020-05-26T00:00:00Z,33834,,,479,,,,,,,,,,,,,,,30,0,152,33834,152,33834,1,0,0533a9356a0f4dc542a452cf9db345b4b7320c7b,0,0,0,0,0,
20200525,MT,479,,33203,,posNeg,33682,3,65,,,,,441,C,5/25/2020 00:00,2020-05-25T00:00:00Z,05/24 20:00,16,65,2020-05-25T00:00:00Z,33682,,,479,,,,,,,,,,,,,,,30,0,301,33682,301,33682,0,0,4c7b967c373d804806a551353978428a84e6f066,0,0,0,0,0,
20200524,MT,479,,32902,,posNeg,33381,3,65,,,,,441,C,5/24/2020 11:58,2020-05-24T11:58:00Z,05/24 07:58,16,65,2020-05-24T11:58:00Z,33381,,,479,,,,,,,,,,,,,,,30,0,729,33381,729,33381,0,0,17c4b9c83fd3dfc139253c75b462c553cd14e6e3,0,0,0,0,0,
20200523,MT,479,,32173,,posNeg,32652,3,65,,,,,441,C,5/23/2020 00:00,2020-05-23T00:00:00Z,05/22 20:00,16,65,2020-05-23T00:00:00Z,32652,,,479,,,,,,,,,,,,,,,30,0,795,32652,795,32652,0,0,1ba1608423ddd76d71e46f9ccd176f83f9fa7512,0,0,0,0,0,
20200522,MT,479,,31378,,posNeg,31857,3,65,,,,,441,C,5/22/2020 12:05,2020-05-22T12:05:00Z,05/22 08:05,16,65,2020-05-22T12:05:00Z,31857,,,479,,,,,,,,,,,,,,,30,0,1333,31857,1333,31857,0,0,2c72fca9b80cafbd551b9398fbc4a8e0dcda6a5c,0,0,0,0,0,
20200521,MT,479,,30045,,posNeg,30524,3,65,,,,,440,C,5/21/2020 00:00,2020-05-21T00:00:00Z,05/20 20:00,16,65,2020-05-21T00:00:00Z,30524,,,479,,,,,,,,,,,,,,,30,1,797,30524,798,30524,0,0,757684852071eb1d1c3375ef27249186b5d7484a,0,0,0,0,0,
20200520,MT,478,,29248,,posNeg,29726,3,65,,,,,440,C,5/20/2020 00:00,2020-05-20T00:00:00Z,05/19 20:00,16,65,2020-05-20T00:00:00Z,29726,,,478,,,,,,,,,,,,,,,30,7,769,29726,776,29726,0,0,e0b1a55474360df5fe64203ee39633cfddd5b314,0,0,0,0,0,
20200519,MT,471,,28479,,posNeg,28950,5,65,,,,,437,B,5/19/2020 00:00,2020-05-19T00:00:00Z,05/18 20:00,16,65,2020-05-19T00:00:00Z,28950,,,471,,,,,,,,,,,,,,,30,1,782,28950,783,28950,0,1,d7cf8ff0f782baeafd7f7ce2fe7cd218aed210e9,0,0,0,0,0,
20200518,MT,470,,27697,,posNeg,28167,4,64,,,,,434,B,5/18/2020 00:00,2020-05-18T00:00:00Z,05/17 20:00,16,64,2020-05-18T00:00:00Z,28167,,,470,,,,,,,,,,,,,,,30,2,1280,28167,1282,28167,0,1,4c1ad6a797bed243b83eaf35fa9e2aab2e3c0504,0,0,0,0,0,
20200517,MT,468,,26417,,posNeg,26885,3,63,,,,,431,B,5/17/2020 00:00,2020-05-17T00:00:00Z,05/16 20:00,16,63,2020-05-17T00:00:00Z,26885,,,468,,,,,,,,,,,,,,,30,0,794,26885,794,26885,0,0,2a08ed0d803ed08f59f2161c66feb4b807b8806b,0,0,0,0,0,
20200516,MT,468,,25623,,posNeg,26091,3,63,,,,,431,B,5/16/2020 00:00,2020-05-16T00:00:00Z,05/15 20:00,16,63,2020-05-16T00:00:00Z,26091,,,468,,,,,,,,,,,,,,,30,2,671,26091,673,26091,0,0,20464489e960b7d059a39c51be34ecf1760f97fe,0,0,0,0,0,
20200515,MT,466,,24952,,posNeg,25418,3,63,,,,,431,B,5/15/2020 00:00,2020-05-15T00:00:00Z,05/14 20:00,16,63,2020-05-15T00:00:00Z,25418,,,466,,,,,,,,,,,,,,,30,4,865,25418,869,25418,0,0,78c9d78469aa42eb3688cd1da9f5aa9602b47ffb,0,0,0,0,0,
20200514,MT,462,,24087,,posNeg,24549,3,63,,,,,431,B,5/14/2020 00:00,2020-05-14T00:00:00Z,05/13 20:00,16,63,2020-05-14T00:00:00Z,24549,,,462,,,,,,,,,,,,,,,30,0,697,24549,697,24549,0,0,910da4763e16de99c0d7bb996114f48494cba277,0,0,0,0,0,
20200513,MT,462,,23390,,posNeg,23852,3,63,,,,,430,B,5/13/2020 00:00,2020-05-13T00:00:00Z,05/12 20:00,16,63,2020-05-13T00:00:00Z,23852,,,462,,,,,,,,,,,,,,,30,1,816,23852,817,23852,0,0,8c6efb9c9137b1b9787ca1b5079c90d31cfe1b12,0,0,0,0,0,
20200512,MT,461,,22574,,posNeg,23035,4,63,,,,,425,B,5/12/2020 00:00,2020-05-12T00:00:00Z,05/11 20:00,16,63,2020-05-12T00:00:00Z,23035,,,461,,,,,,,,,,,,,,,30,2,461,23035,463,23035,0,1,2c5c8d19bcf178014106dfae7cc8d55c0223d305,0,0,0,0,0,
20200511,MT,459,,22113,,posNeg,22572,4,62,,,,,423,C,5/10/2020 00:00,2020-05-10T00:00:00Z,05/09 20:00,16,62,2020-05-10T00:00:00Z,22572,,,459,,,,,,,,,,,,,,,30,1,867,22572,868,22572,0,0,65ce6b44b5569ae0175b466237520b487069013d,0,0,0,0,0,
20200510,MT,458,,21246,,posNeg,21704,4,62,,,,,422,C,5/9/2020 00:00,2020-05-09T00:00:00Z,05/08 20:00,16,62,2020-05-09T00:00:00Z,21704,,,458,,,,,,,,,,,,,,,30,0,375,21704,375,21704,0,0,349bb104fce5e7e3770a2ac024ae779dc01e9e91,0,0,0,0,0,
20200509,MT,458,,20871,,posNeg,21329,4,62,,,,,422,C,5/9/2020 00:00,2020-05-09T00:00:00Z,05/08 20:00,16,62,2020-05-09T00:00:00Z,21329,,,458,,,,,,,,,,,,,,,30,0,384,21329,384,21329,0,0,9bc221157e23c0b36f2a6249d7f9abd8f1a3b5ef,0,0,0,0,0,
20200508,MT,458,,20487,,posNeg,20945,6,62,,,,,420,C,5/8/2020 00:00,2020-05-08T00:00:00Z,05/07 20:00,16,62,2020-05-08T00:00:00Z,20945,,,458,,,,,,,,,,,,,,,30,2,696,20945,698,20945,0,0,4915201db90216d895d922641eccb21f020af74d,0,0,0,0,0,
20200507,MT,456,,19791,,posNeg,20247,6,62,,,,,417,C,5/7/2020 00:00,2020-05-07T00:00:00Z,05/06 20:00,16,62,2020-05-07T00:00:00Z,20247,,,456,,,,,,,,,,,,,,,30,0,543,20247,543,20247,0,0,42a81b5dcc1145a1c8510404b29dfd3d130defe0,0,0,0,0,0,
20200506,MT,456,,19248,,posNeg,19704,6,62,,,,,417,C,5/6/2020 00:00,2020-05-06T00:00:00Z,05/05 20:00,16,62,2020-05-06T00:00:00Z,19704,,,456,,,,,,,,,,,,,,,30,0,4432,19704,4432,19704,0,0,801778ec4ef335149aea6c7e82d2750a50cc7506,0,0,0,0,0,
20200505,MT,456,,14816,,posNeg,15272,6,62,,,,,410,C,5/5/2020 00:00,2020-05-05T00:00:00Z,05/04 20:00,16,62,2020-05-05T00:00:00Z,15272,,,456,,,,,,,,,,,,,,,30,-1,185,15272,184,15272,0,0,581e777bb132c4bdc30926deb4f95a8815331bb7,0,0,0,0,0,
20200504,MT,457,,14631,,posNeg,15088,6,62,,,,,404,C,5/4/2020 00:00,2020-05-04T00:00:00Z,05/03 20:00,16,62,2020-05-04T00:00:00Z,15088,,,457,,,,,,,,,,,,,,,30,2,79,15088,81,15088,0,1,de360f004d70eccbcab85c0bf97082ddbe1b49af,0,0,0,0,0,
20200503,MT,455,,14552,,posNeg,15007,5,61,,,,,404,C,5/3/2020 00:00,2020-05-03T00:00:00Z,05/02 20:00,16,61,2020-05-03T00:00:00Z,15007,,,455,,,,,,,,,,,,,,,30,0,372,15007,372,15007,0,0,50bc8c6c43b4911f5957bc443c8e93d646043ab8,0,0,0,0,0,
20200502,MT,455,,14180,,posNeg,14635,5,61,,,,,404,C,5/2/2020 00:00,2020-05-02T00:00:00Z,05/01 20:00,16,61,2020-05-02T00:00:00Z,14635,,,455,,,,,,,,,,,,,,,30,2,430,14635,432,14635,0,0,c4c71ae7b3f369f247585d61cf286aff42dc644b,0,0,0,0,0,
20200501,MT,453,,13750,,posNeg,14203,5,61,,,,,397,C,4/30/2020 00:00,2020-04-30T00:00:00Z,04/29 20:00,16,61,2020-04-30T00:00:00Z,14203,,,453,,,,,,,,,,,,,,,30,0,289,14203,289,14203,0,0,9245d341db01fef6497f26172e33e799331e9b01,0,0,0,0,0,
20200430,MT,453,,13461,,posNeg,13914,5,61,,,,,392,C,4/30/2020 00:00,2020-04-30T00:00:00Z,04/29 20:00,16,61,2020-04-30T00:00:00Z,13914,,,453,,,,,,,,,,,,,,,30,2,384,13914,386,13914,0,0,8e4804e597ea5218aebcab92b9ccd182518149d5,0,0,0,0,0,
20200429,MT,451,,13077,,posNeg,13528,5,61,,,,,382,C,4/29/2020 00:00,2020-04-29T00:00:00Z,04/28 20:00,16,61,2020-04-29T00:00:00Z,13528,,,,,,,,,,,,,,,,,,30,0,337,13528,337,13528,1,0,9de794a323bbf8189f31e4c16266b06f572f5956,0,0,0,0,0,
20200428,MT,451,,12740,,posNeg,13191,10,61,,,,,356,C,4/28/2020 00:00,2020-04-28T00:00:00Z,04/27 20:00,15,61,2020-04-28T00:00:00Z,13191,,,,,,,,,,,,,,,,,,30,2,156,13191,158,13191,1,0,efbbd372c9bd359265371cea635e92f259453205,0,0,0,0,0,
20200427,MT,449,,12584,,posNeg,13033,11,61,,,,,352,C,4/27/2020 00:00,2020-04-27T00:00:00Z,04/26 20:00,14,61,2020-04-27T00:00:00Z,13033,,,,,,,,,,,,,,,,,,30,1,170,13033,171,13033,0,0,466f2fe3bf716b1a442335c620fb53fb5951cb43,0,0,0,0,0,
20200426,MT,448,,12414,,posNeg,12862,11,61,,,,,339,C,4/26/2020 00:00,2020-04-26T00:00:00Z,04/25 20:00,14,61,2020-04-26T00:00:00Z,12862,,,,,,,,,,,,,,,,,,30,3,362,12862,365,12862,0,0,79057c6372000ed2a1ef6f419cf8330bb13dc45c,0,0,0,0,0,
20200425,MT,445,,12052,,posNeg,12497,11,61,,,,,339,C,4/25/2020 00:00,2020-04-25T00:00:00Z,04/24 20:00,14,61,2020-04-25T00:00:00Z,12497,,,,,,,,,,,,,,,,,,30,1,369,12497,370,12497,0,2,ba826cb2cd87e403167cf9c4417b025836913e13,0,0,0,0,0,
20200424,MT,444,,11683,,posNeg,12127,12,59,,,,,325,A,4/24/2020 00:00,2020-04-24T00:00:00Z,04/23 20:00,14,59,2020-04-24T00:00:00Z,12127,,,,,,,,,,,,,,,,,,30,2,250,12127,252,12127,0,0,b520d0f5ad19ecd052fa02c995968c07a769a4e4,0,0,0,0,0,
20200423,MT,442,,11433,,posNeg,11875,13,59,,,,,306,A,4/23/2020 00:00,2020-04-23T00:00:00Z,04/22 20:00,14,59,2020-04-23T00:00:00Z,11875,,,,,,,,,,,,,,,,,,30,3,289,11875,292,11875,0,0,8a22b0d16802be223158c30d8dc98c2f69701a10,0,0,0,0,0,
20200422,MT,439,,11144,,posNeg,11583,13,59,,,,,296,A,4/22/2020 00:00,2020-04-22T00:00:00Z,04/21 20:00,14,59,2020-04-22T00:00:00Z,11583,,,,,,,,,,,,,,,,,,30,2,340,11583,342,11583,2,0,3e51b1a5138a64402ce67b715ec616c81f9c7b01,0,0,0,0,0,
20200421,MT,437,,10804,,posNeg,11241,14,59,,,,,273,A,4/21/2020 11:56,2020-04-21T11:56:00Z,04/21 07:56,12,59,2020-04-21T11:56:00Z,11241,,,,,,,,,,,,,,,,,,30,4,186,11241,190,11241,2,2,7cd0d77eab719dcbe85261abb8d120f73e70d269,0,0,0,0,0,
20200420,MT,433,,10618,,posNeg,11051,19,57,,,,,243,A,4/20/2020 11:00,2020-04-20T11:00:00Z,04/20 07:00,10,57,2020-04-20T11:00:00Z,11051,,,,,,,,,,,,,,,,,,30,0,153,11051,153,11051,0,2,e24c85d07500d83c881975b7a72510885e0996f6,0,0,0,0,0,
20200419,MT,433,,10465,,posNeg,10898,18,55,,,,,243,A,4/19/2020 11:40,2020-04-19T11:40:00Z,04/19 07:40,10,55,2020-04-19T11:40:00Z,10898,,,,,,,,,,,,,,,,,,30,7,322,10898,329,10898,0,0,a4849114bfca18c8b743d1a8c58b76fef85b16d8,0,0,0,0,0,
20200418,MT,426,,10143,,posNeg,10569,17,55,,,,,234,A,4/18/2020 10:18,2020-04-18T10:18:00Z,04/18 06:18,10,55,2020-04-18T10:18:00Z,10569,,,,,,,,,,,,,,,,,,30,4,321,10569,325,10569,2,1,62857bb0309b1307ac78033b11e41aa49e493e26,0,0,0,0,0,
20200417,MT,422,,9822,,posNeg,10244,21,54,,,,,233,A,4/17/2020 10:44,2020-04-17T10:44:00Z,04/17 06:44,8,54,2020-04-17T10:44:00Z,10244,,,,,,,,,,,,,,,,,,30,7,301,10244,308,10244,1,2,c779f3307000c96bba4821724506284a351562a8,0,0,0,0,0,
20200416,MT,415,,9521,,posNeg,9936,21,52,,,,,218,A,4/16/2020 11:44,2020-04-16T11:44:00Z,04/16 07:44,7,52,2020-04-16T11:44:00Z,9936,,,,,,,,,,,,,,,,,,30,11,342,9936,353,9936,0,1,fb8b588915ebf9a53d035c42228f994143739f3f,0,0,0,0,0,
20200415,MT,404,,9179,,posNeg,9583,21,51,,,,,209,A,4/15/2020 11:59,2020-04-15T11:59:00Z,04/15 07:59,7,51,2020-04-15T11:59:00Z,9583,,,,,,,,,,,,,,,,,,30,5,344,9583,349,9583,0,1,8215ce34232acdc513d2d141b80af0009f88cf89,0,0,0,0,0,
20200414,MT,399,,8835,,posNeg,9234,24,50,,,,,197,A,4/14/2020 11:56,2020-04-14T11:56:00Z,04/14 07:56,7,50,2020-04-14T11:56:00Z,9234,,,,,,,,,,,,,,,,,,30,5,131,9234,136,9234,0,3,38a036ddcc3e72402d3455e5c51e3f84d51ddda6,0,0,0,0,0,
20200413,MT,394,,8704,,posNeg,9098,21,47,,,,,171,A,4/13/2020 13:11,2020-04-13T13:11:00Z,04/13 09:11,7,47,2020-04-13T13:11:00Z,9098,,,,,,,,,,,,,,,,,,30,7,178,9098,185,9098,1,0,27ece9e80f4e6cfd9383d2203539a0ff65f9a4aa,0,0,0,0,0,
20200412,MT,387,,8526,,posNeg,8913,22,47,,,,,169,A,4/12/2020 10:21,2020-04-12T10:21:00Z,04/12 06:21,6,47,2020-04-12T10:21:00Z,8913,,,,,,,,,,,,,,,,,,30,10,322,8913,332,8913,0,1,231316368297a36257ad9897ccee139ee49b0472,0,0,0,0,0,
20200411,MT,377,,8204,,posNeg,8581,21,46,,,,,169,A,4/10/2020 00:00,2020-04-10T00:00:00Z,04/09 20:00,6,46,2020-04-10T00:00:00Z,8581,,,,,,,,,,,,,,,,,,30,12,272,8581,284,8581,0,5,57d4821e070efc03d79d0754fca3585a15dce7f1,0,0,0,0,0,
20200410,MT,365,,7932,,posNeg,8297,29,41,,,,,165,A,4/10/2020 11:25,2020-04-10T11:25:00Z,04/10 07:25,6,41,2020-04-10T11:25:00Z,8297,,,,,,,,,,,,,,,,,,30,11,426,8297,437,8297,0,5,66c9f2138efd8a120afc397c74b833e6c6230012,0,0,0,0,0,
20200409,MT,354,,7506,,posNeg,7860,13,36,,,,,157,A,4/9/2020 13:33,2020-04-09T13:33:00Z,04/09 09:33,6,36,2020-04-09T13:33:00Z,7860,,,,,,,,,,,,,,,,,,30,22,440,7860,462,7860,0,5,7740d72e218e6a1da6a4dbb1f0d5eda0397231c2,0,0,0,0,0,
20200408,MT,332,,7066,,posNeg,7398,,31,,,,,135,A,4/8/2020 13:45,2020-04-08T13:45:00Z,04/08 09:45,6,31,2020-04-08T13:45:00Z,7398,,,,,,,,,,,,,,,,,,30,13,400,7398,413,7398,0,3,5f4c8fd0a501b1b25444f761dd6fd08c9bc0df48,0,0,0,0,0,
20200407,MT,319,,6666,,posNeg,6985,,28,,,,,,A,4/7/2020 13:28,2020-04-07T13:28:00Z,04/07 09:28,6,28,2020-04-07T13:28:00Z,6985,,,,,,,,,,,,,,,,,,30,20,175,6985,195,6985,0,4,0807104b7cc6918c2878fd5c826dad721f1fa36d,0,0,0,0,0,
20200406,MT,299,,6491,,posNeg,6790,,24,,,,,,A,4/6/2020 10:00,2020-04-06T10:00:00Z,04/06 06:00,6,24,2020-04-06T10:00:00Z,6789,,,,,,,,,,,,,,,,,,30,13,174,6790,187,6790,0,0,dd6249920642816376fadd7055959642fe47a08b,0,0,0,0,0,
20200405,MT,286,,6317,,posNeg,6603,,24,,,,,,A,4/5/2020 10:00,2020-04-05T10:00:00Z,04/05 06:00,6,24,2020-04-05T10:00:00Z,6603,,,,,,,,,,,,,,,,,,30,21,405,6603,426,6603,1,0,e00ddc9028ca7163d413067372dbe3936029be74,0,0,0,0,0,
20200404,MT,265,,5912,,posNeg,6177,,24,,,,,,A,4/4/2020 10:00,2020-04-04T10:00:00Z,04/04 06:00,5,24,2020-04-04T10:00:00Z,6229,,,,,,,,,,,,,,,,,,30,22,579,6177,601,6177,0,0,a7a1bba51d1c76a476327a615b947fed55dcc71c,0,0,0,0,0,
20200403,MT,243,,5333,,posNeg,5576,,24,,,,,,A,4/3/2020 10:00,2020-04-03T10:00:00Z,04/03 06:00,5,24,2020-04-03T10:00:00Z,5718,,,,,,,,,,,,,,,,,,30,16,240,5576,256,5576,0,4,5ca13b96e8ce8773f87f96d13188f704d5f5ba29,0,0,0,0,0,
20200402,MT,227,,5093,,posNeg,5320,,20,,,,,,A,4/2/2020 10:00,2020-04-02T10:00:00Z,04/02 06:00,5,20,2020-04-02T10:00:00Z,5188,,,,,,,,,,,,,,,,,,30,19,383,5320,402,5320,0,3,607149bb2a49f7e3504238aabfa8da4917a49a03,0,0,0,0,0,
20200401,MT,208,,4710,,posNeg,4918,,17,,,,,,A,4/1/2020 10:00,2020-04-01T10:00:00Z,04/01 06:00,5,17,2020-04-01T10:00:00Z,4845,,,,,,,,,,,,,,,,,,30,24,476,4918,500,4918,1,3,e893e3ba758ea59e335f696262fe761aacadc90a,0,0,0,0,0,
20200331,MT,184,,4234,,posNeg,4418,,14,,,,,,A,3/31/2020 10:00,2020-03-31T10:00:00Z,03/31 06:00,4,14,2020-03-31T10:00:00Z,3885,,,,,,,,,,,,,,,,,,30,13,91,4418,104,4418,0,4,b19e3bc2fb6628dafb69de5110464e45f88a93a6,0,0,0,0,0,
20200330,MT,171,,4143,,posNeg,4314,,10,,,,,,A,3/30/2020 10:00,2020-03-30T10:00:00Z,03/30 06:00,4,10,2020-03-30T10:00:00Z,3885,,,,,,,,,,,,,,,,,,30,17,0,4314,17,4314,3,2,8e22ddca0138127a5e2d8b9c538cb635918e61f7,0,0,0,0,0,
20200329,MT,154,,4143,,posNeg,4297,,8,,,,,,A,3/29/2020 10:00,2020-03-29T10:00:00Z,03/29 06:00,1,8,2020-03-29T10:00:00Z,3885,,,,,,,,,,,,,,,,,,30,25,887,4297,912,4297,0,1,d00590b9a529b4b68af851edb4dfba94c44ecb14,0,0,0,0,0,
20200328,MT,129,,3256,,posNeg,3385,,7,,,,,,A,3/28/2020 12:30,2020-03-28T12:30:00Z,03/28 08:30,1,7,2020-03-28T12:30:00Z,3417,,,,,,,,,,,,,,,,,,30,21,666,3385,687,3385,1,0,52959c26e1fb7052b7376b806eb0725049c2f42c,0,0,0,0,0,
20200327,MT,108,,2590,,posNeg,2698,,7,,,,,,A,3/27/2020 10:00,2020-03-27T10:00:00Z,03/27 06:00,,7,2020-03-27T10:00:00Z,,,,,,,,,,,,,,,,,,,30,37,462,2698,499,2698,0,6,c47a1daff69c1c2bdf558286ad1d9007b7847e6a,0,0,0,0,0,
20200326,MT,71,,2128,,posNeg,2199,,1,,,,,,C,3/26/2020 10:00,2020-03-26T10:00:00Z,03/26 06:00,,1,2020-03-26T10:00:00Z,,,,,,,,,,,,,,,,,,,30,18,180,2199,198,2199,0,1,899d26700626ae55b7d28441fd856f5e6962e2a9,0,0,0,0,0,
20200325,MT,53,,1948,,posNeg,2001,,,,,,,,C,3/25/2020 10:00,2020-03-25T10:00:00Z,03/25 06:00,,,2020-03-25T10:00:00Z,,,,,,,,,,,,,,,,,,,30,7,305,2001,312,2001,0,0,29b204a691ef5ba47b9da4b83652458ab843897f,0,0,0,0,0,
20200324,MT,46,,1643,,posNeg,1689,,,,,,,,C,3/24/2020 10:00,2020-03-24T10:00:00Z,03/24 06:00,,,2020-03-24T10:00:00Z,,,,,,,,,,,,,,,,,,,30,12,497,1689,509,1689,0,0,7d652051913cdd8e545ea7940e69401fe395bc7a,0,0,0,0,0,
20200323,MT,34,,1146,,posNeg,1180,,,,,,,,C,3/23/2020 10:00,2020-03-23T10:00:00Z,03/23 06:00,,,2020-03-23T10:00:00Z,,,,,,,,,,,,,,,,,,,30,3,0,1180,3,1180,0,0,570d5a81c48a13fc03f9ac1f9b91f3337e931fd2,0,0,0,0,0,
20200322,MT,31,,1146,,posNeg,1177,,,,,,,,,3/22/2020 00:00,2020-03-22T00:00:00Z,03/21 20:00,,,2020-03-22T00:00:00Z,,,,,,,,,,,,,,,,,,,30,11,0,1177,11,1177,0,0,87886729752cdfeab1e3306626ae1bbee54959ac,0,0,0,0,0,
20200321,MT,20,,1146,,posNeg,1166,,,,,,,,,3/20/2020 21:24,2020-03-20T21:24:00Z,03/20 17:24,,,2020-03-20T21:24:00Z,,,,,,,,,,,,,,,,,,,30,4,215,1166,219,1166,0,0,37ae531fb0b6288ff20b760ad2de964b4e3d958e,0,0,0,0,0,
20200320,MT,16,,931,,posNeg,947,,,,,,,,,3/19/2020 22:11,2020-03-19T22:11:00Z,03/19 18:11,,,2020-03-19T22:11:00Z,,,,,,,,,,,,,,,,,,,30,4,170,947,174,947,0,0,551b1f152ec7aca0ebf8f64e0b4c747c1dc512d9,0,0,0,0,0,
20200319,MT,12,,761,,posNeg,773,,,,,,,,,3/18/2020 23:23,2020-03-18T23:23:00Z,03/18 19:23,,,2020-03-18T23:23:00Z,,,,,,,,,,,,,,,,,,,30,2,262,773,264,773,0,0,34c39e15f4f3eea71df602f83e2440e29b334b95,0,0,0,0,0,
20200318,MT,10,,499,,posNeg,509,,,,,,,,,3/18/2020 10:15,2020-03-18T10:15:00Z,03/18 06:15,,,2020-03-18T10:15:00Z,,,,,,,,,,,,,,,,,,,30,2,196,509,198,509,0,0,b765eecf957114abe82e1afe013f6976cd582c2e,0,0,0,0,0,
20200317,MT,8,,303,,posNeg,311,,,,,,,,,3/16/2020 21:22,2020-03-16T21:22:00Z,03/16 17:22,,,2020-03-16T21:22:00Z,,,,,,,,,,,,,,,,,,,30,1,105,311,106,311,0,0,71de8beedea389efd98774c98af210c3837d4cd2,0,0,0,0,0,
20200316,MT,7,,198,,posNeg,205,,,,,,,,,3/16/2020 15:51,2020-03-16T15:51:00Z,03/16 11:51,,,2020-03-16T15:51:00Z,,,,,,,,,,,,,,,,,,,30,0,95,205,95,205,0,0,8a08bb87396a28179211c43228eb6aa61919c1e4,0,0,0,0,0,
20200315,MT,7,,103,57,posNeg,110,,,,,,,,,3/14/2020 17:52,2020-03-14T17:52:00Z,03/14 13:52,,,2020-03-14T17:52:00Z,,,,,,,,,,,,,,,,,,,30,2,0,167,2,110,0,0,edc72ad42831567453015dbcb61e43bcd955fc4a,0,0,0,0,0,
20200314,MT,5,,103,,posNeg,108,,,,,,,,,3/13/2020 19:00,2020-03-13T19:00:00Z,03/13 15:00,,,2020-03-13T19:00:00Z,,,,,,,,,,,,,,,,,,,30,4,48,108,52,108,0,0,306fd91316f590ca2cf2fd35a873e0a099d4b2d4,0,0,0,0,0,
20200313,MT,1,,55,,posNeg,56,,,,,,,,,3/12/2020 19:00,2020-03-12T19:00:00Z,03/12 15:00,,,2020-03-12T19:00:00Z,,,,,,,,,,,,,,,,,,,30,0,21,56,21,56,0,0,88086939372d1e6653e19d68064f14902b0d13f1,0,0,0,0,0,
20200312,MT,1,,34,,posNeg,35,,,,,,,,,3/11/2020 19:00,2020-03-11T19:00:00Z,03/11 15:00,,,2020-03-11T19:00:00Z,,,,,,,,,,,,,,,,,,,30,1,13,35,14,35,0,0,ab230940f3b28dcf3065d45d3238a54bfb274ff5,0,0,0,0,0,
20200311,MT,0,,21,,posNeg,21,,,,,,,,,,,,,,,,,,,,,,,,,,,,,,,,,30,0,6,21,6,21,0,0,8a56aaca9c84e1a881b73983afafacac67597154,0,0,0,0,0,
20200310,MT,0,,15,,posNeg,15,,,,,,,,,,,,,,,,,,,,,,,,,,,,,,,,,30,0,4,15,4,15,0,0,bd29f0b21436877ea6b315b13689ba75da4ee5ad,0,0,0,0,0,
20200309,MT,0,,11,,posNeg,11,,,,,,,,,,,,,,,,,,,,,,,,,,,,,,,,,30,0,0,11,0,11,0,0,7bb51f953bcebb1fae3ffdad9507a9133461889f,0,0,0,0,0,
20200308,MT,0,,11,,posNeg,11,,,,,,,,,,,,,,,,,,,,,,,,,,,,,,,,,30,0,0,11,0,11,0,0,219ed3ca2253a7b5096311f2ccb03029db359764,0,0,0,0,0,
20200307,MT,0,,11,,posNeg,11,,,,,,,,,,,,,,,,,,,,,,,,,,,,,,,,,30,0,0,11,0,11,0,0,b66b65aaafe0b0f0bc27f611798ebb090ddc581a,0,0,0,0,0,
